A1: Fondamenti di Ricerca Operativa L-A
A2: Prova Scritta del 12 Dicembre 2005
A4: Validita' per chi registra direttamente il voto: fino a martedi' 20 Dicembre 2005
A5: (non procrastinabile; non si risponde a mail o telefonate in merito).
A7: Validita' per chi sostiene l'orale: fino all'appello di Aprile 2006.
A8: Visione degli elaborati e orali: martedi' 20 Dicembre 2005, ore 15.00, Aula 61
A9: Prossimi appelli: Gennaio, Aprile
A11: matricola | B11: Cognome | C11: Nome | D11: 1 | E11: 2 | F11: bonus | G11: voto
A12: 182758 | B12: AGRIMAN | C12: PAOLO | D12: 20 | E12: 9 | F12: 3 | G12: =IF(SUM(D12:F12)<18,"Insuff.",SUM(D12:F12)) -> 32
A13: 179267 | B13: ALTINI | C13: MARCO | D13: 17 | E13: 7 | F13: 3 | G13: =IF(SUM(D13:F13)<18,"Insuff.",SUM(D13:F13)) -> 27
A14: 181725 | B14: ALUIGI | C14: ANDREA | D14: 21 | E14: 9 | F14: 3 | G14: =IF(SUM(D14:F14)<18,"Insuff.",SUM(D14:F14)) -> 33
A15: 900012520 | B15: ALVA OLIVA | C15: ALEXANDRA | D15: 15 | E15: 1 | F15: 3 | G15: =IF(SUM(D15:F15)<18,"Insuff.",SUM(D15:F15)) -> 19
A16: 900016367 | B16: ANGJELI | C16: SALVI | D16: 19 | E16: 9 | F16: 3 | G16: =IF(SUM(D16:F16)<18,"Insuff.",SUM(D16:F16)) -> 31
A17: 160202 | B17: ANTONIOLI | C17: FABRIZIO | D17: 21 | E17: 7 | F17: 0 | G17: =IF(SUM(D17:F17)<18,"Insuff.",SUM(D17:F17)) -> 28
A18: 140884 | B18: ARDONDI | C18: ROBERTO | D18: 7 | E18: 2 | F18: 3 | G18: =IF(SUM(D18:F18)<18,"Insuff.",SUM(D18:F18)) -> Insuff.
A19: 168217 | B19: ASAADI | C19: RACHID | D19: 16 | E19: 9 | F19: 3 | G19: =IF(SUM(D19:F19)<18,"Insuff.",SUM(D19:F19)) -> 28
A20: 183082 | B20: ASCANI | C20: LORENZO | D20: 15 | E20: 3 | F20: 3 | G20: =IF(SUM(D20:F20)<18,"Insuff.",SUM(D20:F20)) -> 21
A21: 242516 | B21: BELARDINELLI | C21: ENRICO | D21: 10 | E21: 9 | F21: 3 | G21: =IF(SUM(D21:F21)<18,"Insuff.",SUM(D21:F21)) -> 22
A22: 183155 | B22: BERNARDINI | C22: LUCA | D22: 21 | E22: 1 | F22: 3 | G22: =IF(SUM(D22:F22)<18,"Insuff.",SUM(D22:F22)) -> 25
A23: 184930 | B23: BERTOZZI | C23: SIMONA | D23: 20 | E23: 8 | F23: 3 | G23: =IF(SUM(D23:F23)<18,"Insuff.",SUM(D23:F23)) -> 31
A24: 161536 | B24: BEZZI | C24: FRANCESCO | D24: 8 | E24: 9 | F24: 3 | G24: =IF(SUM(D24:F24)<18,"Insuff.",SUM(D24:F24)) -> 20
A25: 180851 | B25: BONETTI | C25: STEFANO | D25: 14 | E25: 1 | F25: 3 | G25: =IF(SUM(D25:F25)<18,"Insuff.",SUM(D25:F25)) -> 18
A26: 180215 | B26: BONI | C26: GIULIO | D26: 15 | E26: 8 | F26: 3 | G26: =IF(SUM(D26:F26)<18,"Insuff.",SUM(D26:F26)) -> 26
A27: 122835 | B27: BORTONE | C27: ANDREA | D27: 2 | E27: 1 | F27: 0 | G27: =IF(SUM(D27:F27)<18,"Insuff.",SUM(D27:F27)) -> Insuff. | H27: (*)
A28: 122811 | B28: BRESCIA | C28: FERNANDO | D28: 17 | E28: 9 | F28: 3 | G28: =IF(SUM(D28:F28)<18,"Insuff.",SUM(D28:F28)) -> 29
A29: 181844 | B29: BRUNI | C29: MATTEO | D29: 21 | E29: 5 | F29: 3 | G29: =IF(SUM(D29:F29)<18,"Insuff.",SUM(D29:F29)) -> 29
A30: 181394 | B30: CACCIARI | C30: ALESSANDRO | D30: 20 | E30: 9 | F30: 3 | G30: =IF(SUM(D30:F30)<18,"Insuff.",SUM(D30:F30)) -> 32
A31: 183651 | B31: CALORE | C31: FRANCESCO | D31: 21 | E31: 8 | F31: 3 | G31: =IF(SUM(D31:F31)<18,"Insuff.",SUM(D31:F31)) -> 32
A32: 192671 | B32: CANGINI | C32: ALESSANDRO | D32: 19 | E32: 9 | F32: 3 | G32: =IF(SUM(D32:F32)<18,"Insuff.",SUM(D32:F32)) -> 31
A33: 149308 | B33: CAPUTO | C33: FABIO | D33: 7 | E33: 3 | F33: 3 | G33: =IF(SUM(D33:F33)<18,"Insuff.",SUM(D33:F33)) -> Insuff.
A34: 179941 | B34: CARDONE | C34: GIUSEPPE | D34: 8 | E34: 7 | F34: 3 | G34: =IF(SUM(D34:F34)<18,"Insuff.",SUM(D34:F34)) -> 18
A35: 180908 | B35: CARISI | C35: ROBERTO | D35: 21 | E35: 9 | F35: 3 | G35: =IF(SUM(D35:F35)<18,"Insuff.",SUM(D35:F35)) -> 33
A36: 128045 | B36: CAVALLARO | C36: FRANCESCO | D36: 16 | E36: 3 | F36: 0 | G36: =IF(SUM(D36:F36)<18,"Insuff.",SUM(D36:F36)) -> 19
A37: 182245 | B37: CHIAPPINI | C37: CHIARA | D37: 17 | E37: 7 | F37: 3 | G37: =IF(SUM(D37:F37)<18,"Insuff.",SUM(D37:F37)) -> 27
A38: 192644 | B38: CIAMBERLANO | C38: FABRIZIO | D38: 3 | E38: 4 | F38: 3 | G38: =IF(SUM(D38:F38)<18,"Insuff.",SUM(D38:F38)) -> Insuff.
A39: 121748 | B39: CIAVARELLA | C39: PRIMIANO | D39: 12 | E39: 8 | F39: 3 | G39: =IF(SUM(D39:F39)<18,"Insuff.",SUM(D39:F39)) -> 23
A40: 164846 | B40: COCCI | C40: GIACOMO | D40: 6 | E40: 1 | F40: 3 | G40: =IF(SUM(D40:F40)<18,"Insuff.",SUM(D40:F40)) -> Insuff.
A41: 900012128 | B41: CORADDUZZA | C41: EMMA | D41: 14 | E41: 3 | F41: 3 | G41: =IF(SUM(D41:F41)<18,"Insuff.",SUM(D41:F41)) -> 20
A42: 178651 | B42: CRISTIANI | C42: ALESSANDRO | D42: 7 | E42: 4 | F42: 3 | G42: =IF(SUM(D42:F42)<18,"Insuff.",SUM(D42:F42)) -> Insuff.
A43: 183729 | B43: D'ALESSANDRO | C43: DAVIDE | D43: 17 | E43: 6 | F43: 3 | G43: =IF(SUM(D43:F43)<18,"Insuff.",SUM(D43:F43)) -> 26
A44: 900021975 | B44: D'ANTONA | C44: LUCA | D44: 20 | E44: 8 | F44: 3 | G44: =IF(SUM(D44:F44)<18,"Insuff.",SUM(D44:F44)) -> 31
A45: 159447 | B45: D'AVERSA | C45: DANILO | D45: 14 | E45: 1 | F45: 3 | G45: =IF(SUM(D45:F45)<18,"Insuff.",SUM(D45:F45)) -> 18
A46: 900016682 | B46: DE GIOVANNI | C46: LORENZO | D46: 15 | E46: 7 | F46: 3 | G46: =IF(SUM(D46:F46)<18,"Insuff.",SUM(D46:F46)) -> 25
A47: 183212 | B47: DE LISI | C47: FRANCESCO | D47: 13 | E47: 9 | F47: 3 | G47: =IF(SUM(D47:F47)<18,"Insuff.",SUM(D47:F47)) -> 25
A48: 185044 | B48: DEL GATTO | C48: TOMMASO | D48: 16 | E48: 8 | F48: 3 | G48: =IF(SUM(D48:F48)<18,"Insuff.",SUM(D48:F48)) -> 27
A49: 183628 | B49: DI GIACOMO | C49: MATTEO | D49: 8 | E49: 2 | F49: 3 | G49: =IF(SUM(D49:F49)<18,"Insuff.",SUM(D49:F49)) -> Insuff.
A50: 185587 | B50: DI GIOVANNI | C50: ALESSANDRO | D50: 17 | E50: 6 | F50: 3 | G50: =IF(SUM(D50:F50)<18,"Insuff.",SUM(D50:F50)) -> 26
A51: 180457 | B51: DI MICHELE | C51: VALENTINA | D51: 10 | E51: 7 | F51: 3 | G51: =IF(SUM(D51:F51)<18,"Insuff.",SUM(D51:F51)) -> 20
A52: 159636 | B52: DI PIERRI | C52: DARIO | D52: 12 | E52: 9 | F52: 3 | G52: =IF(SUM(D52:F52)<18,"Insuff.",SUM(D52:F52)) -> 24
A53: 180561 | B53: DI ZIO | C53: ANGELO | D53: 19 | E53: 0 | F53: 3 | G53: =IF(SUM(D53:F53)<18,"Insuff.",SUM(D53:F53)) -> 22
A54: 159622 | B54: DONINI | C54: LUCA | D54: 20 | E54: 1 | F54: 3 | G54: =IF(SUM(D54:F54)<18,"Insuff.",SUM(D54:F54)) -> 24
A55: 184317 | B55: DONINI | C55: MAURIZIO | D55: 12 | E55: 9 | F55: 3 | G55: =IF(SUM(D55:F55)<18,"Insuff.",SUM(D55:F55)) -> 24
A56: 163699 | B56: FALCONE | C56: FRANCESCO | D56: 14 | E56: 3 | F56: 3 | G56: =IF(SUM(D56:F56)<18,"Insuff.",SUM(D56:F56)) -> 20
A57: 185573 | B57: FANELLI | C57: MARIO | D57: 21 | E57: 9 | F57: 3 | G57: =IF(SUM(D57:F57)<18,"Insuff.",SUM(D57:F57)) -> 33
A58: 166694 | B58: FARACI | C58: FABIO | D58: 12 | E58: 1 | F58: 0 | G58: =IF(SUM(D58:F58)<18,"Insuff.",SUM(D58:F58)) -> Insuff.
A59: 178967 | B59: FARINA | C59: FEDERICO | D59: 11 | E59: 8 | F59: 3 | G59: =IF(SUM(D59:F59)<18,"Insuff.",SUM(D59:F59)) -> 22
A60: 158368 | B60: FAZZINI | C60: FRANCESCO | D60: 13 | E60: 2 | F60: 3 | G60: =IF(SUM(D60:F60)<18,"Insuff.",SUM(D60:F60)) -> 18
A61: 179887 | B61: FILIPPI | C61: MATTIA | D61: 20 | E61: 6 | F61: 3 | G61: =IF(SUM(D61:F61)<18,"Insuff.",SUM(D61:F61)) -> 29
A62: 162122 | B62: FIORE | C62: VINCENZO | D62: 16 | E62: 9 | F62: 0 | G62: =IF(SUM(D62:F62)<18,"Insuff.",SUM(D62:F62)) -> 25
A63: 189009 | B63: GALANTI | C63: ANGELO | D63: 19 | E63: 9 | F63: 3 | G63: =IF(SUM(D63:F63)<18,"Insuff.",SUM(D63:F63)) -> 31
A64: 158218 | B64: GASBARRO | C64: DAVIDE | D64: 11 | E64: 2 | F64: 0 | G64: =IF(SUM(D64:F64)<18,"Insuff.",SUM(D64:F64)) -> Insuff.
A65: 191871 | B65: GIACCHETTA | C65: MARIANNA | D65: 16 | E65: 9 | F65: 3 | G65: =IF(SUM(D65:F65)<18,"Insuff.",SUM(D65:F65)) -> 28
A66: 179897 | B66: GIOVANNINI | C66: GIACOMO | D66: 12 | E66: 9 | F66: 3 | G66: =IF(SUM(D66:F66)<18,"Insuff.",SUM(D66:F66)) -> 24
A67: 179921 | B67: GOLINELLI | C67: STEFANO | D67: 20 | E67: 7 | F67: 3 | G67: =IF(SUM(D67:F67)<18,"Insuff.",SUM(D67:F67)) -> 30
A68: 185272 | B68: GRECO | C68: FEDERICA | D68: 13 | E68: 8 | F68: 3 | G68: =IF(SUM(D68:F68)<18,"Insuff.",SUM(D68:F68)) -> 24
A69: 190581 | B69: GUALTIERI | C69: CHIARA | D69: 18 | E69: 8 | F69: 3 | G69: =IF(SUM(D69:F69)<18,"Insuff.",SUM(D69:F69)) -> 29
A70: 182170 | B70: LAMA | C70: LORENZO | D70: 14 | E70: 6 | F70: 3 | G70: =IF(SUM(D70:F70)<18,"Insuff.",SUM(D70:F70)) -> 23
A71: 188294 | B71: LAURIA | C71: MANUELA | D71: 16 | E71: 9 | F71: 3 | G71: =IF(SUM(D71:F71)<18,"Insuff.",SUM(D71:F71)) -> 28
A72: 178388 | B72: LEPORE | C72: VALENTINA | D72: 20 | E72: 8 | F72: 3 | G72: =IF(SUM(D72:F72)<18,"Insuff.",SUM(D72:F72)) -> 31
A73: 186268 | B73: LORETI | C73: DANIELA | D73: 20 | E73: 9 | F73: 3 | G73: =IF(SUM(D73:F73)<18,"Insuff.",SUM(D73:F73)) -> 32
A74: 138627 | B74: MACCAFERRI | C74: DAVIDE | D74: 8 | E74: 0 | F74: 3 | G74: =IF(SUM(D74:F74)<18,"Insuff.",SUM(D74:F74)) -> Insuff.
A75: 168278 | B75: MACRI | C75: PAOLO | D75: 8 | E75: 3 | F75: 3 | G75: =IF(SUM(D75:F75)<18,"Insuff.",SUM(D75:F75)) -> Insuff.
A76: 124220 | B76: MANESE | C76: STEFANO GUERINO | D76: 6 | E76: 2 | F76: 3 | G76: =IF(SUM(D76:F76)<18,"Insuff.",SUM(D76:F76)) -> Insuff.
A77: 192700 | B77: MANGANARO | C77: ANDREA | D77: 19 | E77: 9 | F77: 3 | G77: =IF(SUM(D77:F77)<18,"Insuff.",SUM(D77:F77)) -> 31
A78: 187012 | B78: MANZOLI | C78: DAVIDE | D78: 21 | E78: 8 | F78: 3 | G78: =IF(SUM(D78:F78)<18,"Insuff.",SUM(D78:F78)) -> 32
A79: 178565 | B79: MARTINI | C79: LUCA | D79: 14 | E79: 6 | F79: 3 | G79: =IF(SUM(D79:F79)<18,"Insuff.",SUM(D79:F79)) -> 23
A80: 185941 | B80: MASCARO | C80: PAOLO | D80: 14 | E80: 1 | F80: 3 | G80: =IF(SUM(D80:F80)<18,"Insuff.",SUM(D80:F80)) -> 18
A81: 185475 | B81: MASCIOLI | C81: SILVIO | D81: 13 | E81: 9 | F81: 3 | G81: =IF(SUM(D81:F81)<18,"Insuff.",SUM(D81:F81)) -> 25
A82: 182984 | B82: MATALONI | C82: GIACOMO | D82: 12 | E82: 1 | F82: 3 | G82: =IF(SUM(D82:F82)<18,"Insuff.",SUM(D82:F82)) -> Insuff.
A83: 157115 | B83: MOLITERNI | C83: ANDREA | D83: 13 | E83: 0 | F83: 3 | G83: =IF(SUM(D83:F83)<18,"Insuff.",SUM(D83:F83)) -> Insuff.
A84: 182976 | B84: MONTICELLI | C84: DAVIDE | D84: 19 | E84: 6 | F84: 3 | G84: =IF(SUM(D84:F84)<18,"Insuff.",SUM(D84:F84)) -> 28
A85: 180372 | B85: MORARA | C85: ALBERTO | D85: 21 | E85: 9 | F85: 3 | G85: =IF(SUM(D85:F85)<18,"Insuff.",SUM(D85:F85)) -> 33
A86: 229674 | B86: NEGRISOLI | C86: ALBERTO | D86: 10 | E86: 0 | F86: 0 | G86: =IF(SUM(D86:F86)<18,"Insuff.",SUM(D86:F86)) -> Insuff. | H86: (*)
A87: 2148061650 | B87: PALLOTTI | C87: GIACOMO | D87: 20 | E87: 1 | F87: 3 | G87: =IF(SUM(D87:F87)<18,"Insuff.",SUM(D87:F87)) -> 24
A88: 158022 | B88: PALMISANO | C88: GIOVANNI | D88: 11 | E88: 7 | F88: 0 | G88: =IF(SUM(D88:F88)<18,"Insuff.",SUM(D88:F88)) -> 18
A89: 181106 | B89: PATTUZZI | C89: DANIELE | D89: 19 | E89: 8 | F89: 3 | G89: =IF(SUM(D89:F89)<18,"Insuff.",SUM(D89:F89)) -> 30
A90: 179352 | B90: PERINI | C90: GIORGIO | D90: 12 | E90: 9 | F90: 3 | G90: =IF(SUM(D90:F90)<18,"Insuff.",SUM(D90:F90)) -> 24
A91: 180404 | B91: PERNAFINI | C91: ALESSANDRO | D91: 21 | E91: 9 | F91: 3 | G91: =IF(SUM(D91:F91)<18,"Insuff.",SUM(D91:F91)) -> 33
A92: 191384 | B92: PICHINELLI | C92: MATTEO | D92: 15 | E92: 8 | F92: 3 | G92: =IF(SUM(D92:F92)<18,"Insuff.",SUM(D92:F92)) -> 26
A93: 900012077 | B93: PIRO | C93: RAFFAELE | D93: 9 | E93: 6 | F93: 3 | G93: =IF(SUM(D93:F93)<18,"Insuff.",SUM(D93:F93)) -> 18
A94: 178246 | B94: PISCINO | C94: PAOLO | D94: 8 | E94: 9 | F94: 3 | G94: =IF(SUM(D94:F94)<18,"Insuff.",SUM(D94:F94)) -> 20
A95: 182058 | B95: PIVA | C95: MARCO | D95: 13 | E95: 3 | F95: 3 | G95: =IF(SUM(D95:F95)<18,"Insuff.",SUM(D95:F95)) -> 19
A96: 142717 | B96: PIZZUTI | C96: GIANROCCO | D96: 13 | E96: 0 | F96: 0 | G96: =IF(SUM(D96:F96)<18,"Insuff.",SUM(D96:F96)) -> Insuff.
A97: 159743 | B97: POLIDORO | C97: GIORDANO | D97: 13 | E97: 8 | F97: 0 | G97: =IF(SUM(D97:F97)<18,"Insuff.",SUM(D97:F97)) -> 21
A98: 178931 | B98: POMPEO | C98: DAVIDE | D98: 15 | E98: 5 | F98: 3 | G98: =IF(SUM(D98:F98)<18,"Insuff.",SUM(D98:F98)) -> 23
A99: 180928 | B99: PRATI | C99: ALEX | D99: 19 | E99: 8 | F99: 3 | G99: =IF(SUM(D99:F99)<18,"Insuff.",SUM(D99:F99)) -> 30
A100: 192627 | B100: RAIMONDO | C100: ALESSANDRO | D100: 13 | E100: 2 | F100: 3 | G100: =IF(SUM(D100:F100)<18,"Insuff.",SUM(D100:F100)) -> 18
A101: 184277 | B101: RAPINO | C101: DAVIDE | D101: 6 | E101: 1 | F101: 3 | G101: =IF(SUM(D101:F101)<18,"Insuff.",SUM(D101:F101)) -> Insuff.
A102: 188884 | B102: ROMAGNOLI | C102: CAMILLA | D102: 12 | E102: 1 | F102: 3 | G102: =IF(SUM(D102:F102)<18,"Insuff.",SUM(D102:F102)) -> Insuff.
A103: 138633 | B103: ROSSI | C103: ANTONELLO | D103: 11 | E103: 2 | F103: 0 | G103: =IF(SUM(D103:F103)<18,"Insuff.",SUM(D103:F103)) -> Insuff.
A104: 179378 | B104: ROVINETTI | C104: ANDREA | D104: 11 | E104: 9 | F104: 3 | G104: =IF(SUM(D104:F104)<18,"Insuff.",SUM(D104:F104)) -> 23
A105: 184040 | B105: SACCO | C105: ALEX | D105: 11 | E105: 0 | F105: 3 | G105: =IF(SUM(D105:F105)<18,"Insuff.",SUM(D105:F105)) -> Insuff.
A106: 181076 | B106: SALBAROLI | C106: FRANCESCO | D106: 16 | E106: 8 | F106: 3 | G106: =IF(SUM(D106:F106)<18,"Insuff.",SUM(D106:F106)) -> 27
A107: 900018170 | B107: SALVARO | C107: MATTIA | D107: 20 | E107: 9 | F107: 3 | G107: =IF(SUM(D107:F107)<18,"Insuff.",SUM(D107:F107)) -> 32
A108: 178737 | B108: SAVIOLI | C108: ALESSANDRO | D108: 21 | E108: 9 | F108: 3 | G108: =IF(SUM(D108:F108)<18,"Insuff.",SUM(D108:F108)) -> 33
A109: 178811 | B109: SCHIROSI | C109: ANTONIO | D109: 19 | E109: 1 | F109: 3 | G109: =IF(SUM(D109:F109)<18,"Insuff.",SUM(D109:F109)) -> 23
A110: 181423 | B110: TARINI | C110: MARCO | D110: 16 | E110: 9 | F110: 3 | G110: =IF(SUM(D110:F110)<18,"Insuff.",SUM(D110:F110)) -> 28
A111: 158591 | B111: TOMEI | C111: STEFANO | D111: 8 | E111: 4 | F111: 3 | G111: =IF(SUM(D111:F111)<18,"Insuff.",SUM(D111:F111)) -> Insuff.
A112: 187325 | B112: TONELLI | C112: ANDREA | D112: 11 | E112: 6 | F112: 3 | G112: =IF(SUM(D112:F112)<18,"Insuff.",SUM(D112:F112)) -> 20
A113: 185896 | B113: TONIOLO | C113: GIORGIO | D113: 15 | E113: 6 | F113: 3 | G113: =IF(SUM(D113:F113)<18,"Insuff.",SUM(D113:F113)) -> 24
A114: 158267 | B114: VARRIANO | C114: PAOLA | D114: 13 | E114: 0 | F114: 0 | G114: =IF(SUM(D114:F114)<18,"Insuff.",SUM(D114:F114)) -> Insuff.
A115: 159801 | B115: VETRI | C115: SIMONE | D115: 19 | E115: 3 | F115: 3 | G115: =IF(SUM(D115:F115)<18,"Insuff.",SUM(D115:F115)) -> 25
A116: 180015 | B116: VIMERCATI | C116: UMBERTO | D116: 21 | E116: 1 | F116: 3 | G116: =IF(SUM(D116:F116)<18,"Insuff.",SUM(D116:F116)) -> 25
A117: 233659 | B117: ZACCHE | C117: ALESSANDRO | D117: 8 | E117: 0 | F117: 0 | G117: =IF(SUM(D117:F117)<18,"Insuff.",SUM(D117:F117)) -> Insuff.
A118: 184689 | B118: ZAPPACOSTA | C118: ALEX | D118: 20 | E118: 8 | F118: 3 | G118: =IF(SUM(D118:F118)<18,"Insuff.",SUM(D118:F118)) -> 31
A119: (*) L'esito del prossimo appello verra' verbalizzato in ogni caso.