A1: Fondamenti di Ricerca Operativa L-A
A2: Prova Scritta del 21 Giugno 2006
A4: Validita' per chi non sostiene l'orale: fino al 27 Giugno 2006, ore 15.00
A5: (non procrastinabile; non si risponde a mail o telefonate in merito).
A7: Validita' per chi sostiene l'orale: fino all'appello di Settembre 2006.
A8: Visione degli elaborati e orali: 27 Giugno 2006, ore 14.00, Aula 81
A9: Prossimi appelli: Luglio 2006, Settembre 2006
A11: matricola | B11: Cognome | C11: Nome | D11: 1 | E11: 2 | F11: bonus | G11: voto
A12: 143059 | B12: ANGELINI | C12: ENRICO | D12: 15 | E12: 12 | F12: 3 | G12: =IF(SUM(D12:F12)<18,"Insuff.",SUM(D12:F12)) -> 30
A13: 158364 | B13: BALDI | C13: ERICK | D13: 2 | E13: 7 | F13: 0 | G13: =IF(SUM(D13:F13)<18,"Insuff.",SUM(D13:F13)) -> Insuff.
A14: 122282 | B14: BETTI | C14: ALESSANDRO | D14: 1 | E14: 2 | F14: 0 | G14: =IF(SUM(D14:F14)<18,"Insuff.",SUM(D14:F14)) -> Insuff.
A15: 161536 | B15: BEZZI | C15: FRANCESCO | D15: 9 | E15: 9 | F15: 0 | G15: =IF(SUM(D15:F15)<18,"Insuff.",SUM(D15:F15)) -> 18 | H15: (*)
A16: 122835 | B16: BORTONE | C16: ANDREA | D16: 1 | E16: 2 | F16: 0 | G16: =IF(SUM(D16:F16)<18,"Insuff.",SUM(D16:F16)) -> Insuff. | H16: (**)
A17: 900016641 | B17: BURRHUS | C17: LANDRY NJIKE | D17: 11 | E17: 3 | F17: 3 | G17: 17 | H17: (***)
A18: 192644 | B18: CIAMBERLANO | C18: FABRIZIO | D18: 9 | E18: 8 | F18: 0 | G18: 17 | H18: (***)
A19: 159962 | B19: CIARROCCHI | C19: PAOLO | D19: 16 | E19: 8 | F19: 0 | G19: =IF(SUM(D19:F19)<18,"Insuff.",SUM(D19:F19)) -> 24
A20: 159447 | B20: D'AVERSA | C20: DANILO | D20: 13 | E20: 10 | F20: 0 | G20: =IF(SUM(D20:F20)<18,"Insuff.",SUM(D20:F20)) -> 23
A21: 159504 | B21: GRASSI | C21: ENRICO | D21: 7 | E21: 6 | F21: 0 | G21: =IF(SUM(D21:F21)<18,"Insuff.",SUM(D21:F21)) -> Insuff.
A22: 900018747 | B22: IANNUZZI | C22: CRISTIAN | D22: 3 | E22: 1 | F22: 0 | G22: =IF(SUM(D22:F22)<18,"Insuff.",SUM(D22:F22)) -> Insuff.
A23: 181321 | B23: LEONE | C23: GIUSEPPE | D23: 18 | E23: 12 | F23: 0 | G23: =IF(SUM(D23:F23)<18,"Insuff.",SUM(D23:F23)) -> 30
A24: 900018299 | B24: LIPARI | C24: TIZIANA | D24: 5 | E24: 10 | F24: 3 | G24: =IF(SUM(D24:F24)<18,"Insuff.",SUM(D24:F24)) -> 18
A25: 168278 | B25: MACRI | C25: PAOLO | D25: 7 | E25: 1 | F25: 0 | G25: =IF(SUM(D25:F25)<18,"Insuff.",SUM(D25:F25)) -> Insuff.
A26: 161046 | B26: MAZZOTTA | C26: GIOVANNI | D26: 6 | E26: 8 | F26: 3 | G26: 17 | H26: (***)
A27: 2108048325 | B27: MOSCHELLA | C27: MARIA | D27: 7 | E27: 10 | F27: 0 | G27: 17 | H27: (***)
A28: 139463 | B28: PALMUCCI | C28: MASSIMILIANO | D28: 11 | E28: 10 | F28: 0 | G28: =IF(SUM(D28:F28)<18,"Insuff.",SUM(D28:F28)) -> 21
A29: 146630 | B29: PEDONE | C29: GIOVANNI | D29: 12 | E29: 7 | F29: 0 | G29: =IF(SUM(D29:F29)<18,"Insuff.",SUM(D29:F29)) -> 19
A30: 184277 | B30: RAPINO | C30: DAVIDE | D30: 6 | E30: 8 | F30: 0 | G30: =IF(SUM(D30:F30)<18,"Insuff.",SUM(D30:F30)) -> Insuff.
A31: 169597 | B31: SABBATINI | C31: CRISTIAN | D31: 18 | E31: 12 | F31: 0 | G31: =IF(SUM(D31:F31)<18,"Insuff.",SUM(D31:F31)) -> 30
A32: 181004 | B32: SAVORELLI | C32: MATTEO | D32: 11 | E32: 7 | F32: 3 | G32: =IF(SUM(D32:F32)<18,"Insuff.",SUM(D32:F32)) -> 21
A33: 185970 | B33: SPATARO | C33: CATALDO | D33: 14 | E33: 10 | F33: 3 | G33: =IF(SUM(D33:F33)<18,"Insuff.",SUM(D33:F33)) -> 27
A34: 233659 | B34: ZACCHE | C34: ALESSANDRO | D34: 12 | E34: 12 | F34: 0 | G34: =IF(SUM(D34:F34)<18,"Insuff.",SUM(D34:F34)) -> 24
A35: (*) L'eventuale esito negativo del prossimo appello verra' verbalizzato.
A36: (**) L'esito e' stato verbalizzato.
A37: (***) Puo' registrare 18.