A1: Fondamenti di Ricerca Operativa L-A
A2: Prova Scritta del 17 Marzo 2003
A4: Validita': fino a Giugno 2003
A5: Visione degli elaborati e orali:Lunedi' 24 Marzo ore 15.00 Aula 6.1
A6: Prossimi appelli: Aprile, Giugno, Luglio
A8: matricola | B8: Cognome | C8: Nome | D8: 1 | E8: 2 | F8: 3 | G8: bonus | H8: voto
A9: 105881 | B9: ABADIE MANRIQUE | C9: RICARDO ELOY | D9: 20 | E9: 7 | G9: 3 | H9: =D9+E9+F9+G9 -> 30
A10: 122708 | B10: ADDIMANDA | C10: ELISA | D10: 16 | E10: 6 | G10: 3 | H10: =D10+E10+F10+G10 -> 25
A11: 127356 | B11: AGRESTI | C11: SERENA | D11: 12 | E11: 8 | G11: 3 | H11: =D11+E11+F11+G11 -> 23
A12: 127122 | B12: ANCARANI | C12: LUCA | D12: 15 | E12: 9 | G12: 3 | H12: =D12+E12+F12+G12 -> 27
A13: 127370 | B13: ARGENTIERO | C13: STEFANO | D13: 11 | E13: 9 | G13: 3 | H13: =D13+E13+F13+G13 -> 23
A14: 127940 | B14: BABINI | C14: MARTINA | D14: 8 | E14: 9 | G14: 3 | H14: =D14+E14+F14+G14 -> 20
A15: 123594 | B15: BALDUCCI | C15: DANIELE | D15: 7 | E15: 9 | G15: 3 | H15: =D15+E15+F15+G15 -> 19
A16: 122910 | B16: BAMPO | C16: MAURO | D16: 21 | E16: 9 | G16: 3 | H16: =D16+E16+F16+G16 -> 33
A17: 123833 | B17: BARONCINI | C17: DANIELE | D17: 11 | E17: 3 | G17: 3 | H17: =D17+E17+F17+G17 -> 17 | I17: *
A18: 127287 | B18: BARRANO | C18: EMANUELE | D18: 2 | E18: 4 | G18: 3 | H18: Insuff.
A19: 121895 | B19: BASSINI | C19: ILARIA | D19: 16 | E19: 3 | G19: 3 | H19: =D19+E19+F19+G19 -> 22
A20: 124286 | B20: BATTARRA | C20: PAOLO | D20: 19 | E20: 8 | G20: 3 | H20: =D20+E20+F20+G20 -> 30
A21: 900003207 | B21: BELARDI | C21: ANDREA | D21: 19 | E21: 9 | G21: 3 | H21: =D21+E21+F21+G21 -> 31
A22: 122915 | B22: BELLINI | C22: MARCO | D22: 13 | E22: 2 | G22: 3 | H22: =D22+E22+F22+G22 -> 18
A23: 125461 | B23: BELLOCCHI | C23: MARCO MARIA | D23: 18 | E23: 8 | G23: 3 | H23: =D23+E23+F23+G23 -> 29
A24: 122171 | B24: BERTI | C24: CLAUDIO | D24: 16 | E24: 8 | G24: 3 | H24: =D24+E24+F24+G24 -> 27
A25: 2148062266 | B25: BERTORELLI | C25: SIMONE | D25: 18 | E25: 2 | G25: 3 | H25: =D25+E25+F25+G25 -> 23
A26: 124168 | B26: BONAZZA | C26: FEDERICO | D26: 12 | E26: 8 | G26: 3 | H26: =D26+E26+F26+G26 -> 23
A27: 125511 | B27: BORELLI | C27: VINCENZO | D27: 21 | E27: 9 | G27: 3 | H27: =D27+E27+F27+G27 -> 33
A28: 122560 | B28: BRICCHI | C28: LORENZO | D28: 14 | E28: 5 | G28: 3 | H28: =D28+E28+F28+G28 -> 22
A29: 122507 | B29: BRUGNONI | C29: MIRCO | D29: 14 | E29: 9 | G29: 3 | H29: =D29+E29+F29+G29 -> 26
A30: 122490 | B30: BRUNETTI | C30: LUCA | D30: 16 | E30: 2 | G30: 3 | H30: =D30+E30+F30+G30 -> 21
A31: 900003209 | B31: BUCCELLA | C31: ALBERTO | D31: 13 | E31: 8 | G31: 3 | H31: =D31+E31+F31+G31 -> 24
A32: 123038 | B32: BURGIO | C32: PAOLO | D32: 16 | E32: 7 | G32: 3 | H32: =D32+E32+F32+G32 -> 26
A33: 127284 | B33: BUSACCA | C33: FULVIO | D33: 19 | E33: 9 | G33: 3 | H33: =D33+E33+F33+G33 -> 31
A34: 900003457 | B34: CAFFIERO | C34: ALESSANDRO | D34: 18 | E34: 9 | G34: 3 | H34: =D34+E34+F34+G34 -> 30
A35: 105176 | B35: CALORI | C35: ALESSANDRO | D35: 14 | E35: 2 | G35: 3 | H35: =D35+E35+F35+G35 -> 19
A36: 127911 | B36: CANTARINI | C36: FRANCESCO | D36: 18 | E36: 9 | G36: 3 | H36: =D36+E36+F36+G36 -> 30
A37: 127931 | B37: CAROTTI | C37: LAMBERTO | D37: 15 | E37: 4 | G37: 3 | H37: =D37+E37+F37+G37 -> 22
A38: 122942 | B38: CARPENE' | C38: MICHELE | D38: 8 | E38: 1 | G38: 3 | H38: Insuff. | I38: ***
A39: 124354 | B39: CARUSO | C39: VINCENZO | D39: 21 | E39: 9 | G39: 3 | H39: =D39+E39+F39+G39 -> 33
A40: 104375 | B40: CERUTI | C40: ANDREA | D40: 8 | E40: 7 | G40: 3 | H40: =D40+E40+F40+G40 -> 18
A41: 110255 | B41: COCCI GRIFONI | C41: GAETANO | D41: 16 | E41: 8 | G41: 3 | H41: =D41+E41+F41+G41 -> 27
A42: 2148063608 | B42: COLOMBINI | C42: EMANUELE | D42: 20 | E42: 3 | G42: 3 | H42: =D42+E42+F42+G42 -> 26
A43: 125550 | B43: COLOMBINI | C43: GABRIELE | D43: 6 | E43: 4 | G43: 3 | H43: Insuff.
A44: 114918 | B44: CORSINI | C44: ALESSIO | D44: 8 | E44: 2 | G44: 3 | H44: Insuff.
A45: 123517 | B45: DALLA TORRE | C45: ALESSANDRO | D45: 14 | E45: 9 | G45: 3 | H45: =D45+E45+F45+G45 -> 26
A46: 103924 | B46: DI BIAGIO | C46: ANDREA | D46: 13 | E46: 9 | G46: 3 | H46: =D46+E46+F46+G46 -> 25
A47: 121743 | B47: DI CREDICO | C47: FEDERICO | D47: 13 | E47: 6 | G47: 3 | H47: =D47+E47+F47+G47 -> 22
A48: 121765 | B48: DI NAPOLI | C48: GIOVANNI | D48: 17 | E48: 6 | G48: 3 | H48: =D48+E48+F48+G48 -> 26
A49: 104930 | B49: DI TOLLO | C49: ALFONSO | D49: 7 | E49: 2 | G49: 3 | H49: Insuff.
A50: 122109 | B50: DI TOMASO | C50: VITTORIO | D50: 19 | E50: 9 | G50: 3 | H50: =D50+E50+F50+G50 -> 31
A51: 125458 | B51: DIONIGI | C51: GIACOMO | D51: 18 | E51: 9 | G51: 3 | H51: =D51+E51+F51+G51 -> 30
A52: 125672 | B52: DOLIF | C52: EMILIANO | D52: 12 | E52: 7 | G52: 3 | H52: =D52+E52+F52+G52 -> 22
A53: 123273 | B53: FERRANTI | C53: ETTORE | D53: 19 | E53: 9 | G53: 3 | H53: =D53+E53+F53+G53 -> 31
A54: 121528 | B54: FIORANI | C54: ENRICO | D54: 21 | E54: 5 | G54: 3 | H54: =D54+E54+F54+G54 -> 29
A55: 121917 | B55: FIORETTI | C55: FABIO | D55: 12 | E55: 2 | G55: 3 | H55: =D55+E55+F55+G55 -> 17 | I55: *
A56: 124843 | B56: GAETANI | C56: ANTONIO | D56: 19 | E56: 9 | G56: 3 | H56: =D56+E56+F56+G56 -> 31
A57: 122877 | B57: GALLI | C57: LAURA | D57: 21 | E57: 9 | G57: 3 | H57: =D57+E57+F57+G57 -> 33
A58: 107073 | B58: GATTAMORTA | C58: MIRKO | D58: 21 | E58: 8 | G58: 3 | H58: =D58+E58+F58+G58 -> 32
A59: 121701 | B59: GATTARI | C59: GABRIELE | D59: 5 | E59: 9 | G59: 3 | H59: =D59+E59+F59+G59 -> 17 | I59: *
A60: 127861 | B60: GELSUMINO | C60: ERIKA | D60: 4 | E60: 1 | G60: 3 | H60: Insuff.
A61: 2148064429 | B61: GENTILI | C61: PAOLO | D61: 9 | E61: 8 | G61: 3 | H61: =D61+E61+F61+G61 -> 20
A62: 127141 | B62: GERMINALE | C62: MARCO | D62: 14 | E62: 8 | G62: 3 | H62: =D62+E62+F62+G62 -> 25
A63: 128819 | B63: GIGANTE | C63: PAOLO | D63: 4 | E63: 6 | G63: 3 | H63: Insuff.
A64: 121979 | B64: GOTTARDI | C64: GIANPAOLO | D64: 17 | E64: 6 | G64: 3 | H64: =D64+E64+F64+G64 -> 26
A65: 122284 | B65: GRUPPIONI | C65: EMANUELE | D65: 14 | E65: 0 | G65: 3 | H65: =D65+E65+F65+G65 -> 17 | I65: *
A66: 121673 | B66: GUADAGNO | C66: POTITO | D66: 7 | E66: 3 | G66: 3 | H66: Insuff.
A67: 900003117 | B67: INGENITO | C67: GUIDO ANGELO | D67: 12 | E67: 4 | G67: 3 | H67: =D67+E67+F67+G67 -> 19
A68: 900005389 | B68: KASTLUNGER | C68: TONE | D68: 10 | E68: 4 | G68: 3 | H68: =D68+E68+F68+G68 -> 17 | I68: *
A69: 122017 | B69: LAGUARDIA | C69: FLAVIO | D69: 14 | E69: 6 | G69: 3 | H69: =D69+E69+F69+G69 -> 23
A70: 122738 | B70: LEARDINI | C70: FRANCESCO | D70: 13 | E70: 5 | G70: 3 | H70: =D70+E70+F70+G70 -> 21
A71: 128035 | B71: LEONETTI | C71: FRANCESCO | D71: 11 | E71: 6 | G71: 3 | H71: =D71+E71+F71+G71 -> 20
A72: 900003528 | B72: LOSARDO | C72: AGOSTINO | D72: 10 | E72: 4 | G72: 3 | H72: =D72+E72+F72+G72 -> 17 | I72: *
A73: 124166 | B73: LUCCHI | C73: FRANCESCO | D73: 18 | E73: 6 | G73: 3 | H73: =D73+E73+F73+G73 -> 27
A74: 900003165 | B74: MAGNANI | C74: FEDERICA | D74: 20 | E74: 8 | G74: 3 | H74: =D74+E74+F74+G74 -> 31
A75: 125696 | B75: MAMO | C75: GIUSEPPE | D75: 7 | E75: 7 | G75: 3 | H75: =D75+E75+F75+G75 -> 17 | I75: *
A76: 123804 | B76: MANSERVISI | C76: ALBERTO | D76: 16 | E76: 1 | G76: 3 | H76: =D76+E76+F76+G76 -> 20
A77: 123298 | B77: MARCHETTI | C77: ALEX | D77: 17 | E77: 4 | G77: 3 | H77: =D77+E77+F77+G77 -> 24
A78: 122375 | B78: MARIANI | C78: ALESSANDRO | D78: 21 | E78: 9 | G78: 3 | H78: =D78+E78+F78+G78 -> 33
A79: 128859 | B79: MASETTI | C79: MARCO | D79: 10 | E79: 8 | G79: 3 | H79: =D79+E79+F79+G79 -> 21
A80: 122605 | B80: MASI | C80: GIULIANO | D80: 18 | E80: 8 | G80: 3 | H80: =D80+E80+F80+G80 -> 29
A81: 123351 | B81: MAZZONI | C81: ANDREA | D81: 12 | E81: 7 | G81: 3 | H81: =D81+E81+F81+G81 -> 22
A82: 127966 | B82: MERCATI | C82: ALBERTO | D82: 15 | G82: 3 | H82: =D82+E82+F82+G82 -> 18
A83: 121960 | B83: MIRANDOLA | C83: ALEX | D83: 12 | E83: 8 | G83: 3 | H83: =D83+E83+F83+G83 -> 23
A84: 123175 | B84: MONROY | C84: RICARDO | D84: 7 | E84: 4 | G84: 3 | H84: Insuff.
A85: 125494 | B85: MONTALI | C85: MARCO | D85: 21 | E85: 8 | G85: 3 | H85: =D85+E85+F85+G85 -> 32
A86: 124749 | B86: MORETTI | C86: LEONARDO | D86: 15 | E86: 9 | G86: 3 | H86: =D86+E86+F86+G86 -> 27
A87: 121661 | B87: MORLUNGHI | C87: ANDREA | D87: 9 | E87: 8 | G87: 3 | H87: =D87+E87+F87+G87 -> 20
A88: 123955 | B88: MORSIANI | C88: MARCO | D88: 17 | E88: 9 | G88: 3 | H88: =D88+E88+F88+G88 -> 29
A89: 106662 | B89: NUVOLI | C89: CHRISTIAN | D89: 19 | E89: 8 | G89: 3 | H89: =D89+E89+F89+G89 -> 30
A90: 122350 | B90: PACE | C90: MICHELE | D90: 18 | E90: 9 | G90: 3 | H90: =D90+E90+F90+G90 -> 30
A91: 121943 | B91: PANACCIO | C91: MARISA | D91: 17 | E91: 5 | G91: 3 | H91: =D91+E91+F91+G91 -> 25
A92: 122261 | B92: PANZACCHI | C92: MATTEO | D92: 12 | E92: 8 | G92: 3 | H92: =D92+E92+F92+G92 -> 23
A93: 127790 | B93: PARENZA | C93: BENEDETTA | D93: 7 | E93: 8 | G93: 3 | H93: =D93+E93+F93+G93 -> 18
A94: 121944 | B94: PARISINI | C94: FABIO | D94: 16 | E94: 9 | G94: 3 | H94: =D94+E94+F94+G94 -> 28
A95: 122278 | B95: PELLEGRINI | C95: SIMONE | D95: 18 | E95: 8 | G95: 3 | H95: =D95+E95+F95+G95 -> 29
A96: 122052 | B96: PETRI | C96: MATTEO TOMMASO | D96: 16 | E96: 6 | G96: 3 | H96: =D96+E96+F96+G96 -> 25
A97: 123566 | B97: PISTOLESI | C97: LUCA | D97: 14 | E97: 5 | G97: 3 | H97: =D97+E97+F97+G97 -> 22
A98: 124882 | B98: PIZZI | C98: ANGELO | D98: 7 | E98: 8 | G98: 3 | H98: =D98+E98+F98+G98 -> 18
A99: 2148064437 | B99: POMPEI | C99: FABIO | D99: 19 | E99: 8 | G99: 3 | H99: =D99+E99+F99+G99 -> 30
A100: 130929 | B100: RAMETTA | C100: FABRIZIO | D100: 13 | E100: 6 | G100: 3 | H100: =D100+E100+F100+G100 -> 22
A101: 2147064457 | B101: RIMONDI | C101: CHRISTIAN | D101: 11 | E101: 8 | G101: 3 | H101: =D101+E101+F101+G101 -> 22
A102: 900004149 | B102: RINALDI | C102: MARIO | D102: 12 | E102: 5 | G102: 3 | H102: =D102+E102+F102+G102 -> 20
A103: 123267 | B103: RONDINI | C103: ELISA | D103: 19 | E103: 8 | G103: 3 | H103: =D103+E103+F103+G103 -> 30
A104: 125603 | B104: ROSSI | C104: DANIELE | D104: 18 | E104: 9 | G104: 3 | H104: =D104+E104+F104+G104 -> 30
A105: 123998 | B105: RUOTOLO | C105: DIEGO | D105: 17 | E105: 7 | G105: 3 | H105: =D105+E105+F105+G105 -> 27
A106: 121989 | B106: SACCHETTI | C106: MAURO | D106: 20 | E106: 9 | G106: 3 | H106: =D106+E106+F106+G106 -> 32
A107: 125652 | B107: SALDARI | C107: FABIO | D107: 13 | E107: 5 | G107: 3 | H107: =D107+E107+F107+G107 -> 21
A108: 121465 | B108: SALICETTI | C108: ANDREA | D108: 10 | E108: 7 | G108: 3 | H108: =D108+E108+F108+G108 -> 20
A109: 121474 | B109: SAMORANI | C109: MICHELE | D109: 20 | E109: 9 | G109: 3 | H109: =D109+E109+F109+G109 -> 32
A110: 123097 | B110: SANTUCCI | C110: PAOLO | D110: 19 | E110: 8 | G110: 3 | H110: =D110+E110+F110+G110 -> 30
A111: 125530 | B111: SIMONE | C111: MICHELE | D111: 21 | E111: 9 | G111: 3 | H111: =D111+E111+F111+G111 -> 33
A112: 122558 | B112: SOTTARA | C112: DAVIDE | D112: 18 | E112: 8 | G112: 3 | H112: =D112+E112+F112+G112 -> 29
A113: 127847 | B113: STORONI | C113: STEFANO | D113: 12 | E113: 8 | G113: 3 | H113: =D113+E113+F113+G113 -> 23
A114: 900000340 | B114: SUZZI | C114: PATRIK | D114: 17 | E114: 6 | G114: 3 | H114: =D114+E114+F114+G114 -> 26
A115: 126674 | B115: TALO' | C115: FRANCESCO | D115: 21 | E115: 8 | G115: 3 | H115: =D115+E115+F115+G115 -> 32
A116: 2146061181 | B116: TAMBURINI | C116: MARCO | D116: 14 | E116: 6 | G116: 3 | H116: =D116+E116+F116+G116 -> 23
A117: 2108055848 | B117: TOMAIUOLI | C117: GIUSEPPE | D117: 19 | E117: 9 | G117: 3 | H117: =D117+E117+F117+G117 -> 31
A118: 2148062646 | B118: TORCHIA | C118: ALESSANDRO | D118: 17 | E118: 3 | G118: 3 | H118: =D118+E118+F118+G118 -> 23
A119: 123243 | B119: TRIVIGNO | C119: ROCCO | D119: 18 | E119: 5 | G119: 3 | H119: =D119+E119+F119+G119 -> 26
A120: 103696 | B120: TUNDIS | C120: LUCA | D120: 14 | E120: 5 | G120: 3 | H120: =D120+E120+F120+G120 -> 22
A121: 105577 | B121: VICINELLI | C121: STEFANO | D121: 19 | E121: 9 | G121: 3 | H121: =D121+E121+F121+G121 -> 31
A122: 122020 | B122: VIGLIOTTI | C122: GUIDO | D122: 16 | E122: 8 | G122: 3 | H122: =D122+E122+F122+G122 -> 27
A123: 128027 | B123: VIOLI | C123: VALENTINA | D123: 9 | E123: 5 | G123: 3 | H123: =D123+E123+F123+G123 -> 17 | I123: *
A124: 122074 | B124: VOLI | C124: STEFANO | D124: 12 | E124: 2 | G124: 3 | H124: =D124+E124+F124+G124 -> 17 | I124: *
A125: 104243 | B125: ZAMBONELLI | C125: LEONARDO | D125: 16 | E125: 9 | G125: 3 | H125: =D125+E125+F125+G125 -> 28
A126: 121870 | B126: ZANELLA | C126: NICOLA | D126: 16 | E126: 2 | G126: 3 | H126: =D126+E126+F126+G126 -> 21
A127: 126687 | B127: ZORZI | C127: ALESSANDRO | D127: 12 | E127: 9 | G127: 3 | H127: =D127+E127+F127+G127 -> 24
A128: * = ammesso/a all'orale
A130: *** CARPENE' e BUCCI non hanno riconsegnato il testo