A1: Fondamenti di Ricerca Operativa LA
A2: Prova Scritta del 18 Dicembre 2006
A4: Validita' per chi non sostiene l'orale: fino al 22 Dicembre 2006, ore 16.00
A5: (non procrastinabile; non si risponde a mail o telefonate in merito).
A7: Validita' per chi sostiene l'orale: fino all'appello di Aprile 2007.
A8: Visione degli elaborati e orali: 22 Dicembre 2006, ore 15.00, Aula 62
A9: Prossimi appelli: Gennaio 2007, Aprile 2007
A11: matricola | B11: Cognome | C11: Nome | D11: 1 | E11: 2 | F11: bonus | G11: voto
A12: 222850 | B12: ACCOGLI | C12: DONATO | D12: 2 | E12: 7 | F12: 3 | G12: =IF(SUM(D12:F12)<17,"Insuff.",SUM(D12:F12)) -> Insuff.
A13: 217184 | B13: ALBERGHINI | C13: ALAN | D13: 17 | E13: 5 | F13: 3 | G13: =IF(SUM(D13:F13)<17,"Insuff.",SUM(D13:F13)) -> 25
A14: 141553 | B14: BALBONI | C14: CHIARA | D14: 5 | E14: 9 | F14: 3 | G14: =IF(SUM(D14:F14)<17,"Insuff.",SUM(D14:F14)) -> 17 | H14: (*)
A15: 223595 | B15: BEDESCHI | C15: EMANUELE | D15: 16 | E15: 2 | F15: 3 | G15: =IF(SUM(D15:F15)<17,"Insuff.",SUM(D15:F15)) -> 21
A16: 133920 | B16: BENVENUTI | C16: LORENZO | D16: 8 | E16: 2 | F16: 3 | G16: =IF(SUM(D16:F16)<17,"Insuff.",SUM(D16:F16)) -> Insuff.
A17: 220193 | B17: BERGAMINI | C17: ENRICO | D17: 5 | E17: 3 | F17: 3 | G17: =IF(SUM(D17:F17)<17,"Insuff.",SUM(D17:F17)) -> Insuff.
A18: 139610 | B18: BIANCONCINI | C18: LUCA | D18: 3 | E18: 2 | F18: 3 | G18: =IF(SUM(D18:F18)<17,"Insuff.",SUM(D18:F18)) -> Insuff.
A19: 218689 | B19: BILLI | C19: DENIS | D19: 13 | E19: 6 | F19: 3 | G19: =IF(SUM(D19:F19)<17,"Insuff.",SUM(D19:F19)) -> 22
A20: 219430 | B20: BOIANI | C20: FABIO | D20: 19 | E20: 10 | F20: 3 | G20: =IF(SUM(D20:F20)<17,"Insuff.",SUM(D20:F20)) -> 32
A21: 218712 | B21: BRUCIATI | C21: STEFANO | D21: 5 | E21: 5 | F21: 3 | G21: =IF(SUM(D21:F21)<17,"Insuff.",SUM(D21:F21)) -> Insuff.
A22: 221404 | B22: BUCALETTI | C22: ANDREA | D22: 19 | E22: 6 | F22: 3 | G22: =IF(SUM(D22:F22)<17,"Insuff.",SUM(D22:F22)) -> 28
A23: 225498 | B23: BUETI | C23: LUCA | D23: 8 | E23: 8 | F23: 3 | G23: =IF(SUM(D23:F23)<17,"Insuff.",SUM(D23:F23)) -> 19
A24: 160958 | B24: BUSICO | C24: ALESSANDRO | D24: 10 | E24: 4 | F24: 3 | G24: =IF(SUM(D24:F24)<17,"Insuff.",SUM(D24:F24)) -> 17 | H24: (*)
A25: 180378 | B25: CALZOLARI | C25: MANUEL | D25: 2 | E25: 7 | F25: 3 | G25: =IF(SUM(D25:F25)<17,"Insuff.",SUM(D25:F25)) -> Insuff.
A26: 217560 | B26: CANDELORO | C26: DAVIDE | D26: 5 | E26: 10 | F26: 3 | G26: =IF(SUM(D26:F26)<17,"Insuff.",SUM(D26:F26)) -> 18
A27: 900009741 | B27: CARAGNULO | C27: VINCENZO | D27: 2 | E27: 0 | F27: 3 | G27: =IF(SUM(D27:F27)<17,"Insuff.",SUM(D27:F27)) -> Insuff.
A28: 900011534 | B28: CARBONARO | C28: FRANCESCO | D28: 5 | E28: 9 | F28: 3 | G28: =IF(SUM(D28:F28)<17,"Insuff.",SUM(D28:F28)) -> 17 | H28: (*)
A29: 217290 | B29: CARPINO | C29: GIULIO | D29: 5 | E29: 9 | F29: 3 | G29: =IF(SUM(D29:F29)<17,"Insuff.",SUM(D29:F29)) -> 17 | H29: (*)
A30: 218734 | B30: CASADIO | C30: MARCO | D30: 7 | E30: 7 | F30: 3 | G30: =IF(SUM(D30:F30)<17,"Insuff.",SUM(D30:F30)) -> 17 | H30: (*)
A31: 219836 | B31: CAVAGNERO | C31: FILIPPO | D31: 4 | E31: 0 | F31: 3 | G31: =IF(SUM(D31:F31)<17,"Insuff.",SUM(D31:F31)) -> Insuff.
A32: 185974 | B32: CHIARELLI | C32: GIOVANNI | D32: 4 | E32: 6 | F32: 0 | G32: =IF(SUM(D32:F32)<17,"Insuff.",SUM(D32:F32)) -> Insuff.
A33: 217397 | B33: CINARDO | C33: ANGELO DAVIDE | D33: 19 | E33: 10 | F33: 3 | G33: =IF(SUM(D33:F33)<17,"Insuff.",SUM(D33:F33)) -> 32
A34: 222373 | B34: COGNIGNI | C34: ALESSIA | D34: 3 | E34: 0 | F34: 3 | G34: =IF(SUM(D34:F34)<17,"Insuff.",SUM(D34:F34)) -> Insuff.
A35: 2146064668 | B35: COLASANTE | C35: FILIPPO | D35: 3 | E35: 2 | F35: 3 | G35: =IF(SUM(D35:F35)<17,"Insuff.",SUM(D35:F35)) -> Insuff.
A36: 219145 | B36: COLONNA | C36: FABRIZIO | D36: 5 | E36: 10 | F36: 3 | G36: =IF(SUM(D36:F36)<17,"Insuff.",SUM(D36:F36)) -> 18
A37: 168244 | B37: CONTE | C37: PASQUALE | D37: 3 | E37: 2 | F37: 3 | G37: =IF(SUM(D37:F37)<17,"Insuff.",SUM(D37:F37)) -> Insuff.
A38: 184583 | B38: CORRADINI | C38: FEDERICO | D38: 19 | E38: 10 | F38: 3 | G38: =IF(SUM(D38:F38)<17,"Insuff.",SUM(D38:F38)) -> 32
A39: 191116 | B39: CURATOLA | C39: GIOVANNI | D39: 7 | E39: 7 | F39: 3 | G39: =IF(SUM(D39:F39)<17,"Insuff.",SUM(D39:F39)) -> 17 | H39: (*)
A40: 225170 | B40: D'ALESSANDRO | C40: MARCO | D40: 7 | E40: 8 | F40: 3 | G40: =IF(SUM(D40:F40)<17,"Insuff.",SUM(D40:F40)) -> 18
A41: 218738 | B41: DE BENEDETTO | C41: JACOPO | D41: 7 | E41: 1 | F41: 3 | G41: =IF(SUM(D41:F41)<17,"Insuff.",SUM(D41:F41)) -> Insuff.
A42: 218094 | B42: DE LUCA | C42: PATRIZIA | D42: 7 | E42: 7 | F42: 3 | G42: =IF(SUM(D42:F42)<17,"Insuff.",SUM(D42:F42)) -> 17 | H42: (*)
A43: 221093 | B43: DE VITO | C43: DIEGO | D43: 12 | E43: 6 | F43: 3 | G43: =IF(SUM(D43:F43)<17,"Insuff.",SUM(D43:F43)) -> 21
A44: 221042 | B44: DECORTE | C44: ANDREA | D44: 6 | E44: 1 | F44: 3 | G44: =IF(SUM(D44:F44)<17,"Insuff.",SUM(D44:F44)) -> Insuff.
A45: 218250 | B45: DELLA MOTTA | C45: ALESSIO | D45: 2 | E45: 2 | F45: 3 | G45: =IF(SUM(D45:F45)<17,"Insuff.",SUM(D45:F45)) -> Insuff.
A46: 222801 | B46: DI CARLO | C46: DOMENICO | D46: 13 | E46: 5 | F46: 3 | G46: =IF(SUM(D46:F46)<17,"Insuff.",SUM(D46:F46)) -> 21
A47: 163504 | B47: DI GIACINTO | C47: EDOARDO | D47: 3 | E47: 7 | F47: 3 | G47: =IF(SUM(D47:F47)<17,"Insuff.",SUM(D47:F47)) -> Insuff.
A48: 900022478 | B48: DI GIOVANNI | C48: FERDINANDO | D48: 5 | E48: 2 | F48: 0 | G48: =IF(SUM(D48:F48)<17,"Insuff.",SUM(D48:F48)) -> Insuff.
A49: 164368 | B49: DI STANISLAO | C49: ALESSANDRO | D49: 4 | E49: 6 | F49: 3 | G49: =IF(SUM(D49:F49)<17,"Insuff.",SUM(D49:F49)) -> Insuff.
A50: 218559 | B50: D'IORIO | C50: ANDREA | D50: 19 | E50: 8 | F50: 3 | G50: =IF(SUM(D50:F50)<17,"Insuff.",SUM(D50:F50)) -> 30
A51: 900025666 | B51: ENYEGUE | C51: FRANCIS DECHERIBERT | D51: 14 | E51: 10 | F51: 3 | G51: =IF(SUM(D51:F51)<17,"Insuff.",SUM(D51:F51)) -> 27
A52: 900026160 | B52: ESPOSITO | C52: GIOVANNI | D52: 6 | E52: 10 | F52: 3 | G52: =IF(SUM(D52:F52)<17,"Insuff.",SUM(D52:F52)) -> 19
A53: 220692 | B53: FAETANI | C53: DANIELE | D53: 15 | E53: 9 | F53: 3 | G53: =IF(SUM(D53:F53)<17,"Insuff.",SUM(D53:F53)) -> 27
A54: 217784 | B54: FERRARI | C54: MARCO | D54: 16 | E54: 1 | F54: 3 | G54: =IF(SUM(D54:F54)<17,"Insuff.",SUM(D54:F54)) -> 20
A55: 218263 | B55: FERRUZZI | C55: SIMONE | D55: 6 | E55: 9 | F55: 3 | G55: =IF(SUM(D55:F55)<17,"Insuff.",SUM(D55:F55)) -> 18
A56: 217189 | B56: FONTANA | C56: DAMIANO | D56: 19 | E56: 10 | F56: 3 | G56: =IF(SUM(D56:F56)<17,"Insuff.",SUM(D56:F56)) -> 32
A57: 217157 | B57: FONTANELLI | C57: DAVIDE | D57: 20 | E57: 10 | F57: 3 | G57: =IF(SUM(D57:F57)<17,"Insuff.",SUM(D57:F57)) -> 33
A58: 167583 | B58: FRISULLO | C58: FEDERICA MARIA | D58: 3 | E58: 6 | F58: 3 | G58: =IF(SUM(D58:F58)<17,"Insuff.",SUM(D58:F58)) -> Insuff.
A59: 220317 | B59: GIAMMARINO | C59: GIUSEPPE | D59: 2 | E59: 4 | F59: 3 | G59: =IF(SUM(D59:F59)<17,"Insuff.",SUM(D59:F59)) -> Insuff.
A60: 217281 | B60: GRASSANO | C60: UGO | D60: 6 | E60: 2 | F60: 3 | G60: =IF(SUM(D60:F60)<17,"Insuff.",SUM(D60:F60)) -> Insuff.
A61: 218082 | B61: GRATTI | C61: LUIGI | D61: 3 | E61: 3 | F61: 3 | G61: =IF(SUM(D61:F61)<17,"Insuff.",SUM(D61:F61)) -> Insuff.
A62: 167601 | B62: HEIBI | C62: FAYAD | D62: 3 | E62: 3 | F62: 3 | G62: =IF(SUM(D62:F62)<17,"Insuff.",SUM(D62:F62)) -> Insuff.
A63: 139629 | B63: IMPOSIMATO | C63: ARTURO | D63: 5 | E63: 0 | F63: 3 | G63: =IF(SUM(D63:F63)<17,"Insuff.",SUM(D63:F63)) -> Insuff.
A64: 224197 | B64: LA ROTA | C64: FRANCESCO MARIA | D64: 14 | E64: 9 | F64: 3 | G64: =IF(SUM(D64:F64)<17,"Insuff.",SUM(D64:F64)) -> 26
A65: 217386 | B65: LAMALFA | C65: SALVATORE | D65: 17 | E65: 3 | F65: 3 | G65: =IF(SUM(D65:F65)<17,"Insuff.",SUM(D65:F65)) -> 23
A66: 126073 | B66: LEONE | C66: MASSIMILIANO | D66: 4 | E66: 0 | F66: 0 | G66: =IF(SUM(D66:F66)<17,"Insuff.",SUM(D66:F66)) -> Insuff.
A67: 217252 | B67: LIVINI | C67: MARCO | D67: 5 | E67: 2 | F67: 3 | G67: =IF(SUM(D67:F67)<17,"Insuff.",SUM(D67:F67)) -> Insuff.
A68: 219487 | B68: LOLLI | C68: ANDREA | D68: 4 | E68: 4 | F68: 3 | G68: =IF(SUM(D68:F68)<17,"Insuff.",SUM(D68:F68)) -> Insuff.
A69: 223425 | B69: LOVERRE | C69: FRANCESCO | D69: 9 | E69: 2 | F69: 3 | G69: =IF(SUM(D69:F69)<17,"Insuff.",SUM(D69:F69)) -> Insuff.
A70: 113561 | B70: LUCHENA | C70: FRANCESCO | D70: 19 | E70: 7 | F70: 3 | G70: =IF(SUM(D70:F70)<17,"Insuff.",SUM(D70:F70)) -> 29
A71: 218720 | B71: MACAGNINO | C71: DANIELE | D71: 5 | E71: 4 | F71: 3 | G71: =IF(SUM(D71:F71)<17,"Insuff.",SUM(D71:F71)) -> Insuff.
A72: 289158 | B72: MACCOLINI | C72: SILVIA | D72: 5 | E72: 10 | F72: 3 | G72: =IF(SUM(D72:F72)<17,"Insuff.",SUM(D72:F72)) -> 18
A73: 227903 | B73: MAISTO | C73: LUCA | D73: 5 | E73: 9 | F73: 3 | G73: =IF(SUM(D73:F73)<17,"Insuff.",SUM(D73:F73)) -> 17 | H73: (*)
A74: 218265 | B74: MANCINI | C74: LAURA | D74: 18 | E74: 9 | F74: 3 | G74: =IF(SUM(D74:F74)<17,"Insuff.",SUM(D74:F74)) -> 30
A75: 900025017 | B75: MANCO | C75: SIMONE | D75: 6 | E75: 5 | F75: 3 | G75: =IF(SUM(D75:F75)<17,"Insuff.",SUM(D75:F75)) -> Insuff.
A76: 124220 | B76: MANESE | C76: STEFANO GUERINO | D76: 2 | E76: 3 | F76: 0 | G76: =IF(SUM(D76:F76)<17,"Insuff.",SUM(D76:F76)) -> Insuff.
A77: 225269 | B77: MATTEI | C77: ALESSANDRO | D77: 16 | E77: 8 | F77: 3 | G77: =IF(SUM(D77:F77)<17,"Insuff.",SUM(D77:F77)) -> 27
A78: 158710 | B78: MONACHINI | C78: LORENZO | D78: 14 | E78: 2 | F78: 3 | G78: =IF(SUM(D78:F78)<17,"Insuff.",SUM(D78:F78)) -> 19
A79: 218598 | B79: NANNI | C79: MARCO | D79: 10 | E79: 8 | F79: 3 | G79: =IF(SUM(D79:F79)<17,"Insuff.",SUM(D79:F79)) -> 21
A80: 217043 | B80: NARDELLI | C80: LUCA | D80: 19 | E80: 5 | F80: 3 | G80: =IF(SUM(D80:F80)<17,"Insuff.",SUM(D80:F80)) -> 27
A81: 107016 | B81: NASILLI | C81: NUNZIO | D81: 3 | E81: 8 | F81: 0 | G81: =IF(SUM(D81:F81)<17,"Insuff.",SUM(D81:F81)) -> Insuff.
A82: 2108059204 | B82: ORTOLANI | C82: MAURIZIO | D82: 6 | E82: 4 | F82: 0 | G82: =IF(SUM(D82:F82)<17,"Insuff.",SUM(D82:F82)) -> Insuff.
A83: 221504 | B83: PACI | C83: FRANCESCO | D83: 18 | E83: 10 | F83: 3 | G83: =IF(SUM(D83:F83)<17,"Insuff.",SUM(D83:F83)) -> 31
A84: 217406 | B84: PALOSSI | C84: DANIELE | D84: 11 | E84: 5 | F84: 3 | G84: =IF(SUM(D84:F84)<17,"Insuff.",SUM(D84:F84)) -> 19
A85: 219175 | B85: PARCAROLI | C85: STEFANO | D85: 7 | E85: 4 | F85: 3 | G85: =IF(SUM(D85:F85)<17,"Insuff.",SUM(D85:F85)) -> Insuff.
A86: 221593 | B86: PEDICINI | C86: FEDELE | D86: 5 | E86: 1 | F86: 3 | G86: =IF(SUM(D86:F86)<17,"Insuff.",SUM(D86:F86)) -> Insuff.
A87: 215458 | B87: PERI | C87: FRANCESCO | D87: 19 | E87: 6 | F87: 3 | G87: =IF(SUM(D87:F87)<17,"Insuff.",SUM(D87:F87)) -> 28
A88: 221855 | B88: PIETROBELLI | C88: FRANCESCO | D88: 14 | E88: 10 | F88: 3 | G88: =IF(SUM(D88:F88)<17,"Insuff.",SUM(D88:F88)) -> 27
A89: 900021517 | B89: QIAO | C89: XIN | D89: 7 | E89: 7 | F89: 3 | G89: =IF(SUM(D89:F89)<17,"Insuff.",SUM(D89:F89)) -> 17 | H89: (*)
A90: 900025170 | B90: ROMANO | C90: MARCO BERNARDINO | D90: 4 | E90: 4 | F90: 3 | G90: =IF(SUM(D90:F90)<17,"Insuff.",SUM(D90:F90)) -> Insuff.
A91: 123698 | B91: RUSSO | C91: GABRIELLA | D91: 5 | E91: 7 | F91: 3 | G91: =IF(SUM(D91:F91)<17,"Insuff.",SUM(D91:F91)) -> Insuff.
A92: 157623 | B92: SANTIN | C92: LUCA | D92: 7 | E92: 7 | F92: 3 | G92: =IF(SUM(D92:F92)<17,"Insuff.",SUM(D92:F92)) -> 17 | H92: (*)
A93: 217777 | B93: SAVIOLI | C93: ENRICO | D93: 20 | E93: 7 | F93: 3 | G93: =IF(SUM(D93:F93)<17,"Insuff.",SUM(D93:F93)) -> 30
A94: 220716 | B94: SELVAGNO | C94: ALESSANDRO | D94: 18 | E94: 7 | F94: 3 | G94: =IF(SUM(D94:F94)<17,"Insuff.",SUM(D94:F94)) -> 28
A95: 217476 | B95: SIBANI | C95: GABRIELE | D95: 11 | E95: 3 | F95: 3 | G95: =IF(SUM(D95:F95)<17,"Insuff.",SUM(D95:F95)) -> 17 | H95: (*)
A96: 900020757 | B96: SIMO DJILO | C96: ZACHARIE | D96: 11 | E96: 3 | F96: 3 | G96: =IF(SUM(D96:F96)<17,"Insuff.",SUM(D96:F96)) -> 17 | H96: (*)
A97: 219400 | B97: TABARONI | C97: ANDREA | D97: 6 | E97: 9 | F97: 3 | G97: =IF(SUM(D97:F97)<17,"Insuff.",SUM(D97:F97)) -> 18
A98: 185954 | B98: TALLA FOKO | C98: ROGER | D98: 4 | E98: 1 | F98: 3 | G98: =IF(SUM(D98:F98)<17,"Insuff.",SUM(D98:F98)) -> Insuff.
A99: 216387 | B99: TERZINI | C99: MARIO | D99: 14 | E99: 10 | F99: 3 | G99: =IF(SUM(D99:F99)<17,"Insuff.",SUM(D99:F99)) -> 27
A100: 180234 | B100: TICCA | C100: NICOLA | D100: 14 | E100: 0 | F100: 3 | G100: =IF(SUM(D100:F100)<17,"Insuff.",SUM(D100:F100)) -> 17 | H100: (*)
A101: 900025844 | B101: TOMMASI | C101: PIERPAOLO | D101: 5 | E101: 0 | F101: 3 | G101: =IF(SUM(D101:F101)<17,"Insuff.",SUM(D101:F101)) -> Insuff.
A102: 221646 | B102: TURRINI | C102: ANDREA | D102: 13 | E102: 3 | F102: 3 | G102: =IF(SUM(D102:F102)<17,"Insuff.",SUM(D102:F102)) -> 19
A103: 162366 | B103: VAGNARELLI | C103: VALERIO | D103: 4 | E103: 4 | F103: 0 | G103: =IF(SUM(D103:F103)<17,"Insuff.",SUM(D103:F103)) -> Insuff.
A104: 179677 | B104: VERDICCHIA | C104: QUINTINO | D104: 19 | E104: 2 | F104: 3 | G104: =IF(SUM(D104:F104)<17,"Insuff.",SUM(D104:F104)) -> 24
A105: 271759 | B105: ZAMPOLINI | C105: GIANFRANCO | D105: 7 | E105: 10 | F105: 3 | G105: =IF(SUM(D105:F105)<17,"Insuff.",SUM(D105:F105)) -> 20
A106: 123295 | B106: ZANELLI | C106: DIEGO | D106: 14 | E106: 7 | F106: 3 | G106: =IF(SUM(D106:F106)<17,"Insuff.",SUM(D106:F106)) -> 24
A107: (*) Puo' registrare 18.