A1: Fondamenti di Ricerca Operativa L-A
A2: Prova Scritta del 26 Giugno 2003
A4: Validita': fino a Settembre 2003
A5: Visione elaborati e orali:Lunedi' 30 Giugno ore 17.00 Aula 6.1
A6: Prossimi appelli: Luglio, Settembre, Gennaio
A8: matricola | B8: Cognome | C8: Nome | D8: 1 | E8: 2 | F8: bonus | G8: voto
A9: 127356 | B9: AGRESTI | C9: SERENA | D9: 18 | E9: 5 | F9: 0 | G9: =SUM(D9:F9) -> 23
A10: 127287 | B10: BARRANO | C10: EMANUELE | D10: 12 | E10: 4 | F10: 0 | G10: =SUM(D10:F10) -> 16 | H10: *
A11: 122490 | B11: BRUNETTI | C11: LUCA | D11: 24 | E11: 5 | F11: 0 | G11: =SUM(D11:F11) -> 29
A12: 121741 | B12: BUCCI | C12: DAVIDE | D12: 12 | E12: 5 | F12: 0 | G12: =SUM(D12:F12) -> 17 | H12: *
A13: 128724 | B13: CESARI | C13: EDOARDO | D13: 11 | E13: 1 | F13: 3 | G13: Insuff.
A14: 114918 | B14: CORSINI | C14: ALESSIO | D14: 8 | E14: 4 | F14: 0 | G14: Insuff.
A15: 2148062024 | B15: GIOVACCHINI | C15: PARIDE | D15: 12 | E15: 3 | F15: 0 | G15: Insuff.
A16: 121979 | B16: GOTTARDI | C16: GIANPAOLO | D16: 22 | E16: 3 | F16: 0 | G16: =SUM(D16:F16) -> 25
A17: 123175 | B17: MONROY | C17: RICARDO | D17: 12 | E17: 4 | F17: 0 | G17: =SUM(D17:F17) -> 16 | H17: *
A18: 121661 | B18: MORLUNGHI | C18: ANDREA | D18: 16 | E18: 3 | F18: 0 | G18: =SUM(D18:F18) -> 19
A19: 900004149 | B19: RINALDI | C19: MARIO | D19: 10 | E19: 4 | F19: 0 | G19: Insuff.
A20: 108113 | B20: VERNA | C20: GERARDO | D20: 8 | E20: 3 | F20: 0 | G20: Insuff.
A21: 128027 | B21: VIOLI | C21: VALENTINA | D21: 14 | E21: 5 | F21: 0 | G21: =SUM(D21:F21) -> 19
A22: 122074 | B22: VOLI | C22: STEFANO | D22: 5 | E22: 3 | F22: 0 | G22: Insuff.
A23: * = ammesso all'orale