A1: Fondamenti di Ricerca Operativa L-A
A2: Prova Scritta del 24 Marzo 2005
A4: Validita' per chi registra direttamente il voto: fino a giovedi' 31 Marzo 2005.
A5: Validita' per chi sostiene l'orale: fino a Giugno 2005.
A6: Visione degli elaborati e orali: giovedi' 31 Marzo 2005, ore 14.00, Aula 81
A7: Prossimi appelli: 12 Aprile 2005, Giugno 2005, Luglio 2005
A9: matricola | B9: Cognome | C9: Nome | D9: 1 | E9: 2 | F9: bonus | G9: voto
A10: 221057 | B10: ACERBO | C10: LORENZO | D10: 18 | E10: 6 | F10: 3 | G10: =IF(SUM(D10:F10)<18,"Insuff.",SUM(D10:F10)) -> 27
A11: 161187 | B11: ACHILLE | C11: FRANCESCO | D11: 22 | E11: 8 | F11: 3 | G11: =IF(SUM(D11:F11)<18,"Insuff.",SUM(D11:F11)) -> 33
A12: 130382 | B12: ALAGNA | C12: LUCA | D12: 20 | E12: 1 | F12: 3 | G12: =IF(SUM(D12:F12)<18,"Insuff.",SUM(D12:F12)) -> 24
A13: 161252 | B13: ANTONELLI | C13: ALESSANDRO | D13: 19 | E13: 8 | F13: 3 | G13: =IF(SUM(D13:F13)<18,"Insuff.",SUM(D13:F13)) -> 30
A14: 159852 | B14: ARTESINO | C14: SIMONE | D14: 14 | E14: 8 | F14: 3 | G14: =IF(SUM(D14:F14)<18,"Insuff.",SUM(D14:F14)) -> 25
A15: 161408 | B15: BARBIERI | C15: PRISCO | D15: 8 | E15: 0 | F15: 3 | G15: =IF(SUM(D15:F15)<18,"Insuff.",SUM(D15:F15)) -> Insuff.
A16: 158824 | B16: BASSETTI | C16: MANUELA | D16: 22 | E16: 5 | F16: 3 | G16: =IF(SUM(D16:F16)<18,"Insuff.",SUM(D16:F16)) -> 30
A17: 162437 | B17: BENCIVENNI | C17: PIERO | D17: 20 | E17: 3 | F17: 3 | G17: =IF(SUM(D17:F17)<18,"Insuff.",SUM(D17:F17)) -> 26
A18: 900011581 | B18: BENINI | C18: MASSIMO | D18: 20 | E18: 8 | F18: 3 | G18: =IF(SUM(D18:F18)<18,"Insuff.",SUM(D18:F18)) -> 31
A19: 157833 | B19: BENINI | C19: PAOLO | D19: 20 | E19: 1 | F19: 3 | G19: =IF(SUM(D19:F19)<18,"Insuff.",SUM(D19:F19)) -> 24
A20: 157856 | B20: BERTELLI | C20: GIANLUCA | D20: 22 | E20: 5 | F20: 3 | G20: =IF(SUM(D20:F20)<18,"Insuff.",SUM(D20:F20)) -> 30
A21: 2148064414 | B21: BERTONI | C21: GIANLUCA | D21: 10 | E21: 1 | F21: 3 | G21: =IF(SUM(D21:F21)<18,"Insuff.",SUM(D21:F21)) -> Insuff.
A22: 122282 | B22: BETTI | C22: ALESSANDRO | D22: 12 | E22: 0 | F22: 0 | G22: =IF(SUM(D22:F22)<18,"Insuff.",SUM(D22:F22)) -> Insuff.
A23: 900005789 | B23: BIANCHERA | C23: DANIELE | D23: 21 | E23: 8 | F23: 3 | G23: =IF(SUM(D23:F23)<18,"Insuff.",SUM(D23:F23)) -> 32
A24: 156855 | B24: BORSELLI | C24: MICHELE | D24: 15 | E24: 3 | F24: 3 | G24: =IF(SUM(D24:F24)<18,"Insuff.",SUM(D24:F24)) -> 21
A25: 162925 | B25: BORTOLINI | C25: MARIA ELENA | D25: 18 | E25: 1 | F25: 3 | G25: =IF(SUM(D25:F25)<18,"Insuff.",SUM(D25:F25)) -> 22
A26: 161451 | B26: BRANDOLESE | C26: ANDREA | D26: 21 | E26: 4 | F26: 3 | G26: =IF(SUM(D26:F26)<18,"Insuff.",SUM(D26:F26)) -> 28
A27: 157684 | B27: CAFINI | C27: RAUL | D27: 12 | E27: 0 | F27: 3 | G27: =IF(SUM(D27:F27)<18,"Insuff.",SUM(D27:F27)) -> Insuff.
A28: 140594 | B28: CAMAIONI | C28: EMANUELE | D28: 17 | E28: 3 | F28: 3 | G28: =IF(SUM(D28:F28)<18,"Insuff.",SUM(D28:F28)) -> 23
A29: 149988 | B29: CAMPITELLI | C29: NUNZIO | D29: 11 | E29: 7 | F29: 3 | G29: =IF(SUM(D29:F29)<18,"Insuff.",SUM(D29:F29)) -> 21
A30: 162316 | B30: CANTORESI | C30: PATRIZIA | D30: 22 | E30: 8 | F30: 3 | G30: =IF(SUM(D30:F30)<18,"Insuff.",SUM(D30:F30)) -> 33
A31: 900003451 | B31: CAVALLARI | C31: VALERIA | D31: 20 | E31: 4 | F31: 3 | G31: =IF(SUM(D31:F31)<18,"Insuff.",SUM(D31:F31)) -> 27
A32: 160528 | B32: CERAVOLO | C32: FRANCESCO | D32: 21 | E32: 8 | F32: 3 | G32: =IF(SUM(D32:F32)<18,"Insuff.",SUM(D32:F32)) -> 32
A33: 229657 | B33: CHIARINI | C33: MATTIA | D33: 7 | E33: 0 | F33: 3 | G33: =IF(SUM(D33:F33)<18,"Insuff.",SUM(D33:F33)) -> Insuff.
A34: 163489 | B34: CINALLI | C34: PATRIC | D34: 12 | E34: 8 | F34: 3 | G34: =IF(SUM(D34:F34)<18,"Insuff.",SUM(D34:F34)) -> 23
A35: 157932 | B35: CIRRI | C35: ANDREA | D35: 21 | E35: 3 | F35: 3 | G35: =IF(SUM(D35:F35)<18,"Insuff.",SUM(D35:F35)) -> 27
A36: 900003238 | B36: COIANA | C36: ROBERTO | D36: 17 | E36: 6 | F36: 3 | G36: =IF(SUM(D36:F36)<18,"Insuff.",SUM(D36:F36)) -> 26
A37: 158275 | B37: CORAPI | C37: DOMENICO | D37: 21 | E37: 8 | F37: 3 | G37: =IF(SUM(D37:F37)<18,"Insuff.",SUM(D37:F37)) -> 32
A38: 157964 | B38: CORVARO | C38: MATTEO | D38: 20 | E38: 5 | F38: 3 | G38: =IF(SUM(D38:F38)<18,"Insuff.",SUM(D38:F38)) -> 28
A39: 160485 | B39: DAL MONTE | C39: AGNESE | D39: 21 | E39: 8 | F39: 3 | G39: =IF(SUM(D39:F39)<18,"Insuff.",SUM(D39:F39)) -> 32
A40: 157982 | B40: DI LELLO | C40: ALESSANDRO | D40: 22 | E40: 8 | F40: 3 | G40: =IF(SUM(D40:F40)<18,"Insuff.",SUM(D40:F40)) -> 33
A41: 164605 | B41: DI MARIA | C41: COSTANZO | D41: 21 | E41: 8 | F41: 3 | G41: =IF(SUM(D41:F41)<18,"Insuff.",SUM(D41:F41)) -> 32
A42: 158845 | B42: DIGNANI | C42: DANILO | D42: 21 | E42: 5 | F42: 3 | G42: =IF(SUM(D42:F42)<18,"Insuff.",SUM(D42:F42)) -> 29
A43: 159128 | B43: DINARDO | C43: MICHELE | D43: 18 | E43: 8 | F43: 3 | G43: =IF(SUM(D43:F43)<18,"Insuff.",SUM(D43:F43)) -> 29
A44: 166694 | B44: FARACI | C44: FABIO | D44: 0 | E44: 0 | F44: 3 | G44: =IF(SUM(D44:F44)<18,"Insuff.",SUM(D44:F44)) -> Insuff.
A45: 157748 | B45: FERRI | C45: FRANCESCO | D45: 18 | E45: 6 | F45: 3 | G45: =IF(SUM(D45:F45)<18,"Insuff.",SUM(D45:F45)) -> 27
A46: 160516 | B46: FERRONI | C46: ADRIANO | D46: 13 | E46: 2 | F46: 3 | G46: =IF(SUM(D46:F46)<18,"Insuff.",SUM(D46:F46)) -> 18
A47: 144319 | B47: FILOPOULOS | C47: NIKOS | D47: 22 | E47: 7 | F47: 3 | G47: =IF(SUM(D47:F47)<18,"Insuff.",SUM(D47:F47)) -> 32
A48: 159638 | B48: FIOCCHI | C48: RICCARDO | D48: 16 | E48: 4 | F48: 3 | G48: =IF(SUM(D48:F48)<18,"Insuff.",SUM(D48:F48)) -> 23
A49: 158280 | B49: FLORIO | C49: CHRISTIAN | D49: 13 | E49: 8 | F49: 3 | G49: =IF(SUM(D49:F49)<18,"Insuff.",SUM(D49:F49)) -> 24
A50: 227706 | B50: FRANCIOSI | C50: LORENZO | D50: 6 | E50: 1 | F50: 3 | G50: =IF(SUM(D50:F50)<18,"Insuff.",SUM(D50:F50)) -> Insuff.
A51: 170532 | B51: FUSARO | C51: FAUSTO GIORGIO MARIA | D51: 22 | E51: 6 | F51: 3 | G51: =IF(SUM(D51:F51)<18,"Insuff.",SUM(D51:F51)) -> 31
A52: 158414 | B52: GALASSI | C52: FRANCESCO | D52: 20 | E52: 8 | F52: 3 | G52: =IF(SUM(D52:F52)<18,"Insuff.",SUM(D52:F52)) -> 31
A53: 168023 | B53: GESUALDI | C53: MARCO MATTEO | D53: 21 | E53: 8 | F53: 3 | G53: =IF(SUM(D53:F53)<18,"Insuff.",SUM(D53:F53)) -> 32
A54: 160204 | B54: GHIRLANDA | C54: MARCO | D54: 12 | E54: 6 | F54: 3 | G54: =IF(SUM(D54:F54)<18,"Insuff.",SUM(D54:F54)) -> 21
A55: 159028 | B55: GIOMBI | C55: GIORGIO | D55: 19 | E55: 8 | F55: 3 | G55: =IF(SUM(D55:F55)<18,"Insuff.",SUM(D55:F55)) -> 30
A56: 2148062452 | B56: GIORGI | C56: GIANMARCO | D56: 6 | E56: 1 | F56: 0 | G56: =IF(SUM(D56:F56)<18,"Insuff.",SUM(D56:F56)) -> Insuff.
A57: 158576 | B57: GIOVANNELLI | C57: ANTONIO | D57: 18 | E57: 8 | F57: 3 | G57: =IF(SUM(D57:F57)<18,"Insuff.",SUM(D57:F57)) -> 29
A58: 160563 | B58: GIRI | C58: GIANLUCA | D58: 22 | E58: 8 | F58: 3 | G58: =IF(SUM(D58:F58)<18,"Insuff.",SUM(D58:F58)) -> 33
A59: 168897 | B59: GIULIONI | C59: CRISTIANO | D59: 19 | E59: 6 | F59: 3 | G59: =IF(SUM(D59:F59)<18,"Insuff.",SUM(D59:F59)) -> 28
A60: 161980 | B60: GREGORI | C60: RICCARDO | D60: 21 | E60: 8 | F60: 3 | G60: =IF(SUM(D60:F60)<18,"Insuff.",SUM(D60:F60)) -> 32
A61: 165737 | B61: GROTTESI | C61: RENATO | D61: 16 | E61: 5 | F61: 3 | G61: =IF(SUM(D61:F61)<18,"Insuff.",SUM(D61:F61)) -> 24
A62: 900007168 | B62: KENMEGNE TAME | C62: CAMILLE | D62: 14 | E62: 1 | F62: 3 | G62: =IF(SUM(D62:F62)<18,"Insuff.",SUM(D62:F62)) -> 18
A63: 167722 | B63: LA MORGIA | C63: CINZIA | D63: 20 | E63: 8 | F63: 3 | G63: =IF(SUM(D63:F63)<18,"Insuff.",SUM(D63:F63)) -> 31
A64: 166964 | B64: LAGNA | C64: ANTONIO | D64: 9 | E64: 6 | F64: 3 | G64: =IF(SUM(D64:F64)<18,"Insuff.",SUM(D64:F64)) -> 18
A65: 131127 | B65: LEFEMINE | C65: VITO | D65: 12 | E65: 6 | F65: 0 | G65: =IF(SUM(D65:F65)<18,"Insuff.",SUM(D65:F65)) -> 18
A66: 900013208 | B66: LOPCI | C66: JUVENT | D66: 22 | E66: 8 | F66: 3 | G66: =IF(SUM(D66:F66)<18,"Insuff.",SUM(D66:F66)) -> 33
A67: 900018289 | B67: LOPOPOLO | C67: MAURO | D67: 18 | E67: 6 | F67: 3 | G67: =IF(SUM(D67:F67)<18,"Insuff.",SUM(D67:F67)) -> 27
A68: 158219 | B68: MALTONI | C68: ELISA | D68: 9 | E68: 6 | F68: 3 | G68: =IF(SUM(D68:F68)<18,"Insuff.",SUM(D68:F68)) -> 18
A69: 158006 | B69: MARONCELLI | C69: GIOVANNI | D69: 16 | E69: 6 | F69: 3 | G69: =IF(SUM(D69:F69)<18,"Insuff.",SUM(D69:F69)) -> 25
A70: 157432 | B70: MASI | C70: FRANCESCO | D70: 21 | E70: 7 | F70: 3 | G70: =IF(SUM(D70:F70)<18,"Insuff.",SUM(D70:F70)) -> 31
A71: 130238 | B71: MENALDO | C71: GIACOMO | D71: 21 | E71: 1 | F71: 3 | G71: =IF(SUM(D71:F71)<18,"Insuff.",SUM(D71:F71)) -> 25
A72: 158349 | B72: MENGOLI | C72: DARIO | D72: 11 | E72: 6 | F72: 3 | G72: =IF(SUM(D72:F72)<18,"Insuff.",SUM(D72:F72)) -> 20
A73: 161488 | B73: MINARDI | C73: CLAUDIO | D73: 21 | E73: 8 | F73: 3 | G73: =IF(SUM(D73:F73)<18,"Insuff.",SUM(D73:F73)) -> 32
A74: 900012086 | B74: MINELLI | C74: MARCO | D74: 18 | E74: 0 | F74: 3 | G74: =IF(SUM(D74:F74)<18,"Insuff.",SUM(D74:F74)) -> 21
A75: 158527 | B75: MINIELLO | C75: GIUSEPPE | D75: 22 | E75: 8 | F75: 3 | G75: =IF(SUM(D75:F75)<18,"Insuff.",SUM(D75:F75)) -> 33
A76: 900011722 | B76: MONTECCHIA | C76: AMBRA | D76: 20 | E76: 8 | F76: 3 | G76: =IF(SUM(D76:F76)<18,"Insuff.",SUM(D76:F76)) -> 31
A77: 158779 | B77: MONTI | C77: STEFANO | D77: 19 | E77: 6 | F77: 3 | G77: =IF(SUM(D77:F77)<18,"Insuff.",SUM(D77:F77)) -> 28
A78: 168942 | B78: NANNI | C78: VALERIA | D78: 20 | E78: 4 | F78: 3 | G78: =IF(SUM(D78:F78)<18,"Insuff.",SUM(D78:F78)) -> 27
A79: 161825 | B79: NEGRO | C79: ROCCO | D79: 17 | E79: 7 | F79: 3 | G79: =IF(SUM(D79:F79)<18,"Insuff.",SUM(D79:F79)) -> 27
A80: 157408 | B80: NERI | C80: ANDREA | D80: 11 | E80: 8 | F80: 3 | G80: =IF(SUM(D80:F80)<18,"Insuff.",SUM(D80:F80)) -> 22
A81: 900005606 | B81: OCCHIPINTI | C81: ANDREA | D81: 21 | E81: 8 | F81: 0 | G81: =IF(SUM(D81:F81)<18,"Insuff.",SUM(D81:F81)) -> 29
A82: 162519 | B82: ORSI | C82: MICHELE | D82: 22 | E82: 5 | F82: 3 | G82: =IF(SUM(D82:F82)<18,"Insuff.",SUM(D82:F82)) -> 30
A83: 142594 | B83: ORTOLANI | C83: ALESSANDRO | D83: 15 | E83: 0 | F83: 3 | G83: =IF(SUM(D83:F83)<18,"Insuff.",SUM(D83:F83)) -> 18
A84: 158820 | B84: PALUMBO | C84: CLAUDIO | D84: 21 | E84: 5 | F84: 3 | G84: =IF(SUM(D84:F84)<18,"Insuff.",SUM(D84:F84)) -> 29
A85: 163236 | B85: PATRICELLI | C85: LUIGI | D85: 20 | E85: 6 | F85: 3 | G85: =IF(SUM(D85:F85)<18,"Insuff.",SUM(D85:F85)) -> 29
A86: 233655 | B86: PELAGATTI | C86: NICOLA | D86: 11 | E86: 1 | F86: 3 | G86: =IF(SUM(D86:F86)<18,"Insuff.",SUM(D86:F86)) -> Insuff.
A87: 165941 | B87: PERSI | C87: SARA | D87: 22 | E87: 8 | F87: 3 | G87: =IF(SUM(D87:F87)<18,"Insuff.",SUM(D87:F87)) -> 33
A88: 160489 | B88: PESENTI | C88: ANDREA | D88: 20 | E88: 8 | F88: 3 | G88: =IF(SUM(D88:F88)<18,"Insuff.",SUM(D88:F88)) -> 31
A89: 160318 | B89: PETROSINO | C89: MATTIA | D89: 17 | E89: 8 | F89: 3 | G89: =IF(SUM(D89:F89)<18,"Insuff.",SUM(D89:F89)) -> 28
A90: 143287 | B90: POLETTI | C90: LUCA | D90: 21 | E90: 8 | F90: 3 | G90: =IF(SUM(D90:F90)<18,"Insuff.",SUM(D90:F90)) -> 32
A91: 162333 | B91: PORZI | C91: FABRIZIO | D91: 22 | E91: 8 | F91: 3 | G91: =IF(SUM(D91:F91)<18,"Insuff.",SUM(D91:F91)) -> 33
A92: 162228 | B92: PRENCIPE | C92: PAOLO | D92: 17 | E92: 3 | F92: 3 | G92: =IF(SUM(D92:F92)<18,"Insuff.",SUM(D92:F92)) -> 23
A93: 159749 | B93: QUARANTA | C93: MARCO | D93: 19 | E93: 6 | F93: 3 | G93: =IF(SUM(D93:F93)<18,"Insuff.",SUM(D93:F93)) -> 28
A94: 163651 | B94: RISI | C94: IACOPO | D94: 10 | E94: 5 | F94: 3 | G94: =IF(SUM(D94:F94)<18,"Insuff.",SUM(D94:F94)) -> 18
A95: 158318 | B95: RIZZI | C95: ELISA | D95: 19 | E95: 8 | F95: 3 | G95: =IF(SUM(D95:F95)<18,"Insuff.",SUM(D95:F95)) -> 30
A96: 128176 | B96: ROSADA | C96: GIOVANNI BATTISTA | D96: 20 | E96: 2 | F96: 0 | G96: =IF(SUM(D96:F96)<18,"Insuff.",SUM(D96:F96)) -> 22
A97: 222378 | B97: ROSSI | C97: EMANUELE | D97: 7 | E97: 6 | F97: 3 | G97: =IF(SUM(D97:F97)<18,"Insuff.",SUM(D97:F97)) -> Insuff.
A98: 2148054237 | B98: ROSSI | C98: FRANCESCO | D98: 19 | E98: 1 | F98: 3 | G98: =IF(SUM(D98:F98)<18,"Insuff.",SUM(D98:F98)) -> 23
A99: 160074 | B99: ROSSIGNOLI | C99: ENRICO | D99: 21 | E99: 6 | F99: 3 | G99: =IF(SUM(D99:F99)<18,"Insuff.",SUM(D99:F99)) -> 30
A100: 160495 | B100: ROVATTI | C100: FABRIZIO | D100: 22 | E100: 5 | F100: 3 | G100: =IF(SUM(D100:F100)<18,"Insuff.",SUM(D100:F100)) -> 30
A101: 158184 | B101: SCALAVINO | C101: ENRICO | D101: 21 | E101: 8 | F101: 3 | G101: =IF(SUM(D101:F101)<18,"Insuff.",SUM(D101:F101)) -> 32
A102: 157906 | B102: SERRANGELI | C102: ALESSIO | D102: 18 | E102: 8 | F102: 3 | G102: =IF(SUM(D102:F102)<18,"Insuff.",SUM(D102:F102)) -> 29
A103: 162004 | B103: SIGNANI | C103: LORENZO | D103: 11 | E103: 4 | F103: 3 | G103: =IF(SUM(D103:F103)<18,"Insuff.",SUM(D103:F103)) -> 18
A104: 161624 | B104: SINATTI | C104: STEFANO | D104: 19 | E104: 0 | F104: 3 | G104: =IF(SUM(D104:F104)<18,"Insuff.",SUM(D104:F104)) -> 22
A105: 140287 | B105: SLAGER | C105: GIANFILIPPO | D105: 18 | E105: 1 | F105: 3 | G105: =IF(SUM(D105:F105)<18,"Insuff.",SUM(D105:F105)) -> 22
A106: 159585 | B106: SOFFRITTI | C106: LUCA | D106: 14 | E106: 5 | F106: 3 | G106: =IF(SUM(D106:F106)<18,"Insuff.",SUM(D106:F106)) -> 22
A107: 159835 | B107: SPADAVECCHIA | C107: STEFANO | D107: 15 | E107: 8 | F107: 3 | G107: =IF(SUM(D107:F107)<18,"Insuff.",SUM(D107:F107)) -> 26
A108: 157278 | B108: SPROTETTO | C108: FRANCESCO MARIA | D108: 11 | E108: 4 | F108: 3 | G108: =IF(SUM(D108:F108)<18,"Insuff.",SUM(D108:F108)) -> 18
A109: 230797 | B109: TASSINI | C109: NICOLA | D109: 8 | E109: 0 | F109: 3 | G109: =IF(SUM(D109:F109)<18,"Insuff.",SUM(D109:F109)) -> Insuff.
A110: 159528 | B110: TILES | C110: DANIELE | D110: 20 | E110: 6 | F110: 3 | G110: =IF(SUM(D110:F110)<18,"Insuff.",SUM(D110:F110)) -> 29
A111: 158206 | B111: TIRAFERRI | C111: DANIELE | D111: 16 | E111: 6 | F111: 3 | G111: =IF(SUM(D111:F111)<18,"Insuff.",SUM(D111:F111)) -> 25
A112: 168821 | B112: TRAINA | C112: SALVATORE | D112: 7 | E112: 8 | F112: 3 | G112: =IF(SUM(D112:F112)<18,"Insuff.",SUM(D112:F112)) -> 18
A113: 163298 | B113: TRECCANI | C113: TIZIANO | D113: 5 | E113: 6 | F113: 3 | G113: =IF(SUM(D113:F113)<18,"Insuff.",SUM(D113:F113)) -> Insuff.
A114: 164814 | B114: TUFAROLO | C114: YURI | D114: 22 | E114: 4 | F114: 3 | G114: =IF(SUM(D114:F114)<18,"Insuff.",SUM(D114:F114)) -> 29
A115: 158267 | B115: VARRIANO | C115: PAOLA | D115: 20 | E115: 5 | F115: 3 | G115: =IF(SUM(D115:F115)<18,"Insuff.",SUM(D115:F115)) -> 28
A116: 158468 | B116: VENTURI | C116: MAURIZIO | D116: 22 | E116: 8 | F116: 3 | G116: =IF(SUM(D116:F116)<18,"Insuff.",SUM(D116:F116)) -> 33
A117: 159346 | B117: VITALI | C117: ANDREA | D117: 22 | E117: 8 | F117: 3 | G117: =IF(SUM(D117:F117)<18,"Insuff.",SUM(D117:F117)) -> 33
A118: 900012076 | B118: VUKOVIC | C118: VELJKO | D118: 6 | E118: 6 | F118: 3 | G118: =IF(SUM(D118:F118)<18,"Insuff.",SUM(D118:F118)) -> Insuff.
A119: 233659 | B119: ZACCHE | C119: ALESSANDRO | D119: 11 | E119: 4 | F119: 3 | G119: =IF(SUM(D119:F119)<18,"Insuff.",SUM(D119:F119)) -> 18
A120: 157573 | B120: ZANARDI | C120: VALENTINA | D120: 21 | E120: 8 | F120: 3 | G120: =IF(SUM(D120:F120)<18,"Insuff.",SUM(D120:F120)) -> 32
A121: 900003862 | B121: ZECCA | C121: PARIDE | D121: 20 | E121: 1 | F121: 3 | G121: =IF(SUM(D121:F121)<18,"Insuff.",SUM(D121:F121)) -> 24