A1: Fondamenti di Ricerca Operativa L-A
A2: Prova Scritta del 14 Luglio 2004
A4: Validita' per chi registra direttamente il voto: fino a mercoledi' 21 Luglio 2004.
A5: Validita' per chi sostiene l'orale: fino a Gennaio 2005.
A6: Visione degli elaborati e orali: Mercoledi' 21 Lugio 2004, ore 15.00, Aula 61
A7: Prossimi appelli: Settembre, Gennaio
A9: matricola | B9: Cognome | C9: Nome | D9: 1 | E9: 2 | F9: bonus | G9: voto
A10: 123594 | B10: BALDUCCI | C10: DANIELE | D10: 5 | E10: 7 | F10: 0 | G10: Insuff.
A11: 2148062305 | B11: BRUNELLI | C11: FRANCESCA | D11: 9 | E11: 2 | F11: 0 | G11: Insuff.
A12: 143222 | B12: CORBELLI | C12: MATTEO | D12: 10 | E12: 5 | F12: 3 | G12: =SUM(D12:F12) -> 18
A13: 106249 | B13: D'APOLITO | C13: FABIO | D13: 15 | E13: 8 | F13: 3 | G13: =SUM(D13:F13) -> 26
A14: 2148064426 | B14: D'ARDES | C14: LUCA | D14: 6 | E14: 0 | F14: 3 | G14: Insuff.
A15: 143865 | B15: DE ANGELIS | C15: DANIELE | D15: 13 | E15: 8 | F15: 3 | G15: =SUM(D15:F15) -> 24
A16: 142395 | B16: DI FABIO | C16: CARMINE | D16: 14 | E16: 0 | F16: 3 | G16: =SUM(D16:F16) -> 17 | H16: *
A17: 900003191 | B17: DI STEFANO | C17: NUNZIO | D17: 7 | E17: 1 | F17: 0 | G17: Insuff.
A18: 104930 | B18: DI TOLLO | C18: ALFONSO | D18: 18 | E18: 3 | F18: 0 | G18: =SUM(D18:F18) -> 21
A19: 141194 | B19: FARINA | C19: CRISTIAN | D19: 19 | E19: 8 | F19: 0 | G19: =SUM(D19:F19) -> 27
A20: 127861 | B20: GELSUMINO | C20: ERIKA | D20: 8 | E20: 1 | F20: 0 | G20: Insuff.
A21: 2148062452 | B21: GIORGI | C21: GIANMARCO | D21: 6 | E21: 1 | F21: 0 | G21: Insuff.
A22: 131127 | B22: LEFEMINE | C22: VITO | D22: 9 | E22: 5 | F22: 3 | G22: =SUM(D22:F22) -> 17 | H22: *
A23: 144302 | B23: MACCIONI | C23: CARLA | D23: 20 | E23: 8 | F23: 3 | G23: =SUM(D23:F23) -> 31
A24: 106904 | B24: MARINO | C24: LUIGI | D24: 6 | E24: 8 | F24: 0 | G24: Insuff.
B25: OCCHIPINTI | C25: ANDREA | D25: 10 | E25: 2 | F25: 3 | G25: Insuff.
A26: 139463 | B26: PALMUCCI | C26: MASSIMILIANO | D26: 8 | E26: 0 | F26: 3 | G26: Insuff.
A27: 139974 | B27: PASINI | C27: ALESSANDRO | D27: 15 | E27: 4 | F27: 3 | G27: =SUM(D27:F27) -> 22
A28: 146630 | B28: PEDONE | C28: GIOVANNI | D28: 4 | E28: 4 | F28: 3 | G28: Insuff.
A29: 2148062353 | B29: PIKASSIS | C29: CRISTINA CATERINA | D29: 2 | E29: 0 | F29: 0 | G29: Insuff.
A30: 148973 | B30: PINTO | C30: ALBERTO | D30: 8 | E30: 1 | F30: 0 | G30: Insuff.
A31: 128984 | B31: RASPADORI | C31: GIANLUCA | D31: 9 | E31: 3 | F31: 0 | G31: Insuff.
A32: 900007158 | B32: SAPORITO | C32: MASSIMILIANO | D32: 4 | E32: 0 | F32: 0 | G32: Insuff.
A33: 140069 | B33: SPECA | C33: YARI | D33: 2 | E33: 3 | F33: 3 | G33: Insuff.
A34: 2148064438 | B34: TEMPESTA | C34: DAVIDE | D34: 6 | E34: 1 | F34: 3 | G34: Insuff.
A35: 126571 | B35: TILLI | C35: PRIMO | D35: 6 | E35: 3 | F35: 0 | G35: Insuff.
A36: * Puo' registrare 18