A1: Fondamenti di Ricerca Operativa L-A
A2: Prova Scritta del 22 Giugno 2005
A4: Validita' per chi registra direttamente il voto: fino a giovedi' 30 Giugno 2005.
A5: Validita' per chi sostiene l'orale: fino a Settembre 2005.
A6: Visione degli elaborati e orali: giovedi' 30 Giugno 2005, ore 15.00, Aula 61
A7: Prossimi appelli: Luglio 2005, Settembre 2005
A9: matricola | B9: Cognome | C9: Nome | D9: 1 | E9: 2 | F9: bonus | G9: voto
A10: 145393 | B10: BADIALI | C10: MARCO | D10: 11 | E10: 7 | F10: 0 | G10: =IF(SUM(D10:F10)<18,"Insuff.",SUM(D10:F10)) -> 18
A11: 122282 | B11: BETTI | C11: ALESSANDRO | D11: 9 | E11: 1 | F11: 0 | G11: =IF(SUM(D11:F11)<18,"Insuff.",SUM(D11:F11)) -> Insuff. | H11: ***
A12: 141277 | B12: BON | C12: ALESSANDRO | D12: 19 | E12: 5 | F12: 0 | G12: =IF(SUM(D12:F12)<18,"Insuff.",SUM(D12:F12)) -> 24
A13: 128045 | B13: CAVALLARO | C13: FRANCESCO | D13: 11 | E13: 2 | F13: 0 | G13: =IF(SUM(D13:F13)<18,"Insuff.",SUM(D13:F13)) -> Insuff.
A14: 159335 | B14: D'APOTE | C14: LEONARDO | D14: 6 | E14: 10 | F14: 3 | G14: =IF(SUM(D14:F14)<18,"Insuff.",SUM(D14:F14)) -> 19
A15: 140903 | B15: D'ASCANIO | C15: AMEDEO | D15: 10 | E15: 3 | F15: 0 | G15: =IF(SUM(D15:F15)<18,"Insuff.",SUM(D15:F15)) -> Insuff.
A16: 158166 | B16: DE FILIPPIS | C16: LUCA | D16: 15 | E16: 10 | F16: 3 | G16: =IF(SUM(D16:F16)<18,"Insuff.",SUM(D16:F16)) -> 28
A17: 900012012 | B17: DE MARCO | C17: MASSIMO | D17: 19 | E17: 3 | F17: 3 | G17: =IF(SUM(D17:F17)<18,"Insuff.",SUM(D17:F17)) -> 25
A18: 144105 | B18: D'ERCOLE | C18: FRANCESCO | D18: 17 | E18: 6 | F18: 3 | G18: =IF(SUM(D18:F18)<18,"Insuff.",SUM(D18:F18)) -> 26
A19: 166694 | B19: FARACI | C19: FABIO | D19: 1 | E19: 2 | F19: 0 | G19: =IF(SUM(D19:F19)<18,"Insuff.",SUM(D19:F19)) -> Insuff. | H19: ***
A20: 227706 | B20: FRANCIOSI | C20: LORENZO | D20: 18 | E20: 5 | F20: 0 | G20: =IF(SUM(D20:F20)<18,"Insuff.",SUM(D20:F20)) -> 23
A21: 236072 | B21: FURLOTTI | C21: ANDREA | D21: 15 | E21: 0 | F21: 3 | G21: =IF(SUM(D21:F21)<18,"Insuff.",SUM(D21:F21)) -> 18
A22: 166964 | B22: LAGNA | C22: ANTONIO | D22: 19 | E22: 6 | F22: 0 | G22: =IF(SUM(D22:F22)<18,"Insuff.",SUM(D22:F22)) -> 25
A23: 107899 | B23: MALVASIO | C23: ELISA | D23: 9 | E23: 1 | F23: 0 | G23: =IF(SUM(D23:F23)<18,"Insuff.",SUM(D23:F23)) -> Insuff.
A24: 235389 | B24: MARTELLA | C24: ALESSANDRO | D24: 0 | E24: 0 | F24: 0 | G24: =IF(SUM(D24:F24)<18,"Insuff.",SUM(D24:F24)) -> Insuff.
A25: 158022 | B25: PALMISANO | C25: GIOVANNI | D25: 8 | E25: 1 | F25: 0 | G25: =IF(SUM(D25:F25)<18,"Insuff.",SUM(D25:F25)) -> Insuff.
A26: 139463 | B26: PALMUCCI | C26: MASSIMILIANO | D26: 18 | E26: 0 | F26: 0 | G26: =IF(SUM(D26:F26)<18,"Insuff.",SUM(D26:F26)) -> 18
A27: 160489 | B27: PESENTI | C27: ANDREA | D27: 17 | E27: 11 | F27: 0 | G27: =IF(SUM(D27:F27)<18,"Insuff.",SUM(D27:F27)) -> 28
A28: 142717 | B28: PIZZUTI | C28: GIANROCCO | D28: 9 | E28: 0 | F28: 0 | G28: =IF(SUM(D28:F28)<18,"Insuff.",SUM(D28:F28)) -> Insuff.
A29: 128984 | B29: RASPADORI | C29: GIANLUCA | D29: 0 | E29: 0 | F29: 0 | G29: =IF(SUM(D29:F29)<18,"Insuff.",SUM(D29:F29)) -> Insuff. | H29: ***
A30: 160495 | B30: ROVATTI | C30: FABRIZIO | D30: 19 | E30: 10 | F30: 3 | G30: =IF(SUM(D30:F30)<18,"Insuff.",SUM(D30:F30)) -> 32
A31: 150572 | B31: SFAMURRI | C31: ALESSANDRO | D31: 6 | E31: 4 | F31: 3 | G31: =IF(SUM(D31:F31)<18,"Insuff.",SUM(D31:F31)) -> Insuff.
A32: 167152 | B32: TASSONI | C32: DAVIDE | D32: 18 | E32: 4 | F32: 3 | G32: =IF(SUM(D32:F32)<18,"Insuff.",SUM(D32:F32)) -> 25
A33: 163298 | B33: TRECCANI | C33: TIZIANO | D33: 17 | E33: 7 | F33: 0 | G33: =IF(SUM(D33:F33)<18,"Insuff.",SUM(D33:F33)) -> 24
A34: 233659 | B34: ZACCHE | C34: ALESSANDRO | D34: 13 | E34: 1 | F34: 0 | G34: =IF(SUM(D34:F34)<18,"Insuff.",SUM(D34:F34)) -> Insuff.
A35: 900003862 | B35: ZECCA | C35: PARIDE | D35: 15 | E35: 3 | F35: 0 | G35: =IF(SUM(D35:F35)<18,"Insuff.",SUM(D35:F35)) -> 18
A36: *** Il prossimo risultato verra' registrato in ogni caso