A1: Fondamenti di Ricerca Operativa L-A
A2: Prova Scritta del 21 Giugno 2004
A4: Validita': fino a Settembre 2004
A5: Visione degli elaborati e orali: Mercoledi' 30 Giugno 2004, ore 15.00
A6: (Per l'aula vedere la bacheca del DEIS)
A7: Prossimi appelli: Luglio, Settembre, Gennaio
A9: matricola | B9: Cognome | C9: Nome | D9: 1 | E9: 2 | F9: 3 | G9: bonus | H9: voto
A10: 141000 | B10: AMATI | C10: DANIELE | D10: 18 | E10: 11 | G10: 0 | H10: =SUM(D10:G10) -> 29
A11: 141214 | B11: BALDINI | C11: VITTORIO | D11: 18 | E11: 8 | G11: 3 | H11: =SUM(D11:G11) -> 29
A12: 123833 | B12: BARONCINI | C12: DANIELE | D12: 14 | E12: 11 | G12: 0 | H12: =SUM(D12:G12) -> 25
A13: 142536 | B13: BERGAMASCHI | C13: PAOLO | D13: 14 | E13: 8 | G13: 3 | H13: =SUM(D13:G13) -> 25
A14: 2148061513 | B14: BERNABEI | C14: CHIARA | D14: 13 | E14: 11 | G14: 0 | H14: =SUM(D14:G14) -> 24
A15: 122282 | B15: BETTI | C15: ALESSANDRO | D15: 14 | E15: 2 | G15: 0 | H15: =SUM(D15:G15) -> 16 | I15: *
A16: 122010 | B16: BONFIETTI | C16: ALESSIO | D16: 7 | E16: 10 | G16: 3 | H16: =SUM(D16:G16) -> 20
A17: 149845 | B17: BUONAMICO | C17: ORAZIO | D17: 17 | E17: 11 | G17: 3 | H17: =SUM(D17:G17) -> 31
A18: 139201 | B18: CAMPETI | C18: LUCA | D18: 19 | E18: 11 | G18: 0 | H18: =SUM(D18:G18) -> 30
A19: 149124 | B19: CARANNA | C19: VITTORIA | D19: 17 | E19: 8 | G19: 3 | H19: =SUM(D19:G19) -> 28
A20: 145534 | B20: CARUGNO | C20: GIANGREGORIO | D20: 18 | E20: 8 | G20: 0 | H20: =SUM(D20:G20) -> 26
A21: 126767 | B21: CASTAGNO | C21: CRISTIAN | D21: 10 | E21: 1 | G21: 3 | H21: Insuff.
A22: 140533 | B22: CASTELLI | C22: LORENZO | D22: 19 | E22: 11 | G22: 3 | H22: =SUM(D22:G22) -> 33
A23: 142021 | B23: CELLEMME | C23: FRANCESCO | D23: 17 | E23: 11 | G23: 3 | H23: =SUM(D23:G23) -> 31
A24: 139980 | B24: COLTELLI | C24: DINO | D24: 19 | E24: 11 | G24: 0 | H24: =SUM(D24:G24) -> 30
A25: 900007251 | B25: CUTILLO | C25: LUCA | D25: 18 | E25: 11 | G25: 3 | H25: =SUM(D25:G25) -> 32
A26: 900005294 | B26: D'AMELIO | C26: PASQUALINO | D26: 16 | E26: 9 | G26: 0 | H26: =SUM(D26:G26) -> 25
A27: 104911 | B27: DE MARCO | C27: ANDREA | D27: 18 | E27: 11 | G27: 0 | H27: =SUM(D27:G27) -> 29
A28: 122201 | B28: DI RUSCIO | C28: GIULIO | D28: 8 | E28: 11 | G28: 3 | H28: =SUM(D28:G28) -> 22
A29: 900003191 | B29: DI STEFANO | C29: NUNZIO | D29: 14 | E29: 2 | G29: 0 | H29: =SUM(D29:G29) -> 16 | I29: *
A30: 125467 | B30: FAIENZA | C30: STEFANO ERNESTO | D30: 19 | E30: 9 | G30: 0 | H30: =SUM(D30:G30) -> 28
A31: 121917 | B31: FIORETTI | C31: FABIO | D31: 18 | E31: 11 | G31: 0 | H31: =SUM(D31:G31) -> 29
A32: 127861 | B32: GELSUMINO | C32: ERIKA | D32: 13 | E32: 6 | G32: 0 | H32: =SUM(D32:G32) -> 19
A33: 2146059188 | B33: GHERGO | C33: GIANLUCA | D33: 18 | E33: 11 | G33: 3 | H33: =SUM(D33:G33) -> 32
A34: 2148062452 | B34: GIORGI | C34: GIANMARCO | D34: 11 | E34: 1 | G34: 0 | H34: Insuff.
A35: 141093 | B35: GRAZI | C35: ALESSANDRO | D35: 16 | E35: 11 | G35: 0 | H35: =SUM(D35:G35) -> 27
A36: 124815 | B36: INNOCENTI | C36: SIMONE | D36: 19 | E36: 5 | G36: 0 | H36: =SUM(D36:G36) -> 24
A37: 138978 | B37: LICASTRO | C37: ANDREA | D37: 19 | E37: 11 | G37: 3 | H37: =SUM(D37:G37) -> 33
A38: 144358 | B38: LUPINETTI | C38: ALESSANDRO | D38: 12 | E38: 11 | G38: 3 | H38: =SUM(D38:G38) -> 26
B39: MALVASIO | C39: ELISA | D39: 11 | E39: 0 | G39: 3 | H39: Insuff.
A40: 149306 | B40: MANCO | C40: ROCCO ALESSANDRO | D40: 19 | E40: 11 | G40: 0 | H40: =SUM(D40:G40) -> 30
A41: 106904 | B41: MARINO | C41: LUIGI | D41: 5 | E41: 4 | G41: 3 | H41: Insuff.
A42: 145228 | B42: MARTELLA | C42: VITO | D42: 19 | E42: 11 | G42: 0 | H42: =SUM(D42:G42) -> 30
A43: 139523 | B43: MAZZANTI | C43: ROBERTO | D43: 16 | E43: 11 | G43: 0 | H43: =SUM(D43:G43) -> 27
A44: 123351 | B44: MAZZONI | C44: ANDREA | D44: 18 | E44: 9 | G44: 0 | H44: =SUM(D44:G44) -> 27
A45: 110691 | B45: MINGHETTI | C45: ELISA | D45: 2 | E45: 0 | G45: 3 | H45: Insuff.
A46: 142104 | B46: MONOPOLI | C46: ANDREA | D46: 15 | E46: 11 | G46: 0 | H46: =SUM(D46:G46) -> 26
A47: 106601 | B47: MOTTULA | C47: MARIO | D47: 16 | E47: 8 | G47: 3 | H47: =SUM(D47:G47) -> 27
A48: 146505 | B48: PEGOLO | C48: MARCO | D48: 12 | E48: 6 | G48: 0 | H48: =SUM(D48:G48) -> 18
A49: 144037 | B49: PIERGENTILI | C49: LUCA | D49: 12 | E49: 11 | G49: 0 | H49: =SUM(D49:G49) -> 23
A50: 2148062353 | B50: PIKASSIS | C50: CRISTINA CATERINA | D50: 10 | E50: 0 | G50: 0 | H50: Insuff.
A51: 148973 | B51: PINTO | C51: ALBERTO | D51: 5 | E51: 3 | G51: 3 | H51: Insuff.
A52: 123566 | B52: PISTOLESI | C52: LUCA | D52: 18 | E52: 9 | G52: 0 | H52: =SUM(D52:G52) -> 27
A53: 142717 | B53: PIZZUTI | C53: GIANROCCO | D53: 9 | E53: 1 | G53: 0 | H53: Insuff.
A54: 2148063442 | B54: POLIANDRI | C54: ALESSANDRA | D54: 19 | E54: 7 | G54: 3 | H54: =SUM(D54:G54) -> 29
A55: 900016361 | B55: POZZULO | C55: EMILIO | D55: 13 | E55: 7 | G55: 0 | H55: =SUM(D55:G55) -> 20
A56: 141882 | B56: PRANDINI | C56: ROBERTO | D56: 19 | E56: 11 | G56: 0 | H56: =SUM(D56:G56) -> 30
A57: 124273 | B57: ROMANELLI | C57: ELIO | D57: 16 | E57: 11 | G57: 0 | H57: =SUM(D57:G57) -> 27
A58: 139135 | B58: SALVADORI | C58: DAVIDE | D58: 7 | E58: 11 | G58: 0 | H58: =SUM(D58:G58) -> 18
A59: 900009617 | B59: SAPONARA | C59: ALFREDO | D59: 9 | E59: 11 | G59: 3 | H59: =SUM(D59:G59) -> 23
A60: 900007158 | B60: SAPORITO | C60: MASSIMILIANO | G60: 0 | H60: Annullato
A61: 126597 | B61: SCHIAVONI | C61: RICCARDO | D61: 17 | E61: 8 | G61: 3 | H61: =SUM(D61:G61) -> 28
A62: 150119 | B62: SILENZI | C62: ELISA | D62: 16 | E62: 7 | G62: 0 | H62: =SUM(D62:G62) -> 23
A63: 900000355 | B63: SREPFLER | C63: SRGJAN | D63: 8 | E63: 9 | G63: 0 | H63: =SUM(D63:G63) -> 17 | I63: *
A64: 123238 | B64: TAMAGNINI | C64: STEFANO | D64: 11 | E64: 11 | G64: 0 | H64: =SUM(D64:G64) -> 22
A65: 113440 | B65: TROCINO | C65: ANDREA | D65: 13 | E65: 11 | G65: 0 | H65: =SUM(D65:G65) -> 24
A66: 142235 | B66: ZAPPACOSTA | C66: DAVIDE | D66: 14 | E66: 6 | G66: 0 | H66: =SUM(D66:G66) -> 20
A67: * = ammesso all'orale