A1: Fondamenti di Ricerca Operativa L-A
A2: Prova Scritta del 12 Settembre 2005
A4: Validita' per chi registra direttamente il voto: fino a martedi' 20 Settembre 2005
A5: (non procrastinabile; non si risponde a mail o telefonate in merito).
A7: Validita' per chi sostiene l'orale: fino all'appello di Gennaio 2006.
A8: Visione degli elaborati e orali: martedi' 20 Settembre 2005, ore 15.00, Aula 61
A9: Prossimi appelli: Dicembre, Gennaio
A11: matricola | B11: Cognome | C11: Nome | D11: 1 | E11: 2 | F11: bonus | G11: voto
A12: 160202 | B12: ANTONIOLI | C12: FABRIZIO | D12: 3 | E12: 9 | F12: 0 | G12: =IF(SUM(D12:F12)<18,"Insuff.",SUM(D12:F12)) -> Insuff.
A13: 122835 | B13: BORTONE | C13: ANDREA | D13: 1 | E13: 4 | F13: 0 | G13: =IF(SUM(D13:F13)<18,"Insuff.",SUM(D13:F13)) -> Insuff.
A14: 158809 | B14: CARDONE | C14: RAFFAELE | D14: 7 | E14: 8 | F14: 3 | G14: =IF(SUM(D14:F14)<18,"Insuff.",SUM(D14:F14)) -> 18
A15: 128045 | B15: CAVALLARO | C15: FRANCESCO | D15: 6 | E15: 7 | F15: 0 | G15: =IF(SUM(D15:F15)<18,"Insuff.",SUM(D15:F15)) -> Insuff.
A16: 160436 | B16: D'AGOSTINO | C16: STEFANO | D16: 6 | E16: 9 | F16: 0 | G16: =IF(SUM(D16:F16)<18,"Insuff.",SUM(D16:F16)) -> Insuff.
A17: 140903 | B17: D'ASCANIO | C17: AMEDEO | D17: 16 | E17: 9 | F17: 0 | G17: =IF(SUM(D17:F17)<18,"Insuff.",SUM(D17:F17)) -> 25
A18: 196007 | B18: DI MARCO | C18: FULVIO | D18: 21 | E18: 9 | F18: 0 | G18: =IF(SUM(D18:F18)<18,"Insuff.",SUM(D18:F18)) -> 30
A19: 168981 | B19: FALGHERI | C19: GIUSEPPE | D19: 4 | E19: 0 | F19: 3 | G19: =IF(SUM(D19:F19)<18,"Insuff.",SUM(D19:F19)) -> Insuff.
A20: 162122 | B20: FIORE | C20: VINCENZO | D20: 15 | E20: 0 | F20: 3 | G20: =IF(SUM(D20:F20)<18,"Insuff.",SUM(D20:F20)) -> 18
A21: 158218 | B21: GASBARRO | C21: DAVIDE | D21: 5 | E21: 3 | F21: 3 | G21: =IF(SUM(D21:F21)<18,"Insuff.",SUM(D21:F21)) -> Insuff.
A22: 900012698 | B22: GENOVESE | C22: EMANUELE | D22: 15 | E22: 7 | F22: 3 | G22: =IF(SUM(D22:F22)<18,"Insuff.",SUM(D22:F22)) -> 25
A23: 159145 | B23: GIULIANELLI | C23: MICHELE | D23: 21 | E23: 5 | F23: 3 | G23: =IF(SUM(D23:F23)<18,"Insuff.",SUM(D23:F23)) -> 29
A24: 159504 | B24: GRASSI | C24: ENRICO | D24: 9 | E24: 4 | F24: 0 | G24: =IF(SUM(D24:F24)<18,"Insuff.",SUM(D24:F24)) -> Insuff.
A25: 2148064468 | B25: LANZI | C25: GIUSEPPE | D25: 15 | E25: 8 | F25: 0 | G25: =IF(SUM(D25:F25)<18,"Insuff.",SUM(D25:F25)) -> 23
A26: 229674 | B26: NEGRISOLI | C26: ALBERTO | D26: 1 | E26: 7 | F26: 0 | G26: =IF(SUM(D26:F26)<18,"Insuff.",SUM(D26:F26)) -> Insuff.
A27: 2148061650 | B27: PALLOTTI | C27: GIACOMO | D27: 4 | E27: 5 | F27: 3 | G27: =IF(SUM(D27:F27)<18,"Insuff.",SUM(D27:F27)) -> Insuff.
A28: 158022 | B28: PALMISANO | C28: GIOVANNI | D28: 11 | E28: 4 | F28: 0 | G28: =IF(SUM(D28:F28)<18,"Insuff.",SUM(D28:F28)) -> Insuff.
A29: 139463 | B29: PALMUCCI | C29: MASSIMILIANO | D29: 13 | E29: 0 | F29: 0 | G29: =IF(SUM(D29:F29)<18,"Insuff.",SUM(D29:F29)) -> Insuff.
A30: 161401 | B30: PANTISANO | C30: FRANCESCO | D30: 13 | E30: 8 | F30: 3 | G30: =IF(SUM(D30:F30)<18,"Insuff.",SUM(D30:F30)) -> 24
A31: 122810 | B31: PERONI | C31: GIOVANNI | D31: 20 | E31: 9 | F31: 3 | G31: =IF(SUM(D31:F31)<18,"Insuff.",SUM(D31:F31)) -> 32
A32: 159743 | B32: POLIDORO | C32: GIORDANO | D32: 7 | E32: 7 | F32: 0 | G32: =IF(SUM(D32:F32)<18,"Insuff.",SUM(D32:F32)) -> Insuff.
A33: 233154 | B33: PRESICCE | C33: CARMELO GIUSEPPE | D33: 19 | E33: 9 | F33: 3 | G33: =IF(SUM(D33:F33)<18,"Insuff.",SUM(D33:F33)) -> 31
A34: 900007152 | B34: SCIARRETTA | C34: ELISEO | D34: 9 | E34: 9 | F34: 0 | G34: =IF(SUM(D34:F34)<18,"Insuff.",SUM(D34:F34)) -> 18
A35: 158267 | B35: VARRIANO | C35: PAOLA | D35: 13 | E35: 7 | F35: 0 | G35: =IF(SUM(D35:F35)<18,"Insuff.",SUM(D35:F35)) -> 20
A36: 900013879 | B36: VERNALI | C36: ALESSANDRO | D36: 17 | E36: 7 | F36: 3 | G36: =IF(SUM(D36:F36)<18,"Insuff.",SUM(D36:F36)) -> 27
A37: 139968 | B37: VIMINI | C37: PAOLO | D37: 15 | E37: 8 | F37: 3 | G37: =IF(SUM(D37:F37)<18,"Insuff.",SUM(D37:F37)) -> 26
A38: 212516 | B38: ZANELLA | C38: MATTEO | D38: 14 | E38: 9 | F38: 3 | G38: =IF(SUM(D38:F38)<18,"Insuff.",SUM(D38:F38)) -> 26
A39: 138998 | B39: ZANUSO | C39: CLARISSA | D39: 8 | E39: 9 | F39: 3 | G39: =IF(SUM(D39:F39)<18,"Insuff.",SUM(D39:F39)) -> 20
A40: 122985 | B40: ZINCANI | C40: MIRCO | D40: 21 | E40: 9 | F40: 3 | G40: =IF(SUM(D40:F40)<18,"Insuff.",SUM(D40:F40)) -> 33
A41: 236939 | B41: ZUCCHINI | C41: CLAUDIO | D41: 15 | E41: 9 | F41: 3 | G41: =IF(SUM(D41:F41)<18,"Insuff.",SUM(D41:F41)) -> 27