A1: Fondamenti di Ricerca Operativa L-A
A2: Prova Scritta del 12 Luglio 2006
A4: Validita' per chi non sostiene l'orale: fino al 18 Luglio 2006, ore 15.00
A5: (non procrastinabile; non si risponde a mail o telefonate in merito).
A7: Validita' per chi sostiene l'orale: fino all'appello di Dicembre 2006.
A8: Visione degli elaborati e orali: 18 Luglio 2006, ore 14.00, Aula 61
A9: Prossimi appelli: Settembre 2006, Dicembre 2006
A11: matricola | B11: Cognome | C11: Nome | D11: 1 | E11: 2 | F11: bonus | G11: voto
A12: 158364 | B12: BALDI | C12: ERICK | D12: 3 | E12: 8 | F12: 0 | G12: =IF(SUM(D12:F12)<18,"Insuff.",SUM(D12:F12)) -> Insuff.
A13: 900016641 | B13: BURRHUS | C13: LANDRY NJIKE | D13: 5 | E13: 0 | F13: 0 | G13: =IF(SUM(D13:F13)<18,"Insuff.",SUM(D13:F13)) -> Insuff.
A14: 185974 | B14: CHIARELLI | C14: GIOVANNI | D14: 3 | E14: 0 | F14: 3 | G14: =IF(SUM(D14:F14)<18,"Insuff.",SUM(D14:F14)) -> Insuff.
A15: 178651 | B15: CRISTIANI | C15: ALESSANDRO | D15: 5 | E15: 12 | F15: 0 | G15: 17 | H15: (**)
A16: 181432 | B16: FRANCESCHELLI | C16: ALESSIO | D16: 13 | E16: 15 | F16: 3 | G16: =IF(SUM(D16:F16)<18,"Insuff.",SUM(D16:F16)) -> 31
A17: 236303 | B17: GAETA | C17: ALESSIO | D17: 15 | E17: 12 | F17: 3 | G17: =IF(SUM(D17:F17)<18,"Insuff.",SUM(D17:F17)) -> 30
A18: 159504 | B18: GRASSI | C18: ENRICO | D18: 7 | E18: 13 | F18: 0 | G18: =IF(SUM(D18:F18)<18,"Insuff.",SUM(D18:F18)) -> 20
A19: 147388 | B19: GUERRIERI | C19: ANDREA | D19: 7 | E19: 8 | F19: 3 | G19: =IF(SUM(D19:F19)<18,"Insuff.",SUM(D19:F19)) -> 18
A20: 900018747 | B20: IANNUZZI | C20: CRISTIAN | D20: 9 | E20: 13 | F20: 0 | G20: =IF(SUM(D20:F20)<18,"Insuff.",SUM(D20:F20)) -> 22
A21: 139629 | B21: IMPOSIMATO | C21: ARTURO | D21: 0 | E21: 0 | F21: 0 | G21: Insuff. | H21: (*)
A22: 181832 | B22: KOUSSIS | C22: JONATHAN | D22: 1 | E22: 0 | F22: 0 | G22: =IF(SUM(D22:F22)<18,"Insuff.",SUM(D22:F22)) -> Insuff. | H22: (*)
A23: 900025523 | B23: MA | C23: YUE | D23: 13 | E23: 8 | F23: 3 | G23: =IF(SUM(D23:F23)<18,"Insuff.",SUM(D23:F23)) -> 24
A24: 168278 | B24: MACRI | C24: PAOLO | D24: 12 | E24: 12 | F24: 0 | G24: =IF(SUM(D24:F24)<18,"Insuff.",SUM(D24:F24)) -> 24
A25: 107899 | B25: MALVASIO | C25: ELISA | D25: 2 | E25: 6 | F25: 0 | G25: =IF(SUM(D25:F25)<18,"Insuff.",SUM(D25:F25)) -> Insuff.
A26: 124220 | B26: MANESE | C26: STEFANO GUERINO | D26: 5 | E26: 9 | F26: 0 | G26: =IF(SUM(D26:F26)<18,"Insuff.",SUM(D26:F26)) -> Insuff.
A27: 245147 | B27: MORINI | C27: NICOLA | D27: 9 | E27: 12 | F27: 3 | G27: =IF(SUM(D27:F27)<18,"Insuff.",SUM(D27:F27)) -> 24
A28: 107016 | B28: NASILLI | C28: NUNZIO | D28: 4 | E28: 6 | F28: 3 | G28: =IF(SUM(D28:F28)<18,"Insuff.",SUM(D28:F28)) -> Insuff.
A29: 180408 | B29: PIZZUTI | C29: FRANCESCO | D29: 9 | E29: 5 | F29: 3 | G29: 17 | H29: (**)
A30: 182012 | B30: RIA | C30: LUIGI | D30: 9 | E30: 14 | F30: 0 | G30: =IF(SUM(D30:F30)<18,"Insuff.",SUM(D30:F30)) -> 23
A31: 184040 | B31: SACCO | C31: ALEX | D31: 3 | E31: 11 | F31: 0 | G31: =IF(SUM(D31:F31)<18,"Insuff.",SUM(D31:F31)) -> Insuff.
A32: 181488 | B32: ZANCANARO | C32: MARCO | D32: 11 | E32: 13 | F32: 0 | G32: =IF(SUM(D32:F32)<18,"Insuff.",SUM(D32:F32)) -> 24
A33: (*) L'eventuale esito negativo del prossimo appello verra' verbalizzato.
A34: (**) Puo' registrare 18.