A1: Suddivisione Corsi per Anno
J2: 1 | K2: 2 | L2: 3 | M2: 4 | N2: 5 | O2: altro
A3: Anno di Corso | B3: Numero corsi | J3: =SUM(J4:J397) -> 48 | K3: =SUM(K4:K397) -> 114 | L3: =SUM(L4:L397) -> 126 | M3: =SUM(M4:M397) -> 61 | N3: =SUM(N4:N397) -> 28 | O3: =SUM(O4:O397) -> 17 | P3: =SUM(J3:O3) -> 394
A4: 1° (triennale) | B4: =J3 -> 48 | J4: 0 | K4: 0 | L4: 0 | M4: 1 | N4: 0 | O4: =1-SUM(J4:N4) -> 0
A5: 2° (triennale) | B5: =K3 -> 114 | J5: 0 | K5: 0 | L5: 1 | M5: 0 | N5: 0 | O5: =1-SUM(J5:N5) -> 0
A6: 3° (triennale) | B6: =L3 -> 126 | J6: 0 | K6: 0 | L6: 1 | M6: 0 | N6: 0 | O6: =1-SUM(J6:N6) -> 0
A7: 4° (1° specialistica) | B7: =M3 -> 61 | J7: 0 | K7: 0 | L7: 1 | M7: 0 | N7: 0 | O7: =1-SUM(J7:N7) -> 0
A8: 5° (2° specialistica) | B8: =N3 -> 28 | J8: 0 | K8: 0 | L8: 0 | M8: 0 | N8: 0 | O8: =1-SUM(J8:N8) -> 1
A9: Altro | B9: =O3 -> 17 | J9: 0 | K9: 0 | L9: 1 | M9: 0 | N9: 0 | O9: =1-SUM(J9:N9) -> 0
A10: Totale | B10: =SUM(B4:B8) -> 377 | J10: 0 | K10: 0 | L10: 1 | M10: 0 | N10: 0 | O10: =1-SUM(J10:N10) -> 0
J11: 0 | K11: 0 | L11: 1 | M11: 0 | N11: 0 | O11: =1-SUM(J11:N11) -> 0
J12: 0 | K12: 0 | L12: 1 | M12: 0 | N12: 0 | O12: =1-SUM(J12:N12) -> 0
J13: 0 | K13: 1 | L13: 0 | M13: 0 | N13: 0 | O13: =1-SUM(J13:N13) -> 0
J14: 0 | K14: 0 | L14: 1 | M14: 0 | N14: 0 | O14: =1-SUM(J14:N14) -> 0
J15: 0 | K15: 0 | L15: 1 | M15: 0 | N15: 0 | O15: =1-SUM(J15:N15) -> 0
J16: 0 | K16: 0 | L16: 1 | M16: 0 | N16: 0 | O16: =1-SUM(J16:N16) -> 0
J17: 1 | K17: 0 | L17: 0 | M17: 0 | N17: 0 | O17: =1-SUM(J17:N17) -> 0
J18: 0 | K18: 1 | L18: 0 | M18: 0 | N18: 0 | O18: =1-SUM(J18:N18) -> 0
J19: 0 | K19: 1 | L19: 0 | M19: 0 | N19: 0 | O19: =1-SUM(J19:N19) -> 0
J20: 0 | K20: 0 | L20: 0 | M20: 1 | N20: 0 | O20: =1-SUM(J20:N20) -> 0
J21: 0 | K21: 0 | L21: 0 | M21: 1 | N21: 0 | O21: =1-SUM(J21:N21) -> 0
J22: 0 | K22: 0 | L22: 0 | M22: 0 | N22: 1 | O22: =1-SUM(J22:N22) -> 0
J23: 0 | K23: 0 | L23: 0 | M23: 0 | N23: 1 | O23: =1-SUM(J23:N23) -> 0
J24: 0 | K24: 0 | L24: 0 | M24: 0 | N24: 1 | O24: =1-SUM(J24:N24) -> 0
J25: 0 | K25: 1 | L25: 0 | M25: 0 | N25: 0 | O25: =1-SUM(J25:N25) -> 0
J26: 0 | K26: 0 | L26: 1 | M26: 0 | N26: 0 | O26: =1-SUM(J26:N26) -> 0
J27: 0 | K27: 0 | L27: 0 | M27: 1 | N27: 0 | O27: =1-SUM(J27:N27) -> 0
J28: 0 | K28: 0 | L28: 0 | M28: 0 | N28: 1 | O28: =1-SUM(J28:N28) -> 0
J29: 0 | K29: 0 | L29: 1 | M29: 0 | N29: 0 | O29: =1-SUM(J29:N29) -> 0
J30: 0 | K30: 0 | L30: 1 | M30: 0 | N30: 0 | O30: =1-SUM(J30:N30) -> 0
J31: 0 | K31: 0 | L31: 0 | M31: 1 | N31: 0 | O31: =1-SUM(J31:N31) -> 0
J32: 0 | K32: 0 | L32: 0 | M32: 1 | N32: 0 | O32: =1-SUM(J32:N32) -> 0
J33: 0 | K33: 0 | L33: 0 | M33: 1 | N33: 0 | O33: =1-SUM(J33:N33) -> 0
J34: 0 | K34: 0 | L34: 0 | M34: 1 | N34: 0 | O34: =1-SUM(J34:N34) -> 0
J35: 0 | K35: 1 | L35: 0 | M35: 0 | N35: 0 | O35: =1-SUM(J35:N35) -> 0
J36: 0 | K36: 0 | L36: 1 | M36: 0 | N36: 0 | O36: =1-SUM(J36:N36) -> 0
J37: 0 | K37: 0 | L37: 1 | M37: 0 | N37: 0 | O37: =1-SUM(J37:N37) -> 0
J38: 0 | K38: 1 | L38: 0 | M38: 0 | N38: 0 | O38: =1-SUM(J38:N38) -> 0
J39: 0 | K39: 0 | L39: 0 | M39: 0 | N39: 1 | O39: =1-SUM(J39:N39) -> 0
J40: 0 | K40: 0 | L40: 0 | M40: 0 | N40: 1 | O40: =1-SUM(J40:N40) -> 0
J41: 0 | K41: 0 | L41: 0 | M41: 1 | N41: 0 | O41: =1-SUM(J41:N41) -> 0
J42: 0 | K42: 0 | L42: 0 | M42: 1 | N42: 0 | O42: =1-SUM(J42:N42) -> 0
J43: 0 | K43: 0 | L43: 0 | M43: 0 | N43: 1 | O43: =1-SUM(J43:N43) -> 0
J44: 0 | K44: 0 | L44: 0 | M44: 1 | N44: 0 | O44: =1-SUM(J44:N44) -> 0
J45: 0 | K45: 1 | L45: 0 | M45: 0 | N45: 0 | O45: =1-SUM(J45:N45) -> 0
J46: 0 | K46: 0 | L46: 0 | M46: 0 | N46: 0 | O46: =1-SUM(J46:N46) -> 1
J47: 0 | K47: 1 | L47: 0 | M47: 0 | N47: 0 | O47: =1-SUM(J47:N47) -> 0
J48: 0 | K48: 0 | L48: 0 | M48: 0 | N48: 0 | O48: =1-SUM(J48:N48) -> 1
J49: 0 | K49: 1 | L49: 0 | M49: 0 | N49: 0 | O49: =1-SUM(J49:N49) -> 0
J50: 0 | K50: 1 | L50: 0 | M50: 0 | N50: 0 | O50: =1-SUM(J50:N50) -> 0
J51: 0 | K51: 0 | L51: 1 | M51: 0 | N51: 0 | O51: =1-SUM(J51:N51) -> 0
J52: 0 | K52: 0 | L52: 0 | M52: 1 | N52: 0 | O52: =1-SUM(J52:N52) -> 0
J53: 0 | K53: 0 | L53: 0 | M53: 1 | N53: 0 | O53: =1-SUM(J53:N53) -> 0
J54: 0 | K54: 0 | L54: 0 | M54: 0 | N54: 1 | O54: =1-SUM(J54:N54) -> 0
J55: 0 | K55: 0 | L55: 0 | M55: 1 | N55: 0 | O55: =1-SUM(J55:N55) -> 0
J56: 0 | K56: 0 | L56: 0 | M56: 0 | N56: 1 | O56: =1-SUM(J56:N56) -> 0
J57: 0 | K57: 0 | L57: 0 | M57: 1 | N57: 0 | O57: =1-SUM(J57:N57) -> 0
J58: 0 | K58: 0 | L58: 0 | M58: 1 | N58: 0 | O58: =1-SUM(J58:N58) -> 0
J59: 0 | K59: 1 | L59: 0 | M59: 0 | N59: 0 | O59: =1-SUM(J59:N59) -> 0
J60: 0 | K60: 1 | L60: 0 | M60: 0 | N60: 0 | O60: =1-SUM(J60:N60) -> 0
J61: 0 | K61: 1 | L61: 0 | M61: 0 | N61: 0 | O61: =1-SUM(J61:N61) -> 0
J62: 0 | K62: 1 | L62: 0 | M62: 0 | N62: 0 | O62: =1-SUM(J62:N62) -> 0
J63: 0 | K63: 1 | L63: 0 | M63: 0 | N63: 0 | O63: =1-SUM(J63:N63) -> 0
J64: 0 | K64: 0 | L64: 0 | M64: 0 | N64: 0 | O64: =1-SUM(J64:N64) -> 1
J65: 0 | K65: 0 | L65: 1 | M65: 0 | N65: 0 | O65: =1-SUM(J65:N65) -> 0
J66: 0 | K66: 0 | L66: 1 | M66: 0 | N66: 0 | O66: =1-SUM(J66:N66) -> 0
J67: 0 | K67: 0 | L67: 1 | M67: 0 | N67: 0 | O67: =1-SUM(J67:N67) -> 0
J68: 0 | K68: 1 | L68: 0 | M68: 0 | N68: 0 | O68: =1-SUM(J68:N68) -> 0
J69: 0 | K69: 1 | L69: 0 | M69: 0 | N69: 0 | O69: =1-SUM(J69:N69) -> 0
J70: 0 | K70: 0 | L70: 1 | M70: 0 | N70: 0 | O70: =1-SUM(J70:N70) -> 0
J71: 0 | K71: 0 | L71: 0 | M71: 1 | N71: 0 | O71: =1-SUM(J71:N71) -> 0
J72: 0 | K72: 0 | L72: 0 | M72: 0 | N72: 1 | O72: =1-SUM(J72:N72) -> 0
J73: 0 | K73: 1 | L73: 0 | M73: 0 | N73: 0 | O73: =1-SUM(J73:N73) -> 0
J74: 1 | K74: 0 | L74: 0 | M74: 0 | N74: 0 | O74: =1-SUM(J74:N74) -> 0
J75: 1 | K75: 0 | L75: 0 | M75: 0 | N75: 0 | O75: =1-SUM(J75:N75) -> 0
J76: 1 | K76: 0 | L76: 0 | M76: 0 | N76: 0 | O76: =1-SUM(J76:N76) -> 0
J77: 1 | K77: 0 | L77: 0 | M77: 0 | N77: 0 | O77: =1-SUM(J77:N77) -> 0
J78: 1 | K78: 0 | L78: 0 | M78: 0 | N78: 0 | O78: =1-SUM(J78:N78) -> 0
J79: 1 | K79: 0 | L79: 0 | M79: 0 | N79: 0 | O79: =1-SUM(J79:N79) -> 0
J80: 1 | K80: 0 | L80: 0 | M80: 0 | N80: 0 | O80: =1-SUM(J80:N80) -> 0
J81: 0 | K81: 0 | L81: 1 | M81: 0 | N81: 0 | O81: =1-SUM(J81:N81) -> 0
J82: 0 | K82: 1 | L82: 0 | M82: 0 | N82: 0 | O82: =1-SUM(J82:N82) -> 0
J83: 0 | K83: 0 | L83: 0 | M83: 1 | N83: 0 | O83: =1-SUM(J83:N83) -> 0
J84: 0 | K84: 0 | L84: 1 | M84: 0 | N84: 0 | O84: =1-SUM(J84:N84) -> 0
J85: 0 | K85: 0 | L85: 1 | M85: 0 | N85: 0 | O85: =1-SUM(J85:N85) -> 0
J86: 0 | K86: 1 | L86: 0 | M86: 0 | N86: 0 | O86: =1-SUM(J86:N86) -> 0
J87: 0 | K87: 1 | L87: 0 | M87: 0 | N87: 0 | O87: =1-SUM(J87:N87) -> 0
J88: 0 | K88: 0 | L88: 0 | M88: 1 | N88: 0 | O88: =1-SUM(J88:N88) -> 0
J89: 0 | K89: 0 | L89: 0 | M89: 1 | N89: 0 | O89: =1-SUM(J89:N89) -> 0
J90: 0 | K90: 0 | L90: 0 | M90: 1 | N90: 0 | O90: =1-SUM(J90:N90) -> 0
J91: 0 | K91: 0 | L91: 1 | M91: 0 | N91: 0 | O91: =1-SUM(J91:N91) -> 0
J92: 0 | K92: 0 | L92: 1 | M92: 0 | N92: 0 | O92: =1-SUM(J92:N92) -> 0
J93: 0 | K93: 0 | L93: 0 | M93: 1 | N93: 0 | O93: =1-SUM(J93:N93) -> 0
J94: 0 | K94: 1 | L94: 0 | M94: 0 | N94: 0 | O94: =1-SUM(J94:N94) -> 0
J95: 0 | K95: 1 | L95: 0 | M95: 0 | N95: 0 | O95: =1-SUM(J95:N95) -> 0
J96: 0 | K96: 1 | L96: 0 | M96: 0 | N96: 0 | O96: =1-SUM(J96:N96) -> 0
J97: 0 | K97: 0 | L97: 1 | M97: 0 | N97: 0 | O97: =1-SUM(J97:N97) -> 0
J98: 0 | K98: 0 | L98: 1 | M98: 0 | N98: 0 | O98: =1-SUM(J98:N98) -> 0
J99: 0 | K99: 0 | L99: 1 | M99: 0 | N99: 0 | O99: =1-SUM(J99:N99) -> 0
J100: 0 | K100: 0 | L100: 1 | M100: 0 | N100: 0 | O100: =1-SUM(J100:N100) -> 0
J101: 0 | K101: 0 | L101: 0 | M101: 1 | N101: 0 | O101: =1-SUM(J101:N101) -> 0
J102: 0 | K102: 0 | L102: 1 | M102: 0 | N102: 0 | O102: =1-SUM(J102:N102) -> 0
J103: 1 | K103: 0 | L103: 0 | M103: 0 | N103: 0 | O103: =1-SUM(J103:N103) -> 0
J104: 0 | K104: 0 | L104: 0 | M104: 1 | N104: 0 | O104: =1-SUM(J104:N104) -> 0
J105: 0 | K105: 0 | L105: 1 | M105: 0 | N105: 0 | O105: =1-SUM(J105:N105) -> 0
J106: 1 | K106: 0 | L106: 0 | M106: 0 | N106: 0 | O106: =1-SUM(J106:N106) -> 0
J107: 0 | K107: 1 | L107: 0 | M107: 0 | N107: 0 | O107: =1-SUM(J107:N107) -> 0
J108: 0 | K108: 1 | L108: 0 | M108: 0 | N108: 0 | O108: =1-SUM(J108:N108) -> 0
J109: 0 | K109: 1 | L109: 0 | M109: 0 | N109: 0 | O109: =1-SUM(J109:N109) -> 0
J110: 0 | K110: 0 | L110: 1 | M110: 0 | N110: 0 | O110: =1-SUM(J110:N110) -> 0
J111: 1 | K111: 0 | L111: 0 | M111: 0 | N111: 0 | O111: =1-SUM(J111:N111) -> 0
J112: 0 | K112: 0 | L112: 1 | M112: 0 | N112: 0 | O112: =1-SUM(J112:N112) -> 0
J113: 0 | K113: 0 | L113: 0 | M113: 0 | N113: 1 | O113: =1-SUM(J113:N113) -> 0
J114: 0 | K114: 0 | L114: 0 | M114: 0 | N114: 0 | O114: =1-SUM(J114:N114) -> 1
J115: 0 | K115: 1 | L115: 0 | M115: 0 | N115: 0 | O115: =1-SUM(J115:N115) -> 0
J116: 0 | K116: 0 | L116: 1 | M116: 0 | N116: 0 | O116: =1-SUM(J116:N116) -> 0
J117: 0 | K117: 1 | L117: 0 | M117: 0 | N117: 0 | O117: =1-SUM(J117:N117) -> 0
J118: 0 | K118: 0 | L118: 0 | M118: 1 | N118: 0 | O118: =1-SUM(J118:N118) -> 0
J119: 0 | K119: 0 | L119: 0 | M119: 1 | N119: 0 | O119: =1-SUM(J119:N119) -> 0
J120: 0 | K120: 0 | L120: 0 | M120: 1 | N120: 0 | O120: =1-SUM(J120:N120) -> 0
J121: 0 | K121: 0 | L121: 0 | M121: 0 | N121: 1 | O121: =1-SUM(J121:N121) -> 0
J122: 0 | K122: 0 | L122: 0 | M122: 0 | N122: 1 | O122: =1-SUM(J122:N122) -> 0
J123: 0 | K123: 0 | L123: 1 | M123: 0 | N123: 0 | O123: =1-SUM(J123:N123) -> 0
J124: 0 | K124: 1 | L124: 0 | M124: 0 | N124: 0 | O124: =1-SUM(J124:N124) -> 0
J125: 0 | K125: 1 | L125: 0 | M125: 0 | N125: 0 | O125: =1-SUM(J125:N125) -> 0
J126: 0 | K126: 0 | L126: 0 | M126: 1 | N126: 0 | O126: =1-SUM(J126:N126) -> 0
J127: 0 | K127: 1 | L127: 0 | M127: 0 | N127: 0 | O127: =1-SUM(J127:N127) -> 0
J128: 0 | K128: 1 | L128: 0 | M128: 0 | N128: 0 | O128: =1-SUM(J128:N128) -> 0
J129: 0 | K129: 0 | L129: 0 | M129: 1 | N129: 0 | O129: =1-SUM(J129:N129) -> 0
J130: 1 | K130: 0 | L130: 0 | M130: 0 | N130: 0 | O130: =1-SUM(J130:N130) -> 0
J131: 0 | K131: 0 | L131: 1 | M131: 0 | N131: 0 | O131: =1-SUM(J131:N131) -> 0
J132: 1 | K132: 0 | L132: 0 | M132: 0 | N132: 0 | O132: =1-SUM(J132:N132) -> 0
J133: 1 | K133: 0 | L133: 0 | M133: 0 | N133: 0 | O133: =1-SUM(J133:N133) -> 0
J134: 0 | K134: 1 | L134: 0 | M134: 0 | N134: 0 | O134: =1-SUM(J134:N134) -> 0
J135: 0 | K135: 1 | L135: 0 | M135: 0 | N135: 0 | O135: =1-SUM(J135:N135) -> 0
J136: 1 | K136: 0 | L136: 0 | M136: 0 | N136: 0 | O136: =1-SUM(J136:N136) -> 0
J137: 0 | K137: 1 | L137: 0 | M137: 0 | N137: 0 | O137: =1-SUM(J137:N137) -> 0
J138: 1 | K138: 0 | L138: 0 | M138: 0 | N138: 0 | O138: =1-SUM(J138:N138) -> 0
J139: 1 | K139: 0 | L139: 0 | M139: 0 | N139: 0 | O139: =1-SUM(J139:N139) -> 0
J140: 0 | K140: 1 | L140: 0 | M140: 0 | N140: 0 | O140: =1-SUM(J140:N140) -> 0
J141: 0 | K141: 0 | L141: 1 | M141: 0 | N141: 0 | O141: =1-SUM(J141:N141) -> 0
J142: 0 | K142: 0 | L142: 1 | M142: 0 | N142: 0 | O142: =1-SUM(J142:N142) -> 0
J143: 0 | K143: 0 | L143: 1 | M143: 0 | N143: 0 | O143: =1-SUM(J143:N143) -> 0
J144: 0 | K144: 0 | L144: 0 | M144: 0 | N144: 1 | O144: =1-SUM(J144:N144) -> 0
J145: 0 | K145: 0 | L145: 1 | M145: 0 | N145: 0 | O145: =1-SUM(J145:N145) -> 0
J146: 0 | K146: 0 | L146: 1 | M146: 0 | N146: 0 | O146: =1-SUM(J146:N146) -> 0
J147: 0 | K147: 0 | L147: 1 | M147: 0 | N147: 0 | O147: =1-SUM(J147:N147) -> 0
J148: 0 | K148: 0 | L148: 1 | M148: 0 | N148: 0 | O148: =1-SUM(J148:N148) -> 0
J149: 0 | K149: 0 | L149: 0 | M149: 1 | N149: 0 | O149: =1-SUM(J149:N149) -> 0
J150: 0 | K150: 0 | L150: 0 | M150: 1 | N150: 0 | O150: =1-SUM(J150:N150) -> 0
J151: 0 | K151: 0 | L151: 0 | M151: 1 | N151: 0 | O151: =1-SUM(J151:N151) -> 0
J152: 0 | K152: 1 | L152: 0 | M152: 0 | N152: 0 | O152: =1-SUM(J152:N152) -> 0
J153: 0 | K153: 1 | L153: 0 | M153: 0 | N153: 0 | O153: =1-SUM(J153:N153) -> 0
J154: 0 | K154: 0 | L154: 1 | M154: 0 | N154: 0 | O154: =1-SUM(J154:N154) -> 0
J155: 0 | K155: 0 | L155: 1 | M155: 0 | N155: 0 | O155: =1-SUM(J155:N155) -> 0
J156: 0 | K156: 0 | L156: 1 | M156: 0 | N156: 0 | O156: =1-SUM(J156:N156) -> 0
J157: 0 | K157: 0 | L157: 0 | M157: 1 | N157: 0 | O157: =1-SUM(J157:N157) -> 0
J158: 0 | K158: 0 | L158: 0 | M158: 1 | N158: 0 | O158: =1-SUM(J158:N158) -> 0
J159: 0 | K159: 0 | L159: 1 | M159: 0 | N159: 0 | O159: =1-SUM(J159:N159) -> 0
J160: 0 | K160: 0 | L160: 0 | M160: 0 | N160: 1 | O160: =1-SUM(J160:N160) -> 0
J161: 0 | K161: 0 | L161: 1 | M161: 0 | N161: 0 | O161: =1-SUM(J161:N161) -> 0
J162: 0 | K162: 1 | L162: 0 | M162: 0 | N162: 0 | O162: =1-SUM(J162:N162) -> 0
J163: 0 | K163: 1 | L163: 0 | M163: 0 | N163: 0 | O163: =1-SUM(J163:N163) -> 0
J164: 0 | K164: 0 | L164: 1 | M164: 0 | N164: 0 | O164: =1-SUM(J164:N164) -> 0
J165: 0 | K165: 0 | L165: 1 | M165: 0 | N165: 0 | O165: =1-SUM(J165:N165) -> 0
J166: 0 | K166: 0 | L166: 0 | M166: 1 | N166: 0 | O166: =1-SUM(J166:N166) -> 0
J167: 0 | K167: 1 | L167: 0 | M167: 0 | N167: 0 | O167: =1-SUM(J167:N167) -> 0
J168: 0 | K168: 0 | L168: 0 | M168: 1 | N168: 0 | O168: =1-SUM(J168:N168) -> 0
J169: 0 | K169: 1 | L169: 0 | M169: 0 | N169: 0 | O169: =1-SUM(J169:N169) -> 0
J170: 0 | K170: 0 | L170: 1 | M170: 0 | N170: 0 | O170: =1-SUM(J170:N170) -> 0
J171: 0 | K171: 0 | L171: 1 | M171: 0 | N171: 0 | O171: =1-SUM(J171:N171) -> 0
J172: 0 | K172: 0 | L172: 0 | M172: 1 | N172: 0 | O172: =1-SUM(J172:N172) -> 0
J173: 0 | K173: 1 | L173: 0 | M173: 0 | N173: 0 | O173: =1-SUM(J173:N173) -> 0
J174: 0 | K174: 0 | L174: 1 | M174: 0 | N174: 0 | O174: =1-SUM(J174:N174) -> 0
J175: 0 | K175: 0 | L175: 1 | M175: 0 | N175: 0 | O175: =1-SUM(J175:N175) -> 0
J176: 0 | K176: 0 | L176: 1 | M176: 0 | N176: 0 | O176: =1-SUM(J176:N176) -> 0
J177: 0 | K177: 0 | L177: 0 | M177: 1 | N177: 0 | O177: =1-SUM(J177:N177) -> 0
J178: 0 | K178: 0 | L178: 1 | M178: 0 | N178: 0 | O178: =1-SUM(J178:N178) -> 0
J179: 0 | K179: 0 | L179: 0 | M179: 1 | N179: 0 | O179: =1-SUM(J179:N179) -> 0
J180: 0 | K180: 0 | L180: 0 | M180: 1 | N180: 0 | O180: =1-SUM(J180:N180) -> 0
J181: 0 | K181: 1 | L181: 0 | M181: 0 | N181: 0 | O181: =1-SUM(J181:N181) -> 0
J182: 0 | K182: 0 | L182: 1 | M182: 0 | N182: 0 | O182: =1-SUM(J182:N182) -> 0
J183: 0 | K183: 0 | L183: 1 | M183: 0 | N183: 0 | O183: =1-SUM(J183:N183) -> 0
J184: 0 | K184: 0 | L184: 1 | M184: 0 | N184: 0 | O184: =1-SUM(J184:N184) -> 0
J185: 1 | K185: 0 | L185: 0 | M185: 0 | N185: 0 | O185: =1-SUM(J185:N185) -> 0
J186: 1 | K186: 0 | L186: 0 | M186: 0 | N186: 0 | O186: =1-SUM(J186:N186) -> 0
J187: 0 | K187: 1 | L187: 0 | M187: 0 | N187: 0 | O187: =1-SUM(J187:N187) -> 0
J188: 0 | K188: 0 | L188: 1 | M188: 0 | N188: 0 | O188: =1-SUM(J188:N188) -> 0
J189: 0 | K189: 0 | L189: 1 | M189: 0 | N189: 0 | O189: =1-SUM(J189:N189) -> 0
J190: 0 | K190: 1 | L190: 0 | M190: 0 | N190: 0 | O190: =1-SUM(J190:N190) -> 0
J191: 0 | K191: 0 | L191: 0 | M191: 1 | N191: 0 | O191: =1-SUM(J191:N191) -> 0
J192: 0 | K192: 0 | L192: 1 | M192: 0 | N192: 0 | O192: =1-SUM(J192:N192) -> 0
J193: 0 | K193: 0 | L193: 1 | M193: 0 | N193: 0 | O193: =1-SUM(J193:N193) -> 0
J194: 0 | K194: 0 | L194: 1 | M194: 0 | N194: 0 | O194: =1-SUM(J194:N194) -> 0
J195: 0 | K195: 0 | L195: 1 | M195: 0 | N195: 0 | O195: =1-SUM(J195:N195) -> 0
J196: 0 | K196: 1 | L196: 0 | M196: 0 | N196: 0 | O196: =1-SUM(J196:N196) -> 0
J197: 0 | K197: 1 | L197: 0 | M197: 0 | N197: 0 | O197: =1-SUM(J197:N197) -> 0
J198: 0 | K198: 1 | L198: 0 | M198: 0 | N198: 0 | O198: =1-SUM(J198:N198) -> 0
J199: 0 | K199: 0 | L199: 0 | M199: 1 | N199: 0 | O199: =1-SUM(J199:N199) -> 0
J200: 0 | K200: 0 | L200: 0 | M200: 1 | N200: 0 | O200: =1-SUM(J200:N200) -> 0
J201: 0 | K201: 0 | L201: 0 | M201: 1 | N201: 0 | O201: =1-SUM(J201:N201) -> 0
J202: 0 | K202: 1 | L202: 0 | M202: 0 | N202: 0 | O202: =1-SUM(J202:N202) -> 0
J203: 0 | K203: 0 | L203: 1 | M203: 0 | N203: 0 | O203: =1-SUM(J203:N203) -> 0
J204: 0 | K204: 1 | L204: 0 | M204: 0 | N204: 0 | O204: =1-SUM(J204:N204) -> 0
J205: 0 | K205: 1 | L205: 0 | M205: 0 | N205: 0 | O205: =1-SUM(J205:N205) -> 0
J206: 0 | K206: 0 | L206: 1 | M206: 0 | N206: 0 | O206: =1-SUM(J206:N206) -> 0
J207: 0 | K207: 1 | L207: 0 | M207: 0 | N207: 0 | O207: =1-SUM(J207:N207) -> 0
J208: 0 | K208: 1 | L208: 0 | M208: 0 | N208: 0 | O208: =1-SUM(J208:N208) -> 0
J209: 0 | K209: 1 | L209: 0 | M209: 0 | N209: 0 | O209: =1-SUM(J209:N209) -> 0
J210: 0 | K210: 0 | L210: 1 | M210: 0 | N210: 0 | O210: =1-SUM(J210:N210) -> 0
J211: 0 | K211: 0 | L211: 0 | M211: 1 | N211: 0 | O211: =1-SUM(J211:N211) -> 0
J212: 0 | K212: 0 | L212: 1 | M212: 0 | N212: 0 | O212: =1-SUM(J212:N212) -> 0
J213: 0 | K213: 0 | L213: 1 | M213: 0 | N213: 0 | O213: =1-SUM(J213:N213) -> 0
J214: 0 | K214: 1 | L214: 0 | M214: 0 | N214: 0 | O214: =1-SUM(J214:N214) -> 0
J215: 0 | K215: 0 | L215: 1 | M215: 0 | N215: 0 | O215: =1-SUM(J215:N215) -> 0
J216: 0 | K216: 0 | L216: 0 | M216: 0 | N216: 1 | O216: =1-SUM(J216:N216) -> 0
J217: 0 | K217: 0 | L217: 0 | M217: 0 | N217: 1 | O217: =1-SUM(J217:N217) -> 0
J218: 0 | K218: 0 | L218: 0 | M218: 1 | N218: 0 | O218: =1-SUM(J218:N218) -> 0
J219: 0 | K219: 0 | L219: 1 | M219: 0 | N219: 0 | O219: =1-SUM(J219:N219) -> 0
J220: 0 | K220: 0 | L220: 0 | M220: 0 | N220: 0 | O220: =1-SUM(J220:N220) -> 1
J221: 0 | K221: 0 | L221: 1 | M221: 0 | N221: 0 | O221: =1-SUM(J221:N221) -> 0
J222: 0 | K222: 0 | L222: 1 | M222: 0 | N222: 0 | O222: =1-SUM(J222:N222) -> 0
J223: 0 | K223: 1 | L223: 0 | M223: 0 | N223: 0 | O223: =1-SUM(J223:N223) -> 0
J224: 1 | K224: 0 | L224: 0 | M224: 0 | N224: 0 | O224: =1-SUM(J224:N224) -> 0
J225: 1 | K225: 0 | L225: 0 | M225: 0 | N225: 0 | O225: =1-SUM(J225:N225) -> 0
J226: 0 | K226: 0 | L226: 0 | M226: 1 | N226: 0 | O226: =1-SUM(J226:N226) -> 0
J227: 0 | K227: 0 | L227: 1 | M227: 0 | N227: 0 | O227: =1-SUM(J227:N227) -> 0
J228: 0 | K228: 1 | L228: 0 | M228: 0 | N228: 0 | O228: =1-SUM(J228:N228) -> 0
J229: 0 | K229: 0 | L229: 1 | M229: 0 | N229: 0 | O229: =1-SUM(J229:N229) -> 0
J230: 0 | K230: 0 | L230: 1 | M230: 0 | N230: 0 | O230: =1-SUM(J230:N230) -> 0
J231: 0 | K231: 0 | L231: 0 | M231: 1 | N231: 0 | O231: =1-SUM(J231:N231) -> 0
J232: 0 | K232: 1 | L232: 0 | M232: 0 | N232: 0 | O232: =1-SUM(J232:N232) -> 0
J233: 0 | K233: 1 | L233: 0 | M233: 0 | N233: 0 | O233: =1-SUM(J233:N233) -> 0
J234: 0 | K234: 1 | L234: 0 | M234: 0 | N234: 0 | O234: =1-SUM(J234:N234) -> 0
J235: 0 | K235: 0 | L235: 1 | M235: 0 | N235: 0 | O235: =1-SUM(J235:N235) -> 0
J236: 0 | K236: 1 | L236: 0 | M236: 0 | N236: 0 | O236: =1-SUM(J236:N236) -> 0
J237: 0 | K237: 0 | L237: 1 | M237: 0 | N237: 0 | O237: =1-SUM(J237:N237) -> 0
J238: 0 | K238: 0 | L238: 1 | M238: 0 | N238: 0 | O238: =1-SUM(J238:N238) -> 0
J239: 0 | K239: 0 | L239: 1 | M239: 0 | N239: 0 | O239: =1-SUM(J239:N239) -> 0
J240: 0 | K240: 0 | L240: 1 | M240: 0 | N240: 0 | O240: =1-SUM(J240:N240) -> 0
J241: 0 | K241: 1 | L241: 0 | M241: 0 | N241: 0 | O241: =1-SUM(J241:N241) -> 0
J242: 0 | K242: 1 | L242: 0 | M242: 0 | N242: 0 | O242: =1-SUM(J242:N242) -> 0
J243: 0 | K243: 0 | L243: 1 | M243: 0 | N243: 0 | O243: =1-SUM(J243:N243) -> 0
J244: 0 | K244: 0 | L244: 1 | M244: 0 | N244: 0 | O244: =1-SUM(J244:N244) -> 0
J245: 0 | K245: 0 | L245: 1 | M245: 0 | N245: 0 | O245: =1-SUM(J245:N245) -> 0
J246: 0 | K246: 1 | L246: 0 | M246: 0 | N246: 0 | O246: =1-SUM(J246:N246) -> 0
J247: 1 | K247: 0 | L247: 0 | M247: 0 | N247: 0 | O247: =1-SUM(J247:N247) -> 0
J248: 0 | K248: 1 | L248: 0 | M248: 0 | N248: 0 | O248: =1-SUM(J248:N248) -> 0
J249: 1 | K249: 0 | L249: 0 | M249: 0 | N249: 0 | O249: =1-SUM(J249:N249) -> 0
J250: 1 | K250: 0 | L250: 0 | M250: 0 | N250: 0 | O250: =1-SUM(J250:N250) -> 0
J251: 0 | K251: 0 | L251: 1 | M251: 0 | N251: 0 | O251: =1-SUM(J251:N251) -> 0
J252: 1 | K252: 0 | L252: 0 | M252: 0 | N252: 0 | O252: =1-SUM(J252:N252) -> 0
J253: 1 | K253: 0 | L253: 0 | M253: 0 | N253: 0 | O253: =1-SUM(J253:N253) -> 0
J254: 1 | K254: 0 | L254: 0 | M254: 0 | N254: 0 | O254: =1-SUM(J254:N254) -> 0
J255: 1 | K255: 0 | L255: 0 | M255: 0 | N255: 0 | O255: =1-SUM(J255:N255) -> 0
J256: 0 | K256: 1 | L256: 0 | M256: 0 | N256: 0 | O256: =1-SUM(J256:N256) -> 0
J257: 1 | K257: 0 | L257: 0 | M257: 0 | N257: 0 | O257: =1-SUM(J257:N257) -> 0
J258: 0 | K258: 0 | L258: 0 | M258: 1 | N258: 0 | O258: =1-SUM(J258:N258) -> 0
J259: 0 | K259: 1 | L259: 0 | M259: 0 | N259: 0 | O259: =1-SUM(J259:N259) -> 0
J260: 1 | K260: 0 | L260: 0 | M260: 0 | N260: 0 | O260: =1-SUM(J260:N260) -> 0
J261: 0 | K261: 0 | L261: 1 | M261: 0 | N261: 0 | O261: =1-SUM(J261:N261) -> 0
J262: 0 | K262: 0 | L262: 0 | M262: 0 | N262: 1 | O262: =1-SUM(J262:N262) -> 0
J263: 0 | K263: 0 | L263: 0 | M263: 1 | N263: 0 | O263: =1-SUM(J263:N263) -> 0
J264: 0 | K264: 0 | L264: 0 | M264: 0 | N264: 1 | O264: =1-SUM(J264:N264) -> 0
J265: 0 | K265: 0 | L265: 1 | M265: 0 | N265: 0 | O265: =1-SUM(J265:N265) -> 0
J266: 0 | K266: 0 | L266: 0 | M266: 0 | N266: 1 | O266: =1-SUM(J266:N266) -> 0
J267: 0 | K267: 1 | L267: 0 | M267: 0 | N267: 0 | O267: =1-SUM(J267:N267) -> 0
J268: 0 | K268: 1 | L268: 0 | M268: 0 | N268: 0 | O268: =1-SUM(J268:N268) -> 0
J269: 0 | K269: 0 | L269: 0 | M269: 1 | N269: 0 | O269: =1-SUM(J269:N269) -> 0
J270: 0 | K270: 1 | L270: 0 | M270: 0 | N270: 0 | O270: =1-SUM(J270:N270) -> 0
J271: 0 | K271: 1 | L271: 0 | M271: 0 | N271: 0 | O271: =1-SUM(J271:N271) -> 0
J272: 0 | K272: 1 | L272: 0 | M272: 0 | N272: 0 | O272: =1-SUM(J272:N272) -> 0
J273: 0 | K273: 0 | L273: 1 | M273: 0 | N273: 0 | O273: =1-SUM(J273:N273) -> 0
J274: 0 | K274: 0 | L274: 0 | M274: 1 | N274: 0 | O274: =1-SUM(J274:N274) -> 0
J275: 0 | K275: 1 | L275: 0 | M275: 0 | N275: 0 | O275: =1-SUM(J275:N275) -> 0
J276: 1 | K276: 0 | L276: 0 | M276: 0 | N276: 0 | O276: =1-SUM(J276:N276) -> 0
J277: 0 | K277: 0 | L277: 1 | M277: 0 | N277: 0 | O277: =1-SUM(J277:N277) -> 0
J278: 0 | K278: 0 | L278: 0 | M278: 0 | N278: 1 | O278: =1-SUM(J278:N278) -> 0
J279: 0 | K279: 0 | L279: 1 | M279: 0 | N279: 0 | O279: =1-SUM(J279:N279) -> 0
J280: 0 | K280: 0 | L280: 0 | M280: 0 | N280: 1 | O280: =1-SUM(J280:N280) -> 0
J281: 0 | K281: 0 | L281: 1 | M281: 0 | N281: 0 | O281: =1-SUM(J281:N281) -> 0
J282: 0 | K282: 1 | L282: 0 | M282: 0 | N282: 0 | O282: =1-SUM(J282:N282) -> 0
J283: 0 | K283: 0 | L283: 0 | M283: 0 | N283: 1 | O283: =1-SUM(J283:N283) -> 0
J284: 0 | K284: 1 | L284: 0 | M284: 0 | N284: 0 | O284: =1-SUM(J284:N284) -> 0
J285: 0 | K285: 0 | L285: 0 | M285: 1 | N285: 0 | O285: =1-SUM(J285:N285) -> 0
J286: 0 | K286: 0 | L286: 1 | M286: 0 | N286: 0 | O286: =1-SUM(J286:N286) -> 0
J287: 0 | K287: 1 | L287: 0 | M287: 0 | N287: 0 | O287: =1-SUM(J287:N287) -> 0
J288: 0 | K288: 1 | L288: 0 | M288: 0 | N288: 0 | O288: =1-SUM(J288:N288) -> 0
J289: 0 | K289: 1 | L289: 0 | M289: 0 | N289: 0 | O289: =1-SUM(J289:N289) -> 0
J290: 0 | K290: 1 | L290: 0 | M290: 0 | N290: 0 | O290: =1-SUM(J290:N290) -> 0
J291: 0 | K291: 0 | L291: 0 | M291: 0 | N291: 1 | O291: =1-SUM(J291:N291) -> 0
J292: 0 | K292: 0 | L292: 0 | M292: 1 | N292: 0 | O292: =1-SUM(J292:N292) -> 0
J293: 0 | K293: 0 | L293: 0 | M293: 1 | N293: 0 | O293: =1-SUM(J293:N293) -> 0
J294: 0 | K294: 0 | L294: 1 | M294: 0 | N294: 0 | O294: =1-SUM(J294:N294) -> 0
J295: 0 | K295: 1 | L295: 0 | M295: 0 | N295: 0 | O295: =1-SUM(J295:N295) -> 0
J296: 0 | K296: 0 | L296: 0 | M296: 1 | N296: 0 | O296: =1-SUM(J296:N296) -> 0
J297: 0 | K297: 0 | L297: 0 | M297: 1 | N297: 0 | O297: =1-SUM(J297:N297) -> 0
J298: 1 | K298: 0 | L298: 0 | M298: 0 | N298: 0 | O298: =1-SUM(J298:N298) -> 0
J299: 1 | K299: 0 | L299: 0 | M299: 0 | N299: 0 | O299: =1-SUM(J299:N299) -> 0
J300: 0 | K300: 0 | L300: 1 | M300: 0 | N300: 0 | O300: =1-SUM(J300:N300) -> 0
J301: 0 | K301: 1 | L301: 0 | M301: 0 | N301: 0 | O301: =1-SUM(J301:N301) -> 0
J302: 1 | K302: 0 | L302: 0 | M302: 0 | N302: 0 | O302: =1-SUM(J302:N302) -> 0
J303: 0 | K303: 0 | L303: 1 | M303: 0 | N303: 0 | O303: =1-SUM(J303:N303) -> 0
J304: 0 | K304: 0 | L304: 1 | M304: 0 | N304: 0 | O304: =1-SUM(J304:N304) -> 0
J305: 0 | K305: 1 | L305: 0 | M305: 0 | N305: 0 | O305: =1-SUM(J305:N305) -> 0
J306: 0 | K306: 0 | L306: 1 | M306: 0 | N306: 0 | O306: =1-SUM(J306:N306) -> 0
J307: 0 | K307: 0 | L307: 0 | M307: 0 | N307: 0 | O307: =1-SUM(J307:N307) -> 1
J308: 0 | K308: 0 | L308: 1 | M308: 0 | N308: 0 | O308: =1-SUM(J308:N308) -> 0
J309: 0 | K309: 0 | L309: 1 | M309: 0 | N309: 0 | O309: =1-SUM(J309:N309) -> 0
J310: 0 | K310: 0 | L310: 0 | M310: 0 | N310: 0 | O310: =1-SUM(J310:N310) -> 1
J311: 0 | K311: 0 | L311: 1 | M311: 0 | N311: 0 | O311: =1-SUM(J311:N311) -> 0
J312: 1 | K312: 0 | L312: 0 | M312: 0 | N312: 0 | O312: =1-SUM(J312:N312) -> 0
J313: 0 | K313: 1 | L313: 0 | M313: 0 | N313: 0 | O313: =1-SUM(J313:N313) -> 0
J314: 0 | K314: 0 | L314: 1 | M314: 0 | N314: 0 | O314: =1-SUM(J314:N314) -> 0
J315: 0 | K315: 1 | L315: 0 | M315: 0 | N315: 0 | O315: =1-SUM(J315:N315) -> 0
J316: 0 | K316: 0 | L316: 1 | M316: 0 | N316: 0 | O316: =1-SUM(J316:N316) -> 0
J317: 0 | K317: 1 | L317: 0 | M317: 0 | N317: 0 | O317: =1-SUM(J317:N317) -> 0
J318: 0 | K318: 1 | L318: 0 | M318: 0 | N318: 0 | O318: =1-SUM(J318:N318) -> 0
J319: 0 | K319: 1 | L319: 0 | M319: 0 | N319: 0 | O319: =1-SUM(J319:N319) -> 0
J320: 1 | K320: 0 | L320: 0 | M320: 0 | N320: 0 | O320: =1-SUM(J320:N320) -> 0
J321: 0 | K321: 0 | L321: 1 | M321: 0 | N321: 0 | O321: =1-SUM(J321:N321) -> 0
J322: 0 | K322: 0 | L322: 0 | M322: 0 | N322: 0 | O322: =1-SUM(J322:N322) -> 1
J323: 0 | K323: 0 | L323: 0 | M323: 0 | N323: 0 | O323: =1-SUM(J323:N323) -> 1
J324: 0 | K324: 0 | L324: 0 | M324: 0 | N324: 0 | O324: =1-SUM(J324:N324) -> 1
J325: 0 | K325: 0 | L325: 0 | M325: 0 | N325: 0 | O325: =1-SUM(J325:N325) -> 1
J326: 0 | K326: 0 | L326: 0 | M326: 0 | N326: 0 | O326: =1-SUM(J326:N326) -> 1
J327: 0 | K327: 0 | L327: 0 | M327: 0 | N327: 0 | O327: =1-SUM(J327:N327) -> 1
J328: 0 | K328: 0 | L328: 0 | M328: 0 | N328: 0 | O328: =1-SUM(J328:N328) -> 1
J329: 0 | K329: 0 | L329: 0 | M329: 1 | N329: 0 | O329: =1-SUM(J329:N329) -> 0
J330: 0 | K330: 0 | L330: 0 | M330: 0 | N330: 0 | O330: =1-SUM(J330:N330) -> 1
J331: 1 | K331: 0 | L331: 0 | M331: 0 | N331: 0 | O331: =1-SUM(J331:N331) -> 0
J332: 0 | K332: 1 | L332: 0 | M332: 0 | N332: 0 | O332: =1-SUM(J332:N332) -> 0
J333: 0 | K333: 1 | L333: 0 | M333: 0 | N333: 0 | O333: =1-SUM(J333:N333) -> 0
J334: 0 | K334: 0 | L334: 1 | M334: 0 | N334: 0 | O334: =1-SUM(J334:N334) -> 0
J335: 0 | K335: 0 | L335: 1 | M335: 0 | N335: 0 | O335: =1-SUM(J335:N335) -> 0
J336: 0 | K336: 0 | L336: 1 | M336: 0 | N336: 0 | O336: =1-SUM(J336:N336) -> 0
J337: 1 | K337: 0 | L337: 0 | M337: 0 | N337: 0 | O337: =1-SUM(J337:N337) -> 0
J338: 0 | K338: 1 | L338: 0 | M338: 0 | N338: 0 | O338: =1-SUM(J338:N338) -> 0
J339: 0 | K339: 1 | L339: 0 | M339: 0 | N339: 0 | O339: =1-SUM(J339:N339) -> 0
J340: 0 | K340: 0 | L340: 1 | M340: 0 | N340: 0 | O340: =1-SUM(J340:N340) -> 0
J341: 0 | K341: 0 | L341: 1 | M341: 0 | N341: 0 | O341: =1-SUM(J341:N341) -> 0
J342: 1 | K342: 0 | L342: 0 | M342: 0 | N342: 0 | O342: =1-SUM(J342:N342) -> 0
J343: 0 | K343: 1 | L343: 0 | M343: 0 | N343: 0 | O343: =1-SUM(J343:N343) -> 0
J344: 0 | K344: 1 | L344: 0 | M344: 0 | N344: 0 | O344: =1-SUM(J344:N344) -> 0
J345: 0 | K345: 1 | L345: 0 | M345: 0 | N345: 0 | O345: =1-SUM(J345:N345) -> 0
J346: 0 | K346: 1 | L346: 0 | M346: 0 | N346: 0 | O346: =1-SUM(J346:N346) -> 0
J347: 0 | K347: 1 | L347: 0 | M347: 0 | N347: 0 | O347: =1-SUM(J347:N347) -> 0
J348: 0 | K348: 1 | L348: 0 | M348: 0 | N348: 0 | O348: =1-SUM(J348:N348) -> 0
J349: 0 | K349: 1 | L349: 0 | M349: 0 | N349: 0 | O349: =1-SUM(J349:N349) -> 0
J350: 0 | K350: 1 | L350: 0 | M350: 0 | N350: 0 | O350: =1-SUM(J350:N350) -> 0
J351: 0 | K351: 0 | L351: 1 | M351: 0 | N351: 0 | O351: =1-SUM(J351:N351) -> 0
J352: 0 | K352: 1 | L352: 0 | M352: 0 | N352: 0 | O352: =1-SUM(J352:N352) -> 0
J353: 0 | K353: 0 | L353: 1 | M353: 0 | N353: 0 | O353: =1-SUM(J353:N353) -> 0
J354: 0 | K354: 0 | L354: 1 | M354: 0 | N354: 0 | O354: =1-SUM(J354:N354) -> 0
J355: 0 | K355: 0 | L355: 1 | M355: 0 | N355: 0 | O355: =1-SUM(J355:N355) -> 0
J356: 0 | K356: 1 | L356: 0 | M356: 0 | N356: 0 | O356: =1-SUM(J356:N356) -> 0
J357: 0 | K357: 1 | L357: 0 | M357: 0 | N357: 0 | O357: =1-SUM(J357:N357) -> 0
J358: 0 | K358: 1 | L358: 0 | M358: 0 | N358: 0 | O358: =1-SUM(J358:N358) -> 0
J359: 0 | K359: 1 | L359: 0 | M359: 0 | N359: 0 | O359: =1-SUM(J359:N359) -> 0
J360: 0 | K360: 1 | L360: 0 | M360: 0 | N360: 0 | O360: =1-SUM(J360:N360) -> 0
J361: 1 | K361: 0 | L361: 0 | M361: 0 | N361: 0 | O361: =1-SUM(J361:N361) -> 0
J362: 0 | K362: 1 | L362: 0 | M362: 0 | N362: 0 | O362: =1-SUM(J362:N362) -> 0
J363: 0 | K363: 1 | L363: 0 | M363: 0 | N363: 0 | O363: =1-SUM(J363:N363) -> 0
J364: 1 | K364: 0 | L364: 0 | M364: 0 | N364: 0 | O364: =1-SUM(J364:N364) -> 0
J365: 1 | K365: 0 | L365: 0 | M365: 0 | N365: 0 | O365: =1-SUM(J365:N365) -> 0
J366: 1 | K366: 0 | L366: 0 | M366: 0 | N366: 0 | O366: =1-SUM(J366:N366) -> 0
J367: 0 | K367: 0 | L367: 1 | M367: 0 | N367: 0 | O367: =1-SUM(J367:N367) -> 0
J368: 0 | K368: 0 | L368: 1 | M368: 0 | N368: 0 | O368: =1-SUM(J368:N368) -> 0
J369: 1 | K369: 0 | L369: 0 | M369: 0 | N369: 0 | O369: =1-SUM(J369:N369) -> 0
J370: 0 | K370: 1 | L370: 0 | M370: 0 | N370: 0 | O370: =1-SUM(J370:N370) -> 0
J371: 0 | K371: 0 | L371: 1 | M371: 0 | N371: 0 | O371: =1-SUM(J371:N371) -> 0
J372: 0 | K372: 1 | L372: 0 | M372: 0 | N372: 0 | O372: =1-SUM(J372:N372) -> 0
J373: 0 | K373: 0 | L373: 1 | M373: 0 | N373: 0 | O373: =1-SUM(J373:N373) -> 0
J374: 0 | K374: 1 | L374: 0 | M374: 0 | N374: 0 | O374: =1-SUM(J374:N374) -> 0
J375: 0 | K375: 0 | L375: 0 | M375: 1 | N375: 0 | O375: =1-SUM(J375:N375) -> 0
J376: 1 | K376: 0 | L376: 0 | M376: 0 | N376: 0 | O376: =1-SUM(J376:N376) -> 0
J377: 1 | K377: 0 | L377: 0 | M377: 0 | N377: 0 | O377: =1-SUM(J377:N377) -> 0
J378: 1 | K378: 0 | L378: 0 | M378: 0 | N378: 0 | O378: =1-SUM(J378:N378) -> 0
J379: 1 | K379: 0 | L379: 0 | M379: 0 | N379: 0 | O379: =1-SUM(J379:N379) -> 0
J380: 0 | K380: 0 | L380: 1 | M380: 0 | N380: 0 | O380: =1-SUM(J380:N380) -> 0
J381: 0 | K381: 0 | L381: 0 | M381: 1 | N381: 0 | O381: =1-SUM(J381:N381) -> 0
J382: 0 | K382: 0 | L382: 1 | M382: 0 | N382: 0 | O382: =1-SUM(J382:N382) -> 0
J383: 0 | K383: 0 | L383: 0 | M383: 0 | N383: 1 | O383: =1-SUM(J383:N383) -> 0
J384: 0 | K384: 0 | L384: 0 | M384: 0 | N384: 1 | O384: =1-SUM(J384:N384) -> 0
J385: 0 | K385: 0 | L385: 1 | M385: 0 | N385: 0 | O385: =1-SUM(J385:N385) -> 0
J386: 0 | K386: 0 | L386: 1 | M386: 0 | N386: 0 | O386: =1-SUM(J386:N386) -> 0
J387: 0 | K387: 0 | L387: 0 | M387: 0 | N387: 0 | O387: =1-SUM(J387:N387) -> 1
J388: 0 | K388: 0 | L388: 1 | M388: 0 | N388: 0 | O388: =1-SUM(J388:N388) -> 0
J389: 0 | K389: 1 | L389: 0 | M389: 0 | N389: 0 | O389: =1-SUM(J389:N389) -> 0
J390: 0 | K390: 0 | L390: 1 | M390: 0 | N390: 0 | O390: =1-SUM(J390:N390) -> 0
J391: 0 | K391: 0 | L391: 1 | M391: 0 | N391: 0 | O391: =1-SUM(J391:N391) -> 0
J392: 0 | K392: 0 | L392: 0 | M392: 0 | N392: 1 | O392: =1-SUM(J392:N392) -> 0
J393: 0 | K393: 0 | L393: 0 | M393: 0 | N393: 1 | O393: =1-SUM(J393:N393) -> 0
J394: 0 | K394: 0 | L394: 1 | M394: 0 | N394: 0 | O394: =1-SUM(J394:N394) -> 0
J395: 0 | K395: 1 | L395: 0 | M395: 0 | N395: 0 | O395: =1-SUM(J395:N395) -> 0
J396: 0 | K396: 0 | L396: 0 | M396: 1 | N396: 0 | O396: =1-SUM(J396:N396) -> 0
J397: 0 | K397: 0 | L397: 1 | M397: 0 | N397: 0 | O397: =1-SUM(J397:N397) -> 0