A1: Suddivisione Corsi per Aree Geografiche
H2: Area Geografica | I2: Laureati 2003
H3: Nord | I3: 105324
A4: Area Geografica | B4: Totale corsi | H4: Centro | I4: 68506
A5: Nord | B5: 174 | H5: Sud | I5: 39763
A6: Centro | B6: 113 | H6: Isole | I6: 19908
A7: Sud | B7: 87 | H7: Totale | I7: =SUM(I3:I6) -> 233501
A8: Isole | B8: 20
A9: Totale | B9: =SUM(B5:B8) -> 394 | H9: Area Geografica | I9: Popolazione 2001 (X 1000)
H10: Nord | I10: =SUM(J10:K10) -> 25574 | J10: 14939 | K10: 10635
H11: Centro | I11: 10907
H12: Sud | I12: 13915
H13: Isole | I13: 6601
H14: Totale | I14: =SUM(I10:I13) -> 56997
H16: Area Geografica | I16: Studenti Iscritti 2003/04
H17: Nord | I17: 691447
H18: Centro | I18: 489801
H19: Sud | I19: 407601
H20: Isole | I20: 214175
H21: Totale | I21: =SUM(I17:I20) -> 1803024