A1: Suddivisione Corsi per Numero di Crediti
I2: 1 | J2: 2 | K2: 2.5 | L2: 3 | M2: 4 | N2: 5 | O2: 6 | P2: 7 | Q2: 7.5 | R2: 8 | S2: 9 | T2: 10 | U2: 11 | V2: 12 | W2: altro
A3: Crediti | B3: Numero corsi | I3: 0 | J3: 0 | K3: 0 | L3: 0 | M3: 0 | N3: 0 | O3: 0 | P3: 0 | Q3: 0 | R3: 0 | S3: 1 | T3: 0 | U3: 0 | V3: 0 | W3: =1-SUM(I3:V3) -> 0
A4: Cred. 1 | B4: =I397 -> 1 | I4: 0 | J4: 0 | K4: 0 | L4: 0 | M4: 0 | N4: 0 | O4: 0 | P4: 1 | Q4: 0 | R4: 0 | S4: 0 | T4: 0 | U4: 0 | V4: 0 | W4: =1-SUM(I4:V4) -> 0
A5: Cred. 2 | B5: =J397 -> 4 | I5: 0 | J5: 0 | K5: 0 | L5: 0 | M5: 0 | N5: 0 | O5: 0 | P5: 1 | Q5: 0 | R5: 0 | S5: 0 | T5: 0 | U5: 0 | V5: 0 | W5: =1-SUM(I5:V5) -> 0
A6: Cred. 2.5 | B6: =K397 -> 5 | I6: 0 | J6: 0 | K6: 0 | L6: 0 | M6: 0 | N6: 0 | O6: 0 | P6: 1 | Q6: 0 | R6: 0 | S6: 0 | T6: 0 | U6: 0 | V6: 0 | W6: =1-SUM(I6:V6) -> 0
A7: Cred. 3 | B7: =L397 -> 26 | I7: 0 | J7: 0 | K7: 0 | L7: 0 | M7: 0 | N7: 0 | O7: 0 | P7: 0 | Q7: 0 | R7: 0 | S7: 0 | T7: 0 | U7: 0 | V7: 0 | W7: =1-SUM(I7:V7) -> 1
A8: Cred. 4 | B8: =M397 -> 24 | I8: 0 | J8: 0 | K8: 0 | L8: 0 | M8: 0 | N8: 0 | O8: 1 | P8: 0 | Q8: 0 | R8: 0 | S8: 0 | T8: 0 | U8: 0 | V8: 0 | W8: =1-SUM(I8:V8) -> 0
A9: Cred. 5 | B9: =N397 -> 161 | I9: 0 | J9: 0 | K9: 0 | L9: 0 | M9: 0 | N9: 0 | O9: 1 | P9: 0 | Q9: 0 | R9: 0 | S9: 0 | T9: 0 | U9: 0 | V9: 0 | W9: =1-SUM(I9:V9) -> 0
A10: Cred. 6 | B10: =O397 -> 126 | I10: 0 | J10: 0 | K10: 0 | L10: 0 | M10: 0 | N10: 0 | O10: 1 | P10: 0 | Q10: 0 | R10: 0 | S10: 0 | T10: 0 | U10: 0 | V10: 0 | W10: =1-SUM(I10:V10) -> 0
A11: Cred. 7 | B11: =P397 -> 13 | I11: 0 | J11: 0 | K11: 0 | L11: 0 | M11: 0 | N11: 0 | O11: 0 | P11: 0 | Q11: 0 | R11: 1 | S11: 0 | T11: 0 | U11: 0 | V11: 0 | W11: =1-SUM(I11:V11) -> 0
A12: Cred. 7.5 | B12: =Q397 -> 1 | I12: 0 | J12: 0 | K12: 0 | L12: 0 | M12: 0 | N12: 0 | O12: 1 | P12: 0 | Q12: 0 | R12: 0 | S12: 0 | T12: 0 | U12: 0 | V12: 0 | W12: =1-SUM(I12:V12) -> 0
A13: Cred. 8 | B13: =R397 -> 6 | I13: 0 | J13: 0 | K13: 0 | L13: 0 | M13: 0 | N13: 0 | O13: 1 | P13: 0 | Q13: 0 | R13: 0 | S13: 0 | T13: 0 | U13: 0 | V13: 0 | W13: =1-SUM(I13:V13) -> 0
A14: Cred. 9 | B14: =S397 -> 8 | I14: 0 | J14: 0 | K14: 0 | L14: 0 | M14: 0 | N14: 0 | O14: 1 | P14: 0 | Q14: 0 | R14: 0 | S14: 0 | T14: 0 | U14: 0 | V14: 0 | W14: =1-SUM(I14:V14) -> 0
A15: Cred. 10 | B15: =T397 -> 8 | I15: 0 | J15: 0 | K15: 0 | L15: 0 | M15: 0 | N15: 0 | O15: 1 | P15: 0 | Q15: 0 | R15: 0 | S15: 0 | T15: 0 | U15: 0 | V15: 0 | W15: =1-SUM(I15:V15) -> 0
A16: Cred. 12 | B16: =V397 -> 4 | I16: 0 | J16: 0 | K16: 0 | L16: 0 | M16: 0 | N16: 0 | O16: 1 | P16: 0 | Q16: 0 | R16: 0 | S16: 0 | T16: 0 | U16: 0 | V16: 0 | W16: =1-SUM(I16:V16) -> 0
A17: altro | B17: =W397 -> 7 | I17: 0 | J17: 0 | K17: 0 | L17: 0 | M17: 0 | N17: 1 | O17: 0 | P17: 0 | Q17: 0 | R17: 0 | S17: 0 | T17: 0 | U17: 0 | V17: 0 | W17: =1-SUM(I17:V17) -> 0
A18: Totale | B18: =SUM(B4:B17) -> 394 | I18: 0 | J18: 0 | K18: 0 | L18: 0 | M18: 0 | N18: 1 | O18: 0 | P18: 0 | Q18: 0 | R18: 0 | S18: 0 | T18: 0 | U18: 0 | V18: 0 | W18: =1-SUM(I18:V18) -> 0
I19: 0 | J19: 0 | K19: 0 | L19: 0 | M19: 0 | N19: 1 | O19: 0 | P19: 0 | Q19: 0 | R19: 0 | S19: 0 | T19: 0 | U19: 0 | V19: 0 | W19: =1-SUM(I19:V19) -> 0
I20: 0 | J20: 0 | K20: 0 | L20: 0 | M20: 0 | N20: 1 | O20: 0 | P20: 0 | Q20: 0 | R20: 0 | S20: 0 | T20: 0 | U20: 0 | V20: 0 | W20: =1-SUM(I20:V20) -> 0
I21: 0 | J21: 0 | K21: 0 | L21: 0 | M21: 0 | N21: 1 | O21: 0 | P21: 0 | Q21: 0 | R21: 0 | S21: 0 | T21: 0 | U21: 0 | V21: 0 | W21: =1-SUM(I21:V21) -> 0
I22: 0 | J22: 0 | K22: 0 | L22: 0 | M22: 0 | N22: 1 | O22: 0 | P22: 0 | Q22: 0 | R22: 0 | S22: 0 | T22: 0 | U22: 0 | V22: 0 | W22: =1-SUM(I22:V22) -> 0
I23: 0 | J23: 0 | K23: 0 | L23: 0 | M23: 0 | N23: 1 | O23: 0 | P23: 0 | Q23: 0 | R23: 0 | S23: 0 | T23: 0 | U23: 0 | V23: 0 | W23: =1-SUM(I23:V23) -> 0
I24: 0 | J24: 0 | K24: 0 | L24: 0 | M24: 0 | N24: 0 | O24: 1 | P24: 0 | Q24: 0 | R24: 0 | S24: 0 | T24: 0 | U24: 0 | V24: 0 | W24: =1-SUM(I24:V24) -> 0
I25: 0 | J25: 0 | K25: 0 | L25: 0 | M25: 0 | N25: 0 | O25: 1 | P25: 0 | Q25: 0 | R25: 0 | S25: 0 | T25: 0 | U25: 0 | V25: 0 | W25: =1-SUM(I25:V25) -> 0
I26: 0 | J26: 0 | K26: 0 | L26: 0 | M26: 0 | N26: 1 | O26: 0 | P26: 0 | Q26: 0 | R26: 0 | S26: 0 | T26: 0 | U26: 0 | V26: 0 | W26: =1-SUM(I26:V26) -> 0
I27: 0 | J27: 0 | K27: 0 | L27: 0 | M27: 0 | N27: 1 | O27: 0 | P27: 0 | Q27: 0 | R27: 0 | S27: 0 | T27: 0 | U27: 0 | V27: 0 | W27: =1-SUM(I27:V27) -> 0
I28: 0 | J28: 0 | K28: 0 | L28: 0 | M28: 0 | N28: 0 | O28: 1 | P28: 0 | Q28: 0 | R28: 0 | S28: 0 | T28: 0 | U28: 0 | V28: 0 | W28: =1-SUM(I28:V28) -> 0
I29: 0 | J29: 0 | K29: 0 | L29: 0 | M29: 0 | N29: 0 | O29: 1 | P29: 0 | Q29: 0 | R29: 0 | S29: 0 | T29: 0 | U29: 0 | V29: 0 | W29: =1-SUM(I29:V29) -> 0
I30: 0 | J30: 0 | K30: 0 | L30: 0 | M30: 0 | N30: 0 | O30: 1 | P30: 0 | Q30: 0 | R30: 0 | S30: 0 | T30: 0 | U30: 0 | V30: 0 | W30: =1-SUM(I30:V30) -> 0
I31: 0 | J31: 0 | K31: 0 | L31: 0 | M31: 0 | N31: 0 | O31: 1 | P31: 0 | Q31: 0 | R31: 0 | S31: 0 | T31: 0 | U31: 0 | V31: 0 | W31: =1-SUM(I31:V31) -> 0
I32: 0 | J32: 0 | K32: 0 | L32: 0 | M32: 0 | N32: 0 | O32: 1 | P32: 0 | Q32: 0 | R32: 0 | S32: 0 | T32: 0 | U32: 0 | V32: 0 | W32: =1-SUM(I32:V32) -> 0
I33: 0 | J33: 0 | K33: 0 | L33: 0 | M33: 0 | N33: 0 | O33: 1 | P33: 0 | Q33: 0 | R33: 0 | S33: 0 | T33: 0 | U33: 0 | V33: 0 | W33: =1-SUM(I33:V33) -> 0
I34: 0 | J34: 0 | K34: 0 | L34: 0 | M34: 0 | N34: 0 | O34: 0 | P34: 1 | Q34: 0 | R34: 0 | S34: 0 | T34: 0 | U34: 0 | V34: 0 | W34: =1-SUM(I34:V34) -> 0
I35: 0 | J35: 0 | K35: 0 | L35: 0 | M35: 0 | N35: 1 | O35: 0 | P35: 0 | Q35: 0 | R35: 0 | S35: 0 | T35: 0 | U35: 0 | V35: 0 | W35: =1-SUM(I35:V35) -> 0
I36: 0 | J36: 0 | K36: 0 | L36: 0 | M36: 0 | N36: 1 | O36: 0 | P36: 0 | Q36: 0 | R36: 0 | S36: 0 | T36: 0 | U36: 0 | V36: 0 | W36: =1-SUM(I36:V36) -> 0
I37: 0 | J37: 0 | K37: 0 | L37: 0 | M37: 0 | N37: 1 | O37: 0 | P37: 0 | Q37: 0 | R37: 0 | S37: 0 | T37: 0 | U37: 0 | V37: 0 | W37: =1-SUM(I37:V37) -> 0
I38: 0 | J38: 0 | K38: 0 | L38: 0 | M38: 0 | N38: 1 | O38: 0 | P38: 0 | Q38: 0 | R38: 0 | S38: 0 | T38: 0 | U38: 0 | V38: 0 | W38: =1-SUM(I38:V38) -> 0
I39: 0 | J39: 0 | K39: 0 | L39: 0 | M39: 0 | N39: 1 | O39: 0 | P39: 0 | Q39: 0 | R39: 0 | S39: 0 | T39: 0 | U39: 0 | V39: 0 | W39: =1-SUM(I39:V39) -> 0
I40: 0 | J40: 0 | K40: 0 | L40: 0 | M40: 0 | N40: 1 | O40: 0 | P40: 0 | Q40: 0 | R40: 0 | S40: 0 | T40: 0 | U40: 0 | V40: 0 | W40: =1-SUM(I40:V40) -> 0
I41: 0 | J41: 0 | K41: 0 | L41: 1 | M41: 0 | N41: 0 | O41: 0 | P41: 0 | Q41: 0 | R41: 0 | S41: 0 | T41: 0 | U41: 0 | V41: 0 | W41: =1-SUM(I41:V41) -> 0
I42: 0 | J42: 0 | K42: 0 | L42: 1 | M42: 0 | N42: 0 | O42: 0 | P42: 0 | Q42: 0 | R42: 0 | S42: 0 | T42: 0 | U42: 0 | V42: 0 | W42: =1-SUM(I42:V42) -> 0
I43: 0 | J43: 0 | K43: 0 | L43: 0 | M43: 0 | N43: 0 | O43: 1 | P43: 0 | Q43: 0 | R43: 0 | S43: 0 | T43: 0 | U43: 0 | V43: 0 | W43: =1-SUM(I43:V43) -> 0
I44: 0 | J44: 0 | K44: 0 | L44: 0 | M44: 0 | N44: 1 | O44: 0 | P44: 0 | Q44: 0 | R44: 0 | S44: 0 | T44: 0 | U44: 0 | V44: 0 | W44: =1-SUM(I44:V44) -> 0
I45: 0 | J45: 0 | K45: 0 | L45: 0 | M45: 0 | N45: 1 | O45: 0 | P45: 0 | Q45: 0 | R45: 0 | S45: 0 | T45: 0 | U45: 0 | V45: 0 | W45: =1-SUM(I45:V45) -> 0
I46: 0 | J46: 0 | K46: 0 | L46: 0 | M46: 0 | N46: 1 | O46: 0 | P46: 0 | Q46: 0 | R46: 0 | S46: 0 | T46: 0 | U46: 0 | V46: 0 | W46: =1-SUM(I46:V46) -> 0
I47: 0 | J47: 0 | K47: 0 | L47: 0 | M47: 0 | N47: 1 | O47: 0 | P47: 0 | Q47: 0 | R47: 0 | S47: 0 | T47: 0 | U47: 0 | V47: 0 | W47: =1-SUM(I47:V47) -> 0
I48: 0 | J48: 0 | K48: 0 | L48: 0 | M48: 0 | N48: 0 | O48: 0 | P48: 0 | Q48: 0 | R48: 0 | S48: 0 | T48: 1 | U48: 0 | V48: 0 | W48: =1-SUM(I48:V48) -> 0
I49: 0 | J49: 0 | K49: 0 | L49: 0 | M49: 0 | N49: 1 | O49: 0 | P49: 0 | Q49: 0 | R49: 0 | S49: 0 | T49: 0 | U49: 0 | V49: 0 | W49: =1-SUM(I49:V49) -> 0
I50: 0 | J50: 0 | K50: 0 | L50: 0 | M50: 0 | N50: 1 | O50: 0 | P50: 0 | Q50: 0 | R50: 0 | S50: 0 | T50: 0 | U50: 0 | V50: 0 | W50: =1-SUM(I50:V50) -> 0
I51: 0 | J51: 0 | K51: 0 | L51: 0 | M51: 0 | N51: 1 | O51: 0 | P51: 0 | Q51: 0 | R51: 0 | S51: 0 | T51: 0 | U51: 0 | V51: 0 | W51: =1-SUM(I51:V51) -> 0
I52: 0 | J52: 0 | K52: 0 | L52: 0 | M52: 0 | N52: 1 | O52: 0 | P52: 0 | Q52: 0 | R52: 0 | S52: 0 | T52: 0 | U52: 0 | V52: 0 | W52: =1-SUM(I52:V52) -> 0
I53: 0 | J53: 0 | K53: 0 | L53: 0 | M53: 0 | N53: 1 | O53: 0 | P53: 0 | Q53: 0 | R53: 0 | S53: 0 | T53: 0 | U53: 0 | V53: 0 | W53: =1-SUM(I53:V53) -> 0
I54: 0 | J54: 0 | K54: 0 | L54: 0 | M54: 0 | N54: 1 | O54: 0 | P54: 0 | Q54: 0 | R54: 0 | S54: 0 | T54: 0 | U54: 0 | V54: 0 | W54: =1-SUM(I54:V54) -> 0
I55: 0 | J55: 0 | K55: 0 | L55: 0 | M55: 0 | N55: 1 | O55: 0 | P55: 0 | Q55: 0 | R55: 0 | S55: 0 | T55: 0 | U55: 0 | V55: 0 | W55: =1-SUM(I55:V55) -> 0
I56: 0 | J56: 0 | K56: 0 | L56: 0 | M56: 1 | N56: 0 | O56: 0 | P56: 0 | Q56: 0 | R56: 0 | S56: 0 | T56: 0 | U56: 0 | V56: 0 | W56: =1-SUM(I56:V56) -> 0
I57: 0 | J57: 0 | K57: 0 | L57: 0 | M57: 1 | N57: 0 | O57: 0 | P57: 0 | Q57: 0 | R57: 0 | S57: 0 | T57: 0 | U57: 0 | V57: 0 | W57: =1-SUM(I57:V57) -> 0
I58: 0 | J58: 0 | K58: 0 | L58: 0 | M58: 0 | N58: 0 | O58: 1 | P58: 0 | Q58: 0 | R58: 0 | S58: 0 | T58: 0 | U58: 0 | V58: 0 | W58: =1-SUM(I58:V58) -> 0
I59: 0 | J59: 0 | K59: 0 | L59: 0 | M59: 0 | N59: 0 | O59: 1 | P59: 0 | Q59: 0 | R59: 0 | S59: 0 | T59: 0 | U59: 0 | V59: 0 | W59: =1-SUM(I59:V59) -> 0
I60: 0 | J60: 0 | K60: 0 | L60: 0 | M60: 0 | N60: 0 | O60: 1 | P60: 0 | Q60: 0 | R60: 0 | S60: 0 | T60: 0 | U60: 0 | V60: 0 | W60: =1-SUM(I60:V60) -> 0
I61: 0 | J61: 0 | K61: 0 | L61: 0 | M61: 0 | N61: 0 | O61: 1 | P61: 0 | Q61: 0 | R61: 0 | S61: 0 | T61: 0 | U61: 0 | V61: 0 | W61: =1-SUM(I61:V61) -> 0
I62: 0 | J62: 0 | K62: 0 | L62: 0 | M62: 0 | N62: 0 | O62: 1 | P62: 0 | Q62: 0 | R62: 0 | S62: 0 | T62: 0 | U62: 0 | V62: 0 | W62: =1-SUM(I62:V62) -> 0
I63: 0 | J63: 0 | K63: 0 | L63: 0 | M63: 0 | N63: 0 | O63: 1 | P63: 0 | Q63: 0 | R63: 0 | S63: 0 | T63: 0 | U63: 0 | V63: 0 | W63: =1-SUM(I63:V63) -> 0
I64: 0 | J64: 0 | K64: 0 | L64: 0 | M64: 0 | N64: 0 | O64: 1 | P64: 0 | Q64: 0 | R64: 0 | S64: 0 | T64: 0 | U64: 0 | V64: 0 | W64: =1-SUM(I64:V64) -> 0
I65: 0 | J65: 0 | K65: 0 | L65: 0 | M65: 0 | N65: 0 | O65: 1 | P65: 0 | Q65: 0 | R65: 0 | S65: 0 | T65: 0 | U65: 0 | V65: 0 | W65: =1-SUM(I65:V65) -> 0
I66: 0 | J66: 0 | K66: 0 | L66: 0 | M66: 0 | N66: 0 | O66: 1 | P66: 0 | Q66: 0 | R66: 0 | S66: 0 | T66: 0 | U66: 0 | V66: 0 | W66: =1-SUM(I66:V66) -> 0
I67: 0 | J67: 0 | K67: 0 | L67: 0 | M67: 0 | N67: 0 | O67: 1 | P67: 0 | Q67: 0 | R67: 0 | S67: 0 | T67: 0 | U67: 0 | V67: 0 | W67: =1-SUM(I67:V67) -> 0
I68: 0 | J68: 0 | K68: 0 | L68: 0 | M68: 0 | N68: 0 | O68: 1 | P68: 0 | Q68: 0 | R68: 0 | S68: 0 | T68: 0 | U68: 0 | V68: 0 | W68: =1-SUM(I68:V68) -> 0
I69: 0 | J69: 0 | K69: 0 | L69: 0 | M69: 0 | N69: 1 | O69: 0 | P69: 0 | Q69: 0 | R69: 0 | S69: 0 | T69: 0 | U69: 0 | V69: 0 | W69: =1-SUM(I69:V69) -> 0
I70: 0 | J70: 0 | K70: 0 | L70: 0 | M70: 0 | N70: 0 | O70: 1 | P70: 0 | Q70: 0 | R70: 0 | S70: 0 | T70: 0 | U70: 0 | V70: 0 | W70: =1-SUM(I70:V70) -> 0
I71: 0 | J71: 0 | K71: 0 | L71: 0 | M71: 0 | N71: 0 | O71: 1 | P71: 0 | Q71: 0 | R71: 0 | S71: 0 | T71: 0 | U71: 0 | V71: 0 | W71: =1-SUM(I71:V71) -> 0
I72: 0 | J72: 0 | K72: 0 | L72: 0 | M72: 0 | N72: 0 | O72: 1 | P72: 0 | Q72: 0 | R72: 0 | S72: 0 | T72: 0 | U72: 0 | V72: 0 | W72: =1-SUM(I72:V72) -> 0
I73: 0 | J73: 0 | K73: 0 | L73: 0 | M73: 0 | N73: 1 | O73: 0 | P73: 0 | Q73: 0 | R73: 0 | S73: 0 | T73: 0 | U73: 0 | V73: 0 | W73: =1-SUM(I73:V73) -> 0
I74: 0 | J74: 0 | K74: 0 | L74: 0 | M74: 0 | N74: 1 | O74: 0 | P74: 0 | Q74: 0 | R74: 0 | S74: 0 | T74: 0 | U74: 0 | V74: 0 | W74: =1-SUM(I74:V74) -> 0
I75: 0 | J75: 0 | K75: 0 | L75: 0 | M75: 0 | N75: 1 | O75: 0 | P75: 0 | Q75: 0 | R75: 0 | S75: 0 | T75: 0 | U75: 0 | V75: 0 | W75: =1-SUM(I75:V75) -> 0
I76: 0 | J76: 0 | K76: 0 | L76: 0 | M76: 0 | N76: 1 | O76: 0 | P76: 0 | Q76: 0 | R76: 0 | S76: 0 | T76: 0 | U76: 0 | V76: 0 | W76: =1-SUM(I76:V76) -> 0
I77: 0 | J77: 0 | K77: 0 | L77: 0 | M77: 0 | N77: 1 | O77: 0 | P77: 0 | Q77: 0 | R77: 0 | S77: 0 | T77: 0 | U77: 0 | V77: 0 | W77: =1-SUM(I77:V77) -> 0
I78: 0 | J78: 0 | K78: 0 | L78: 0 | M78: 0 | N78: 1 | O78: 0 | P78: 0 | Q78: 0 | R78: 0 | S78: 0 | T78: 0 | U78: 0 | V78: 0 | W78: =1-SUM(I78:V78) -> 0
I79: 0 | J79: 0 | K79: 0 | L79: 0 | M79: 0 | N79: 1 | O79: 0 | P79: 0 | Q79: 0 | R79: 0 | S79: 0 | T79: 0 | U79: 0 | V79: 0 | W79: =1-SUM(I79:V79) -> 0
I80: 0 | J80: 0 | K80: 0 | L80: 0 | M80: 0 | N80: 1 | O80: 0 | P80: 0 | Q80: 0 | R80: 0 | S80: 0 | T80: 0 | U80: 0 | V80: 0 | W80: =1-SUM(I80:V80) -> 0
I81: 0 | J81: 0 | K81: 0 | L81: 0 | M81: 0 | N81: 1 | O81: 0 | P81: 0 | Q81: 0 | R81: 0 | S81: 0 | T81: 0 | U81: 0 | V81: 0 | W81: =1-SUM(I81:V81) -> 0
I82: 0 | J82: 0 | K82: 0 | L82: 0 | M82: 0 | N82: 1 | O82: 0 | P82: 0 | Q82: 0 | R82: 0 | S82: 0 | T82: 0 | U82: 0 | V82: 0 | W82: =1-SUM(I82:V82) -> 0
I83: 0 | J83: 0 | K83: 0 | L83: 0 | M83: 0 | N83: 1 | O83: 0 | P83: 0 | Q83: 0 | R83: 0 | S83: 0 | T83: 0 | U83: 0 | V83: 0 | W83: =1-SUM(I83:V83) -> 0
I84: 0 | J84: 0 | K84: 0 | L84: 0 | M84: 0 | N84: 1 | O84: 0 | P84: 0 | Q84: 0 | R84: 0 | S84: 0 | T84: 0 | U84: 0 | V84: 0 | W84: =1-SUM(I84:V84) -> 0
I85: 0 | J85: 0 | K85: 0 | L85: 0 | M85: 0 | N85: 1 | O85: 0 | P85: 0 | Q85: 0 | R85: 0 | S85: 0 | T85: 0 | U85: 0 | V85: 0 | W85: =1-SUM(I85:V85) -> 0
I86: 0 | J86: 0 | K86: 0 | L86: 0 | M86: 0 | N86: 1 | O86: 0 | P86: 0 | Q86: 0 | R86: 0 | S86: 0 | T86: 0 | U86: 0 | V86: 0 | W86: =1-SUM(I86:V86) -> 0
I87: 0 | J87: 0 | K87: 0 | L87: 0 | M87: 0 | N87: 0 | O87: 0 | P87: 0 | Q87: 0 | R87: 0 | S87: 0 | T87: 1 | U87: 0 | V87: 0 | W87: =1-SUM(I87:V87) -> 0
I88: 0 | J88: 0 | K88: 0 | L88: 0 | M88: 0 | N88: 1 | O88: 0 | P88: 0 | Q88: 0 | R88: 0 | S88: 0 | T88: 0 | U88: 0 | V88: 0 | W88: =1-SUM(I88:V88) -> 0
I89: 0 | J89: 0 | K89: 0 | L89: 0 | M89: 0 | N89: 0 | O89: 0 | P89: 0 | Q89: 1 | R89: 0 | S89: 0 | T89: 0 | U89: 0 | V89: 0 | W89: =1-SUM(I89:V89) -> 0
I90: 0 | J90: 0 | K90: 0 | L90: 0 | M90: 0 | N90: 1 | O90: 0 | P90: 0 | Q90: 0 | R90: 0 | S90: 0 | T90: 0 | U90: 0 | V90: 0 | W90: =1-SUM(I90:V90) -> 0
I91: 0 | J91: 0 | K91: 0 | L91: 0 | M91: 0 | N91: 1 | O91: 0 | P91: 0 | Q91: 0 | R91: 0 | S91: 0 | T91: 0 | U91: 0 | V91: 0 | W91: =1-SUM(I91:V91) -> 0
I92: 0 | J92: 0 | K92: 0 | L92: 0 | M92: 0 | N92: 0 | O92: 0 | P92: 0 | Q92: 0 | R92: 0 | S92: 0 | T92: 1 | U92: 0 | V92: 0 | W92: =1-SUM(I92:V92) -> 0
I93: 0 | J93: 0 | K93: 0 | L93: 0 | M93: 0 | N93: 1 | O93: 0 | P93: 0 | Q93: 0 | R93: 0 | S93: 0 | T93: 0 | U93: 0 | V93: 0 | W93: =1-SUM(I93:V93) -> 0
I94: 0 | J94: 0 | K94: 0 | L94: 0 | M94: 0 | N94: 0 | O94: 1 | P94: 0 | Q94: 0 | R94: 0 | S94: 0 | T94: 0 | U94: 0 | V94: 0 | W94: =1-SUM(I94:V94) -> 0
I95: 0 | J95: 0 | K95: 0 | L95: 0 | M95: 0 | N95: 1 | O95: 0 | P95: 0 | Q95: 0 | R95: 0 | S95: 0 | T95: 0 | U95: 0 | V95: 0 | W95: =1-SUM(I95:V95) -> 0
I96: 0 | J96: 0 | K96: 0 | L96: 0 | M96: 0 | N96: 1 | O96: 0 | P96: 0 | Q96: 0 | R96: 0 | S96: 0 | T96: 0 | U96: 0 | V96: 0 | W96: =1-SUM(I96:V96) -> 0
I97: 0 | J97: 0 | K97: 0 | L97: 0 | M97: 0 | N97: 1 | O97: 0 | P97: 0 | Q97: 0 | R97: 0 | S97: 0 | T97: 0 | U97: 0 | V97: 0 | W97: =1-SUM(I97:V97) -> 0
I98: 0 | J98: 0 | K98: 0 | L98: 0 | M98: 0 | N98: 1 | O98: 0 | P98: 0 | Q98: 0 | R98: 0 | S98: 0 | T98: 0 | U98: 0 | V98: 0 | W98: =1-SUM(I98:V98) -> 0
I99: 0 | J99: 0 | K99: 0 | L99: 0 | M99: 0 | N99: 1 | O99: 0 | P99: 0 | Q99: 0 | R99: 0 | S99: 0 | T99: 0 | U99: 0 | V99: 0 | W99: =1-SUM(I99:V99) -> 0
I100: 0 | J100: 0 | K100: 0 | L100: 0 | M100: 0 | N100: 1 | O100: 0 | P100: 0 | Q100: 0 | R100: 0 | S100: 0 | T100: 0 | U100: 0 | V100: 0 | W100: =1-SUM(I100:V100) -> 0
I101: 0 | J101: 0 | K101: 0 | L101: 0 | M101: 0 | N101: 0 | O101: 1 | P101: 0 | Q101: 0 | R101: 0 | S101: 0 | T101: 0 | U101: 0 | V101: 0 | W101: =1-SUM(I101:V101) -> 0
I102: 0 | J102: 0 | K102: 0 | L102: 0 | M102: 1 | N102: 0 | O102: 0 | P102: 0 | Q102: 0 | R102: 0 | S102: 0 | T102: 0 | U102: 0 | V102: 0 | W102: =1-SUM(I102:V102) -> 0
I103: 0 | J103: 0 | K103: 0 | L103: 0 | M103: 0 | N103: 0 | O103: 0 | P103: 0 | Q103: 0 | R103: 0 | S103: 1 | T103: 0 | U103: 0 | V103: 0 | W103: =1-SUM(I103:V103) -> 0
I104: 0 | J104: 0 | K104: 0 | L104: 0 | M104: 0 | N104: 0 | O104: 1 | P104: 0 | Q104: 0 | R104: 0 | S104: 0 | T104: 0 | U104: 0 | V104: 0 | W104: =1-SUM(I104:V104) -> 0
I105: 0 | J105: 0 | K105: 0 | L105: 0 | M105: 0 | N105: 0 | O105: 1 | P105: 0 | Q105: 0 | R105: 0 | S105: 0 | T105: 0 | U105: 0 | V105: 0 | W105: =1-SUM(I105:V105) -> 0
I106: 0 | J106: 0 | K106: 0 | L106: 0 | M106: 0 | N106: 0 | O106: 1 | P106: 0 | Q106: 0 | R106: 0 | S106: 0 | T106: 0 | U106: 0 | V106: 0 | W106: =1-SUM(I106:V106) -> 0
I107: 0 | J107: 0 | K107: 0 | L107: 0 | M107: 0 | N107: 0 | O107: 1 | P107: 0 | Q107: 0 | R107: 0 | S107: 0 | T107: 0 | U107: 0 | V107: 0 | W107: =1-SUM(I107:V107) -> 0
I108: 0 | J108: 0 | K108: 0 | L108: 0 | M108: 0 | N108: 0 | O108: 1 | P108: 0 | Q108: 0 | R108: 0 | S108: 0 | T108: 0 | U108: 0 | V108: 0 | W108: =1-SUM(I108:V108) -> 0
I109: 0 | J109: 0 | K109: 0 | L109: 1 | M109: 0 | N109: 0 | O109: 0 | P109: 0 | Q109: 0 | R109: 0 | S109: 0 | T109: 0 | U109: 0 | V109: 0 | W109: =1-SUM(I109:V109) -> 0
I110: 0 | J110: 0 | K110: 0 | L110: 0 | M110: 1 | N110: 0 | O110: 0 | P110: 0 | Q110: 0 | R110: 0 | S110: 0 | T110: 0 | U110: 0 | V110: 0 | W110: =1-SUM(I110:V110) -> 0
I111: 0 | J111: 0 | K111: 0 | L111: 0 | M111: 0 | N111: 1 | O111: 0 | P111: 0 | Q111: 0 | R111: 0 | S111: 0 | T111: 0 | U111: 0 | V111: 0 | W111: =1-SUM(I111:V111) -> 0
I112: 0 | J112: 0 | K112: 0 | L112: 0 | M112: 1 | N112: 0 | O112: 0 | P112: 0 | Q112: 0 | R112: 0 | S112: 0 | T112: 0 | U112: 0 | V112: 0 | W112: =1-SUM(I112:V112) -> 0
I113: 0 | J113: 0 | K113: 0 | L113: 0 | M113: 1 | N113: 0 | O113: 0 | P113: 0 | Q113: 0 | R113: 0 | S113: 0 | T113: 0 | U113: 0 | V113: 0 | W113: =1-SUM(I113:V113) -> 0
I114: 0 | J114: 0 | K114: 0 | L114: 0 | M114: 0 | N114: 1 | O114: 0 | P114: 0 | Q114: 0 | R114: 0 | S114: 0 | T114: 0 | U114: 0 | V114: 0 | W114: =1-SUM(I114:V114) -> 0
I115: 0 | J115: 0 | K115: 0 | L115: 0 | M115: 0 | N115: 0 | O115: 1 | P115: 0 | Q115: 0 | R115: 0 | S115: 0 | T115: 0 | U115: 0 | V115: 0 | W115: =1-SUM(I115:V115) -> 0
I116: 0 | J116: 0 | K116: 0 | L116: 0 | M116: 0 | N116: 0 | O116: 1 | P116: 0 | Q116: 0 | R116: 0 | S116: 0 | T116: 0 | U116: 0 | V116: 0 | W116: =1-SUM(I116:V116) -> 0
I117: 0 | J117: 0 | K117: 0 | L117: 0 | M117: 0 | N117: 0 | O117: 1 | P117: 0 | Q117: 0 | R117: 0 | S117: 0 | T117: 0 | U117: 0 | V117: 0 | W117: =1-SUM(I117:V117) -> 0
I118: 0 | J118: 0 | K118: 0 | L118: 0 | M118: 0 | N118: 0 | O118: 0 | P118: 0 | Q118: 0 | R118: 0 | S118: 1 | T118: 0 | U118: 0 | V118: 0 | W118: =1-SUM(I118:V118) -> 0
I119: 0 | J119: 0 | K119: 0 | L119: 0 | M119: 0 | N119: 0 | O119: 1 | P119: 0 | Q119: 0 | R119: 0 | S119: 0 | T119: 0 | U119: 0 | V119: 0 | W119: =1-SUM(I119:V119) -> 0
I120: 0 | J120: 0 | K120: 0 | L120: 0 | M120: 0 | N120: 0 | O120: 0 | P120: 0 | Q120: 0 | R120: 0 | S120: 0 | T120: 0 | U120: 0 | V120: 1 | W120: =1-SUM(I120:V120) -> 0
I121: 0 | J121: 0 | K121: 0 | L121: 0 | M121: 0 | N121: 0 | O121: 1 | P121: 0 | Q121: 0 | R121: 0 | S121: 0 | T121: 0 | U121: 0 | V121: 0 | W121: =1-SUM(I121:V121) -> 0
I122: 0 | J122: 0 | K122: 0 | L122: 0 | M122: 0 | N122: 1 | O122: 0 | P122: 0 | Q122: 0 | R122: 0 | S122: 0 | T122: 0 | U122: 0 | V122: 0 | W122: =1-SUM(I122:V122) -> 0
I123: 0 | J123: 0 | K123: 0 | L123: 0 | M123: 0 | N123: 1 | O123: 0 | P123: 0 | Q123: 0 | R123: 0 | S123: 0 | T123: 0 | U123: 0 | V123: 0 | W123: =1-SUM(I123:V123) -> 0
I124: 0 | J124: 0 | K124: 0 | L124: 0 | M124: 0 | N124: 1 | O124: 0 | P124: 0 | Q124: 0 | R124: 0 | S124: 0 | T124: 0 | U124: 0 | V124: 0 | W124: =1-SUM(I124:V124) -> 0
I125: 0 | J125: 0 | K125: 0 | L125: 0 | M125: 0 | N125: 0 | O125: 1 | P125: 0 | Q125: 0 | R125: 0 | S125: 0 | T125: 0 | U125: 0 | V125: 0 | W125: =1-SUM(I125:V125) -> 0
I126: 0 | J126: 0 | K126: 1 | L126: 0 | M126: 0 | N126: 0 | O126: 0 | P126: 0 | Q126: 0 | R126: 0 | S126: 0 | T126: 0 | U126: 0 | V126: 0 | W126: =1-SUM(I126:V126) -> 0
I127: 0 | J127: 0 | K127: 1 | L127: 0 | M127: 0 | N127: 0 | O127: 0 | P127: 0 | Q127: 0 | R127: 0 | S127: 0 | T127: 0 | U127: 0 | V127: 0 | W127: =1-SUM(I127:V127) -> 0
I128: 0 | J128: 0 | K128: 1 | L128: 0 | M128: 0 | N128: 0 | O128: 0 | P128: 0 | Q128: 0 | R128: 0 | S128: 0 | T128: 0 | U128: 0 | V128: 0 | W128: =1-SUM(I128:V128) -> 0
I129: 0 | J129: 0 | K129: 0 | L129: 0 | M129: 0 | N129: 1 | O129: 0 | P129: 0 | Q129: 0 | R129: 0 | S129: 0 | T129: 0 | U129: 0 | V129: 0 | W129: =1-SUM(I129:V129) -> 0
I130: 0 | J130: 0 | K130: 0 | L130: 0 | M130: 0 | N130: 0 | O130: 1 | P130: 0 | Q130: 0 | R130: 0 | S130: 0 | T130: 0 | U130: 0 | V130: 0 | W130: =1-SUM(I130:V130) -> 0
I131: 0 | J131: 0 | K131: 0 | L131: 0 | M131: 0 | N131: 0 | O131: 1 | P131: 0 | Q131: 0 | R131: 0 | S131: 0 | T131: 0 | U131: 0 | V131: 0 | W131: =1-SUM(I131:V131) -> 0
I132: 0 | J132: 0 | K132: 0 | L132: 0 | M132: 0 | N132: 1 | O132: 0 | P132: 0 | Q132: 0 | R132: 0 | S132: 0 | T132: 0 | U132: 0 | V132: 0 | W132: =1-SUM(I132:V132) -> 0
I133: 0 | J133: 0 | K133: 0 | L133: 0 | M133: 0 | N133: 1 | O133: 0 | P133: 0 | Q133: 0 | R133: 0 | S133: 0 | T133: 0 | U133: 0 | V133: 0 | W133: =1-SUM(I133:V133) -> 0
I134: 0 | J134: 0 | K134: 0 | L134: 0 | M134: 0 | N134: 0 | O134: 1 | P134: 0 | Q134: 0 | R134: 0 | S134: 0 | T134: 0 | U134: 0 | V134: 0 | W134: =1-SUM(I134:V134) -> 0
I135: 0 | J135: 0 | K135: 0 | L135: 0 | M135: 0 | N135: 0 | O135: 1 | P135: 0 | Q135: 0 | R135: 0 | S135: 0 | T135: 0 | U135: 0 | V135: 0 | W135: =1-SUM(I135:V135) -> 0
I136: 0 | J136: 0 | K136: 0 | L136: 0 | M136: 0 | N136: 0 | O136: 1 | P136: 0 | Q136: 0 | R136: 0 | S136: 0 | T136: 0 | U136: 0 | V136: 0 | W136: =1-SUM(I136:V136) -> 0
I137: 0 | J137: 0 | K137: 0 | L137: 0 | M137: 0 | N137: 1 | O137: 0 | P137: 0 | Q137: 0 | R137: 0 | S137: 0 | T137: 0 | U137: 0 | V137: 0 | W137: =1-SUM(I137:V137) -> 0
I138: 0 | J138: 0 | K138: 1 | L138: 0 | M138: 0 | N138: 0 | O138: 0 | P138: 0 | Q138: 0 | R138: 0 | S138: 0 | T138: 0 | U138: 0 | V138: 0 | W138: =1-SUM(I138:V138) -> 0
I139: 0 | J139: 0 | K139: 1 | L139: 0 | M139: 0 | N139: 0 | O139: 0 | P139: 0 | Q139: 0 | R139: 0 | S139: 0 | T139: 0 | U139: 0 | V139: 0 | W139: =1-SUM(I139:V139) -> 0
I140: 0 | J140: 0 | K140: 0 | L140: 1 | M140: 0 | N140: 0 | O140: 0 | P140: 0 | Q140: 0 | R140: 0 | S140: 0 | T140: 0 | U140: 0 | V140: 0 | W140: =1-SUM(I140:V140) -> 0
I141: 0 | J141: 0 | K141: 0 | L141: 1 | M141: 0 | N141: 0 | O141: 0 | P141: 0 | Q141: 0 | R141: 0 | S141: 0 | T141: 0 | U141: 0 | V141: 0 | W141: =1-SUM(I141:V141) -> 0
I142: 0 | J142: 0 | K142: 0 | L142: 1 | M142: 0 | N142: 0 | O142: 0 | P142: 0 | Q142: 0 | R142: 0 | S142: 0 | T142: 0 | U142: 0 | V142: 0 | W142: =1-SUM(I142:V142) -> 0
I143: 0 | J143: 0 | K143: 0 | L143: 1 | M143: 0 | N143: 0 | O143: 0 | P143: 0 | Q143: 0 | R143: 0 | S143: 0 | T143: 0 | U143: 0 | V143: 0 | W143: =1-SUM(I143:V143) -> 0
I144: 0 | J144: 0 | K144: 0 | L144: 0 | M144: 0 | N144: 0 | O144: 0 | P144: 1 | Q144: 0 | R144: 0 | S144: 0 | T144: 0 | U144: 0 | V144: 0 | W144: =1-SUM(I144:V144) -> 0
I145: 0 | J145: 0 | K145: 0 | L145: 0 | M145: 0 | N145: 0 | O145: 0 | P145: 1 | Q145: 0 | R145: 0 | S145: 0 | T145: 0 | U145: 0 | V145: 0 | W145: =1-SUM(I145:V145) -> 0
I146: 0 | J146: 0 | K146: 0 | L146: 0 | M146: 0 | N146: 0 | O146: 0 | P146: 1 | Q146: 0 | R146: 0 | S146: 0 | T146: 0 | U146: 0 | V146: 0 | W146: =1-SUM(I146:V146) -> 0
I147: 0 | J147: 0 | K147: 0 | L147: 0 | M147: 0 | N147: 0 | O147: 0 | P147: 1 | Q147: 0 | R147: 0 | S147: 0 | T147: 0 | U147: 0 | V147: 0 | W147: =1-SUM(I147:V147) -> 0
I148: 0 | J148: 0 | K148: 0 | L148: 0 | M148: 0 | N148: 0 | O148: 1 | P148: 0 | Q148: 0 | R148: 0 | S148: 0 | T148: 0 | U148: 0 | V148: 0 | W148: =1-SUM(I148:V148) -> 0
I149: 0 | J149: 1 | K149: 0 | L149: 0 | M149: 0 | N149: 0 | O149: 0 | P149: 0 | Q149: 0 | R149: 0 | S149: 0 | T149: 0 | U149: 0 | V149: 0 | W149: =1-SUM(I149:V149) -> 0
I150: 0 | J150: 1 | K150: 0 | L150: 0 | M150: 0 | N150: 0 | O150: 0 | P150: 0 | Q150: 0 | R150: 0 | S150: 0 | T150: 0 | U150: 0 | V150: 0 | W150: =1-SUM(I150:V150) -> 0
I151: 0 | J151: 0 | K151: 0 | L151: 0 | M151: 0 | N151: 0 | O151: 0 | P151: 1 | Q151: 0 | R151: 0 | S151: 0 | T151: 0 | U151: 0 | V151: 0 | W151: =1-SUM(I151:V151) -> 0
I152: 0 | J152: 0 | K152: 0 | L152: 0 | M152: 0 | N152: 1 | O152: 0 | P152: 0 | Q152: 0 | R152: 0 | S152: 0 | T152: 0 | U152: 0 | V152: 0 | W152: =1-SUM(I152:V152) -> 0
I153: 0 | J153: 0 | K153: 0 | L153: 0 | M153: 0 | N153: 1 | O153: 0 | P153: 0 | Q153: 0 | R153: 0 | S153: 0 | T153: 0 | U153: 0 | V153: 0 | W153: =1-SUM(I153:V153) -> 0
I154: 0 | J154: 0 | K154: 0 | L154: 0 | M154: 0 | N154: 1 | O154: 0 | P154: 0 | Q154: 0 | R154: 0 | S154: 0 | T154: 0 | U154: 0 | V154: 0 | W154: =1-SUM(I154:V154) -> 0
I155: 0 | J155: 0 | K155: 0 | L155: 0 | M155: 0 | N155: 1 | O155: 0 | P155: 0 | Q155: 0 | R155: 0 | S155: 0 | T155: 0 | U155: 0 | V155: 0 | W155: =1-SUM(I155:V155) -> 0
I156: 0 | J156: 0 | K156: 0 | L156: 0 | M156: 0 | N156: 1 | O156: 0 | P156: 0 | Q156: 0 | R156: 0 | S156: 0 | T156: 0 | U156: 0 | V156: 0 | W156: =1-SUM(I156:V156) -> 0
I157: 0 | J157: 0 | K157: 0 | L157: 0 | M157: 0 | N157: 1 | O157: 0 | P157: 0 | Q157: 0 | R157: 0 | S157: 0 | T157: 0 | U157: 0 | V157: 0 | W157: =1-SUM(I157:V157) -> 0
I158: 0 | J158: 0 | K158: 0 | L158: 0 | M158: 0 | N158: 1 | O158: 0 | P158: 0 | Q158: 0 | R158: 0 | S158: 0 | T158: 0 | U158: 0 | V158: 0 | W158: =1-SUM(I158:V158) -> 0
I159: 0 | J159: 0 | K159: 0 | L159: 1 | M159: 0 | N159: 0 | O159: 0 | P159: 0 | Q159: 0 | R159: 0 | S159: 0 | T159: 0 | U159: 0 | V159: 0 | W159: =1-SUM(I159:V159) -> 0
I160: 0 | J160: 0 | K160: 0 | L160: 0 | M160: 0 | N160: 1 | O160: 0 | P160: 0 | Q160: 0 | R160: 0 | S160: 0 | T160: 0 | U160: 0 | V160: 0 | W160: =1-SUM(I160:V160) -> 0
I161: 0 | J161: 0 | K161: 0 | L161: 0 | M161: 0 | N161: 1 | O161: 0 | P161: 0 | Q161: 0 | R161: 0 | S161: 0 | T161: 0 | U161: 0 | V161: 0 | W161: =1-SUM(I161:V161) -> 0
I162: 0 | J162: 0 | K162: 0 | L162: 0 | M162: 0 | N162: 1 | O162: 0 | P162: 0 | Q162: 0 | R162: 0 | S162: 0 | T162: 0 | U162: 0 | V162: 0 | W162: =1-SUM(I162:V162) -> 0
I163: 0 | J163: 0 | K163: 0 | L163: 0 | M163: 0 | N163: 1 | O163: 0 | P163: 0 | Q163: 0 | R163: 0 | S163: 0 | T163: 0 | U163: 0 | V163: 0 | W163: =1-SUM(I163:V163) -> 0
I164: 0 | J164: 0 | K164: 0 | L164: 0 | M164: 0 | N164: 1 | O164: 0 | P164: 0 | Q164: 0 | R164: 0 | S164: 0 | T164: 0 | U164: 0 | V164: 0 | W164: =1-SUM(I164:V164) -> 0
I165: 0 | J165: 0 | K165: 0 | L165: 0 | M165: 0 | N165: 0 | O165: 0 | P165: 0 | Q165: 0 | R165: 0 | S165: 0 | T165: 1 | U165: 0 | V165: 0 | W165: =1-SUM(I165:V165) -> 0
I166: 0 | J166: 0 | K166: 0 | L166: 0 | M166: 0 | N166: 0 | O166: 1 | P166: 0 | Q166: 0 | R166: 0 | S166: 0 | T166: 0 | U166: 0 | V166: 0 | W166: =1-SUM(I166:V166) -> 0
I167: 0 | J167: 0 | K167: 0 | L167: 0 | M167: 0 | N167: 0 | O167: 1 | P167: 0 | Q167: 0 | R167: 0 | S167: 0 | T167: 0 | U167: 0 | V167: 0 | W167: =1-SUM(I167:V167) -> 0
I168: 0 | J168: 0 | K168: 0 | L168: 0 | M168: 0 | N168: 1 | O168: 0 | P168: 0 | Q168: 0 | R168: 0 | S168: 0 | T168: 0 | U168: 0 | V168: 0 | W168: =1-SUM(I168:V168) -> 0
I169: 0 | J169: 0 | K169: 0 | L169: 0 | M169: 0 | N169: 1 | O169: 0 | P169: 0 | Q169: 0 | R169: 0 | S169: 0 | T169: 0 | U169: 0 | V169: 0 | W169: =1-SUM(I169:V169) -> 0
I170: 0 | J170: 0 | K170: 0 | L170: 0 | M170: 0 | N170: 0 | O170: 0 | P170: 0 | Q170: 0 | R170: 0 | S170: 1 | T170: 0 | U170: 0 | V170: 0 | W170: =1-SUM(I170:V170) -> 0
I171: 0 | J171: 0 | K171: 0 | L171: 0 | M171: 0 | N171: 0 | O171: 1 | P171: 0 | Q171: 0 | R171: 0 | S171: 0 | T171: 0 | U171: 0 | V171: 0 | W171: =1-SUM(I171:V171) -> 0
I172: 0 | J172: 0 | K172: 0 | L172: 0 | M172: 0 | N172: 0 | O172: 1 | P172: 0 | Q172: 0 | R172: 0 | S172: 0 | T172: 0 | U172: 0 | V172: 0 | W172: =1-SUM(I172:V172) -> 0
I173: 0 | J173: 0 | K173: 0 | L173: 1 | M173: 0 | N173: 0 | O173: 0 | P173: 0 | Q173: 0 | R173: 0 | S173: 0 | T173: 0 | U173: 0 | V173: 0 | W173: =1-SUM(I173:V173) -> 0
I174: 0 | J174: 0 | K174: 0 | L174: 1 | M174: 0 | N174: 0 | O174: 0 | P174: 0 | Q174: 0 | R174: 0 | S174: 0 | T174: 0 | U174: 0 | V174: 0 | W174: =1-SUM(I174:V174) -> 0
I175: 0 | J175: 0 | K175: 0 | L175: 1 | M175: 0 | N175: 0 | O175: 0 | P175: 0 | Q175: 0 | R175: 0 | S175: 0 | T175: 0 | U175: 0 | V175: 0 | W175: =1-SUM(I175:V175) -> 0
I176: 0 | J176: 0 | K176: 0 | L176: 0 | M176: 0 | N176: 0 | O176: 1 | P176: 0 | Q176: 0 | R176: 0 | S176: 0 | T176: 0 | U176: 0 | V176: 0 | W176: =1-SUM(I176:V176) -> 0
I177: 0 | J177: 0 | K177: 0 | L177: 1 | M177: 0 | N177: 0 | O177: 0 | P177: 0 | Q177: 0 | R177: 0 | S177: 0 | T177: 0 | U177: 0 | V177: 0 | W177: =1-SUM(I177:V177) -> 0
I178: 0 | J178: 0 | K178: 0 | L178: 0 | M178: 0 | N178: 0 | O178: 1 | P178: 0 | Q178: 0 | R178: 0 | S178: 0 | T178: 0 | U178: 0 | V178: 0 | W178: =1-SUM(I178:V178) -> 0
I179: 0 | J179: 0 | K179: 0 | L179: 0 | M179: 0 | N179: 0 | O179: 1 | P179: 0 | Q179: 0 | R179: 0 | S179: 0 | T179: 0 | U179: 0 | V179: 0 | W179: =1-SUM(I179:V179) -> 0
I180: 0 | J180: 0 | K180: 0 | L180: 0 | M180: 0 | N180: 0 | O180: 1 | P180: 0 | Q180: 0 | R180: 0 | S180: 0 | T180: 0 | U180: 0 | V180: 0 | W180: =1-SUM(I180:V180) -> 0
I181: 0 | J181: 0 | K181: 0 | L181: 1 | M181: 0 | N181: 0 | O181: 0 | P181: 0 | Q181: 0 | R181: 0 | S181: 0 | T181: 0 | U181: 0 | V181: 0 | W181: =1-SUM(I181:V181) -> 0
I182: 0 | J182: 0 | K182: 0 | L182: 0 | M182: 0 | N182: 0 | O182: 1 | P182: 0 | Q182: 0 | R182: 0 | S182: 0 | T182: 0 | U182: 0 | V182: 0 | W182: =1-SUM(I182:V182) -> 0
I183: 0 | J183: 0 | K183: 0 | L183: 1 | M183: 0 | N183: 0 | O183: 0 | P183: 0 | Q183: 0 | R183: 0 | S183: 0 | T183: 0 | U183: 0 | V183: 0 | W183: =1-SUM(I183:V183) -> 0
I184: 0 | J184: 0 | K184: 0 | L184: 0 | M184: 0 | N184: 0 | O184: 1 | P184: 0 | Q184: 0 | R184: 0 | S184: 0 | T184: 0 | U184: 0 | V184: 0 | W184: =1-SUM(I184:V184) -> 0
I185: 0 | J185: 0 | K185: 0 | L185: 0 | M185: 0 | N185: 0 | O185: 1 | P185: 0 | Q185: 0 | R185: 0 | S185: 0 | T185: 0 | U185: 0 | V185: 0 | W185: =1-SUM(I185:V185) -> 0
I186: 0 | J186: 0 | K186: 0 | L186: 1 | M186: 0 | N186: 0 | O186: 0 | P186: 0 | Q186: 0 | R186: 0 | S186: 0 | T186: 0 | U186: 0 | V186: 0 | W186: =1-SUM(I186:V186) -> 0
I187: 0 | J187: 0 | K187: 0 | L187: 0 | M187: 0 | N187: 0 | O187: 1 | P187: 0 | Q187: 0 | R187: 0 | S187: 0 | T187: 0 | U187: 0 | V187: 0 | W187: =1-SUM(I187:V187) -> 0
I188: 0 | J188: 0 | K188: 0 | L188: 0 | M188: 0 | N188: 0 | O188: 1 | P188: 0 | Q188: 0 | R188: 0 | S188: 0 | T188: 0 | U188: 0 | V188: 0 | W188: =1-SUM(I188:V188) -> 0
I189: 0 | J189: 0 | K189: 0 | L189: 0 | M189: 0 | N189: 0 | O189: 1 | P189: 0 | Q189: 0 | R189: 0 | S189: 0 | T189: 0 | U189: 0 | V189: 0 | W189: =1-SUM(I189:V189) -> 0
I190: 0 | J190: 0 | K190: 0 | L190: 0 | M190: 0 | N190: 0 | O190: 1 | P190: 0 | Q190: 0 | R190: 0 | S190: 0 | T190: 0 | U190: 0 | V190: 0 | W190: =1-SUM(I190:V190) -> 0
I191: 0 | J191: 0 | K191: 0 | L191: 0 | M191: 0 | N191: 0 | O191: 1 | P191: 0 | Q191: 0 | R191: 0 | S191: 0 | T191: 0 | U191: 0 | V191: 0 | W191: =1-SUM(I191:V191) -> 0
I192: 0 | J192: 0 | K192: 0 | L192: 0 | M192: 0 | N192: 0 | O192: 1 | P192: 0 | Q192: 0 | R192: 0 | S192: 0 | T192: 0 | U192: 0 | V192: 0 | W192: =1-SUM(I192:V192) -> 0
I193: 0 | J193: 0 | K193: 0 | L193: 0 | M193: 0 | N193: 0 | O193: 1 | P193: 0 | Q193: 0 | R193: 0 | S193: 0 | T193: 0 | U193: 0 | V193: 0 | W193: =1-SUM(I193:V193) -> 0
I194: 0 | J194: 0 | K194: 0 | L194: 0 | M194: 0 | N194: 0 | O194: 1 | P194: 0 | Q194: 0 | R194: 0 | S194: 0 | T194: 0 | U194: 0 | V194: 0 | W194: =1-SUM(I194:V194) -> 0
I195: 0 | J195: 0 | K195: 0 | L195: 0 | M195: 0 | N195: 0 | O195: 1 | P195: 0 | Q195: 0 | R195: 0 | S195: 0 | T195: 0 | U195: 0 | V195: 0 | W195: =1-SUM(I195:V195) -> 0
I196: 0 | J196: 0 | K196: 0 | L196: 0 | M196: 0 | N196: 0 | O196: 1 | P196: 0 | Q196: 0 | R196: 0 | S196: 0 | T196: 0 | U196: 0 | V196: 0 | W196: =1-SUM(I196:V196) -> 0
I197: 0 | J197: 0 | K197: 0 | L197: 0 | M197: 0 | N197: 0 | O197: 1 | P197: 0 | Q197: 0 | R197: 0 | S197: 0 | T197: 0 | U197: 0 | V197: 0 | W197: =1-SUM(I197:V197) -> 0
I198: 0 | J198: 0 | K198: 0 | L198: 0 | M198: 0 | N198: 0 | O198: 1 | P198: 0 | Q198: 0 | R198: 0 | S198: 0 | T198: 0 | U198: 0 | V198: 0 | W198: =1-SUM(I198:V198) -> 0
I199: 0 | J199: 0 | K199: 0 | L199: 0 | M199: 0 | N199: 0 | O199: 1 | P199: 0 | Q199: 0 | R199: 0 | S199: 0 | T199: 0 | U199: 0 | V199: 0 | W199: =1-SUM(I199:V199) -> 0
I200: 0 | J200: 0 | K200: 0 | L200: 0 | M200: 0 | N200: 0 | O200: 1 | P200: 0 | Q200: 0 | R200: 0 | S200: 0 | T200: 0 | U200: 0 | V200: 0 | W200: =1-SUM(I200:V200) -> 0
I201: 0 | J201: 0 | K201: 0 | L201: 0 | M201: 0 | N201: 0 | O201: 1 | P201: 0 | Q201: 0 | R201: 0 | S201: 0 | T201: 0 | U201: 0 | V201: 0 | W201: =1-SUM(I201:V201) -> 0
I202: 0 | J202: 0 | K202: 0 | L202: 0 | M202: 0 | N202: 0 | O202: 1 | P202: 0 | Q202: 0 | R202: 0 | S202: 0 | T202: 0 | U202: 0 | V202: 0 | W202: =1-SUM(I202:V202) -> 0
I203: 0 | J203: 0 | K203: 0 | L203: 0 | M203: 0 | N203: 1 | O203: 0 | P203: 0 | Q203: 0 | R203: 0 | S203: 0 | T203: 0 | U203: 0 | V203: 0 | W203: =1-SUM(I203:V203) -> 0
I204: 0 | J204: 0 | K204: 0 | L204: 0 | M204: 0 | N204: 0 | O204: 1 | P204: 0 | Q204: 0 | R204: 0 | S204: 0 | T204: 0 | U204: 0 | V204: 0 | W204: =1-SUM(I204:V204) -> 0
I205: 0 | J205: 0 | K205: 0 | L205: 0 | M205: 0 | N205: 0 | O205: 1 | P205: 0 | Q205: 0 | R205: 0 | S205: 0 | T205: 0 | U205: 0 | V205: 0 | W205: =1-SUM(I205:V205) -> 0
I206: 0 | J206: 0 | K206: 0 | L206: 0 | M206: 0 | N206: 0 | O206: 1 | P206: 0 | Q206: 0 | R206: 0 | S206: 0 | T206: 0 | U206: 0 | V206: 0 | W206: =1-SUM(I206:V206) -> 0
I207: 0 | J207: 0 | K207: 0 | L207: 0 | M207: 0 | N207: 1 | O207: 0 | P207: 0 | Q207: 0 | R207: 0 | S207: 0 | T207: 0 | U207: 0 | V207: 0 | W207: =1-SUM(I207:V207) -> 0
I208: 0 | J208: 0 | K208: 0 | L208: 0 | M208: 0 | N208: 0 | O208: 1 | P208: 0 | Q208: 0 | R208: 0 | S208: 0 | T208: 0 | U208: 0 | V208: 0 | W208: =1-SUM(I208:V208) -> 0
I209: 0 | J209: 0 | K209: 0 | L209: 0 | M209: 0 | N209: 0 | O209: 0 | P209: 0 | Q209: 0 | R209: 0 | S209: 1 | T209: 0 | U209: 0 | V209: 0 | W209: =1-SUM(I209:V209) -> 0
I210: 0 | J210: 0 | K210: 0 | L210: 1 | M210: 0 | N210: 0 | O210: 0 | P210: 0 | Q210: 0 | R210: 0 | S210: 0 | T210: 0 | U210: 0 | V210: 0 | W210: =1-SUM(I210:V210) -> 0
I211: 0 | J211: 0 | K211: 0 | L211: 0 | M211: 0 | N211: 1 | O211: 0 | P211: 0 | Q211: 0 | R211: 0 | S211: 0 | T211: 0 | U211: 0 | V211: 0 | W211: =1-SUM(I211:V211) -> 0
I212: 0 | J212: 0 | K212: 0 | L212: 0 | M212: 0 | N212: 1 | O212: 0 | P212: 0 | Q212: 0 | R212: 0 | S212: 0 | T212: 0 | U212: 0 | V212: 0 | W212: =1-SUM(I212:V212) -> 0
I213: 0 | J213: 0 | K213: 0 | L213: 1 | M213: 0 | N213: 0 | O213: 0 | P213: 0 | Q213: 0 | R213: 0 | S213: 0 | T213: 0 | U213: 0 | V213: 0 | W213: =1-SUM(I213:V213) -> 0
I214: 0 | J214: 0 | K214: 0 | L214: 0 | M214: 0 | N214: 0 | O214: 1 | P214: 0 | Q214: 0 | R214: 0 | S214: 0 | T214: 0 | U214: 0 | V214: 0 | W214: =1-SUM(I214:V214) -> 0
I215: 0 | J215: 0 | K215: 0 | L215: 0 | M215: 0 | N215: 1 | O215: 0 | P215: 0 | Q215: 0 | R215: 0 | S215: 0 | T215: 0 | U215: 0 | V215: 0 | W215: =1-SUM(I215:V215) -> 0
I216: 0 | J216: 0 | K216: 0 | L216: 1 | M216: 0 | N216: 0 | O216: 0 | P216: 0 | Q216: 0 | R216: 0 | S216: 0 | T216: 0 | U216: 0 | V216: 0 | W216: =1-SUM(I216:V216) -> 0
I217: 0 | J217: 0 | K217: 0 | L217: 0 | M217: 0 | N217: 1 | O217: 0 | P217: 0 | Q217: 0 | R217: 0 | S217: 0 | T217: 0 | U217: 0 | V217: 0 | W217: =1-SUM(I217:V217) -> 0
I218: 0 | J218: 0 | K218: 0 | L218: 1 | M218: 0 | N218: 0 | O218: 0 | P218: 0 | Q218: 0 | R218: 0 | S218: 0 | T218: 0 | U218: 0 | V218: 0 | W218: =1-SUM(I218:V218) -> 0
I219: 0 | J219: 0 | K219: 0 | L219: 1 | M219: 0 | N219: 0 | O219: 0 | P219: 0 | Q219: 0 | R219: 0 | S219: 0 | T219: 0 | U219: 0 | V219: 0 | W219: =1-SUM(I219:V219) -> 0
I220: 0 | J220: 0 | K220: 0 | L220: 0 | M220: 0 | N220: 0 | O220: 1 | P220: 0 | Q220: 0 | R220: 0 | S220: 0 | T220: 0 | U220: 0 | V220: 0 | W220: =1-SUM(I220:V220) -> 0
I221: 0 | J221: 0 | K221: 0 | L221: 0 | M221: 0 | N221: 0 | O221: 1 | P221: 0 | Q221: 0 | R221: 0 | S221: 0 | T221: 0 | U221: 0 | V221: 0 | W221: =1-SUM(I221:V221) -> 0
I222: 0 | J222: 0 | K222: 0 | L222: 0 | M222: 0 | N222: 1 | O222: 0 | P222: 0 | Q222: 0 | R222: 0 | S222: 0 | T222: 0 | U222: 0 | V222: 0 | W222: =1-SUM(I222:V222) -> 0
I223: 0 | J223: 0 | K223: 0 | L223: 0 | M223: 0 | N223: 0 | O223: 0 | P223: 0 | Q223: 0 | R223: 0 | S223: 0 | T223: 0 | U223: 0 | V223: 1 | W223: =1-SUM(I223:V223) -> 0
I224: 0 | J224: 0 | K224: 0 | L224: 0 | M224: 0 | N224: 0 | O224: 0 | P224: 0 | Q224: 0 | R224: 0 | S224: 0 | T224: 0 | U224: 0 | V224: 1 | W224: =1-SUM(I224:V224) -> 0
I225: 0 | J225: 0 | K225: 0 | L225: 0 | M225: 0 | N225: 1 | O225: 0 | P225: 0 | Q225: 0 | R225: 0 | S225: 0 | T225: 0 | U225: 0 | V225: 0 | W225: =1-SUM(I225:V225) -> 0
I226: 0 | J226: 0 | K226: 0 | L226: 0 | M226: 0 | N226: 0 | O226: 1 | P226: 0 | Q226: 0 | R226: 0 | S226: 0 | T226: 0 | U226: 0 | V226: 0 | W226: =1-SUM(I226:V226) -> 0
I227: 0 | J227: 0 | K227: 0 | L227: 0 | M227: 0 | N227: 0 | O227: 0 | P227: 1 | Q227: 0 | R227: 0 | S227: 0 | T227: 0 | U227: 0 | V227: 0 | W227: =1-SUM(I227:V227) -> 0
I228: 0 | J228: 0 | K228: 0 | L228: 0 | M228: 0 | N228: 0 | O228: 0 | P228: 1 | Q228: 0 | R228: 0 | S228: 0 | T228: 0 | U228: 0 | V228: 0 | W228: =1-SUM(I228:V228) -> 0
I229: 0 | J229: 0 | K229: 0 | L229: 0 | M229: 0 | N229: 0 | O229: 1 | P229: 0 | Q229: 0 | R229: 0 | S229: 0 | T229: 0 | U229: 0 | V229: 0 | W229: =1-SUM(I229:V229) -> 0
I230: 0 | J230: 0 | K230: 0 | L230: 0 | M230: 0 | N230: 0 | O230: 1 | P230: 0 | Q230: 0 | R230: 0 | S230: 0 | T230: 0 | U230: 0 | V230: 0 | W230: =1-SUM(I230:V230) -> 0
I231: 0 | J231: 0 | K231: 0 | L231: 0 | M231: 0 | N231: 0 | O231: 1 | P231: 0 | Q231: 0 | R231: 0 | S231: 0 | T231: 0 | U231: 0 | V231: 0 | W231: =1-SUM(I231:V231) -> 0
I232: 0 | J232: 0 | K232: 0 | L232: 0 | M232: 0 | N232: 0 | O232: 1 | P232: 0 | Q232: 0 | R232: 0 | S232: 0 | T232: 0 | U232: 0 | V232: 0 | W232: =1-SUM(I232:V232) -> 0
I233: 0 | J233: 0 | K233: 0 | L233: 0 | M233: 0 | N233: 0 | O233: 1 | P233: 0 | Q233: 0 | R233: 0 | S233: 0 | T233: 0 | U233: 0 | V233: 0 | W233: =1-SUM(I233:V233) -> 0
I234: 0 | J234: 0 | K234: 0 | L234: 0 | M234: 0 | N234: 0 | O234: 1 | P234: 0 | Q234: 0 | R234: 0 | S234: 0 | T234: 0 | U234: 0 | V234: 0 | W234: =1-SUM(I234:V234) -> 0
I235: 0 | J235: 0 | K235: 0 | L235: 0 | M235: 0 | N235: 0 | O235: 0 | P235: 0 | Q235: 0 | R235: 0 | S235: 0 | T235: 0 | U235: 0 | V235: 1 | W235: =1-SUM(I235:V235) -> 0
I236: 0 | J236: 0 | K236: 0 | L236: 0 | M236: 0 | N236: 0 | O236: 0 | P236: 0 | Q236: 0 | R236: 0 | S236: 1 | T236: 0 | U236: 0 | V236: 0 | W236: =1-SUM(I236:V236) -> 0
I237: 0 | J237: 0 | K237: 0 | L237: 0 | M237: 0 | N237: 0 | O237: 1 | P237: 0 | Q237: 0 | R237: 0 | S237: 0 | T237: 0 | U237: 0 | V237: 0 | W237: =1-SUM(I237:V237) -> 0
I238: 0 | J238: 1 | K238: 0 | L238: 0 | M238: 0 | N238: 0 | O238: 0 | P238: 0 | Q238: 0 | R238: 0 | S238: 0 | T238: 0 | U238: 0 | V238: 0 | W238: =1-SUM(I238:V238) -> 0
I239: 0 | J239: 1 | K239: 0 | L239: 0 | M239: 0 | N239: 0 | O239: 0 | P239: 0 | Q239: 0 | R239: 0 | S239: 0 | T239: 0 | U239: 0 | V239: 0 | W239: =1-SUM(I239:V239) -> 0
I240: 0 | J240: 0 | K240: 0 | L240: 0 | M240: 0 | N240: 0 | O240: 1 | P240: 0 | Q240: 0 | R240: 0 | S240: 0 | T240: 0 | U240: 0 | V240: 0 | W240: =1-SUM(I240:V240) -> 0
I241: 0 | J241: 0 | K241: 0 | L241: 0 | M241: 0 | N241: 0 | O241: 1 | P241: 0 | Q241: 0 | R241: 0 | S241: 0 | T241: 0 | U241: 0 | V241: 0 | W241: =1-SUM(I241:V241) -> 0
I242: 0 | J242: 0 | K242: 0 | L242: 0 | M242: 0 | N242: 1 | O242: 0 | P242: 0 | Q242: 0 | R242: 0 | S242: 0 | T242: 0 | U242: 0 | V242: 0 | W242: =1-SUM(I242:V242) -> 0
I243: 0 | J243: 0 | K243: 0 | L243: 0 | M243: 0 | N243: 1 | O243: 0 | P243: 0 | Q243: 0 | R243: 0 | S243: 0 | T243: 0 | U243: 0 | V243: 0 | W243: =1-SUM(I243:V243) -> 0
I244: 0 | J244: 0 | K244: 0 | L244: 0 | M244: 0 | N244: 1 | O244: 0 | P244: 0 | Q244: 0 | R244: 0 | S244: 0 | T244: 0 | U244: 0 | V244: 0 | W244: =1-SUM(I244:V244) -> 0
I245: 1 | J245: 0 | K245: 0 | L245: 0 | M245: 0 | N245: 0 | O245: 0 | P245: 0 | Q245: 0 | R245: 0 | S245: 0 | T245: 0 | U245: 0 | V245: 0 | W245: =1-SUM(I245:V245) -> 0
I246: 0 | J246: 0 | K246: 0 | L246: 0 | M246: 0 | N246: 1 | O246: 0 | P246: 0 | Q246: 0 | R246: 0 | S246: 0 | T246: 0 | U246: 0 | V246: 0 | W246: =1-SUM(I246:V246) -> 0
I247: 0 | J247: 0 | K247: 0 | L247: 0 | M247: 0 | N247: 1 | O247: 0 | P247: 0 | Q247: 0 | R247: 0 | S247: 0 | T247: 0 | U247: 0 | V247: 0 | W247: =1-SUM(I247:V247) -> 0
I248: 0 | J248: 0 | K248: 0 | L248: 0 | M248: 0 | N248: 1 | O248: 0 | P248: 0 | Q248: 0 | R248: 0 | S248: 0 | T248: 0 | U248: 0 | V248: 0 | W248: =1-SUM(I248:V248) -> 0
I249: 0 | J249: 0 | K249: 0 | L249: 0 | M249: 0 | N249: 1 | O249: 0 | P249: 0 | Q249: 0 | R249: 0 | S249: 0 | T249: 0 | U249: 0 | V249: 0 | W249: =1-SUM(I249:V249) -> 0
I250: 0 | J250: 0 | K250: 0 | L250: 0 | M250: 0 | N250: 1 | O250: 0 | P250: 0 | Q250: 0 | R250: 0 | S250: 0 | T250: 0 | U250: 0 | V250: 0 | W250: =1-SUM(I250:V250) -> 0
I251: 0 | J251: 0 | K251: 0 | L251: 0 | M251: 0 | N251: 1 | O251: 0 | P251: 0 | Q251: 0 | R251: 0 | S251: 0 | T251: 0 | U251: 0 | V251: 0 | W251: =1-SUM(I251:V251) -> 0
I252: 0 | J252: 0 | K252: 0 | L252: 0 | M252: 0 | N252: 1 | O252: 0 | P252: 0 | Q252: 0 | R252: 0 | S252: 0 | T252: 0 | U252: 0 | V252: 0 | W252: =1-SUM(I252:V252) -> 0
I253: 0 | J253: 0 | K253: 0 | L253: 0 | M253: 0 | N253: 1 | O253: 0 | P253: 0 | Q253: 0 | R253: 0 | S253: 0 | T253: 0 | U253: 0 | V253: 0 | W253: =1-SUM(I253:V253) -> 0
I254: 0 | J254: 0 | K254: 0 | L254: 0 | M254: 0 | N254: 1 | O254: 0 | P254: 0 | Q254: 0 | R254: 0 | S254: 0 | T254: 0 | U254: 0 | V254: 0 | W254: =1-SUM(I254:V254) -> 0
I255: 0 | J255: 0 | K255: 0 | L255: 0 | M255: 0 | N255: 1 | O255: 0 | P255: 0 | Q255: 0 | R255: 0 | S255: 0 | T255: 0 | U255: 0 | V255: 0 | W255: =1-SUM(I255:V255) -> 0
I256: 0 | J256: 0 | K256: 0 | L256: 0 | M256: 0 | N256: 1 | O256: 0 | P256: 0 | Q256: 0 | R256: 0 | S256: 0 | T256: 0 | U256: 0 | V256: 0 | W256: =1-SUM(I256:V256) -> 0
I257: 0 | J257: 0 | K257: 0 | L257: 0 | M257: 0 | N257: 1 | O257: 0 | P257: 0 | Q257: 0 | R257: 0 | S257: 0 | T257: 0 | U257: 0 | V257: 0 | W257: =1-SUM(I257:V257) -> 0
I258: 0 | J258: 0 | K258: 0 | L258: 0 | M258: 0 | N258: 1 | O258: 0 | P258: 0 | Q258: 0 | R258: 0 | S258: 0 | T258: 0 | U258: 0 | V258: 0 | W258: =1-SUM(I258:V258) -> 0
I259: 0 | J259: 0 | K259: 0 | L259: 0 | M259: 0 | N259: 1 | O259: 0 | P259: 0 | Q259: 0 | R259: 0 | S259: 0 | T259: 0 | U259: 0 | V259: 0 | W259: =1-SUM(I259:V259) -> 0
I260: 0 | J260: 0 | K260: 0 | L260: 0 | M260: 0 | N260: 1 | O260: 0 | P260: 0 | Q260: 0 | R260: 0 | S260: 0 | T260: 0 | U260: 0 | V260: 0 | W260: =1-SUM(I260:V260) -> 0
I261: 0 | J261: 0 | K261: 0 | L261: 0 | M261: 0 | N261: 1 | O261: 0 | P261: 0 | Q261: 0 | R261: 0 | S261: 0 | T261: 0 | U261: 0 | V261: 0 | W261: =1-SUM(I261:V261) -> 0
I262: 0 | J262: 0 | K262: 0 | L262: 0 | M262: 0 | N262: 1 | O262: 0 | P262: 0 | Q262: 0 | R262: 0 | S262: 0 | T262: 0 | U262: 0 | V262: 0 | W262: =1-SUM(I262:V262) -> 0
I263: 0 | J263: 0 | K263: 0 | L263: 0 | M263: 0 | N263: 0 | O263: 0 | P263: 0 | Q263: 0 | R263: 1 | S263: 0 | T263: 0 | U263: 0 | V263: 0 | W263: =1-SUM(I263:V263) -> 0
I264: 0 | J264: 0 | K264: 0 | L264: 0 | M264: 0 | N264: 0 | O264: 0 | P264: 0 | Q264: 0 | R264: 1 | S264: 0 | T264: 0 | U264: 0 | V264: 0 | W264: =1-SUM(I264:V264) -> 0
I265: 0 | J265: 0 | K265: 0 | L265: 0 | M265: 1 | N265: 0 | O265: 0 | P265: 0 | Q265: 0 | R265: 0 | S265: 0 | T265: 0 | U265: 0 | V265: 0 | W265: =1-SUM(I265:V265) -> 0
I266: 0 | J266: 0 | K266: 0 | L266: 0 | M266: 0 | N266: 0 | O266: 0 | P266: 0 | Q266: 0 | R266: 1 | S266: 0 | T266: 0 | U266: 0 | V266: 0 | W266: =1-SUM(I266:V266) -> 0
I267: 0 | J267: 0 | K267: 0 | L267: 0 | M267: 1 | N267: 0 | O267: 0 | P267: 0 | Q267: 0 | R267: 0 | S267: 0 | T267: 0 | U267: 0 | V267: 0 | W267: =1-SUM(I267:V267) -> 0
I268: 0 | J268: 0 | K268: 0 | L268: 0 | M268: 0 | N268: 0 | O268: 0 | P268: 0 | Q268: 0 | R268: 1 | S268: 0 | T268: 0 | U268: 0 | V268: 0 | W268: =1-SUM(I268:V268) -> 0
I269: 0 | J269: 0 | K269: 0 | L269: 0 | M269: 0 | N269: 0 | O269: 0 | P269: 0 | Q269: 0 | R269: 1 | S269: 0 | T269: 0 | U269: 0 | V269: 0 | W269: =1-SUM(I269:V269) -> 0
I270: 0 | J270: 0 | K270: 0 | L270: 0 | M270: 1 | N270: 0 | O270: 0 | P270: 0 | Q270: 0 | R270: 0 | S270: 0 | T270: 0 | U270: 0 | V270: 0 | W270: =1-SUM(I270:V270) -> 0
I271: 0 | J271: 0 | K271: 0 | L271: 0 | M271: 1 | N271: 0 | O271: 0 | P271: 0 | Q271: 0 | R271: 0 | S271: 0 | T271: 0 | U271: 0 | V271: 0 | W271: =1-SUM(I271:V271) -> 0
I272: 0 | J272: 0 | K272: 0 | L272: 0 | M272: 0 | N272: 1 | O272: 0 | P272: 0 | Q272: 0 | R272: 0 | S272: 0 | T272: 0 | U272: 0 | V272: 0 | W272: =1-SUM(I272:V272) -> 0
I273: 0 | J273: 0 | K273: 0 | L273: 0 | M273: 0 | N273: 1 | O273: 0 | P273: 0 | Q273: 0 | R273: 0 | S273: 0 | T273: 0 | U273: 0 | V273: 0 | W273: =1-SUM(I273:V273) -> 0
I274: 0 | J274: 0 | K274: 0 | L274: 0 | M274: 0 | N274: 1 | O274: 0 | P274: 0 | Q274: 0 | R274: 0 | S274: 0 | T274: 0 | U274: 0 | V274: 0 | W274: =1-SUM(I274:V274) -> 0
I275: 0 | J275: 0 | K275: 0 | L275: 0 | M275: 0 | N275: 1 | O275: 0 | P275: 0 | Q275: 0 | R275: 0 | S275: 0 | T275: 0 | U275: 0 | V275: 0 | W275: =1-SUM(I275:V275) -> 0
I276: 0 | J276: 0 | K276: 0 | L276: 0 | M276: 0 | N276: 1 | O276: 0 | P276: 0 | Q276: 0 | R276: 0 | S276: 0 | T276: 0 | U276: 0 | V276: 0 | W276: =1-SUM(I276:V276) -> 0
I277: 0 | J277: 0 | K277: 0 | L277: 0 | M277: 0 | N277: 1 | O277: 0 | P277: 0 | Q277: 0 | R277: 0 | S277: 0 | T277: 0 | U277: 0 | V277: 0 | W277: =1-SUM(I277:V277) -> 0
I278: 0 | J278: 0 | K278: 0 | L278: 0 | M278: 0 | N278: 1 | O278: 0 | P278: 0 | Q278: 0 | R278: 0 | S278: 0 | T278: 0 | U278: 0 | V278: 0 | W278: =1-SUM(I278:V278) -> 0
I279: 0 | J279: 0 | K279: 0 | L279: 0 | M279: 0 | N279: 1 | O279: 0 | P279: 0 | Q279: 0 | R279: 0 | S279: 0 | T279: 0 | U279: 0 | V279: 0 | W279: =1-SUM(I279:V279) -> 0
I280: 0 | J280: 0 | K280: 0 | L280: 0 | M280: 0 | N280: 1 | O280: 0 | P280: 0 | Q280: 0 | R280: 0 | S280: 0 | T280: 0 | U280: 0 | V280: 0 | W280: =1-SUM(I280:V280) -> 0
I281: 0 | J281: 0 | K281: 0 | L281: 0 | M281: 0 | N281: 1 | O281: 0 | P281: 0 | Q281: 0 | R281: 0 | S281: 0 | T281: 0 | U281: 0 | V281: 0 | W281: =1-SUM(I281:V281) -> 0
I282: 0 | J282: 0 | K282: 0 | L282: 0 | M282: 0 | N282: 1 | O282: 0 | P282: 0 | Q282: 0 | R282: 0 | S282: 0 | T282: 0 | U282: 0 | V282: 0 | W282: =1-SUM(I282:V282) -> 0
I283: 0 | J283: 0 | K283: 0 | L283: 0 | M283: 0 | N283: 1 | O283: 0 | P283: 0 | Q283: 0 | R283: 0 | S283: 0 | T283: 0 | U283: 0 | V283: 0 | W283: =1-SUM(I283:V283) -> 0
I284: 0 | J284: 0 | K284: 0 | L284: 0 | M284: 0 | N284: 1 | O284: 0 | P284: 0 | Q284: 0 | R284: 0 | S284: 0 | T284: 0 | U284: 0 | V284: 0 | W284: =1-SUM(I284:V284) -> 0
I285: 0 | J285: 0 | K285: 0 | L285: 0 | M285: 0 | N285: 1 | O285: 0 | P285: 0 | Q285: 0 | R285: 0 | S285: 0 | T285: 0 | U285: 0 | V285: 0 | W285: =1-SUM(I285:V285) -> 0
I286: 0 | J286: 0 | K286: 0 | L286: 0 | M286: 0 | N286: 1 | O286: 0 | P286: 0 | Q286: 0 | R286: 0 | S286: 0 | T286: 0 | U286: 0 | V286: 0 | W286: =1-SUM(I286:V286) -> 0
I287: 0 | J287: 0 | K287: 0 | L287: 0 | M287: 0 | N287: 1 | O287: 0 | P287: 0 | Q287: 0 | R287: 0 | S287: 0 | T287: 0 | U287: 0 | V287: 0 | W287: =1-SUM(I287:V287) -> 0
I288: 0 | J288: 0 | K288: 0 | L288: 0 | M288: 0 | N288: 1 | O288: 0 | P288: 0 | Q288: 0 | R288: 0 | S288: 0 | T288: 0 | U288: 0 | V288: 0 | W288: =1-SUM(I288:V288) -> 0
I289: 0 | J289: 0 | K289: 0 | L289: 0 | M289: 0 | N289: 1 | O289: 0 | P289: 0 | Q289: 0 | R289: 0 | S289: 0 | T289: 0 | U289: 0 | V289: 0 | W289: =1-SUM(I289:V289) -> 0
I290: 0 | J290: 0 | K290: 0 | L290: 0 | M290: 0 | N290: 0 | O290: 0 | P290: 0 | Q290: 0 | R290: 0 | S290: 0 | T290: 1 | U290: 0 | V290: 0 | W290: =1-SUM(I290:V290) -> 0
I291: 0 | J291: 0 | K291: 0 | L291: 0 | M291: 0 | N291: 0 | O291: 1 | P291: 0 | Q291: 0 | R291: 0 | S291: 0 | T291: 0 | U291: 0 | V291: 0 | W291: =1-SUM(I291:V291) -> 0
I292: 0 | J292: 0 | K292: 0 | L292: 0 | M292: 0 | N292: 0 | O292: 1 | P292: 0 | Q292: 0 | R292: 0 | S292: 0 | T292: 0 | U292: 0 | V292: 0 | W292: =1-SUM(I292:V292) -> 0
I293: 0 | J293: 0 | K293: 0 | L293: 0 | M293: 0 | N293: 1 | O293: 0 | P293: 0 | Q293: 0 | R293: 0 | S293: 0 | T293: 0 | U293: 0 | V293: 0 | W293: =1-SUM(I293:V293) -> 0
I294: 0 | J294: 0 | K294: 0 | L294: 0 | M294: 0 | N294: 1 | O294: 0 | P294: 0 | Q294: 0 | R294: 0 | S294: 0 | T294: 0 | U294: 0 | V294: 0 | W294: =1-SUM(I294:V294) -> 0
I295: 0 | J295: 0 | K295: 0 | L295: 0 | M295: 0 | N295: 0 | O295: 0 | P295: 0 | Q295: 0 | R295: 0 | S295: 0 | T295: 1 | U295: 0 | V295: 0 | W295: =1-SUM(I295:V295) -> 0
I296: 0 | J296: 0 | K296: 0 | L296: 0 | M296: 0 | N296: 0 | O296: 0 | P296: 0 | Q296: 0 | R296: 0 | S296: 0 | T296: 1 | U296: 0 | V296: 0 | W296: =1-SUM(I296:V296) -> 0
I297: 0 | J297: 0 | K297: 0 | L297: 0 | M297: 0 | N297: 0 | O297: 1 | P297: 0 | Q297: 0 | R297: 0 | S297: 0 | T297: 0 | U297: 0 | V297: 0 | W297: =1-SUM(I297:V297) -> 0
I298: 0 | J298: 0 | K298: 0 | L298: 0 | M298: 0 | N298: 1 | O298: 0 | P298: 0 | Q298: 0 | R298: 0 | S298: 0 | T298: 0 | U298: 0 | V298: 0 | W298: =1-SUM(I298:V298) -> 0
I299: 0 | J299: 0 | K299: 0 | L299: 0 | M299: 0 | N299: 0 | O299: 0 | P299: 0 | Q299: 0 | R299: 0 | S299: 0 | T299: 1 | U299: 0 | V299: 0 | W299: =1-SUM(I299:V299) -> 0
I300: 0 | J300: 0 | K300: 0 | L300: 0 | M300: 0 | N300: 1 | O300: 0 | P300: 0 | Q300: 0 | R300: 0 | S300: 0 | T300: 0 | U300: 0 | V300: 0 | W300: =1-SUM(I300:V300) -> 0
I301: 0 | J301: 0 | K301: 0 | L301: 0 | M301: 0 | N301: 1 | O301: 0 | P301: 0 | Q301: 0 | R301: 0 | S301: 0 | T301: 0 | U301: 0 | V301: 0 | W301: =1-SUM(I301:V301) -> 0
I302: 0 | J302: 0 | K302: 0 | L302: 0 | M302: 0 | N302: 0 | O302: 1 | P302: 0 | Q302: 0 | R302: 0 | S302: 0 | T302: 0 | U302: 0 | V302: 0 | W302: =1-SUM(I302:V302) -> 0
I303: 0 | J303: 0 | K303: 0 | L303: 0 | M303: 0 | N303: 0 | O303: 1 | P303: 0 | Q303: 0 | R303: 0 | S303: 0 | T303: 0 | U303: 0 | V303: 0 | W303: =1-SUM(I303:V303) -> 0
I304: 0 | J304: 0 | K304: 0 | L304: 0 | M304: 0 | N304: 0 | O304: 1 | P304: 0 | Q304: 0 | R304: 0 | S304: 0 | T304: 0 | U304: 0 | V304: 0 | W304: =1-SUM(I304:V304) -> 0
I305: 0 | J305: 0 | K305: 0 | L305: 0 | M305: 0 | N305: 0 | O305: 0 | P305: 0 | Q305: 0 | R305: 0 | S305: 0 | T305: 0 | U305: 0 | V305: 0 | W305: =1-SUM(I305:V305) -> 1
I306: 0 | J306: 0 | K306: 0 | L306: 0 | M306: 0 | N306: 0 | O306: 0 | P306: 0 | Q306: 0 | R306: 0 | S306: 0 | T306: 0 | U306: 0 | V306: 0 | W306: =1-SUM(I306:V306) -> 1
I307: 0 | J307: 0 | K307: 0 | L307: 0 | M307: 0 | N307: 0 | O307: 1 | P307: 0 | Q307: 0 | R307: 0 | S307: 0 | T307: 0 | U307: 0 | V307: 0 | W307: =1-SUM(I307:V307) -> 0
I308: 0 | J308: 0 | K308: 0 | L308: 0 | M308: 0 | N308: 0 | O308: 1 | P308: 0 | Q308: 0 | R308: 0 | S308: 0 | T308: 0 | U308: 0 | V308: 0 | W308: =1-SUM(I308:V308) -> 0
I309: 0 | J309: 0 | K309: 0 | L309: 0 | M309: 0 | N309: 0 | O309: 0 | P309: 0 | Q309: 0 | R309: 0 | S309: 0 | T309: 0 | U309: 0 | V309: 0 | W309: =1-SUM(I309:V309) -> 1
I310: 0 | J310: 0 | K310: 0 | L310: 0 | M310: 0 | N310: 0 | O310: 1 | P310: 0 | Q310: 0 | R310: 0 | S310: 0 | T310: 0 | U310: 0 | V310: 0 | W310: =1-SUM(I310:V310) -> 0
I311: 0 | J311: 0 | K311: 0 | L311: 0 | M311: 0 | N311: 0 | O311: 1 | P311: 0 | Q311: 0 | R311: 0 | S311: 0 | T311: 0 | U311: 0 | V311: 0 | W311: =1-SUM(I311:V311) -> 0
I312: 0 | J312: 0 | K312: 0 | L312: 0 | M312: 0 | N312: 0 | O312: 0 | P312: 0 | Q312: 0 | R312: 0 | S312: 1 | T312: 0 | U312: 0 | V312: 0 | W312: =1-SUM(I312:V312) -> 0
I313: 0 | J313: 0 | K313: 0 | L313: 0 | M313: 0 | N313: 0 | O313: 1 | P313: 0 | Q313: 0 | R313: 0 | S313: 0 | T313: 0 | U313: 0 | V313: 0 | W313: =1-SUM(I313:V313) -> 0
I314: 0 | J314: 0 | K314: 0 | L314: 0 | M314: 1 | N314: 0 | O314: 0 | P314: 0 | Q314: 0 | R314: 0 | S314: 0 | T314: 0 | U314: 0 | V314: 0 | W314: =1-SUM(I314:V314) -> 0
I315: 0 | J315: 0 | K315: 0 | L315: 0 | M315: 0 | N315: 1 | O315: 0 | P315: 0 | Q315: 0 | R315: 0 | S315: 0 | T315: 0 | U315: 0 | V315: 0 | W315: =1-SUM(I315:V315) -> 0
I316: 0 | J316: 0 | K316: 0 | L316: 0 | M316: 0 | N316: 0 | O316: 1 | P316: 0 | Q316: 0 | R316: 0 | S316: 0 | T316: 0 | U316: 0 | V316: 0 | W316: =1-SUM(I316:V316) -> 0
I317: 0 | J317: 0 | K317: 0 | L317: 0 | M317: 0 | N317: 0 | O317: 1 | P317: 0 | Q317: 0 | R317: 0 | S317: 0 | T317: 0 | U317: 0 | V317: 0 | W317: =1-SUM(I317:V317) -> 0
I318: 0 | J318: 0 | K318: 0 | L318: 0 | M318: 0 | N318: 0 | O318: 1 | P318: 0 | Q318: 0 | R318: 0 | S318: 0 | T318: 0 | U318: 0 | V318: 0 | W318: =1-SUM(I318:V318) -> 0
I319: 0 | J319: 0 | K319: 0 | L319: 1 | M319: 0 | N319: 0 | O319: 0 | P319: 0 | Q319: 0 | R319: 0 | S319: 0 | T319: 0 | U319: 0 | V319: 0 | W319: =1-SUM(I319:V319) -> 0
I320: 0 | J320: 0 | K320: 0 | L320: 0 | M320: 0 | N320: 0 | O320: 1 | P320: 0 | Q320: 0 | R320: 0 | S320: 0 | T320: 0 | U320: 0 | V320: 0 | W320: =1-SUM(I320:V320) -> 0
I321: 0 | J321: 0 | K321: 0 | L321: 0 | M321: 0 | N321: 0 | O321: 0 | P321: 1 | Q321: 0 | R321: 0 | S321: 0 | T321: 0 | U321: 0 | V321: 0 | W321: =1-SUM(I321:V321) -> 0
I322: 0 | J322: 0 | K322: 0 | L322: 0 | M322: 0 | N322: 0 | O322: 0 | P322: 1 | Q322: 0 | R322: 0 | S322: 0 | T322: 0 | U322: 0 | V322: 0 | W322: =1-SUM(I322:V322) -> 0
I323: 0 | J323: 0 | K323: 0 | L323: 0 | M323: 0 | N323: 1 | O323: 0 | P323: 0 | Q323: 0 | R323: 0 | S323: 0 | T323: 0 | U323: 0 | V323: 0 | W323: =1-SUM(I323:V323) -> 0
I324: 0 | J324: 0 | K324: 0 | L324: 0 | M324: 1 | N324: 0 | O324: 0 | P324: 0 | Q324: 0 | R324: 0 | S324: 0 | T324: 0 | U324: 0 | V324: 0 | W324: =1-SUM(I324:V324) -> 0
I325: 0 | J325: 0 | K325: 0 | L325: 0 | M325: 1 | N325: 0 | O325: 0 | P325: 0 | Q325: 0 | R325: 0 | S325: 0 | T325: 0 | U325: 0 | V325: 0 | W325: =1-SUM(I325:V325) -> 0
I326: 0 | J326: 0 | K326: 0 | L326: 0 | M326: 0 | N326: 1 | O326: 0 | P326: 0 | Q326: 0 | R326: 0 | S326: 0 | T326: 0 | U326: 0 | V326: 0 | W326: =1-SUM(I326:V326) -> 0
I327: 0 | J327: 0 | K327: 0 | L327: 0 | M327: 0 | N327: 1 | O327: 0 | P327: 0 | Q327: 0 | R327: 0 | S327: 0 | T327: 0 | U327: 0 | V327: 0 | W327: =1-SUM(I327:V327) -> 0
I328: 0 | J328: 0 | K328: 0 | L328: 0 | M328: 0 | N328: 0 | O328: 1 | P328: 0 | Q328: 0 | R328: 0 | S328: 0 | T328: 0 | U328: 0 | V328: 0 | W328: =1-SUM(I328:V328) -> 0
I329: 0 | J329: 0 | K329: 0 | L329: 0 | M329: 0 | N329: 0 | O329: 0 | P329: 0 | Q329: 0 | R329: 0 | S329: 0 | T329: 0 | U329: 0 | V329: 0 | W329: =1-SUM(I329:V329) -> 1
I330: 0 | J330: 0 | K330: 0 | L330: 0 | M330: 1 | N330: 0 | O330: 0 | P330: 0 | Q330: 0 | R330: 0 | S330: 0 | T330: 0 | U330: 0 | V330: 0 | W330: =1-SUM(I330:V330) -> 0
I331: 0 | J331: 0 | K331: 0 | L331: 0 | M331: 0 | N331: 1 | O331: 0 | P331: 0 | Q331: 0 | R331: 0 | S331: 0 | T331: 0 | U331: 0 | V331: 0 | W331: =1-SUM(I331:V331) -> 0
I332: 0 | J332: 0 | K332: 0 | L332: 0 | M332: 0 | N332: 1 | O332: 0 | P332: 0 | Q332: 0 | R332: 0 | S332: 0 | T332: 0 | U332: 0 | V332: 0 | W332: =1-SUM(I332:V332) -> 0
I333: 0 | J333: 0 | K333: 0 | L333: 0 | M333: 0 | N333: 1 | O333: 0 | P333: 0 | Q333: 0 | R333: 0 | S333: 0 | T333: 0 | U333: 0 | V333: 0 | W333: =1-SUM(I333:V333) -> 0
I334: 0 | J334: 0 | K334: 0 | L334: 0 | M334: 0 | N334: 1 | O334: 0 | P334: 0 | Q334: 0 | R334: 0 | S334: 0 | T334: 0 | U334: 0 | V334: 0 | W334: =1-SUM(I334:V334) -> 0
I335: 0 | J335: 0 | K335: 0 | L335: 0 | M335: 1 | N335: 0 | O335: 0 | P335: 0 | Q335: 0 | R335: 0 | S335: 0 | T335: 0 | U335: 0 | V335: 0 | W335: =1-SUM(I335:V335) -> 0
I336: 0 | J336: 0 | K336: 0 | L336: 0 | M336: 0 | N336: 1 | O336: 0 | P336: 0 | Q336: 0 | R336: 0 | S336: 0 | T336: 0 | U336: 0 | V336: 0 | W336: =1-SUM(I336:V336) -> 0
I337: 0 | J337: 0 | K337: 0 | L337: 0 | M337: 0 | N337: 1 | O337: 0 | P337: 0 | Q337: 0 | R337: 0 | S337: 0 | T337: 0 | U337: 0 | V337: 0 | W337: =1-SUM(I337:V337) -> 0
I338: 0 | J338: 0 | K338: 0 | L338: 0 | M338: 0 | N338: 1 | O338: 0 | P338: 0 | Q338: 0 | R338: 0 | S338: 0 | T338: 0 | U338: 0 | V338: 0 | W338: =1-SUM(I338:V338) -> 0
I339: 0 | J339: 0 | K339: 0 | L339: 0 | M339: 0 | N339: 1 | O339: 0 | P339: 0 | Q339: 0 | R339: 0 | S339: 0 | T339: 0 | U339: 0 | V339: 0 | W339: =1-SUM(I339:V339) -> 0
I340: 0 | J340: 0 | K340: 0 | L340: 0 | M340: 1 | N340: 0 | O340: 0 | P340: 0 | Q340: 0 | R340: 0 | S340: 0 | T340: 0 | U340: 0 | V340: 0 | W340: =1-SUM(I340:V340) -> 0
I341: 0 | J341: 0 | K341: 0 | L341: 0 | M341: 0 | N341: 1 | O341: 0 | P341: 0 | Q341: 0 | R341: 0 | S341: 0 | T341: 0 | U341: 0 | V341: 0 | W341: =1-SUM(I341:V341) -> 0
I342: 0 | J342: 0 | K342: 0 | L342: 0 | M342: 0 | N342: 1 | O342: 0 | P342: 0 | Q342: 0 | R342: 0 | S342: 0 | T342: 0 | U342: 0 | V342: 0 | W342: =1-SUM(I342:V342) -> 0
I343: 0 | J343: 0 | K343: 0 | L343: 0 | M343: 0 | N343: 1 | O343: 0 | P343: 0 | Q343: 0 | R343: 0 | S343: 0 | T343: 0 | U343: 0 | V343: 0 | W343: =1-SUM(I343:V343) -> 0
I344: 0 | J344: 0 | K344: 0 | L344: 0 | M344: 0 | N344: 1 | O344: 0 | P344: 0 | Q344: 0 | R344: 0 | S344: 0 | T344: 0 | U344: 0 | V344: 0 | W344: =1-SUM(I344:V344) -> 0
I345: 0 | J345: 0 | K345: 0 | L345: 1 | M345: 0 | N345: 0 | O345: 0 | P345: 0 | Q345: 0 | R345: 0 | S345: 0 | T345: 0 | U345: 0 | V345: 0 | W345: =1-SUM(I345:V345) -> 0
I346: 0 | J346: 0 | K346: 0 | L346: 0 | M346: 0 | N346: 1 | O346: 0 | P346: 0 | Q346: 0 | R346: 0 | S346: 0 | T346: 0 | U346: 0 | V346: 0 | W346: =1-SUM(I346:V346) -> 0
I347: 0 | J347: 0 | K347: 0 | L347: 0 | M347: 0 | N347: 1 | O347: 0 | P347: 0 | Q347: 0 | R347: 0 | S347: 0 | T347: 0 | U347: 0 | V347: 0 | W347: =1-SUM(I347:V347) -> 0
I348: 0 | J348: 0 | K348: 0 | L348: 0 | M348: 0 | N348: 1 | O348: 0 | P348: 0 | Q348: 0 | R348: 0 | S348: 0 | T348: 0 | U348: 0 | V348: 0 | W348: =1-SUM(I348:V348) -> 0
I349: 0 | J349: 0 | K349: 0 | L349: 0 | M349: 1 | N349: 0 | O349: 0 | P349: 0 | Q349: 0 | R349: 0 | S349: 0 | T349: 0 | U349: 0 | V349: 0 | W349: =1-SUM(I349:V349) -> 0
I350: 0 | J350: 0 | K350: 0 | L350: 0 | M350: 1 | N350: 0 | O350: 0 | P350: 0 | Q350: 0 | R350: 0 | S350: 0 | T350: 0 | U350: 0 | V350: 0 | W350: =1-SUM(I350:V350) -> 0
I351: 0 | J351: 0 | K351: 0 | L351: 0 | M351: 0 | N351: 1 | O351: 0 | P351: 0 | Q351: 0 | R351: 0 | S351: 0 | T351: 0 | U351: 0 | V351: 0 | W351: =1-SUM(I351:V351) -> 0
I352: 0 | J352: 0 | K352: 0 | L352: 0 | M352: 0 | N352: 1 | O352: 0 | P352: 0 | Q352: 0 | R352: 0 | S352: 0 | T352: 0 | U352: 0 | V352: 0 | W352: =1-SUM(I352:V352) -> 0
I353: 0 | J353: 0 | K353: 0 | L353: 0 | M353: 0 | N353: 1 | O353: 0 | P353: 0 | Q353: 0 | R353: 0 | S353: 0 | T353: 0 | U353: 0 | V353: 0 | W353: =1-SUM(I353:V353) -> 0
I354: 0 | J354: 0 | K354: 0 | L354: 0 | M354: 0 | N354: 1 | O354: 0 | P354: 0 | Q354: 0 | R354: 0 | S354: 0 | T354: 0 | U354: 0 | V354: 0 | W354: =1-SUM(I354:V354) -> 0
I355: 0 | J355: 0 | K355: 0 | L355: 0 | M355: 0 | N355: 1 | O355: 0 | P355: 0 | Q355: 0 | R355: 0 | S355: 0 | T355: 0 | U355: 0 | V355: 0 | W355: =1-SUM(I355:V355) -> 0
I356: 0 | J356: 0 | K356: 0 | L356: 0 | M356: 0 | N356: 1 | O356: 0 | P356: 0 | Q356: 0 | R356: 0 | S356: 0 | T356: 0 | U356: 0 | V356: 0 | W356: =1-SUM(I356:V356) -> 0
I357: 0 | J357: 0 | K357: 0 | L357: 0 | M357: 0 | N357: 1 | O357: 0 | P357: 0 | Q357: 0 | R357: 0 | S357: 0 | T357: 0 | U357: 0 | V357: 0 | W357: =1-SUM(I357:V357) -> 0
I358: 0 | J358: 0 | K358: 0 | L358: 0 | M358: 0 | N358: 1 | O358: 0 | P358: 0 | Q358: 0 | R358: 0 | S358: 0 | T358: 0 | U358: 0 | V358: 0 | W358: =1-SUM(I358:V358) -> 0
I359: 0 | J359: 0 | K359: 0 | L359: 0 | M359: 0 | N359: 1 | O359: 0 | P359: 0 | Q359: 0 | R359: 0 | S359: 0 | T359: 0 | U359: 0 | V359: 0 | W359: =1-SUM(I359:V359) -> 0
I360: 0 | J360: 0 | K360: 0 | L360: 0 | M360: 0 | N360: 1 | O360: 0 | P360: 0 | Q360: 0 | R360: 0 | S360: 0 | T360: 0 | U360: 0 | V360: 0 | W360: =1-SUM(I360:V360) -> 0
I361: 0 | J361: 0 | K361: 0 | L361: 0 | M361: 0 | N361: 1 | O361: 0 | P361: 0 | Q361: 0 | R361: 0 | S361: 0 | T361: 0 | U361: 0 | V361: 0 | W361: =1-SUM(I361:V361) -> 0
I362: 0 | J362: 0 | K362: 0 | L362: 0 | M362: 0 | N362: 1 | O362: 0 | P362: 0 | Q362: 0 | R362: 0 | S362: 0 | T362: 0 | U362: 0 | V362: 0 | W362: =1-SUM(I362:V362) -> 0
I363: 0 | J363: 0 | K363: 0 | L363: 0 | M363: 1 | N363: 0 | O363: 0 | P363: 0 | Q363: 0 | R363: 0 | S363: 0 | T363: 0 | U363: 0 | V363: 0 | W363: =1-SUM(I363:V363) -> 0
I364: 0 | J364: 0 | K364: 0 | L364: 0 | M364: 1 | N364: 0 | O364: 0 | P364: 0 | Q364: 0 | R364: 0 | S364: 0 | T364: 0 | U364: 0 | V364: 0 | W364: =1-SUM(I364:V364) -> 0
I365: 0 | J365: 0 | K365: 0 | L365: 0 | M365: 0 | N365: 1 | O365: 0 | P365: 0 | Q365: 0 | R365: 0 | S365: 0 | T365: 0 | U365: 0 | V365: 0 | W365: =1-SUM(I365:V365) -> 0
I366: 0 | J366: 0 | K366: 0 | L366: 0 | M366: 0 | N366: 1 | O366: 0 | P366: 0 | Q366: 0 | R366: 0 | S366: 0 | T366: 0 | U366: 0 | V366: 0 | W366: =1-SUM(I366:V366) -> 0
I367: 0 | J367: 0 | K367: 0 | L367: 0 | M367: 0 | N367: 1 | O367: 0 | P367: 0 | Q367: 0 | R367: 0 | S367: 0 | T367: 0 | U367: 0 | V367: 0 | W367: =1-SUM(I367:V367) -> 0
I368: 0 | J368: 0 | K368: 0 | L368: 0 | M368: 0 | N368: 1 | O368: 0 | P368: 0 | Q368: 0 | R368: 0 | S368: 0 | T368: 0 | U368: 0 | V368: 0 | W368: =1-SUM(I368:V368) -> 0
I369: 0 | J369: 0 | K369: 0 | L369: 0 | M369: 1 | N369: 0 | O369: 0 | P369: 0 | Q369: 0 | R369: 0 | S369: 0 | T369: 0 | U369: 0 | V369: 0 | W369: =1-SUM(I369:V369) -> 0
I370: 0 | J370: 0 | K370: 0 | L370: 0 | M370: 1 | N370: 0 | O370: 0 | P370: 0 | Q370: 0 | R370: 0 | S370: 0 | T370: 0 | U370: 0 | V370: 0 | W370: =1-SUM(I370:V370) -> 0
I371: 0 | J371: 0 | K371: 0 | L371: 0 | M371: 0 | N371: 1 | O371: 0 | P371: 0 | Q371: 0 | R371: 0 | S371: 0 | T371: 0 | U371: 0 | V371: 0 | W371: =1-SUM(I371:V371) -> 0
I372: 0 | J372: 0 | K372: 0 | L372: 0 | M372: 0 | N372: 0 | O372: 0 | P372: 0 | Q372: 0 | R372: 0 | S372: 0 | T372: 0 | U372: 0 | V372: 0 | W372: =1-SUM(I372:V372) -> 1
I373: 0 | J373: 0 | K373: 0 | L373: 0 | M373: 1 | N373: 0 | O373: 0 | P373: 0 | Q373: 0 | R373: 0 | S373: 0 | T373: 0 | U373: 0 | V373: 0 | W373: =1-SUM(I373:V373) -> 0
I374: 0 | J374: 0 | K374: 0 | L374: 0 | M374: 1 | N374: 0 | O374: 0 | P374: 0 | Q374: 0 | R374: 0 | S374: 0 | T374: 0 | U374: 0 | V374: 0 | W374: =1-SUM(I374:V374) -> 0
I375: 0 | J375: 0 | K375: 0 | L375: 0 | M375: 0 | N375: 0 | O375: 1 | P375: 0 | Q375: 0 | R375: 0 | S375: 0 | T375: 0 | U375: 0 | V375: 0 | W375: =1-SUM(I375:V375) -> 0
I376: 0 | J376: 0 | K376: 0 | L376: 0 | M376: 0 | N376: 0 | O376: 1 | P376: 0 | Q376: 0 | R376: 0 | S376: 0 | T376: 0 | U376: 0 | V376: 0 | W376: =1-SUM(I376:V376) -> 0
I377: 0 | J377: 0 | K377: 0 | L377: 0 | M377: 0 | N377: 0 | O377: 1 | P377: 0 | Q377: 0 | R377: 0 | S377: 0 | T377: 0 | U377: 0 | V377: 0 | W377: =1-SUM(I377:V377) -> 0
I378: 0 | J378: 0 | K378: 0 | L378: 0 | M378: 0 | N378: 0 | O378: 1 | P378: 0 | Q378: 0 | R378: 0 | S378: 0 | T378: 0 | U378: 0 | V378: 0 | W378: =1-SUM(I378:V378) -> 0
I379: 0 | J379: 0 | K379: 0 | L379: 0 | M379: 0 | N379: 0 | O379: 1 | P379: 0 | Q379: 0 | R379: 0 | S379: 0 | T379: 0 | U379: 0 | V379: 0 | W379: =1-SUM(I379:V379) -> 0
I380: 0 | J380: 0 | K380: 0 | L380: 0 | M380: 0 | N380: 0 | O380: 1 | P380: 0 | Q380: 0 | R380: 0 | S380: 0 | T380: 0 | U380: 0 | V380: 0 | W380: =1-SUM(I380:V380) -> 0
I381: 0 | J381: 0 | K381: 0 | L381: 0 | M381: 0 | N381: 0 | O381: 1 | P381: 0 | Q381: 0 | R381: 0 | S381: 0 | T381: 0 | U381: 0 | V381: 0 | W381: =1-SUM(I381:V381) -> 0
I382: 0 | J382: 0 | K382: 0 | L382: 0 | M382: 0 | N382: 0 | O382: 0 | P382: 0 | Q382: 0 | R382: 0 | S382: 1 | T382: 0 | U382: 0 | V382: 0 | W382: =1-SUM(I382:V382) -> 0
I383: 0 | J383: 0 | K383: 0 | L383: 1 | M383: 0 | N383: 0 | O383: 0 | P383: 0 | Q383: 0 | R383: 0 | S383: 0 | T383: 0 | U383: 0 | V383: 0 | W383: =1-SUM(I383:V383) -> 0
I384: 0 | J384: 0 | K384: 0 | L384: 0 | M384: 0 | N384: 0 | O384: 1 | P384: 0 | Q384: 0 | R384: 0 | S384: 0 | T384: 0 | U384: 0 | V384: 0 | W384: =1-SUM(I384:V384) -> 0
I385: 0 | J385: 0 | K385: 0 | L385: 0 | M385: 0 | N385: 0 | O385: 1 | P385: 0 | Q385: 0 | R385: 0 | S385: 0 | T385: 0 | U385: 0 | V385: 0 | W385: =1-SUM(I385:V385) -> 0
I386: 0 | J386: 0 | K386: 0 | L386: 0 | M386: 0 | N386: 0 | O386: 0 | P386: 0 | Q386: 0 | R386: 0 | S386: 0 | T386: 0 | U386: 0 | V386: 0 | W386: =1-SUM(I386:V386) -> 1
I387: 0 | J387: 0 | K387: 0 | L387: 1 | M387: 0 | N387: 0 | O387: 0 | P387: 0 | Q387: 0 | R387: 0 | S387: 0 | T387: 0 | U387: 0 | V387: 0 | W387: =1-SUM(I387:V387) -> 0
I388: 0 | J388: 0 | K388: 0 | L388: 1 | M388: 0 | N388: 0 | O388: 0 | P388: 0 | Q388: 0 | R388: 0 | S388: 0 | T388: 0 | U388: 0 | V388: 0 | W388: =1-SUM(I388:V388) -> 0
I389: 0 | J389: 0 | K389: 0 | L389: 0 | M389: 0 | N389: 0 | O389: 1 | P389: 0 | Q389: 0 | R389: 0 | S389: 0 | T389: 0 | U389: 0 | V389: 0 | W389: =1-SUM(I389:V389) -> 0
I390: 0 | J390: 0 | K390: 0 | L390: 0 | M390: 0 | N390: 0 | O390: 1 | P390: 0 | Q390: 0 | R390: 0 | S390: 0 | T390: 0 | U390: 0 | V390: 0 | W390: =1-SUM(I390:V390) -> 0
I391: 0 | J391: 0 | K391: 0 | L391: 0 | M391: 0 | N391: 0 | O391: 1 | P391: 0 | Q391: 0 | R391: 0 | S391: 0 | T391: 0 | U391: 0 | V391: 0 | W391: =1-SUM(I391:V391) -> 0
I392: 0 | J392: 0 | K392: 0 | L392: 0 | M392: 0 | N392: 0 | O392: 1 | P392: 0 | Q392: 0 | R392: 0 | S392: 0 | T392: 0 | U392: 0 | V392: 0 | W392: =1-SUM(I392:V392) -> 0
I393: 0 | J393: 0 | K393: 0 | L393: 0 | M393: 0 | N393: 0 | O393: 1 | P393: 0 | Q393: 0 | R393: 0 | S393: 0 | T393: 0 | U393: 0 | V393: 0 | W393: =1-SUM(I393:V393) -> 0
I394: 0 | J394: 0 | K394: 0 | L394: 0 | M394: 0 | N394: 0 | O394: 1 | P394: 0 | Q394: 0 | R394: 0 | S394: 0 | T394: 0 | U394: 0 | V394: 0 | W394: =1-SUM(I394:V394) -> 0
I395: 0 | J395: 0 | K395: 0 | L395: 0 | M395: 0 | N395: 0 | O395: 1 | P395: 0 | Q395: 0 | R395: 0 | S395: 0 | T395: 0 | U395: 0 | V395: 0 | W395: =1-SUM(I395:V395) -> 0
I396: 0 | J396: 0 | K396: 0 | L396: 1 | M396: 0 | N396: 0 | O396: 0 | P396: 0 | Q396: 0 | R396: 0 | S396: 0 | T396: 0 | U396: 0 | V396: 0 | W396: =1-SUM(I396:V396) -> 0
I397: =SUM(I3:I396) -> 1 | J397: =SUM(J3:J396) -> 4 | K397: =SUM(K3:K396) -> 5 | L397: =SUM(L3:L396) -> 26 | M397: =SUM(M3:M396) -> 24 | N397: =SUM(N3:N396) -> 161 | O397: =SUM(O3:O396) -> 126 | P397: =SUM(P3:P396) -> 13 | Q397: =SUM(Q3:Q396) -> 1 | R397: =SUM(R3:R396) -> 6 | S397: =SUM(S3:S396) -> 8 | T397: =SUM(T3:T396) -> 8 | U397: =SUM(U3:U396) -> 0 | V397: =SUM(V3:V396) -> 4 | W397: =SUM(W3:W396) -> 7