A1: Suddivisione Corsi per Facoltà
H2: Architettura | I2: Economia | J2: Ingegneria | K2: Interfacoltà | L2: Medicina | M2: Scienze MFN | N2: Scienze statistiche | O2: Sociologia
A3: Facoltà | B3: Numero corsi | G3: =SUM(H3:O3) -> 394 | H3: =SUM(H4:H397) -> 1 | I3: =SUM(I4:I397) -> 60 | J3: =SUM(J4:J397) -> 216 | K3: =SUM(K4:K397) -> 2 | L3: =SUM(L4:L397) -> 1 | M3: =SUM(M4:M397) -> 98 | N3: =SUM(N4:N397) -> 14 | O3: =SUM(O4:O397) -> 2
A4: Architettura | B4: =H3 -> 1 | H4: 0 | I4: 0 | J4: 1 | K4: 0 | L4: 0 | M4: 0 | N4: 0 | O4: 0
A5: Economia | B5: =I3 -> 60 | H5: 0 | I5: 0 | J5: 1 | K5: 0 | L5: 0 | M5: 0 | N5: 0 | O5: 0
A6: Ingegneria | B6: =J3 -> 216 | H6: 0 | I6: 0 | J6: 1 | K6: 0 | L6: 0 | M6: 0 | N6: 0 | O6: 0
A7: Interfacoltà | B7: =K3 -> 2 | H7: 0 | I7: 0 | J7: 1 | K7: 0 | L7: 0 | M7: 0 | N7: 0 | O7: 0
A8: Medicina | B8: =L3 -> 1 | H8: 0 | I8: 0 | J8: 0 | K8: 0 | L8: 1 | M8: 0 | N8: 0 | O8: 0
A9: Scienze MFN | B9: =M3 -> 98 | H9: 0 | I9: 0 | J9: 0 | K9: 0 | L9: 0 | M9: 1 | N9: 0 | O9: 0
A10: Scienze Statistiche | B10: =N3 -> 14 | H10: 0 | I10: 0 | J10: 0 | K10: 0 | L10: 0 | M10: 1 | N10: 0 | O10: 0
A11: Sociologia | B11: =O3 -> 2 | H11: 0 | I11: 0 | J11: 0 | K11: 0 | L11: 0 | M11: 1 | N11: 0 | O11: 0
A12: Totale | B12: =SUM(B4:B11) -> 394 | H12: 0 | I12: 0 | J12: 0 | K12: 0 | L12: 0 | M12: 1 | N12: 0 | O12: 0
H13: 0 | I13: 0 | J13: 0 | K13: 0 | L13: 0 | M13: 0 | N13: 1 | O13: 0
H14: 0 | I14: 0 | J14: 0 | K14: 0 | L14: 0 | M14: 0 | N14: 1 | O14: 0
H15: 0 | I15: 0 | J15: 0 | K15: 0 | L15: 0 | M15: 0 | N15: 1 | O15: 0
H16: 0 | I16: 0 | J16: 0 | K16: 0 | L16: 0 | M16: 0 | N16: 1 | O16: 0
H17: 0 | I17: 1 | J17: 0 | K17: 0 | L17: 0 | M17: 0 | N17: 0 | O17: 0
H18: 0 | I18: 1 | J18: 0 | K18: 0 | L18: 0 | M18: 0 | N18: 0 | O18: 0
H19: 0 | I19: 1 | J19: 0 | K19: 0 | L19: 0 | M19: 0 | N19: 0 | O19: 0
H20: 0 | I20: 1 | J20: 0 | K20: 0 | L20: 0 | M20: 0 | N20: 0 | O20: 0
H21: 0 | I21: 1 | J21: 0 | K21: 0 | L21: 0 | M21: 0 | N21: 0 | O21: 0
H22: 0 | I22: 1 | J22: 0 | K22: 0 | L22: 0 | M22: 0 | N22: 0 | O22: 0
H23: 0 | I23: 1 | J23: 0 | K23: 0 | L23: 0 | M23: 0 | N23: 0 | O23: 0
H24: 0 | I24: 1 | J24: 0 | K24: 0 | L24: 0 | M24: 0 | N24: 0 | O24: 0
H25: 0 | I25: 0 | J25: 0 | K25: 0 | L25: 0 | M25: 1 | N25: 0 | O25: 0
H26: 0 | I26: 0 | J26: 0 | K26: 0 | L26: 0 | M26: 1 | N26: 0 | O26: 0
H27: 0 | I27: 1 | J27: 0 | K27: 0 | L27: 0 | M27: 0 | N27: 0 | O27: 0
H28: 0 | I28: 1 | J28: 0 | K28: 0 | L28: 0 | M28: 0 | N28: 0 | O28: 0
H29: 0 | I29: 0 | J29: 0 | K29: 0 | L29: 0 | M29: 1 | N29: 0 | O29: 0
H30: 0 | I30: 0 | J30: 0 | K30: 0 | L30: 0 | M30: 1 | N30: 0 | O30: 0
H31: 0 | I31: 0 | J31: 0 | K31: 0 | L31: 0 | M31: 1 | N31: 0 | O31: 0
H32: 0 | I32: 0 | J32: 0 | K32: 0 | L32: 0 | M32: 1 | N32: 0 | O32: 0
H33: 0 | I33: 0 | J33: 0 | K33: 0 | L33: 0 | M33: 1 | N33: 0 | O33: 0
H34: 0 | I34: 0 | J34: 0 | K34: 0 | L34: 0 | M34: 1 | N34: 0 | O34: 0
H35: 0 | I35: 0 | J35: 0 | K35: 1 | L35: 0 | M35: 0 | N35: 0 | O35: 0
H36: 0 | I36: 0 | J36: 1 | K36: 0 | L36: 0 | M36: 0 | N36: 0 | O36: 0
H37: 0 | I37: 1 | J37: 0 | K37: 0 | L37: 0 | M37: 0 | N37: 0 | O37: 0
H38: 0 | I38: 1 | J38: 0 | K38: 0 | L38: 0 | M38: 0 | N38: 0 | O38: 0
H39: 0 | I39: 1 | J39: 0 | K39: 0 | L39: 0 | M39: 0 | N39: 0 | O39: 0
H40: 0 | I40: 1 | J40: 0 | K40: 0 | L40: 0 | M40: 0 | N40: 0 | O40: 0
H41: 0 | I41: 1 | J41: 0 | K41: 0 | L41: 0 | M41: 0 | N41: 0 | O41: 0
H42: 0 | I42: 0 | J42: 0 | K42: 0 | L42: 0 | M42: 0 | N42: 0 | O42: 1
H43: 0 | I43: 0 | J43: 0 | K43: 0 | L43: 0 | M43: 0 | N43: 0 | O43: 1
H44: 0 | I44: 0 | J44: 0 | K44: 0 | L44: 0 | M44: 1 | N44: 0 | O44: 0
H45: 0 | I45: 0 | J45: 1 | K45: 0 | L45: 0 | M45: 0 | N45: 0 | O45: 0
H46: 0 | I46: 1 | J46: 0 | K46: 0 | L46: 0 | M46: 0 | N46: 0 | O46: 0
H47: 0 | I47: 1 | J47: 0 | K47: 0 | L47: 0 | M47: 0 | N47: 0 | O47: 0
H48: 0 | I48: 1 | J48: 0 | K48: 0 | L48: 0 | M48: 0 | N48: 0 | O48: 0
H49: 0 | I49: 1 | J49: 0 | K49: 0 | L49: 0 | M49: 0 | N49: 0 | O49: 0
H50: 0 | I50: 1 | J50: 0 | K50: 0 | L50: 0 | M50: 0 | N50: 0 | O50: 0
H51: 0 | I51: 1 | J51: 0 | K51: 0 | L51: 0 | M51: 0 | N51: 0 | O51: 0
H52: 0 | I52: 1 | J52: 0 | K52: 0 | L52: 0 | M52: 0 | N52: 0 | O52: 0
H53: 0 | I53: 1 | J53: 0 | K53: 0 | L53: 0 | M53: 0 | N53: 0 | O53: 0
H54: 0 | I54: 1 | J54: 0 | K54: 0 | L54: 0 | M54: 0 | N54: 0 | O54: 0
H55: 0 | I55: 1 | J55: 0 | K55: 0 | L55: 0 | M55: 0 | N55: 0 | O55: 0
H56: 0 | I56: 1 | J56: 0 | K56: 0 | L56: 0 | M56: 0 | N56: 0 | O56: 0
H57: 0 | I57: 0 | J57: 0 | K57: 0 | L57: 0 | M57: 1 | N57: 0 | O57: 0
H58: 0 | I58: 0 | J58: 0 | K58: 0 | L58: 0 | M58: 1 | N58: 0 | O58: 0
H59: 0 | I59: 0 | J59: 0 | K59: 0 | L59: 0 | M59: 1 | N59: 0 | O59: 0
H60: 0 | I60: 0 | J60: 0 | K60: 0 | L60: 0 | M60: 1 | N60: 0 | O60: 0
H61: 0 | I61: 0 | J61: 0 | K61: 0 | L61: 0 | M61: 1 | N61: 0 | O61: 0
H62: 0 | I62: 0 | J62: 0 | K62: 0 | L62: 0 | M62: 1 | N62: 0 | O62: 0
H63: 0 | I63: 0 | J63: 0 | K63: 0 | L63: 0 | M63: 1 | N63: 0 | O63: 0
H64: 0 | I64: 0 | J64: 0 | K64: 0 | L64: 0 | M64: 1 | N64: 0 | O64: 0
H65: 0 | I65: 0 | J65: 0 | K65: 0 | L65: 0 | M65: 1 | N65: 0 | O65: 0
H66: 0 | I66: 0 | J66: 0 | K66: 0 | L66: 0 | M66: 1 | N66: 0 | O66: 0
H67: 0 | I67: 1 | J67: 0 | K67: 0 | L67: 0 | M67: 0 | N67: 0 | O67: 0
H68: 0 | I68: 1 | J68: 0 | K68: 0 | L68: 0 | M68: 0 | N68: 0 | O68: 0
H69: 0 | I69: 0 | J69: 0 | K69: 0 | L69: 0 | M69: 1 | N69: 0 | O69: 0
H70: 0 | I70: 0 | J70: 0 | K70: 0 | L70: 0 | M70: 1 | N70: 0 | O70: 0
H71: 0 | I71: 0 | J71: 0 | K71: 0 | L71: 0 | M71: 1 | N71: 0 | O71: 0
H72: 0 | I72: 0 | J72: 0 | K72: 0 | L72: 0 | M72: 1 | N72: 0 | O72: 0
H73: 0 | I73: 0 | J73: 0 | K73: 0 | L73: 0 | M73: 1 | N73: 0 | O73: 0
H74: 0 | I74: 0 | J74: 1 | K74: 0 | L74: 0 | M74: 0 | N74: 0 | O74: 0
H75: 0 | I75: 0 | J75: 1 | K75: 0 | L75: 0 | M75: 0 | N75: 0 | O75: 0
H76: 0 | I76: 0 | J76: 1 | K76: 0 | L76: 0 | M76: 0 | N76: 0 | O76: 0
H77: 0 | I77: 0 | J77: 1 | K77: 0 | L77: 0 | M77: 0 | N77: 0 | O77: 0
H78: 0 | I78: 0 | J78: 1 | K78: 0 | L78: 0 | M78: 0 | N78: 0 | O78: 0
H79: 0 | I79: 0 | J79: 1 | K79: 0 | L79: 0 | M79: 0 | N79: 0 | O79: 0
H80: 0 | I80: 0 | J80: 1 | K80: 0 | L80: 0 | M80: 0 | N80: 0 | O80: 0
H81: 0 | I81: 0 | J81: 1 | K81: 0 | L81: 0 | M81: 0 | N81: 0 | O81: 0
H82: 0 | I82: 0 | J82: 1 | K82: 0 | L82: 0 | M82: 0 | N82: 0 | O82: 0
H83: 0 | I83: 0 | J83: 1 | K83: 0 | L83: 0 | M83: 0 | N83: 0 | O83: 0
H84: 0 | I84: 0 | J84: 1 | K84: 0 | L84: 0 | M84: 0 | N84: 0 | O84: 0
H85: 0 | I85: 0 | J85: 1 | K85: 0 | L85: 0 | M85: 0 | N85: 0 | O85: 0
H86: 0 | I86: 0 | J86: 1 | K86: 0 | L86: 0 | M86: 0 | N86: 0 | O86: 0
H87: 0 | I87: 0 | J87: 1 | K87: 0 | L87: 0 | M87: 0 | N87: 0 | O87: 0
H88: 0 | I88: 0 | J88: 1 | K88: 0 | L88: 0 | M88: 0 | N88: 0 | O88: 0
H89: 0 | I89: 0 | J89: 1 | K89: 0 | L89: 0 | M89: 0 | N89: 0 | O89: 0
H90: 0 | I90: 0 | J90: 1 | K90: 0 | L90: 0 | M90: 0 | N90: 0 | O90: 0
H91: 0 | I91: 0 | J91: 1 | K91: 0 | L91: 0 | M91: 0 | N91: 0 | O91: 0
H92: 0 | I92: 0 | J92: 1 | K92: 0 | L92: 0 | M92: 0 | N92: 0 | O92: 0
H93: 0 | I93: 0 | J93: 1 | K93: 0 | L93: 0 | M93: 0 | N93: 0 | O93: 0
H94: 0 | I94: 0 | J94: 1 | K94: 0 | L94: 0 | M94: 0 | N94: 0 | O94: 0
H95: 0 | I95: 0 | J95: 0 | K95: 0 | L95: 0 | M95: 1 | N95: 0 | O95: 0
H96: 0 | I96: 0 | J96: 0 | K96: 0 | L96: 0 | M96: 1 | N96: 0 | O96: 0
H97: 0 | I97: 0 | J97: 0 | K97: 0 | L97: 0 | M97: 1 | N97: 0 | O97: 0
H98: 0 | I98: 0 | J98: 0 | K98: 0 | L98: 0 | M98: 1 | N98: 0 | O98: 0
H99: 0 | I99: 0 | J99: 0 | K99: 0 | L99: 0 | M99: 1 | N99: 0 | O99: 0
H100: 0 | I100: 0 | J100: 0 | K100: 0 | L100: 0 | M100: 1 | N100: 0 | O100: 0
H101: 0 | I101: 0 | J101: 0 | K101: 0 | L101: 0 | M101: 1 | N101: 0 | O101: 0
H102: 0 | I102: 0 | J102: 0 | K102: 0 | L102: 0 | M102: 1 | N102: 0 | O102: 0
H103: 1 | I103: 0 | J103: 0 | K103: 0 | L103: 0 | M103: 0 | N103: 0 | O103: 0
H104: 0 | I104: 0 | J104: 1 | K104: 0 | L104: 0 | M104: 0 | N104: 0 | O104: 0
H105: 0 | I105: 0 | J105: 1 | K105: 0 | L105: 0 | M105: 0 | N105: 0 | O105: 0
H106: 0 | I106: 0 | J106: 1 | K106: 0 | L106: 0 | M106: 0 | N106: 0 | O106: 0
H107: 0 | I107: 0 | J107: 1 | K107: 0 | L107: 0 | M107: 0 | N107: 0 | O107: 0
H108: 0 | I108: 0 | J108: 1 | K108: 0 | L108: 0 | M108: 0 | N108: 0 | O108: 0
H109: 0 | I109: 0 | J109: 1 | K109: 0 | L109: 0 | M109: 0 | N109: 0 | O109: 0
H110: 0 | I110: 0 | J110: 1 | K110: 0 | L110: 0 | M110: 0 | N110: 0 | O110: 0
H111: 0 | I111: 0 | J111: 1 | K111: 0 | L111: 0 | M111: 0 | N111: 0 | O111: 0
H112: 0 | I112: 0 | J112: 1 | K112: 0 | L112: 0 | M112: 0 | N112: 0 | O112: 0
H113: 0 | I113: 0 | J113: 1 | K113: 0 | L113: 0 | M113: 0 | N113: 0 | O113: 0
H114: 0 | I114: 0 | J114: 1 | K114: 0 | L114: 0 | M114: 0 | N114: 0 | O114: 0
H115: 0 | I115: 1 | J115: 0 | K115: 0 | L115: 0 | M115: 0 | N115: 0 | O115: 0
H116: 0 | I116: 0 | J116: 0 | K116: 0 | L116: 0 | M116: 1 | N116: 0 | O116: 0
H117: 0 | I117: 0 | J117: 0 | K117: 0 | L117: 0 | M117: 1 | N117: 0 | O117: 0
H118: 0 | I118: 0 | J118: 0 | K118: 0 | L118: 0 | M118: 1 | N118: 0 | O118: 0
H119: 0 | I119: 0 | J119: 0 | K119: 0 | L119: 0 | M119: 1 | N119: 0 | O119: 0
H120: 0 | I120: 0 | J120: 0 | K120: 0 | L120: 0 | M120: 1 | N120: 0 | O120: 0
H121: 0 | I121: 0 | J121: 0 | K121: 0 | L121: 0 | M121: 1 | N121: 0 | O121: 0
H122: 0 | I122: 0 | J122: 0 | K122: 0 | L122: 0 | M122: 1 | N122: 0 | O122: 0
H123: 0 | I123: 1 | J123: 0 | K123: 0 | L123: 0 | M123: 0 | N123: 0 | O123: 0
H124: 0 | I124: 1 | J124: 0 | K124: 0 | L124: 0 | M124: 0 | N124: 0 | O124: 0
H125: 0 | I125: 1 | J125: 0 | K125: 0 | L125: 0 | M125: 0 | N125: 0 | O125: 0
H126: 0 | I126: 1 | J126: 0 | K126: 0 | L126: 0 | M126: 0 | N126: 0 | O126: 0
H127: 0 | I127: 0 | J127: 1 | K127: 0 | L127: 0 | M127: 0 | N127: 0 | O127: 0
H128: 0 | I128: 0 | J128: 1 | K128: 0 | L128: 0 | M128: 0 | N128: 0 | O128: 0
H129: 0 | I129: 0 | J129: 1 | K129: 0 | L129: 0 | M129: 0 | N129: 0 | O129: 0
H130: 0 | I130: 0 | J130: 1 | K130: 0 | L130: 0 | M130: 0 | N130: 0 | O130: 0
H131: 0 | I131: 0 | J131: 1 | K131: 0 | L131: 0 | M131: 0 | N131: 0 | O131: 0
H132: 0 | I132: 0 | J132: 1 | K132: 0 | L132: 0 | M132: 0 | N132: 0 | O132: 0
H133: 0 | I133: 0 | J133: 1 | K133: 0 | L133: 0 | M133: 0 | N133: 0 | O133: 0
H134: 0 | I134: 0 | J134: 1 | K134: 0 | L134: 0 | M134: 0 | N134: 0 | O134: 0
H135: 0 | I135: 0 | J135: 1 | K135: 0 | L135: 0 | M135: 0 | N135: 0 | O135: 0
H136: 0 | I136: 0 | J136: 1 | K136: 0 | L136: 0 | M136: 0 | N136: 0 | O136: 0
H137: 0 | I137: 0 | J137: 1 | K137: 0 | L137: 0 | M137: 0 | N137: 0 | O137: 0
H138: 0 | I138: 0 | J138: 1 | K138: 0 | L138: 0 | M138: 0 | N138: 0 | O138: 0
H139: 0 | I139: 0 | J139: 1 | K139: 0 | L139: 0 | M139: 0 | N139: 0 | O139: 0
H140: 0 | I140: 0 | J140: 1 | K140: 0 | L140: 0 | M140: 0 | N140: 0 | O140: 0
H141: 0 | I141: 1 | J141: 0 | K141: 0 | L141: 0 | M141: 0 | N141: 0 | O141: 0
H142: 0 | I142: 1 | J142: 0 | K142: 0 | L142: 0 | M142: 0 | N142: 0 | O142: 0
H143: 0 | I143: 1 | J143: 0 | K143: 0 | L143: 0 | M143: 0 | N143: 0 | O143: 0
H144: 0 | I144: 1 | J144: 0 | K144: 0 | L144: 0 | M144: 0 | N144: 0 | O144: 0
H145: 0 | I145: 0 | J145: 0 | K145: 0 | L145: 0 | M145: 1 | N145: 0 | O145: 0
H146: 0 | I146: 0 | J146: 0 | K146: 0 | L146: 0 | M146: 1 | N146: 0 | O146: 0
H147: 0 | I147: 0 | J147: 0 | K147: 0 | L147: 0 | M147: 1 | N147: 0 | O147: 0
H148: 0 | I148: 0 | J148: 0 | K148: 0 | L148: 0 | M148: 1 | N148: 0 | O148: 0
H149: 0 | I149: 0 | J149: 0 | K149: 0 | L149: 0 | M149: 1 | N149: 0 | O149: 0
H150: 0 | I150: 0 | J150: 0 | K150: 0 | L150: 0 | M150: 1 | N150: 0 | O150: 0
H151: 0 | I151: 0 | J151: 0 | K151: 0 | L151: 0 | M151: 1 | N151: 0 | O151: 0
H152: 0 | I152: 0 | J152: 0 | K152: 0 | L152: 0 | M152: 1 | N152: 0 | O152: 0
H153: 0 | I153: 0 | J153: 1 | K153: 0 | L153: 0 | M153: 0 | N153: 0 | O153: 0
H154: 0 | I154: 0 | J154: 1 | K154: 0 | L154: 0 | M154: 0 | N154: 0 | O154: 0
H155: 0 | I155: 0 | J155: 1 | K155: 0 | L155: 0 | M155: 0 | N155: 0 | O155: 0
H156: 0 | I156: 0 | J156: 1 | K156: 0 | L156: 0 | M156: 0 | N156: 0 | O156: 0
H157: 0 | I157: 0 | J157: 1 | K157: 0 | L157: 0 | M157: 0 | N157: 0 | O157: 0
H158: 0 | I158: 0 | J158: 1 | K158: 0 | L158: 0 | M158: 0 | N158: 0 | O158: 0
H159: 0 | I159: 0 | J159: 1 | K159: 0 | L159: 0 | M159: 0 | N159: 0 | O159: 0
H160: 0 | I160: 0 | J160: 1 | K160: 0 | L160: 0 | M160: 0 | N160: 0 | O160: 0
H161: 0 | I161: 0 | J161: 1 | K161: 0 | L161: 0 | M161: 0 | N161: 0 | O161: 0
H162: 0 | I162: 0 | J162: 1 | K162: 0 | L162: 0 | M162: 0 | N162: 0 | O162: 0
H163: 0 | I163: 0 | J163: 1 | K163: 0 | L163: 0 | M163: 0 | N163: 0 | O163: 0
H164: 0 | I164: 0 | J164: 1 | K164: 0 | L164: 0 | M164: 0 | N164: 0 | O164: 0
H165: 0 | I165: 0 | J165: 1 | K165: 0 | L165: 0 | M165: 0 | N165: 0 | O165: 0
H166: 0 | I166: 0 | J166: 1 | K166: 0 | L166: 0 | M166: 0 | N166: 0 | O166: 0
H167: 0 | I167: 0 | J167: 0 | K167: 0 | L167: 0 | M167: 1 | N167: 0 | O167: 0
H168: 0 | I168: 0 | J168: 0 | K168: 0 | L168: 0 | M168: 1 | N168: 0 | O168: 0
H169: 0 | I169: 0 | J169: 0 | K169: 0 | L169: 0 | M169: 1 | N169: 0 | O169: 0
H170: 0 | I170: 0 | J170: 0 | K170: 0 | L170: 0 | M170: 1 | N170: 0 | O170: 0
H171: 0 | I171: 1 | J171: 0 | K171: 0 | L171: 0 | M171: 0 | N171: 0 | O171: 0
H172: 0 | I172: 1 | J172: 0 | K172: 0 | L172: 0 | M172: 0 | N172: 0 | O172: 0
H173: 0 | I173: 0 | J173: 1 | K173: 0 | L173: 0 | M173: 0 | N173: 0 | O173: 0
H174: 0 | I174: 0 | J174: 1 | K174: 0 | L174: 0 | M174: 0 | N174: 0 | O174: 0
H175: 0 | I175: 0 | J175: 1 | K175: 0 | L175: 0 | M175: 0 | N175: 0 | O175: 0
H176: 0 | I176: 0 | J176: 1 | K176: 0 | L176: 0 | M176: 0 | N176: 0 | O176: 0
H177: 0 | I177: 0 | J177: 1 | K177: 0 | L177: 0 | M177: 0 | N177: 0 | O177: 0
H178: 0 | I178: 0 | J178: 1 | K178: 0 | L178: 0 | M178: 0 | N178: 0 | O178: 0
H179: 0 | I179: 0 | J179: 1 | K179: 0 | L179: 0 | M179: 0 | N179: 0 | O179: 0
H180: 0 | I180: 0 | J180: 1 | K180: 0 | L180: 0 | M180: 0 | N180: 0 | O180: 0
H181: 0 | I181: 0 | J181: 1 | K181: 0 | L181: 0 | M181: 0 | N181: 0 | O181: 0
H182: 0 | I182: 0 | J182: 1 | K182: 0 | L182: 0 | M182: 0 | N182: 0 | O182: 0
H183: 0 | I183: 0 | J183: 1 | K183: 0 | L183: 0 | M183: 0 | N183: 0 | O183: 0
H184: 0 | I184: 0 | J184: 1 | K184: 0 | L184: 0 | M184: 0 | N184: 0 | O184: 0
H185: 0 | I185: 0 | J185: 1 | K185: 0 | L185: 0 | M185: 0 | N185: 0 | O185: 0
H186: 0 | I186: 0 | J186: 1 | K186: 0 | L186: 0 | M186: 0 | N186: 0 | O186: 0
H187: 0 | I187: 0 | J187: 1 | K187: 0 | L187: 0 | M187: 0 | N187: 0 | O187: 0
H188: 0 | I188: 0 | J188: 0 | K188: 0 | L188: 0 | M188: 1 | N188: 0 | O188: 0
H189: 0 | I189: 0 | J189: 0 | K189: 0 | L189: 0 | M189: 1 | N189: 0 | O189: 0
H190: 0 | I190: 0 | J190: 0 | K190: 0 | L190: 0 | M190: 1 | N190: 0 | O190: 0
H191: 0 | I191: 0 | J191: 0 | K191: 0 | L191: 0 | M191: 1 | N191: 0 | O191: 0
H192: 0 | I192: 0 | J192: 0 | K192: 0 | L192: 0 | M192: 1 | N192: 0 | O192: 0
H193: 0 | I193: 0 | J193: 0 | K193: 0 | L193: 0 | M193: 1 | N193: 0 | O193: 0
H194: 0 | I194: 0 | J194: 0 | K194: 0 | L194: 0 | M194: 1 | N194: 0 | O194: 0
H195: 0 | I195: 0 | J195: 1 | K195: 0 | L195: 0 | M195: 0 | N195: 0 | O195: 0
H196: 0 | I196: 0 | J196: 0 | K196: 0 | L196: 0 | M196: 1 | N196: 0 | O196: 0
H197: 0 | I197: 0 | J197: 0 | K197: 0 | L197: 0 | M197: 1 | N197: 0 | O197: 0
H198: 0 | I198: 0 | J198: 0 | K198: 0 | L198: 0 | M198: 1 | N198: 0 | O198: 0
H199: 0 | I199: 0 | J199: 1 | K199: 0 | L199: 0 | M199: 0 | N199: 0 | O199: 0
H200: 0 | I200: 0 | J200: 1 | K200: 0 | L200: 0 | M200: 0 | N200: 0 | O200: 0
H201: 0 | I201: 0 | J201: 1 | K201: 0 | L201: 0 | M201: 0 | N201: 0 | O201: 0
H202: 0 | I202: 0 | J202: 1 | K202: 0 | L202: 0 | M202: 0 | N202: 0 | O202: 0
H203: 0 | I203: 0 | J203: 1 | K203: 0 | L203: 0 | M203: 0 | N203: 0 | O203: 0
H204: 0 | I204: 0 | J204: 1 | K204: 0 | L204: 0 | M204: 0 | N204: 0 | O204: 0
H205: 0 | I205: 0 | J205: 1 | K205: 0 | L205: 0 | M205: 0 | N205: 0 | O205: 0
H206: 0 | I206: 0 | J206: 1 | K206: 0 | L206: 0 | M206: 0 | N206: 0 | O206: 0
H207: 0 | I207: 0 | J207: 1 | K207: 0 | L207: 0 | M207: 0 | N207: 0 | O207: 0
H208: 0 | I208: 0 | J208: 1 | K208: 0 | L208: 0 | M208: 0 | N208: 0 | O208: 0
H209: 0 | I209: 0 | J209: 0 | K209: 0 | L209: 0 | M209: 1 | N209: 0 | O209: 0
H210: 0 | I210: 1 | J210: 0 | K210: 0 | L210: 0 | M210: 0 | N210: 0 | O210: 0
H211: 0 | I211: 0 | J211: 1 | K211: 0 | L211: 0 | M211: 0 | N211: 0 | O211: 0
H212: 0 | I212: 0 | J212: 1 | K212: 0 | L212: 0 | M212: 0 | N212: 0 | O212: 0
H213: 0 | I213: 0 | J213: 1 | K213: 0 | L213: 0 | M213: 0 | N213: 0 | O213: 0
H214: 0 | I214: 0 | J214: 1 | K214: 0 | L214: 0 | M214: 0 | N214: 0 | O214: 0
H215: 0 | I215: 0 | J215: 1 | K215: 0 | L215: 0 | M215: 0 | N215: 0 | O215: 0
H216: 0 | I216: 0 | J216: 1 | K216: 0 | L216: 0 | M216: 0 | N216: 0 | O216: 0
H217: 0 | I217: 0 | J217: 1 | K217: 0 | L217: 0 | M217: 0 | N217: 0 | O217: 0
H218: 0 | I218: 0 | J218: 1 | K218: 0 | L218: 0 | M218: 0 | N218: 0 | O218: 0
H219: 0 | I219: 0 | J219: 0 | K219: 0 | L219: 0 | M219: 1 | N219: 0 | O219: 0
H220: 0 | I220: 0 | J220: 0 | K220: 0 | L220: 0 | M220: 1 | N220: 0 | O220: 0
H221: 0 | I221: 0 | J221: 0 | K221: 0 | L221: 0 | M221: 1 | N221: 0 | O221: 0
H222: 0 | I222: 0 | J222: 0 | K222: 0 | L222: 0 | M222: 1 | N222: 0 | O222: 0
H223: 0 | I223: 0 | J223: 1 | K223: 0 | L223: 0 | M223: 0 | N223: 0 | O223: 0
H224: 0 | I224: 0 | J224: 1 | K224: 0 | L224: 0 | M224: 0 | N224: 0 | O224: 0
H225: 0 | I225: 0 | J225: 1 | K225: 0 | L225: 0 | M225: 0 | N225: 0 | O225: 0
H226: 0 | I226: 0 | J226: 1 | K226: 0 | L226: 0 | M226: 0 | N226: 0 | O226: 0
H227: 0 | I227: 0 | J227: 0 | K227: 1 | L227: 0 | M227: 0 | N227: 0 | O227: 0
H228: 0 | I228: 0 | J228: 0 | K228: 0 | L228: 0 | M228: 1 | N228: 0 | O228: 0
H229: 0 | I229: 0 | J229: 0 | K229: 0 | L229: 0 | M229: 1 | N229: 0 | O229: 0
H230: 0 | I230: 0 | J230: 0 | K230: 0 | L230: 0 | M230: 1 | N230: 0 | O230: 0
H231: 0 | I231: 0 | J231: 0 | K231: 0 | L231: 0 | M231: 1 | N231: 0 | O231: 0
H232: 0 | I232: 0 | J232: 0 | K232: 0 | L232: 0 | M232: 1 | N232: 0 | O232: 0
H233: 0 | I233: 0 | J233: 0 | K233: 0 | L233: 0 | M233: 1 | N233: 0 | O233: 0
H234: 0 | I234: 0 | J234: 0 | K234: 0 | L234: 0 | M234: 1 | N234: 0 | O234: 0
H235: 0 | I235: 0 | J235: 0 | K235: 0 | L235: 0 | M235: 1 | N235: 0 | O235: 0
H236: 0 | I236: 0 | J236: 0 | K236: 0 | L236: 0 | M236: 1 | N236: 0 | O236: 0
H237: 0 | I237: 0 | J237: 0 | K237: 0 | L237: 0 | M237: 1 | N237: 0 | O237: 0
H238: 0 | I238: 0 | J238: 1 | K238: 0 | L238: 0 | M238: 0 | N238: 0 | O238: 0
H239: 0 | I239: 0 | J239: 1 | K239: 0 | L239: 0 | M239: 0 | N239: 0 | O239: 0
H240: 0 | I240: 0 | J240: 1 | K240: 0 | L240: 0 | M240: 0 | N240: 0 | O240: 0
H241: 0 | I241: 0 | J241: 1 | K241: 0 | L241: 0 | M241: 0 | N241: 0 | O241: 0
H242: 0 | I242: 0 | J242: 1 | K242: 0 | L242: 0 | M242: 0 | N242: 0 | O242: 0
H243: 0 | I243: 1 | J243: 0 | K243: 0 | L243: 0 | M243: 0 | N243: 0 | O243: 0
H244: 0 | I244: 1 | J244: 0 | K244: 0 | L244: 0 | M244: 0 | N244: 0 | O244: 0
H245: 0 | I245: 1 | J245: 0 | K245: 0 | L245: 0 | M245: 0 | N245: 0 | O245: 0
H246: 0 | I246: 1 | J246: 0 | K246: 0 | L246: 0 | M246: 0 | N246: 0 | O246: 0
H247: 0 | I247: 0 | J247: 1 | K247: 0 | L247: 0 | M247: 0 | N247: 0 | O247: 0
H248: 0 | I248: 0 | J248: 1 | K248: 0 | L248: 0 | M248: 0 | N248: 0 | O248: 0
H249: 0 | I249: 0 | J249: 1 | K249: 0 | L249: 0 | M249: 0 | N249: 0 | O249: 0
H250: 0 | I250: 0 | J250: 1 | K250: 0 | L250: 0 | M250: 0 | N250: 0 | O250: 0
H251: 0 | I251: 0 | J251: 1 | K251: 0 | L251: 0 | M251: 0 | N251: 0 | O251: 0
H252: 0 | I252: 0 | J252: 1 | K252: 0 | L252: 0 | M252: 0 | N252: 0 | O252: 0
H253: 0 | I253: 0 | J253: 1 | K253: 0 | L253: 0 | M253: 0 | N253: 0 | O253: 0
H254: 0 | I254: 0 | J254: 1 | K254: 0 | L254: 0 | M254: 0 | N254: 0 | O254: 0
H255: 0 | I255: 0 | J255: 1 | K255: 0 | L255: 0 | M255: 0 | N255: 0 | O255: 0
H256: 0 | I256: 0 | J256: 1 | K256: 0 | L256: 0 | M256: 0 | N256: 0 | O256: 0
H257: 0 | I257: 0 | J257: 1 | K257: 0 | L257: 0 | M257: 0 | N257: 0 | O257: 0
H258: 0 | I258: 0 | J258: 1 | K258: 0 | L258: 0 | M258: 0 | N258: 0 | O258: 0
H259: 0 | I259: 0 | J259: 1 | K259: 0 | L259: 0 | M259: 0 | N259: 0 | O259: 0
H260: 0 | I260: 0 | J260: 1 | K260: 0 | L260: 0 | M260: 0 | N260: 0 | O260: 0
H261: 0 | I261: 0 | J261: 1 | K261: 0 | L261: 0 | M261: 0 | N261: 0 | O261: 0
H262: 0 | I262: 0 | J262: 1 | K262: 0 | L262: 0 | M262: 0 | N262: 0 | O262: 0
H263: 0 | I263: 0 | J263: 1 | K263: 0 | L263: 0 | M263: 0 | N263: 0 | O263: 0
H264: 0 | I264: 0 | J264: 0 | K264: 0 | L264: 0 | M264: 0 | N264: 1 | O264: 0
H265: 0 | I265: 0 | J265: 0 | K265: 0 | L265: 0 | M265: 0 | N265: 1 | O265: 0
H266: 0 | I266: 0 | J266: 0 | K266: 0 | L266: 0 | M266: 0 | N266: 1 | O266: 0
H267: 0 | I267: 0 | J267: 0 | K267: 0 | L267: 0 | M267: 0 | N267: 1 | O267: 0
H268: 0 | I268: 0 | J268: 0 | K268: 0 | L268: 0 | M268: 0 | N268: 1 | O268: 0
H269: 0 | I269: 0 | J269: 0 | K269: 0 | L269: 0 | M269: 0 | N269: 1 | O269: 0
H270: 0 | I270: 0 | J270: 0 | K270: 0 | L270: 0 | M270: 0 | N270: 1 | O270: 0
H271: 0 | I271: 0 | J271: 0 | K271: 0 | L271: 0 | M271: 0 | N271: 1 | O271: 0
H272: 0 | I272: 0 | J272: 0 | K272: 0 | L272: 0 | M272: 0 | N272: 1 | O272: 0
H273: 0 | I273: 0 | J273: 1 | K273: 0 | L273: 0 | M273: 0 | N273: 0 | O273: 0
H274: 0 | I274: 0 | J274: 1 | K274: 0 | L274: 0 | M274: 0 | N274: 0 | O274: 0
H275: 0 | I275: 0 | J275: 1 | K275: 0 | L275: 0 | M275: 0 | N275: 0 | O275: 0
H276: 0 | I276: 0 | J276: 1 | K276: 0 | L276: 0 | M276: 0 | N276: 0 | O276: 0
H277: 0 | I277: 0 | J277: 1 | K277: 0 | L277: 0 | M277: 0 | N277: 0 | O277: 0
H278: 0 | I278: 0 | J278: 1 | K278: 0 | L278: 0 | M278: 0 | N278: 0 | O278: 0
H279: 0 | I279: 0 | J279: 1 | K279: 0 | L279: 0 | M279: 0 | N279: 0 | O279: 0
H280: 0 | I280: 0 | J280: 1 | K280: 0 | L280: 0 | M280: 0 | N280: 0 | O280: 0
H281: 0 | I281: 0 | J281: 1 | K281: 0 | L281: 0 | M281: 0 | N281: 0 | O281: 0
H282: 0 | I282: 0 | J282: 1 | K282: 0 | L282: 0 | M282: 0 | N282: 0 | O282: 0
H283: 0 | I283: 0 | J283: 1 | K283: 0 | L283: 0 | M283: 0 | N283: 0 | O283: 0
H284: 0 | I284: 0 | J284: 1 | K284: 0 | L284: 0 | M284: 0 | N284: 0 | O284: 0
H285: 0 | I285: 0 | J285: 1 | K285: 0 | L285: 0 | M285: 0 | N285: 0 | O285: 0
H286: 0 | I286: 0 | J286: 1 | K286: 0 | L286: 0 | M286: 0 | N286: 0 | O286: 0
H287: 0 | I287: 0 | J287: 1 | K287: 0 | L287: 0 | M287: 0 | N287: 0 | O287: 0
H288: 0 | I288: 0 | J288: 1 | K288: 0 | L288: 0 | M288: 0 | N288: 0 | O288: 0
H289: 0 | I289: 0 | J289: 1 | K289: 0 | L289: 0 | M289: 0 | N289: 0 | O289: 0
H290: 0 | I290: 0 | J290: 1 | K290: 0 | L290: 0 | M290: 0 | N290: 0 | O290: 0
H291: 0 | I291: 0 | J291: 1 | K291: 0 | L291: 0 | M291: 0 | N291: 0 | O291: 0
H292: 0 | I292: 0 | J292: 1 | K292: 0 | L292: 0 | M292: 0 | N292: 0 | O292: 0
H293: 0 | I293: 0 | J293: 1 | K293: 0 | L293: 0 | M293: 0 | N293: 0 | O293: 0
H294: 0 | I294: 1 | J294: 0 | K294: 0 | L294: 0 | M294: 0 | N294: 0 | O294: 0
H295: 0 | I295: 0 | J295: 1 | K295: 0 | L295: 0 | M295: 0 | N295: 0 | O295: 0
H296: 0 | I296: 0 | J296: 1 | K296: 0 | L296: 0 | M296: 0 | N296: 0 | O296: 0
H297: 0 | I297: 0 | J297: 1 | K297: 0 | L297: 0 | M297: 0 | N297: 0 | O297: 0
H298: 0 | I298: 0 | J298: 1 | K298: 0 | L298: 0 | M298: 0 | N298: 0 | O298: 0
H299: 0 | I299: 0 | J299: 1 | K299: 0 | L299: 0 | M299: 0 | N299: 0 | O299: 0
H300: 0 | I300: 0 | J300: 1 | K300: 0 | L300: 0 | M300: 0 | N300: 0 | O300: 0
H301: 0 | I301: 0 | J301: 1 | K301: 0 | L301: 0 | M301: 0 | N301: 0 | O301: 0
H302: 0 | I302: 0 | J302: 1 | K302: 0 | L302: 0 | M302: 0 | N302: 0 | O302: 0
H303: 0 | I303: 0 | J303: 0 | K303: 0 | L303: 0 | M303: 1 | N303: 0 | O303: 0
H304: 0 | I304: 0 | J304: 0 | K304: 0 | L304: 0 | M304: 1 | N304: 0 | O304: 0
H305: 0 | I305: 0 | J305: 0 | K305: 0 | L305: 0 | M305: 1 | N305: 0 | O305: 0
H306: 0 | I306: 0 | J306: 0 | K306: 0 | L306: 0 | M306: 1 | N306: 0 | O306: 0
H307: 0 | I307: 0 | J307: 0 | K307: 0 | L307: 0 | M307: 1 | N307: 0 | O307: 0
H308: 0 | I308: 0 | J308: 0 | K308: 0 | L308: 0 | M308: 1 | N308: 0 | O308: 0
H309: 0 | I309: 0 | J309: 0 | K309: 0 | L309: 0 | M309: 1 | N309: 0 | O309: 0
H310: 0 | I310: 0 | J310: 0 | K310: 0 | L310: 0 | M310: 0 | N310: 1 | O310: 0
H311: 0 | I311: 0 | J311: 1 | K311: 0 | L311: 0 | M311: 0 | N311: 0 | O311: 0
H312: 0 | I312: 0 | J312: 1 | K312: 0 | L312: 0 | M312: 0 | N312: 0 | O312: 0
H313: 0 | I313: 0 | J313: 1 | K313: 0 | L313: 0 | M313: 0 | N313: 0 | O313: 0
H314: 0 | I314: 0 | J314: 1 | K314: 0 | L314: 0 | M314: 0 | N314: 0 | O314: 0
H315: 0 | I315: 0 | J315: 1 | K315: 0 | L315: 0 | M315: 0 | N315: 0 | O315: 0
H316: 0 | I316: 0 | J316: 1 | K316: 0 | L316: 0 | M316: 0 | N316: 0 | O316: 0
H317: 0 | I317: 0 | J317: 1 | K317: 0 | L317: 0 | M317: 0 | N317: 0 | O317: 0
H318: 0 | I318: 0 | J318: 0 | K318: 0 | L318: 0 | M318: 1 | N318: 0 | O318: 0
H319: 0 | I319: 0 | J319: 0 | K319: 0 | L319: 0 | M319: 1 | N319: 0 | O319: 0
H320: 0 | I320: 0 | J320: 0 | K320: 0 | L320: 0 | M320: 1 | N320: 0 | O320: 0
H321: 0 | I321: 0 | J321: 0 | K321: 0 | L321: 0 | M321: 1 | N321: 0 | O321: 0
H322: 0 | I322: 1 | J322: 0 | K322: 0 | L322: 0 | M322: 0 | N322: 0 | O322: 0
H323: 0 | I323: 1 | J323: 0 | K323: 0 | L323: 0 | M323: 0 | N323: 0 | O323: 0
H324: 0 | I324: 1 | J324: 0 | K324: 0 | L324: 0 | M324: 0 | N324: 0 | O324: 0
H325: 0 | I325: 1 | J325: 0 | K325: 0 | L325: 0 | M325: 0 | N325: 0 | O325: 0
H326: 0 | I326: 1 | J326: 0 | K326: 0 | L326: 0 | M326: 0 | N326: 0 | O326: 0
H327: 0 | I327: 1 | J327: 0 | K327: 0 | L327: 0 | M327: 0 | N327: 0 | O327: 0
H328: 0 | I328: 1 | J328: 0 | K328: 0 | L328: 0 | M328: 0 | N328: 0 | O328: 0
H329: 0 | I329: 1 | J329: 0 | K329: 0 | L329: 0 | M329: 0 | N329: 0 | O329: 0
H330: 0 | I330: 1 | J330: 0 | K330: 0 | L330: 0 | M330: 0 | N330: 0 | O330: 0
H331: 0 | I331: 0 | J331: 1 | K331: 0 | L331: 0 | M331: 0 | N331: 0 | O331: 0
H332: 0 | I332: 0 | J332: 1 | K332: 0 | L332: 0 | M332: 0 | N332: 0 | O332: 0
H333: 0 | I333: 0 | J333: 1 | K333: 0 | L333: 0 | M333: 0 | N333: 0 | O333: 0
H334: 0 | I334: 0 | J334: 1 | K334: 0 | L334: 0 | M334: 0 | N334: 0 | O334: 0
H335: 0 | I335: 0 | J335: 1 | K335: 0 | L335: 0 | M335: 0 | N335: 0 | O335: 0
H336: 0 | I336: 0 | J336: 1 | K336: 0 | L336: 0 | M336: 0 | N336: 0 | O336: 0
H337: 0 | I337: 0 | J337: 1 | K337: 0 | L337: 0 | M337: 0 | N337: 0 | O337: 0
H338: 0 | I338: 0 | J338: 1 | K338: 0 | L338: 0 | M338: 0 | N338: 0 | O338: 0
H339: 0 | I339: 0 | J339: 1 | K339: 0 | L339: 0 | M339: 0 | N339: 0 | O339: 0
H340: 0 | I340: 0 | J340: 1 | K340: 0 | L340: 0 | M340: 0 | N340: 0 | O340: 0
H341: 0 | I341: 0 | J341: 1 | K341: 0 | L341: 0 | M341: 0 | N341: 0 | O341: 0
H342: 0 | I342: 0 | J342: 1 | K342: 0 | L342: 0 | M342: 0 | N342: 0 | O342: 0
H343: 0 | I343: 0 | J343: 1 | K343: 0 | L343: 0 | M343: 0 | N343: 0 | O343: 0
H344: 0 | I344: 0 | J344: 1 | K344: 0 | L344: 0 | M344: 0 | N344: 0 | O344: 0
H345: 0 | I345: 0 | J345: 1 | K345: 0 | L345: 0 | M345: 0 | N345: 0 | O345: 0
H346: 0 | I346: 0 | J346: 1 | K346: 0 | L346: 0 | M346: 0 | N346: 0 | O346: 0
H347: 0 | I347: 0 | J347: 1 | K347: 0 | L347: 0 | M347: 0 | N347: 0 | O347: 0
H348: 0 | I348: 0 | J348: 1 | K348: 0 | L348: 0 | M348: 0 | N348: 0 | O348: 0
H349: 0 | I349: 0 | J349: 1 | K349: 0 | L349: 0 | M349: 0 | N349: 0 | O349: 0
H350: 0 | I350: 0 | J350: 1 | K350: 0 | L350: 0 | M350: 0 | N350: 0 | O350: 0
H351: 0 | I351: 0 | J351: 1 | K351: 0 | L351: 0 | M351: 0 | N351: 0 | O351: 0
H352: 0 | I352: 0 | J352: 1 | K352: 0 | L352: 0 | M352: 0 | N352: 0 | O352: 0
H353: 0 | I353: 0 | J353: 1 | K353: 0 | L353: 0 | M353: 0 | N353: 0 | O353: 0
H354: 0 | I354: 0 | J354: 1 | K354: 0 | L354: 0 | M354: 0 | N354: 0 | O354: 0
H355: 0 | I355: 0 | J355: 1 | K355: 0 | L355: 0 | M355: 0 | N355: 0 | O355: 0
H356: 0 | I356: 0 | J356: 0 | K356: 0 | L356: 0 | M356: 1 | N356: 0 | O356: 0
H357: 0 | I357: 1 | J357: 0 | K357: 0 | L357: 0 | M357: 0 | N357: 0 | O357: 0
H358: 0 | I358: 1 | J358: 0 | K358: 0 | L358: 0 | M358: 0 | N358: 0 | O358: 0
H359: 0 | I359: 1 | J359: 0 | K359: 0 | L359: 0 | M359: 0 | N359: 0 | O359: 0
H360: 0 | I360: 1 | J360: 0 | K360: 0 | L360: 0 | M360: 0 | N360: 0 | O360: 0
H361: 0 | I361: 0 | J361: 1 | K361: 0 | L361: 0 | M361: 0 | N361: 0 | O361: 0
H362: 0 | I362: 0 | J362: 1 | K362: 0 | L362: 0 | M362: 0 | N362: 0 | O362: 0
H363: 0 | I363: 0 | J363: 1 | K363: 0 | L363: 0 | M363: 0 | N363: 0 | O363: 0
H364: 0 | I364: 0 | J364: 1 | K364: 0 | L364: 0 | M364: 0 | N364: 0 | O364: 0
H365: 0 | I365: 0 | J365: 1 | K365: 0 | L365: 0 | M365: 0 | N365: 0 | O365: 0
H366: 0 | I366: 0 | J366: 1 | K366: 0 | L366: 0 | M366: 0 | N366: 0 | O366: 0
H367: 0 | I367: 0 | J367: 1 | K367: 0 | L367: 0 | M367: 0 | N367: 0 | O367: 0
H368: 0 | I368: 0 | J368: 1 | K368: 0 | L368: 0 | M368: 0 | N368: 0 | O368: 0
H369: 0 | I369: 0 | J369: 1 | K369: 0 | L369: 0 | M369: 0 | N369: 0 | O369: 0
H370: 0 | I370: 0 | J370: 1 | K370: 0 | L370: 0 | M370: 0 | N370: 0 | O370: 0
H371: 0 | I371: 0 | J371: 1 | K371: 0 | L371: 0 | M371: 0 | N371: 0 | O371: 0
H372: 0 | I372: 0 | J372: 1 | K372: 0 | L372: 0 | M372: 0 | N372: 0 | O372: 0
H373: 0 | I373: 0 | J373: 1 | K373: 0 | L373: 0 | M373: 0 | N373: 0 | O373: 0
H374: 0 | I374: 0 | J374: 1 | K374: 0 | L374: 0 | M374: 0 | N374: 0 | O374: 0
H375: 0 | I375: 0 | J375: 1 | K375: 0 | L375: 0 | M375: 0 | N375: 0 | O375: 0
H376: 0 | I376: 0 | J376: 1 | K376: 0 | L376: 0 | M376: 0 | N376: 0 | O376: 0
H377: 0 | I377: 0 | J377: 1 | K377: 0 | L377: 0 | M377: 0 | N377: 0 | O377: 0
H378: 0 | I378: 0 | J378: 1 | K378: 0 | L378: 0 | M378: 0 | N378: 0 | O378: 0
H379: 0 | I379: 0 | J379: 1 | K379: 0 | L379: 0 | M379: 0 | N379: 0 | O379: 0
H380: 0 | I380: 0 | J380: 1 | K380: 0 | L380: 0 | M380: 0 | N380: 0 | O380: 0
H381: 0 | I381: 0 | J381: 1 | K381: 0 | L381: 0 | M381: 0 | N381: 0 | O381: 0
H382: 0 | I382: 0 | J382: 1 | K382: 0 | L382: 0 | M382: 0 | N382: 0 | O382: 0
H383: 0 | I383: 0 | J383: 1 | K383: 0 | L383: 0 | M383: 0 | N383: 0 | O383: 0
H384: 0 | I384: 0 | J384: 1 | K384: 0 | L384: 0 | M384: 0 | N384: 0 | O384: 0
H385: 0 | I385: 0 | J385: 0 | K385: 0 | L385: 0 | M385: 1 | N385: 0 | O385: 0
H386: 0 | I386: 0 | J386: 0 | K386: 0 | L386: 0 | M386: 1 | N386: 0 | O386: 0
H387: 0 | I387: 0 | J387: 0 | K387: 0 | L387: 0 | M387: 1 | N387: 0 | O387: 0
H388: 0 | I388: 0 | J388: 1 | K388: 0 | L388: 0 | M388: 0 | N388: 0 | O388: 0
H389: 0 | I389: 1 | J389: 0 | K389: 0 | L389: 0 | M389: 0 | N389: 0 | O389: 0
H390: 0 | I390: 1 | J390: 0 | K390: 0 | L390: 0 | M390: 0 | N390: 0 | O390: 0
H391: 0 | I391: 0 | J391: 1 | K391: 0 | L391: 0 | M391: 0 | N391: 0 | O391: 0
H392: 0 | I392: 0 | J392: 1 | K392: 0 | L392: 0 | M392: 0 | N392: 0 | O392: 0
H393: 0 | I393: 0 | J393: 1 | K393: 0 | L393: 0 | M393: 0 | N393: 0 | O393: 0
H394: 0 | I394: 0 | J394: 1 | K394: 0 | L394: 0 | M394: 0 | N394: 0 | O394: 0
H395: 0 | I395: 0 | J395: 0 | K395: 0 | L395: 0 | M395: 1 | N395: 0 | O395: 0
H396: 0 | I396: 0 | J396: 0 | K396: 0 | L396: 0 | M396: 1 | N396: 0 | O396: 0
H397: 0 | I397: 0 | J397: 0 | K397: 0 | L397: 0 | M397: 1 | N397: 0 | O397: 0