A1: Suddivisione Corsi in Obbligatori - Non Obbligatori
I2: obbligatorio | J2: non obbligatorio | K2: altro
B3: Numero corsi | I3: 1 | J3: 0 | K3: =1-SUM(I3:J3) -> 0
A4: Obbligatorio | B4: =I397 -> 228 | I4: 0 | J4: 1 | K4: =1-SUM(I4:J4) -> 0
A5: Non obbligatorio | B5: =J397 -> 153 | I5: 0 | J5: 1 | K5: =1-SUM(I5:J5) -> 0
A6: Non indicato | B6: =K397 -> 13 | I6: 0 | J6: 1 | K6: =1-SUM(I6:J6) -> 0
A7: Totale | B7: =SUM(B4:B6) -> 394 | D7: Home | I7: 1 | J7: 0 | K7: =1-SUM(I7:J7) -> 0
I8: 0 | J8: 1 | K8: =1-SUM(I8:J8) -> 0
I9: 0 | J9: 0 | K9: =1-SUM(I9:J9) -> 1
I10: 0 | J10: 1 | K10: =1-SUM(I10:J10) -> 0
I11: 0 | J11: 1 | K11: =1-SUM(I11:J11) -> 0
I12: 0 | J12: 1 | K12: =1-SUM(I12:J12) -> 0
I13: 0 | J13: 1 | K13: =1-SUM(I13:J13) -> 0
I14: 0 | J14: 1 | K14: =1-SUM(I14:J14) -> 0
I15: 0 | J15: 1 | K15: =1-SUM(I15:J15) -> 0
I16: 0 | J16: 1 | K16: =1-SUM(I16:J16) -> 0
I17: 1 | J17: 0 | K17: =1-SUM(I17:J17) -> 0
I18: 1 | J18: 0 | K18: =1-SUM(I18:J18) -> 0
I19: 0 | J19: 1 | K19: =1-SUM(I19:J19) -> 0
I20: 1 | J20: 0 | K20: =1-SUM(I20:J20) -> 0
I21: 0 | J21: 1 | K21: =1-SUM(I21:J21) -> 0
I22: 0 | J22: 1 | K22: =1-SUM(I22:J22) -> 0
I23: 1 | J23: 0 | K23: =1-SUM(I23:J23) -> 0
I24: 1 | J24: 0 | K24: =1-SUM(I24:J24) -> 0
I25: 0 | J25: 1 | K25: =1-SUM(I25:J25) -> 0
I26: 0 | J26: 1 | K26: =1-SUM(I26:J26) -> 0
I27: 0 | J27: 1 | K27: =1-SUM(I27:J27) -> 0
I28: 1 | J28: 0 | K28: =1-SUM(I28:J28) -> 0
I29: 0 | J29: 1 | K29: =1-SUM(I29:J29) -> 0
I30: 0 | J30: 1 | K30: =1-SUM(I30:J30) -> 0
I31: 0 | J31: 1 | K31: =1-SUM(I31:J31) -> 0
I32: 1 | J32: 0 | K32: =1-SUM(I32:J32) -> 0
I33: 0 | J33: 1 | K33: =1-SUM(I33:J33) -> 0
I34: 1 | J34: 0 | K34: =1-SUM(I34:J34) -> 0
I35: 1 | J35: 0 | K35: =1-SUM(I35:J35) -> 0
I36: 1 | J36: 0 | K36: =1-SUM(I36:J36) -> 0
I37: 1 | J37: 0 | K37: =1-SUM(I37:J37) -> 0
I38: 1 | J38: 0 | K38: =1-SUM(I38:J38) -> 0
I39: 1 | J39: 0 | K39: =1-SUM(I39:J39) -> 0
I40: 1 | J40: 0 | K40: =1-SUM(I40:J40) -> 0
I41: 1 | J41: 0 | K41: =1-SUM(I41:J41) -> 0
I42: 1 | J42: 0 | K42: =1-SUM(I42:J42) -> 0
I43: 0 | J43: 1 | K43: =1-SUM(I43:J43) -> 0
I44: 1 | J44: 0 | K44: =1-SUM(I44:J44) -> 0
I45: 0 | J45: 1 | K45: =1-SUM(I45:J45) -> 0
I46: 1 | J46: 0 | K46: =1-SUM(I46:J46) -> 0
I47: 0 | J47: 1 | K47: =1-SUM(I47:J47) -> 0
I48: 1 | J48: 0 | K48: =1-SUM(I48:J48) -> 0
I49: 1 | J49: 0 | K49: =1-SUM(I49:J49) -> 0
I50: 1 | J50: 0 | K50: =1-SUM(I50:J50) -> 0
I51: 1 | J51: 0 | K51: =1-SUM(I51:J51) -> 0
I52: 1 | J52: 0 | K52: =1-SUM(I52:J52) -> 0
I53: 1 | J53: 0 | K53: =1-SUM(I53:J53) -> 0
I54: 1 | J54: 0 | K54: =1-SUM(I54:J54) -> 0
I55: 1 | J55: 0 | K55: =1-SUM(I55:J55) -> 0
I56: 1 | J56: 0 | K56: =1-SUM(I56:J56) -> 0
I57: 1 | J57: 0 | K57: =1-SUM(I57:J57) -> 0
I58: 1 | J58: 0 | K58: =1-SUM(I58:J58) -> 0
I59: 1 | J59: 0 | K59: =1-SUM(I59:J59) -> 0
I60: 1 | J60: 0 | K60: =1-SUM(I60:J60) -> 0
I61: 1 | J61: 0 | K61: =1-SUM(I61:J61) -> 0
I62: 1 | J62: 0 | K62: =1-SUM(I62:J62) -> 0
I63: 1 | J63: 0 | K63: =1-SUM(I63:J63) -> 0
I64: 0 | J64: 1 | K64: =1-SUM(I64:J64) -> 0
I65: 1 | J65: 0 | K65: =1-SUM(I65:J65) -> 0
I66: 0 | J66: 1 | K66: =1-SUM(I66:J66) -> 0
I67: 1 | J67: 0 | K67: =1-SUM(I67:J67) -> 0
I68: 0 | J68: 1 | K68: =1-SUM(I68:J68) -> 0
I69: 1 | J69: 0 | K69: =1-SUM(I69:J69) -> 0
I70: 0 | J70: 1 | K70: =1-SUM(I70:J70) -> 0
I71: 0 | J71: 1 | K71: =1-SUM(I71:J71) -> 0
I72: 0 | J72: 1 | K72: =1-SUM(I72:J72) -> 0
I73: 1 | J73: 0 | K73: =1-SUM(I73:J73) -> 0
I74: 1 | J74: 0 | K74: =1-SUM(I74:J74) -> 0
I75: 1 | J75: 0 | K75: =1-SUM(I75:J75) -> 0
I76: 1 | J76: 0 | K76: =1-SUM(I76:J76) -> 0
I77: 1 | J77: 0 | K77: =1-SUM(I77:J77) -> 0
I78: 1 | J78: 0 | K78: =1-SUM(I78:J78) -> 0
I79: 1 | J79: 0 | K79: =1-SUM(I79:J79) -> 0
I80: 1 | J80: 0 | K80: =1-SUM(I80:J80) -> 0
I81: 1 | J81: 0 | K81: =1-SUM(I81:J81) -> 0
I82: 1 | J82: 0 | K82: =1-SUM(I82:J82) -> 0
I83: 1 | J83: 0 | K83: =1-SUM(I83:J83) -> 0
I84: 1 | J84: 0 | K84: =1-SUM(I84:J84) -> 0
I85: 1 | J85: 0 | K85: =1-SUM(I85:J85) -> 0
I86: 1 | J86: 0 | K86: =1-SUM(I86:J86) -> 0
I87: 0 | J87: 1 | K87: =1-SUM(I87:J87) -> 0
I88: 0 | J88: 1 | K88: =1-SUM(I88:J88) -> 0
I89: 1 | J89: 0 | K89: =1-SUM(I89:J89) -> 0
I90: 0 | J90: 1 | K90: =1-SUM(I90:J90) -> 0
I91: 0 | J91: 1 | K91: =1-SUM(I91:J91) -> 0
I92: 0 | J92: 1 | K92: =1-SUM(I92:J92) -> 0
I93: 1 | J93: 0 | K93: =1-SUM(I93:J93) -> 0
I94: 1 | J94: 0 | K94: =1-SUM(I94:J94) -> 0
I95: 1 | J95: 0 | K95: =1-SUM(I95:J95) -> 0
I96: 1 | J96: 0 | K96: =1-SUM(I96:J96) -> 0
I97: 1 | J97: 0 | K97: =1-SUM(I97:J97) -> 0
I98: 1 | J98: 0 | K98: =1-SUM(I98:J98) -> 0
I99: 1 | J99: 0 | K99: =1-SUM(I99:J99) -> 0
I100: 1 | J100: 0 | K100: =1-SUM(I100:J100) -> 0
I101: 1 | J101: 0 | K101: =1-SUM(I101:J101) -> 0
I102: 1 | J102: 0 | K102: =1-SUM(I102:J102) -> 0
I103: 1 | J103: 0 | K103: =1-SUM(I103:J103) -> 0
I104: 1 | J104: 0 | K104: =1-SUM(I104:J104) -> 0
I105: 1 | J105: 0 | K105: =1-SUM(I105:J105) -> 0
I106: 1 | J106: 0 | K106: =1-SUM(I106:J106) -> 0
I107: 1 | J107: 0 | K107: =1-SUM(I107:J107) -> 0
I108: 1 | J108: 0 | K108: =1-SUM(I108:J108) -> 0
I109: 1 | J109: 0 | K109: =1-SUM(I109:J109) -> 0
I110: 1 | J110: 0 | K110: =1-SUM(I110:J110) -> 0
I111: 1 | J111: 0 | K111: =1-SUM(I111:J111) -> 0
I112: 1 | J112: 0 | K112: =1-SUM(I112:J112) -> 0
I113: 0 | J113: 1 | K113: =1-SUM(I113:J113) -> 0
I114: 1 | J114: 0 | K114: =1-SUM(I114:J114) -> 0
I115: 1 | J115: 0 | K115: =1-SUM(I115:J115) -> 0
I116: 1 | J116: 0 | K116: =1-SUM(I116:J116) -> 0
I117: 1 | J117: 0 | K117: =1-SUM(I117:J117) -> 0
I118: 1 | J118: 0 | K118: =1-SUM(I118:J118) -> 0
I119: 1 | J119: 0 | K119: =1-SUM(I119:J119) -> 0
I120: 1 | J120: 0 | K120: =1-SUM(I120:J120) -> 0
I121: 1 | J121: 0 | K121: =1-SUM(I121:J121) -> 0
I122: 0 | J122: 1 | K122: =1-SUM(I122:J122) -> 0
I123: 1 | J123: 0 | K123: =1-SUM(I123:J123) -> 0
I124: 1 | J124: 0 | K124: =1-SUM(I124:J124) -> 0
I125: 1 | J125: 0 | K125: =1-SUM(I125:J125) -> 0
I126: 0 | J126: 1 | K126: =1-SUM(I126:J126) -> 0
I127: 0 | J127: 1 | K127: =1-SUM(I127:J127) -> 0
I128: 1 | J128: 0 | K128: =1-SUM(I128:J128) -> 0
I129: 1 | J129: 0 | K129: =1-SUM(I129:J129) -> 0
I130: 1 | J130: 0 | K130: =1-SUM(I130:J130) -> 0
I131: 1 | J131: 0 | K131: =1-SUM(I131:J131) -> 0
I132: 1 | J132: 0 | K132: =1-SUM(I132:J132) -> 0
I133: 0 | J133: 1 | K133: =1-SUM(I133:J133) -> 0
I134: 1 | J134: 0 | K134: =1-SUM(I134:J134) -> 0
I135: 1 | J135: 0 | K135: =1-SUM(I135:J135) -> 0
I136: 1 | J136: 0 | K136: =1-SUM(I136:J136) -> 0
I137: 1 | J137: 0 | K137: =1-SUM(I137:J137) -> 0
I138: 1 | J138: 0 | K138: =1-SUM(I138:J138) -> 0
I139: 1 | J139: 0 | K139: =1-SUM(I139:J139) -> 0
I140: 1 | J140: 0 | K140: =1-SUM(I140:J140) -> 0
I141: 1 | J141: 0 | K141: =1-SUM(I141:J141) -> 0
I142: 1 | J142: 0 | K142: =1-SUM(I142:J142) -> 0
I143: 1 | J143: 0 | K143: =1-SUM(I143:J143) -> 0
I144: 0 | J144: 1 | K144: =1-SUM(I144:J144) -> 0
I145: 0 | J145: 1 | K145: =1-SUM(I145:J145) -> 0
I146: 0 | J146: 1 | K146: =1-SUM(I146:J146) -> 0
I147: 1 | J147: 0 | K147: =1-SUM(I147:J147) -> 0
I148: 1 | J148: 0 | K148: =1-SUM(I148:J148) -> 0
I149: 0 | J149: 1 | K149: =1-SUM(I149:J149) -> 0
I150: 0 | J150: 1 | K150: =1-SUM(I150:J150) -> 0
I151: 0 | J151: 1 | K151: =1-SUM(I151:J151) -> 0
I152: 1 | J152: 0 | K152: =1-SUM(I152:J152) -> 0
I153: 0 | J153: 1 | K153: =1-SUM(I153:J153) -> 0
I154: 0 | J154: 1 | K154: =1-SUM(I154:J154) -> 0
I155: 0 | J155: 1 | K155: =1-SUM(I155:J155) -> 0
I156: 0 | J156: 1 | K156: =1-SUM(I156:J156) -> 0
I157: 0 | J157: 1 | K157: =1-SUM(I157:J157) -> 0
I158: 0 | J158: 1 | K158: =1-SUM(I158:J158) -> 0
I159: 0 | J159: 1 | K159: =1-SUM(I159:J159) -> 0
I160: 1 | J160: 0 | K160: =1-SUM(I160:J160) -> 0
I161: 1 | J161: 0 | K161: =1-SUM(I161:J161) -> 0
I162: 1 | J162: 0 | K162: =1-SUM(I162:J162) -> 0
I163: 0 | J163: 1 | K163: =1-SUM(I163:J163) -> 0
I164: 1 | J164: 0 | K164: =1-SUM(I164:J164) -> 0
I165: 1 | J165: 0 | K165: =1-SUM(I165:J165) -> 0
I166: 1 | J166: 0 | K166: =1-SUM(I166:J166) -> 0
I167: 0 | J167: 1 | K167: =1-SUM(I167:J167) -> 0
I168: 0 | J168: 1 | K168: =1-SUM(I168:J168) -> 0
I169: 0 | J169: 1 | K169: =1-SUM(I169:J169) -> 0
I170: 0 | J170: 1 | K170: =1-SUM(I170:J170) -> 0
I171: 1 | J171: 0 | K171: =1-SUM(I171:J171) -> 0
I172: 1 | J172: 0 | K172: =1-SUM(I172:J172) -> 0
I173: 0 | J173: 1 | K173: =1-SUM(I173:J173) -> 0
I174: 0 | J174: 1 | K174: =1-SUM(I174:J174) -> 0
I175: 1 | J175: 0 | K175: =1-SUM(I175:J175) -> 0
I176: 1 | J176: 0 | K176: =1-SUM(I176:J176) -> 0
I177: 0 | J177: 1 | K177: =1-SUM(I177:J177) -> 0
I178: 0 | J178: 1 | K178: =1-SUM(I178:J178) -> 0
I179: 0 | J179: 1 | K179: =1-SUM(I179:J179) -> 0
I180: 1 | J180: 0 | K180: =1-SUM(I180:J180) -> 0
I181: 1 | J181: 0 | K181: =1-SUM(I181:J181) -> 0
I182: 0 | J182: 1 | K182: =1-SUM(I182:J182) -> 0
I183: 0 | J183: 1 | K183: =1-SUM(I183:J183) -> 0
I184: 0 | J184: 1 | K184: =1-SUM(I184:J184) -> 0
I185: 1 | J185: 0 | K185: =1-SUM(I185:J185) -> 0
I186: 0 | J186: 1 | K186: =1-SUM(I186:J186) -> 0
I187: 0 | J187: 1 | K187: =1-SUM(I187:J187) -> 0
I188: 0 | J188: 1 | K188: =1-SUM(I188:J188) -> 0
I189: 1 | J189: 0 | K189: =1-SUM(I189:J189) -> 0
I190: 1 | J190: 0 | K190: =1-SUM(I190:J190) -> 0
I191: 0 | J191: 1 | K191: =1-SUM(I191:J191) -> 0
I192: 0 | J192: 1 | K192: =1-SUM(I192:J192) -> 0
I193: 0 | J193: 1 | K193: =1-SUM(I193:J193) -> 0
I194: 1 | J194: 0 | K194: =1-SUM(I194:J194) -> 0
I195: 0 | J195: 1 | K195: =1-SUM(I195:J195) -> 0
I196: 1 | J196: 0 | K196: =1-SUM(I196:J196) -> 0
I197: 0 | J197: 1 | K197: =1-SUM(I197:J197) -> 0
I198: 1 | J198: 0 | K198: =1-SUM(I198:J198) -> 0
I199: 0 | J199: 1 | K199: =1-SUM(I199:J199) -> 0
I200: 1 | J200: 0 | K200: =1-SUM(I200:J200) -> 0
I201: 1 | J201: 0 | K201: =1-SUM(I201:J201) -> 0
I202: 1 | J202: 0 | K202: =1-SUM(I202:J202) -> 0
I203: 1 | J203: 0 | K203: =1-SUM(I203:J203) -> 0
I204: 1 | J204: 0 | K204: =1-SUM(I204:J204) -> 0
I205: 1 | J205: 0 | K205: =1-SUM(I205:J205) -> 0
I206: 1 | J206: 0 | K206: =1-SUM(I206:J206) -> 0
I207: 1 | J207: 0 | K207: =1-SUM(I207:J207) -> 0
I208: 0 | J208: 1 | K208: =1-SUM(I208:J208) -> 0
I209: 0 | J209: 1 | K209: =1-SUM(I209:J209) -> 0
I210: 1 | J210: 0 | K210: =1-SUM(I210:J210) -> 0
I211: 0 | J211: 1 | K211: =1-SUM(I211:J211) -> 0
I212: 1 | J212: 0 | K212: =1-SUM(I212:J212) -> 0
I213: 1 | J213: 0 | K213: =1-SUM(I213:J213) -> 0
I214: 1 | J214: 0 | K214: =1-SUM(I214:J214) -> 0
I215: 1 | J215: 0 | K215: =1-SUM(I215:J215) -> 0
I216: 1 | J216: 0 | K216: =1-SUM(I216:J216) -> 0
I217: 0 | J217: 1 | K217: =1-SUM(I217:J217) -> 0
I218: 0 | J218: 1 | K218: =1-SUM(I218:J218) -> 0
I219: 0 | J219: 1 | K219: =1-SUM(I219:J219) -> 0
I220: 0 | J220: 1 | K220: =1-SUM(I220:J220) -> 0
I221: 1 | J221: 0 | K221: =1-SUM(I221:J221) -> 0
I222: 1 | J222: 0 | K222: =1-SUM(I222:J222) -> 0
I223: 1 | J223: 0 | K223: =1-SUM(I223:J223) -> 0
I224: 1 | J224: 0 | K224: =1-SUM(I224:J224) -> 0
I225: 1 | J225: 0 | K225: =1-SUM(I225:J225) -> 0
I226: 1 | J226: 0 | K226: =1-SUM(I226:J226) -> 0
I227: 1 | J227: 0 | K227: =1-SUM(I227:J227) -> 0
I228: 0 | J228: 1 | K228: =1-SUM(I228:J228) -> 0
I229: 0 | J229: 1 | K229: =1-SUM(I229:J229) -> 0
I230: 0 | J230: 1 | K230: =1-SUM(I230:J230) -> 0
I231: 1 | J231: 0 | K231: =1-SUM(I231:J231) -> 0
I232: 1 | J232: 0 | K232: =1-SUM(I232:J232) -> 0
I233: 1 | J233: 0 | K233: =1-SUM(I233:J233) -> 0
I234: 0 | J234: 1 | K234: =1-SUM(I234:J234) -> 0
I235: 1 | J235: 0 | K235: =1-SUM(I235:J235) -> 0
I236: 1 | J236: 0 | K236: =1-SUM(I236:J236) -> 0
I237: 1 | J237: 0 | K237: =1-SUM(I237:J237) -> 0
I238: 0 | J238: 1 | K238: =1-SUM(I238:J238) -> 0
I239: 0 | J239: 1 | K239: =1-SUM(I239:J239) -> 0
I240: 1 | J240: 0 | K240: =1-SUM(I240:J240) -> 0
I241: 1 | J241: 0 | K241: =1-SUM(I241:J241) -> 0
I242: 0 | J242: 1 | K242: =1-SUM(I242:J242) -> 0
I243: 0 | J243: 1 | K243: =1-SUM(I243:J243) -> 0
I244: 0 | J244: 1 | K244: =1-SUM(I244:J244) -> 0
I245: 1 | J245: 0 | K245: =1-SUM(I245:J245) -> 0
I246: 1 | J246: 0 | K246: =1-SUM(I246:J246) -> 0
I247: 1 | J247: 0 | K247: =1-SUM(I247:J247) -> 0
I248: 1 | J248: 0 | K248: =1-SUM(I248:J248) -> 0
I249: 1 | J249: 0 | K249: =1-SUM(I249:J249) -> 0
I250: 1 | J250: 0 | K250: =1-SUM(I250:J250) -> 0
I251: 1 | J251: 0 | K251: =1-SUM(I251:J251) -> 0
I252: 1 | J252: 0 | K252: =1-SUM(I252:J252) -> 0
I253: 1 | J253: 0 | K253: =1-SUM(I253:J253) -> 0
I254: 1 | J254: 0 | K254: =1-SUM(I254:J254) -> 0
I255: 1 | J255: 0 | K255: =1-SUM(I255:J255) -> 0
I256: 1 | J256: 0 | K256: =1-SUM(I256:J256) -> 0
I257: 1 | J257: 0 | K257: =1-SUM(I257:J257) -> 0
I258: 1 | J258: 0 | K258: =1-SUM(I258:J258) -> 0
I259: 1 | J259: 0 | K259: =1-SUM(I259:J259) -> 0
I260: 1 | J260: 0 | K260: =1-SUM(I260:J260) -> 0
I261: 0 | J261: 1 | K261: =1-SUM(I261:J261) -> 0
I262: 0 | J262: 1 | K262: =1-SUM(I262:J262) -> 0
I263: 0 | J263: 1 | K263: =1-SUM(I263:J263) -> 0
I264: 1 | J264: 0 | K264: =1-SUM(I264:J264) -> 0
I265: 0 | J265: 1 | K265: =1-SUM(I265:J265) -> 0
I266: 1 | J266: 0 | K266: =1-SUM(I266:J266) -> 0
I267: 0 | J267: 1 | K267: =1-SUM(I267:J267) -> 0
I268: 0 | J268: 1 | K268: =1-SUM(I268:J268) -> 0
I269: 1 | J269: 0 | K269: =1-SUM(I269:J269) -> 0
I270: 1 | J270: 0 | K270: =1-SUM(I270:J270) -> 0
I271: 0 | J271: 1 | K271: =1-SUM(I271:J271) -> 0
I272: 0 | J272: 1 | K272: =1-SUM(I272:J272) -> 0
I273: 1 | J273: 0 | K273: =1-SUM(I273:J273) -> 0
I274: 0 | J274: 1 | K274: =1-SUM(I274:J274) -> 0
I275: 0 | J275: 1 | K275: =1-SUM(I275:J275) -> 0
I276: 1 | J276: 0 | K276: =1-SUM(I276:J276) -> 0
I277: 0 | J277: 1 | K277: =1-SUM(I277:J277) -> 0
I278: 1 | J278: 0 | K278: =1-SUM(I278:J278) -> 0
I279: 0 | J279: 1 | K279: =1-SUM(I279:J279) -> 0
I280: 1 | J280: 0 | K280: =1-SUM(I280:J280) -> 0
I281: 1 | J281: 0 | K281: =1-SUM(I281:J281) -> 0
I282: 1 | J282: 0 | K282: =1-SUM(I282:J282) -> 0
I283: 0 | J283: 1 | K283: =1-SUM(I283:J283) -> 0
I284: 0 | J284: 1 | K284: =1-SUM(I284:J284) -> 0
I285: 1 | J285: 0 | K285: =1-SUM(I285:J285) -> 0
I286: 1 | J286: 0 | K286: =1-SUM(I286:J286) -> 0
I287: 1 | J287: 0 | K287: =1-SUM(I287:J287) -> 0
I288: 1 | J288: 0 | K288: =1-SUM(I288:J288) -> 0
I289: 1 | J289: 0 | K289: =1-SUM(I289:J289) -> 0
I290: 0 | J290: 1 | K290: =1-SUM(I290:J290) -> 0
I291: 1 | J291: 0 | K291: =1-SUM(I291:J291) -> 0
I292: 1 | J292: 0 | K292: =1-SUM(I292:J292) -> 0
I293: 0 | J293: 0 | K293: =1-SUM(I293:J293) -> 1
I294: 1 | J294: 0 | K294: =1-SUM(I294:J294) -> 0
I295: 1 | J295: 0 | K295: =1-SUM(I295:J295) -> 0
I296: 0 | J296: 1 | K296: =1-SUM(I296:J296) -> 0
I297: 1 | J297: 0 | K297: =1-SUM(I297:J297) -> 0
I298: 1 | J298: 0 | K298: =1-SUM(I298:J298) -> 0
I299: 1 | J299: 0 | K299: =1-SUM(I299:J299) -> 0
I300: 1 | J300: 0 | K300: =1-SUM(I300:J300) -> 0
I301: 1 | J301: 0 | K301: =1-SUM(I301:J301) -> 0
I302: 0 | J302: 0 | K302: =1-SUM(I302:J302) -> 1
I303: 0 | J303: 0 | K303: =1-SUM(I303:J303) -> 1
I304: 0 | J304: 0 | K304: =1-SUM(I304:J304) -> 1
I305: 0 | J305: 0 | K305: =1-SUM(I305:J305) -> 1
I306: 0 | J306: 0 | K306: =1-SUM(I306:J306) -> 1
I307: 0 | J307: 0 | K307: =1-SUM(I307:J307) -> 1
I308: 0 | J308: 0 | K308: =1-SUM(I308:J308) -> 1
I309: 0 | J309: 0 | K309: =1-SUM(I309:J309) -> 1
I310: 0 | J310: 1 | K310: =1-SUM(I310:J310) -> 0
I311: 1 | J311: 0 | K311: =1-SUM(I311:J311) -> 0
I312: 1 | J312: 0 | K312: =1-SUM(I312:J312) -> 0
I313: 0 | J313: 1 | K313: =1-SUM(I313:J313) -> 0
I314: 1 | J314: 0 | K314: =1-SUM(I314:J314) -> 0
I315: 1 | J315: 0 | K315: =1-SUM(I315:J315) -> 0
I316: 1 | J316: 0 | K316: =1-SUM(I316:J316) -> 0
I317: 1 | J317: 0 | K317: =1-SUM(I317:J317) -> 0
I318: 1 | J318: 0 | K318: =1-SUM(I318:J318) -> 0
I319: 1 | J319: 0 | K319: =1-SUM(I319:J319) -> 0
I320: 0 | J320: 1 | K320: =1-SUM(I320:J320) -> 0
I321: 0 | J321: 1 | K321: =1-SUM(I321:J321) -> 0
I322: 0 | J322: 1 | K322: =1-SUM(I322:J322) -> 0
I323: 0 | J323: 1 | K323: =1-SUM(I323:J323) -> 0
I324: 0 | J324: 1 | K324: =1-SUM(I324:J324) -> 0
I325: 0 | J325: 1 | K325: =1-SUM(I325:J325) -> 0
I326: 1 | J326: 0 | K326: =1-SUM(I326:J326) -> 0
I327: 0 | J327: 1 | K327: =1-SUM(I327:J327) -> 0
I328: 0 | J328: 0 | K328: =1-SUM(I328:J328) -> 1
I329: 0 | J329: 0 | K329: =1-SUM(I329:J329) -> 1
I330: 1 | J330: 0 | K330: =1-SUM(I330:J330) -> 0
I331: 1 | J331: 0 | K331: =1-SUM(I331:J331) -> 0
I332: 1 | J332: 0 | K332: =1-SUM(I332:J332) -> 0
I333: 1 | J333: 0 | K333: =1-SUM(I333:J333) -> 0
I334: 0 | J334: 1 | K334: =1-SUM(I334:J334) -> 0
I335: 0 | J335: 1 | K335: =1-SUM(I335:J335) -> 0
I336: 1 | J336: 0 | K336: =1-SUM(I336:J336) -> 0
I337: 1 | J337: 0 | K337: =1-SUM(I337:J337) -> 0
I338: 1 | J338: 0 | K338: =1-SUM(I338:J338) -> 0
I339: 1 | J339: 0 | K339: =1-SUM(I339:J339) -> 0
I340: 0 | J340: 1 | K340: =1-SUM(I340:J340) -> 0
I341: 1 | J341: 0 | K341: =1-SUM(I341:J341) -> 0
I342: 0 | J342: 1 | K342: =1-SUM(I342:J342) -> 0
I343: 0 | J343: 1 | K343: =1-SUM(I343:J343) -> 0
I344: 0 | J344: 1 | K344: =1-SUM(I344:J344) -> 0
I345: 0 | J345: 1 | K345: =1-SUM(I345:J345) -> 0
I346: 0 | J346: 1 | K346: =1-SUM(I346:J346) -> 0
I347: 0 | J347: 1 | K347: =1-SUM(I347:J347) -> 0
I348: 0 | J348: 1 | K348: =1-SUM(I348:J348) -> 0
I349: 0 | J349: 1 | K349: =1-SUM(I349:J349) -> 0
I350: 0 | J350: 1 | K350: =1-SUM(I350:J350) -> 0
I351: 1 | J351: 0 | K351: =1-SUM(I351:J351) -> 0
I352: 0 | J352: 1 | K352: =1-SUM(I352:J352) -> 0
I353: 0 | J353: 1 | K353: =1-SUM(I353:J353) -> 0
I354: 0 | J354: 1 | K354: =1-SUM(I354:J354) -> 0
I355: 0 | J355: 1 | K355: =1-SUM(I355:J355) -> 0
I356: 0 | J356: 1 | K356: =1-SUM(I356:J356) -> 0
I357: 0 | J357: 1 | K357: =1-SUM(I357:J357) -> 0
I358: 0 | J358: 1 | K358: =1-SUM(I358:J358) -> 0
I359: 0 | J359: 1 | K359: =1-SUM(I359:J359) -> 0
I360: 1 | J360: 0 | K360: =1-SUM(I360:J360) -> 0
I361: 1 | J361: 0 | K361: =1-SUM(I361:J361) -> 0
I362: 0 | J362: 1 | K362: =1-SUM(I362:J362) -> 0
I363: 1 | J363: 0 | K363: =1-SUM(I363:J363) -> 0
I364: 1 | J364: 0 | K364: =1-SUM(I364:J364) -> 0
I365: 0 | J365: 1 | K365: =1-SUM(I365:J365) -> 0
I366: 0 | J366: 1 | K366: =1-SUM(I366:J366) -> 0
I367: 0 | J367: 1 | K367: =1-SUM(I367:J367) -> 0
I368: 0 | J368: 1 | K368: =1-SUM(I368:J368) -> 0
I369: 0 | J369: 1 | K369: =1-SUM(I369:J369) -> 0
I370: 1 | J370: 0 | K370: =1-SUM(I370:J370) -> 0
I371: 1 | J371: 0 | K371: =1-SUM(I371:J371) -> 0
I372: 0 | J372: 1 | K372: =1-SUM(I372:J372) -> 0
I373: 1 | J373: 0 | K373: =1-SUM(I373:J373) -> 0
I374: 1 | J374: 0 | K374: =1-SUM(I374:J374) -> 0
I375: 1 | J375: 0 | K375: =1-SUM(I375:J375) -> 0
I376: 1 | J376: 0 | K376: =1-SUM(I376:J376) -> 0
I377: 1 | J377: 0 | K377: =1-SUM(I377:J377) -> 0
I378: 1 | J378: 0 | K378: =1-SUM(I378:J378) -> 0
I379: 0 | J379: 1 | K379: =1-SUM(I379:J379) -> 0
I380: 1 | J380: 0 | K380: =1-SUM(I380:J380) -> 0
I381: 0 | J381: 1 | K381: =1-SUM(I381:J381) -> 0
I382: 0 | J382: 1 | K382: =1-SUM(I382:J382) -> 0
I383: 1 | J383: 0 | K383: =1-SUM(I383:J383) -> 0
I384: 0 | J384: 1 | K384: =1-SUM(I384:J384) -> 0
I385: 1 | J385: 0 | K385: =1-SUM(I385:J385) -> 0
I386: 0 | J386: 0 | K386: =1-SUM(I386:J386) -> 1
I387: 1 | J387: 0 | K387: =1-SUM(I387:J387) -> 0
I388: 1 | J388: 0 | K388: =1-SUM(I388:J388) -> 0
I389: 1 | J389: 0 | K389: =1-SUM(I389:J389) -> 0
I390: 0 | J390: 1 | K390: =1-SUM(I390:J390) -> 0
I391: 0 | J391: 1 | K391: =1-SUM(I391:J391) -> 0
I392: 0 | J392: 1 | K392: =1-SUM(I392:J392) -> 0
I393: 0 | J393: 1 | K393: =1-SUM(I393:J393) -> 0
I394: 1 | J394: 0 | K394: =1-SUM(I394:J394) -> 0
I395: 0 | J395: 1 | K395: =1-SUM(I395:J395) -> 0
I396: 0 | J396: 1 | K396: =1-SUM(I396:J396) -> 0
I397: =SUM(I3:I396) -> 228 | J397: =SUM(J3:J396) -> 153 | K397: =SUM(K3:K396) -> 13