A1: Programmi
O2: modelli matematici | R2: LP | U2: simplesso | X2: dualità | AA2: ILP | AD2: NLP (COND. OTT.) | AG2: NLP (ALGORITMI) | AJ2: GRAFI | AM2: RETI | AP2: giochi | AS2: complessità | AV2: branch_and_bound | AY2: rilassamenti | BB2: programmazione dinamica | BE2: metaeuristici | BH2: simulazione | BK2: mcda | BN2: altro
A3: Argomento | C3: SI | E3: NO | G3: Non indicato | O3: si | P3: no | Q3: altro | R3: si | S3: no | T3: altro | U3: si | V3: no | W3: altro | X3: si | Y3: no | Z3: altro | AA3: si | AB3: no | AC3: altro | AD3: si | AE3: no | AF3: altro | AG3: si | AH3: no | AI3: altro | AJ3: si | AK3: no | AL3: altro | AM3: si | AN3: no | AO3: altro | AP3: si | AQ3: no | AR3: altro | AS3: si | AT3: no | AU3: altro | AV3: si | AW3: no | AX3: altro | AY3: si | AZ3: no | BA3: altro | BB3: si | BC3: no | BD3: altro | BE3: si | BF3: no | BG3: altro | BH3: si | BI3: no | BJ3: altro | BK3: si | BL3: no | BM3: altro | BN3: 1 | BO3: =1-BN3 -> 0
B4: corsi | C4: perc. | D4: corsi | E4: perc. | F4: corsi | G4: perc.
A5: MODELLI MATEMATICI | B5: =O399 -> 312 | C5: =B5/$I$23*100 -> 79.187817258883257 | D5: =P399 -> 68 | E5: =D5/$I$23*100 -> 17.258883248730964 | F5: =Q399 -> 14 | G5: =F5/$I$23*100 -> 3.5532994923857872 | O5: 1 | P5: 0 | Q5: =1-SUM(O5:P5) -> 0 | R5: 1 | S5: 0 | T5: =1-SUM(R5:S5) -> 0 | U5: 1 | V5: 0 | W5: =1-SUM(U5:V5) -> 0 | X5: 1 | Y5: 0 | Z5: =1-SUM(X5:Y5) -> 0 | AA5: 1 | AB5: 0 | AC5: =1-SUM(AA5:AB5) -> 0 | AD5: 0 | AE5: 1 | AF5: =1-SUM(AD5:AE5) -> 0 | AG5: 0 | AH5: 1 | AI5: =1-SUM(AG5:AH5) -> 0 | AJ5: 1 | AK5: 0 | AL5: =1-SUM(AJ5:AK5) -> 0 | AM5: 1 | AN5: 0 | AO5: =1-SUM(AM5:AN5) -> 0 | AP5: 0 | AQ5: 1 | AR5: =1-SUM(AP5:AQ5) -> 0 | AS5: 1 | AT5: 0 | AU5: =1-SUM(AS5:AT5) -> 0 | AV5: 1 | AW5: 0 | AX5: =1-SUM(AV5:AW5) -> 0 | AY5: 1 | AZ5: 0 | BA5: =1-SUM(AY5:AZ5) -> 0 | BB5: 0 | BC5: 1 | BD5: =1-SUM(BB5:BC5) -> 0 | BE5: 1 | BF5: 0 | BG5: =1-SUM(BE5:BF5) -> 0 | BH5: 0 | BI5: 1 | BJ5: =1-SUM(BH5:BI5) -> 0 | BK5: 0 | BL5: 1 | BM5: =1-SUM(BK5:BL5) -> 0 | BN5: 1 | BO5: =1-BN5 -> 0
A6: LP | B6: =R399 -> 209 | C6: =B6/$I$23*100 -> 53.045685279187815 | D6: =S399 -> 171 | E6: =D6/$I$23*100 -> 43.401015228426395 | F6: =T399 -> 14 | G6: =F6/$I$23*100 -> 3.5532994923857872 | O6: 1 | P6: 0 | Q6: =1-SUM(O6:P6) -> 0 | R6: 1 | S6: 0 | T6: =1-SUM(R6:S6) -> 0 | U6: 1 | V6: 0 | W6: =1-SUM(U6:V6) -> 0 | X6: 1 | Y6: 0 | Z6: =1-SUM(X6:Y6) -> 0 | AA6: 1 | AB6: 0 | AC6: =1-SUM(AA6:AB6) -> 0 | AD6: 0 | AE6: 1 | AF6: =1-SUM(AD6:AE6) -> 0 | AG6: 0 | AH6: 1 | AI6: =1-SUM(AG6:AH6) -> 0 | AJ6: 1 | AK6: 0 | AL6: =1-SUM(AJ6:AK6) -> 0 | AM6: 1 | AN6: 0 | AO6: =1-SUM(AM6:AN6) -> 0 | AP6: 0 | AQ6: 1 | AR6: =1-SUM(AP6:AQ6) -> 0 | AS6: 1 | AT6: 0 | AU6: =1-SUM(AS6:AT6) -> 0 | AV6: 1 | AW6: 0 | AX6: =1-SUM(AV6:AW6) -> 0 | AY6: 0 | AZ6: 1 | BA6: =1-SUM(AY6:AZ6) -> 0 | BB6: 0 | BC6: 1 | BD6: =1-SUM(BB6:BC6) -> 0 | BE6: 1 | BF6: 0 | BG6: =1-SUM(BE6:BF6) -> 0 | BH6: 0 | BI6: 1 | BJ6: =1-SUM(BH6:BI6) -> 0 | BK6: 0 | BL6: 1 | BM6: =1-SUM(BK6:BL6) -> 0 | BN6: 1 | BO6: =1-BN6 -> 0
A7: SIMPLESSO | B7: =U399 -> 158 | C7: =B7/$I$23*100 -> 40.101522842639589 | D7: =V399 -> 218 | E7: =D7/$I$23*100 -> 55.329949238578678 | F7: =W399 -> 18 | G7: =F7/$I$23*100 -> 4.5685279187817258 | O7: 1 | P7: 0 | Q7: =1-SUM(O7:P7) -> 0 | R7: 1 | S7: 0 | T7: =1-SUM(R7:S7) -> 0 | U7: 1 | V7: 0 | W7: =1-SUM(U7:V7) -> 0 | X7: 1 | Y7: 0 | Z7: =1-SUM(X7:Y7) -> 0 | AA7: 1 | AB7: 0 | AC7: =1-SUM(AA7:AB7) -> 0 | AD7: 0 | AE7: 1 | AF7: =1-SUM(AD7:AE7) -> 0 | AG7: 0 | AH7: 1 | AI7: =1-SUM(AG7:AH7) -> 0 | AJ7: 1 | AK7: 0 | AL7: =1-SUM(AJ7:AK7) -> 0 | AM7: 1 | AN7: 0 | AO7: =1-SUM(AM7:AN7) -> 0 | AP7: 0 | AQ7: 1 | AR7: =1-SUM(AP7:AQ7) -> 0 | AS7: 1 | AT7: 0 | AU7: =1-SUM(AS7:AT7) -> 0 | AV7: 1 | AW7: 0 | AX7: =1-SUM(AV7:AW7) -> 0 | AY7: 0 | AZ7: 1 | BA7: =1-SUM(AY7:AZ7) -> 0 | BB7: 0 | BC7: 1 | BD7: =1-SUM(BB7:BC7) -> 0 | BE7: 1 | BF7: 0 | BG7: =1-SUM(BE7:BF7) -> 0 | BH7: 0 | BI7: 1 | BJ7: =1-SUM(BH7:BI7) -> 0 | BK7: 0 | BL7: 1 | BM7: =1-SUM(BK7:BL7) -> 0 | BN7: 1 | BO7: =1-BN7 -> 0
A8: DUALITA' | B8: =X399 -> 155 | C8: =B8/$I$23*100 -> 39.340101522842644 | D8: =Y399 -> 225 | E8: =D8/$I$23*100 -> 57.106598984771573 | F8: =Z399 -> 14 | G8: =F8/$I$23*100 -> 3.5532994923857872 | O8: 1 | P8: 0 | Q8: =1-SUM(O8:P8) -> 0 | R8: 1 | S8: 0 | T8: =1-SUM(R8:S8) -> 0 | U8: 1 | V8: 0 | W8: =1-SUM(U8:V8) -> 0 | X8: 1 | Y8: 0 | Z8: =1-SUM(X8:Y8) -> 0 | AA8: 1 | AB8: 0 | AC8: =1-SUM(AA8:AB8) -> 0 | AD8: 0 | AE8: 1 | AF8: =1-SUM(AD8:AE8) -> 0 | AG8: 0 | AH8: 1 | AI8: =1-SUM(AG8:AH8) -> 0 | AJ8: 1 | AK8: 0 | AL8: =1-SUM(AJ8:AK8) -> 0 | AM8: 1 | AN8: 0 | AO8: =1-SUM(AM8:AN8) -> 0 | AP8: 0 | AQ8: 1 | AR8: =1-SUM(AP8:AQ8) -> 0 | AS8: 1 | AT8: 0 | AU8: =1-SUM(AS8:AT8) -> 0 | AV8: 1 | AW8: 0 | AX8: =1-SUM(AV8:AW8) -> 0 | AY8: 0 | AZ8: 1 | BA8: =1-SUM(AY8:AZ8) -> 0 | BB8: 0 | BC8: 1 | BD8: =1-SUM(BB8:BC8) -> 0 | BE8: 1 | BF8: 0 | BG8: =1-SUM(BE8:BF8) -> 0 | BH8: 0 | BI8: 1 | BJ8: =1-SUM(BH8:BI8) -> 0 | BK8: 0 | BL8: 1 | BM8: =1-SUM(BK8:BL8) -> 0 | BN8: 1 | BO8: =1-BN8 -> 0
A9: ILP | B9: =AA399 -> 209 | C9: =B9/$I$23*100 -> 53.045685279187815 | D9: =AB399 -> 170 | E9: =D9/$I$23*100 -> 43.147208121827411 | F9: =AC399 -> 15 | G9: =F9/$I$23*100 -> 3.8071065989847721 | O9: 1 | P9: 0 | Q9: =1-SUM(O9:P9) -> 0 | R9: 1 | S9: 0 | T9: =1-SUM(R9:S9) -> 0 | U9: 0 | V9: 1 | W9: =1-SUM(U9:V9) -> 0 | X9: 0 | Y9: 1 | Z9: =1-SUM(X9:Y9) -> 0 | AA9: 1 | AB9: 0 | AC9: =1-SUM(AA9:AB9) -> 0 | AD9: 0 | AE9: 1 | AF9: =1-SUM(AD9:AE9) -> 0 | AG9: 0 | AH9: 1 | AI9: =1-SUM(AG9:AH9) -> 0 | AJ9: 1 | AK9: 0 | AL9: =1-SUM(AJ9:AK9) -> 0 | AM9: 1 | AN9: 0 | AO9: =1-SUM(AM9:AN9) -> 0 | AP9: 0 | AQ9: 1 | AR9: =1-SUM(AP9:AQ9) -> 0 | AS9: 0 | AT9: 1 | AU9: =1-SUM(AS9:AT9) -> 0 | AV9: 0 | AW9: 1 | AX9: =1-SUM(AV9:AW9) -> 0 | AY9: 0 | AZ9: 1 | BA9: =1-SUM(AY9:AZ9) -> 0 | BB9: 0 | BC9: 1 | BD9: =1-SUM(BB9:BC9) -> 0 | BE9: 0 | BF9: 1 | BG9: =1-SUM(BE9:BF9) -> 0 | BH9: 1 | BI9: 0 | BJ9: =1-SUM(BH9:BI9) -> 0 | BK9: 0 | BL9: 1 | BM9: =1-SUM(BK9:BL9) -> 0 | BN9: 1 | BO9: =1-BN9 -> 0
A10: NLP (COND. OTT.) | B10: =AD399 -> 68 | C10: =B10/$I$23*100 -> 17.258883248730964 | D10: =AE399 -> 308 | E10: =D10/$I$23*100 -> 78.172588832487307 | F10: =AF399 -> 18 | G10: =F10/$I$23*100 -> 4.5685279187817258 | O10: 1 | P10: 0 | Q10: =1-SUM(O10:P10) -> 0 | R10: 1 | S10: 0 | T10: =1-SUM(R10:S10) -> 0 | U10: 1 | V10: 0 | W10: =1-SUM(U10:V10) -> 0 | X10: 1 | Y10: 0 | Z10: =1-SUM(X10:Y10) -> 0 | AA10: 0 | AB10: 1 | AC10: =1-SUM(AA10:AB10) -> 0 | AD10: 1 | AE10: 0 | AF10: =1-SUM(AD10:AE10) -> 0 | AG10: 1 | AH10: 0 | AI10: =1-SUM(AG10:AH10) -> 0 | AJ10: 0 | AK10: 1 | AL10: =1-SUM(AJ10:AK10) -> 0 | AM10: 0 | AN10: 1 | AO10: =1-SUM(AM10:AN10) -> 0 | AP10: 0 | AQ10: 1 | AR10: =1-SUM(AP10:AQ10) -> 0 | AS10: 0 | AT10: 1 | AU10: =1-SUM(AS10:AT10) -> 0 | AV10: 0 | AW10: 1 | AX10: =1-SUM(AV10:AW10) -> 0 | AY10: 0 | AZ10: 1 | BA10: =1-SUM(AY10:AZ10) -> 0 | BB10: 0 | BC10: 1 | BD10: =1-SUM(BB10:BC10) -> 0 | BE10: 0 | BF10: 1 | BG10: =1-SUM(BE10:BF10) -> 0 | BH10: 0 | BI10: 1 | BJ10: =1-SUM(BH10:BI10) -> 0 | BK10: 0 | BL10: 1 | BM10: =1-SUM(BK10:BL10) -> 0 | BN10: 1 | BO10: =1-BN10 -> 0
A11: NLP (ALGORITMI) | B11: =AG399 -> 61 | C11: =B11/$I$23*100 -> 15.482233502538071 | D11: =AH399 -> 315 | E11: =D11/$I$23*100 -> 79.949238578680209 | F11: =AI399 -> 18 | G11: =F11/$I$23*100 -> 4.5685279187817258 | O11: 1 | P11: 0 | Q11: =1-SUM(O11:P11) -> 0 | R11: 1 | S11: 0 | T11: =1-SUM(R11:S11) -> 0 | U11: 1 | V11: 0 | W11: =1-SUM(U11:V11) -> 0 | X11: 1 | Y11: 0 | Z11: =1-SUM(X11:Y11) -> 0 | AA11: 1 | AB11: 0 | AC11: =1-SUM(AA11:AB11) -> 0 | AD11: 0 | AE11: 1 | AF11: =1-SUM(AD11:AE11) -> 0 | AG11: 0 | AH11: 1 | AI11: =1-SUM(AG11:AH11) -> 0 | AJ11: 1 | AK11: 0 | AL11: =1-SUM(AJ11:AK11) -> 0 | AM11: 0 | AN11: 1 | AO11: =1-SUM(AM11:AN11) -> 0 | AP11: 0 | AQ11: 1 | AR11: =1-SUM(AP11:AQ11) -> 0 | AS11: 0 | AT11: 1 | AU11: =1-SUM(AS11:AT11) -> 0 | AV11: 1 | AW11: 0 | AX11: =1-SUM(AV11:AW11) -> 0 | AY11: 0 | AZ11: 1 | BA11: =1-SUM(AY11:AZ11) -> 0 | BB11: 1 | BC11: 0 | BD11: =1-SUM(BB11:BC11) -> 0 | BE11: 0 | BF11: 1 | BG11: =1-SUM(BE11:BF11) -> 0 | BH11: 0 | BI11: 1 | BJ11: =1-SUM(BH11:BI11) -> 0 | BK11: 0 | BL11: 1 | BM11: =1-SUM(BK11:BL11) -> 0 | BN11: 1 | BO11: =1-BN11 -> 0
A12: GRAFI | B12: =AJ399 -> 198 | C12: =B12/$I$23*100 -> 50.253807106598977 | D12: =AK399 -> 182 | E12: =D12/$I$23*100 -> 46.192893401015226 | F12: =AL399 -> 14 | G12: =F12/$I$23*100 -> 3.5532994923857872 | O12: 1 | P12: 0 | Q12: =1-SUM(O12:P12) -> 0 | R12: 0 | S12: 1 | T12: =1-SUM(R12:S12) -> 0 | U12: 0 | V12: 1 | W12: =1-SUM(U12:V12) -> 0 | X12: 0 | Y12: 1 | Z12: =1-SUM(X12:Y12) -> 0 | AA12: 1 | AB12: 0 | AC12: =1-SUM(AA12:AB12) -> 0 | AD12: 0 | AE12: 1 | AF12: =1-SUM(AD12:AE12) -> 0 | AG12: 0 | AH12: 1 | AI12: =1-SUM(AG12:AH12) -> 0 | AJ12: 0 | AK12: 1 | AL12: =1-SUM(AJ12:AK12) -> 0 | AM12: 0 | AN12: 1 | AO12: =1-SUM(AM12:AN12) -> 0 | AP12: 0 | AQ12: 1 | AR12: =1-SUM(AP12:AQ12) -> 0 | AS12: 1 | AT12: 0 | AU12: =1-SUM(AS12:AT12) -> 0 | AV12: 1 | AW12: 0 | AX12: =1-SUM(AV12:AW12) -> 0 | AY12: 1 | AZ12: 0 | BA12: =1-SUM(AY12:AZ12) -> 0 | BB12: 0 | BC12: 1 | BD12: =1-SUM(BB12:BC12) -> 0 | BE12: 0 | BF12: 1 | BG12: =1-SUM(BE12:BF12) -> 0 | BH12: 0 | BI12: 1 | BJ12: =1-SUM(BH12:BI12) -> 0 | BK12: 0 | BL12: 1 | BM12: =1-SUM(BK12:BL12) -> 0 | BN12: 0 | BO12: =1-BN12 -> 1
A13: RETI | B13: =AM399 -> 157 | C13: =B13/$I$23*100 -> 39.847715736040605 | D13: =AN399 -> 223 | E13: =D13/$I$23*100 -> 56.598984771573605 | F13: =AO399 -> 14 | G13: =F13/$I$23*100 -> 3.5532994923857872 | O13: 1 | P13: 0 | Q13: =1-SUM(O13:P13) -> 0 | R13: 0 | S13: 1 | T13: =1-SUM(R13:S13) -> 0 | U13: 0 | V13: 1 | W13: =1-SUM(U13:V13) -> 0 | X13: 0 | Y13: 1 | Z13: =1-SUM(X13:Y13) -> 0 | AA13: 0 | AB13: 1 | AC13: =1-SUM(AA13:AB13) -> 0 | AD13: 0 | AE13: 1 | AF13: =1-SUM(AD13:AE13) -> 0 | AG13: 0 | AH13: 1 | AI13: =1-SUM(AG13:AH13) -> 0 | AJ13: 0 | AK13: 1 | AL13: =1-SUM(AJ13:AK13) -> 0 | AM13: 0 | AN13: 1 | AO13: =1-SUM(AM13:AN13) -> 0 | AP13: 0 | AQ13: 1 | AR13: =1-SUM(AP13:AQ13) -> 0 | AS13: 1 | AT13: 0 | AU13: =1-SUM(AS13:AT13) -> 0 | AV13: 0 | AW13: 1 | AX13: =1-SUM(AV13:AW13) -> 0 | AY13: 0 | AZ13: 1 | BA13: =1-SUM(AY13:AZ13) -> 0 | BB13: 0 | BC13: 1 | BD13: =1-SUM(BB13:BC13) -> 0 | BE13: 0 | BF13: 1 | BG13: =1-SUM(BE13:BF13) -> 0 | BH13: 1 | BI13: 0 | BJ13: =1-SUM(BH13:BI13) -> 0 | BK13: 0 | BL13: 1 | BM13: =1-SUM(BK13:BL13) -> 0 | BN13: 1 | BO13: =1-BN13 -> 0
A14: GIOCHI | B14: =AP399 -> 26 | C14: =B14/$I$23*100 -> 6.5989847715736047 | D14: =AQ399 -> 354 | E14: =D14/$I$23*100 -> 89.847715736040612 | F14: =AR399 -> 14 | G14: =F14/$I$23*100 -> 3.5532994923857872 | O14: 1 | P14: 0 | Q14: =1-SUM(O14:P14) -> 0 | R14: 0 | S14: 1 | T14: =1-SUM(R14:S14) -> 0 | U14: 0 | V14: 1 | W14: =1-SUM(U14:V14) -> 0 | X14: 0 | Y14: 1 | Z14: =1-SUM(X14:Y14) -> 0 | AA14: 0 | AB14: 1 | AC14: =1-SUM(AA14:AB14) -> 0 | AD14: 0 | AE14: 1 | AF14: =1-SUM(AD14:AE14) -> 0 | AG14: 0 | AH14: 1 | AI14: =1-SUM(AG14:AH14) -> 0 | AJ14: 0 | AK14: 1 | AL14: =1-SUM(AJ14:AK14) -> 0 | AM14: 0 | AN14: 1 | AO14: =1-SUM(AM14:AN14) -> 0 | AP14: 0 | AQ14: 1 | AR14: =1-SUM(AP14:AQ14) -> 0 | AS14: 0 | AT14: 1 | AU14: =1-SUM(AS14:AT14) -> 0 | AV14: 0 | AW14: 1 | AX14: =1-SUM(AV14:AW14) -> 0 | AY14: 0 | AZ14: 1 | BA14: =1-SUM(AY14:AZ14) -> 0 | BB14: 0 | BC14: 1 | BD14: =1-SUM(BB14:BC14) -> 0 | BE14: 0 | BF14: 1 | BG14: =1-SUM(BE14:BF14) -> 0 | BH14: 0 | BI14: 1 | BJ14: =1-SUM(BH14:BI14) -> 0 | BK14: 0 | BL14: 1 | BM14: =1-SUM(BK14:BL14) -> 0 | BN14: 1 | BO14: =1-BN14 -> 0
A15: COMPLESSITA' | B15: =AS399 -> 115 | C15: =B15/$I$23*100 -> 29.187817258883246 | D15: =AT399 -> 262 | E15: =D15/$I$23*100 -> 66.497461928934015 | F15: =AU399 -> 17 | G15: =F15/$I$23*100 -> 4.3147208121827409 | O15: 0 | P15: 1 | Q15: =1-SUM(O15:P15) -> 0 | R15: 1 | S15: 0 | T15: =1-SUM(R15:S15) -> 0 | U15: 1 | V15: 0 | W15: =1-SUM(U15:V15) -> 0 | X15: 1 | Y15: 0 | Z15: =1-SUM(X15:Y15) -> 0 | AA15: 0 | AB15: 1 | AC15: =1-SUM(AA15:AB15) -> 0 | AD15: 0 | AE15: 1 | AF15: =1-SUM(AD15:AE15) -> 0 | AG15: 0 | AH15: 1 | AI15: =1-SUM(AG15:AH15) -> 0 | AJ15: 0 | AK15: 1 | AL15: =1-SUM(AJ15:AK15) -> 0 | AM15: 0 | AN15: 1 | AO15: =1-SUM(AM15:AN15) -> 0 | AP15: 0 | AQ15: 1 | AR15: =1-SUM(AP15:AQ15) -> 0 | AS15: 0 | AT15: 1 | AU15: =1-SUM(AS15:AT15) -> 0 | AV15: 0 | AW15: 1 | AX15: =1-SUM(AV15:AW15) -> 0 | AY15: 0 | AZ15: 1 | BA15: =1-SUM(AY15:AZ15) -> 0 | BB15: 0 | BC15: 1 | BD15: =1-SUM(BB15:BC15) -> 0 | BE15: 0 | BF15: 1 | BG15: =1-SUM(BE15:BF15) -> 0 | BH15: 0 | BI15: 1 | BJ15: =1-SUM(BH15:BI15) -> 0 | BK15: 0 | BL15: 1 | BM15: =1-SUM(BK15:BL15) -> 0 | BN15: 1 | BO15: =1-BN15 -> 0
A16: BRANCH-AND-BOUND | B16: =AV399 -> 168 | C16: =B16/$I$23*100 -> 42.639593908629443 | D16: =AW399 -> 211 | E16: =D16/$I$23*100 -> 53.55329949238579 | F16: =AX399 -> 15 | G16: =F16/$I$23*100 -> 3.8071065989847721 | O16: 0 | P16: 1 | Q16: =1-SUM(O16:P16) -> 0 | R16: 0 | S16: 1 | T16: =1-SUM(R16:S16) -> 0 | U16: 0 | V16: 1 | W16: =1-SUM(U16:V16) -> 0 | X16: 0 | Y16: 1 | Z16: =1-SUM(X16:Y16) -> 0 | AA16: 0 | AB16: 1 | AC16: =1-SUM(AA16:AB16) -> 0 | AD16: 0 | AE16: 1 | AF16: =1-SUM(AD16:AE16) -> 0 | AG16: 0 | AH16: 1 | AI16: =1-SUM(AG16:AH16) -> 0 | AJ16: 1 | AK16: 0 | AL16: =1-SUM(AJ16:AK16) -> 0 | AM16: 1 | AN16: 0 | AO16: =1-SUM(AM16:AN16) -> 0 | AP16: 0 | AQ16: 1 | AR16: =1-SUM(AP16:AQ16) -> 0 | AS16: 1 | AT16: 0 | AU16: =1-SUM(AS16:AT16) -> 0 | AV16: 1 | AW16: 0 | AX16: =1-SUM(AV16:AW16) -> 0 | AY16: 1 | AZ16: 0 | BA16: =1-SUM(AY16:AZ16) -> 0 | BB16: 1 | BC16: 0 | BD16: =1-SUM(BB16:BC16) -> 0 | BE16: 1 | BF16: 0 | BG16: =1-SUM(BE16:BF16) -> 0 | BH16: 0 | BI16: 1 | BJ16: =1-SUM(BH16:BI16) -> 0 | BK16: 0 | BL16: 1 | BM16: =1-SUM(BK16:BL16) -> 0 | BN16: 1 | BO16: =1-BN16 -> 0
A17: RILASSAMENTI | B17: =AY399 -> 121 | C17: =B17/$I$23*100 -> 30.710659898477154 | D17: =AZ399 -> 259 | E17: =D17/$I$23*100 -> 65.736040609137063 | F17: =BA399 -> 14 | G17: =F17/$I$23*100 -> 3.5532994923857872 | O17: 0 | P17: 1 | Q17: =1-SUM(O17:P17) -> 0 | R17: 0 | S17: 1 | T17: =1-SUM(R17:S17) -> 0 | U17: 0 | V17: 1 | W17: =1-SUM(U17:V17) -> 0 | X17: 0 | Y17: 1 | Z17: =1-SUM(X17:Y17) -> 0 | AA17: 0 | AB17: 1 | AC17: =1-SUM(AA17:AB17) -> 0 | AD17: 0 | AE17: 1 | AF17: =1-SUM(AD17:AE17) -> 0 | AG17: 0 | AH17: 1 | AI17: =1-SUM(AG17:AH17) -> 0 | AJ17: 0 | AK17: 1 | AL17: =1-SUM(AJ17:AK17) -> 0 | AM17: 0 | AN17: 1 | AO17: =1-SUM(AM17:AN17) -> 0 | AP17: 0 | AQ17: 1 | AR17: =1-SUM(AP17:AQ17) -> 0 | AS17: 0 | AT17: 1 | AU17: =1-SUM(AS17:AT17) -> 0 | AV17: 0 | AW17: 1 | AX17: =1-SUM(AV17:AW17) -> 0 | AY17: 0 | AZ17: 1 | BA17: =1-SUM(AY17:AZ17) -> 0 | BB17: 0 | BC17: 1 | BD17: =1-SUM(BB17:BC17) -> 0 | BE17: 0 | BF17: 1 | BG17: =1-SUM(BE17:BF17) -> 0 | BH17: 1 | BI17: 0 | BJ17: =1-SUM(BH17:BI17) -> 0 | BK17: 0 | BL17: 1 | BM17: =1-SUM(BK17:BL17) -> 0 | BN17: 1 | BO17: =1-BN17 -> 0
A18: PROG. DINAMICA | B18: =BB399 -> 73 | C18: =B18/$I$23*100 -> 18.527918781725887 | D18: =BC399 -> 307 | E18: =D18/$I$23*100 -> 77.918781725888323 | F18: =BD399 -> 14 | G18: =F18/$I$23*100 -> 3.5532994923857872 | O18: 1 | P18: 0 | Q18: =1-SUM(O18:P18) -> 0 | R18: 1 | S18: 0 | T18: =1-SUM(R18:S18) -> 0 | U18: 1 | V18: 0 | W18: =1-SUM(U18:V18) -> 0 | X18: 0 | Y18: 1 | Z18: =1-SUM(X18:Y18) -> 0 | AA18: 1 | AB18: 0 | AC18: =1-SUM(AA18:AB18) -> 0 | AD18: 1 | AE18: 0 | AF18: =1-SUM(AD18:AE18) -> 0 | AG18: 0 | AH18: 1 | AI18: =1-SUM(AG18:AH18) -> 0 | AJ18: 1 | AK18: 0 | AL18: =1-SUM(AJ18:AK18) -> 0 | AM18: 0 | AN18: 1 | AO18: =1-SUM(AM18:AN18) -> 0 | AP18: 0 | AQ18: 1 | AR18: =1-SUM(AP18:AQ18) -> 0 | AS18: 0 | AT18: 1 | AU18: =1-SUM(AS18:AT18) -> 0 | AV18: 1 | AW18: 0 | AX18: =1-SUM(AV18:AW18) -> 0 | AY18: 0 | AZ18: 1 | BA18: =1-SUM(AY18:AZ18) -> 0 | BB18: 1 | BC18: 0 | BD18: =1-SUM(BB18:BC18) -> 0 | BE18: 0 | BF18: 1 | BG18: =1-SUM(BE18:BF18) -> 0 | BH18: 1 | BI18: 0 | BJ18: =1-SUM(BH18:BI18) -> 0 | BK18: 0 | BL18: 1 | BM18: =1-SUM(BK18:BL18) -> 0 | BN18: 1 | BO18: =1-BN18 -> 0
A19: METAEURISTICI | B19: =BE399 -> 86 | C19: =B19/$I$23*100 -> 21.82741116751269 | D19: =BF399 -> 293 | E19: =D19/$I$23*100 -> 74.365482233502533 | F19: =BG399 -> 15 | G19: =F19/$I$23*100 -> 3.8071065989847721 | O19: 1 | P19: 0 | Q19: =1-SUM(O19:P19) -> 0 | R19: 0 | S19: 1 | T19: =1-SUM(R19:S19) -> 0 | U19: 0 | V19: 1 | W19: =1-SUM(U19:V19) -> 0 | X19: 0 | Y19: 1 | Z19: =1-SUM(X19:Y19) -> 0 | AA19: 0 | AB19: 1 | AC19: =1-SUM(AA19:AB19) -> 0 | AD19: 0 | AE19: 1 | AF19: =1-SUM(AD19:AE19) -> 0 | AG19: 0 | AH19: 1 | AI19: =1-SUM(AG19:AH19) -> 0 | AJ19: 1 | AK19: 0 | AL19: =1-SUM(AJ19:AK19) -> 0 | AM19: 0 | AN19: 1 | AO19: =1-SUM(AM19:AN19) -> 0 | AP19: 0 | AQ19: 1 | AR19: =1-SUM(AP19:AQ19) -> 0 | AS19: 1 | AT19: 0 | AU19: =1-SUM(AS19:AT19) -> 0 | AV19: 0 | AW19: 1 | AX19: =1-SUM(AV19:AW19) -> 0 | AY19: 0 | AZ19: 1 | BA19: =1-SUM(AY19:AZ19) -> 0 | BB19: 0 | BC19: 1 | BD19: =1-SUM(BB19:BC19) -> 0 | BE19: 0 | BF19: 1 | BG19: =1-SUM(BE19:BF19) -> 0 | BH19: 0 | BI19: 1 | BJ19: =1-SUM(BH19:BI19) -> 0 | BK19: 0 | BL19: 1 | BM19: =1-SUM(BK19:BL19) -> 0 | BN19: 1 | BO19: =1-BN19 -> 0
A20: SIMULAZIONE | B20: =BH399 -> 60 | C20: =B20/$I$23*100 -> 15.228426395939088 | D20: =BI399 -> 317 | E20: =D20/$I$23*100 -> 80.456852791878177 | F20: =BJ399 -> 17 | G20: =F20/$I$23*100 -> 4.3147208121827409 | O20: 1 | P20: 0 | Q20: =1-SUM(O20:P20) -> 0 | R20: 0 | S20: 1 | T20: =1-SUM(R20:S20) -> 0 | U20: 0 | V20: 1 | W20: =1-SUM(U20:V20) -> 0 | X20: 0 | Y20: 1 | Z20: =1-SUM(X20:Y20) -> 0 | AA20: 0 | AB20: 1 | AC20: =1-SUM(AA20:AB20) -> 0 | AD20: 0 | AE20: 1 | AF20: =1-SUM(AD20:AE20) -> 0 | AG20: 0 | AH20: 1 | AI20: =1-SUM(AG20:AH20) -> 0 | AJ20: 1 | AK20: 0 | AL20: =1-SUM(AJ20:AK20) -> 0 | AM20: 0 | AN20: 1 | AO20: =1-SUM(AM20:AN20) -> 0 | AP20: 0 | AQ20: 1 | AR20: =1-SUM(AP20:AQ20) -> 0 | AS20: 1 | AT20: 0 | AU20: =1-SUM(AS20:AT20) -> 0 | AV20: 0 | AW20: 1 | AX20: =1-SUM(AV20:AW20) -> 0 | AY20: 0 | AZ20: 1 | BA20: =1-SUM(AY20:AZ20) -> 0 | BB20: 0 | BC20: 1 | BD20: =1-SUM(BB20:BC20) -> 0 | BE20: 0 | BF20: 1 | BG20: =1-SUM(BE20:BF20) -> 0 | BH20: 0 | BI20: 1 | BJ20: =1-SUM(BH20:BI20) -> 0 | BK20: 0 | BL20: 1 | BM20: =1-SUM(BK20:BL20) -> 0 | BN20: 1 | BO20: =1-BN20 -> 0
A21: MCDA | B21: =BK399 -> 41 | C21: =B21/$I$23*100 -> 10.406091370558377 | D21: =BL399 -> 339 | E21: =D21/$I$23*100 -> 86.040609137055839 | F21: =BM399 -> 14 | G21: =F21/$I$23*100 -> 3.5532994923857872 | O21: 1 | P21: 0 | Q21: =1-SUM(O21:P21) -> 0 | R21: 0 | S21: 1 | T21: =1-SUM(R21:S21) -> 0 | U21: 0 | V21: 1 | W21: =1-SUM(U21:V21) -> 0 | X21: 0 | Y21: 1 | Z21: =1-SUM(X21:Y21) -> 0 | AA21: 0 | AB21: 1 | AC21: =1-SUM(AA21:AB21) -> 0 | AD21: 0 | AE21: 1 | AF21: =1-SUM(AD21:AE21) -> 0 | AG21: 0 | AH21: 1 | AI21: =1-SUM(AG21:AH21) -> 0 | AJ21: 1 | AK21: 0 | AL21: =1-SUM(AJ21:AK21) -> 0 | AM21: 0 | AN21: 1 | AO21: =1-SUM(AM21:AN21) -> 0 | AP21: 0 | AQ21: 1 | AR21: =1-SUM(AP21:AQ21) -> 0 | AS21: 1 | AT21: 0 | AU21: =1-SUM(AS21:AT21) -> 0 | AV21: 1 | AW21: 0 | AX21: =1-SUM(AV21:AW21) -> 0 | AY21: 0 | AZ21: 1 | BA21: =1-SUM(AY21:AZ21) -> 0 | BB21: 0 | BC21: 1 | BD21: =1-SUM(BB21:BC21) -> 0 | BE21: 1 | BF21: 0 | BG21: =1-SUM(BE21:BF21) -> 0 | BH21: 0 | BI21: 1 | BJ21: =1-SUM(BH21:BI21) -> 0 | BK21: 0 | BL21: 1 | BM21: =1-SUM(BK21:BL21) -> 0 | BN21: 0 | BO21: =1-BN21 -> 1
A22: ALTRO (*) | B22: =BN399 -> 182 | C22: =B22/$I$23*100 -> 46.192893401015226 | D22: =BO399 -> 212 | E22: =D22/$I$23*100 -> 53.807106598984767 | F22: 0 | G22: =F22/$I$23*100 -> 0 | O22: 1 | P22: 0 | Q22: =1-SUM(O22:P22) -> 0 | R22: 0 | S22: 1 | T22: =1-SUM(R22:S22) -> 0 | U22: 0 | V22: 1 | W22: =1-SUM(U22:V22) -> 0 | X22: 0 | Y22: 1 | Z22: =1-SUM(X22:Y22) -> 0 | AA22: 0 | AB22: 1 | AC22: =1-SUM(AA22:AB22) -> 0 | AD22: 0 | AE22: 1 | AF22: =1-SUM(AD22:AE22) -> 0 | AG22: 0 | AH22: 1 | AI22: =1-SUM(AG22:AH22) -> 0 | AJ22: 0 | AK22: 1 | AL22: =1-SUM(AJ22:AK22) -> 0 | AM22: 0 | AN22: 1 | AO22: =1-SUM(AM22:AN22) -> 0 | AP22: 0 | AQ22: 1 | AR22: =1-SUM(AP22:AQ22) -> 0 | AS22: 0 | AT22: 1 | AU22: =1-SUM(AS22:AT22) -> 0 | AV22: 0 | AW22: 1 | AX22: =1-SUM(AV22:AW22) -> 0 | AY22: 0 | AZ22: 1 | BA22: =1-SUM(AY22:AZ22) -> 0 | BB22: 0 | BC22: 1 | BD22: =1-SUM(BB22:BC22) -> 0 | BE22: 1 | BF22: 0 | BG22: =1-SUM(BE22:BF22) -> 0 | BH22: 0 | BI22: 1 | BJ22: =1-SUM(BH22:BI22) -> 0 | BK22: 0 | BL22: 1 | BM22: =1-SUM(BK22:BL22) -> 0 | BN22: 0 | BO22: =1-BN22 -> 1
A23: Totale | B23: =B22+B21+B20+B19+B18+B17+B16+B15+B14+B13+B12+B11+B10+B9+B8+B7+B6+B5 -> 2399 | D23: =D22+D21+D20+D19+D18+D17+D16+D15+D14+D13+D12+D11+D10+D9+D8+D7+D6+D5 -> 4434 | F23: =F22+F21+F20+F19+F18+F17+F16+F15+F14+F13+F12+F11+F10+F9+F8+F7+F6+F5 -> 259 | I23: =F5+D5+B5 -> 394 | O23: 1 | P23: 0 | Q23: =1-SUM(O23:P23) -> 0 | R23: 0 | S23: 1 | T23: =1-SUM(R23:S23) -> 0 | U23: 0 | V23: 1 | W23: =1-SUM(U23:V23) -> 0 | X23: 0 | Y23: 1 | Z23: =1-SUM(X23:Y23) -> 0 | AA23: 0 | AB23: 1 | AC23: =1-SUM(AA23:AB23) -> 0 | AD23: 0 | AE23: 1 | AF23: =1-SUM(AD23:AE23) -> 0 | AG23: 0 | AH23: 1 | AI23: =1-SUM(AG23:AH23) -> 0 | AJ23: 0 | AK23: 1 | AL23: =1-SUM(AJ23:AK23) -> 0 | AM23: 0 | AN23: 1 | AO23: =1-SUM(AM23:AN23) -> 0 | AP23: 0 | AQ23: 1 | AR23: =1-SUM(AP23:AQ23) -> 0 | AS23: 0 | AT23: 1 | AU23: =1-SUM(AS23:AT23) -> 0 | AV23: 0 | AW23: 1 | AX23: =1-SUM(AV23:AW23) -> 0 | AY23: 0 | AZ23: 1 | BA23: =1-SUM(AY23:AZ23) -> 0 | BB23: 0 | BC23: 1 | BD23: =1-SUM(BB23:BC23) -> 0 | BE23: 0 | BF23: 1 | BG23: =1-SUM(BE23:BF23) -> 0 | BH23: 0 | BI23: 1 | BJ23: =1-SUM(BH23:BI23) -> 0 | BK23: 0 | BL23: 1 | BM23: =1-SUM(BK23:BL23) -> 0 | BN23: 0 | BO23: =1-BN23 -> 1
O24: 1 | P24: 0 | Q24: =1-SUM(O24:P24) -> 0 | R24: 0 | S24: 1 | T24: =1-SUM(R24:S24) -> 0 | U24: 0 | V24: 1 | W24: =1-SUM(U24:V24) -> 0 | X24: 0 | Y24: 1 | Z24: =1-SUM(X24:Y24) -> 0 | AA24: 0 | AB24: 1 | AC24: =1-SUM(AA24:AB24) -> 0 | AD24: 0 | AE24: 1 | AF24: =1-SUM(AD24:AE24) -> 0 | AG24: 0 | AH24: 1 | AI24: =1-SUM(AG24:AH24) -> 0 | AJ24: 0 | AK24: 1 | AL24: =1-SUM(AJ24:AK24) -> 0 | AM24: 0 | AN24: 1 | AO24: =1-SUM(AM24:AN24) -> 0 | AP24: 0 | AQ24: 1 | AR24: =1-SUM(AP24:AQ24) -> 0 | AS24: 0 | AT24: 1 | AU24: =1-SUM(AS24:AT24) -> 0 | AV24: 0 | AW24: 1 | AX24: =1-SUM(AV24:AW24) -> 0 | AY24: 0 | AZ24: 1 | BA24: =1-SUM(AY24:AZ24) -> 0 | BB24: 0 | BC24: 1 | BD24: =1-SUM(BB24:BC24) -> 0 | BE24: 0 | BF24: 1 | BG24: =1-SUM(BE24:BF24) -> 0 | BH24: 0 | BI24: 1 | BJ24: =1-SUM(BH24:BI24) -> 0 | BK24: 0 | BL24: 1 | BM24: =1-SUM(BK24:BL24) -> 0 | BN24: 1 | BO24: =1-BN24 -> 0
O25: 1 | P25: 0 | Q25: =1-SUM(O25:P25) -> 0 | R25: 0 | S25: 1 | T25: =1-SUM(R25:S25) -> 0 | U25: 0 | V25: 1 | W25: =1-SUM(U25:V25) -> 0 | X25: 0 | Y25: 1 | Z25: =1-SUM(X25:Y25) -> 0 | AA25: 1 | AB25: 0 | AC25: =1-SUM(AA25:AB25) -> 0 | AD25: 0 | AE25: 1 | AF25: =1-SUM(AD25:AE25) -> 0 | AG25: 0 | AH25: 1 | AI25: =1-SUM(AG25:AH25) -> 0 | AJ25: 1 | AK25: 0 | AL25: =1-SUM(AJ25:AK25) -> 0 | AM25: 0 | AN25: 1 | AO25: =1-SUM(AM25:AN25) -> 0 | AP25: 0 | AQ25: 1 | AR25: =1-SUM(AP25:AQ25) -> 0 | AS25: 1 | AT25: 0 | AU25: =1-SUM(AS25:AT25) -> 0 | AV25: 1 | AW25: 0 | AX25: =1-SUM(AV25:AW25) -> 0 | AY25: 0 | AZ25: 1 | BA25: =1-SUM(AY25:AZ25) -> 0 | BB25: 0 | BC25: 1 | BD25: =1-SUM(BB25:BC25) -> 0 | BE25: 0 | BF25: 1 | BG25: =1-SUM(BE25:BF25) -> 0 | BH25: 0 | BI25: 1 | BJ25: =1-SUM(BH25:BI25) -> 0 | BK25: 0 | BL25: 1 | BM25: =1-SUM(BK25:BL25) -> 0 | BN25: 1 | BO25: =1-BN25 -> 0
O26: 1 | P26: 0 | Q26: =1-SUM(O26:P26) -> 0 | R26: 1 | S26: 0 | T26: =1-SUM(R26:S26) -> 0 | U26: 0 | V26: 0 | W26: =1-SUM(U26:V26) -> 1 | X26: 1 | Y26: 0 | Z26: =1-SUM(X26:Y26) -> 0 | AA26: 1 | AB26: 0 | AC26: =1-SUM(AA26:AB26) -> 0 | AD26: 0 | AE26: 1 | AF26: =1-SUM(AD26:AE26) -> 0 | AG26: 0 | AH26: 1 | AI26: =1-SUM(AG26:AH26) -> 0 | AJ26: 0 | AK26: 1 | AL26: =1-SUM(AJ26:AK26) -> 0 | AM26: 0 | AN26: 1 | AO26: =1-SUM(AM26:AN26) -> 0 | AP26: 0 | AQ26: 1 | AR26: =1-SUM(AP26:AQ26) -> 0 | AS26: 0 | AT26: 1 | AU26: =1-SUM(AS26:AT26) -> 0 | AV26: 0 | AW26: 1 | AX26: =1-SUM(AV26:AW26) -> 0 | AY26: 0 | AZ26: 1 | BA26: =1-SUM(AY26:AZ26) -> 0 | BB26: 0 | BC26: 1 | BD26: =1-SUM(BB26:BC26) -> 0 | BE26: 0 | BF26: 1 | BG26: =1-SUM(BE26:BF26) -> 0 | BH26: 0 | BI26: 1 | BJ26: =1-SUM(BH26:BI26) -> 0 | BK26: 0 | BL26: 1 | BM26: =1-SUM(BK26:BL26) -> 0 | BN26: 1 | BO26: =1-BN26 -> 0
A27: (*) = data mining, matroidi, combinatorica poliedrale, algoritmi approssimati, scheduling, routing | O27: 1 | P27: 0 | Q27: =1-SUM(O27:P27) -> 0 | R27: 0 | S27: 1 | T27: =1-SUM(R27:S27) -> 0 | U27: 0 | V27: 1 | W27: =1-SUM(U27:V27) -> 0 | X27: 0 | Y27: 1 | Z27: =1-SUM(X27:Y27) -> 0 | AA27: 1 | AB27: 0 | AC27: =1-SUM(AA27:AB27) -> 0 | AD27: 0 | AE27: 1 | AF27: =1-SUM(AD27:AE27) -> 0 | AG27: 0 | AH27: 1 | AI27: =1-SUM(AG27:AH27) -> 0 | AJ27: 1 | AK27: 0 | AL27: =1-SUM(AJ27:AK27) -> 0 | AM27: 0 | AN27: 1 | AO27: =1-SUM(AM27:AN27) -> 0 | AP27: 0 | AQ27: 1 | AR27: =1-SUM(AP27:AQ27) -> 0 | AS27: 1 | AT27: 0 | AU27: =1-SUM(AS27:AT27) -> 0 | AV27: 1 | AW27: 0 | AX27: =1-SUM(AV27:AW27) -> 0 | AY27: 0 | AZ27: 1 | BA27: =1-SUM(AY27:AZ27) -> 0 | BB27: 0 | BC27: 1 | BD27: =1-SUM(BB27:BC27) -> 0 | BE27: 0 | BF27: 1 | BG27: =1-SUM(BE27:BF27) -> 0 | BH27: 0 | BI27: 1 | BJ27: =1-SUM(BH27:BI27) -> 0 | BK27: 0 | BL27: 1 | BM27: =1-SUM(BK27:BL27) -> 0 | BN27: 1 | BO27: =1-BN27 -> 0
A28: code, modelli markoviani, multiobiettivi, generazione colonne, logica, strutture dati | O28: 1 | P28: 0 | Q28: =1-SUM(O28:P28) -> 0 | R28: 0 | S28: 1 | T28: =1-SUM(R28:S28) -> 0 | U28: 0 | V28: 1 | W28: =1-SUM(U28:V28) -> 0 | X28: 0 | Y28: 1 | Z28: =1-SUM(X28:Y28) -> 0 | AA28: 1 | AB28: 0 | AC28: =1-SUM(AA28:AB28) -> 0 | AD28: 0 | AE28: 1 | AF28: =1-SUM(AD28:AE28) -> 0 | AG28: 0 | AH28: 1 | AI28: =1-SUM(AG28:AH28) -> 0 | AJ28: 1 | AK28: 0 | AL28: =1-SUM(AJ28:AK28) -> 0 | AM28: 1 | AN28: 0 | AO28: =1-SUM(AM28:AN28) -> 0 | AP28: 0 | AQ28: 1 | AR28: =1-SUM(AP28:AQ28) -> 0 | AS28: 1 | AT28: 0 | AU28: =1-SUM(AS28:AT28) -> 0 | AV28: 1 | AW28: 0 | AX28: =1-SUM(AV28:AW28) -> 0 | AY28: 0 | AZ28: 1 | BA28: =1-SUM(AY28:AZ28) -> 0 | BB28: 0 | BC28: 1 | BD28: =1-SUM(BB28:BC28) -> 0 | BE28: 0 | BF28: 1 | BG28: =1-SUM(BE28:BF28) -> 0 | BH28: 0 | BI28: 1 | BJ28: =1-SUM(BH28:BI28) -> 0 | BK28: 0 | BL28: 1 | BM28: =1-SUM(BK28:BL28) -> 0 | BN28: 0 | BO28: =1-BN28 -> 1
A29: matematica finanziaria, teoria decisioni, metodi previsione, scorte, reti neurali, | O29: 1 | P29: 0 | Q29: =1-SUM(O29:P29) -> 0 | R29: 0 | S29: 1 | T29: =1-SUM(R29:S29) -> 0 | U29: 0 | V29: 1 | W29: =1-SUM(U29:V29) -> 0 | X29: 0 | Y29: 1 | Z29: =1-SUM(X29:Y29) -> 0 | AA29: 1 | AB29: 0 | AC29: =1-SUM(AA29:AB29) -> 0 | AD29: 0 | AE29: 1 | AF29: =1-SUM(AD29:AE29) -> 0 | AG29: 0 | AH29: 1 | AI29: =1-SUM(AG29:AH29) -> 0 | AJ29: 0 | AK29: 1 | AL29: =1-SUM(AJ29:AK29) -> 0 | AM29: 0 | AN29: 1 | AO29: =1-SUM(AM29:AN29) -> 0 | AP29: 0 | AQ29: 1 | AR29: =1-SUM(AP29:AQ29) -> 0 | AS29: 0 | AT29: 1 | AU29: =1-SUM(AS29:AT29) -> 0 | AV29: 0 | AW29: 1 | AX29: =1-SUM(AV29:AW29) -> 0 | AY29: 0 | AZ29: 1 | BA29: =1-SUM(AY29:AZ29) -> 0 | BB29: 0 | BC29: 1 | BD29: =1-SUM(BB29:BC29) -> 0 | BE29: 0 | BF29: 1 | BG29: =1-SUM(BE29:BF29) -> 0 | BH29: 1 | BI29: 0 | BJ29: =1-SUM(BH29:BI29) -> 0 | BK29: 0 | BL29: 1 | BM29: =1-SUM(BK29:BL29) -> 0 | BN29: 1 | BO29: =1-BN29 -> 0
O30: 1 | P30: 0 | Q30: =1-SUM(O30:P30) -> 0 | R30: 1 | S30: 0 | T30: =1-SUM(R30:S30) -> 0 | U30: 1 | V30: 0 | W30: =1-SUM(U30:V30) -> 0 | X30: 1 | Y30: 0 | Z30: =1-SUM(X30:Y30) -> 0 | AA30: 1 | AB30: 0 | AC30: =1-SUM(AA30:AB30) -> 0 | AD30: 0 | AE30: 1 | AF30: =1-SUM(AD30:AE30) -> 0 | AG30: 0 | AH30: 1 | AI30: =1-SUM(AG30:AH30) -> 0 | AJ30: 0 | AK30: 1 | AL30: =1-SUM(AJ30:AK30) -> 0 | AM30: 0 | AN30: 1 | AO30: =1-SUM(AM30:AN30) -> 0 | AP30: 0 | AQ30: 1 | AR30: =1-SUM(AP30:AQ30) -> 0 | AS30: 0 | AT30: 1 | AU30: =1-SUM(AS30:AT30) -> 0 | AV30: 1 | AW30: 0 | AX30: =1-SUM(AV30:AW30) -> 0 | AY30: 1 | AZ30: 0 | BA30: =1-SUM(AY30:AZ30) -> 0 | BB30: 0 | BC30: 1 | BD30: =1-SUM(BB30:BC30) -> 0 | BE30: 0 | BF30: 1 | BG30: =1-SUM(BE30:BF30) -> 0 | BH30: 0 | BI30: 1 | BJ30: =1-SUM(BH30:BI30) -> 0 | BK30: 0 | BL30: 1 | BM30: =1-SUM(BK30:BL30) -> 0 | BN30: 0 | BO30: =1-BN30 -> 1
O31: 0 | P31: 1 | Q31: =1-SUM(O31:P31) -> 0 | R31: 0 | S31: 1 | T31: =1-SUM(R31:S31) -> 0 | U31: 0 | V31: 1 | W31: =1-SUM(U31:V31) -> 0 | X31: 0 | Y31: 1 | Z31: =1-SUM(X31:Y31) -> 0 | AA31: 1 | AB31: 0 | AC31: =1-SUM(AA31:AB31) -> 0 | AD31: 0 | AE31: 1 | AF31: =1-SUM(AD31:AE31) -> 0 | AG31: 0 | AH31: 1 | AI31: =1-SUM(AG31:AH31) -> 0 | AJ31: 1 | AK31: 0 | AL31: =1-SUM(AJ31:AK31) -> 0 | AM31: 1 | AN31: 0 | AO31: =1-SUM(AM31:AN31) -> 0 | AP31: 0 | AQ31: 1 | AR31: =1-SUM(AP31:AQ31) -> 0 | AS31: 0 | AT31: 1 | AU31: =1-SUM(AS31:AT31) -> 0 | AV31: 0 | AW31: 1 | AX31: =1-SUM(AV31:AW31) -> 0 | AY31: 0 | AZ31: 1 | BA31: =1-SUM(AY31:AZ31) -> 0 | BB31: 1 | BC31: 0 | BD31: =1-SUM(BB31:BC31) -> 0 | BE31: 0 | BF31: 1 | BG31: =1-SUM(BE31:BF31) -> 0 | BH31: 0 | BI31: 1 | BJ31: =1-SUM(BH31:BI31) -> 0 | BK31: 0 | BL31: 1 | BM31: =1-SUM(BK31:BL31) -> 0 | BN31: 0 | BO31: =1-BN31 -> 1
O32: 1 | P32: 0 | Q32: =1-SUM(O32:P32) -> 0 | R32: 0 | S32: 1 | T32: =1-SUM(R32:S32) -> 0 | U32: 0 | V32: 1 | W32: =1-SUM(U32:V32) -> 0 | X32: 0 | Y32: 1 | Z32: =1-SUM(X32:Y32) -> 0 | AA32: 0 | AB32: 1 | AC32: =1-SUM(AA32:AB32) -> 0 | AD32: 0 | AE32: 1 | AF32: =1-SUM(AD32:AE32) -> 0 | AG32: 0 | AH32: 1 | AI32: =1-SUM(AG32:AH32) -> 0 | AJ32: 0 | AK32: 1 | AL32: =1-SUM(AJ32:AK32) -> 0 | AM32: 0 | AN32: 1 | AO32: =1-SUM(AM32:AN32) -> 0 | AP32: 0 | AQ32: 1 | AR32: =1-SUM(AP32:AQ32) -> 0 | AS32: 0 | AT32: 1 | AU32: =1-SUM(AS32:AT32) -> 0 | AV32: 0 | AW32: 1 | AX32: =1-SUM(AV32:AW32) -> 0 | AY32: 0 | AZ32: 1 | BA32: =1-SUM(AY32:AZ32) -> 0 | BB32: 1 | BC32: 0 | BD32: =1-SUM(BB32:BC32) -> 0 | BE32: 0 | BF32: 1 | BG32: =1-SUM(BE32:BF32) -> 0 | BH32: 0 | BI32: 1 | BJ32: =1-SUM(BH32:BI32) -> 0 | BK32: 0 | BL32: 1 | BM32: =1-SUM(BK32:BL32) -> 0 | BN32: 0 | BO32: =1-BN32 -> 1
A33: Argomenti presenti in più del 40% dei corsi: | O33: 0 | P33: 1 | Q33: =1-SUM(O33:P33) -> 0 | R33: 0 | S33: 1 | T33: =1-SUM(R33:S33) -> 0 | U33: 0 | V33: 1 | W33: =1-SUM(U33:V33) -> 0 | X33: 0 | Y33: 1 | Z33: =1-SUM(X33:Y33) -> 0 | AA33: 0 | AB33: 1 | AC33: =1-SUM(AA33:AB33) -> 0 | AD33: 0 | AE33: 1 | AF33: =1-SUM(AD33:AE33) -> 0 | AG33: 0 | AH33: 1 | AI33: =1-SUM(AG33:AH33) -> 0 | AJ33: 0 | AK33: 1 | AL33: =1-SUM(AJ33:AK33) -> 0 | AM33: 0 | AN33: 1 | AO33: =1-SUM(AM33:AN33) -> 0 | AP33: 1 | AQ33: 0 | AR33: =1-SUM(AP33:AQ33) -> 0 | AS33: 0 | AT33: 1 | AU33: =1-SUM(AS33:AT33) -> 0 | AV33: 0 | AW33: 1 | AX33: =1-SUM(AV33:AW33) -> 0 | AY33: 0 | AZ33: 1 | BA33: =1-SUM(AY33:AZ33) -> 0 | BB33: 0 | BC33: 1 | BD33: =1-SUM(BB33:BC33) -> 0 | BE33: 0 | BF33: 1 | BG33: =1-SUM(BE33:BF33) -> 0 | BH33: 0 | BI33: 1 | BJ33: =1-SUM(BH33:BI33) -> 0 | BK33: 1 | BL33: 0 | BM33: =1-SUM(BK33:BL33) -> 0 | BN33: 0 | BO33: =1-BN33 -> 1
O34: 1 | P34: 0 | Q34: =1-SUM(O34:P34) -> 0 | R34: 1 | S34: 0 | T34: =1-SUM(R34:S34) -> 0 | U34: 0 | V34: 1 | W34: =1-SUM(U34:V34) -> 0 | X34: 1 | Y34: 0 | Z34: =1-SUM(X34:Y34) -> 0 | AA34: 1 | AB34: 0 | AC34: =1-SUM(AA34:AB34) -> 0 | AD34: 0 | AE34: 1 | AF34: =1-SUM(AD34:AE34) -> 0 | AG34: 0 | AH34: 1 | AI34: =1-SUM(AG34:AH34) -> 0 | AJ34: 1 | AK34: 0 | AL34: =1-SUM(AJ34:AK34) -> 0 | AM34: 1 | AN34: 0 | AO34: =1-SUM(AM34:AN34) -> 0 | AP34: 0 | AQ34: 1 | AR34: =1-SUM(AP34:AQ34) -> 0 | AS34: 0 | AT34: 1 | AU34: =1-SUM(AS34:AT34) -> 0 | AV34: 1 | AW34: 0 | AX34: =1-SUM(AV34:AW34) -> 0 | AY34: 0 | AZ34: 1 | BA34: =1-SUM(AY34:AZ34) -> 0 | BB34: 1 | BC34: 0 | BD34: =1-SUM(BB34:BC34) -> 0 | BE34: 1 | BF34: 0 | BG34: =1-SUM(BE34:BF34) -> 0 | BH34: 0 | BI34: 1 | BJ34: =1-SUM(BH34:BI34) -> 0 | BK34: 1 | BL34: 0 | BM34: =1-SUM(BK34:BL34) -> 0 | BN34: 0 | BO34: =1-BN34 -> 1
A35: =A5 -> MODELLI MATEMATICI | O35: 1 | P35: 0 | Q35: =1-SUM(O35:P35) -> 0 | R35: 0 | S35: 1 | T35: =1-SUM(R35:S35) -> 0 | U35: 0 | V35: 1 | W35: =1-SUM(U35:V35) -> 0 | X35: 0 | Y35: 1 | Z35: =1-SUM(X35:Y35) -> 0 | AA35: 1 | AB35: 0 | AC35: =1-SUM(AA35:AB35) -> 0 | AD35: 0 | AE35: 1 | AF35: =1-SUM(AD35:AE35) -> 0 | AG35: 0 | AH35: 1 | AI35: =1-SUM(AG35:AH35) -> 0 | AJ35: 0 | AK35: 1 | AL35: =1-SUM(AJ35:AK35) -> 0 | AM35: 0 | AN35: 1 | AO35: =1-SUM(AM35:AN35) -> 0 | AP35: 0 | AQ35: 1 | AR35: =1-SUM(AP35:AQ35) -> 0 | AS35: 0 | AT35: 1 | AU35: =1-SUM(AS35:AT35) -> 0 | AV35: 1 | AW35: 0 | AX35: =1-SUM(AV35:AW35) -> 0 | AY35: 1 | AZ35: 0 | BA35: =1-SUM(AY35:AZ35) -> 0 | BB35: 0 | BC35: 1 | BD35: =1-SUM(BB35:BC35) -> 0 | BE35: 1 | BF35: 0 | BG35: =1-SUM(BE35:BF35) -> 0 | BH35: 0 | BI35: 1 | BJ35: =1-SUM(BH35:BI35) -> 0 | BK35: 0 | BL35: 1 | BM35: =1-SUM(BK35:BL35) -> 0 | BN35: 0 | BO35: =1-BN35 -> 1
A36: =A6 -> LP | O36: 0 | P36: 1 | Q36: =1-SUM(O36:P36) -> 0 | R36: 0 | S36: 1 | T36: =1-SUM(R36:S36) -> 0 | U36: 0 | V36: 1 | W36: =1-SUM(U36:V36) -> 0 | X36: 0 | Y36: 1 | Z36: =1-SUM(X36:Y36) -> 0 | AA36: 0 | AB36: 1 | AC36: =1-SUM(AA36:AB36) -> 0 | AD36: 0 | AE36: 1 | AF36: =1-SUM(AD36:AE36) -> 0 | AG36: 0 | AH36: 1 | AI36: =1-SUM(AG36:AH36) -> 0 | AJ36: 1 | AK36: 0 | AL36: =1-SUM(AJ36:AK36) -> 0 | AM36: 0 | AN36: 1 | AO36: =1-SUM(AM36:AN36) -> 0 | AP36: 0 | AQ36: 1 | AR36: =1-SUM(AP36:AQ36) -> 0 | AS36: 0 | AT36: 1 | AU36: =1-SUM(AS36:AT36) -> 0 | AV36: 0 | AW36: 1 | AX36: =1-SUM(AV36:AW36) -> 0 | AY36: 0 | AZ36: 1 | BA36: =1-SUM(AY36:AZ36) -> 0 | BB36: 0 | BC36: 1 | BD36: =1-SUM(BB36:BC36) -> 0 | BE36: 0 | BF36: 1 | BG36: =1-SUM(BE36:BF36) -> 0 | BH36: 0 | BI36: 1 | BJ36: =1-SUM(BH36:BI36) -> 0 | BK36: 0 | BL36: 1 | BM36: =1-SUM(BK36:BL36) -> 0 | BN36: 1 | BO36: =1-BN36 -> 0
A37: SIMPLESSO | O37: 1 | P37: 0 | Q37: =1-SUM(O37:P37) -> 0 | R37: 1 | S37: 0 | T37: =1-SUM(R37:S37) -> 0 | U37: 1 | V37: 0 | W37: =1-SUM(U37:V37) -> 0 | X37: 1 | Y37: 0 | Z37: =1-SUM(X37:Y37) -> 0 | AA37: 0 | AB37: 1 | AC37: =1-SUM(AA37:AB37) -> 0 | AD37: 0 | AE37: 1 | AF37: =1-SUM(AD37:AE37) -> 0 | AG37: 0 | AH37: 1 | AI37: =1-SUM(AG37:AH37) -> 0 | AJ37: 1 | AK37: 0 | AL37: =1-SUM(AJ37:AK37) -> 0 | AM37: 1 | AN37: 0 | AO37: =1-SUM(AM37:AN37) -> 0 | AP37: 0 | AQ37: 1 | AR37: =1-SUM(AP37:AQ37) -> 0 | AS37: 0 | AT37: 1 | AU37: =1-SUM(AS37:AT37) -> 0 | AV37: 0 | AW37: 1 | AX37: =1-SUM(AV37:AW37) -> 0 | AY37: 0 | AZ37: 1 | BA37: =1-SUM(AY37:AZ37) -> 0 | BB37: 0 | BC37: 1 | BD37: =1-SUM(BB37:BC37) -> 0 | BE37: 0 | BF37: 1 | BG37: =1-SUM(BE37:BF37) -> 0 | BH37: 0 | BI37: 1 | BJ37: =1-SUM(BH37:BI37) -> 0 | BK37: 0 | BL37: 1 | BM37: =1-SUM(BK37:BL37) -> 0 | BN37: 1 | BO37: =1-BN37 -> 0
A38: =A9 -> ILP | O38: 1 | P38: 0 | Q38: =1-SUM(O38:P38) -> 0 | R38: 1 | S38: 0 | T38: =1-SUM(R38:S38) -> 0 | U38: 0 | V38: 1 | W38: =1-SUM(U38:V38) -> 0 | X38: 1 | Y38: 0 | Z38: =1-SUM(X38:Y38) -> 0 | AA38: 1 | AB38: 0 | AC38: =1-SUM(AA38:AB38) -> 0 | AD38: 0 | AE38: 1 | AF38: =1-SUM(AD38:AE38) -> 0 | AG38: 0 | AH38: 1 | AI38: =1-SUM(AG38:AH38) -> 0 | AJ38: 1 | AK38: 0 | AL38: =1-SUM(AJ38:AK38) -> 0 | AM38: 1 | AN38: 0 | AO38: =1-SUM(AM38:AN38) -> 0 | AP38: 0 | AQ38: 1 | AR38: =1-SUM(AP38:AQ38) -> 0 | AS38: 0 | AT38: 1 | AU38: =1-SUM(AS38:AT38) -> 0 | AV38: 1 | AW38: 0 | AX38: =1-SUM(AV38:AW38) -> 0 | AY38: 0 | AZ38: 1 | BA38: =1-SUM(AY38:AZ38) -> 0 | BB38: 1 | BC38: 0 | BD38: =1-SUM(BB38:BC38) -> 0 | BE38: 1 | BF38: 0 | BG38: =1-SUM(BE38:BF38) -> 0 | BH38: 0 | BI38: 1 | BJ38: =1-SUM(BH38:BI38) -> 0 | BK38: 1 | BL38: 0 | BM38: =1-SUM(BK38:BL38) -> 0 | BN38: 0 | BO38: =1-BN38 -> 1
A39: =A12 -> GRAFI | O39: 1 | P39: 0 | Q39: =1-SUM(O39:P39) -> 0 | R39: 1 | S39: 0 | T39: =1-SUM(R39:S39) -> 0 | U39: 1 | V39: 0 | W39: =1-SUM(U39:V39) -> 0 | X39: 1 | Y39: 0 | Z39: =1-SUM(X39:Y39) -> 0 | AA39: 0 | AB39: 1 | AC39: =1-SUM(AA39:AB39) -> 0 | AD39: 0 | AE39: 1 | AF39: =1-SUM(AD39:AE39) -> 0 | AG39: 0 | AH39: 1 | AI39: =1-SUM(AG39:AH39) -> 0 | AJ39: 0 | AK39: 1 | AL39: =1-SUM(AJ39:AK39) -> 0 | AM39: 0 | AN39: 1 | AO39: =1-SUM(AM39:AN39) -> 0 | AP39: 0 | AQ39: 1 | AR39: =1-SUM(AP39:AQ39) -> 0 | AS39: 0 | AT39: 1 | AU39: =1-SUM(AS39:AT39) -> 0 | AV39: 1 | AW39: 0 | AX39: =1-SUM(AV39:AW39) -> 0 | AY39: 0 | AZ39: 1 | BA39: =1-SUM(AY39:AZ39) -> 0 | BB39: 0 | BC39: 1 | BD39: =1-SUM(BB39:BC39) -> 0 | BE39: 0 | BF39: 1 | BG39: =1-SUM(BE39:BF39) -> 0 | BH39: 0 | BI39: 1 | BJ39: =1-SUM(BH39:BI39) -> 0 | BK39: 0 | BL39: 1 | BM39: =1-SUM(BK39:BL39) -> 0 | BN39: 0 | BO39: =1-BN39 -> 1
A40: =A16 -> BRANCH-AND-BOUND | O40: 1 | P40: 0 | Q40: =1-SUM(O40:P40) -> 0 | R40: 0 | S40: 1 | T40: =1-SUM(R40:S40) -> 0 | U40: 0 | V40: 1 | W40: =1-SUM(U40:V40) -> 0 | X40: 0 | Y40: 1 | Z40: =1-SUM(X40:Y40) -> 0 | AA40: 0 | AB40: 1 | AC40: =1-SUM(AA40:AB40) -> 0 | AD40: 1 | AE40: 0 | AF40: =1-SUM(AD40:AE40) -> 0 | AG40: 0 | AH40: 1 | AI40: =1-SUM(AG40:AH40) -> 0 | AJ40: 0 | AK40: 1 | AL40: =1-SUM(AJ40:AK40) -> 0 | AM40: 0 | AN40: 1 | AO40: =1-SUM(AM40:AN40) -> 0 | AP40: 0 | AQ40: 1 | AR40: =1-SUM(AP40:AQ40) -> 0 | AS40: 0 | AT40: 1 | AU40: =1-SUM(AS40:AT40) -> 0 | AV40: 0 | AW40: 1 | AX40: =1-SUM(AV40:AW40) -> 0 | AY40: 0 | AZ40: 1 | BA40: =1-SUM(AY40:AZ40) -> 0 | BB40: 1 | BC40: 0 | BD40: =1-SUM(BB40:BC40) -> 0 | BE40: 0 | BF40: 1 | BG40: =1-SUM(BE40:BF40) -> 0 | BH40: 0 | BI40: 1 | BJ40: =1-SUM(BH40:BI40) -> 0 | BK40: 1 | BL40: 0 | BM40: =1-SUM(BK40:BL40) -> 0 | BN40: 1 | BO40: =1-BN40 -> 0
O41: 1 | P41: 0 | Q41: =1-SUM(O41:P41) -> 0 | R41: 0 | S41: 1 | T41: =1-SUM(R41:S41) -> 0 | U41: 0 | V41: 1 | W41: =1-SUM(U41:V41) -> 0 | X41: 0 | Y41: 1 | Z41: =1-SUM(X41:Y41) -> 0 | AA41: 0 | AB41: 1 | AC41: =1-SUM(AA41:AB41) -> 0 | AD41: 0 | AE41: 1 | AF41: =1-SUM(AD41:AE41) -> 0 | AG41: 0 | AH41: 1 | AI41: =1-SUM(AG41:AH41) -> 0 | AJ41: 0 | AK41: 1 | AL41: =1-SUM(AJ41:AK41) -> 0 | AM41: 0 | AN41: 1 | AO41: =1-SUM(AM41:AN41) -> 0 | AP41: 0 | AQ41: 1 | AR41: =1-SUM(AP41:AQ41) -> 0 | AS41: 0 | AT41: 1 | AU41: =1-SUM(AS41:AT41) -> 0 | AV41: 0 | AW41: 1 | AX41: =1-SUM(AV41:AW41) -> 0 | AY41: 0 | AZ41: 1 | BA41: =1-SUM(AY41:AZ41) -> 0 | BB41: 0 | BC41: 1 | BD41: =1-SUM(BB41:BC41) -> 0 | BE41: 0 | BF41: 1 | BG41: =1-SUM(BE41:BF41) -> 0 | BH41: 0 | BI41: 1 | BJ41: =1-SUM(BH41:BI41) -> 0 | BK41: 1 | BL41: 0 | BM41: =1-SUM(BK41:BL41) -> 0 | BN41: 0 | BO41: =1-BN41 -> 1
O42: 0 | P42: 1 | Q42: =1-SUM(O42:P42) -> 0 | R42: 0 | S42: 1 | T42: =1-SUM(R42:S42) -> 0 | U42: 0 | V42: 1 | W42: =1-SUM(U42:V42) -> 0 | X42: 0 | Y42: 1 | Z42: =1-SUM(X42:Y42) -> 0 | AA42: 0 | AB42: 1 | AC42: =1-SUM(AA42:AB42) -> 0 | AD42: 0 | AE42: 1 | AF42: =1-SUM(AD42:AE42) -> 0 | AG42: 0 | AH42: 1 | AI42: =1-SUM(AG42:AH42) -> 0 | AJ42: 0 | AK42: 1 | AL42: =1-SUM(AJ42:AK42) -> 0 | AM42: 0 | AN42: 1 | AO42: =1-SUM(AM42:AN42) -> 0 | AP42: 1 | AQ42: 0 | AR42: =1-SUM(AP42:AQ42) -> 0 | AS42: 0 | AT42: 1 | AU42: =1-SUM(AS42:AT42) -> 0 | AV42: 0 | AW42: 1 | AX42: =1-SUM(AV42:AW42) -> 0 | AY42: 0 | AZ42: 1 | BA42: =1-SUM(AY42:AZ42) -> 0 | BB42: 0 | BC42: 1 | BD42: =1-SUM(BB42:BC42) -> 0 | BE42: 0 | BF42: 1 | BG42: =1-SUM(BE42:BF42) -> 0 | BH42: 0 | BI42: 1 | BJ42: =1-SUM(BH42:BI42) -> 0 | BK42: 0 | BL42: 1 | BM42: =1-SUM(BK42:BL42) -> 0 | BN42: 0 | BO42: =1-BN42 -> 1
O43: 0 | P43: 1 | Q43: =1-SUM(O43:P43) -> 0 | R43: 0 | S43: 1 | T43: =1-SUM(R43:S43) -> 0 | U43: 0 | V43: 1 | W43: =1-SUM(U43:V43) -> 0 | X43: 0 | Y43: 1 | Z43: =1-SUM(X43:Y43) -> 0 | AA43: 0 | AB43: 1 | AC43: =1-SUM(AA43:AB43) -> 0 | AD43: 0 | AE43: 1 | AF43: =1-SUM(AD43:AE43) -> 0 | AG43: 0 | AH43: 1 | AI43: =1-SUM(AG43:AH43) -> 0 | AJ43: 1 | AK43: 0 | AL43: =1-SUM(AJ43:AK43) -> 0 | AM43: 1 | AN43: 0 | AO43: =1-SUM(AM43:AN43) -> 0 | AP43: 0 | AQ43: 1 | AR43: =1-SUM(AP43:AQ43) -> 0 | AS43: 1 | AT43: 0 | AU43: =1-SUM(AS43:AT43) -> 0 | AV43: 0 | AW43: 1 | AX43: =1-SUM(AV43:AW43) -> 0 | AY43: 0 | AZ43: 1 | BA43: =1-SUM(AY43:AZ43) -> 0 | BB43: 0 | BC43: 1 | BD43: =1-SUM(BB43:BC43) -> 0 | BE43: 0 | BF43: 1 | BG43: =1-SUM(BE43:BF43) -> 0 | BH43: 0 | BI43: 1 | BJ43: =1-SUM(BH43:BI43) -> 0 | BK43: 0 | BL43: 1 | BM43: =1-SUM(BK43:BL43) -> 0 | BN43: 1 | BO43: =1-BN43 -> 0
O44: 1 | P44: 0 | Q44: =1-SUM(O44:P44) -> 0 | R44: 0 | S44: 1 | T44: =1-SUM(R44:S44) -> 0 | U44: 0 | V44: 1 | W44: =1-SUM(U44:V44) -> 0 | X44: 0 | Y44: 1 | Z44: =1-SUM(X44:Y44) -> 0 | AA44: 0 | AB44: 1 | AC44: =1-SUM(AA44:AB44) -> 0 | AD44: 0 | AE44: 1 | AF44: =1-SUM(AD44:AE44) -> 0 | AG44: 0 | AH44: 1 | AI44: =1-SUM(AG44:AH44) -> 0 | AJ44: 0 | AK44: 1 | AL44: =1-SUM(AJ44:AK44) -> 0 | AM44: 0 | AN44: 1 | AO44: =1-SUM(AM44:AN44) -> 0 | AP44: 1 | AQ44: 0 | AR44: =1-SUM(AP44:AQ44) -> 0 | AS44: 0 | AT44: 1 | AU44: =1-SUM(AS44:AT44) -> 0 | AV44: 0 | AW44: 1 | AX44: =1-SUM(AV44:AW44) -> 0 | AY44: 0 | AZ44: 1 | BA44: =1-SUM(AY44:AZ44) -> 0 | BB44: 0 | BC44: 1 | BD44: =1-SUM(BB44:BC44) -> 0 | BE44: 0 | BF44: 1 | BG44: =1-SUM(BE44:BF44) -> 0 | BH44: 0 | BI44: 1 | BJ44: =1-SUM(BH44:BI44) -> 0 | BK44: 0 | BL44: 1 | BM44: =1-SUM(BK44:BL44) -> 0 | BN44: 1 | BO44: =1-BN44 -> 0
O45: 0 | P45: 1 | Q45: =1-SUM(O45:P45) -> 0 | R45: 1 | S45: 0 | T45: =1-SUM(R45:S45) -> 0 | U45: 1 | V45: 0 | W45: =1-SUM(U45:V45) -> 0 | X45: 1 | Y45: 0 | Z45: =1-SUM(X45:Y45) -> 0 | AA45: 0 | AB45: 1 | AC45: =1-SUM(AA45:AB45) -> 0 | AD45: 0 | AE45: 1 | AF45: =1-SUM(AD45:AE45) -> 0 | AG45: 1 | AH45: 0 | AI45: =1-SUM(AG45:AH45) -> 0 | AJ45: 0 | AK45: 1 | AL45: =1-SUM(AJ45:AK45) -> 0 | AM45: 0 | AN45: 1 | AO45: =1-SUM(AM45:AN45) -> 0 | AP45: 0 | AQ45: 1 | AR45: =1-SUM(AP45:AQ45) -> 0 | AS45: 0 | AT45: 1 | AU45: =1-SUM(AS45:AT45) -> 0 | AV45: 0 | AW45: 1 | AX45: =1-SUM(AV45:AW45) -> 0 | AY45: 0 | AZ45: 1 | BA45: =1-SUM(AY45:AZ45) -> 0 | BB45: 0 | BC45: 1 | BD45: =1-SUM(BB45:BC45) -> 0 | BE45: 0 | BF45: 1 | BG45: =1-SUM(BE45:BF45) -> 0 | BH45: 1 | BI45: 0 | BJ45: =1-SUM(BH45:BI45) -> 0 | BK45: 0 | BL45: 1 | BM45: =1-SUM(BK45:BL45) -> 0 | BN45: 0 | BO45: =1-BN45 -> 1
O46: 1 | P46: 0 | Q46: =1-SUM(O46:P46) -> 0 | R46: 1 | S46: 0 | T46: =1-SUM(R46:S46) -> 0 | U46: 1 | V46: 0 | W46: =1-SUM(U46:V46) -> 0 | X46: 1 | Y46: 0 | Z46: =1-SUM(X46:Y46) -> 0 | AA46: 0 | AB46: 1 | AC46: =1-SUM(AA46:AB46) -> 0 | AD46: 1 | AE46: 0 | AF46: =1-SUM(AD46:AE46) -> 0 | AG46: 0 | AH46: 1 | AI46: =1-SUM(AG46:AH46) -> 0 | AJ46: 1 | AK46: 0 | AL46: =1-SUM(AJ46:AK46) -> 0 | AM46: 1 | AN46: 0 | AO46: =1-SUM(AM46:AN46) -> 0 | AP46: 1 | AQ46: 0 | AR46: =1-SUM(AP46:AQ46) -> 0 | AS46: 0 | AT46: 1 | AU46: =1-SUM(AS46:AT46) -> 0 | AV46: 0 | AW46: 1 | AX46: =1-SUM(AV46:AW46) -> 0 | AY46: 0 | AZ46: 1 | BA46: =1-SUM(AY46:AZ46) -> 0 | BB46: 1 | BC46: 0 | BD46: =1-SUM(BB46:BC46) -> 0 | BE46: 0 | BF46: 1 | BG46: =1-SUM(BE46:BF46) -> 0 | BH46: 0 | BI46: 1 | BJ46: =1-SUM(BH46:BI46) -> 0 | BK46: 0 | BL46: 1 | BM46: =1-SUM(BK46:BL46) -> 0 | BN46: 1 | BO46: =1-BN46 -> 0
O47: 0 | P47: 0 | Q47: =1-SUM(O47:P47) -> 1 | R47: 0 | S47: 0 | T47: =1-SUM(R47:S47) -> 1 | U47: 0 | V47: 0 | W47: =1-SUM(U47:V47) -> 1 | X47: 0 | Y47: 0 | Z47: =1-SUM(X47:Y47) -> 1 | AA47: 0 | AB47: 0 | AC47: =1-SUM(AA47:AB47) -> 1 | AD47: 0 | AE47: 0 | AF47: =1-SUM(AD47:AE47) -> 1 | AG47: 0 | AH47: 0 | AI47: =1-SUM(AG47:AH47) -> 1 | AJ47: 0 | AK47: 0 | AL47: =1-SUM(AJ47:AK47) -> 1 | AM47: 0 | AN47: 0 | AO47: =1-SUM(AM47:AN47) -> 1 | AP47: 0 | AQ47: 0 | AR47: =1-SUM(AP47:AQ47) -> 1 | AS47: 0 | AT47: 0 | AU47: =1-SUM(AS47:AT47) -> 1 | AV47: 0 | AW47: 0 | AX47: =1-SUM(AV47:AW47) -> 1 | AY47: 0 | AZ47: 0 | BA47: =1-SUM(AY47:AZ47) -> 1 | BB47: 0 | BC47: 0 | BD47: =1-SUM(BB47:BC47) -> 1 | BE47: 0 | BF47: 0 | BG47: =1-SUM(BE47:BF47) -> 1 | BH47: 0 | BI47: 0 | BJ47: =1-SUM(BH47:BI47) -> 1 | BK47: 0 | BL47: 0 | BM47: =1-SUM(BK47:BL47) -> 1 | BN47: 1 | BO47: =1-BN47 -> 0
O48: 0 | P48: 0 | Q48: =1-SUM(O48:P48) -> 1 | R48: 0 | S48: 0 | T48: =1-SUM(R48:S48) -> 1 | U48: 0 | V48: 0 | W48: =1-SUM(U48:V48) -> 1 | X48: 0 | Y48: 0 | Z48: =1-SUM(X48:Y48) -> 1 | AA48: 0 | AB48: 0 | AC48: =1-SUM(AA48:AB48) -> 1 | AD48: 0 | AE48: 0 | AF48: =1-SUM(AD48:AE48) -> 1 | AG48: 0 | AH48: 0 | AI48: =1-SUM(AG48:AH48) -> 1 | AJ48: 0 | AK48: 0 | AL48: =1-SUM(AJ48:AK48) -> 1 | AM48: 0 | AN48: 0 | AO48: =1-SUM(AM48:AN48) -> 1 | AP48: 0 | AQ48: 0 | AR48: =1-SUM(AP48:AQ48) -> 1 | AS48: 0 | AT48: 0 | AU48: =1-SUM(AS48:AT48) -> 1 | AV48: 0 | AW48: 0 | AX48: =1-SUM(AV48:AW48) -> 1 | AY48: 0 | AZ48: 0 | BA48: =1-SUM(AY48:AZ48) -> 1 | BB48: 0 | BC48: 0 | BD48: =1-SUM(BB48:BC48) -> 1 | BE48: 0 | BF48: 0 | BG48: =1-SUM(BE48:BF48) -> 1 | BH48: 0 | BI48: 0 | BJ48: =1-SUM(BH48:BI48) -> 1 | BK48: 0 | BL48: 0 | BM48: =1-SUM(BK48:BL48) -> 1 | BN48: 1 | BO48: =1-BN48 -> 0
O49: 0 | P49: 0 | Q49: =1-SUM(O49:P49) -> 1 | R49: 0 | S49: 0 | T49: =1-SUM(R49:S49) -> 1 | U49: 0 | V49: 0 | W49: =1-SUM(U49:V49) -> 1 | X49: 0 | Y49: 0 | Z49: =1-SUM(X49:Y49) -> 1 | AA49: 0 | AB49: 0 | AC49: =1-SUM(AA49:AB49) -> 1 | AD49: 0 | AE49: 0 | AF49: =1-SUM(AD49:AE49) -> 1 | AG49: 0 | AH49: 0 | AI49: =1-SUM(AG49:AH49) -> 1 | AJ49: 0 | AK49: 0 | AL49: =1-SUM(AJ49:AK49) -> 1 | AM49: 0 | AN49: 0 | AO49: =1-SUM(AM49:AN49) -> 1 | AP49: 0 | AQ49: 0 | AR49: =1-SUM(AP49:AQ49) -> 1 | AS49: 0 | AT49: 0 | AU49: =1-SUM(AS49:AT49) -> 1 | AV49: 0 | AW49: 0 | AX49: =1-SUM(AV49:AW49) -> 1 | AY49: 0 | AZ49: 0 | BA49: =1-SUM(AY49:AZ49) -> 1 | BB49: 0 | BC49: 0 | BD49: =1-SUM(BB49:BC49) -> 1 | BE49: 0 | BF49: 0 | BG49: =1-SUM(BE49:BF49) -> 1 | BH49: 0 | BI49: 0 | BJ49: =1-SUM(BH49:BI49) -> 1 | BK49: 0 | BL49: 0 | BM49: =1-SUM(BK49:BL49) -> 1 | BN49: 0 | BO49: =1-BN49 -> 1
O50: 1 | P50: 0 | Q50: =1-SUM(O50:P50) -> 0 | R50: 1 | S50: 0 | T50: =1-SUM(R50:S50) -> 0 | U50: 1 | V50: 0 | W50: =1-SUM(U50:V50) -> 0 | X50: 1 | Y50: 0 | Z50: =1-SUM(X50:Y50) -> 0 | AA50: 1 | AB50: 0 | AC50: =1-SUM(AA50:AB50) -> 0 | AD50: 0 | AE50: 1 | AF50: =1-SUM(AD50:AE50) -> 0 | AG50: 0 | AH50: 1 | AI50: =1-SUM(AG50:AH50) -> 0 | AJ50: 1 | AK50: 0 | AL50: =1-SUM(AJ50:AK50) -> 0 | AM50: 1 | AN50: 0 | AO50: =1-SUM(AM50:AN50) -> 0 | AP50: 0 | AQ50: 1 | AR50: =1-SUM(AP50:AQ50) -> 0 | AS50: 0 | AT50: 1 | AU50: =1-SUM(AS50:AT50) -> 0 | AV50: 1 | AW50: 0 | AX50: =1-SUM(AV50:AW50) -> 0 | AY50: 0 | AZ50: 1 | BA50: =1-SUM(AY50:AZ50) -> 0 | BB50: 0 | BC50: 1 | BD50: =1-SUM(BB50:BC50) -> 0 | BE50: 0 | BF50: 1 | BG50: =1-SUM(BE50:BF50) -> 0 | BH50: 1 | BI50: 0 | BJ50: =1-SUM(BH50:BI50) -> 0 | BK50: 0 | BL50: 1 | BM50: =1-SUM(BK50:BL50) -> 0 | BN50: 0 | BO50: =1-BN50 -> 1
O51: 1 | P51: 0 | Q51: =1-SUM(O51:P51) -> 0 | R51: 1 | S51: 0 | T51: =1-SUM(R51:S51) -> 0 | U51: 0 | V51: 1 | W51: =1-SUM(U51:V51) -> 0 | X51: 1 | Y51: 0 | Z51: =1-SUM(X51:Y51) -> 0 | AA51: 1 | AB51: 0 | AC51: =1-SUM(AA51:AB51) -> 0 | AD51: 1 | AE51: 0 | AF51: =1-SUM(AD51:AE51) -> 0 | AG51: 0 | AH51: 1 | AI51: =1-SUM(AG51:AH51) -> 0 | AJ51: 0 | AK51: 1 | AL51: =1-SUM(AJ51:AK51) -> 0 | AM51: 0 | AN51: 1 | AO51: =1-SUM(AM51:AN51) -> 0 | AP51: 0 | AQ51: 1 | AR51: =1-SUM(AP51:AQ51) -> 0 | AS51: 0 | AT51: 1 | AU51: =1-SUM(AS51:AT51) -> 0 | AV51: 0 | AW51: 1 | AX51: =1-SUM(AV51:AW51) -> 0 | AY51: 0 | AZ51: 1 | BA51: =1-SUM(AY51:AZ51) -> 0 | BB51: 1 | BC51: 0 | BD51: =1-SUM(BB51:BC51) -> 0 | BE51: 0 | BF51: 1 | BG51: =1-SUM(BE51:BF51) -> 0 | BH51: 0 | BI51: 1 | BJ51: =1-SUM(BH51:BI51) -> 0 | BK51: 0 | BL51: 1 | BM51: =1-SUM(BK51:BL51) -> 0 | BN51: 0 | BO51: =1-BN51 -> 1
O52: 1 | P52: 0 | Q52: =1-SUM(O52:P52) -> 0 | R52: 0 | S52: 1 | T52: =1-SUM(R52:S52) -> 0 | U52: 0 | V52: 1 | W52: =1-SUM(U52:V52) -> 0 | X52: 0 | Y52: 1 | Z52: =1-SUM(X52:Y52) -> 0 | AA52: 0 | AB52: 1 | AC52: =1-SUM(AA52:AB52) -> 0 | AD52: 0 | AE52: 1 | AF52: =1-SUM(AD52:AE52) -> 0 | AG52: 0 | AH52: 1 | AI52: =1-SUM(AG52:AH52) -> 0 | AJ52: 0 | AK52: 1 | AL52: =1-SUM(AJ52:AK52) -> 0 | AM52: 0 | AN52: 1 | AO52: =1-SUM(AM52:AN52) -> 0 | AP52: 0 | AQ52: 1 | AR52: =1-SUM(AP52:AQ52) -> 0 | AS52: 0 | AT52: 1 | AU52: =1-SUM(AS52:AT52) -> 0 | AV52: 0 | AW52: 1 | AX52: =1-SUM(AV52:AW52) -> 0 | AY52: 0 | AZ52: 1 | BA52: =1-SUM(AY52:AZ52) -> 0 | BB52: 0 | BC52: 1 | BD52: =1-SUM(BB52:BC52) -> 0 | BE52: 0 | BF52: 1 | BG52: =1-SUM(BE52:BF52) -> 0 | BH52: 0 | BI52: 1 | BJ52: =1-SUM(BH52:BI52) -> 0 | BK52: 0 | BL52: 1 | BM52: =1-SUM(BK52:BL52) -> 0 | BN52: 0 | BO52: =1-BN52 -> 1
O53: 1 | P53: 0 | Q53: =1-SUM(O53:P53) -> 0 | R53: 0 | S53: 1 | T53: =1-SUM(R53:S53) -> 0 | U53: 0 | V53: 1 | W53: =1-SUM(U53:V53) -> 0 | X53: 0 | Y53: 1 | Z53: =1-SUM(X53:Y53) -> 0 | AA53: 1 | AB53: 0 | AC53: =1-SUM(AA53:AB53) -> 0 | AD53: 0 | AE53: 1 | AF53: =1-SUM(AD53:AE53) -> 0 | AG53: 0 | AH53: 1 | AI53: =1-SUM(AG53:AH53) -> 0 | AJ53: 0 | AK53: 1 | AL53: =1-SUM(AJ53:AK53) -> 0 | AM53: 0 | AN53: 1 | AO53: =1-SUM(AM53:AN53) -> 0 | AP53: 0 | AQ53: 1 | AR53: =1-SUM(AP53:AQ53) -> 0 | AS53: 0 | AT53: 1 | AU53: =1-SUM(AS53:AT53) -> 0 | AV53: 0 | AW53: 1 | AX53: =1-SUM(AV53:AW53) -> 0 | AY53: 0 | AZ53: 1 | BA53: =1-SUM(AY53:AZ53) -> 0 | BB53: 0 | BC53: 1 | BD53: =1-SUM(BB53:BC53) -> 0 | BE53: 0 | BF53: 1 | BG53: =1-SUM(BE53:BF53) -> 0 | BH53: 0 | BI53: 1 | BJ53: =1-SUM(BH53:BI53) -> 0 | BK53: 0 | BL53: 1 | BM53: =1-SUM(BK53:BL53) -> 0 | BN53: 0 | BO53: =1-BN53 -> 1
O54: 1 | P54: 0 | Q54: =1-SUM(O54:P54) -> 0 | R54: 0 | S54: 1 | T54: =1-SUM(R54:S54) -> 0 | U54: 0 | V54: 1 | W54: =1-SUM(U54:V54) -> 0 | X54: 0 | Y54: 1 | Z54: =1-SUM(X54:Y54) -> 0 | AA54: 0 | AB54: 1 | AC54: =1-SUM(AA54:AB54) -> 0 | AD54: 0 | AE54: 1 | AF54: =1-SUM(AD54:AE54) -> 0 | AG54: 0 | AH54: 1 | AI54: =1-SUM(AG54:AH54) -> 0 | AJ54: 0 | AK54: 1 | AL54: =1-SUM(AJ54:AK54) -> 0 | AM54: 0 | AN54: 1 | AO54: =1-SUM(AM54:AN54) -> 0 | AP54: 0 | AQ54: 1 | AR54: =1-SUM(AP54:AQ54) -> 0 | AS54: 0 | AT54: 1 | AU54: =1-SUM(AS54:AT54) -> 0 | AV54: 0 | AW54: 1 | AX54: =1-SUM(AV54:AW54) -> 0 | AY54: 0 | AZ54: 1 | BA54: =1-SUM(AY54:AZ54) -> 0 | BB54: 0 | BC54: 1 | BD54: =1-SUM(BB54:BC54) -> 0 | BE54: 1 | BF54: 0 | BG54: =1-SUM(BE54:BF54) -> 0 | BH54: 1 | BI54: 0 | BJ54: =1-SUM(BH54:BI54) -> 0 | BK54: 0 | BL54: 1 | BM54: =1-SUM(BK54:BL54) -> 0 | BN54: 0 | BO54: =1-BN54 -> 1
O55: 1 | P55: 0 | Q55: =1-SUM(O55:P55) -> 0 | R55: 0 | S55: 1 | T55: =1-SUM(R55:S55) -> 0 | U55: 0 | V55: 1 | W55: =1-SUM(U55:V55) -> 0 | X55: 0 | Y55: 1 | Z55: =1-SUM(X55:Y55) -> 0 | AA55: 1 | AB55: 0 | AC55: =1-SUM(AA55:AB55) -> 0 | AD55: 0 | AE55: 1 | AF55: =1-SUM(AD55:AE55) -> 0 | AG55: 0 | AH55: 1 | AI55: =1-SUM(AG55:AH55) -> 0 | AJ55: 0 | AK55: 1 | AL55: =1-SUM(AJ55:AK55) -> 0 | AM55: 0 | AN55: 1 | AO55: =1-SUM(AM55:AN55) -> 0 | AP55: 0 | AQ55: 1 | AR55: =1-SUM(AP55:AQ55) -> 0 | AS55: 0 | AT55: 1 | AU55: =1-SUM(AS55:AT55) -> 0 | AV55: 0 | AW55: 1 | AX55: =1-SUM(AV55:AW55) -> 0 | AY55: 0 | AZ55: 1 | BA55: =1-SUM(AY55:AZ55) -> 0 | BB55: 0 | BC55: 1 | BD55: =1-SUM(BB55:BC55) -> 0 | BE55: 1 | BF55: 0 | BG55: =1-SUM(BE55:BF55) -> 0 | BH55: 0 | BI55: 1 | BJ55: =1-SUM(BH55:BI55) -> 0 | BK55: 0 | BL55: 1 | BM55: =1-SUM(BK55:BL55) -> 0 | BN55: 0 | BO55: =1-BN55 -> 1
O56: 1 | P56: 0 | Q56: =1-SUM(O56:P56) -> 0 | R56: 0 | S56: 1 | T56: =1-SUM(R56:S56) -> 0 | U56: 0 | V56: 1 | W56: =1-SUM(U56:V56) -> 0 | X56: 0 | Y56: 1 | Z56: =1-SUM(X56:Y56) -> 0 | AA56: 1 | AB56: 0 | AC56: =1-SUM(AA56:AB56) -> 0 | AD56: 0 | AE56: 1 | AF56: =1-SUM(AD56:AE56) -> 0 | AG56: 0 | AH56: 1 | AI56: =1-SUM(AG56:AH56) -> 0 | AJ56: 0 | AK56: 1 | AL56: =1-SUM(AJ56:AK56) -> 0 | AM56: 0 | AN56: 1 | AO56: =1-SUM(AM56:AN56) -> 0 | AP56: 0 | AQ56: 1 | AR56: =1-SUM(AP56:AQ56) -> 0 | AS56: 0 | AT56: 1 | AU56: =1-SUM(AS56:AT56) -> 0 | AV56: 0 | AW56: 1 | AX56: =1-SUM(AV56:AW56) -> 0 | AY56: 0 | AZ56: 1 | BA56: =1-SUM(AY56:AZ56) -> 0 | BB56: 0 | BC56: 1 | BD56: =1-SUM(BB56:BC56) -> 0 | BE56: 1 | BF56: 0 | BG56: =1-SUM(BE56:BF56) -> 0 | BH56: 1 | BI56: 0 | BJ56: =1-SUM(BH56:BI56) -> 0 | BK56: 0 | BL56: 1 | BM56: =1-SUM(BK56:BL56) -> 0 | BN56: 0 | BO56: =1-BN56 -> 1
O57: 1 | P57: 0 | Q57: =1-SUM(O57:P57) -> 0 | R57: 0 | S57: 1 | T57: =1-SUM(R57:S57) -> 0 | U57: 0 | V57: 1 | W57: =1-SUM(U57:V57) -> 0 | X57: 0 | Y57: 1 | Z57: =1-SUM(X57:Y57) -> 0 | AA57: 1 | AB57: 0 | AC57: =1-SUM(AA57:AB57) -> 0 | AD57: 0 | AE57: 1 | AF57: =1-SUM(AD57:AE57) -> 0 | AG57: 0 | AH57: 1 | AI57: =1-SUM(AG57:AH57) -> 0 | AJ57: 0 | AK57: 1 | AL57: =1-SUM(AJ57:AK57) -> 0 | AM57: 0 | AN57: 1 | AO57: =1-SUM(AM57:AN57) -> 0 | AP57: 0 | AQ57: 1 | AR57: =1-SUM(AP57:AQ57) -> 0 | AS57: 0 | AT57: 1 | AU57: =1-SUM(AS57:AT57) -> 0 | AV57: 0 | AW57: 1 | AX57: =1-SUM(AV57:AW57) -> 0 | AY57: 0 | AZ57: 1 | BA57: =1-SUM(AY57:AZ57) -> 0 | BB57: 0 | BC57: 1 | BD57: =1-SUM(BB57:BC57) -> 0 | BE57: 1 | BF57: 0 | BG57: =1-SUM(BE57:BF57) -> 0 | BH57: 0 | BI57: 1 | BJ57: =1-SUM(BH57:BI57) -> 0 | BK57: 0 | BL57: 1 | BM57: =1-SUM(BK57:BL57) -> 0 | BN57: 1 | BO57: =1-BN57 -> 0
O58: 1 | P58: 0 | Q58: =1-SUM(O58:P58) -> 0 | R58: 1 | S58: 0 | T58: =1-SUM(R58:S58) -> 0 | U58: 0 | V58: 1 | W58: =1-SUM(U58:V58) -> 0 | X58: 1 | Y58: 0 | Z58: =1-SUM(X58:Y58) -> 0 | AA58: 1 | AB58: 0 | AC58: =1-SUM(AA58:AB58) -> 0 | AD58: 1 | AE58: 0 | AF58: =1-SUM(AD58:AE58) -> 0 | AG58: 1 | AH58: 0 | AI58: =1-SUM(AG58:AH58) -> 0 | AJ58: 0 | AK58: 1 | AL58: =1-SUM(AJ58:AK58) -> 0 | AM58: 0 | AN58: 1 | AO58: =1-SUM(AM58:AN58) -> 0 | AP58: 0 | AQ58: 1 | AR58: =1-SUM(AP58:AQ58) -> 0 | AS58: 0 | AT58: 1 | AU58: =1-SUM(AS58:AT58) -> 0 | AV58: 1 | AW58: 0 | AX58: =1-SUM(AV58:AW58) -> 0 | AY58: 0 | AZ58: 1 | BA58: =1-SUM(AY58:AZ58) -> 0 | BB58: 0 | BC58: 1 | BD58: =1-SUM(BB58:BC58) -> 0 | BE58: 0 | BF58: 1 | BG58: =1-SUM(BE58:BF58) -> 0 | BH58: 0 | BI58: 1 | BJ58: =1-SUM(BH58:BI58) -> 0 | BK58: 0 | BL58: 1 | BM58: =1-SUM(BK58:BL58) -> 0 | BN58: 1 | BO58: =1-BN58 -> 0
O59: 1 | P59: 0 | Q59: =1-SUM(O59:P59) -> 0 | R59: 0 | S59: 1 | T59: =1-SUM(R59:S59) -> 0 | U59: 0 | V59: 1 | W59: =1-SUM(U59:V59) -> 0 | X59: 0 | Y59: 1 | Z59: =1-SUM(X59:Y59) -> 0 | AA59: 0 | AB59: 1 | AC59: =1-SUM(AA59:AB59) -> 0 | AD59: 0 | AE59: 1 | AF59: =1-SUM(AD59:AE59) -> 0 | AG59: 0 | AH59: 1 | AI59: =1-SUM(AG59:AH59) -> 0 | AJ59: 1 | AK59: 0 | AL59: =1-SUM(AJ59:AK59) -> 0 | AM59: 1 | AN59: 0 | AO59: =1-SUM(AM59:AN59) -> 0 | AP59: 0 | AQ59: 1 | AR59: =1-SUM(AP59:AQ59) -> 0 | AS59: 0 | AT59: 1 | AU59: =1-SUM(AS59:AT59) -> 0 | AV59: 0 | AW59: 1 | AX59: =1-SUM(AV59:AW59) -> 0 | AY59: 0 | AZ59: 1 | BA59: =1-SUM(AY59:AZ59) -> 0 | BB59: 0 | BC59: 1 | BD59: =1-SUM(BB59:BC59) -> 0 | BE59: 0 | BF59: 1 | BG59: =1-SUM(BE59:BF59) -> 0 | BH59: 1 | BI59: 0 | BJ59: =1-SUM(BH59:BI59) -> 0 | BK59: 0 | BL59: 1 | BM59: =1-SUM(BK59:BL59) -> 0 | BN59: 1 | BO59: =1-BN59 -> 0
O60: 1 | P60: 0 | Q60: =1-SUM(O60:P60) -> 0 | R60: 1 | S60: 0 | T60: =1-SUM(R60:S60) -> 0 | U60: 1 | V60: 0 | W60: =1-SUM(U60:V60) -> 0 | X60: 1 | Y60: 0 | Z60: =1-SUM(X60:Y60) -> 0 | AA60: 1 | AB60: 0 | AC60: =1-SUM(AA60:AB60) -> 0 | AD60: 1 | AE60: 0 | AF60: =1-SUM(AD60:AE60) -> 0 | AG60: 1 | AH60: 0 | AI60: =1-SUM(AG60:AH60) -> 0 | AJ60: 1 | AK60: 0 | AL60: =1-SUM(AJ60:AK60) -> 0 | AM60: 1 | AN60: 0 | AO60: =1-SUM(AM60:AN60) -> 0 | AP60: 0 | AQ60: 1 | AR60: =1-SUM(AP60:AQ60) -> 0 | AS60: 0 | AT60: 1 | AU60: =1-SUM(AS60:AT60) -> 0 | AV60: 1 | AW60: 0 | AX60: =1-SUM(AV60:AW60) -> 0 | AY60: 0 | AZ60: 1 | BA60: =1-SUM(AY60:AZ60) -> 0 | BB60: 0 | BC60: 1 | BD60: =1-SUM(BB60:BC60) -> 0 | BE60: 0 | BF60: 1 | BG60: =1-SUM(BE60:BF60) -> 0 | BH60: 0 | BI60: 1 | BJ60: =1-SUM(BH60:BI60) -> 0 | BK60: 0 | BL60: 1 | BM60: =1-SUM(BK60:BL60) -> 0 | BN60: 1 | BO60: =1-BN60 -> 0
O61: 1 | P61: 0 | Q61: =1-SUM(O61:P61) -> 0 | R61: 1 | S61: 0 | T61: =1-SUM(R61:S61) -> 0 | U61: 1 | V61: 0 | W61: =1-SUM(U61:V61) -> 0 | X61: 1 | Y61: 0 | Z61: =1-SUM(X61:Y61) -> 0 | AA61: 1 | AB61: 0 | AC61: =1-SUM(AA61:AB61) -> 0 | AD61: 1 | AE61: 0 | AF61: =1-SUM(AD61:AE61) -> 0 | AG61: 1 | AH61: 0 | AI61: =1-SUM(AG61:AH61) -> 0 | AJ61: 1 | AK61: 0 | AL61: =1-SUM(AJ61:AK61) -> 0 | AM61: 1 | AN61: 0 | AO61: =1-SUM(AM61:AN61) -> 0 | AP61: 0 | AQ61: 1 | AR61: =1-SUM(AP61:AQ61) -> 0 | AS61: 0 | AT61: 1 | AU61: =1-SUM(AS61:AT61) -> 0 | AV61: 1 | AW61: 0 | AX61: =1-SUM(AV61:AW61) -> 0 | AY61: 0 | AZ61: 1 | BA61: =1-SUM(AY61:AZ61) -> 0 | BB61: 0 | BC61: 1 | BD61: =1-SUM(BB61:BC61) -> 0 | BE61: 0 | BF61: 1 | BG61: =1-SUM(BE61:BF61) -> 0 | BH61: 0 | BI61: 1 | BJ61: =1-SUM(BH61:BI61) -> 0 | BK61: 0 | BL61: 1 | BM61: =1-SUM(BK61:BL61) -> 0 | BN61: 0 | BO61: =1-BN61 -> 1
O62: 0 | P62: 1 | Q62: =1-SUM(O62:P62) -> 0 | R62: 0 | S62: 1 | T62: =1-SUM(R62:S62) -> 0 | U62: 0 | V62: 1 | W62: =1-SUM(U62:V62) -> 0 | X62: 0 | Y62: 1 | Z62: =1-SUM(X62:Y62) -> 0 | AA62: 0 | AB62: 1 | AC62: =1-SUM(AA62:AB62) -> 0 | AD62: 0 | AE62: 1 | AF62: =1-SUM(AD62:AE62) -> 0 | AG62: 0 | AH62: 1 | AI62: =1-SUM(AG62:AH62) -> 0 | AJ62: 0 | AK62: 1 | AL62: =1-SUM(AJ62:AK62) -> 0 | AM62: 0 | AN62: 1 | AO62: =1-SUM(AM62:AN62) -> 0 | AP62: 0 | AQ62: 1 | AR62: =1-SUM(AP62:AQ62) -> 0 | AS62: 0 | AT62: 1 | AU62: =1-SUM(AS62:AT62) -> 0 | AV62: 0 | AW62: 1 | AX62: =1-SUM(AV62:AW62) -> 0 | AY62: 0 | AZ62: 1 | BA62: =1-SUM(AY62:AZ62) -> 0 | BB62: 0 | BC62: 1 | BD62: =1-SUM(BB62:BC62) -> 0 | BE62: 0 | BF62: 1 | BG62: =1-SUM(BE62:BF62) -> 0 | BH62: 0 | BI62: 1 | BJ62: =1-SUM(BH62:BI62) -> 0 | BK62: 0 | BL62: 1 | BM62: =1-SUM(BK62:BL62) -> 0 | BN62: 0 | BO62: =1-BN62 -> 1
O63: 0 | P63: 1 | Q63: =1-SUM(O63:P63) -> 0 | R63: 0 | S63: 1 | T63: =1-SUM(R63:S63) -> 0 | U63: 0 | V63: 1 | W63: =1-SUM(U63:V63) -> 0 | X63: 0 | Y63: 1 | Z63: =1-SUM(X63:Y63) -> 0 | AA63: 0 | AB63: 1 | AC63: =1-SUM(AA63:AB63) -> 0 | AD63: 0 | AE63: 1 | AF63: =1-SUM(AD63:AE63) -> 0 | AG63: 0 | AH63: 1 | AI63: =1-SUM(AG63:AH63) -> 0 | AJ63: 0 | AK63: 1 | AL63: =1-SUM(AJ63:AK63) -> 0 | AM63: 0 | AN63: 1 | AO63: =1-SUM(AM63:AN63) -> 0 | AP63: 0 | AQ63: 1 | AR63: =1-SUM(AP63:AQ63) -> 0 | AS63: 0 | AT63: 1 | AU63: =1-SUM(AS63:AT63) -> 0 | AV63: 0 | AW63: 1 | AX63: =1-SUM(AV63:AW63) -> 0 | AY63: 0 | AZ63: 1 | BA63: =1-SUM(AY63:AZ63) -> 0 | BB63: 0 | BC63: 1 | BD63: =1-SUM(BB63:BC63) -> 0 | BE63: 0 | BF63: 1 | BG63: =1-SUM(BE63:BF63) -> 0 | BH63: 0 | BI63: 1 | BJ63: =1-SUM(BH63:BI63) -> 0 | BK63: 0 | BL63: 1 | BM63: =1-SUM(BK63:BL63) -> 0 | BN63: 0 | BO63: =1-BN63 -> 1
O64: 1 | P64: 0 | Q64: =1-SUM(O64:P64) -> 0 | R64: 0 | S64: 1 | T64: =1-SUM(R64:S64) -> 0 | U64: 0 | V64: 1 | W64: =1-SUM(U64:V64) -> 0 | X64: 0 | Y64: 1 | Z64: =1-SUM(X64:Y64) -> 0 | AA64: 0 | AB64: 1 | AC64: =1-SUM(AA64:AB64) -> 0 | AD64: 1 | AE64: 0 | AF64: =1-SUM(AD64:AE64) -> 0 | AG64: 1 | AH64: 0 | AI64: =1-SUM(AG64:AH64) -> 0 | AJ64: 0 | AK64: 1 | AL64: =1-SUM(AJ64:AK64) -> 0 | AM64: 0 | AN64: 1 | AO64: =1-SUM(AM64:AN64) -> 0 | AP64: 0 | AQ64: 1 | AR64: =1-SUM(AP64:AQ64) -> 0 | AS64: 0 | AT64: 1 | AU64: =1-SUM(AS64:AT64) -> 0 | AV64: 0 | AW64: 1 | AX64: =1-SUM(AV64:AW64) -> 0 | AY64: 0 | AZ64: 1 | BA64: =1-SUM(AY64:AZ64) -> 0 | BB64: 0 | BC64: 1 | BD64: =1-SUM(BB64:BC64) -> 0 | BE64: 0 | BF64: 1 | BG64: =1-SUM(BE64:BF64) -> 0 | BH64: 1 | BI64: 0 | BJ64: =1-SUM(BH64:BI64) -> 0 | BK64: 0 | BL64: 1 | BM64: =1-SUM(BK64:BL64) -> 0 | BN64: 0 | BO64: =1-BN64 -> 1
O65: 1 | P65: 0 | Q65: =1-SUM(O65:P65) -> 0 | R65: 0 | S65: 1 | T65: =1-SUM(R65:S65) -> 0 | U65: 0 | V65: 1 | W65: =1-SUM(U65:V65) -> 0 | X65: 0 | Y65: 1 | Z65: =1-SUM(X65:Y65) -> 0 | AA65: 1 | AB65: 0 | AC65: =1-SUM(AA65:AB65) -> 0 | AD65: 0 | AE65: 1 | AF65: =1-SUM(AD65:AE65) -> 0 | AG65: 1 | AH65: 0 | AI65: =1-SUM(AG65:AH65) -> 0 | AJ65: 0 | AK65: 1 | AL65: =1-SUM(AJ65:AK65) -> 0 | AM65: 0 | AN65: 1 | AO65: =1-SUM(AM65:AN65) -> 0 | AP65: 0 | AQ65: 1 | AR65: =1-SUM(AP65:AQ65) -> 0 | AS65: 0 | AT65: 1 | AU65: =1-SUM(AS65:AT65) -> 0 | AV65: 0 | AW65: 1 | AX65: =1-SUM(AV65:AW65) -> 0 | AY65: 0 | AZ65: 1 | BA65: =1-SUM(AY65:AZ65) -> 0 | BB65: 0 | BC65: 1 | BD65: =1-SUM(BB65:BC65) -> 0 | BE65: 0 | BF65: 1 | BG65: =1-SUM(BE65:BF65) -> 0 | BH65: 1 | BI65: 0 | BJ65: =1-SUM(BH65:BI65) -> 0 | BK65: 1 | BL65: 0 | BM65: =1-SUM(BK65:BL65) -> 0 | BN65: 0 | BO65: =1-BN65 -> 1
O66: 1 | P66: 0 | Q66: =1-SUM(O66:P66) -> 0 | R66: 0 | S66: 1 | T66: =1-SUM(R66:S66) -> 0 | U66: 0 | V66: 1 | W66: =1-SUM(U66:V66) -> 0 | X66: 0 | Y66: 1 | Z66: =1-SUM(X66:Y66) -> 0 | AA66: 0 | AB66: 1 | AC66: =1-SUM(AA66:AB66) -> 0 | AD66: 0 | AE66: 1 | AF66: =1-SUM(AD66:AE66) -> 0 | AG66: 0 | AH66: 1 | AI66: =1-SUM(AG66:AH66) -> 0 | AJ66: 1 | AK66: 0 | AL66: =1-SUM(AJ66:AK66) -> 0 | AM66: 0 | AN66: 1 | AO66: =1-SUM(AM66:AN66) -> 0 | AP66: 0 | AQ66: 1 | AR66: =1-SUM(AP66:AQ66) -> 0 | AS66: 0 | AT66: 1 | AU66: =1-SUM(AS66:AT66) -> 0 | AV66: 0 | AW66: 1 | AX66: =1-SUM(AV66:AW66) -> 0 | AY66: 0 | AZ66: 1 | BA66: =1-SUM(AY66:AZ66) -> 0 | BB66: 0 | BC66: 1 | BD66: =1-SUM(BB66:BC66) -> 0 | BE66: 0 | BF66: 1 | BG66: =1-SUM(BE66:BF66) -> 0 | BH66: 1 | BI66: 0 | BJ66: =1-SUM(BH66:BI66) -> 0 | BK66: 0 | BL66: 1 | BM66: =1-SUM(BK66:BL66) -> 0 | BN66: 0 | BO66: =1-BN66 -> 1
O67: 1 | P67: 0 | Q67: =1-SUM(O67:P67) -> 0 | R67: 1 | S67: 0 | T67: =1-SUM(R67:S67) -> 0 | U67: 0 | V67: 1 | W67: =1-SUM(U67:V67) -> 0 | X67: 1 | Y67: 0 | Z67: =1-SUM(X67:Y67) -> 0 | AA67: 0 | AB67: 1 | AC67: =1-SUM(AA67:AB67) -> 0 | AD67: 1 | AE67: 0 | AF67: =1-SUM(AD67:AE67) -> 0 | AG67: 1 | AH67: 0 | AI67: =1-SUM(AG67:AH67) -> 0 | AJ67: 0 | AK67: 1 | AL67: =1-SUM(AJ67:AK67) -> 0 | AM67: 0 | AN67: 1 | AO67: =1-SUM(AM67:AN67) -> 0 | AP67: 0 | AQ67: 1 | AR67: =1-SUM(AP67:AQ67) -> 0 | AS67: 0 | AT67: 1 | AU67: =1-SUM(AS67:AT67) -> 0 | AV67: 0 | AW67: 1 | AX67: =1-SUM(AV67:AW67) -> 0 | AY67: 0 | AZ67: 1 | BA67: =1-SUM(AY67:AZ67) -> 0 | BB67: 0 | BC67: 1 | BD67: =1-SUM(BB67:BC67) -> 0 | BE67: 0 | BF67: 1 | BG67: =1-SUM(BE67:BF67) -> 0 | BH67: 1 | BI67: 0 | BJ67: =1-SUM(BH67:BI67) -> 0 | BK67: 0 | BL67: 1 | BM67: =1-SUM(BK67:BL67) -> 0 | BN67: 0 | BO67: =1-BN67 -> 1
O68: 1 | P68: 0 | Q68: =1-SUM(O68:P68) -> 0 | R68: 1 | S68: 0 | T68: =1-SUM(R68:S68) -> 0 | U68: 1 | V68: 0 | W68: =1-SUM(U68:V68) -> 0 | X68: 1 | Y68: 0 | Z68: =1-SUM(X68:Y68) -> 0 | AA68: 0 | AB68: 1 | AC68: =1-SUM(AA68:AB68) -> 0 | AD68: 0 | AE68: 1 | AF68: =1-SUM(AD68:AE68) -> 0 | AG68: 0 | AH68: 1 | AI68: =1-SUM(AG68:AH68) -> 0 | AJ68: 1 | AK68: 0 | AL68: =1-SUM(AJ68:AK68) -> 0 | AM68: 1 | AN68: 0 | AO68: =1-SUM(AM68:AN68) -> 0 | AP68: 0 | AQ68: 1 | AR68: =1-SUM(AP68:AQ68) -> 0 | AS68: 0 | AT68: 1 | AU68: =1-SUM(AS68:AT68) -> 0 | AV68: 1 | AW68: 0 | AX68: =1-SUM(AV68:AW68) -> 0 | AY68: 0 | AZ68: 1 | BA68: =1-SUM(AY68:AZ68) -> 0 | BB68: 0 | BC68: 1 | BD68: =1-SUM(BB68:BC68) -> 0 | BE68: 0 | BF68: 1 | BG68: =1-SUM(BE68:BF68) -> 0 | BH68: 1 | BI68: 0 | BJ68: =1-SUM(BH68:BI68) -> 0 | BK68: 0 | BL68: 1 | BM68: =1-SUM(BK68:BL68) -> 0 | BN68: 0 | BO68: =1-BN68 -> 1
O69: 1 | P69: 0 | Q69: =1-SUM(O69:P69) -> 0 | R69: 1 | S69: 0 | T69: =1-SUM(R69:S69) -> 0 | U69: 1 | V69: 0 | W69: =1-SUM(U69:V69) -> 0 | X69: 1 | Y69: 0 | Z69: =1-SUM(X69:Y69) -> 0 | AA69: 0 | AB69: 1 | AC69: =1-SUM(AA69:AB69) -> 0 | AD69: 0 | AE69: 1 | AF69: =1-SUM(AD69:AE69) -> 0 | AG69: 0 | AH69: 1 | AI69: =1-SUM(AG69:AH69) -> 0 | AJ69: 1 | AK69: 0 | AL69: =1-SUM(AJ69:AK69) -> 0 | AM69: 1 | AN69: 0 | AO69: =1-SUM(AM69:AN69) -> 0 | AP69: 1 | AQ69: 0 | AR69: =1-SUM(AP69:AQ69) -> 0 | AS69: 0 | AT69: 1 | AU69: =1-SUM(AS69:AT69) -> 0 | AV69: 0 | AW69: 1 | AX69: =1-SUM(AV69:AW69) -> 0 | AY69: 0 | AZ69: 1 | BA69: =1-SUM(AY69:AZ69) -> 0 | BB69: 0 | BC69: 1 | BD69: =1-SUM(BB69:BC69) -> 0 | BE69: 0 | BF69: 1 | BG69: =1-SUM(BE69:BF69) -> 0 | BH69: 1 | BI69: 0 | BJ69: =1-SUM(BH69:BI69) -> 0 | BK69: 0 | BL69: 1 | BM69: =1-SUM(BK69:BL69) -> 0 | BN69: 0 | BO69: =1-BN69 -> 1
O70: 1 | P70: 0 | Q70: =1-SUM(O70:P70) -> 0 | R70: 1 | S70: 0 | T70: =1-SUM(R70:S70) -> 0 | U70: 1 | V70: 0 | W70: =1-SUM(U70:V70) -> 0 | X70: 1 | Y70: 0 | Z70: =1-SUM(X70:Y70) -> 0 | AA70: 1 | AB70: 0 | AC70: =1-SUM(AA70:AB70) -> 0 | AD70: 0 | AE70: 1 | AF70: =1-SUM(AD70:AE70) -> 0 | AG70: 1 | AH70: 0 | AI70: =1-SUM(AG70:AH70) -> 0 | AJ70: 1 | AK70: 0 | AL70: =1-SUM(AJ70:AK70) -> 0 | AM70: 0 | AN70: 1 | AO70: =1-SUM(AM70:AN70) -> 0 | AP70: 0 | AQ70: 1 | AR70: =1-SUM(AP70:AQ70) -> 0 | AS70: 1 | AT70: 0 | AU70: =1-SUM(AS70:AT70) -> 0 | AV70: 1 | AW70: 0 | AX70: =1-SUM(AV70:AW70) -> 0 | AY70: 0 | AZ70: 1 | BA70: =1-SUM(AY70:AZ70) -> 0 | BB70: 0 | BC70: 1 | BD70: =1-SUM(BB70:BC70) -> 0 | BE70: 0 | BF70: 1 | BG70: =1-SUM(BE70:BF70) -> 0 | BH70: 0 | BI70: 1 | BJ70: =1-SUM(BH70:BI70) -> 0 | BK70: 1 | BL70: 0 | BM70: =1-SUM(BK70:BL70) -> 0 | BN70: 0 | BO70: =1-BN70 -> 1
O71: 1 | P71: 0 | Q71: =1-SUM(O71:P71) -> 0 | R71: 1 | S71: 0 | T71: =1-SUM(R71:S71) -> 0 | U71: 1 | V71: 0 | W71: =1-SUM(U71:V71) -> 0 | X71: 1 | Y71: 0 | Z71: =1-SUM(X71:Y71) -> 0 | AA71: 1 | AB71: 0 | AC71: =1-SUM(AA71:AB71) -> 0 | AD71: 1 | AE71: 0 | AF71: =1-SUM(AD71:AE71) -> 0 | AG71: 0 | AH71: 1 | AI71: =1-SUM(AG71:AH71) -> 0 | AJ71: 0 | AK71: 1 | AL71: =1-SUM(AJ71:AK71) -> 0 | AM71: 0 | AN71: 1 | AO71: =1-SUM(AM71:AN71) -> 0 | AP71: 0 | AQ71: 1 | AR71: =1-SUM(AP71:AQ71) -> 0 | AS71: 0 | AT71: 1 | AU71: =1-SUM(AS71:AT71) -> 0 | AV71: 1 | AW71: 0 | AX71: =1-SUM(AV71:AW71) -> 0 | AY71: 1 | AZ71: 0 | BA71: =1-SUM(AY71:AZ71) -> 0 | BB71: 0 | BC71: 1 | BD71: =1-SUM(BB71:BC71) -> 0 | BE71: 0 | BF71: 1 | BG71: =1-SUM(BE71:BF71) -> 0 | BH71: 0 | BI71: 1 | BJ71: =1-SUM(BH71:BI71) -> 0 | BK71: 1 | BL71: 0 | BM71: =1-SUM(BK71:BL71) -> 0 | BN71: 0 | BO71: =1-BN71 -> 1
O72: 0 | P72: 1 | Q72: =1-SUM(O72:P72) -> 0 | R72: 1 | S72: 0 | T72: =1-SUM(R72:S72) -> 0 | U72: 1 | V72: 0 | W72: =1-SUM(U72:V72) -> 0 | X72: 0 | Y72: 1 | Z72: =1-SUM(X72:Y72) -> 0 | AA72: 0 | AB72: 1 | AC72: =1-SUM(AA72:AB72) -> 0 | AD72: 0 | AE72: 1 | AF72: =1-SUM(AD72:AE72) -> 0 | AG72: 1 | AH72: 0 | AI72: =1-SUM(AG72:AH72) -> 0 | AJ72: 1 | AK72: 0 | AL72: =1-SUM(AJ72:AK72) -> 0 | AM72: 1 | AN72: 0 | AO72: =1-SUM(AM72:AN72) -> 0 | AP72: 0 | AQ72: 1 | AR72: =1-SUM(AP72:AQ72) -> 0 | AS72: 0 | AT72: 1 | AU72: =1-SUM(AS72:AT72) -> 0 | AV72: 1 | AW72: 0 | AX72: =1-SUM(AV72:AW72) -> 0 | AY72: 1 | AZ72: 0 | BA72: =1-SUM(AY72:AZ72) -> 0 | BB72: 1 | BC72: 0 | BD72: =1-SUM(BB72:BC72) -> 0 | BE72: 1 | BF72: 0 | BG72: =1-SUM(BE72:BF72) -> 0 | BH72: 0 | BI72: 1 | BJ72: =1-SUM(BH72:BI72) -> 0 | BK72: 0 | BL72: 1 | BM72: =1-SUM(BK72:BL72) -> 0 | BN72: 0 | BO72: =1-BN72 -> 1
O73: 1 | P73: 0 | Q73: =1-SUM(O73:P73) -> 0 | R73: 0 | S73: 1 | T73: =1-SUM(R73:S73) -> 0 | U73: 0 | V73: 1 | W73: =1-SUM(U73:V73) -> 0 | X73: 0 | Y73: 1 | Z73: =1-SUM(X73:Y73) -> 0 | AA73: 1 | AB73: 0 | AC73: =1-SUM(AA73:AB73) -> 0 | AD73: 0 | AE73: 1 | AF73: =1-SUM(AD73:AE73) -> 0 | AG73: 0 | AH73: 1 | AI73: =1-SUM(AG73:AH73) -> 0 | AJ73: 0 | AK73: 1 | AL73: =1-SUM(AJ73:AK73) -> 0 | AM73: 0 | AN73: 1 | AO73: =1-SUM(AM73:AN73) -> 0 | AP73: 0 | AQ73: 1 | AR73: =1-SUM(AP73:AQ73) -> 0 | AS73: 0 | AT73: 1 | AU73: =1-SUM(AS73:AT73) -> 0 | AV73: 1 | AW73: 0 | AX73: =1-SUM(AV73:AW73) -> 0 | AY73: 1 | AZ73: 0 | BA73: =1-SUM(AY73:AZ73) -> 0 | BB73: 0 | BC73: 1 | BD73: =1-SUM(BB73:BC73) -> 0 | BE73: 0 | BF73: 1 | BG73: =1-SUM(BE73:BF73) -> 0 | BH73: 0 | BI73: 1 | BJ73: =1-SUM(BH73:BI73) -> 0 | BK73: 0 | BL73: 1 | BM73: =1-SUM(BK73:BL73) -> 0 | BN73: 0 | BO73: =1-BN73 -> 1
O74: 1 | P74: 0 | Q74: =1-SUM(O74:P74) -> 0 | R74: 0 | S74: 1 | T74: =1-SUM(R74:S74) -> 0 | U74: 0 | V74: 1 | W74: =1-SUM(U74:V74) -> 0 | X74: 0 | Y74: 1 | Z74: =1-SUM(X74:Y74) -> 0 | AA74: 0 | AB74: 1 | AC74: =1-SUM(AA74:AB74) -> 0 | AD74: 0 | AE74: 1 | AF74: =1-SUM(AD74:AE74) -> 0 | AG74: 0 | AH74: 1 | AI74: =1-SUM(AG74:AH74) -> 0 | AJ74: 0 | AK74: 1 | AL74: =1-SUM(AJ74:AK74) -> 0 | AM74: 0 | AN74: 1 | AO74: =1-SUM(AM74:AN74) -> 0 | AP74: 0 | AQ74: 1 | AR74: =1-SUM(AP74:AQ74) -> 0 | AS74: 0 | AT74: 1 | AU74: =1-SUM(AS74:AT74) -> 0 | AV74: 0 | AW74: 1 | AX74: =1-SUM(AV74:AW74) -> 0 | AY74: 0 | AZ74: 1 | BA74: =1-SUM(AY74:AZ74) -> 0 | BB74: 0 | BC74: 1 | BD74: =1-SUM(BB74:BC74) -> 0 | BE74: 0 | BF74: 1 | BG74: =1-SUM(BE74:BF74) -> 0 | BH74: 0 | BI74: 1 | BJ74: =1-SUM(BH74:BI74) -> 0 | BK74: 0 | BL74: 1 | BM74: =1-SUM(BK74:BL74) -> 0 | BN74: 1 | BO74: =1-BN74 -> 0
O75: 1 | P75: 0 | Q75: =1-SUM(O75:P75) -> 0 | R75: 1 | S75: 0 | T75: =1-SUM(R75:S75) -> 0 | U75: 1 | V75: 0 | W75: =1-SUM(U75:V75) -> 0 | X75: 1 | Y75: 0 | Z75: =1-SUM(X75:Y75) -> 0 | AA75: 1 | AB75: 0 | AC75: =1-SUM(AA75:AB75) -> 0 | AD75: 1 | AE75: 0 | AF75: =1-SUM(AD75:AE75) -> 0 | AG75: 1 | AH75: 0 | AI75: =1-SUM(AG75:AH75) -> 0 | AJ75: 1 | AK75: 0 | AL75: =1-SUM(AJ75:AK75) -> 0 | AM75: 1 | AN75: 0 | AO75: =1-SUM(AM75:AN75) -> 0 | AP75: 0 | AQ75: 1 | AR75: =1-SUM(AP75:AQ75) -> 0 | AS75: 1 | AT75: 0 | AU75: =1-SUM(AS75:AT75) -> 0 | AV75: 1 | AW75: 0 | AX75: =1-SUM(AV75:AW75) -> 0 | AY75: 1 | AZ75: 0 | BA75: =1-SUM(AY75:AZ75) -> 0 | BB75: 0 | BC75: 1 | BD75: =1-SUM(BB75:BC75) -> 0 | BE75: 0 | BF75: 1 | BG75: =1-SUM(BE75:BF75) -> 0 | BH75: 0 | BI75: 1 | BJ75: =1-SUM(BH75:BI75) -> 0 | BK75: 0 | BL75: 1 | BM75: =1-SUM(BK75:BL75) -> 0 | BN75: 0 | BO75: =1-BN75 -> 1
O76: 1 | P76: 0 | Q76: =1-SUM(O76:P76) -> 0 | R76: 1 | S76: 0 | T76: =1-SUM(R76:S76) -> 0 | U76: 1 | V76: 0 | W76: =1-SUM(U76:V76) -> 0 | X76: 1 | Y76: 0 | Z76: =1-SUM(X76:Y76) -> 0 | AA76: 1 | AB76: 0 | AC76: =1-SUM(AA76:AB76) -> 0 | AD76: 0 | AE76: 1 | AF76: =1-SUM(AD76:AE76) -> 0 | AG76: 0 | AH76: 1 | AI76: =1-SUM(AG76:AH76) -> 0 | AJ76: 1 | AK76: 0 | AL76: =1-SUM(AJ76:AK76) -> 0 | AM76: 1 | AN76: 0 | AO76: =1-SUM(AM76:AN76) -> 0 | AP76: 0 | AQ76: 1 | AR76: =1-SUM(AP76:AQ76) -> 0 | AS76: 1 | AT76: 0 | AU76: =1-SUM(AS76:AT76) -> 0 | AV76: 1 | AW76: 0 | AX76: =1-SUM(AV76:AW76) -> 0 | AY76: 0 | AZ76: 1 | BA76: =1-SUM(AY76:AZ76) -> 0 | BB76: 0 | BC76: 1 | BD76: =1-SUM(BB76:BC76) -> 0 | BE76: 0 | BF76: 1 | BG76: =1-SUM(BE76:BF76) -> 0 | BH76: 0 | BI76: 1 | BJ76: =1-SUM(BH76:BI76) -> 0 | BK76: 0 | BL76: 1 | BM76: =1-SUM(BK76:BL76) -> 0 | BN76: 0 | BO76: =1-BN76 -> 1
O77: 1 | P77: 0 | Q77: =1-SUM(O77:P77) -> 0 | R77: 1 | S77: 0 | T77: =1-SUM(R77:S77) -> 0 | U77: 1 | V77: 0 | W77: =1-SUM(U77:V77) -> 0 | X77: 1 | Y77: 0 | Z77: =1-SUM(X77:Y77) -> 0 | AA77: 1 | AB77: 0 | AC77: =1-SUM(AA77:AB77) -> 0 | AD77: 0 | AE77: 1 | AF77: =1-SUM(AD77:AE77) -> 0 | AG77: 0 | AH77: 1 | AI77: =1-SUM(AG77:AH77) -> 0 | AJ77: 1 | AK77: 0 | AL77: =1-SUM(AJ77:AK77) -> 0 | AM77: 1 | AN77: 0 | AO77: =1-SUM(AM77:AN77) -> 0 | AP77: 0 | AQ77: 1 | AR77: =1-SUM(AP77:AQ77) -> 0 | AS77: 1 | AT77: 0 | AU77: =1-SUM(AS77:AT77) -> 0 | AV77: 1 | AW77: 0 | AX77: =1-SUM(AV77:AW77) -> 0 | AY77: 0 | AZ77: 1 | BA77: =1-SUM(AY77:AZ77) -> 0 | BB77: 0 | BC77: 1 | BD77: =1-SUM(BB77:BC77) -> 0 | BE77: 0 | BF77: 1 | BG77: =1-SUM(BE77:BF77) -> 0 | BH77: 0 | BI77: 1 | BJ77: =1-SUM(BH77:BI77) -> 0 | BK77: 0 | BL77: 1 | BM77: =1-SUM(BK77:BL77) -> 0 | BN77: 0 | BO77: =1-BN77 -> 1
O78: 1 | P78: 0 | Q78: =1-SUM(O78:P78) -> 0 | R78: 1 | S78: 0 | T78: =1-SUM(R78:S78) -> 0 | U78: 1 | V78: 0 | W78: =1-SUM(U78:V78) -> 0 | X78: 1 | Y78: 0 | Z78: =1-SUM(X78:Y78) -> 0 | AA78: 1 | AB78: 0 | AC78: =1-SUM(AA78:AB78) -> 0 | AD78: 0 | AE78: 1 | AF78: =1-SUM(AD78:AE78) -> 0 | AG78: 0 | AH78: 1 | AI78: =1-SUM(AG78:AH78) -> 0 | AJ78: 1 | AK78: 0 | AL78: =1-SUM(AJ78:AK78) -> 0 | AM78: 1 | AN78: 0 | AO78: =1-SUM(AM78:AN78) -> 0 | AP78: 0 | AQ78: 1 | AR78: =1-SUM(AP78:AQ78) -> 0 | AS78: 1 | AT78: 0 | AU78: =1-SUM(AS78:AT78) -> 0 | AV78: 1 | AW78: 0 | AX78: =1-SUM(AV78:AW78) -> 0 | AY78: 0 | AZ78: 1 | BA78: =1-SUM(AY78:AZ78) -> 0 | BB78: 0 | BC78: 1 | BD78: =1-SUM(BB78:BC78) -> 0 | BE78: 0 | BF78: 1 | BG78: =1-SUM(BE78:BF78) -> 0 | BH78: 0 | BI78: 1 | BJ78: =1-SUM(BH78:BI78) -> 0 | BK78: 0 | BL78: 1 | BM78: =1-SUM(BK78:BL78) -> 0 | BN78: 1 | BO78: =1-BN78 -> 0
O79: 1 | P79: 0 | Q79: =1-SUM(O79:P79) -> 0 | R79: 1 | S79: 0 | T79: =1-SUM(R79:S79) -> 0 | U79: 1 | V79: 0 | W79: =1-SUM(U79:V79) -> 0 | X79: 1 | Y79: 0 | Z79: =1-SUM(X79:Y79) -> 0 | AA79: 1 | AB79: 0 | AC79: =1-SUM(AA79:AB79) -> 0 | AD79: 1 | AE79: 0 | AF79: =1-SUM(AD79:AE79) -> 0 | AG79: 1 | AH79: 0 | AI79: =1-SUM(AG79:AH79) -> 0 | AJ79: 1 | AK79: 0 | AL79: =1-SUM(AJ79:AK79) -> 0 | AM79: 1 | AN79: 0 | AO79: =1-SUM(AM79:AN79) -> 0 | AP79: 0 | AQ79: 1 | AR79: =1-SUM(AP79:AQ79) -> 0 | AS79: 1 | AT79: 0 | AU79: =1-SUM(AS79:AT79) -> 0 | AV79: 1 | AW79: 0 | AX79: =1-SUM(AV79:AW79) -> 0 | AY79: 1 | AZ79: 0 | BA79: =1-SUM(AY79:AZ79) -> 0 | BB79: 0 | BC79: 1 | BD79: =1-SUM(BB79:BC79) -> 0 | BE79: 1 | BF79: 0 | BG79: =1-SUM(BE79:BF79) -> 0 | BH79: 0 | BI79: 1 | BJ79: =1-SUM(BH79:BI79) -> 0 | BK79: 0 | BL79: 1 | BM79: =1-SUM(BK79:BL79) -> 0 | BN79: 0 | BO79: =1-BN79 -> 1
O80: 1 | P80: 0 | Q80: =1-SUM(O80:P80) -> 0 | R80: 1 | S80: 0 | T80: =1-SUM(R80:S80) -> 0 | U80: 1 | V80: 0 | W80: =1-SUM(U80:V80) -> 0 | X80: 1 | Y80: 0 | Z80: =1-SUM(X80:Y80) -> 0 | AA80: 1 | AB80: 0 | AC80: =1-SUM(AA80:AB80) -> 0 | AD80: 0 | AE80: 1 | AF80: =1-SUM(AD80:AE80) -> 0 | AG80: 0 | AH80: 1 | AI80: =1-SUM(AG80:AH80) -> 0 | AJ80: 1 | AK80: 0 | AL80: =1-SUM(AJ80:AK80) -> 0 | AM80: 1 | AN80: 0 | AO80: =1-SUM(AM80:AN80) -> 0 | AP80: 0 | AQ80: 1 | AR80: =1-SUM(AP80:AQ80) -> 0 | AS80: 1 | AT80: 0 | AU80: =1-SUM(AS80:AT80) -> 0 | AV80: 1 | AW80: 0 | AX80: =1-SUM(AV80:AW80) -> 0 | AY80: 0 | AZ80: 1 | BA80: =1-SUM(AY80:AZ80) -> 0 | BB80: 0 | BC80: 1 | BD80: =1-SUM(BB80:BC80) -> 0 | BE80: 0 | BF80: 1 | BG80: =1-SUM(BE80:BF80) -> 0 | BH80: 0 | BI80: 1 | BJ80: =1-SUM(BH80:BI80) -> 0 | BK80: 0 | BL80: 1 | BM80: =1-SUM(BK80:BL80) -> 0 | BN80: 0 | BO80: =1-BN80 -> 1
O81: 1 | P81: 0 | Q81: =1-SUM(O81:P81) -> 0 | R81: 1 | S81: 0 | T81: =1-SUM(R81:S81) -> 0 | U81: 1 | V81: 0 | W81: =1-SUM(U81:V81) -> 0 | X81: 1 | Y81: 0 | Z81: =1-SUM(X81:Y81) -> 0 | AA81: 1 | AB81: 0 | AC81: =1-SUM(AA81:AB81) -> 0 | AD81: 0 | AE81: 1 | AF81: =1-SUM(AD81:AE81) -> 0 | AG81: 0 | AH81: 1 | AI81: =1-SUM(AG81:AH81) -> 0 | AJ81: 1 | AK81: 0 | AL81: =1-SUM(AJ81:AK81) -> 0 | AM81: 1 | AN81: 0 | AO81: =1-SUM(AM81:AN81) -> 0 | AP81: 0 | AQ81: 1 | AR81: =1-SUM(AP81:AQ81) -> 0 | AS81: 1 | AT81: 0 | AU81: =1-SUM(AS81:AT81) -> 0 | AV81: 1 | AW81: 0 | AX81: =1-SUM(AV81:AW81) -> 0 | AY81: 0 | AZ81: 1 | BA81: =1-SUM(AY81:AZ81) -> 0 | BB81: 0 | BC81: 1 | BD81: =1-SUM(BB81:BC81) -> 0 | BE81: 0 | BF81: 1 | BG81: =1-SUM(BE81:BF81) -> 0 | BH81: 0 | BI81: 1 | BJ81: =1-SUM(BH81:BI81) -> 0 | BK81: 0 | BL81: 1 | BM81: =1-SUM(BK81:BL81) -> 0 | BN81: 1 | BO81: =1-BN81 -> 0
O82: 1 | P82: 0 | Q82: =1-SUM(O82:P82) -> 0 | R82: 1 | S82: 0 | T82: =1-SUM(R82:S82) -> 0 | U82: 1 | V82: 0 | W82: =1-SUM(U82:V82) -> 0 | X82: 1 | Y82: 0 | Z82: =1-SUM(X82:Y82) -> 0 | AA82: 1 | AB82: 0 | AC82: =1-SUM(AA82:AB82) -> 0 | AD82: 0 | AE82: 1 | AF82: =1-SUM(AD82:AE82) -> 0 | AG82: 0 | AH82: 1 | AI82: =1-SUM(AG82:AH82) -> 0 | AJ82: 1 | AK82: 0 | AL82: =1-SUM(AJ82:AK82) -> 0 | AM82: 1 | AN82: 0 | AO82: =1-SUM(AM82:AN82) -> 0 | AP82: 0 | AQ82: 1 | AR82: =1-SUM(AP82:AQ82) -> 0 | AS82: 1 | AT82: 0 | AU82: =1-SUM(AS82:AT82) -> 0 | AV82: 1 | AW82: 0 | AX82: =1-SUM(AV82:AW82) -> 0 | AY82: 0 | AZ82: 1 | BA82: =1-SUM(AY82:AZ82) -> 0 | BB82: 1 | BC82: 0 | BD82: =1-SUM(BB82:BC82) -> 0 | BE82: 0 | BF82: 1 | BG82: =1-SUM(BE82:BF82) -> 0 | BH82: 0 | BI82: 1 | BJ82: =1-SUM(BH82:BI82) -> 0 | BK82: 0 | BL82: 1 | BM82: =1-SUM(BK82:BL82) -> 0 | BN82: 1 | BO82: =1-BN82 -> 0
O83: 1 | P83: 0 | Q83: =1-SUM(O83:P83) -> 0 | R83: 1 | S83: 0 | T83: =1-SUM(R83:S83) -> 0 | U83: 1 | V83: 0 | W83: =1-SUM(U83:V83) -> 0 | X83: 1 | Y83: 0 | Z83: =1-SUM(X83:Y83) -> 0 | AA83: 1 | AB83: 0 | AC83: =1-SUM(AA83:AB83) -> 0 | AD83: 0 | AE83: 1 | AF83: =1-SUM(AD83:AE83) -> 0 | AG83: 0 | AH83: 1 | AI83: =1-SUM(AG83:AH83) -> 0 | AJ83: 1 | AK83: 0 | AL83: =1-SUM(AJ83:AK83) -> 0 | AM83: 1 | AN83: 0 | AO83: =1-SUM(AM83:AN83) -> 0 | AP83: 0 | AQ83: 1 | AR83: =1-SUM(AP83:AQ83) -> 0 | AS83: 1 | AT83: 0 | AU83: =1-SUM(AS83:AT83) -> 0 | AV83: 1 | AW83: 0 | AX83: =1-SUM(AV83:AW83) -> 0 | AY83: 0 | AZ83: 1 | BA83: =1-SUM(AY83:AZ83) -> 0 | BB83: 1 | BC83: 0 | BD83: =1-SUM(BB83:BC83) -> 0 | BE83: 0 | BF83: 1 | BG83: =1-SUM(BE83:BF83) -> 0 | BH83: 0 | BI83: 1 | BJ83: =1-SUM(BH83:BI83) -> 0 | BK83: 0 | BL83: 1 | BM83: =1-SUM(BK83:BL83) -> 0 | BN83: 1 | BO83: =1-BN83 -> 0
O84: 1 | P84: 0 | Q84: =1-SUM(O84:P84) -> 0 | R84: 1 | S84: 0 | T84: =1-SUM(R84:S84) -> 0 | U84: 1 | V84: 0 | W84: =1-SUM(U84:V84) -> 0 | X84: 1 | Y84: 0 | Z84: =1-SUM(X84:Y84) -> 0 | AA84: 1 | AB84: 0 | AC84: =1-SUM(AA84:AB84) -> 0 | AD84: 0 | AE84: 1 | AF84: =1-SUM(AD84:AE84) -> 0 | AG84: 0 | AH84: 1 | AI84: =1-SUM(AG84:AH84) -> 0 | AJ84: 1 | AK84: 0 | AL84: =1-SUM(AJ84:AK84) -> 0 | AM84: 1 | AN84: 0 | AO84: =1-SUM(AM84:AN84) -> 0 | AP84: 0 | AQ84: 1 | AR84: =1-SUM(AP84:AQ84) -> 0 | AS84: 1 | AT84: 0 | AU84: =1-SUM(AS84:AT84) -> 0 | AV84: 1 | AW84: 0 | AX84: =1-SUM(AV84:AW84) -> 0 | AY84: 0 | AZ84: 1 | BA84: =1-SUM(AY84:AZ84) -> 0 | BB84: 1 | BC84: 0 | BD84: =1-SUM(BB84:BC84) -> 0 | BE84: 0 | BF84: 1 | BG84: =1-SUM(BE84:BF84) -> 0 | BH84: 0 | BI84: 1 | BJ84: =1-SUM(BH84:BI84) -> 0 | BK84: 0 | BL84: 1 | BM84: =1-SUM(BK84:BL84) -> 0 | BN84: 1 | BO84: =1-BN84 -> 0
O85: 1 | P85: 0 | Q85: =1-SUM(O85:P85) -> 0 | R85: 1 | S85: 0 | T85: =1-SUM(R85:S85) -> 0 | U85: 1 | V85: 0 | W85: =1-SUM(U85:V85) -> 0 | X85: 1 | Y85: 0 | Z85: =1-SUM(X85:Y85) -> 0 | AA85: 1 | AB85: 0 | AC85: =1-SUM(AA85:AB85) -> 0 | AD85: 0 | AE85: 1 | AF85: =1-SUM(AD85:AE85) -> 0 | AG85: 0 | AH85: 1 | AI85: =1-SUM(AG85:AH85) -> 0 | AJ85: 1 | AK85: 0 | AL85: =1-SUM(AJ85:AK85) -> 0 | AM85: 1 | AN85: 0 | AO85: =1-SUM(AM85:AN85) -> 0 | AP85: 0 | AQ85: 1 | AR85: =1-SUM(AP85:AQ85) -> 0 | AS85: 1 | AT85: 0 | AU85: =1-SUM(AS85:AT85) -> 0 | AV85: 1 | AW85: 0 | AX85: =1-SUM(AV85:AW85) -> 0 | AY85: 0 | AZ85: 1 | BA85: =1-SUM(AY85:AZ85) -> 0 | BB85: 1 | BC85: 0 | BD85: =1-SUM(BB85:BC85) -> 0 | BE85: 0 | BF85: 1 | BG85: =1-SUM(BE85:BF85) -> 0 | BH85: 0 | BI85: 1 | BJ85: =1-SUM(BH85:BI85) -> 0 | BK85: 0 | BL85: 1 | BM85: =1-SUM(BK85:BL85) -> 0 | BN85: 1 | BO85: =1-BN85 -> 0
O86: 1 | P86: 0 | Q86: =1-SUM(O86:P86) -> 0 | R86: 1 | S86: 0 | T86: =1-SUM(R86:S86) -> 0 | U86: 1 | V86: 0 | W86: =1-SUM(U86:V86) -> 0 | X86: 1 | Y86: 0 | Z86: =1-SUM(X86:Y86) -> 0 | AA86: 1 | AB86: 0 | AC86: =1-SUM(AA86:AB86) -> 0 | AD86: 1 | AE86: 0 | AF86: =1-SUM(AD86:AE86) -> 0 | AG86: 0 | AH86: 1 | AI86: =1-SUM(AG86:AH86) -> 0 | AJ86: 1 | AK86: 0 | AL86: =1-SUM(AJ86:AK86) -> 0 | AM86: 1 | AN86: 0 | AO86: =1-SUM(AM86:AN86) -> 0 | AP86: 0 | AQ86: 1 | AR86: =1-SUM(AP86:AQ86) -> 0 | AS86: 1 | AT86: 0 | AU86: =1-SUM(AS86:AT86) -> 0 | AV86: 1 | AW86: 0 | AX86: =1-SUM(AV86:AW86) -> 0 | AY86: 1 | AZ86: 0 | BA86: =1-SUM(AY86:AZ86) -> 0 | BB86: 0 | BC86: 1 | BD86: =1-SUM(BB86:BC86) -> 0 | BE86: 0 | BF86: 1 | BG86: =1-SUM(BE86:BF86) -> 0 | BH86: 0 | BI86: 1 | BJ86: =1-SUM(BH86:BI86) -> 0 | BK86: 0 | BL86: 1 | BM86: =1-SUM(BK86:BL86) -> 0 | BN86: 1 | BO86: =1-BN86 -> 0
O87: 1 | P87: 0 | Q87: =1-SUM(O87:P87) -> 0 | R87: 1 | S87: 0 | T87: =1-SUM(R87:S87) -> 0 | U87: 1 | V87: 0 | W87: =1-SUM(U87:V87) -> 0 | X87: 1 | Y87: 0 | Z87: =1-SUM(X87:Y87) -> 0 | AA87: 1 | AB87: 0 | AC87: =1-SUM(AA87:AB87) -> 0 | AD87: 0 | AE87: 1 | AF87: =1-SUM(AD87:AE87) -> 0 | AG87: 0 | AH87: 1 | AI87: =1-SUM(AG87:AH87) -> 0 | AJ87: 1 | AK87: 0 | AL87: =1-SUM(AJ87:AK87) -> 0 | AM87: 1 | AN87: 0 | AO87: =1-SUM(AM87:AN87) -> 0 | AP87: 0 | AQ87: 1 | AR87: =1-SUM(AP87:AQ87) -> 0 | AS87: 1 | AT87: 0 | AU87: =1-SUM(AS87:AT87) -> 0 | AV87: 1 | AW87: 0 | AX87: =1-SUM(AV87:AW87) -> 0 | AY87: 0 | AZ87: 1 | BA87: =1-SUM(AY87:AZ87) -> 0 | BB87: 1 | BC87: 0 | BD87: =1-SUM(BB87:BC87) -> 0 | BE87: 0 | BF87: 1 | BG87: =1-SUM(BE87:BF87) -> 0 | BH87: 0 | BI87: 1 | BJ87: =1-SUM(BH87:BI87) -> 0 | BK87: 0 | BL87: 1 | BM87: =1-SUM(BK87:BL87) -> 0 | BN87: 1 | BO87: =1-BN87 -> 0
O88: 1 | P88: 0 | Q88: =1-SUM(O88:P88) -> 0 | R88: 1 | S88: 0 | T88: =1-SUM(R88:S88) -> 0 | U88: 1 | V88: 0 | W88: =1-SUM(U88:V88) -> 0 | X88: 1 | Y88: 0 | Z88: =1-SUM(X88:Y88) -> 0 | AA88: 1 | AB88: 0 | AC88: =1-SUM(AA88:AB88) -> 0 | AD88: 0 | AE88: 1 | AF88: =1-SUM(AD88:AE88) -> 0 | AG88: 0 | AH88: 1 | AI88: =1-SUM(AG88:AH88) -> 0 | AJ88: 1 | AK88: 0 | AL88: =1-SUM(AJ88:AK88) -> 0 | AM88: 1 | AN88: 0 | AO88: =1-SUM(AM88:AN88) -> 0 | AP88: 0 | AQ88: 1 | AR88: =1-SUM(AP88:AQ88) -> 0 | AS88: 1 | AT88: 0 | AU88: =1-SUM(AS88:AT88) -> 0 | AV88: 1 | AW88: 0 | AX88: =1-SUM(AV88:AW88) -> 0 | AY88: 0 | AZ88: 1 | BA88: =1-SUM(AY88:AZ88) -> 0 | BB88: 1 | BC88: 0 | BD88: =1-SUM(BB88:BC88) -> 0 | BE88: 0 | BF88: 1 | BG88: =1-SUM(BE88:BF88) -> 0 | BH88: 0 | BI88: 1 | BJ88: =1-SUM(BH88:BI88) -> 0 | BK88: 0 | BL88: 1 | BM88: =1-SUM(BK88:BL88) -> 0 | BN88: 0 | BO88: =1-BN88 -> 1
O89: 0 | P89: 1 | Q89: =1-SUM(O89:P89) -> 0 | R89: 0 | S89: 1 | T89: =1-SUM(R89:S89) -> 0 | U89: 0 | V89: 1 | W89: =1-SUM(U89:V89) -> 0 | X89: 0 | Y89: 1 | Z89: =1-SUM(X89:Y89) -> 0 | AA89: 0 | AB89: 1 | AC89: =1-SUM(AA89:AB89) -> 0 | AD89: 1 | AE89: 0 | AF89: =1-SUM(AD89:AE89) -> 0 | AG89: 1 | AH89: 0 | AI89: =1-SUM(AG89:AH89) -> 0 | AJ89: 0 | AK89: 1 | AL89: =1-SUM(AJ89:AK89) -> 0 | AM89: 0 | AN89: 1 | AO89: =1-SUM(AM89:AN89) -> 0 | AP89: 0 | AQ89: 1 | AR89: =1-SUM(AP89:AQ89) -> 0 | AS89: 0 | AT89: 1 | AU89: =1-SUM(AS89:AT89) -> 0 | AV89: 0 | AW89: 1 | AX89: =1-SUM(AV89:AW89) -> 0 | AY89: 1 | AZ89: 0 | BA89: =1-SUM(AY89:AZ89) -> 0 | BB89: 0 | BC89: 1 | BD89: =1-SUM(BB89:BC89) -> 0 | BE89: 0 | BF89: 1 | BG89: =1-SUM(BE89:BF89) -> 0 | BH89: 0 | BI89: 1 | BJ89: =1-SUM(BH89:BI89) -> 0 | BK89: 1 | BL89: 0 | BM89: =1-SUM(BK89:BL89) -> 0 | BN89: 0 | BO89: =1-BN89 -> 1
O90: 1 | P90: 0 | Q90: =1-SUM(O90:P90) -> 0 | R90: 0 | S90: 1 | T90: =1-SUM(R90:S90) -> 0 | U90: 0 | V90: 1 | W90: =1-SUM(U90:V90) -> 0 | X90: 0 | Y90: 1 | Z90: =1-SUM(X90:Y90) -> 0 | AA90: 0 | AB90: 1 | AC90: =1-SUM(AA90:AB90) -> 0 | AD90: 0 | AE90: 1 | AF90: =1-SUM(AD90:AE90) -> 0 | AG90: 0 | AH90: 1 | AI90: =1-SUM(AG90:AH90) -> 0 | AJ90: 0 | AK90: 1 | AL90: =1-SUM(AJ90:AK90) -> 0 | AM90: 0 | AN90: 1 | AO90: =1-SUM(AM90:AN90) -> 0 | AP90: 0 | AQ90: 1 | AR90: =1-SUM(AP90:AQ90) -> 0 | AS90: 0 | AT90: 1 | AU90: =1-SUM(AS90:AT90) -> 0 | AV90: 0 | AW90: 1 | AX90: =1-SUM(AV90:AW90) -> 0 | AY90: 0 | AZ90: 1 | BA90: =1-SUM(AY90:AZ90) -> 0 | BB90: 0 | BC90: 1 | BD90: =1-SUM(BB90:BC90) -> 0 | BE90: 0 | BF90: 1 | BG90: =1-SUM(BE90:BF90) -> 0 | BH90: 0 | BI90: 1 | BJ90: =1-SUM(BH90:BI90) -> 0 | BK90: 1 | BL90: 0 | BM90: =1-SUM(BK90:BL90) -> 0 | BN90: 0 | BO90: =1-BN90 -> 1
O91: 1 | P91: 0 | Q91: =1-SUM(O91:P91) -> 0 | R91: 0 | S91: 1 | T91: =1-SUM(R91:S91) -> 0 | U91: 0 | V91: 1 | W91: =1-SUM(U91:V91) -> 0 | X91: 0 | Y91: 1 | Z91: =1-SUM(X91:Y91) -> 0 | AA91: 0 | AB91: 1 | AC91: =1-SUM(AA91:AB91) -> 0 | AD91: 0 | AE91: 1 | AF91: =1-SUM(AD91:AE91) -> 0 | AG91: 0 | AH91: 1 | AI91: =1-SUM(AG91:AH91) -> 0 | AJ91: 0 | AK91: 1 | AL91: =1-SUM(AJ91:AK91) -> 0 | AM91: 0 | AN91: 1 | AO91: =1-SUM(AM91:AN91) -> 0 | AP91: 0 | AQ91: 1 | AR91: =1-SUM(AP91:AQ91) -> 0 | AS91: 0 | AT91: 1 | AU91: =1-SUM(AS91:AT91) -> 0 | AV91: 0 | AW91: 1 | AX91: =1-SUM(AV91:AW91) -> 0 | AY91: 0 | AZ91: 1 | BA91: =1-SUM(AY91:AZ91) -> 0 | BB91: 0 | BC91: 1 | BD91: =1-SUM(BB91:BC91) -> 0 | BE91: 0 | BF91: 1 | BG91: =1-SUM(BE91:BF91) -> 0 | BH91: 0 | BI91: 1 | BJ91: =1-SUM(BH91:BI91) -> 0 | BK91: 1 | BL91: 0 | BM91: =1-SUM(BK91:BL91) -> 0 | BN91: 0 | BO91: =1-BN91 -> 1
O92: 1 | P92: 0 | Q92: =1-SUM(O92:P92) -> 0 | R92: 1 | S92: 0 | T92: =1-SUM(R92:S92) -> 0 | U92: 0 | V92: 1 | W92: =1-SUM(U92:V92) -> 0 | X92: 0 | Y92: 1 | Z92: =1-SUM(X92:Y92) -> 0 | AA92: 1 | AB92: 0 | AC92: =1-SUM(AA92:AB92) -> 0 | AD92: 0 | AE92: 1 | AF92: =1-SUM(AD92:AE92) -> 0 | AG92: 0 | AH92: 1 | AI92: =1-SUM(AG92:AH92) -> 0 | AJ92: 0 | AK92: 1 | AL92: =1-SUM(AJ92:AK92) -> 0 | AM92: 0 | AN92: 1 | AO92: =1-SUM(AM92:AN92) -> 0 | AP92: 0 | AQ92: 1 | AR92: =1-SUM(AP92:AQ92) -> 0 | AS92: 0 | AT92: 1 | AU92: =1-SUM(AS92:AT92) -> 0 | AV92: 0 | AW92: 1 | AX92: =1-SUM(AV92:AW92) -> 0 | AY92: 0 | AZ92: 1 | BA92: =1-SUM(AY92:AZ92) -> 0 | BB92: 0 | BC92: 1 | BD92: =1-SUM(BB92:BC92) -> 0 | BE92: 1 | BF92: 0 | BG92: =1-SUM(BE92:BF92) -> 0 | BH92: 0 | BI92: 1 | BJ92: =1-SUM(BH92:BI92) -> 0 | BK92: 0 | BL92: 1 | BM92: =1-SUM(BK92:BL92) -> 0 | BN92: 1 | BO92: =1-BN92 -> 0
O93: 1 | P93: 0 | Q93: =1-SUM(O93:P93) -> 0 | R93: 0 | S93: 1 | T93: =1-SUM(R93:S93) -> 0 | U93: 0 | V93: 1 | W93: =1-SUM(U93:V93) -> 0 | X93: 0 | Y93: 1 | Z93: =1-SUM(X93:Y93) -> 0 | AA93: 0 | AB93: 1 | AC93: =1-SUM(AA93:AB93) -> 0 | AD93: 1 | AE93: 0 | AF93: =1-SUM(AD93:AE93) -> 0 | AG93: 1 | AH93: 0 | AI93: =1-SUM(AG93:AH93) -> 0 | AJ93: 0 | AK93: 1 | AL93: =1-SUM(AJ93:AK93) -> 0 | AM93: 0 | AN93: 1 | AO93: =1-SUM(AM93:AN93) -> 0 | AP93: 0 | AQ93: 1 | AR93: =1-SUM(AP93:AQ93) -> 0 | AS93: 0 | AT93: 1 | AU93: =1-SUM(AS93:AT93) -> 0 | AV93: 0 | AW93: 1 | AX93: =1-SUM(AV93:AW93) -> 0 | AY93: 0 | AZ93: 1 | BA93: =1-SUM(AY93:AZ93) -> 0 | BB93: 0 | BC93: 1 | BD93: =1-SUM(BB93:BC93) -> 0 | BE93: 0 | BF93: 1 | BG93: =1-SUM(BE93:BF93) -> 0 | BH93: 0 | BI93: 1 | BJ93: =1-SUM(BH93:BI93) -> 0 | BK93: 1 | BL93: 0 | BM93: =1-SUM(BK93:BL93) -> 0 | BN93: 0 | BO93: =1-BN93 -> 1
O94: 0 | P94: 1 | Q94: =1-SUM(O94:P94) -> 0 | R94: 0 | S94: 1 | T94: =1-SUM(R94:S94) -> 0 | U94: 0 | V94: 1 | W94: =1-SUM(U94:V94) -> 0 | X94: 0 | Y94: 1 | Z94: =1-SUM(X94:Y94) -> 0 | AA94: 0 | AB94: 1 | AC94: =1-SUM(AA94:AB94) -> 0 | AD94: 0 | AE94: 1 | AF94: =1-SUM(AD94:AE94) -> 0 | AG94: 0 | AH94: 1 | AI94: =1-SUM(AG94:AH94) -> 0 | AJ94: 0 | AK94: 1 | AL94: =1-SUM(AJ94:AK94) -> 0 | AM94: 0 | AN94: 1 | AO94: =1-SUM(AM94:AN94) -> 0 | AP94: 0 | AQ94: 1 | AR94: =1-SUM(AP94:AQ94) -> 0 | AS94: 0 | AT94: 1 | AU94: =1-SUM(AS94:AT94) -> 0 | AV94: 0 | AW94: 1 | AX94: =1-SUM(AV94:AW94) -> 0 | AY94: 1 | AZ94: 0 | BA94: =1-SUM(AY94:AZ94) -> 0 | BB94: 0 | BC94: 1 | BD94: =1-SUM(BB94:BC94) -> 0 | BE94: 0 | BF94: 1 | BG94: =1-SUM(BE94:BF94) -> 0 | BH94: 0 | BI94: 1 | BJ94: =1-SUM(BH94:BI94) -> 0 | BK94: 1 | BL94: 0 | BM94: =1-SUM(BK94:BL94) -> 0 | BN94: 1 | BO94: =1-BN94 -> 0
O95: 1 | P95: 0 | Q95: =1-SUM(O95:P95) -> 0 | R95: 1 | S95: 0 | T95: =1-SUM(R95:S95) -> 0 | U95: 1 | V95: 0 | W95: =1-SUM(U95:V95) -> 0 | X95: 1 | Y95: 0 | Z95: =1-SUM(X95:Y95) -> 0 | AA95: 1 | AB95: 0 | AC95: =1-SUM(AA95:AB95) -> 0 | AD95: 1 | AE95: 0 | AF95: =1-SUM(AD95:AE95) -> 0 | AG95: 1 | AH95: 0 | AI95: =1-SUM(AG95:AH95) -> 0 | AJ95: 1 | AK95: 0 | AL95: =1-SUM(AJ95:AK95) -> 0 | AM95: 1 | AN95: 0 | AO95: =1-SUM(AM95:AN95) -> 0 | AP95: 0 | AQ95: 1 | AR95: =1-SUM(AP95:AQ95) -> 0 | AS95: 1 | AT95: 0 | AU95: =1-SUM(AS95:AT95) -> 0 | AV95: 1 | AW95: 0 | AX95: =1-SUM(AV95:AW95) -> 0 | AY95: 1 | AZ95: 0 | BA95: =1-SUM(AY95:AZ95) -> 0 | BB95: 0 | BC95: 1 | BD95: =1-SUM(BB95:BC95) -> 0 | BE95: 1 | BF95: 0 | BG95: =1-SUM(BE95:BF95) -> 0 | BH95: 0 | BI95: 1 | BJ95: =1-SUM(BH95:BI95) -> 0 | BK95: 1 | BL95: 0 | BM95: =1-SUM(BK95:BL95) -> 0 | BN95: 1 | BO95: =1-BN95 -> 0
O96: 1 | P96: 0 | Q96: =1-SUM(O96:P96) -> 0 | R96: 1 | S96: 0 | T96: =1-SUM(R96:S96) -> 0 | U96: 1 | V96: 0 | W96: =1-SUM(U96:V96) -> 0 | X96: 1 | Y96: 0 | Z96: =1-SUM(X96:Y96) -> 0 | AA96: 1 | AB96: 0 | AC96: =1-SUM(AA96:AB96) -> 0 | AD96: 0 | AE96: 1 | AF96: =1-SUM(AD96:AE96) -> 0 | AG96: 0 | AH96: 1 | AI96: =1-SUM(AG96:AH96) -> 0 | AJ96: 1 | AK96: 0 | AL96: =1-SUM(AJ96:AK96) -> 0 | AM96: 1 | AN96: 0 | AO96: =1-SUM(AM96:AN96) -> 0 | AP96: 0 | AQ96: 1 | AR96: =1-SUM(AP96:AQ96) -> 0 | AS96: 0 | AT96: 1 | AU96: =1-SUM(AS96:AT96) -> 0 | AV96: 1 | AW96: 0 | AX96: =1-SUM(AV96:AW96) -> 0 | AY96: 0 | AZ96: 1 | BA96: =1-SUM(AY96:AZ96) -> 0 | BB96: 0 | BC96: 1 | BD96: =1-SUM(BB96:BC96) -> 0 | BE96: 0 | BF96: 1 | BG96: =1-SUM(BE96:BF96) -> 0 | BH96: 0 | BI96: 1 | BJ96: =1-SUM(BH96:BI96) -> 0 | BK96: 0 | BL96: 1 | BM96: =1-SUM(BK96:BL96) -> 0 | BN96: 1 | BO96: =1-BN96 -> 0
O97: 1 | P97: 0 | Q97: =1-SUM(O97:P97) -> 0 | R97: 1 | S97: 0 | T97: =1-SUM(R97:S97) -> 0 | U97: 1 | V97: 0 | W97: =1-SUM(U97:V97) -> 0 | X97: 1 | Y97: 0 | Z97: =1-SUM(X97:Y97) -> 0 | AA97: 1 | AB97: 0 | AC97: =1-SUM(AA97:AB97) -> 0 | AD97: 0 | AE97: 1 | AF97: =1-SUM(AD97:AE97) -> 0 | AG97: 0 | AH97: 1 | AI97: =1-SUM(AG97:AH97) -> 0 | AJ97: 1 | AK97: 0 | AL97: =1-SUM(AJ97:AK97) -> 0 | AM97: 1 | AN97: 0 | AO97: =1-SUM(AM97:AN97) -> 0 | AP97: 0 | AQ97: 1 | AR97: =1-SUM(AP97:AQ97) -> 0 | AS97: 0 | AT97: 1 | AU97: =1-SUM(AS97:AT97) -> 0 | AV97: 1 | AW97: 0 | AX97: =1-SUM(AV97:AW97) -> 0 | AY97: 0 | AZ97: 1 | BA97: =1-SUM(AY97:AZ97) -> 0 | BB97: 1 | BC97: 0 | BD97: =1-SUM(BB97:BC97) -> 0 | BE97: 0 | BF97: 1 | BG97: =1-SUM(BE97:BF97) -> 0 | BH97: 0 | BI97: 1 | BJ97: =1-SUM(BH97:BI97) -> 0 | BK97: 0 | BL97: 1 | BM97: =1-SUM(BK97:BL97) -> 0 | BN97: 0 | BO97: =1-BN97 -> 1
O98: 1 | P98: 0 | Q98: =1-SUM(O98:P98) -> 0 | R98: 1 | S98: 0 | T98: =1-SUM(R98:S98) -> 0 | U98: 0 | V98: 1 | W98: =1-SUM(U98:V98) -> 0 | X98: 0 | Y98: 1 | Z98: =1-SUM(X98:Y98) -> 0 | AA98: 0 | AB98: 1 | AC98: =1-SUM(AA98:AB98) -> 0 | AD98: 0 | AE98: 1 | AF98: =1-SUM(AD98:AE98) -> 0 | AG98: 0 | AH98: 1 | AI98: =1-SUM(AG98:AH98) -> 0 | AJ98: 0 | AK98: 1 | AL98: =1-SUM(AJ98:AK98) -> 0 | AM98: 0 | AN98: 1 | AO98: =1-SUM(AM98:AN98) -> 0 | AP98: 0 | AQ98: 1 | AR98: =1-SUM(AP98:AQ98) -> 0 | AS98: 0 | AT98: 1 | AU98: =1-SUM(AS98:AT98) -> 0 | AV98: 0 | AW98: 1 | AX98: =1-SUM(AV98:AW98) -> 0 | AY98: 0 | AZ98: 1 | BA98: =1-SUM(AY98:AZ98) -> 0 | BB98: 0 | BC98: 1 | BD98: =1-SUM(BB98:BC98) -> 0 | BE98: 0 | BF98: 1 | BG98: =1-SUM(BE98:BF98) -> 0 | BH98: 0 | BI98: 1 | BJ98: =1-SUM(BH98:BI98) -> 0 | BK98: 0 | BL98: 1 | BM98: =1-SUM(BK98:BL98) -> 0 | BN98: 0 | BO98: =1-BN98 -> 1
O99: 1 | P99: 0 | Q99: =1-SUM(O99:P99) -> 0 | R99: 1 | S99: 0 | T99: =1-SUM(R99:S99) -> 0 | U99: 0 | V99: 1 | W99: =1-SUM(U99:V99) -> 0 | X99: 0 | Y99: 1 | Z99: =1-SUM(X99:Y99) -> 0 | AA99: 0 | AB99: 1 | AC99: =1-SUM(AA99:AB99) -> 0 | AD99: 0 | AE99: 1 | AF99: =1-SUM(AD99:AE99) -> 0 | AG99: 0 | AH99: 1 | AI99: =1-SUM(AG99:AH99) -> 0 | AJ99: 0 | AK99: 1 | AL99: =1-SUM(AJ99:AK99) -> 0 | AM99: 0 | AN99: 1 | AO99: =1-SUM(AM99:AN99) -> 0 | AP99: 0 | AQ99: 1 | AR99: =1-SUM(AP99:AQ99) -> 0 | AS99: 0 | AT99: 1 | AU99: =1-SUM(AS99:AT99) -> 0 | AV99: 0 | AW99: 1 | AX99: =1-SUM(AV99:AW99) -> 0 | AY99: 0 | AZ99: 1 | BA99: =1-SUM(AY99:AZ99) -> 0 | BB99: 0 | BC99: 1 | BD99: =1-SUM(BB99:BC99) -> 0 | BE99: 0 | BF99: 1 | BG99: =1-SUM(BE99:BF99) -> 0 | BH99: 0 | BI99: 1 | BJ99: =1-SUM(BH99:BI99) -> 0 | BK99: 0 | BL99: 1 | BM99: =1-SUM(BK99:BL99) -> 0 | BN99: 0 | BO99: =1-BN99 -> 1
O100: 1 | P100: 0 | Q100: =1-SUM(O100:P100) -> 0 | R100: 1 | S100: 0 | T100: =1-SUM(R100:S100) -> 0 | U100: 0 | V100: 1 | W100: =1-SUM(U100:V100) -> 0 | X100: 0 | Y100: 1 | Z100: =1-SUM(X100:Y100) -> 0 | AA100: 0 | AB100: 1 | AC100: =1-SUM(AA100:AB100) -> 0 | AD100: 0 | AE100: 1 | AF100: =1-SUM(AD100:AE100) -> 0 | AG100: 0 | AH100: 1 | AI100: =1-SUM(AG100:AH100) -> 0 | AJ100: 0 | AK100: 1 | AL100: =1-SUM(AJ100:AK100) -> 0 | AM100: 0 | AN100: 1 | AO100: =1-SUM(AM100:AN100) -> 0 | AP100: 0 | AQ100: 1 | AR100: =1-SUM(AP100:AQ100) -> 0 | AS100: 0 | AT100: 1 | AU100: =1-SUM(AS100:AT100) -> 0 | AV100: 0 | AW100: 1 | AX100: =1-SUM(AV100:AW100) -> 0 | AY100: 0 | AZ100: 1 | BA100: =1-SUM(AY100:AZ100) -> 0 | BB100: 0 | BC100: 1 | BD100: =1-SUM(BB100:BC100) -> 0 | BE100: 0 | BF100: 1 | BG100: =1-SUM(BE100:BF100) -> 0 | BH100: 0 | BI100: 0 | BJ100: =1-SUM(BH100:BI100) -> 1 | BK100: 0 | BL100: 1 | BM100: =1-SUM(BK100:BL100) -> 0 | BN100: 1 | BO100: =1-BN100 -> 0
O101: 0 | P101: 1 | Q101: =1-SUM(O101:P101) -> 0 | R101: 1 | S101: 0 | T101: =1-SUM(R101:S101) -> 0 | U101: 0 | V101: 1 | W101: =1-SUM(U101:V101) -> 0 | X101: 1 | Y101: 0 | Z101: =1-SUM(X101:Y101) -> 0 | AA101: 0 | AB101: 1 | AC101: =1-SUM(AA101:AB101) -> 0 | AD101: 0 | AE101: 1 | AF101: =1-SUM(AD101:AE101) -> 0 | AG101: 0 | AH101: 1 | AI101: =1-SUM(AG101:AH101) -> 0 | AJ101: 0 | AK101: 1 | AL101: =1-SUM(AJ101:AK101) -> 0 | AM101: 0 | AN101: 1 | AO101: =1-SUM(AM101:AN101) -> 0 | AP101: 0 | AQ101: 1 | AR101: =1-SUM(AP101:AQ101) -> 0 | AS101: 0 | AT101: 1 | AU101: =1-SUM(AS101:AT101) -> 0 | AV101: 0 | AW101: 1 | AX101: =1-SUM(AV101:AW101) -> 0 | AY101: 1 | AZ101: 0 | BA101: =1-SUM(AY101:AZ101) -> 0 | BB101: 0 | BC101: 1 | BD101: =1-SUM(BB101:BC101) -> 0 | BE101: 0 | BF101: 1 | BG101: =1-SUM(BE101:BF101) -> 0 | BH101: 0 | BI101: 1 | BJ101: =1-SUM(BH101:BI101) -> 0 | BK101: 0 | BL101: 1 | BM101: =1-SUM(BK101:BL101) -> 0 | BN101: 1 | BO101: =1-BN101 -> 0
O102: 0 | P102: 1 | Q102: =1-SUM(O102:P102) -> 0 | R102: 0 | S102: 1 | T102: =1-SUM(R102:S102) -> 0 | U102: 0 | V102: 1 | W102: =1-SUM(U102:V102) -> 0 | X102: 0 | Y102: 1 | Z102: =1-SUM(X102:Y102) -> 0 | AA102: 0 | AB102: 1 | AC102: =1-SUM(AA102:AB102) -> 0 | AD102: 0 | AE102: 1 | AF102: =1-SUM(AD102:AE102) -> 0 | AG102: 0 | AH102: 1 | AI102: =1-SUM(AG102:AH102) -> 0 | AJ102: 1 | AK102: 0 | AL102: =1-SUM(AJ102:AK102) -> 0 | AM102: 1 | AN102: 0 | AO102: =1-SUM(AM102:AN102) -> 0 | AP102: 0 | AQ102: 1 | AR102: =1-SUM(AP102:AQ102) -> 0 | AS102: 1 | AT102: 0 | AU102: =1-SUM(AS102:AT102) -> 0 | AV102: 0 | AW102: 1 | AX102: =1-SUM(AV102:AW102) -> 0 | AY102: 1 | AZ102: 0 | BA102: =1-SUM(AY102:AZ102) -> 0 | BB102: 0 | BC102: 1 | BD102: =1-SUM(BB102:BC102) -> 0 | BE102: 1 | BF102: 0 | BG102: =1-SUM(BE102:BF102) -> 0 | BH102: 0 | BI102: 1 | BJ102: =1-SUM(BH102:BI102) -> 0 | BK102: 0 | BL102: 1 | BM102: =1-SUM(BK102:BL102) -> 0 | BN102: 1 | BO102: =1-BN102 -> 0
O103: 0 | P103: 1 | Q103: =1-SUM(O103:P103) -> 0 | R103: 0 | S103: 1 | T103: =1-SUM(R103:S103) -> 0 | U103: 0 | V103: 1 | W103: =1-SUM(U103:V103) -> 0 | X103: 0 | Y103: 1 | Z103: =1-SUM(X103:Y103) -> 0 | AA103: 0 | AB103: 1 | AC103: =1-SUM(AA103:AB103) -> 0 | AD103: 0 | AE103: 1 | AF103: =1-SUM(AD103:AE103) -> 0 | AG103: 0 | AH103: 1 | AI103: =1-SUM(AG103:AH103) -> 0 | AJ103: 1 | AK103: 0 | AL103: =1-SUM(AJ103:AK103) -> 0 | AM103: 1 | AN103: 0 | AO103: =1-SUM(AM103:AN103) -> 0 | AP103: 0 | AQ103: 1 | AR103: =1-SUM(AP103:AQ103) -> 0 | AS103: 1 | AT103: 0 | AU103: =1-SUM(AS103:AT103) -> 0 | AV103: 0 | AW103: 1 | AX103: =1-SUM(AV103:AW103) -> 0 | AY103: 1 | AZ103: 0 | BA103: =1-SUM(AY103:AZ103) -> 0 | BB103: 0 | BC103: 1 | BD103: =1-SUM(BB103:BC103) -> 0 | BE103: 1 | BF103: 0 | BG103: =1-SUM(BE103:BF103) -> 0 | BH103: 0 | BI103: 1 | BJ103: =1-SUM(BH103:BI103) -> 0 | BK103: 0 | BL103: 1 | BM103: =1-SUM(BK103:BL103) -> 0 | BN103: 1 | BO103: =1-BN103 -> 0
O104: 1 | P104: 0 | Q104: =1-SUM(O104:P104) -> 0 | R104: 1 | S104: 0 | T104: =1-SUM(R104:S104) -> 0 | U104: 0 | V104: 1 | W104: =1-SUM(U104:V104) -> 0 | X104: 1 | Y104: 0 | Z104: =1-SUM(X104:Y104) -> 0 | AA104: 1 | AB104: 0 | AC104: =1-SUM(AA104:AB104) -> 0 | AD104: 0 | AE104: 1 | AF104: =1-SUM(AD104:AE104) -> 0 | AG104: 0 | AH104: 1 | AI104: =1-SUM(AG104:AH104) -> 0 | AJ104: 1 | AK104: 0 | AL104: =1-SUM(AJ104:AK104) -> 0 | AM104: 0 | AN104: 1 | AO104: =1-SUM(AM104:AN104) -> 0 | AP104: 0 | AQ104: 1 | AR104: =1-SUM(AP104:AQ104) -> 0 | AS104: 0 | AT104: 1 | AU104: =1-SUM(AS104:AT104) -> 0 | AV104: 0 | AW104: 1 | AX104: =1-SUM(AV104:AW104) -> 0 | AY104: 0 | AZ104: 1 | BA104: =1-SUM(AY104:AZ104) -> 0 | BB104: 0 | BC104: 1 | BD104: =1-SUM(BB104:BC104) -> 0 | BE104: 0 | BF104: 1 | BG104: =1-SUM(BE104:BF104) -> 0 | BH104: 0 | BI104: 1 | BJ104: =1-SUM(BH104:BI104) -> 0 | BK104: 0 | BL104: 1 | BM104: =1-SUM(BK104:BL104) -> 0 | BN104: 0 | BO104: =1-BN104 -> 1
O105: 1 | P105: 0 | Q105: =1-SUM(O105:P105) -> 0 | R105: 1 | S105: 0 | T105: =1-SUM(R105:S105) -> 0 | U105: 1 | V105: 0 | W105: =1-SUM(U105:V105) -> 0 | X105: 1 | Y105: 0 | Z105: =1-SUM(X105:Y105) -> 0 | AA105: 1 | AB105: 0 | AC105: =1-SUM(AA105:AB105) -> 0 | AD105: 0 | AE105: 1 | AF105: =1-SUM(AD105:AE105) -> 0 | AG105: 0 | AH105: 1 | AI105: =1-SUM(AG105:AH105) -> 0 | AJ105: 0 | AK105: 1 | AL105: =1-SUM(AJ105:AK105) -> 0 | AM105: 1 | AN105: 0 | AO105: =1-SUM(AM105:AN105) -> 0 | AP105: 0 | AQ105: 1 | AR105: =1-SUM(AP105:AQ105) -> 0 | AS105: 0 | AT105: 1 | AU105: =1-SUM(AS105:AT105) -> 0 | AV105: 1 | AW105: 0 | AX105: =1-SUM(AV105:AW105) -> 0 | AY105: 1 | AZ105: 0 | BA105: =1-SUM(AY105:AZ105) -> 0 | BB105: 0 | BC105: 1 | BD105: =1-SUM(BB105:BC105) -> 0 | BE105: 0 | BF105: 1 | BG105: =1-SUM(BE105:BF105) -> 0 | BH105: 0 | BI105: 1 | BJ105: =1-SUM(BH105:BI105) -> 0 | BK105: 0 | BL105: 1 | BM105: =1-SUM(BK105:BL105) -> 0 | BN105: 0 | BO105: =1-BN105 -> 1
A106: Argomento | C106: SI | E106: NO | G106: Altro | O106: 1 | P106: 0 | Q106: =1-SUM(O106:P106) -> 0 | R106: 1 | S106: 0 | T106: =1-SUM(R106:S106) -> 0 | U106: 1 | V106: 0 | W106: =1-SUM(U106:V106) -> 0 | X106: 1 | Y106: 0 | Z106: =1-SUM(X106:Y106) -> 0 | AA106: 0 | AB106: 1 | AC106: =1-SUM(AA106:AB106) -> 0 | AD106: 0 | AE106: 1 | AF106: =1-SUM(AD106:AE106) -> 0 | AG106: 0 | AH106: 1 | AI106: =1-SUM(AG106:AH106) -> 0 | AJ106: 0 | AK106: 1 | AL106: =1-SUM(AJ106:AK106) -> 0 | AM106: 1 | AN106: 0 | AO106: =1-SUM(AM106:AN106) -> 0 | AP106: 0 | AQ106: 1 | AR106: =1-SUM(AP106:AQ106) -> 0 | AS106: 0 | AT106: 1 | AU106: =1-SUM(AS106:AT106) -> 0 | AV106: 0 | AW106: 1 | AX106: =1-SUM(AV106:AW106) -> 0 | AY106: 1 | AZ106: 0 | BA106: =1-SUM(AY106:AZ106) -> 0 | BB106: 0 | BC106: 1 | BD106: =1-SUM(BB106:BC106) -> 0 | BE106: 0 | BF106: 1 | BG106: =1-SUM(BE106:BF106) -> 0 | BH106: 0 | BI106: 1 | BJ106: =1-SUM(BH106:BI106) -> 0 | BK106: 0 | BL106: 1 | BM106: =1-SUM(BK106:BL106) -> 0 | BN106: 0 | BO106: =1-BN106 -> 1
B107: corsi | C107: perc. | D107: corsi | E107: perc. | F107: corsi | G107: perc. | O107: 1 | P107: 0 | Q107: =1-SUM(O107:P107) -> 0 | R107: 0 | S107: 1 | T107: =1-SUM(R107:S107) -> 0 | U107: 0 | V107: 1 | W107: =1-SUM(U107:V107) -> 0 | X107: 0 | Y107: 1 | Z107: =1-SUM(X107:Y107) -> 0 | AA107: 1 | AB107: 0 | AC107: =1-SUM(AA107:AB107) -> 0 | AD107: 0 | AE107: 1 | AF107: =1-SUM(AD107:AE107) -> 0 | AG107: 0 | AH107: 1 | AI107: =1-SUM(AG107:AH107) -> 0 | AJ107: 1 | AK107: 0 | AL107: =1-SUM(AJ107:AK107) -> 0 | AM107: 1 | AN107: 0 | AO107: =1-SUM(AM107:AN107) -> 0 | AP107: 0 | AQ107: 1 | AR107: =1-SUM(AP107:AQ107) -> 0 | AS107: 0 | AT107: 1 | AU107: =1-SUM(AS107:AT107) -> 0 | AV107: 1 | AW107: 0 | AX107: =1-SUM(AV107:AW107) -> 0 | AY107: 0 | AZ107: 1 | BA107: =1-SUM(AY107:AZ107) -> 0 | BB107: 0 | BC107: 1 | BD107: =1-SUM(BB107:BC107) -> 0 | BE107: 0 | BF107: 1 | BG107: =1-SUM(BE107:BF107) -> 0 | BH107: 0 | BI107: 1 | BJ107: =1-SUM(BH107:BI107) -> 0 | BK107: 0 | BL107: 1 | BM107: =1-SUM(BK107:BL107) -> 0 | BN107: 0 | BO107: =1-BN107 -> 1
A108: =A22 -> ALTRO (*) | B108: =B22 -> 182 | C108: =C22 -> 46.192893401015226 | D108: =D22 -> 212 | E108: =E22 -> 53.807106598984767 | F108: =F22 -> 0 | G108: =G22 -> 0 | O108: 1 | P108: 0 | Q108: =1-SUM(O108:P108) -> 0 | R108: 1 | S108: 0 | T108: =1-SUM(R108:S108) -> 0 | U108: 1 | V108: 0 | W108: =1-SUM(U108:V108) -> 0 | X108: 1 | Y108: 0 | Z108: =1-SUM(X108:Y108) -> 0 | AA108: 1 | AB108: 0 | AC108: =1-SUM(AA108:AB108) -> 0 | AD108: 0 | AE108: 1 | AF108: =1-SUM(AD108:AE108) -> 0 | AG108: 0 | AH108: 1 | AI108: =1-SUM(AG108:AH108) -> 0 | AJ108: 1 | AK108: 0 | AL108: =1-SUM(AJ108:AK108) -> 0 | AM108: 1 | AN108: 0 | AO108: =1-SUM(AM108:AN108) -> 0 | AP108: 0 | AQ108: 1 | AR108: =1-SUM(AP108:AQ108) -> 0 | AS108: 0 | AT108: 1 | AU108: =1-SUM(AS108:AT108) -> 0 | AV108: 0 | AW108: 1 | AX108: =1-SUM(AV108:AW108) -> 0 | AY108: 0 | AZ108: 1 | BA108: =1-SUM(AY108:AZ108) -> 0 | BB108: 0 | BC108: 1 | BD108: =1-SUM(BB108:BC108) -> 0 | BE108: 0 | BF108: 1 | BG108: =1-SUM(BE108:BF108) -> 0 | BH108: 0 | BI108: 1 | BJ108: =1-SUM(BH108:BI108) -> 0 | BK108: 0 | BL108: 1 | BM108: =1-SUM(BK108:BL108) -> 0 | BN108: 0 | BO108: =1-BN108 -> 1
A109: =A21 -> MCDA | B109: =B21 -> 41 | C109: =C21 -> 10.406091370558377 | D109: =D21 -> 339 | E109: =E21 -> 86.040609137055839 | F109: =F21 -> 14 | G109: =G21 -> 3.5532994923857872 | O109: 1 | P109: 0 | Q109: =1-SUM(O109:P109) -> 0 | R109: 1 | S109: 0 | T109: =1-SUM(R109:S109) -> 0 | U109: 1 | V109: 0 | W109: =1-SUM(U109:V109) -> 0 | X109: 1 | Y109: 0 | Z109: =1-SUM(X109:Y109) -> 0 | AA109: 1 | AB109: 0 | AC109: =1-SUM(AA109:AB109) -> 0 | AD109: 0 | AE109: 1 | AF109: =1-SUM(AD109:AE109) -> 0 | AG109: 0 | AH109: 1 | AI109: =1-SUM(AG109:AH109) -> 0 | AJ109: 0 | AK109: 1 | AL109: =1-SUM(AJ109:AK109) -> 0 | AM109: 1 | AN109: 0 | AO109: =1-SUM(AM109:AN109) -> 0 | AP109: 0 | AQ109: 1 | AR109: =1-SUM(AP109:AQ109) -> 0 | AS109: 0 | AT109: 1 | AU109: =1-SUM(AS109:AT109) -> 0 | AV109: 0 | AW109: 1 | AX109: =1-SUM(AV109:AW109) -> 0 | AY109: 0 | AZ109: 1 | BA109: =1-SUM(AY109:AZ109) -> 0 | BB109: 0 | BC109: 1 | BD109: =1-SUM(BB109:BC109) -> 0 | BE109: 0 | BF109: 1 | BG109: =1-SUM(BE109:BF109) -> 0 | BH109: 0 | BI109: 1 | BJ109: =1-SUM(BH109:BI109) -> 0 | BK109: 0 | BL109: 1 | BM109: =1-SUM(BK109:BL109) -> 0 | BN109: 0 | BO109: =1-BN109 -> 1
A110: =A20 -> SIMULAZIONE | B110: =B20 -> 60 | C110: =C20 -> 15.228426395939088 | D110: =D20 -> 317 | E110: =E20 -> 80.456852791878177 | F110: =F20 -> 17 | G110: =G20 -> 4.3147208121827409 | O110: 1 | P110: 0 | Q110: =1-SUM(O110:P110) -> 0 | R110: 1 | S110: 0 | T110: =1-SUM(R110:S110) -> 0 | U110: 1 | V110: 0 | W110: =1-SUM(U110:V110) -> 0 | X110: 1 | Y110: 0 | Z110: =1-SUM(X110:Y110) -> 0 | AA110: 1 | AB110: 0 | AC110: =1-SUM(AA110:AB110) -> 0 | AD110: 1 | AE110: 0 | AF110: =1-SUM(AD110:AE110) -> 0 | AG110: 1 | AH110: 0 | AI110: =1-SUM(AG110:AH110) -> 0 | AJ110: 1 | AK110: 0 | AL110: =1-SUM(AJ110:AK110) -> 0 | AM110: 0 | AN110: 1 | AO110: =1-SUM(AM110:AN110) -> 0 | AP110: 0 | AQ110: 1 | AR110: =1-SUM(AP110:AQ110) -> 0 | AS110: 0 | AT110: 1 | AU110: =1-SUM(AS110:AT110) -> 0 | AV110: 1 | AW110: 0 | AX110: =1-SUM(AV110:AW110) -> 0 | AY110: 0 | AZ110: 1 | BA110: =1-SUM(AY110:AZ110) -> 0 | BB110: 0 | BC110: 1 | BD110: =1-SUM(BB110:BC110) -> 0 | BE110: 0 | BF110: 1 | BG110: =1-SUM(BE110:BF110) -> 0 | BH110: 0 | BI110: 1 | BJ110: =1-SUM(BH110:BI110) -> 0 | BK110: 0 | BL110: 1 | BM110: =1-SUM(BK110:BL110) -> 0 | BN110: 0 | BO110: =1-BN110 -> 1
A111: =A19 -> METAEURISTICI | B111: =B19 -> 86 | C111: =C19 -> 21.82741116751269 | D111: =D19 -> 293 | E111: =E19 -> 74.365482233502533 | F111: =F19 -> 15 | G111: =G19 -> 3.8071065989847721 | O111: 1 | P111: 0 | Q111: =1-SUM(O111:P111) -> 0 | R111: 1 | S111: 0 | T111: =1-SUM(R111:S111) -> 0 | U111: 0 | V111: 1 | W111: =1-SUM(U111:V111) -> 0 | X111: 0 | Y111: 1 | Z111: =1-SUM(X111:Y111) -> 0 | AA111: 1 | AB111: 0 | AC111: =1-SUM(AA111:AB111) -> 0 | AD111: 0 | AE111: 1 | AF111: =1-SUM(AD111:AE111) -> 0 | AG111: 0 | AH111: 1 | AI111: =1-SUM(AG111:AH111) -> 0 | AJ111: 0 | AK111: 1 | AL111: =1-SUM(AJ111:AK111) -> 0 | AM111: 1 | AN111: 0 | AO111: =1-SUM(AM111:AN111) -> 0 | AP111: 0 | AQ111: 1 | AR111: =1-SUM(AP111:AQ111) -> 0 | AS111: 0 | AT111: 1 | AU111: =1-SUM(AS111:AT111) -> 0 | AV111: 0 | AW111: 1 | AX111: =1-SUM(AV111:AW111) -> 0 | AY111: 0 | AZ111: 1 | BA111: =1-SUM(AY111:AZ111) -> 0 | BB111: 0 | BC111: 1 | BD111: =1-SUM(BB111:BC111) -> 0 | BE111: 0 | BF111: 1 | BG111: =1-SUM(BE111:BF111) -> 0 | BH111: 0 | BI111: 1 | BJ111: =1-SUM(BH111:BI111) -> 0 | BK111: 0 | BL111: 1 | BM111: =1-SUM(BK111:BL111) -> 0 | BN111: 0 | BO111: =1-BN111 -> 1
A112: =A18 -> PROG. DINAMICA | B112: =B18 -> 73 | C112: =C18 -> 18.527918781725887 | D112: =D18 -> 307 | E112: =E18 -> 77.918781725888323 | F112: =F18 -> 14 | G112: =G18 -> 3.5532994923857872 | O112: 1 | P112: 0 | Q112: =1-SUM(O112:P112) -> 0 | R112: 1 | S112: 0 | T112: =1-SUM(R112:S112) -> 0 | U112: 0 | V112: 0 | W112: =1-SUM(U112:V112) -> 1 | X112: 1 | Y112: 0 | Z112: =1-SUM(X112:Y112) -> 0 | AA112: 1 | AB112: 0 | AC112: =1-SUM(AA112:AB112) -> 0 | AD112: 0 | AE112: 1 | AF112: =1-SUM(AD112:AE112) -> 0 | AG112: 0 | AH112: 0 | AI112: =1-SUM(AG112:AH112) -> 1 | AJ112: 1 | AK112: 0 | AL112: =1-SUM(AJ112:AK112) -> 0 | AM112: 0 | AN112: 1 | AO112: =1-SUM(AM112:AN112) -> 0 | AP112: 0 | AQ112: 1 | AR112: =1-SUM(AP112:AQ112) -> 0 | AS112: 0 | AT112: 1 | AU112: =1-SUM(AS112:AT112) -> 0 | AV112: 1 | AW112: 0 | AX112: =1-SUM(AV112:AW112) -> 0 | AY112: 0 | AZ112: 1 | BA112: =1-SUM(AY112:AZ112) -> 0 | BB112: 0 | BC112: 1 | BD112: =1-SUM(BB112:BC112) -> 0 | BE112: 0 | BF112: 1 | BG112: =1-SUM(BE112:BF112) -> 0 | BH112: 0 | BI112: 1 | BJ112: =1-SUM(BH112:BI112) -> 0 | BK112: 0 | BL112: 1 | BM112: =1-SUM(BK112:BL112) -> 0 | BN112: 0 | BO112: =1-BN112 -> 1
A113: =A17 -> RILASSAMENTI | B113: =B17 -> 121 | C113: =C17 -> 30.710659898477154 | D113: =D17 -> 259 | E113: =E17 -> 65.736040609137063 | F113: =F17 -> 14 | G113: =G17 -> 3.5532994923857872 | O113: 1 | P113: 0 | Q113: =1-SUM(O113:P113) -> 0 | R113: 0 | S113: 1 | T113: =1-SUM(R113:S113) -> 0 | U113: 0 | V113: 1 | W113: =1-SUM(U113:V113) -> 0 | X113: 0 | Y113: 1 | Z113: =1-SUM(X113:Y113) -> 0 | AA113: 0 | AB113: 1 | AC113: =1-SUM(AA113:AB113) -> 0 | AD113: 0 | AE113: 1 | AF113: =1-SUM(AD113:AE113) -> 0 | AG113: 0 | AH113: 1 | AI113: =1-SUM(AG113:AH113) -> 0 | AJ113: 0 | AK113: 1 | AL113: =1-SUM(AJ113:AK113) -> 0 | AM113: 0 | AN113: 1 | AO113: =1-SUM(AM113:AN113) -> 0 | AP113: 0 | AQ113: 1 | AR113: =1-SUM(AP113:AQ113) -> 0 | AS113: 0 | AT113: 1 | AU113: =1-SUM(AS113:AT113) -> 0 | AV113: 0 | AW113: 1 | AX113: =1-SUM(AV113:AW113) -> 0 | AY113: 1 | AZ113: 0 | BA113: =1-SUM(AY113:AZ113) -> 0 | BB113: 0 | BC113: 1 | BD113: =1-SUM(BB113:BC113) -> 0 | BE113: 1 | BF113: 0 | BG113: =1-SUM(BE113:BF113) -> 0 | BH113: 0 | BI113: 1 | BJ113: =1-SUM(BH113:BI113) -> 0 | BK113: 0 | BL113: 1 | BM113: =1-SUM(BK113:BL113) -> 0 | BN113: 0 | BO113: =1-BN113 -> 1
A114: =A16 -> BRANCH-AND-BOUND | B114: =B16 -> 168 | C114: =C16 -> 42.639593908629443 | D114: =D16 -> 211 | E114: =E16 -> 53.55329949238579 | F114: =F16 -> 15 | G114: =G16 -> 3.8071065989847721 | O114: 1 | P114: 0 | Q114: =1-SUM(O114:P114) -> 0 | R114: 1 | S114: 0 | T114: =1-SUM(R114:S114) -> 0 | U114: 1 | V114: 0 | W114: =1-SUM(U114:V114) -> 0 | X114: 1 | Y114: 0 | Z114: =1-SUM(X114:Y114) -> 0 | AA114: 1 | AB114: 0 | AC114: =1-SUM(AA114:AB114) -> 0 | AD114: 0 | AE114: 1 | AF114: =1-SUM(AD114:AE114) -> 0 | AG114: 0 | AH114: 1 | AI114: =1-SUM(AG114:AH114) -> 0 | AJ114: 1 | AK114: 0 | AL114: =1-SUM(AJ114:AK114) -> 0 | AM114: 1 | AN114: 0 | AO114: =1-SUM(AM114:AN114) -> 0 | AP114: 0 | AQ114: 1 | AR114: =1-SUM(AP114:AQ114) -> 0 | AS114: 1 | AT114: 0 | AU114: =1-SUM(AS114:AT114) -> 0 | AV114: 1 | AW114: 0 | AX114: =1-SUM(AV114:AW114) -> 0 | AY114: 1 | AZ114: 0 | BA114: =1-SUM(AY114:AZ114) -> 0 | BB114: 0 | BC114: 1 | BD114: =1-SUM(BB114:BC114) -> 0 | BE114: 0 | BF114: 1 | BG114: =1-SUM(BE114:BF114) -> 0 | BH114: 0 | BI114: 1 | BJ114: =1-SUM(BH114:BI114) -> 0 | BK114: 0 | BL114: 1 | BM114: =1-SUM(BK114:BL114) -> 0 | BN114: 0 | BO114: =1-BN114 -> 1
A115: =A15 -> COMPLESSITA' | B115: =B15 -> 115 | C115: =C15 -> 29.187817258883246 | D115: =D15 -> 262 | E115: =E15 -> 66.497461928934015 | F115: =F15 -> 17 | G115: =G15 -> 4.3147208121827409 | O115: 1 | P115: 0 | Q115: =1-SUM(O115:P115) -> 0 | R115: 1 | S115: 0 | T115: =1-SUM(R115:S115) -> 0 | U115: 1 | V115: 0 | W115: =1-SUM(U115:V115) -> 0 | X115: 1 | Y115: 0 | Z115: =1-SUM(X115:Y115) -> 0 | AA115: 1 | AB115: 0 | AC115: =1-SUM(AA115:AB115) -> 0 | AD115: 0 | AE115: 1 | AF115: =1-SUM(AD115:AE115) -> 0 | AG115: 0 | AH115: 1 | AI115: =1-SUM(AG115:AH115) -> 0 | AJ115: 1 | AK115: 0 | AL115: =1-SUM(AJ115:AK115) -> 0 | AM115: 1 | AN115: 0 | AO115: =1-SUM(AM115:AN115) -> 0 | AP115: 0 | AQ115: 1 | AR115: =1-SUM(AP115:AQ115) -> 0 | AS115: 1 | AT115: 0 | AU115: =1-SUM(AS115:AT115) -> 0 | AV115: 1 | AW115: 0 | AX115: =1-SUM(AV115:AW115) -> 0 | AY115: 1 | AZ115: 0 | BA115: =1-SUM(AY115:AZ115) -> 0 | BB115: 0 | BC115: 1 | BD115: =1-SUM(BB115:BC115) -> 0 | BE115: 0 | BF115: 1 | BG115: =1-SUM(BE115:BF115) -> 0 | BH115: 0 | BI115: 1 | BJ115: =1-SUM(BH115:BI115) -> 0 | BK115: 0 | BL115: 1 | BM115: =1-SUM(BK115:BL115) -> 0 | BN115: 0 | BO115: =1-BN115 -> 1
A116: =A14 -> GIOCHI | B116: =B14 -> 26 | C116: =C14 -> 6.5989847715736047 | D116: =D14 -> 354 | E116: =E14 -> 89.847715736040612 | F116: =F14 -> 14 | G116: =G14 -> 3.5532994923857872 | O116: 1 | P116: 0 | Q116: =1-SUM(O116:P116) -> 0 | R116: 1 | S116: 0 | T116: =1-SUM(R116:S116) -> 0 | U116: 1 | V116: 0 | W116: =1-SUM(U116:V116) -> 0 | X116: 0 | Y116: 1 | Z116: =1-SUM(X116:Y116) -> 0 | AA116: 1 | AB116: 0 | AC116: =1-SUM(AA116:AB116) -> 0 | AD116: 0 | AE116: 1 | AF116: =1-SUM(AD116:AE116) -> 0 | AG116: 0 | AH116: 1 | AI116: =1-SUM(AG116:AH116) -> 0 | AJ116: 1 | AK116: 0 | AL116: =1-SUM(AJ116:AK116) -> 0 | AM116: 0 | AN116: 1 | AO116: =1-SUM(AM116:AN116) -> 0 | AP116: 0 | AQ116: 1 | AR116: =1-SUM(AP116:AQ116) -> 0 | AS116: 0 | AT116: 1 | AU116: =1-SUM(AS116:AT116) -> 0 | AV116: 1 | AW116: 0 | AX116: =1-SUM(AV116:AW116) -> 0 | AY116: 0 | AZ116: 1 | BA116: =1-SUM(AY116:AZ116) -> 0 | BB116: 0 | BC116: 1 | BD116: =1-SUM(BB116:BC116) -> 0 | BE116: 0 | BF116: 1 | BG116: =1-SUM(BE116:BF116) -> 0 | BH116: 0 | BI116: 1 | BJ116: =1-SUM(BH116:BI116) -> 0 | BK116: 0 | BL116: 1 | BM116: =1-SUM(BK116:BL116) -> 0 | BN116: 0 | BO116: =1-BN116 -> 1
A117: =A13 -> RETI | B117: =B13 -> 157 | C117: =C13 -> 39.847715736040605 | D117: =D13 -> 223 | E117: =E13 -> 56.598984771573605 | F117: =F13 -> 14 | G117: =G13 -> 3.5532994923857872 | O117: 1 | P117: 0 | Q117: =1-SUM(O117:P117) -> 0 | R117: 0 | S117: 1 | T117: =1-SUM(R117:S117) -> 0 | U117: 0 | V117: 1 | W117: =1-SUM(U117:V117) -> 0 | X117: 0 | Y117: 1 | Z117: =1-SUM(X117:Y117) -> 0 | AA117: 1 | AB117: 0 | AC117: =1-SUM(AA117:AB117) -> 0 | AD117: 0 | AE117: 1 | AF117: =1-SUM(AD117:AE117) -> 0 | AG117: 0 | AH117: 1 | AI117: =1-SUM(AG117:AH117) -> 0 | AJ117: 1 | AK117: 0 | AL117: =1-SUM(AJ117:AK117) -> 0 | AM117: 1 | AN117: 0 | AO117: =1-SUM(AM117:AN117) -> 0 | AP117: 0 | AQ117: 1 | AR117: =1-SUM(AP117:AQ117) -> 0 | AS117: 0 | AT117: 1 | AU117: =1-SUM(AS117:AT117) -> 0 | AV117: 1 | AW117: 0 | AX117: =1-SUM(AV117:AW117) -> 0 | AY117: 1 | AZ117: 0 | BA117: =1-SUM(AY117:AZ117) -> 0 | BB117: 1 | BC117: 0 | BD117: =1-SUM(BB117:BC117) -> 0 | BE117: 1 | BF117: 0 | BG117: =1-SUM(BE117:BF117) -> 0 | BH117: 0 | BI117: 1 | BJ117: =1-SUM(BH117:BI117) -> 0 | BK117: 0 | BL117: 1 | BM117: =1-SUM(BK117:BL117) -> 0 | BN117: 0 | BO117: =1-BN117 -> 1
A118: =A12 -> GRAFI | B118: =B12 -> 198 | C118: =C12 -> 50.253807106598977 | D118: =D12 -> 182 | E118: =E12 -> 46.192893401015226 | F118: =F12 -> 14 | G118: =G12 -> 3.5532994923857872 | O118: 1 | P118: 0 | Q118: =1-SUM(O118:P118) -> 0 | R118: 1 | S118: 0 | T118: =1-SUM(R118:S118) -> 0 | U118: 0 | V118: 0 | W118: =1-SUM(U118:V118) -> 1 | X118: 1 | Y118: 0 | Z118: =1-SUM(X118:Y118) -> 0 | AA118: 0 | AB118: 1 | AC118: =1-SUM(AA118:AB118) -> 0 | AD118: 0 | AE118: 1 | AF118: =1-SUM(AD118:AE118) -> 0 | AG118: 0 | AH118: 1 | AI118: =1-SUM(AG118:AH118) -> 0 | AJ118: 0 | AK118: 1 | AL118: =1-SUM(AJ118:AK118) -> 0 | AM118: 0 | AN118: 1 | AO118: =1-SUM(AM118:AN118) -> 0 | AP118: 0 | AQ118: 1 | AR118: =1-SUM(AP118:AQ118) -> 0 | AS118: 0 | AT118: 1 | AU118: =1-SUM(AS118:AT118) -> 0 | AV118: 0 | AW118: 1 | AX118: =1-SUM(AV118:AW118) -> 0 | AY118: 0 | AZ118: 1 | BA118: =1-SUM(AY118:AZ118) -> 0 | BB118: 0 | BC118: 1 | BD118: =1-SUM(BB118:BC118) -> 0 | BE118: 0 | BF118: 1 | BG118: =1-SUM(BE118:BF118) -> 0 | BH118: 0 | BI118: 1 | BJ118: =1-SUM(BH118:BI118) -> 0 | BK118: 0 | BL118: 1 | BM118: =1-SUM(BK118:BL118) -> 0 | BN118: 0 | BO118: =1-BN118 -> 1
A119: =A11 -> NLP (ALGORITMI) | B119: =B11 -> 61 | C119: =C11 -> 15.482233502538071 | D119: =D11 -> 315 | E119: =E11 -> 79.949238578680209 | F119: =F11 -> 18 | G119: =G11 -> 4.5685279187817258 | O119: 0 | P119: 1 | Q119: =1-SUM(O119:P119) -> 0 | R119: 0 | S119: 1 | T119: =1-SUM(R119:S119) -> 0 | U119: 0 | V119: 1 | W119: =1-SUM(U119:V119) -> 0 | X119: 0 | Y119: 1 | Z119: =1-SUM(X119:Y119) -> 0 | AA119: 0 | AB119: 1 | AC119: =1-SUM(AA119:AB119) -> 0 | AD119: 0 | AE119: 1 | AF119: =1-SUM(AD119:AE119) -> 0 | AG119: 0 | AH119: 1 | AI119: =1-SUM(AG119:AH119) -> 0 | AJ119: 0 | AK119: 1 | AL119: =1-SUM(AJ119:AK119) -> 0 | AM119: 1 | AN119: 0 | AO119: =1-SUM(AM119:AN119) -> 0 | AP119: 0 | AQ119: 1 | AR119: =1-SUM(AP119:AQ119) -> 0 | AS119: 0 | AT119: 1 | AU119: =1-SUM(AS119:AT119) -> 0 | AV119: 0 | AW119: 1 | AX119: =1-SUM(AV119:AW119) -> 0 | AY119: 0 | AZ119: 1 | BA119: =1-SUM(AY119:AZ119) -> 0 | BB119: 0 | BC119: 1 | BD119: =1-SUM(BB119:BC119) -> 0 | BE119: 0 | BF119: 1 | BG119: =1-SUM(BE119:BF119) -> 0 | BH119: 1 | BI119: 0 | BJ119: =1-SUM(BH119:BI119) -> 0 | BK119: 0 | BL119: 1 | BM119: =1-SUM(BK119:BL119) -> 0 | BN119: 0 | BO119: =1-BN119 -> 1
A120: =A10 -> NLP (COND. OTT.) | B120: =B10 -> 68 | C120: =C10 -> 17.258883248730964 | D120: =D10 -> 308 | E120: =E10 -> 78.172588832487307 | F120: =F10 -> 18 | G120: =G10 -> 4.5685279187817258 | O120: 1 | P120: 0 | Q120: =1-SUM(O120:P120) -> 0 | R120: 0 | S120: 1 | T120: =1-SUM(R120:S120) -> 0 | U120: 0 | V120: 1 | W120: =1-SUM(U120:V120) -> 0 | X120: 1 | Y120: 0 | Z120: =1-SUM(X120:Y120) -> 0 | AA120: 1 | AB120: 0 | AC120: =1-SUM(AA120:AB120) -> 0 | AD120: 0 | AE120: 1 | AF120: =1-SUM(AD120:AE120) -> 0 | AG120: 0 | AH120: 1 | AI120: =1-SUM(AG120:AH120) -> 0 | AJ120: 1 | AK120: 0 | AL120: =1-SUM(AJ120:AK120) -> 0 | AM120: 1 | AN120: 0 | AO120: =1-SUM(AM120:AN120) -> 0 | AP120: 1 | AQ120: 0 | AR120: =1-SUM(AP120:AQ120) -> 0 | AS120: 0 | AT120: 1 | AU120: =1-SUM(AS120:AT120) -> 0 | AV120: 0 | AW120: 1 | AX120: =1-SUM(AV120:AW120) -> 0 | AY120: 0 | AZ120: 1 | BA120: =1-SUM(AY120:AZ120) -> 0 | BB120: 0 | BC120: 1 | BD120: =1-SUM(BB120:BC120) -> 0 | BE120: 0 | BF120: 1 | BG120: =1-SUM(BE120:BF120) -> 0 | BH120: 0 | BI120: 1 | BJ120: =1-SUM(BH120:BI120) -> 0 | BK120: 0 | BL120: 1 | BM120: =1-SUM(BK120:BL120) -> 0 | BN120: 0 | BO120: =1-BN120 -> 1
A121: =A9 -> ILP | B121: =B9 -> 209 | C121: =C9 -> 53.045685279187815 | D121: =D9 -> 170 | E121: =E9 -> 43.147208121827411 | F121: =F9 -> 15 | G121: =G9 -> 3.8071065989847721 | O121: 1 | P121: 0 | Q121: =1-SUM(O121:P121) -> 0 | R121: 0 | S121: 1 | T121: =1-SUM(R121:S121) -> 0 | U121: 0 | V121: 1 | W121: =1-SUM(U121:V121) -> 0 | X121: 0 | Y121: 1 | Z121: =1-SUM(X121:Y121) -> 0 | AA121: 1 | AB121: 0 | AC121: =1-SUM(AA121:AB121) -> 0 | AD121: 0 | AE121: 1 | AF121: =1-SUM(AD121:AE121) -> 0 | AG121: 0 | AH121: 1 | AI121: =1-SUM(AG121:AH121) -> 0 | AJ121: 0 | AK121: 1 | AL121: =1-SUM(AJ121:AK121) -> 0 | AM121: 0 | AN121: 1 | AO121: =1-SUM(AM121:AN121) -> 0 | AP121: 0 | AQ121: 1 | AR121: =1-SUM(AP121:AQ121) -> 0 | AS121: 0 | AT121: 1 | AU121: =1-SUM(AS121:AT121) -> 0 | AV121: 1 | AW121: 0 | AX121: =1-SUM(AV121:AW121) -> 0 | AY121: 1 | AZ121: 0 | BA121: =1-SUM(AY121:AZ121) -> 0 | BB121: 1 | BC121: 0 | BD121: =1-SUM(BB121:BC121) -> 0 | BE121: 0 | BF121: 1 | BG121: =1-SUM(BE121:BF121) -> 0 | BH121: 0 | BI121: 1 | BJ121: =1-SUM(BH121:BI121) -> 0 | BK121: 0 | BL121: 1 | BM121: =1-SUM(BK121:BL121) -> 0 | BN121: 0 | BO121: =1-BN121 -> 1
A122: =A8 -> DUALITA' | B122: =B8 -> 155 | C122: =C8 -> 39.340101522842644 | D122: =D8 -> 225 | E122: =E8 -> 57.106598984771573 | F122: =F8 -> 14 | G122: =G8 -> 3.5532994923857872 | O122: 1 | P122: 0 | Q122: =1-SUM(O122:P122) -> 0 | R122: 0 | S122: 1 | T122: =1-SUM(R122:S122) -> 0 | U122: 0 | V122: 1 | W122: =1-SUM(U122:V122) -> 0 | X122: 0 | Y122: 1 | Z122: =1-SUM(X122:Y122) -> 0 | AA122: 1 | AB122: 0 | AC122: =1-SUM(AA122:AB122) -> 0 | AD122: 0 | AE122: 1 | AF122: =1-SUM(AD122:AE122) -> 0 | AG122: 0 | AH122: 1 | AI122: =1-SUM(AG122:AH122) -> 0 | AJ122: 1 | AK122: 0 | AL122: =1-SUM(AJ122:AK122) -> 0 | AM122: 1 | AN122: 0 | AO122: =1-SUM(AM122:AN122) -> 0 | AP122: 0 | AQ122: 1 | AR122: =1-SUM(AP122:AQ122) -> 0 | AS122: 0 | AT122: 1 | AU122: =1-SUM(AS122:AT122) -> 0 | AV122: 0 | AW122: 1 | AX122: =1-SUM(AV122:AW122) -> 0 | AY122: 0 | AZ122: 1 | BA122: =1-SUM(AY122:AZ122) -> 0 | BB122: 0 | BC122: 1 | BD122: =1-SUM(BB122:BC122) -> 0 | BE122: 1 | BF122: 0 | BG122: =1-SUM(BE122:BF122) -> 0 | BH122: 1 | BI122: 0 | BJ122: =1-SUM(BH122:BI122) -> 0 | BK122: 0 | BL122: 1 | BM122: =1-SUM(BK122:BL122) -> 0 | BN122: 0 | BO122: =1-BN122 -> 1
A123: =A7 -> SIMPLESSO | B123: =B7 -> 158 | C123: =C7 -> 40.101522842639589 | D123: =D7 -> 218 | E123: =E7 -> 55.329949238578678 | F123: =F7 -> 18 | G123: =G7 -> 4.5685279187817258 | O123: 1 | P123: 0 | Q123: =1-SUM(O123:P123) -> 0 | R123: 0 | S123: 1 | T123: =1-SUM(R123:S123) -> 0 | U123: 0 | V123: 1 | W123: =1-SUM(U123:V123) -> 0 | X123: 0 | Y123: 1 | Z123: =1-SUM(X123:Y123) -> 0 | AA123: 1 | AB123: 0 | AC123: =1-SUM(AA123:AB123) -> 0 | AD123: 0 | AE123: 1 | AF123: =1-SUM(AD123:AE123) -> 0 | AG123: 0 | AH123: 1 | AI123: =1-SUM(AG123:AH123) -> 0 | AJ123: 1 | AK123: 0 | AL123: =1-SUM(AJ123:AK123) -> 0 | AM123: 1 | AN123: 0 | AO123: =1-SUM(AM123:AN123) -> 0 | AP123: 0 | AQ123: 1 | AR123: =1-SUM(AP123:AQ123) -> 0 | AS123: 1 | AT123: 0 | AU123: =1-SUM(AS123:AT123) -> 0 | AV123: 1 | AW123: 0 | AX123: =1-SUM(AV123:AW123) -> 0 | AY123: 1 | AZ123: 0 | BA123: =1-SUM(AY123:AZ123) -> 0 | BB123: 1 | BC123: 0 | BD123: =1-SUM(BB123:BC123) -> 0 | BE123: 1 | BF123: 0 | BG123: =1-SUM(BE123:BF123) -> 0 | BH123: 1 | BI123: 0 | BJ123: =1-SUM(BH123:BI123) -> 0 | BK123: 0 | BL123: 1 | BM123: =1-SUM(BK123:BL123) -> 0 | BN123: 0 | BO123: =1-BN123 -> 1
A124: =A6 -> LP | B124: =B6 -> 209 | C124: =C6 -> 53.045685279187815 | D124: =D6 -> 171 | E124: =E6 -> 43.401015228426395 | F124: =F6 -> 14 | G124: =G6 -> 3.5532994923857872 | O124: 1 | P124: 0 | Q124: =1-SUM(O124:P124) -> 0 | R124: 1 | S124: 0 | T124: =1-SUM(R124:S124) -> 0 | U124: 1 | V124: 0 | W124: =1-SUM(U124:V124) -> 0 | X124: 0 | Y124: 1 | Z124: =1-SUM(X124:Y124) -> 0 | AA124: 0 | AB124: 1 | AC124: =1-SUM(AA124:AB124) -> 0 | AD124: 0 | AE124: 1 | AF124: =1-SUM(AD124:AE124) -> 0 | AG124: 0 | AH124: 1 | AI124: =1-SUM(AG124:AH124) -> 0 | AJ124: 0 | AK124: 1 | AL124: =1-SUM(AJ124:AK124) -> 0 | AM124: 0 | AN124: 1 | AO124: =1-SUM(AM124:AN124) -> 0 | AP124: 0 | AQ124: 1 | AR124: =1-SUM(AP124:AQ124) -> 0 | AS124: 0 | AT124: 1 | AU124: =1-SUM(AS124:AT124) -> 0 | AV124: 1 | AW124: 0 | AX124: =1-SUM(AV124:AW124) -> 0 | AY124: 0 | AZ124: 1 | BA124: =1-SUM(AY124:AZ124) -> 0 | BB124: 0 | BC124: 1 | BD124: =1-SUM(BB124:BC124) -> 0 | BE124: 1 | BF124: 0 | BG124: =1-SUM(BE124:BF124) -> 0 | BH124: 0 | BI124: 1 | BJ124: =1-SUM(BH124:BI124) -> 0 | BK124: 0 | BL124: 1 | BM124: =1-SUM(BK124:BL124) -> 0 | BN124: 0 | BO124: =1-BN124 -> 1
A125: =A5 -> MODELLI MATEMATICI | B125: =B5 -> 312 | C125: =C5 -> 79.187817258883257 | D125: =D5 -> 68 | E125: =E5 -> 17.258883248730964 | F125: =F5 -> 14 | G125: =G5 -> 3.5532994923857872 | O125: 0 | P125: 1 | Q125: =1-SUM(O125:P125) -> 0 | R125: 0 | S125: 1 | T125: =1-SUM(R125:S125) -> 0 | U125: 0 | V125: 1 | W125: =1-SUM(U125:V125) -> 0 | X125: 0 | Y125: 1 | Z125: =1-SUM(X125:Y125) -> 0 | AA125: 0 | AB125: 1 | AC125: =1-SUM(AA125:AB125) -> 0 | AD125: 1 | AE125: 0 | AF125: =1-SUM(AD125:AE125) -> 0 | AG125: 1 | AH125: 0 | AI125: =1-SUM(AG125:AH125) -> 0 | AJ125: 0 | AK125: 1 | AL125: =1-SUM(AJ125:AK125) -> 0 | AM125: 0 | AN125: 1 | AO125: =1-SUM(AM125:AN125) -> 0 | AP125: 0 | AQ125: 1 | AR125: =1-SUM(AP125:AQ125) -> 0 | AS125: 0 | AT125: 1 | AU125: =1-SUM(AS125:AT125) -> 0 | AV125: 0 | AW125: 1 | AX125: =1-SUM(AV125:AW125) -> 0 | AY125: 0 | AZ125: 1 | BA125: =1-SUM(AY125:AZ125) -> 0 | BB125: 0 | BC125: 1 | BD125: =1-SUM(BB125:BC125) -> 0 | BE125: 0 | BF125: 1 | BG125: =1-SUM(BE125:BF125) -> 0 | BH125: 0 | BI125: 1 | BJ125: =1-SUM(BH125:BI125) -> 0 | BK125: 0 | BL125: 1 | BM125: =1-SUM(BK125:BL125) -> 0 | BN125: 0 | BO125: =1-BN125 -> 1
A126: Totale | B126: =B125+B124+B123+B122+B121+B120+B119+B118+B117+B116+B115+B114+B113+B112+B111+B110+B109+B108 -> 2399 | D126: =D125+D124+D123+D122+D121+D120+D119+D118+D117+D116+D115+D114+D113+D112+D111+D110+D109+D108 -> 4434 | F126: =F125+F124+F123+F122+F121+F120+F119+F118+F117+F116+F115+F114+F113+F112+F111+F110+F109+F108 -> 259 | O126: 0 | P126: 1 | Q126: =1-SUM(O126:P126) -> 0 | R126: 0 | S126: 1 | T126: =1-SUM(R126:S126) -> 0 | U126: 0 | V126: 1 | W126: =1-SUM(U126:V126) -> 0 | X126: 0 | Y126: 1 | Z126: =1-SUM(X126:Y126) -> 0 | AA126: 0 | AB126: 1 | AC126: =1-SUM(AA126:AB126) -> 0 | AD126: 0 | AE126: 1 | AF126: =1-SUM(AD126:AE126) -> 0 | AG126: 0 | AH126: 1 | AI126: =1-SUM(AG126:AH126) -> 0 | AJ126: 0 | AK126: 1 | AL126: =1-SUM(AJ126:AK126) -> 0 | AM126: 0 | AN126: 1 | AO126: =1-SUM(AM126:AN126) -> 0 | AP126: 1 | AQ126: 0 | AR126: =1-SUM(AP126:AQ126) -> 0 | AS126: 0 | AT126: 1 | AU126: =1-SUM(AS126:AT126) -> 0 | AV126: 0 | AW126: 1 | AX126: =1-SUM(AV126:AW126) -> 0 | AY126: 0 | AZ126: 1 | BA126: =1-SUM(AY126:AZ126) -> 0 | BB126: 0 | BC126: 1 | BD126: =1-SUM(BB126:BC126) -> 0 | BE126: 0 | BF126: 1 | BG126: =1-SUM(BE126:BF126) -> 0 | BH126: 0 | BI126: 1 | BJ126: =1-SUM(BH126:BI126) -> 0 | BK126: 0 | BL126: 1 | BM126: =1-SUM(BK126:BL126) -> 0 | BN126: 0 | BO126: =1-BN126 -> 1
O127: 0 | P127: 1 | Q127: =1-SUM(O127:P127) -> 0 | R127: 1 | S127: 0 | T127: =1-SUM(R127:S127) -> 0 | U127: 1 | V127: 0 | W127: =1-SUM(U127:V127) -> 0 | X127: 0 | Y127: 1 | Z127: =1-SUM(X127:Y127) -> 0 | AA127: 1 | AB127: 0 | AC127: =1-SUM(AA127:AB127) -> 0 | AD127: 0 | AE127: 1 | AF127: =1-SUM(AD127:AE127) -> 0 | AG127: 0 | AH127: 1 | AI127: =1-SUM(AG127:AH127) -> 0 | AJ127: 1 | AK127: 0 | AL127: =1-SUM(AJ127:AK127) -> 0 | AM127: 0 | AN127: 1 | AO127: =1-SUM(AM127:AN127) -> 0 | AP127: 0 | AQ127: 1 | AR127: =1-SUM(AP127:AQ127) -> 0 | AS127: 1 | AT127: 0 | AU127: =1-SUM(AS127:AT127) -> 0 | AV127: 1 | AW127: 0 | AX127: =1-SUM(AV127:AW127) -> 0 | AY127: 0 | AZ127: 1 | BA127: =1-SUM(AY127:AZ127) -> 0 | BB127: 0 | BC127: 1 | BD127: =1-SUM(BB127:BC127) -> 0 | BE127: 0 | BF127: 1 | BG127: =1-SUM(BE127:BF127) -> 0 | BH127: 0 | BI127: 1 | BJ127: =1-SUM(BH127:BI127) -> 0 | BK127: 0 | BL127: 1 | BM127: =1-SUM(BK127:BL127) -> 0 | BN127: 0 | BO127: =1-BN127 -> 1
O128: 1 | P128: 0 | Q128: =1-SUM(O128:P128) -> 0 | R128: 0 | S128: 1 | T128: =1-SUM(R128:S128) -> 0 | U128: 0 | V128: 1 | W128: =1-SUM(U128:V128) -> 0 | X128: 0 | Y128: 1 | Z128: =1-SUM(X128:Y128) -> 0 | AA128: 0 | AB128: 1 | AC128: =1-SUM(AA128:AB128) -> 0 | AD128: 1 | AE128: 0 | AF128: =1-SUM(AD128:AE128) -> 0 | AG128: 1 | AH128: 0 | AI128: =1-SUM(AG128:AH128) -> 0 | AJ128: 1 | AK128: 0 | AL128: =1-SUM(AJ128:AK128) -> 0 | AM128: 1 | AN128: 0 | AO128: =1-SUM(AM128:AN128) -> 0 | AP128: 0 | AQ128: 1 | AR128: =1-SUM(AP128:AQ128) -> 0 | AS128: 0 | AT128: 1 | AU128: =1-SUM(AS128:AT128) -> 0 | AV128: 0 | AW128: 1 | AX128: =1-SUM(AV128:AW128) -> 0 | AY128: 0 | AZ128: 1 | BA128: =1-SUM(AY128:AZ128) -> 0 | BB128: 0 | BC128: 1 | BD128: =1-SUM(BB128:BC128) -> 0 | BE128: 1 | BF128: 0 | BG128: =1-SUM(BE128:BF128) -> 0 | BH128: 1 | BI128: 0 | BJ128: =1-SUM(BH128:BI128) -> 0 | BK128: 1 | BL128: 0 | BM128: =1-SUM(BK128:BL128) -> 0 | BN128: 0 | BO128: =1-BN128 -> 1
O129: 1 | P129: 0 | Q129: =1-SUM(O129:P129) -> 0 | R129: 0 | S129: 1 | T129: =1-SUM(R129:S129) -> 0 | U129: 0 | V129: 1 | W129: =1-SUM(U129:V129) -> 0 | X129: 0 | Y129: 1 | Z129: =1-SUM(X129:Y129) -> 0 | AA129: 0 | AB129: 1 | AC129: =1-SUM(AA129:AB129) -> 0 | AD129: 1 | AE129: 0 | AF129: =1-SUM(AD129:AE129) -> 0 | AG129: 1 | AH129: 0 | AI129: =1-SUM(AG129:AH129) -> 0 | AJ129: 0 | AK129: 1 | AL129: =1-SUM(AJ129:AK129) -> 0 | AM129: 0 | AN129: 1 | AO129: =1-SUM(AM129:AN129) -> 0 | AP129: 0 | AQ129: 1 | AR129: =1-SUM(AP129:AQ129) -> 0 | AS129: 1 | AT129: 0 | AU129: =1-SUM(AS129:AT129) -> 0 | AV129: 0 | AW129: 1 | AX129: =1-SUM(AV129:AW129) -> 0 | AY129: 0 | AZ129: 1 | BA129: =1-SUM(AY129:AZ129) -> 0 | BB129: 0 | BC129: 1 | BD129: =1-SUM(BB129:BC129) -> 0 | BE129: 1 | BF129: 0 | BG129: =1-SUM(BE129:BF129) -> 0 | BH129: 1 | BI129: 0 | BJ129: =1-SUM(BH129:BI129) -> 0 | BK129: 0 | BL129: 1 | BM129: =1-SUM(BK129:BL129) -> 0 | BN129: 0 | BO129: =1-BN129 -> 1
O130: 1 | P130: 0 | Q130: =1-SUM(O130:P130) -> 0 | R130: 1 | S130: 0 | T130: =1-SUM(R130:S130) -> 0 | U130: 1 | V130: 0 | W130: =1-SUM(U130:V130) -> 0 | X130: 0 | Y130: 1 | Z130: =1-SUM(X130:Y130) -> 0 | AA130: 1 | AB130: 0 | AC130: =1-SUM(AA130:AB130) -> 0 | AD130: 1 | AE130: 0 | AF130: =1-SUM(AD130:AE130) -> 0 | AG130: 1 | AH130: 0 | AI130: =1-SUM(AG130:AH130) -> 0 | AJ130: 1 | AK130: 0 | AL130: =1-SUM(AJ130:AK130) -> 0 | AM130: 1 | AN130: 0 | AO130: =1-SUM(AM130:AN130) -> 0 | AP130: 0 | AQ130: 1 | AR130: =1-SUM(AP130:AQ130) -> 0 | AS130: 0 | AT130: 1 | AU130: =1-SUM(AS130:AT130) -> 0 | AV130: 1 | AW130: 0 | AX130: =1-SUM(AV130:AW130) -> 0 | AY130: 1 | AZ130: 0 | BA130: =1-SUM(AY130:AZ130) -> 0 | BB130: 0 | BC130: 1 | BD130: =1-SUM(BB130:BC130) -> 0 | BE130: 0 | BF130: 1 | BG130: =1-SUM(BE130:BF130) -> 0 | BH130: 1 | BI130: 0 | BJ130: =1-SUM(BH130:BI130) -> 0 | BK130: 0 | BL130: 1 | BM130: =1-SUM(BK130:BL130) -> 0 | BN130: 0 | BO130: =1-BN130 -> 1
O131: 1 | P131: 0 | Q131: =1-SUM(O131:P131) -> 0 | R131: 1 | S131: 0 | T131: =1-SUM(R131:S131) -> 0 | U131: 1 | V131: 0 | W131: =1-SUM(U131:V131) -> 0 | X131: 0 | Y131: 1 | Z131: =1-SUM(X131:Y131) -> 0 | AA131: 1 | AB131: 0 | AC131: =1-SUM(AA131:AB131) -> 0 | AD131: 0 | AE131: 1 | AF131: =1-SUM(AD131:AE131) -> 0 | AG131: 0 | AH131: 1 | AI131: =1-SUM(AG131:AH131) -> 0 | AJ131: 1 | AK131: 0 | AL131: =1-SUM(AJ131:AK131) -> 0 | AM131: 1 | AN131: 0 | AO131: =1-SUM(AM131:AN131) -> 0 | AP131: 0 | AQ131: 1 | AR131: =1-SUM(AP131:AQ131) -> 0 | AS131: 1 | AT131: 0 | AU131: =1-SUM(AS131:AT131) -> 0 | AV131: 1 | AW131: 0 | AX131: =1-SUM(AV131:AW131) -> 0 | AY131: 1 | AZ131: 0 | BA131: =1-SUM(AY131:AZ131) -> 0 | BB131: 1 | BC131: 0 | BD131: =1-SUM(BB131:BC131) -> 0 | BE131: 0 | BF131: 1 | BG131: =1-SUM(BE131:BF131) -> 0 | BH131: 1 | BI131: 0 | BJ131: =1-SUM(BH131:BI131) -> 0 | BK131: 0 | BL131: 1 | BM131: =1-SUM(BK131:BL131) -> 0 | BN131: 0 | BO131: =1-BN131 -> 1
O132: 1 | P132: 0 | Q132: =1-SUM(O132:P132) -> 0 | R132: 1 | S132: 0 | T132: =1-SUM(R132:S132) -> 0 | U132: 1 | V132: 0 | W132: =1-SUM(U132:V132) -> 0 | X132: 1 | Y132: 0 | Z132: =1-SUM(X132:Y132) -> 0 | AA132: 1 | AB132: 0 | AC132: =1-SUM(AA132:AB132) -> 0 | AD132: 0 | AE132: 1 | AF132: =1-SUM(AD132:AE132) -> 0 | AG132: 0 | AH132: 1 | AI132: =1-SUM(AG132:AH132) -> 0 | AJ132: 0 | AK132: 1 | AL132: =1-SUM(AJ132:AK132) -> 0 | AM132: 0 | AN132: 1 | AO132: =1-SUM(AM132:AN132) -> 0 | AP132: 0 | AQ132: 1 | AR132: =1-SUM(AP132:AQ132) -> 0 | AS132: 1 | AT132: 0 | AU132: =1-SUM(AS132:AT132) -> 0 | AV132: 1 | AW132: 0 | AX132: =1-SUM(AV132:AW132) -> 0 | AY132: 1 | AZ132: 0 | BA132: =1-SUM(AY132:AZ132) -> 0 | BB132: 1 | BC132: 0 | BD132: =1-SUM(BB132:BC132) -> 0 | BE132: 0 | BF132: 1 | BG132: =1-SUM(BE132:BF132) -> 0 | BH132: 0 | BI132: 1 | BJ132: =1-SUM(BH132:BI132) -> 0 | BK132: 0 | BL132: 1 | BM132: =1-SUM(BK132:BL132) -> 0 | BN132: 0 | BO132: =1-BN132 -> 1
O133: 1 | P133: 0 | Q133: =1-SUM(O133:P133) -> 0 | R133: 0 | S133: 1 | T133: =1-SUM(R133:S133) -> 0 | U133: 0 | V133: 1 | W133: =1-SUM(U133:V133) -> 0 | X133: 0 | Y133: 1 | Z133: =1-SUM(X133:Y133) -> 0 | AA133: 0 | AB133: 1 | AC133: =1-SUM(AA133:AB133) -> 0 | AD133: 1 | AE133: 0 | AF133: =1-SUM(AD133:AE133) -> 0 | AG133: 1 | AH133: 0 | AI133: =1-SUM(AG133:AH133) -> 0 | AJ133: 1 | AK133: 0 | AL133: =1-SUM(AJ133:AK133) -> 0 | AM133: 1 | AN133: 0 | AO133: =1-SUM(AM133:AN133) -> 0 | AP133: 0 | AQ133: 1 | AR133: =1-SUM(AP133:AQ133) -> 0 | AS133: 0 | AT133: 1 | AU133: =1-SUM(AS133:AT133) -> 0 | AV133: 0 | AW133: 1 | AX133: =1-SUM(AV133:AW133) -> 0 | AY133: 0 | AZ133: 1 | BA133: =1-SUM(AY133:AZ133) -> 0 | BB133: 0 | BC133: 1 | BD133: =1-SUM(BB133:BC133) -> 0 | BE133: 1 | BF133: 0 | BG133: =1-SUM(BE133:BF133) -> 0 | BH133: 1 | BI133: 0 | BJ133: =1-SUM(BH133:BI133) -> 0 | BK133: 1 | BL133: 0 | BM133: =1-SUM(BK133:BL133) -> 0 | BN133: 0 | BO133: =1-BN133 -> 1
O134: 1 | P134: 0 | Q134: =1-SUM(O134:P134) -> 0 | R134: 1 | S134: 0 | T134: =1-SUM(R134:S134) -> 0 | U134: 1 | V134: 0 | W134: =1-SUM(U134:V134) -> 0 | X134: 1 | Y134: 0 | Z134: =1-SUM(X134:Y134) -> 0 | AA134: 1 | AB134: 0 | AC134: =1-SUM(AA134:AB134) -> 0 | AD134: 0 | AE134: 1 | AF134: =1-SUM(AD134:AE134) -> 0 | AG134: 0 | AH134: 1 | AI134: =1-SUM(AG134:AH134) -> 0 | AJ134: 1 | AK134: 0 | AL134: =1-SUM(AJ134:AK134) -> 0 | AM134: 1 | AN134: 0 | AO134: =1-SUM(AM134:AN134) -> 0 | AP134: 0 | AQ134: 1 | AR134: =1-SUM(AP134:AQ134) -> 0 | AS134: 1 | AT134: 0 | AU134: =1-SUM(AS134:AT134) -> 0 | AV134: 1 | AW134: 0 | AX134: =1-SUM(AV134:AW134) -> 0 | AY134: 1 | AZ134: 0 | BA134: =1-SUM(AY134:AZ134) -> 0 | BB134: 1 | BC134: 0 | BD134: =1-SUM(BB134:BC134) -> 0 | BE134: 0 | BF134: 1 | BG134: =1-SUM(BE134:BF134) -> 0 | BH134: 0 | BI134: 1 | BJ134: =1-SUM(BH134:BI134) -> 0 | BK134: 0 | BL134: 1 | BM134: =1-SUM(BK134:BL134) -> 0 | BN134: 0 | BO134: =1-BN134 -> 1
O135: 1 | P135: 0 | Q135: =1-SUM(O135:P135) -> 0 | R135: 0 | S135: 1 | T135: =1-SUM(R135:S135) -> 0 | U135: 0 | V135: 1 | W135: =1-SUM(U135:V135) -> 0 | X135: 0 | Y135: 1 | Z135: =1-SUM(X135:Y135) -> 0 | AA135: 0 | AB135: 1 | AC135: =1-SUM(AA135:AB135) -> 0 | AD135: 1 | AE135: 0 | AF135: =1-SUM(AD135:AE135) -> 0 | AG135: 1 | AH135: 0 | AI135: =1-SUM(AG135:AH135) -> 0 | AJ135: 0 | AK135: 1 | AL135: =1-SUM(AJ135:AK135) -> 0 | AM135: 0 | AN135: 1 | AO135: =1-SUM(AM135:AN135) -> 0 | AP135: 0 | AQ135: 1 | AR135: =1-SUM(AP135:AQ135) -> 0 | AS135: 0 | AT135: 1 | AU135: =1-SUM(AS135:AT135) -> 0 | AV135: 0 | AW135: 1 | AX135: =1-SUM(AV135:AW135) -> 0 | AY135: 0 | AZ135: 1 | BA135: =1-SUM(AY135:AZ135) -> 0 | BB135: 0 | BC135: 1 | BD135: =1-SUM(BB135:BC135) -> 0 | BE135: 1 | BF135: 0 | BG135: =1-SUM(BE135:BF135) -> 0 | BH135: 1 | BI135: 0 | BJ135: =1-SUM(BH135:BI135) -> 0 | BK135: 1 | BL135: 0 | BM135: =1-SUM(BK135:BL135) -> 0 | BN135: 0 | BO135: =1-BN135 -> 1
O136: 1 | P136: 0 | Q136: =1-SUM(O136:P136) -> 0 | R136: 1 | S136: 0 | T136: =1-SUM(R136:S136) -> 0 | U136: 1 | V136: 0 | W136: =1-SUM(U136:V136) -> 0 | X136: 1 | Y136: 0 | Z136: =1-SUM(X136:Y136) -> 0 | AA136: 1 | AB136: 0 | AC136: =1-SUM(AA136:AB136) -> 0 | AD136: 0 | AE136: 1 | AF136: =1-SUM(AD136:AE136) -> 0 | AG136: 0 | AH136: 1 | AI136: =1-SUM(AG136:AH136) -> 0 | AJ136: 1 | AK136: 0 | AL136: =1-SUM(AJ136:AK136) -> 0 | AM136: 1 | AN136: 0 | AO136: =1-SUM(AM136:AN136) -> 0 | AP136: 0 | AQ136: 1 | AR136: =1-SUM(AP136:AQ136) -> 0 | AS136: 1 | AT136: 0 | AU136: =1-SUM(AS136:AT136) -> 0 | AV136: 1 | AW136: 0 | AX136: =1-SUM(AV136:AW136) -> 0 | AY136: 1 | AZ136: 0 | BA136: =1-SUM(AY136:AZ136) -> 0 | BB136: 1 | BC136: 0 | BD136: =1-SUM(BB136:BC136) -> 0 | BE136: 0 | BF136: 1 | BG136: =1-SUM(BE136:BF136) -> 0 | BH136: 0 | BI136: 1 | BJ136: =1-SUM(BH136:BI136) -> 0 | BK136: 0 | BL136: 1 | BM136: =1-SUM(BK136:BL136) -> 0 | BN136: 0 | BO136: =1-BN136 -> 1
O137: 1 | P137: 0 | Q137: =1-SUM(O137:P137) -> 0 | R137: 0 | S137: 1 | T137: =1-SUM(R137:S137) -> 0 | U137: 0 | V137: 1 | W137: =1-SUM(U137:V137) -> 0 | X137: 0 | Y137: 1 | Z137: =1-SUM(X137:Y137) -> 0 | AA137: 1 | AB137: 0 | AC137: =1-SUM(AA137:AB137) -> 0 | AD137: 1 | AE137: 0 | AF137: =1-SUM(AD137:AE137) -> 0 | AG137: 1 | AH137: 0 | AI137: =1-SUM(AG137:AH137) -> 0 | AJ137: 1 | AK137: 0 | AL137: =1-SUM(AJ137:AK137) -> 0 | AM137: 1 | AN137: 0 | AO137: =1-SUM(AM137:AN137) -> 0 | AP137: 1 | AQ137: 0 | AR137: =1-SUM(AP137:AQ137) -> 0 | AS137: 0 | AT137: 1 | AU137: =1-SUM(AS137:AT137) -> 0 | AV137: 0 | AW137: 1 | AX137: =1-SUM(AV137:AW137) -> 0 | AY137: 0 | AZ137: 1 | BA137: =1-SUM(AY137:AZ137) -> 0 | BB137: 0 | BC137: 1 | BD137: =1-SUM(BB137:BC137) -> 0 | BE137: 1 | BF137: 0 | BG137: =1-SUM(BE137:BF137) -> 0 | BH137: 1 | BI137: 0 | BJ137: =1-SUM(BH137:BI137) -> 0 | BK137: 0 | BL137: 1 | BM137: =1-SUM(BK137:BL137) -> 0 | BN137: 0 | BO137: =1-BN137 -> 1
O138: 1 | P138: 0 | Q138: =1-SUM(O138:P138) -> 0 | R138: 1 | S138: 0 | T138: =1-SUM(R138:S138) -> 0 | U138: 0 | V138: 1 | W138: =1-SUM(U138:V138) -> 0 | X138: 1 | Y138: 0 | Z138: =1-SUM(X138:Y138) -> 0 | AA138: 1 | AB138: 0 | AC138: =1-SUM(AA138:AB138) -> 0 | AD138: 0 | AE138: 0 | AF138: =1-SUM(AD138:AE138) -> 1 | AG138: 0 | AH138: 0 | AI138: =1-SUM(AG138:AH138) -> 1 | AJ138: 1 | AK138: 0 | AL138: =1-SUM(AJ138:AK138) -> 0 | AM138: 1 | AN138: 0 | AO138: =1-SUM(AM138:AN138) -> 0 | AP138: 0 | AQ138: 1 | AR138: =1-SUM(AP138:AQ138) -> 0 | AS138: 0 | AT138: 1 | AU138: =1-SUM(AS138:AT138) -> 0 | AV138: 1 | AW138: 0 | AX138: =1-SUM(AV138:AW138) -> 0 | AY138: 0 | AZ138: 1 | BA138: =1-SUM(AY138:AZ138) -> 0 | BB138: 0 | BC138: 1 | BD138: =1-SUM(BB138:BC138) -> 0 | BE138: 1 | BF138: 0 | BG138: =1-SUM(BE138:BF138) -> 0 | BH138: 0 | BI138: 1 | BJ138: =1-SUM(BH138:BI138) -> 0 | BK138: 1 | BL138: 0 | BM138: =1-SUM(BK138:BL138) -> 0 | BN138: 0 | BO138: =1-BN138 -> 1
O139: 1 | P139: 0 | Q139: =1-SUM(O139:P139) -> 0 | R139: 1 | S139: 0 | T139: =1-SUM(R139:S139) -> 0 | U139: 1 | V139: 0 | W139: =1-SUM(U139:V139) -> 0 | X139: 1 | Y139: 0 | Z139: =1-SUM(X139:Y139) -> 0 | AA139: 1 | AB139: 0 | AC139: =1-SUM(AA139:AB139) -> 0 | AD139: 0 | AE139: 1 | AF139: =1-SUM(AD139:AE139) -> 0 | AG139: 0 | AH139: 1 | AI139: =1-SUM(AG139:AH139) -> 0 | AJ139: 1 | AK139: 0 | AL139: =1-SUM(AJ139:AK139) -> 0 | AM139: 1 | AN139: 0 | AO139: =1-SUM(AM139:AN139) -> 0 | AP139: 0 | AQ139: 1 | AR139: =1-SUM(AP139:AQ139) -> 0 | AS139: 1 | AT139: 0 | AU139: =1-SUM(AS139:AT139) -> 0 | AV139: 1 | AW139: 0 | AX139: =1-SUM(AV139:AW139) -> 0 | AY139: 1 | AZ139: 0 | BA139: =1-SUM(AY139:AZ139) -> 0 | BB139: 1 | BC139: 0 | BD139: =1-SUM(BB139:BC139) -> 0 | BE139: 0 | BF139: 1 | BG139: =1-SUM(BE139:BF139) -> 0 | BH139: 0 | BI139: 1 | BJ139: =1-SUM(BH139:BI139) -> 0 | BK139: 0 | BL139: 1 | BM139: =1-SUM(BK139:BL139) -> 0 | BN139: 0 | BO139: =1-BN139 -> 1
O140: 1 | P140: 0 | Q140: =1-SUM(O140:P140) -> 0 | R140: 0 | S140: 1 | T140: =1-SUM(R140:S140) -> 0 | U140: 0 | V140: 1 | W140: =1-SUM(U140:V140) -> 0 | X140: 0 | Y140: 1 | Z140: =1-SUM(X140:Y140) -> 0 | AA140: 0 | AB140: 1 | AC140: =1-SUM(AA140:AB140) -> 0 | AD140: 1 | AE140: 0 | AF140: =1-SUM(AD140:AE140) -> 0 | AG140: 1 | AH140: 0 | AI140: =1-SUM(AG140:AH140) -> 0 | AJ140: 0 | AK140: 1 | AL140: =1-SUM(AJ140:AK140) -> 0 | AM140: 0 | AN140: 1 | AO140: =1-SUM(AM140:AN140) -> 0 | AP140: 0 | AQ140: 1 | AR140: =1-SUM(AP140:AQ140) -> 0 | AS140: 0 | AT140: 1 | AU140: =1-SUM(AS140:AT140) -> 0 | AV140: 0 | AW140: 1 | AX140: =1-SUM(AV140:AW140) -> 0 | AY140: 0 | AZ140: 1 | BA140: =1-SUM(AY140:AZ140) -> 0 | BB140: 0 | BC140: 1 | BD140: =1-SUM(BB140:BC140) -> 0 | BE140: 1 | BF140: 0 | BG140: =1-SUM(BE140:BF140) -> 0 | BH140: 1 | BI140: 0 | BJ140: =1-SUM(BH140:BI140) -> 0 | BK140: 1 | BL140: 0 | BM140: =1-SUM(BK140:BL140) -> 0 | BN140: 0 | BO140: =1-BN140 -> 1
O141: 1 | P141: 0 | Q141: =1-SUM(O141:P141) -> 0 | R141: 0 | S141: 1 | T141: =1-SUM(R141:S141) -> 0 | U141: 0 | V141: 1 | W141: =1-SUM(U141:V141) -> 0 | X141: 0 | Y141: 1 | Z141: =1-SUM(X141:Y141) -> 0 | AA141: 0 | AB141: 1 | AC141: =1-SUM(AA141:AB141) -> 0 | AD141: 1 | AE141: 0 | AF141: =1-SUM(AD141:AE141) -> 0 | AG141: 1 | AH141: 0 | AI141: =1-SUM(AG141:AH141) -> 0 | AJ141: 0 | AK141: 1 | AL141: =1-SUM(AJ141:AK141) -> 0 | AM141: 0 | AN141: 1 | AO141: =1-SUM(AM141:AN141) -> 0 | AP141: 0 | AQ141: 1 | AR141: =1-SUM(AP141:AQ141) -> 0 | AS141: 1 | AT141: 0 | AU141: =1-SUM(AS141:AT141) -> 0 | AV141: 0 | AW141: 1 | AX141: =1-SUM(AV141:AW141) -> 0 | AY141: 0 | AZ141: 1 | BA141: =1-SUM(AY141:AZ141) -> 0 | BB141: 0 | BC141: 1 | BD141: =1-SUM(BB141:BC141) -> 0 | BE141: 1 | BF141: 0 | BG141: =1-SUM(BE141:BF141) -> 0 | BH141: 1 | BI141: 0 | BJ141: =1-SUM(BH141:BI141) -> 0 | BK141: 0 | BL141: 1 | BM141: =1-SUM(BK141:BL141) -> 0 | BN141: 0 | BO141: =1-BN141 -> 1
O142: 1 | P142: 0 | Q142: =1-SUM(O142:P142) -> 0 | R142: 1 | S142: 0 | T142: =1-SUM(R142:S142) -> 0 | U142: 1 | V142: 0 | W142: =1-SUM(U142:V142) -> 0 | X142: 1 | Y142: 0 | Z142: =1-SUM(X142:Y142) -> 0 | AA142: 1 | AB142: 0 | AC142: =1-SUM(AA142:AB142) -> 0 | AD142: 0 | AE142: 1 | AF142: =1-SUM(AD142:AE142) -> 0 | AG142: 0 | AH142: 1 | AI142: =1-SUM(AG142:AH142) -> 0 | AJ142: 1 | AK142: 0 | AL142: =1-SUM(AJ142:AK142) -> 0 | AM142: 0 | AN142: 1 | AO142: =1-SUM(AM142:AN142) -> 0 | AP142: 0 | AQ142: 1 | AR142: =1-SUM(AP142:AQ142) -> 0 | AS142: 0 | AT142: 1 | AU142: =1-SUM(AS142:AT142) -> 0 | AV142: 1 | AW142: 0 | AX142: =1-SUM(AV142:AW142) -> 0 | AY142: 0 | AZ142: 1 | BA142: =1-SUM(AY142:AZ142) -> 0 | BB142: 0 | BC142: 1 | BD142: =1-SUM(BB142:BC142) -> 0 | BE142: 0 | BF142: 1 | BG142: =1-SUM(BE142:BF142) -> 0 | BH142: 0 | BI142: 1 | BJ142: =1-SUM(BH142:BI142) -> 0 | BK142: 0 | BL142: 1 | BM142: =1-SUM(BK142:BL142) -> 0 | BN142: 0 | BO142: =1-BN142 -> 1
O143: 1 | P143: 0 | Q143: =1-SUM(O143:P143) -> 0 | R143: 1 | S143: 0 | T143: =1-SUM(R143:S143) -> 0 | U143: 0 | V143: 1 | W143: =1-SUM(U143:V143) -> 0 | X143: 0 | Y143: 1 | Z143: =1-SUM(X143:Y143) -> 0 | AA143: 1 | AB143: 0 | AC143: =1-SUM(AA143:AB143) -> 0 | AD143: 0 | AE143: 1 | AF143: =1-SUM(AD143:AE143) -> 0 | AG143: 0 | AH143: 1 | AI143: =1-SUM(AG143:AH143) -> 0 | AJ143: 1 | AK143: 0 | AL143: =1-SUM(AJ143:AK143) -> 0 | AM143: 1 | AN143: 0 | AO143: =1-SUM(AM143:AN143) -> 0 | AP143: 0 | AQ143: 1 | AR143: =1-SUM(AP143:AQ143) -> 0 | AS143: 1 | AT143: 0 | AU143: =1-SUM(AS143:AT143) -> 0 | AV143: 0 | AW143: 1 | AX143: =1-SUM(AV143:AW143) -> 0 | AY143: 1 | AZ143: 0 | BA143: =1-SUM(AY143:AZ143) -> 0 | BB143: 0 | BC143: 1 | BD143: =1-SUM(BB143:BC143) -> 0 | BE143: 0 | BF143: 1 | BG143: =1-SUM(BE143:BF143) -> 0 | BH143: 0 | BI143: 1 | BJ143: =1-SUM(BH143:BI143) -> 0 | BK143: 0 | BL143: 1 | BM143: =1-SUM(BK143:BL143) -> 0 | BN143: 0 | BO143: =1-BN143 -> 1
O144: 0 | P144: 1 | Q144: =1-SUM(O144:P144) -> 0 | R144: 0 | S144: 1 | T144: =1-SUM(R144:S144) -> 0 | U144: 0 | V144: 1 | W144: =1-SUM(U144:V144) -> 0 | X144: 0 | Y144: 1 | Z144: =1-SUM(X144:Y144) -> 0 | AA144: 0 | AB144: 1 | AC144: =1-SUM(AA144:AB144) -> 0 | AD144: 0 | AE144: 1 | AF144: =1-SUM(AD144:AE144) -> 0 | AG144: 0 | AH144: 1 | AI144: =1-SUM(AG144:AH144) -> 0 | AJ144: 0 | AK144: 1 | AL144: =1-SUM(AJ144:AK144) -> 0 | AM144: 0 | AN144: 1 | AO144: =1-SUM(AM144:AN144) -> 0 | AP144: 0 | AQ144: 1 | AR144: =1-SUM(AP144:AQ144) -> 0 | AS144: 0 | AT144: 1 | AU144: =1-SUM(AS144:AT144) -> 0 | AV144: 0 | AW144: 1 | AX144: =1-SUM(AV144:AW144) -> 0 | AY144: 0 | AZ144: 1 | BA144: =1-SUM(AY144:AZ144) -> 0 | BB144: 0 | BC144: 1 | BD144: =1-SUM(BB144:BC144) -> 0 | BE144: 0 | BF144: 1 | BG144: =1-SUM(BE144:BF144) -> 0 | BH144: 1 | BI144: 0 | BJ144: =1-SUM(BH144:BI144) -> 0 | BK144: 0 | BL144: 1 | BM144: =1-SUM(BK144:BL144) -> 0 | BN144: 0 | BO144: =1-BN144 -> 1
O145: 1 | P145: 0 | Q145: =1-SUM(O145:P145) -> 0 | R145: 1 | S145: 0 | T145: =1-SUM(R145:S145) -> 0 | U145: 0 | V145: 1 | W145: =1-SUM(U145:V145) -> 0 | X145: 0 | Y145: 1 | Z145: =1-SUM(X145:Y145) -> 0 | AA145: 1 | AB145: 0 | AC145: =1-SUM(AA145:AB145) -> 0 | AD145: 0 | AE145: 1 | AF145: =1-SUM(AD145:AE145) -> 0 | AG145: 0 | AH145: 1 | AI145: =1-SUM(AG145:AH145) -> 0 | AJ145: 0 | AK145: 1 | AL145: =1-SUM(AJ145:AK145) -> 0 | AM145: 0 | AN145: 1 | AO145: =1-SUM(AM145:AN145) -> 0 | AP145: 0 | AQ145: 1 | AR145: =1-SUM(AP145:AQ145) -> 0 | AS145: 0 | AT145: 1 | AU145: =1-SUM(AS145:AT145) -> 0 | AV145: 0 | AW145: 1 | AX145: =1-SUM(AV145:AW145) -> 0 | AY145: 0 | AZ145: 1 | BA145: =1-SUM(AY145:AZ145) -> 0 | BB145: 0 | BC145: 1 | BD145: =1-SUM(BB145:BC145) -> 0 | BE145: 0 | BF145: 1 | BG145: =1-SUM(BE145:BF145) -> 0 | BH145: 0 | BI145: 1 | BJ145: =1-SUM(BH145:BI145) -> 0 | BK145: 0 | BL145: 1 | BM145: =1-SUM(BK145:BL145) -> 0 | BN145: 1 | BO145: =1-BN145 -> 0
O146: 1 | P146: 0 | Q146: =1-SUM(O146:P146) -> 0 | R146: 0 | S146: 1 | T146: =1-SUM(R146:S146) -> 0 | U146: 0 | V146: 1 | W146: =1-SUM(U146:V146) -> 0 | X146: 0 | Y146: 1 | Z146: =1-SUM(X146:Y146) -> 0 | AA146: 0 | AB146: 1 | AC146: =1-SUM(AA146:AB146) -> 0 | AD146: 0 | AE146: 1 | AF146: =1-SUM(AD146:AE146) -> 0 | AG146: 0 | AH146: 1 | AI146: =1-SUM(AG146:AH146) -> 0 | AJ146: 1 | AK146: 0 | AL146: =1-SUM(AJ146:AK146) -> 0 | AM146: 0 | AN146: 1 | AO146: =1-SUM(AM146:AN146) -> 0 | AP146: 1 | AQ146: 0 | AR146: =1-SUM(AP146:AQ146) -> 0 | AS146: 0 | AT146: 1 | AU146: =1-SUM(AS146:AT146) -> 0 | AV146: 0 | AW146: 1 | AX146: =1-SUM(AV146:AW146) -> 0 | AY146: 0 | AZ146: 1 | BA146: =1-SUM(AY146:AZ146) -> 0 | BB146: 0 | BC146: 1 | BD146: =1-SUM(BB146:BC146) -> 0 | BE146: 0 | BF146: 1 | BG146: =1-SUM(BE146:BF146) -> 0 | BH146: 0 | BI146: 1 | BJ146: =1-SUM(BH146:BI146) -> 0 | BK146: 0 | BL146: 1 | BM146: =1-SUM(BK146:BL146) -> 0 | BN146: 1 | BO146: =1-BN146 -> 0
O147: 0 | P147: 1 | Q147: =1-SUM(O147:P147) -> 0 | R147: 1 | S147: 0 | T147: =1-SUM(R147:S147) -> 0 | U147: 1 | V147: 0 | W147: =1-SUM(U147:V147) -> 0 | X147: 1 | Y147: 0 | Z147: =1-SUM(X147:Y147) -> 0 | AA147: 0 | AB147: 1 | AC147: =1-SUM(AA147:AB147) -> 0 | AD147: 0 | AE147: 1 | AF147: =1-SUM(AD147:AE147) -> 0 | AG147: 0 | AH147: 1 | AI147: =1-SUM(AG147:AH147) -> 0 | AJ147: 1 | AK147: 0 | AL147: =1-SUM(AJ147:AK147) -> 0 | AM147: 0 | AN147: 1 | AO147: =1-SUM(AM147:AN147) -> 0 | AP147: 1 | AQ147: 0 | AR147: =1-SUM(AP147:AQ147) -> 0 | AS147: 0 | AT147: 1 | AU147: =1-SUM(AS147:AT147) -> 0 | AV147: 0 | AW147: 1 | AX147: =1-SUM(AV147:AW147) -> 0 | AY147: 0 | AZ147: 1 | BA147: =1-SUM(AY147:AZ147) -> 0 | BB147: 0 | BC147: 1 | BD147: =1-SUM(BB147:BC147) -> 0 | BE147: 0 | BF147: 1 | BG147: =1-SUM(BE147:BF147) -> 0 | BH147: 0 | BI147: 1 | BJ147: =1-SUM(BH147:BI147) -> 0 | BK147: 0 | BL147: 1 | BM147: =1-SUM(BK147:BL147) -> 0 | BN147: 0 | BO147: =1-BN147 -> 1
O148: 0 | P148: 1 | Q148: =1-SUM(O148:P148) -> 0 | R148: 0 | S148: 1 | T148: =1-SUM(R148:S148) -> 0 | U148: 0 | V148: 1 | W148: =1-SUM(U148:V148) -> 0 | X148: 0 | Y148: 1 | Z148: =1-SUM(X148:Y148) -> 0 | AA148: 0 | AB148: 1 | AC148: =1-SUM(AA148:AB148) -> 0 | AD148: 0 | AE148: 1 | AF148: =1-SUM(AD148:AE148) -> 0 | AG148: 0 | AH148: 1 | AI148: =1-SUM(AG148:AH148) -> 0 | AJ148: 0 | AK148: 1 | AL148: =1-SUM(AJ148:AK148) -> 0 | AM148: 0 | AN148: 1 | AO148: =1-SUM(AM148:AN148) -> 0 | AP148: 0 | AQ148: 1 | AR148: =1-SUM(AP148:AQ148) -> 0 | AS148: 0 | AT148: 1 | AU148: =1-SUM(AS148:AT148) -> 0 | AV148: 0 | AW148: 1 | AX148: =1-SUM(AV148:AW148) -> 0 | AY148: 0 | AZ148: 1 | BA148: =1-SUM(AY148:AZ148) -> 0 | BB148: 0 | BC148: 1 | BD148: =1-SUM(BB148:BC148) -> 0 | BE148: 0 | BF148: 1 | BG148: =1-SUM(BE148:BF148) -> 0 | BH148: 0 | BI148: 1 | BJ148: =1-SUM(BH148:BI148) -> 0 | BK148: 0 | BL148: 1 | BM148: =1-SUM(BK148:BL148) -> 0 | BN148: 0 | BO148: =1-BN148 -> 1
O149: 0 | P149: 1 | Q149: =1-SUM(O149:P149) -> 0 | R149: 0 | S149: 1 | T149: =1-SUM(R149:S149) -> 0 | U149: 0 | V149: 1 | W149: =1-SUM(U149:V149) -> 0 | X149: 0 | Y149: 1 | Z149: =1-SUM(X149:Y149) -> 0 | AA149: 0 | AB149: 1 | AC149: =1-SUM(AA149:AB149) -> 0 | AD149: 0 | AE149: 1 | AF149: =1-SUM(AD149:AE149) -> 0 | AG149: 0 | AH149: 1 | AI149: =1-SUM(AG149:AH149) -> 0 | AJ149: 0 | AK149: 1 | AL149: =1-SUM(AJ149:AK149) -> 0 | AM149: 0 | AN149: 1 | AO149: =1-SUM(AM149:AN149) -> 0 | AP149: 1 | AQ149: 0 | AR149: =1-SUM(AP149:AQ149) -> 0 | AS149: 0 | AT149: 1 | AU149: =1-SUM(AS149:AT149) -> 0 | AV149: 0 | AW149: 1 | AX149: =1-SUM(AV149:AW149) -> 0 | AY149: 0 | AZ149: 1 | BA149: =1-SUM(AY149:AZ149) -> 0 | BB149: 0 | BC149: 1 | BD149: =1-SUM(BB149:BC149) -> 0 | BE149: 0 | BF149: 1 | BG149: =1-SUM(BE149:BF149) -> 0 | BH149: 0 | BI149: 1 | BJ149: =1-SUM(BH149:BI149) -> 0 | BK149: 0 | BL149: 1 | BM149: =1-SUM(BK149:BL149) -> 0 | BN149: 1 | BO149: =1-BN149 -> 0
O150: 1 | P150: 0 | Q150: =1-SUM(O150:P150) -> 0 | R150: 0 | S150: 1 | T150: =1-SUM(R150:S150) -> 0 | U150: 0 | V150: 1 | W150: =1-SUM(U150:V150) -> 0 | X150: 0 | Y150: 1 | Z150: =1-SUM(X150:Y150) -> 0 | AA150: 0 | AB150: 1 | AC150: =1-SUM(AA150:AB150) -> 0 | AD150: 0 | AE150: 1 | AF150: =1-SUM(AD150:AE150) -> 0 | AG150: 0 | AH150: 1 | AI150: =1-SUM(AG150:AH150) -> 0 | AJ150: 0 | AK150: 1 | AL150: =1-SUM(AJ150:AK150) -> 0 | AM150: 0 | AN150: 1 | AO150: =1-SUM(AM150:AN150) -> 0 | AP150: 1 | AQ150: 0 | AR150: =1-SUM(AP150:AQ150) -> 0 | AS150: 0 | AT150: 1 | AU150: =1-SUM(AS150:AT150) -> 0 | AV150: 0 | AW150: 1 | AX150: =1-SUM(AV150:AW150) -> 0 | AY150: 0 | AZ150: 1 | BA150: =1-SUM(AY150:AZ150) -> 0 | BB150: 0 | BC150: 1 | BD150: =1-SUM(BB150:BC150) -> 0 | BE150: 0 | BF150: 1 | BG150: =1-SUM(BE150:BF150) -> 0 | BH150: 0 | BI150: 1 | BJ150: =1-SUM(BH150:BI150) -> 0 | BK150: 0 | BL150: 1 | BM150: =1-SUM(BK150:BL150) -> 0 | BN150: 1 | BO150: =1-BN150 -> 0
O151: 1 | P151: 0 | Q151: =1-SUM(O151:P151) -> 0 | R151: 0 | S151: 1 | T151: =1-SUM(R151:S151) -> 0 | U151: 0 | V151: 1 | W151: =1-SUM(U151:V151) -> 0 | X151: 0 | Y151: 1 | Z151: =1-SUM(X151:Y151) -> 0 | AA151: 0 | AB151: 1 | AC151: =1-SUM(AA151:AB151) -> 0 | AD151: 0 | AE151: 1 | AF151: =1-SUM(AD151:AE151) -> 0 | AG151: 0 | AH151: 1 | AI151: =1-SUM(AG151:AH151) -> 0 | AJ151: 0 | AK151: 1 | AL151: =1-SUM(AJ151:AK151) -> 0 | AM151: 0 | AN151: 1 | AO151: =1-SUM(AM151:AN151) -> 0 | AP151: 0 | AQ151: 1 | AR151: =1-SUM(AP151:AQ151) -> 0 | AS151: 0 | AT151: 1 | AU151: =1-SUM(AS151:AT151) -> 0 | AV151: 0 | AW151: 1 | AX151: =1-SUM(AV151:AW151) -> 0 | AY151: 0 | AZ151: 1 | BA151: =1-SUM(AY151:AZ151) -> 0 | BB151: 0 | BC151: 1 | BD151: =1-SUM(BB151:BC151) -> 0 | BE151: 0 | BF151: 1 | BG151: =1-SUM(BE151:BF151) -> 0 | BH151: 0 | BI151: 1 | BJ151: =1-SUM(BH151:BI151) -> 0 | BK151: 0 | BL151: 1 | BM151: =1-SUM(BK151:BL151) -> 0 | BN151: 0 | BO151: =1-BN151 -> 1
O152: 0 | P152: 1 | Q152: =1-SUM(O152:P152) -> 0 | R152: 0 | S152: 1 | T152: =1-SUM(R152:S152) -> 0 | U152: 0 | V152: 1 | W152: =1-SUM(U152:V152) -> 0 | X152: 0 | Y152: 1 | Z152: =1-SUM(X152:Y152) -> 0 | AA152: 0 | AB152: 1 | AC152: =1-SUM(AA152:AB152) -> 0 | AD152: 0 | AE152: 1 | AF152: =1-SUM(AD152:AE152) -> 0 | AG152: 0 | AH152: 1 | AI152: =1-SUM(AG152:AH152) -> 0 | AJ152: 0 | AK152: 1 | AL152: =1-SUM(AJ152:AK152) -> 0 | AM152: 0 | AN152: 1 | AO152: =1-SUM(AM152:AN152) -> 0 | AP152: 1 | AQ152: 0 | AR152: =1-SUM(AP152:AQ152) -> 0 | AS152: 0 | AT152: 1 | AU152: =1-SUM(AS152:AT152) -> 0 | AV152: 0 | AW152: 1 | AX152: =1-SUM(AV152:AW152) -> 0 | AY152: 0 | AZ152: 1 | BA152: =1-SUM(AY152:AZ152) -> 0 | BB152: 0 | BC152: 1 | BD152: =1-SUM(BB152:BC152) -> 0 | BE152: 0 | BF152: 1 | BG152: =1-SUM(BE152:BF152) -> 0 | BH152: 0 | BI152: 1 | BJ152: =1-SUM(BH152:BI152) -> 0 | BK152: 0 | BL152: 1 | BM152: =1-SUM(BK152:BL152) -> 0 | BN152: 1 | BO152: =1-BN152 -> 0
O153: 0 | P153: 1 | Q153: =1-SUM(O153:P153) -> 0 | R153: 1 | S153: 0 | T153: =1-SUM(R153:S153) -> 0 | U153: 1 | V153: 0 | W153: =1-SUM(U153:V153) -> 0 | X153: 1 | Y153: 0 | Z153: =1-SUM(X153:Y153) -> 0 | AA153: 1 | AB153: 0 | AC153: =1-SUM(AA153:AB153) -> 0 | AD153: 1 | AE153: 0 | AF153: =1-SUM(AD153:AE153) -> 0 | AG153: 0 | AH153: 1 | AI153: =1-SUM(AG153:AH153) -> 0 | AJ153: 1 | AK153: 0 | AL153: =1-SUM(AJ153:AK153) -> 0 | AM153: 1 | AN153: 0 | AO153: =1-SUM(AM153:AN153) -> 0 | AP153: 0 | AQ153: 1 | AR153: =1-SUM(AP153:AQ153) -> 0 | AS153: 1 | AT153: 0 | AU153: =1-SUM(AS153:AT153) -> 0 | AV153: 1 | AW153: 0 | AX153: =1-SUM(AV153:AW153) -> 0 | AY153: 0 | AZ153: 1 | BA153: =1-SUM(AY153:AZ153) -> 0 | BB153: 0 | BC153: 1 | BD153: =1-SUM(BB153:BC153) -> 0 | BE153: 0 | BF153: 1 | BG153: =1-SUM(BE153:BF153) -> 0 | BH153: 0 | BI153: 1 | BJ153: =1-SUM(BH153:BI153) -> 0 | BK153: 0 | BL153: 1 | BM153: =1-SUM(BK153:BL153) -> 0 | BN153: 1 | BO153: =1-BN153 -> 0
O154: 1 | P154: 0 | Q154: =1-SUM(O154:P154) -> 0 | R154: 1 | S154: 0 | T154: =1-SUM(R154:S154) -> 0 | U154: 1 | V154: 0 | W154: =1-SUM(U154:V154) -> 0 | X154: 1 | Y154: 0 | Z154: =1-SUM(X154:Y154) -> 0 | AA154: 1 | AB154: 0 | AC154: =1-SUM(AA154:AB154) -> 0 | AD154: 0 | AE154: 1 | AF154: =1-SUM(AD154:AE154) -> 0 | AG154: 0 | AH154: 1 | AI154: =1-SUM(AG154:AH154) -> 0 | AJ154: 0 | AK154: 1 | AL154: =1-SUM(AJ154:AK154) -> 0 | AM154: 0 | AN154: 1 | AO154: =1-SUM(AM154:AN154) -> 0 | AP154: 0 | AQ154: 1 | AR154: =1-SUM(AP154:AQ154) -> 0 | AS154: 0 | AT154: 1 | AU154: =1-SUM(AS154:AT154) -> 0 | AV154: 1 | AW154: 0 | AX154: =1-SUM(AV154:AW154) -> 0 | AY154: 0 | AZ154: 1 | BA154: =1-SUM(AY154:AZ154) -> 0 | BB154: 0 | BC154: 1 | BD154: =1-SUM(BB154:BC154) -> 0 | BE154: 1 | BF154: 0 | BG154: =1-SUM(BE154:BF154) -> 0 | BH154: 0 | BI154: 1 | BJ154: =1-SUM(BH154:BI154) -> 0 | BK154: 1 | BL154: 0 | BM154: =1-SUM(BK154:BL154) -> 0 | BN154: 1 | BO154: =1-BN154 -> 0
O155: 1 | P155: 0 | Q155: =1-SUM(O155:P155) -> 0 | R155: 1 | S155: 0 | T155: =1-SUM(R155:S155) -> 0 | U155: 1 | V155: 0 | W155: =1-SUM(U155:V155) -> 0 | X155: 1 | Y155: 0 | Z155: =1-SUM(X155:Y155) -> 0 | AA155: 0 | AB155: 1 | AC155: =1-SUM(AA155:AB155) -> 0 | AD155: 0 | AE155: 1 | AF155: =1-SUM(AD155:AE155) -> 0 | AG155: 0 | AH155: 1 | AI155: =1-SUM(AG155:AH155) -> 0 | AJ155: 1 | AK155: 0 | AL155: =1-SUM(AJ155:AK155) -> 0 | AM155: 0 | AN155: 1 | AO155: =1-SUM(AM155:AN155) -> 0 | AP155: 0 | AQ155: 1 | AR155: =1-SUM(AP155:AQ155) -> 0 | AS155: 0 | AT155: 1 | AU155: =1-SUM(AS155:AT155) -> 0 | AV155: 0 | AW155: 1 | AX155: =1-SUM(AV155:AW155) -> 0 | AY155: 0 | AZ155: 1 | BA155: =1-SUM(AY155:AZ155) -> 0 | BB155: 0 | BC155: 1 | BD155: =1-SUM(BB155:BC155) -> 0 | BE155: 0 | BF155: 1 | BG155: =1-SUM(BE155:BF155) -> 0 | BH155: 0 | BI155: 1 | BJ155: =1-SUM(BH155:BI155) -> 0 | BK155: 0 | BL155: 1 | BM155: =1-SUM(BK155:BL155) -> 0 | BN155: 1 | BO155: =1-BN155 -> 0
O156: 1 | P156: 0 | Q156: =1-SUM(O156:P156) -> 0 | R156: 0 | S156: 1 | T156: =1-SUM(R156:S156) -> 0 | U156: 0 | V156: 1 | W156: =1-SUM(U156:V156) -> 0 | X156: 0 | Y156: 1 | Z156: =1-SUM(X156:Y156) -> 0 | AA156: 1 | AB156: 0 | AC156: =1-SUM(AA156:AB156) -> 0 | AD156: 0 | AE156: 1 | AF156: =1-SUM(AD156:AE156) -> 0 | AG156: 0 | AH156: 1 | AI156: =1-SUM(AG156:AH156) -> 0 | AJ156: 1 | AK156: 0 | AL156: =1-SUM(AJ156:AK156) -> 0 | AM156: 0 | AN156: 1 | AO156: =1-SUM(AM156:AN156) -> 0 | AP156: 0 | AQ156: 1 | AR156: =1-SUM(AP156:AQ156) -> 0 | AS156: 1 | AT156: 0 | AU156: =1-SUM(AS156:AT156) -> 0 | AV156: 1 | AW156: 0 | AX156: =1-SUM(AV156:AW156) -> 0 | AY156: 1 | AZ156: 0 | BA156: =1-SUM(AY156:AZ156) -> 0 | BB156: 1 | BC156: 0 | BD156: =1-SUM(BB156:BC156) -> 0 | BE156: 1 | BF156: 0 | BG156: =1-SUM(BE156:BF156) -> 0 | BH156: 0 | BI156: 1 | BJ156: =1-SUM(BH156:BI156) -> 0 | BK156: 0 | BL156: 1 | BM156: =1-SUM(BK156:BL156) -> 0 | BN156: 1 | BO156: =1-BN156 -> 0
O157: 1 | P157: 0 | Q157: =1-SUM(O157:P157) -> 0 | R157: 1 | S157: 0 | T157: =1-SUM(R157:S157) -> 0 | U157: 1 | V157: 0 | W157: =1-SUM(U157:V157) -> 0 | X157: 1 | Y157: 0 | Z157: =1-SUM(X157:Y157) -> 0 | AA157: 0 | AB157: 1 | AC157: =1-SUM(AA157:AB157) -> 0 | AD157: 0 | AE157: 1 | AF157: =1-SUM(AD157:AE157) -> 0 | AG157: 0 | AH157: 1 | AI157: =1-SUM(AG157:AH157) -> 0 | AJ157: 1 | AK157: 0 | AL157: =1-SUM(AJ157:AK157) -> 0 | AM157: 0 | AN157: 1 | AO157: =1-SUM(AM157:AN157) -> 0 | AP157: 0 | AQ157: 1 | AR157: =1-SUM(AP157:AQ157) -> 0 | AS157: 0 | AT157: 1 | AU157: =1-SUM(AS157:AT157) -> 0 | AV157: 1 | AW157: 0 | AX157: =1-SUM(AV157:AW157) -> 0 | AY157: 1 | AZ157: 0 | BA157: =1-SUM(AY157:AZ157) -> 0 | BB157: 0 | BC157: 1 | BD157: =1-SUM(BB157:BC157) -> 0 | BE157: 0 | BF157: 1 | BG157: =1-SUM(BE157:BF157) -> 0 | BH157: 0 | BI157: 1 | BJ157: =1-SUM(BH157:BI157) -> 0 | BK157: 0 | BL157: 1 | BM157: =1-SUM(BK157:BL157) -> 0 | BN157: 1 | BO157: =1-BN157 -> 0
O158: 1 | P158: 0 | Q158: =1-SUM(O158:P158) -> 0 | R158: 0 | S158: 1 | T158: =1-SUM(R158:S158) -> 0 | U158: 0 | V158: 1 | W158: =1-SUM(U158:V158) -> 0 | X158: 0 | Y158: 1 | Z158: =1-SUM(X158:Y158) -> 0 | AA158: 1 | AB158: 0 | AC158: =1-SUM(AA158:AB158) -> 0 | AD158: 0 | AE158: 1 | AF158: =1-SUM(AD158:AE158) -> 0 | AG158: 0 | AH158: 1 | AI158: =1-SUM(AG158:AH158) -> 0 | AJ158: 1 | AK158: 0 | AL158: =1-SUM(AJ158:AK158) -> 0 | AM158: 0 | AN158: 1 | AO158: =1-SUM(AM158:AN158) -> 0 | AP158: 0 | AQ158: 1 | AR158: =1-SUM(AP158:AQ158) -> 0 | AS158: 1 | AT158: 0 | AU158: =1-SUM(AS158:AT158) -> 0 | AV158: 1 | AW158: 0 | AX158: =1-SUM(AV158:AW158) -> 0 | AY158: 1 | AZ158: 0 | BA158: =1-SUM(AY158:AZ158) -> 0 | BB158: 1 | BC158: 0 | BD158: =1-SUM(BB158:BC158) -> 0 | BE158: 1 | BF158: 0 | BG158: =1-SUM(BE158:BF158) -> 0 | BH158: 0 | BI158: 1 | BJ158: =1-SUM(BH158:BI158) -> 0 | BK158: 0 | BL158: 1 | BM158: =1-SUM(BK158:BL158) -> 0 | BN158: 0 | BO158: =1-BN158 -> 1
O159: 1 | P159: 0 | Q159: =1-SUM(O159:P159) -> 0 | R159: 0 | S159: 1 | T159: =1-SUM(R159:S159) -> 0 | U159: 0 | V159: 1 | W159: =1-SUM(U159:V159) -> 0 | X159: 0 | Y159: 1 | Z159: =1-SUM(X159:Y159) -> 0 | AA159: 1 | AB159: 0 | AC159: =1-SUM(AA159:AB159) -> 0 | AD159: 0 | AE159: 1 | AF159: =1-SUM(AD159:AE159) -> 0 | AG159: 0 | AH159: 1 | AI159: =1-SUM(AG159:AH159) -> 0 | AJ159: 1 | AK159: 0 | AL159: =1-SUM(AJ159:AK159) -> 0 | AM159: 0 | AN159: 1 | AO159: =1-SUM(AM159:AN159) -> 0 | AP159: 0 | AQ159: 1 | AR159: =1-SUM(AP159:AQ159) -> 0 | AS159: 1 | AT159: 0 | AU159: =1-SUM(AS159:AT159) -> 0 | AV159: 1 | AW159: 0 | AX159: =1-SUM(AV159:AW159) -> 0 | AY159: 1 | AZ159: 0 | BA159: =1-SUM(AY159:AZ159) -> 0 | BB159: 1 | BC159: 0 | BD159: =1-SUM(BB159:BC159) -> 0 | BE159: 1 | BF159: 0 | BG159: =1-SUM(BE159:BF159) -> 0 | BH159: 0 | BI159: 1 | BJ159: =1-SUM(BH159:BI159) -> 0 | BK159: 0 | BL159: 1 | BM159: =1-SUM(BK159:BL159) -> 0 | BN159: 1 | BO159: =1-BN159 -> 0
O160: 1 | P160: 0 | Q160: =1-SUM(O160:P160) -> 0 | R160: 1 | S160: 0 | T160: =1-SUM(R160:S160) -> 0 | U160: 1 | V160: 0 | W160: =1-SUM(U160:V160) -> 0 | X160: 1 | Y160: 0 | Z160: =1-SUM(X160:Y160) -> 0 | AA160: 1 | AB160: 0 | AC160: =1-SUM(AA160:AB160) -> 0 | AD160: 0 | AE160: 1 | AF160: =1-SUM(AD160:AE160) -> 0 | AG160: 0 | AH160: 1 | AI160: =1-SUM(AG160:AH160) -> 0 | AJ160: 1 | AK160: 0 | AL160: =1-SUM(AJ160:AK160) -> 0 | AM160: 0 | AN160: 1 | AO160: =1-SUM(AM160:AN160) -> 0 | AP160: 0 | AQ160: 1 | AR160: =1-SUM(AP160:AQ160) -> 0 | AS160: 1 | AT160: 0 | AU160: =1-SUM(AS160:AT160) -> 0 | AV160: 1 | AW160: 0 | AX160: =1-SUM(AV160:AW160) -> 0 | AY160: 0 | AZ160: 1 | BA160: =1-SUM(AY160:AZ160) -> 0 | BB160: 0 | BC160: 1 | BD160: =1-SUM(BB160:BC160) -> 0 | BE160: 0 | BF160: 1 | BG160: =1-SUM(BE160:BF160) -> 0 | BH160: 0 | BI160: 1 | BJ160: =1-SUM(BH160:BI160) -> 0 | BK160: 0 | BL160: 1 | BM160: =1-SUM(BK160:BL160) -> 0 | BN160: 1 | BO160: =1-BN160 -> 0
O161: 1 | P161: 0 | Q161: =1-SUM(O161:P161) -> 0 | R161: 0 | S161: 1 | T161: =1-SUM(R161:S161) -> 0 | U161: 0 | V161: 1 | W161: =1-SUM(U161:V161) -> 0 | X161: 0 | Y161: 1 | Z161: =1-SUM(X161:Y161) -> 0 | AA161: 1 | AB161: 0 | AC161: =1-SUM(AA161:AB161) -> 0 | AD161: 0 | AE161: 1 | AF161: =1-SUM(AD161:AE161) -> 0 | AG161: 0 | AH161: 1 | AI161: =1-SUM(AG161:AH161) -> 0 | AJ161: 1 | AK161: 0 | AL161: =1-SUM(AJ161:AK161) -> 0 | AM161: 1 | AN161: 0 | AO161: =1-SUM(AM161:AN161) -> 0 | AP161: 0 | AQ161: 1 | AR161: =1-SUM(AP161:AQ161) -> 0 | AS161: 0 | AT161: 1 | AU161: =1-SUM(AS161:AT161) -> 0 | AV161: 0 | AW161: 1 | AX161: =1-SUM(AV161:AW161) -> 0 | AY161: 0 | AZ161: 1 | BA161: =1-SUM(AY161:AZ161) -> 0 | BB161: 1 | BC161: 0 | BD161: =1-SUM(BB161:BC161) -> 0 | BE161: 1 | BF161: 0 | BG161: =1-SUM(BE161:BF161) -> 0 | BH161: 0 | BI161: 1 | BJ161: =1-SUM(BH161:BI161) -> 0 | BK161: 0 | BL161: 1 | BM161: =1-SUM(BK161:BL161) -> 0 | BN161: 0 | BO161: =1-BN161 -> 1
O162: 1 | P162: 0 | Q162: =1-SUM(O162:P162) -> 0 | R162: 1 | S162: 0 | T162: =1-SUM(R162:S162) -> 0 | U162: 1 | V162: 0 | W162: =1-SUM(U162:V162) -> 0 | X162: 0 | Y162: 1 | Z162: =1-SUM(X162:Y162) -> 0 | AA162: 1 | AB162: 0 | AC162: =1-SUM(AA162:AB162) -> 0 | AD162: 0 | AE162: 1 | AF162: =1-SUM(AD162:AE162) -> 0 | AG162: 0 | AH162: 1 | AI162: =1-SUM(AG162:AH162) -> 0 | AJ162: 1 | AK162: 0 | AL162: =1-SUM(AJ162:AK162) -> 0 | AM162: 0 | AN162: 1 | AO162: =1-SUM(AM162:AN162) -> 0 | AP162: 0 | AQ162: 1 | AR162: =1-SUM(AP162:AQ162) -> 0 | AS162: 0 | AT162: 1 | AU162: =1-SUM(AS162:AT162) -> 0 | AV162: 1 | AW162: 0 | AX162: =1-SUM(AV162:AW162) -> 0 | AY162: 0 | AZ162: 1 | BA162: =1-SUM(AY162:AZ162) -> 0 | BB162: 0 | BC162: 1 | BD162: =1-SUM(BB162:BC162) -> 0 | BE162: 1 | BF162: 0 | BG162: =1-SUM(BE162:BF162) -> 0 | BH162: 0 | BI162: 1 | BJ162: =1-SUM(BH162:BI162) -> 0 | BK162: 0 | BL162: 1 | BM162: =1-SUM(BK162:BL162) -> 0 | BN162: 1 | BO162: =1-BN162 -> 0
O163: 1 | P163: 0 | Q163: =1-SUM(O163:P163) -> 0 | R163: 1 | S163: 0 | T163: =1-SUM(R163:S163) -> 0 | U163: 1 | V163: 0 | W163: =1-SUM(U163:V163) -> 0 | X163: 1 | Y163: 0 | Z163: =1-SUM(X163:Y163) -> 0 | AA163: 1 | AB163: 0 | AC163: =1-SUM(AA163:AB163) -> 0 | AD163: 0 | AE163: 1 | AF163: =1-SUM(AD163:AE163) -> 0 | AG163: 0 | AH163: 1 | AI163: =1-SUM(AG163:AH163) -> 0 | AJ163: 1 | AK163: 0 | AL163: =1-SUM(AJ163:AK163) -> 0 | AM163: 0 | AN163: 1 | AO163: =1-SUM(AM163:AN163) -> 0 | AP163: 0 | AQ163: 1 | AR163: =1-SUM(AP163:AQ163) -> 0 | AS163: 0 | AT163: 1 | AU163: =1-SUM(AS163:AT163) -> 0 | AV163: 1 | AW163: 0 | AX163: =1-SUM(AV163:AW163) -> 0 | AY163: 0 | AZ163: 1 | BA163: =1-SUM(AY163:AZ163) -> 0 | BB163: 0 | BC163: 1 | BD163: =1-SUM(BB163:BC163) -> 0 | BE163: 0 | BF163: 1 | BG163: =1-SUM(BE163:BF163) -> 0 | BH163: 0 | BI163: 1 | BJ163: =1-SUM(BH163:BI163) -> 0 | BK163: 0 | BL163: 1 | BM163: =1-SUM(BK163:BL163) -> 0 | BN163: 1 | BO163: =1-BN163 -> 0
O164: 1 | P164: 0 | Q164: =1-SUM(O164:P164) -> 0 | R164: 1 | S164: 0 | T164: =1-SUM(R164:S164) -> 0 | U164: 1 | V164: 0 | W164: =1-SUM(U164:V164) -> 0 | X164: 1 | Y164: 0 | Z164: =1-SUM(X164:Y164) -> 0 | AA164: 1 | AB164: 0 | AC164: =1-SUM(AA164:AB164) -> 0 | AD164: 0 | AE164: 1 | AF164: =1-SUM(AD164:AE164) -> 0 | AG164: 0 | AH164: 1 | AI164: =1-SUM(AG164:AH164) -> 0 | AJ164: 1 | AK164: 0 | AL164: =1-SUM(AJ164:AK164) -> 0 | AM164: 0 | AN164: 1 | AO164: =1-SUM(AM164:AN164) -> 0 | AP164: 0 | AQ164: 1 | AR164: =1-SUM(AP164:AQ164) -> 0 | AS164: 0 | AT164: 1 | AU164: =1-SUM(AS164:AT164) -> 0 | AV164: 1 | AW164: 0 | AX164: =1-SUM(AV164:AW164) -> 0 | AY164: 0 | AZ164: 1 | BA164: =1-SUM(AY164:AZ164) -> 0 | BB164: 0 | BC164: 1 | BD164: =1-SUM(BB164:BC164) -> 0 | BE164: 0 | BF164: 1 | BG164: =1-SUM(BE164:BF164) -> 0 | BH164: 0 | BI164: 1 | BJ164: =1-SUM(BH164:BI164) -> 0 | BK164: 0 | BL164: 1 | BM164: =1-SUM(BK164:BL164) -> 0 | BN164: 1 | BO164: =1-BN164 -> 0
O165: 1 | P165: 0 | Q165: =1-SUM(O165:P165) -> 0 | R165: 0 | S165: 1 | T165: =1-SUM(R165:S165) -> 0 | U165: 0 | V165: 1 | W165: =1-SUM(U165:V165) -> 0 | X165: 0 | Y165: 1 | Z165: =1-SUM(X165:Y165) -> 0 | AA165: 1 | AB165: 0 | AC165: =1-SUM(AA165:AB165) -> 0 | AD165: 0 | AE165: 1 | AF165: =1-SUM(AD165:AE165) -> 0 | AG165: 0 | AH165: 1 | AI165: =1-SUM(AG165:AH165) -> 0 | AJ165: 1 | AK165: 0 | AL165: =1-SUM(AJ165:AK165) -> 0 | AM165: 0 | AN165: 1 | AO165: =1-SUM(AM165:AN165) -> 0 | AP165: 0 | AQ165: 1 | AR165: =1-SUM(AP165:AQ165) -> 0 | AS165: 1 | AT165: 0 | AU165: =1-SUM(AS165:AT165) -> 0 | AV165: 1 | AW165: 0 | AX165: =1-SUM(AV165:AW165) -> 0 | AY165: 1 | AZ165: 0 | BA165: =1-SUM(AY165:AZ165) -> 0 | BB165: 1 | BC165: 0 | BD165: =1-SUM(BB165:BC165) -> 0 | BE165: 1 | BF165: 0 | BG165: =1-SUM(BE165:BF165) -> 0 | BH165: 0 | BI165: 1 | BJ165: =1-SUM(BH165:BI165) -> 0 | BK165: 0 | BL165: 1 | BM165: =1-SUM(BK165:BL165) -> 0 | BN165: 1 | BO165: =1-BN165 -> 0
O166: 1 | P166: 0 | Q166: =1-SUM(O166:P166) -> 0 | R166: 0 | S166: 1 | T166: =1-SUM(R166:S166) -> 0 | U166: 0 | V166: 1 | W166: =1-SUM(U166:V166) -> 0 | X166: 0 | Y166: 1 | Z166: =1-SUM(X166:Y166) -> 0 | AA166: 0 | AB166: 1 | AC166: =1-SUM(AA166:AB166) -> 0 | AD166: 0 | AE166: 1 | AF166: =1-SUM(AD166:AE166) -> 0 | AG166: 0 | AH166: 1 | AI166: =1-SUM(AG166:AH166) -> 0 | AJ166: 1 | AK166: 0 | AL166: =1-SUM(AJ166:AK166) -> 0 | AM166: 0 | AN166: 1 | AO166: =1-SUM(AM166:AN166) -> 0 | AP166: 0 | AQ166: 1 | AR166: =1-SUM(AP166:AQ166) -> 0 | AS166: 0 | AT166: 1 | AU166: =1-SUM(AS166:AT166) -> 0 | AV166: 0 | AW166: 1 | AX166: =1-SUM(AV166:AW166) -> 0 | AY166: 0 | AZ166: 1 | BA166: =1-SUM(AY166:AZ166) -> 0 | BB166: 0 | BC166: 1 | BD166: =1-SUM(BB166:BC166) -> 0 | BE166: 0 | BF166: 1 | BG166: =1-SUM(BE166:BF166) -> 0 | BH166: 0 | BI166: 1 | BJ166: =1-SUM(BH166:BI166) -> 0 | BK166: 1 | BL166: 0 | BM166: =1-SUM(BK166:BL166) -> 0 | BN166: 1 | BO166: =1-BN166 -> 0
O167: 1 | P167: 0 | Q167: =1-SUM(O167:P167) -> 0 | R167: 0 | S167: 1 | T167: =1-SUM(R167:S167) -> 0 | U167: 0 | V167: 1 | W167: =1-SUM(U167:V167) -> 0 | X167: 0 | Y167: 1 | Z167: =1-SUM(X167:Y167) -> 0 | AA167: 0 | AB167: 1 | AC167: =1-SUM(AA167:AB167) -> 0 | AD167: 0 | AE167: 1 | AF167: =1-SUM(AD167:AE167) -> 0 | AG167: 0 | AH167: 1 | AI167: =1-SUM(AG167:AH167) -> 0 | AJ167: 1 | AK167: 0 | AL167: =1-SUM(AJ167:AK167) -> 0 | AM167: 0 | AN167: 1 | AO167: =1-SUM(AM167:AN167) -> 0 | AP167: 0 | AQ167: 1 | AR167: =1-SUM(AP167:AQ167) -> 0 | AS167: 0 | AT167: 1 | AU167: =1-SUM(AS167:AT167) -> 0 | AV167: 0 | AW167: 1 | AX167: =1-SUM(AV167:AW167) -> 0 | AY167: 0 | AZ167: 1 | BA167: =1-SUM(AY167:AZ167) -> 0 | BB167: 0 | BC167: 1 | BD167: =1-SUM(BB167:BC167) -> 0 | BE167: 0 | BF167: 1 | BG167: =1-SUM(BE167:BF167) -> 0 | BH167: 0 | BI167: 1 | BJ167: =1-SUM(BH167:BI167) -> 0 | BK167: 1 | BL167: 0 | BM167: =1-SUM(BK167:BL167) -> 0 | BN167: 1 | BO167: =1-BN167 -> 0
O168: 1 | P168: 0 | Q168: =1-SUM(O168:P168) -> 0 | R168: 1 | S168: 0 | T168: =1-SUM(R168:S168) -> 0 | U168: 1 | V168: 0 | W168: =1-SUM(U168:V168) -> 0 | X168: 1 | Y168: 0 | Z168: =1-SUM(X168:Y168) -> 0 | AA168: 1 | AB168: 0 | AC168: =1-SUM(AA168:AB168) -> 0 | AD168: 0 | AE168: 1 | AF168: =1-SUM(AD168:AE168) -> 0 | AG168: 0 | AH168: 1 | AI168: =1-SUM(AG168:AH168) -> 0 | AJ168: 1 | AK168: 0 | AL168: =1-SUM(AJ168:AK168) -> 0 | AM168: 0 | AN168: 1 | AO168: =1-SUM(AM168:AN168) -> 0 | AP168: 0 | AQ168: 1 | AR168: =1-SUM(AP168:AQ168) -> 0 | AS168: 0 | AT168: 1 | AU168: =1-SUM(AS168:AT168) -> 0 | AV168: 1 | AW168: 0 | AX168: =1-SUM(AV168:AW168) -> 0 | AY168: 1 | AZ168: 0 | BA168: =1-SUM(AY168:AZ168) -> 0 | BB168: 0 | BC168: 1 | BD168: =1-SUM(BB168:BC168) -> 0 | BE168: 0 | BF168: 1 | BG168: =1-SUM(BE168:BF168) -> 0 | BH168: 0 | BI168: 1 | BJ168: =1-SUM(BH168:BI168) -> 0 | BK168: 0 | BL168: 1 | BM168: =1-SUM(BK168:BL168) -> 0 | BN168: 1 | BO168: =1-BN168 -> 0
O169: 0 | P169: 1 | Q169: =1-SUM(O169:P169) -> 0 | R169: 0 | S169: 1 | T169: =1-SUM(R169:S169) -> 0 | U169: 0 | V169: 1 | W169: =1-SUM(U169:V169) -> 0 | X169: 0 | Y169: 1 | Z169: =1-SUM(X169:Y169) -> 0 | AA169: 0 | AB169: 1 | AC169: =1-SUM(AA169:AB169) -> 0 | AD169: 1 | AE169: 0 | AF169: =1-SUM(AD169:AE169) -> 0 | AG169: 1 | AH169: 0 | AI169: =1-SUM(AG169:AH169) -> 0 | AJ169: 1 | AK169: 0 | AL169: =1-SUM(AJ169:AK169) -> 0 | AM169: 1 | AN169: 0 | AO169: =1-SUM(AM169:AN169) -> 0 | AP169: 0 | AQ169: 1 | AR169: =1-SUM(AP169:AQ169) -> 0 | AS169: 1 | AT169: 0 | AU169: =1-SUM(AS169:AT169) -> 0 | AV169: 1 | AW169: 0 | AX169: =1-SUM(AV169:AW169) -> 0 | AY169: 1 | AZ169: 0 | BA169: =1-SUM(AY169:AZ169) -> 0 | BB169: 1 | BC169: 0 | BD169: =1-SUM(BB169:BC169) -> 0 | BE169: 1 | BF169: 0 | BG169: =1-SUM(BE169:BF169) -> 0 | BH169: 0 | BI169: 1 | BJ169: =1-SUM(BH169:BI169) -> 0 | BK169: 0 | BL169: 1 | BM169: =1-SUM(BK169:BL169) -> 0 | BN169: 1 | BO169: =1-BN169 -> 0
O170: 1 | P170: 0 | Q170: =1-SUM(O170:P170) -> 0 | R170: 1 | S170: 0 | T170: =1-SUM(R170:S170) -> 0 | U170: 1 | V170: 0 | W170: =1-SUM(U170:V170) -> 0 | X170: 1 | Y170: 0 | Z170: =1-SUM(X170:Y170) -> 0 | AA170: 0 | AB170: 1 | AC170: =1-SUM(AA170:AB170) -> 0 | AD170: 0 | AE170: 1 | AF170: =1-SUM(AD170:AE170) -> 0 | AG170: 0 | AH170: 1 | AI170: =1-SUM(AG170:AH170) -> 0 | AJ170: 0 | AK170: 1 | AL170: =1-SUM(AJ170:AK170) -> 0 | AM170: 0 | AN170: 1 | AO170: =1-SUM(AM170:AN170) -> 0 | AP170: 1 | AQ170: 0 | AR170: =1-SUM(AP170:AQ170) -> 0 | AS170: 0 | AT170: 1 | AU170: =1-SUM(AS170:AT170) -> 0 | AV170: 0 | AW170: 1 | AX170: =1-SUM(AV170:AW170) -> 0 | AY170: 0 | AZ170: 1 | BA170: =1-SUM(AY170:AZ170) -> 0 | BB170: 0 | BC170: 1 | BD170: =1-SUM(BB170:BC170) -> 0 | BE170: 0 | BF170: 1 | BG170: =1-SUM(BE170:BF170) -> 0 | BH170: 0 | BI170: 1 | BJ170: =1-SUM(BH170:BI170) -> 0 | BK170: 0 | BL170: 1 | BM170: =1-SUM(BK170:BL170) -> 0 | BN170: 1 | BO170: =1-BN170 -> 0
O171: 1 | P171: 0 | Q171: =1-SUM(O171:P171) -> 0 | R171: 0 | S171: 1 | T171: =1-SUM(R171:S171) -> 0 | U171: 0 | V171: 1 | W171: =1-SUM(U171:V171) -> 0 | X171: 0 | Y171: 1 | Z171: =1-SUM(X171:Y171) -> 0 | AA171: 0 | AB171: 1 | AC171: =1-SUM(AA171:AB171) -> 0 | AD171: 0 | AE171: 1 | AF171: =1-SUM(AD171:AE171) -> 0 | AG171: 0 | AH171: 1 | AI171: =1-SUM(AG171:AH171) -> 0 | AJ171: 1 | AK171: 0 | AL171: =1-SUM(AJ171:AK171) -> 0 | AM171: 1 | AN171: 0 | AO171: =1-SUM(AM171:AN171) -> 0 | AP171: 1 | AQ171: 0 | AR171: =1-SUM(AP171:AQ171) -> 0 | AS171: 0 | AT171: 1 | AU171: =1-SUM(AS171:AT171) -> 0 | AV171: 0 | AW171: 1 | AX171: =1-SUM(AV171:AW171) -> 0 | AY171: 0 | AZ171: 1 | BA171: =1-SUM(AY171:AZ171) -> 0 | BB171: 0 | BC171: 1 | BD171: =1-SUM(BB171:BC171) -> 0 | BE171: 0 | BF171: 1 | BG171: =1-SUM(BE171:BF171) -> 0 | BH171: 0 | BI171: 1 | BJ171: =1-SUM(BH171:BI171) -> 0 | BK171: 0 | BL171: 1 | BM171: =1-SUM(BK171:BL171) -> 0 | BN171: 1 | BO171: =1-BN171 -> 0
O172: 1 | P172: 0 | Q172: =1-SUM(O172:P172) -> 0 | R172: 1 | S172: 0 | T172: =1-SUM(R172:S172) -> 0 | U172: 1 | V172: 0 | W172: =1-SUM(U172:V172) -> 0 | X172: 0 | Y172: 1 | Z172: =1-SUM(X172:Y172) -> 0 | AA172: 0 | AB172: 1 | AC172: =1-SUM(AA172:AB172) -> 0 | AD172: 1 | AE172: 0 | AF172: =1-SUM(AD172:AE172) -> 0 | AG172: 1 | AH172: 0 | AI172: =1-SUM(AG172:AH172) -> 0 | AJ172: 1 | AK172: 0 | AL172: =1-SUM(AJ172:AK172) -> 0 | AM172: 0 | AN172: 1 | AO172: =1-SUM(AM172:AN172) -> 0 | AP172: 0 | AQ172: 1 | AR172: =1-SUM(AP172:AQ172) -> 0 | AS172: 1 | AT172: 0 | AU172: =1-SUM(AS172:AT172) -> 0 | AV172: 1 | AW172: 0 | AX172: =1-SUM(AV172:AW172) -> 0 | AY172: 1 | AZ172: 0 | BA172: =1-SUM(AY172:AZ172) -> 0 | BB172: 0 | BC172: 1 | BD172: =1-SUM(BB172:BC172) -> 0 | BE172: 0 | BF172: 1 | BG172: =1-SUM(BE172:BF172) -> 0 | BH172: 1 | BI172: 0 | BJ172: =1-SUM(BH172:BI172) -> 0 | BK172: 0 | BL172: 1 | BM172: =1-SUM(BK172:BL172) -> 0 | BN172: 1 | BO172: =1-BN172 -> 0
O173: 1 | P173: 0 | Q173: =1-SUM(O173:P173) -> 0 | R173: 0 | S173: 1 | T173: =1-SUM(R173:S173) -> 0 | U173: 0 | V173: 1 | W173: =1-SUM(U173:V173) -> 0 | X173: 0 | Y173: 1 | Z173: =1-SUM(X173:Y173) -> 0 | AA173: 0 | AB173: 1 | AC173: =1-SUM(AA173:AB173) -> 0 | AD173: 1 | AE173: 0 | AF173: =1-SUM(AD173:AE173) -> 0 | AG173: 1 | AH173: 0 | AI173: =1-SUM(AG173:AH173) -> 0 | AJ173: 1 | AK173: 0 | AL173: =1-SUM(AJ173:AK173) -> 0 | AM173: 0 | AN173: 1 | AO173: =1-SUM(AM173:AN173) -> 0 | AP173: 0 | AQ173: 1 | AR173: =1-SUM(AP173:AQ173) -> 0 | AS173: 1 | AT173: 0 | AU173: =1-SUM(AS173:AT173) -> 0 | AV173: 1 | AW173: 0 | AX173: =1-SUM(AV173:AW173) -> 0 | AY173: 1 | AZ173: 0 | BA173: =1-SUM(AY173:AZ173) -> 0 | BB173: 0 | BC173: 1 | BD173: =1-SUM(BB173:BC173) -> 0 | BE173: 1 | BF173: 0 | BG173: =1-SUM(BE173:BF173) -> 0 | BH173: 1 | BI173: 0 | BJ173: =1-SUM(BH173:BI173) -> 0 | BK173: 1 | BL173: 0 | BM173: =1-SUM(BK173:BL173) -> 0 | BN173: 1 | BO173: =1-BN173 -> 0
O174: 1 | P174: 0 | Q174: =1-SUM(O174:P174) -> 0 | R174: 1 | S174: 0 | T174: =1-SUM(R174:S174) -> 0 | U174: 0 | V174: 1 | W174: =1-SUM(U174:V174) -> 0 | X174: 0 | Y174: 1 | Z174: =1-SUM(X174:Y174) -> 0 | AA174: 1 | AB174: 0 | AC174: =1-SUM(AA174:AB174) -> 0 | AD174: 0 | AE174: 1 | AF174: =1-SUM(AD174:AE174) -> 0 | AG174: 0 | AH174: 1 | AI174: =1-SUM(AG174:AH174) -> 0 | AJ174: 1 | AK174: 0 | AL174: =1-SUM(AJ174:AK174) -> 0 | AM174: 0 | AN174: 1 | AO174: =1-SUM(AM174:AN174) -> 0 | AP174: 0 | AQ174: 1 | AR174: =1-SUM(AP174:AQ174) -> 0 | AS174: 0 | AT174: 1 | AU174: =1-SUM(AS174:AT174) -> 0 | AV174: 1 | AW174: 0 | AX174: =1-SUM(AV174:AW174) -> 0 | AY174: 1 | AZ174: 0 | BA174: =1-SUM(AY174:AZ174) -> 0 | BB174: 0 | BC174: 1 | BD174: =1-SUM(BB174:BC174) -> 0 | BE174: 0 | BF174: 1 | BG174: =1-SUM(BE174:BF174) -> 0 | BH174: 1 | BI174: 0 | BJ174: =1-SUM(BH174:BI174) -> 0 | BK174: 0 | BL174: 1 | BM174: =1-SUM(BK174:BL174) -> 0 | BN174: 1 | BO174: =1-BN174 -> 0
O175: 1 | P175: 0 | Q175: =1-SUM(O175:P175) -> 0 | R175: 1 | S175: 0 | T175: =1-SUM(R175:S175) -> 0 | U175: 0 | V175: 1 | W175: =1-SUM(U175:V175) -> 0 | X175: 0 | Y175: 1 | Z175: =1-SUM(X175:Y175) -> 0 | AA175: 1 | AB175: 0 | AC175: =1-SUM(AA175:AB175) -> 0 | AD175: 0 | AE175: 1 | AF175: =1-SUM(AD175:AE175) -> 0 | AG175: 0 | AH175: 1 | AI175: =1-SUM(AG175:AH175) -> 0 | AJ175: 1 | AK175: 0 | AL175: =1-SUM(AJ175:AK175) -> 0 | AM175: 0 | AN175: 1 | AO175: =1-SUM(AM175:AN175) -> 0 | AP175: 0 | AQ175: 1 | AR175: =1-SUM(AP175:AQ175) -> 0 | AS175: 0 | AT175: 1 | AU175: =1-SUM(AS175:AT175) -> 0 | AV175: 0 | AW175: 1 | AX175: =1-SUM(AV175:AW175) -> 0 | AY175: 0 | AZ175: 1 | BA175: =1-SUM(AY175:AZ175) -> 0 | BB175: 0 | BC175: 1 | BD175: =1-SUM(BB175:BC175) -> 0 | BE175: 0 | BF175: 1 | BG175: =1-SUM(BE175:BF175) -> 0 | BH175: 1 | BI175: 0 | BJ175: =1-SUM(BH175:BI175) -> 0 | BK175: 0 | BL175: 1 | BM175: =1-SUM(BK175:BL175) -> 0 | BN175: 1 | BO175: =1-BN175 -> 0
O176: 1 | P176: 0 | Q176: =1-SUM(O176:P176) -> 0 | R176: 1 | S176: 0 | T176: =1-SUM(R176:S176) -> 0 | U176: 0 | V176: 1 | W176: =1-SUM(U176:V176) -> 0 | X176: 0 | Y176: 1 | Z176: =1-SUM(X176:Y176) -> 0 | AA176: 1 | AB176: 0 | AC176: =1-SUM(AA176:AB176) -> 0 | AD176: 0 | AE176: 1 | AF176: =1-SUM(AD176:AE176) -> 0 | AG176: 0 | AH176: 1 | AI176: =1-SUM(AG176:AH176) -> 0 | AJ176: 1 | AK176: 0 | AL176: =1-SUM(AJ176:AK176) -> 0 | AM176: 0 | AN176: 1 | AO176: =1-SUM(AM176:AN176) -> 0 | AP176: 0 | AQ176: 1 | AR176: =1-SUM(AP176:AQ176) -> 0 | AS176: 0 | AT176: 1 | AU176: =1-SUM(AS176:AT176) -> 0 | AV176: 0 | AW176: 1 | AX176: =1-SUM(AV176:AW176) -> 0 | AY176: 0 | AZ176: 1 | BA176: =1-SUM(AY176:AZ176) -> 0 | BB176: 0 | BC176: 1 | BD176: =1-SUM(BB176:BC176) -> 0 | BE176: 0 | BF176: 1 | BG176: =1-SUM(BE176:BF176) -> 0 | BH176: 1 | BI176: 0 | BJ176: =1-SUM(BH176:BI176) -> 0 | BK176: 0 | BL176: 1 | BM176: =1-SUM(BK176:BL176) -> 0 | BN176: 1 | BO176: =1-BN176 -> 0
O177: 1 | P177: 0 | Q177: =1-SUM(O177:P177) -> 0 | R177: 1 | S177: 0 | T177: =1-SUM(R177:S177) -> 0 | U177: 1 | V177: 0 | W177: =1-SUM(U177:V177) -> 0 | X177: 0 | Y177: 1 | Z177: =1-SUM(X177:Y177) -> 0 | AA177: 0 | AB177: 1 | AC177: =1-SUM(AA177:AB177) -> 0 | AD177: 0 | AE177: 1 | AF177: =1-SUM(AD177:AE177) -> 0 | AG177: 0 | AH177: 1 | AI177: =1-SUM(AG177:AH177) -> 0 | AJ177: 1 | AK177: 0 | AL177: =1-SUM(AJ177:AK177) -> 0 | AM177: 0 | AN177: 1 | AO177: =1-SUM(AM177:AN177) -> 0 | AP177: 0 | AQ177: 1 | AR177: =1-SUM(AP177:AQ177) -> 0 | AS177: 1 | AT177: 0 | AU177: =1-SUM(AS177:AT177) -> 0 | AV177: 0 | AW177: 1 | AX177: =1-SUM(AV177:AW177) -> 0 | AY177: 0 | AZ177: 1 | BA177: =1-SUM(AY177:AZ177) -> 0 | BB177: 0 | BC177: 1 | BD177: =1-SUM(BB177:BC177) -> 0 | BE177: 0 | BF177: 1 | BG177: =1-SUM(BE177:BF177) -> 0 | BH177: 0 | BI177: 1 | BJ177: =1-SUM(BH177:BI177) -> 0 | BK177: 0 | BL177: 1 | BM177: =1-SUM(BK177:BL177) -> 0 | BN177: 1 | BO177: =1-BN177 -> 0
O178: 1 | P178: 0 | Q178: =1-SUM(O178:P178) -> 0 | R178: 0 | S178: 1 | T178: =1-SUM(R178:S178) -> 0 | U178: 0 | V178: 1 | W178: =1-SUM(U178:V178) -> 0 | X178: 1 | Y178: 0 | Z178: =1-SUM(X178:Y178) -> 0 | AA178: 1 | AB178: 0 | AC178: =1-SUM(AA178:AB178) -> 0 | AD178: 0 | AE178: 1 | AF178: =1-SUM(AD178:AE178) -> 0 | AG178: 0 | AH178: 1 | AI178: =1-SUM(AG178:AH178) -> 0 | AJ178: 1 | AK178: 0 | AL178: =1-SUM(AJ178:AK178) -> 0 | AM178: 0 | AN178: 1 | AO178: =1-SUM(AM178:AN178) -> 0 | AP178: 0 | AQ178: 1 | AR178: =1-SUM(AP178:AQ178) -> 0 | AS178: 1 | AT178: 0 | AU178: =1-SUM(AS178:AT178) -> 0 | AV178: 1 | AW178: 0 | AX178: =1-SUM(AV178:AW178) -> 0 | AY178: 1 | AZ178: 0 | BA178: =1-SUM(AY178:AZ178) -> 0 | BB178: 1 | BC178: 0 | BD178: =1-SUM(BB178:BC178) -> 0 | BE178: 0 | BF178: 1 | BG178: =1-SUM(BE178:BF178) -> 0 | BH178: 1 | BI178: 0 | BJ178: =1-SUM(BH178:BI178) -> 0 | BK178: 0 | BL178: 1 | BM178: =1-SUM(BK178:BL178) -> 0 | BN178: 1 | BO178: =1-BN178 -> 0
O179: 1 | P179: 0 | Q179: =1-SUM(O179:P179) -> 0 | R179: 1 | S179: 0 | T179: =1-SUM(R179:S179) -> 0 | U179: 0 | V179: 1 | W179: =1-SUM(U179:V179) -> 0 | X179: 0 | Y179: 1 | Z179: =1-SUM(X179:Y179) -> 0 | AA179: 1 | AB179: 0 | AC179: =1-SUM(AA179:AB179) -> 0 | AD179: 0 | AE179: 1 | AF179: =1-SUM(AD179:AE179) -> 0 | AG179: 0 | AH179: 1 | AI179: =1-SUM(AG179:AH179) -> 0 | AJ179: 1 | AK179: 0 | AL179: =1-SUM(AJ179:AK179) -> 0 | AM179: 0 | AN179: 1 | AO179: =1-SUM(AM179:AN179) -> 0 | AP179: 0 | AQ179: 1 | AR179: =1-SUM(AP179:AQ179) -> 0 | AS179: 0 | AT179: 1 | AU179: =1-SUM(AS179:AT179) -> 0 | AV179: 0 | AW179: 1 | AX179: =1-SUM(AV179:AW179) -> 0 | AY179: 0 | AZ179: 1 | BA179: =1-SUM(AY179:AZ179) -> 0 | BB179: 0 | BC179: 1 | BD179: =1-SUM(BB179:BC179) -> 0 | BE179: 0 | BF179: 1 | BG179: =1-SUM(BE179:BF179) -> 0 | BH179: 1 | BI179: 0 | BJ179: =1-SUM(BH179:BI179) -> 0 | BK179: 0 | BL179: 1 | BM179: =1-SUM(BK179:BL179) -> 0 | BN179: 1 | BO179: =1-BN179 -> 0
O180: 1 | P180: 0 | Q180: =1-SUM(O180:P180) -> 0 | R180: 0 | S180: 1 | T180: =1-SUM(R180:S180) -> 0 | U180: 0 | V180: 1 | W180: =1-SUM(U180:V180) -> 0 | X180: 0 | Y180: 1 | Z180: =1-SUM(X180:Y180) -> 0 | AA180: 1 | AB180: 0 | AC180: =1-SUM(AA180:AB180) -> 0 | AD180: 0 | AE180: 1 | AF180: =1-SUM(AD180:AE180) -> 0 | AG180: 0 | AH180: 1 | AI180: =1-SUM(AG180:AH180) -> 0 | AJ180: 1 | AK180: 0 | AL180: =1-SUM(AJ180:AK180) -> 0 | AM180: 0 | AN180: 1 | AO180: =1-SUM(AM180:AN180) -> 0 | AP180: 0 | AQ180: 1 | AR180: =1-SUM(AP180:AQ180) -> 0 | AS180: 1 | AT180: 0 | AU180: =1-SUM(AS180:AT180) -> 0 | AV180: 1 | AW180: 0 | AX180: =1-SUM(AV180:AW180) -> 0 | AY180: 1 | AZ180: 0 | BA180: =1-SUM(AY180:AZ180) -> 0 | BB180: 1 | BC180: 0 | BD180: =1-SUM(BB180:BC180) -> 0 | BE180: 0 | BF180: 1 | BG180: =1-SUM(BE180:BF180) -> 0 | BH180: 0 | BI180: 1 | BJ180: =1-SUM(BH180:BI180) -> 0 | BK180: 0 | BL180: 1 | BM180: =1-SUM(BK180:BL180) -> 0 | BN180: 1 | BO180: =1-BN180 -> 0
O181: 1 | P181: 0 | Q181: =1-SUM(O181:P181) -> 0 | R181: 0 | S181: 1 | T181: =1-SUM(R181:S181) -> 0 | U181: 0 | V181: 1 | W181: =1-SUM(U181:V181) -> 0 | X181: 0 | Y181: 1 | Z181: =1-SUM(X181:Y181) -> 0 | AA181: 1 | AB181: 0 | AC181: =1-SUM(AA181:AB181) -> 0 | AD181: 0 | AE181: 1 | AF181: =1-SUM(AD181:AE181) -> 0 | AG181: 0 | AH181: 1 | AI181: =1-SUM(AG181:AH181) -> 0 | AJ181: 1 | AK181: 0 | AL181: =1-SUM(AJ181:AK181) -> 0 | AM181: 0 | AN181: 1 | AO181: =1-SUM(AM181:AN181) -> 0 | AP181: 0 | AQ181: 1 | AR181: =1-SUM(AP181:AQ181) -> 0 | AS181: 0 | AT181: 1 | AU181: =1-SUM(AS181:AT181) -> 0 | AV181: 0 | AW181: 1 | AX181: =1-SUM(AV181:AW181) -> 0 | AY181: 1 | AZ181: 0 | BA181: =1-SUM(AY181:AZ181) -> 0 | BB181: 0 | BC181: 1 | BD181: =1-SUM(BB181:BC181) -> 0 | BE181: 1 | BF181: 0 | BG181: =1-SUM(BE181:BF181) -> 0 | BH181: 0 | BI181: 1 | BJ181: =1-SUM(BH181:BI181) -> 0 | BK181: 0 | BL181: 1 | BM181: =1-SUM(BK181:BL181) -> 0 | BN181: 1 | BO181: =1-BN181 -> 0
O182: 1 | P182: 0 | Q182: =1-SUM(O182:P182) -> 0 | R182: 1 | S182: 0 | T182: =1-SUM(R182:S182) -> 0 | U182: 0 | V182: 1 | W182: =1-SUM(U182:V182) -> 0 | X182: 0 | Y182: 1 | Z182: =1-SUM(X182:Y182) -> 0 | AA182: 1 | AB182: 0 | AC182: =1-SUM(AA182:AB182) -> 0 | AD182: 0 | AE182: 1 | AF182: =1-SUM(AD182:AE182) -> 0 | AG182: 0 | AH182: 1 | AI182: =1-SUM(AG182:AH182) -> 0 | AJ182: 1 | AK182: 0 | AL182: =1-SUM(AJ182:AK182) -> 0 | AM182: 0 | AN182: 1 | AO182: =1-SUM(AM182:AN182) -> 0 | AP182: 0 | AQ182: 1 | AR182: =1-SUM(AP182:AQ182) -> 0 | AS182: 0 | AT182: 1 | AU182: =1-SUM(AS182:AT182) -> 0 | AV182: 1 | AW182: 0 | AX182: =1-SUM(AV182:AW182) -> 0 | AY182: 1 | AZ182: 0 | BA182: =1-SUM(AY182:AZ182) -> 0 | BB182: 0 | BC182: 1 | BD182: =1-SUM(BB182:BC182) -> 0 | BE182: 0 | BF182: 1 | BG182: =1-SUM(BE182:BF182) -> 0 | BH182: 1 | BI182: 0 | BJ182: =1-SUM(BH182:BI182) -> 0 | BK182: 0 | BL182: 1 | BM182: =1-SUM(BK182:BL182) -> 0 | BN182: 1 | BO182: =1-BN182 -> 0
O183: 0 | P183: 1 | Q183: =1-SUM(O183:P183) -> 0 | R183: 0 | S183: 1 | T183: =1-SUM(R183:S183) -> 0 | U183: 1 | V183: 0 | W183: =1-SUM(U183:V183) -> 0 | X183: 1 | Y183: 0 | Z183: =1-SUM(X183:Y183) -> 0 | AA183: 1 | AB183: 0 | AC183: =1-SUM(AA183:AB183) -> 0 | AD183: 0 | AE183: 1 | AF183: =1-SUM(AD183:AE183) -> 0 | AG183: 0 | AH183: 1 | AI183: =1-SUM(AG183:AH183) -> 0 | AJ183: 0 | AK183: 1 | AL183: =1-SUM(AJ183:AK183) -> 0 | AM183: 0 | AN183: 1 | AO183: =1-SUM(AM183:AN183) -> 0 | AP183: 0 | AQ183: 1 | AR183: =1-SUM(AP183:AQ183) -> 0 | AS183: 0 | AT183: 1 | AU183: =1-SUM(AS183:AT183) -> 0 | AV183: 1 | AW183: 0 | AX183: =1-SUM(AV183:AW183) -> 0 | AY183: 0 | AZ183: 1 | BA183: =1-SUM(AY183:AZ183) -> 0 | BB183: 0 | BC183: 1 | BD183: =1-SUM(BB183:BC183) -> 0 | BE183: 0 | BF183: 1 | BG183: =1-SUM(BE183:BF183) -> 0 | BH183: 0 | BI183: 1 | BJ183: =1-SUM(BH183:BI183) -> 0 | BK183: 0 | BL183: 1 | BM183: =1-SUM(BK183:BL183) -> 0 | BN183: 1 | BO183: =1-BN183 -> 0
O184: 1 | P184: 0 | Q184: =1-SUM(O184:P184) -> 0 | R184: 1 | S184: 0 | T184: =1-SUM(R184:S184) -> 0 | U184: 0 | V184: 1 | W184: =1-SUM(U184:V184) -> 0 | X184: 0 | Y184: 1 | Z184: =1-SUM(X184:Y184) -> 0 | AA184: 1 | AB184: 0 | AC184: =1-SUM(AA184:AB184) -> 0 | AD184: 0 | AE184: 1 | AF184: =1-SUM(AD184:AE184) -> 0 | AG184: 0 | AH184: 1 | AI184: =1-SUM(AG184:AH184) -> 0 | AJ184: 1 | AK184: 0 | AL184: =1-SUM(AJ184:AK184) -> 0 | AM184: 0 | AN184: 1 | AO184: =1-SUM(AM184:AN184) -> 0 | AP184: 0 | AQ184: 1 | AR184: =1-SUM(AP184:AQ184) -> 0 | AS184: 1 | AT184: 0 | AU184: =1-SUM(AS184:AT184) -> 0 | AV184: 1 | AW184: 0 | AX184: =1-SUM(AV184:AW184) -> 0 | AY184: 0 | AZ184: 1 | BA184: =1-SUM(AY184:AZ184) -> 0 | BB184: 0 | BC184: 1 | BD184: =1-SUM(BB184:BC184) -> 0 | BE184: 1 | BF184: 0 | BG184: =1-SUM(BE184:BF184) -> 0 | BH184: 0 | BI184: 1 | BJ184: =1-SUM(BH184:BI184) -> 0 | BK184: 0 | BL184: 1 | BM184: =1-SUM(BK184:BL184) -> 0 | BN184: 1 | BO184: =1-BN184 -> 0
O185: 1 | P185: 0 | Q185: =1-SUM(O185:P185) -> 0 | R185: 0 | S185: 1 | T185: =1-SUM(R185:S185) -> 0 | U185: 0 | V185: 1 | W185: =1-SUM(U185:V185) -> 0 | X185: 0 | Y185: 1 | Z185: =1-SUM(X185:Y185) -> 0 | AA185: 0 | AB185: 1 | AC185: =1-SUM(AA185:AB185) -> 0 | AD185: 0 | AE185: 1 | AF185: =1-SUM(AD185:AE185) -> 0 | AG185: 0 | AH185: 1 | AI185: =1-SUM(AG185:AH185) -> 0 | AJ185: 0 | AK185: 1 | AL185: =1-SUM(AJ185:AK185) -> 0 | AM185: 0 | AN185: 1 | AO185: =1-SUM(AM185:AN185) -> 0 | AP185: 0 | AQ185: 1 | AR185: =1-SUM(AP185:AQ185) -> 0 | AS185: 0 | AT185: 1 | AU185: =1-SUM(AS185:AT185) -> 0 | AV185: 0 | AW185: 1 | AX185: =1-SUM(AV185:AW185) -> 0 | AY185: 0 | AZ185: 1 | BA185: =1-SUM(AY185:AZ185) -> 0 | BB185: 0 | BC185: 1 | BD185: =1-SUM(BB185:BC185) -> 0 | BE185: 1 | BF185: 0 | BG185: =1-SUM(BE185:BF185) -> 0 | BH185: 1 | BI185: 0 | BJ185: =1-SUM(BH185:BI185) -> 0 | BK185: 0 | BL185: 1 | BM185: =1-SUM(BK185:BL185) -> 0 | BN185: 1 | BO185: =1-BN185 -> 0
O186: 1 | P186: 0 | Q186: =1-SUM(O186:P186) -> 0 | R186: 1 | S186: 0 | T186: =1-SUM(R186:S186) -> 0 | U186: 1 | V186: 0 | W186: =1-SUM(U186:V186) -> 0 | X186: 0 | Y186: 1 | Z186: =1-SUM(X186:Y186) -> 0 | AA186: 1 | AB186: 0 | AC186: =1-SUM(AA186:AB186) -> 0 | AD186: 0 | AE186: 1 | AF186: =1-SUM(AD186:AE186) -> 0 | AG186: 0 | AH186: 1 | AI186: =1-SUM(AG186:AH186) -> 0 | AJ186: 1 | AK186: 0 | AL186: =1-SUM(AJ186:AK186) -> 0 | AM186: 1 | AN186: 0 | AO186: =1-SUM(AM186:AN186) -> 0 | AP186: 0 | AQ186: 1 | AR186: =1-SUM(AP186:AQ186) -> 0 | AS186: 1 | AT186: 0 | AU186: =1-SUM(AS186:AT186) -> 0 | AV186: 1 | AW186: 0 | AX186: =1-SUM(AV186:AW186) -> 0 | AY186: 0 | AZ186: 1 | BA186: =1-SUM(AY186:AZ186) -> 0 | BB186: 0 | BC186: 1 | BD186: =1-SUM(BB186:BC186) -> 0 | BE186: 0 | BF186: 1 | BG186: =1-SUM(BE186:BF186) -> 0 | BH186: 0 | BI186: 1 | BJ186: =1-SUM(BH186:BI186) -> 0 | BK186: 0 | BL186: 1 | BM186: =1-SUM(BK186:BL186) -> 0 | BN186: 1 | BO186: =1-BN186 -> 0
O187: 1 | P187: 0 | Q187: =1-SUM(O187:P187) -> 0 | R187: 1 | S187: 0 | T187: =1-SUM(R187:S187) -> 0 | U187: 1 | V187: 0 | W187: =1-SUM(U187:V187) -> 0 | X187: 1 | Y187: 0 | Z187: =1-SUM(X187:Y187) -> 0 | AA187: 1 | AB187: 0 | AC187: =1-SUM(AA187:AB187) -> 0 | AD187: 1 | AE187: 0 | AF187: =1-SUM(AD187:AE187) -> 0 | AG187: 0 | AH187: 1 | AI187: =1-SUM(AG187:AH187) -> 0 | AJ187: 1 | AK187: 0 | AL187: =1-SUM(AJ187:AK187) -> 0 | AM187: 0 | AN187: 1 | AO187: =1-SUM(AM187:AN187) -> 0 | AP187: 0 | AQ187: 1 | AR187: =1-SUM(AP187:AQ187) -> 0 | AS187: 1 | AT187: 0 | AU187: =1-SUM(AS187:AT187) -> 0 | AV187: 1 | AW187: 0 | AX187: =1-SUM(AV187:AW187) -> 0 | AY187: 0 | AZ187: 1 | BA187: =1-SUM(AY187:AZ187) -> 0 | BB187: 0 | BC187: 1 | BD187: =1-SUM(BB187:BC187) -> 0 | BE187: 0 | BF187: 1 | BG187: =1-SUM(BE187:BF187) -> 0 | BH187: 0 | BI187: 1 | BJ187: =1-SUM(BH187:BI187) -> 0 | BK187: 0 | BL187: 1 | BM187: =1-SUM(BK187:BL187) -> 0 | BN187: 1 | BO187: =1-BN187 -> 0
O188: 1 | P188: 0 | Q188: =1-SUM(O188:P188) -> 0 | R188: 0 | S188: 1 | T188: =1-SUM(R188:S188) -> 0 | U188: 0 | V188: 1 | W188: =1-SUM(U188:V188) -> 0 | X188: 0 | Y188: 1 | Z188: =1-SUM(X188:Y188) -> 0 | AA188: 0 | AB188: 1 | AC188: =1-SUM(AA188:AB188) -> 0 | AD188: 0 | AE188: 1 | AF188: =1-SUM(AD188:AE188) -> 0 | AG188: 0 | AH188: 1 | AI188: =1-SUM(AG188:AH188) -> 0 | AJ188: 1 | AK188: 0 | AL188: =1-SUM(AJ188:AK188) -> 0 | AM188: 1 | AN188: 0 | AO188: =1-SUM(AM188:AN188) -> 0 | AP188: 0 | AQ188: 1 | AR188: =1-SUM(AP188:AQ188) -> 0 | AS188: 0 | AT188: 1 | AU188: =1-SUM(AS188:AT188) -> 0 | AV188: 0 | AW188: 1 | AX188: =1-SUM(AV188:AW188) -> 0 | AY188: 1 | AZ188: 0 | BA188: =1-SUM(AY188:AZ188) -> 0 | BB188: 1 | BC188: 0 | BD188: =1-SUM(BB188:BC188) -> 0 | BE188: 1 | BF188: 0 | BG188: =1-SUM(BE188:BF188) -> 0 | BH188: 0 | BI188: 1 | BJ188: =1-SUM(BH188:BI188) -> 0 | BK188: 0 | BL188: 1 | BM188: =1-SUM(BK188:BL188) -> 0 | BN188: 0 | BO188: =1-BN188 -> 1
O189: 1 | P189: 0 | Q189: =1-SUM(O189:P189) -> 0 | R189: 1 | S189: 0 | T189: =1-SUM(R189:S189) -> 0 | U189: 1 | V189: 0 | W189: =1-SUM(U189:V189) -> 0 | X189: 1 | Y189: 0 | Z189: =1-SUM(X189:Y189) -> 0 | AA189: 1 | AB189: 0 | AC189: =1-SUM(AA189:AB189) -> 0 | AD189: 0 | AE189: 1 | AF189: =1-SUM(AD189:AE189) -> 0 | AG189: 0 | AH189: 1 | AI189: =1-SUM(AG189:AH189) -> 0 | AJ189: 0 | AK189: 1 | AL189: =1-SUM(AJ189:AK189) -> 0 | AM189: 1 | AN189: 0 | AO189: =1-SUM(AM189:AN189) -> 0 | AP189: 0 | AQ189: 1 | AR189: =1-SUM(AP189:AQ189) -> 0 | AS189: 0 | AT189: 1 | AU189: =1-SUM(AS189:AT189) -> 0 | AV189: 0 | AW189: 1 | AX189: =1-SUM(AV189:AW189) -> 0 | AY189: 0 | AZ189: 1 | BA189: =1-SUM(AY189:AZ189) -> 0 | BB189: 0 | BC189: 1 | BD189: =1-SUM(BB189:BC189) -> 0 | BE189: 0 | BF189: 1 | BG189: =1-SUM(BE189:BF189) -> 0 | BH189: 0 | BI189: 1 | BJ189: =1-SUM(BH189:BI189) -> 0 | BK189: 0 | BL189: 1 | BM189: =1-SUM(BK189:BL189) -> 0 | BN189: 0 | BO189: =1-BN189 -> 1
O190: 1 | P190: 0 | Q190: =1-SUM(O190:P190) -> 0 | R190: 1 | S190: 0 | T190: =1-SUM(R190:S190) -> 0 | U190: 1 | V190: 0 | W190: =1-SUM(U190:V190) -> 0 | X190: 1 | Y190: 0 | Z190: =1-SUM(X190:Y190) -> 0 | AA190: 1 | AB190: 0 | AC190: =1-SUM(AA190:AB190) -> 0 | AD190: 0 | AE190: 1 | AF190: =1-SUM(AD190:AE190) -> 0 | AG190: 0 | AH190: 1 | AI190: =1-SUM(AG190:AH190) -> 0 | AJ190: 0 | AK190: 1 | AL190: =1-SUM(AJ190:AK190) -> 0 | AM190: 1 | AN190: 0 | AO190: =1-SUM(AM190:AN190) -> 0 | AP190: 0 | AQ190: 1 | AR190: =1-SUM(AP190:AQ190) -> 0 | AS190: 0 | AT190: 1 | AU190: =1-SUM(AS190:AT190) -> 0 | AV190: 0 | AW190: 1 | AX190: =1-SUM(AV190:AW190) -> 0 | AY190: 0 | AZ190: 1 | BA190: =1-SUM(AY190:AZ190) -> 0 | BB190: 0 | BC190: 1 | BD190: =1-SUM(BB190:BC190) -> 0 | BE190: 0 | BF190: 1 | BG190: =1-SUM(BE190:BF190) -> 0 | BH190: 0 | BI190: 1 | BJ190: =1-SUM(BH190:BI190) -> 0 | BK190: 0 | BL190: 1 | BM190: =1-SUM(BK190:BL190) -> 0 | BN190: 1 | BO190: =1-BN190 -> 0
O191: 1 | P191: 0 | Q191: =1-SUM(O191:P191) -> 0 | R191: 1 | S191: 0 | T191: =1-SUM(R191:S191) -> 0 | U191: 1 | V191: 0 | W191: =1-SUM(U191:V191) -> 0 | X191: 1 | Y191: 0 | Z191: =1-SUM(X191:Y191) -> 0 | AA191: 0 | AB191: 1 | AC191: =1-SUM(AA191:AB191) -> 0 | AD191: 0 | AE191: 1 | AF191: =1-SUM(AD191:AE191) -> 0 | AG191: 0 | AH191: 1 | AI191: =1-SUM(AG191:AH191) -> 0 | AJ191: 0 | AK191: 1 | AL191: =1-SUM(AJ191:AK191) -> 0 | AM191: 1 | AN191: 0 | AO191: =1-SUM(AM191:AN191) -> 0 | AP191: 0 | AQ191: 1 | AR191: =1-SUM(AP191:AQ191) -> 0 | AS191: 1 | AT191: 0 | AU191: =1-SUM(AS191:AT191) -> 0 | AV191: 0 | AW191: 1 | AX191: =1-SUM(AV191:AW191) -> 0 | AY191: 0 | AZ191: 1 | BA191: =1-SUM(AY191:AZ191) -> 0 | BB191: 0 | BC191: 1 | BD191: =1-SUM(BB191:BC191) -> 0 | BE191: 0 | BF191: 1 | BG191: =1-SUM(BE191:BF191) -> 0 | BH191: 0 | BI191: 1 | BJ191: =1-SUM(BH191:BI191) -> 0 | BK191: 0 | BL191: 1 | BM191: =1-SUM(BK191:BL191) -> 0 | BN191: 1 | BO191: =1-BN191 -> 0
O192: 1 | P192: 0 | Q192: =1-SUM(O192:P192) -> 0 | R192: 0 | S192: 1 | T192: =1-SUM(R192:S192) -> 0 | U192: 0 | V192: 1 | W192: =1-SUM(U192:V192) -> 0 | X192: 0 | Y192: 1 | Z192: =1-SUM(X192:Y192) -> 0 | AA192: 1 | AB192: 0 | AC192: =1-SUM(AA192:AB192) -> 0 | AD192: 0 | AE192: 1 | AF192: =1-SUM(AD192:AE192) -> 0 | AG192: 0 | AH192: 1 | AI192: =1-SUM(AG192:AH192) -> 0 | AJ192: 0 | AK192: 1 | AL192: =1-SUM(AJ192:AK192) -> 0 | AM192: 0 | AN192: 1 | AO192: =1-SUM(AM192:AN192) -> 0 | AP192: 0 | AQ192: 1 | AR192: =1-SUM(AP192:AQ192) -> 0 | AS192: 1 | AT192: 0 | AU192: =1-SUM(AS192:AT192) -> 0 | AV192: 1 | AW192: 0 | AX192: =1-SUM(AV192:AW192) -> 0 | AY192: 1 | AZ192: 0 | BA192: =1-SUM(AY192:AZ192) -> 0 | BB192: 1 | BC192: 0 | BD192: =1-SUM(BB192:BC192) -> 0 | BE192: 1 | BF192: 0 | BG192: =1-SUM(BE192:BF192) -> 0 | BH192: 0 | BI192: 1 | BJ192: =1-SUM(BH192:BI192) -> 0 | BK192: 0 | BL192: 1 | BM192: =1-SUM(BK192:BL192) -> 0 | BN192: 0 | BO192: =1-BN192 -> 1
O193: 1 | P193: 0 | Q193: =1-SUM(O193:P193) -> 0 | R193: 0 | S193: 1 | T193: =1-SUM(R193:S193) -> 0 | U193: 0 | V193: 1 | W193: =1-SUM(U193:V193) -> 0 | X193: 0 | Y193: 1 | Z193: =1-SUM(X193:Y193) -> 0 | AA193: 1 | AB193: 0 | AC193: =1-SUM(AA193:AB193) -> 0 | AD193: 0 | AE193: 1 | AF193: =1-SUM(AD193:AE193) -> 0 | AG193: 0 | AH193: 1 | AI193: =1-SUM(AG193:AH193) -> 0 | AJ193: 1 | AK193: 0 | AL193: =1-SUM(AJ193:AK193) -> 0 | AM193: 1 | AN193: 0 | AO193: =1-SUM(AM193:AN193) -> 0 | AP193: 0 | AQ193: 1 | AR193: =1-SUM(AP193:AQ193) -> 0 | AS193: 1 | AT193: 0 | AU193: =1-SUM(AS193:AT193) -> 0 | AV193: 1 | AW193: 0 | AX193: =1-SUM(AV193:AW193) -> 0 | AY193: 1 | AZ193: 0 | BA193: =1-SUM(AY193:AZ193) -> 0 | BB193: 1 | BC193: 0 | BD193: =1-SUM(BB193:BC193) -> 0 | BE193: 1 | BF193: 0 | BG193: =1-SUM(BE193:BF193) -> 0 | BH193: 0 | BI193: 1 | BJ193: =1-SUM(BH193:BI193) -> 0 | BK193: 0 | BL193: 1 | BM193: =1-SUM(BK193:BL193) -> 0 | BN193: 0 | BO193: =1-BN193 -> 1
O194: 1 | P194: 0 | Q194: =1-SUM(O194:P194) -> 0 | R194: 0 | S194: 1 | T194: =1-SUM(R194:S194) -> 0 | U194: 0 | V194: 1 | W194: =1-SUM(U194:V194) -> 0 | X194: 0 | Y194: 1 | Z194: =1-SUM(X194:Y194) -> 0 | AA194: 1 | AB194: 0 | AC194: =1-SUM(AA194:AB194) -> 0 | AD194: 0 | AE194: 1 | AF194: =1-SUM(AD194:AE194) -> 0 | AG194: 0 | AH194: 1 | AI194: =1-SUM(AG194:AH194) -> 0 | AJ194: 1 | AK194: 0 | AL194: =1-SUM(AJ194:AK194) -> 0 | AM194: 1 | AN194: 0 | AO194: =1-SUM(AM194:AN194) -> 0 | AP194: 0 | AQ194: 1 | AR194: =1-SUM(AP194:AQ194) -> 0 | AS194: 1 | AT194: 0 | AU194: =1-SUM(AS194:AT194) -> 0 | AV194: 0 | AW194: 1 | AX194: =1-SUM(AV194:AW194) -> 0 | AY194: 0 | AZ194: 1 | BA194: =1-SUM(AY194:AZ194) -> 0 | BB194: 0 | BC194: 1 | BD194: =1-SUM(BB194:BC194) -> 0 | BE194: 0 | BF194: 1 | BG194: =1-SUM(BE194:BF194) -> 0 | BH194: 0 | BI194: 1 | BJ194: =1-SUM(BH194:BI194) -> 0 | BK194: 0 | BL194: 1 | BM194: =1-SUM(BK194:BL194) -> 0 | BN194: 0 | BO194: =1-BN194 -> 1
O195: 1 | P195: 0 | Q195: =1-SUM(O195:P195) -> 0 | R195: 0 | S195: 1 | T195: =1-SUM(R195:S195) -> 0 | U195: 0 | V195: 1 | W195: =1-SUM(U195:V195) -> 0 | X195: 0 | Y195: 1 | Z195: =1-SUM(X195:Y195) -> 0 | AA195: 1 | AB195: 0 | AC195: =1-SUM(AA195:AB195) -> 0 | AD195: 1 | AE195: 0 | AF195: =1-SUM(AD195:AE195) -> 0 | AG195: 1 | AH195: 0 | AI195: =1-SUM(AG195:AH195) -> 0 | AJ195: 1 | AK195: 0 | AL195: =1-SUM(AJ195:AK195) -> 0 | AM195: 1 | AN195: 0 | AO195: =1-SUM(AM195:AN195) -> 0 | AP195: 0 | AQ195: 1 | AR195: =1-SUM(AP195:AQ195) -> 0 | AS195: 1 | AT195: 0 | AU195: =1-SUM(AS195:AT195) -> 0 | AV195: 1 | AW195: 0 | AX195: =1-SUM(AV195:AW195) -> 0 | AY195: 1 | AZ195: 0 | BA195: =1-SUM(AY195:AZ195) -> 0 | BB195: 0 | BC195: 1 | BD195: =1-SUM(BB195:BC195) -> 0 | BE195: 1 | BF195: 0 | BG195: =1-SUM(BE195:BF195) -> 0 | BH195: 0 | BI195: 1 | BJ195: =1-SUM(BH195:BI195) -> 0 | BK195: 0 | BL195: 1 | BM195: =1-SUM(BK195:BL195) -> 0 | BN195: 1 | BO195: =1-BN195 -> 0
O196: 1 | P196: 0 | Q196: =1-SUM(O196:P196) -> 0 | R196: 1 | S196: 0 | T196: =1-SUM(R196:S196) -> 0 | U196: 1 | V196: 0 | W196: =1-SUM(U196:V196) -> 0 | X196: 1 | Y196: 0 | Z196: =1-SUM(X196:Y196) -> 0 | AA196: 1 | AB196: 0 | AC196: =1-SUM(AA196:AB196) -> 0 | AD196: 0 | AE196: 1 | AF196: =1-SUM(AD196:AE196) -> 0 | AG196: 0 | AH196: 1 | AI196: =1-SUM(AG196:AH196) -> 0 | AJ196: 1 | AK196: 0 | AL196: =1-SUM(AJ196:AK196) -> 0 | AM196: 1 | AN196: 0 | AO196: =1-SUM(AM196:AN196) -> 0 | AP196: 0 | AQ196: 1 | AR196: =1-SUM(AP196:AQ196) -> 0 | AS196: 1 | AT196: 0 | AU196: =1-SUM(AS196:AT196) -> 0 | AV196: 1 | AW196: 0 | AX196: =1-SUM(AV196:AW196) -> 0 | AY196: 0 | AZ196: 1 | BA196: =1-SUM(AY196:AZ196) -> 0 | BB196: 1 | BC196: 0 | BD196: =1-SUM(BB196:BC196) -> 0 | BE196: 0 | BF196: 1 | BG196: =1-SUM(BE196:BF196) -> 0 | BH196: 0 | BI196: 1 | BJ196: =1-SUM(BH196:BI196) -> 0 | BK196: 0 | BL196: 1 | BM196: =1-SUM(BK196:BL196) -> 0 | BN196: 1 | BO196: =1-BN196 -> 0
O197: 0 | P197: 1 | Q197: =1-SUM(O197:P197) -> 0 | R197: 0 | S197: 1 | T197: =1-SUM(R197:S197) -> 0 | U197: 0 | V197: 1 | W197: =1-SUM(U197:V197) -> 0 | X197: 0 | Y197: 1 | Z197: =1-SUM(X197:Y197) -> 0 | AA197: 0 | AB197: 1 | AC197: =1-SUM(AA197:AB197) -> 0 | AD197: 0 | AE197: 1 | AF197: =1-SUM(AD197:AE197) -> 0 | AG197: 0 | AH197: 1 | AI197: =1-SUM(AG197:AH197) -> 0 | AJ197: 0 | AK197: 1 | AL197: =1-SUM(AJ197:AK197) -> 0 | AM197: 0 | AN197: 1 | AO197: =1-SUM(AM197:AN197) -> 0 | AP197: 1 | AQ197: 0 | AR197: =1-SUM(AP197:AQ197) -> 0 | AS197: 0 | AT197: 1 | AU197: =1-SUM(AS197:AT197) -> 0 | AV197: 0 | AW197: 1 | AX197: =1-SUM(AV197:AW197) -> 0 | AY197: 0 | AZ197: 1 | BA197: =1-SUM(AY197:AZ197) -> 0 | BB197: 0 | BC197: 1 | BD197: =1-SUM(BB197:BC197) -> 0 | BE197: 0 | BF197: 1 | BG197: =1-SUM(BE197:BF197) -> 0 | BH197: 0 | BI197: 1 | BJ197: =1-SUM(BH197:BI197) -> 0 | BK197: 1 | BL197: 0 | BM197: =1-SUM(BK197:BL197) -> 0 | BN197: 1 | BO197: =1-BN197 -> 0
O198: 0 | P198: 1 | Q198: =1-SUM(O198:P198) -> 0 | R198: 0 | S198: 1 | T198: =1-SUM(R198:S198) -> 0 | U198: 0 | V198: 1 | W198: =1-SUM(U198:V198) -> 0 | X198: 0 | Y198: 1 | Z198: =1-SUM(X198:Y198) -> 0 | AA198: 0 | AB198: 1 | AC198: =1-SUM(AA198:AB198) -> 0 | AD198: 0 | AE198: 1 | AF198: =1-SUM(AD198:AE198) -> 0 | AG198: 0 | AH198: 1 | AI198: =1-SUM(AG198:AH198) -> 0 | AJ198: 0 | AK198: 1 | AL198: =1-SUM(AJ198:AK198) -> 0 | AM198: 0 | AN198: 1 | AO198: =1-SUM(AM198:AN198) -> 0 | AP198: 1 | AQ198: 0 | AR198: =1-SUM(AP198:AQ198) -> 0 | AS198: 0 | AT198: 1 | AU198: =1-SUM(AS198:AT198) -> 0 | AV198: 0 | AW198: 1 | AX198: =1-SUM(AV198:AW198) -> 0 | AY198: 0 | AZ198: 1 | BA198: =1-SUM(AY198:AZ198) -> 0 | BB198: 0 | BC198: 1 | BD198: =1-SUM(BB198:BC198) -> 0 | BE198: 0 | BF198: 1 | BG198: =1-SUM(BE198:BF198) -> 0 | BH198: 0 | BI198: 1 | BJ198: =1-SUM(BH198:BI198) -> 0 | BK198: 1 | BL198: 0 | BM198: =1-SUM(BK198:BL198) -> 0 | BN198: 1 | BO198: =1-BN198 -> 0
O199: 0 | P199: 1 | Q199: =1-SUM(O199:P199) -> 0 | R199: 0 | S199: 1 | T199: =1-SUM(R199:S199) -> 0 | U199: 0 | V199: 1 | W199: =1-SUM(U199:V199) -> 0 | X199: 0 | Y199: 1 | Z199: =1-SUM(X199:Y199) -> 0 | AA199: 0 | AB199: 1 | AC199: =1-SUM(AA199:AB199) -> 0 | AD199: 0 | AE199: 1 | AF199: =1-SUM(AD199:AE199) -> 0 | AG199: 0 | AH199: 1 | AI199: =1-SUM(AG199:AH199) -> 0 | AJ199: 0 | AK199: 1 | AL199: =1-SUM(AJ199:AK199) -> 0 | AM199: 0 | AN199: 1 | AO199: =1-SUM(AM199:AN199) -> 0 | AP199: 1 | AQ199: 0 | AR199: =1-SUM(AP199:AQ199) -> 0 | AS199: 0 | AT199: 1 | AU199: =1-SUM(AS199:AT199) -> 0 | AV199: 0 | AW199: 1 | AX199: =1-SUM(AV199:AW199) -> 0 | AY199: 0 | AZ199: 1 | BA199: =1-SUM(AY199:AZ199) -> 0 | BB199: 0 | BC199: 1 | BD199: =1-SUM(BB199:BC199) -> 0 | BE199: 0 | BF199: 1 | BG199: =1-SUM(BE199:BF199) -> 0 | BH199: 0 | BI199: 1 | BJ199: =1-SUM(BH199:BI199) -> 0 | BK199: 1 | BL199: 0 | BM199: =1-SUM(BK199:BL199) -> 0 | BN199: 1 | BO199: =1-BN199 -> 0
O200: 1 | P200: 0 | Q200: =1-SUM(O200:P200) -> 0 | R200: 1 | S200: 0 | T200: =1-SUM(R200:S200) -> 0 | U200: 0 | V200: 1 | W200: =1-SUM(U200:V200) -> 0 | X200: 0 | Y200: 1 | Z200: =1-SUM(X200:Y200) -> 0 | AA200: 1 | AB200: 0 | AC200: =1-SUM(AA200:AB200) -> 0 | AD200: 0 | AE200: 1 | AF200: =1-SUM(AD200:AE200) -> 0 | AG200: 0 | AH200: 1 | AI200: =1-SUM(AG200:AH200) -> 0 | AJ200: 0 | AK200: 1 | AL200: =1-SUM(AJ200:AK200) -> 0 | AM200: 1 | AN200: 0 | AO200: =1-SUM(AM200:AN200) -> 0 | AP200: 0 | AQ200: 1 | AR200: =1-SUM(AP200:AQ200) -> 0 | AS200: 1 | AT200: 0 | AU200: =1-SUM(AS200:AT200) -> 0 | AV200: 1 | AW200: 0 | AX200: =1-SUM(AV200:AW200) -> 0 | AY200: 1 | AZ200: 0 | BA200: =1-SUM(AY200:AZ200) -> 0 | BB200: 1 | BC200: 0 | BD200: =1-SUM(BB200:BC200) -> 0 | BE200: 0 | BF200: 1 | BG200: =1-SUM(BE200:BF200) -> 0 | BH200: 0 | BI200: 1 | BJ200: =1-SUM(BH200:BI200) -> 0 | BK200: 0 | BL200: 1 | BM200: =1-SUM(BK200:BL200) -> 0 | BN200: 1 | BO200: =1-BN200 -> 0
O201: 0 | P201: 1 | Q201: =1-SUM(O201:P201) -> 0 | R201: 0 | S201: 1 | T201: =1-SUM(R201:S201) -> 0 | U201: 0 | V201: 1 | W201: =1-SUM(U201:V201) -> 0 | X201: 0 | Y201: 1 | Z201: =1-SUM(X201:Y201) -> 0 | AA201: 0 | AB201: 1 | AC201: =1-SUM(AA201:AB201) -> 0 | AD201: 0 | AE201: 1 | AF201: =1-SUM(AD201:AE201) -> 0 | AG201: 0 | AH201: 1 | AI201: =1-SUM(AG201:AH201) -> 0 | AJ201: 0 | AK201: 1 | AL201: =1-SUM(AJ201:AK201) -> 0 | AM201: 0 | AN201: 1 | AO201: =1-SUM(AM201:AN201) -> 0 | AP201: 0 | AQ201: 1 | AR201: =1-SUM(AP201:AQ201) -> 0 | AS201: 0 | AT201: 1 | AU201: =1-SUM(AS201:AT201) -> 0 | AV201: 0 | AW201: 1 | AX201: =1-SUM(AV201:AW201) -> 0 | AY201: 0 | AZ201: 1 | BA201: =1-SUM(AY201:AZ201) -> 0 | BB201: 0 | BC201: 1 | BD201: =1-SUM(BB201:BC201) -> 0 | BE201: 0 | BF201: 1 | BG201: =1-SUM(BE201:BF201) -> 0 | BH201: 1 | BI201: 0 | BJ201: =1-SUM(BH201:BI201) -> 0 | BK201: 0 | BL201: 1 | BM201: =1-SUM(BK201:BL201) -> 0 | BN201: 1 | BO201: =1-BN201 -> 0
O202: 1 | P202: 0 | Q202: =1-SUM(O202:P202) -> 0 | R202: 0 | S202: 1 | T202: =1-SUM(R202:S202) -> 0 | U202: 0 | V202: 1 | W202: =1-SUM(U202:V202) -> 0 | X202: 0 | Y202: 1 | Z202: =1-SUM(X202:Y202) -> 0 | AA202: 1 | AB202: 0 | AC202: =1-SUM(AA202:AB202) -> 0 | AD202: 0 | AE202: 1 | AF202: =1-SUM(AD202:AE202) -> 0 | AG202: 0 | AH202: 1 | AI202: =1-SUM(AG202:AH202) -> 0 | AJ202: 0 | AK202: 1 | AL202: =1-SUM(AJ202:AK202) -> 0 | AM202: 1 | AN202: 0 | AO202: =1-SUM(AM202:AN202) -> 0 | AP202: 0 | AQ202: 1 | AR202: =1-SUM(AP202:AQ202) -> 0 | AS202: 0 | AT202: 1 | AU202: =1-SUM(AS202:AT202) -> 0 | AV202: 1 | AW202: 0 | AX202: =1-SUM(AV202:AW202) -> 0 | AY202: 1 | AZ202: 0 | BA202: =1-SUM(AY202:AZ202) -> 0 | BB202: 0 | BC202: 1 | BD202: =1-SUM(BB202:BC202) -> 0 | BE202: 1 | BF202: 0 | BG202: =1-SUM(BE202:BF202) -> 0 | BH202: 1 | BI202: 0 | BJ202: =1-SUM(BH202:BI202) -> 0 | BK202: 0 | BL202: 1 | BM202: =1-SUM(BK202:BL202) -> 0 | BN202: 1 | BO202: =1-BN202 -> 0
O203: 1 | P203: 0 | Q203: =1-SUM(O203:P203) -> 0 | R203: 1 | S203: 0 | T203: =1-SUM(R203:S203) -> 0 | U203: 1 | V203: 0 | W203: =1-SUM(U203:V203) -> 0 | X203: 1 | Y203: 0 | Z203: =1-SUM(X203:Y203) -> 0 | AA203: 1 | AB203: 0 | AC203: =1-SUM(AA203:AB203) -> 0 | AD203: 0 | AE203: 1 | AF203: =1-SUM(AD203:AE203) -> 0 | AG203: 0 | AH203: 1 | AI203: =1-SUM(AG203:AH203) -> 0 | AJ203: 1 | AK203: 0 | AL203: =1-SUM(AJ203:AK203) -> 0 | AM203: 1 | AN203: 0 | AO203: =1-SUM(AM203:AN203) -> 0 | AP203: 0 | AQ203: 1 | AR203: =1-SUM(AP203:AQ203) -> 0 | AS203: 0 | AT203: 1 | AU203: =1-SUM(AS203:AT203) -> 0 | AV203: 1 | AW203: 0 | AX203: =1-SUM(AV203:AW203) -> 0 | AY203: 1 | AZ203: 0 | BA203: =1-SUM(AY203:AZ203) -> 0 | BB203: 0 | BC203: 1 | BD203: =1-SUM(BB203:BC203) -> 0 | BE203: 0 | BF203: 1 | BG203: =1-SUM(BE203:BF203) -> 0 | BH203: 0 | BI203: 1 | BJ203: =1-SUM(BH203:BI203) -> 0 | BK203: 0 | BL203: 1 | BM203: =1-SUM(BK203:BL203) -> 0 | BN203: 1 | BO203: =1-BN203 -> 0
O204: 1 | P204: 0 | Q204: =1-SUM(O204:P204) -> 0 | R204: 0 | S204: 1 | T204: =1-SUM(R204:S204) -> 0 | U204: 0 | V204: 1 | W204: =1-SUM(U204:V204) -> 0 | X204: 0 | Y204: 1 | Z204: =1-SUM(X204:Y204) -> 0 | AA204: 1 | AB204: 0 | AC204: =1-SUM(AA204:AB204) -> 0 | AD204: 0 | AE204: 1 | AF204: =1-SUM(AD204:AE204) -> 0 | AG204: 0 | AH204: 1 | AI204: =1-SUM(AG204:AH204) -> 0 | AJ204: 0 | AK204: 1 | AL204: =1-SUM(AJ204:AK204) -> 0 | AM204: 0 | AN204: 1 | AO204: =1-SUM(AM204:AN204) -> 0 | AP204: 0 | AQ204: 1 | AR204: =1-SUM(AP204:AQ204) -> 0 | AS204: 0 | AT204: 1 | AU204: =1-SUM(AS204:AT204) -> 0 | AV204: 0 | AW204: 1 | AX204: =1-SUM(AV204:AW204) -> 0 | AY204: 1 | AZ204: 0 | BA204: =1-SUM(AY204:AZ204) -> 0 | BB204: 0 | BC204: 1 | BD204: =1-SUM(BB204:BC204) -> 0 | BE204: 1 | BF204: 0 | BG204: =1-SUM(BE204:BF204) -> 0 | BH204: 0 | BI204: 1 | BJ204: =1-SUM(BH204:BI204) -> 0 | BK204: 0 | BL204: 1 | BM204: =1-SUM(BK204:BL204) -> 0 | BN204: 0 | BO204: =1-BN204 -> 1
O205: 0 | P205: 1 | Q205: =1-SUM(O205:P205) -> 0 | R205: 0 | S205: 1 | T205: =1-SUM(R205:S205) -> 0 | U205: 0 | V205: 1 | W205: =1-SUM(U205:V205) -> 0 | X205: 0 | Y205: 1 | Z205: =1-SUM(X205:Y205) -> 0 | AA205: 0 | AB205: 1 | AC205: =1-SUM(AA205:AB205) -> 0 | AD205: 0 | AE205: 1 | AF205: =1-SUM(AD205:AE205) -> 0 | AG205: 0 | AH205: 1 | AI205: =1-SUM(AG205:AH205) -> 0 | AJ205: 0 | AK205: 1 | AL205: =1-SUM(AJ205:AK205) -> 0 | AM205: 0 | AN205: 1 | AO205: =1-SUM(AM205:AN205) -> 0 | AP205: 0 | AQ205: 1 | AR205: =1-SUM(AP205:AQ205) -> 0 | AS205: 0 | AT205: 1 | AU205: =1-SUM(AS205:AT205) -> 0 | AV205: 0 | AW205: 1 | AX205: =1-SUM(AV205:AW205) -> 0 | AY205: 0 | AZ205: 1 | BA205: =1-SUM(AY205:AZ205) -> 0 | BB205: 0 | BC205: 1 | BD205: =1-SUM(BB205:BC205) -> 0 | BE205: 0 | BF205: 1 | BG205: =1-SUM(BE205:BF205) -> 0 | BH205: 0 | BI205: 1 | BJ205: =1-SUM(BH205:BI205) -> 0 | BK205: 0 | BL205: 1 | BM205: =1-SUM(BK205:BL205) -> 0 | BN205: 1 | BO205: =1-BN205 -> 0
O206: 1 | P206: 0 | Q206: =1-SUM(O206:P206) -> 0 | R206: 1 | S206: 0 | T206: =1-SUM(R206:S206) -> 0 | U206: 1 | V206: 0 | W206: =1-SUM(U206:V206) -> 0 | X206: 1 | Y206: 0 | Z206: =1-SUM(X206:Y206) -> 0 | AA206: 1 | AB206: 0 | AC206: =1-SUM(AA206:AB206) -> 0 | AD206: 0 | AE206: 1 | AF206: =1-SUM(AD206:AE206) -> 0 | AG206: 0 | AH206: 1 | AI206: =1-SUM(AG206:AH206) -> 0 | AJ206: 1 | AK206: 0 | AL206: =1-SUM(AJ206:AK206) -> 0 | AM206: 1 | AN206: 0 | AO206: =1-SUM(AM206:AN206) -> 0 | AP206: 0 | AQ206: 1 | AR206: =1-SUM(AP206:AQ206) -> 0 | AS206: 0 | AT206: 1 | AU206: =1-SUM(AS206:AT206) -> 0 | AV206: 1 | AW206: 0 | AX206: =1-SUM(AV206:AW206) -> 0 | AY206: 1 | AZ206: 0 | BA206: =1-SUM(AY206:AZ206) -> 0 | BB206: 0 | BC206: 1 | BD206: =1-SUM(BB206:BC206) -> 0 | BE206: 0 | BF206: 1 | BG206: =1-SUM(BE206:BF206) -> 0 | BH206: 0 | BI206: 1 | BJ206: =1-SUM(BH206:BI206) -> 0 | BK206: 0 | BL206: 1 | BM206: =1-SUM(BK206:BL206) -> 0 | BN206: 1 | BO206: =1-BN206 -> 0
O207: 1 | P207: 0 | Q207: =1-SUM(O207:P207) -> 0 | R207: 0 | S207: 1 | T207: =1-SUM(R207:S207) -> 0 | U207: 0 | V207: 1 | W207: =1-SUM(U207:V207) -> 0 | X207: 0 | Y207: 1 | Z207: =1-SUM(X207:Y207) -> 0 | AA207: 1 | AB207: 0 | AC207: =1-SUM(AA207:AB207) -> 0 | AD207: 0 | AE207: 1 | AF207: =1-SUM(AD207:AE207) -> 0 | AG207: 0 | AH207: 1 | AI207: =1-SUM(AG207:AH207) -> 0 | AJ207: 0 | AK207: 1 | AL207: =1-SUM(AJ207:AK207) -> 0 | AM207: 0 | AN207: 1 | AO207: =1-SUM(AM207:AN207) -> 0 | AP207: 0 | AQ207: 1 | AR207: =1-SUM(AP207:AQ207) -> 0 | AS207: 0 | AT207: 1 | AU207: =1-SUM(AS207:AT207) -> 0 | AV207: 0 | AW207: 1 | AX207: =1-SUM(AV207:AW207) -> 0 | AY207: 1 | AZ207: 0 | BA207: =1-SUM(AY207:AZ207) -> 0 | BB207: 0 | BC207: 1 | BD207: =1-SUM(BB207:BC207) -> 0 | BE207: 1 | BF207: 0 | BG207: =1-SUM(BE207:BF207) -> 0 | BH207: 0 | BI207: 1 | BJ207: =1-SUM(BH207:BI207) -> 0 | BK207: 0 | BL207: 1 | BM207: =1-SUM(BK207:BL207) -> 0 | BN207: 1 | BO207: =1-BN207 -> 0
O208: 1 | P208: 0 | Q208: =1-SUM(O208:P208) -> 0 | R208: 1 | S208: 0 | T208: =1-SUM(R208:S208) -> 0 | U208: 0 | V208: 1 | W208: =1-SUM(U208:V208) -> 0 | X208: 0 | Y208: 1 | Z208: =1-SUM(X208:Y208) -> 0 | AA208: 1 | AB208: 0 | AC208: =1-SUM(AA208:AB208) -> 0 | AD208: 0 | AE208: 1 | AF208: =1-SUM(AD208:AE208) -> 0 | AG208: 0 | AH208: 1 | AI208: =1-SUM(AG208:AH208) -> 0 | AJ208: 0 | AK208: 1 | AL208: =1-SUM(AJ208:AK208) -> 0 | AM208: 1 | AN208: 0 | AO208: =1-SUM(AM208:AN208) -> 0 | AP208: 0 | AQ208: 1 | AR208: =1-SUM(AP208:AQ208) -> 0 | AS208: 1 | AT208: 0 | AU208: =1-SUM(AS208:AT208) -> 0 | AV208: 1 | AW208: 0 | AX208: =1-SUM(AV208:AW208) -> 0 | AY208: 1 | AZ208: 0 | BA208: =1-SUM(AY208:AZ208) -> 0 | BB208: 0 | BC208: 1 | BD208: =1-SUM(BB208:BC208) -> 0 | BE208: 0 | BF208: 1 | BG208: =1-SUM(BE208:BF208) -> 0 | BH208: 0 | BI208: 1 | BJ208: =1-SUM(BH208:BI208) -> 0 | BK208: 0 | BL208: 1 | BM208: =1-SUM(BK208:BL208) -> 0 | BN208: 1 | BO208: =1-BN208 -> 0
O209: 1 | P209: 0 | Q209: =1-SUM(O209:P209) -> 0 | R209: 1 | S209: 0 | T209: =1-SUM(R209:S209) -> 0 | U209: 0 | V209: 1 | W209: =1-SUM(U209:V209) -> 0 | X209: 0 | Y209: 1 | Z209: =1-SUM(X209:Y209) -> 0 | AA209: 1 | AB209: 0 | AC209: =1-SUM(AA209:AB209) -> 0 | AD209: 0 | AE209: 1 | AF209: =1-SUM(AD209:AE209) -> 0 | AG209: 0 | AH209: 1 | AI209: =1-SUM(AG209:AH209) -> 0 | AJ209: 1 | AK209: 0 | AL209: =1-SUM(AJ209:AK209) -> 0 | AM209: 0 | AN209: 1 | AO209: =1-SUM(AM209:AN209) -> 0 | AP209: 0 | AQ209: 1 | AR209: =1-SUM(AP209:AQ209) -> 0 | AS209: 0 | AT209: 1 | AU209: =1-SUM(AS209:AT209) -> 0 | AV209: 1 | AW209: 0 | AX209: =1-SUM(AV209:AW209) -> 0 | AY209: 0 | AZ209: 1 | BA209: =1-SUM(AY209:AZ209) -> 0 | BB209: 0 | BC209: 1 | BD209: =1-SUM(BB209:BC209) -> 0 | BE209: 0 | BF209: 1 | BG209: =1-SUM(BE209:BF209) -> 0 | BH209: 1 | BI209: 0 | BJ209: =1-SUM(BH209:BI209) -> 0 | BK209: 0 | BL209: 1 | BM209: =1-SUM(BK209:BL209) -> 0 | BN209: 1 | BO209: =1-BN209 -> 0
O210: 1 | P210: 0 | Q210: =1-SUM(O210:P210) -> 0 | R210: 1 | S210: 0 | T210: =1-SUM(R210:S210) -> 0 | U210: 1 | V210: 0 | W210: =1-SUM(U210:V210) -> 0 | X210: 1 | Y210: 0 | Z210: =1-SUM(X210:Y210) -> 0 | AA210: 1 | AB210: 0 | AC210: =1-SUM(AA210:AB210) -> 0 | AD210: 0 | AE210: 1 | AF210: =1-SUM(AD210:AE210) -> 0 | AG210: 0 | AH210: 1 | AI210: =1-SUM(AG210:AH210) -> 0 | AJ210: 1 | AK210: 0 | AL210: =1-SUM(AJ210:AK210) -> 0 | AM210: 0 | AN210: 1 | AO210: =1-SUM(AM210:AN210) -> 0 | AP210: 0 | AQ210: 1 | AR210: =1-SUM(AP210:AQ210) -> 0 | AS210: 0 | AT210: 1 | AU210: =1-SUM(AS210:AT210) -> 0 | AV210: 1 | AW210: 0 | AX210: =1-SUM(AV210:AW210) -> 0 | AY210: 1 | AZ210: 0 | BA210: =1-SUM(AY210:AZ210) -> 0 | BB210: 0 | BC210: 1 | BD210: =1-SUM(BB210:BC210) -> 0 | BE210: 0 | BF210: 1 | BG210: =1-SUM(BE210:BF210) -> 0 | BH210: 0 | BI210: 1 | BJ210: =1-SUM(BH210:BI210) -> 0 | BK210: 0 | BL210: 1 | BM210: =1-SUM(BK210:BL210) -> 0 | BN210: 1 | BO210: =1-BN210 -> 0
O211: 1 | P211: 0 | Q211: =1-SUM(O211:P211) -> 0 | R211: 1 | S211: 0 | T211: =1-SUM(R211:S211) -> 0 | U211: 1 | V211: 0 | W211: =1-SUM(U211:V211) -> 0 | X211: 0 | Y211: 1 | Z211: =1-SUM(X211:Y211) -> 0 | AA211: 0 | AB211: 1 | AC211: =1-SUM(AA211:AB211) -> 0 | AD211: 1 | AE211: 0 | AF211: =1-SUM(AD211:AE211) -> 0 | AG211: 1 | AH211: 0 | AI211: =1-SUM(AG211:AH211) -> 0 | AJ211: 0 | AK211: 1 | AL211: =1-SUM(AJ211:AK211) -> 0 | AM211: 0 | AN211: 1 | AO211: =1-SUM(AM211:AN211) -> 0 | AP211: 0 | AQ211: 1 | AR211: =1-SUM(AP211:AQ211) -> 0 | AS211: 0 | AT211: 1 | AU211: =1-SUM(AS211:AT211) -> 0 | AV211: 0 | AW211: 1 | AX211: =1-SUM(AV211:AW211) -> 0 | AY211: 0 | AZ211: 1 | BA211: =1-SUM(AY211:AZ211) -> 0 | BB211: 0 | BC211: 1 | BD211: =1-SUM(BB211:BC211) -> 0 | BE211: 0 | BF211: 1 | BG211: =1-SUM(BE211:BF211) -> 0 | BH211: 0 | BI211: 1 | BJ211: =1-SUM(BH211:BI211) -> 0 | BK211: 0 | BL211: 1 | BM211: =1-SUM(BK211:BL211) -> 0 | BN211: 1 | BO211: =1-BN211 -> 0
O212: 1 | P212: 0 | Q212: =1-SUM(O212:P212) -> 0 | R212: 1 | S212: 0 | T212: =1-SUM(R212:S212) -> 0 | U212: 1 | V212: 0 | W212: =1-SUM(U212:V212) -> 0 | X212: 1 | Y212: 0 | Z212: =1-SUM(X212:Y212) -> 0 | AA212: 1 | AB212: 0 | AC212: =1-SUM(AA212:AB212) -> 0 | AD212: 0 | AE212: 1 | AF212: =1-SUM(AD212:AE212) -> 0 | AG212: 0 | AH212: 1 | AI212: =1-SUM(AG212:AH212) -> 0 | AJ212: 1 | AK212: 0 | AL212: =1-SUM(AJ212:AK212) -> 0 | AM212: 1 | AN212: 0 | AO212: =1-SUM(AM212:AN212) -> 0 | AP212: 0 | AQ212: 1 | AR212: =1-SUM(AP212:AQ212) -> 0 | AS212: 0 | AT212: 1 | AU212: =1-SUM(AS212:AT212) -> 0 | AV212: 1 | AW212: 0 | AX212: =1-SUM(AV212:AW212) -> 0 | AY212: 0 | AZ212: 1 | BA212: =1-SUM(AY212:AZ212) -> 0 | BB212: 0 | BC212: 1 | BD212: =1-SUM(BB212:BC212) -> 0 | BE212: 0 | BF212: 1 | BG212: =1-SUM(BE212:BF212) -> 0 | BH212: 0 | BI212: 1 | BJ212: =1-SUM(BH212:BI212) -> 0 | BK212: 0 | BL212: 1 | BM212: =1-SUM(BK212:BL212) -> 0 | BN212: 1 | BO212: =1-BN212 -> 0
O213: 1 | P213: 0 | Q213: =1-SUM(O213:P213) -> 0 | R213: 1 | S213: 0 | T213: =1-SUM(R213:S213) -> 0 | U213: 1 | V213: 0 | W213: =1-SUM(U213:V213) -> 0 | X213: 1 | Y213: 0 | Z213: =1-SUM(X213:Y213) -> 0 | AA213: 1 | AB213: 0 | AC213: =1-SUM(AA213:AB213) -> 0 | AD213: 1 | AE213: 0 | AF213: =1-SUM(AD213:AE213) -> 0 | AG213: 1 | AH213: 0 | AI213: =1-SUM(AG213:AH213) -> 0 | AJ213: 1 | AK213: 0 | AL213: =1-SUM(AJ213:AK213) -> 0 | AM213: 1 | AN213: 0 | AO213: =1-SUM(AM213:AN213) -> 0 | AP213: 0 | AQ213: 1 | AR213: =1-SUM(AP213:AQ213) -> 0 | AS213: 0 | AT213: 1 | AU213: =1-SUM(AS213:AT213) -> 0 | AV213: 1 | AW213: 0 | AX213: =1-SUM(AV213:AW213) -> 0 | AY213: 1 | AZ213: 0 | BA213: =1-SUM(AY213:AZ213) -> 0 | BB213: 0 | BC213: 1 | BD213: =1-SUM(BB213:BC213) -> 0 | BE213: 0 | BF213: 1 | BG213: =1-SUM(BE213:BF213) -> 0 | BH213: 0 | BI213: 1 | BJ213: =1-SUM(BH213:BI213) -> 0 | BK213: 0 | BL213: 1 | BM213: =1-SUM(BK213:BL213) -> 0 | BN213: 1 | BO213: =1-BN213 -> 0
O214: 0 | P214: 1 | Q214: =1-SUM(O214:P214) -> 0 | R214: 1 | S214: 0 | T214: =1-SUM(R214:S214) -> 0 | U214: 1 | V214: 0 | W214: =1-SUM(U214:V214) -> 0 | X214: 1 | Y214: 0 | Z214: =1-SUM(X214:Y214) -> 0 | AA214: 1 | AB214: 0 | AC214: =1-SUM(AA214:AB214) -> 0 | AD214: 0 | AE214: 1 | AF214: =1-SUM(AD214:AE214) -> 0 | AG214: 0 | AH214: 1 | AI214: =1-SUM(AG214:AH214) -> 0 | AJ214: 1 | AK214: 0 | AL214: =1-SUM(AJ214:AK214) -> 0 | AM214: 1 | AN214: 0 | AO214: =1-SUM(AM214:AN214) -> 0 | AP214: 0 | AQ214: 1 | AR214: =1-SUM(AP214:AQ214) -> 0 | AS214: 0 | AT214: 1 | AU214: =1-SUM(AS214:AT214) -> 0 | AV214: 1 | AW214: 0 | AX214: =1-SUM(AV214:AW214) -> 0 | AY214: 0 | AZ214: 1 | BA214: =1-SUM(AY214:AZ214) -> 0 | BB214: 0 | BC214: 1 | BD214: =1-SUM(BB214:BC214) -> 0 | BE214: 0 | BF214: 1 | BG214: =1-SUM(BE214:BF214) -> 0 | BH214: 0 | BI214: 1 | BJ214: =1-SUM(BH214:BI214) -> 0 | BK214: 0 | BL214: 1 | BM214: =1-SUM(BK214:BL214) -> 0 | BN214: 1 | BO214: =1-BN214 -> 0
O215: 1 | P215: 0 | Q215: =1-SUM(O215:P215) -> 0 | R215: 0 | S215: 1 | T215: =1-SUM(R215:S215) -> 0 | U215: 0 | V215: 1 | W215: =1-SUM(U215:V215) -> 0 | X215: 0 | Y215: 1 | Z215: =1-SUM(X215:Y215) -> 0 | AA215: 0 | AB215: 1 | AC215: =1-SUM(AA215:AB215) -> 0 | AD215: 0 | AE215: 1 | AF215: =1-SUM(AD215:AE215) -> 0 | AG215: 0 | AH215: 1 | AI215: =1-SUM(AG215:AH215) -> 0 | AJ215: 0 | AK215: 1 | AL215: =1-SUM(AJ215:AK215) -> 0 | AM215: 0 | AN215: 1 | AO215: =1-SUM(AM215:AN215) -> 0 | AP215: 0 | AQ215: 1 | AR215: =1-SUM(AP215:AQ215) -> 0 | AS215: 0 | AT215: 1 | AU215: =1-SUM(AS215:AT215) -> 0 | AV215: 0 | AW215: 1 | AX215: =1-SUM(AV215:AW215) -> 0 | AY215: 0 | AZ215: 1 | BA215: =1-SUM(AY215:AZ215) -> 0 | BB215: 0 | BC215: 1 | BD215: =1-SUM(BB215:BC215) -> 0 | BE215: 0 | BF215: 1 | BG215: =1-SUM(BE215:BF215) -> 0 | BH215: 0 | BI215: 1 | BJ215: =1-SUM(BH215:BI215) -> 0 | BK215: 0 | BL215: 1 | BM215: =1-SUM(BK215:BL215) -> 0 | BN215: 1 | BO215: =1-BN215 -> 0
O216: 0 | P216: 1 | Q216: =1-SUM(O216:P216) -> 0 | R216: 1 | S216: 0 | T216: =1-SUM(R216:S216) -> 0 | U216: 1 | V216: 0 | W216: =1-SUM(U216:V216) -> 0 | X216: 1 | Y216: 0 | Z216: =1-SUM(X216:Y216) -> 0 | AA216: 1 | AB216: 0 | AC216: =1-SUM(AA216:AB216) -> 0 | AD216: 1 | AE216: 0 | AF216: =1-SUM(AD216:AE216) -> 0 | AG216: 0 | AH216: 1 | AI216: =1-SUM(AG216:AH216) -> 0 | AJ216: 1 | AK216: 0 | AL216: =1-SUM(AJ216:AK216) -> 0 | AM216: 1 | AN216: 0 | AO216: =1-SUM(AM216:AN216) -> 0 | AP216: 0 | AQ216: 1 | AR216: =1-SUM(AP216:AQ216) -> 0 | AS216: 0 | AT216: 1 | AU216: =1-SUM(AS216:AT216) -> 0 | AV216: 1 | AW216: 0 | AX216: =1-SUM(AV216:AW216) -> 0 | AY216: 0 | AZ216: 1 | BA216: =1-SUM(AY216:AZ216) -> 0 | BB216: 0 | BC216: 1 | BD216: =1-SUM(BB216:BC216) -> 0 | BE216: 0 | BF216: 1 | BG216: =1-SUM(BE216:BF216) -> 0 | BH216: 0 | BI216: 1 | BJ216: =1-SUM(BH216:BI216) -> 0 | BK216: 0 | BL216: 1 | BM216: =1-SUM(BK216:BL216) -> 0 | BN216: 0 | BO216: =1-BN216 -> 1
O217: 1 | P217: 0 | Q217: =1-SUM(O217:P217) -> 0 | R217: 0 | S217: 1 | T217: =1-SUM(R217:S217) -> 0 | U217: 0 | V217: 1 | W217: =1-SUM(U217:V217) -> 0 | X217: 0 | Y217: 1 | Z217: =1-SUM(X217:Y217) -> 0 | AA217: 0 | AB217: 1 | AC217: =1-SUM(AA217:AB217) -> 0 | AD217: 0 | AE217: 1 | AF217: =1-SUM(AD217:AE217) -> 0 | AG217: 0 | AH217: 1 | AI217: =1-SUM(AG217:AH217) -> 0 | AJ217: 0 | AK217: 1 | AL217: =1-SUM(AJ217:AK217) -> 0 | AM217: 0 | AN217: 1 | AO217: =1-SUM(AM217:AN217) -> 0 | AP217: 0 | AQ217: 1 | AR217: =1-SUM(AP217:AQ217) -> 0 | AS217: 0 | AT217: 1 | AU217: =1-SUM(AS217:AT217) -> 0 | AV217: 0 | AW217: 1 | AX217: =1-SUM(AV217:AW217) -> 0 | AY217: 0 | AZ217: 1 | BA217: =1-SUM(AY217:AZ217) -> 0 | BB217: 0 | BC217: 1 | BD217: =1-SUM(BB217:BC217) -> 0 | BE217: 0 | BF217: 1 | BG217: =1-SUM(BE217:BF217) -> 0 | BH217: 0 | BI217: 1 | BJ217: =1-SUM(BH217:BI217) -> 0 | BK217: 0 | BL217: 1 | BM217: =1-SUM(BK217:BL217) -> 0 | BN217: 1 | BO217: =1-BN217 -> 0
O218: 1 | P218: 0 | Q218: =1-SUM(O218:P218) -> 0 | R218: 0 | S218: 1 | T218: =1-SUM(R218:S218) -> 0 | U218: 0 | V218: 1 | W218: =1-SUM(U218:V218) -> 0 | X218: 0 | Y218: 1 | Z218: =1-SUM(X218:Y218) -> 0 | AA218: 1 | AB218: 0 | AC218: =1-SUM(AA218:AB218) -> 0 | AD218: 0 | AE218: 1 | AF218: =1-SUM(AD218:AE218) -> 0 | AG218: 0 | AH218: 1 | AI218: =1-SUM(AG218:AH218) -> 0 | AJ218: 0 | AK218: 1 | AL218: =1-SUM(AJ218:AK218) -> 0 | AM218: 0 | AN218: 1 | AO218: =1-SUM(AM218:AN218) -> 0 | AP218: 0 | AQ218: 1 | AR218: =1-SUM(AP218:AQ218) -> 0 | AS218: 0 | AT218: 1 | AU218: =1-SUM(AS218:AT218) -> 0 | AV218: 0 | AW218: 1 | AX218: =1-SUM(AV218:AW218) -> 0 | AY218: 1 | AZ218: 0 | BA218: =1-SUM(AY218:AZ218) -> 0 | BB218: 0 | BC218: 1 | BD218: =1-SUM(BB218:BC218) -> 0 | BE218: 1 | BF218: 0 | BG218: =1-SUM(BE218:BF218) -> 0 | BH218: 0 | BI218: 1 | BJ218: =1-SUM(BH218:BI218) -> 0 | BK218: 0 | BL218: 1 | BM218: =1-SUM(BK218:BL218) -> 0 | BN218: 0 | BO218: =1-BN218 -> 1
O219: 0 | P219: 1 | Q219: =1-SUM(O219:P219) -> 0 | R219: 0 | S219: 1 | T219: =1-SUM(R219:S219) -> 0 | U219: 0 | V219: 1 | W219: =1-SUM(U219:V219) -> 0 | X219: 0 | Y219: 1 | Z219: =1-SUM(X219:Y219) -> 0 | AA219: 0 | AB219: 1 | AC219: =1-SUM(AA219:AB219) -> 0 | AD219: 1 | AE219: 0 | AF219: =1-SUM(AD219:AE219) -> 0 | AG219: 1 | AH219: 0 | AI219: =1-SUM(AG219:AH219) -> 0 | AJ219: 0 | AK219: 1 | AL219: =1-SUM(AJ219:AK219) -> 0 | AM219: 0 | AN219: 1 | AO219: =1-SUM(AM219:AN219) -> 0 | AP219: 0 | AQ219: 1 | AR219: =1-SUM(AP219:AQ219) -> 0 | AS219: 0 | AT219: 1 | AU219: =1-SUM(AS219:AT219) -> 0 | AV219: 0 | AW219: 1 | AX219: =1-SUM(AV219:AW219) -> 0 | AY219: 0 | AZ219: 1 | BA219: =1-SUM(AY219:AZ219) -> 0 | BB219: 0 | BC219: 1 | BD219: =1-SUM(BB219:BC219) -> 0 | BE219: 0 | BF219: 1 | BG219: =1-SUM(BE219:BF219) -> 0 | BH219: 0 | BI219: 1 | BJ219: =1-SUM(BH219:BI219) -> 0 | BK219: 0 | BL219: 1 | BM219: =1-SUM(BK219:BL219) -> 0 | BN219: 0 | BO219: =1-BN219 -> 1
O220: 1 | P220: 0 | Q220: =1-SUM(O220:P220) -> 0 | R220: 0 | S220: 1 | T220: =1-SUM(R220:S220) -> 0 | U220: 0 | V220: 1 | W220: =1-SUM(U220:V220) -> 0 | X220: 0 | Y220: 1 | Z220: =1-SUM(X220:Y220) -> 0 | AA220: 1 | AB220: 0 | AC220: =1-SUM(AA220:AB220) -> 0 | AD220: 0 | AE220: 1 | AF220: =1-SUM(AD220:AE220) -> 0 | AG220: 1 | AH220: 0 | AI220: =1-SUM(AG220:AH220) -> 0 | AJ220: 1 | AK220: 0 | AL220: =1-SUM(AJ220:AK220) -> 0 | AM220: 1 | AN220: 0 | AO220: =1-SUM(AM220:AN220) -> 0 | AP220: 0 | AQ220: 1 | AR220: =1-SUM(AP220:AQ220) -> 0 | AS220: 1 | AT220: 0 | AU220: =1-SUM(AS220:AT220) -> 0 | AV220: 1 | AW220: 0 | AX220: =1-SUM(AV220:AW220) -> 0 | AY220: 1 | AZ220: 0 | BA220: =1-SUM(AY220:AZ220) -> 0 | BB220: 0 | BC220: 1 | BD220: =1-SUM(BB220:BC220) -> 0 | BE220: 1 | BF220: 0 | BG220: =1-SUM(BE220:BF220) -> 0 | BH220: 0 | BI220: 1 | BJ220: =1-SUM(BH220:BI220) -> 0 | BK220: 0 | BL220: 1 | BM220: =1-SUM(BK220:BL220) -> 0 | BN220: 0 | BO220: =1-BN220 -> 1
O221: 1 | P221: 0 | Q221: =1-SUM(O221:P221) -> 0 | R221: 0 | S221: 1 | T221: =1-SUM(R221:S221) -> 0 | U221: 0 | V221: 1 | W221: =1-SUM(U221:V221) -> 0 | X221: 0 | Y221: 1 | Z221: =1-SUM(X221:Y221) -> 0 | AA221: 0 | AB221: 1 | AC221: =1-SUM(AA221:AB221) -> 0 | AD221: 0 | AE221: 1 | AF221: =1-SUM(AD221:AE221) -> 0 | AG221: 1 | AH221: 0 | AI221: =1-SUM(AG221:AH221) -> 0 | AJ221: 1 | AK221: 0 | AL221: =1-SUM(AJ221:AK221) -> 0 | AM221: 1 | AN221: 0 | AO221: =1-SUM(AM221:AN221) -> 0 | AP221: 0 | AQ221: 1 | AR221: =1-SUM(AP221:AQ221) -> 0 | AS221: 1 | AT221: 0 | AU221: =1-SUM(AS221:AT221) -> 0 | AV221: 0 | AW221: 1 | AX221: =1-SUM(AV221:AW221) -> 0 | AY221: 0 | AZ221: 1 | BA221: =1-SUM(AY221:AZ221) -> 0 | BB221: 0 | BC221: 1 | BD221: =1-SUM(BB221:BC221) -> 0 | BE221: 0 | BF221: 1 | BG221: =1-SUM(BE221:BF221) -> 0 | BH221: 0 | BI221: 1 | BJ221: =1-SUM(BH221:BI221) -> 0 | BK221: 0 | BL221: 1 | BM221: =1-SUM(BK221:BL221) -> 0 | BN221: 0 | BO221: =1-BN221 -> 1
O222: 1 | P222: 0 | Q222: =1-SUM(O222:P222) -> 0 | R222: 1 | S222: 0 | T222: =1-SUM(R222:S222) -> 0 | U222: 1 | V222: 0 | W222: =1-SUM(U222:V222) -> 0 | X222: 1 | Y222: 0 | Z222: =1-SUM(X222:Y222) -> 0 | AA222: 1 | AB222: 0 | AC222: =1-SUM(AA222:AB222) -> 0 | AD222: 0 | AE222: 1 | AF222: =1-SUM(AD222:AE222) -> 0 | AG222: 0 | AH222: 1 | AI222: =1-SUM(AG222:AH222) -> 0 | AJ222: 0 | AK222: 1 | AL222: =1-SUM(AJ222:AK222) -> 0 | AM222: 0 | AN222: 1 | AO222: =1-SUM(AM222:AN222) -> 0 | AP222: 0 | AQ222: 1 | AR222: =1-SUM(AP222:AQ222) -> 0 | AS222: 0 | AT222: 1 | AU222: =1-SUM(AS222:AT222) -> 0 | AV222: 0 | AW222: 1 | AX222: =1-SUM(AV222:AW222) -> 0 | AY222: 0 | AZ222: 1 | BA222: =1-SUM(AY222:AZ222) -> 0 | BB222: 0 | BC222: 1 | BD222: =1-SUM(BB222:BC222) -> 0 | BE222: 0 | BF222: 1 | BG222: =1-SUM(BE222:BF222) -> 0 | BH222: 0 | BI222: 1 | BJ222: =1-SUM(BH222:BI222) -> 0 | BK222: 0 | BL222: 1 | BM222: =1-SUM(BK222:BL222) -> 0 | BN222: 1 | BO222: =1-BN222 -> 0
O223: 1 | P223: 0 | Q223: =1-SUM(O223:P223) -> 0 | R223: 1 | S223: 0 | T223: =1-SUM(R223:S223) -> 0 | U223: 1 | V223: 0 | W223: =1-SUM(U223:V223) -> 0 | X223: 1 | Y223: 0 | Z223: =1-SUM(X223:Y223) -> 0 | AA223: 0 | AB223: 1 | AC223: =1-SUM(AA223:AB223) -> 0 | AD223: 0 | AE223: 1 | AF223: =1-SUM(AD223:AE223) -> 0 | AG223: 0 | AH223: 1 | AI223: =1-SUM(AG223:AH223) -> 0 | AJ223: 0 | AK223: 1 | AL223: =1-SUM(AJ223:AK223) -> 0 | AM223: 1 | AN223: 0 | AO223: =1-SUM(AM223:AN223) -> 0 | AP223: 0 | AQ223: 1 | AR223: =1-SUM(AP223:AQ223) -> 0 | AS223: 0 | AT223: 1 | AU223: =1-SUM(AS223:AT223) -> 0 | AV223: 0 | AW223: 1 | AX223: =1-SUM(AV223:AW223) -> 0 | AY223: 0 | AZ223: 1 | BA223: =1-SUM(AY223:AZ223) -> 0 | BB223: 0 | BC223: 1 | BD223: =1-SUM(BB223:BC223) -> 0 | BE223: 0 | BF223: 1 | BG223: =1-SUM(BE223:BF223) -> 0 | BH223: 0 | BI223: 1 | BJ223: =1-SUM(BH223:BI223) -> 0 | BK223: 0 | BL223: 1 | BM223: =1-SUM(BK223:BL223) -> 0 | BN223: 0 | BO223: =1-BN223 -> 1
O224: 1 | P224: 0 | Q224: =1-SUM(O224:P224) -> 0 | R224: 1 | S224: 0 | T224: =1-SUM(R224:S224) -> 0 | U224: 1 | V224: 0 | W224: =1-SUM(U224:V224) -> 0 | X224: 1 | Y224: 0 | Z224: =1-SUM(X224:Y224) -> 0 | AA224: 0 | AB224: 1 | AC224: =1-SUM(AA224:AB224) -> 0 | AD224: 0 | AE224: 1 | AF224: =1-SUM(AD224:AE224) -> 0 | AG224: 0 | AH224: 1 | AI224: =1-SUM(AG224:AH224) -> 0 | AJ224: 1 | AK224: 0 | AL224: =1-SUM(AJ224:AK224) -> 0 | AM224: 1 | AN224: 0 | AO224: =1-SUM(AM224:AN224) -> 0 | AP224: 0 | AQ224: 1 | AR224: =1-SUM(AP224:AQ224) -> 0 | AS224: 0 | AT224: 1 | AU224: =1-SUM(AS224:AT224) -> 0 | AV224: 0 | AW224: 1 | AX224: =1-SUM(AV224:AW224) -> 0 | AY224: 0 | AZ224: 1 | BA224: =1-SUM(AY224:AZ224) -> 0 | BB224: 0 | BC224: 1 | BD224: =1-SUM(BB224:BC224) -> 0 | BE224: 0 | BF224: 1 | BG224: =1-SUM(BE224:BF224) -> 0 | BH224: 0 | BI224: 1 | BJ224: =1-SUM(BH224:BI224) -> 0 | BK224: 0 | BL224: 1 | BM224: =1-SUM(BK224:BL224) -> 0 | BN224: 0 | BO224: =1-BN224 -> 1
O225: 1 | P225: 0 | Q225: =1-SUM(O225:P225) -> 0 | R225: 1 | S225: 0 | T225: =1-SUM(R225:S225) -> 0 | U225: 1 | V225: 0 | W225: =1-SUM(U225:V225) -> 0 | X225: 1 | Y225: 0 | Z225: =1-SUM(X225:Y225) -> 0 | AA225: 0 | AB225: 1 | AC225: =1-SUM(AA225:AB225) -> 0 | AD225: 1 | AE225: 0 | AF225: =1-SUM(AD225:AE225) -> 0 | AG225: 1 | AH225: 0 | AI225: =1-SUM(AG225:AH225) -> 0 | AJ225: 1 | AK225: 0 | AL225: =1-SUM(AJ225:AK225) -> 0 | AM225: 1 | AN225: 0 | AO225: =1-SUM(AM225:AN225) -> 0 | AP225: 0 | AQ225: 1 | AR225: =1-SUM(AP225:AQ225) -> 0 | AS225: 0 | AT225: 1 | AU225: =1-SUM(AS225:AT225) -> 0 | AV225: 0 | AW225: 1 | AX225: =1-SUM(AV225:AW225) -> 0 | AY225: 0 | AZ225: 1 | BA225: =1-SUM(AY225:AZ225) -> 0 | BB225: 0 | BC225: 1 | BD225: =1-SUM(BB225:BC225) -> 0 | BE225: 0 | BF225: 1 | BG225: =1-SUM(BE225:BF225) -> 0 | BH225: 0 | BI225: 1 | BJ225: =1-SUM(BH225:BI225) -> 0 | BK225: 0 | BL225: 1 | BM225: =1-SUM(BK225:BL225) -> 0 | BN225: 0 | BO225: =1-BN225 -> 1
O226: 0 | P226: 1 | Q226: =1-SUM(O226:P226) -> 0 | R226: 1 | S226: 0 | T226: =1-SUM(R226:S226) -> 0 | U226: 1 | V226: 0 | W226: =1-SUM(U226:V226) -> 0 | X226: 1 | Y226: 0 | Z226: =1-SUM(X226:Y226) -> 0 | AA226: 0 | AB226: 1 | AC226: =1-SUM(AA226:AB226) -> 0 | AD226: 1 | AE226: 0 | AF226: =1-SUM(AD226:AE226) -> 0 | AG226: 1 | AH226: 0 | AI226: =1-SUM(AG226:AH226) -> 0 | AJ226: 1 | AK226: 0 | AL226: =1-SUM(AJ226:AK226) -> 0 | AM226: 1 | AN226: 0 | AO226: =1-SUM(AM226:AN226) -> 0 | AP226: 0 | AQ226: 1 | AR226: =1-SUM(AP226:AQ226) -> 0 | AS226: 0 | AT226: 1 | AU226: =1-SUM(AS226:AT226) -> 0 | AV226: 0 | AW226: 1 | AX226: =1-SUM(AV226:AW226) -> 0 | AY226: 0 | AZ226: 1 | BA226: =1-SUM(AY226:AZ226) -> 0 | BB226: 0 | BC226: 1 | BD226: =1-SUM(BB226:BC226) -> 0 | BE226: 0 | BF226: 1 | BG226: =1-SUM(BE226:BF226) -> 0 | BH226: 0 | BI226: 1 | BJ226: =1-SUM(BH226:BI226) -> 0 | BK226: 0 | BL226: 1 | BM226: =1-SUM(BK226:BL226) -> 0 | BN226: 0 | BO226: =1-BN226 -> 1
O227: 1 | P227: 0 | Q227: =1-SUM(O227:P227) -> 0 | R227: 0 | S227: 1 | T227: =1-SUM(R227:S227) -> 0 | U227: 0 | V227: 1 | W227: =1-SUM(U227:V227) -> 0 | X227: 0 | Y227: 1 | Z227: =1-SUM(X227:Y227) -> 0 | AA227: 1 | AB227: 0 | AC227: =1-SUM(AA227:AB227) -> 0 | AD227: 1 | AE227: 0 | AF227: =1-SUM(AD227:AE227) -> 0 | AG227: 1 | AH227: 0 | AI227: =1-SUM(AG227:AH227) -> 0 | AJ227: 0 | AK227: 1 | AL227: =1-SUM(AJ227:AK227) -> 0 | AM227: 0 | AN227: 1 | AO227: =1-SUM(AM227:AN227) -> 0 | AP227: 0 | AQ227: 1 | AR227: =1-SUM(AP227:AQ227) -> 0 | AS227: 0 | AT227: 1 | AU227: =1-SUM(AS227:AT227) -> 0 | AV227: 1 | AW227: 0 | AX227: =1-SUM(AV227:AW227) -> 0 | AY227: 1 | AZ227: 0 | BA227: =1-SUM(AY227:AZ227) -> 0 | BB227: 1 | BC227: 0 | BD227: =1-SUM(BB227:BC227) -> 0 | BE227: 1 | BF227: 0 | BG227: =1-SUM(BE227:BF227) -> 0 | BH227: 0 | BI227: 1 | BJ227: =1-SUM(BH227:BI227) -> 0 | BK227: 0 | BL227: 1 | BM227: =1-SUM(BK227:BL227) -> 0 | BN227: 0 | BO227: =1-BN227 -> 1
O228: 1 | P228: 0 | Q228: =1-SUM(O228:P228) -> 0 | R228: 0 | S228: 1 | T228: =1-SUM(R228:S228) -> 0 | U228: 0 | V228: 1 | W228: =1-SUM(U228:V228) -> 0 | X228: 0 | Y228: 1 | Z228: =1-SUM(X228:Y228) -> 0 | AA228: 0 | AB228: 1 | AC228: =1-SUM(AA228:AB228) -> 0 | AD228: 0 | AE228: 1 | AF228: =1-SUM(AD228:AE228) -> 0 | AG228: 0 | AH228: 1 | AI228: =1-SUM(AG228:AH228) -> 0 | AJ228: 0 | AK228: 1 | AL228: =1-SUM(AJ228:AK228) -> 0 | AM228: 0 | AN228: 1 | AO228: =1-SUM(AM228:AN228) -> 0 | AP228: 1 | AQ228: 0 | AR228: =1-SUM(AP228:AQ228) -> 0 | AS228: 0 | AT228: 1 | AU228: =1-SUM(AS228:AT228) -> 0 | AV228: 0 | AW228: 1 | AX228: =1-SUM(AV228:AW228) -> 0 | AY228: 0 | AZ228: 1 | BA228: =1-SUM(AY228:AZ228) -> 0 | BB228: 0 | BC228: 1 | BD228: =1-SUM(BB228:BC228) -> 0 | BE228: 0 | BF228: 1 | BG228: =1-SUM(BE228:BF228) -> 0 | BH228: 1 | BI228: 0 | BJ228: =1-SUM(BH228:BI228) -> 0 | BK228: 1 | BL228: 0 | BM228: =1-SUM(BK228:BL228) -> 0 | BN228: 0 | BO228: =1-BN228 -> 1
O229: 0 | P229: 1 | Q229: =1-SUM(O229:P229) -> 0 | R229: 1 | S229: 0 | T229: =1-SUM(R229:S229) -> 0 | U229: 1 | V229: 0 | W229: =1-SUM(U229:V229) -> 0 | X229: 1 | Y229: 0 | Z229: =1-SUM(X229:Y229) -> 0 | AA229: 0 | AB229: 1 | AC229: =1-SUM(AA229:AB229) -> 0 | AD229: 0 | AE229: 1 | AF229: =1-SUM(AD229:AE229) -> 0 | AG229: 0 | AH229: 1 | AI229: =1-SUM(AG229:AH229) -> 0 | AJ229: 1 | AK229: 0 | AL229: =1-SUM(AJ229:AK229) -> 0 | AM229: 1 | AN229: 0 | AO229: =1-SUM(AM229:AN229) -> 0 | AP229: 0 | AQ229: 1 | AR229: =1-SUM(AP229:AQ229) -> 0 | AS229: 0 | AT229: 1 | AU229: =1-SUM(AS229:AT229) -> 0 | AV229: 0 | AW229: 1 | AX229: =1-SUM(AV229:AW229) -> 0 | AY229: 0 | AZ229: 1 | BA229: =1-SUM(AY229:AZ229) -> 0 | BB229: 0 | BC229: 1 | BD229: =1-SUM(BB229:BC229) -> 0 | BE229: 0 | BF229: 1 | BG229: =1-SUM(BE229:BF229) -> 0 | BH229: 0 | BI229: 1 | BJ229: =1-SUM(BH229:BI229) -> 0 | BK229: 0 | BL229: 1 | BM229: =1-SUM(BK229:BL229) -> 0 | BN229: 0 | BO229: =1-BN229 -> 1
O230: 1 | P230: 0 | Q230: =1-SUM(O230:P230) -> 0 | R230: 0 | S230: 1 | T230: =1-SUM(R230:S230) -> 0 | U230: 0 | V230: 1 | W230: =1-SUM(U230:V230) -> 0 | X230: 1 | Y230: 0 | Z230: =1-SUM(X230:Y230) -> 0 | AA230: 0 | AB230: 1 | AC230: =1-SUM(AA230:AB230) -> 0 | AD230: 1 | AE230: 0 | AF230: =1-SUM(AD230:AE230) -> 0 | AG230: 0 | AH230: 1 | AI230: =1-SUM(AG230:AH230) -> 0 | AJ230: 0 | AK230: 1 | AL230: =1-SUM(AJ230:AK230) -> 0 | AM230: 0 | AN230: 1 | AO230: =1-SUM(AM230:AN230) -> 0 | AP230: 1 | AQ230: 0 | AR230: =1-SUM(AP230:AQ230) -> 0 | AS230: 0 | AT230: 1 | AU230: =1-SUM(AS230:AT230) -> 0 | AV230: 0 | AW230: 1 | AX230: =1-SUM(AV230:AW230) -> 0 | AY230: 0 | AZ230: 1 | BA230: =1-SUM(AY230:AZ230) -> 0 | BB230: 0 | BC230: 1 | BD230: =1-SUM(BB230:BC230) -> 0 | BE230: 0 | BF230: 1 | BG230: =1-SUM(BE230:BF230) -> 0 | BH230: 0 | BI230: 1 | BJ230: =1-SUM(BH230:BI230) -> 0 | BK230: 0 | BL230: 1 | BM230: =1-SUM(BK230:BL230) -> 0 | BN230: 0 | BO230: =1-BN230 -> 1
O231: 1 | P231: 0 | Q231: =1-SUM(O231:P231) -> 0 | R231: 1 | S231: 0 | T231: =1-SUM(R231:S231) -> 0 | U231: 0 | V231: 1 | W231: =1-SUM(U231:V231) -> 0 | X231: 0 | Y231: 1 | Z231: =1-SUM(X231:Y231) -> 0 | AA231: 1 | AB231: 0 | AC231: =1-SUM(AA231:AB231) -> 0 | AD231: 0 | AE231: 1 | AF231: =1-SUM(AD231:AE231) -> 0 | AG231: 0 | AH231: 1 | AI231: =1-SUM(AG231:AH231) -> 0 | AJ231: 0 | AK231: 1 | AL231: =1-SUM(AJ231:AK231) -> 0 | AM231: 0 | AN231: 1 | AO231: =1-SUM(AM231:AN231) -> 0 | AP231: 0 | AQ231: 1 | AR231: =1-SUM(AP231:AQ231) -> 0 | AS231: 0 | AT231: 1 | AU231: =1-SUM(AS231:AT231) -> 0 | AV231: 0 | AW231: 1 | AX231: =1-SUM(AV231:AW231) -> 0 | AY231: 0 | AZ231: 1 | BA231: =1-SUM(AY231:AZ231) -> 0 | BB231: 0 | BC231: 1 | BD231: =1-SUM(BB231:BC231) -> 0 | BE231: 0 | BF231: 1 | BG231: =1-SUM(BE231:BF231) -> 0 | BH231: 0 | BI231: 1 | BJ231: =1-SUM(BH231:BI231) -> 0 | BK231: 0 | BL231: 1 | BM231: =1-SUM(BK231:BL231) -> 0 | BN231: 0 | BO231: =1-BN231 -> 1
O232: 1 | P232: 0 | Q232: =1-SUM(O232:P232) -> 0 | R232: 1 | S232: 0 | T232: =1-SUM(R232:S232) -> 0 | U232: 0 | V232: 1 | W232: =1-SUM(U232:V232) -> 0 | X232: 0 | Y232: 1 | Z232: =1-SUM(X232:Y232) -> 0 | AA232: 1 | AB232: 0 | AC232: =1-SUM(AA232:AB232) -> 0 | AD232: 0 | AE232: 1 | AF232: =1-SUM(AD232:AE232) -> 0 | AG232: 0 | AH232: 1 | AI232: =1-SUM(AG232:AH232) -> 0 | AJ232: 1 | AK232: 0 | AL232: =1-SUM(AJ232:AK232) -> 0 | AM232: 1 | AN232: 0 | AO232: =1-SUM(AM232:AN232) -> 0 | AP232: 0 | AQ232: 1 | AR232: =1-SUM(AP232:AQ232) -> 0 | AS232: 1 | AT232: 0 | AU232: =1-SUM(AS232:AT232) -> 0 | AV232: 1 | AW232: 0 | AX232: =1-SUM(AV232:AW232) -> 0 | AY232: 1 | AZ232: 0 | BA232: =1-SUM(AY232:AZ232) -> 0 | BB232: 1 | BC232: 0 | BD232: =1-SUM(BB232:BC232) -> 0 | BE232: 1 | BF232: 0 | BG232: =1-SUM(BE232:BF232) -> 0 | BH232: 0 | BI232: 1 | BJ232: =1-SUM(BH232:BI232) -> 0 | BK232: 1 | BL232: 0 | BM232: =1-SUM(BK232:BL232) -> 0 | BN232: 0 | BO232: =1-BN232 -> 1
O233: 1 | P233: 0 | Q233: =1-SUM(O233:P233) -> 0 | R233: 1 | S233: 0 | T233: =1-SUM(R233:S233) -> 0 | U233: 1 | V233: 0 | W233: =1-SUM(U233:V233) -> 0 | X233: 1 | Y233: 0 | Z233: =1-SUM(X233:Y233) -> 0 | AA233: 0 | AB233: 1 | AC233: =1-SUM(AA233:AB233) -> 0 | AD233: 0 | AE233: 1 | AF233: =1-SUM(AD233:AE233) -> 0 | AG233: 0 | AH233: 1 | AI233: =1-SUM(AG233:AH233) -> 0 | AJ233: 1 | AK233: 0 | AL233: =1-SUM(AJ233:AK233) -> 0 | AM233: 0 | AN233: 1 | AO233: =1-SUM(AM233:AN233) -> 0 | AP233: 0 | AQ233: 1 | AR233: =1-SUM(AP233:AQ233) -> 0 | AS233: 1 | AT233: 0 | AU233: =1-SUM(AS233:AT233) -> 0 | AV233: 0 | AW233: 1 | AX233: =1-SUM(AV233:AW233) -> 0 | AY233: 0 | AZ233: 1 | BA233: =1-SUM(AY233:AZ233) -> 0 | BB233: 0 | BC233: 1 | BD233: =1-SUM(BB233:BC233) -> 0 | BE233: 0 | BF233: 1 | BG233: =1-SUM(BE233:BF233) -> 0 | BH233: 0 | BI233: 1 | BJ233: =1-SUM(BH233:BI233) -> 0 | BK233: 0 | BL233: 1 | BM233: =1-SUM(BK233:BL233) -> 0 | BN233: 0 | BO233: =1-BN233 -> 1
O234: 1 | P234: 0 | Q234: =1-SUM(O234:P234) -> 0 | R234: 1 | S234: 0 | T234: =1-SUM(R234:S234) -> 0 | U234: 1 | V234: 0 | W234: =1-SUM(U234:V234) -> 0 | X234: 1 | Y234: 0 | Z234: =1-SUM(X234:Y234) -> 0 | AA234: 0 | AB234: 1 | AC234: =1-SUM(AA234:AB234) -> 0 | AD234: 0 | AE234: 1 | AF234: =1-SUM(AD234:AE234) -> 0 | AG234: 0 | AH234: 1 | AI234: =1-SUM(AG234:AH234) -> 0 | AJ234: 1 | AK234: 0 | AL234: =1-SUM(AJ234:AK234) -> 0 | AM234: 0 | AN234: 1 | AO234: =1-SUM(AM234:AN234) -> 0 | AP234: 0 | AQ234: 1 | AR234: =1-SUM(AP234:AQ234) -> 0 | AS234: 1 | AT234: 0 | AU234: =1-SUM(AS234:AT234) -> 0 | AV234: 0 | AW234: 1 | AX234: =1-SUM(AV234:AW234) -> 0 | AY234: 0 | AZ234: 1 | BA234: =1-SUM(AY234:AZ234) -> 0 | BB234: 0 | BC234: 1 | BD234: =1-SUM(BB234:BC234) -> 0 | BE234: 0 | BF234: 1 | BG234: =1-SUM(BE234:BF234) -> 0 | BH234: 0 | BI234: 1 | BJ234: =1-SUM(BH234:BI234) -> 0 | BK234: 0 | BL234: 1 | BM234: =1-SUM(BK234:BL234) -> 0 | BN234: 0 | BO234: =1-BN234 -> 1
O235: 1 | P235: 0 | Q235: =1-SUM(O235:P235) -> 0 | R235: 1 | S235: 0 | T235: =1-SUM(R235:S235) -> 0 | U235: 1 | V235: 0 | W235: =1-SUM(U235:V235) -> 0 | X235: 1 | Y235: 0 | Z235: =1-SUM(X235:Y235) -> 0 | AA235: 0 | AB235: 1 | AC235: =1-SUM(AA235:AB235) -> 0 | AD235: 0 | AE235: 1 | AF235: =1-SUM(AD235:AE235) -> 0 | AG235: 0 | AH235: 1 | AI235: =1-SUM(AG235:AH235) -> 0 | AJ235: 1 | AK235: 0 | AL235: =1-SUM(AJ235:AK235) -> 0 | AM235: 0 | AN235: 1 | AO235: =1-SUM(AM235:AN235) -> 0 | AP235: 0 | AQ235: 1 | AR235: =1-SUM(AP235:AQ235) -> 0 | AS235: 1 | AT235: 0 | AU235: =1-SUM(AS235:AT235) -> 0 | AV235: 0 | AW235: 1 | AX235: =1-SUM(AV235:AW235) -> 0 | AY235: 0 | AZ235: 1 | BA235: =1-SUM(AY235:AZ235) -> 0 | BB235: 0 | BC235: 1 | BD235: =1-SUM(BB235:BC235) -> 0 | BE235: 0 | BF235: 1 | BG235: =1-SUM(BE235:BF235) -> 0 | BH235: 0 | BI235: 1 | BJ235: =1-SUM(BH235:BI235) -> 0 | BK235: 0 | BL235: 1 | BM235: =1-SUM(BK235:BL235) -> 0 | BN235: 0 | BO235: =1-BN235 -> 1
O236: 1 | P236: 0 | Q236: =1-SUM(O236:P236) -> 0 | R236: 0 | S236: 1 | T236: =1-SUM(R236:S236) -> 0 | U236: 0 | V236: 1 | W236: =1-SUM(U236:V236) -> 0 | X236: 0 | Y236: 1 | Z236: =1-SUM(X236:Y236) -> 0 | AA236: 0 | AB236: 1 | AC236: =1-SUM(AA236:AB236) -> 0 | AD236: 0 | AE236: 1 | AF236: =1-SUM(AD236:AE236) -> 0 | AG236: 0 | AH236: 1 | AI236: =1-SUM(AG236:AH236) -> 0 | AJ236: 0 | AK236: 1 | AL236: =1-SUM(AJ236:AK236) -> 0 | AM236: 0 | AN236: 1 | AO236: =1-SUM(AM236:AN236) -> 0 | AP236: 0 | AQ236: 1 | AR236: =1-SUM(AP236:AQ236) -> 0 | AS236: 0 | AT236: 1 | AU236: =1-SUM(AS236:AT236) -> 0 | AV236: 0 | AW236: 1 | AX236: =1-SUM(AV236:AW236) -> 0 | AY236: 0 | AZ236: 1 | BA236: =1-SUM(AY236:AZ236) -> 0 | BB236: 0 | BC236: 1 | BD236: =1-SUM(BB236:BC236) -> 0 | BE236: 0 | BF236: 1 | BG236: =1-SUM(BE236:BF236) -> 0 | BH236: 1 | BI236: 0 | BJ236: =1-SUM(BH236:BI236) -> 0 | BK236: 0 | BL236: 1 | BM236: =1-SUM(BK236:BL236) -> 0 | BN236: 0 | BO236: =1-BN236 -> 1
O237: 1 | P237: 0 | Q237: =1-SUM(O237:P237) -> 0 | R237: 1 | S237: 0 | T237: =1-SUM(R237:S237) -> 0 | U237: 1 | V237: 0 | W237: =1-SUM(U237:V237) -> 0 | X237: 1 | Y237: 0 | Z237: =1-SUM(X237:Y237) -> 0 | AA237: 1 | AB237: 0 | AC237: =1-SUM(AA237:AB237) -> 0 | AD237: 0 | AE237: 1 | AF237: =1-SUM(AD237:AE237) -> 0 | AG237: 0 | AH237: 1 | AI237: =1-SUM(AG237:AH237) -> 0 | AJ237: 1 | AK237: 0 | AL237: =1-SUM(AJ237:AK237) -> 0 | AM237: 1 | AN237: 0 | AO237: =1-SUM(AM237:AN237) -> 0 | AP237: 0 | AQ237: 1 | AR237: =1-SUM(AP237:AQ237) -> 0 | AS237: 1 | AT237: 0 | AU237: =1-SUM(AS237:AT237) -> 0 | AV237: 1 | AW237: 0 | AX237: =1-SUM(AV237:AW237) -> 0 | AY237: 1 | AZ237: 0 | BA237: =1-SUM(AY237:AZ237) -> 0 | BB237: 0 | BC237: 1 | BD237: =1-SUM(BB237:BC237) -> 0 | BE237: 1 | BF237: 0 | BG237: =1-SUM(BE237:BF237) -> 0 | BH237: 0 | BI237: 1 | BJ237: =1-SUM(BH237:BI237) -> 0 | BK237: 0 | BL237: 1 | BM237: =1-SUM(BK237:BL237) -> 0 | BN237: 0 | BO237: =1-BN237 -> 1
O238: 1 | P238: 0 | Q238: =1-SUM(O238:P238) -> 0 | R238: 1 | S238: 0 | T238: =1-SUM(R238:S238) -> 0 | U238: 0 | V238: 1 | W238: =1-SUM(U238:V238) -> 0 | X238: 0 | Y238: 1 | Z238: =1-SUM(X238:Y238) -> 0 | AA238: 1 | AB238: 0 | AC238: =1-SUM(AA238:AB238) -> 0 | AD238: 0 | AE238: 0 | AF238: =1-SUM(AD238:AE238) -> 1 | AG238: 0 | AH238: 0 | AI238: =1-SUM(AG238:AH238) -> 1 | AJ238: 0 | AK238: 1 | AL238: =1-SUM(AJ238:AK238) -> 0 | AM238: 0 | AN238: 1 | AO238: =1-SUM(AM238:AN238) -> 0 | AP238: 0 | AQ238: 1 | AR238: =1-SUM(AP238:AQ238) -> 0 | AS238: 0 | AT238: 1 | AU238: =1-SUM(AS238:AT238) -> 0 | AV238: 0 | AW238: 1 | AX238: =1-SUM(AV238:AW238) -> 0 | AY238: 0 | AZ238: 1 | BA238: =1-SUM(AY238:AZ238) -> 0 | BB238: 0 | BC238: 1 | BD238: =1-SUM(BB238:BC238) -> 0 | BE238: 0 | BF238: 1 | BG238: =1-SUM(BE238:BF238) -> 0 | BH238: 0 | BI238: 0 | BJ238: =1-SUM(BH238:BI238) -> 1 | BK238: 0 | BL238: 1 | BM238: =1-SUM(BK238:BL238) -> 0 | BN238: 0 | BO238: =1-BN238 -> 1
O239: 1 | P239: 0 | Q239: =1-SUM(O239:P239) -> 0 | R239: 0 | S239: 1 | T239: =1-SUM(R239:S239) -> 0 | U239: 0 | V239: 1 | W239: =1-SUM(U239:V239) -> 0 | X239: 0 | Y239: 1 | Z239: =1-SUM(X239:Y239) -> 0 | AA239: 1 | AB239: 0 | AC239: =1-SUM(AA239:AB239) -> 0 | AD239: 0 | AE239: 1 | AF239: =1-SUM(AD239:AE239) -> 0 | AG239: 0 | AH239: 1 | AI239: =1-SUM(AG239:AH239) -> 0 | AJ239: 1 | AK239: 0 | AL239: =1-SUM(AJ239:AK239) -> 0 | AM239: 1 | AN239: 0 | AO239: =1-SUM(AM239:AN239) -> 0 | AP239: 0 | AQ239: 1 | AR239: =1-SUM(AP239:AQ239) -> 0 | AS239: 1 | AT239: 0 | AU239: =1-SUM(AS239:AT239) -> 0 | AV239: 1 | AW239: 0 | AX239: =1-SUM(AV239:AW239) -> 0 | AY239: 1 | AZ239: 0 | BA239: =1-SUM(AY239:AZ239) -> 0 | BB239: 1 | BC239: 0 | BD239: =1-SUM(BB239:BC239) -> 0 | BE239: 0 | BF239: 1 | BG239: =1-SUM(BE239:BF239) -> 0 | BH239: 0 | BI239: 1 | BJ239: =1-SUM(BH239:BI239) -> 0 | BK239: 0 | BL239: 1 | BM239: =1-SUM(BK239:BL239) -> 0 | BN239: 0 | BO239: =1-BN239 -> 1
O240: 1 | P240: 0 | Q240: =1-SUM(O240:P240) -> 0 | R240: 1 | S240: 0 | T240: =1-SUM(R240:S240) -> 0 | U240: 1 | V240: 0 | W240: =1-SUM(U240:V240) -> 0 | X240: 0 | Y240: 1 | Z240: =1-SUM(X240:Y240) -> 0 | AA240: 1 | AB240: 0 | AC240: =1-SUM(AA240:AB240) -> 0 | AD240: 0 | AE240: 1 | AF240: =1-SUM(AD240:AE240) -> 0 | AG240: 1 | AH240: 0 | AI240: =1-SUM(AG240:AH240) -> 0 | AJ240: 0 | AK240: 1 | AL240: =1-SUM(AJ240:AK240) -> 0 | AM240: 0 | AN240: 1 | AO240: =1-SUM(AM240:AN240) -> 0 | AP240: 0 | AQ240: 1 | AR240: =1-SUM(AP240:AQ240) -> 0 | AS240: 0 | AT240: 1 | AU240: =1-SUM(AS240:AT240) -> 0 | AV240: 0 | AW240: 1 | AX240: =1-SUM(AV240:AW240) -> 0 | AY240: 0 | AZ240: 1 | BA240: =1-SUM(AY240:AZ240) -> 0 | BB240: 1 | BC240: 0 | BD240: =1-SUM(BB240:BC240) -> 0 | BE240: 0 | BF240: 1 | BG240: =1-SUM(BE240:BF240) -> 0 | BH240: 0 | BI240: 1 | BJ240: =1-SUM(BH240:BI240) -> 0 | BK240: 0 | BL240: 1 | BM240: =1-SUM(BK240:BL240) -> 0 | BN240: 0 | BO240: =1-BN240 -> 1
O241: 0 | P241: 1 | Q241: =1-SUM(O241:P241) -> 0 | R241: 0 | S241: 1 | T241: =1-SUM(R241:S241) -> 0 | U241: 0 | V241: 1 | W241: =1-SUM(U241:V241) -> 0 | X241: 0 | Y241: 1 | Z241: =1-SUM(X241:Y241) -> 0 | AA241: 0 | AB241: 1 | AC241: =1-SUM(AA241:AB241) -> 0 | AD241: 0 | AE241: 1 | AF241: =1-SUM(AD241:AE241) -> 0 | AG241: 0 | AH241: 1 | AI241: =1-SUM(AG241:AH241) -> 0 | AJ241: 0 | AK241: 1 | AL241: =1-SUM(AJ241:AK241) -> 0 | AM241: 0 | AN241: 1 | AO241: =1-SUM(AM241:AN241) -> 0 | AP241: 0 | AQ241: 1 | AR241: =1-SUM(AP241:AQ241) -> 0 | AS241: 0 | AT241: 1 | AU241: =1-SUM(AS241:AT241) -> 0 | AV241: 0 | AW241: 1 | AX241: =1-SUM(AV241:AW241) -> 0 | AY241: 0 | AZ241: 1 | BA241: =1-SUM(AY241:AZ241) -> 0 | BB241: 0 | BC241: 1 | BD241: =1-SUM(BB241:BC241) -> 0 | BE241: 0 | BF241: 1 | BG241: =1-SUM(BE241:BF241) -> 0 | BH241: 1 | BI241: 0 | BJ241: =1-SUM(BH241:BI241) -> 0 | BK241: 0 | BL241: 1 | BM241: =1-SUM(BK241:BL241) -> 0 | BN241: 0 | BO241: =1-BN241 -> 1
O242: 1 | P242: 0 | Q242: =1-SUM(O242:P242) -> 0 | R242: 1 | S242: 0 | T242: =1-SUM(R242:S242) -> 0 | U242: 1 | V242: 0 | W242: =1-SUM(U242:V242) -> 0 | X242: 1 | Y242: 0 | Z242: =1-SUM(X242:Y242) -> 0 | AA242: 0 | AB242: 1 | AC242: =1-SUM(AA242:AB242) -> 0 | AD242: 1 | AE242: 0 | AF242: =1-SUM(AD242:AE242) -> 0 | AG242: 1 | AH242: 0 | AI242: =1-SUM(AG242:AH242) -> 0 | AJ242: 1 | AK242: 0 | AL242: =1-SUM(AJ242:AK242) -> 0 | AM242: 0 | AN242: 1 | AO242: =1-SUM(AM242:AN242) -> 0 | AP242: 0 | AQ242: 1 | AR242: =1-SUM(AP242:AQ242) -> 0 | AS242: 0 | AT242: 1 | AU242: =1-SUM(AS242:AT242) -> 0 | AV242: 0 | AW242: 1 | AX242: =1-SUM(AV242:AW242) -> 0 | AY242: 0 | AZ242: 1 | BA242: =1-SUM(AY242:AZ242) -> 0 | BB242: 0 | BC242: 1 | BD242: =1-SUM(BB242:BC242) -> 0 | BE242: 0 | BF242: 1 | BG242: =1-SUM(BE242:BF242) -> 0 | BH242: 0 | BI242: 1 | BJ242: =1-SUM(BH242:BI242) -> 0 | BK242: 0 | BL242: 1 | BM242: =1-SUM(BK242:BL242) -> 0 | BN242: 1 | BO242: =1-BN242 -> 0
O243: 1 | P243: 0 | Q243: =1-SUM(O243:P243) -> 0 | R243: 1 | S243: 0 | T243: =1-SUM(R243:S243) -> 0 | U243: 0 | V243: 0 | W243: =1-SUM(U243:V243) -> 1 | X243: 1 | Y243: 0 | Z243: =1-SUM(X243:Y243) -> 0 | AA243: 1 | AB243: 0 | AC243: =1-SUM(AA243:AB243) -> 0 | AD243: 1 | AE243: 0 | AF243: =1-SUM(AD243:AE243) -> 0 | AG243: 1 | AH243: 0 | AI243: =1-SUM(AG243:AH243) -> 0 | AJ243: 1 | AK243: 0 | AL243: =1-SUM(AJ243:AK243) -> 0 | AM243: 0 | AN243: 1 | AO243: =1-SUM(AM243:AN243) -> 0 | AP243: 0 | AQ243: 1 | AR243: =1-SUM(AP243:AQ243) -> 0 | AS243: 0 | AT243: 1 | AU243: =1-SUM(AS243:AT243) -> 0 | AV243: 0 | AW243: 1 | AX243: =1-SUM(AV243:AW243) -> 0 | AY243: 0 | AZ243: 1 | BA243: =1-SUM(AY243:AZ243) -> 0 | BB243: 1 | BC243: 0 | BD243: =1-SUM(BB243:BC243) -> 0 | BE243: 0 | BF243: 1 | BG243: =1-SUM(BE243:BF243) -> 0 | BH243: 0 | BI243: 1 | BJ243: =1-SUM(BH243:BI243) -> 0 | BK243: 0 | BL243: 1 | BM243: =1-SUM(BK243:BL243) -> 0 | BN243: 0 | BO243: =1-BN243 -> 1
O244: 1 | P244: 0 | Q244: =1-SUM(O244:P244) -> 0 | R244: 1 | S244: 0 | T244: =1-SUM(R244:S244) -> 0 | U244: 0 | V244: 1 | W244: =1-SUM(U244:V244) -> 0 | X244: 1 | Y244: 0 | Z244: =1-SUM(X244:Y244) -> 0 | AA244: 1 | AB244: 0 | AC244: =1-SUM(AA244:AB244) -> 0 | AD244: 1 | AE244: 0 | AF244: =1-SUM(AD244:AE244) -> 0 | AG244: 0 | AH244: 1 | AI244: =1-SUM(AG244:AH244) -> 0 | AJ244: 0 | AK244: 1 | AL244: =1-SUM(AJ244:AK244) -> 0 | AM244: 1 | AN244: 0 | AO244: =1-SUM(AM244:AN244) -> 0 | AP244: 1 | AQ244: 0 | AR244: =1-SUM(AP244:AQ244) -> 0 | AS244: 0 | AT244: 1 | AU244: =1-SUM(AS244:AT244) -> 0 | AV244: 1 | AW244: 0 | AX244: =1-SUM(AV244:AW244) -> 0 | AY244: 0 | AZ244: 1 | BA244: =1-SUM(AY244:AZ244) -> 0 | BB244: 0 | BC244: 1 | BD244: =1-SUM(BB244:BC244) -> 0 | BE244: 0 | BF244: 1 | BG244: =1-SUM(BE244:BF244) -> 0 | BH244: 0 | BI244: 1 | BJ244: =1-SUM(BH244:BI244) -> 0 | BK244: 1 | BL244: 0 | BM244: =1-SUM(BK244:BL244) -> 0 | BN244: 1 | BO244: =1-BN244 -> 0
O245: 1 | P245: 0 | Q245: =1-SUM(O245:P245) -> 0 | R245: 1 | S245: 0 | T245: =1-SUM(R245:S245) -> 0 | U245: 0 | V245: 1 | W245: =1-SUM(U245:V245) -> 0 | X245: 0 | Y245: 1 | Z245: =1-SUM(X245:Y245) -> 0 | AA245: 1 | AB245: 0 | AC245: =1-SUM(AA245:AB245) -> 0 | AD245: 0 | AE245: 1 | AF245: =1-SUM(AD245:AE245) -> 0 | AG245: 0 | AH245: 1 | AI245: =1-SUM(AG245:AH245) -> 0 | AJ245: 0 | AK245: 1 | AL245: =1-SUM(AJ245:AK245) -> 0 | AM245: 1 | AN245: 0 | AO245: =1-SUM(AM245:AN245) -> 0 | AP245: 0 | AQ245: 1 | AR245: =1-SUM(AP245:AQ245) -> 0 | AS245: 0 | AT245: 1 | AU245: =1-SUM(AS245:AT245) -> 0 | AV245: 0 | AW245: 1 | AX245: =1-SUM(AV245:AW245) -> 0 | AY245: 0 | AZ245: 1 | BA245: =1-SUM(AY245:AZ245) -> 0 | BB245: 0 | BC245: 1 | BD245: =1-SUM(BB245:BC245) -> 0 | BE245: 0 | BF245: 1 | BG245: =1-SUM(BE245:BF245) -> 0 | BH245: 1 | BI245: 0 | BJ245: =1-SUM(BH245:BI245) -> 0 | BK245: 1 | BL245: 0 | BM245: =1-SUM(BK245:BL245) -> 0 | BN245: 0 | BO245: =1-BN245 -> 1
O246: 1 | P246: 0 | Q246: =1-SUM(O246:P246) -> 0 | R246: 1 | S246: 0 | T246: =1-SUM(R246:S246) -> 0 | U246: 1 | V246: 0 | W246: =1-SUM(U246:V246) -> 0 | X246: 1 | Y246: 0 | Z246: =1-SUM(X246:Y246) -> 0 | AA246: 1 | AB246: 0 | AC246: =1-SUM(AA246:AB246) -> 0 | AD246: 1 | AE246: 0 | AF246: =1-SUM(AD246:AE246) -> 0 | AG246: 0 | AH246: 1 | AI246: =1-SUM(AG246:AH246) -> 0 | AJ246: 0 | AK246: 1 | AL246: =1-SUM(AJ246:AK246) -> 0 | AM246: 1 | AN246: 0 | AO246: =1-SUM(AM246:AN246) -> 0 | AP246: 1 | AQ246: 0 | AR246: =1-SUM(AP246:AQ246) -> 0 | AS246: 0 | AT246: 1 | AU246: =1-SUM(AS246:AT246) -> 0 | AV246: 1 | AW246: 0 | AX246: =1-SUM(AV246:AW246) -> 0 | AY246: 0 | AZ246: 1 | BA246: =1-SUM(AY246:AZ246) -> 0 | BB246: 0 | BC246: 1 | BD246: =1-SUM(BB246:BC246) -> 0 | BE246: 0 | BF246: 1 | BG246: =1-SUM(BE246:BF246) -> 0 | BH246: 0 | BI246: 1 | BJ246: =1-SUM(BH246:BI246) -> 0 | BK246: 1 | BL246: 0 | BM246: =1-SUM(BK246:BL246) -> 0 | BN246: 0 | BO246: =1-BN246 -> 1
O247: 1 | P247: 0 | Q247: =1-SUM(O247:P247) -> 0 | R247: 1 | S247: 0 | T247: =1-SUM(R247:S247) -> 0 | U247: 0 | V247: 1 | W247: =1-SUM(U247:V247) -> 0 | X247: 0 | Y247: 1 | Z247: =1-SUM(X247:Y247) -> 0 | AA247: 0 | AB247: 1 | AC247: =1-SUM(AA247:AB247) -> 0 | AD247: 0 | AE247: 1 | AF247: =1-SUM(AD247:AE247) -> 0 | AG247: 0 | AH247: 1 | AI247: =1-SUM(AG247:AH247) -> 0 | AJ247: 0 | AK247: 1 | AL247: =1-SUM(AJ247:AK247) -> 0 | AM247: 0 | AN247: 1 | AO247: =1-SUM(AM247:AN247) -> 0 | AP247: 0 | AQ247: 1 | AR247: =1-SUM(AP247:AQ247) -> 0 | AS247: 0 | AT247: 1 | AU247: =1-SUM(AS247:AT247) -> 0 | AV247: 0 | AW247: 1 | AX247: =1-SUM(AV247:AW247) -> 0 | AY247: 0 | AZ247: 1 | BA247: =1-SUM(AY247:AZ247) -> 0 | BB247: 0 | BC247: 1 | BD247: =1-SUM(BB247:BC247) -> 0 | BE247: 0 | BF247: 1 | BG247: =1-SUM(BE247:BF247) -> 0 | BH247: 1 | BI247: 0 | BJ247: =1-SUM(BH247:BI247) -> 0 | BK247: 0 | BL247: 1 | BM247: =1-SUM(BK247:BL247) -> 0 | BN247: 0 | BO247: =1-BN247 -> 1
O248: 1 | P248: 0 | Q248: =1-SUM(O248:P248) -> 0 | R248: 1 | S248: 0 | T248: =1-SUM(R248:S248) -> 0 | U248: 1 | V248: 0 | W248: =1-SUM(U248:V248) -> 0 | X248: 0 | Y248: 1 | Z248: =1-SUM(X248:Y248) -> 0 | AA248: 0 | AB248: 1 | AC248: =1-SUM(AA248:AB248) -> 0 | AD248: 0 | AE248: 1 | AF248: =1-SUM(AD248:AE248) -> 0 | AG248: 0 | AH248: 1 | AI248: =1-SUM(AG248:AH248) -> 0 | AJ248: 0 | AK248: 1 | AL248: =1-SUM(AJ248:AK248) -> 0 | AM248: 0 | AN248: 1 | AO248: =1-SUM(AM248:AN248) -> 0 | AP248: 0 | AQ248: 1 | AR248: =1-SUM(AP248:AQ248) -> 0 | AS248: 0 | AT248: 1 | AU248: =1-SUM(AS248:AT248) -> 0 | AV248: 0 | AW248: 1 | AX248: =1-SUM(AV248:AW248) -> 0 | AY248: 0 | AZ248: 1 | BA248: =1-SUM(AY248:AZ248) -> 0 | BB248: 0 | BC248: 1 | BD248: =1-SUM(BB248:BC248) -> 0 | BE248: 0 | BF248: 1 | BG248: =1-SUM(BE248:BF248) -> 0 | BH248: 0 | BI248: 1 | BJ248: =1-SUM(BH248:BI248) -> 0 | BK248: 0 | BL248: 1 | BM248: =1-SUM(BK248:BL248) -> 0 | BN248: 0 | BO248: =1-BN248 -> 1
O249: 1 | P249: 0 | Q249: =1-SUM(O249:P249) -> 0 | R249: 0 | S249: 1 | T249: =1-SUM(R249:S249) -> 0 | U249: 0 | V249: 1 | W249: =1-SUM(U249:V249) -> 0 | X249: 0 | Y249: 1 | Z249: =1-SUM(X249:Y249) -> 0 | AA249: 0 | AB249: 1 | AC249: =1-SUM(AA249:AB249) -> 0 | AD249: 0 | AE249: 1 | AF249: =1-SUM(AD249:AE249) -> 0 | AG249: 0 | AH249: 1 | AI249: =1-SUM(AG249:AH249) -> 0 | AJ249: 1 | AK249: 0 | AL249: =1-SUM(AJ249:AK249) -> 0 | AM249: 1 | AN249: 0 | AO249: =1-SUM(AM249:AN249) -> 0 | AP249: 0 | AQ249: 1 | AR249: =1-SUM(AP249:AQ249) -> 0 | AS249: 0 | AT249: 1 | AU249: =1-SUM(AS249:AT249) -> 0 | AV249: 0 | AW249: 1 | AX249: =1-SUM(AV249:AW249) -> 0 | AY249: 0 | AZ249: 1 | BA249: =1-SUM(AY249:AZ249) -> 0 | BB249: 0 | BC249: 1 | BD249: =1-SUM(BB249:BC249) -> 0 | BE249: 0 | BF249: 1 | BG249: =1-SUM(BE249:BF249) -> 0 | BH249: 0 | BI249: 1 | BJ249: =1-SUM(BH249:BI249) -> 0 | BK249: 0 | BL249: 1 | BM249: =1-SUM(BK249:BL249) -> 0 | BN249: 0 | BO249: =1-BN249 -> 1
O250: 1 | P250: 0 | Q250: =1-SUM(O250:P250) -> 0 | R250: 1 | S250: 0 | T250: =1-SUM(R250:S250) -> 0 | U250: 1 | V250: 0 | W250: =1-SUM(U250:V250) -> 0 | X250: 0 | Y250: 1 | Z250: =1-SUM(X250:Y250) -> 0 | AA250: 0 | AB250: 1 | AC250: =1-SUM(AA250:AB250) -> 0 | AD250: 0 | AE250: 1 | AF250: =1-SUM(AD250:AE250) -> 0 | AG250: 0 | AH250: 1 | AI250: =1-SUM(AG250:AH250) -> 0 | AJ250: 0 | AK250: 1 | AL250: =1-SUM(AJ250:AK250) -> 0 | AM250: 0 | AN250: 1 | AO250: =1-SUM(AM250:AN250) -> 0 | AP250: 0 | AQ250: 1 | AR250: =1-SUM(AP250:AQ250) -> 0 | AS250: 0 | AT250: 1 | AU250: =1-SUM(AS250:AT250) -> 0 | AV250: 0 | AW250: 1 | AX250: =1-SUM(AV250:AW250) -> 0 | AY250: 0 | AZ250: 1 | BA250: =1-SUM(AY250:AZ250) -> 0 | BB250: 0 | BC250: 1 | BD250: =1-SUM(BB250:BC250) -> 0 | BE250: 0 | BF250: 1 | BG250: =1-SUM(BE250:BF250) -> 0 | BH250: 0 | BI250: 1 | BJ250: =1-SUM(BH250:BI250) -> 0 | BK250: 0 | BL250: 1 | BM250: =1-SUM(BK250:BL250) -> 0 | BN250: 0 | BO250: =1-BN250 -> 1
O251: 1 | P251: 0 | Q251: =1-SUM(O251:P251) -> 0 | R251: 1 | S251: 0 | T251: =1-SUM(R251:S251) -> 0 | U251: 1 | V251: 0 | W251: =1-SUM(U251:V251) -> 0 | X251: 0 | Y251: 1 | Z251: =1-SUM(X251:Y251) -> 0 | AA251: 0 | AB251: 1 | AC251: =1-SUM(AA251:AB251) -> 0 | AD251: 0 | AE251: 1 | AF251: =1-SUM(AD251:AE251) -> 0 | AG251: 0 | AH251: 1 | AI251: =1-SUM(AG251:AH251) -> 0 | AJ251: 0 | AK251: 1 | AL251: =1-SUM(AJ251:AK251) -> 0 | AM251: 0 | AN251: 1 | AO251: =1-SUM(AM251:AN251) -> 0 | AP251: 0 | AQ251: 1 | AR251: =1-SUM(AP251:AQ251) -> 0 | AS251: 0 | AT251: 1 | AU251: =1-SUM(AS251:AT251) -> 0 | AV251: 0 | AW251: 1 | AX251: =1-SUM(AV251:AW251) -> 0 | AY251: 0 | AZ251: 1 | BA251: =1-SUM(AY251:AZ251) -> 0 | BB251: 0 | BC251: 1 | BD251: =1-SUM(BB251:BC251) -> 0 | BE251: 0 | BF251: 1 | BG251: =1-SUM(BE251:BF251) -> 0 | BH251: 0 | BI251: 1 | BJ251: =1-SUM(BH251:BI251) -> 0 | BK251: 0 | BL251: 1 | BM251: =1-SUM(BK251:BL251) -> 0 | BN251: 0 | BO251: =1-BN251 -> 1
O252: 1 | P252: 0 | Q252: =1-SUM(O252:P252) -> 0 | R252: 1 | S252: 0 | T252: =1-SUM(R252:S252) -> 0 | U252: 0 | V252: 1 | W252: =1-SUM(U252:V252) -> 0 | X252: 0 | Y252: 1 | Z252: =1-SUM(X252:Y252) -> 0 | AA252: 1 | AB252: 0 | AC252: =1-SUM(AA252:AB252) -> 0 | AD252: 0 | AE252: 1 | AF252: =1-SUM(AD252:AE252) -> 0 | AG252: 0 | AH252: 1 | AI252: =1-SUM(AG252:AH252) -> 0 | AJ252: 0 | AK252: 1 | AL252: =1-SUM(AJ252:AK252) -> 0 | AM252: 0 | AN252: 1 | AO252: =1-SUM(AM252:AN252) -> 0 | AP252: 0 | AQ252: 1 | AR252: =1-SUM(AP252:AQ252) -> 0 | AS252: 0 | AT252: 1 | AU252: =1-SUM(AS252:AT252) -> 0 | AV252: 1 | AW252: 0 | AX252: =1-SUM(AV252:AW252) -> 0 | AY252: 0 | AZ252: 1 | BA252: =1-SUM(AY252:AZ252) -> 0 | BB252: 1 | BC252: 0 | BD252: =1-SUM(BB252:BC252) -> 0 | BE252: 1 | BF252: 0 | BG252: =1-SUM(BE252:BF252) -> 0 | BH252: 0 | BI252: 1 | BJ252: =1-SUM(BH252:BI252) -> 0 | BK252: 0 | BL252: 1 | BM252: =1-SUM(BK252:BL252) -> 0 | BN252: 0 | BO252: =1-BN252 -> 1
O253: 1 | P253: 0 | Q253: =1-SUM(O253:P253) -> 0 | R253: 1 | S253: 0 | T253: =1-SUM(R253:S253) -> 0 | U253: 1 | V253: 0 | W253: =1-SUM(U253:V253) -> 0 | X253: 0 | Y253: 1 | Z253: =1-SUM(X253:Y253) -> 0 | AA253: 0 | AB253: 1 | AC253: =1-SUM(AA253:AB253) -> 0 | AD253: 0 | AE253: 1 | AF253: =1-SUM(AD253:AE253) -> 0 | AG253: 0 | AH253: 1 | AI253: =1-SUM(AG253:AH253) -> 0 | AJ253: 0 | AK253: 1 | AL253: =1-SUM(AJ253:AK253) -> 0 | AM253: 0 | AN253: 1 | AO253: =1-SUM(AM253:AN253) -> 0 | AP253: 0 | AQ253: 1 | AR253: =1-SUM(AP253:AQ253) -> 0 | AS253: 0 | AT253: 1 | AU253: =1-SUM(AS253:AT253) -> 0 | AV253: 0 | AW253: 1 | AX253: =1-SUM(AV253:AW253) -> 0 | AY253: 0 | AZ253: 1 | BA253: =1-SUM(AY253:AZ253) -> 0 | BB253: 0 | BC253: 1 | BD253: =1-SUM(BB253:BC253) -> 0 | BE253: 0 | BF253: 1 | BG253: =1-SUM(BE253:BF253) -> 0 | BH253: 0 | BI253: 1 | BJ253: =1-SUM(BH253:BI253) -> 0 | BK253: 0 | BL253: 1 | BM253: =1-SUM(BK253:BL253) -> 0 | BN253: 0 | BO253: =1-BN253 -> 1
O254: 1 | P254: 0 | Q254: =1-SUM(O254:P254) -> 0 | R254: 1 | S254: 0 | T254: =1-SUM(R254:S254) -> 0 | U254: 1 | V254: 0 | W254: =1-SUM(U254:V254) -> 0 | X254: 0 | Y254: 1 | Z254: =1-SUM(X254:Y254) -> 0 | AA254: 0 | AB254: 1 | AC254: =1-SUM(AA254:AB254) -> 0 | AD254: 0 | AE254: 1 | AF254: =1-SUM(AD254:AE254) -> 0 | AG254: 0 | AH254: 1 | AI254: =1-SUM(AG254:AH254) -> 0 | AJ254: 0 | AK254: 1 | AL254: =1-SUM(AJ254:AK254) -> 0 | AM254: 0 | AN254: 1 | AO254: =1-SUM(AM254:AN254) -> 0 | AP254: 0 | AQ254: 1 | AR254: =1-SUM(AP254:AQ254) -> 0 | AS254: 0 | AT254: 1 | AU254: =1-SUM(AS254:AT254) -> 0 | AV254: 0 | AW254: 1 | AX254: =1-SUM(AV254:AW254) -> 0 | AY254: 0 | AZ254: 1 | BA254: =1-SUM(AY254:AZ254) -> 0 | BB254: 0 | BC254: 1 | BD254: =1-SUM(BB254:BC254) -> 0 | BE254: 0 | BF254: 1 | BG254: =1-SUM(BE254:BF254) -> 0 | BH254: 0 | BI254: 1 | BJ254: =1-SUM(BH254:BI254) -> 0 | BK254: 0 | BL254: 1 | BM254: =1-SUM(BK254:BL254) -> 0 | BN254: 1 | BO254: =1-BN254 -> 0
O255: 1 | P255: 0 | Q255: =1-SUM(O255:P255) -> 0 | R255: 1 | S255: 0 | T255: =1-SUM(R255:S255) -> 0 | U255: 0 | V255: 1 | W255: =1-SUM(U255:V255) -> 0 | X255: 1 | Y255: 0 | Z255: =1-SUM(X255:Y255) -> 0 | AA255: 0 | AB255: 1 | AC255: =1-SUM(AA255:AB255) -> 0 | AD255: 1 | AE255: 0 | AF255: =1-SUM(AD255:AE255) -> 0 | AG255: 0 | AH255: 1 | AI255: =1-SUM(AG255:AH255) -> 0 | AJ255: 1 | AK255: 0 | AL255: =1-SUM(AJ255:AK255) -> 0 | AM255: 1 | AN255: 0 | AO255: =1-SUM(AM255:AN255) -> 0 | AP255: 0 | AQ255: 1 | AR255: =1-SUM(AP255:AQ255) -> 0 | AS255: 0 | AT255: 1 | AU255: =1-SUM(AS255:AT255) -> 0 | AV255: 0 | AW255: 1 | AX255: =1-SUM(AV255:AW255) -> 0 | AY255: 0 | AZ255: 1 | BA255: =1-SUM(AY255:AZ255) -> 0 | BB255: 0 | BC255: 1 | BD255: =1-SUM(BB255:BC255) -> 0 | BE255: 0 | BF255: 1 | BG255: =1-SUM(BE255:BF255) -> 0 | BH255: 0 | BI255: 1 | BJ255: =1-SUM(BH255:BI255) -> 0 | BK255: 0 | BL255: 1 | BM255: =1-SUM(BK255:BL255) -> 0 | BN255: 1 | BO255: =1-BN255 -> 0
O256: 1 | P256: 0 | Q256: =1-SUM(O256:P256) -> 0 | R256: 1 | S256: 0 | T256: =1-SUM(R256:S256) -> 0 | U256: 1 | V256: 0 | W256: =1-SUM(U256:V256) -> 0 | X256: 1 | Y256: 0 | Z256: =1-SUM(X256:Y256) -> 0 | AA256: 0 | AB256: 1 | AC256: =1-SUM(AA256:AB256) -> 0 | AD256: 0 | AE256: 1 | AF256: =1-SUM(AD256:AE256) -> 0 | AG256: 0 | AH256: 1 | AI256: =1-SUM(AG256:AH256) -> 0 | AJ256: 0 | AK256: 1 | AL256: =1-SUM(AJ256:AK256) -> 0 | AM256: 0 | AN256: 1 | AO256: =1-SUM(AM256:AN256) -> 0 | AP256: 0 | AQ256: 1 | AR256: =1-SUM(AP256:AQ256) -> 0 | AS256: 0 | AT256: 1 | AU256: =1-SUM(AS256:AT256) -> 0 | AV256: 0 | AW256: 1 | AX256: =1-SUM(AV256:AW256) -> 0 | AY256: 0 | AZ256: 1 | BA256: =1-SUM(AY256:AZ256) -> 0 | BB256: 0 | BC256: 1 | BD256: =1-SUM(BB256:BC256) -> 0 | BE256: 0 | BF256: 1 | BG256: =1-SUM(BE256:BF256) -> 0 | BH256: 0 | BI256: 1 | BJ256: =1-SUM(BH256:BI256) -> 0 | BK256: 0 | BL256: 1 | BM256: =1-SUM(BK256:BL256) -> 0 | BN256: 0 | BO256: =1-BN256 -> 1
O257: 1 | P257: 0 | Q257: =1-SUM(O257:P257) -> 0 | R257: 0 | S257: 1 | T257: =1-SUM(R257:S257) -> 0 | U257: 0 | V257: 1 | W257: =1-SUM(U257:V257) -> 0 | X257: 1 | Y257: 0 | Z257: =1-SUM(X257:Y257) -> 0 | AA257: 0 | AB257: 1 | AC257: =1-SUM(AA257:AB257) -> 0 | AD257: 1 | AE257: 0 | AF257: =1-SUM(AD257:AE257) -> 0 | AG257: 1 | AH257: 0 | AI257: =1-SUM(AG257:AH257) -> 0 | AJ257: 0 | AK257: 1 | AL257: =1-SUM(AJ257:AK257) -> 0 | AM257: 0 | AN257: 1 | AO257: =1-SUM(AM257:AN257) -> 0 | AP257: 0 | AQ257: 1 | AR257: =1-SUM(AP257:AQ257) -> 0 | AS257: 0 | AT257: 1 | AU257: =1-SUM(AS257:AT257) -> 0 | AV257: 0 | AW257: 1 | AX257: =1-SUM(AV257:AW257) -> 0 | AY257: 0 | AZ257: 1 | BA257: =1-SUM(AY257:AZ257) -> 0 | BB257: 0 | BC257: 1 | BD257: =1-SUM(BB257:BC257) -> 0 | BE257: 0 | BF257: 1 | BG257: =1-SUM(BE257:BF257) -> 0 | BH257: 0 | BI257: 1 | BJ257: =1-SUM(BH257:BI257) -> 0 | BK257: 0 | BL257: 1 | BM257: =1-SUM(BK257:BL257) -> 0 | BN257: 0 | BO257: =1-BN257 -> 1
O258: 1 | P258: 0 | Q258: =1-SUM(O258:P258) -> 0 | R258: 0 | S258: 1 | T258: =1-SUM(R258:S258) -> 0 | U258: 0 | V258: 1 | W258: =1-SUM(U258:V258) -> 0 | X258: 0 | Y258: 1 | Z258: =1-SUM(X258:Y258) -> 0 | AA258: 0 | AB258: 1 | AC258: =1-SUM(AA258:AB258) -> 0 | AD258: 1 | AE258: 0 | AF258: =1-SUM(AD258:AE258) -> 0 | AG258: 1 | AH258: 0 | AI258: =1-SUM(AG258:AH258) -> 0 | AJ258: 0 | AK258: 1 | AL258: =1-SUM(AJ258:AK258) -> 0 | AM258: 0 | AN258: 1 | AO258: =1-SUM(AM258:AN258) -> 0 | AP258: 1 | AQ258: 0 | AR258: =1-SUM(AP258:AQ258) -> 0 | AS258: 0 | AT258: 1 | AU258: =1-SUM(AS258:AT258) -> 0 | AV258: 0 | AW258: 1 | AX258: =1-SUM(AV258:AW258) -> 0 | AY258: 0 | AZ258: 1 | BA258: =1-SUM(AY258:AZ258) -> 0 | BB258: 1 | BC258: 0 | BD258: =1-SUM(BB258:BC258) -> 0 | BE258: 0 | BF258: 1 | BG258: =1-SUM(BE258:BF258) -> 0 | BH258: 0 | BI258: 1 | BJ258: =1-SUM(BH258:BI258) -> 0 | BK258: 1 | BL258: 0 | BM258: =1-SUM(BK258:BL258) -> 0 | BN258: 1 | BO258: =1-BN258 -> 0
O259: 1 | P259: 0 | Q259: =1-SUM(O259:P259) -> 0 | R259: 1 | S259: 0 | T259: =1-SUM(R259:S259) -> 0 | U259: 0 | V259: 1 | W259: =1-SUM(U259:V259) -> 0 | X259: 0 | Y259: 1 | Z259: =1-SUM(X259:Y259) -> 0 | AA259: 1 | AB259: 0 | AC259: =1-SUM(AA259:AB259) -> 0 | AD259: 0 | AE259: 1 | AF259: =1-SUM(AD259:AE259) -> 0 | AG259: 0 | AH259: 1 | AI259: =1-SUM(AG259:AH259) -> 0 | AJ259: 1 | AK259: 0 | AL259: =1-SUM(AJ259:AK259) -> 0 | AM259: 1 | AN259: 0 | AO259: =1-SUM(AM259:AN259) -> 0 | AP259: 0 | AQ259: 1 | AR259: =1-SUM(AP259:AQ259) -> 0 | AS259: 1 | AT259: 0 | AU259: =1-SUM(AS259:AT259) -> 0 | AV259: 1 | AW259: 0 | AX259: =1-SUM(AV259:AW259) -> 0 | AY259: 0 | AZ259: 1 | BA259: =1-SUM(AY259:AZ259) -> 0 | BB259: 0 | BC259: 1 | BD259: =1-SUM(BB259:BC259) -> 0 | BE259: 1 | BF259: 0 | BG259: =1-SUM(BE259:BF259) -> 0 | BH259: 0 | BI259: 1 | BJ259: =1-SUM(BH259:BI259) -> 0 | BK259: 0 | BL259: 1 | BM259: =1-SUM(BK259:BL259) -> 0 | BN259: 1 | BO259: =1-BN259 -> 0
O260: 1 | P260: 0 | Q260: =1-SUM(O260:P260) -> 0 | R260: 0 | S260: 1 | T260: =1-SUM(R260:S260) -> 0 | U260: 0 | V260: 1 | W260: =1-SUM(U260:V260) -> 0 | X260: 0 | Y260: 1 | Z260: =1-SUM(X260:Y260) -> 0 | AA260: 0 | AB260: 1 | AC260: =1-SUM(AA260:AB260) -> 0 | AD260: 0 | AE260: 1 | AF260: =1-SUM(AD260:AE260) -> 0 | AG260: 0 | AH260: 1 | AI260: =1-SUM(AG260:AH260) -> 0 | AJ260: 1 | AK260: 0 | AL260: =1-SUM(AJ260:AK260) -> 0 | AM260: 1 | AN260: 0 | AO260: =1-SUM(AM260:AN260) -> 0 | AP260: 0 | AQ260: 1 | AR260: =1-SUM(AP260:AQ260) -> 0 | AS260: 1 | AT260: 0 | AU260: =1-SUM(AS260:AT260) -> 0 | AV260: 0 | AW260: 1 | AX260: =1-SUM(AV260:AW260) -> 0 | AY260: 0 | AZ260: 1 | BA260: =1-SUM(AY260:AZ260) -> 0 | BB260: 0 | BC260: 1 | BD260: =1-SUM(BB260:BC260) -> 0 | BE260: 0 | BF260: 1 | BG260: =1-SUM(BE260:BF260) -> 0 | BH260: 0 | BI260: 1 | BJ260: =1-SUM(BH260:BI260) -> 0 | BK260: 0 | BL260: 1 | BM260: =1-SUM(BK260:BL260) -> 0 | BN260: 1 | BO260: =1-BN260 -> 0
O261: 1 | P261: 0 | Q261: =1-SUM(O261:P261) -> 0 | R261: 1 | S261: 0 | T261: =1-SUM(R261:S261) -> 0 | U261: 1 | V261: 0 | W261: =1-SUM(U261:V261) -> 0 | X261: 0 | Y261: 1 | Z261: =1-SUM(X261:Y261) -> 0 | AA261: 0 | AB261: 1 | AC261: =1-SUM(AA261:AB261) -> 0 | AD261: 0 | AE261: 1 | AF261: =1-SUM(AD261:AE261) -> 0 | AG261: 0 | AH261: 1 | AI261: =1-SUM(AG261:AH261) -> 0 | AJ261: 0 | AK261: 1 | AL261: =1-SUM(AJ261:AK261) -> 0 | AM261: 0 | AN261: 1 | AO261: =1-SUM(AM261:AN261) -> 0 | AP261: 0 | AQ261: 1 | AR261: =1-SUM(AP261:AQ261) -> 0 | AS261: 0 | AT261: 1 | AU261: =1-SUM(AS261:AT261) -> 0 | AV261: 0 | AW261: 1 | AX261: =1-SUM(AV261:AW261) -> 0 | AY261: 0 | AZ261: 1 | BA261: =1-SUM(AY261:AZ261) -> 0 | BB261: 0 | BC261: 1 | BD261: =1-SUM(BB261:BC261) -> 0 | BE261: 0 | BF261: 1 | BG261: =1-SUM(BE261:BF261) -> 0 | BH261: 0 | BI261: 1 | BJ261: =1-SUM(BH261:BI261) -> 0 | BK261: 0 | BL261: 1 | BM261: =1-SUM(BK261:BL261) -> 0 | BN261: 0 | BO261: =1-BN261 -> 1
O262: 0 | P262: 1 | Q262: =1-SUM(O262:P262) -> 0 | R262: 0 | S262: 1 | T262: =1-SUM(R262:S262) -> 0 | U262: 0 | V262: 1 | W262: =1-SUM(U262:V262) -> 0 | X262: 0 | Y262: 1 | Z262: =1-SUM(X262:Y262) -> 0 | AA262: 0 | AB262: 1 | AC262: =1-SUM(AA262:AB262) -> 0 | AD262: 0 | AE262: 1 | AF262: =1-SUM(AD262:AE262) -> 0 | AG262: 0 | AH262: 1 | AI262: =1-SUM(AG262:AH262) -> 0 | AJ262: 0 | AK262: 1 | AL262: =1-SUM(AJ262:AK262) -> 0 | AM262: 0 | AN262: 1 | AO262: =1-SUM(AM262:AN262) -> 0 | AP262: 0 | AQ262: 1 | AR262: =1-SUM(AP262:AQ262) -> 0 | AS262: 0 | AT262: 1 | AU262: =1-SUM(AS262:AT262) -> 0 | AV262: 0 | AW262: 1 | AX262: =1-SUM(AV262:AW262) -> 0 | AY262: 0 | AZ262: 1 | BA262: =1-SUM(AY262:AZ262) -> 0 | BB262: 0 | BC262: 1 | BD262: =1-SUM(BB262:BC262) -> 0 | BE262: 0 | BF262: 1 | BG262: =1-SUM(BE262:BF262) -> 0 | BH262: 1 | BI262: 0 | BJ262: =1-SUM(BH262:BI262) -> 0 | BK262: 0 | BL262: 1 | BM262: =1-SUM(BK262:BL262) -> 0 | BN262: 1 | BO262: =1-BN262 -> 0
O263: 1 | P263: 0 | Q263: =1-SUM(O263:P263) -> 0 | R263: 1 | S263: 0 | T263: =1-SUM(R263:S263) -> 0 | U263: 0 | V263: 1 | W263: =1-SUM(U263:V263) -> 0 | X263: 1 | Y263: 0 | Z263: =1-SUM(X263:Y263) -> 0 | AA263: 0 | AB263: 1 | AC263: =1-SUM(AA263:AB263) -> 0 | AD263: 1 | AE263: 0 | AF263: =1-SUM(AD263:AE263) -> 0 | AG263: 0 | AH263: 1 | AI263: =1-SUM(AG263:AH263) -> 0 | AJ263: 0 | AK263: 1 | AL263: =1-SUM(AJ263:AK263) -> 0 | AM263: 0 | AN263: 1 | AO263: =1-SUM(AM263:AN263) -> 0 | AP263: 0 | AQ263: 1 | AR263: =1-SUM(AP263:AQ263) -> 0 | AS263: 0 | AT263: 1 | AU263: =1-SUM(AS263:AT263) -> 0 | AV263: 0 | AW263: 1 | AX263: =1-SUM(AV263:AW263) -> 0 | AY263: 0 | AZ263: 1 | BA263: =1-SUM(AY263:AZ263) -> 0 | BB263: 0 | BC263: 1 | BD263: =1-SUM(BB263:BC263) -> 0 | BE263: 0 | BF263: 1 | BG263: =1-SUM(BE263:BF263) -> 0 | BH263: 0 | BI263: 1 | BJ263: =1-SUM(BH263:BI263) -> 0 | BK263: 0 | BL263: 1 | BM263: =1-SUM(BK263:BL263) -> 0 | BN263: 0 | BO263: =1-BN263 -> 1
O264: 0 | P264: 1 | Q264: =1-SUM(O264:P264) -> 0 | R264: 1 | S264: 0 | T264: =1-SUM(R264:S264) -> 0 | U264: 0 | V264: 1 | W264: =1-SUM(U264:V264) -> 0 | X264: 1 | Y264: 0 | Z264: =1-SUM(X264:Y264) -> 0 | AA264: 0 | AB264: 1 | AC264: =1-SUM(AA264:AB264) -> 0 | AD264: 0 | AE264: 1 | AF264: =1-SUM(AD264:AE264) -> 0 | AG264: 1 | AH264: 0 | AI264: =1-SUM(AG264:AH264) -> 0 | AJ264: 0 | AK264: 1 | AL264: =1-SUM(AJ264:AK264) -> 0 | AM264: 0 | AN264: 1 | AO264: =1-SUM(AM264:AN264) -> 0 | AP264: 0 | AQ264: 1 | AR264: =1-SUM(AP264:AQ264) -> 0 | AS264: 1 | AT264: 0 | AU264: =1-SUM(AS264:AT264) -> 0 | AV264: 0 | AW264: 1 | AX264: =1-SUM(AV264:AW264) -> 0 | AY264: 0 | AZ264: 1 | BA264: =1-SUM(AY264:AZ264) -> 0 | BB264: 0 | BC264: 1 | BD264: =1-SUM(BB264:BC264) -> 0 | BE264: 0 | BF264: 1 | BG264: =1-SUM(BE264:BF264) -> 0 | BH264: 0 | BI264: 1 | BJ264: =1-SUM(BH264:BI264) -> 0 | BK264: 0 | BL264: 1 | BM264: =1-SUM(BK264:BL264) -> 0 | BN264: 1 | BO264: =1-BN264 -> 0
O265: 0 | P265: 1 | Q265: =1-SUM(O265:P265) -> 0 | R265: 1 | S265: 0 | T265: =1-SUM(R265:S265) -> 0 | U265: 1 | V265: 0 | W265: =1-SUM(U265:V265) -> 0 | X265: 1 | Y265: 0 | Z265: =1-SUM(X265:Y265) -> 0 | AA265: 0 | AB265: 1 | AC265: =1-SUM(AA265:AB265) -> 0 | AD265: 1 | AE265: 0 | AF265: =1-SUM(AD265:AE265) -> 0 | AG265: 1 | AH265: 0 | AI265: =1-SUM(AG265:AH265) -> 0 | AJ265: 0 | AK265: 1 | AL265: =1-SUM(AJ265:AK265) -> 0 | AM265: 0 | AN265: 1 | AO265: =1-SUM(AM265:AN265) -> 0 | AP265: 0 | AQ265: 1 | AR265: =1-SUM(AP265:AQ265) -> 0 | AS265: 1 | AT265: 0 | AU265: =1-SUM(AS265:AT265) -> 0 | AV265: 0 | AW265: 1 | AX265: =1-SUM(AV265:AW265) -> 0 | AY265: 0 | AZ265: 1 | BA265: =1-SUM(AY265:AZ265) -> 0 | BB265: 1 | BC265: 0 | BD265: =1-SUM(BB265:BC265) -> 0 | BE265: 0 | BF265: 1 | BG265: =1-SUM(BE265:BF265) -> 0 | BH265: 0 | BI265: 1 | BJ265: =1-SUM(BH265:BI265) -> 0 | BK265: 0 | BL265: 1 | BM265: =1-SUM(BK265:BL265) -> 0 | BN265: 1 | BO265: =1-BN265 -> 0
O266: 1 | P266: 0 | Q266: =1-SUM(O266:P266) -> 0 | R266: 1 | S266: 0 | T266: =1-SUM(R266:S266) -> 0 | U266: 1 | V266: 0 | W266: =1-SUM(U266:V266) -> 0 | X266: 1 | Y266: 0 | Z266: =1-SUM(X266:Y266) -> 0 | AA266: 0 | AB266: 1 | AC266: =1-SUM(AA266:AB266) -> 0 | AD266: 0 | AE266: 1 | AF266: =1-SUM(AD266:AE266) -> 0 | AG266: 0 | AH266: 1 | AI266: =1-SUM(AG266:AH266) -> 0 | AJ266: 1 | AK266: 0 | AL266: =1-SUM(AJ266:AK266) -> 0 | AM266: 0 | AN266: 1 | AO266: =1-SUM(AM266:AN266) -> 0 | AP266: 0 | AQ266: 1 | AR266: =1-SUM(AP266:AQ266) -> 0 | AS266: 0 | AT266: 1 | AU266: =1-SUM(AS266:AT266) -> 0 | AV266: 0 | AW266: 1 | AX266: =1-SUM(AV266:AW266) -> 0 | AY266: 0 | AZ266: 1 | BA266: =1-SUM(AY266:AZ266) -> 0 | BB266: 0 | BC266: 1 | BD266: =1-SUM(BB266:BC266) -> 0 | BE266: 0 | BF266: 1 | BG266: =1-SUM(BE266:BF266) -> 0 | BH266: 0 | BI266: 1 | BJ266: =1-SUM(BH266:BI266) -> 0 | BK266: 0 | BL266: 1 | BM266: =1-SUM(BK266:BL266) -> 0 | BN266: 1 | BO266: =1-BN266 -> 0
O267: 1 | P267: 0 | Q267: =1-SUM(O267:P267) -> 0 | R267: 0 | S267: 1 | T267: =1-SUM(R267:S267) -> 0 | U267: 0 | V267: 1 | W267: =1-SUM(U267:V267) -> 0 | X267: 0 | Y267: 1 | Z267: =1-SUM(X267:Y267) -> 0 | AA267: 0 | AB267: 1 | AC267: =1-SUM(AA267:AB267) -> 0 | AD267: 0 | AE267: 1 | AF267: =1-SUM(AD267:AE267) -> 0 | AG267: 0 | AH267: 1 | AI267: =1-SUM(AG267:AH267) -> 0 | AJ267: 0 | AK267: 1 | AL267: =1-SUM(AJ267:AK267) -> 0 | AM267: 0 | AN267: 1 | AO267: =1-SUM(AM267:AN267) -> 0 | AP267: 0 | AQ267: 1 | AR267: =1-SUM(AP267:AQ267) -> 0 | AS267: 0 | AT267: 1 | AU267: =1-SUM(AS267:AT267) -> 0 | AV267: 0 | AW267: 1 | AX267: =1-SUM(AV267:AW267) -> 0 | AY267: 0 | AZ267: 1 | BA267: =1-SUM(AY267:AZ267) -> 0 | BB267: 0 | BC267: 1 | BD267: =1-SUM(BB267:BC267) -> 0 | BE267: 0 | BF267: 1 | BG267: =1-SUM(BE267:BF267) -> 0 | BH267: 0 | BI267: 1 | BJ267: =1-SUM(BH267:BI267) -> 0 | BK267: 0 | BL267: 1 | BM267: =1-SUM(BK267:BL267) -> 0 | BN267: 0 | BO267: =1-BN267 -> 1
O268: 1 | P268: 0 | Q268: =1-SUM(O268:P268) -> 0 | R268: 1 | S268: 0 | T268: =1-SUM(R268:S268) -> 0 | U268: 0 | V268: 1 | W268: =1-SUM(U268:V268) -> 0 | X268: 1 | Y268: 0 | Z268: =1-SUM(X268:Y268) -> 0 | AA268: 1 | AB268: 0 | AC268: =1-SUM(AA268:AB268) -> 0 | AD268: 0 | AE268: 1 | AF268: =1-SUM(AD268:AE268) -> 0 | AG268: 0 | AH268: 1 | AI268: =1-SUM(AG268:AH268) -> 0 | AJ268: 1 | AK268: 0 | AL268: =1-SUM(AJ268:AK268) -> 0 | AM268: 1 | AN268: 0 | AO268: =1-SUM(AM268:AN268) -> 0 | AP268: 0 | AQ268: 1 | AR268: =1-SUM(AP268:AQ268) -> 0 | AS268: 1 | AT268: 0 | AU268: =1-SUM(AS268:AT268) -> 0 | AV268: 1 | AW268: 0 | AX268: =1-SUM(AV268:AW268) -> 0 | AY268: 1 | AZ268: 0 | BA268: =1-SUM(AY268:AZ268) -> 0 | BB268: 0 | BC268: 1 | BD268: =1-SUM(BB268:BC268) -> 0 | BE268: 0 | BF268: 1 | BG268: =1-SUM(BE268:BF268) -> 0 | BH268: 1 | BI268: 0 | BJ268: =1-SUM(BH268:BI268) -> 0 | BK268: 1 | BL268: 0 | BM268: =1-SUM(BK268:BL268) -> 0 | BN268: 0 | BO268: =1-BN268 -> 1
O269: 1 | P269: 0 | Q269: =1-SUM(O269:P269) -> 0 | R269: 0 | S269: 1 | T269: =1-SUM(R269:S269) -> 0 | U269: 0 | V269: 1 | W269: =1-SUM(U269:V269) -> 0 | X269: 0 | Y269: 1 | Z269: =1-SUM(X269:Y269) -> 0 | AA269: 0 | AB269: 1 | AC269: =1-SUM(AA269:AB269) -> 0 | AD269: 0 | AE269: 1 | AF269: =1-SUM(AD269:AE269) -> 0 | AG269: 0 | AH269: 1 | AI269: =1-SUM(AG269:AH269) -> 0 | AJ269: 0 | AK269: 1 | AL269: =1-SUM(AJ269:AK269) -> 0 | AM269: 1 | AN269: 0 | AO269: =1-SUM(AM269:AN269) -> 0 | AP269: 0 | AQ269: 1 | AR269: =1-SUM(AP269:AQ269) -> 0 | AS269: 0 | AT269: 1 | AU269: =1-SUM(AS269:AT269) -> 0 | AV269: 0 | AW269: 1 | AX269: =1-SUM(AV269:AW269) -> 0 | AY269: 0 | AZ269: 1 | BA269: =1-SUM(AY269:AZ269) -> 0 | BB269: 0 | BC269: 1 | BD269: =1-SUM(BB269:BC269) -> 0 | BE269: 0 | BF269: 1 | BG269: =1-SUM(BE269:BF269) -> 0 | BH269: 0 | BI269: 1 | BJ269: =1-SUM(BH269:BI269) -> 0 | BK269: 0 | BL269: 1 | BM269: =1-SUM(BK269:BL269) -> 0 | BN269: 0 | BO269: =1-BN269 -> 1
O270: 1 | P270: 0 | Q270: =1-SUM(O270:P270) -> 0 | R270: 0 | S270: 1 | T270: =1-SUM(R270:S270) -> 0 | U270: 0 | V270: 1 | W270: =1-SUM(U270:V270) -> 0 | X270: 0 | Y270: 1 | Z270: =1-SUM(X270:Y270) -> 0 | AA270: 0 | AB270: 1 | AC270: =1-SUM(AA270:AB270) -> 0 | AD270: 0 | AE270: 1 | AF270: =1-SUM(AD270:AE270) -> 0 | AG270: 0 | AH270: 1 | AI270: =1-SUM(AG270:AH270) -> 0 | AJ270: 1 | AK270: 0 | AL270: =1-SUM(AJ270:AK270) -> 0 | AM270: 1 | AN270: 0 | AO270: =1-SUM(AM270:AN270) -> 0 | AP270: 0 | AQ270: 1 | AR270: =1-SUM(AP270:AQ270) -> 0 | AS270: 1 | AT270: 0 | AU270: =1-SUM(AS270:AT270) -> 0 | AV270: 0 | AW270: 1 | AX270: =1-SUM(AV270:AW270) -> 0 | AY270: 0 | AZ270: 1 | BA270: =1-SUM(AY270:AZ270) -> 0 | BB270: 0 | BC270: 1 | BD270: =1-SUM(BB270:BC270) -> 0 | BE270: 0 | BF270: 1 | BG270: =1-SUM(BE270:BF270) -> 0 | BH270: 0 | BI270: 1 | BJ270: =1-SUM(BH270:BI270) -> 0 | BK270: 0 | BL270: 1 | BM270: =1-SUM(BK270:BL270) -> 0 | BN270: 1 | BO270: =1-BN270 -> 0
O271: 0 | P271: 1 | Q271: =1-SUM(O271:P271) -> 0 | R271: 0 | S271: 1 | T271: =1-SUM(R271:S271) -> 0 | U271: 0 | V271: 1 | W271: =1-SUM(U271:V271) -> 0 | X271: 0 | Y271: 1 | Z271: =1-SUM(X271:Y271) -> 0 | AA271: 0 | AB271: 1 | AC271: =1-SUM(AA271:AB271) -> 0 | AD271: 0 | AE271: 1 | AF271: =1-SUM(AD271:AE271) -> 0 | AG271: 0 | AH271: 1 | AI271: =1-SUM(AG271:AH271) -> 0 | AJ271: 0 | AK271: 1 | AL271: =1-SUM(AJ271:AK271) -> 0 | AM271: 0 | AN271: 1 | AO271: =1-SUM(AM271:AN271) -> 0 | AP271: 0 | AQ271: 1 | AR271: =1-SUM(AP271:AQ271) -> 0 | AS271: 0 | AT271: 1 | AU271: =1-SUM(AS271:AT271) -> 0 | AV271: 0 | AW271: 1 | AX271: =1-SUM(AV271:AW271) -> 0 | AY271: 0 | AZ271: 1 | BA271: =1-SUM(AY271:AZ271) -> 0 | BB271: 0 | BC271: 1 | BD271: =1-SUM(BB271:BC271) -> 0 | BE271: 0 | BF271: 1 | BG271: =1-SUM(BE271:BF271) -> 0 | BH271: 0 | BI271: 1 | BJ271: =1-SUM(BH271:BI271) -> 0 | BK271: 0 | BL271: 1 | BM271: =1-SUM(BK271:BL271) -> 0 | BN271: 1 | BO271: =1-BN271 -> 0
O272: 0 | P272: 1 | Q272: =1-SUM(O272:P272) -> 0 | R272: 0 | S272: 1 | T272: =1-SUM(R272:S272) -> 0 | U272: 0 | V272: 1 | W272: =1-SUM(U272:V272) -> 0 | X272: 0 | Y272: 1 | Z272: =1-SUM(X272:Y272) -> 0 | AA272: 0 | AB272: 1 | AC272: =1-SUM(AA272:AB272) -> 0 | AD272: 0 | AE272: 1 | AF272: =1-SUM(AD272:AE272) -> 0 | AG272: 0 | AH272: 1 | AI272: =1-SUM(AG272:AH272) -> 0 | AJ272: 0 | AK272: 1 | AL272: =1-SUM(AJ272:AK272) -> 0 | AM272: 0 | AN272: 1 | AO272: =1-SUM(AM272:AN272) -> 0 | AP272: 0 | AQ272: 1 | AR272: =1-SUM(AP272:AQ272) -> 0 | AS272: 0 | AT272: 1 | AU272: =1-SUM(AS272:AT272) -> 0 | AV272: 0 | AW272: 1 | AX272: =1-SUM(AV272:AW272) -> 0 | AY272: 0 | AZ272: 1 | BA272: =1-SUM(AY272:AZ272) -> 0 | BB272: 0 | BC272: 1 | BD272: =1-SUM(BB272:BC272) -> 0 | BE272: 0 | BF272: 1 | BG272: =1-SUM(BE272:BF272) -> 0 | BH272: 1 | BI272: 0 | BJ272: =1-SUM(BH272:BI272) -> 0 | BK272: 0 | BL272: 1 | BM272: =1-SUM(BK272:BL272) -> 0 | BN272: 1 | BO272: =1-BN272 -> 0
O273: 1 | P273: 0 | Q273: =1-SUM(O273:P273) -> 0 | R273: 1 | S273: 0 | T273: =1-SUM(R273:S273) -> 0 | U273: 0 | V273: 1 | W273: =1-SUM(U273:V273) -> 0 | X273: 1 | Y273: 0 | Z273: =1-SUM(X273:Y273) -> 0 | AA273: 1 | AB273: 0 | AC273: =1-SUM(AA273:AB273) -> 0 | AD273: 0 | AE273: 1 | AF273: =1-SUM(AD273:AE273) -> 0 | AG273: 0 | AH273: 1 | AI273: =1-SUM(AG273:AH273) -> 0 | AJ273: 1 | AK273: 0 | AL273: =1-SUM(AJ273:AK273) -> 0 | AM273: 0 | AN273: 1 | AO273: =1-SUM(AM273:AN273) -> 0 | AP273: 0 | AQ273: 1 | AR273: =1-SUM(AP273:AQ273) -> 0 | AS273: 1 | AT273: 0 | AU273: =1-SUM(AS273:AT273) -> 0 | AV273: 0 | AW273: 1 | AX273: =1-SUM(AV273:AW273) -> 0 | AY273: 0 | AZ273: 1 | BA273: =1-SUM(AY273:AZ273) -> 0 | BB273: 0 | BC273: 1 | BD273: =1-SUM(BB273:BC273) -> 0 | BE273: 0 | BF273: 1 | BG273: =1-SUM(BE273:BF273) -> 0 | BH273: 0 | BI273: 1 | BJ273: =1-SUM(BH273:BI273) -> 0 | BK273: 0 | BL273: 1 | BM273: =1-SUM(BK273:BL273) -> 0 | BN273: 1 | BO273: =1-BN273 -> 0
O274: 1 | P274: 0 | Q274: =1-SUM(O274:P274) -> 0 | R274: 0 | S274: 1 | T274: =1-SUM(R274:S274) -> 0 | U274: 0 | V274: 1 | W274: =1-SUM(U274:V274) -> 0 | X274: 1 | Y274: 0 | Z274: =1-SUM(X274:Y274) -> 0 | AA274: 1 | AB274: 0 | AC274: =1-SUM(AA274:AB274) -> 0 | AD274: 0 | AE274: 1 | AF274: =1-SUM(AD274:AE274) -> 0 | AG274: 0 | AH274: 1 | AI274: =1-SUM(AG274:AH274) -> 0 | AJ274: 1 | AK274: 0 | AL274: =1-SUM(AJ274:AK274) -> 0 | AM274: 1 | AN274: 0 | AO274: =1-SUM(AM274:AN274) -> 0 | AP274: 0 | AQ274: 1 | AR274: =1-SUM(AP274:AQ274) -> 0 | AS274: 1 | AT274: 0 | AU274: =1-SUM(AS274:AT274) -> 0 | AV274: 0 | AW274: 1 | AX274: =1-SUM(AV274:AW274) -> 0 | AY274: 1 | AZ274: 0 | BA274: =1-SUM(AY274:AZ274) -> 0 | BB274: 0 | BC274: 1 | BD274: =1-SUM(BB274:BC274) -> 0 | BE274: 1 | BF274: 0 | BG274: =1-SUM(BE274:BF274) -> 0 | BH274: 0 | BI274: 1 | BJ274: =1-SUM(BH274:BI274) -> 0 | BK274: 0 | BL274: 1 | BM274: =1-SUM(BK274:BL274) -> 0 | BN274: 1 | BO274: =1-BN274 -> 0
O275: 1 | P275: 0 | Q275: =1-SUM(O275:P275) -> 0 | R275: 0 | S275: 1 | T275: =1-SUM(R275:S275) -> 0 | U275: 0 | V275: 1 | W275: =1-SUM(U275:V275) -> 0 | X275: 1 | Y275: 0 | Z275: =1-SUM(X275:Y275) -> 0 | AA275: 1 | AB275: 0 | AC275: =1-SUM(AA275:AB275) -> 0 | AD275: 0 | AE275: 1 | AF275: =1-SUM(AD275:AE275) -> 0 | AG275: 0 | AH275: 1 | AI275: =1-SUM(AG275:AH275) -> 0 | AJ275: 1 | AK275: 0 | AL275: =1-SUM(AJ275:AK275) -> 0 | AM275: 1 | AN275: 0 | AO275: =1-SUM(AM275:AN275) -> 0 | AP275: 0 | AQ275: 1 | AR275: =1-SUM(AP275:AQ275) -> 0 | AS275: 1 | AT275: 0 | AU275: =1-SUM(AS275:AT275) -> 0 | AV275: 1 | AW275: 0 | AX275: =1-SUM(AV275:AW275) -> 0 | AY275: 1 | AZ275: 0 | BA275: =1-SUM(AY275:AZ275) -> 0 | BB275: 0 | BC275: 1 | BD275: =1-SUM(BB275:BC275) -> 0 | BE275: 1 | BF275: 0 | BG275: =1-SUM(BE275:BF275) -> 0 | BH275: 0 | BI275: 1 | BJ275: =1-SUM(BH275:BI275) -> 0 | BK275: 0 | BL275: 1 | BM275: =1-SUM(BK275:BL275) -> 0 | BN275: 0 | BO275: =1-BN275 -> 1
O276: 0 | P276: 1 | Q276: =1-SUM(O276:P276) -> 0 | R276: 0 | S276: 1 | T276: =1-SUM(R276:S276) -> 0 | U276: 0 | V276: 1 | W276: =1-SUM(U276:V276) -> 0 | X276: 0 | Y276: 1 | Z276: =1-SUM(X276:Y276) -> 0 | AA276: 0 | AB276: 1 | AC276: =1-SUM(AA276:AB276) -> 0 | AD276: 0 | AE276: 1 | AF276: =1-SUM(AD276:AE276) -> 0 | AG276: 0 | AH276: 1 | AI276: =1-SUM(AG276:AH276) -> 0 | AJ276: 1 | AK276: 0 | AL276: =1-SUM(AJ276:AK276) -> 0 | AM276: 1 | AN276: 0 | AO276: =1-SUM(AM276:AN276) -> 0 | AP276: 0 | AQ276: 1 | AR276: =1-SUM(AP276:AQ276) -> 0 | AS276: 1 | AT276: 0 | AU276: =1-SUM(AS276:AT276) -> 0 | AV276: 0 | AW276: 1 | AX276: =1-SUM(AV276:AW276) -> 0 | AY276: 0 | AZ276: 1 | BA276: =1-SUM(AY276:AZ276) -> 0 | BB276: 0 | BC276: 1 | BD276: =1-SUM(BB276:BC276) -> 0 | BE276: 0 | BF276: 1 | BG276: =1-SUM(BE276:BF276) -> 0 | BH276: 0 | BI276: 1 | BJ276: =1-SUM(BH276:BI276) -> 0 | BK276: 0 | BL276: 1 | BM276: =1-SUM(BK276:BL276) -> 0 | BN276: 0 | BO276: =1-BN276 -> 1
O277: 0 | P277: 1 | Q277: =1-SUM(O277:P277) -> 0 | R277: 0 | S277: 1 | T277: =1-SUM(R277:S277) -> 0 | U277: 0 | V277: 1 | W277: =1-SUM(U277:V277) -> 0 | X277: 0 | Y277: 1 | Z277: =1-SUM(X277:Y277) -> 0 | AA277: 0 | AB277: 1 | AC277: =1-SUM(AA277:AB277) -> 0 | AD277: 0 | AE277: 1 | AF277: =1-SUM(AD277:AE277) -> 0 | AG277: 0 | AH277: 1 | AI277: =1-SUM(AG277:AH277) -> 0 | AJ277: 0 | AK277: 1 | AL277: =1-SUM(AJ277:AK277) -> 0 | AM277: 0 | AN277: 1 | AO277: =1-SUM(AM277:AN277) -> 0 | AP277: 0 | AQ277: 1 | AR277: =1-SUM(AP277:AQ277) -> 0 | AS277: 0 | AT277: 1 | AU277: =1-SUM(AS277:AT277) -> 0 | AV277: 0 | AW277: 1 | AX277: =1-SUM(AV277:AW277) -> 0 | AY277: 0 | AZ277: 1 | BA277: =1-SUM(AY277:AZ277) -> 0 | BB277: 0 | BC277: 1 | BD277: =1-SUM(BB277:BC277) -> 0 | BE277: 0 | BF277: 1 | BG277: =1-SUM(BE277:BF277) -> 0 | BH277: 0 | BI277: 1 | BJ277: =1-SUM(BH277:BI277) -> 0 | BK277: 0 | BL277: 1 | BM277: =1-SUM(BK277:BL277) -> 0 | BN277: 1 | BO277: =1-BN277 -> 0
O278: 1 | P278: 0 | Q278: =1-SUM(O278:P278) -> 0 | R278: 0 | S278: 1 | T278: =1-SUM(R278:S278) -> 0 | U278: 0 | V278: 1 | W278: =1-SUM(U278:V278) -> 0 | X278: 0 | Y278: 1 | Z278: =1-SUM(X278:Y278) -> 0 | AA278: 1 | AB278: 0 | AC278: =1-SUM(AA278:AB278) -> 0 | AD278: 0 | AE278: 1 | AF278: =1-SUM(AD278:AE278) -> 0 | AG278: 0 | AH278: 1 | AI278: =1-SUM(AG278:AH278) -> 0 | AJ278: 1 | AK278: 0 | AL278: =1-SUM(AJ278:AK278) -> 0 | AM278: 0 | AN278: 1 | AO278: =1-SUM(AM278:AN278) -> 0 | AP278: 0 | AQ278: 1 | AR278: =1-SUM(AP278:AQ278) -> 0 | AS278: 1 | AT278: 0 | AU278: =1-SUM(AS278:AT278) -> 0 | AV278: 0 | AW278: 1 | AX278: =1-SUM(AV278:AW278) -> 0 | AY278: 1 | AZ278: 0 | BA278: =1-SUM(AY278:AZ278) -> 0 | BB278: 1 | BC278: 0 | BD278: =1-SUM(BB278:BC278) -> 0 | BE278: 1 | BF278: 0 | BG278: =1-SUM(BE278:BF278) -> 0 | BH278: 0 | BI278: 1 | BJ278: =1-SUM(BH278:BI278) -> 0 | BK278: 0 | BL278: 1 | BM278: =1-SUM(BK278:BL278) -> 0 | BN278: 0 | BO278: =1-BN278 -> 1
O279: 1 | P279: 0 | Q279: =1-SUM(O279:P279) -> 0 | R279: 0 | S279: 1 | T279: =1-SUM(R279:S279) -> 0 | U279: 0 | V279: 1 | W279: =1-SUM(U279:V279) -> 0 | X279: 0 | Y279: 1 | Z279: =1-SUM(X279:Y279) -> 0 | AA279: 0 | AB279: 1 | AC279: =1-SUM(AA279:AB279) -> 0 | AD279: 0 | AE279: 1 | AF279: =1-SUM(AD279:AE279) -> 0 | AG279: 0 | AH279: 1 | AI279: =1-SUM(AG279:AH279) -> 0 | AJ279: 1 | AK279: 0 | AL279: =1-SUM(AJ279:AK279) -> 0 | AM279: 1 | AN279: 0 | AO279: =1-SUM(AM279:AN279) -> 0 | AP279: 0 | AQ279: 1 | AR279: =1-SUM(AP279:AQ279) -> 0 | AS279: 0 | AT279: 1 | AU279: =1-SUM(AS279:AT279) -> 0 | AV279: 0 | AW279: 1 | AX279: =1-SUM(AV279:AW279) -> 0 | AY279: 1 | AZ279: 0 | BA279: =1-SUM(AY279:AZ279) -> 0 | BB279: 0 | BC279: 1 | BD279: =1-SUM(BB279:BC279) -> 0 | BE279: 0 | BF279: 1 | BG279: =1-SUM(BE279:BF279) -> 0 | BH279: 0 | BI279: 1 | BJ279: =1-SUM(BH279:BI279) -> 0 | BK279: 0 | BL279: 1 | BM279: =1-SUM(BK279:BL279) -> 0 | BN279: 1 | BO279: =1-BN279 -> 0
O280: 1 | P280: 0 | Q280: =1-SUM(O280:P280) -> 0 | R280: 0 | S280: 1 | T280: =1-SUM(R280:S280) -> 0 | U280: 0 | V280: 1 | W280: =1-SUM(U280:V280) -> 0 | X280: 0 | Y280: 1 | Z280: =1-SUM(X280:Y280) -> 0 | AA280: 0 | AB280: 1 | AC280: =1-SUM(AA280:AB280) -> 0 | AD280: 0 | AE280: 1 | AF280: =1-SUM(AD280:AE280) -> 0 | AG280: 0 | AH280: 1 | AI280: =1-SUM(AG280:AH280) -> 0 | AJ280: 1 | AK280: 0 | AL280: =1-SUM(AJ280:AK280) -> 0 | AM280: 0 | AN280: 1 | AO280: =1-SUM(AM280:AN280) -> 0 | AP280: 0 | AQ280: 1 | AR280: =1-SUM(AP280:AQ280) -> 0 | AS280: 1 | AT280: 0 | AU280: =1-SUM(AS280:AT280) -> 0 | AV280: 1 | AW280: 0 | AX280: =1-SUM(AV280:AW280) -> 0 | AY280: 1 | AZ280: 0 | BA280: =1-SUM(AY280:AZ280) -> 0 | BB280: 1 | BC280: 0 | BD280: =1-SUM(BB280:BC280) -> 0 | BE280: 0 | BF280: 1 | BG280: =1-SUM(BE280:BF280) -> 0 | BH280: 0 | BI280: 1 | BJ280: =1-SUM(BH280:BI280) -> 0 | BK280: 0 | BL280: 1 | BM280: =1-SUM(BK280:BL280) -> 0 | BN280: 1 | BO280: =1-BN280 -> 0
O281: 1 | P281: 0 | Q281: =1-SUM(O281:P281) -> 0 | R281: 0 | S281: 1 | T281: =1-SUM(R281:S281) -> 0 | U281: 0 | V281: 1 | W281: =1-SUM(U281:V281) -> 0 | X281: 0 | Y281: 1 | Z281: =1-SUM(X281:Y281) -> 0 | AA281: 0 | AB281: 1 | AC281: =1-SUM(AA281:AB281) -> 0 | AD281: 0 | AE281: 1 | AF281: =1-SUM(AD281:AE281) -> 0 | AG281: 0 | AH281: 1 | AI281: =1-SUM(AG281:AH281) -> 0 | AJ281: 1 | AK281: 0 | AL281: =1-SUM(AJ281:AK281) -> 0 | AM281: 1 | AN281: 0 | AO281: =1-SUM(AM281:AN281) -> 0 | AP281: 0 | AQ281: 1 | AR281: =1-SUM(AP281:AQ281) -> 0 | AS281: 1 | AT281: 0 | AU281: =1-SUM(AS281:AT281) -> 0 | AV281: 1 | AW281: 0 | AX281: =1-SUM(AV281:AW281) -> 0 | AY281: 1 | AZ281: 0 | BA281: =1-SUM(AY281:AZ281) -> 0 | BB281: 1 | BC281: 0 | BD281: =1-SUM(BB281:BC281) -> 0 | BE281: 0 | BF281: 1 | BG281: =1-SUM(BE281:BF281) -> 0 | BH281: 0 | BI281: 1 | BJ281: =1-SUM(BH281:BI281) -> 0 | BK281: 0 | BL281: 1 | BM281: =1-SUM(BK281:BL281) -> 0 | BN281: 0 | BO281: =1-BN281 -> 1
O282: 1 | P282: 0 | Q282: =1-SUM(O282:P282) -> 0 | R282: 0 | S282: 1 | T282: =1-SUM(R282:S282) -> 0 | U282: 0 | V282: 1 | W282: =1-SUM(U282:V282) -> 0 | X282: 1 | Y282: 0 | Z282: =1-SUM(X282:Y282) -> 0 | AA282: 1 | AB282: 0 | AC282: =1-SUM(AA282:AB282) -> 0 | AD282: 0 | AE282: 0 | AF282: =1-SUM(AD282:AE282) -> 1 | AG282: 0 | AH282: 0 | AI282: =1-SUM(AG282:AH282) -> 1 | AJ282: 1 | AK282: 0 | AL282: =1-SUM(AJ282:AK282) -> 0 | AM282: 0 | AN282: 1 | AO282: =1-SUM(AM282:AN282) -> 0 | AP282: 0 | AQ282: 1 | AR282: =1-SUM(AP282:AQ282) -> 0 | AS282: 1 | AT282: 0 | AU282: =1-SUM(AS282:AT282) -> 0 | AV282: 0 | AW282: 1 | AX282: =1-SUM(AV282:AW282) -> 0 | AY282: 1 | AZ282: 0 | BA282: =1-SUM(AY282:AZ282) -> 0 | BB282: 1 | BC282: 0 | BD282: =1-SUM(BB282:BC282) -> 0 | BE282: 0 | BF282: 1 | BG282: =1-SUM(BE282:BF282) -> 0 | BH282: 0 | BI282: 1 | BJ282: =1-SUM(BH282:BI282) -> 0 | BK282: 0 | BL282: 1 | BM282: =1-SUM(BK282:BL282) -> 0 | BN282: 0 | BO282: =1-BN282 -> 1
O283: 1 | P283: 0 | Q283: =1-SUM(O283:P283) -> 0 | R283: 1 | S283: 0 | T283: =1-SUM(R283:S283) -> 0 | U283: 1 | V283: 0 | W283: =1-SUM(U283:V283) -> 0 | X283: 1 | Y283: 0 | Z283: =1-SUM(X283:Y283) -> 0 | AA283: 1 | AB283: 0 | AC283: =1-SUM(AA283:AB283) -> 0 | AD283: 0 | AE283: 1 | AF283: =1-SUM(AD283:AE283) -> 0 | AG283: 0 | AH283: 1 | AI283: =1-SUM(AG283:AH283) -> 0 | AJ283: 0 | AK283: 1 | AL283: =1-SUM(AJ283:AK283) -> 0 | AM283: 0 | AN283: 1 | AO283: =1-SUM(AM283:AN283) -> 0 | AP283: 0 | AQ283: 1 | AR283: =1-SUM(AP283:AQ283) -> 0 | AS283: 0 | AT283: 1 | AU283: =1-SUM(AS283:AT283) -> 0 | AV283: 1 | AW283: 0 | AX283: =1-SUM(AV283:AW283) -> 0 | AY283: 0 | AZ283: 1 | BA283: =1-SUM(AY283:AZ283) -> 0 | BB283: 0 | BC283: 1 | BD283: =1-SUM(BB283:BC283) -> 0 | BE283: 0 | BF283: 1 | BG283: =1-SUM(BE283:BF283) -> 0 | BH283: 0 | BI283: 1 | BJ283: =1-SUM(BH283:BI283) -> 0 | BK283: 0 | BL283: 1 | BM283: =1-SUM(BK283:BL283) -> 0 | BN283: 0 | BO283: =1-BN283 -> 1
O284: 1 | P284: 0 | Q284: =1-SUM(O284:P284) -> 0 | R284: 1 | S284: 0 | T284: =1-SUM(R284:S284) -> 0 | U284: 0 | V284: 1 | W284: =1-SUM(U284:V284) -> 0 | X284: 0 | Y284: 1 | Z284: =1-SUM(X284:Y284) -> 0 | AA284: 1 | AB284: 0 | AC284: =1-SUM(AA284:AB284) -> 0 | AD284: 0 | AE284: 1 | AF284: =1-SUM(AD284:AE284) -> 0 | AG284: 1 | AH284: 0 | AI284: =1-SUM(AG284:AH284) -> 0 | AJ284: 0 | AK284: 1 | AL284: =1-SUM(AJ284:AK284) -> 0 | AM284: 1 | AN284: 0 | AO284: =1-SUM(AM284:AN284) -> 0 | AP284: 0 | AQ284: 1 | AR284: =1-SUM(AP284:AQ284) -> 0 | AS284: 1 | AT284: 0 | AU284: =1-SUM(AS284:AT284) -> 0 | AV284: 1 | AW284: 0 | AX284: =1-SUM(AV284:AW284) -> 0 | AY284: 1 | AZ284: 0 | BA284: =1-SUM(AY284:AZ284) -> 0 | BB284: 1 | BC284: 0 | BD284: =1-SUM(BB284:BC284) -> 0 | BE284: 0 | BF284: 1 | BG284: =1-SUM(BE284:BF284) -> 0 | BH284: 0 | BI284: 1 | BJ284: =1-SUM(BH284:BI284) -> 0 | BK284: 0 | BL284: 1 | BM284: =1-SUM(BK284:BL284) -> 0 | BN284: 1 | BO284: =1-BN284 -> 0
O285: 0 | P285: 1 | Q285: =1-SUM(O285:P285) -> 0 | R285: 0 | S285: 1 | T285: =1-SUM(R285:S285) -> 0 | U285: 0 | V285: 1 | W285: =1-SUM(U285:V285) -> 0 | X285: 0 | Y285: 1 | Z285: =1-SUM(X285:Y285) -> 0 | AA285: 0 | AB285: 1 | AC285: =1-SUM(AA285:AB285) -> 0 | AD285: 0 | AE285: 1 | AF285: =1-SUM(AD285:AE285) -> 0 | AG285: 0 | AH285: 1 | AI285: =1-SUM(AG285:AH285) -> 0 | AJ285: 1 | AK285: 0 | AL285: =1-SUM(AJ285:AK285) -> 0 | AM285: 1 | AN285: 0 | AO285: =1-SUM(AM285:AN285) -> 0 | AP285: 0 | AQ285: 1 | AR285: =1-SUM(AP285:AQ285) -> 0 | AS285: 0 | AT285: 1 | AU285: =1-SUM(AS285:AT285) -> 0 | AV285: 0 | AW285: 1 | AX285: =1-SUM(AV285:AW285) -> 0 | AY285: 0 | AZ285: 1 | BA285: =1-SUM(AY285:AZ285) -> 0 | BB285: 0 | BC285: 1 | BD285: =1-SUM(BB285:BC285) -> 0 | BE285: 0 | BF285: 1 | BG285: =1-SUM(BE285:BF285) -> 0 | BH285: 0 | BI285: 1 | BJ285: =1-SUM(BH285:BI285) -> 0 | BK285: 0 | BL285: 1 | BM285: =1-SUM(BK285:BL285) -> 0 | BN285: 0 | BO285: =1-BN285 -> 1
O286: 1 | P286: 0 | Q286: =1-SUM(O286:P286) -> 0 | R286: 0 | S286: 1 | T286: =1-SUM(R286:S286) -> 0 | U286: 0 | V286: 1 | W286: =1-SUM(U286:V286) -> 0 | X286: 1 | Y286: 0 | Z286: =1-SUM(X286:Y286) -> 0 | AA286: 1 | AB286: 0 | AC286: =1-SUM(AA286:AB286) -> 0 | AD286: 0 | AE286: 1 | AF286: =1-SUM(AD286:AE286) -> 0 | AG286: 0 | AH286: 1 | AI286: =1-SUM(AG286:AH286) -> 0 | AJ286: 1 | AK286: 0 | AL286: =1-SUM(AJ286:AK286) -> 0 | AM286: 1 | AN286: 0 | AO286: =1-SUM(AM286:AN286) -> 0 | AP286: 0 | AQ286: 1 | AR286: =1-SUM(AP286:AQ286) -> 0 | AS286: 1 | AT286: 0 | AU286: =1-SUM(AS286:AT286) -> 0 | AV286: 0 | AW286: 1 | AX286: =1-SUM(AV286:AW286) -> 0 | AY286: 1 | AZ286: 0 | BA286: =1-SUM(AY286:AZ286) -> 0 | BB286: 1 | BC286: 0 | BD286: =1-SUM(BB286:BC286) -> 0 | BE286: 1 | BF286: 0 | BG286: =1-SUM(BE286:BF286) -> 0 | BH286: 0 | BI286: 1 | BJ286: =1-SUM(BH286:BI286) -> 0 | BK286: 0 | BL286: 1 | BM286: =1-SUM(BK286:BL286) -> 0 | BN286: 1 | BO286: =1-BN286 -> 0
O287: 1 | P287: 0 | Q287: =1-SUM(O287:P287) -> 0 | R287: 0 | S287: 1 | T287: =1-SUM(R287:S287) -> 0 | U287: 0 | V287: 1 | W287: =1-SUM(U287:V287) -> 0 | X287: 0 | Y287: 1 | Z287: =1-SUM(X287:Y287) -> 0 | AA287: 1 | AB287: 0 | AC287: =1-SUM(AA287:AB287) -> 0 | AD287: 0 | AE287: 1 | AF287: =1-SUM(AD287:AE287) -> 0 | AG287: 0 | AH287: 1 | AI287: =1-SUM(AG287:AH287) -> 0 | AJ287: 1 | AK287: 0 | AL287: =1-SUM(AJ287:AK287) -> 0 | AM287: 1 | AN287: 0 | AO287: =1-SUM(AM287:AN287) -> 0 | AP287: 0 | AQ287: 1 | AR287: =1-SUM(AP287:AQ287) -> 0 | AS287: 0 | AT287: 1 | AU287: =1-SUM(AS287:AT287) -> 0 | AV287: 1 | AW287: 0 | AX287: =1-SUM(AV287:AW287) -> 0 | AY287: 1 | AZ287: 0 | BA287: =1-SUM(AY287:AZ287) -> 0 | BB287: 1 | BC287: 0 | BD287: =1-SUM(BB287:BC287) -> 0 | BE287: 0 | BF287: 1 | BG287: =1-SUM(BE287:BF287) -> 0 | BH287: 0 | BI287: 1 | BJ287: =1-SUM(BH287:BI287) -> 0 | BK287: 0 | BL287: 1 | BM287: =1-SUM(BK287:BL287) -> 0 | BN287: 0 | BO287: =1-BN287 -> 1
O288: 1 | P288: 0 | Q288: =1-SUM(O288:P288) -> 0 | R288: 1 | S288: 0 | T288: =1-SUM(R288:S288) -> 0 | U288: 1 | V288: 0 | W288: =1-SUM(U288:V288) -> 0 | X288: 1 | Y288: 0 | Z288: =1-SUM(X288:Y288) -> 0 | AA288: 0 | AB288: 1 | AC288: =1-SUM(AA288:AB288) -> 0 | AD288: 0 | AE288: 1 | AF288: =1-SUM(AD288:AE288) -> 0 | AG288: 0 | AH288: 1 | AI288: =1-SUM(AG288:AH288) -> 0 | AJ288: 1 | AK288: 0 | AL288: =1-SUM(AJ288:AK288) -> 0 | AM288: 1 | AN288: 0 | AO288: =1-SUM(AM288:AN288) -> 0 | AP288: 0 | AQ288: 1 | AR288: =1-SUM(AP288:AQ288) -> 0 | AS288: 0 | AT288: 1 | AU288: =1-SUM(AS288:AT288) -> 0 | AV288: 0 | AW288: 1 | AX288: =1-SUM(AV288:AW288) -> 0 | AY288: 0 | AZ288: 1 | BA288: =1-SUM(AY288:AZ288) -> 0 | BB288: 0 | BC288: 1 | BD288: =1-SUM(BB288:BC288) -> 0 | BE288: 0 | BF288: 1 | BG288: =1-SUM(BE288:BF288) -> 0 | BH288: 0 | BI288: 1 | BJ288: =1-SUM(BH288:BI288) -> 0 | BK288: 0 | BL288: 1 | BM288: =1-SUM(BK288:BL288) -> 0 | BN288: 0 | BO288: =1-BN288 -> 1
O289: 1 | P289: 0 | Q289: =1-SUM(O289:P289) -> 0 | R289: 0 | S289: 1 | T289: =1-SUM(R289:S289) -> 0 | U289: 0 | V289: 1 | W289: =1-SUM(U289:V289) -> 0 | X289: 0 | Y289: 1 | Z289: =1-SUM(X289:Y289) -> 0 | AA289: 0 | AB289: 1 | AC289: =1-SUM(AA289:AB289) -> 0 | AD289: 0 | AE289: 1 | AF289: =1-SUM(AD289:AE289) -> 0 | AG289: 0 | AH289: 1 | AI289: =1-SUM(AG289:AH289) -> 0 | AJ289: 1 | AK289: 0 | AL289: =1-SUM(AJ289:AK289) -> 0 | AM289: 0 | AN289: 1 | AO289: =1-SUM(AM289:AN289) -> 0 | AP289: 1 | AQ289: 0 | AR289: =1-SUM(AP289:AQ289) -> 0 | AS289: 0 | AT289: 1 | AU289: =1-SUM(AS289:AT289) -> 0 | AV289: 0 | AW289: 1 | AX289: =1-SUM(AV289:AW289) -> 0 | AY289: 0 | AZ289: 1 | BA289: =1-SUM(AY289:AZ289) -> 0 | BB289: 0 | BC289: 1 | BD289: =1-SUM(BB289:BC289) -> 0 | BE289: 0 | BF289: 1 | BG289: =1-SUM(BE289:BF289) -> 0 | BH289: 0 | BI289: 1 | BJ289: =1-SUM(BH289:BI289) -> 0 | BK289: 0 | BL289: 1 | BM289: =1-SUM(BK289:BL289) -> 0 | BN289: 0 | BO289: =1-BN289 -> 1
O290: 1 | P290: 0 | Q290: =1-SUM(O290:P290) -> 0 | R290: 0 | S290: 1 | T290: =1-SUM(R290:S290) -> 0 | U290: 0 | V290: 1 | W290: =1-SUM(U290:V290) -> 0 | X290: 0 | Y290: 1 | Z290: =1-SUM(X290:Y290) -> 0 | AA290: 1 | AB290: 0 | AC290: =1-SUM(AA290:AB290) -> 0 | AD290: 0 | AE290: 1 | AF290: =1-SUM(AD290:AE290) -> 0 | AG290: 0 | AH290: 1 | AI290: =1-SUM(AG290:AH290) -> 0 | AJ290: 1 | AK290: 0 | AL290: =1-SUM(AJ290:AK290) -> 0 | AM290: 0 | AN290: 1 | AO290: =1-SUM(AM290:AN290) -> 0 | AP290: 0 | AQ290: 1 | AR290: =1-SUM(AP290:AQ290) -> 0 | AS290: 0 | AT290: 1 | AU290: =1-SUM(AS290:AT290) -> 0 | AV290: 1 | AW290: 0 | AX290: =1-SUM(AV290:AW290) -> 0 | AY290: 1 | AZ290: 0 | BA290: =1-SUM(AY290:AZ290) -> 0 | BB290: 1 | BC290: 0 | BD290: =1-SUM(BB290:BC290) -> 0 | BE290: 1 | BF290: 0 | BG290: =1-SUM(BE290:BF290) -> 0 | BH290: 0 | BI290: 1 | BJ290: =1-SUM(BH290:BI290) -> 0 | BK290: 0 | BL290: 1 | BM290: =1-SUM(BK290:BL290) -> 0 | BN290: 0 | BO290: =1-BN290 -> 1
O291: 1 | P291: 0 | Q291: =1-SUM(O291:P291) -> 0 | R291: 0 | S291: 1 | T291: =1-SUM(R291:S291) -> 0 | U291: 0 | V291: 1 | W291: =1-SUM(U291:V291) -> 0 | X291: 0 | Y291: 1 | Z291: =1-SUM(X291:Y291) -> 0 | AA291: 1 | AB291: 0 | AC291: =1-SUM(AA291:AB291) -> 0 | AD291: 0 | AE291: 1 | AF291: =1-SUM(AD291:AE291) -> 0 | AG291: 0 | AH291: 1 | AI291: =1-SUM(AG291:AH291) -> 0 | AJ291: 1 | AK291: 0 | AL291: =1-SUM(AJ291:AK291) -> 0 | AM291: 0 | AN291: 1 | AO291: =1-SUM(AM291:AN291) -> 0 | AP291: 0 | AQ291: 1 | AR291: =1-SUM(AP291:AQ291) -> 0 | AS291: 0 | AT291: 1 | AU291: =1-SUM(AS291:AT291) -> 0 | AV291: 1 | AW291: 0 | AX291: =1-SUM(AV291:AW291) -> 0 | AY291: 1 | AZ291: 0 | BA291: =1-SUM(AY291:AZ291) -> 0 | BB291: 1 | BC291: 0 | BD291: =1-SUM(BB291:BC291) -> 0 | BE291: 1 | BF291: 0 | BG291: =1-SUM(BE291:BF291) -> 0 | BH291: 0 | BI291: 1 | BJ291: =1-SUM(BH291:BI291) -> 0 | BK291: 0 | BL291: 1 | BM291: =1-SUM(BK291:BL291) -> 0 | BN291: 1 | BO291: =1-BN291 -> 0
O292: 1 | P292: 0 | Q292: =1-SUM(O292:P292) -> 0 | R292: 1 | S292: 0 | T292: =1-SUM(R292:S292) -> 0 | U292: 1 | V292: 0 | W292: =1-SUM(U292:V292) -> 0 | X292: 1 | Y292: 0 | Z292: =1-SUM(X292:Y292) -> 0 | AA292: 1 | AB292: 0 | AC292: =1-SUM(AA292:AB292) -> 0 | AD292: 1 | AE292: 0 | AF292: =1-SUM(AD292:AE292) -> 0 | AG292: 0 | AH292: 1 | AI292: =1-SUM(AG292:AH292) -> 0 | AJ292: 1 | AK292: 0 | AL292: =1-SUM(AJ292:AK292) -> 0 | AM292: 1 | AN292: 0 | AO292: =1-SUM(AM292:AN292) -> 0 | AP292: 0 | AQ292: 1 | AR292: =1-SUM(AP292:AQ292) -> 0 | AS292: 0 | AT292: 0 | AU292: =1-SUM(AS292:AT292) -> 1 | AV292: 1 | AW292: 0 | AX292: =1-SUM(AV292:AW292) -> 0 | AY292: 0 | AZ292: 1 | BA292: =1-SUM(AY292:AZ292) -> 0 | BB292: 0 | BC292: 1 | BD292: =1-SUM(BB292:BC292) -> 0 | BE292: 0 | BF292: 0 | BG292: =1-SUM(BE292:BF292) -> 1 | BH292: 0 | BI292: 1 | BJ292: =1-SUM(BH292:BI292) -> 0 | BK292: 0 | BL292: 1 | BM292: =1-SUM(BK292:BL292) -> 0 | BN292: 1 | BO292: =1-BN292 -> 0
O293: 1 | P293: 0 | Q293: =1-SUM(O293:P293) -> 0 | R293: 1 | S293: 0 | T293: =1-SUM(R293:S293) -> 0 | U293: 1 | V293: 0 | W293: =1-SUM(U293:V293) -> 0 | X293: 1 | Y293: 0 | Z293: =1-SUM(X293:Y293) -> 0 | AA293: 1 | AB293: 0 | AC293: =1-SUM(AA293:AB293) -> 0 | AD293: 1 | AE293: 0 | AF293: =1-SUM(AD293:AE293) -> 0 | AG293: 0 | AH293: 1 | AI293: =1-SUM(AG293:AH293) -> 0 | AJ293: 1 | AK293: 0 | AL293: =1-SUM(AJ293:AK293) -> 0 | AM293: 0 | AN293: 1 | AO293: =1-SUM(AM293:AN293) -> 0 | AP293: 0 | AQ293: 1 | AR293: =1-SUM(AP293:AQ293) -> 0 | AS293: 0 | AT293: 1 | AU293: =1-SUM(AS293:AT293) -> 0 | AV293: 1 | AW293: 0 | AX293: =1-SUM(AV293:AW293) -> 0 | AY293: 0 | AZ293: 1 | BA293: =1-SUM(AY293:AZ293) -> 0 | BB293: 0 | BC293: 1 | BD293: =1-SUM(BB293:BC293) -> 0 | BE293: 0 | BF293: 1 | BG293: =1-SUM(BE293:BF293) -> 0 | BH293: 0 | BI293: 1 | BJ293: =1-SUM(BH293:BI293) -> 0 | BK293: 0 | BL293: 1 | BM293: =1-SUM(BK293:BL293) -> 0 | BN293: 0 | BO293: =1-BN293 -> 1
O294: 1 | P294: 0 | Q294: =1-SUM(O294:P294) -> 0 | R294: 0 | S294: 1 | T294: =1-SUM(R294:S294) -> 0 | U294: 0 | V294: 1 | W294: =1-SUM(U294:V294) -> 0 | X294: 0 | Y294: 1 | Z294: =1-SUM(X294:Y294) -> 0 | AA294: 0 | AB294: 1 | AC294: =1-SUM(AA294:AB294) -> 0 | AD294: 1 | AE294: 0 | AF294: =1-SUM(AD294:AE294) -> 0 | AG294: 1 | AH294: 0 | AI294: =1-SUM(AG294:AH294) -> 0 | AJ294: 0 | AK294: 1 | AL294: =1-SUM(AJ294:AK294) -> 0 | AM294: 0 | AN294: 1 | AO294: =1-SUM(AM294:AN294) -> 0 | AP294: 0 | AQ294: 1 | AR294: =1-SUM(AP294:AQ294) -> 0 | AS294: 0 | AT294: 1 | AU294: =1-SUM(AS294:AT294) -> 0 | AV294: 0 | AW294: 1 | AX294: =1-SUM(AV294:AW294) -> 0 | AY294: 1 | AZ294: 0 | BA294: =1-SUM(AY294:AZ294) -> 0 | BB294: 0 | BC294: 1 | BD294: =1-SUM(BB294:BC294) -> 0 | BE294: 0 | BF294: 1 | BG294: =1-SUM(BE294:BF294) -> 0 | BH294: 0 | BI294: 1 | BJ294: =1-SUM(BH294:BI294) -> 0 | BK294: 0 | BL294: 1 | BM294: =1-SUM(BK294:BL294) -> 0 | BN294: 0 | BO294: =1-BN294 -> 1
O295: 1 | P295: 0 | Q295: =1-SUM(O295:P295) -> 0 | R295: 1 | S295: 0 | T295: =1-SUM(R295:S295) -> 0 | U295: 1 | V295: 0 | W295: =1-SUM(U295:V295) -> 0 | X295: 1 | Y295: 0 | Z295: =1-SUM(X295:Y295) -> 0 | AA295: 0 | AB295: 1 | AC295: =1-SUM(AA295:AB295) -> 0 | AD295: 1 | AE295: 0 | AF295: =1-SUM(AD295:AE295) -> 0 | AG295: 0 | AH295: 1 | AI295: =1-SUM(AG295:AH295) -> 0 | AJ295: 0 | AK295: 1 | AL295: =1-SUM(AJ295:AK295) -> 0 | AM295: 0 | AN295: 1 | AO295: =1-SUM(AM295:AN295) -> 0 | AP295: 0 | AQ295: 1 | AR295: =1-SUM(AP295:AQ295) -> 0 | AS295: 0 | AT295: 1 | AU295: =1-SUM(AS295:AT295) -> 0 | AV295: 0 | AW295: 1 | AX295: =1-SUM(AV295:AW295) -> 0 | AY295: 0 | AZ295: 1 | BA295: =1-SUM(AY295:AZ295) -> 0 | BB295: 0 | BC295: 1 | BD295: =1-SUM(BB295:BC295) -> 0 | BE295: 0 | BF295: 1 | BG295: =1-SUM(BE295:BF295) -> 0 | BH295: 0 | BI295: 1 | BJ295: =1-SUM(BH295:BI295) -> 0 | BK295: 0 | BL295: 1 | BM295: =1-SUM(BK295:BL295) -> 0 | BN295: 1 | BO295: =1-BN295 -> 0
O296: 1 | P296: 0 | Q296: =1-SUM(O296:P296) -> 0 | R296: 1 | S296: 0 | T296: =1-SUM(R296:S296) -> 0 | U296: 1 | V296: 0 | W296: =1-SUM(U296:V296) -> 0 | X296: 1 | Y296: 0 | Z296: =1-SUM(X296:Y296) -> 0 | AA296: 1 | AB296: 0 | AC296: =1-SUM(AA296:AB296) -> 0 | AD296: 0 | AE296: 1 | AF296: =1-SUM(AD296:AE296) -> 0 | AG296: 0 | AH296: 1 | AI296: =1-SUM(AG296:AH296) -> 0 | AJ296: 0 | AK296: 1 | AL296: =1-SUM(AJ296:AK296) -> 0 | AM296: 0 | AN296: 1 | AO296: =1-SUM(AM296:AN296) -> 0 | AP296: 0 | AQ296: 1 | AR296: =1-SUM(AP296:AQ296) -> 0 | AS296: 0 | AT296: 1 | AU296: =1-SUM(AS296:AT296) -> 0 | AV296: 1 | AW296: 0 | AX296: =1-SUM(AV296:AW296) -> 0 | AY296: 1 | AZ296: 0 | BA296: =1-SUM(AY296:AZ296) -> 0 | BB296: 0 | BC296: 1 | BD296: =1-SUM(BB296:BC296) -> 0 | BE296: 0 | BF296: 1 | BG296: =1-SUM(BE296:BF296) -> 0 | BH296: 0 | BI296: 1 | BJ296: =1-SUM(BH296:BI296) -> 0 | BK296: 0 | BL296: 1 | BM296: =1-SUM(BK296:BL296) -> 0 | BN296: 1 | BO296: =1-BN296 -> 0
O297: 1 | P297: 0 | Q297: =1-SUM(O297:P297) -> 0 | R297: 1 | S297: 0 | T297: =1-SUM(R297:S297) -> 0 | U297: 1 | V297: 0 | W297: =1-SUM(U297:V297) -> 0 | X297: 1 | Y297: 0 | Z297: =1-SUM(X297:Y297) -> 0 | AA297: 1 | AB297: 0 | AC297: =1-SUM(AA297:AB297) -> 0 | AD297: 0 | AE297: 1 | AF297: =1-SUM(AD297:AE297) -> 0 | AG297: 0 | AH297: 1 | AI297: =1-SUM(AG297:AH297) -> 0 | AJ297: 1 | AK297: 0 | AL297: =1-SUM(AJ297:AK297) -> 0 | AM297: 1 | AN297: 0 | AO297: =1-SUM(AM297:AN297) -> 0 | AP297: 0 | AQ297: 1 | AR297: =1-SUM(AP297:AQ297) -> 0 | AS297: 1 | AT297: 0 | AU297: =1-SUM(AS297:AT297) -> 0 | AV297: 1 | AW297: 0 | AX297: =1-SUM(AV297:AW297) -> 0 | AY297: 1 | AZ297: 0 | BA297: =1-SUM(AY297:AZ297) -> 0 | BB297: 0 | BC297: 1 | BD297: =1-SUM(BB297:BC297) -> 0 | BE297: 1 | BF297: 0 | BG297: =1-SUM(BE297:BF297) -> 0 | BH297: 0 | BI297: 1 | BJ297: =1-SUM(BH297:BI297) -> 0 | BK297: 0 | BL297: 1 | BM297: =1-SUM(BK297:BL297) -> 0 | BN297: 1 | BO297: =1-BN297 -> 0
O298: 1 | P298: 0 | Q298: =1-SUM(O298:P298) -> 0 | R298: 1 | S298: 0 | T298: =1-SUM(R298:S298) -> 0 | U298: 1 | V298: 0 | W298: =1-SUM(U298:V298) -> 0 | X298: 1 | Y298: 0 | Z298: =1-SUM(X298:Y298) -> 0 | AA298: 1 | AB298: 0 | AC298: =1-SUM(AA298:AB298) -> 0 | AD298: 0 | AE298: 1 | AF298: =1-SUM(AD298:AE298) -> 0 | AG298: 0 | AH298: 1 | AI298: =1-SUM(AG298:AH298) -> 0 | AJ298: 1 | AK298: 0 | AL298: =1-SUM(AJ298:AK298) -> 0 | AM298: 1 | AN298: 0 | AO298: =1-SUM(AM298:AN298) -> 0 | AP298: 0 | AQ298: 1 | AR298: =1-SUM(AP298:AQ298) -> 0 | AS298: 1 | AT298: 0 | AU298: =1-SUM(AS298:AT298) -> 0 | AV298: 1 | AW298: 0 | AX298: =1-SUM(AV298:AW298) -> 0 | AY298: 1 | AZ298: 0 | BA298: =1-SUM(AY298:AZ298) -> 0 | BB298: 0 | BC298: 1 | BD298: =1-SUM(BB298:BC298) -> 0 | BE298: 1 | BF298: 0 | BG298: =1-SUM(BE298:BF298) -> 0 | BH298: 0 | BI298: 1 | BJ298: =1-SUM(BH298:BI298) -> 0 | BK298: 0 | BL298: 1 | BM298: =1-SUM(BK298:BL298) -> 0 | BN298: 1 | BO298: =1-BN298 -> 0
O299: 1 | P299: 0 | Q299: =1-SUM(O299:P299) -> 0 | R299: 1 | S299: 0 | T299: =1-SUM(R299:S299) -> 0 | U299: 1 | V299: 0 | W299: =1-SUM(U299:V299) -> 0 | X299: 1 | Y299: 0 | Z299: =1-SUM(X299:Y299) -> 0 | AA299: 0 | AB299: 0 | AC299: =1-SUM(AA299:AB299) -> 1 | AD299: 0 | AE299: 0 | AF299: =1-SUM(AD299:AE299) -> 1 | AG299: 0 | AH299: 1 | AI299: =1-SUM(AG299:AH299) -> 0 | AJ299: 0 | AK299: 1 | AL299: =1-SUM(AJ299:AK299) -> 0 | AM299: 0 | AN299: 1 | AO299: =1-SUM(AM299:AN299) -> 0 | AP299: 0 | AQ299: 1 | AR299: =1-SUM(AP299:AQ299) -> 0 | AS299: 0 | AT299: 1 | AU299: =1-SUM(AS299:AT299) -> 0 | AV299: 0 | AW299: 0 | AX299: =1-SUM(AV299:AW299) -> 1 | AY299: 0 | AZ299: 1 | BA299: =1-SUM(AY299:AZ299) -> 0 | BB299: 0 | BC299: 1 | BD299: =1-SUM(BB299:BC299) -> 0 | BE299: 0 | BF299: 1 | BG299: =1-SUM(BE299:BF299) -> 0 | BH299: 0 | BI299: 1 | BJ299: =1-SUM(BH299:BI299) -> 0 | BK299: 0 | BL299: 1 | BM299: =1-SUM(BK299:BL299) -> 0 | BN299: 1 | BO299: =1-BN299 -> 0
O300: 1 | P300: 0 | Q300: =1-SUM(O300:P300) -> 0 | R300: 1 | S300: 0 | T300: =1-SUM(R300:S300) -> 0 | U300: 1 | V300: 0 | W300: =1-SUM(U300:V300) -> 0 | X300: 1 | Y300: 0 | Z300: =1-SUM(X300:Y300) -> 0 | AA300: 1 | AB300: 0 | AC300: =1-SUM(AA300:AB300) -> 0 | AD300: 0 | AE300: 1 | AF300: =1-SUM(AD300:AE300) -> 0 | AG300: 0 | AH300: 1 | AI300: =1-SUM(AG300:AH300) -> 0 | AJ300: 1 | AK300: 0 | AL300: =1-SUM(AJ300:AK300) -> 0 | AM300: 1 | AN300: 0 | AO300: =1-SUM(AM300:AN300) -> 0 | AP300: 0 | AQ300: 1 | AR300: =1-SUM(AP300:AQ300) -> 0 | AS300: 0 | AT300: 1 | AU300: =1-SUM(AS300:AT300) -> 0 | AV300: 1 | AW300: 0 | AX300: =1-SUM(AV300:AW300) -> 0 | AY300: 0 | AZ300: 1 | BA300: =1-SUM(AY300:AZ300) -> 0 | BB300: 0 | BC300: 1 | BD300: =1-SUM(BB300:BC300) -> 0 | BE300: 1 | BF300: 0 | BG300: =1-SUM(BE300:BF300) -> 0 | BH300: 0 | BI300: 1 | BJ300: =1-SUM(BH300:BI300) -> 0 | BK300: 0 | BL300: 1 | BM300: =1-SUM(BK300:BL300) -> 0 | BN300: 1 | BO300: =1-BN300 -> 0
O301: 1 | P301: 0 | Q301: =1-SUM(O301:P301) -> 0 | R301: 0 | S301: 1 | T301: =1-SUM(R301:S301) -> 0 | U301: 0 | V301: 1 | W301: =1-SUM(U301:V301) -> 0 | X301: 1 | Y301: 0 | Z301: =1-SUM(X301:Y301) -> 0 | AA301: 1 | AB301: 0 | AC301: =1-SUM(AA301:AB301) -> 0 | AD301: 0 | AE301: 1 | AF301: =1-SUM(AD301:AE301) -> 0 | AG301: 0 | AH301: 1 | AI301: =1-SUM(AG301:AH301) -> 0 | AJ301: 1 | AK301: 0 | AL301: =1-SUM(AJ301:AK301) -> 0 | AM301: 1 | AN301: 0 | AO301: =1-SUM(AM301:AN301) -> 0 | AP301: 0 | AQ301: 1 | AR301: =1-SUM(AP301:AQ301) -> 0 | AS301: 1 | AT301: 0 | AU301: =1-SUM(AS301:AT301) -> 0 | AV301: 0 | AW301: 1 | AX301: =1-SUM(AV301:AW301) -> 0 | AY301: 1 | AZ301: 0 | BA301: =1-SUM(AY301:AZ301) -> 0 | BB301: 0 | BC301: 1 | BD301: =1-SUM(BB301:BC301) -> 0 | BE301: 1 | BF301: 0 | BG301: =1-SUM(BE301:BF301) -> 0 | BH301: 0 | BI301: 1 | BJ301: =1-SUM(BH301:BI301) -> 0 | BK301: 1 | BL301: 0 | BM301: =1-SUM(BK301:BL301) -> 0 | BN301: 1 | BO301: =1-BN301 -> 0
O302: 1 | P302: 0 | Q302: =1-SUM(O302:P302) -> 0 | R302: 1 | S302: 0 | T302: =1-SUM(R302:S302) -> 0 | U302: 1 | V302: 0 | W302: =1-SUM(U302:V302) -> 0 | X302: 1 | Y302: 0 | Z302: =1-SUM(X302:Y302) -> 0 | AA302: 1 | AB302: 0 | AC302: =1-SUM(AA302:AB302) -> 0 | AD302: 0 | AE302: 1 | AF302: =1-SUM(AD302:AE302) -> 0 | AG302: 0 | AH302: 1 | AI302: =1-SUM(AG302:AH302) -> 0 | AJ302: 0 | AK302: 1 | AL302: =1-SUM(AJ302:AK302) -> 0 | AM302: 0 | AN302: 1 | AO302: =1-SUM(AM302:AN302) -> 0 | AP302: 0 | AQ302: 1 | AR302: =1-SUM(AP302:AQ302) -> 0 | AS302: 0 | AT302: 1 | AU302: =1-SUM(AS302:AT302) -> 0 | AV302: 1 | AW302: 0 | AX302: =1-SUM(AV302:AW302) -> 0 | AY302: 1 | AZ302: 0 | BA302: =1-SUM(AY302:AZ302) -> 0 | BB302: 0 | BC302: 1 | BD302: =1-SUM(BB302:BC302) -> 0 | BE302: 0 | BF302: 1 | BG302: =1-SUM(BE302:BF302) -> 0 | BH302: 0 | BI302: 1 | BJ302: =1-SUM(BH302:BI302) -> 0 | BK302: 0 | BL302: 1 | BM302: =1-SUM(BK302:BL302) -> 0 | BN302: 1 | BO302: =1-BN302 -> 0
O303: 1 | P303: 0 | Q303: =1-SUM(O303:P303) -> 0 | R303: 1 | S303: 0 | T303: =1-SUM(R303:S303) -> 0 | U303: 1 | V303: 0 | W303: =1-SUM(U303:V303) -> 0 | X303: 1 | Y303: 0 | Z303: =1-SUM(X303:Y303) -> 0 | AA303: 1 | AB303: 0 | AC303: =1-SUM(AA303:AB303) -> 0 | AD303: 0 | AE303: 1 | AF303: =1-SUM(AD303:AE303) -> 0 | AG303: 0 | AH303: 1 | AI303: =1-SUM(AG303:AH303) -> 0 | AJ303: 0 | AK303: 1 | AL303: =1-SUM(AJ303:AK303) -> 0 | AM303: 0 | AN303: 1 | AO303: =1-SUM(AM303:AN303) -> 0 | AP303: 0 | AQ303: 1 | AR303: =1-SUM(AP303:AQ303) -> 0 | AS303: 0 | AT303: 1 | AU303: =1-SUM(AS303:AT303) -> 0 | AV303: 1 | AW303: 0 | AX303: =1-SUM(AV303:AW303) -> 0 | AY303: 1 | AZ303: 0 | BA303: =1-SUM(AY303:AZ303) -> 0 | BB303: 0 | BC303: 1 | BD303: =1-SUM(BB303:BC303) -> 0 | BE303: 0 | BF303: 1 | BG303: =1-SUM(BE303:BF303) -> 0 | BH303: 0 | BI303: 1 | BJ303: =1-SUM(BH303:BI303) -> 0 | BK303: 0 | BL303: 1 | BM303: =1-SUM(BK303:BL303) -> 0 | BN303: 1 | BO303: =1-BN303 -> 0
O304: 0 | P304: 0 | Q304: =1-SUM(O304:P304) -> 1 | R304: 0 | S304: 0 | T304: =1-SUM(R304:S304) -> 1 | U304: 0 | V304: 0 | W304: =1-SUM(U304:V304) -> 1 | X304: 0 | Y304: 0 | Z304: =1-SUM(X304:Y304) -> 1 | AA304: 0 | AB304: 0 | AC304: =1-SUM(AA304:AB304) -> 1 | AD304: 0 | AE304: 0 | AF304: =1-SUM(AD304:AE304) -> 1 | AG304: 0 | AH304: 0 | AI304: =1-SUM(AG304:AH304) -> 1 | AJ304: 0 | AK304: 0 | AL304: =1-SUM(AJ304:AK304) -> 1 | AM304: 0 | AN304: 0 | AO304: =1-SUM(AM304:AN304) -> 1 | AP304: 0 | AQ304: 0 | AR304: =1-SUM(AP304:AQ304) -> 1 | AS304: 0 | AT304: 0 | AU304: =1-SUM(AS304:AT304) -> 1 | AV304: 0 | AW304: 0 | AX304: =1-SUM(AV304:AW304) -> 1 | AY304: 0 | AZ304: 0 | BA304: =1-SUM(AY304:AZ304) -> 1 | BB304: 0 | BC304: 0 | BD304: =1-SUM(BB304:BC304) -> 1 | BE304: 0 | BF304: 0 | BG304: =1-SUM(BE304:BF304) -> 1 | BH304: 0 | BI304: 0 | BJ304: =1-SUM(BH304:BI304) -> 1 | BK304: 0 | BL304: 0 | BM304: =1-SUM(BK304:BL304) -> 1 | BN304: 1 | BO304: =1-BN304 -> 0
O305: 0 | P305: 0 | Q305: =1-SUM(O305:P305) -> 1 | R305: 0 | S305: 0 | T305: =1-SUM(R305:S305) -> 1 | U305: 0 | V305: 0 | W305: =1-SUM(U305:V305) -> 1 | X305: 0 | Y305: 0 | Z305: =1-SUM(X305:Y305) -> 1 | AA305: 0 | AB305: 0 | AC305: =1-SUM(AA305:AB305) -> 1 | AD305: 0 | AE305: 0 | AF305: =1-SUM(AD305:AE305) -> 1 | AG305: 0 | AH305: 0 | AI305: =1-SUM(AG305:AH305) -> 1 | AJ305: 0 | AK305: 0 | AL305: =1-SUM(AJ305:AK305) -> 1 | AM305: 0 | AN305: 0 | AO305: =1-SUM(AM305:AN305) -> 1 | AP305: 0 | AQ305: 0 | AR305: =1-SUM(AP305:AQ305) -> 1 | AS305: 0 | AT305: 0 | AU305: =1-SUM(AS305:AT305) -> 1 | AV305: 0 | AW305: 0 | AX305: =1-SUM(AV305:AW305) -> 1 | AY305: 0 | AZ305: 0 | BA305: =1-SUM(AY305:AZ305) -> 1 | BB305: 0 | BC305: 0 | BD305: =1-SUM(BB305:BC305) -> 1 | BE305: 0 | BF305: 0 | BG305: =1-SUM(BE305:BF305) -> 1 | BH305: 0 | BI305: 0 | BJ305: =1-SUM(BH305:BI305) -> 1 | BK305: 0 | BL305: 0 | BM305: =1-SUM(BK305:BL305) -> 1 | BN305: 0 | BO305: =1-BN305 -> 1
O306: 0 | P306: 1 | Q306: =1-SUM(O306:P306) -> 0 | R306: 0 | S306: 1 | T306: =1-SUM(R306:S306) -> 0 | U306: 0 | V306: 1 | W306: =1-SUM(U306:V306) -> 0 | X306: 0 | Y306: 1 | Z306: =1-SUM(X306:Y306) -> 0 | AA306: 0 | AB306: 1 | AC306: =1-SUM(AA306:AB306) -> 0 | AD306: 0 | AE306: 1 | AF306: =1-SUM(AD306:AE306) -> 0 | AG306: 0 | AH306: 1 | AI306: =1-SUM(AG306:AH306) -> 0 | AJ306: 1 | AK306: 0 | AL306: =1-SUM(AJ306:AK306) -> 0 | AM306: 0 | AN306: 1 | AO306: =1-SUM(AM306:AN306) -> 0 | AP306: 0 | AQ306: 1 | AR306: =1-SUM(AP306:AQ306) -> 0 | AS306: 0 | AT306: 1 | AU306: =1-SUM(AS306:AT306) -> 0 | AV306: 0 | AW306: 1 | AX306: =1-SUM(AV306:AW306) -> 0 | AY306: 0 | AZ306: 1 | BA306: =1-SUM(AY306:AZ306) -> 0 | BB306: 0 | BC306: 1 | BD306: =1-SUM(BB306:BC306) -> 0 | BE306: 0 | BF306: 1 | BG306: =1-SUM(BE306:BF306) -> 0 | BH306: 0 | BI306: 1 | BJ306: =1-SUM(BH306:BI306) -> 0 | BK306: 0 | BL306: 1 | BM306: =1-SUM(BK306:BL306) -> 0 | BN306: 0 | BO306: =1-BN306 -> 1
O307: 1 | P307: 0 | Q307: =1-SUM(O307:P307) -> 0 | R307: 1 | S307: 0 | T307: =1-SUM(R307:S307) -> 0 | U307: 1 | V307: 0 | W307: =1-SUM(U307:V307) -> 0 | X307: 1 | Y307: 0 | Z307: =1-SUM(X307:Y307) -> 0 | AA307: 0 | AB307: 1 | AC307: =1-SUM(AA307:AB307) -> 0 | AD307: 1 | AE307: 0 | AF307: =1-SUM(AD307:AE307) -> 0 | AG307: 1 | AH307: 0 | AI307: =1-SUM(AG307:AH307) -> 0 | AJ307: 1 | AK307: 0 | AL307: =1-SUM(AJ307:AK307) -> 0 | AM307: 1 | AN307: 0 | AO307: =1-SUM(AM307:AN307) -> 0 | AP307: 1 | AQ307: 0 | AR307: =1-SUM(AP307:AQ307) -> 0 | AS307: 0 | AT307: 1 | AU307: =1-SUM(AS307:AT307) -> 0 | AV307: 0 | AW307: 1 | AX307: =1-SUM(AV307:AW307) -> 0 | AY307: 0 | AZ307: 1 | BA307: =1-SUM(AY307:AZ307) -> 0 | BB307: 0 | BC307: 1 | BD307: =1-SUM(BB307:BC307) -> 0 | BE307: 0 | BF307: 1 | BG307: =1-SUM(BE307:BF307) -> 0 | BH307: 0 | BI307: 1 | BJ307: =1-SUM(BH307:BI307) -> 0 | BK307: 0 | BL307: 1 | BM307: =1-SUM(BK307:BL307) -> 0 | BN307: 0 | BO307: =1-BN307 -> 1
O308: 0 | P308: 1 | Q308: =1-SUM(O308:P308) -> 0 | R308: 0 | S308: 1 | T308: =1-SUM(R308:S308) -> 0 | U308: 0 | V308: 1 | W308: =1-SUM(U308:V308) -> 0 | X308: 0 | Y308: 1 | Z308: =1-SUM(X308:Y308) -> 0 | AA308: 0 | AB308: 1 | AC308: =1-SUM(AA308:AB308) -> 0 | AD308: 1 | AE308: 0 | AF308: =1-SUM(AD308:AE308) -> 0 | AG308: 0 | AH308: 1 | AI308: =1-SUM(AG308:AH308) -> 0 | AJ308: 0 | AK308: 1 | AL308: =1-SUM(AJ308:AK308) -> 0 | AM308: 0 | AN308: 1 | AO308: =1-SUM(AM308:AN308) -> 0 | AP308: 0 | AQ308: 1 | AR308: =1-SUM(AP308:AQ308) -> 0 | AS308: 0 | AT308: 1 | AU308: =1-SUM(AS308:AT308) -> 0 | AV308: 0 | AW308: 1 | AX308: =1-SUM(AV308:AW308) -> 0 | AY308: 0 | AZ308: 1 | BA308: =1-SUM(AY308:AZ308) -> 0 | BB308: 0 | BC308: 1 | BD308: =1-SUM(BB308:BC308) -> 0 | BE308: 0 | BF308: 1 | BG308: =1-SUM(BE308:BF308) -> 0 | BH308: 0 | BI308: 1 | BJ308: =1-SUM(BH308:BI308) -> 0 | BK308: 0 | BL308: 1 | BM308: =1-SUM(BK308:BL308) -> 0 | BN308: 1 | BO308: =1-BN308 -> 0
O309: 0 | P309: 0 | Q309: =1-SUM(O309:P309) -> 1 | R309: 0 | S309: 0 | T309: =1-SUM(R309:S309) -> 1 | U309: 0 | V309: 0 | W309: =1-SUM(U309:V309) -> 1 | X309: 0 | Y309: 0 | Z309: =1-SUM(X309:Y309) -> 1 | AA309: 0 | AB309: 0 | AC309: =1-SUM(AA309:AB309) -> 1 | AD309: 0 | AE309: 0 | AF309: =1-SUM(AD309:AE309) -> 1 | AG309: 0 | AH309: 0 | AI309: =1-SUM(AG309:AH309) -> 1 | AJ309: 0 | AK309: 0 | AL309: =1-SUM(AJ309:AK309) -> 1 | AM309: 0 | AN309: 0 | AO309: =1-SUM(AM309:AN309) -> 1 | AP309: 0 | AQ309: 0 | AR309: =1-SUM(AP309:AQ309) -> 1 | AS309: 0 | AT309: 0 | AU309: =1-SUM(AS309:AT309) -> 1 | AV309: 0 | AW309: 0 | AX309: =1-SUM(AV309:AW309) -> 1 | AY309: 0 | AZ309: 0 | BA309: =1-SUM(AY309:AZ309) -> 1 | BB309: 0 | BC309: 0 | BD309: =1-SUM(BB309:BC309) -> 1 | BE309: 0 | BF309: 0 | BG309: =1-SUM(BE309:BF309) -> 1 | BH309: 0 | BI309: 0 | BJ309: =1-SUM(BH309:BI309) -> 1 | BK309: 0 | BL309: 0 | BM309: =1-SUM(BK309:BL309) -> 1 | BN309: 0 | BO309: =1-BN309 -> 1
O310: 1 | P310: 0 | Q310: =1-SUM(O310:P310) -> 0 | R310: 1 | S310: 0 | T310: =1-SUM(R310:S310) -> 0 | U310: 1 | V310: 0 | W310: =1-SUM(U310:V310) -> 0 | X310: 0 | Y310: 1 | Z310: =1-SUM(X310:Y310) -> 0 | AA310: 0 | AB310: 1 | AC310: =1-SUM(AA310:AB310) -> 0 | AD310: 0 | AE310: 1 | AF310: =1-SUM(AD310:AE310) -> 0 | AG310: 0 | AH310: 1 | AI310: =1-SUM(AG310:AH310) -> 0 | AJ310: 1 | AK310: 0 | AL310: =1-SUM(AJ310:AK310) -> 0 | AM310: 1 | AN310: 0 | AO310: =1-SUM(AM310:AN310) -> 0 | AP310: 0 | AQ310: 1 | AR310: =1-SUM(AP310:AQ310) -> 0 | AS310: 0 | AT310: 1 | AU310: =1-SUM(AS310:AT310) -> 0 | AV310: 0 | AW310: 1 | AX310: =1-SUM(AV310:AW310) -> 0 | AY310: 0 | AZ310: 1 | BA310: =1-SUM(AY310:AZ310) -> 0 | BB310: 0 | BC310: 1 | BD310: =1-SUM(BB310:BC310) -> 0 | BE310: 0 | BF310: 1 | BG310: =1-SUM(BE310:BF310) -> 0 | BH310: 0 | BI310: 1 | BJ310: =1-SUM(BH310:BI310) -> 0 | BK310: 0 | BL310: 1 | BM310: =1-SUM(BK310:BL310) -> 0 | BN310: 0 | BO310: =1-BN310 -> 1
O311: 1 | P311: 0 | Q311: =1-SUM(O311:P311) -> 0 | R311: 1 | S311: 0 | T311: =1-SUM(R311:S311) -> 0 | U311: 1 | V311: 0 | W311: =1-SUM(U311:V311) -> 0 | X311: 0 | Y311: 1 | Z311: =1-SUM(X311:Y311) -> 0 | AA311: 0 | AB311: 1 | AC311: =1-SUM(AA311:AB311) -> 0 | AD311: 0 | AE311: 1 | AF311: =1-SUM(AD311:AE311) -> 0 | AG311: 0 | AH311: 1 | AI311: =1-SUM(AG311:AH311) -> 0 | AJ311: 0 | AK311: 1 | AL311: =1-SUM(AJ311:AK311) -> 0 | AM311: 0 | AN311: 1 | AO311: =1-SUM(AM311:AN311) -> 0 | AP311: 0 | AQ311: 1 | AR311: =1-SUM(AP311:AQ311) -> 0 | AS311: 0 | AT311: 1 | AU311: =1-SUM(AS311:AT311) -> 0 | AV311: 0 | AW311: 1 | AX311: =1-SUM(AV311:AW311) -> 0 | AY311: 0 | AZ311: 1 | BA311: =1-SUM(AY311:AZ311) -> 0 | BB311: 0 | BC311: 1 | BD311: =1-SUM(BB311:BC311) -> 0 | BE311: 0 | BF311: 1 | BG311: =1-SUM(BE311:BF311) -> 0 | BH311: 0 | BI311: 1 | BJ311: =1-SUM(BH311:BI311) -> 0 | BK311: 0 | BL311: 1 | BM311: =1-SUM(BK311:BL311) -> 0 | BN311: 1 | BO311: =1-BN311 -> 0
O312: 1 | P312: 0 | Q312: =1-SUM(O312:P312) -> 0 | R312: 1 | S312: 0 | T312: =1-SUM(R312:S312) -> 0 | U312: 1 | V312: 0 | W312: =1-SUM(U312:V312) -> 0 | X312: 1 | Y312: 0 | Z312: =1-SUM(X312:Y312) -> 0 | AA312: 1 | AB312: 0 | AC312: =1-SUM(AA312:AB312) -> 0 | AD312: 0 | AE312: 1 | AF312: =1-SUM(AD312:AE312) -> 0 | AG312: 0 | AH312: 1 | AI312: =1-SUM(AG312:AH312) -> 0 | AJ312: 1 | AK312: 0 | AL312: =1-SUM(AJ312:AK312) -> 0 | AM312: 1 | AN312: 0 | AO312: =1-SUM(AM312:AN312) -> 0 | AP312: 0 | AQ312: 1 | AR312: =1-SUM(AP312:AQ312) -> 0 | AS312: 0 | AT312: 1 | AU312: =1-SUM(AS312:AT312) -> 0 | AV312: 1 | AW312: 0 | AX312: =1-SUM(AV312:AW312) -> 0 | AY312: 0 | AZ312: 1 | BA312: =1-SUM(AY312:AZ312) -> 0 | BB312: 0 | BC312: 1 | BD312: =1-SUM(BB312:BC312) -> 0 | BE312: 0 | BF312: 1 | BG312: =1-SUM(BE312:BF312) -> 0 | BH312: 0 | BI312: 1 | BJ312: =1-SUM(BH312:BI312) -> 0 | BK312: 0 | BL312: 1 | BM312: =1-SUM(BK312:BL312) -> 0 | BN312: 1 | BO312: =1-BN312 -> 0
O313: 0 | P313: 1 | Q313: =1-SUM(O313:P313) -> 0 | R313: 0 | S313: 1 | T313: =1-SUM(R313:S313) -> 0 | U313: 0 | V313: 1 | W313: =1-SUM(U313:V313) -> 0 | X313: 0 | Y313: 1 | Z313: =1-SUM(X313:Y313) -> 0 | AA313: 1 | AB313: 0 | AC313: =1-SUM(AA313:AB313) -> 0 | AD313: 0 | AE313: 1 | AF313: =1-SUM(AD313:AE313) -> 0 | AG313: 0 | AH313: 1 | AI313: =1-SUM(AG313:AH313) -> 0 | AJ313: 0 | AK313: 1 | AL313: =1-SUM(AJ313:AK313) -> 0 | AM313: 0 | AN313: 1 | AO313: =1-SUM(AM313:AN313) -> 0 | AP313: 0 | AQ313: 1 | AR313: =1-SUM(AP313:AQ313) -> 0 | AS313: 1 | AT313: 0 | AU313: =1-SUM(AS313:AT313) -> 0 | AV313: 1 | AW313: 0 | AX313: =1-SUM(AV313:AW313) -> 0 | AY313: 1 | AZ313: 0 | BA313: =1-SUM(AY313:AZ313) -> 0 | BB313: 1 | BC313: 0 | BD313: =1-SUM(BB313:BC313) -> 0 | BE313: 1 | BF313: 0 | BG313: =1-SUM(BE313:BF313) -> 0 | BH313: 0 | BI313: 0 | BJ313: =1-SUM(BH313:BI313) -> 1 | BK313: 0 | BL313: 1 | BM313: =1-SUM(BK313:BL313) -> 0 | BN313: 0 | BO313: =1-BN313 -> 1
O314: 1 | P314: 0 | Q314: =1-SUM(O314:P314) -> 0 | R314: 1 | S314: 0 | T314: =1-SUM(R314:S314) -> 0 | U314: 1 | V314: 0 | W314: =1-SUM(U314:V314) -> 0 | X314: 1 | Y314: 0 | Z314: =1-SUM(X314:Y314) -> 0 | AA314: 1 | AB314: 0 | AC314: =1-SUM(AA314:AB314) -> 0 | AD314: 0 | AE314: 1 | AF314: =1-SUM(AD314:AE314) -> 0 | AG314: 0 | AH314: 1 | AI314: =1-SUM(AG314:AH314) -> 0 | AJ314: 1 | AK314: 0 | AL314: =1-SUM(AJ314:AK314) -> 0 | AM314: 1 | AN314: 0 | AO314: =1-SUM(AM314:AN314) -> 0 | AP314: 0 | AQ314: 1 | AR314: =1-SUM(AP314:AQ314) -> 0 | AS314: 0 | AT314: 1 | AU314: =1-SUM(AS314:AT314) -> 0 | AV314: 1 | AW314: 0 | AX314: =1-SUM(AV314:AW314) -> 0 | AY314: 0 | AZ314: 1 | BA314: =1-SUM(AY314:AZ314) -> 0 | BB314: 0 | BC314: 1 | BD314: =1-SUM(BB314:BC314) -> 0 | BE314: 0 | BF314: 1 | BG314: =1-SUM(BE314:BF314) -> 0 | BH314: 0 | BI314: 1 | BJ314: =1-SUM(BH314:BI314) -> 0 | BK314: 0 | BL314: 1 | BM314: =1-SUM(BK314:BL314) -> 0 | BN314: 1 | BO314: =1-BN314 -> 0
O315: 1 | P315: 0 | Q315: =1-SUM(O315:P315) -> 0 | R315: 0 | S315: 1 | T315: =1-SUM(R315:S315) -> 0 | U315: 0 | V315: 1 | W315: =1-SUM(U315:V315) -> 0 | X315: 0 | Y315: 1 | Z315: =1-SUM(X315:Y315) -> 0 | AA315: 0 | AB315: 1 | AC315: =1-SUM(AA315:AB315) -> 0 | AD315: 0 | AE315: 1 | AF315: =1-SUM(AD315:AE315) -> 0 | AG315: 0 | AH315: 1 | AI315: =1-SUM(AG315:AH315) -> 0 | AJ315: 0 | AK315: 1 | AL315: =1-SUM(AJ315:AK315) -> 0 | AM315: 1 | AN315: 0 | AO315: =1-SUM(AM315:AN315) -> 0 | AP315: 0 | AQ315: 1 | AR315: =1-SUM(AP315:AQ315) -> 0 | AS315: 0 | AT315: 1 | AU315: =1-SUM(AS315:AT315) -> 0 | AV315: 1 | AW315: 0 | AX315: =1-SUM(AV315:AW315) -> 0 | AY315: 1 | AZ315: 0 | BA315: =1-SUM(AY315:AZ315) -> 0 | BB315: 0 | BC315: 1 | BD315: =1-SUM(BB315:BC315) -> 0 | BE315: 1 | BF315: 0 | BG315: =1-SUM(BE315:BF315) -> 0 | BH315: 0 | BI315: 1 | BJ315: =1-SUM(BH315:BI315) -> 0 | BK315: 0 | BL315: 1 | BM315: =1-SUM(BK315:BL315) -> 0 | BN315: 1 | BO315: =1-BN315 -> 0
O316: 1 | P316: 0 | Q316: =1-SUM(O316:P316) -> 0 | R316: 0 | S316: 1 | T316: =1-SUM(R316:S316) -> 0 | U316: 0 | V316: 1 | W316: =1-SUM(U316:V316) -> 0 | X316: 0 | Y316: 1 | Z316: =1-SUM(X316:Y316) -> 0 | AA316: 1 | AB316: 0 | AC316: =1-SUM(AA316:AB316) -> 0 | AD316: 0 | AE316: 1 | AF316: =1-SUM(AD316:AE316) -> 0 | AG316: 0 | AH316: 1 | AI316: =1-SUM(AG316:AH316) -> 0 | AJ316: 0 | AK316: 1 | AL316: =1-SUM(AJ316:AK316) -> 0 | AM316: 1 | AN316: 0 | AO316: =1-SUM(AM316:AN316) -> 0 | AP316: 0 | AQ316: 1 | AR316: =1-SUM(AP316:AQ316) -> 0 | AS316: 0 | AT316: 1 | AU316: =1-SUM(AS316:AT316) -> 0 | AV316: 1 | AW316: 0 | AX316: =1-SUM(AV316:AW316) -> 0 | AY316: 1 | AZ316: 0 | BA316: =1-SUM(AY316:AZ316) -> 0 | BB316: 1 | BC316: 0 | BD316: =1-SUM(BB316:BC316) -> 0 | BE316: 1 | BF316: 0 | BG316: =1-SUM(BE316:BF316) -> 0 | BH316: 0 | BI316: 1 | BJ316: =1-SUM(BH316:BI316) -> 0 | BK316: 0 | BL316: 1 | BM316: =1-SUM(BK316:BL316) -> 0 | BN316: 1 | BO316: =1-BN316 -> 0
O317: 1 | P317: 0 | Q317: =1-SUM(O317:P317) -> 0 | R317: 1 | S317: 0 | T317: =1-SUM(R317:S317) -> 0 | U317: 1 | V317: 0 | W317: =1-SUM(U317:V317) -> 0 | X317: 1 | Y317: 0 | Z317: =1-SUM(X317:Y317) -> 0 | AA317: 1 | AB317: 0 | AC317: =1-SUM(AA317:AB317) -> 0 | AD317: 1 | AE317: 0 | AF317: =1-SUM(AD317:AE317) -> 0 | AG317: 1 | AH317: 0 | AI317: =1-SUM(AG317:AH317) -> 0 | AJ317: 1 | AK317: 0 | AL317: =1-SUM(AJ317:AK317) -> 0 | AM317: 0 | AN317: 1 | AO317: =1-SUM(AM317:AN317) -> 0 | AP317: 0 | AQ317: 1 | AR317: =1-SUM(AP317:AQ317) -> 0 | AS317: 0 | AT317: 1 | AU317: =1-SUM(AS317:AT317) -> 0 | AV317: 1 | AW317: 0 | AX317: =1-SUM(AV317:AW317) -> 0 | AY317: 0 | AZ317: 1 | BA317: =1-SUM(AY317:AZ317) -> 0 | BB317: 0 | BC317: 1 | BD317: =1-SUM(BB317:BC317) -> 0 | BE317: 0 | BF317: 1 | BG317: =1-SUM(BE317:BF317) -> 0 | BH317: 0 | BI317: 1 | BJ317: =1-SUM(BH317:BI317) -> 0 | BK317: 0 | BL317: 1 | BM317: =1-SUM(BK317:BL317) -> 0 | BN317: 1 | BO317: =1-BN317 -> 0
O318: 0 | P318: 1 | Q318: =1-SUM(O318:P318) -> 0 | R318: 0 | S318: 1 | T318: =1-SUM(R318:S318) -> 0 | U318: 0 | V318: 1 | W318: =1-SUM(U318:V318) -> 0 | X318: 0 | Y318: 1 | Z318: =1-SUM(X318:Y318) -> 0 | AA318: 1 | AB318: 0 | AC318: =1-SUM(AA318:AB318) -> 0 | AD318: 0 | AE318: 1 | AF318: =1-SUM(AD318:AE318) -> 0 | AG318: 0 | AH318: 1 | AI318: =1-SUM(AG318:AH318) -> 0 | AJ318: 1 | AK318: 0 | AL318: =1-SUM(AJ318:AK318) -> 0 | AM318: 1 | AN318: 0 | AO318: =1-SUM(AM318:AN318) -> 0 | AP318: 0 | AQ318: 1 | AR318: =1-SUM(AP318:AQ318) -> 0 | AS318: 0 | AT318: 1 | AU318: =1-SUM(AS318:AT318) -> 0 | AV318: 1 | AW318: 0 | AX318: =1-SUM(AV318:AW318) -> 0 | AY318: 1 | AZ318: 0 | BA318: =1-SUM(AY318:AZ318) -> 0 | BB318: 0 | BC318: 1 | BD318: =1-SUM(BB318:BC318) -> 0 | BE318: 1 | BF318: 0 | BG318: =1-SUM(BE318:BF318) -> 0 | BH318: 0 | BI318: 1 | BJ318: =1-SUM(BH318:BI318) -> 0 | BK318: 0 | BL318: 1 | BM318: =1-SUM(BK318:BL318) -> 0 | BN318: 1 | BO318: =1-BN318 -> 0
O319: 1 | P319: 0 | Q319: =1-SUM(O319:P319) -> 0 | R319: 1 | S319: 0 | T319: =1-SUM(R319:S319) -> 0 | U319: 1 | V319: 0 | W319: =1-SUM(U319:V319) -> 0 | X319: 1 | Y319: 0 | Z319: =1-SUM(X319:Y319) -> 0 | AA319: 0 | AB319: 1 | AC319: =1-SUM(AA319:AB319) -> 0 | AD319: 0 | AE319: 1 | AF319: =1-SUM(AD319:AE319) -> 0 | AG319: 0 | AH319: 1 | AI319: =1-SUM(AG319:AH319) -> 0 | AJ319: 0 | AK319: 1 | AL319: =1-SUM(AJ319:AK319) -> 0 | AM319: 0 | AN319: 1 | AO319: =1-SUM(AM319:AN319) -> 0 | AP319: 0 | AQ319: 1 | AR319: =1-SUM(AP319:AQ319) -> 0 | AS319: 0 | AT319: 0 | AU319: =1-SUM(AS319:AT319) -> 1 | AV319: 0 | AW319: 1 | AX319: =1-SUM(AV319:AW319) -> 0 | AY319: 0 | AZ319: 1 | BA319: =1-SUM(AY319:AZ319) -> 0 | BB319: 0 | BC319: 1 | BD319: =1-SUM(BB319:BC319) -> 0 | BE319: 0 | BF319: 1 | BG319: =1-SUM(BE319:BF319) -> 0 | BH319: 0 | BI319: 1 | BJ319: =1-SUM(BH319:BI319) -> 0 | BK319: 0 | BL319: 1 | BM319: =1-SUM(BK319:BL319) -> 0 | BN319: 1 | BO319: =1-BN319 -> 0
O320: 0 | P320: 1 | Q320: =1-SUM(O320:P320) -> 0 | R320: 0 | S320: 1 | T320: =1-SUM(R320:S320) -> 0 | U320: 0 | V320: 1 | W320: =1-SUM(U320:V320) -> 0 | X320: 0 | Y320: 1 | Z320: =1-SUM(X320:Y320) -> 0 | AA320: 1 | AB320: 0 | AC320: =1-SUM(AA320:AB320) -> 0 | AD320: 0 | AE320: 1 | AF320: =1-SUM(AD320:AE320) -> 0 | AG320: 0 | AH320: 1 | AI320: =1-SUM(AG320:AH320) -> 0 | AJ320: 1 | AK320: 0 | AL320: =1-SUM(AJ320:AK320) -> 0 | AM320: 1 | AN320: 0 | AO320: =1-SUM(AM320:AN320) -> 0 | AP320: 0 | AQ320: 1 | AR320: =1-SUM(AP320:AQ320) -> 0 | AS320: 0 | AT320: 1 | AU320: =1-SUM(AS320:AT320) -> 0 | AV320: 1 | AW320: 0 | AX320: =1-SUM(AV320:AW320) -> 0 | AY320: 1 | AZ320: 0 | BA320: =1-SUM(AY320:AZ320) -> 0 | BB320: 0 | BC320: 1 | BD320: =1-SUM(BB320:BC320) -> 0 | BE320: 1 | BF320: 0 | BG320: =1-SUM(BE320:BF320) -> 0 | BH320: 0 | BI320: 1 | BJ320: =1-SUM(BH320:BI320) -> 0 | BK320: 0 | BL320: 1 | BM320: =1-SUM(BK320:BL320) -> 0 | BN320: 1 | BO320: =1-BN320 -> 0
O321: 1 | P321: 0 | Q321: =1-SUM(O321:P321) -> 0 | R321: 1 | S321: 0 | T321: =1-SUM(R321:S321) -> 0 | U321: 0 | V321: 1 | W321: =1-SUM(U321:V321) -> 0 | X321: 0 | Y321: 1 | Z321: =1-SUM(X321:Y321) -> 0 | AA321: 1 | AB321: 0 | AC321: =1-SUM(AA321:AB321) -> 0 | AD321: 0 | AE321: 1 | AF321: =1-SUM(AD321:AE321) -> 0 | AG321: 0 | AH321: 1 | AI321: =1-SUM(AG321:AH321) -> 0 | AJ321: 1 | AK321: 0 | AL321: =1-SUM(AJ321:AK321) -> 0 | AM321: 0 | AN321: 1 | AO321: =1-SUM(AM321:AN321) -> 0 | AP321: 0 | AQ321: 1 | AR321: =1-SUM(AP321:AQ321) -> 0 | AS321: 0 | AT321: 0 | AU321: =1-SUM(AS321:AT321) -> 1 | AV321: 1 | AW321: 0 | AX321: =1-SUM(AV321:AW321) -> 0 | AY321: 1 | AZ321: 0 | BA321: =1-SUM(AY321:AZ321) -> 0 | BB321: 0 | BC321: 1 | BD321: =1-SUM(BB321:BC321) -> 0 | BE321: 1 | BF321: 0 | BG321: =1-SUM(BE321:BF321) -> 0 | BH321: 0 | BI321: 1 | BJ321: =1-SUM(BH321:BI321) -> 0 | BK321: 0 | BL321: 1 | BM321: =1-SUM(BK321:BL321) -> 0 | BN321: 1 | BO321: =1-BN321 -> 0
O322: 1 | P322: 0 | Q322: =1-SUM(O322:P322) -> 0 | R322: 0 | S322: 1 | T322: =1-SUM(R322:S322) -> 0 | U322: 0 | V322: 1 | W322: =1-SUM(U322:V322) -> 0 | X322: 0 | Y322: 1 | Z322: =1-SUM(X322:Y322) -> 0 | AA322: 1 | AB322: 0 | AC322: =1-SUM(AA322:AB322) -> 0 | AD322: 0 | AE322: 1 | AF322: =1-SUM(AD322:AE322) -> 0 | AG322: 0 | AH322: 1 | AI322: =1-SUM(AG322:AH322) -> 0 | AJ322: 0 | AK322: 1 | AL322: =1-SUM(AJ322:AK322) -> 0 | AM322: 1 | AN322: 0 | AO322: =1-SUM(AM322:AN322) -> 0 | AP322: 0 | AQ322: 1 | AR322: =1-SUM(AP322:AQ322) -> 0 | AS322: 0 | AT322: 1 | AU322: =1-SUM(AS322:AT322) -> 0 | AV322: 0 | AW322: 1 | AX322: =1-SUM(AV322:AW322) -> 0 | AY322: 1 | AZ322: 0 | BA322: =1-SUM(AY322:AZ322) -> 0 | BB322: 0 | BC322: 1 | BD322: =1-SUM(BB322:BC322) -> 0 | BE322: 1 | BF322: 0 | BG322: =1-SUM(BE322:BF322) -> 0 | BH322: 0 | BI322: 1 | BJ322: =1-SUM(BH322:BI322) -> 0 | BK322: 0 | BL322: 1 | BM322: =1-SUM(BK322:BL322) -> 0 | BN322: 1 | BO322: =1-BN322 -> 0
O323: 0 | P323: 0 | Q323: =1-SUM(O323:P323) -> 1 | R323: 0 | S323: 0 | T323: =1-SUM(R323:S323) -> 1 | U323: 0 | V323: 0 | W323: =1-SUM(U323:V323) -> 1 | X323: 0 | Y323: 0 | Z323: =1-SUM(X323:Y323) -> 1 | AA323: 0 | AB323: 0 | AC323: =1-SUM(AA323:AB323) -> 1 | AD323: 0 | AE323: 0 | AF323: =1-SUM(AD323:AE323) -> 1 | AG323: 0 | AH323: 0 | AI323: =1-SUM(AG323:AH323) -> 1 | AJ323: 0 | AK323: 0 | AL323: =1-SUM(AJ323:AK323) -> 1 | AM323: 0 | AN323: 0 | AO323: =1-SUM(AM323:AN323) -> 1 | AP323: 0 | AQ323: 0 | AR323: =1-SUM(AP323:AQ323) -> 1 | AS323: 0 | AT323: 0 | AU323: =1-SUM(AS323:AT323) -> 1 | AV323: 0 | AW323: 0 | AX323: =1-SUM(AV323:AW323) -> 1 | AY323: 0 | AZ323: 0 | BA323: =1-SUM(AY323:AZ323) -> 1 | BB323: 0 | BC323: 0 | BD323: =1-SUM(BB323:BC323) -> 1 | BE323: 0 | BF323: 0 | BG323: =1-SUM(BE323:BF323) -> 1 | BH323: 0 | BI323: 0 | BJ323: =1-SUM(BH323:BI323) -> 1 | BK323: 0 | BL323: 0 | BM323: =1-SUM(BK323:BL323) -> 1 | BN323: 1 | BO323: =1-BN323 -> 0
O324: 0 | P324: 0 | Q324: =1-SUM(O324:P324) -> 1 | R324: 0 | S324: 0 | T324: =1-SUM(R324:S324) -> 1 | U324: 0 | V324: 0 | W324: =1-SUM(U324:V324) -> 1 | X324: 0 | Y324: 0 | Z324: =1-SUM(X324:Y324) -> 1 | AA324: 0 | AB324: 0 | AC324: =1-SUM(AA324:AB324) -> 1 | AD324: 0 | AE324: 0 | AF324: =1-SUM(AD324:AE324) -> 1 | AG324: 0 | AH324: 0 | AI324: =1-SUM(AG324:AH324) -> 1 | AJ324: 0 | AK324: 0 | AL324: =1-SUM(AJ324:AK324) -> 1 | AM324: 0 | AN324: 0 | AO324: =1-SUM(AM324:AN324) -> 1 | AP324: 0 | AQ324: 0 | AR324: =1-SUM(AP324:AQ324) -> 1 | AS324: 0 | AT324: 0 | AU324: =1-SUM(AS324:AT324) -> 1 | AV324: 0 | AW324: 0 | AX324: =1-SUM(AV324:AW324) -> 1 | AY324: 0 | AZ324: 0 | BA324: =1-SUM(AY324:AZ324) -> 1 | BB324: 0 | BC324: 0 | BD324: =1-SUM(BB324:BC324) -> 1 | BE324: 0 | BF324: 0 | BG324: =1-SUM(BE324:BF324) -> 1 | BH324: 0 | BI324: 0 | BJ324: =1-SUM(BH324:BI324) -> 1 | BK324: 0 | BL324: 0 | BM324: =1-SUM(BK324:BL324) -> 1 | BN324: 1 | BO324: =1-BN324 -> 0
O325: 0 | P325: 0 | Q325: =1-SUM(O325:P325) -> 1 | R325: 0 | S325: 0 | T325: =1-SUM(R325:S325) -> 1 | U325: 0 | V325: 0 | W325: =1-SUM(U325:V325) -> 1 | X325: 0 | Y325: 0 | Z325: =1-SUM(X325:Y325) -> 1 | AA325: 0 | AB325: 0 | AC325: =1-SUM(AA325:AB325) -> 1 | AD325: 0 | AE325: 0 | AF325: =1-SUM(AD325:AE325) -> 1 | AG325: 0 | AH325: 0 | AI325: =1-SUM(AG325:AH325) -> 1 | AJ325: 0 | AK325: 0 | AL325: =1-SUM(AJ325:AK325) -> 1 | AM325: 0 | AN325: 0 | AO325: =1-SUM(AM325:AN325) -> 1 | AP325: 0 | AQ325: 0 | AR325: =1-SUM(AP325:AQ325) -> 1 | AS325: 0 | AT325: 0 | AU325: =1-SUM(AS325:AT325) -> 1 | AV325: 0 | AW325: 0 | AX325: =1-SUM(AV325:AW325) -> 1 | AY325: 0 | AZ325: 0 | BA325: =1-SUM(AY325:AZ325) -> 1 | BB325: 0 | BC325: 0 | BD325: =1-SUM(BB325:BC325) -> 1 | BE325: 0 | BF325: 0 | BG325: =1-SUM(BE325:BF325) -> 1 | BH325: 0 | BI325: 0 | BJ325: =1-SUM(BH325:BI325) -> 1 | BK325: 0 | BL325: 0 | BM325: =1-SUM(BK325:BL325) -> 1 | BN325: 1 | BO325: =1-BN325 -> 0
O326: 0 | P326: 0 | Q326: =1-SUM(O326:P326) -> 1 | R326: 0 | S326: 0 | T326: =1-SUM(R326:S326) -> 1 | U326: 0 | V326: 0 | W326: =1-SUM(U326:V326) -> 1 | X326: 0 | Y326: 0 | Z326: =1-SUM(X326:Y326) -> 1 | AA326: 0 | AB326: 0 | AC326: =1-SUM(AA326:AB326) -> 1 | AD326: 0 | AE326: 0 | AF326: =1-SUM(AD326:AE326) -> 1 | AG326: 0 | AH326: 0 | AI326: =1-SUM(AG326:AH326) -> 1 | AJ326: 0 | AK326: 0 | AL326: =1-SUM(AJ326:AK326) -> 1 | AM326: 0 | AN326: 0 | AO326: =1-SUM(AM326:AN326) -> 1 | AP326: 0 | AQ326: 0 | AR326: =1-SUM(AP326:AQ326) -> 1 | AS326: 0 | AT326: 0 | AU326: =1-SUM(AS326:AT326) -> 1 | AV326: 0 | AW326: 0 | AX326: =1-SUM(AV326:AW326) -> 1 | AY326: 0 | AZ326: 0 | BA326: =1-SUM(AY326:AZ326) -> 1 | BB326: 0 | BC326: 0 | BD326: =1-SUM(BB326:BC326) -> 1 | BE326: 0 | BF326: 0 | BG326: =1-SUM(BE326:BF326) -> 1 | BH326: 0 | BI326: 0 | BJ326: =1-SUM(BH326:BI326) -> 1 | BK326: 0 | BL326: 0 | BM326: =1-SUM(BK326:BL326) -> 1 | BN326: 1 | BO326: =1-BN326 -> 0
O327: 0 | P327: 0 | Q327: =1-SUM(O327:P327) -> 1 | R327: 0 | S327: 0 | T327: =1-SUM(R327:S327) -> 1 | U327: 0 | V327: 0 | W327: =1-SUM(U327:V327) -> 1 | X327: 0 | Y327: 0 | Z327: =1-SUM(X327:Y327) -> 1 | AA327: 0 | AB327: 0 | AC327: =1-SUM(AA327:AB327) -> 1 | AD327: 0 | AE327: 0 | AF327: =1-SUM(AD327:AE327) -> 1 | AG327: 0 | AH327: 0 | AI327: =1-SUM(AG327:AH327) -> 1 | AJ327: 0 | AK327: 0 | AL327: =1-SUM(AJ327:AK327) -> 1 | AM327: 0 | AN327: 0 | AO327: =1-SUM(AM327:AN327) -> 1 | AP327: 0 | AQ327: 0 | AR327: =1-SUM(AP327:AQ327) -> 1 | AS327: 0 | AT327: 0 | AU327: =1-SUM(AS327:AT327) -> 1 | AV327: 0 | AW327: 0 | AX327: =1-SUM(AV327:AW327) -> 1 | AY327: 0 | AZ327: 0 | BA327: =1-SUM(AY327:AZ327) -> 1 | BB327: 0 | BC327: 0 | BD327: =1-SUM(BB327:BC327) -> 1 | BE327: 0 | BF327: 0 | BG327: =1-SUM(BE327:BF327) -> 1 | BH327: 0 | BI327: 0 | BJ327: =1-SUM(BH327:BI327) -> 1 | BK327: 0 | BL327: 0 | BM327: =1-SUM(BK327:BL327) -> 1 | BN327: 1 | BO327: =1-BN327 -> 0
O328: 0 | P328: 0 | Q328: =1-SUM(O328:P328) -> 1 | R328: 0 | S328: 0 | T328: =1-SUM(R328:S328) -> 1 | U328: 0 | V328: 0 | W328: =1-SUM(U328:V328) -> 1 | X328: 0 | Y328: 0 | Z328: =1-SUM(X328:Y328) -> 1 | AA328: 0 | AB328: 0 | AC328: =1-SUM(AA328:AB328) -> 1 | AD328: 0 | AE328: 0 | AF328: =1-SUM(AD328:AE328) -> 1 | AG328: 0 | AH328: 0 | AI328: =1-SUM(AG328:AH328) -> 1 | AJ328: 0 | AK328: 0 | AL328: =1-SUM(AJ328:AK328) -> 1 | AM328: 0 | AN328: 0 | AO328: =1-SUM(AM328:AN328) -> 1 | AP328: 0 | AQ328: 0 | AR328: =1-SUM(AP328:AQ328) -> 1 | AS328: 0 | AT328: 0 | AU328: =1-SUM(AS328:AT328) -> 1 | AV328: 0 | AW328: 0 | AX328: =1-SUM(AV328:AW328) -> 1 | AY328: 0 | AZ328: 0 | BA328: =1-SUM(AY328:AZ328) -> 1 | BB328: 0 | BC328: 0 | BD328: =1-SUM(BB328:BC328) -> 1 | BE328: 0 | BF328: 0 | BG328: =1-SUM(BE328:BF328) -> 1 | BH328: 0 | BI328: 0 | BJ328: =1-SUM(BH328:BI328) -> 1 | BK328: 0 | BL328: 0 | BM328: =1-SUM(BK328:BL328) -> 1 | BN328: 1 | BO328: =1-BN328 -> 0
O329: 0 | P329: 0 | Q329: =1-SUM(O329:P329) -> 1 | R329: 0 | S329: 0 | T329: =1-SUM(R329:S329) -> 1 | U329: 0 | V329: 0 | W329: =1-SUM(U329:V329) -> 1 | X329: 0 | Y329: 0 | Z329: =1-SUM(X329:Y329) -> 1 | AA329: 0 | AB329: 0 | AC329: =1-SUM(AA329:AB329) -> 1 | AD329: 0 | AE329: 0 | AF329: =1-SUM(AD329:AE329) -> 1 | AG329: 0 | AH329: 0 | AI329: =1-SUM(AG329:AH329) -> 1 | AJ329: 0 | AK329: 0 | AL329: =1-SUM(AJ329:AK329) -> 1 | AM329: 0 | AN329: 0 | AO329: =1-SUM(AM329:AN329) -> 1 | AP329: 0 | AQ329: 0 | AR329: =1-SUM(AP329:AQ329) -> 1 | AS329: 0 | AT329: 0 | AU329: =1-SUM(AS329:AT329) -> 1 | AV329: 0 | AW329: 0 | AX329: =1-SUM(AV329:AW329) -> 1 | AY329: 0 | AZ329: 0 | BA329: =1-SUM(AY329:AZ329) -> 1 | BB329: 0 | BC329: 0 | BD329: =1-SUM(BB329:BC329) -> 1 | BE329: 0 | BF329: 0 | BG329: =1-SUM(BE329:BF329) -> 1 | BH329: 0 | BI329: 0 | BJ329: =1-SUM(BH329:BI329) -> 1 | BK329: 0 | BL329: 0 | BM329: =1-SUM(BK329:BL329) -> 1 | BN329: 1 | BO329: =1-BN329 -> 0
O330: 0 | P330: 0 | Q330: =1-SUM(O330:P330) -> 1 | R330: 0 | S330: 0 | T330: =1-SUM(R330:S330) -> 1 | U330: 0 | V330: 0 | W330: =1-SUM(U330:V330) -> 1 | X330: 0 | Y330: 0 | Z330: =1-SUM(X330:Y330) -> 1 | AA330: 0 | AB330: 0 | AC330: =1-SUM(AA330:AB330) -> 1 | AD330: 0 | AE330: 0 | AF330: =1-SUM(AD330:AE330) -> 1 | AG330: 0 | AH330: 0 | AI330: =1-SUM(AG330:AH330) -> 1 | AJ330: 0 | AK330: 0 | AL330: =1-SUM(AJ330:AK330) -> 1 | AM330: 0 | AN330: 0 | AO330: =1-SUM(AM330:AN330) -> 1 | AP330: 0 | AQ330: 0 | AR330: =1-SUM(AP330:AQ330) -> 1 | AS330: 0 | AT330: 0 | AU330: =1-SUM(AS330:AT330) -> 1 | AV330: 0 | AW330: 0 | AX330: =1-SUM(AV330:AW330) -> 1 | AY330: 0 | AZ330: 0 | BA330: =1-SUM(AY330:AZ330) -> 1 | BB330: 0 | BC330: 0 | BD330: =1-SUM(BB330:BC330) -> 1 | BE330: 0 | BF330: 0 | BG330: =1-SUM(BE330:BF330) -> 1 | BH330: 0 | BI330: 0 | BJ330: =1-SUM(BH330:BI330) -> 1 | BK330: 0 | BL330: 0 | BM330: =1-SUM(BK330:BL330) -> 1 | BN330: 0 | BO330: =1-BN330 -> 1
O331: 0 | P331: 1 | Q331: =1-SUM(O331:P331) -> 0 | R331: 0 | S331: 1 | T331: =1-SUM(R331:S331) -> 0 | U331: 0 | V331: 1 | W331: =1-SUM(U331:V331) -> 0 | X331: 0 | Y331: 1 | Z331: =1-SUM(X331:Y331) -> 0 | AA331: 0 | AB331: 1 | AC331: =1-SUM(AA331:AB331) -> 0 | AD331: 0 | AE331: 1 | AF331: =1-SUM(AD331:AE331) -> 0 | AG331: 0 | AH331: 1 | AI331: =1-SUM(AG331:AH331) -> 0 | AJ331: 0 | AK331: 1 | AL331: =1-SUM(AJ331:AK331) -> 0 | AM331: 0 | AN331: 1 | AO331: =1-SUM(AM331:AN331) -> 0 | AP331: 1 | AQ331: 0 | AR331: =1-SUM(AP331:AQ331) -> 0 | AS331: 0 | AT331: 1 | AU331: =1-SUM(AS331:AT331) -> 0 | AV331: 0 | AW331: 1 | AX331: =1-SUM(AV331:AW331) -> 0 | AY331: 0 | AZ331: 1 | BA331: =1-SUM(AY331:AZ331) -> 0 | BB331: 0 | BC331: 1 | BD331: =1-SUM(BB331:BC331) -> 0 | BE331: 0 | BF331: 1 | BG331: =1-SUM(BE331:BF331) -> 0 | BH331: 0 | BI331: 1 | BJ331: =1-SUM(BH331:BI331) -> 0 | BK331: 0 | BL331: 1 | BM331: =1-SUM(BK331:BL331) -> 0 | BN331: 0 | BO331: =1-BN331 -> 1
O332: 1 | P332: 0 | Q332: =1-SUM(O332:P332) -> 0 | R332: 1 | S332: 0 | T332: =1-SUM(R332:S332) -> 0 | U332: 0 | V332: 1 | W332: =1-SUM(U332:V332) -> 0 | X332: 0 | Y332: 1 | Z332: =1-SUM(X332:Y332) -> 0 | AA332: 1 | AB332: 0 | AC332: =1-SUM(AA332:AB332) -> 0 | AD332: 0 | AE332: 1 | AF332: =1-SUM(AD332:AE332) -> 0 | AG332: 0 | AH332: 1 | AI332: =1-SUM(AG332:AH332) -> 0 | AJ332: 0 | AK332: 1 | AL332: =1-SUM(AJ332:AK332) -> 0 | AM332: 0 | AN332: 1 | AO332: =1-SUM(AM332:AN332) -> 0 | AP332: 0 | AQ332: 1 | AR332: =1-SUM(AP332:AQ332) -> 0 | AS332: 0 | AT332: 1 | AU332: =1-SUM(AS332:AT332) -> 0 | AV332: 0 | AW332: 1 | AX332: =1-SUM(AV332:AW332) -> 0 | AY332: 0 | AZ332: 1 | BA332: =1-SUM(AY332:AZ332) -> 0 | BB332: 0 | BC332: 1 | BD332: =1-SUM(BB332:BC332) -> 0 | BE332: 0 | BF332: 1 | BG332: =1-SUM(BE332:BF332) -> 0 | BH332: 0 | BI332: 1 | BJ332: =1-SUM(BH332:BI332) -> 0 | BK332: 0 | BL332: 1 | BM332: =1-SUM(BK332:BL332) -> 0 | BN332: 0 | BO332: =1-BN332 -> 1
O333: 0 | P333: 1 | Q333: =1-SUM(O333:P333) -> 0 | R333: 1 | S333: 0 | T333: =1-SUM(R333:S333) -> 0 | U333: 1 | V333: 0 | W333: =1-SUM(U333:V333) -> 0 | X333: 1 | Y333: 0 | Z333: =1-SUM(X333:Y333) -> 0 | AA333: 1 | AB333: 0 | AC333: =1-SUM(AA333:AB333) -> 0 | AD333: 0 | AE333: 1 | AF333: =1-SUM(AD333:AE333) -> 0 | AG333: 0 | AH333: 1 | AI333: =1-SUM(AG333:AH333) -> 0 | AJ333: 0 | AK333: 1 | AL333: =1-SUM(AJ333:AK333) -> 0 | AM333: 0 | AN333: 1 | AO333: =1-SUM(AM333:AN333) -> 0 | AP333: 0 | AQ333: 1 | AR333: =1-SUM(AP333:AQ333) -> 0 | AS333: 0 | AT333: 1 | AU333: =1-SUM(AS333:AT333) -> 0 | AV333: 0 | AW333: 1 | AX333: =1-SUM(AV333:AW333) -> 0 | AY333: 1 | AZ333: 0 | BA333: =1-SUM(AY333:AZ333) -> 0 | BB333: 0 | BC333: 1 | BD333: =1-SUM(BB333:BC333) -> 0 | BE333: 0 | BF333: 1 | BG333: =1-SUM(BE333:BF333) -> 0 | BH333: 0 | BI333: 1 | BJ333: =1-SUM(BH333:BI333) -> 0 | BK333: 0 | BL333: 1 | BM333: =1-SUM(BK333:BL333) -> 0 | BN333: 0 | BO333: =1-BN333 -> 1
O334: 0 | P334: 1 | Q334: =1-SUM(O334:P334) -> 0 | R334: 0 | S334: 1 | T334: =1-SUM(R334:S334) -> 0 | U334: 0 | V334: 1 | W334: =1-SUM(U334:V334) -> 0 | X334: 0 | Y334: 1 | Z334: =1-SUM(X334:Y334) -> 0 | AA334: 0 | AB334: 1 | AC334: =1-SUM(AA334:AB334) -> 0 | AD334: 0 | AE334: 1 | AF334: =1-SUM(AD334:AE334) -> 0 | AG334: 0 | AH334: 1 | AI334: =1-SUM(AG334:AH334) -> 0 | AJ334: 0 | AK334: 1 | AL334: =1-SUM(AJ334:AK334) -> 0 | AM334: 0 | AN334: 1 | AO334: =1-SUM(AM334:AN334) -> 0 | AP334: 0 | AQ334: 1 | AR334: =1-SUM(AP334:AQ334) -> 0 | AS334: 0 | AT334: 1 | AU334: =1-SUM(AS334:AT334) -> 0 | AV334: 0 | AW334: 1 | AX334: =1-SUM(AV334:AW334) -> 0 | AY334: 0 | AZ334: 1 | BA334: =1-SUM(AY334:AZ334) -> 0 | BB334: 1 | BC334: 0 | BD334: =1-SUM(BB334:BC334) -> 0 | BE334: 0 | BF334: 1 | BG334: =1-SUM(BE334:BF334) -> 0 | BH334: 1 | BI334: 0 | BJ334: =1-SUM(BH334:BI334) -> 0 | BK334: 0 | BL334: 1 | BM334: =1-SUM(BK334:BL334) -> 0 | BN334: 0 | BO334: =1-BN334 -> 1
O335: 1 | P335: 0 | Q335: =1-SUM(O335:P335) -> 0 | R335: 0 | S335: 1 | T335: =1-SUM(R335:S335) -> 0 | U335: 0 | V335: 1 | W335: =1-SUM(U335:V335) -> 0 | X335: 0 | Y335: 1 | Z335: =1-SUM(X335:Y335) -> 0 | AA335: 0 | AB335: 1 | AC335: =1-SUM(AA335:AB335) -> 0 | AD335: 1 | AE335: 0 | AF335: =1-SUM(AD335:AE335) -> 0 | AG335: 1 | AH335: 0 | AI335: =1-SUM(AG335:AH335) -> 0 | AJ335: 1 | AK335: 0 | AL335: =1-SUM(AJ335:AK335) -> 0 | AM335: 1 | AN335: 0 | AO335: =1-SUM(AM335:AN335) -> 0 | AP335: 0 | AQ335: 1 | AR335: =1-SUM(AP335:AQ335) -> 0 | AS335: 0 | AT335: 1 | AU335: =1-SUM(AS335:AT335) -> 0 | AV335: 0 | AW335: 1 | AX335: =1-SUM(AV335:AW335) -> 0 | AY335: 0 | AZ335: 1 | BA335: =1-SUM(AY335:AZ335) -> 0 | BB335: 0 | BC335: 1 | BD335: =1-SUM(BB335:BC335) -> 0 | BE335: 0 | BF335: 1 | BG335: =1-SUM(BE335:BF335) -> 0 | BH335: 0 | BI335: 1 | BJ335: =1-SUM(BH335:BI335) -> 0 | BK335: 0 | BL335: 1 | BM335: =1-SUM(BK335:BL335) -> 0 | BN335: 0 | BO335: =1-BN335 -> 1
O336: 1 | P336: 0 | Q336: =1-SUM(O336:P336) -> 0 | R336: 0 | S336: 1 | T336: =1-SUM(R336:S336) -> 0 | U336: 0 | V336: 1 | W336: =1-SUM(U336:V336) -> 0 | X336: 0 | Y336: 1 | Z336: =1-SUM(X336:Y336) -> 0 | AA336: 0 | AB336: 1 | AC336: =1-SUM(AA336:AB336) -> 0 | AD336: 0 | AE336: 1 | AF336: =1-SUM(AD336:AE336) -> 0 | AG336: 0 | AH336: 1 | AI336: =1-SUM(AG336:AH336) -> 0 | AJ336: 1 | AK336: 0 | AL336: =1-SUM(AJ336:AK336) -> 0 | AM336: 1 | AN336: 0 | AO336: =1-SUM(AM336:AN336) -> 0 | AP336: 0 | AQ336: 1 | AR336: =1-SUM(AP336:AQ336) -> 0 | AS336: 0 | AT336: 1 | AU336: =1-SUM(AS336:AT336) -> 0 | AV336: 0 | AW336: 1 | AX336: =1-SUM(AV336:AW336) -> 0 | AY336: 0 | AZ336: 1 | BA336: =1-SUM(AY336:AZ336) -> 0 | BB336: 0 | BC336: 1 | BD336: =1-SUM(BB336:BC336) -> 0 | BE336: 0 | BF336: 1 | BG336: =1-SUM(BE336:BF336) -> 0 | BH336: 0 | BI336: 1 | BJ336: =1-SUM(BH336:BI336) -> 0 | BK336: 0 | BL336: 1 | BM336: =1-SUM(BK336:BL336) -> 0 | BN336: 0 | BO336: =1-BN336 -> 1
O337: 1 | P337: 0 | Q337: =1-SUM(O337:P337) -> 0 | R337: 0 | S337: 1 | T337: =1-SUM(R337:S337) -> 0 | U337: 0 | V337: 1 | W337: =1-SUM(U337:V337) -> 0 | X337: 0 | Y337: 1 | Z337: =1-SUM(X337:Y337) -> 0 | AA337: 1 | AB337: 0 | AC337: =1-SUM(AA337:AB337) -> 0 | AD337: 0 | AE337: 1 | AF337: =1-SUM(AD337:AE337) -> 0 | AG337: 0 | AH337: 1 | AI337: =1-SUM(AG337:AH337) -> 0 | AJ337: 0 | AK337: 1 | AL337: =1-SUM(AJ337:AK337) -> 0 | AM337: 0 | AN337: 1 | AO337: =1-SUM(AM337:AN337) -> 0 | AP337: 0 | AQ337: 1 | AR337: =1-SUM(AP337:AQ337) -> 0 | AS337: 0 | AT337: 1 | AU337: =1-SUM(AS337:AT337) -> 0 | AV337: 0 | AW337: 1 | AX337: =1-SUM(AV337:AW337) -> 0 | AY337: 1 | AZ337: 0 | BA337: =1-SUM(AY337:AZ337) -> 0 | BB337: 0 | BC337: 1 | BD337: =1-SUM(BB337:BC337) -> 0 | BE337: 0 | BF337: 1 | BG337: =1-SUM(BE337:BF337) -> 0 | BH337: 1 | BI337: 0 | BJ337: =1-SUM(BH337:BI337) -> 0 | BK337: 1 | BL337: 0 | BM337: =1-SUM(BK337:BL337) -> 0 | BN337: 0 | BO337: =1-BN337 -> 1
O338: 1 | P338: 0 | Q338: =1-SUM(O338:P338) -> 0 | R338: 1 | S338: 0 | T338: =1-SUM(R338:S338) -> 0 | U338: 0 | V338: 1 | W338: =1-SUM(U338:V338) -> 0 | X338: 0 | Y338: 1 | Z338: =1-SUM(X338:Y338) -> 0 | AA338: 1 | AB338: 0 | AC338: =1-SUM(AA338:AB338) -> 0 | AD338: 0 | AE338: 1 | AF338: =1-SUM(AD338:AE338) -> 0 | AG338: 0 | AH338: 1 | AI338: =1-SUM(AG338:AH338) -> 0 | AJ338: 0 | AK338: 1 | AL338: =1-SUM(AJ338:AK338) -> 0 | AM338: 0 | AN338: 1 | AO338: =1-SUM(AM338:AN338) -> 0 | AP338: 0 | AQ338: 1 | AR338: =1-SUM(AP338:AQ338) -> 0 | AS338: 0 | AT338: 1 | AU338: =1-SUM(AS338:AT338) -> 0 | AV338: 0 | AW338: 1 | AX338: =1-SUM(AV338:AW338) -> 0 | AY338: 0 | AZ338: 1 | BA338: =1-SUM(AY338:AZ338) -> 0 | BB338: 0 | BC338: 1 | BD338: =1-SUM(BB338:BC338) -> 0 | BE338: 0 | BF338: 1 | BG338: =1-SUM(BE338:BF338) -> 0 | BH338: 0 | BI338: 1 | BJ338: =1-SUM(BH338:BI338) -> 0 | BK338: 0 | BL338: 1 | BM338: =1-SUM(BK338:BL338) -> 0 | BN338: 0 | BO338: =1-BN338 -> 1
O339: 0 | P339: 1 | Q339: =1-SUM(O339:P339) -> 0 | R339: 1 | S339: 0 | T339: =1-SUM(R339:S339) -> 0 | U339: 1 | V339: 0 | W339: =1-SUM(U339:V339) -> 0 | X339: 1 | Y339: 0 | Z339: =1-SUM(X339:Y339) -> 0 | AA339: 1 | AB339: 0 | AC339: =1-SUM(AA339:AB339) -> 0 | AD339: 0 | AE339: 1 | AF339: =1-SUM(AD339:AE339) -> 0 | AG339: 0 | AH339: 1 | AI339: =1-SUM(AG339:AH339) -> 0 | AJ339: 0 | AK339: 1 | AL339: =1-SUM(AJ339:AK339) -> 0 | AM339: 0 | AN339: 1 | AO339: =1-SUM(AM339:AN339) -> 0 | AP339: 0 | AQ339: 1 | AR339: =1-SUM(AP339:AQ339) -> 0 | AS339: 0 | AT339: 1 | AU339: =1-SUM(AS339:AT339) -> 0 | AV339: 1 | AW339: 0 | AX339: =1-SUM(AV339:AW339) -> 0 | AY339: 1 | AZ339: 0 | BA339: =1-SUM(AY339:AZ339) -> 0 | BB339: 0 | BC339: 1 | BD339: =1-SUM(BB339:BC339) -> 0 | BE339: 0 | BF339: 1 | BG339: =1-SUM(BE339:BF339) -> 0 | BH339: 0 | BI339: 1 | BJ339: =1-SUM(BH339:BI339) -> 0 | BK339: 0 | BL339: 1 | BM339: =1-SUM(BK339:BL339) -> 0 | BN339: 0 | BO339: =1-BN339 -> 1
O340: 0 | P340: 1 | Q340: =1-SUM(O340:P340) -> 0 | R340: 0 | S340: 1 | T340: =1-SUM(R340:S340) -> 0 | U340: 0 | V340: 1 | W340: =1-SUM(U340:V340) -> 0 | X340: 0 | Y340: 1 | Z340: =1-SUM(X340:Y340) -> 0 | AA340: 0 | AB340: 1 | AC340: =1-SUM(AA340:AB340) -> 0 | AD340: 0 | AE340: 1 | AF340: =1-SUM(AD340:AE340) -> 0 | AG340: 0 | AH340: 1 | AI340: =1-SUM(AG340:AH340) -> 0 | AJ340: 0 | AK340: 1 | AL340: =1-SUM(AJ340:AK340) -> 0 | AM340: 0 | AN340: 1 | AO340: =1-SUM(AM340:AN340) -> 0 | AP340: 0 | AQ340: 1 | AR340: =1-SUM(AP340:AQ340) -> 0 | AS340: 0 | AT340: 1 | AU340: =1-SUM(AS340:AT340) -> 0 | AV340: 0 | AW340: 1 | AX340: =1-SUM(AV340:AW340) -> 0 | AY340: 0 | AZ340: 1 | BA340: =1-SUM(AY340:AZ340) -> 0 | BB340: 1 | BC340: 0 | BD340: =1-SUM(BB340:BC340) -> 0 | BE340: 0 | BF340: 1 | BG340: =1-SUM(BE340:BF340) -> 0 | BH340: 1 | BI340: 0 | BJ340: =1-SUM(BH340:BI340) -> 0 | BK340: 0 | BL340: 1 | BM340: =1-SUM(BK340:BL340) -> 0 | BN340: 0 | BO340: =1-BN340 -> 1
O341: 1 | P341: 0 | Q341: =1-SUM(O341:P341) -> 0 | R341: 0 | S341: 1 | T341: =1-SUM(R341:S341) -> 0 | U341: 0 | V341: 1 | W341: =1-SUM(U341:V341) -> 0 | X341: 0 | Y341: 1 | Z341: =1-SUM(X341:Y341) -> 0 | AA341: 0 | AB341: 1 | AC341: =1-SUM(AA341:AB341) -> 0 | AD341: 1 | AE341: 0 | AF341: =1-SUM(AD341:AE341) -> 0 | AG341: 1 | AH341: 0 | AI341: =1-SUM(AG341:AH341) -> 0 | AJ341: 1 | AK341: 0 | AL341: =1-SUM(AJ341:AK341) -> 0 | AM341: 1 | AN341: 0 | AO341: =1-SUM(AM341:AN341) -> 0 | AP341: 0 | AQ341: 1 | AR341: =1-SUM(AP341:AQ341) -> 0 | AS341: 0 | AT341: 1 | AU341: =1-SUM(AS341:AT341) -> 0 | AV341: 0 | AW341: 1 | AX341: =1-SUM(AV341:AW341) -> 0 | AY341: 0 | AZ341: 1 | BA341: =1-SUM(AY341:AZ341) -> 0 | BB341: 0 | BC341: 1 | BD341: =1-SUM(BB341:BC341) -> 0 | BE341: 0 | BF341: 1 | BG341: =1-SUM(BE341:BF341) -> 0 | BH341: 0 | BI341: 1 | BJ341: =1-SUM(BH341:BI341) -> 0 | BK341: 0 | BL341: 1 | BM341: =1-SUM(BK341:BL341) -> 0 | BN341: 0 | BO341: =1-BN341 -> 1
O342: 1 | P342: 0 | Q342: =1-SUM(O342:P342) -> 0 | R342: 0 | S342: 1 | T342: =1-SUM(R342:S342) -> 0 | U342: 0 | V342: 1 | W342: =1-SUM(U342:V342) -> 0 | X342: 0 | Y342: 1 | Z342: =1-SUM(X342:Y342) -> 0 | AA342: 0 | AB342: 1 | AC342: =1-SUM(AA342:AB342) -> 0 | AD342: 0 | AE342: 1 | AF342: =1-SUM(AD342:AE342) -> 0 | AG342: 0 | AH342: 1 | AI342: =1-SUM(AG342:AH342) -> 0 | AJ342: 0 | AK342: 1 | AL342: =1-SUM(AJ342:AK342) -> 0 | AM342: 0 | AN342: 1 | AO342: =1-SUM(AM342:AN342) -> 0 | AP342: 0 | AQ342: 1 | AR342: =1-SUM(AP342:AQ342) -> 0 | AS342: 1 | AT342: 0 | AU342: =1-SUM(AS342:AT342) -> 0 | AV342: 0 | AW342: 1 | AX342: =1-SUM(AV342:AW342) -> 0 | AY342: 0 | AZ342: 1 | BA342: =1-SUM(AY342:AZ342) -> 0 | BB342: 0 | BC342: 1 | BD342: =1-SUM(BB342:BC342) -> 0 | BE342: 0 | BF342: 1 | BG342: =1-SUM(BE342:BF342) -> 0 | BH342: 1 | BI342: 0 | BJ342: =1-SUM(BH342:BI342) -> 0 | BK342: 1 | BL342: 0 | BM342: =1-SUM(BK342:BL342) -> 0 | BN342: 0 | BO342: =1-BN342 -> 1
O343: 0 | P343: 1 | Q343: =1-SUM(O343:P343) -> 0 | R343: 0 | S343: 1 | T343: =1-SUM(R343:S343) -> 0 | U343: 0 | V343: 1 | W343: =1-SUM(U343:V343) -> 0 | X343: 0 | Y343: 1 | Z343: =1-SUM(X343:Y343) -> 0 | AA343: 0 | AB343: 1 | AC343: =1-SUM(AA343:AB343) -> 0 | AD343: 1 | AE343: 0 | AF343: =1-SUM(AD343:AE343) -> 0 | AG343: 1 | AH343: 0 | AI343: =1-SUM(AG343:AH343) -> 0 | AJ343: 0 | AK343: 1 | AL343: =1-SUM(AJ343:AK343) -> 0 | AM343: 0 | AN343: 1 | AO343: =1-SUM(AM343:AN343) -> 0 | AP343: 0 | AQ343: 1 | AR343: =1-SUM(AP343:AQ343) -> 0 | AS343: 1 | AT343: 0 | AU343: =1-SUM(AS343:AT343) -> 0 | AV343: 0 | AW343: 1 | AX343: =1-SUM(AV343:AW343) -> 0 | AY343: 1 | AZ343: 0 | BA343: =1-SUM(AY343:AZ343) -> 0 | BB343: 0 | BC343: 1 | BD343: =1-SUM(BB343:BC343) -> 0 | BE343: 0 | BF343: 1 | BG343: =1-SUM(BE343:BF343) -> 0 | BH343: 0 | BI343: 1 | BJ343: =1-SUM(BH343:BI343) -> 0 | BK343: 0 | BL343: 1 | BM343: =1-SUM(BK343:BL343) -> 0 | BN343: 0 | BO343: =1-BN343 -> 1
O344: 1 | P344: 0 | Q344: =1-SUM(O344:P344) -> 0 | R344: 0 | S344: 1 | T344: =1-SUM(R344:S344) -> 0 | U344: 0 | V344: 1 | W344: =1-SUM(U344:V344) -> 0 | X344: 0 | Y344: 1 | Z344: =1-SUM(X344:Y344) -> 0 | AA344: 1 | AB344: 0 | AC344: =1-SUM(AA344:AB344) -> 0 | AD344: 1 | AE344: 0 | AF344: =1-SUM(AD344:AE344) -> 0 | AG344: 1 | AH344: 0 | AI344: =1-SUM(AG344:AH344) -> 0 | AJ344: 0 | AK344: 1 | AL344: =1-SUM(AJ344:AK344) -> 0 | AM344: 0 | AN344: 1 | AO344: =1-SUM(AM344:AN344) -> 0 | AP344: 0 | AQ344: 1 | AR344: =1-SUM(AP344:AQ344) -> 0 | AS344: 0 | AT344: 1 | AU344: =1-SUM(AS344:AT344) -> 0 | AV344: 0 | AW344: 1 | AX344: =1-SUM(AV344:AW344) -> 0 | AY344: 1 | AZ344: 0 | BA344: =1-SUM(AY344:AZ344) -> 0 | BB344: 0 | BC344: 1 | BD344: =1-SUM(BB344:BC344) -> 0 | BE344: 0 | BF344: 1 | BG344: =1-SUM(BE344:BF344) -> 0 | BH344: 0 | BI344: 1 | BJ344: =1-SUM(BH344:BI344) -> 0 | BK344: 0 | BL344: 1 | BM344: =1-SUM(BK344:BL344) -> 0 | BN344: 0 | BO344: =1-BN344 -> 1
O345: 0 | P345: 1 | Q345: =1-SUM(O345:P345) -> 0 | R345: 0 | S345: 1 | T345: =1-SUM(R345:S345) -> 0 | U345: 0 | V345: 1 | W345: =1-SUM(U345:V345) -> 0 | X345: 0 | Y345: 1 | Z345: =1-SUM(X345:Y345) -> 0 | AA345: 1 | AB345: 0 | AC345: =1-SUM(AA345:AB345) -> 0 | AD345: 0 | AE345: 1 | AF345: =1-SUM(AD345:AE345) -> 0 | AG345: 0 | AH345: 1 | AI345: =1-SUM(AG345:AH345) -> 0 | AJ345: 0 | AK345: 1 | AL345: =1-SUM(AJ345:AK345) -> 0 | AM345: 0 | AN345: 1 | AO345: =1-SUM(AM345:AN345) -> 0 | AP345: 0 | AQ345: 1 | AR345: =1-SUM(AP345:AQ345) -> 0 | AS345: 1 | AT345: 0 | AU345: =1-SUM(AS345:AT345) -> 0 | AV345: 0 | AW345: 1 | AX345: =1-SUM(AV345:AW345) -> 0 | AY345: 1 | AZ345: 0 | BA345: =1-SUM(AY345:AZ345) -> 0 | BB345: 1 | BC345: 0 | BD345: =1-SUM(BB345:BC345) -> 0 | BE345: 1 | BF345: 0 | BG345: =1-SUM(BE345:BF345) -> 0 | BH345: 1 | BI345: 0 | BJ345: =1-SUM(BH345:BI345) -> 0 | BK345: 0 | BL345: 1 | BM345: =1-SUM(BK345:BL345) -> 0 | BN345: 0 | BO345: =1-BN345 -> 1
O346: 1 | P346: 0 | Q346: =1-SUM(O346:P346) -> 0 | R346: 0 | S346: 1 | T346: =1-SUM(R346:S346) -> 0 | U346: 0 | V346: 1 | W346: =1-SUM(U346:V346) -> 0 | X346: 0 | Y346: 1 | Z346: =1-SUM(X346:Y346) -> 0 | AA346: 1 | AB346: 0 | AC346: =1-SUM(AA346:AB346) -> 0 | AD346: 1 | AE346: 0 | AF346: =1-SUM(AD346:AE346) -> 0 | AG346: 1 | AH346: 0 | AI346: =1-SUM(AG346:AH346) -> 0 | AJ346: 0 | AK346: 1 | AL346: =1-SUM(AJ346:AK346) -> 0 | AM346: 0 | AN346: 1 | AO346: =1-SUM(AM346:AN346) -> 0 | AP346: 0 | AQ346: 1 | AR346: =1-SUM(AP346:AQ346) -> 0 | AS346: 0 | AT346: 1 | AU346: =1-SUM(AS346:AT346) -> 0 | AV346: 0 | AW346: 1 | AX346: =1-SUM(AV346:AW346) -> 0 | AY346: 0 | AZ346: 1 | BA346: =1-SUM(AY346:AZ346) -> 0 | BB346: 0 | BC346: 1 | BD346: =1-SUM(BB346:BC346) -> 0 | BE346: 1 | BF346: 0 | BG346: =1-SUM(BE346:BF346) -> 0 | BH346: 0 | BI346: 1 | BJ346: =1-SUM(BH346:BI346) -> 0 | BK346: 1 | BL346: 0 | BM346: =1-SUM(BK346:BL346) -> 0 | BN346: 0 | BO346: =1-BN346 -> 1
O347: 0 | P347: 1 | Q347: =1-SUM(O347:P347) -> 0 | R347: 0 | S347: 1 | T347: =1-SUM(R347:S347) -> 0 | U347: 0 | V347: 1 | W347: =1-SUM(U347:V347) -> 0 | X347: 0 | Y347: 1 | Z347: =1-SUM(X347:Y347) -> 0 | AA347: 0 | AB347: 1 | AC347: =1-SUM(AA347:AB347) -> 0 | AD347: 0 | AE347: 1 | AF347: =1-SUM(AD347:AE347) -> 0 | AG347: 0 | AH347: 1 | AI347: =1-SUM(AG347:AH347) -> 0 | AJ347: 1 | AK347: 0 | AL347: =1-SUM(AJ347:AK347) -> 0 | AM347: 1 | AN347: 0 | AO347: =1-SUM(AM347:AN347) -> 0 | AP347: 0 | AQ347: 1 | AR347: =1-SUM(AP347:AQ347) -> 0 | AS347: 0 | AT347: 1 | AU347: =1-SUM(AS347:AT347) -> 0 | AV347: 0 | AW347: 1 | AX347: =1-SUM(AV347:AW347) -> 0 | AY347: 0 | AZ347: 1 | BA347: =1-SUM(AY347:AZ347) -> 0 | BB347: 0 | BC347: 1 | BD347: =1-SUM(BB347:BC347) -> 0 | BE347: 0 | BF347: 1 | BG347: =1-SUM(BE347:BF347) -> 0 | BH347: 0 | BI347: 1 | BJ347: =1-SUM(BH347:BI347) -> 0 | BK347: 0 | BL347: 1 | BM347: =1-SUM(BK347:BL347) -> 0 | BN347: 0 | BO347: =1-BN347 -> 1
O348: 1 | P348: 0 | Q348: =1-SUM(O348:P348) -> 0 | R348: 1 | S348: 0 | T348: =1-SUM(R348:S348) -> 0 | U348: 0 | V348: 1 | W348: =1-SUM(U348:V348) -> 0 | X348: 1 | Y348: 0 | Z348: =1-SUM(X348:Y348) -> 0 | AA348: 1 | AB348: 0 | AC348: =1-SUM(AA348:AB348) -> 0 | AD348: 0 | AE348: 1 | AF348: =1-SUM(AD348:AE348) -> 0 | AG348: 1 | AH348: 0 | AI348: =1-SUM(AG348:AH348) -> 0 | AJ348: 0 | AK348: 1 | AL348: =1-SUM(AJ348:AK348) -> 0 | AM348: 1 | AN348: 0 | AO348: =1-SUM(AM348:AN348) -> 0 | AP348: 0 | AQ348: 1 | AR348: =1-SUM(AP348:AQ348) -> 0 | AS348: 1 | AT348: 0 | AU348: =1-SUM(AS348:AT348) -> 0 | AV348: 1 | AW348: 0 | AX348: =1-SUM(AV348:AW348) -> 0 | AY348: 1 | AZ348: 0 | BA348: =1-SUM(AY348:AZ348) -> 0 | BB348: 0 | BC348: 1 | BD348: =1-SUM(BB348:BC348) -> 0 | BE348: 1 | BF348: 0 | BG348: =1-SUM(BE348:BF348) -> 0 | BH348: 0 | BI348: 1 | BJ348: =1-SUM(BH348:BI348) -> 0 | BK348: 0 | BL348: 1 | BM348: =1-SUM(BK348:BL348) -> 0 | BN348: 0 | BO348: =1-BN348 -> 1
O349: 1 | P349: 0 | Q349: =1-SUM(O349:P349) -> 0 | R349: 0 | S349: 1 | T349: =1-SUM(R349:S349) -> 0 | U349: 0 | V349: 1 | W349: =1-SUM(U349:V349) -> 0 | X349: 1 | Y349: 0 | Z349: =1-SUM(X349:Y349) -> 0 | AA349: 1 | AB349: 0 | AC349: =1-SUM(AA349:AB349) -> 0 | AD349: 0 | AE349: 1 | AF349: =1-SUM(AD349:AE349) -> 0 | AG349: 1 | AH349: 0 | AI349: =1-SUM(AG349:AH349) -> 0 | AJ349: 0 | AK349: 1 | AL349: =1-SUM(AJ349:AK349) -> 0 | AM349: 1 | AN349: 0 | AO349: =1-SUM(AM349:AN349) -> 0 | AP349: 0 | AQ349: 1 | AR349: =1-SUM(AP349:AQ349) -> 0 | AS349: 1 | AT349: 0 | AU349: =1-SUM(AS349:AT349) -> 0 | AV349: 1 | AW349: 0 | AX349: =1-SUM(AV349:AW349) -> 0 | AY349: 1 | AZ349: 0 | BA349: =1-SUM(AY349:AZ349) -> 0 | BB349: 1 | BC349: 0 | BD349: =1-SUM(BB349:BC349) -> 0 | BE349: 1 | BF349: 0 | BG349: =1-SUM(BE349:BF349) -> 0 | BH349: 0 | BI349: 1 | BJ349: =1-SUM(BH349:BI349) -> 0 | BK349: 0 | BL349: 1 | BM349: =1-SUM(BK349:BL349) -> 0 | BN349: 0 | BO349: =1-BN349 -> 1
O350: 0 | P350: 1 | Q350: =1-SUM(O350:P350) -> 0 | R350: 1 | S350: 0 | T350: =1-SUM(R350:S350) -> 0 | U350: 1 | V350: 0 | W350: =1-SUM(U350:V350) -> 0 | X350: 1 | Y350: 0 | Z350: =1-SUM(X350:Y350) -> 0 | AA350: 1 | AB350: 0 | AC350: =1-SUM(AA350:AB350) -> 0 | AD350: 0 | AE350: 1 | AF350: =1-SUM(AD350:AE350) -> 0 | AG350: 0 | AH350: 1 | AI350: =1-SUM(AG350:AH350) -> 0 | AJ350: 0 | AK350: 1 | AL350: =1-SUM(AJ350:AK350) -> 0 | AM350: 1 | AN350: 0 | AO350: =1-SUM(AM350:AN350) -> 0 | AP350: 0 | AQ350: 1 | AR350: =1-SUM(AP350:AQ350) -> 0 | AS350: 0 | AT350: 1 | AU350: =1-SUM(AS350:AT350) -> 0 | AV350: 1 | AW350: 0 | AX350: =1-SUM(AV350:AW350) -> 0 | AY350: 1 | AZ350: 0 | BA350: =1-SUM(AY350:AZ350) -> 0 | BB350: 1 | BC350: 0 | BD350: =1-SUM(BB350:BC350) -> 0 | BE350: 1 | BF350: 0 | BG350: =1-SUM(BE350:BF350) -> 0 | BH350: 0 | BI350: 1 | BJ350: =1-SUM(BH350:BI350) -> 0 | BK350: 0 | BL350: 1 | BM350: =1-SUM(BK350:BL350) -> 0 | BN350: 0 | BO350: =1-BN350 -> 1
O351: 1 | P351: 0 | Q351: =1-SUM(O351:P351) -> 0 | R351: 0 | S351: 1 | T351: =1-SUM(R351:S351) -> 0 | U351: 0 | V351: 1 | W351: =1-SUM(U351:V351) -> 0 | X351: 0 | Y351: 1 | Z351: =1-SUM(X351:Y351) -> 0 | AA351: 0 | AB351: 1 | AC351: =1-SUM(AA351:AB351) -> 0 | AD351: 0 | AE351: 1 | AF351: =1-SUM(AD351:AE351) -> 0 | AG351: 1 | AH351: 0 | AI351: =1-SUM(AG351:AH351) -> 0 | AJ351: 1 | AK351: 0 | AL351: =1-SUM(AJ351:AK351) -> 0 | AM351: 1 | AN351: 0 | AO351: =1-SUM(AM351:AN351) -> 0 | AP351: 0 | AQ351: 1 | AR351: =1-SUM(AP351:AQ351) -> 0 | AS351: 0 | AT351: 1 | AU351: =1-SUM(AS351:AT351) -> 0 | AV351: 0 | AW351: 1 | AX351: =1-SUM(AV351:AW351) -> 0 | AY351: 0 | AZ351: 1 | BA351: =1-SUM(AY351:AZ351) -> 0 | BB351: 1 | BC351: 0 | BD351: =1-SUM(BB351:BC351) -> 0 | BE351: 0 | BF351: 1 | BG351: =1-SUM(BE351:BF351) -> 0 | BH351: 1 | BI351: 0 | BJ351: =1-SUM(BH351:BI351) -> 0 | BK351: 0 | BL351: 1 | BM351: =1-SUM(BK351:BL351) -> 0 | BN351: 0 | BO351: =1-BN351 -> 1
O352: 1 | P352: 0 | Q352: =1-SUM(O352:P352) -> 0 | R352: 1 | S352: 0 | T352: =1-SUM(R352:S352) -> 0 | U352: 0 | V352: 1 | W352: =1-SUM(U352:V352) -> 0 | X352: 0 | Y352: 1 | Z352: =1-SUM(X352:Y352) -> 0 | AA352: 1 | AB352: 0 | AC352: =1-SUM(AA352:AB352) -> 0 | AD352: 0 | AE352: 1 | AF352: =1-SUM(AD352:AE352) -> 0 | AG352: 0 | AH352: 1 | AI352: =1-SUM(AG352:AH352) -> 0 | AJ352: 0 | AK352: 1 | AL352: =1-SUM(AJ352:AK352) -> 0 | AM352: 1 | AN352: 0 | AO352: =1-SUM(AM352:AN352) -> 0 | AP352: 0 | AQ352: 1 | AR352: =1-SUM(AP352:AQ352) -> 0 | AS352: 0 | AT352: 1 | AU352: =1-SUM(AS352:AT352) -> 0 | AV352: 1 | AW352: 0 | AX352: =1-SUM(AV352:AW352) -> 0 | AY352: 1 | AZ352: 0 | BA352: =1-SUM(AY352:AZ352) -> 0 | BB352: 0 | BC352: 1 | BD352: =1-SUM(BB352:BC352) -> 0 | BE352: 0 | BF352: 1 | BG352: =1-SUM(BE352:BF352) -> 0 | BH352: 0 | BI352: 1 | BJ352: =1-SUM(BH352:BI352) -> 0 | BK352: 0 | BL352: 1 | BM352: =1-SUM(BK352:BL352) -> 0 | BN352: 0 | BO352: =1-BN352 -> 1
O353: 0 | P353: 1 | Q353: =1-SUM(O353:P353) -> 0 | R353: 0 | S353: 1 | T353: =1-SUM(R353:S353) -> 0 | U353: 0 | V353: 1 | W353: =1-SUM(U353:V353) -> 0 | X353: 0 | Y353: 1 | Z353: =1-SUM(X353:Y353) -> 0 | AA353: 0 | AB353: 1 | AC353: =1-SUM(AA353:AB353) -> 0 | AD353: 0 | AE353: 1 | AF353: =1-SUM(AD353:AE353) -> 0 | AG353: 0 | AH353: 1 | AI353: =1-SUM(AG353:AH353) -> 0 | AJ353: 0 | AK353: 1 | AL353: =1-SUM(AJ353:AK353) -> 0 | AM353: 0 | AN353: 1 | AO353: =1-SUM(AM353:AN353) -> 0 | AP353: 0 | AQ353: 1 | AR353: =1-SUM(AP353:AQ353) -> 0 | AS353: 0 | AT353: 1 | AU353: =1-SUM(AS353:AT353) -> 0 | AV353: 0 | AW353: 1 | AX353: =1-SUM(AV353:AW353) -> 0 | AY353: 0 | AZ353: 1 | BA353: =1-SUM(AY353:AZ353) -> 0 | BB353: 1 | BC353: 0 | BD353: =1-SUM(BB353:BC353) -> 0 | BE353: 0 | BF353: 1 | BG353: =1-SUM(BE353:BF353) -> 0 | BH353: 1 | BI353: 0 | BJ353: =1-SUM(BH353:BI353) -> 0 | BK353: 0 | BL353: 1 | BM353: =1-SUM(BK353:BL353) -> 0 | BN353: 0 | BO353: =1-BN353 -> 1
O354: 1 | P354: 0 | Q354: =1-SUM(O354:P354) -> 0 | R354: 1 | S354: 0 | T354: =1-SUM(R354:S354) -> 0 | U354: 1 | V354: 0 | W354: =1-SUM(U354:V354) -> 0 | X354: 0 | Y354: 1 | Z354: =1-SUM(X354:Y354) -> 0 | AA354: 1 | AB354: 0 | AC354: =1-SUM(AA354:AB354) -> 0 | AD354: 0 | AE354: 1 | AF354: =1-SUM(AD354:AE354) -> 0 | AG354: 0 | AH354: 1 | AI354: =1-SUM(AG354:AH354) -> 0 | AJ354: 1 | AK354: 0 | AL354: =1-SUM(AJ354:AK354) -> 0 | AM354: 1 | AN354: 0 | AO354: =1-SUM(AM354:AN354) -> 0 | AP354: 0 | AQ354: 1 | AR354: =1-SUM(AP354:AQ354) -> 0 | AS354: 1 | AT354: 0 | AU354: =1-SUM(AS354:AT354) -> 0 | AV354: 1 | AW354: 0 | AX354: =1-SUM(AV354:AW354) -> 0 | AY354: 1 | AZ354: 0 | BA354: =1-SUM(AY354:AZ354) -> 0 | BB354: 0 | BC354: 1 | BD354: =1-SUM(BB354:BC354) -> 0 | BE354: 0 | BF354: 1 | BG354: =1-SUM(BE354:BF354) -> 0 | BH354: 0 | BI354: 1 | BJ354: =1-SUM(BH354:BI354) -> 0 | BK354: 0 | BL354: 1 | BM354: =1-SUM(BK354:BL354) -> 0 | BN354: 0 | BO354: =1-BN354 -> 1
O355: 1 | P355: 0 | Q355: =1-SUM(O355:P355) -> 0 | R355: 0 | S355: 1 | T355: =1-SUM(R355:S355) -> 0 | U355: 0 | V355: 1 | W355: =1-SUM(U355:V355) -> 0 | X355: 0 | Y355: 1 | Z355: =1-SUM(X355:Y355) -> 0 | AA355: 1 | AB355: 0 | AC355: =1-SUM(AA355:AB355) -> 0 | AD355: 1 | AE355: 0 | AF355: =1-SUM(AD355:AE355) -> 0 | AG355: 1 | AH355: 0 | AI355: =1-SUM(AG355:AH355) -> 0 | AJ355: 1 | AK355: 0 | AL355: =1-SUM(AJ355:AK355) -> 0 | AM355: 0 | AN355: 1 | AO355: =1-SUM(AM355:AN355) -> 0 | AP355: 0 | AQ355: 1 | AR355: =1-SUM(AP355:AQ355) -> 0 | AS355: 1 | AT355: 0 | AU355: =1-SUM(AS355:AT355) -> 0 | AV355: 1 | AW355: 0 | AX355: =1-SUM(AV355:AW355) -> 0 | AY355: 1 | AZ355: 0 | BA355: =1-SUM(AY355:AZ355) -> 0 | BB355: 0 | BC355: 1 | BD355: =1-SUM(BB355:BC355) -> 0 | BE355: 0 | BF355: 1 | BG355: =1-SUM(BE355:BF355) -> 0 | BH355: 0 | BI355: 1 | BJ355: =1-SUM(BH355:BI355) -> 0 | BK355: 1 | BL355: 0 | BM355: =1-SUM(BK355:BL355) -> 0 | BN355: 0 | BO355: =1-BN355 -> 1
O356: 0 | P356: 1 | Q356: =1-SUM(O356:P356) -> 0 | R356: 1 | S356: 0 | T356: =1-SUM(R356:S356) -> 0 | U356: 1 | V356: 0 | W356: =1-SUM(U356:V356) -> 0 | X356: 1 | Y356: 0 | Z356: =1-SUM(X356:Y356) -> 0 | AA356: 1 | AB356: 0 | AC356: =1-SUM(AA356:AB356) -> 0 | AD356: 0 | AE356: 1 | AF356: =1-SUM(AD356:AE356) -> 0 | AG356: 0 | AH356: 1 | AI356: =1-SUM(AG356:AH356) -> 0 | AJ356: 0 | AK356: 1 | AL356: =1-SUM(AJ356:AK356) -> 0 | AM356: 0 | AN356: 1 | AO356: =1-SUM(AM356:AN356) -> 0 | AP356: 0 | AQ356: 1 | AR356: =1-SUM(AP356:AQ356) -> 0 | AS356: 0 | AT356: 1 | AU356: =1-SUM(AS356:AT356) -> 0 | AV356: 1 | AW356: 0 | AX356: =1-SUM(AV356:AW356) -> 0 | AY356: 0 | AZ356: 1 | BA356: =1-SUM(AY356:AZ356) -> 0 | BB356: 0 | BC356: 1 | BD356: =1-SUM(BB356:BC356) -> 0 | BE356: 0 | BF356: 1 | BG356: =1-SUM(BE356:BF356) -> 0 | BH356: 0 | BI356: 1 | BJ356: =1-SUM(BH356:BI356) -> 0 | BK356: 0 | BL356: 1 | BM356: =1-SUM(BK356:BL356) -> 0 | BN356: 0 | BO356: =1-BN356 -> 1
O357: 1 | P357: 0 | Q357: =1-SUM(O357:P357) -> 0 | R357: 1 | S357: 0 | T357: =1-SUM(R357:S357) -> 0 | U357: 1 | V357: 0 | W357: =1-SUM(U357:V357) -> 0 | X357: 1 | Y357: 0 | Z357: =1-SUM(X357:Y357) -> 0 | AA357: 1 | AB357: 0 | AC357: =1-SUM(AA357:AB357) -> 0 | AD357: 0 | AE357: 1 | AF357: =1-SUM(AD357:AE357) -> 0 | AG357: 0 | AH357: 1 | AI357: =1-SUM(AG357:AH357) -> 0 | AJ357: 0 | AK357: 1 | AL357: =1-SUM(AJ357:AK357) -> 0 | AM357: 0 | AN357: 1 | AO357: =1-SUM(AM357:AN357) -> 0 | AP357: 0 | AQ357: 1 | AR357: =1-SUM(AP357:AQ357) -> 0 | AS357: 0 | AT357: 1 | AU357: =1-SUM(AS357:AT357) -> 0 | AV357: 1 | AW357: 0 | AX357: =1-SUM(AV357:AW357) -> 0 | AY357: 1 | AZ357: 0 | BA357: =1-SUM(AY357:AZ357) -> 0 | BB357: 0 | BC357: 1 | BD357: =1-SUM(BB357:BC357) -> 0 | BE357: 0 | BF357: 1 | BG357: =1-SUM(BE357:BF357) -> 0 | BH357: 0 | BI357: 1 | BJ357: =1-SUM(BH357:BI357) -> 0 | BK357: 0 | BL357: 1 | BM357: =1-SUM(BK357:BL357) -> 0 | BN357: 0 | BO357: =1-BN357 -> 1
O358: 0 | P358: 1 | Q358: =1-SUM(O358:P358) -> 0 | R358: 0 | S358: 1 | T358: =1-SUM(R358:S358) -> 0 | U358: 0 | V358: 1 | W358: =1-SUM(U358:V358) -> 0 | X358: 0 | Y358: 1 | Z358: =1-SUM(X358:Y358) -> 0 | AA358: 0 | AB358: 1 | AC358: =1-SUM(AA358:AB358) -> 0 | AD358: 0 | AE358: 1 | AF358: =1-SUM(AD358:AE358) -> 0 | AG358: 0 | AH358: 1 | AI358: =1-SUM(AG358:AH358) -> 0 | AJ358: 0 | AK358: 1 | AL358: =1-SUM(AJ358:AK358) -> 0 | AM358: 0 | AN358: 1 | AO358: =1-SUM(AM358:AN358) -> 0 | AP358: 0 | AQ358: 1 | AR358: =1-SUM(AP358:AQ358) -> 0 | AS358: 0 | AT358: 1 | AU358: =1-SUM(AS358:AT358) -> 0 | AV358: 0 | AW358: 1 | AX358: =1-SUM(AV358:AW358) -> 0 | AY358: 0 | AZ358: 1 | BA358: =1-SUM(AY358:AZ358) -> 0 | BB358: 1 | BC358: 0 | BD358: =1-SUM(BB358:BC358) -> 0 | BE358: 0 | BF358: 1 | BG358: =1-SUM(BE358:BF358) -> 0 | BH358: 1 | BI358: 0 | BJ358: =1-SUM(BH358:BI358) -> 0 | BK358: 0 | BL358: 1 | BM358: =1-SUM(BK358:BL358) -> 0 | BN358: 0 | BO358: =1-BN358 -> 1
O359: 1 | P359: 0 | Q359: =1-SUM(O359:P359) -> 0 | R359: 1 | S359: 0 | T359: =1-SUM(R359:S359) -> 0 | U359: 0 | V359: 1 | W359: =1-SUM(U359:V359) -> 0 | X359: 1 | Y359: 0 | Z359: =1-SUM(X359:Y359) -> 0 | AA359: 1 | AB359: 0 | AC359: =1-SUM(AA359:AB359) -> 0 | AD359: 0 | AE359: 1 | AF359: =1-SUM(AD359:AE359) -> 0 | AG359: 1 | AH359: 0 | AI359: =1-SUM(AG359:AH359) -> 0 | AJ359: 0 | AK359: 1 | AL359: =1-SUM(AJ359:AK359) -> 0 | AM359: 1 | AN359: 0 | AO359: =1-SUM(AM359:AN359) -> 0 | AP359: 0 | AQ359: 1 | AR359: =1-SUM(AP359:AQ359) -> 0 | AS359: 0 | AT359: 1 | AU359: =1-SUM(AS359:AT359) -> 0 | AV359: 0 | AW359: 1 | AX359: =1-SUM(AV359:AW359) -> 0 | AY359: 1 | AZ359: 0 | BA359: =1-SUM(AY359:AZ359) -> 0 | BB359: 0 | BC359: 1 | BD359: =1-SUM(BB359:BC359) -> 0 | BE359: 0 | BF359: 1 | BG359: =1-SUM(BE359:BF359) -> 0 | BH359: 0 | BI359: 1 | BJ359: =1-SUM(BH359:BI359) -> 0 | BK359: 0 | BL359: 1 | BM359: =1-SUM(BK359:BL359) -> 0 | BN359: 0 | BO359: =1-BN359 -> 1
O360: 1 | P360: 0 | Q360: =1-SUM(O360:P360) -> 0 | R360: 1 | S360: 0 | T360: =1-SUM(R360:S360) -> 0 | U360: 1 | V360: 0 | W360: =1-SUM(U360:V360) -> 0 | X360: 1 | Y360: 0 | Z360: =1-SUM(X360:Y360) -> 0 | AA360: 1 | AB360: 0 | AC360: =1-SUM(AA360:AB360) -> 0 | AD360: 0 | AE360: 1 | AF360: =1-SUM(AD360:AE360) -> 0 | AG360: 0 | AH360: 1 | AI360: =1-SUM(AG360:AH360) -> 0 | AJ360: 0 | AK360: 1 | AL360: =1-SUM(AJ360:AK360) -> 0 | AM360: 0 | AN360: 1 | AO360: =1-SUM(AM360:AN360) -> 0 | AP360: 0 | AQ360: 1 | AR360: =1-SUM(AP360:AQ360) -> 0 | AS360: 0 | AT360: 1 | AU360: =1-SUM(AS360:AT360) -> 0 | AV360: 0 | AW360: 1 | AX360: =1-SUM(AV360:AW360) -> 0 | AY360: 1 | AZ360: 0 | BA360: =1-SUM(AY360:AZ360) -> 0 | BB360: 0 | BC360: 1 | BD360: =1-SUM(BB360:BC360) -> 0 | BE360: 0 | BF360: 1 | BG360: =1-SUM(BE360:BF360) -> 0 | BH360: 0 | BI360: 1 | BJ360: =1-SUM(BH360:BI360) -> 0 | BK360: 0 | BL360: 1 | BM360: =1-SUM(BK360:BL360) -> 0 | BN360: 0 | BO360: =1-BN360 -> 1
O361: 1 | P361: 0 | Q361: =1-SUM(O361:P361) -> 0 | R361: 0 | S361: 1 | T361: =1-SUM(R361:S361) -> 0 | U361: 0 | V361: 1 | W361: =1-SUM(U361:V361) -> 0 | X361: 0 | Y361: 1 | Z361: =1-SUM(X361:Y361) -> 0 | AA361: 0 | AB361: 1 | AC361: =1-SUM(AA361:AB361) -> 0 | AD361: 1 | AE361: 0 | AF361: =1-SUM(AD361:AE361) -> 0 | AG361: 1 | AH361: 0 | AI361: =1-SUM(AG361:AH361) -> 0 | AJ361: 1 | AK361: 0 | AL361: =1-SUM(AJ361:AK361) -> 0 | AM361: 1 | AN361: 0 | AO361: =1-SUM(AM361:AN361) -> 0 | AP361: 0 | AQ361: 1 | AR361: =1-SUM(AP361:AQ361) -> 0 | AS361: 0 | AT361: 1 | AU361: =1-SUM(AS361:AT361) -> 0 | AV361: 0 | AW361: 1 | AX361: =1-SUM(AV361:AW361) -> 0 | AY361: 0 | AZ361: 1 | BA361: =1-SUM(AY361:AZ361) -> 0 | BB361: 0 | BC361: 1 | BD361: =1-SUM(BB361:BC361) -> 0 | BE361: 0 | BF361: 1 | BG361: =1-SUM(BE361:BF361) -> 0 | BH361: 0 | BI361: 1 | BJ361: =1-SUM(BH361:BI361) -> 0 | BK361: 0 | BL361: 1 | BM361: =1-SUM(BK361:BL361) -> 0 | BN361: 0 | BO361: =1-BN361 -> 1
O362: 1 | P362: 0 | Q362: =1-SUM(O362:P362) -> 0 | R362: 1 | S362: 0 | T362: =1-SUM(R362:S362) -> 0 | U362: 1 | V362: 0 | W362: =1-SUM(U362:V362) -> 0 | X362: 0 | Y362: 1 | Z362: =1-SUM(X362:Y362) -> 0 | AA362: 1 | AB362: 0 | AC362: =1-SUM(AA362:AB362) -> 0 | AD362: 0 | AE362: 1 | AF362: =1-SUM(AD362:AE362) -> 0 | AG362: 0 | AH362: 1 | AI362: =1-SUM(AG362:AH362) -> 0 | AJ362: 0 | AK362: 1 | AL362: =1-SUM(AJ362:AK362) -> 0 | AM362: 1 | AN362: 0 | AO362: =1-SUM(AM362:AN362) -> 0 | AP362: 0 | AQ362: 1 | AR362: =1-SUM(AP362:AQ362) -> 0 | AS362: 1 | AT362: 0 | AU362: =1-SUM(AS362:AT362) -> 0 | AV362: 1 | AW362: 0 | AX362: =1-SUM(AV362:AW362) -> 0 | AY362: 1 | AZ362: 0 | BA362: =1-SUM(AY362:AZ362) -> 0 | BB362: 0 | BC362: 1 | BD362: =1-SUM(BB362:BC362) -> 0 | BE362: 0 | BF362: 1 | BG362: =1-SUM(BE362:BF362) -> 0 | BH362: 0 | BI362: 1 | BJ362: =1-SUM(BH362:BI362) -> 0 | BK362: 0 | BL362: 1 | BM362: =1-SUM(BK362:BL362) -> 0 | BN362: 0 | BO362: =1-BN362 -> 1
O363: 1 | P363: 0 | Q363: =1-SUM(O363:P363) -> 0 | R363: 1 | S363: 0 | T363: =1-SUM(R363:S363) -> 0 | U363: 1 | V363: 0 | W363: =1-SUM(U363:V363) -> 0 | X363: 0 | Y363: 1 | Z363: =1-SUM(X363:Y363) -> 0 | AA363: 1 | AB363: 0 | AC363: =1-SUM(AA363:AB363) -> 0 | AD363: 0 | AE363: 1 | AF363: =1-SUM(AD363:AE363) -> 0 | AG363: 0 | AH363: 1 | AI363: =1-SUM(AG363:AH363) -> 0 | AJ363: 1 | AK363: 0 | AL363: =1-SUM(AJ363:AK363) -> 0 | AM363: 1 | AN363: 0 | AO363: =1-SUM(AM363:AN363) -> 0 | AP363: 0 | AQ363: 1 | AR363: =1-SUM(AP363:AQ363) -> 0 | AS363: 0 | AT363: 1 | AU363: =1-SUM(AS363:AT363) -> 0 | AV363: 1 | AW363: 0 | AX363: =1-SUM(AV363:AW363) -> 0 | AY363: 1 | AZ363: 0 | BA363: =1-SUM(AY363:AZ363) -> 0 | BB363: 0 | BC363: 1 | BD363: =1-SUM(BB363:BC363) -> 0 | BE363: 0 | BF363: 1 | BG363: =1-SUM(BE363:BF363) -> 0 | BH363: 0 | BI363: 1 | BJ363: =1-SUM(BH363:BI363) -> 0 | BK363: 1 | BL363: 0 | BM363: =1-SUM(BK363:BL363) -> 0 | BN363: 0 | BO363: =1-BN363 -> 1
O364: 1 | P364: 0 | Q364: =1-SUM(O364:P364) -> 0 | R364: 1 | S364: 0 | T364: =1-SUM(R364:S364) -> 0 | U364: 1 | V364: 0 | W364: =1-SUM(U364:V364) -> 0 | X364: 0 | Y364: 1 | Z364: =1-SUM(X364:Y364) -> 0 | AA364: 1 | AB364: 0 | AC364: =1-SUM(AA364:AB364) -> 0 | AD364: 0 | AE364: 1 | AF364: =1-SUM(AD364:AE364) -> 0 | AG364: 0 | AH364: 1 | AI364: =1-SUM(AG364:AH364) -> 0 | AJ364: 0 | AK364: 1 | AL364: =1-SUM(AJ364:AK364) -> 0 | AM364: 0 | AN364: 1 | AO364: =1-SUM(AM364:AN364) -> 0 | AP364: 0 | AQ364: 1 | AR364: =1-SUM(AP364:AQ364) -> 0 | AS364: 1 | AT364: 0 | AU364: =1-SUM(AS364:AT364) -> 0 | AV364: 1 | AW364: 0 | AX364: =1-SUM(AV364:AW364) -> 0 | AY364: 1 | AZ364: 0 | BA364: =1-SUM(AY364:AZ364) -> 0 | BB364: 0 | BC364: 1 | BD364: =1-SUM(BB364:BC364) -> 0 | BE364: 0 | BF364: 1 | BG364: =1-SUM(BE364:BF364) -> 0 | BH364: 0 | BI364: 1 | BJ364: =1-SUM(BH364:BI364) -> 0 | BK364: 0 | BL364: 1 | BM364: =1-SUM(BK364:BL364) -> 0 | BN364: 0 | BO364: =1-BN364 -> 1
O365: 0 | P365: 1 | Q365: =1-SUM(O365:P365) -> 0 | R365: 1 | S365: 0 | T365: =1-SUM(R365:S365) -> 0 | U365: 1 | V365: 0 | W365: =1-SUM(U365:V365) -> 0 | X365: 0 | Y365: 1 | Z365: =1-SUM(X365:Y365) -> 0 | AA365: 1 | AB365: 0 | AC365: =1-SUM(AA365:AB365) -> 0 | AD365: 0 | AE365: 1 | AF365: =1-SUM(AD365:AE365) -> 0 | AG365: 0 | AH365: 1 | AI365: =1-SUM(AG365:AH365) -> 0 | AJ365: 0 | AK365: 1 | AL365: =1-SUM(AJ365:AK365) -> 0 | AM365: 0 | AN365: 1 | AO365: =1-SUM(AM365:AN365) -> 0 | AP365: 0 | AQ365: 1 | AR365: =1-SUM(AP365:AQ365) -> 0 | AS365: 0 | AT365: 1 | AU365: =1-SUM(AS365:AT365) -> 0 | AV365: 1 | AW365: 0 | AX365: =1-SUM(AV365:AW365) -> 0 | AY365: 1 | AZ365: 0 | BA365: =1-SUM(AY365:AZ365) -> 0 | BB365: 0 | BC365: 1 | BD365: =1-SUM(BB365:BC365) -> 0 | BE365: 0 | BF365: 1 | BG365: =1-SUM(BE365:BF365) -> 0 | BH365: 0 | BI365: 1 | BJ365: =1-SUM(BH365:BI365) -> 0 | BK365: 0 | BL365: 1 | BM365: =1-SUM(BK365:BL365) -> 0 | BN365: 0 | BO365: =1-BN365 -> 1
O366: 1 | P366: 0 | Q366: =1-SUM(O366:P366) -> 0 | R366: 1 | S366: 0 | T366: =1-SUM(R366:S366) -> 0 | U366: 1 | V366: 0 | W366: =1-SUM(U366:V366) -> 0 | X366: 0 | Y366: 1 | Z366: =1-SUM(X366:Y366) -> 0 | AA366: 1 | AB366: 0 | AC366: =1-SUM(AA366:AB366) -> 0 | AD366: 0 | AE366: 1 | AF366: =1-SUM(AD366:AE366) -> 0 | AG366: 0 | AH366: 1 | AI366: =1-SUM(AG366:AH366) -> 0 | AJ366: 0 | AK366: 1 | AL366: =1-SUM(AJ366:AK366) -> 0 | AM366: 0 | AN366: 1 | AO366: =1-SUM(AM366:AN366) -> 0 | AP366: 0 | AQ366: 1 | AR366: =1-SUM(AP366:AQ366) -> 0 | AS366: 0 | AT366: 1 | AU366: =1-SUM(AS366:AT366) -> 0 | AV366: 1 | AW366: 0 | AX366: =1-SUM(AV366:AW366) -> 0 | AY366: 1 | AZ366: 0 | BA366: =1-SUM(AY366:AZ366) -> 0 | BB366: 0 | BC366: 1 | BD366: =1-SUM(BB366:BC366) -> 0 | BE366: 0 | BF366: 1 | BG366: =1-SUM(BE366:BF366) -> 0 | BH366: 0 | BI366: 1 | BJ366: =1-SUM(BH366:BI366) -> 0 | BK366: 0 | BL366: 1 | BM366: =1-SUM(BK366:BL366) -> 0 | BN366: 0 | BO366: =1-BN366 -> 1
O367: 0 | P367: 1 | Q367: =1-SUM(O367:P367) -> 0 | R367: 1 | S367: 0 | T367: =1-SUM(R367:S367) -> 0 | U367: 1 | V367: 0 | W367: =1-SUM(U367:V367) -> 0 | X367: 0 | Y367: 1 | Z367: =1-SUM(X367:Y367) -> 0 | AA367: 1 | AB367: 0 | AC367: =1-SUM(AA367:AB367) -> 0 | AD367: 0 | AE367: 1 | AF367: =1-SUM(AD367:AE367) -> 0 | AG367: 0 | AH367: 1 | AI367: =1-SUM(AG367:AH367) -> 0 | AJ367: 0 | AK367: 1 | AL367: =1-SUM(AJ367:AK367) -> 0 | AM367: 0 | AN367: 1 | AO367: =1-SUM(AM367:AN367) -> 0 | AP367: 0 | AQ367: 1 | AR367: =1-SUM(AP367:AQ367) -> 0 | AS367: 1 | AT367: 0 | AU367: =1-SUM(AS367:AT367) -> 0 | AV367: 1 | AW367: 0 | AX367: =1-SUM(AV367:AW367) -> 0 | AY367: 1 | AZ367: 0 | BA367: =1-SUM(AY367:AZ367) -> 0 | BB367: 1 | BC367: 0 | BD367: =1-SUM(BB367:BC367) -> 0 | BE367: 0 | BF367: 1 | BG367: =1-SUM(BE367:BF367) -> 0 | BH367: 0 | BI367: 1 | BJ367: =1-SUM(BH367:BI367) -> 0 | BK367: 0 | BL367: 1 | BM367: =1-SUM(BK367:BL367) -> 0 | BN367: 0 | BO367: =1-BN367 -> 1
O368: 1 | P368: 0 | Q368: =1-SUM(O368:P368) -> 0 | R368: 1 | S368: 0 | T368: =1-SUM(R368:S368) -> 0 | U368: 1 | V368: 0 | W368: =1-SUM(U368:V368) -> 0 | X368: 0 | Y368: 1 | Z368: =1-SUM(X368:Y368) -> 0 | AA368: 1 | AB368: 0 | AC368: =1-SUM(AA368:AB368) -> 0 | AD368: 0 | AE368: 1 | AF368: =1-SUM(AD368:AE368) -> 0 | AG368: 0 | AH368: 1 | AI368: =1-SUM(AG368:AH368) -> 0 | AJ368: 0 | AK368: 1 | AL368: =1-SUM(AJ368:AK368) -> 0 | AM368: 1 | AN368: 0 | AO368: =1-SUM(AM368:AN368) -> 0 | AP368: 0 | AQ368: 1 | AR368: =1-SUM(AP368:AQ368) -> 0 | AS368: 1 | AT368: 0 | AU368: =1-SUM(AS368:AT368) -> 0 | AV368: 1 | AW368: 0 | AX368: =1-SUM(AV368:AW368) -> 0 | AY368: 1 | AZ368: 0 | BA368: =1-SUM(AY368:AZ368) -> 0 | BB368: 0 | BC368: 1 | BD368: =1-SUM(BB368:BC368) -> 0 | BE368: 0 | BF368: 1 | BG368: =1-SUM(BE368:BF368) -> 0 | BH368: 0 | BI368: 1 | BJ368: =1-SUM(BH368:BI368) -> 0 | BK368: 0 | BL368: 1 | BM368: =1-SUM(BK368:BL368) -> 0 | BN368: 0 | BO368: =1-BN368 -> 1
O369: 1 | P369: 0 | Q369: =1-SUM(O369:P369) -> 0 | R369: 0 | S369: 1 | T369: =1-SUM(R369:S369) -> 0 | U369: 0 | V369: 1 | W369: =1-SUM(U369:V369) -> 0 | X369: 0 | Y369: 1 | Z369: =1-SUM(X369:Y369) -> 0 | AA369: 1 | AB369: 0 | AC369: =1-SUM(AA369:AB369) -> 0 | AD369: 1 | AE369: 0 | AF369: =1-SUM(AD369:AE369) -> 0 | AG369: 1 | AH369: 0 | AI369: =1-SUM(AG369:AH369) -> 0 | AJ369: 1 | AK369: 0 | AL369: =1-SUM(AJ369:AK369) -> 0 | AM369: 0 | AN369: 1 | AO369: =1-SUM(AM369:AN369) -> 0 | AP369: 0 | AQ369: 1 | AR369: =1-SUM(AP369:AQ369) -> 0 | AS369: 1 | AT369: 0 | AU369: =1-SUM(AS369:AT369) -> 0 | AV369: 1 | AW369: 0 | AX369: =1-SUM(AV369:AW369) -> 0 | AY369: 1 | AZ369: 0 | BA369: =1-SUM(AY369:AZ369) -> 0 | BB369: 0 | BC369: 1 | BD369: =1-SUM(BB369:BC369) -> 0 | BE369: 0 | BF369: 1 | BG369: =1-SUM(BE369:BF369) -> 0 | BH369: 0 | BI369: 1 | BJ369: =1-SUM(BH369:BI369) -> 0 | BK369: 1 | BL369: 0 | BM369: =1-SUM(BK369:BL369) -> 0 | BN369: 0 | BO369: =1-BN369 -> 1
O370: 1 | P370: 0 | Q370: =1-SUM(O370:P370) -> 0 | R370: 0 | S370: 1 | T370: =1-SUM(R370:S370) -> 0 | U370: 0 | V370: 1 | W370: =1-SUM(U370:V370) -> 0 | X370: 0 | Y370: 1 | Z370: =1-SUM(X370:Y370) -> 0 | AA370: 0 | AB370: 1 | AC370: =1-SUM(AA370:AB370) -> 0 | AD370: 0 | AE370: 1 | AF370: =1-SUM(AD370:AE370) -> 0 | AG370: 0 | AH370: 1 | AI370: =1-SUM(AG370:AH370) -> 0 | AJ370: 0 | AK370: 1 | AL370: =1-SUM(AJ370:AK370) -> 0 | AM370: 0 | AN370: 1 | AO370: =1-SUM(AM370:AN370) -> 0 | AP370: 0 | AQ370: 1 | AR370: =1-SUM(AP370:AQ370) -> 0 | AS370: 1 | AT370: 0 | AU370: =1-SUM(AS370:AT370) -> 0 | AV370: 0 | AW370: 1 | AX370: =1-SUM(AV370:AW370) -> 0 | AY370: 0 | AZ370: 1 | BA370: =1-SUM(AY370:AZ370) -> 0 | BB370: 1 | BC370: 0 | BD370: =1-SUM(BB370:BC370) -> 0 | BE370: 0 | BF370: 1 | BG370: =1-SUM(BE370:BF370) -> 0 | BH370: 1 | BI370: 0 | BJ370: =1-SUM(BH370:BI370) -> 0 | BK370: 0 | BL370: 1 | BM370: =1-SUM(BK370:BL370) -> 0 | BN370: 0 | BO370: =1-BN370 -> 1
O371: 1 | P371: 0 | Q371: =1-SUM(O371:P371) -> 0 | R371: 1 | S371: 0 | T371: =1-SUM(R371:S371) -> 0 | U371: 1 | V371: 0 | W371: =1-SUM(U371:V371) -> 0 | X371: 1 | Y371: 0 | Z371: =1-SUM(X371:Y371) -> 0 | AA371: 1 | AB371: 0 | AC371: =1-SUM(AA371:AB371) -> 0 | AD371: 0 | AE371: 1 | AF371: =1-SUM(AD371:AE371) -> 0 | AG371: 0 | AH371: 1 | AI371: =1-SUM(AG371:AH371) -> 0 | AJ371: 1 | AK371: 0 | AL371: =1-SUM(AJ371:AK371) -> 0 | AM371: 1 | AN371: 0 | AO371: =1-SUM(AM371:AN371) -> 0 | AP371: 0 | AQ371: 1 | AR371: =1-SUM(AP371:AQ371) -> 0 | AS371: 0 | AT371: 1 | AU371: =1-SUM(AS371:AT371) -> 0 | AV371: 1 | AW371: 0 | AX371: =1-SUM(AV371:AW371) -> 0 | AY371: 1 | AZ371: 0 | BA371: =1-SUM(AY371:AZ371) -> 0 | BB371: 0 | BC371: 1 | BD371: =1-SUM(BB371:BC371) -> 0 | BE371: 0 | BF371: 1 | BG371: =1-SUM(BE371:BF371) -> 0 | BH371: 0 | BI371: 1 | BJ371: =1-SUM(BH371:BI371) -> 0 | BK371: 0 | BL371: 1 | BM371: =1-SUM(BK371:BL371) -> 0 | BN371: 0 | BO371: =1-BN371 -> 1
O372: 1 | P372: 0 | Q372: =1-SUM(O372:P372) -> 0 | R372: 1 | S372: 0 | T372: =1-SUM(R372:S372) -> 0 | U372: 1 | V372: 0 | W372: =1-SUM(U372:V372) -> 0 | X372: 1 | Y372: 0 | Z372: =1-SUM(X372:Y372) -> 0 | AA372: 1 | AB372: 0 | AC372: =1-SUM(AA372:AB372) -> 0 | AD372: 0 | AE372: 1 | AF372: =1-SUM(AD372:AE372) -> 0 | AG372: 0 | AH372: 1 | AI372: =1-SUM(AG372:AH372) -> 0 | AJ372: 0 | AK372: 1 | AL372: =1-SUM(AJ372:AK372) -> 0 | AM372: 0 | AN372: 1 | AO372: =1-SUM(AM372:AN372) -> 0 | AP372: 0 | AQ372: 1 | AR372: =1-SUM(AP372:AQ372) -> 0 | AS372: 1 | AT372: 0 | AU372: =1-SUM(AS372:AT372) -> 0 | AV372: 1 | AW372: 0 | AX372: =1-SUM(AV372:AW372) -> 0 | AY372: 0 | AZ372: 1 | BA372: =1-SUM(AY372:AZ372) -> 0 | BB372: 0 | BC372: 1 | BD372: =1-SUM(BB372:BC372) -> 0 | BE372: 0 | BF372: 1 | BG372: =1-SUM(BE372:BF372) -> 0 | BH372: 1 | BI372: 0 | BJ372: =1-SUM(BH372:BI372) -> 0 | BK372: 0 | BL372: 1 | BM372: =1-SUM(BK372:BL372) -> 0 | BN372: 0 | BO372: =1-BN372 -> 1
O373: 1 | P373: 0 | Q373: =1-SUM(O373:P373) -> 0 | R373: 1 | S373: 0 | T373: =1-SUM(R373:S373) -> 0 | U373: 0 | V373: 1 | W373: =1-SUM(U373:V373) -> 0 | X373: 0 | Y373: 1 | Z373: =1-SUM(X373:Y373) -> 0 | AA373: 0 | AB373: 1 | AC373: =1-SUM(AA373:AB373) -> 0 | AD373: 0 | AE373: 1 | AF373: =1-SUM(AD373:AE373) -> 0 | AG373: 0 | AH373: 1 | AI373: =1-SUM(AG373:AH373) -> 0 | AJ373: 0 | AK373: 1 | AL373: =1-SUM(AJ373:AK373) -> 0 | AM373: 0 | AN373: 1 | AO373: =1-SUM(AM373:AN373) -> 0 | AP373: 0 | AQ373: 1 | AR373: =1-SUM(AP373:AQ373) -> 0 | AS373: 0 | AT373: 1 | AU373: =1-SUM(AS373:AT373) -> 0 | AV373: 0 | AW373: 1 | AX373: =1-SUM(AV373:AW373) -> 0 | AY373: 0 | AZ373: 1 | BA373: =1-SUM(AY373:AZ373) -> 0 | BB373: 0 | BC373: 1 | BD373: =1-SUM(BB373:BC373) -> 0 | BE373: 0 | BF373: 1 | BG373: =1-SUM(BE373:BF373) -> 0 | BH373: 0 | BI373: 1 | BJ373: =1-SUM(BH373:BI373) -> 0 | BK373: 0 | BL373: 1 | BM373: =1-SUM(BK373:BL373) -> 0 | BN373: 0 | BO373: =1-BN373 -> 1
O374: 0 | P374: 1 | Q374: =1-SUM(O374:P374) -> 0 | R374: 1 | S374: 0 | T374: =1-SUM(R374:S374) -> 0 | U374: 1 | V374: 0 | W374: =1-SUM(U374:V374) -> 0 | X374: 1 | Y374: 0 | Z374: =1-SUM(X374:Y374) -> 0 | AA374: 1 | AB374: 0 | AC374: =1-SUM(AA374:AB374) -> 0 | AD374: 0 | AE374: 1 | AF374: =1-SUM(AD374:AE374) -> 0 | AG374: 0 | AH374: 1 | AI374: =1-SUM(AG374:AH374) -> 0 | AJ374: 0 | AK374: 1 | AL374: =1-SUM(AJ374:AK374) -> 0 | AM374: 1 | AN374: 0 | AO374: =1-SUM(AM374:AN374) -> 0 | AP374: 0 | AQ374: 1 | AR374: =1-SUM(AP374:AQ374) -> 0 | AS374: 0 | AT374: 1 | AU374: =1-SUM(AS374:AT374) -> 0 | AV374: 1 | AW374: 0 | AX374: =1-SUM(AV374:AW374) -> 0 | AY374: 0 | AZ374: 1 | BA374: =1-SUM(AY374:AZ374) -> 0 | BB374: 0 | BC374: 1 | BD374: =1-SUM(BB374:BC374) -> 0 | BE374: 0 | BF374: 1 | BG374: =1-SUM(BE374:BF374) -> 0 | BH374: 0 | BI374: 1 | BJ374: =1-SUM(BH374:BI374) -> 0 | BK374: 0 | BL374: 1 | BM374: =1-SUM(BK374:BL374) -> 0 | BN374: 1 | BO374: =1-BN374 -> 0
O375: 1 | P375: 0 | Q375: =1-SUM(O375:P375) -> 0 | R375: 1 | S375: 0 | T375: =1-SUM(R375:S375) -> 0 | U375: 1 | V375: 0 | W375: =1-SUM(U375:V375) -> 0 | X375: 0 | Y375: 1 | Z375: =1-SUM(X375:Y375) -> 0 | AA375: 1 | AB375: 0 | AC375: =1-SUM(AA375:AB375) -> 0 | AD375: 0 | AE375: 1 | AF375: =1-SUM(AD375:AE375) -> 0 | AG375: 0 | AH375: 1 | AI375: =1-SUM(AG375:AH375) -> 0 | AJ375: 1 | AK375: 0 | AL375: =1-SUM(AJ375:AK375) -> 0 | AM375: 1 | AN375: 0 | AO375: =1-SUM(AM375:AN375) -> 0 | AP375: 0 | AQ375: 1 | AR375: =1-SUM(AP375:AQ375) -> 0 | AS375: 0 | AT375: 1 | AU375: =1-SUM(AS375:AT375) -> 0 | AV375: 1 | AW375: 0 | AX375: =1-SUM(AV375:AW375) -> 0 | AY375: 0 | AZ375: 1 | BA375: =1-SUM(AY375:AZ375) -> 0 | BB375: 0 | BC375: 1 | BD375: =1-SUM(BB375:BC375) -> 0 | BE375: 1 | BF375: 0 | BG375: =1-SUM(BE375:BF375) -> 0 | BH375: 0 | BI375: 1 | BJ375: =1-SUM(BH375:BI375) -> 0 | BK375: 0 | BL375: 1 | BM375: =1-SUM(BK375:BL375) -> 0 | BN375: 1 | BO375: =1-BN375 -> 0
O376: 1 | P376: 0 | Q376: =1-SUM(O376:P376) -> 0 | R376: 1 | S376: 0 | T376: =1-SUM(R376:S376) -> 0 | U376: 1 | V376: 0 | W376: =1-SUM(U376:V376) -> 0 | X376: 0 | Y376: 1 | Z376: =1-SUM(X376:Y376) -> 0 | AA376: 1 | AB376: 0 | AC376: =1-SUM(AA376:AB376) -> 0 | AD376: 0 | AE376: 1 | AF376: =1-SUM(AD376:AE376) -> 0 | AG376: 0 | AH376: 1 | AI376: =1-SUM(AG376:AH376) -> 0 | AJ376: 1 | AK376: 0 | AL376: =1-SUM(AJ376:AK376) -> 0 | AM376: 1 | AN376: 0 | AO376: =1-SUM(AM376:AN376) -> 0 | AP376: 0 | AQ376: 1 | AR376: =1-SUM(AP376:AQ376) -> 0 | AS376: 0 | AT376: 1 | AU376: =1-SUM(AS376:AT376) -> 0 | AV376: 1 | AW376: 0 | AX376: =1-SUM(AV376:AW376) -> 0 | AY376: 0 | AZ376: 1 | BA376: =1-SUM(AY376:AZ376) -> 0 | BB376: 0 | BC376: 1 | BD376: =1-SUM(BB376:BC376) -> 0 | BE376: 1 | BF376: 0 | BG376: =1-SUM(BE376:BF376) -> 0 | BH376: 0 | BI376: 1 | BJ376: =1-SUM(BH376:BI376) -> 0 | BK376: 0 | BL376: 1 | BM376: =1-SUM(BK376:BL376) -> 0 | BN376: 1 | BO376: =1-BN376 -> 0
O377: 1 | P377: 0 | Q377: =1-SUM(O377:P377) -> 0 | R377: 1 | S377: 0 | T377: =1-SUM(R377:S377) -> 0 | U377: 1 | V377: 0 | W377: =1-SUM(U377:V377) -> 0 | X377: 1 | Y377: 0 | Z377: =1-SUM(X377:Y377) -> 0 | AA377: 0 | AB377: 1 | AC377: =1-SUM(AA377:AB377) -> 0 | AD377: 0 | AE377: 1 | AF377: =1-SUM(AD377:AE377) -> 0 | AG377: 0 | AH377: 1 | AI377: =1-SUM(AG377:AH377) -> 0 | AJ377: 1 | AK377: 0 | AL377: =1-SUM(AJ377:AK377) -> 0 | AM377: 0 | AN377: 1 | AO377: =1-SUM(AM377:AN377) -> 0 | AP377: 0 | AQ377: 1 | AR377: =1-SUM(AP377:AQ377) -> 0 | AS377: 0 | AT377: 1 | AU377: =1-SUM(AS377:AT377) -> 0 | AV377: 0 | AW377: 1 | AX377: =1-SUM(AV377:AW377) -> 0 | AY377: 0 | AZ377: 1 | BA377: =1-SUM(AY377:AZ377) -> 0 | BB377: 0 | BC377: 1 | BD377: =1-SUM(BB377:BC377) -> 0 | BE377: 0 | BF377: 1 | BG377: =1-SUM(BE377:BF377) -> 0 | BH377: 0 | BI377: 1 | BJ377: =1-SUM(BH377:BI377) -> 0 | BK377: 0 | BL377: 1 | BM377: =1-SUM(BK377:BL377) -> 0 | BN377: 1 | BO377: =1-BN377 -> 0
O378: 1 | P378: 0 | Q378: =1-SUM(O378:P378) -> 0 | R378: 1 | S378: 0 | T378: =1-SUM(R378:S378) -> 0 | U378: 1 | V378: 0 | W378: =1-SUM(U378:V378) -> 0 | X378: 1 | Y378: 0 | Z378: =1-SUM(X378:Y378) -> 0 | AA378: 0 | AB378: 1 | AC378: =1-SUM(AA378:AB378) -> 0 | AD378: 0 | AE378: 1 | AF378: =1-SUM(AD378:AE378) -> 0 | AG378: 0 | AH378: 1 | AI378: =1-SUM(AG378:AH378) -> 0 | AJ378: 1 | AK378: 0 | AL378: =1-SUM(AJ378:AK378) -> 0 | AM378: 0 | AN378: 1 | AO378: =1-SUM(AM378:AN378) -> 0 | AP378: 0 | AQ378: 1 | AR378: =1-SUM(AP378:AQ378) -> 0 | AS378: 0 | AT378: 1 | AU378: =1-SUM(AS378:AT378) -> 0 | AV378: 0 | AW378: 1 | AX378: =1-SUM(AV378:AW378) -> 0 | AY378: 0 | AZ378: 1 | BA378: =1-SUM(AY378:AZ378) -> 0 | BB378: 0 | BC378: 1 | BD378: =1-SUM(BB378:BC378) -> 0 | BE378: 0 | BF378: 1 | BG378: =1-SUM(BE378:BF378) -> 0 | BH378: 0 | BI378: 1 | BJ378: =1-SUM(BH378:BI378) -> 0 | BK378: 0 | BL378: 1 | BM378: =1-SUM(BK378:BL378) -> 0 | BN378: 1 | BO378: =1-BN378 -> 0
O379: 1 | P379: 0 | Q379: =1-SUM(O379:P379) -> 0 | R379: 1 | S379: 0 | T379: =1-SUM(R379:S379) -> 0 | U379: 1 | V379: 0 | W379: =1-SUM(U379:V379) -> 0 | X379: 1 | Y379: 0 | Z379: =1-SUM(X379:Y379) -> 0 | AA379: 0 | AB379: 1 | AC379: =1-SUM(AA379:AB379) -> 0 | AD379: 0 | AE379: 1 | AF379: =1-SUM(AD379:AE379) -> 0 | AG379: 0 | AH379: 1 | AI379: =1-SUM(AG379:AH379) -> 0 | AJ379: 1 | AK379: 0 | AL379: =1-SUM(AJ379:AK379) -> 0 | AM379: 0 | AN379: 1 | AO379: =1-SUM(AM379:AN379) -> 0 | AP379: 0 | AQ379: 1 | AR379: =1-SUM(AP379:AQ379) -> 0 | AS379: 0 | AT379: 1 | AU379: =1-SUM(AS379:AT379) -> 0 | AV379: 0 | AW379: 1 | AX379: =1-SUM(AV379:AW379) -> 0 | AY379: 0 | AZ379: 1 | BA379: =1-SUM(AY379:AZ379) -> 0 | BB379: 0 | BC379: 1 | BD379: =1-SUM(BB379:BC379) -> 0 | BE379: 0 | BF379: 1 | BG379: =1-SUM(BE379:BF379) -> 0 | BH379: 0 | BI379: 1 | BJ379: =1-SUM(BH379:BI379) -> 0 | BK379: 0 | BL379: 1 | BM379: =1-SUM(BK379:BL379) -> 0 | BN379: 1 | BO379: =1-BN379 -> 0
O380: 1 | P380: 0 | Q380: =1-SUM(O380:P380) -> 0 | R380: 1 | S380: 0 | T380: =1-SUM(R380:S380) -> 0 | U380: 1 | V380: 0 | W380: =1-SUM(U380:V380) -> 0 | X380: 1 | Y380: 0 | Z380: =1-SUM(X380:Y380) -> 0 | AA380: 0 | AB380: 1 | AC380: =1-SUM(AA380:AB380) -> 0 | AD380: 0 | AE380: 1 | AF380: =1-SUM(AD380:AE380) -> 0 | AG380: 0 | AH380: 1 | AI380: =1-SUM(AG380:AH380) -> 0 | AJ380: 1 | AK380: 0 | AL380: =1-SUM(AJ380:AK380) -> 0 | AM380: 0 | AN380: 1 | AO380: =1-SUM(AM380:AN380) -> 0 | AP380: 0 | AQ380: 1 | AR380: =1-SUM(AP380:AQ380) -> 0 | AS380: 0 | AT380: 1 | AU380: =1-SUM(AS380:AT380) -> 0 | AV380: 0 | AW380: 1 | AX380: =1-SUM(AV380:AW380) -> 0 | AY380: 0 | AZ380: 1 | BA380: =1-SUM(AY380:AZ380) -> 0 | BB380: 0 | BC380: 1 | BD380: =1-SUM(BB380:BC380) -> 0 | BE380: 0 | BF380: 1 | BG380: =1-SUM(BE380:BF380) -> 0 | BH380: 0 | BI380: 1 | BJ380: =1-SUM(BH380:BI380) -> 0 | BK380: 0 | BL380: 1 | BM380: =1-SUM(BK380:BL380) -> 0 | BN380: 1 | BO380: =1-BN380 -> 0
O381: 1 | P381: 0 | Q381: =1-SUM(O381:P381) -> 0 | R381: 1 | S381: 0 | T381: =1-SUM(R381:S381) -> 0 | U381: 1 | V381: 0 | W381: =1-SUM(U381:V381) -> 0 | X381: 1 | Y381: 0 | Z381: =1-SUM(X381:Y381) -> 0 | AA381: 1 | AB381: 0 | AC381: =1-SUM(AA381:AB381) -> 0 | AD381: 1 | AE381: 0 | AF381: =1-SUM(AD381:AE381) -> 0 | AG381: 0 | AH381: 1 | AI381: =1-SUM(AG381:AH381) -> 0 | AJ381: 1 | AK381: 0 | AL381: =1-SUM(AJ381:AK381) -> 0 | AM381: 1 | AN381: 0 | AO381: =1-SUM(AM381:AN381) -> 0 | AP381: 0 | AQ381: 1 | AR381: =1-SUM(AP381:AQ381) -> 0 | AS381: 0 | AT381: 1 | AU381: =1-SUM(AS381:AT381) -> 0 | AV381: 1 | AW381: 0 | AX381: =1-SUM(AV381:AW381) -> 0 | AY381: 0 | AZ381: 1 | BA381: =1-SUM(AY381:AZ381) -> 0 | BB381: 1 | BC381: 0 | BD381: =1-SUM(BB381:BC381) -> 0 | BE381: 0 | BF381: 1 | BG381: =1-SUM(BE381:BF381) -> 0 | BH381: 0 | BI381: 1 | BJ381: =1-SUM(BH381:BI381) -> 0 | BK381: 0 | BL381: 1 | BM381: =1-SUM(BK381:BL381) -> 0 | BN381: 1 | BO381: =1-BN381 -> 0
O382: 1 | P382: 0 | Q382: =1-SUM(O382:P382) -> 0 | R382: 1 | S382: 0 | T382: =1-SUM(R382:S382) -> 0 | U382: 1 | V382: 0 | W382: =1-SUM(U382:V382) -> 0 | X382: 1 | Y382: 0 | Z382: =1-SUM(X382:Y382) -> 0 | AA382: 1 | AB382: 0 | AC382: =1-SUM(AA382:AB382) -> 0 | AD382: 1 | AE382: 0 | AF382: =1-SUM(AD382:AE382) -> 0 | AG382: 0 | AH382: 1 | AI382: =1-SUM(AG382:AH382) -> 0 | AJ382: 1 | AK382: 0 | AL382: =1-SUM(AJ382:AK382) -> 0 | AM382: 1 | AN382: 0 | AO382: =1-SUM(AM382:AN382) -> 0 | AP382: 0 | AQ382: 1 | AR382: =1-SUM(AP382:AQ382) -> 0 | AS382: 0 | AT382: 1 | AU382: =1-SUM(AS382:AT382) -> 0 | AV382: 1 | AW382: 0 | AX382: =1-SUM(AV382:AW382) -> 0 | AY382: 0 | AZ382: 1 | BA382: =1-SUM(AY382:AZ382) -> 0 | BB382: 0 | BC382: 1 | BD382: =1-SUM(BB382:BC382) -> 0 | BE382: 0 | BF382: 1 | BG382: =1-SUM(BE382:BF382) -> 0 | BH382: 0 | BI382: 1 | BJ382: =1-SUM(BH382:BI382) -> 0 | BK382: 0 | BL382: 1 | BM382: =1-SUM(BK382:BL382) -> 0 | BN382: 1 | BO382: =1-BN382 -> 0
O383: 1 | P383: 0 | Q383: =1-SUM(O383:P383) -> 0 | R383: 1 | S383: 0 | T383: =1-SUM(R383:S383) -> 0 | U383: 1 | V383: 0 | W383: =1-SUM(U383:V383) -> 0 | X383: 1 | Y383: 0 | Z383: =1-SUM(X383:Y383) -> 0 | AA383: 0 | AB383: 1 | AC383: =1-SUM(AA383:AB383) -> 0 | AD383: 0 | AE383: 1 | AF383: =1-SUM(AD383:AE383) -> 0 | AG383: 0 | AH383: 1 | AI383: =1-SUM(AG383:AH383) -> 0 | AJ383: 1 | AK383: 0 | AL383: =1-SUM(AJ383:AK383) -> 0 | AM383: 0 | AN383: 1 | AO383: =1-SUM(AM383:AN383) -> 0 | AP383: 0 | AQ383: 1 | AR383: =1-SUM(AP383:AQ383) -> 0 | AS383: 0 | AT383: 1 | AU383: =1-SUM(AS383:AT383) -> 0 | AV383: 1 | AW383: 0 | AX383: =1-SUM(AV383:AW383) -> 0 | AY383: 0 | AZ383: 1 | BA383: =1-SUM(AY383:AZ383) -> 0 | BB383: 0 | BC383: 1 | BD383: =1-SUM(BB383:BC383) -> 0 | BE383: 0 | BF383: 1 | BG383: =1-SUM(BE383:BF383) -> 0 | BH383: 0 | BI383: 1 | BJ383: =1-SUM(BH383:BI383) -> 0 | BK383: 0 | BL383: 1 | BM383: =1-SUM(BK383:BL383) -> 0 | BN383: 0 | BO383: =1-BN383 -> 1
O384: 1 | P384: 0 | Q384: =1-SUM(O384:P384) -> 0 | R384: 0 | S384: 1 | T384: =1-SUM(R384:S384) -> 0 | U384: 0 | V384: 1 | W384: =1-SUM(U384:V384) -> 0 | X384: 0 | Y384: 1 | Z384: =1-SUM(X384:Y384) -> 0 | AA384: 1 | AB384: 0 | AC384: =1-SUM(AA384:AB384) -> 0 | AD384: 0 | AE384: 1 | AF384: =1-SUM(AD384:AE384) -> 0 | AG384: 0 | AH384: 1 | AI384: =1-SUM(AG384:AH384) -> 0 | AJ384: 1 | AK384: 0 | AL384: =1-SUM(AJ384:AK384) -> 0 | AM384: 1 | AN384: 0 | AO384: =1-SUM(AM384:AN384) -> 0 | AP384: 0 | AQ384: 1 | AR384: =1-SUM(AP384:AQ384) -> 0 | AS384: 1 | AT384: 0 | AU384: =1-SUM(AS384:AT384) -> 0 | AV384: 0 | AW384: 1 | AX384: =1-SUM(AV384:AW384) -> 0 | AY384: 0 | AZ384: 1 | BA384: =1-SUM(AY384:AZ384) -> 0 | BB384: 0 | BC384: 1 | BD384: =1-SUM(BB384:BC384) -> 0 | BE384: 1 | BF384: 0 | BG384: =1-SUM(BE384:BF384) -> 0 | BH384: 0 | BI384: 1 | BJ384: =1-SUM(BH384:BI384) -> 0 | BK384: 1 | BL384: 0 | BM384: =1-SUM(BK384:BL384) -> 0 | BN384: 1 | BO384: =1-BN384 -> 0
O385: 1 | P385: 0 | Q385: =1-SUM(O385:P385) -> 0 | R385: 0 | S385: 1 | T385: =1-SUM(R385:S385) -> 0 | U385: 0 | V385: 1 | W385: =1-SUM(U385:V385) -> 0 | X385: 0 | Y385: 1 | Z385: =1-SUM(X385:Y385) -> 0 | AA385: 1 | AB385: 0 | AC385: =1-SUM(AA385:AB385) -> 0 | AD385: 0 | AE385: 1 | AF385: =1-SUM(AD385:AE385) -> 0 | AG385: 0 | AH385: 1 | AI385: =1-SUM(AG385:AH385) -> 0 | AJ385: 1 | AK385: 0 | AL385: =1-SUM(AJ385:AK385) -> 0 | AM385: 1 | AN385: 0 | AO385: =1-SUM(AM385:AN385) -> 0 | AP385: 0 | AQ385: 1 | AR385: =1-SUM(AP385:AQ385) -> 0 | AS385: 0 | AT385: 1 | AU385: =1-SUM(AS385:AT385) -> 0 | AV385: 0 | AW385: 1 | AX385: =1-SUM(AV385:AW385) -> 0 | AY385: 0 | AZ385: 1 | BA385: =1-SUM(AY385:AZ385) -> 0 | BB385: 0 | BC385: 1 | BD385: =1-SUM(BB385:BC385) -> 0 | BE385: 0 | BF385: 1 | BG385: =1-SUM(BE385:BF385) -> 0 | BH385: 0 | BI385: 1 | BJ385: =1-SUM(BH385:BI385) -> 0 | BK385: 0 | BL385: 1 | BM385: =1-SUM(BK385:BL385) -> 0 | BN385: 1 | BO385: =1-BN385 -> 0
O386: 1 | P386: 0 | Q386: =1-SUM(O386:P386) -> 0 | R386: 1 | S386: 0 | T386: =1-SUM(R386:S386) -> 0 | U386: 1 | V386: 0 | W386: =1-SUM(U386:V386) -> 0 | X386: 1 | Y386: 0 | Z386: =1-SUM(X386:Y386) -> 0 | AA386: 1 | AB386: 0 | AC386: =1-SUM(AA386:AB386) -> 0 | AD386: 0 | AE386: 1 | AF386: =1-SUM(AD386:AE386) -> 0 | AG386: 0 | AH386: 1 | AI386: =1-SUM(AG386:AH386) -> 0 | AJ386: 1 | AK386: 0 | AL386: =1-SUM(AJ386:AK386) -> 0 | AM386: 1 | AN386: 0 | AO386: =1-SUM(AM386:AN386) -> 0 | AP386: 0 | AQ386: 1 | AR386: =1-SUM(AP386:AQ386) -> 0 | AS386: 1 | AT386: 0 | AU386: =1-SUM(AS386:AT386) -> 0 | AV386: 1 | AW386: 0 | AX386: =1-SUM(AV386:AW386) -> 0 | AY386: 1 | AZ386: 0 | BA386: =1-SUM(AY386:AZ386) -> 0 | BB386: 1 | BC386: 0 | BD386: =1-SUM(BB386:BC386) -> 0 | BE386: 0 | BF386: 1 | BG386: =1-SUM(BE386:BF386) -> 0 | BH386: 0 | BI386: 1 | BJ386: =1-SUM(BH386:BI386) -> 0 | BK386: 0 | BL386: 1 | BM386: =1-SUM(BK386:BL386) -> 0 | BN386: 1 | BO386: =1-BN386 -> 0
O387: 1 | P387: 0 | Q387: =1-SUM(O387:P387) -> 0 | R387: 1 | S387: 0 | T387: =1-SUM(R387:S387) -> 0 | U387: 1 | V387: 0 | W387: =1-SUM(U387:V387) -> 0 | X387: 1 | Y387: 0 | Z387: =1-SUM(X387:Y387) -> 0 | AA387: 1 | AB387: 0 | AC387: =1-SUM(AA387:AB387) -> 0 | AD387: 0 | AE387: 1 | AF387: =1-SUM(AD387:AE387) -> 0 | AG387: 0 | AH387: 1 | AI387: =1-SUM(AG387:AH387) -> 0 | AJ387: 1 | AK387: 0 | AL387: =1-SUM(AJ387:AK387) -> 0 | AM387: 1 | AN387: 0 | AO387: =1-SUM(AM387:AN387) -> 0 | AP387: 0 | AQ387: 1 | AR387: =1-SUM(AP387:AQ387) -> 0 | AS387: 1 | AT387: 0 | AU387: =1-SUM(AS387:AT387) -> 0 | AV387: 1 | AW387: 0 | AX387: =1-SUM(AV387:AW387) -> 0 | AY387: 1 | AZ387: 0 | BA387: =1-SUM(AY387:AZ387) -> 0 | BB387: 1 | BC387: 0 | BD387: =1-SUM(BB387:BC387) -> 0 | BE387: 0 | BF387: 1 | BG387: =1-SUM(BE387:BF387) -> 0 | BH387: 0 | BI387: 1 | BJ387: =1-SUM(BH387:BI387) -> 0 | BK387: 0 | BL387: 1 | BM387: =1-SUM(BK387:BL387) -> 0 | BN387: 1 | BO387: =1-BN387 -> 0
O388: 1 | P388: 0 | Q388: =1-SUM(O388:P388) -> 0 | R388: 0 | S388: 1 | T388: =1-SUM(R388:S388) -> 0 | U388: 0 | V388: 1 | W388: =1-SUM(U388:V388) -> 0 | X388: 0 | Y388: 1 | Z388: =1-SUM(X388:Y388) -> 0 | AA388: 1 | AB388: 0 | AC388: =1-SUM(AA388:AB388) -> 0 | AD388: 0 | AE388: 1 | AF388: =1-SUM(AD388:AE388) -> 0 | AG388: 0 | AH388: 1 | AI388: =1-SUM(AG388:AH388) -> 0 | AJ388: 1 | AK388: 0 | AL388: =1-SUM(AJ388:AK388) -> 0 | AM388: 1 | AN388: 0 | AO388: =1-SUM(AM388:AN388) -> 0 | AP388: 0 | AQ388: 1 | AR388: =1-SUM(AP388:AQ388) -> 0 | AS388: 1 | AT388: 0 | AU388: =1-SUM(AS388:AT388) -> 0 | AV388: 1 | AW388: 0 | AX388: =1-SUM(AV388:AW388) -> 0 | AY388: 1 | AZ388: 0 | BA388: =1-SUM(AY388:AZ388) -> 0 | BB388: 1 | BC388: 0 | BD388: =1-SUM(BB388:BC388) -> 0 | BE388: 1 | BF388: 0 | BG388: =1-SUM(BE388:BF388) -> 0 | BH388: 0 | BI388: 1 | BJ388: =1-SUM(BH388:BI388) -> 0 | BK388: 0 | BL388: 1 | BM388: =1-SUM(BK388:BL388) -> 0 | BN388: 1 | BO388: =1-BN388 -> 0
O389: 1 | P389: 0 | Q389: =1-SUM(O389:P389) -> 0 | R389: 1 | S389: 0 | T389: =1-SUM(R389:S389) -> 0 | U389: 1 | V389: 0 | W389: =1-SUM(U389:V389) -> 0 | X389: 0 | Y389: 1 | Z389: =1-SUM(X389:Y389) -> 0 | AA389: 0 | AB389: 1 | AC389: =1-SUM(AA389:AB389) -> 0 | AD389: 0 | AE389: 1 | AF389: =1-SUM(AD389:AE389) -> 0 | AG389: 0 | AH389: 1 | AI389: =1-SUM(AG389:AH389) -> 0 | AJ389: 1 | AK389: 0 | AL389: =1-SUM(AJ389:AK389) -> 0 | AM389: 0 | AN389: 1 | AO389: =1-SUM(AM389:AN389) -> 0 | AP389: 0 | AQ389: 1 | AR389: =1-SUM(AP389:AQ389) -> 0 | AS389: 0 | AT389: 1 | AU389: =1-SUM(AS389:AT389) -> 0 | AV389: 0 | AW389: 1 | AX389: =1-SUM(AV389:AW389) -> 0 | AY389: 0 | AZ389: 1 | BA389: =1-SUM(AY389:AZ389) -> 0 | BB389: 0 | BC389: 1 | BD389: =1-SUM(BB389:BC389) -> 0 | BE389: 0 | BF389: 1 | BG389: =1-SUM(BE389:BF389) -> 0 | BH389: 0 | BI389: 1 | BJ389: =1-SUM(BH389:BI389) -> 0 | BK389: 0 | BL389: 1 | BM389: =1-SUM(BK389:BL389) -> 0 | BN389: 1 | BO389: =1-BN389 -> 0
O390: 1 | P390: 0 | Q390: =1-SUM(O390:P390) -> 0 | R390: 1 | S390: 0 | T390: =1-SUM(R390:S390) -> 0 | U390: 1 | V390: 0 | W390: =1-SUM(U390:V390) -> 0 | X390: 0 | Y390: 1 | Z390: =1-SUM(X390:Y390) -> 0 | AA390: 0 | AB390: 1 | AC390: =1-SUM(AA390:AB390) -> 0 | AD390: 0 | AE390: 1 | AF390: =1-SUM(AD390:AE390) -> 0 | AG390: 0 | AH390: 1 | AI390: =1-SUM(AG390:AH390) -> 0 | AJ390: 0 | AK390: 1 | AL390: =1-SUM(AJ390:AK390) -> 0 | AM390: 0 | AN390: 1 | AO390: =1-SUM(AM390:AN390) -> 0 | AP390: 0 | AQ390: 1 | AR390: =1-SUM(AP390:AQ390) -> 0 | AS390: 0 | AT390: 1 | AU390: =1-SUM(AS390:AT390) -> 0 | AV390: 0 | AW390: 1 | AX390: =1-SUM(AV390:AW390) -> 0 | AY390: 0 | AZ390: 1 | BA390: =1-SUM(AY390:AZ390) -> 0 | BB390: 0 | BC390: 1 | BD390: =1-SUM(BB390:BC390) -> 0 | BE390: 0 | BF390: 1 | BG390: =1-SUM(BE390:BF390) -> 0 | BH390: 0 | BI390: 1 | BJ390: =1-SUM(BH390:BI390) -> 0 | BK390: 0 | BL390: 1 | BM390: =1-SUM(BK390:BL390) -> 0 | BN390: 1 | BO390: =1-BN390 -> 0
O391: 1 | P391: 0 | Q391: =1-SUM(O391:P391) -> 0 | R391: 1 | S391: 0 | T391: =1-SUM(R391:S391) -> 0 | U391: 1 | V391: 0 | W391: =1-SUM(U391:V391) -> 0 | X391: 1 | Y391: 0 | Z391: =1-SUM(X391:Y391) -> 0 | AA391: 1 | AB391: 0 | AC391: =1-SUM(AA391:AB391) -> 0 | AD391: 0 | AE391: 1 | AF391: =1-SUM(AD391:AE391) -> 0 | AG391: 0 | AH391: 1 | AI391: =1-SUM(AG391:AH391) -> 0 | AJ391: 0 | AK391: 1 | AL391: =1-SUM(AJ391:AK391) -> 0 | AM391: 0 | AN391: 1 | AO391: =1-SUM(AM391:AN391) -> 0 | AP391: 0 | AQ391: 1 | AR391: =1-SUM(AP391:AQ391) -> 0 | AS391: 0 | AT391: 1 | AU391: =1-SUM(AS391:AT391) -> 0 | AV391: 1 | AW391: 0 | AX391: =1-SUM(AV391:AW391) -> 0 | AY391: 0 | AZ391: 1 | BA391: =1-SUM(AY391:AZ391) -> 0 | BB391: 0 | BC391: 1 | BD391: =1-SUM(BB391:BC391) -> 0 | BE391: 0 | BF391: 1 | BG391: =1-SUM(BE391:BF391) -> 0 | BH391: 0 | BI391: 1 | BJ391: =1-SUM(BH391:BI391) -> 0 | BK391: 0 | BL391: 1 | BM391: =1-SUM(BK391:BL391) -> 0 | BN391: 0 | BO391: =1-BN391 -> 1
O392: 1 | P392: 0 | Q392: =1-SUM(O392:P392) -> 0 | R392: 1 | S392: 0 | T392: =1-SUM(R392:S392) -> 0 | U392: 0 | V392: 1 | W392: =1-SUM(U392:V392) -> 0 | X392: 0 | Y392: 1 | Z392: =1-SUM(X392:Y392) -> 0 | AA392: 0 | AB392: 1 | AC392: =1-SUM(AA392:AB392) -> 0 | AD392: 1 | AE392: 0 | AF392: =1-SUM(AD392:AE392) -> 0 | AG392: 1 | AH392: 0 | AI392: =1-SUM(AG392:AH392) -> 0 | AJ392: 0 | AK392: 1 | AL392: =1-SUM(AJ392:AK392) -> 0 | AM392: 0 | AN392: 1 | AO392: =1-SUM(AM392:AN392) -> 0 | AP392: 0 | AQ392: 1 | AR392: =1-SUM(AP392:AQ392) -> 0 | AS392: 0 | AT392: 1 | AU392: =1-SUM(AS392:AT392) -> 0 | AV392: 0 | AW392: 1 | AX392: =1-SUM(AV392:AW392) -> 0 | AY392: 1 | AZ392: 0 | BA392: =1-SUM(AY392:AZ392) -> 0 | BB392: 0 | BC392: 1 | BD392: =1-SUM(BB392:BC392) -> 0 | BE392: 0 | BF392: 1 | BG392: =1-SUM(BE392:BF392) -> 0 | BH392: 0 | BI392: 1 | BJ392: =1-SUM(BH392:BI392) -> 0 | BK392: 0 | BL392: 1 | BM392: =1-SUM(BK392:BL392) -> 0 | BN392: 0 | BO392: =1-BN392 -> 1
O393: 1 | P393: 0 | Q393: =1-SUM(O393:P393) -> 0 | R393: 1 | S393: 0 | T393: =1-SUM(R393:S393) -> 0 | U393: 1 | V393: 0 | W393: =1-SUM(U393:V393) -> 0 | X393: 1 | Y393: 0 | Z393: =1-SUM(X393:Y393) -> 0 | AA393: 1 | AB393: 0 | AC393: =1-SUM(AA393:AB393) -> 0 | AD393: 0 | AE393: 1 | AF393: =1-SUM(AD393:AE393) -> 0 | AG393: 0 | AH393: 1 | AI393: =1-SUM(AG393:AH393) -> 0 | AJ393: 0 | AK393: 1 | AL393: =1-SUM(AJ393:AK393) -> 0 | AM393: 0 | AN393: 1 | AO393: =1-SUM(AM393:AN393) -> 0 | AP393: 0 | AQ393: 1 | AR393: =1-SUM(AP393:AQ393) -> 0 | AS393: 0 | AT393: 1 | AU393: =1-SUM(AS393:AT393) -> 0 | AV393: 1 | AW393: 0 | AX393: =1-SUM(AV393:AW393) -> 0 | AY393: 0 | AZ393: 1 | BA393: =1-SUM(AY393:AZ393) -> 0 | BB393: 0 | BC393: 1 | BD393: =1-SUM(BB393:BC393) -> 0 | BE393: 0 | BF393: 1 | BG393: =1-SUM(BE393:BF393) -> 0 | BH393: 1 | BI393: 0 | BJ393: =1-SUM(BH393:BI393) -> 0 | BK393: 0 | BL393: 1 | BM393: =1-SUM(BK393:BL393) -> 0 | BN393: 0 | BO393: =1-BN393 -> 1
O394: 1 | P394: 0 | Q394: =1-SUM(O394:P394) -> 0 | R394: 1 | S394: 0 | T394: =1-SUM(R394:S394) -> 0 | U394: 0 | V394: 1 | W394: =1-SUM(U394:V394) -> 0 | X394: 0 | Y394: 1 | Z394: =1-SUM(X394:Y394) -> 0 | AA394: 0 | AB394: 1 | AC394: =1-SUM(AA394:AB394) -> 0 | AD394: 0 | AE394: 1 | AF394: =1-SUM(AD394:AE394) -> 0 | AG394: 0 | AH394: 1 | AI394: =1-SUM(AG394:AH394) -> 0 | AJ394: 0 | AK394: 1 | AL394: =1-SUM(AJ394:AK394) -> 0 | AM394: 0 | AN394: 1 | AO394: =1-SUM(AM394:AN394) -> 0 | AP394: 0 | AQ394: 1 | AR394: =1-SUM(AP394:AQ394) -> 0 | AS394: 0 | AT394: 1 | AU394: =1-SUM(AS394:AT394) -> 0 | AV394: 0 | AW394: 1 | AX394: =1-SUM(AV394:AW394) -> 0 | AY394: 0 | AZ394: 1 | BA394: =1-SUM(AY394:AZ394) -> 0 | BB394: 0 | BC394: 1 | BD394: =1-SUM(BB394:BC394) -> 0 | BE394: 0 | BF394: 1 | BG394: =1-SUM(BE394:BF394) -> 0 | BH394: 0 | BI394: 1 | BJ394: =1-SUM(BH394:BI394) -> 0 | BK394: 0 | BL394: 1 | BM394: =1-SUM(BK394:BL394) -> 0 | BN394: 0 | BO394: =1-BN394 -> 1
O395: 1 | P395: 0 | Q395: =1-SUM(O395:P395) -> 0 | R395: 1 | S395: 0 | T395: =1-SUM(R395:S395) -> 0 | U395: 1 | V395: 0 | W395: =1-SUM(U395:V395) -> 0 | X395: 0 | Y395: 1 | Z395: =1-SUM(X395:Y395) -> 0 | AA395: 0 | AB395: 1 | AC395: =1-SUM(AA395:AB395) -> 0 | AD395: 0 | AE395: 1 | AF395: =1-SUM(AD395:AE395) -> 0 | AG395: 0 | AH395: 1 | AI395: =1-SUM(AG395:AH395) -> 0 | AJ395: 0 | AK395: 1 | AL395: =1-SUM(AJ395:AK395) -> 0 | AM395: 0 | AN395: 1 | AO395: =1-SUM(AM395:AN395) -> 0 | AP395: 0 | AQ395: 1 | AR395: =1-SUM(AP395:AQ395) -> 0 | AS395: 0 | AT395: 1 | AU395: =1-SUM(AS395:AT395) -> 0 | AV395: 0 | AW395: 1 | AX395: =1-SUM(AV395:AW395) -> 0 | AY395: 0 | AZ395: 1 | BA395: =1-SUM(AY395:AZ395) -> 0 | BB395: 0 | BC395: 1 | BD395: =1-SUM(BB395:BC395) -> 0 | BE395: 0 | BF395: 1 | BG395: =1-SUM(BE395:BF395) -> 0 | BH395: 0 | BI395: 1 | BJ395: =1-SUM(BH395:BI395) -> 0 | BK395: 0 | BL395: 1 | BM395: =1-SUM(BK395:BL395) -> 0 | BN395: 1 | BO395: =1-BN395 -> 0
O396: 1 | P396: 0 | Q396: =1-SUM(O396:P396) -> 0 | R396: 1 | S396: 0 | T396: =1-SUM(R396:S396) -> 0 | U396: 1 | V396: 0 | W396: =1-SUM(U396:V396) -> 0 | X396: 1 | Y396: 0 | Z396: =1-SUM(X396:Y396) -> 0 | AA396: 0 | AB396: 1 | AC396: =1-SUM(AA396:AB396) -> 0 | AD396: 0 | AE396: 1 | AF396: =1-SUM(AD396:AE396) -> 0 | AG396: 0 | AH396: 1 | AI396: =1-SUM(AG396:AH396) -> 0 | AJ396: 1 | AK396: 0 | AL396: =1-SUM(AJ396:AK396) -> 0 | AM396: 1 | AN396: 0 | AO396: =1-SUM(AM396:AN396) -> 0 | AP396: 0 | AQ396: 1 | AR396: =1-SUM(AP396:AQ396) -> 0 | AS396: 1 | AT396: 0 | AU396: =1-SUM(AS396:AT396) -> 0 | AV396: 0 | AW396: 1 | AX396: =1-SUM(AV396:AW396) -> 0 | AY396: 0 | AZ396: 1 | BA396: =1-SUM(AY396:AZ396) -> 0 | BB396: 0 | BC396: 1 | BD396: =1-SUM(BB396:BC396) -> 0 | BE396: 0 | BF396: 1 | BG396: =1-SUM(BE396:BF396) -> 0 | BH396: 0 | BI396: 1 | BJ396: =1-SUM(BH396:BI396) -> 0 | BK396: 0 | BL396: 1 | BM396: =1-SUM(BK396:BL396) -> 0 | BN396: 1 | BO396: =1-BN396 -> 0
O397: 1 | P397: 0 | Q397: =1-SUM(O397:P397) -> 0 | R397: 0 | S397: 1 | T397: =1-SUM(R397:S397) -> 0 | U397: 0 | V397: 1 | W397: =1-SUM(U397:V397) -> 0 | X397: 1 | Y397: 0 | Z397: =1-SUM(X397:Y397) -> 0 | AA397: 1 | AB397: 0 | AC397: =1-SUM(AA397:AB397) -> 0 | AD397: 0 | AE397: 1 | AF397: =1-SUM(AD397:AE397) -> 0 | AG397: 0 | AH397: 1 | AI397: =1-SUM(AG397:AH397) -> 0 | AJ397: 0 | AK397: 1 | AL397: =1-SUM(AJ397:AK397) -> 0 | AM397: 1 | AN397: 0 | AO397: =1-SUM(AM397:AN397) -> 0 | AP397: 0 | AQ397: 1 | AR397: =1-SUM(AP397:AQ397) -> 0 | AS397: 1 | AT397: 0 | AU397: =1-SUM(AS397:AT397) -> 0 | AV397: 1 | AW397: 0 | AX397: =1-SUM(AV397:AW397) -> 0 | AY397: 1 | AZ397: 0 | BA397: =1-SUM(AY397:AZ397) -> 0 | BB397: 1 | BC397: 0 | BD397: =1-SUM(BB397:BC397) -> 0 | BE397: 1 | BF397: 0 | BG397: =1-SUM(BE397:BF397) -> 0 | BH397: 0 | BI397: 1 | BJ397: =1-SUM(BH397:BI397) -> 0 | BK397: 0 | BL397: 1 | BM397: =1-SUM(BK397:BL397) -> 0 | BN397: 0 | BO397: =1-BN397 -> 1
O398: 1 | P398: 0 | Q398: =1-SUM(O398:P398) -> 0 | R398: 0 | S398: 1 | T398: =1-SUM(R398:S398) -> 0 | U398: 0 | V398: 1 | W398: =1-SUM(U398:V398) -> 0 | X398: 0 | Y398: 1 | Z398: =1-SUM(X398:Y398) -> 0 | AA398: 1 | AB398: 0 | AC398: =1-SUM(AA398:AB398) -> 0 | AD398: 0 | AE398: 1 | AF398: =1-SUM(AD398:AE398) -> 0 | AG398: 0 | AH398: 1 | AI398: =1-SUM(AG398:AH398) -> 0 | AJ398: 0 | AK398: 1 | AL398: =1-SUM(AJ398:AK398) -> 0 | AM398: 1 | AN398: 0 | AO398: =1-SUM(AM398:AN398) -> 0 | AP398: 0 | AQ398: 1 | AR398: =1-SUM(AP398:AQ398) -> 0 | AS398: 0 | AT398: 1 | AU398: =1-SUM(AS398:AT398) -> 0 | AV398: 1 | AW398: 0 | AX398: =1-SUM(AV398:AW398) -> 0 | AY398: 0 | AZ398: 1 | BA398: =1-SUM(AY398:AZ398) -> 0 | BB398: 0 | BC398: 1 | BD398: =1-SUM(BB398:BC398) -> 0 | BE398: 0 | BF398: 1 | BG398: =1-SUM(BE398:BF398) -> 0 | BH398: 0 | BI398: 1 | BJ398: =1-SUM(BH398:BI398) -> 0 | BK398: 0 | BL398: 1 | BM398: =1-SUM(BK398:BL398) -> 0 | BN398: 1 | BO398: =1-BN398 -> 0
O399: =SUM(O4:O398) -> 312 | P399: =SUM(P4:P398) -> 68 | Q399: =SUM(Q4:Q398) -> 14 | R399: =SUM(R4:R398) -> 209 | S399: =SUM(S4:S398) -> 171 | T399: =SUM(T4:T398) -> 14 | U399: =SUM(U4:U398) -> 158 | V399: =SUM(V4:V398) -> 218 | W399: =SUM(W4:W398) -> 18 | X399: =SUM(X4:X398) -> 155 | Y399: =SUM(Y4:Y398) -> 225 | Z399: =SUM(Z4:Z398) -> 14 | AA399: =SUM(AA4:AA398) -> 209 | AB399: =SUM(AB4:AB398) -> 170 | AC399: =SUM(AC4:AC398) -> 15 | AD399: =SUM(AD4:AD398) -> 68 | AE399: =SUM(AE4:AE398) -> 308 | AF399: =SUM(AF4:AF398) -> 18 | AG399: =SUM(AG4:AG398) -> 61 | AH399: =SUM(AH4:AH398) -> 315 | AI399: =SUM(AI4:AI398) -> 18 | AJ399: =SUM(AJ4:AJ398) -> 198 | AK399: =SUM(AK4:AK398) -> 182 | AL399: =SUM(AL4:AL398) -> 14 | AM399: =SUM(AM4:AM398) -> 157 | AN399: =SUM(AN4:AN398) -> 223 | AO399: =SUM(AO4:AO398) -> 14 | AP399: =SUM(AP4:AP398) -> 26 | AQ399: =SUM(AQ4:AQ398) -> 354 | AR399: =SUM(AR4:AR398) -> 14 | AS399: =SUM(AS4:AS398) -> 115 | AT399: =SUM(AT4:AT398) -> 262 | AU399: =SUM(AU4:AU398) -> 17 | AV399: =SUM(AV4:AV398) -> 168 | AW399: =SUM(AW4:AW398) -> 211 | AX399: =SUM(AX4:AX398) -> 15 | AY399: =SUM(AY4:AY398) -> 121 | AZ399: =SUM(AZ4:AZ398) -> 259 | BA399: =SUM(BA4:BA398) -> 14 | BB399: =SUM(BB4:BB398) -> 73 | BC399: =SUM(BC4:BC398) -> 307 | BD399: =SUM(BD4:BD398) -> 14 | BE399: =SUM(BE4:BE398) -> 86 | BF399: =SUM(BF4:BF398) -> 293 | BG399: =SUM(BG4:BG398) -> 15 | BH399: =SUM(BH4:BH398) -> 60 | BI399: =SUM(BI4:BI398) -> 317 | BJ399: =SUM(BJ4:BJ398) -> 17 | BK399: =SUM(BK4:BK398) -> 41 | BL399: =SUM(BL4:BL398) -> 339 | BM399: =SUM(BM4:BM398) -> 14 | BN399: =SUM(BN4:BN398) -> 182 | BO399: =SUM(BO4:BO398) -> 212