A1: Raggruppamenti dei Docenti
F2: INF/04 | G2: INF/05 | H2: MAT/05 | I2: MAT/06 | J2: MAT/08 | K2: MAT/09 | L2: S04A | M2: SECS-S/02 | N2: SECS-S/06 | O2: Straniero | P2: Contratto | Q2: Supplente | R2: str + contr | S2: altro
A3: Raggruppamento | C3: Numero corsi | E3: =SUM(F3:Q3)+S3 -> 394 | F3: =SUM(F4:F397) -> 1 | G3: =SUM(G4:G397) -> 3 | H3: =SUM(H4:H397) -> 6 | I3: =SUM(I4:I397) -> 3 | J3: =SUM(J4:J397) -> 3 | K3: =SUM(K4:K397) -> 332 | L3: =SUM(L4:L397) -> 1 | M3: =SUM(M4:M397) -> 1 | N3: =SUM(N4:N397) -> 14 | O3: =SUM(O4:O397) -> 2 | P3: =SUM(P4:P397) -> 1 | Q3: =SUM(Q4:Q397) -> 2 | R3: =SUM(O3:Q3) -> 5 | S3: =SUM(S4:S397) -> 25
A4: INF/04 | B4: AUTOMATICA | C4: =F3 -> 1 | F4: 0 | G4: 0 | H4: 0 | I4: 0 | J4: 0 | K4: 1 | L4: 0 | M4: 0 | N4: 0 | O4: 0 | P4: 0 | Q4: 0 | S4: =1-SUM(F4:Q4) -> 0
A5: INF/05 | B5: SISTEMI DI ELABORAZIONE DELLE INFORMAZIONI | C5: =G3 -> 3 | F5: 0 | G5: 0 | H5: 0 | I5: 0 | J5: 0 | K5: 1 | L5: 0 | M5: 0 | N5: 0 | O5: 0 | P5: 0 | Q5: 0 | S5: =1-SUM(F5:Q5) -> 0
A6: MAT/05 | B6: ANALISI MATEMATICA | C6: =H3 -> 6 | F6: 0 | G6: 0 | H6: 0 | I6: 0 | J6: 0 | K6: 1 | L6: 0 | M6: 0 | N6: 0 | O6: 0 | P6: 0 | Q6: 0 | S6: =1-SUM(F6:Q6) -> 0
A7: MAT/06 | B7: PROBABILITÀ E STATISTICA MATEMATICA | C7: =I3 -> 3 | F7: 0 | G7: 0 | H7: 0 | I7: 0 | J7: 0 | K7: 1 | L7: 0 | M7: 0 | N7: 0 | O7: 0 | P7: 0 | Q7: 0 | S7: =1-SUM(F7:Q7) -> 0
A8: MAT/08 | B8: ANALISI NUMERICA | C8: =J3 -> 3 | F8: 0 | G8: 0 | H8: 0 | I8: 0 | J8: 0 | K8: 1 | L8: 0 | M8: 0 | N8: 0 | O8: 0 | P8: 0 | Q8: 0 | S8: =1-SUM(F8:Q8) -> 0
A9: MAT/09 | B9: RICERCA OPERATIVA | C9: =K3 -> 332 | F9: 0 | G9: 0 | H9: 0 | I9: 0 | J9: 0 | K9: 1 | L9: 0 | M9: 0 | N9: 0 | O9: 0 | P9: 0 | Q9: 0 | S9: =1-SUM(F9:Q9) -> 0
A10: S04A | C10: =L3 -> 1 | F10: 0 | G10: 0 | H10: 0 | I10: 0 | J10: 0 | K10: 1 | L10: 0 | M10: 0 | N10: 0 | O10: 0 | P10: 0 | Q10: 0 | S10: =1-SUM(F10:Q10) -> 0
A11: SECS-S/02 | B11: STATISTICA PER LA RICERCA SPERIMENTALE E TECNOLOGICA | C11: =M3 -> 1 | F11: 0 | G11: 0 | H11: 0 | I11: 0 | J11: 0 | K11: 1 | L11: 0 | M11: 0 | N11: 0 | O11: 0 | P11: 0 | Q11: 0 | S11: =1-SUM(F11:Q11) -> 0
A12: SECS-S/06 | B12: METODI MATEMATICI DELL'ECONOMIA E DELLE SCIENZE ATTUARIALI E FINANZIARIE | C12: =N3 -> 14 | F12: 0 | G12: 0 | H12: 0 | I12: 0 | J12: 0 | K12: 1 | L12: 0 | M12: 0 | N12: 0 | O12: 0 | P12: 0 | Q12: 0 | S12: =1-SUM(F12:Q12) -> 0
A13: Stranieri/contratti… | C13: =R3 -> 5 | F13: 0 | G13: 0 | H13: 0 | I13: 0 | J13: 0 | K13: 1 | L13: 0 | M13: 0 | N13: 0 | O13: 0 | P13: 0 | Q13: 0 | S13: =1-SUM(F13:Q13) -> 0
A14: Non indicato | C14: =S3 -> 25 | F14: 0 | G14: 0 | H14: 0 | I14: 0 | J14: 0 | K14: 1 | L14: 0 | M14: 0 | N14: 0 | O14: 0 | P14: 0 | Q14: 0 | S14: =1-SUM(F14:Q14) -> 0
A15: Totale | C15: =SUM(C4:C14) -> 394 | F15: 0 | G15: 0 | H15: 0 | I15: 0 | J15: 0 | K15: 1 | L15: 0 | M15: 0 | N15: 0 | O15: 0 | P15: 0 | Q15: 0 | S15: =1-SUM(F15:Q15) -> 0
F16: 0 | G16: 0 | H16: 0 | I16: 0 | J16: 0 | K16: 1 | L16: 0 | M16: 0 | N16: 0 | O16: 0 | P16: 0 | Q16: 0 | S16: =1-SUM(F16:Q16) -> 0
F17: 0 | G17: 0 | H17: 0 | I17: 0 | J17: 0 | K17: 1 | L17: 0 | M17: 0 | N17: 0 | O17: 0 | P17: 0 | Q17: 0 | S17: =1-SUM(F17:Q17) -> 0
F18: 0 | G18: 0 | H18: 0 | I18: 0 | J18: 0 | K18: 0 | L18: 0 | M18: 0 | N18: 1 | O18: 0 | P18: 0 | Q18: 0 | S18: =1-SUM(F18:Q18) -> 0
F19: 0 | G19: 0 | H19: 0 | I19: 0 | J19: 0 | K19: 1 | L19: 0 | M19: 0 | N19: 0 | O19: 0 | P19: 0 | Q19: 0 | S19: =1-SUM(F19:Q19) -> 0
F20: 0 | G20: 0 | H20: 0 | I20: 0 | J20: 0 | K20: 0 | L20: 0 | M20: 0 | N20: 1 | O20: 0 | P20: 0 | Q20: 0 | S20: =1-SUM(F20:Q20) -> 0
F21: 0 | G21: 0 | H21: 0 | I21: 0 | J21: 0 | K21: 1 | L21: 0 | M21: 0 | N21: 0 | O21: 0 | P21: 0 | Q21: 0 | S21: =1-SUM(F21:Q21) -> 0
F22: 0 | G22: 0 | H22: 0 | I22: 0 | J22: 0 | K22: 1 | L22: 0 | M22: 0 | N22: 0 | O22: 0 | P22: 0 | Q22: 0 | S22: =1-SUM(F22:Q22) -> 0
F23: 0 | G23: 0 | H23: 0 | I23: 0 | J23: 0 | K23: 0 | L23: 0 | M23: 0 | N23: 1 | O23: 0 | P23: 0 | Q23: 0 | S23: =1-SUM(F23:Q23) -> 0
F24: 0 | G24: 0 | H24: 0 | I24: 0 | J24: 0 | K24: 0 | L24: 0 | M24: 0 | N24: 1 | O24: 0 | P24: 0 | Q24: 0 | S24: =1-SUM(F24:Q24) -> 0
F25: 0 | G25: 0 | H25: 0 | I25: 0 | J25: 0 | K25: 1 | L25: 0 | M25: 0 | N25: 0 | O25: 0 | P25: 0 | Q25: 0 | S25: =1-SUM(F25:Q25) -> 0
F26: 0 | G26: 0 | H26: 0 | I26: 0 | J26: 0 | K26: 1 | L26: 0 | M26: 0 | N26: 0 | O26: 0 | P26: 0 | Q26: 0 | S26: =1-SUM(F26:Q26) -> 0
F27: 0 | G27: 0 | H27: 0 | I27: 0 | J27: 0 | K27: 1 | L27: 0 | M27: 0 | N27: 0 | O27: 0 | P27: 0 | Q27: 0 | S27: =1-SUM(F27:Q27) -> 0
F28: 0 | G28: 0 | H28: 0 | I28: 0 | J28: 0 | K28: 1 | L28: 0 | M28: 0 | N28: 0 | O28: 0 | P28: 0 | Q28: 0 | S28: =1-SUM(F28:Q28) -> 0
F29: 0 | G29: 0 | H29: 0 | I29: 0 | J29: 0 | K29: 1 | L29: 0 | M29: 0 | N29: 0 | O29: 0 | P29: 0 | Q29: 0 | S29: =1-SUM(F29:Q29) -> 0
F30: 0 | G30: 0 | H30: 0 | I30: 0 | J30: 0 | K30: 1 | L30: 0 | M30: 0 | N30: 0 | O30: 0 | P30: 0 | Q30: 0 | S30: =1-SUM(F30:Q30) -> 0
F31: 0 | G31: 0 | H31: 0 | I31: 0 | J31: 0 | K31: 1 | L31: 0 | M31: 0 | N31: 0 | O31: 0 | P31: 0 | Q31: 0 | S31: =1-SUM(F31:Q31) -> 0
F32: 0 | G32: 0 | H32: 0 | I32: 0 | J32: 0 | K32: 1 | L32: 0 | M32: 0 | N32: 0 | O32: 0 | P32: 0 | Q32: 0 | S32: =1-SUM(F32:Q32) -> 0
F33: 0 | G33: 0 | H33: 0 | I33: 0 | J33: 0 | K33: 1 | L33: 0 | M33: 0 | N33: 0 | O33: 0 | P33: 0 | Q33: 0 | S33: =1-SUM(F33:Q33) -> 0
F34: 0 | G34: 0 | H34: 0 | I34: 0 | J34: 0 | K34: 1 | L34: 0 | M34: 0 | N34: 0 | O34: 0 | P34: 0 | Q34: 0 | S34: =1-SUM(F34:Q34) -> 0
F35: 0 | G35: 0 | H35: 0 | I35: 0 | J35: 0 | K35: 1 | L35: 0 | M35: 0 | N35: 0 | O35: 0 | P35: 0 | Q35: 0 | S35: =1-SUM(F35:Q35) -> 0
F36: 0 | G36: 0 | H36: 0 | I36: 0 | J36: 0 | K36: 1 | L36: 0 | M36: 0 | N36: 0 | O36: 0 | P36: 0 | Q36: 0 | S36: =1-SUM(F36:Q36) -> 0
F37: 0 | G37: 0 | H37: 0 | I37: 0 | J37: 0 | K37: 1 | L37: 0 | M37: 0 | N37: 0 | O37: 0 | P37: 0 | Q37: 0 | S37: =1-SUM(F37:Q37) -> 0
F38: 0 | G38: 0 | H38: 0 | I38: 0 | J38: 0 | K38: 0 | L38: 0 | M38: 0 | N38: 1 | O38: 0 | P38: 0 | Q38: 0 | S38: =1-SUM(F38:Q38) -> 0
F39: 0 | G39: 0 | H39: 0 | I39: 0 | J39: 0 | K39: 0 | L39: 0 | M39: 0 | N39: 1 | O39: 0 | P39: 0 | Q39: 0 | S39: =1-SUM(F39:Q39) -> 0
F40: 0 | G40: 0 | H40: 0 | I40: 1 | J40: 0 | K40: 0 | L40: 0 | M40: 0 | N40: 0 | O40: 0 | P40: 0 | Q40: 0 | S40: =1-SUM(F40:Q40) -> 0
F41: 0 | G41: 0 | H41: 0 | I41: 0 | J41: 0 | K41: 1 | L41: 0 | M41: 0 | N41: 0 | O41: 0 | P41: 0 | Q41: 0 | S41: =1-SUM(F41:Q41) -> 0
F42: 0 | G42: 0 | H42: 0 | I42: 0 | J42: 0 | K42: 0 | L42: 0 | M42: 0 | N42: 1 | O42: 0 | P42: 0 | Q42: 0 | S42: =1-SUM(F42:Q42) -> 0
F43: 0 | G43: 0 | H43: 0 | I43: 0 | J43: 0 | K43: 0 | L43: 0 | M43: 0 | N43: 1 | O43: 0 | P43: 0 | Q43: 0 | S43: =1-SUM(F43:Q43) -> 0
F44: 0 | G44: 0 | H44: 0 | I44: 0 | J44: 0 | K44: 0 | L44: 0 | M44: 1 | N44: 0 | O44: 0 | P44: 0 | Q44: 0 | S44: =1-SUM(F44:Q44) -> 0
F45: 0 | G45: 0 | H45: 0 | I45: 0 | J45: 0 | K45: 1 | L45: 0 | M45: 0 | N45: 0 | O45: 0 | P45: 0 | Q45: 0 | S45: =1-SUM(F45:Q45) -> 0
F46: 0 | G46: 0 | H46: 0 | I46: 0 | J46: 0 | K46: 0 | L46: 0 | M46: 0 | N46: 0 | O46: 0 | P46: 0 | Q46: 0 | S46: =1-SUM(F46:Q46) -> 1
F47: 0 | G47: 0 | H47: 0 | I47: 0 | J47: 0 | K47: 0 | L47: 0 | M47: 0 | N47: 0 | O47: 0 | P47: 0 | Q47: 0 | S47: =1-SUM(F47:Q47) -> 1
F48: 0 | G48: 0 | H48: 0 | I48: 0 | J48: 0 | K48: 0 | L48: 0 | M48: 0 | N48: 0 | O48: 0 | P48: 0 | Q48: 0 | S48: =1-SUM(F48:Q48) -> 1
F49: 0 | G49: 0 | H49: 0 | I49: 0 | J49: 0 | K49: 1 | L49: 0 | M49: 0 | N49: 0 | O49: 0 | P49: 0 | Q49: 0 | S49: =1-SUM(F49:Q49) -> 0
F50: 0 | G50: 0 | H50: 0 | I50: 0 | J50: 0 | K50: 1 | L50: 0 | M50: 0 | N50: 0 | O50: 0 | P50: 0 | Q50: 0 | S50: =1-SUM(F50:Q50) -> 0
F51: 0 | G51: 0 | H51: 0 | I51: 0 | J51: 0 | K51: 1 | L51: 0 | M51: 0 | N51: 0 | O51: 0 | P51: 0 | Q51: 0 | S51: =1-SUM(F51:Q51) -> 0
F52: 0 | G52: 0 | H52: 0 | I52: 0 | J52: 0 | K52: 1 | L52: 0 | M52: 0 | N52: 0 | O52: 0 | P52: 0 | Q52: 0 | S52: =1-SUM(F52:Q52) -> 0
F53: 0 | G53: 0 | H53: 0 | I53: 0 | J53: 0 | K53: 0 | L53: 0 | M53: 0 | N53: 1 | O53: 0 | P53: 0 | Q53: 0 | S53: =1-SUM(F53:Q53) -> 0
F54: 0 | G54: 0 | H54: 0 | I54: 0 | J54: 0 | K54: 1 | L54: 0 | M54: 0 | N54: 0 | O54: 0 | P54: 0 | Q54: 0 | S54: =1-SUM(F54:Q54) -> 0
F55: 0 | G55: 0 | H55: 0 | I55: 0 | J55: 0 | K55: 1 | L55: 0 | M55: 0 | N55: 0 | O55: 0 | P55: 0 | Q55: 0 | S55: =1-SUM(F55:Q55) -> 0
F56: 0 | G56: 0 | H56: 0 | I56: 0 | J56: 0 | K56: 1 | L56: 0 | M56: 0 | N56: 0 | O56: 0 | P56: 0 | Q56: 0 | S56: =1-SUM(F56:Q56) -> 0
F57: 0 | G57: 0 | H57: 0 | I57: 0 | J57: 0 | K57: 1 | L57: 0 | M57: 0 | N57: 0 | O57: 0 | P57: 0 | Q57: 0 | S57: =1-SUM(F57:Q57) -> 0
F58: 0 | G58: 0 | H58: 0 | I58: 0 | J58: 0 | K58: 1 | L58: 0 | M58: 0 | N58: 0 | O58: 0 | P58: 0 | Q58: 0 | S58: =1-SUM(F58:Q58) -> 0
F59: 0 | G59: 0 | H59: 0 | I59: 0 | J59: 0 | K59: 1 | L59: 0 | M59: 0 | N59: 0 | O59: 0 | P59: 0 | Q59: 0 | S59: =1-SUM(F59:Q59) -> 0
F60: 0 | G60: 0 | H60: 0 | I60: 0 | J60: 0 | K60: 1 | L60: 0 | M60: 0 | N60: 0 | O60: 0 | P60: 0 | Q60: 0 | S60: =1-SUM(F60:Q60) -> 0
F61: 0 | G61: 0 | H61: 0 | I61: 0 | J61: 0 | K61: 1 | L61: 0 | M61: 0 | N61: 0 | O61: 0 | P61: 0 | Q61: 0 | S61: =1-SUM(F61:Q61) -> 0
F62: 0 | G62: 0 | H62: 0 | I62: 0 | J62: 0 | K62: 1 | L62: 0 | M62: 0 | N62: 0 | O62: 0 | P62: 0 | Q62: 0 | S62: =1-SUM(F62:Q62) -> 0
F63: 0 | G63: 0 | H63: 0 | I63: 0 | J63: 0 | K63: 1 | L63: 0 | M63: 0 | N63: 0 | O63: 0 | P63: 0 | Q63: 0 | S63: =1-SUM(F63:Q63) -> 0
F64: 0 | G64: 0 | H64: 0 | I64: 0 | J64: 0 | K64: 1 | L64: 0 | M64: 0 | N64: 0 | O64: 0 | P64: 0 | Q64: 0 | S64: =1-SUM(F64:Q64) -> 0
F65: 0 | G65: 0 | H65: 0 | I65: 0 | J65: 0 | K65: 1 | L65: 0 | M65: 0 | N65: 0 | O65: 0 | P65: 0 | Q65: 0 | S65: =1-SUM(F65:Q65) -> 0
F66: 0 | G66: 0 | H66: 0 | I66: 0 | J66: 0 | K66: 1 | L66: 0 | M66: 0 | N66: 0 | O66: 0 | P66: 0 | Q66: 0 | S66: =1-SUM(F66:Q66) -> 0
F67: 0 | G67: 1 | H67: 0 | I67: 0 | J67: 0 | K67: 0 | L67: 0 | M67: 0 | N67: 0 | O67: 0 | P67: 0 | Q67: 0 | S67: =1-SUM(F67:Q67) -> 0
F68: 0 | G68: 1 | H68: 0 | I68: 0 | J68: 0 | K68: 0 | L68: 0 | M68: 0 | N68: 0 | O68: 0 | P68: 0 | Q68: 0 | S68: =1-SUM(F68:Q68) -> 0
F69: 0 | G69: 0 | H69: 0 | I69: 0 | J69: 0 | K69: 1 | L69: 0 | M69: 0 | N69: 0 | O69: 0 | P69: 0 | Q69: 0 | S69: =1-SUM(F69:Q69) -> 0
F70: 0 | G70: 0 | H70: 0 | I70: 0 | J70: 0 | K70: 1 | L70: 0 | M70: 0 | N70: 0 | O70: 0 | P70: 0 | Q70: 0 | S70: =1-SUM(F70:Q70) -> 0
F71: 0 | G71: 0 | H71: 0 | I71: 0 | J71: 0 | K71: 1 | L71: 0 | M71: 0 | N71: 0 | O71: 0 | P71: 0 | Q71: 0 | S71: =1-SUM(F71:Q71) -> 0
F72: 0 | G72: 0 | H72: 0 | I72: 0 | J72: 0 | K72: 1 | L72: 0 | M72: 0 | N72: 0 | O72: 0 | P72: 0 | Q72: 0 | S72: =1-SUM(F72:Q72) -> 0
F73: 0 | G73: 0 | H73: 0 | I73: 0 | J73: 0 | K73: 1 | L73: 0 | M73: 0 | N73: 0 | O73: 0 | P73: 0 | Q73: 0 | S73: =1-SUM(F73:Q73) -> 0
F74: 0 | G74: 0 | H74: 0 | I74: 0 | J74: 0 | K74: 1 | L74: 0 | M74: 0 | N74: 0 | O74: 0 | P74: 0 | Q74: 0 | S74: =1-SUM(F74:Q74) -> 0
F75: 0 | G75: 0 | H75: 0 | I75: 0 | J75: 0 | K75: 1 | L75: 0 | M75: 0 | N75: 0 | O75: 0 | P75: 0 | Q75: 0 | S75: =1-SUM(F75:Q75) -> 0
F76: 0 | G76: 0 | H76: 0 | I76: 0 | J76: 0 | K76: 1 | L76: 0 | M76: 0 | N76: 0 | O76: 0 | P76: 0 | Q76: 0 | S76: =1-SUM(F76:Q76) -> 0
F77: 0 | G77: 0 | H77: 0 | I77: 0 | J77: 0 | K77: 1 | L77: 0 | M77: 0 | N77: 0 | O77: 0 | P77: 0 | Q77: 0 | S77: =1-SUM(F77:Q77) -> 0
F78: 0 | G78: 0 | H78: 0 | I78: 0 | J78: 0 | K78: 1 | L78: 0 | M78: 0 | N78: 0 | O78: 0 | P78: 0 | Q78: 0 | S78: =1-SUM(F78:Q78) -> 0
F79: 0 | G79: 0 | H79: 0 | I79: 0 | J79: 0 | K79: 1 | L79: 0 | M79: 0 | N79: 0 | O79: 0 | P79: 0 | Q79: 0 | S79: =1-SUM(F79:Q79) -> 0
F80: 0 | G80: 0 | H80: 0 | I80: 0 | J80: 0 | K80: 0 | L80: 0 | M80: 0 | N80: 1 | O80: 0 | P80: 0 | Q80: 0 | S80: =1-SUM(F80:Q80) -> 0
F81: 0 | G81: 0 | H81: 0 | I81: 0 | J81: 0 | K81: 1 | L81: 0 | M81: 0 | N81: 0 | O81: 0 | P81: 0 | Q81: 0 | S81: =1-SUM(F81:Q81) -> 0
F82: 0 | G82: 0 | H82: 0 | I82: 0 | J82: 0 | K82: 1 | L82: 0 | M82: 0 | N82: 0 | O82: 0 | P82: 0 | Q82: 0 | S82: =1-SUM(F82:Q82) -> 0
F83: 0 | G83: 0 | H83: 0 | I83: 0 | J83: 0 | K83: 1 | L83: 0 | M83: 0 | N83: 0 | O83: 0 | P83: 0 | Q83: 0 | S83: =1-SUM(F83:Q83) -> 0
F84: 0 | G84: 0 | H84: 0 | I84: 0 | J84: 0 | K84: 1 | L84: 0 | M84: 0 | N84: 0 | O84: 0 | P84: 0 | Q84: 0 | S84: =1-SUM(F84:Q84) -> 0
F85: 0 | G85: 0 | H85: 0 | I85: 0 | J85: 0 | K85: 1 | L85: 0 | M85: 0 | N85: 0 | O85: 0 | P85: 0 | Q85: 0 | S85: =1-SUM(F85:Q85) -> 0
F86: 0 | G86: 0 | H86: 0 | I86: 0 | J86: 0 | K86: 1 | L86: 0 | M86: 0 | N86: 0 | O86: 0 | P86: 0 | Q86: 0 | S86: =1-SUM(F86:Q86) -> 0
F87: 0 | G87: 0 | H87: 0 | I87: 0 | J87: 0 | K87: 1 | L87: 0 | M87: 0 | N87: 0 | O87: 0 | P87: 0 | Q87: 0 | S87: =1-SUM(F87:Q87) -> 0
F88: 0 | G88: 0 | H88: 0 | I88: 0 | J88: 0 | K88: 0 | L88: 0 | M88: 0 | N88: 1 | O88: 0 | P88: 0 | Q88: 0 | S88: =1-SUM(F88:Q88) -> 0
F89: 0 | G89: 0 | H89: 0 | I89: 0 | J89: 0 | K89: 1 | L89: 0 | M89: 0 | N89: 0 | O89: 0 | P89: 0 | Q89: 0 | S89: =1-SUM(F89:Q89) -> 0
F90: 0 | G90: 0 | H90: 0 | I90: 0 | J90: 0 | K90: 1 | L90: 0 | M90: 0 | N90: 0 | O90: 0 | P90: 0 | Q90: 0 | S90: =1-SUM(F90:Q90) -> 0
F91: 0 | G91: 0 | H91: 0 | I91: 0 | J91: 0 | K91: 1 | L91: 0 | M91: 0 | N91: 0 | O91: 0 | P91: 0 | Q91: 0 | S91: =1-SUM(F91:Q91) -> 0
F92: 0 | G92: 0 | H92: 0 | I92: 0 | J92: 0 | K92: 0 | L92: 0 | M92: 0 | N92: 1 | O92: 0 | P92: 0 | Q92: 0 | S92: =1-SUM(F92:Q92) -> 0
F93: 0 | G93: 0 | H93: 0 | I93: 0 | J93: 0 | K93: 1 | L93: 0 | M93: 0 | N93: 0 | O93: 0 | P93: 0 | Q93: 0 | S93: =1-SUM(F93:Q93) -> 0
F94: 0 | G94: 0 | H94: 0 | I94: 0 | J94: 0 | K94: 1 | L94: 0 | M94: 0 | N94: 0 | O94: 0 | P94: 0 | Q94: 0 | S94: =1-SUM(F94:Q94) -> 0
F95: 0 | G95: 0 | H95: 0 | I95: 0 | J95: 0 | K95: 1 | L95: 0 | M95: 0 | N95: 0 | O95: 0 | P95: 0 | Q95: 0 | S95: =1-SUM(F95:Q95) -> 0
F96: 0 | G96: 0 | H96: 0 | I96: 0 | J96: 0 | K96: 1 | L96: 0 | M96: 0 | N96: 0 | O96: 0 | P96: 0 | Q96: 0 | S96: =1-SUM(F96:Q96) -> 0
F97: 0 | G97: 0 | H97: 0 | I97: 0 | J97: 0 | K97: 1 | L97: 0 | M97: 0 | N97: 0 | O97: 0 | P97: 0 | Q97: 0 | S97: =1-SUM(F97:Q97) -> 0
F98: 0 | G98: 0 | H98: 0 | I98: 0 | J98: 0 | K98: 1 | L98: 0 | M98: 0 | N98: 0 | O98: 0 | P98: 0 | Q98: 0 | S98: =1-SUM(F98:Q98) -> 0
F99: 0 | G99: 0 | H99: 0 | I99: 0 | J99: 0 | K99: 1 | L99: 0 | M99: 0 | N99: 0 | O99: 0 | P99: 0 | Q99: 0 | S99: =1-SUM(F99:Q99) -> 0
F100: 0 | G100: 0 | H100: 0 | I100: 0 | J100: 0 | K100: 1 | L100: 0 | M100: 0 | N100: 0 | O100: 0 | P100: 0 | Q100: 0 | S100: =1-SUM(F100:Q100) -> 0
F101: 0 | G101: 0 | H101: 0 | I101: 0 | J101: 0 | K101: 1 | L101: 0 | M101: 0 | N101: 0 | O101: 0 | P101: 0 | Q101: 0 | S101: =1-SUM(F101:Q101) -> 0
F102: 0 | G102: 0 | H102: 0 | I102: 0 | J102: 0 | K102: 1 | L102: 0 | M102: 0 | N102: 0 | O102: 0 | P102: 0 | Q102: 0 | S102: =1-SUM(F102:Q102) -> 0
F103: 0 | G103: 0 | H103: 0 | I103: 0 | J103: 0 | K103: 1 | L103: 0 | M103: 0 | N103: 0 | O103: 0 | P103: 0 | Q103: 0 | S103: =1-SUM(F103:Q103) -> 0
F104: 0 | G104: 0 | H104: 0 | I104: 0 | J104: 0 | K104: 1 | L104: 0 | M104: 0 | N104: 0 | O104: 0 | P104: 0 | Q104: 0 | S104: =1-SUM(F104:Q104) -> 0
F105: 0 | G105: 0 | H105: 0 | I105: 0 | J105: 0 | K105: 1 | L105: 0 | M105: 0 | N105: 0 | O105: 0 | P105: 0 | Q105: 0 | S105: =1-SUM(F105:Q105) -> 0
F106: 0 | G106: 0 | H106: 0 | I106: 0 | J106: 0 | K106: 1 | L106: 0 | M106: 0 | N106: 0 | O106: 0 | P106: 0 | Q106: 0 | S106: =1-SUM(F106:Q106) -> 0
F107: 0 | G107: 0 | H107: 0 | I107: 0 | J107: 0 | K107: 1 | L107: 0 | M107: 0 | N107: 0 | O107: 0 | P107: 0 | Q107: 0 | S107: =1-SUM(F107:Q107) -> 0
F108: 0 | G108: 0 | H108: 0 | I108: 0 | J108: 0 | K108: 1 | L108: 0 | M108: 0 | N108: 0 | O108: 0 | P108: 0 | Q108: 0 | S108: =1-SUM(F108:Q108) -> 0
F109: 0 | G109: 0 | H109: 0 | I109: 0 | J109: 0 | K109: 0 | L109: 0 | M109: 0 | N109: 0 | O109: 0 | P109: 0 | Q109: 0 | S109: =1-SUM(F109:Q109) -> 1
F110: 0 | G110: 0 | H110: 0 | I110: 0 | J110: 0 | K110: 0 | L110: 0 | M110: 0 | N110: 0 | O110: 0 | P110: 0 | Q110: 0 | S110: =1-SUM(F110:Q110) -> 1
F111: 0 | G111: 0 | H111: 0 | I111: 0 | J111: 0 | K111: 1 | L111: 0 | M111: 0 | N111: 0 | O111: 0 | P111: 0 | Q111: 0 | S111: =1-SUM(F111:Q111) -> 0
F112: 0 | G112: 0 | H112: 0 | I112: 0 | J112: 0 | K112: 1 | L112: 0 | M112: 0 | N112: 0 | O112: 0 | P112: 0 | Q112: 0 | S112: =1-SUM(F112:Q112) -> 0
F113: 0 | G113: 0 | H113: 0 | I113: 0 | J113: 0 | K113: 1 | L113: 0 | M113: 0 | N113: 0 | O113: 0 | P113: 0 | Q113: 0 | S113: =1-SUM(F113:Q113) -> 0
F114: 0 | G114: 0 | H114: 0 | I114: 0 | J114: 0 | K114: 1 | L114: 0 | M114: 0 | N114: 0 | O114: 0 | P114: 0 | Q114: 0 | S114: =1-SUM(F114:Q114) -> 0
F115: 0 | G115: 0 | H115: 0 | I115: 0 | J115: 0 | K115: 1 | L115: 0 | M115: 0 | N115: 0 | O115: 0 | P115: 0 | Q115: 0 | S115: =1-SUM(F115:Q115) -> 0
F116: 0 | G116: 0 | H116: 0 | I116: 0 | J116: 0 | K116: 1 | L116: 0 | M116: 0 | N116: 0 | O116: 0 | P116: 0 | Q116: 0 | S116: =1-SUM(F116:Q116) -> 0
F117: 0 | G117: 0 | H117: 0 | I117: 0 | J117: 0 | K117: 1 | L117: 0 | M117: 0 | N117: 0 | O117: 0 | P117: 0 | Q117: 0 | S117: =1-SUM(F117:Q117) -> 0
F118: 0 | G118: 0 | H118: 0 | I118: 0 | J118: 0 | K118: 0 | L118: 0 | M118: 0 | N118: 0 | O118: 0 | P118: 0 | Q118: 0 | S118: =1-SUM(F118:Q118) -> 1
F119: 0 | G119: 0 | H119: 0 | I119: 0 | J119: 0 | K119: 1 | L119: 0 | M119: 0 | N119: 0 | O119: 0 | P119: 0 | Q119: 0 | S119: =1-SUM(F119:Q119) -> 0
F120: 0 | G120: 0 | H120: 0 | I120: 0 | J120: 0 | K120: 1 | L120: 0 | M120: 0 | N120: 0 | O120: 0 | P120: 0 | Q120: 0 | S120: =1-SUM(F120:Q120) -> 0
F121: 0 | G121: 0 | H121: 0 | I121: 0 | J121: 0 | K121: 1 | L121: 0 | M121: 0 | N121: 0 | O121: 0 | P121: 0 | Q121: 0 | S121: =1-SUM(F121:Q121) -> 0
F122: 0 | G122: 0 | H122: 0 | I122: 0 | J122: 0 | K122: 1 | L122: 0 | M122: 0 | N122: 0 | O122: 0 | P122: 0 | Q122: 0 | S122: =1-SUM(F122:Q122) -> 0
F123: 0 | G123: 0 | H123: 0 | I123: 0 | J123: 0 | K123: 0 | L123: 0 | M123: 0 | N123: 1 | O123: 0 | P123: 0 | Q123: 0 | S123: =1-SUM(F123:Q123) -> 0
F124: 0 | G124: 0 | H124: 0 | I124: 1 | J124: 0 | K124: 0 | L124: 0 | M124: 0 | N124: 0 | O124: 0 | P124: 0 | Q124: 0 | S124: =1-SUM(F124:Q124) -> 0
F125: 0 | G125: 0 | H125: 0 | I125: 1 | J125: 0 | K125: 0 | L125: 0 | M125: 0 | N125: 0 | O125: 0 | P125: 0 | Q125: 0 | S125: =1-SUM(F125:Q125) -> 0
F126: 0 | G126: 0 | H126: 0 | I126: 0 | J126: 0 | K126: 1 | L126: 0 | M126: 0 | N126: 0 | O126: 0 | P126: 0 | Q126: 0 | S126: =1-SUM(F126:Q126) -> 0
F127: 0 | G127: 0 | H127: 0 | I127: 0 | J127: 0 | K127: 1 | L127: 0 | M127: 0 | N127: 0 | O127: 0 | P127: 0 | Q127: 0 | S127: =1-SUM(F127:Q127) -> 0
F128: 0 | G128: 0 | H128: 0 | I128: 0 | J128: 0 | K128: 1 | L128: 0 | M128: 0 | N128: 0 | O128: 0 | P128: 0 | Q128: 0 | S128: =1-SUM(F128:Q128) -> 0
F129: 0 | G129: 0 | H129: 0 | I129: 0 | J129: 0 | K129: 1 | L129: 0 | M129: 0 | N129: 0 | O129: 0 | P129: 0 | Q129: 0 | S129: =1-SUM(F129:Q129) -> 0
F130: 0 | G130: 0 | H130: 0 | I130: 0 | J130: 0 | K130: 1 | L130: 0 | M130: 0 | N130: 0 | O130: 0 | P130: 0 | Q130: 0 | S130: =1-SUM(F130:Q130) -> 0
F131: 1 | G131: 0 | H131: 0 | I131: 0 | J131: 0 | K131: 0 | L131: 0 | M131: 0 | N131: 0 | O131: 0 | P131: 0 | Q131: 0 | S131: =1-SUM(F131:Q131) -> 0
F132: 0 | G132: 0 | H132: 0 | I132: 0 | J132: 0 | K132: 1 | L132: 0 | M132: 0 | N132: 0 | O132: 0 | P132: 0 | Q132: 0 | S132: =1-SUM(F132:Q132) -> 0
F133: 0 | G133: 0 | H133: 0 | I133: 0 | J133: 0 | K133: 1 | L133: 0 | M133: 0 | N133: 0 | O133: 0 | P133: 0 | Q133: 0 | S133: =1-SUM(F133:Q133) -> 0
F134: 0 | G134: 0 | H134: 0 | I134: 0 | J134: 0 | K134: 1 | L134: 0 | M134: 0 | N134: 0 | O134: 0 | P134: 0 | Q134: 0 | S134: =1-SUM(F134:Q134) -> 0
F135: 0 | G135: 0 | H135: 0 | I135: 0 | J135: 0 | K135: 1 | L135: 0 | M135: 0 | N135: 0 | O135: 0 | P135: 0 | Q135: 0 | S135: =1-SUM(F135:Q135) -> 0
F136: 0 | G136: 0 | H136: 0 | I136: 0 | J136: 0 | K136: 1 | L136: 0 | M136: 0 | N136: 0 | O136: 0 | P136: 0 | Q136: 0 | S136: =1-SUM(F136:Q136) -> 0
F137: 0 | G137: 0 | H137: 0 | I137: 0 | J137: 0 | K137: 1 | L137: 0 | M137: 0 | N137: 0 | O137: 0 | P137: 0 | Q137: 0 | S137: =1-SUM(F137:Q137) -> 0
F138: 0 | G138: 0 | H138: 0 | I138: 0 | J138: 0 | K138: 1 | L138: 0 | M138: 0 | N138: 0 | O138: 0 | P138: 0 | Q138: 0 | S138: =1-SUM(F138:Q138) -> 0
F139: 0 | G139: 0 | H139: 0 | I139: 0 | J139: 0 | K139: 1 | L139: 0 | M139: 0 | N139: 0 | O139: 0 | P139: 0 | Q139: 0 | S139: =1-SUM(F139:Q139) -> 0
F140: 0 | G140: 0 | H140: 0 | I140: 0 | J140: 0 | K140: 1 | L140: 0 | M140: 0 | N140: 0 | O140: 0 | P140: 0 | Q140: 0 | S140: =1-SUM(F140:Q140) -> 0
F141: 0 | G141: 0 | H141: 0 | I141: 0 | J141: 0 | K141: 1 | L141: 0 | M141: 0 | N141: 0 | O141: 0 | P141: 0 | Q141: 0 | S141: =1-SUM(F141:Q141) -> 0
F142: 0 | G142: 0 | H142: 0 | I142: 0 | J142: 0 | K142: 1 | L142: 0 | M142: 0 | N142: 0 | O142: 0 | P142: 0 | Q142: 0 | S142: =1-SUM(F142:Q142) -> 0
F143: 0 | G143: 0 | H143: 0 | I143: 0 | J143: 0 | K143: 1 | L143: 0 | M143: 0 | N143: 0 | O143: 0 | P143: 0 | Q143: 0 | S143: =1-SUM(F143:Q143) -> 0
F144: 0 | G144: 0 | H144: 0 | I144: 0 | J144: 0 | K144: 1 | L144: 0 | M144: 0 | N144: 0 | O144: 0 | P144: 0 | Q144: 0 | S144: =1-SUM(F144:Q144) -> 0
F145: 0 | G145: 0 | H145: 1 | I145: 0 | J145: 0 | K145: 0 | L145: 0 | M145: 0 | N145: 0 | O145: 0 | P145: 0 | Q145: 0 | S145: =1-SUM(F145:Q145) -> 0
F146: 0 | G146: 0 | H146: 0 | I146: 0 | J146: 0 | K146: 0 | L146: 0 | M146: 0 | N146: 0 | O146: 1 | P146: 0 | Q146: 0 | S146: =1-SUM(F146:Q146) -> 0
F147: 0 | G147: 0 | H147: 0 | I147: 0 | J147: 0 | K147: 1 | L147: 0 | M147: 0 | N147: 0 | O147: 0 | P147: 0 | Q147: 0 | S147: =1-SUM(F147:Q147) -> 0
F148: 0 | G148: 0 | H148: 0 | I148: 0 | J148: 0 | K148: 1 | L148: 0 | M148: 0 | N148: 0 | O148: 0 | P148: 0 | Q148: 0 | S148: =1-SUM(F148:Q148) -> 0
F149: 0 | G149: 0 | H149: 0 | I149: 0 | J149: 0 | K149: 1 | L149: 0 | M149: 0 | N149: 0 | O149: 0 | P149: 0 | Q149: 0 | S149: =1-SUM(F149:Q149) -> 0
F150: 0 | G150: 0 | H150: 0 | I150: 0 | J150: 0 | K150: 1 | L150: 0 | M150: 0 | N150: 0 | O150: 0 | P150: 0 | Q150: 0 | S150: =1-SUM(F150:Q150) -> 0
F151: 0 | G151: 0 | H151: 0 | I151: 0 | J151: 0 | K151: 1 | L151: 0 | M151: 0 | N151: 0 | O151: 0 | P151: 0 | Q151: 0 | S151: =1-SUM(F151:Q151) -> 0
F152: 0 | G152: 0 | H152: 0 | I152: 0 | J152: 0 | K152: 1 | L152: 0 | M152: 0 | N152: 0 | O152: 0 | P152: 0 | Q152: 0 | S152: =1-SUM(F152:Q152) -> 0
F153: 0 | G153: 0 | H153: 0 | I153: 0 | J153: 0 | K153: 0 | L153: 0 | M153: 0 | N153: 0 | O153: 1 | P153: 0 | Q153: 0 | S153: =1-SUM(F153:Q153) -> 0
F154: 0 | G154: 0 | H154: 0 | I154: 0 | J154: 0 | K154: 1 | L154: 0 | M154: 0 | N154: 0 | O154: 0 | P154: 0 | Q154: 0 | S154: =1-SUM(F154:Q154) -> 0
F155: 0 | G155: 0 | H155: 0 | I155: 0 | J155: 0 | K155: 1 | L155: 0 | M155: 0 | N155: 0 | O155: 0 | P155: 0 | Q155: 0 | S155: =1-SUM(F155:Q155) -> 0
F156: 0 | G156: 0 | H156: 0 | I156: 0 | J156: 0 | K156: 1 | L156: 0 | M156: 0 | N156: 0 | O156: 0 | P156: 0 | Q156: 0 | S156: =1-SUM(F156:Q156) -> 0
F157: 0 | G157: 0 | H157: 0 | I157: 0 | J157: 0 | K157: 1 | L157: 0 | M157: 0 | N157: 0 | O157: 0 | P157: 0 | Q157: 0 | S157: =1-SUM(F157:Q157) -> 0
F158: 0 | G158: 0 | H158: 0 | I158: 0 | J158: 0 | K158: 1 | L158: 0 | M158: 0 | N158: 0 | O158: 0 | P158: 0 | Q158: 0 | S158: =1-SUM(F158:Q158) -> 0
F159: 0 | G159: 0 | H159: 0 | I159: 0 | J159: 0 | K159: 1 | L159: 0 | M159: 0 | N159: 0 | O159: 0 | P159: 0 | Q159: 0 | S159: =1-SUM(F159:Q159) -> 0
F160: 0 | G160: 0 | H160: 0 | I160: 0 | J160: 0 | K160: 1 | L160: 0 | M160: 0 | N160: 0 | O160: 0 | P160: 0 | Q160: 0 | S160: =1-SUM(F160:Q160) -> 0
F161: 0 | G161: 0 | H161: 0 | I161: 0 | J161: 0 | K161: 1 | L161: 0 | M161: 0 | N161: 0 | O161: 0 | P161: 0 | Q161: 0 | S161: =1-SUM(F161:Q161) -> 0
F162: 0 | G162: 0 | H162: 0 | I162: 0 | J162: 0 | K162: 1 | L162: 0 | M162: 0 | N162: 0 | O162: 0 | P162: 0 | Q162: 0 | S162: =1-SUM(F162:Q162) -> 0
F163: 0 | G163: 0 | H163: 0 | I163: 0 | J163: 0 | K163: 1 | L163: 0 | M163: 0 | N163: 0 | O163: 0 | P163: 0 | Q163: 0 | S163: =1-SUM(F163:Q163) -> 0
F164: 0 | G164: 0 | H164: 0 | I164: 0 | J164: 0 | K164: 1 | L164: 0 | M164: 0 | N164: 0 | O164: 0 | P164: 0 | Q164: 0 | S164: =1-SUM(F164:Q164) -> 0
F165: 0 | G165: 0 | H165: 0 | I165: 0 | J165: 0 | K165: 1 | L165: 0 | M165: 0 | N165: 0 | O165: 0 | P165: 0 | Q165: 0 | S165: =1-SUM(F165:Q165) -> 0
F166: 0 | G166: 0 | H166: 0 | I166: 0 | J166: 0 | K166: 1 | L166: 0 | M166: 0 | N166: 0 | O166: 0 | P166: 0 | Q166: 0 | S166: =1-SUM(F166:Q166) -> 0
F167: 0 | G167: 0 | H167: 0 | I167: 0 | J167: 0 | K167: 1 | L167: 0 | M167: 0 | N167: 0 | O167: 0 | P167: 0 | Q167: 0 | S167: =1-SUM(F167:Q167) -> 0
F168: 0 | G168: 0 | H168: 0 | I168: 0 | J168: 0 | K168: 1 | L168: 0 | M168: 0 | N168: 0 | O168: 0 | P168: 0 | Q168: 0 | S168: =1-SUM(F168:Q168) -> 0
F169: 0 | G169: 0 | H169: 0 | I169: 0 | J169: 0 | K169: 1 | L169: 0 | M169: 0 | N169: 0 | O169: 0 | P169: 0 | Q169: 0 | S169: =1-SUM(F169:Q169) -> 0
F170: 0 | G170: 0 | H170: 0 | I170: 0 | J170: 0 | K170: 1 | L170: 0 | M170: 0 | N170: 0 | O170: 0 | P170: 0 | Q170: 0 | S170: =1-SUM(F170:Q170) -> 0
F171: 0 | G171: 0 | H171: 0 | I171: 0 | J171: 0 | K171: 1 | L171: 0 | M171: 0 | N171: 0 | O171: 0 | P171: 0 | Q171: 0 | S171: =1-SUM(F171:Q171) -> 0
F172: 0 | G172: 0 | H172: 0 | I172: 0 | J172: 0 | K172: 1 | L172: 0 | M172: 0 | N172: 0 | O172: 0 | P172: 0 | Q172: 0 | S172: =1-SUM(F172:Q172) -> 0
F173: 0 | G173: 0 | H173: 0 | I173: 0 | J173: 0 | K173: 1 | L173: 0 | M173: 0 | N173: 0 | O173: 0 | P173: 0 | Q173: 0 | S173: =1-SUM(F173:Q173) -> 0
F174: 0 | G174: 0 | H174: 0 | I174: 0 | J174: 0 | K174: 1 | L174: 0 | M174: 0 | N174: 0 | O174: 0 | P174: 0 | Q174: 0 | S174: =1-SUM(F174:Q174) -> 0
F175: 0 | G175: 0 | H175: 0 | I175: 0 | J175: 0 | K175: 1 | L175: 0 | M175: 0 | N175: 0 | O175: 0 | P175: 0 | Q175: 0 | S175: =1-SUM(F175:Q175) -> 0
F176: 0 | G176: 0 | H176: 0 | I176: 0 | J176: 0 | K176: 1 | L176: 0 | M176: 0 | N176: 0 | O176: 0 | P176: 0 | Q176: 0 | S176: =1-SUM(F176:Q176) -> 0
F177: 0 | G177: 0 | H177: 0 | I177: 0 | J177: 0 | K177: 1 | L177: 0 | M177: 0 | N177: 0 | O177: 0 | P177: 0 | Q177: 0 | S177: =1-SUM(F177:Q177) -> 0
F178: 0 | G178: 0 | H178: 0 | I178: 0 | J178: 0 | K178: 1 | L178: 0 | M178: 0 | N178: 0 | O178: 0 | P178: 0 | Q178: 0 | S178: =1-SUM(F178:Q178) -> 0
F179: 0 | G179: 0 | H179: 0 | I179: 0 | J179: 0 | K179: 1 | L179: 0 | M179: 0 | N179: 0 | O179: 0 | P179: 0 | Q179: 0 | S179: =1-SUM(F179:Q179) -> 0
F180: 0 | G180: 0 | H180: 0 | I180: 0 | J180: 0 | K180: 1 | L180: 0 | M180: 0 | N180: 0 | O180: 0 | P180: 0 | Q180: 0 | S180: =1-SUM(F180:Q180) -> 0
F181: 0 | G181: 0 | H181: 0 | I181: 0 | J181: 0 | K181: 1 | L181: 0 | M181: 0 | N181: 0 | O181: 0 | P181: 0 | Q181: 0 | S181: =1-SUM(F181:Q181) -> 0
F182: 0 | G182: 0 | H182: 0 | I182: 0 | J182: 0 | K182: 1 | L182: 0 | M182: 0 | N182: 0 | O182: 0 | P182: 0 | Q182: 0 | S182: =1-SUM(F182:Q182) -> 0
F183: 0 | G183: 0 | H183: 0 | I183: 0 | J183: 0 | K183: 1 | L183: 0 | M183: 0 | N183: 0 | O183: 0 | P183: 0 | Q183: 0 | S183: =1-SUM(F183:Q183) -> 0
F184: 0 | G184: 0 | H184: 0 | I184: 0 | J184: 0 | K184: 1 | L184: 0 | M184: 0 | N184: 0 | O184: 0 | P184: 0 | Q184: 0 | S184: =1-SUM(F184:Q184) -> 0
F185: 0 | G185: 0 | H185: 0 | I185: 0 | J185: 0 | K185: 1 | L185: 0 | M185: 0 | N185: 0 | O185: 0 | P185: 0 | Q185: 0 | S185: =1-SUM(F185:Q185) -> 0
F186: 0 | G186: 0 | H186: 0 | I186: 0 | J186: 0 | K186: 1 | L186: 0 | M186: 0 | N186: 0 | O186: 0 | P186: 0 | Q186: 0 | S186: =1-SUM(F186:Q186) -> 0
F187: 0 | G187: 0 | H187: 0 | I187: 0 | J187: 0 | K187: 1 | L187: 0 | M187: 0 | N187: 0 | O187: 0 | P187: 0 | Q187: 0 | S187: =1-SUM(F187:Q187) -> 0
F188: 0 | G188: 0 | H188: 1 | I188: 0 | J188: 0 | K188: 0 | L188: 0 | M188: 0 | N188: 0 | O188: 0 | P188: 0 | Q188: 0 | S188: =1-SUM(F188:Q188) -> 0
F189: 0 | G189: 0 | H189: 1 | I189: 0 | J189: 0 | K189: 0 | L189: 0 | M189: 0 | N189: 0 | O189: 0 | P189: 0 | Q189: 0 | S189: =1-SUM(F189:Q189) -> 0
F190: 0 | G190: 0 | H190: 0 | I190: 0 | J190: 0 | K190: 1 | L190: 0 | M190: 0 | N190: 0 | O190: 0 | P190: 0 | Q190: 0 | S190: =1-SUM(F190:Q190) -> 0
F191: 0 | G191: 0 | H191: 0 | I191: 0 | J191: 0 | K191: 1 | L191: 0 | M191: 0 | N191: 0 | O191: 0 | P191: 0 | Q191: 0 | S191: =1-SUM(F191:Q191) -> 0
F192: 0 | G192: 0 | H192: 0 | I192: 0 | J192: 0 | K192: 1 | L192: 0 | M192: 0 | N192: 0 | O192: 0 | P192: 0 | Q192: 0 | S192: =1-SUM(F192:Q192) -> 0
F193: 0 | G193: 0 | H193: 0 | I193: 0 | J193: 0 | K193: 1 | L193: 0 | M193: 0 | N193: 0 | O193: 0 | P193: 0 | Q193: 0 | S193: =1-SUM(F193:Q193) -> 0
F194: 0 | G194: 0 | H194: 0 | I194: 0 | J194: 0 | K194: 1 | L194: 0 | M194: 0 | N194: 0 | O194: 0 | P194: 0 | Q194: 0 | S194: =1-SUM(F194:Q194) -> 0
F195: 0 | G195: 0 | H195: 0 | I195: 0 | J195: 0 | K195: 1 | L195: 0 | M195: 0 | N195: 0 | O195: 0 | P195: 0 | Q195: 0 | S195: =1-SUM(F195:Q195) -> 0
F196: 0 | G196: 0 | H196: 1 | I196: 0 | J196: 0 | K196: 0 | L196: 0 | M196: 0 | N196: 0 | O196: 0 | P196: 0 | Q196: 0 | S196: =1-SUM(F196:Q196) -> 0
F197: 0 | G197: 0 | H197: 1 | I197: 0 | J197: 0 | K197: 0 | L197: 0 | M197: 0 | N197: 0 | O197: 0 | P197: 0 | Q197: 0 | S197: =1-SUM(F197:Q197) -> 0
F198: 0 | G198: 0 | H198: 1 | I198: 0 | J198: 0 | K198: 0 | L198: 0 | M198: 0 | N198: 0 | O198: 0 | P198: 0 | Q198: 0 | S198: =1-SUM(F198:Q198) -> 0
F199: 0 | G199: 0 | H199: 0 | I199: 0 | J199: 0 | K199: 1 | L199: 0 | M199: 0 | N199: 0 | O199: 0 | P199: 0 | Q199: 0 | S199: =1-SUM(F199:Q199) -> 0
F200: 0 | G200: 0 | H200: 0 | I200: 0 | J200: 0 | K200: 1 | L200: 0 | M200: 0 | N200: 0 | O200: 0 | P200: 0 | Q200: 0 | S200: =1-SUM(F200:Q200) -> 0
F201: 0 | G201: 0 | H201: 0 | I201: 0 | J201: 0 | K201: 1 | L201: 0 | M201: 0 | N201: 0 | O201: 0 | P201: 0 | Q201: 0 | S201: =1-SUM(F201:Q201) -> 0
F202: 0 | G202: 0 | H202: 0 | I202: 0 | J202: 0 | K202: 1 | L202: 0 | M202: 0 | N202: 0 | O202: 0 | P202: 0 | Q202: 0 | S202: =1-SUM(F202:Q202) -> 0
F203: 0 | G203: 0 | H203: 0 | I203: 0 | J203: 0 | K203: 1 | L203: 0 | M203: 0 | N203: 0 | O203: 0 | P203: 0 | Q203: 0 | S203: =1-SUM(F203:Q203) -> 0
F204: 0 | G204: 1 | H204: 0 | I204: 0 | J204: 0 | K204: 0 | L204: 0 | M204: 0 | N204: 0 | O204: 0 | P204: 0 | Q204: 0 | S204: =1-SUM(F204:Q204) -> 0
F205: 0 | G205: 0 | H205: 0 | I205: 0 | J205: 0 | K205: 1 | L205: 0 | M205: 0 | N205: 0 | O205: 0 | P205: 0 | Q205: 0 | S205: =1-SUM(F205:Q205) -> 0
F206: 0 | G206: 0 | H206: 0 | I206: 0 | J206: 0 | K206: 1 | L206: 0 | M206: 0 | N206: 0 | O206: 0 | P206: 0 | Q206: 0 | S206: =1-SUM(F206:Q206) -> 0
F207: 0 | G207: 0 | H207: 0 | I207: 0 | J207: 0 | K207: 1 | L207: 0 | M207: 0 | N207: 0 | O207: 0 | P207: 0 | Q207: 0 | S207: =1-SUM(F207:Q207) -> 0
F208: 0 | G208: 0 | H208: 0 | I208: 0 | J208: 0 | K208: 1 | L208: 0 | M208: 0 | N208: 0 | O208: 0 | P208: 0 | Q208: 0 | S208: =1-SUM(F208:Q208) -> 0
F209: 0 | G209: 0 | H209: 0 | I209: 0 | J209: 0 | K209: 1 | L209: 0 | M209: 0 | N209: 0 | O209: 0 | P209: 0 | Q209: 0 | S209: =1-SUM(F209:Q209) -> 0
F210: 0 | G210: 0 | H210: 0 | I210: 0 | J210: 0 | K210: 0 | L210: 0 | M210: 0 | N210: 1 | O210: 0 | P210: 0 | Q210: 0 | S210: =1-SUM(F210:Q210) -> 0
F211: 0 | G211: 0 | H211: 0 | I211: 0 | J211: 0 | K211: 0 | L211: 0 | M211: 0 | N211: 0 | O211: 0 | P211: 1 | Q211: 0 | S211: =1-SUM(F211:Q211) -> 0
F212: 0 | G212: 0 | H212: 0 | I212: 0 | J212: 0 | K212: 1 | L212: 0 | M212: 0 | N212: 0 | O212: 0 | P212: 0 | Q212: 0 | S212: =1-SUM(F212:Q212) -> 0
F213: 0 | G213: 0 | H213: 0 | I213: 0 | J213: 0 | K213: 1 | L213: 0 | M213: 0 | N213: 0 | O213: 0 | P213: 0 | Q213: 0 | S213: =1-SUM(F213:Q213) -> 0
F214: 0 | G214: 0 | H214: 0 | I214: 0 | J214: 0 | K214: 1 | L214: 0 | M214: 0 | N214: 0 | O214: 0 | P214: 0 | Q214: 0 | S214: =1-SUM(F214:Q214) -> 0
F215: 0 | G215: 0 | H215: 0 | I215: 0 | J215: 0 | K215: 1 | L215: 0 | M215: 0 | N215: 0 | O215: 0 | P215: 0 | Q215: 0 | S215: =1-SUM(F215:Q215) -> 0
F216: 0 | G216: 0 | H216: 0 | I216: 0 | J216: 0 | K216: 1 | L216: 0 | M216: 0 | N216: 0 | O216: 0 | P216: 0 | Q216: 0 | S216: =1-SUM(F216:Q216) -> 0
F217: 0 | G217: 0 | H217: 0 | I217: 0 | J217: 0 | K217: 1 | L217: 0 | M217: 0 | N217: 0 | O217: 0 | P217: 0 | Q217: 0 | S217: =1-SUM(F217:Q217) -> 0
F218: 0 | G218: 0 | H218: 0 | I218: 0 | J218: 0 | K218: 1 | L218: 0 | M218: 0 | N218: 0 | O218: 0 | P218: 0 | Q218: 0 | S218: =1-SUM(F218:Q218) -> 0
F219: 0 | G219: 0 | H219: 0 | I219: 0 | J219: 0 | K219: 1 | L219: 0 | M219: 0 | N219: 0 | O219: 0 | P219: 0 | Q219: 0 | S219: =1-SUM(F219:Q219) -> 0
F220: 0 | G220: 0 | H220: 0 | I220: 0 | J220: 0 | K220: 1 | L220: 0 | M220: 0 | N220: 0 | O220: 0 | P220: 0 | Q220: 0 | S220: =1-SUM(F220:Q220) -> 0
F221: 0 | G221: 0 | H221: 0 | I221: 0 | J221: 0 | K221: 1 | L221: 0 | M221: 0 | N221: 0 | O221: 0 | P221: 0 | Q221: 0 | S221: =1-SUM(F221:Q221) -> 0
F222: 0 | G222: 0 | H222: 0 | I222: 0 | J222: 1 | K222: 0 | L222: 0 | M222: 0 | N222: 0 | O222: 0 | P222: 0 | Q222: 0 | S222: =1-SUM(F222:Q222) -> 0
F223: 0 | G223: 0 | H223: 0 | I223: 0 | J223: 0 | K223: 1 | L223: 0 | M223: 0 | N223: 0 | O223: 0 | P223: 0 | Q223: 0 | S223: =1-SUM(F223:Q223) -> 0
F224: 0 | G224: 0 | H224: 0 | I224: 0 | J224: 0 | K224: 1 | L224: 0 | M224: 0 | N224: 0 | O224: 0 | P224: 0 | Q224: 0 | S224: =1-SUM(F224:Q224) -> 0
F225: 0 | G225: 0 | H225: 0 | I225: 0 | J225: 0 | K225: 1 | L225: 0 | M225: 0 | N225: 0 | O225: 0 | P225: 0 | Q225: 0 | S225: =1-SUM(F225:Q225) -> 0
F226: 0 | G226: 0 | H226: 0 | I226: 0 | J226: 0 | K226: 1 | L226: 0 | M226: 0 | N226: 0 | O226: 0 | P226: 0 | Q226: 0 | S226: =1-SUM(F226:Q226) -> 0
F227: 0 | G227: 0 | H227: 0 | I227: 0 | J227: 0 | K227: 1 | L227: 0 | M227: 0 | N227: 0 | O227: 0 | P227: 0 | Q227: 0 | S227: =1-SUM(F227:Q227) -> 0
F228: 0 | G228: 0 | H228: 0 | I228: 0 | J228: 0 | K228: 1 | L228: 0 | M228: 0 | N228: 0 | O228: 0 | P228: 0 | Q228: 0 | S228: =1-SUM(F228:Q228) -> 0
F229: 0 | G229: 0 | H229: 0 | I229: 0 | J229: 0 | K229: 1 | L229: 0 | M229: 0 | N229: 0 | O229: 0 | P229: 0 | Q229: 0 | S229: =1-SUM(F229:Q229) -> 0
F230: 0 | G230: 0 | H230: 0 | I230: 0 | J230: 0 | K230: 1 | L230: 0 | M230: 0 | N230: 0 | O230: 0 | P230: 0 | Q230: 0 | S230: =1-SUM(F230:Q230) -> 0
F231: 0 | G231: 0 | H231: 0 | I231: 0 | J231: 0 | K231: 1 | L231: 0 | M231: 0 | N231: 0 | O231: 0 | P231: 0 | Q231: 0 | S231: =1-SUM(F231:Q231) -> 0
F232: 0 | G232: 0 | H232: 0 | I232: 0 | J232: 0 | K232: 1 | L232: 0 | M232: 0 | N232: 0 | O232: 0 | P232: 0 | Q232: 0 | S232: =1-SUM(F232:Q232) -> 0
F233: 0 | G233: 0 | H233: 0 | I233: 0 | J233: 0 | K233: 1 | L233: 0 | M233: 0 | N233: 0 | O233: 0 | P233: 0 | Q233: 0 | S233: =1-SUM(F233:Q233) -> 0
F234: 0 | G234: 0 | H234: 0 | I234: 0 | J234: 0 | K234: 1 | L234: 0 | M234: 0 | N234: 0 | O234: 0 | P234: 0 | Q234: 0 | S234: =1-SUM(F234:Q234) -> 0
F235: 0 | G235: 0 | H235: 0 | I235: 0 | J235: 0 | K235: 1 | L235: 0 | M235: 0 | N235: 0 | O235: 0 | P235: 0 | Q235: 0 | S235: =1-SUM(F235:Q235) -> 0
F236: 0 | G236: 0 | H236: 0 | I236: 0 | J236: 0 | K236: 1 | L236: 0 | M236: 0 | N236: 0 | O236: 0 | P236: 0 | Q236: 0 | S236: =1-SUM(F236:Q236) -> 0
F237: 0 | G237: 0 | H237: 0 | I237: 0 | J237: 0 | K237: 1 | L237: 0 | M237: 0 | N237: 0 | O237: 0 | P237: 0 | Q237: 0 | S237: =1-SUM(F237:Q237) -> 0
F238: 0 | G238: 0 | H238: 0 | I238: 0 | J238: 0 | K238: 1 | L238: 0 | M238: 0 | N238: 0 | O238: 0 | P238: 0 | Q238: 0 | S238: =1-SUM(F238:Q238) -> 0
F239: 0 | G239: 0 | H239: 0 | I239: 0 | J239: 0 | K239: 1 | L239: 0 | M239: 0 | N239: 0 | O239: 0 | P239: 0 | Q239: 0 | S239: =1-SUM(F239:Q239) -> 0
F240: 0 | G240: 0 | H240: 0 | I240: 0 | J240: 0 | K240: 1 | L240: 0 | M240: 0 | N240: 0 | O240: 0 | P240: 0 | Q240: 0 | S240: =1-SUM(F240:Q240) -> 0
F241: 0 | G241: 0 | H241: 0 | I241: 0 | J241: 0 | K241: 1 | L241: 0 | M241: 0 | N241: 0 | O241: 0 | P241: 0 | Q241: 0 | S241: =1-SUM(F241:Q241) -> 0
F242: 0 | G242: 0 | H242: 0 | I242: 0 | J242: 0 | K242: 1 | L242: 0 | M242: 0 | N242: 0 | O242: 0 | P242: 0 | Q242: 0 | S242: =1-SUM(F242:Q242) -> 0
F243: 0 | G243: 0 | H243: 0 | I243: 0 | J243: 0 | K243: 1 | L243: 0 | M243: 0 | N243: 0 | O243: 0 | P243: 0 | Q243: 0 | S243: =1-SUM(F243:Q243) -> 0
F244: 0 | G244: 0 | H244: 0 | I244: 0 | J244: 0 | K244: 1 | L244: 0 | M244: 0 | N244: 0 | O244: 0 | P244: 0 | Q244: 0 | S244: =1-SUM(F244:Q244) -> 0
F245: 0 | G245: 0 | H245: 0 | I245: 0 | J245: 0 | K245: 1 | L245: 0 | M245: 0 | N245: 0 | O245: 0 | P245: 0 | Q245: 0 | S245: =1-SUM(F245:Q245) -> 0
F246: 0 | G246: 0 | H246: 0 | I246: 0 | J246: 0 | K246: 1 | L246: 0 | M246: 0 | N246: 0 | O246: 0 | P246: 0 | Q246: 0 | S246: =1-SUM(F246:Q246) -> 0
F247: 0 | G247: 0 | H247: 0 | I247: 0 | J247: 0 | K247: 1 | L247: 0 | M247: 0 | N247: 0 | O247: 0 | P247: 0 | Q247: 0 | S247: =1-SUM(F247:Q247) -> 0
F248: 0 | G248: 0 | H248: 0 | I248: 0 | J248: 0 | K248: 1 | L248: 0 | M248: 0 | N248: 0 | O248: 0 | P248: 0 | Q248: 0 | S248: =1-SUM(F248:Q248) -> 0
F249: 0 | G249: 0 | H249: 0 | I249: 0 | J249: 0 | K249: 1 | L249: 0 | M249: 0 | N249: 0 | O249: 0 | P249: 0 | Q249: 0 | S249: =1-SUM(F249:Q249) -> 0
F250: 0 | G250: 0 | H250: 0 | I250: 0 | J250: 0 | K250: 1 | L250: 0 | M250: 0 | N250: 0 | O250: 0 | P250: 0 | Q250: 0 | S250: =1-SUM(F250:Q250) -> 0
F251: 0 | G251: 0 | H251: 0 | I251: 0 | J251: 0 | K251: 1 | L251: 0 | M251: 0 | N251: 0 | O251: 0 | P251: 0 | Q251: 0 | S251: =1-SUM(F251:Q251) -> 0
F252: 0 | G252: 0 | H252: 0 | I252: 0 | J252: 0 | K252: 1 | L252: 0 | M252: 0 | N252: 0 | O252: 0 | P252: 0 | Q252: 0 | S252: =1-SUM(F252:Q252) -> 0
F253: 0 | G253: 0 | H253: 0 | I253: 0 | J253: 0 | K253: 1 | L253: 0 | M253: 0 | N253: 0 | O253: 0 | P253: 0 | Q253: 0 | S253: =1-SUM(F253:Q253) -> 0
F254: 0 | G254: 0 | H254: 0 | I254: 0 | J254: 0 | K254: 1 | L254: 0 | M254: 0 | N254: 0 | O254: 0 | P254: 0 | Q254: 0 | S254: =1-SUM(F254:Q254) -> 0
F255: 0 | G255: 0 | H255: 0 | I255: 0 | J255: 0 | K255: 1 | L255: 0 | M255: 0 | N255: 0 | O255: 0 | P255: 0 | Q255: 0 | S255: =1-SUM(F255:Q255) -> 0
F256: 0 | G256: 0 | H256: 0 | I256: 0 | J256: 0 | K256: 1 | L256: 0 | M256: 0 | N256: 0 | O256: 0 | P256: 0 | Q256: 0 | S256: =1-SUM(F256:Q256) -> 0
F257: 0 | G257: 0 | H257: 0 | I257: 0 | J257: 0 | K257: 1 | L257: 0 | M257: 0 | N257: 0 | O257: 0 | P257: 0 | Q257: 0 | S257: =1-SUM(F257:Q257) -> 0
F258: 0 | G258: 0 | H258: 0 | I258: 0 | J258: 0 | K258: 1 | L258: 0 | M258: 0 | N258: 0 | O258: 0 | P258: 0 | Q258: 0 | S258: =1-SUM(F258:Q258) -> 0
F259: 0 | G259: 0 | H259: 0 | I259: 0 | J259: 0 | K259: 1 | L259: 0 | M259: 0 | N259: 0 | O259: 0 | P259: 0 | Q259: 0 | S259: =1-SUM(F259:Q259) -> 0
F260: 0 | G260: 0 | H260: 0 | I260: 0 | J260: 0 | K260: 1 | L260: 0 | M260: 0 | N260: 0 | O260: 0 | P260: 0 | Q260: 0 | S260: =1-SUM(F260:Q260) -> 0
F261: 0 | G261: 0 | H261: 0 | I261: 0 | J261: 0 | K261: 1 | L261: 0 | M261: 0 | N261: 0 | O261: 0 | P261: 0 | Q261: 0 | S261: =1-SUM(F261:Q261) -> 0
F262: 0 | G262: 0 | H262: 0 | I262: 0 | J262: 0 | K262: 1 | L262: 0 | M262: 0 | N262: 0 | O262: 0 | P262: 0 | Q262: 0 | S262: =1-SUM(F262:Q262) -> 0
F263: 0 | G263: 0 | H263: 0 | I263: 0 | J263: 0 | K263: 1 | L263: 0 | M263: 0 | N263: 0 | O263: 0 | P263: 0 | Q263: 0 | S263: =1-SUM(F263:Q263) -> 0
F264: 0 | G264: 0 | H264: 0 | I264: 0 | J264: 0 | K264: 1 | L264: 0 | M264: 0 | N264: 0 | O264: 0 | P264: 0 | Q264: 0 | S264: =1-SUM(F264:Q264) -> 0
F265: 0 | G265: 0 | H265: 0 | I265: 0 | J265: 0 | K265: 1 | L265: 0 | M265: 0 | N265: 0 | O265: 0 | P265: 0 | Q265: 0 | S265: =1-SUM(F265:Q265) -> 0
F266: 0 | G266: 0 | H266: 0 | I266: 0 | J266: 0 | K266: 1 | L266: 0 | M266: 0 | N266: 0 | O266: 0 | P266: 0 | Q266: 0 | S266: =1-SUM(F266:Q266) -> 0
F267: 0 | G267: 0 | H267: 0 | I267: 0 | J267: 0 | K267: 1 | L267: 0 | M267: 0 | N267: 0 | O267: 0 | P267: 0 | Q267: 0 | S267: =1-SUM(F267:Q267) -> 0
F268: 0 | G268: 0 | H268: 0 | I268: 0 | J268: 0 | K268: 1 | L268: 0 | M268: 0 | N268: 0 | O268: 0 | P268: 0 | Q268: 0 | S268: =1-SUM(F268:Q268) -> 0
F269: 0 | G269: 0 | H269: 0 | I269: 0 | J269: 0 | K269: 1 | L269: 0 | M269: 0 | N269: 0 | O269: 0 | P269: 0 | Q269: 0 | S269: =1-SUM(F269:Q269) -> 0
F270: 0 | G270: 0 | H270: 0 | I270: 0 | J270: 0 | K270: 1 | L270: 0 | M270: 0 | N270: 0 | O270: 0 | P270: 0 | Q270: 0 | S270: =1-SUM(F270:Q270) -> 0
F271: 0 | G271: 0 | H271: 0 | I271: 0 | J271: 0 | K271: 1 | L271: 0 | M271: 0 | N271: 0 | O271: 0 | P271: 0 | Q271: 0 | S271: =1-SUM(F271:Q271) -> 0
F272: 0 | G272: 0 | H272: 0 | I272: 0 | J272: 0 | K272: 1 | L272: 0 | M272: 0 | N272: 0 | O272: 0 | P272: 0 | Q272: 0 | S272: =1-SUM(F272:Q272) -> 0
F273: 0 | G273: 0 | H273: 0 | I273: 0 | J273: 0 | K273: 1 | L273: 0 | M273: 0 | N273: 0 | O273: 0 | P273: 0 | Q273: 0 | S273: =1-SUM(F273:Q273) -> 0
F274: 0 | G274: 0 | H274: 0 | I274: 0 | J274: 0 | K274: 1 | L274: 0 | M274: 0 | N274: 0 | O274: 0 | P274: 0 | Q274: 0 | S274: =1-SUM(F274:Q274) -> 0
F275: 0 | G275: 0 | H275: 0 | I275: 0 | J275: 0 | K275: 1 | L275: 0 | M275: 0 | N275: 0 | O275: 0 | P275: 0 | Q275: 0 | S275: =1-SUM(F275:Q275) -> 0
F276: 0 | G276: 0 | H276: 0 | I276: 0 | J276: 0 | K276: 1 | L276: 0 | M276: 0 | N276: 0 | O276: 0 | P276: 0 | Q276: 0 | S276: =1-SUM(F276:Q276) -> 0
F277: 0 | G277: 0 | H277: 0 | I277: 0 | J277: 0 | K277: 1 | L277: 0 | M277: 0 | N277: 0 | O277: 0 | P277: 0 | Q277: 0 | S277: =1-SUM(F277:Q277) -> 0
F278: 0 | G278: 0 | H278: 0 | I278: 0 | J278: 0 | K278: 1 | L278: 0 | M278: 0 | N278: 0 | O278: 0 | P278: 0 | Q278: 0 | S278: =1-SUM(F278:Q278) -> 0
F279: 0 | G279: 0 | H279: 0 | I279: 0 | J279: 0 | K279: 1 | L279: 0 | M279: 0 | N279: 0 | O279: 0 | P279: 0 | Q279: 0 | S279: =1-SUM(F279:Q279) -> 0
F280: 0 | G280: 0 | H280: 0 | I280: 0 | J280: 0 | K280: 1 | L280: 0 | M280: 0 | N280: 0 | O280: 0 | P280: 0 | Q280: 0 | S280: =1-SUM(F280:Q280) -> 0
F281: 0 | G281: 0 | H281: 0 | I281: 0 | J281: 0 | K281: 1 | L281: 0 | M281: 0 | N281: 0 | O281: 0 | P281: 0 | Q281: 0 | S281: =1-SUM(F281:Q281) -> 0
F282: 0 | G282: 0 | H282: 0 | I282: 0 | J282: 0 | K282: 1 | L282: 0 | M282: 0 | N282: 0 | O282: 0 | P282: 0 | Q282: 0 | S282: =1-SUM(F282:Q282) -> 0
F283: 0 | G283: 0 | H283: 0 | I283: 0 | J283: 0 | K283: 1 | L283: 0 | M283: 0 | N283: 0 | O283: 0 | P283: 0 | Q283: 0 | S283: =1-SUM(F283:Q283) -> 0
F284: 0 | G284: 0 | H284: 0 | I284: 0 | J284: 0 | K284: 1 | L284: 0 | M284: 0 | N284: 0 | O284: 0 | P284: 0 | Q284: 0 | S284: =1-SUM(F284:Q284) -> 0
F285: 0 | G285: 0 | H285: 0 | I285: 0 | J285: 0 | K285: 1 | L285: 0 | M285: 0 | N285: 0 | O285: 0 | P285: 0 | Q285: 0 | S285: =1-SUM(F285:Q285) -> 0
F286: 0 | G286: 0 | H286: 0 | I286: 0 | J286: 0 | K286: 1 | L286: 0 | M286: 0 | N286: 0 | O286: 0 | P286: 0 | Q286: 0 | S286: =1-SUM(F286:Q286) -> 0
F287: 0 | G287: 0 | H287: 0 | I287: 0 | J287: 0 | K287: 1 | L287: 0 | M287: 0 | N287: 0 | O287: 0 | P287: 0 | Q287: 0 | S287: =1-SUM(F287:Q287) -> 0
F288: 0 | G288: 0 | H288: 0 | I288: 0 | J288: 0 | K288: 1 | L288: 0 | M288: 0 | N288: 0 | O288: 0 | P288: 0 | Q288: 0 | S288: =1-SUM(F288:Q288) -> 0
F289: 0 | G289: 0 | H289: 0 | I289: 0 | J289: 0 | K289: 1 | L289: 0 | M289: 0 | N289: 0 | O289: 0 | P289: 0 | Q289: 0 | S289: =1-SUM(F289:Q289) -> 0
F290: 0 | G290: 0 | H290: 0 | I290: 0 | J290: 0 | K290: 1 | L290: 0 | M290: 0 | N290: 0 | O290: 0 | P290: 0 | Q290: 0 | S290: =1-SUM(F290:Q290) -> 0
F291: 0 | G291: 0 | H291: 0 | I291: 0 | J291: 0 | K291: 1 | L291: 0 | M291: 0 | N291: 0 | O291: 0 | P291: 0 | Q291: 0 | S291: =1-SUM(F291:Q291) -> 0
F292: 0 | G292: 0 | H292: 0 | I292: 0 | J292: 0 | K292: 1 | L292: 0 | M292: 0 | N292: 0 | O292: 0 | P292: 0 | Q292: 0 | S292: =1-SUM(F292:Q292) -> 0
F293: 0 | G293: 0 | H293: 0 | I293: 0 | J293: 0 | K293: 1 | L293: 0 | M293: 0 | N293: 0 | O293: 0 | P293: 0 | Q293: 0 | S293: =1-SUM(F293:Q293) -> 0
F294: 0 | G294: 0 | H294: 0 | I294: 0 | J294: 0 | K294: 0 | L294: 0 | M294: 0 | N294: 0 | O294: 0 | P294: 0 | Q294: 0 | S294: =1-SUM(F294:Q294) -> 1
F295: 0 | G295: 0 | H295: 0 | I295: 0 | J295: 0 | K295: 1 | L295: 0 | M295: 0 | N295: 0 | O295: 0 | P295: 0 | Q295: 0 | S295: =1-SUM(F295:Q295) -> 0
F296: 0 | G296: 0 | H296: 0 | I296: 0 | J296: 0 | K296: 1 | L296: 0 | M296: 0 | N296: 0 | O296: 0 | P296: 0 | Q296: 0 | S296: =1-SUM(F296:Q296) -> 0
F297: 0 | G297: 0 | H297: 0 | I297: 0 | J297: 0 | K297: 1 | L297: 0 | M297: 0 | N297: 0 | O297: 0 | P297: 0 | Q297: 0 | S297: =1-SUM(F297:Q297) -> 0
F298: 0 | G298: 0 | H298: 0 | I298: 0 | J298: 0 | K298: 0 | L298: 1 | M298: 0 | N298: 0 | O298: 0 | P298: 0 | Q298: 0 | S298: =1-SUM(F298:Q298) -> 0
F299: 0 | G299: 0 | H299: 0 | I299: 0 | J299: 0 | K299: 1 | L299: 0 | M299: 0 | N299: 0 | O299: 0 | P299: 0 | Q299: 0 | S299: =1-SUM(F299:Q299) -> 0
F300: 0 | G300: 0 | H300: 0 | I300: 0 | J300: 0 | K300: 1 | L300: 0 | M300: 0 | N300: 0 | O300: 0 | P300: 0 | Q300: 0 | S300: =1-SUM(F300:Q300) -> 0
F301: 0 | G301: 0 | H301: 0 | I301: 0 | J301: 0 | K301: 0 | L301: 0 | M301: 0 | N301: 0 | O301: 0 | P301: 0 | Q301: 1 | S301: =1-SUM(F301:Q301) -> 0
F302: 0 | G302: 0 | H302: 0 | I302: 0 | J302: 0 | K302: 0 | L302: 0 | M302: 0 | N302: 0 | O302: 0 | P302: 0 | Q302: 1 | S302: =1-SUM(F302:Q302) -> 0
F303: 0 | G303: 0 | H303: 0 | I303: 0 | J303: 0 | K303: 0 | L303: 0 | M303: 0 | N303: 0 | O303: 0 | P303: 0 | Q303: 0 | S303: =1-SUM(F303:Q303) -> 1
F304: 0 | G304: 0 | H304: 0 | I304: 0 | J304: 0 | K304: 0 | L304: 0 | M304: 0 | N304: 0 | O304: 0 | P304: 0 | Q304: 0 | S304: =1-SUM(F304:Q304) -> 1
F305: 0 | G305: 0 | H305: 0 | I305: 0 | J305: 0 | K305: 0 | L305: 0 | M305: 0 | N305: 0 | O305: 0 | P305: 0 | Q305: 0 | S305: =1-SUM(F305:Q305) -> 1
F306: 0 | G306: 0 | H306: 0 | I306: 0 | J306: 0 | K306: 0 | L306: 0 | M306: 0 | N306: 0 | O306: 0 | P306: 0 | Q306: 0 | S306: =1-SUM(F306:Q306) -> 1
F307: 0 | G307: 0 | H307: 0 | I307: 0 | J307: 0 | K307: 0 | L307: 0 | M307: 0 | N307: 0 | O307: 0 | P307: 0 | Q307: 0 | S307: =1-SUM(F307:Q307) -> 1
F308: 0 | G308: 0 | H308: 0 | I308: 0 | J308: 0 | K308: 0 | L308: 0 | M308: 0 | N308: 0 | O308: 0 | P308: 0 | Q308: 0 | S308: =1-SUM(F308:Q308) -> 1
F309: 0 | G309: 0 | H309: 0 | I309: 0 | J309: 0 | K309: 0 | L309: 0 | M309: 0 | N309: 0 | O309: 0 | P309: 0 | Q309: 0 | S309: =1-SUM(F309:Q309) -> 1
F310: 0 | G310: 0 | H310: 0 | I310: 0 | J310: 0 | K310: 0 | L310: 0 | M310: 0 | N310: 0 | O310: 0 | P310: 0 | Q310: 0 | S310: =1-SUM(F310:Q310) -> 1
F311: 0 | G311: 0 | H311: 0 | I311: 0 | J311: 0 | K311: 1 | L311: 0 | M311: 0 | N311: 0 | O311: 0 | P311: 0 | Q311: 0 | S311: =1-SUM(F311:Q311) -> 0
F312: 0 | G312: 0 | H312: 0 | I312: 0 | J312: 0 | K312: 1 | L312: 0 | M312: 0 | N312: 0 | O312: 0 | P312: 0 | Q312: 0 | S312: =1-SUM(F312:Q312) -> 0
F313: 0 | G313: 0 | H313: 0 | I313: 0 | J313: 0 | K313: 1 | L313: 0 | M313: 0 | N313: 0 | O313: 0 | P313: 0 | Q313: 0 | S313: =1-SUM(F313:Q313) -> 0
F314: 0 | G314: 0 | H314: 0 | I314: 0 | J314: 0 | K314: 1 | L314: 0 | M314: 0 | N314: 0 | O314: 0 | P314: 0 | Q314: 0 | S314: =1-SUM(F314:Q314) -> 0
F315: 0 | G315: 0 | H315: 0 | I315: 0 | J315: 0 | K315: 1 | L315: 0 | M315: 0 | N315: 0 | O315: 0 | P315: 0 | Q315: 0 | S315: =1-SUM(F315:Q315) -> 0
F316: 0 | G316: 0 | H316: 0 | I316: 0 | J316: 0 | K316: 1 | L316: 0 | M316: 0 | N316: 0 | O316: 0 | P316: 0 | Q316: 0 | S316: =1-SUM(F316:Q316) -> 0
F317: 0 | G317: 0 | H317: 0 | I317: 0 | J317: 0 | K317: 1 | L317: 0 | M317: 0 | N317: 0 | O317: 0 | P317: 0 | Q317: 0 | S317: =1-SUM(F317:Q317) -> 0
F318: 0 | G318: 0 | H318: 0 | I318: 0 | J318: 0 | K318: 1 | L318: 0 | M318: 0 | N318: 0 | O318: 0 | P318: 0 | Q318: 0 | S318: =1-SUM(F318:Q318) -> 0
F319: 0 | G319: 0 | H319: 0 | I319: 0 | J319: 0 | K319: 1 | L319: 0 | M319: 0 | N319: 0 | O319: 0 | P319: 0 | Q319: 0 | S319: =1-SUM(F319:Q319) -> 0
F320: 0 | G320: 0 | H320: 0 | I320: 0 | J320: 0 | K320: 1 | L320: 0 | M320: 0 | N320: 0 | O320: 0 | P320: 0 | Q320: 0 | S320: =1-SUM(F320:Q320) -> 0
F321: 0 | G321: 0 | H321: 0 | I321: 0 | J321: 0 | K321: 1 | L321: 0 | M321: 0 | N321: 0 | O321: 0 | P321: 0 | Q321: 0 | S321: =1-SUM(F321:Q321) -> 0
F322: 0 | G322: 0 | H322: 0 | I322: 0 | J322: 0 | K322: 0 | L322: 0 | M322: 0 | N322: 0 | O322: 0 | P322: 0 | Q322: 0 | S322: =1-SUM(F322:Q322) -> 1
F323: 0 | G323: 0 | H323: 0 | I323: 0 | J323: 0 | K323: 0 | L323: 0 | M323: 0 | N323: 0 | O323: 0 | P323: 0 | Q323: 0 | S323: =1-SUM(F323:Q323) -> 1
F324: 0 | G324: 0 | H324: 0 | I324: 0 | J324: 0 | K324: 0 | L324: 0 | M324: 0 | N324: 0 | O324: 0 | P324: 0 | Q324: 0 | S324: =1-SUM(F324:Q324) -> 1
F325: 0 | G325: 0 | H325: 0 | I325: 0 | J325: 0 | K325: 0 | L325: 0 | M325: 0 | N325: 0 | O325: 0 | P325: 0 | Q325: 0 | S325: =1-SUM(F325:Q325) -> 1
F326: 0 | G326: 0 | H326: 0 | I326: 0 | J326: 0 | K326: 0 | L326: 0 | M326: 0 | N326: 0 | O326: 0 | P326: 0 | Q326: 0 | S326: =1-SUM(F326:Q326) -> 1
F327: 0 | G327: 0 | H327: 0 | I327: 0 | J327: 0 | K327: 0 | L327: 0 | M327: 0 | N327: 0 | O327: 0 | P327: 0 | Q327: 0 | S327: =1-SUM(F327:Q327) -> 1
F328: 0 | G328: 0 | H328: 0 | I328: 0 | J328: 0 | K328: 0 | L328: 0 | M328: 0 | N328: 0 | O328: 0 | P328: 0 | Q328: 0 | S328: =1-SUM(F328:Q328) -> 1
F329: 0 | G329: 0 | H329: 0 | I329: 0 | J329: 0 | K329: 0 | L329: 0 | M329: 0 | N329: 0 | O329: 0 | P329: 0 | Q329: 0 | S329: =1-SUM(F329:Q329) -> 1
F330: 0 | G330: 0 | H330: 0 | I330: 0 | J330: 0 | K330: 0 | L330: 0 | M330: 0 | N330: 0 | O330: 0 | P330: 0 | Q330: 0 | S330: =1-SUM(F330:Q330) -> 1
F331: 0 | G331: 0 | H331: 0 | I331: 0 | J331: 0 | K331: 1 | L331: 0 | M331: 0 | N331: 0 | O331: 0 | P331: 0 | Q331: 0 | S331: =1-SUM(F331:Q331) -> 0
F332: 0 | G332: 0 | H332: 0 | I332: 0 | J332: 0 | K332: 1 | L332: 0 | M332: 0 | N332: 0 | O332: 0 | P332: 0 | Q332: 0 | S332: =1-SUM(F332:Q332) -> 0
F333: 0 | G333: 0 | H333: 0 | I333: 0 | J333: 0 | K333: 1 | L333: 0 | M333: 0 | N333: 0 | O333: 0 | P333: 0 | Q333: 0 | S333: =1-SUM(F333:Q333) -> 0
F334: 0 | G334: 0 | H334: 0 | I334: 0 | J334: 0 | K334: 1 | L334: 0 | M334: 0 | N334: 0 | O334: 0 | P334: 0 | Q334: 0 | S334: =1-SUM(F334:Q334) -> 0
F335: 0 | G335: 0 | H335: 0 | I335: 0 | J335: 0 | K335: 1 | L335: 0 | M335: 0 | N335: 0 | O335: 0 | P335: 0 | Q335: 0 | S335: =1-SUM(F335:Q335) -> 0
F336: 0 | G336: 0 | H336: 0 | I336: 0 | J336: 0 | K336: 1 | L336: 0 | M336: 0 | N336: 0 | O336: 0 | P336: 0 | Q336: 0 | S336: =1-SUM(F336:Q336) -> 0
F337: 0 | G337: 0 | H337: 0 | I337: 0 | J337: 0 | K337: 1 | L337: 0 | M337: 0 | N337: 0 | O337: 0 | P337: 0 | Q337: 0 | S337: =1-SUM(F337:Q337) -> 0
F338: 0 | G338: 0 | H338: 0 | I338: 0 | J338: 0 | K338: 1 | L338: 0 | M338: 0 | N338: 0 | O338: 0 | P338: 0 | Q338: 0 | S338: =1-SUM(F338:Q338) -> 0
F339: 0 | G339: 0 | H339: 0 | I339: 0 | J339: 0 | K339: 1 | L339: 0 | M339: 0 | N339: 0 | O339: 0 | P339: 0 | Q339: 0 | S339: =1-SUM(F339:Q339) -> 0
F340: 0 | G340: 0 | H340: 0 | I340: 0 | J340: 0 | K340: 1 | L340: 0 | M340: 0 | N340: 0 | O340: 0 | P340: 0 | Q340: 0 | S340: =1-SUM(F340:Q340) -> 0
F341: 0 | G341: 0 | H341: 0 | I341: 0 | J341: 0 | K341: 1 | L341: 0 | M341: 0 | N341: 0 | O341: 0 | P341: 0 | Q341: 0 | S341: =1-SUM(F341:Q341) -> 0
F342: 0 | G342: 0 | H342: 0 | I342: 0 | J342: 0 | K342: 1 | L342: 0 | M342: 0 | N342: 0 | O342: 0 | P342: 0 | Q342: 0 | S342: =1-SUM(F342:Q342) -> 0
F343: 0 | G343: 0 | H343: 0 | I343: 0 | J343: 0 | K343: 1 | L343: 0 | M343: 0 | N343: 0 | O343: 0 | P343: 0 | Q343: 0 | S343: =1-SUM(F343:Q343) -> 0
F344: 0 | G344: 0 | H344: 0 | I344: 0 | J344: 0 | K344: 1 | L344: 0 | M344: 0 | N344: 0 | O344: 0 | P344: 0 | Q344: 0 | S344: =1-SUM(F344:Q344) -> 0
F345: 0 | G345: 0 | H345: 0 | I345: 0 | J345: 0 | K345: 1 | L345: 0 | M345: 0 | N345: 0 | O345: 0 | P345: 0 | Q345: 0 | S345: =1-SUM(F345:Q345) -> 0
F346: 0 | G346: 0 | H346: 0 | I346: 0 | J346: 0 | K346: 1 | L346: 0 | M346: 0 | N346: 0 | O346: 0 | P346: 0 | Q346: 0 | S346: =1-SUM(F346:Q346) -> 0
F347: 0 | G347: 0 | H347: 0 | I347: 0 | J347: 0 | K347: 1 | L347: 0 | M347: 0 | N347: 0 | O347: 0 | P347: 0 | Q347: 0 | S347: =1-SUM(F347:Q347) -> 0
F348: 0 | G348: 0 | H348: 0 | I348: 0 | J348: 0 | K348: 1 | L348: 0 | M348: 0 | N348: 0 | O348: 0 | P348: 0 | Q348: 0 | S348: =1-SUM(F348:Q348) -> 0
F349: 0 | G349: 0 | H349: 0 | I349: 0 | J349: 0 | K349: 1 | L349: 0 | M349: 0 | N349: 0 | O349: 0 | P349: 0 | Q349: 0 | S349: =1-SUM(F349:Q349) -> 0
F350: 0 | G350: 0 | H350: 0 | I350: 0 | J350: 0 | K350: 1 | L350: 0 | M350: 0 | N350: 0 | O350: 0 | P350: 0 | Q350: 0 | S350: =1-SUM(F350:Q350) -> 0
F351: 0 | G351: 0 | H351: 0 | I351: 0 | J351: 0 | K351: 1 | L351: 0 | M351: 0 | N351: 0 | O351: 0 | P351: 0 | Q351: 0 | S351: =1-SUM(F351:Q351) -> 0
F352: 0 | G352: 0 | H352: 0 | I352: 0 | J352: 0 | K352: 1 | L352: 0 | M352: 0 | N352: 0 | O352: 0 | P352: 0 | Q352: 0 | S352: =1-SUM(F352:Q352) -> 0
F353: 0 | G353: 0 | H353: 0 | I353: 0 | J353: 0 | K353: 1 | L353: 0 | M353: 0 | N353: 0 | O353: 0 | P353: 0 | Q353: 0 | S353: =1-SUM(F353:Q353) -> 0
F354: 0 | G354: 0 | H354: 0 | I354: 0 | J354: 0 | K354: 1 | L354: 0 | M354: 0 | N354: 0 | O354: 0 | P354: 0 | Q354: 0 | S354: =1-SUM(F354:Q354) -> 0
F355: 0 | G355: 0 | H355: 0 | I355: 0 | J355: 0 | K355: 1 | L355: 0 | M355: 0 | N355: 0 | O355: 0 | P355: 0 | Q355: 0 | S355: =1-SUM(F355:Q355) -> 0
F356: 0 | G356: 0 | H356: 0 | I356: 0 | J356: 0 | K356: 1 | L356: 0 | M356: 0 | N356: 0 | O356: 0 | P356: 0 | Q356: 0 | S356: =1-SUM(F356:Q356) -> 0
F357: 0 | G357: 0 | H357: 0 | I357: 0 | J357: 0 | K357: 1 | L357: 0 | M357: 0 | N357: 0 | O357: 0 | P357: 0 | Q357: 0 | S357: =1-SUM(F357:Q357) -> 0
F358: 0 | G358: 0 | H358: 0 | I358: 0 | J358: 0 | K358: 1 | L358: 0 | M358: 0 | N358: 0 | O358: 0 | P358: 0 | Q358: 0 | S358: =1-SUM(F358:Q358) -> 0
F359: 0 | G359: 0 | H359: 0 | I359: 0 | J359: 0 | K359: 1 | L359: 0 | M359: 0 | N359: 0 | O359: 0 | P359: 0 | Q359: 0 | S359: =1-SUM(F359:Q359) -> 0
F360: 0 | G360: 0 | H360: 0 | I360: 0 | J360: 0 | K360: 1 | L360: 0 | M360: 0 | N360: 0 | O360: 0 | P360: 0 | Q360: 0 | S360: =1-SUM(F360:Q360) -> 0
F361: 0 | G361: 0 | H361: 0 | I361: 0 | J361: 0 | K361: 1 | L361: 0 | M361: 0 | N361: 0 | O361: 0 | P361: 0 | Q361: 0 | S361: =1-SUM(F361:Q361) -> 0
F362: 0 | G362: 0 | H362: 0 | I362: 0 | J362: 0 | K362: 1 | L362: 0 | M362: 0 | N362: 0 | O362: 0 | P362: 0 | Q362: 0 | S362: =1-SUM(F362:Q362) -> 0
F363: 0 | G363: 0 | H363: 0 | I363: 0 | J363: 0 | K363: 1 | L363: 0 | M363: 0 | N363: 0 | O363: 0 | P363: 0 | Q363: 0 | S363: =1-SUM(F363:Q363) -> 0
F364: 0 | G364: 0 | H364: 0 | I364: 0 | J364: 0 | K364: 1 | L364: 0 | M364: 0 | N364: 0 | O364: 0 | P364: 0 | Q364: 0 | S364: =1-SUM(F364:Q364) -> 0
F365: 0 | G365: 0 | H365: 0 | I365: 0 | J365: 0 | K365: 1 | L365: 0 | M365: 0 | N365: 0 | O365: 0 | P365: 0 | Q365: 0 | S365: =1-SUM(F365:Q365) -> 0
F366: 0 | G366: 0 | H366: 0 | I366: 0 | J366: 0 | K366: 1 | L366: 0 | M366: 0 | N366: 0 | O366: 0 | P366: 0 | Q366: 0 | S366: =1-SUM(F366:Q366) -> 0
F367: 0 | G367: 0 | H367: 0 | I367: 0 | J367: 0 | K367: 1 | L367: 0 | M367: 0 | N367: 0 | O367: 0 | P367: 0 | Q367: 0 | S367: =1-SUM(F367:Q367) -> 0
F368: 0 | G368: 0 | H368: 0 | I368: 0 | J368: 0 | K368: 1 | L368: 0 | M368: 0 | N368: 0 | O368: 0 | P368: 0 | Q368: 0 | S368: =1-SUM(F368:Q368) -> 0
F369: 0 | G369: 0 | H369: 0 | I369: 0 | J369: 0 | K369: 1 | L369: 0 | M369: 0 | N369: 0 | O369: 0 | P369: 0 | Q369: 0 | S369: =1-SUM(F369:Q369) -> 0
F370: 0 | G370: 0 | H370: 0 | I370: 0 | J370: 0 | K370: 1 | L370: 0 | M370: 0 | N370: 0 | O370: 0 | P370: 0 | Q370: 0 | S370: =1-SUM(F370:Q370) -> 0
F371: 0 | G371: 0 | H371: 0 | I371: 0 | J371: 0 | K371: 1 | L371: 0 | M371: 0 | N371: 0 | O371: 0 | P371: 0 | Q371: 0 | S371: =1-SUM(F371:Q371) -> 0
F372: 0 | G372: 0 | H372: 0 | I372: 0 | J372: 0 | K372: 1 | L372: 0 | M372: 0 | N372: 0 | O372: 0 | P372: 0 | Q372: 0 | S372: =1-SUM(F372:Q372) -> 0
F373: 0 | G373: 0 | H373: 0 | I373: 0 | J373: 0 | K373: 1 | L373: 0 | M373: 0 | N373: 0 | O373: 0 | P373: 0 | Q373: 0 | S373: =1-SUM(F373:Q373) -> 0
F374: 0 | G374: 0 | H374: 0 | I374: 0 | J374: 0 | K374: 1 | L374: 0 | M374: 0 | N374: 0 | O374: 0 | P374: 0 | Q374: 0 | S374: =1-SUM(F374:Q374) -> 0
F375: 0 | G375: 0 | H375: 0 | I375: 0 | J375: 0 | K375: 1 | L375: 0 | M375: 0 | N375: 0 | O375: 0 | P375: 0 | Q375: 0 | S375: =1-SUM(F375:Q375) -> 0
F376: 0 | G376: 0 | H376: 0 | I376: 0 | J376: 0 | K376: 1 | L376: 0 | M376: 0 | N376: 0 | O376: 0 | P376: 0 | Q376: 0 | S376: =1-SUM(F376:Q376) -> 0
F377: 0 | G377: 0 | H377: 0 | I377: 0 | J377: 0 | K377: 1 | L377: 0 | M377: 0 | N377: 0 | O377: 0 | P377: 0 | Q377: 0 | S377: =1-SUM(F377:Q377) -> 0
F378: 0 | G378: 0 | H378: 0 | I378: 0 | J378: 0 | K378: 1 | L378: 0 | M378: 0 | N378: 0 | O378: 0 | P378: 0 | Q378: 0 | S378: =1-SUM(F378:Q378) -> 0
F379: 0 | G379: 0 | H379: 0 | I379: 0 | J379: 0 | K379: 0 | L379: 0 | M379: 0 | N379: 0 | O379: 0 | P379: 0 | Q379: 0 | S379: =1-SUM(F379:Q379) -> 1
F380: 0 | G380: 0 | H380: 0 | I380: 0 | J380: 0 | K380: 1 | L380: 0 | M380: 0 | N380: 0 | O380: 0 | P380: 0 | Q380: 0 | S380: =1-SUM(F380:Q380) -> 0
F381: 0 | G381: 0 | H381: 0 | I381: 0 | J381: 0 | K381: 1 | L381: 0 | M381: 0 | N381: 0 | O381: 0 | P381: 0 | Q381: 0 | S381: =1-SUM(F381:Q381) -> 0
F382: 0 | G382: 0 | H382: 0 | I382: 0 | J382: 0 | K382: 1 | L382: 0 | M382: 0 | N382: 0 | O382: 0 | P382: 0 | Q382: 0 | S382: =1-SUM(F382:Q382) -> 0
F383: 0 | G383: 0 | H383: 0 | I383: 0 | J383: 0 | K383: 1 | L383: 0 | M383: 0 | N383: 0 | O383: 0 | P383: 0 | Q383: 0 | S383: =1-SUM(F383:Q383) -> 0
F384: 0 | G384: 0 | H384: 0 | I384: 0 | J384: 0 | K384: 1 | L384: 0 | M384: 0 | N384: 0 | O384: 0 | P384: 0 | Q384: 0 | S384: =1-SUM(F384:Q384) -> 0
F385: 0 | G385: 0 | H385: 0 | I385: 0 | J385: 0 | K385: 1 | L385: 0 | M385: 0 | N385: 0 | O385: 0 | P385: 0 | Q385: 0 | S385: =1-SUM(F385:Q385) -> 0
F386: 0 | G386: 0 | H386: 0 | I386: 0 | J386: 0 | K386: 1 | L386: 0 | M386: 0 | N386: 0 | O386: 0 | P386: 0 | Q386: 0 | S386: =1-SUM(F386:Q386) -> 0
F387: 0 | G387: 0 | H387: 0 | I387: 0 | J387: 0 | K387: 1 | L387: 0 | M387: 0 | N387: 0 | O387: 0 | P387: 0 | Q387: 0 | S387: =1-SUM(F387:Q387) -> 0
F388: 0 | G388: 0 | H388: 0 | I388: 0 | J388: 0 | K388: 1 | L388: 0 | M388: 0 | N388: 0 | O388: 0 | P388: 0 | Q388: 0 | S388: =1-SUM(F388:Q388) -> 0
F389: 0 | G389: 0 | H389: 0 | I389: 0 | J389: 1 | K389: 0 | L389: 0 | M389: 0 | N389: 0 | O389: 0 | P389: 0 | Q389: 0 | S389: =1-SUM(F389:Q389) -> 0
F390: 0 | G390: 0 | H390: 0 | I390: 0 | J390: 1 | K390: 0 | L390: 0 | M390: 0 | N390: 0 | O390: 0 | P390: 0 | Q390: 0 | S390: =1-SUM(F390:Q390) -> 0
F391: 0 | G391: 0 | H391: 0 | I391: 0 | J391: 0 | K391: 1 | L391: 0 | M391: 0 | N391: 0 | O391: 0 | P391: 0 | Q391: 0 | S391: =1-SUM(F391:Q391) -> 0
F392: 0 | G392: 0 | H392: 0 | I392: 0 | J392: 0 | K392: 1 | L392: 0 | M392: 0 | N392: 0 | O392: 0 | P392: 0 | Q392: 0 | S392: =1-SUM(F392:Q392) -> 0
F393: 0 | G393: 0 | H393: 0 | I393: 0 | J393: 0 | K393: 1 | L393: 0 | M393: 0 | N393: 0 | O393: 0 | P393: 0 | Q393: 0 | S393: =1-SUM(F393:Q393) -> 0
F394: 0 | G394: 0 | H394: 0 | I394: 0 | J394: 0 | K394: 1 | L394: 0 | M394: 0 | N394: 0 | O394: 0 | P394: 0 | Q394: 0 | S394: =1-SUM(F394:Q394) -> 0
F395: 0 | G395: 0 | H395: 0 | I395: 0 | J395: 0 | K395: 1 | L395: 0 | M395: 0 | N395: 0 | O395: 0 | P395: 0 | Q395: 0 | S395: =1-SUM(F395:Q395) -> 0
F396: 0 | G396: 0 | H396: 0 | I396: 0 | J396: 0 | K396: 1 | L396: 0 | M396: 0 | N396: 0 | O396: 0 | P396: 0 | Q396: 0 | S396: =1-SUM(F396:Q396) -> 0
F397: 0 | G397: 0 | H397: 0 | I397: 0 | J397: 0 | K397: 1 | L397: 0 | M397: 0 | N397: 0 | O397: 0 | P397: 0 | Q397: 0 | S397: =1-SUM(F397:Q397) -> 0