A1: Suddivisione Corsi per Regione
A3: Regione | B3: Università | C3: Numero corsi | D3: Totale corsi
A4: Abruzzo | B4: L'Aquila | C4: 8 | D4: =SUM(C4:C5) -> 11
B5: Chieti e Pescara | C5: 3
A6: Calabria | B6: della Calabria | C6: 40 | D6: =SUM(C6:C8) -> 43
B7: Catanzaro | C7: 2
B8: Mediterranea | C8: 1
A9: Campania | B9: Napoli Federico II | C9: 12 | D9: =SUM(C9:C13) -> 24
B10: Salerno | C10: 7
B11: Benevento | C11: 2
B12: Napoli Parthenope | C12: 2
B13: Napoli Seconda Università | C13: 1
A14: Emilia Romagna | B14: Bologna | C14: 24 | D14: =SUM(C14:C17) -> 39
B15: Modena e Reggio Emilia | C15: 9
B16: Ferrara | C16: 4
B17: Parma | C17: 2
A18: Friuli Venezia Giulia | B18: Udine | C18: 9 | D18: =SUM(C18) -> 9
A19: Lazio | B19: Roma La Sapienza | C19: 30 | D19: =SUM(C19:C21) -> 48
B20: Roma Tor Vergata | C20: 12
B21: Roma Tre | C21: 6
A22: Liguria | B22: Genova | C22: 26 | D22: =SUM(C22) -> 26
A23: Lombardia | B23: Poltecnico di Milano | C23: 21 | D23: =SUM(C23:C27) -> 46
B24: Milano Bicocca | C24: 10
B25: Brescia | C25: 8
B26: Milano Statale | C26: 5
B27: Milano Cattolica | C27: 2
A28: Marche | B28: Camerino | C28: 9 | D28: =SUM(C28:C29) -> 16
B29: Politecnico delle Marche | C29: 7
A30: Piemonte | B30: Torino PoliTO | C30: 14 | D30: =SUM(C30:C32) -> 18
B31: Torino | C31: 2
B32: Piemonte Orientale | C32: 2
A33: Puglia | B33: Foggia | C33: 2 | D33: =SUM(C33:C35) -> 20
B34: Lecce | C34: 11
B35: Bari | C35: 7
A36: Sardegna | B36: Cagliari | C36: 3 | D36: =SUM(C36:C37) -> 4
B37: Sassari | C37: 1
A38: Sicilia | B38: Palermo | C38: 8 | D38: =SUM(C38:C40) -> 16
B39: Catania | C39: 5
B40: Messina | C40: 3
A41: Toscana | B41: Firenze | C41: 13 | D41: =SUM(C41:C43) -> 33
B42: Pisa | C42: 15
B43: Siena | C43: 5
A44: Trentino Alto Adige | B44: Trento | C44: 7 | D44: =SUM(C44:C45) -> 11
B45: Bolzano | C45: 4
A46: Umbria | B46: Perugia | C46: 5 | D46: =SUM(C46) -> 5
A47: Veneto | B47: Padova | C47: 14 | D47: =SUM(C47:C48) -> 25
B48: Ca' Foscari | C48: 11
A49: Totale | D49: =SUM(D4:D48) -> 394