A1: Suddivisione Corsi per Università
F2: Bari | G2: Benevento | H2: Bologna | I2: Bolzano | J2: Brescia | K2: Ca' Foscari | L2: Cagliari | M2: Camerino | N2: Catania | O2: Catanzaro | P2: Chieti e Pescara | Q2: della Calabria | R2: Ferrara | S2: Firenze | T2: Foggia | U2: Genova | V2: L'Aquila | W2: Lecce | X2: Mediterranea | Y2: Messina | Z2: Milano-Bicocca | AA2: Milano-Cattolica | AB2: Milano-Statale | AC2: Modena e Reggio Emilia | AD2: Napoli Federico II | AE2: Napoli Parthenope | AF2: Napoli Seconda Università | AG2: Padova | AH2: Palermo | AI2: Parma | AJ2: Perugia | AK2: Piemonte Orientale | AL2: Pisa | AM2: Politecnica delle Marche | AN2: Politecnico di Milano | AO2: Roma La Sapienza | AP2: Roma Tor Vergata | AQ2: Roma Tre | AR2: Salerno | AS2: Sassari | AT2: Siena | AU2: Torino UNI | AV2: Torino PoliTO | AW2: Trento | AX2: Udine
A3: Università | B3: Numero corsi | E3: =SUM(F3:AX3) -> 394 | F3: =SUM(F4:F397) -> 7 | G3: =SUM(G4:G397) -> 2 | H3: =SUM(H4:H397) -> 24 | I3: =SUM(I4:I397) -> 4 | J3: =SUM(J4:J397) -> 8 | K3: =SUM(K4:K397) -> 11 | L3: =SUM(L4:L397) -> 3 | M3: =SUM(M4:M397) -> 9 | N3: =SUM(N4:N397) -> 5 | O3: =SUM(O4:O397) -> 2 | P3: =SUM(P4:P397) -> 3 | Q3: =SUM(Q4:Q397) -> 40 | R3: =SUM(R4:R397) -> 4 | S3: =SUM(S4:S397) -> 13 | T3: =SUM(T4:T397) -> 2 | U3: =SUM(U4:U397) -> 26 | V3: =SUM(V4:V397) -> 8 | W3: =SUM(W4:W397) -> 11 | X3: =SUM(X4:X397) -> 1 | Y3: =SUM(Y4:Y397) -> 3 | Z3: =SUM(Z4:Z397) -> 10 | AA3: =SUM(AA4:AA397) -> 2 | AB3: =SUM(AB4:AB397) -> 5 | AC3: =SUM(AC4:AC397) -> 9 | AD3: =SUM(AD4:AD397) -> 12 | AE3: =SUM(AE4:AE397) -> 2 | AF3: =SUM(AF4:AF397) -> 1 | AG3: =SUM(AG4:AG397) -> 14 | AH3: =SUM(AH4:AH397) -> 8 | AI3: =SUM(AI4:AI397) -> 2 | AJ3: =SUM(AJ4:AJ397) -> 5 | AK3: =SUM(AK4:AK397) -> 2 | AL3: =SUM(AL4:AL397) -> 15 | AM3: =SUM(AM4:AM397) -> 7 | AN3: =SUM(AN4:AN397) -> 21 | AO3: =SUM(AO4:AO397) -> 30 | AP3: =SUM(AP4:AP397) -> 12 | AQ3: =SUM(AQ4:AQ397) -> 6 | AR3: =SUM(AR4:AR397) -> 7 | AS3: =SUM(AS4:AS397) -> 1 | AT3: =SUM(AT4:AT397) -> 5 | AU3: =SUM(AU4:AU397) -> 2 | AV3: =SUM(AV4:AV397) -> 14 | AW3: =SUM(AW4:AW397) -> 7 | AX3: =SUM(AX4:AX397) -> 9
A4: Bari | B4: =F3 -> 7 | F4: 0 | G4: 0 | H4: 0 | I4: 0 | J4: 0 | K4: 0 | L4: 0 | M4: 0 | N4: 0 | O4: 0 | P4: 0 | Q4: 0 | R4: 0 | S4: 0 | T4: 0 | U4: 0 | V4: 0 | W4: 0 | X4: 0 | Y4: 0 | Z4: 0 | AA4: 0 | AB4: 0 | AC4: 0 | AD4: 0 | AE4: 0 | AF4: 0 | AG4: 1 | AH4: 0 | AI4: 0 | AJ4: 0 | AK4: 0 | AL4: 0 | AM4: 0 | AN4: 0 | AO4: 0 | AP4: 0 | AQ4: 0 | AR4: 0 | AS4: 0 | AT4: 0 | AU4: 0 | AV4: 0 | AW4: 0 | AX4: 0
A5: Benevento | B5: =G3 -> 2 | F5: 0 | G5: 0 | H5: 0 | I5: 0 | J5: 0 | K5: 0 | L5: 0 | M5: 0 | N5: 0 | O5: 0 | P5: 0 | Q5: 0 | R5: 0 | S5: 0 | T5: 0 | U5: 0 | V5: 0 | W5: 0 | X5: 0 | Y5: 0 | Z5: 0 | AA5: 0 | AB5: 0 | AC5: 0 | AD5: 0 | AE5: 0 | AF5: 0 | AG5: 1 | AH5: 0 | AI5: 0 | AJ5: 0 | AK5: 0 | AL5: 0 | AM5: 0 | AN5: 0 | AO5: 0 | AP5: 0 | AQ5: 0 | AR5: 0 | AS5: 0 | AT5: 0 | AU5: 0 | AV5: 0 | AW5: 0 | AX5: 0
A6: Bologna | B6: =H3 -> 24 | F6: 0 | G6: 0 | H6: 0 | I6: 0 | J6: 0 | K6: 0 | L6: 0 | M6: 0 | N6: 0 | O6: 0 | P6: 0 | Q6: 0 | R6: 0 | S6: 0 | T6: 0 | U6: 0 | V6: 0 | W6: 0 | X6: 0 | Y6: 0 | Z6: 0 | AA6: 0 | AB6: 0 | AC6: 0 | AD6: 0 | AE6: 0 | AF6: 0 | AG6: 1 | AH6: 0 | AI6: 0 | AJ6: 0 | AK6: 0 | AL6: 0 | AM6: 0 | AN6: 0 | AO6: 0 | AP6: 0 | AQ6: 0 | AR6: 0 | AS6: 0 | AT6: 0 | AU6: 0 | AV6: 0 | AW6: 0 | AX6: 0
A7: Bolzano | B7: =I3 -> 4 | F7: 0 | G7: 0 | H7: 0 | I7: 0 | J7: 0 | K7: 0 | L7: 0 | M7: 0 | N7: 0 | O7: 0 | P7: 0 | Q7: 0 | R7: 0 | S7: 0 | T7: 0 | U7: 0 | V7: 0 | W7: 0 | X7: 0 | Y7: 0 | Z7: 0 | AA7: 0 | AB7: 0 | AC7: 0 | AD7: 0 | AE7: 0 | AF7: 0 | AG7: 1 | AH7: 0 | AI7: 0 | AJ7: 0 | AK7: 0 | AL7: 0 | AM7: 0 | AN7: 0 | AO7: 0 | AP7: 0 | AQ7: 0 | AR7: 0 | AS7: 0 | AT7: 0 | AU7: 0 | AV7: 0 | AW7: 0 | AX7: 0
A8: Brescia | B8: =J3 -> 8 | F8: 0 | G8: 0 | H8: 0 | I8: 0 | J8: 0 | K8: 0 | L8: 0 | M8: 0 | N8: 0 | O8: 0 | P8: 0 | Q8: 0 | R8: 0 | S8: 0 | T8: 0 | U8: 0 | V8: 0 | W8: 0 | X8: 0 | Y8: 0 | Z8: 0 | AA8: 0 | AB8: 0 | AC8: 0 | AD8: 0 | AE8: 0 | AF8: 0 | AG8: 1 | AH8: 0 | AI8: 0 | AJ8: 0 | AK8: 0 | AL8: 0 | AM8: 0 | AN8: 0 | AO8: 0 | AP8: 0 | AQ8: 0 | AR8: 0 | AS8: 0 | AT8: 0 | AU8: 0 | AV8: 0 | AW8: 0 | AX8: 0
A9: Ca' Foscari | B9: =K3 -> 11 | F9: 0 | G9: 0 | H9: 0 | I9: 0 | J9: 0 | K9: 0 | L9: 0 | M9: 0 | N9: 0 | O9: 0 | P9: 0 | Q9: 0 | R9: 0 | S9: 0 | T9: 0 | U9: 0 | V9: 0 | W9: 0 | X9: 0 | Y9: 0 | Z9: 0 | AA9: 0 | AB9: 0 | AC9: 0 | AD9: 0 | AE9: 0 | AF9: 0 | AG9: 1 | AH9: 0 | AI9: 0 | AJ9: 0 | AK9: 0 | AL9: 0 | AM9: 0 | AN9: 0 | AO9: 0 | AP9: 0 | AQ9: 0 | AR9: 0 | AS9: 0 | AT9: 0 | AU9: 0 | AV9: 0 | AW9: 0 | AX9: 0
A10: Cagliari | B10: =L3 -> 3 | F10: 0 | G10: 0 | H10: 0 | I10: 0 | J10: 0 | K10: 0 | L10: 0 | M10: 0 | N10: 0 | O10: 0 | P10: 0 | Q10: 0 | R10: 0 | S10: 0 | T10: 0 | U10: 0 | V10: 0 | W10: 0 | X10: 0 | Y10: 0 | Z10: 0 | AA10: 0 | AB10: 0 | AC10: 0 | AD10: 0 | AE10: 0 | AF10: 0 | AG10: 1 | AH10: 0 | AI10: 0 | AJ10: 0 | AK10: 0 | AL10: 0 | AM10: 0 | AN10: 0 | AO10: 0 | AP10: 0 | AQ10: 0 | AR10: 0 | AS10: 0 | AT10: 0 | AU10: 0 | AV10: 0 | AW10: 0 | AX10: 0
A11: Camerino | B11: =M3 -> 9 | F11: 0 | G11: 0 | H11: 0 | I11: 0 | J11: 0 | K11: 0 | L11: 0 | M11: 0 | N11: 0 | O11: 0 | P11: 0 | Q11: 0 | R11: 0 | S11: 0 | T11: 0 | U11: 0 | V11: 0 | W11: 0 | X11: 0 | Y11: 0 | Z11: 0 | AA11: 0 | AB11: 0 | AC11: 0 | AD11: 0 | AE11: 0 | AF11: 0 | AG11: 1 | AH11: 0 | AI11: 0 | AJ11: 0 | AK11: 0 | AL11: 0 | AM11: 0 | AN11: 0 | AO11: 0 | AP11: 0 | AQ11: 0 | AR11: 0 | AS11: 0 | AT11: 0 | AU11: 0 | AV11: 0 | AW11: 0 | AX11: 0
A12: Catania | B12: =N3 -> 5 | F12: 0 | G12: 0 | H12: 0 | I12: 0 | J12: 0 | K12: 0 | L12: 0 | M12: 0 | N12: 0 | O12: 0 | P12: 0 | Q12: 0 | R12: 0 | S12: 0 | T12: 0 | U12: 0 | V12: 0 | W12: 0 | X12: 0 | Y12: 0 | Z12: 0 | AA12: 0 | AB12: 0 | AC12: 0 | AD12: 0 | AE12: 0 | AF12: 0 | AG12: 1 | AH12: 0 | AI12: 0 | AJ12: 0 | AK12: 0 | AL12: 0 | AM12: 0 | AN12: 0 | AO12: 0 | AP12: 0 | AQ12: 0 | AR12: 0 | AS12: 0 | AT12: 0 | AU12: 0 | AV12: 0 | AW12: 0 | AX12: 0
A13: Catanzaro | B13: =O3 -> 2 | F13: 0 | G13: 0 | H13: 0 | I13: 0 | J13: 0 | K13: 0 | L13: 0 | M13: 0 | N13: 0 | O13: 0 | P13: 0 | Q13: 0 | R13: 0 | S13: 0 | T13: 0 | U13: 0 | V13: 0 | W13: 0 | X13: 0 | Y13: 0 | Z13: 0 | AA13: 0 | AB13: 0 | AC13: 0 | AD13: 0 | AE13: 0 | AF13: 0 | AG13: 1 | AH13: 0 | AI13: 0 | AJ13: 0 | AK13: 0 | AL13: 0 | AM13: 0 | AN13: 0 | AO13: 0 | AP13: 0 | AQ13: 0 | AR13: 0 | AS13: 0 | AT13: 0 | AU13: 0 | AV13: 0 | AW13: 0 | AX13: 0
A14: Chieti e Pescara | B14: =P3 -> 3 | F14: 0 | G14: 0 | H14: 0 | I14: 0 | J14: 0 | K14: 0 | L14: 0 | M14: 0 | N14: 0 | O14: 0 | P14: 0 | Q14: 0 | R14: 0 | S14: 0 | T14: 0 | U14: 0 | V14: 0 | W14: 0 | X14: 0 | Y14: 0 | Z14: 0 | AA14: 0 | AB14: 0 | AC14: 0 | AD14: 0 | AE14: 0 | AF14: 0 | AG14: 1 | AH14: 0 | AI14: 0 | AJ14: 0 | AK14: 0 | AL14: 0 | AM14: 0 | AN14: 0 | AO14: 0 | AP14: 0 | AQ14: 0 | AR14: 0 | AS14: 0 | AT14: 0 | AU14: 0 | AV14: 0 | AW14: 0 | AX14: 0
A15: della Calabria | B15: =Q3 -> 40 | F15: 0 | G15: 0 | H15: 0 | I15: 0 | J15: 0 | K15: 0 | L15: 0 | M15: 0 | N15: 0 | O15: 0 | P15: 0 | Q15: 0 | R15: 0 | S15: 0 | T15: 0 | U15: 0 | V15: 0 | W15: 0 | X15: 0 | Y15: 0 | Z15: 0 | AA15: 0 | AB15: 0 | AC15: 0 | AD15: 0 | AE15: 0 | AF15: 0 | AG15: 1 | AH15: 0 | AI15: 0 | AJ15: 0 | AK15: 0 | AL15: 0 | AM15: 0 | AN15: 0 | AO15: 0 | AP15: 0 | AQ15: 0 | AR15: 0 | AS15: 0 | AT15: 0 | AU15: 0 | AV15: 0 | AW15: 0 | AX15: 0
A16: Ferrara | B16: =R3 -> 4 | F16: 0 | G16: 0 | H16: 0 | I16: 0 | J16: 0 | K16: 0 | L16: 0 | M16: 0 | N16: 0 | O16: 0 | P16: 0 | Q16: 0 | R16: 0 | S16: 0 | T16: 0 | U16: 0 | V16: 0 | W16: 0 | X16: 0 | Y16: 0 | Z16: 0 | AA16: 0 | AB16: 0 | AC16: 0 | AD16: 0 | AE16: 0 | AF16: 0 | AG16: 1 | AH16: 0 | AI16: 0 | AJ16: 0 | AK16: 0 | AL16: 0 | AM16: 0 | AN16: 0 | AO16: 0 | AP16: 0 | AQ16: 0 | AR16: 0 | AS16: 0 | AT16: 0 | AU16: 0 | AV16: 0 | AW16: 0 | AX16: 0
A17: Firenze | B17: =S3 -> 13 | F17: 0 | G17: 0 | H17: 0 | I17: 0 | J17: 0 | K17: 0 | L17: 0 | M17: 0 | N17: 0 | O17: 0 | P17: 0 | Q17: 0 | R17: 0 | S17: 0 | T17: 0 | U17: 0 | V17: 0 | W17: 0 | X17: 0 | Y17: 0 | Z17: 0 | AA17: 0 | AB17: 0 | AC17: 0 | AD17: 0 | AE17: 0 | AF17: 0 | AG17: 1 | AH17: 0 | AI17: 0 | AJ17: 0 | AK17: 0 | AL17: 0 | AM17: 0 | AN17: 0 | AO17: 0 | AP17: 0 | AQ17: 0 | AR17: 0 | AS17: 0 | AT17: 0 | AU17: 0 | AV17: 0 | AW17: 0 | AX17: 0
A18: Foggia | B18: =T3 -> 2 | F18: 0 | G18: 0 | H18: 0 | I18: 0 | J18: 0 | K18: 1 | L18: 0 | M18: 0 | N18: 0 | O18: 0 | P18: 0 | Q18: 0 | R18: 0 | S18: 0 | T18: 0 | U18: 0 | V18: 0 | W18: 0 | X18: 0 | Y18: 0 | Z18: 0 | AA18: 0 | AB18: 0 | AC18: 0 | AD18: 0 | AE18: 0 | AF18: 0 | AG18: 0 | AH18: 0 | AI18: 0 | AJ18: 0 | AK18: 0 | AL18: 0 | AM18: 0 | AN18: 0 | AO18: 0 | AP18: 0 | AQ18: 0 | AR18: 0 | AS18: 0 | AT18: 0 | AU18: 0 | AV18: 0 | AW18: 0 | AX18: 0
A19: Genova | B19: =U3 -> 26 | F19: 0 | G19: 0 | H19: 0 | I19: 0 | J19: 0 | K19: 1 | L19: 0 | M19: 0 | N19: 0 | O19: 0 | P19: 0 | Q19: 0 | R19: 0 | S19: 0 | T19: 0 | U19: 0 | V19: 0 | W19: 0 | X19: 0 | Y19: 0 | Z19: 0 | AA19: 0 | AB19: 0 | AC19: 0 | AD19: 0 | AE19: 0 | AF19: 0 | AG19: 0 | AH19: 0 | AI19: 0 | AJ19: 0 | AK19: 0 | AL19: 0 | AM19: 0 | AN19: 0 | AO19: 0 | AP19: 0 | AQ19: 0 | AR19: 0 | AS19: 0 | AT19: 0 | AU19: 0 | AV19: 0 | AW19: 0 | AX19: 0
A20: L'Aquila | B20: =V3 -> 8 | F20: 0 | G20: 0 | H20: 0 | I20: 0 | J20: 0 | K20: 1 | L20: 0 | M20: 0 | N20: 0 | O20: 0 | P20: 0 | Q20: 0 | R20: 0 | S20: 0 | T20: 0 | U20: 0 | V20: 0 | W20: 0 | X20: 0 | Y20: 0 | Z20: 0 | AA20: 0 | AB20: 0 | AC20: 0 | AD20: 0 | AE20: 0 | AF20: 0 | AG20: 0 | AH20: 0 | AI20: 0 | AJ20: 0 | AK20: 0 | AL20: 0 | AM20: 0 | AN20: 0 | AO20: 0 | AP20: 0 | AQ20: 0 | AR20: 0 | AS20: 0 | AT20: 0 | AU20: 0 | AV20: 0 | AW20: 0 | AX20: 0
A21: Lecce | B21: =W3 -> 11 | F21: 0 | G21: 0 | H21: 0 | I21: 0 | J21: 0 | K21: 1 | L21: 0 | M21: 0 | N21: 0 | O21: 0 | P21: 0 | Q21: 0 | R21: 0 | S21: 0 | T21: 0 | U21: 0 | V21: 0 | W21: 0 | X21: 0 | Y21: 0 | Z21: 0 | AA21: 0 | AB21: 0 | AC21: 0 | AD21: 0 | AE21: 0 | AF21: 0 | AG21: 0 | AH21: 0 | AI21: 0 | AJ21: 0 | AK21: 0 | AL21: 0 | AM21: 0 | AN21: 0 | AO21: 0 | AP21: 0 | AQ21: 0 | AR21: 0 | AS21: 0 | AT21: 0 | AU21: 0 | AV21: 0 | AW21: 0 | AX21: 0
A22: Mediterranea | B22: =X3 -> 1 | F22: 0 | G22: 0 | H22: 0 | I22: 0 | J22: 0 | K22: 1 | L22: 0 | M22: 0 | N22: 0 | O22: 0 | P22: 0 | Q22: 0 | R22: 0 | S22: 0 | T22: 0 | U22: 0 | V22: 0 | W22: 0 | X22: 0 | Y22: 0 | Z22: 0 | AA22: 0 | AB22: 0 | AC22: 0 | AD22: 0 | AE22: 0 | AF22: 0 | AG22: 0 | AH22: 0 | AI22: 0 | AJ22: 0 | AK22: 0 | AL22: 0 | AM22: 0 | AN22: 0 | AO22: 0 | AP22: 0 | AQ22: 0 | AR22: 0 | AS22: 0 | AT22: 0 | AU22: 0 | AV22: 0 | AW22: 0 | AX22: 0
A23: Messina | B23: =Y3 -> 3 | F23: 0 | G23: 0 | H23: 0 | I23: 0 | J23: 0 | K23: 1 | L23: 0 | M23: 0 | N23: 0 | O23: 0 | P23: 0 | Q23: 0 | R23: 0 | S23: 0 | T23: 0 | U23: 0 | V23: 0 | W23: 0 | X23: 0 | Y23: 0 | Z23: 0 | AA23: 0 | AB23: 0 | AC23: 0 | AD23: 0 | AE23: 0 | AF23: 0 | AG23: 0 | AH23: 0 | AI23: 0 | AJ23: 0 | AK23: 0 | AL23: 0 | AM23: 0 | AN23: 0 | AO23: 0 | AP23: 0 | AQ23: 0 | AR23: 0 | AS23: 0 | AT23: 0 | AU23: 0 | AV23: 0 | AW23: 0 | AX23: 0
A24: Milano Bicocca | B24: =Z3 -> 10 | F24: 0 | G24: 0 | H24: 0 | I24: 0 | J24: 0 | K24: 1 | L24: 0 | M24: 0 | N24: 0 | O24: 0 | P24: 0 | Q24: 0 | R24: 0 | S24: 0 | T24: 0 | U24: 0 | V24: 0 | W24: 0 | X24: 0 | Y24: 0 | Z24: 0 | AA24: 0 | AB24: 0 | AC24: 0 | AD24: 0 | AE24: 0 | AF24: 0 | AG24: 0 | AH24: 0 | AI24: 0 | AJ24: 0 | AK24: 0 | AL24: 0 | AM24: 0 | AN24: 0 | AO24: 0 | AP24: 0 | AQ24: 0 | AR24: 0 | AS24: 0 | AT24: 0 | AU24: 0 | AV24: 0 | AW24: 0 | AX24: 0
A25: Milano Cattolica | B25: =AA3 -> 2 | F25: 0 | G25: 0 | H25: 0 | I25: 0 | J25: 0 | K25: 1 | L25: 0 | M25: 0 | N25: 0 | O25: 0 | P25: 0 | Q25: 0 | R25: 0 | S25: 0 | T25: 0 | U25: 0 | V25: 0 | W25: 0 | X25: 0 | Y25: 0 | Z25: 0 | AA25: 0 | AB25: 0 | AC25: 0 | AD25: 0 | AE25: 0 | AF25: 0 | AG25: 0 | AH25: 0 | AI25: 0 | AJ25: 0 | AK25: 0 | AL25: 0 | AM25: 0 | AN25: 0 | AO25: 0 | AP25: 0 | AQ25: 0 | AR25: 0 | AS25: 0 | AT25: 0 | AU25: 0 | AV25: 0 | AW25: 0 | AX25: 0
A26: Milano Statale | B26: =AB3 -> 5 | F26: 0 | G26: 0 | H26: 0 | I26: 0 | J26: 0 | K26: 1 | L26: 0 | M26: 0 | N26: 0 | O26: 0 | P26: 0 | Q26: 0 | R26: 0 | S26: 0 | T26: 0 | U26: 0 | V26: 0 | W26: 0 | X26: 0 | Y26: 0 | Z26: 0 | AA26: 0 | AB26: 0 | AC26: 0 | AD26: 0 | AE26: 0 | AF26: 0 | AG26: 0 | AH26: 0 | AI26: 0 | AJ26: 0 | AK26: 0 | AL26: 0 | AM26: 0 | AN26: 0 | AO26: 0 | AP26: 0 | AQ26: 0 | AR26: 0 | AS26: 0 | AT26: 0 | AU26: 0 | AV26: 0 | AW26: 0 | AX26: 0
A27: Modena e Reggio Emilia | B27: =AC3 -> 9 | F27: 0 | G27: 0 | H27: 0 | I27: 0 | J27: 0 | K27: 1 | L27: 0 | M27: 0 | N27: 0 | O27: 0 | P27: 0 | Q27: 0 | R27: 0 | S27: 0 | T27: 0 | U27: 0 | V27: 0 | W27: 0 | X27: 0 | Y27: 0 | Z27: 0 | AA27: 0 | AB27: 0 | AC27: 0 | AD27: 0 | AE27: 0 | AF27: 0 | AG27: 0 | AH27: 0 | AI27: 0 | AJ27: 0 | AK27: 0 | AL27: 0 | AM27: 0 | AN27: 0 | AO27: 0 | AP27: 0 | AQ27: 0 | AR27: 0 | AS27: 0 | AT27: 0 | AU27: 0 | AV27: 0 | AW27: 0 | AX27: 0
A28: Napoli Federico II | B28: =AD3 -> 12 | F28: 0 | G28: 0 | H28: 0 | I28: 0 | J28: 0 | K28: 1 | L28: 0 | M28: 0 | N28: 0 | O28: 0 | P28: 0 | Q28: 0 | R28: 0 | S28: 0 | T28: 0 | U28: 0 | V28: 0 | W28: 0 | X28: 0 | Y28: 0 | Z28: 0 | AA28: 0 | AB28: 0 | AC28: 0 | AD28: 0 | AE28: 0 | AF28: 0 | AG28: 0 | AH28: 0 | AI28: 0 | AJ28: 0 | AK28: 0 | AL28: 0 | AM28: 0 | AN28: 0 | AO28: 0 | AP28: 0 | AQ28: 0 | AR28: 0 | AS28: 0 | AT28: 0 | AU28: 0 | AV28: 0 | AW28: 0 | AX28: 0
A29: Napoli Parthenope | B29: =AE3 -> 2 | F29: 0 | G29: 0 | H29: 0 | I29: 0 | J29: 0 | K29: 0 | L29: 0 | M29: 0 | N29: 0 | O29: 0 | P29: 0 | Q29: 0 | R29: 0 | S29: 0 | T29: 0 | U29: 0 | V29: 0 | W29: 0 | X29: 0 | Y29: 0 | Z29: 0 | AA29: 0 | AB29: 0 | AC29: 0 | AD29: 0 | AE29: 0 | AF29: 0 | AG29: 0 | AH29: 0 | AI29: 0 | AJ29: 0 | AK29: 0 | AL29: 0 | AM29: 0 | AN29: 0 | AO29: 0 | AP29: 0 | AQ29: 0 | AR29: 0 | AS29: 0 | AT29: 0 | AU29: 0 | AV29: 0 | AW29: 0 | AX29: 1
A30: Napoli Seconda Università | B30: =AF3 -> 1 | F30: 0 | G30: 0 | H30: 0 | I30: 0 | J30: 0 | K30: 0 | L30: 0 | M30: 0 | N30: 0 | O30: 0 | P30: 0 | Q30: 0 | R30: 0 | S30: 0 | T30: 0 | U30: 0 | V30: 0 | W30: 0 | X30: 0 | Y30: 0 | Z30: 0 | AA30: 0 | AB30: 0 | AC30: 0 | AD30: 0 | AE30: 0 | AF30: 0 | AG30: 0 | AH30: 0 | AI30: 0 | AJ30: 0 | AK30: 0 | AL30: 0 | AM30: 0 | AN30: 0 | AO30: 0 | AP30: 0 | AQ30: 0 | AR30: 0 | AS30: 0 | AT30: 0 | AU30: 0 | AV30: 0 | AW30: 0 | AX30: 1
A31: Padova | B31: =AG3 -> 14 | F31: 0 | G31: 0 | H31: 0 | I31: 0 | J31: 0 | K31: 0 | L31: 0 | M31: 0 | N31: 0 | O31: 0 | P31: 0 | Q31: 0 | R31: 0 | S31: 0 | T31: 0 | U31: 0 | V31: 0 | W31: 0 | X31: 0 | Y31: 0 | Z31: 0 | AA31: 0 | AB31: 0 | AC31: 0 | AD31: 0 | AE31: 0 | AF31: 0 | AG31: 0 | AH31: 0 | AI31: 0 | AJ31: 0 | AK31: 0 | AL31: 0 | AM31: 0 | AN31: 0 | AO31: 0 | AP31: 0 | AQ31: 0 | AR31: 0 | AS31: 0 | AT31: 0 | AU31: 0 | AV31: 0 | AW31: 0 | AX31: 1
A32: Palermo | B32: =AH3 -> 8 | F32: 0 | G32: 0 | H32: 0 | I32: 0 | J32: 0 | K32: 0 | L32: 0 | M32: 0 | N32: 0 | O32: 0 | P32: 0 | Q32: 0 | R32: 0 | S32: 0 | T32: 0 | U32: 0 | V32: 0 | W32: 0 | X32: 0 | Y32: 0 | Z32: 0 | AA32: 0 | AB32: 0 | AC32: 0 | AD32: 0 | AE32: 0 | AF32: 0 | AG32: 0 | AH32: 0 | AI32: 0 | AJ32: 0 | AK32: 0 | AL32: 0 | AM32: 0 | AN32: 0 | AO32: 0 | AP32: 0 | AQ32: 0 | AR32: 0 | AS32: 0 | AT32: 0 | AU32: 0 | AV32: 0 | AW32: 0 | AX32: 1
A33: Parma | B33: =AI3 -> 2 | F33: 0 | G33: 0 | H33: 0 | I33: 0 | J33: 0 | K33: 0 | L33: 0 | M33: 0 | N33: 0 | O33: 0 | P33: 0 | Q33: 0 | R33: 0 | S33: 0 | T33: 0 | U33: 0 | V33: 0 | W33: 0 | X33: 0 | Y33: 0 | Z33: 0 | AA33: 0 | AB33: 0 | AC33: 0 | AD33: 0 | AE33: 0 | AF33: 0 | AG33: 0 | AH33: 0 | AI33: 0 | AJ33: 0 | AK33: 0 | AL33: 0 | AM33: 0 | AN33: 0 | AO33: 0 | AP33: 0 | AQ33: 0 | AR33: 0 | AS33: 0 | AT33: 0 | AU33: 0 | AV33: 0 | AW33: 0 | AX33: 1
A34: Perugia | B34: =AJ3 -> 5 | F34: 0 | G34: 0 | H34: 0 | I34: 0 | J34: 0 | K34: 0 | L34: 0 | M34: 0 | N34: 0 | O34: 0 | P34: 0 | Q34: 0 | R34: 0 | S34: 0 | T34: 0 | U34: 0 | V34: 0 | W34: 0 | X34: 0 | Y34: 0 | Z34: 0 | AA34: 0 | AB34: 0 | AC34: 0 | AD34: 0 | AE34: 0 | AF34: 0 | AG34: 0 | AH34: 0 | AI34: 0 | AJ34: 0 | AK34: 0 | AL34: 0 | AM34: 0 | AN34: 0 | AO34: 0 | AP34: 0 | AQ34: 0 | AR34: 0 | AS34: 0 | AT34: 0 | AU34: 0 | AV34: 0 | AW34: 0 | AX34: 1
A35: Piemonte Orientale | B35: =AK3 -> 2 | F35: 0 | G35: 0 | H35: 0 | I35: 0 | J35: 0 | K35: 0 | L35: 0 | M35: 0 | N35: 0 | O35: 0 | P35: 0 | Q35: 0 | R35: 0 | S35: 0 | T35: 0 | U35: 0 | V35: 0 | W35: 0 | X35: 0 | Y35: 0 | Z35: 0 | AA35: 0 | AB35: 0 | AC35: 0 | AD35: 0 | AE35: 0 | AF35: 0 | AG35: 0 | AH35: 0 | AI35: 0 | AJ35: 0 | AK35: 0 | AL35: 0 | AM35: 0 | AN35: 0 | AO35: 0 | AP35: 0 | AQ35: 0 | AR35: 0 | AS35: 0 | AT35: 0 | AU35: 0 | AV35: 0 | AW35: 0 | AX35: 1
A36: Pisa | B36: =AL3 -> 15 | F36: 0 | G36: 0 | H36: 0 | I36: 0 | J36: 0 | K36: 0 | L36: 0 | M36: 0 | N36: 0 | O36: 0 | P36: 0 | Q36: 0 | R36: 0 | S36: 0 | T36: 0 | U36: 0 | V36: 0 | W36: 0 | X36: 0 | Y36: 0 | Z36: 0 | AA36: 0 | AB36: 0 | AC36: 0 | AD36: 0 | AE36: 0 | AF36: 0 | AG36: 0 | AH36: 0 | AI36: 0 | AJ36: 0 | AK36: 0 | AL36: 0 | AM36: 0 | AN36: 0 | AO36: 0 | AP36: 0 | AQ36: 0 | AR36: 0 | AS36: 0 | AT36: 0 | AU36: 0 | AV36: 0 | AW36: 0 | AX36: 1
A37: Politecnico delle Marche | B37: =AM3 -> 7 | F37: 0 | G37: 0 | H37: 0 | I37: 0 | J37: 0 | K37: 0 | L37: 0 | M37: 0 | N37: 0 | O37: 0 | P37: 0 | Q37: 0 | R37: 0 | S37: 0 | T37: 0 | U37: 0 | V37: 0 | W37: 0 | X37: 0 | Y37: 0 | Z37: 0 | AA37: 0 | AB37: 0 | AC37: 0 | AD37: 0 | AE37: 0 | AF37: 0 | AG37: 0 | AH37: 0 | AI37: 0 | AJ37: 0 | AK37: 0 | AL37: 0 | AM37: 0 | AN37: 0 | AO37: 0 | AP37: 0 | AQ37: 0 | AR37: 0 | AS37: 0 | AT37: 0 | AU37: 0 | AV37: 0 | AW37: 0 | AX37: 1
A38: Poltecnico di Milano | B38: =AN3 -> 21 | F38: 0 | G38: 0 | H38: 0 | I38: 0 | J38: 0 | K38: 0 | L38: 0 | M38: 0 | N38: 0 | O38: 0 | P38: 0 | Q38: 0 | R38: 0 | S38: 0 | T38: 0 | U38: 0 | V38: 0 | W38: 0 | X38: 0 | Y38: 0 | Z38: 0 | AA38: 0 | AB38: 0 | AC38: 0 | AD38: 0 | AE38: 0 | AF38: 0 | AG38: 0 | AH38: 0 | AI38: 0 | AJ38: 0 | AK38: 0 | AL38: 0 | AM38: 0 | AN38: 0 | AO38: 0 | AP38: 0 | AQ38: 0 | AR38: 0 | AS38: 0 | AT38: 0 | AU38: 0 | AV38: 0 | AW38: 1 | AX38: 0
A39: Roma La Sapienza | B39: =AO3 -> 30 | F39: 0 | G39: 0 | H39: 0 | I39: 0 | J39: 0 | K39: 0 | L39: 0 | M39: 0 | N39: 0 | O39: 0 | P39: 0 | Q39: 0 | R39: 0 | S39: 0 | T39: 0 | U39: 0 | V39: 0 | W39: 0 | X39: 0 | Y39: 0 | Z39: 0 | AA39: 0 | AB39: 0 | AC39: 0 | AD39: 0 | AE39: 0 | AF39: 0 | AG39: 0 | AH39: 0 | AI39: 0 | AJ39: 0 | AK39: 0 | AL39: 0 | AM39: 0 | AN39: 0 | AO39: 0 | AP39: 0 | AQ39: 0 | AR39: 0 | AS39: 0 | AT39: 0 | AU39: 0 | AV39: 0 | AW39: 1 | AX39: 0
A40: Roma Tor Vergata | B40: =AP3 -> 12 | F40: 0 | G40: 0 | H40: 0 | I40: 0 | J40: 0 | K40: 0 | L40: 0 | M40: 0 | N40: 0 | O40: 0 | P40: 0 | Q40: 0 | R40: 0 | S40: 0 | T40: 0 | U40: 0 | V40: 0 | W40: 0 | X40: 0 | Y40: 0 | Z40: 0 | AA40: 0 | AB40: 0 | AC40: 0 | AD40: 0 | AE40: 0 | AF40: 0 | AG40: 0 | AH40: 0 | AI40: 0 | AJ40: 0 | AK40: 0 | AL40: 0 | AM40: 0 | AN40: 0 | AO40: 0 | AP40: 0 | AQ40: 0 | AR40: 0 | AS40: 0 | AT40: 0 | AU40: 0 | AV40: 0 | AW40: 1 | AX40: 0
A41: Roma Tre | B41: =AQ3 -> 6 | F41: 0 | G41: 0 | H41: 0 | I41: 0 | J41: 0 | K41: 0 | L41: 0 | M41: 0 | N41: 0 | O41: 0 | P41: 0 | Q41: 0 | R41: 0 | S41: 0 | T41: 0 | U41: 0 | V41: 0 | W41: 0 | X41: 0 | Y41: 0 | Z41: 0 | AA41: 0 | AB41: 0 | AC41: 0 | AD41: 0 | AE41: 0 | AF41: 0 | AG41: 0 | AH41: 0 | AI41: 0 | AJ41: 0 | AK41: 0 | AL41: 0 | AM41: 0 | AN41: 0 | AO41: 0 | AP41: 0 | AQ41: 0 | AR41: 0 | AS41: 0 | AT41: 0 | AU41: 0 | AV41: 0 | AW41: 1 | AX41: 0
A42: Salerno | B42: =AR3 -> 7 | F42: 0 | G42: 0 | H42: 0 | I42: 0 | J42: 0 | K42: 0 | L42: 0 | M42: 0 | N42: 0 | O42: 0 | P42: 0 | Q42: 0 | R42: 0 | S42: 0 | T42: 0 | U42: 0 | V42: 0 | W42: 0 | X42: 0 | Y42: 0 | Z42: 0 | AA42: 0 | AB42: 0 | AC42: 0 | AD42: 0 | AE42: 0 | AF42: 0 | AG42: 0 | AH42: 0 | AI42: 0 | AJ42: 0 | AK42: 0 | AL42: 0 | AM42: 0 | AN42: 0 | AO42: 0 | AP42: 0 | AQ42: 0 | AR42: 0 | AS42: 0 | AT42: 0 | AU42: 0 | AV42: 0 | AW42: 1 | AX42: 0
A43: Sassari | B43: =AS3 -> 1 | F43: 0 | G43: 0 | H43: 0 | I43: 0 | J43: 0 | K43: 0 | L43: 0 | M43: 0 | N43: 0 | O43: 0 | P43: 0 | Q43: 0 | R43: 0 | S43: 0 | T43: 0 | U43: 0 | V43: 0 | W43: 0 | X43: 0 | Y43: 0 | Z43: 0 | AA43: 0 | AB43: 0 | AC43: 0 | AD43: 0 | AE43: 0 | AF43: 0 | AG43: 0 | AH43: 0 | AI43: 0 | AJ43: 0 | AK43: 0 | AL43: 0 | AM43: 0 | AN43: 0 | AO43: 0 | AP43: 0 | AQ43: 0 | AR43: 0 | AS43: 0 | AT43: 0 | AU43: 0 | AV43: 0 | AW43: 1 | AX43: 0
A44: Siena | B44: =AT3 -> 5 | F44: 0 | G44: 0 | H44: 0 | I44: 0 | J44: 0 | K44: 0 | L44: 0 | M44: 0 | N44: 0 | O44: 0 | P44: 0 | Q44: 0 | R44: 0 | S44: 0 | T44: 0 | U44: 0 | V44: 0 | W44: 0 | X44: 0 | Y44: 0 | Z44: 0 | AA44: 0 | AB44: 0 | AC44: 0 | AD44: 0 | AE44: 0 | AF44: 0 | AG44: 0 | AH44: 0 | AI44: 0 | AJ44: 0 | AK44: 0 | AL44: 0 | AM44: 0 | AN44: 0 | AO44: 0 | AP44: 0 | AQ44: 0 | AR44: 0 | AS44: 0 | AT44: 0 | AU44: 0 | AV44: 0 | AW44: 1 | AX44: 0
A45: Torino | B45: =AU3 -> 2 | F45: 0 | G45: 0 | H45: 0 | I45: 1 | J45: 0 | K45: 0 | L45: 0 | M45: 0 | N45: 0 | O45: 0 | P45: 0 | Q45: 0 | R45: 0 | S45: 0 | T45: 0 | U45: 0 | V45: 0 | W45: 0 | X45: 0 | Y45: 0 | Z45: 0 | AA45: 0 | AB45: 0 | AC45: 0 | AD45: 0 | AE45: 0 | AF45: 0 | AG45: 0 | AH45: 0 | AI45: 0 | AJ45: 0 | AK45: 0 | AL45: 0 | AM45: 0 | AN45: 0 | AO45: 0 | AP45: 0 | AQ45: 0 | AR45: 0 | AS45: 0 | AT45: 0 | AU45: 0 | AV45: 0 | AW45: 0 | AX45: 0
A46: Torino PoliTO | B46: =AV3 -> 14 | F46: 0 | G46: 0 | H46: 0 | I46: 1 | J46: 0 | K46: 0 | L46: 0 | M46: 0 | N46: 0 | O46: 0 | P46: 0 | Q46: 0 | R46: 0 | S46: 0 | T46: 0 | U46: 0 | V46: 0 | W46: 0 | X46: 0 | Y46: 0 | Z46: 0 | AA46: 0 | AB46: 0 | AC46: 0 | AD46: 0 | AE46: 0 | AF46: 0 | AG46: 0 | AH46: 0 | AI46: 0 | AJ46: 0 | AK46: 0 | AL46: 0 | AM46: 0 | AN46: 0 | AO46: 0 | AP46: 0 | AQ46: 0 | AR46: 0 | AS46: 0 | AT46: 0 | AU46: 0 | AV46: 0 | AW46: 0 | AX46: 0
A47: Trento | B47: =AW3 -> 7 | F47: 0 | G47: 0 | H47: 0 | I47: 1 | J47: 0 | K47: 0 | L47: 0 | M47: 0 | N47: 0 | O47: 0 | P47: 0 | Q47: 0 | R47: 0 | S47: 0 | T47: 0 | U47: 0 | V47: 0 | W47: 0 | X47: 0 | Y47: 0 | Z47: 0 | AA47: 0 | AB47: 0 | AC47: 0 | AD47: 0 | AE47: 0 | AF47: 0 | AG47: 0 | AH47: 0 | AI47: 0 | AJ47: 0 | AK47: 0 | AL47: 0 | AM47: 0 | AN47: 0 | AO47: 0 | AP47: 0 | AQ47: 0 | AR47: 0 | AS47: 0 | AT47: 0 | AU47: 0 | AV47: 0 | AW47: 0 | AX47: 0
A48: Udine | B48: =AX3 -> 9 | F48: 0 | G48: 0 | H48: 0 | I48: 1 | J48: 0 | K48: 0 | L48: 0 | M48: 0 | N48: 0 | O48: 0 | P48: 0 | Q48: 0 | R48: 0 | S48: 0 | T48: 0 | U48: 0 | V48: 0 | W48: 0 | X48: 0 | Y48: 0 | Z48: 0 | AA48: 0 | AB48: 0 | AC48: 0 | AD48: 0 | AE48: 0 | AF48: 0 | AG48: 0 | AH48: 0 | AI48: 0 | AJ48: 0 | AK48: 0 | AL48: 0 | AM48: 0 | AN48: 0 | AO48: 0 | AP48: 0 | AQ48: 0 | AR48: 0 | AS48: 0 | AT48: 0 | AU48: 0 | AV48: 0 | AW48: 0 | AX48: 0
A49: Totale | B49: =SUM(B4:B48) -> 394 | F49: 0 | G49: 0 | H49: 0 | I49: 0 | J49: 1 | K49: 0 | L49: 0 | M49: 0 | N49: 0 | O49: 0 | P49: 0 | Q49: 0 | R49: 0 | S49: 0 | T49: 0 | U49: 0 | V49: 0 | W49: 0 | X49: 0 | Y49: 0 | Z49: 0 | AA49: 0 | AB49: 0 | AC49: 0 | AD49: 0 | AE49: 0 | AF49: 0 | AG49: 0 | AH49: 0 | AI49: 0 | AJ49: 0 | AK49: 0 | AL49: 0 | AM49: 0 | AN49: 0 | AO49: 0 | AP49: 0 | AQ49: 0 | AR49: 0 | AS49: 0 | AT49: 0 | AU49: 0 | AV49: 0 | AW49: 0 | AX49: 0
F50: 0 | G50: 0 | H50: 0 | I50: 0 | J50: 1 | K50: 0 | L50: 0 | M50: 0 | N50: 0 | O50: 0 | P50: 0 | Q50: 0 | R50: 0 | S50: 0 | T50: 0 | U50: 0 | V50: 0 | W50: 0 | X50: 0 | Y50: 0 | Z50: 0 | AA50: 0 | AB50: 0 | AC50: 0 | AD50: 0 | AE50: 0 | AF50: 0 | AG50: 0 | AH50: 0 | AI50: 0 | AJ50: 0 | AK50: 0 | AL50: 0 | AM50: 0 | AN50: 0 | AO50: 0 | AP50: 0 | AQ50: 0 | AR50: 0 | AS50: 0 | AT50: 0 | AU50: 0 | AV50: 0 | AW50: 0 | AX50: 0
F51: 0 | G51: 0 | H51: 0 | I51: 0 | J51: 1 | K51: 0 | L51: 0 | M51: 0 | N51: 0 | O51: 0 | P51: 0 | Q51: 0 | R51: 0 | S51: 0 | T51: 0 | U51: 0 | V51: 0 | W51: 0 | X51: 0 | Y51: 0 | Z51: 0 | AA51: 0 | AB51: 0 | AC51: 0 | AD51: 0 | AE51: 0 | AF51: 0 | AG51: 0 | AH51: 0 | AI51: 0 | AJ51: 0 | AK51: 0 | AL51: 0 | AM51: 0 | AN51: 0 | AO51: 0 | AP51: 0 | AQ51: 0 | AR51: 0 | AS51: 0 | AT51: 0 | AU51: 0 | AV51: 0 | AW51: 0 | AX51: 0
F52: 0 | G52: 0 | H52: 0 | I52: 0 | J52: 1 | K52: 0 | L52: 0 | M52: 0 | N52: 0 | O52: 0 | P52: 0 | Q52: 0 | R52: 0 | S52: 0 | T52: 0 | U52: 0 | V52: 0 | W52: 0 | X52: 0 | Y52: 0 | Z52: 0 | AA52: 0 | AB52: 0 | AC52: 0 | AD52: 0 | AE52: 0 | AF52: 0 | AG52: 0 | AH52: 0 | AI52: 0 | AJ52: 0 | AK52: 0 | AL52: 0 | AM52: 0 | AN52: 0 | AO52: 0 | AP52: 0 | AQ52: 0 | AR52: 0 | AS52: 0 | AT52: 0 | AU52: 0 | AV52: 0 | AW52: 0 | AX52: 0
F53: 0 | G53: 0 | H53: 0 | I53: 0 | J53: 1 | K53: 0 | L53: 0 | M53: 0 | N53: 0 | O53: 0 | P53: 0 | Q53: 0 | R53: 0 | S53: 0 | T53: 0 | U53: 0 | V53: 0 | W53: 0 | X53: 0 | Y53: 0 | Z53: 0 | AA53: 0 | AB53: 0 | AC53: 0 | AD53: 0 | AE53: 0 | AF53: 0 | AG53: 0 | AH53: 0 | AI53: 0 | AJ53: 0 | AK53: 0 | AL53: 0 | AM53: 0 | AN53: 0 | AO53: 0 | AP53: 0 | AQ53: 0 | AR53: 0 | AS53: 0 | AT53: 0 | AU53: 0 | AV53: 0 | AW53: 0 | AX53: 0
F54: 0 | G54: 0 | H54: 0 | I54: 0 | J54: 1 | K54: 0 | L54: 0 | M54: 0 | N54: 0 | O54: 0 | P54: 0 | Q54: 0 | R54: 0 | S54: 0 | T54: 0 | U54: 0 | V54: 0 | W54: 0 | X54: 0 | Y54: 0 | Z54: 0 | AA54: 0 | AB54: 0 | AC54: 0 | AD54: 0 | AE54: 0 | AF54: 0 | AG54: 0 | AH54: 0 | AI54: 0 | AJ54: 0 | AK54: 0 | AL54: 0 | AM54: 0 | AN54: 0 | AO54: 0 | AP54: 0 | AQ54: 0 | AR54: 0 | AS54: 0 | AT54: 0 | AU54: 0 | AV54: 0 | AW54: 0 | AX54: 0
F55: 0 | G55: 0 | H55: 0 | I55: 0 | J55: 1 | K55: 0 | L55: 0 | M55: 0 | N55: 0 | O55: 0 | P55: 0 | Q55: 0 | R55: 0 | S55: 0 | T55: 0 | U55: 0 | V55: 0 | W55: 0 | X55: 0 | Y55: 0 | Z55: 0 | AA55: 0 | AB55: 0 | AC55: 0 | AD55: 0 | AE55: 0 | AF55: 0 | AG55: 0 | AH55: 0 | AI55: 0 | AJ55: 0 | AK55: 0 | AL55: 0 | AM55: 0 | AN55: 0 | AO55: 0 | AP55: 0 | AQ55: 0 | AR55: 0 | AS55: 0 | AT55: 0 | AU55: 0 | AV55: 0 | AW55: 0 | AX55: 0
F56: 0 | G56: 0 | H56: 0 | I56: 0 | J56: 1 | K56: 0 | L56: 0 | M56: 0 | N56: 0 | O56: 0 | P56: 0 | Q56: 0 | R56: 0 | S56: 0 | T56: 0 | U56: 0 | V56: 0 | W56: 0 | X56: 0 | Y56: 0 | Z56: 0 | AA56: 0 | AB56: 0 | AC56: 0 | AD56: 0 | AE56: 0 | AF56: 0 | AG56: 0 | AH56: 0 | AI56: 0 | AJ56: 0 | AK56: 0 | AL56: 0 | AM56: 0 | AN56: 0 | AO56: 0 | AP56: 0 | AQ56: 0 | AR56: 0 | AS56: 0 | AT56: 0 | AU56: 0 | AV56: 0 | AW56: 0 | AX56: 0
F57: 0 | G57: 0 | H57: 0 | I57: 0 | J57: 0 | K57: 0 | L57: 0 | M57: 0 | N57: 0 | O57: 0 | P57: 0 | Q57: 0 | R57: 0 | S57: 0 | T57: 0 | U57: 0 | V57: 0 | W57: 0 | X57: 0 | Y57: 0 | Z57: 1 | AA57: 0 | AB57: 0 | AC57: 0 | AD57: 0 | AE57: 0 | AF57: 0 | AG57: 0 | AH57: 0 | AI57: 0 | AJ57: 0 | AK57: 0 | AL57: 0 | AM57: 0 | AN57: 0 | AO57: 0 | AP57: 0 | AQ57: 0 | AR57: 0 | AS57: 0 | AT57: 0 | AU57: 0 | AV57: 0 | AW57: 0 | AX57: 0
F58: 0 | G58: 0 | H58: 0 | I58: 0 | J58: 0 | K58: 0 | L58: 0 | M58: 0 | N58: 0 | O58: 0 | P58: 0 | Q58: 0 | R58: 0 | S58: 0 | T58: 0 | U58: 0 | V58: 0 | W58: 0 | X58: 0 | Y58: 0 | Z58: 1 | AA58: 0 | AB58: 0 | AC58: 0 | AD58: 0 | AE58: 0 | AF58: 0 | AG58: 0 | AH58: 0 | AI58: 0 | AJ58: 0 | AK58: 0 | AL58: 0 | AM58: 0 | AN58: 0 | AO58: 0 | AP58: 0 | AQ58: 0 | AR58: 0 | AS58: 0 | AT58: 0 | AU58: 0 | AV58: 0 | AW58: 0 | AX58: 0
F59: 0 | G59: 0 | H59: 0 | I59: 0 | J59: 0 | K59: 0 | L59: 0 | M59: 0 | N59: 0 | O59: 0 | P59: 0 | Q59: 0 | R59: 0 | S59: 0 | T59: 0 | U59: 0 | V59: 0 | W59: 0 | X59: 0 | Y59: 0 | Z59: 1 | AA59: 0 | AB59: 0 | AC59: 0 | AD59: 0 | AE59: 0 | AF59: 0 | AG59: 0 | AH59: 0 | AI59: 0 | AJ59: 0 | AK59: 0 | AL59: 0 | AM59: 0 | AN59: 0 | AO59: 0 | AP59: 0 | AQ59: 0 | AR59: 0 | AS59: 0 | AT59: 0 | AU59: 0 | AV59: 0 | AW59: 0 | AX59: 0
F60: 0 | G60: 0 | H60: 0 | I60: 0 | J60: 0 | K60: 0 | L60: 0 | M60: 0 | N60: 0 | O60: 0 | P60: 0 | Q60: 0 | R60: 0 | S60: 0 | T60: 0 | U60: 0 | V60: 0 | W60: 0 | X60: 0 | Y60: 0 | Z60: 1 | AA60: 0 | AB60: 0 | AC60: 0 | AD60: 0 | AE60: 0 | AF60: 0 | AG60: 0 | AH60: 0 | AI60: 0 | AJ60: 0 | AK60: 0 | AL60: 0 | AM60: 0 | AN60: 0 | AO60: 0 | AP60: 0 | AQ60: 0 | AR60: 0 | AS60: 0 | AT60: 0 | AU60: 0 | AV60: 0 | AW60: 0 | AX60: 0
F61: 0 | G61: 0 | H61: 0 | I61: 0 | J61: 0 | K61: 0 | L61: 0 | M61: 0 | N61: 0 | O61: 0 | P61: 0 | Q61: 0 | R61: 0 | S61: 0 | T61: 0 | U61: 0 | V61: 0 | W61: 0 | X61: 0 | Y61: 0 | Z61: 1 | AA61: 0 | AB61: 0 | AC61: 0 | AD61: 0 | AE61: 0 | AF61: 0 | AG61: 0 | AH61: 0 | AI61: 0 | AJ61: 0 | AK61: 0 | AL61: 0 | AM61: 0 | AN61: 0 | AO61: 0 | AP61: 0 | AQ61: 0 | AR61: 0 | AS61: 0 | AT61: 0 | AU61: 0 | AV61: 0 | AW61: 0 | AX61: 0
F62: 0 | G62: 0 | H62: 0 | I62: 0 | J62: 0 | K62: 0 | L62: 0 | M62: 0 | N62: 0 | O62: 0 | P62: 0 | Q62: 0 | R62: 0 | S62: 0 | T62: 0 | U62: 0 | V62: 0 | W62: 0 | X62: 0 | Y62: 0 | Z62: 1 | AA62: 0 | AB62: 0 | AC62: 0 | AD62: 0 | AE62: 0 | AF62: 0 | AG62: 0 | AH62: 0 | AI62: 0 | AJ62: 0 | AK62: 0 | AL62: 0 | AM62: 0 | AN62: 0 | AO62: 0 | AP62: 0 | AQ62: 0 | AR62: 0 | AS62: 0 | AT62: 0 | AU62: 0 | AV62: 0 | AW62: 0 | AX62: 0
F63: 0 | G63: 0 | H63: 0 | I63: 0 | J63: 0 | K63: 0 | L63: 0 | M63: 0 | N63: 0 | O63: 0 | P63: 0 | Q63: 0 | R63: 0 | S63: 0 | T63: 0 | U63: 0 | V63: 0 | W63: 0 | X63: 0 | Y63: 0 | Z63: 1 | AA63: 0 | AB63: 0 | AC63: 0 | AD63: 0 | AE63: 0 | AF63: 0 | AG63: 0 | AH63: 0 | AI63: 0 | AJ63: 0 | AK63: 0 | AL63: 0 | AM63: 0 | AN63: 0 | AO63: 0 | AP63: 0 | AQ63: 0 | AR63: 0 | AS63: 0 | AT63: 0 | AU63: 0 | AV63: 0 | AW63: 0 | AX63: 0
F64: 0 | G64: 0 | H64: 0 | I64: 0 | J64: 0 | K64: 0 | L64: 0 | M64: 0 | N64: 0 | O64: 0 | P64: 0 | Q64: 0 | R64: 0 | S64: 0 | T64: 0 | U64: 0 | V64: 0 | W64: 0 | X64: 0 | Y64: 0 | Z64: 1 | AA64: 0 | AB64: 0 | AC64: 0 | AD64: 0 | AE64: 0 | AF64: 0 | AG64: 0 | AH64: 0 | AI64: 0 | AJ64: 0 | AK64: 0 | AL64: 0 | AM64: 0 | AN64: 0 | AO64: 0 | AP64: 0 | AQ64: 0 | AR64: 0 | AS64: 0 | AT64: 0 | AU64: 0 | AV64: 0 | AW64: 0 | AX64: 0
F65: 0 | G65: 0 | H65: 0 | I65: 0 | J65: 0 | K65: 0 | L65: 0 | M65: 0 | N65: 0 | O65: 0 | P65: 0 | Q65: 0 | R65: 0 | S65: 0 | T65: 0 | U65: 0 | V65: 0 | W65: 0 | X65: 0 | Y65: 0 | Z65: 1 | AA65: 0 | AB65: 0 | AC65: 0 | AD65: 0 | AE65: 0 | AF65: 0 | AG65: 0 | AH65: 0 | AI65: 0 | AJ65: 0 | AK65: 0 | AL65: 0 | AM65: 0 | AN65: 0 | AO65: 0 | AP65: 0 | AQ65: 0 | AR65: 0 | AS65: 0 | AT65: 0 | AU65: 0 | AV65: 0 | AW65: 0 | AX65: 0
F66: 0 | G66: 0 | H66: 0 | I66: 0 | J66: 0 | K66: 0 | L66: 0 | M66: 0 | N66: 0 | O66: 0 | P66: 0 | Q66: 0 | R66: 0 | S66: 0 | T66: 0 | U66: 0 | V66: 0 | W66: 0 | X66: 0 | Y66: 0 | Z66: 1 | AA66: 0 | AB66: 0 | AC66: 0 | AD66: 0 | AE66: 0 | AF66: 0 | AG66: 0 | AH66: 0 | AI66: 0 | AJ66: 0 | AK66: 0 | AL66: 0 | AM66: 0 | AN66: 0 | AO66: 0 | AP66: 0 | AQ66: 0 | AR66: 0 | AS66: 0 | AT66: 0 | AU66: 0 | AV66: 0 | AW66: 0 | AX66: 0
F67: 0 | G67: 0 | H67: 0 | I67: 0 | J67: 0 | K67: 0 | L67: 0 | M67: 0 | N67: 0 | O67: 0 | P67: 0 | Q67: 0 | R67: 0 | S67: 0 | T67: 0 | U67: 0 | V67: 0 | W67: 0 | X67: 0 | Y67: 0 | Z67: 0 | AA67: 1 | AB67: 0 | AC67: 0 | AD67: 0 | AE67: 0 | AF67: 0 | AG67: 0 | AH67: 0 | AI67: 0 | AJ67: 0 | AK67: 0 | AL67: 0 | AM67: 0 | AN67: 0 | AO67: 0 | AP67: 0 | AQ67: 0 | AR67: 0 | AS67: 0 | AT67: 0 | AU67: 0 | AV67: 0 | AW67: 0 | AX67: 0
F68: 0 | G68: 0 | H68: 0 | I68: 0 | J68: 0 | K68: 0 | L68: 0 | M68: 0 | N68: 0 | O68: 0 | P68: 0 | Q68: 0 | R68: 0 | S68: 0 | T68: 0 | U68: 0 | V68: 0 | W68: 0 | X68: 0 | Y68: 0 | Z68: 0 | AA68: 1 | AB68: 0 | AC68: 0 | AD68: 0 | AE68: 0 | AF68: 0 | AG68: 0 | AH68: 0 | AI68: 0 | AJ68: 0 | AK68: 0 | AL68: 0 | AM68: 0 | AN68: 0 | AO68: 0 | AP68: 0 | AQ68: 0 | AR68: 0 | AS68: 0 | AT68: 0 | AU68: 0 | AV68: 0 | AW68: 0 | AX68: 0
F69: 0 | G69: 0 | H69: 0 | I69: 0 | J69: 0 | K69: 0 | L69: 0 | M69: 0 | N69: 0 | O69: 0 | P69: 0 | Q69: 0 | R69: 0 | S69: 0 | T69: 0 | U69: 0 | V69: 0 | W69: 0 | X69: 0 | Y69: 0 | Z69: 0 | AA69: 0 | AB69: 1 | AC69: 0 | AD69: 0 | AE69: 0 | AF69: 0 | AG69: 0 | AH69: 0 | AI69: 0 | AJ69: 0 | AK69: 0 | AL69: 0 | AM69: 0 | AN69: 0 | AO69: 0 | AP69: 0 | AQ69: 0 | AR69: 0 | AS69: 0 | AT69: 0 | AU69: 0 | AV69: 0 | AW69: 0 | AX69: 0
F70: 0 | G70: 0 | H70: 0 | I70: 0 | J70: 0 | K70: 0 | L70: 0 | M70: 0 | N70: 0 | O70: 0 | P70: 0 | Q70: 0 | R70: 0 | S70: 0 | T70: 0 | U70: 0 | V70: 0 | W70: 0 | X70: 0 | Y70: 0 | Z70: 0 | AA70: 0 | AB70: 1 | AC70: 0 | AD70: 0 | AE70: 0 | AF70: 0 | AG70: 0 | AH70: 0 | AI70: 0 | AJ70: 0 | AK70: 0 | AL70: 0 | AM70: 0 | AN70: 0 | AO70: 0 | AP70: 0 | AQ70: 0 | AR70: 0 | AS70: 0 | AT70: 0 | AU70: 0 | AV70: 0 | AW70: 0 | AX70: 0
F71: 0 | G71: 0 | H71: 0 | I71: 0 | J71: 0 | K71: 0 | L71: 0 | M71: 0 | N71: 0 | O71: 0 | P71: 0 | Q71: 0 | R71: 0 | S71: 0 | T71: 0 | U71: 0 | V71: 0 | W71: 0 | X71: 0 | Y71: 0 | Z71: 0 | AA71: 0 | AB71: 1 | AC71: 0 | AD71: 0 | AE71: 0 | AF71: 0 | AG71: 0 | AH71: 0 | AI71: 0 | AJ71: 0 | AK71: 0 | AL71: 0 | AM71: 0 | AN71: 0 | AO71: 0 | AP71: 0 | AQ71: 0 | AR71: 0 | AS71: 0 | AT71: 0 | AU71: 0 | AV71: 0 | AW71: 0 | AX71: 0
F72: 0 | G72: 0 | H72: 0 | I72: 0 | J72: 0 | K72: 0 | L72: 0 | M72: 0 | N72: 0 | O72: 0 | P72: 0 | Q72: 0 | R72: 0 | S72: 0 | T72: 0 | U72: 0 | V72: 0 | W72: 0 | X72: 0 | Y72: 0 | Z72: 0 | AA72: 0 | AB72: 1 | AC72: 0 | AD72: 0 | AE72: 0 | AF72: 0 | AG72: 0 | AH72: 0 | AI72: 0 | AJ72: 0 | AK72: 0 | AL72: 0 | AM72: 0 | AN72: 0 | AO72: 0 | AP72: 0 | AQ72: 0 | AR72: 0 | AS72: 0 | AT72: 0 | AU72: 0 | AV72: 0 | AW72: 0 | AX72: 0
F73: 0 | G73: 0 | H73: 0 | I73: 0 | J73: 0 | K73: 0 | L73: 0 | M73: 0 | N73: 0 | O73: 0 | P73: 0 | Q73: 0 | R73: 0 | S73: 0 | T73: 0 | U73: 0 | V73: 0 | W73: 0 | X73: 0 | Y73: 0 | Z73: 0 | AA73: 0 | AB73: 1 | AC73: 0 | AD73: 0 | AE73: 0 | AF73: 0 | AG73: 0 | AH73: 0 | AI73: 0 | AJ73: 0 | AK73: 0 | AL73: 0 | AM73: 0 | AN73: 0 | AO73: 0 | AP73: 0 | AQ73: 0 | AR73: 0 | AS73: 0 | AT73: 0 | AU73: 0 | AV73: 0 | AW73: 0 | AX73: 0
F74: 0 | G74: 0 | H74: 0 | I74: 0 | J74: 0 | K74: 0 | L74: 0 | M74: 0 | N74: 0 | O74: 0 | P74: 0 | Q74: 0 | R74: 0 | S74: 0 | T74: 0 | U74: 0 | V74: 0 | W74: 0 | X74: 0 | Y74: 0 | Z74: 0 | AA74: 0 | AB74: 0 | AC74: 0 | AD74: 0 | AE74: 0 | AF74: 0 | AG74: 0 | AH74: 0 | AI74: 0 | AJ74: 0 | AK74: 0 | AL74: 0 | AM74: 0 | AN74: 1 | AO74: 0 | AP74: 0 | AQ74: 0 | AR74: 0 | AS74: 0 | AT74: 0 | AU74: 0 | AV74: 0 | AW74: 0 | AX74: 0
F75: 0 | G75: 0 | H75: 0 | I75: 0 | J75: 0 | K75: 0 | L75: 0 | M75: 0 | N75: 0 | O75: 0 | P75: 0 | Q75: 0 | R75: 0 | S75: 0 | T75: 0 | U75: 0 | V75: 0 | W75: 0 | X75: 0 | Y75: 0 | Z75: 0 | AA75: 0 | AB75: 0 | AC75: 0 | AD75: 0 | AE75: 0 | AF75: 0 | AG75: 0 | AH75: 0 | AI75: 0 | AJ75: 0 | AK75: 0 | AL75: 0 | AM75: 0 | AN75: 1 | AO75: 0 | AP75: 0 | AQ75: 0 | AR75: 0 | AS75: 0 | AT75: 0 | AU75: 0 | AV75: 0 | AW75: 0 | AX75: 0
F76: 0 | G76: 0 | H76: 0 | I76: 0 | J76: 0 | K76: 0 | L76: 0 | M76: 0 | N76: 0 | O76: 0 | P76: 0 | Q76: 0 | R76: 0 | S76: 0 | T76: 0 | U76: 0 | V76: 0 | W76: 0 | X76: 0 | Y76: 0 | Z76: 0 | AA76: 0 | AB76: 0 | AC76: 0 | AD76: 0 | AE76: 0 | AF76: 0 | AG76: 0 | AH76: 0 | AI76: 0 | AJ76: 0 | AK76: 0 | AL76: 0 | AM76: 0 | AN76: 1 | AO76: 0 | AP76: 0 | AQ76: 0 | AR76: 0 | AS76: 0 | AT76: 0 | AU76: 0 | AV76: 0 | AW76: 0 | AX76: 0
F77: 0 | G77: 0 | H77: 0 | I77: 0 | J77: 0 | K77: 0 | L77: 0 | M77: 0 | N77: 0 | O77: 0 | P77: 0 | Q77: 0 | R77: 0 | S77: 0 | T77: 0 | U77: 0 | V77: 0 | W77: 0 | X77: 0 | Y77: 0 | Z77: 0 | AA77: 0 | AB77: 0 | AC77: 0 | AD77: 0 | AE77: 0 | AF77: 0 | AG77: 0 | AH77: 0 | AI77: 0 | AJ77: 0 | AK77: 0 | AL77: 0 | AM77: 0 | AN77: 1 | AO77: 0 | AP77: 0 | AQ77: 0 | AR77: 0 | AS77: 0 | AT77: 0 | AU77: 0 | AV77: 0 | AW77: 0 | AX77: 0
F78: 0 | G78: 0 | H78: 0 | I78: 0 | J78: 0 | K78: 0 | L78: 0 | M78: 0 | N78: 0 | O78: 0 | P78: 0 | Q78: 0 | R78: 0 | S78: 0 | T78: 0 | U78: 0 | V78: 0 | W78: 0 | X78: 0 | Y78: 0 | Z78: 0 | AA78: 0 | AB78: 0 | AC78: 0 | AD78: 0 | AE78: 0 | AF78: 0 | AG78: 0 | AH78: 0 | AI78: 0 | AJ78: 0 | AK78: 0 | AL78: 0 | AM78: 0 | AN78: 1 | AO78: 0 | AP78: 0 | AQ78: 0 | AR78: 0 | AS78: 0 | AT78: 0 | AU78: 0 | AV78: 0 | AW78: 0 | AX78: 0
F79: 0 | G79: 0 | H79: 0 | I79: 0 | J79: 0 | K79: 0 | L79: 0 | M79: 0 | N79: 0 | O79: 0 | P79: 0 | Q79: 0 | R79: 0 | S79: 0 | T79: 0 | U79: 0 | V79: 0 | W79: 0 | X79: 0 | Y79: 0 | Z79: 0 | AA79: 0 | AB79: 0 | AC79: 0 | AD79: 0 | AE79: 0 | AF79: 0 | AG79: 0 | AH79: 0 | AI79: 0 | AJ79: 0 | AK79: 0 | AL79: 0 | AM79: 0 | AN79: 1 | AO79: 0 | AP79: 0 | AQ79: 0 | AR79: 0 | AS79: 0 | AT79: 0 | AU79: 0 | AV79: 0 | AW79: 0 | AX79: 0
F80: 0 | G80: 0 | H80: 0 | I80: 0 | J80: 0 | K80: 0 | L80: 0 | M80: 0 | N80: 0 | O80: 0 | P80: 0 | Q80: 0 | R80: 0 | S80: 0 | T80: 0 | U80: 0 | V80: 0 | W80: 0 | X80: 0 | Y80: 0 | Z80: 0 | AA80: 0 | AB80: 0 | AC80: 0 | AD80: 0 | AE80: 0 | AF80: 0 | AG80: 0 | AH80: 0 | AI80: 0 | AJ80: 0 | AK80: 0 | AL80: 0 | AM80: 0 | AN80: 1 | AO80: 0 | AP80: 0 | AQ80: 0 | AR80: 0 | AS80: 0 | AT80: 0 | AU80: 0 | AV80: 0 | AW80: 0 | AX80: 0
F81: 0 | G81: 0 | H81: 0 | I81: 0 | J81: 0 | K81: 0 | L81: 0 | M81: 0 | N81: 0 | O81: 0 | P81: 0 | Q81: 0 | R81: 0 | S81: 0 | T81: 0 | U81: 0 | V81: 0 | W81: 0 | X81: 0 | Y81: 0 | Z81: 0 | AA81: 0 | AB81: 0 | AC81: 0 | AD81: 0 | AE81: 0 | AF81: 0 | AG81: 0 | AH81: 0 | AI81: 0 | AJ81: 0 | AK81: 0 | AL81: 0 | AM81: 0 | AN81: 1 | AO81: 0 | AP81: 0 | AQ81: 0 | AR81: 0 | AS81: 0 | AT81: 0 | AU81: 0 | AV81: 0 | AW81: 0 | AX81: 0
F82: 0 | G82: 0 | H82: 0 | I82: 0 | J82: 0 | K82: 0 | L82: 0 | M82: 0 | N82: 0 | O82: 0 | P82: 0 | Q82: 0 | R82: 0 | S82: 0 | T82: 0 | U82: 0 | V82: 0 | W82: 0 | X82: 0 | Y82: 0 | Z82: 0 | AA82: 0 | AB82: 0 | AC82: 0 | AD82: 0 | AE82: 0 | AF82: 0 | AG82: 0 | AH82: 0 | AI82: 0 | AJ82: 0 | AK82: 0 | AL82: 0 | AM82: 0 | AN82: 1 | AO82: 0 | AP82: 0 | AQ82: 0 | AR82: 0 | AS82: 0 | AT82: 0 | AU82: 0 | AV82: 0 | AW82: 0 | AX82: 0
F83: 0 | G83: 0 | H83: 0 | I83: 0 | J83: 0 | K83: 0 | L83: 0 | M83: 0 | N83: 0 | O83: 0 | P83: 0 | Q83: 0 | R83: 0 | S83: 0 | T83: 0 | U83: 0 | V83: 0 | W83: 0 | X83: 0 | Y83: 0 | Z83: 0 | AA83: 0 | AB83: 0 | AC83: 0 | AD83: 0 | AE83: 0 | AF83: 0 | AG83: 0 | AH83: 0 | AI83: 0 | AJ83: 0 | AK83: 0 | AL83: 0 | AM83: 0 | AN83: 1 | AO83: 0 | AP83: 0 | AQ83: 0 | AR83: 0 | AS83: 0 | AT83: 0 | AU83: 0 | AV83: 0 | AW83: 0 | AX83: 0
F84: 0 | G84: 0 | H84: 0 | I84: 0 | J84: 0 | K84: 0 | L84: 0 | M84: 0 | N84: 0 | O84: 0 | P84: 0 | Q84: 0 | R84: 0 | S84: 0 | T84: 0 | U84: 0 | V84: 0 | W84: 0 | X84: 0 | Y84: 0 | Z84: 0 | AA84: 0 | AB84: 0 | AC84: 0 | AD84: 0 | AE84: 0 | AF84: 0 | AG84: 0 | AH84: 0 | AI84: 0 | AJ84: 0 | AK84: 0 | AL84: 0 | AM84: 0 | AN84: 1 | AO84: 0 | AP84: 0 | AQ84: 0 | AR84: 0 | AS84: 0 | AT84: 0 | AU84: 0 | AV84: 0 | AW84: 0 | AX84: 0
F85: 0 | G85: 0 | H85: 0 | I85: 0 | J85: 0 | K85: 0 | L85: 0 | M85: 0 | N85: 0 | O85: 0 | P85: 0 | Q85: 0 | R85: 0 | S85: 0 | T85: 0 | U85: 0 | V85: 0 | W85: 0 | X85: 0 | Y85: 0 | Z85: 0 | AA85: 0 | AB85: 0 | AC85: 0 | AD85: 0 | AE85: 0 | AF85: 0 | AG85: 0 | AH85: 0 | AI85: 0 | AJ85: 0 | AK85: 0 | AL85: 0 | AM85: 0 | AN85: 1 | AO85: 0 | AP85: 0 | AQ85: 0 | AR85: 0 | AS85: 0 | AT85: 0 | AU85: 0 | AV85: 0 | AW85: 0 | AX85: 0
F86: 0 | G86: 0 | H86: 0 | I86: 0 | J86: 0 | K86: 0 | L86: 0 | M86: 0 | N86: 0 | O86: 0 | P86: 0 | Q86: 0 | R86: 0 | S86: 0 | T86: 0 | U86: 0 | V86: 0 | W86: 0 | X86: 0 | Y86: 0 | Z86: 0 | AA86: 0 | AB86: 0 | AC86: 0 | AD86: 0 | AE86: 0 | AF86: 0 | AG86: 0 | AH86: 0 | AI86: 0 | AJ86: 0 | AK86: 0 | AL86: 0 | AM86: 0 | AN86: 1 | AO86: 0 | AP86: 0 | AQ86: 0 | AR86: 0 | AS86: 0 | AT86: 0 | AU86: 0 | AV86: 0 | AW86: 0 | AX86: 0
F87: 0 | G87: 0 | H87: 0 | I87: 0 | J87: 0 | K87: 0 | L87: 0 | M87: 0 | N87: 0 | O87: 0 | P87: 0 | Q87: 0 | R87: 0 | S87: 0 | T87: 0 | U87: 0 | V87: 0 | W87: 0 | X87: 0 | Y87: 0 | Z87: 0 | AA87: 0 | AB87: 0 | AC87: 0 | AD87: 0 | AE87: 0 | AF87: 0 | AG87: 0 | AH87: 0 | AI87: 0 | AJ87: 0 | AK87: 0 | AL87: 0 | AM87: 0 | AN87: 1 | AO87: 0 | AP87: 0 | AQ87: 0 | AR87: 0 | AS87: 0 | AT87: 0 | AU87: 0 | AV87: 0 | AW87: 0 | AX87: 0
F88: 0 | G88: 0 | H88: 0 | I88: 0 | J88: 0 | K88: 0 | L88: 0 | M88: 0 | N88: 0 | O88: 0 | P88: 0 | Q88: 0 | R88: 0 | S88: 0 | T88: 0 | U88: 0 | V88: 0 | W88: 0 | X88: 0 | Y88: 0 | Z88: 0 | AA88: 0 | AB88: 0 | AC88: 0 | AD88: 0 | AE88: 0 | AF88: 0 | AG88: 0 | AH88: 0 | AI88: 0 | AJ88: 0 | AK88: 0 | AL88: 0 | AM88: 0 | AN88: 1 | AO88: 0 | AP88: 0 | AQ88: 0 | AR88: 0 | AS88: 0 | AT88: 0 | AU88: 0 | AV88: 0 | AW88: 0 | AX88: 0
F89: 0 | G89: 0 | H89: 0 | I89: 0 | J89: 0 | K89: 0 | L89: 0 | M89: 0 | N89: 0 | O89: 0 | P89: 0 | Q89: 0 | R89: 0 | S89: 0 | T89: 0 | U89: 0 | V89: 0 | W89: 0 | X89: 0 | Y89: 0 | Z89: 0 | AA89: 0 | AB89: 0 | AC89: 0 | AD89: 0 | AE89: 0 | AF89: 0 | AG89: 0 | AH89: 0 | AI89: 0 | AJ89: 0 | AK89: 0 | AL89: 0 | AM89: 0 | AN89: 1 | AO89: 0 | AP89: 0 | AQ89: 0 | AR89: 0 | AS89: 0 | AT89: 0 | AU89: 0 | AV89: 0 | AW89: 0 | AX89: 0
F90: 0 | G90: 0 | H90: 0 | I90: 0 | J90: 0 | K90: 0 | L90: 0 | M90: 0 | N90: 0 | O90: 0 | P90: 0 | Q90: 0 | R90: 0 | S90: 0 | T90: 0 | U90: 0 | V90: 0 | W90: 0 | X90: 0 | Y90: 0 | Z90: 0 | AA90: 0 | AB90: 0 | AC90: 0 | AD90: 0 | AE90: 0 | AF90: 0 | AG90: 0 | AH90: 0 | AI90: 0 | AJ90: 0 | AK90: 0 | AL90: 0 | AM90: 0 | AN90: 1 | AO90: 0 | AP90: 0 | AQ90: 0 | AR90: 0 | AS90: 0 | AT90: 0 | AU90: 0 | AV90: 0 | AW90: 0 | AX90: 0
F91: 0 | G91: 0 | H91: 0 | I91: 0 | J91: 0 | K91: 0 | L91: 0 | M91: 0 | N91: 0 | O91: 0 | P91: 0 | Q91: 0 | R91: 0 | S91: 0 | T91: 0 | U91: 0 | V91: 0 | W91: 0 | X91: 0 | Y91: 0 | Z91: 0 | AA91: 0 | AB91: 0 | AC91: 0 | AD91: 0 | AE91: 0 | AF91: 0 | AG91: 0 | AH91: 0 | AI91: 0 | AJ91: 0 | AK91: 0 | AL91: 0 | AM91: 0 | AN91: 1 | AO91: 0 | AP91: 0 | AQ91: 0 | AR91: 0 | AS91: 0 | AT91: 0 | AU91: 0 | AV91: 0 | AW91: 0 | AX91: 0
F92: 0 | G92: 0 | H92: 0 | I92: 0 | J92: 0 | K92: 0 | L92: 0 | M92: 0 | N92: 0 | O92: 0 | P92: 0 | Q92: 0 | R92: 0 | S92: 0 | T92: 0 | U92: 0 | V92: 0 | W92: 0 | X92: 0 | Y92: 0 | Z92: 0 | AA92: 0 | AB92: 0 | AC92: 0 | AD92: 0 | AE92: 0 | AF92: 0 | AG92: 0 | AH92: 0 | AI92: 0 | AJ92: 0 | AK92: 0 | AL92: 0 | AM92: 0 | AN92: 1 | AO92: 0 | AP92: 0 | AQ92: 0 | AR92: 0 | AS92: 0 | AT92: 0 | AU92: 0 | AV92: 0 | AW92: 0 | AX92: 0
F93: 0 | G93: 0 | H93: 0 | I93: 0 | J93: 0 | K93: 0 | L93: 0 | M93: 0 | N93: 0 | O93: 0 | P93: 0 | Q93: 0 | R93: 0 | S93: 0 | T93: 0 | U93: 0 | V93: 0 | W93: 0 | X93: 0 | Y93: 0 | Z93: 0 | AA93: 0 | AB93: 0 | AC93: 0 | AD93: 0 | AE93: 0 | AF93: 0 | AG93: 0 | AH93: 0 | AI93: 0 | AJ93: 0 | AK93: 0 | AL93: 0 | AM93: 0 | AN93: 1 | AO93: 0 | AP93: 0 | AQ93: 0 | AR93: 0 | AS93: 0 | AT93: 0 | AU93: 0 | AV93: 0 | AW93: 0 | AX93: 0
F94: 0 | G94: 0 | H94: 0 | I94: 0 | J94: 0 | K94: 0 | L94: 0 | M94: 0 | N94: 0 | O94: 0 | P94: 0 | Q94: 0 | R94: 0 | S94: 0 | T94: 0 | U94: 0 | V94: 0 | W94: 0 | X94: 0 | Y94: 0 | Z94: 0 | AA94: 0 | AB94: 0 | AC94: 0 | AD94: 0 | AE94: 0 | AF94: 0 | AG94: 0 | AH94: 0 | AI94: 0 | AJ94: 0 | AK94: 0 | AL94: 0 | AM94: 0 | AN94: 1 | AO94: 0 | AP94: 0 | AQ94: 0 | AR94: 0 | AS94: 0 | AT94: 0 | AU94: 0 | AV94: 0 | AW94: 0 | AX94: 0
F95: 0 | G95: 0 | H95: 0 | I95: 0 | J95: 0 | K95: 0 | L95: 0 | M95: 1 | N95: 0 | O95: 0 | P95: 0 | Q95: 0 | R95: 0 | S95: 0 | T95: 0 | U95: 0 | V95: 0 | W95: 0 | X95: 0 | Y95: 0 | Z95: 0 | AA95: 0 | AB95: 0 | AC95: 0 | AD95: 0 | AE95: 0 | AF95: 0 | AG95: 0 | AH95: 0 | AI95: 0 | AJ95: 0 | AK95: 0 | AL95: 0 | AM95: 0 | AN95: 0 | AO95: 0 | AP95: 0 | AQ95: 0 | AR95: 0 | AS95: 0 | AT95: 0 | AU95: 0 | AV95: 0 | AW95: 0 | AX95: 0
F96: 0 | G96: 0 | H96: 0 | I96: 0 | J96: 0 | K96: 0 | L96: 0 | M96: 1 | N96: 0 | O96: 0 | P96: 0 | Q96: 0 | R96: 0 | S96: 0 | T96: 0 | U96: 0 | V96: 0 | W96: 0 | X96: 0 | Y96: 0 | Z96: 0 | AA96: 0 | AB96: 0 | AC96: 0 | AD96: 0 | AE96: 0 | AF96: 0 | AG96: 0 | AH96: 0 | AI96: 0 | AJ96: 0 | AK96: 0 | AL96: 0 | AM96: 0 | AN96: 0 | AO96: 0 | AP96: 0 | AQ96: 0 | AR96: 0 | AS96: 0 | AT96: 0 | AU96: 0 | AV96: 0 | AW96: 0 | AX96: 0
F97: 0 | G97: 0 | H97: 0 | I97: 0 | J97: 0 | K97: 0 | L97: 0 | M97: 1 | N97: 0 | O97: 0 | P97: 0 | Q97: 0 | R97: 0 | S97: 0 | T97: 0 | U97: 0 | V97: 0 | W97: 0 | X97: 0 | Y97: 0 | Z97: 0 | AA97: 0 | AB97: 0 | AC97: 0 | AD97: 0 | AE97: 0 | AF97: 0 | AG97: 0 | AH97: 0 | AI97: 0 | AJ97: 0 | AK97: 0 | AL97: 0 | AM97: 0 | AN97: 0 | AO97: 0 | AP97: 0 | AQ97: 0 | AR97: 0 | AS97: 0 | AT97: 0 | AU97: 0 | AV97: 0 | AW97: 0 | AX97: 0
F98: 0 | G98: 0 | H98: 0 | I98: 0 | J98: 0 | K98: 0 | L98: 0 | M98: 1 | N98: 0 | O98: 0 | P98: 0 | Q98: 0 | R98: 0 | S98: 0 | T98: 0 | U98: 0 | V98: 0 | W98: 0 | X98: 0 | Y98: 0 | Z98: 0 | AA98: 0 | AB98: 0 | AC98: 0 | AD98: 0 | AE98: 0 | AF98: 0 | AG98: 0 | AH98: 0 | AI98: 0 | AJ98: 0 | AK98: 0 | AL98: 0 | AM98: 0 | AN98: 0 | AO98: 0 | AP98: 0 | AQ98: 0 | AR98: 0 | AS98: 0 | AT98: 0 | AU98: 0 | AV98: 0 | AW98: 0 | AX98: 0
F99: 0 | G99: 0 | H99: 0 | I99: 0 | J99: 0 | K99: 0 | L99: 0 | M99: 1 | N99: 0 | O99: 0 | P99: 0 | Q99: 0 | R99: 0 | S99: 0 | T99: 0 | U99: 0 | V99: 0 | W99: 0 | X99: 0 | Y99: 0 | Z99: 0 | AA99: 0 | AB99: 0 | AC99: 0 | AD99: 0 | AE99: 0 | AF99: 0 | AG99: 0 | AH99: 0 | AI99: 0 | AJ99: 0 | AK99: 0 | AL99: 0 | AM99: 0 | AN99: 0 | AO99: 0 | AP99: 0 | AQ99: 0 | AR99: 0 | AS99: 0 | AT99: 0 | AU99: 0 | AV99: 0 | AW99: 0 | AX99: 0
F100: 0 | G100: 0 | H100: 0 | I100: 0 | J100: 0 | K100: 0 | L100: 0 | M100: 1 | N100: 0 | O100: 0 | P100: 0 | Q100: 0 | R100: 0 | S100: 0 | T100: 0 | U100: 0 | V100: 0 | W100: 0 | X100: 0 | Y100: 0 | Z100: 0 | AA100: 0 | AB100: 0 | AC100: 0 | AD100: 0 | AE100: 0 | AF100: 0 | AG100: 0 | AH100: 0 | AI100: 0 | AJ100: 0 | AK100: 0 | AL100: 0 | AM100: 0 | AN100: 0 | AO100: 0 | AP100: 0 | AQ100: 0 | AR100: 0 | AS100: 0 | AT100: 0 | AU100: 0 | AV100: 0 | AW100: 0 | AX100: 0
F101: 0 | G101: 0 | H101: 0 | I101: 0 | J101: 0 | K101: 0 | L101: 0 | M101: 1 | N101: 0 | O101: 0 | P101: 0 | Q101: 0 | R101: 0 | S101: 0 | T101: 0 | U101: 0 | V101: 0 | W101: 0 | X101: 0 | Y101: 0 | Z101: 0 | AA101: 0 | AB101: 0 | AC101: 0 | AD101: 0 | AE101: 0 | AF101: 0 | AG101: 0 | AH101: 0 | AI101: 0 | AJ101: 0 | AK101: 0 | AL101: 0 | AM101: 0 | AN101: 0 | AO101: 0 | AP101: 0 | AQ101: 0 | AR101: 0 | AS101: 0 | AT101: 0 | AU101: 0 | AV101: 0 | AW101: 0 | AX101: 0
F102: 0 | G102: 0 | H102: 0 | I102: 0 | J102: 0 | K102: 0 | L102: 0 | M102: 1 | N102: 0 | O102: 0 | P102: 0 | Q102: 0 | R102: 0 | S102: 0 | T102: 0 | U102: 0 | V102: 0 | W102: 0 | X102: 0 | Y102: 0 | Z102: 0 | AA102: 0 | AB102: 0 | AC102: 0 | AD102: 0 | AE102: 0 | AF102: 0 | AG102: 0 | AH102: 0 | AI102: 0 | AJ102: 0 | AK102: 0 | AL102: 0 | AM102: 0 | AN102: 0 | AO102: 0 | AP102: 0 | AQ102: 0 | AR102: 0 | AS102: 0 | AT102: 0 | AU102: 0 | AV102: 0 | AW102: 0 | AX102: 0
F103: 0 | G103: 0 | H103: 0 | I103: 0 | J103: 0 | K103: 0 | L103: 0 | M103: 1 | N103: 0 | O103: 0 | P103: 0 | Q103: 0 | R103: 0 | S103: 0 | T103: 0 | U103: 0 | V103: 0 | W103: 0 | X103: 0 | Y103: 0 | Z103: 0 | AA103: 0 | AB103: 0 | AC103: 0 | AD103: 0 | AE103: 0 | AF103: 0 | AG103: 0 | AH103: 0 | AI103: 0 | AJ103: 0 | AK103: 0 | AL103: 0 | AM103: 0 | AN103: 0 | AO103: 0 | AP103: 0 | AQ103: 0 | AR103: 0 | AS103: 0 | AT103: 0 | AU103: 0 | AV103: 0 | AW103: 0 | AX103: 0
F104: 0 | G104: 0 | H104: 0 | I104: 0 | J104: 0 | K104: 0 | L104: 0 | M104: 0 | N104: 0 | O104: 0 | P104: 0 | Q104: 0 | R104: 0 | S104: 0 | T104: 0 | U104: 0 | V104: 0 | W104: 0 | X104: 0 | Y104: 0 | Z104: 0 | AA104: 0 | AB104: 0 | AC104: 0 | AD104: 0 | AE104: 0 | AF104: 0 | AG104: 0 | AH104: 0 | AI104: 0 | AJ104: 0 | AK104: 0 | AL104: 0 | AM104: 1 | AN104: 0 | AO104: 0 | AP104: 0 | AQ104: 0 | AR104: 0 | AS104: 0 | AT104: 0 | AU104: 0 | AV104: 0 | AW104: 0 | AX104: 0
F105: 0 | G105: 0 | H105: 0 | I105: 0 | J105: 0 | K105: 0 | L105: 0 | M105: 0 | N105: 0 | O105: 0 | P105: 0 | Q105: 0 | R105: 0 | S105: 0 | T105: 0 | U105: 0 | V105: 0 | W105: 0 | X105: 0 | Y105: 0 | Z105: 0 | AA105: 0 | AB105: 0 | AC105: 0 | AD105: 0 | AE105: 0 | AF105: 0 | AG105: 0 | AH105: 0 | AI105: 0 | AJ105: 0 | AK105: 0 | AL105: 0 | AM105: 1 | AN105: 0 | AO105: 0 | AP105: 0 | AQ105: 0 | AR105: 0 | AS105: 0 | AT105: 0 | AU105: 0 | AV105: 0 | AW105: 0 | AX105: 0
F106: 0 | G106: 0 | H106: 0 | I106: 0 | J106: 0 | K106: 0 | L106: 0 | M106: 0 | N106: 0 | O106: 0 | P106: 0 | Q106: 0 | R106: 0 | S106: 0 | T106: 0 | U106: 0 | V106: 0 | W106: 0 | X106: 0 | Y106: 0 | Z106: 0 | AA106: 0 | AB106: 0 | AC106: 0 | AD106: 0 | AE106: 0 | AF106: 0 | AG106: 0 | AH106: 0 | AI106: 0 | AJ106: 0 | AK106: 0 | AL106: 0 | AM106: 1 | AN106: 0 | AO106: 0 | AP106: 0 | AQ106: 0 | AR106: 0 | AS106: 0 | AT106: 0 | AU106: 0 | AV106: 0 | AW106: 0 | AX106: 0
F107: 0 | G107: 0 | H107: 0 | I107: 0 | J107: 0 | K107: 0 | L107: 0 | M107: 0 | N107: 0 | O107: 0 | P107: 0 | Q107: 0 | R107: 0 | S107: 0 | T107: 0 | U107: 0 | V107: 0 | W107: 0 | X107: 0 | Y107: 0 | Z107: 0 | AA107: 0 | AB107: 0 | AC107: 0 | AD107: 0 | AE107: 0 | AF107: 0 | AG107: 0 | AH107: 0 | AI107: 0 | AJ107: 0 | AK107: 0 | AL107: 0 | AM107: 1 | AN107: 0 | AO107: 0 | AP107: 0 | AQ107: 0 | AR107: 0 | AS107: 0 | AT107: 0 | AU107: 0 | AV107: 0 | AW107: 0 | AX107: 0
F108: 0 | G108: 0 | H108: 0 | I108: 0 | J108: 0 | K108: 0 | L108: 0 | M108: 0 | N108: 0 | O108: 0 | P108: 0 | Q108: 0 | R108: 0 | S108: 0 | T108: 0 | U108: 0 | V108: 0 | W108: 0 | X108: 0 | Y108: 0 | Z108: 0 | AA108: 0 | AB108: 0 | AC108: 0 | AD108: 0 | AE108: 0 | AF108: 0 | AG108: 0 | AH108: 0 | AI108: 0 | AJ108: 0 | AK108: 0 | AL108: 0 | AM108: 1 | AN108: 0 | AO108: 0 | AP108: 0 | AQ108: 0 | AR108: 0 | AS108: 0 | AT108: 0 | AU108: 0 | AV108: 0 | AW108: 0 | AX108: 0
F109: 0 | G109: 0 | H109: 0 | I109: 0 | J109: 0 | K109: 0 | L109: 0 | M109: 0 | N109: 0 | O109: 0 | P109: 0 | Q109: 0 | R109: 0 | S109: 0 | T109: 0 | U109: 0 | V109: 0 | W109: 0 | X109: 0 | Y109: 0 | Z109: 0 | AA109: 0 | AB109: 0 | AC109: 0 | AD109: 0 | AE109: 0 | AF109: 0 | AG109: 0 | AH109: 0 | AI109: 0 | AJ109: 0 | AK109: 0 | AL109: 0 | AM109: 1 | AN109: 0 | AO109: 0 | AP109: 0 | AQ109: 0 | AR109: 0 | AS109: 0 | AT109: 0 | AU109: 0 | AV109: 0 | AW109: 0 | AX109: 0
F110: 0 | G110: 0 | H110: 0 | I110: 0 | J110: 0 | K110: 0 | L110: 0 | M110: 0 | N110: 0 | O110: 0 | P110: 0 | Q110: 0 | R110: 0 | S110: 0 | T110: 0 | U110: 0 | V110: 0 | W110: 0 | X110: 0 | Y110: 0 | Z110: 0 | AA110: 0 | AB110: 0 | AC110: 0 | AD110: 0 | AE110: 0 | AF110: 0 | AG110: 0 | AH110: 0 | AI110: 0 | AJ110: 0 | AK110: 0 | AL110: 0 | AM110: 1 | AN110: 0 | AO110: 0 | AP110: 0 | AQ110: 0 | AR110: 0 | AS110: 0 | AT110: 0 | AU110: 0 | AV110: 0 | AW110: 0 | AX110: 0
F111: 0 | G111: 0 | H111: 0 | I111: 0 | J111: 0 | K111: 0 | L111: 0 | M111: 0 | N111: 0 | O111: 0 | P111: 0 | Q111: 0 | R111: 0 | S111: 0 | T111: 0 | U111: 0 | V111: 0 | W111: 0 | X111: 0 | Y111: 0 | Z111: 0 | AA111: 0 | AB111: 0 | AC111: 0 | AD111: 0 | AE111: 0 | AF111: 0 | AG111: 0 | AH111: 0 | AI111: 0 | AJ111: 1 | AK111: 0 | AL111: 0 | AM111: 0 | AN111: 0 | AO111: 0 | AP111: 0 | AQ111: 0 | AR111: 0 | AS111: 0 | AT111: 0 | AU111: 0 | AV111: 0 | AW111: 0 | AX111: 0
F112: 0 | G112: 0 | H112: 0 | I112: 0 | J112: 0 | K112: 0 | L112: 0 | M112: 0 | N112: 0 | O112: 0 | P112: 0 | Q112: 0 | R112: 0 | S112: 0 | T112: 0 | U112: 0 | V112: 0 | W112: 0 | X112: 0 | Y112: 0 | Z112: 0 | AA112: 0 | AB112: 0 | AC112: 0 | AD112: 0 | AE112: 0 | AF112: 0 | AG112: 0 | AH112: 0 | AI112: 0 | AJ112: 1 | AK112: 0 | AL112: 0 | AM112: 0 | AN112: 0 | AO112: 0 | AP112: 0 | AQ112: 0 | AR112: 0 | AS112: 0 | AT112: 0 | AU112: 0 | AV112: 0 | AW112: 0 | AX112: 0
F113: 0 | G113: 0 | H113: 0 | I113: 0 | J113: 0 | K113: 0 | L113: 0 | M113: 0 | N113: 0 | O113: 0 | P113: 0 | Q113: 0 | R113: 0 | S113: 0 | T113: 0 | U113: 0 | V113: 0 | W113: 0 | X113: 0 | Y113: 0 | Z113: 0 | AA113: 0 | AB113: 0 | AC113: 0 | AD113: 0 | AE113: 0 | AF113: 0 | AG113: 0 | AH113: 0 | AI113: 0 | AJ113: 1 | AK113: 0 | AL113: 0 | AM113: 0 | AN113: 0 | AO113: 0 | AP113: 0 | AQ113: 0 | AR113: 0 | AS113: 0 | AT113: 0 | AU113: 0 | AV113: 0 | AW113: 0 | AX113: 0
F114: 0 | G114: 0 | H114: 0 | I114: 0 | J114: 0 | K114: 0 | L114: 0 | M114: 0 | N114: 0 | O114: 0 | P114: 0 | Q114: 0 | R114: 0 | S114: 0 | T114: 0 | U114: 0 | V114: 0 | W114: 0 | X114: 0 | Y114: 0 | Z114: 0 | AA114: 0 | AB114: 0 | AC114: 0 | AD114: 0 | AE114: 0 | AF114: 0 | AG114: 0 | AH114: 0 | AI114: 0 | AJ114: 1 | AK114: 0 | AL114: 0 | AM114: 0 | AN114: 0 | AO114: 0 | AP114: 0 | AQ114: 0 | AR114: 0 | AS114: 0 | AT114: 0 | AU114: 0 | AV114: 0 | AW114: 0 | AX114: 0
F115: 0 | G115: 0 | H115: 0 | I115: 0 | J115: 0 | K115: 0 | L115: 0 | M115: 0 | N115: 0 | O115: 0 | P115: 0 | Q115: 0 | R115: 0 | S115: 0 | T115: 0 | U115: 0 | V115: 0 | W115: 0 | X115: 0 | Y115: 0 | Z115: 0 | AA115: 0 | AB115: 0 | AC115: 0 | AD115: 0 | AE115: 0 | AF115: 0 | AG115: 0 | AH115: 0 | AI115: 0 | AJ115: 1 | AK115: 0 | AL115: 0 | AM115: 0 | AN115: 0 | AO115: 0 | AP115: 0 | AQ115: 0 | AR115: 0 | AS115: 0 | AT115: 0 | AU115: 0 | AV115: 0 | AW115: 0 | AX115: 0
F116: 0 | G116: 0 | H116: 0 | I116: 0 | J116: 0 | K116: 0 | L116: 0 | M116: 0 | N116: 0 | O116: 0 | P116: 0 | Q116: 0 | R116: 0 | S116: 0 | T116: 0 | U116: 0 | V116: 1 | W116: 0 | X116: 0 | Y116: 0 | Z116: 0 | AA116: 0 | AB116: 0 | AC116: 0 | AD116: 0 | AE116: 0 | AF116: 0 | AG116: 0 | AH116: 0 | AI116: 0 | AJ116: 0 | AK116: 0 | AL116: 0 | AM116: 0 | AN116: 0 | AO116: 0 | AP116: 0 | AQ116: 0 | AR116: 0 | AS116: 0 | AT116: 0 | AU116: 0 | AV116: 0 | AW116: 0 | AX116: 0
F117: 0 | G117: 0 | H117: 0 | I117: 0 | J117: 0 | K117: 0 | L117: 0 | M117: 0 | N117: 0 | O117: 0 | P117: 0 | Q117: 0 | R117: 0 | S117: 0 | T117: 0 | U117: 0 | V117: 1 | W117: 0 | X117: 0 | Y117: 0 | Z117: 0 | AA117: 0 | AB117: 0 | AC117: 0 | AD117: 0 | AE117: 0 | AF117: 0 | AG117: 0 | AH117: 0 | AI117: 0 | AJ117: 0 | AK117: 0 | AL117: 0 | AM117: 0 | AN117: 0 | AO117: 0 | AP117: 0 | AQ117: 0 | AR117: 0 | AS117: 0 | AT117: 0 | AU117: 0 | AV117: 0 | AW117: 0 | AX117: 0
F118: 0 | G118: 0 | H118: 0 | I118: 0 | J118: 0 | K118: 0 | L118: 0 | M118: 0 | N118: 0 | O118: 0 | P118: 0 | Q118: 0 | R118: 0 | S118: 0 | T118: 0 | U118: 0 | V118: 1 | W118: 0 | X118: 0 | Y118: 0 | Z118: 0 | AA118: 0 | AB118: 0 | AC118: 0 | AD118: 0 | AE118: 0 | AF118: 0 | AG118: 0 | AH118: 0 | AI118: 0 | AJ118: 0 | AK118: 0 | AL118: 0 | AM118: 0 | AN118: 0 | AO118: 0 | AP118: 0 | AQ118: 0 | AR118: 0 | AS118: 0 | AT118: 0 | AU118: 0 | AV118: 0 | AW118: 0 | AX118: 0
F119: 0 | G119: 0 | H119: 0 | I119: 0 | J119: 0 | K119: 0 | L119: 0 | M119: 0 | N119: 0 | O119: 0 | P119: 0 | Q119: 0 | R119: 0 | S119: 0 | T119: 0 | U119: 0 | V119: 1 | W119: 0 | X119: 0 | Y119: 0 | Z119: 0 | AA119: 0 | AB119: 0 | AC119: 0 | AD119: 0 | AE119: 0 | AF119: 0 | AG119: 0 | AH119: 0 | AI119: 0 | AJ119: 0 | AK119: 0 | AL119: 0 | AM119: 0 | AN119: 0 | AO119: 0 | AP119: 0 | AQ119: 0 | AR119: 0 | AS119: 0 | AT119: 0 | AU119: 0 | AV119: 0 | AW119: 0 | AX119: 0
F120: 0 | G120: 0 | H120: 0 | I120: 0 | J120: 0 | K120: 0 | L120: 0 | M120: 0 | N120: 0 | O120: 0 | P120: 0 | Q120: 0 | R120: 0 | S120: 0 | T120: 0 | U120: 0 | V120: 1 | W120: 0 | X120: 0 | Y120: 0 | Z120: 0 | AA120: 0 | AB120: 0 | AC120: 0 | AD120: 0 | AE120: 0 | AF120: 0 | AG120: 0 | AH120: 0 | AI120: 0 | AJ120: 0 | AK120: 0 | AL120: 0 | AM120: 0 | AN120: 0 | AO120: 0 | AP120: 0 | AQ120: 0 | AR120: 0 | AS120: 0 | AT120: 0 | AU120: 0 | AV120: 0 | AW120: 0 | AX120: 0
F121: 0 | G121: 0 | H121: 0 | I121: 0 | J121: 0 | K121: 0 | L121: 0 | M121: 0 | N121: 0 | O121: 0 | P121: 0 | Q121: 0 | R121: 0 | S121: 0 | T121: 0 | U121: 0 | V121: 1 | W121: 0 | X121: 0 | Y121: 0 | Z121: 0 | AA121: 0 | AB121: 0 | AC121: 0 | AD121: 0 | AE121: 0 | AF121: 0 | AG121: 0 | AH121: 0 | AI121: 0 | AJ121: 0 | AK121: 0 | AL121: 0 | AM121: 0 | AN121: 0 | AO121: 0 | AP121: 0 | AQ121: 0 | AR121: 0 | AS121: 0 | AT121: 0 | AU121: 0 | AV121: 0 | AW121: 0 | AX121: 0
F122: 0 | G122: 0 | H122: 0 | I122: 0 | J122: 0 | K122: 0 | L122: 0 | M122: 0 | N122: 0 | O122: 0 | P122: 0 | Q122: 0 | R122: 0 | S122: 0 | T122: 0 | U122: 0 | V122: 1 | W122: 0 | X122: 0 | Y122: 0 | Z122: 0 | AA122: 0 | AB122: 0 | AC122: 0 | AD122: 0 | AE122: 0 | AF122: 0 | AG122: 0 | AH122: 0 | AI122: 0 | AJ122: 0 | AK122: 0 | AL122: 0 | AM122: 0 | AN122: 0 | AO122: 0 | AP122: 0 | AQ122: 0 | AR122: 0 | AS122: 0 | AT122: 0 | AU122: 0 | AV122: 0 | AW122: 0 | AX122: 0
F123: 0 | G123: 0 | H123: 0 | I123: 0 | J123: 0 | K123: 0 | L123: 0 | M123: 0 | N123: 0 | O123: 0 | P123: 0 | Q123: 0 | R123: 0 | S123: 0 | T123: 0 | U123: 0 | V123: 1 | W123: 0 | X123: 0 | Y123: 0 | Z123: 0 | AA123: 0 | AB123: 0 | AC123: 0 | AD123: 0 | AE123: 0 | AF123: 0 | AG123: 0 | AH123: 0 | AI123: 0 | AJ123: 0 | AK123: 0 | AL123: 0 | AM123: 0 | AN123: 0 | AO123: 0 | AP123: 0 | AQ123: 0 | AR123: 0 | AS123: 0 | AT123: 0 | AU123: 0 | AV123: 0 | AW123: 0 | AX123: 0
F124: 0 | G124: 0 | H124: 0 | I124: 0 | J124: 0 | K124: 0 | L124: 0 | M124: 0 | N124: 0 | O124: 0 | P124: 1 | Q124: 0 | R124: 0 | S124: 0 | T124: 0 | U124: 0 | V124: 0 | W124: 0 | X124: 0 | Y124: 0 | Z124: 0 | AA124: 0 | AB124: 0 | AC124: 0 | AD124: 0 | AE124: 0 | AF124: 0 | AG124: 0 | AH124: 0 | AI124: 0 | AJ124: 0 | AK124: 0 | AL124: 0 | AM124: 0 | AN124: 0 | AO124: 0 | AP124: 0 | AQ124: 0 | AR124: 0 | AS124: 0 | AT124: 0 | AU124: 0 | AV124: 0 | AW124: 0 | AX124: 0
F125: 0 | G125: 0 | H125: 0 | I125: 0 | J125: 0 | K125: 0 | L125: 0 | M125: 0 | N125: 0 | O125: 0 | P125: 1 | Q125: 0 | R125: 0 | S125: 0 | T125: 0 | U125: 0 | V125: 0 | W125: 0 | X125: 0 | Y125: 0 | Z125: 0 | AA125: 0 | AB125: 0 | AC125: 0 | AD125: 0 | AE125: 0 | AF125: 0 | AG125: 0 | AH125: 0 | AI125: 0 | AJ125: 0 | AK125: 0 | AL125: 0 | AM125: 0 | AN125: 0 | AO125: 0 | AP125: 0 | AQ125: 0 | AR125: 0 | AS125: 0 | AT125: 0 | AU125: 0 | AV125: 0 | AW125: 0 | AX125: 0
F126: 0 | G126: 0 | H126: 0 | I126: 0 | J126: 0 | K126: 0 | L126: 0 | M126: 0 | N126: 0 | O126: 0 | P126: 1 | Q126: 0 | R126: 0 | S126: 0 | T126: 0 | U126: 0 | V126: 0 | W126: 0 | X126: 0 | Y126: 0 | Z126: 0 | AA126: 0 | AB126: 0 | AC126: 0 | AD126: 0 | AE126: 0 | AF126: 0 | AG126: 0 | AH126: 0 | AI126: 0 | AJ126: 0 | AK126: 0 | AL126: 0 | AM126: 0 | AN126: 0 | AO126: 0 | AP126: 0 | AQ126: 0 | AR126: 0 | AS126: 0 | AT126: 0 | AU126: 0 | AV126: 0 | AW126: 0 | AX126: 0
F127: 0 | G127: 0 | H127: 0 | I127: 0 | J127: 0 | K127: 0 | L127: 0 | M127: 0 | N127: 0 | O127: 0 | P127: 0 | Q127: 0 | R127: 0 | S127: 0 | T127: 0 | U127: 1 | V127: 0 | W127: 0 | X127: 0 | Y127: 0 | Z127: 0 | AA127: 0 | AB127: 0 | AC127: 0 | AD127: 0 | AE127: 0 | AF127: 0 | AG127: 0 | AH127: 0 | AI127: 0 | AJ127: 0 | AK127: 0 | AL127: 0 | AM127: 0 | AN127: 0 | AO127: 0 | AP127: 0 | AQ127: 0 | AR127: 0 | AS127: 0 | AT127: 0 | AU127: 0 | AV127: 0 | AW127: 0 | AX127: 0
F128: 0 | G128: 0 | H128: 0 | I128: 0 | J128: 0 | K128: 0 | L128: 0 | M128: 0 | N128: 0 | O128: 0 | P128: 0 | Q128: 0 | R128: 0 | S128: 0 | T128: 0 | U128: 1 | V128: 0 | W128: 0 | X128: 0 | Y128: 0 | Z128: 0 | AA128: 0 | AB128: 0 | AC128: 0 | AD128: 0 | AE128: 0 | AF128: 0 | AG128: 0 | AH128: 0 | AI128: 0 | AJ128: 0 | AK128: 0 | AL128: 0 | AM128: 0 | AN128: 0 | AO128: 0 | AP128: 0 | AQ128: 0 | AR128: 0 | AS128: 0 | AT128: 0 | AU128: 0 | AV128: 0 | AW128: 0 | AX128: 0
F129: 0 | G129: 0 | H129: 0 | I129: 0 | J129: 0 | K129: 0 | L129: 0 | M129: 0 | N129: 0 | O129: 0 | P129: 0 | Q129: 0 | R129: 0 | S129: 0 | T129: 0 | U129: 1 | V129: 0 | W129: 0 | X129: 0 | Y129: 0 | Z129: 0 | AA129: 0 | AB129: 0 | AC129: 0 | AD129: 0 | AE129: 0 | AF129: 0 | AG129: 0 | AH129: 0 | AI129: 0 | AJ129: 0 | AK129: 0 | AL129: 0 | AM129: 0 | AN129: 0 | AO129: 0 | AP129: 0 | AQ129: 0 | AR129: 0 | AS129: 0 | AT129: 0 | AU129: 0 | AV129: 0 | AW129: 0 | AX129: 0
F130: 0 | G130: 0 | H130: 0 | I130: 0 | J130: 0 | K130: 0 | L130: 0 | M130: 0 | N130: 0 | O130: 0 | P130: 0 | Q130: 0 | R130: 0 | S130: 0 | T130: 0 | U130: 1 | V130: 0 | W130: 0 | X130: 0 | Y130: 0 | Z130: 0 | AA130: 0 | AB130: 0 | AC130: 0 | AD130: 0 | AE130: 0 | AF130: 0 | AG130: 0 | AH130: 0 | AI130: 0 | AJ130: 0 | AK130: 0 | AL130: 0 | AM130: 0 | AN130: 0 | AO130: 0 | AP130: 0 | AQ130: 0 | AR130: 0 | AS130: 0 | AT130: 0 | AU130: 0 | AV130: 0 | AW130: 0 | AX130: 0
F131: 0 | G131: 0 | H131: 0 | I131: 0 | J131: 0 | K131: 0 | L131: 0 | M131: 0 | N131: 0 | O131: 0 | P131: 0 | Q131: 0 | R131: 0 | S131: 0 | T131: 0 | U131: 1 | V131: 0 | W131: 0 | X131: 0 | Y131: 0 | Z131: 0 | AA131: 0 | AB131: 0 | AC131: 0 | AD131: 0 | AE131: 0 | AF131: 0 | AG131: 0 | AH131: 0 | AI131: 0 | AJ131: 0 | AK131: 0 | AL131: 0 | AM131: 0 | AN131: 0 | AO131: 0 | AP131: 0 | AQ131: 0 | AR131: 0 | AS131: 0 | AT131: 0 | AU131: 0 | AV131: 0 | AW131: 0 | AX131: 0
F132: 0 | G132: 0 | H132: 0 | I132: 0 | J132: 0 | K132: 0 | L132: 0 | M132: 0 | N132: 0 | O132: 0 | P132: 0 | Q132: 0 | R132: 0 | S132: 0 | T132: 0 | U132: 1 | V132: 0 | W132: 0 | X132: 0 | Y132: 0 | Z132: 0 | AA132: 0 | AB132: 0 | AC132: 0 | AD132: 0 | AE132: 0 | AF132: 0 | AG132: 0 | AH132: 0 | AI132: 0 | AJ132: 0 | AK132: 0 | AL132: 0 | AM132: 0 | AN132: 0 | AO132: 0 | AP132: 0 | AQ132: 0 | AR132: 0 | AS132: 0 | AT132: 0 | AU132: 0 | AV132: 0 | AW132: 0 | AX132: 0
F133: 0 | G133: 0 | H133: 0 | I133: 0 | J133: 0 | K133: 0 | L133: 0 | M133: 0 | N133: 0 | O133: 0 | P133: 0 | Q133: 0 | R133: 0 | S133: 0 | T133: 0 | U133: 1 | V133: 0 | W133: 0 | X133: 0 | Y133: 0 | Z133: 0 | AA133: 0 | AB133: 0 | AC133: 0 | AD133: 0 | AE133: 0 | AF133: 0 | AG133: 0 | AH133: 0 | AI133: 0 | AJ133: 0 | AK133: 0 | AL133: 0 | AM133: 0 | AN133: 0 | AO133: 0 | AP133: 0 | AQ133: 0 | AR133: 0 | AS133: 0 | AT133: 0 | AU133: 0 | AV133: 0 | AW133: 0 | AX133: 0
F134: 0 | G134: 0 | H134: 0 | I134: 0 | J134: 0 | K134: 0 | L134: 0 | M134: 0 | N134: 0 | O134: 0 | P134: 0 | Q134: 0 | R134: 0 | S134: 0 | T134: 0 | U134: 1 | V134: 0 | W134: 0 | X134: 0 | Y134: 0 | Z134: 0 | AA134: 0 | AB134: 0 | AC134: 0 | AD134: 0 | AE134: 0 | AF134: 0 | AG134: 0 | AH134: 0 | AI134: 0 | AJ134: 0 | AK134: 0 | AL134: 0 | AM134: 0 | AN134: 0 | AO134: 0 | AP134: 0 | AQ134: 0 | AR134: 0 | AS134: 0 | AT134: 0 | AU134: 0 | AV134: 0 | AW134: 0 | AX134: 0
F135: 0 | G135: 0 | H135: 0 | I135: 0 | J135: 0 | K135: 0 | L135: 0 | M135: 0 | N135: 0 | O135: 0 | P135: 0 | Q135: 0 | R135: 0 | S135: 0 | T135: 0 | U135: 1 | V135: 0 | W135: 0 | X135: 0 | Y135: 0 | Z135: 0 | AA135: 0 | AB135: 0 | AC135: 0 | AD135: 0 | AE135: 0 | AF135: 0 | AG135: 0 | AH135: 0 | AI135: 0 | AJ135: 0 | AK135: 0 | AL135: 0 | AM135: 0 | AN135: 0 | AO135: 0 | AP135: 0 | AQ135: 0 | AR135: 0 | AS135: 0 | AT135: 0 | AU135: 0 | AV135: 0 | AW135: 0 | AX135: 0
F136: 0 | G136: 0 | H136: 0 | I136: 0 | J136: 0 | K136: 0 | L136: 0 | M136: 0 | N136: 0 | O136: 0 | P136: 0 | Q136: 0 | R136: 0 | S136: 0 | T136: 0 | U136: 1 | V136: 0 | W136: 0 | X136: 0 | Y136: 0 | Z136: 0 | AA136: 0 | AB136: 0 | AC136: 0 | AD136: 0 | AE136: 0 | AF136: 0 | AG136: 0 | AH136: 0 | AI136: 0 | AJ136: 0 | AK136: 0 | AL136: 0 | AM136: 0 | AN136: 0 | AO136: 0 | AP136: 0 | AQ136: 0 | AR136: 0 | AS136: 0 | AT136: 0 | AU136: 0 | AV136: 0 | AW136: 0 | AX136: 0
F137: 0 | G137: 0 | H137: 0 | I137: 0 | J137: 0 | K137: 0 | L137: 0 | M137: 0 | N137: 0 | O137: 0 | P137: 0 | Q137: 0 | R137: 0 | S137: 0 | T137: 0 | U137: 1 | V137: 0 | W137: 0 | X137: 0 | Y137: 0 | Z137: 0 | AA137: 0 | AB137: 0 | AC137: 0 | AD137: 0 | AE137: 0 | AF137: 0 | AG137: 0 | AH137: 0 | AI137: 0 | AJ137: 0 | AK137: 0 | AL137: 0 | AM137: 0 | AN137: 0 | AO137: 0 | AP137: 0 | AQ137: 0 | AR137: 0 | AS137: 0 | AT137: 0 | AU137: 0 | AV137: 0 | AW137: 0 | AX137: 0
F138: 0 | G138: 0 | H138: 0 | I138: 0 | J138: 0 | K138: 0 | L138: 0 | M138: 0 | N138: 0 | O138: 0 | P138: 0 | Q138: 0 | R138: 0 | S138: 0 | T138: 0 | U138: 1 | V138: 0 | W138: 0 | X138: 0 | Y138: 0 | Z138: 0 | AA138: 0 | AB138: 0 | AC138: 0 | AD138: 0 | AE138: 0 | AF138: 0 | AG138: 0 | AH138: 0 | AI138: 0 | AJ138: 0 | AK138: 0 | AL138: 0 | AM138: 0 | AN138: 0 | AO138: 0 | AP138: 0 | AQ138: 0 | AR138: 0 | AS138: 0 | AT138: 0 | AU138: 0 | AV138: 0 | AW138: 0 | AX138: 0
F139: 0 | G139: 0 | H139: 0 | I139: 0 | J139: 0 | K139: 0 | L139: 0 | M139: 0 | N139: 0 | O139: 0 | P139: 0 | Q139: 0 | R139: 0 | S139: 0 | T139: 0 | U139: 1 | V139: 0 | W139: 0 | X139: 0 | Y139: 0 | Z139: 0 | AA139: 0 | AB139: 0 | AC139: 0 | AD139: 0 | AE139: 0 | AF139: 0 | AG139: 0 | AH139: 0 | AI139: 0 | AJ139: 0 | AK139: 0 | AL139: 0 | AM139: 0 | AN139: 0 | AO139: 0 | AP139: 0 | AQ139: 0 | AR139: 0 | AS139: 0 | AT139: 0 | AU139: 0 | AV139: 0 | AW139: 0 | AX139: 0
F140: 0 | G140: 0 | H140: 0 | I140: 0 | J140: 0 | K140: 0 | L140: 0 | M140: 0 | N140: 0 | O140: 0 | P140: 0 | Q140: 0 | R140: 0 | S140: 0 | T140: 0 | U140: 1 | V140: 0 | W140: 0 | X140: 0 | Y140: 0 | Z140: 0 | AA140: 0 | AB140: 0 | AC140: 0 | AD140: 0 | AE140: 0 | AF140: 0 | AG140: 0 | AH140: 0 | AI140: 0 | AJ140: 0 | AK140: 0 | AL140: 0 | AM140: 0 | AN140: 0 | AO140: 0 | AP140: 0 | AQ140: 0 | AR140: 0 | AS140: 0 | AT140: 0 | AU140: 0 | AV140: 0 | AW140: 0 | AX140: 0
F141: 0 | G141: 0 | H141: 0 | I141: 0 | J141: 0 | K141: 0 | L141: 0 | M141: 0 | N141: 0 | O141: 0 | P141: 0 | Q141: 0 | R141: 0 | S141: 0 | T141: 0 | U141: 1 | V141: 0 | W141: 0 | X141: 0 | Y141: 0 | Z141: 0 | AA141: 0 | AB141: 0 | AC141: 0 | AD141: 0 | AE141: 0 | AF141: 0 | AG141: 0 | AH141: 0 | AI141: 0 | AJ141: 0 | AK141: 0 | AL141: 0 | AM141: 0 | AN141: 0 | AO141: 0 | AP141: 0 | AQ141: 0 | AR141: 0 | AS141: 0 | AT141: 0 | AU141: 0 | AV141: 0 | AW141: 0 | AX141: 0
F142: 0 | G142: 0 | H142: 0 | I142: 0 | J142: 0 | K142: 0 | L142: 0 | M142: 0 | N142: 0 | O142: 0 | P142: 0 | Q142: 0 | R142: 0 | S142: 0 | T142: 0 | U142: 1 | V142: 0 | W142: 0 | X142: 0 | Y142: 0 | Z142: 0 | AA142: 0 | AB142: 0 | AC142: 0 | AD142: 0 | AE142: 0 | AF142: 0 | AG142: 0 | AH142: 0 | AI142: 0 | AJ142: 0 | AK142: 0 | AL142: 0 | AM142: 0 | AN142: 0 | AO142: 0 | AP142: 0 | AQ142: 0 | AR142: 0 | AS142: 0 | AT142: 0 | AU142: 0 | AV142: 0 | AW142: 0 | AX142: 0
F143: 0 | G143: 0 | H143: 0 | I143: 0 | J143: 0 | K143: 0 | L143: 0 | M143: 0 | N143: 0 | O143: 0 | P143: 0 | Q143: 0 | R143: 0 | S143: 0 | T143: 0 | U143: 1 | V143: 0 | W143: 0 | X143: 0 | Y143: 0 | Z143: 0 | AA143: 0 | AB143: 0 | AC143: 0 | AD143: 0 | AE143: 0 | AF143: 0 | AG143: 0 | AH143: 0 | AI143: 0 | AJ143: 0 | AK143: 0 | AL143: 0 | AM143: 0 | AN143: 0 | AO143: 0 | AP143: 0 | AQ143: 0 | AR143: 0 | AS143: 0 | AT143: 0 | AU143: 0 | AV143: 0 | AW143: 0 | AX143: 0
F144: 0 | G144: 0 | H144: 0 | I144: 0 | J144: 0 | K144: 0 | L144: 0 | M144: 0 | N144: 0 | O144: 0 | P144: 0 | Q144: 0 | R144: 0 | S144: 0 | T144: 0 | U144: 1 | V144: 0 | W144: 0 | X144: 0 | Y144: 0 | Z144: 0 | AA144: 0 | AB144: 0 | AC144: 0 | AD144: 0 | AE144: 0 | AF144: 0 | AG144: 0 | AH144: 0 | AI144: 0 | AJ144: 0 | AK144: 0 | AL144: 0 | AM144: 0 | AN144: 0 | AO144: 0 | AP144: 0 | AQ144: 0 | AR144: 0 | AS144: 0 | AT144: 0 | AU144: 0 | AV144: 0 | AW144: 0 | AX144: 0
F145: 0 | G145: 0 | H145: 0 | I145: 0 | J145: 0 | K145: 0 | L145: 0 | M145: 0 | N145: 0 | O145: 0 | P145: 0 | Q145: 0 | R145: 0 | S145: 0 | T145: 0 | U145: 1 | V145: 0 | W145: 0 | X145: 0 | Y145: 0 | Z145: 0 | AA145: 0 | AB145: 0 | AC145: 0 | AD145: 0 | AE145: 0 | AF145: 0 | AG145: 0 | AH145: 0 | AI145: 0 | AJ145: 0 | AK145: 0 | AL145: 0 | AM145: 0 | AN145: 0 | AO145: 0 | AP145: 0 | AQ145: 0 | AR145: 0 | AS145: 0 | AT145: 0 | AU145: 0 | AV145: 0 | AW145: 0 | AX145: 0
F146: 0 | G146: 0 | H146: 0 | I146: 0 | J146: 0 | K146: 0 | L146: 0 | M146: 0 | N146: 0 | O146: 0 | P146: 0 | Q146: 0 | R146: 0 | S146: 0 | T146: 0 | U146: 1 | V146: 0 | W146: 0 | X146: 0 | Y146: 0 | Z146: 0 | AA146: 0 | AB146: 0 | AC146: 0 | AD146: 0 | AE146: 0 | AF146: 0 | AG146: 0 | AH146: 0 | AI146: 0 | AJ146: 0 | AK146: 0 | AL146: 0 | AM146: 0 | AN146: 0 | AO146: 0 | AP146: 0 | AQ146: 0 | AR146: 0 | AS146: 0 | AT146: 0 | AU146: 0 | AV146: 0 | AW146: 0 | AX146: 0
F147: 0 | G147: 0 | H147: 0 | I147: 0 | J147: 0 | K147: 0 | L147: 0 | M147: 0 | N147: 0 | O147: 0 | P147: 0 | Q147: 0 | R147: 0 | S147: 0 | T147: 0 | U147: 1 | V147: 0 | W147: 0 | X147: 0 | Y147: 0 | Z147: 0 | AA147: 0 | AB147: 0 | AC147: 0 | AD147: 0 | AE147: 0 | AF147: 0 | AG147: 0 | AH147: 0 | AI147: 0 | AJ147: 0 | AK147: 0 | AL147: 0 | AM147: 0 | AN147: 0 | AO147: 0 | AP147: 0 | AQ147: 0 | AR147: 0 | AS147: 0 | AT147: 0 | AU147: 0 | AV147: 0 | AW147: 0 | AX147: 0
F148: 0 | G148: 0 | H148: 0 | I148: 0 | J148: 0 | K148: 0 | L148: 0 | M148: 0 | N148: 0 | O148: 0 | P148: 0 | Q148: 0 | R148: 0 | S148: 0 | T148: 0 | U148: 1 | V148: 0 | W148: 0 | X148: 0 | Y148: 0 | Z148: 0 | AA148: 0 | AB148: 0 | AC148: 0 | AD148: 0 | AE148: 0 | AF148: 0 | AG148: 0 | AH148: 0 | AI148: 0 | AJ148: 0 | AK148: 0 | AL148: 0 | AM148: 0 | AN148: 0 | AO148: 0 | AP148: 0 | AQ148: 0 | AR148: 0 | AS148: 0 | AT148: 0 | AU148: 0 | AV148: 0 | AW148: 0 | AX148: 0
F149: 0 | G149: 0 | H149: 0 | I149: 0 | J149: 0 | K149: 0 | L149: 0 | M149: 0 | N149: 0 | O149: 0 | P149: 0 | Q149: 0 | R149: 0 | S149: 0 | T149: 0 | U149: 1 | V149: 0 | W149: 0 | X149: 0 | Y149: 0 | Z149: 0 | AA149: 0 | AB149: 0 | AC149: 0 | AD149: 0 | AE149: 0 | AF149: 0 | AG149: 0 | AH149: 0 | AI149: 0 | AJ149: 0 | AK149: 0 | AL149: 0 | AM149: 0 | AN149: 0 | AO149: 0 | AP149: 0 | AQ149: 0 | AR149: 0 | AS149: 0 | AT149: 0 | AU149: 0 | AV149: 0 | AW149: 0 | AX149: 0
F150: 0 | G150: 0 | H150: 0 | I150: 0 | J150: 0 | K150: 0 | L150: 0 | M150: 0 | N150: 0 | O150: 0 | P150: 0 | Q150: 0 | R150: 0 | S150: 0 | T150: 0 | U150: 1 | V150: 0 | W150: 0 | X150: 0 | Y150: 0 | Z150: 0 | AA150: 0 | AB150: 0 | AC150: 0 | AD150: 0 | AE150: 0 | AF150: 0 | AG150: 0 | AH150: 0 | AI150: 0 | AJ150: 0 | AK150: 0 | AL150: 0 | AM150: 0 | AN150: 0 | AO150: 0 | AP150: 0 | AQ150: 0 | AR150: 0 | AS150: 0 | AT150: 0 | AU150: 0 | AV150: 0 | AW150: 0 | AX150: 0
F151: 0 | G151: 0 | H151: 0 | I151: 0 | J151: 0 | K151: 0 | L151: 0 | M151: 0 | N151: 0 | O151: 0 | P151: 0 | Q151: 0 | R151: 0 | S151: 0 | T151: 0 | U151: 1 | V151: 0 | W151: 0 | X151: 0 | Y151: 0 | Z151: 0 | AA151: 0 | AB151: 0 | AC151: 0 | AD151: 0 | AE151: 0 | AF151: 0 | AG151: 0 | AH151: 0 | AI151: 0 | AJ151: 0 | AK151: 0 | AL151: 0 | AM151: 0 | AN151: 0 | AO151: 0 | AP151: 0 | AQ151: 0 | AR151: 0 | AS151: 0 | AT151: 0 | AU151: 0 | AV151: 0 | AW151: 0 | AX151: 0
F152: 0 | G152: 0 | H152: 0 | I152: 0 | J152: 0 | K152: 0 | L152: 0 | M152: 0 | N152: 0 | O152: 0 | P152: 0 | Q152: 0 | R152: 0 | S152: 0 | T152: 0 | U152: 1 | V152: 0 | W152: 0 | X152: 0 | Y152: 0 | Z152: 0 | AA152: 0 | AB152: 0 | AC152: 0 | AD152: 0 | AE152: 0 | AF152: 0 | AG152: 0 | AH152: 0 | AI152: 0 | AJ152: 0 | AK152: 0 | AL152: 0 | AM152: 0 | AN152: 0 | AO152: 0 | AP152: 0 | AQ152: 0 | AR152: 0 | AS152: 0 | AT152: 0 | AU152: 0 | AV152: 0 | AW152: 0 | AX152: 0
F153: 0 | G153: 0 | H153: 0 | I153: 0 | J153: 0 | K153: 0 | L153: 0 | M153: 0 | N153: 0 | O153: 0 | P153: 0 | Q153: 0 | R153: 0 | S153: 0 | T153: 0 | U153: 0 | V153: 0 | W153: 0 | X153: 0 | Y153: 0 | Z153: 0 | AA153: 0 | AB153: 0 | AC153: 0 | AD153: 0 | AE153: 0 | AF153: 0 | AG153: 0 | AH153: 0 | AI153: 0 | AJ153: 0 | AK153: 0 | AL153: 0 | AM153: 0 | AN153: 0 | AO153: 0 | AP153: 0 | AQ153: 0 | AR153: 0 | AS153: 0 | AT153: 0 | AU153: 0 | AV153: 1 | AW153: 0 | AX153: 0
F154: 0 | G154: 0 | H154: 0 | I154: 0 | J154: 0 | K154: 0 | L154: 0 | M154: 0 | N154: 0 | O154: 0 | P154: 0 | Q154: 0 | R154: 0 | S154: 0 | T154: 0 | U154: 0 | V154: 0 | W154: 0 | X154: 0 | Y154: 0 | Z154: 0 | AA154: 0 | AB154: 0 | AC154: 0 | AD154: 0 | AE154: 0 | AF154: 0 | AG154: 0 | AH154: 0 | AI154: 0 | AJ154: 0 | AK154: 0 | AL154: 0 | AM154: 0 | AN154: 0 | AO154: 0 | AP154: 0 | AQ154: 0 | AR154: 0 | AS154: 0 | AT154: 0 | AU154: 0 | AV154: 1 | AW154: 0 | AX154: 0
F155: 0 | G155: 0 | H155: 0 | I155: 0 | J155: 0 | K155: 0 | L155: 0 | M155: 0 | N155: 0 | O155: 0 | P155: 0 | Q155: 0 | R155: 0 | S155: 0 | T155: 0 | U155: 0 | V155: 0 | W155: 0 | X155: 0 | Y155: 0 | Z155: 0 | AA155: 0 | AB155: 0 | AC155: 0 | AD155: 0 | AE155: 0 | AF155: 0 | AG155: 0 | AH155: 0 | AI155: 0 | AJ155: 0 | AK155: 0 | AL155: 0 | AM155: 0 | AN155: 0 | AO155: 0 | AP155: 0 | AQ155: 0 | AR155: 0 | AS155: 0 | AT155: 0 | AU155: 0 | AV155: 1 | AW155: 0 | AX155: 0
F156: 0 | G156: 0 | H156: 0 | I156: 0 | J156: 0 | K156: 0 | L156: 0 | M156: 0 | N156: 0 | O156: 0 | P156: 0 | Q156: 0 | R156: 0 | S156: 0 | T156: 0 | U156: 0 | V156: 0 | W156: 0 | X156: 0 | Y156: 0 | Z156: 0 | AA156: 0 | AB156: 0 | AC156: 0 | AD156: 0 | AE156: 0 | AF156: 0 | AG156: 0 | AH156: 0 | AI156: 0 | AJ156: 0 | AK156: 0 | AL156: 0 | AM156: 0 | AN156: 0 | AO156: 0 | AP156: 0 | AQ156: 0 | AR156: 0 | AS156: 0 | AT156: 0 | AU156: 0 | AV156: 1 | AW156: 0 | AX156: 0
F157: 0 | G157: 0 | H157: 0 | I157: 0 | J157: 0 | K157: 0 | L157: 0 | M157: 0 | N157: 0 | O157: 0 | P157: 0 | Q157: 0 | R157: 0 | S157: 0 | T157: 0 | U157: 0 | V157: 0 | W157: 0 | X157: 0 | Y157: 0 | Z157: 0 | AA157: 0 | AB157: 0 | AC157: 0 | AD157: 0 | AE157: 0 | AF157: 0 | AG157: 0 | AH157: 0 | AI157: 0 | AJ157: 0 | AK157: 0 | AL157: 0 | AM157: 0 | AN157: 0 | AO157: 0 | AP157: 0 | AQ157: 0 | AR157: 0 | AS157: 0 | AT157: 0 | AU157: 0 | AV157: 1 | AW157: 0 | AX157: 0
F158: 0 | G158: 0 | H158: 0 | I158: 0 | J158: 0 | K158: 0 | L158: 0 | M158: 0 | N158: 0 | O158: 0 | P158: 0 | Q158: 0 | R158: 0 | S158: 0 | T158: 0 | U158: 0 | V158: 0 | W158: 0 | X158: 0 | Y158: 0 | Z158: 0 | AA158: 0 | AB158: 0 | AC158: 0 | AD158: 0 | AE158: 0 | AF158: 0 | AG158: 0 | AH158: 0 | AI158: 0 | AJ158: 0 | AK158: 0 | AL158: 0 | AM158: 0 | AN158: 0 | AO158: 0 | AP158: 0 | AQ158: 0 | AR158: 0 | AS158: 0 | AT158: 0 | AU158: 0 | AV158: 1 | AW158: 0 | AX158: 0
F159: 0 | G159: 0 | H159: 0 | I159: 0 | J159: 0 | K159: 0 | L159: 0 | M159: 0 | N159: 0 | O159: 0 | P159: 0 | Q159: 0 | R159: 0 | S159: 0 | T159: 0 | U159: 0 | V159: 0 | W159: 0 | X159: 0 | Y159: 0 | Z159: 0 | AA159: 0 | AB159: 0 | AC159: 0 | AD159: 0 | AE159: 0 | AF159: 0 | AG159: 0 | AH159: 0 | AI159: 0 | AJ159: 0 | AK159: 0 | AL159: 0 | AM159: 0 | AN159: 0 | AO159: 0 | AP159: 0 | AQ159: 0 | AR159: 0 | AS159: 0 | AT159: 0 | AU159: 0 | AV159: 1 | AW159: 0 | AX159: 0
F160: 0 | G160: 0 | H160: 0 | I160: 0 | J160: 0 | K160: 0 | L160: 0 | M160: 0 | N160: 0 | O160: 0 | P160: 0 | Q160: 0 | R160: 0 | S160: 0 | T160: 0 | U160: 0 | V160: 0 | W160: 0 | X160: 0 | Y160: 0 | Z160: 0 | AA160: 0 | AB160: 0 | AC160: 0 | AD160: 0 | AE160: 0 | AF160: 0 | AG160: 0 | AH160: 0 | AI160: 0 | AJ160: 0 | AK160: 0 | AL160: 0 | AM160: 0 | AN160: 0 | AO160: 0 | AP160: 0 | AQ160: 0 | AR160: 0 | AS160: 0 | AT160: 0 | AU160: 0 | AV160: 1 | AW160: 0 | AX160: 0
F161: 0 | G161: 0 | H161: 0 | I161: 0 | J161: 0 | K161: 0 | L161: 0 | M161: 0 | N161: 0 | O161: 0 | P161: 0 | Q161: 0 | R161: 0 | S161: 0 | T161: 0 | U161: 0 | V161: 0 | W161: 0 | X161: 0 | Y161: 0 | Z161: 0 | AA161: 0 | AB161: 0 | AC161: 0 | AD161: 0 | AE161: 0 | AF161: 0 | AG161: 0 | AH161: 0 | AI161: 0 | AJ161: 0 | AK161: 0 | AL161: 0 | AM161: 0 | AN161: 0 | AO161: 0 | AP161: 0 | AQ161: 0 | AR161: 0 | AS161: 0 | AT161: 0 | AU161: 0 | AV161: 1 | AW161: 0 | AX161: 0
F162: 0 | G162: 0 | H162: 0 | I162: 0 | J162: 0 | K162: 0 | L162: 0 | M162: 0 | N162: 0 | O162: 0 | P162: 0 | Q162: 0 | R162: 0 | S162: 0 | T162: 0 | U162: 0 | V162: 0 | W162: 0 | X162: 0 | Y162: 0 | Z162: 0 | AA162: 0 | AB162: 0 | AC162: 0 | AD162: 0 | AE162: 0 | AF162: 0 | AG162: 0 | AH162: 0 | AI162: 0 | AJ162: 0 | AK162: 0 | AL162: 0 | AM162: 0 | AN162: 0 | AO162: 0 | AP162: 0 | AQ162: 0 | AR162: 0 | AS162: 0 | AT162: 0 | AU162: 0 | AV162: 1 | AW162: 0 | AX162: 0
F163: 0 | G163: 0 | H163: 0 | I163: 0 | J163: 0 | K163: 0 | L163: 0 | M163: 0 | N163: 0 | O163: 0 | P163: 0 | Q163: 0 | R163: 0 | S163: 0 | T163: 0 | U163: 0 | V163: 0 | W163: 0 | X163: 0 | Y163: 0 | Z163: 0 | AA163: 0 | AB163: 0 | AC163: 0 | AD163: 0 | AE163: 0 | AF163: 0 | AG163: 0 | AH163: 0 | AI163: 0 | AJ163: 0 | AK163: 0 | AL163: 0 | AM163: 0 | AN163: 0 | AO163: 0 | AP163: 0 | AQ163: 0 | AR163: 0 | AS163: 0 | AT163: 0 | AU163: 0 | AV163: 1 | AW163: 0 | AX163: 0
F164: 0 | G164: 0 | H164: 0 | I164: 0 | J164: 0 | K164: 0 | L164: 0 | M164: 0 | N164: 0 | O164: 0 | P164: 0 | Q164: 0 | R164: 0 | S164: 0 | T164: 0 | U164: 0 | V164: 0 | W164: 0 | X164: 0 | Y164: 0 | Z164: 0 | AA164: 0 | AB164: 0 | AC164: 0 | AD164: 0 | AE164: 0 | AF164: 0 | AG164: 0 | AH164: 0 | AI164: 0 | AJ164: 0 | AK164: 0 | AL164: 0 | AM164: 0 | AN164: 0 | AO164: 0 | AP164: 0 | AQ164: 0 | AR164: 0 | AS164: 0 | AT164: 0 | AU164: 0 | AV164: 1 | AW164: 0 | AX164: 0
F165: 0 | G165: 0 | H165: 0 | I165: 0 | J165: 0 | K165: 0 | L165: 0 | M165: 0 | N165: 0 | O165: 0 | P165: 0 | Q165: 0 | R165: 0 | S165: 0 | T165: 0 | U165: 0 | V165: 0 | W165: 0 | X165: 0 | Y165: 0 | Z165: 0 | AA165: 0 | AB165: 0 | AC165: 0 | AD165: 0 | AE165: 0 | AF165: 0 | AG165: 0 | AH165: 0 | AI165: 0 | AJ165: 0 | AK165: 0 | AL165: 0 | AM165: 0 | AN165: 0 | AO165: 0 | AP165: 0 | AQ165: 0 | AR165: 0 | AS165: 0 | AT165: 0 | AU165: 0 | AV165: 1 | AW165: 0 | AX165: 0
F166: 0 | G166: 0 | H166: 0 | I166: 0 | J166: 0 | K166: 0 | L166: 0 | M166: 0 | N166: 0 | O166: 0 | P166: 0 | Q166: 0 | R166: 0 | S166: 0 | T166: 0 | U166: 0 | V166: 0 | W166: 0 | X166: 0 | Y166: 0 | Z166: 0 | AA166: 0 | AB166: 0 | AC166: 0 | AD166: 0 | AE166: 0 | AF166: 0 | AG166: 0 | AH166: 0 | AI166: 0 | AJ166: 0 | AK166: 0 | AL166: 0 | AM166: 0 | AN166: 0 | AO166: 0 | AP166: 0 | AQ166: 0 | AR166: 0 | AS166: 0 | AT166: 0 | AU166: 0 | AV166: 1 | AW166: 0 | AX166: 0
F167: 0 | G167: 0 | H167: 0 | I167: 0 | J167: 0 | K167: 0 | L167: 0 | M167: 0 | N167: 0 | O167: 0 | P167: 0 | Q167: 0 | R167: 0 | S167: 0 | T167: 0 | U167: 0 | V167: 0 | W167: 0 | X167: 0 | Y167: 0 | Z167: 0 | AA167: 0 | AB167: 0 | AC167: 0 | AD167: 0 | AE167: 0 | AF167: 0 | AG167: 0 | AH167: 0 | AI167: 0 | AJ167: 0 | AK167: 0 | AL167: 0 | AM167: 0 | AN167: 0 | AO167: 0 | AP167: 0 | AQ167: 0 | AR167: 0 | AS167: 0 | AT167: 0 | AU167: 1 | AV167: 0 | AW167: 0 | AX167: 0
F168: 0 | G168: 0 | H168: 0 | I168: 0 | J168: 0 | K168: 0 | L168: 0 | M168: 0 | N168: 0 | O168: 0 | P168: 0 | Q168: 0 | R168: 0 | S168: 0 | T168: 0 | U168: 0 | V168: 0 | W168: 0 | X168: 0 | Y168: 0 | Z168: 0 | AA168: 0 | AB168: 0 | AC168: 0 | AD168: 0 | AE168: 0 | AF168: 0 | AG168: 0 | AH168: 0 | AI168: 0 | AJ168: 0 | AK168: 0 | AL168: 0 | AM168: 0 | AN168: 0 | AO168: 0 | AP168: 0 | AQ168: 0 | AR168: 0 | AS168: 0 | AT168: 0 | AU168: 1 | AV168: 0 | AW168: 0 | AX168: 0
F169: 0 | G169: 0 | H169: 0 | I169: 0 | J169: 0 | K169: 0 | L169: 0 | M169: 0 | N169: 0 | O169: 0 | P169: 0 | Q169: 0 | R169: 0 | S169: 0 | T169: 0 | U169: 0 | V169: 0 | W169: 0 | X169: 0 | Y169: 0 | Z169: 0 | AA169: 0 | AB169: 0 | AC169: 0 | AD169: 0 | AE169: 0 | AF169: 0 | AG169: 0 | AH169: 0 | AI169: 0 | AJ169: 0 | AK169: 1 | AL169: 0 | AM169: 0 | AN169: 0 | AO169: 0 | AP169: 0 | AQ169: 0 | AR169: 0 | AS169: 0 | AT169: 0 | AU169: 0 | AV169: 0 | AW169: 0 | AX169: 0
F170: 0 | G170: 0 | H170: 0 | I170: 0 | J170: 0 | K170: 0 | L170: 0 | M170: 0 | N170: 0 | O170: 0 | P170: 0 | Q170: 0 | R170: 0 | S170: 0 | T170: 0 | U170: 0 | V170: 0 | W170: 0 | X170: 0 | Y170: 0 | Z170: 0 | AA170: 0 | AB170: 0 | AC170: 0 | AD170: 0 | AE170: 0 | AF170: 0 | AG170: 0 | AH170: 0 | AI170: 0 | AJ170: 0 | AK170: 1 | AL170: 0 | AM170: 0 | AN170: 0 | AO170: 0 | AP170: 0 | AQ170: 0 | AR170: 0 | AS170: 0 | AT170: 0 | AU170: 0 | AV170: 0 | AW170: 0 | AX170: 0
F171: 0 | G171: 0 | H171: 1 | I171: 0 | J171: 0 | K171: 0 | L171: 0 | M171: 0 | N171: 0 | O171: 0 | P171: 0 | Q171: 0 | R171: 0 | S171: 0 | T171: 0 | U171: 0 | V171: 0 | W171: 0 | X171: 0 | Y171: 0 | Z171: 0 | AA171: 0 | AB171: 0 | AC171: 0 | AD171: 0 | AE171: 0 | AF171: 0 | AG171: 0 | AH171: 0 | AI171: 0 | AJ171: 0 | AK171: 0 | AL171: 0 | AM171: 0 | AN171: 0 | AO171: 0 | AP171: 0 | AQ171: 0 | AR171: 0 | AS171: 0 | AT171: 0 | AU171: 0 | AV171: 0 | AW171: 0 | AX171: 0
F172: 0 | G172: 0 | H172: 1 | I172: 0 | J172: 0 | K172: 0 | L172: 0 | M172: 0 | N172: 0 | O172: 0 | P172: 0 | Q172: 0 | R172: 0 | S172: 0 | T172: 0 | U172: 0 | V172: 0 | W172: 0 | X172: 0 | Y172: 0 | Z172: 0 | AA172: 0 | AB172: 0 | AC172: 0 | AD172: 0 | AE172: 0 | AF172: 0 | AG172: 0 | AH172: 0 | AI172: 0 | AJ172: 0 | AK172: 0 | AL172: 0 | AM172: 0 | AN172: 0 | AO172: 0 | AP172: 0 | AQ172: 0 | AR172: 0 | AS172: 0 | AT172: 0 | AU172: 0 | AV172: 0 | AW172: 0 | AX172: 0
F173: 0 | G173: 0 | H173: 1 | I173: 0 | J173: 0 | K173: 0 | L173: 0 | M173: 0 | N173: 0 | O173: 0 | P173: 0 | Q173: 0 | R173: 0 | S173: 0 | T173: 0 | U173: 0 | V173: 0 | W173: 0 | X173: 0 | Y173: 0 | Z173: 0 | AA173: 0 | AB173: 0 | AC173: 0 | AD173: 0 | AE173: 0 | AF173: 0 | AG173: 0 | AH173: 0 | AI173: 0 | AJ173: 0 | AK173: 0 | AL173: 0 | AM173: 0 | AN173: 0 | AO173: 0 | AP173: 0 | AQ173: 0 | AR173: 0 | AS173: 0 | AT173: 0 | AU173: 0 | AV173: 0 | AW173: 0 | AX173: 0
F174: 0 | G174: 0 | H174: 1 | I174: 0 | J174: 0 | K174: 0 | L174: 0 | M174: 0 | N174: 0 | O174: 0 | P174: 0 | Q174: 0 | R174: 0 | S174: 0 | T174: 0 | U174: 0 | V174: 0 | W174: 0 | X174: 0 | Y174: 0 | Z174: 0 | AA174: 0 | AB174: 0 | AC174: 0 | AD174: 0 | AE174: 0 | AF174: 0 | AG174: 0 | AH174: 0 | AI174: 0 | AJ174: 0 | AK174: 0 | AL174: 0 | AM174: 0 | AN174: 0 | AO174: 0 | AP174: 0 | AQ174: 0 | AR174: 0 | AS174: 0 | AT174: 0 | AU174: 0 | AV174: 0 | AW174: 0 | AX174: 0
F175: 0 | G175: 0 | H175: 1 | I175: 0 | J175: 0 | K175: 0 | L175: 0 | M175: 0 | N175: 0 | O175: 0 | P175: 0 | Q175: 0 | R175: 0 | S175: 0 | T175: 0 | U175: 0 | V175: 0 | W175: 0 | X175: 0 | Y175: 0 | Z175: 0 | AA175: 0 | AB175: 0 | AC175: 0 | AD175: 0 | AE175: 0 | AF175: 0 | AG175: 0 | AH175: 0 | AI175: 0 | AJ175: 0 | AK175: 0 | AL175: 0 | AM175: 0 | AN175: 0 | AO175: 0 | AP175: 0 | AQ175: 0 | AR175: 0 | AS175: 0 | AT175: 0 | AU175: 0 | AV175: 0 | AW175: 0 | AX175: 0
F176: 0 | G176: 0 | H176: 1 | I176: 0 | J176: 0 | K176: 0 | L176: 0 | M176: 0 | N176: 0 | O176: 0 | P176: 0 | Q176: 0 | R176: 0 | S176: 0 | T176: 0 | U176: 0 | V176: 0 | W176: 0 | X176: 0 | Y176: 0 | Z176: 0 | AA176: 0 | AB176: 0 | AC176: 0 | AD176: 0 | AE176: 0 | AF176: 0 | AG176: 0 | AH176: 0 | AI176: 0 | AJ176: 0 | AK176: 0 | AL176: 0 | AM176: 0 | AN176: 0 | AO176: 0 | AP176: 0 | AQ176: 0 | AR176: 0 | AS176: 0 | AT176: 0 | AU176: 0 | AV176: 0 | AW176: 0 | AX176: 0
F177: 0 | G177: 0 | H177: 1 | I177: 0 | J177: 0 | K177: 0 | L177: 0 | M177: 0 | N177: 0 | O177: 0 | P177: 0 | Q177: 0 | R177: 0 | S177: 0 | T177: 0 | U177: 0 | V177: 0 | W177: 0 | X177: 0 | Y177: 0 | Z177: 0 | AA177: 0 | AB177: 0 | AC177: 0 | AD177: 0 | AE177: 0 | AF177: 0 | AG177: 0 | AH177: 0 | AI177: 0 | AJ177: 0 | AK177: 0 | AL177: 0 | AM177: 0 | AN177: 0 | AO177: 0 | AP177: 0 | AQ177: 0 | AR177: 0 | AS177: 0 | AT177: 0 | AU177: 0 | AV177: 0 | AW177: 0 | AX177: 0
F178: 0 | G178: 0 | H178: 1 | I178: 0 | J178: 0 | K178: 0 | L178: 0 | M178: 0 | N178: 0 | O178: 0 | P178: 0 | Q178: 0 | R178: 0 | S178: 0 | T178: 0 | U178: 0 | V178: 0 | W178: 0 | X178: 0 | Y178: 0 | Z178: 0 | AA178: 0 | AB178: 0 | AC178: 0 | AD178: 0 | AE178: 0 | AF178: 0 | AG178: 0 | AH178: 0 | AI178: 0 | AJ178: 0 | AK178: 0 | AL178: 0 | AM178: 0 | AN178: 0 | AO178: 0 | AP178: 0 | AQ178: 0 | AR178: 0 | AS178: 0 | AT178: 0 | AU178: 0 | AV178: 0 | AW178: 0 | AX178: 0
F179: 0 | G179: 0 | H179: 1 | I179: 0 | J179: 0 | K179: 0 | L179: 0 | M179: 0 | N179: 0 | O179: 0 | P179: 0 | Q179: 0 | R179: 0 | S179: 0 | T179: 0 | U179: 0 | V179: 0 | W179: 0 | X179: 0 | Y179: 0 | Z179: 0 | AA179: 0 | AB179: 0 | AC179: 0 | AD179: 0 | AE179: 0 | AF179: 0 | AG179: 0 | AH179: 0 | AI179: 0 | AJ179: 0 | AK179: 0 | AL179: 0 | AM179: 0 | AN179: 0 | AO179: 0 | AP179: 0 | AQ179: 0 | AR179: 0 | AS179: 0 | AT179: 0 | AU179: 0 | AV179: 0 | AW179: 0 | AX179: 0
F180: 0 | G180: 0 | H180: 1 | I180: 0 | J180: 0 | K180: 0 | L180: 0 | M180: 0 | N180: 0 | O180: 0 | P180: 0 | Q180: 0 | R180: 0 | S180: 0 | T180: 0 | U180: 0 | V180: 0 | W180: 0 | X180: 0 | Y180: 0 | Z180: 0 | AA180: 0 | AB180: 0 | AC180: 0 | AD180: 0 | AE180: 0 | AF180: 0 | AG180: 0 | AH180: 0 | AI180: 0 | AJ180: 0 | AK180: 0 | AL180: 0 | AM180: 0 | AN180: 0 | AO180: 0 | AP180: 0 | AQ180: 0 | AR180: 0 | AS180: 0 | AT180: 0 | AU180: 0 | AV180: 0 | AW180: 0 | AX180: 0
F181: 0 | G181: 0 | H181: 1 | I181: 0 | J181: 0 | K181: 0 | L181: 0 | M181: 0 | N181: 0 | O181: 0 | P181: 0 | Q181: 0 | R181: 0 | S181: 0 | T181: 0 | U181: 0 | V181: 0 | W181: 0 | X181: 0 | Y181: 0 | Z181: 0 | AA181: 0 | AB181: 0 | AC181: 0 | AD181: 0 | AE181: 0 | AF181: 0 | AG181: 0 | AH181: 0 | AI181: 0 | AJ181: 0 | AK181: 0 | AL181: 0 | AM181: 0 | AN181: 0 | AO181: 0 | AP181: 0 | AQ181: 0 | AR181: 0 | AS181: 0 | AT181: 0 | AU181: 0 | AV181: 0 | AW181: 0 | AX181: 0
F182: 0 | G182: 0 | H182: 1 | I182: 0 | J182: 0 | K182: 0 | L182: 0 | M182: 0 | N182: 0 | O182: 0 | P182: 0 | Q182: 0 | R182: 0 | S182: 0 | T182: 0 | U182: 0 | V182: 0 | W182: 0 | X182: 0 | Y182: 0 | Z182: 0 | AA182: 0 | AB182: 0 | AC182: 0 | AD182: 0 | AE182: 0 | AF182: 0 | AG182: 0 | AH182: 0 | AI182: 0 | AJ182: 0 | AK182: 0 | AL182: 0 | AM182: 0 | AN182: 0 | AO182: 0 | AP182: 0 | AQ182: 0 | AR182: 0 | AS182: 0 | AT182: 0 | AU182: 0 | AV182: 0 | AW182: 0 | AX182: 0
F183: 0 | G183: 0 | H183: 1 | I183: 0 | J183: 0 | K183: 0 | L183: 0 | M183: 0 | N183: 0 | O183: 0 | P183: 0 | Q183: 0 | R183: 0 | S183: 0 | T183: 0 | U183: 0 | V183: 0 | W183: 0 | X183: 0 | Y183: 0 | Z183: 0 | AA183: 0 | AB183: 0 | AC183: 0 | AD183: 0 | AE183: 0 | AF183: 0 | AG183: 0 | AH183: 0 | AI183: 0 | AJ183: 0 | AK183: 0 | AL183: 0 | AM183: 0 | AN183: 0 | AO183: 0 | AP183: 0 | AQ183: 0 | AR183: 0 | AS183: 0 | AT183: 0 | AU183: 0 | AV183: 0 | AW183: 0 | AX183: 0
F184: 0 | G184: 0 | H184: 1 | I184: 0 | J184: 0 | K184: 0 | L184: 0 | M184: 0 | N184: 0 | O184: 0 | P184: 0 | Q184: 0 | R184: 0 | S184: 0 | T184: 0 | U184: 0 | V184: 0 | W184: 0 | X184: 0 | Y184: 0 | Z184: 0 | AA184: 0 | AB184: 0 | AC184: 0 | AD184: 0 | AE184: 0 | AF184: 0 | AG184: 0 | AH184: 0 | AI184: 0 | AJ184: 0 | AK184: 0 | AL184: 0 | AM184: 0 | AN184: 0 | AO184: 0 | AP184: 0 | AQ184: 0 | AR184: 0 | AS184: 0 | AT184: 0 | AU184: 0 | AV184: 0 | AW184: 0 | AX184: 0
F185: 0 | G185: 0 | H185: 1 | I185: 0 | J185: 0 | K185: 0 | L185: 0 | M185: 0 | N185: 0 | O185: 0 | P185: 0 | Q185: 0 | R185: 0 | S185: 0 | T185: 0 | U185: 0 | V185: 0 | W185: 0 | X185: 0 | Y185: 0 | Z185: 0 | AA185: 0 | AB185: 0 | AC185: 0 | AD185: 0 | AE185: 0 | AF185: 0 | AG185: 0 | AH185: 0 | AI185: 0 | AJ185: 0 | AK185: 0 | AL185: 0 | AM185: 0 | AN185: 0 | AO185: 0 | AP185: 0 | AQ185: 0 | AR185: 0 | AS185: 0 | AT185: 0 | AU185: 0 | AV185: 0 | AW185: 0 | AX185: 0
F186: 0 | G186: 0 | H186: 1 | I186: 0 | J186: 0 | K186: 0 | L186: 0 | M186: 0 | N186: 0 | O186: 0 | P186: 0 | Q186: 0 | R186: 0 | S186: 0 | T186: 0 | U186: 0 | V186: 0 | W186: 0 | X186: 0 | Y186: 0 | Z186: 0 | AA186: 0 | AB186: 0 | AC186: 0 | AD186: 0 | AE186: 0 | AF186: 0 | AG186: 0 | AH186: 0 | AI186: 0 | AJ186: 0 | AK186: 0 | AL186: 0 | AM186: 0 | AN186: 0 | AO186: 0 | AP186: 0 | AQ186: 0 | AR186: 0 | AS186: 0 | AT186: 0 | AU186: 0 | AV186: 0 | AW186: 0 | AX186: 0
F187: 0 | G187: 0 | H187: 1 | I187: 0 | J187: 0 | K187: 0 | L187: 0 | M187: 0 | N187: 0 | O187: 0 | P187: 0 | Q187: 0 | R187: 0 | S187: 0 | T187: 0 | U187: 0 | V187: 0 | W187: 0 | X187: 0 | Y187: 0 | Z187: 0 | AA187: 0 | AB187: 0 | AC187: 0 | AD187: 0 | AE187: 0 | AF187: 0 | AG187: 0 | AH187: 0 | AI187: 0 | AJ187: 0 | AK187: 0 | AL187: 0 | AM187: 0 | AN187: 0 | AO187: 0 | AP187: 0 | AQ187: 0 | AR187: 0 | AS187: 0 | AT187: 0 | AU187: 0 | AV187: 0 | AW187: 0 | AX187: 0
F188: 0 | G188: 0 | H188: 1 | I188: 0 | J188: 0 | K188: 0 | L188: 0 | M188: 0 | N188: 0 | O188: 0 | P188: 0 | Q188: 0 | R188: 0 | S188: 0 | T188: 0 | U188: 0 | V188: 0 | W188: 0 | X188: 0 | Y188: 0 | Z188: 0 | AA188: 0 | AB188: 0 | AC188: 0 | AD188: 0 | AE188: 0 | AF188: 0 | AG188: 0 | AH188: 0 | AI188: 0 | AJ188: 0 | AK188: 0 | AL188: 0 | AM188: 0 | AN188: 0 | AO188: 0 | AP188: 0 | AQ188: 0 | AR188: 0 | AS188: 0 | AT188: 0 | AU188: 0 | AV188: 0 | AW188: 0 | AX188: 0
F189: 0 | G189: 0 | H189: 1 | I189: 0 | J189: 0 | K189: 0 | L189: 0 | M189: 0 | N189: 0 | O189: 0 | P189: 0 | Q189: 0 | R189: 0 | S189: 0 | T189: 0 | U189: 0 | V189: 0 | W189: 0 | X189: 0 | Y189: 0 | Z189: 0 | AA189: 0 | AB189: 0 | AC189: 0 | AD189: 0 | AE189: 0 | AF189: 0 | AG189: 0 | AH189: 0 | AI189: 0 | AJ189: 0 | AK189: 0 | AL189: 0 | AM189: 0 | AN189: 0 | AO189: 0 | AP189: 0 | AQ189: 0 | AR189: 0 | AS189: 0 | AT189: 0 | AU189: 0 | AV189: 0 | AW189: 0 | AX189: 0
F190: 0 | G190: 0 | H190: 1 | I190: 0 | J190: 0 | K190: 0 | L190: 0 | M190: 0 | N190: 0 | O190: 0 | P190: 0 | Q190: 0 | R190: 0 | S190: 0 | T190: 0 | U190: 0 | V190: 0 | W190: 0 | X190: 0 | Y190: 0 | Z190: 0 | AA190: 0 | AB190: 0 | AC190: 0 | AD190: 0 | AE190: 0 | AF190: 0 | AG190: 0 | AH190: 0 | AI190: 0 | AJ190: 0 | AK190: 0 | AL190: 0 | AM190: 0 | AN190: 0 | AO190: 0 | AP190: 0 | AQ190: 0 | AR190: 0 | AS190: 0 | AT190: 0 | AU190: 0 | AV190: 0 | AW190: 0 | AX190: 0
F191: 0 | G191: 0 | H191: 1 | I191: 0 | J191: 0 | K191: 0 | L191: 0 | M191: 0 | N191: 0 | O191: 0 | P191: 0 | Q191: 0 | R191: 0 | S191: 0 | T191: 0 | U191: 0 | V191: 0 | W191: 0 | X191: 0 | Y191: 0 | Z191: 0 | AA191: 0 | AB191: 0 | AC191: 0 | AD191: 0 | AE191: 0 | AF191: 0 | AG191: 0 | AH191: 0 | AI191: 0 | AJ191: 0 | AK191: 0 | AL191: 0 | AM191: 0 | AN191: 0 | AO191: 0 | AP191: 0 | AQ191: 0 | AR191: 0 | AS191: 0 | AT191: 0 | AU191: 0 | AV191: 0 | AW191: 0 | AX191: 0
F192: 0 | G192: 0 | H192: 1 | I192: 0 | J192: 0 | K192: 0 | L192: 0 | M192: 0 | N192: 0 | O192: 0 | P192: 0 | Q192: 0 | R192: 0 | S192: 0 | T192: 0 | U192: 0 | V192: 0 | W192: 0 | X192: 0 | Y192: 0 | Z192: 0 | AA192: 0 | AB192: 0 | AC192: 0 | AD192: 0 | AE192: 0 | AF192: 0 | AG192: 0 | AH192: 0 | AI192: 0 | AJ192: 0 | AK192: 0 | AL192: 0 | AM192: 0 | AN192: 0 | AO192: 0 | AP192: 0 | AQ192: 0 | AR192: 0 | AS192: 0 | AT192: 0 | AU192: 0 | AV192: 0 | AW192: 0 | AX192: 0
F193: 0 | G193: 0 | H193: 1 | I193: 0 | J193: 0 | K193: 0 | L193: 0 | M193: 0 | N193: 0 | O193: 0 | P193: 0 | Q193: 0 | R193: 0 | S193: 0 | T193: 0 | U193: 0 | V193: 0 | W193: 0 | X193: 0 | Y193: 0 | Z193: 0 | AA193: 0 | AB193: 0 | AC193: 0 | AD193: 0 | AE193: 0 | AF193: 0 | AG193: 0 | AH193: 0 | AI193: 0 | AJ193: 0 | AK193: 0 | AL193: 0 | AM193: 0 | AN193: 0 | AO193: 0 | AP193: 0 | AQ193: 0 | AR193: 0 | AS193: 0 | AT193: 0 | AU193: 0 | AV193: 0 | AW193: 0 | AX193: 0
F194: 0 | G194: 0 | H194: 1 | I194: 0 | J194: 0 | K194: 0 | L194: 0 | M194: 0 | N194: 0 | O194: 0 | P194: 0 | Q194: 0 | R194: 0 | S194: 0 | T194: 0 | U194: 0 | V194: 0 | W194: 0 | X194: 0 | Y194: 0 | Z194: 0 | AA194: 0 | AB194: 0 | AC194: 0 | AD194: 0 | AE194: 0 | AF194: 0 | AG194: 0 | AH194: 0 | AI194: 0 | AJ194: 0 | AK194: 0 | AL194: 0 | AM194: 0 | AN194: 0 | AO194: 0 | AP194: 0 | AQ194: 0 | AR194: 0 | AS194: 0 | AT194: 0 | AU194: 0 | AV194: 0 | AW194: 0 | AX194: 0
F195: 0 | G195: 0 | H195: 0 | I195: 0 | J195: 0 | K195: 0 | L195: 0 | M195: 0 | N195: 0 | O195: 0 | P195: 0 | Q195: 0 | R195: 1 | S195: 0 | T195: 0 | U195: 0 | V195: 0 | W195: 0 | X195: 0 | Y195: 0 | Z195: 0 | AA195: 0 | AB195: 0 | AC195: 0 | AD195: 0 | AE195: 0 | AF195: 0 | AG195: 0 | AH195: 0 | AI195: 0 | AJ195: 0 | AK195: 0 | AL195: 0 | AM195: 0 | AN195: 0 | AO195: 0 | AP195: 0 | AQ195: 0 | AR195: 0 | AS195: 0 | AT195: 0 | AU195: 0 | AV195: 0 | AW195: 0 | AX195: 0
F196: 0 | G196: 0 | H196: 0 | I196: 0 | J196: 0 | K196: 0 | L196: 0 | M196: 0 | N196: 0 | O196: 0 | P196: 0 | Q196: 0 | R196: 1 | S196: 0 | T196: 0 | U196: 0 | V196: 0 | W196: 0 | X196: 0 | Y196: 0 | Z196: 0 | AA196: 0 | AB196: 0 | AC196: 0 | AD196: 0 | AE196: 0 | AF196: 0 | AG196: 0 | AH196: 0 | AI196: 0 | AJ196: 0 | AK196: 0 | AL196: 0 | AM196: 0 | AN196: 0 | AO196: 0 | AP196: 0 | AQ196: 0 | AR196: 0 | AS196: 0 | AT196: 0 | AU196: 0 | AV196: 0 | AW196: 0 | AX196: 0
F197: 0 | G197: 0 | H197: 0 | I197: 0 | J197: 0 | K197: 0 | L197: 0 | M197: 0 | N197: 0 | O197: 0 | P197: 0 | Q197: 0 | R197: 1 | S197: 0 | T197: 0 | U197: 0 | V197: 0 | W197: 0 | X197: 0 | Y197: 0 | Z197: 0 | AA197: 0 | AB197: 0 | AC197: 0 | AD197: 0 | AE197: 0 | AF197: 0 | AG197: 0 | AH197: 0 | AI197: 0 | AJ197: 0 | AK197: 0 | AL197: 0 | AM197: 0 | AN197: 0 | AO197: 0 | AP197: 0 | AQ197: 0 | AR197: 0 | AS197: 0 | AT197: 0 | AU197: 0 | AV197: 0 | AW197: 0 | AX197: 0
F198: 0 | G198: 0 | H198: 0 | I198: 0 | J198: 0 | K198: 0 | L198: 0 | M198: 0 | N198: 0 | O198: 0 | P198: 0 | Q198: 0 | R198: 1 | S198: 0 | T198: 0 | U198: 0 | V198: 0 | W198: 0 | X198: 0 | Y198: 0 | Z198: 0 | AA198: 0 | AB198: 0 | AC198: 0 | AD198: 0 | AE198: 0 | AF198: 0 | AG198: 0 | AH198: 0 | AI198: 0 | AJ198: 0 | AK198: 0 | AL198: 0 | AM198: 0 | AN198: 0 | AO198: 0 | AP198: 0 | AQ198: 0 | AR198: 0 | AS198: 0 | AT198: 0 | AU198: 0 | AV198: 0 | AW198: 0 | AX198: 0
F199: 0 | G199: 0 | H199: 0 | I199: 0 | J199: 0 | K199: 0 | L199: 0 | M199: 0 | N199: 0 | O199: 0 | P199: 0 | Q199: 0 | R199: 0 | S199: 0 | T199: 0 | U199: 0 | V199: 0 | W199: 0 | X199: 0 | Y199: 0 | Z199: 0 | AA199: 0 | AB199: 0 | AC199: 1 | AD199: 0 | AE199: 0 | AF199: 0 | AG199: 0 | AH199: 0 | AI199: 0 | AJ199: 0 | AK199: 0 | AL199: 0 | AM199: 0 | AN199: 0 | AO199: 0 | AP199: 0 | AQ199: 0 | AR199: 0 | AS199: 0 | AT199: 0 | AU199: 0 | AV199: 0 | AW199: 0 | AX199: 0
F200: 0 | G200: 0 | H200: 0 | I200: 0 | J200: 0 | K200: 0 | L200: 0 | M200: 0 | N200: 0 | O200: 0 | P200: 0 | Q200: 0 | R200: 0 | S200: 0 | T200: 0 | U200: 0 | V200: 0 | W200: 0 | X200: 0 | Y200: 0 | Z200: 0 | AA200: 0 | AB200: 0 | AC200: 1 | AD200: 0 | AE200: 0 | AF200: 0 | AG200: 0 | AH200: 0 | AI200: 0 | AJ200: 0 | AK200: 0 | AL200: 0 | AM200: 0 | AN200: 0 | AO200: 0 | AP200: 0 | AQ200: 0 | AR200: 0 | AS200: 0 | AT200: 0 | AU200: 0 | AV200: 0 | AW200: 0 | AX200: 0
F201: 0 | G201: 0 | H201: 0 | I201: 0 | J201: 0 | K201: 0 | L201: 0 | M201: 0 | N201: 0 | O201: 0 | P201: 0 | Q201: 0 | R201: 0 | S201: 0 | T201: 0 | U201: 0 | V201: 0 | W201: 0 | X201: 0 | Y201: 0 | Z201: 0 | AA201: 0 | AB201: 0 | AC201: 1 | AD201: 0 | AE201: 0 | AF201: 0 | AG201: 0 | AH201: 0 | AI201: 0 | AJ201: 0 | AK201: 0 | AL201: 0 | AM201: 0 | AN201: 0 | AO201: 0 | AP201: 0 | AQ201: 0 | AR201: 0 | AS201: 0 | AT201: 0 | AU201: 0 | AV201: 0 | AW201: 0 | AX201: 0
F202: 0 | G202: 0 | H202: 0 | I202: 0 | J202: 0 | K202: 0 | L202: 0 | M202: 0 | N202: 0 | O202: 0 | P202: 0 | Q202: 0 | R202: 0 | S202: 0 | T202: 0 | U202: 0 | V202: 0 | W202: 0 | X202: 0 | Y202: 0 | Z202: 0 | AA202: 0 | AB202: 0 | AC202: 1 | AD202: 0 | AE202: 0 | AF202: 0 | AG202: 0 | AH202: 0 | AI202: 0 | AJ202: 0 | AK202: 0 | AL202: 0 | AM202: 0 | AN202: 0 | AO202: 0 | AP202: 0 | AQ202: 0 | AR202: 0 | AS202: 0 | AT202: 0 | AU202: 0 | AV202: 0 | AW202: 0 | AX202: 0
F203: 0 | G203: 0 | H203: 0 | I203: 0 | J203: 0 | K203: 0 | L203: 0 | M203: 0 | N203: 0 | O203: 0 | P203: 0 | Q203: 0 | R203: 0 | S203: 0 | T203: 0 | U203: 0 | V203: 0 | W203: 0 | X203: 0 | Y203: 0 | Z203: 0 | AA203: 0 | AB203: 0 | AC203: 1 | AD203: 0 | AE203: 0 | AF203: 0 | AG203: 0 | AH203: 0 | AI203: 0 | AJ203: 0 | AK203: 0 | AL203: 0 | AM203: 0 | AN203: 0 | AO203: 0 | AP203: 0 | AQ203: 0 | AR203: 0 | AS203: 0 | AT203: 0 | AU203: 0 | AV203: 0 | AW203: 0 | AX203: 0
F204: 0 | G204: 0 | H204: 0 | I204: 0 | J204: 0 | K204: 0 | L204: 0 | M204: 0 | N204: 0 | O204: 0 | P204: 0 | Q204: 0 | R204: 0 | S204: 0 | T204: 0 | U204: 0 | V204: 0 | W204: 0 | X204: 0 | Y204: 0 | Z204: 0 | AA204: 0 | AB204: 0 | AC204: 1 | AD204: 0 | AE204: 0 | AF204: 0 | AG204: 0 | AH204: 0 | AI204: 0 | AJ204: 0 | AK204: 0 | AL204: 0 | AM204: 0 | AN204: 0 | AO204: 0 | AP204: 0 | AQ204: 0 | AR204: 0 | AS204: 0 | AT204: 0 | AU204: 0 | AV204: 0 | AW204: 0 | AX204: 0
F205: 0 | G205: 0 | H205: 0 | I205: 0 | J205: 0 | K205: 0 | L205: 0 | M205: 0 | N205: 0 | O205: 0 | P205: 0 | Q205: 0 | R205: 0 | S205: 0 | T205: 0 | U205: 0 | V205: 0 | W205: 0 | X205: 0 | Y205: 0 | Z205: 0 | AA205: 0 | AB205: 0 | AC205: 1 | AD205: 0 | AE205: 0 | AF205: 0 | AG205: 0 | AH205: 0 | AI205: 0 | AJ205: 0 | AK205: 0 | AL205: 0 | AM205: 0 | AN205: 0 | AO205: 0 | AP205: 0 | AQ205: 0 | AR205: 0 | AS205: 0 | AT205: 0 | AU205: 0 | AV205: 0 | AW205: 0 | AX205: 0
F206: 0 | G206: 0 | H206: 0 | I206: 0 | J206: 0 | K206: 0 | L206: 0 | M206: 0 | N206: 0 | O206: 0 | P206: 0 | Q206: 0 | R206: 0 | S206: 0 | T206: 0 | U206: 0 | V206: 0 | W206: 0 | X206: 0 | Y206: 0 | Z206: 0 | AA206: 0 | AB206: 0 | AC206: 1 | AD206: 0 | AE206: 0 | AF206: 0 | AG206: 0 | AH206: 0 | AI206: 0 | AJ206: 0 | AK206: 0 | AL206: 0 | AM206: 0 | AN206: 0 | AO206: 0 | AP206: 0 | AQ206: 0 | AR206: 0 | AS206: 0 | AT206: 0 | AU206: 0 | AV206: 0 | AW206: 0 | AX206: 0
F207: 0 | G207: 0 | H207: 0 | I207: 0 | J207: 0 | K207: 0 | L207: 0 | M207: 0 | N207: 0 | O207: 0 | P207: 0 | Q207: 0 | R207: 0 | S207: 0 | T207: 0 | U207: 0 | V207: 0 | W207: 0 | X207: 0 | Y207: 0 | Z207: 0 | AA207: 0 | AB207: 0 | AC207: 1 | AD207: 0 | AE207: 0 | AF207: 0 | AG207: 0 | AH207: 0 | AI207: 0 | AJ207: 0 | AK207: 0 | AL207: 0 | AM207: 0 | AN207: 0 | AO207: 0 | AP207: 0 | AQ207: 0 | AR207: 0 | AS207: 0 | AT207: 0 | AU207: 0 | AV207: 0 | AW207: 0 | AX207: 0
F208: 0 | G208: 0 | H208: 0 | I208: 0 | J208: 0 | K208: 0 | L208: 0 | M208: 0 | N208: 0 | O208: 0 | P208: 0 | Q208: 0 | R208: 0 | S208: 0 | T208: 0 | U208: 0 | V208: 0 | W208: 0 | X208: 0 | Y208: 0 | Z208: 0 | AA208: 0 | AB208: 0 | AC208: 0 | AD208: 0 | AE208: 0 | AF208: 0 | AG208: 0 | AH208: 0 | AI208: 1 | AJ208: 0 | AK208: 0 | AL208: 0 | AM208: 0 | AN208: 0 | AO208: 0 | AP208: 0 | AQ208: 0 | AR208: 0 | AS208: 0 | AT208: 0 | AU208: 0 | AV208: 0 | AW208: 0 | AX208: 0
F209: 0 | G209: 0 | H209: 0 | I209: 0 | J209: 0 | K209: 0 | L209: 0 | M209: 0 | N209: 0 | O209: 0 | P209: 0 | Q209: 0 | R209: 0 | S209: 0 | T209: 0 | U209: 0 | V209: 0 | W209: 0 | X209: 0 | Y209: 0 | Z209: 0 | AA209: 0 | AB209: 0 | AC209: 0 | AD209: 0 | AE209: 0 | AF209: 0 | AG209: 0 | AH209: 0 | AI209: 1 | AJ209: 0 | AK209: 0 | AL209: 0 | AM209: 0 | AN209: 0 | AO209: 0 | AP209: 0 | AQ209: 0 | AR209: 0 | AS209: 0 | AT209: 0 | AU209: 0 | AV209: 0 | AW209: 0 | AX209: 0
F210: 0 | G210: 0 | H210: 0 | I210: 0 | J210: 0 | K210: 0 | L210: 0 | M210: 0 | N210: 0 | O210: 0 | P210: 0 | Q210: 0 | R210: 0 | S210: 1 | T210: 0 | U210: 0 | V210: 0 | W210: 0 | X210: 0 | Y210: 0 | Z210: 0 | AA210: 0 | AB210: 0 | AC210: 0 | AD210: 0 | AE210: 0 | AF210: 0 | AG210: 0 | AH210: 0 | AI210: 0 | AJ210: 0 | AK210: 0 | AL210: 0 | AM210: 0 | AN210: 0 | AO210: 0 | AP210: 0 | AQ210: 0 | AR210: 0 | AS210: 0 | AT210: 0 | AU210: 0 | AV210: 0 | AW210: 0 | AX210: 0
F211: 0 | G211: 0 | H211: 0 | I211: 0 | J211: 0 | K211: 0 | L211: 0 | M211: 0 | N211: 0 | O211: 0 | P211: 0 | Q211: 0 | R211: 0 | S211: 1 | T211: 0 | U211: 0 | V211: 0 | W211: 0 | X211: 0 | Y211: 0 | Z211: 0 | AA211: 0 | AB211: 0 | AC211: 0 | AD211: 0 | AE211: 0 | AF211: 0 | AG211: 0 | AH211: 0 | AI211: 0 | AJ211: 0 | AK211: 0 | AL211: 0 | AM211: 0 | AN211: 0 | AO211: 0 | AP211: 0 | AQ211: 0 | AR211: 0 | AS211: 0 | AT211: 0 | AU211: 0 | AV211: 0 | AW211: 0 | AX211: 0
F212: 0 | G212: 0 | H212: 0 | I212: 0 | J212: 0 | K212: 0 | L212: 0 | M212: 0 | N212: 0 | O212: 0 | P212: 0 | Q212: 0 | R212: 0 | S212: 1 | T212: 0 | U212: 0 | V212: 0 | W212: 0 | X212: 0 | Y212: 0 | Z212: 0 | AA212: 0 | AB212: 0 | AC212: 0 | AD212: 0 | AE212: 0 | AF212: 0 | AG212: 0 | AH212: 0 | AI212: 0 | AJ212: 0 | AK212: 0 | AL212: 0 | AM212: 0 | AN212: 0 | AO212: 0 | AP212: 0 | AQ212: 0 | AR212: 0 | AS212: 0 | AT212: 0 | AU212: 0 | AV212: 0 | AW212: 0 | AX212: 0
F213: 0 | G213: 0 | H213: 0 | I213: 0 | J213: 0 | K213: 0 | L213: 0 | M213: 0 | N213: 0 | O213: 0 | P213: 0 | Q213: 0 | R213: 0 | S213: 1 | T213: 0 | U213: 0 | V213: 0 | W213: 0 | X213: 0 | Y213: 0 | Z213: 0 | AA213: 0 | AB213: 0 | AC213: 0 | AD213: 0 | AE213: 0 | AF213: 0 | AG213: 0 | AH213: 0 | AI213: 0 | AJ213: 0 | AK213: 0 | AL213: 0 | AM213: 0 | AN213: 0 | AO213: 0 | AP213: 0 | AQ213: 0 | AR213: 0 | AS213: 0 | AT213: 0 | AU213: 0 | AV213: 0 | AW213: 0 | AX213: 0
F214: 0 | G214: 0 | H214: 0 | I214: 0 | J214: 0 | K214: 0 | L214: 0 | M214: 0 | N214: 0 | O214: 0 | P214: 0 | Q214: 0 | R214: 0 | S214: 1 | T214: 0 | U214: 0 | V214: 0 | W214: 0 | X214: 0 | Y214: 0 | Z214: 0 | AA214: 0 | AB214: 0 | AC214: 0 | AD214: 0 | AE214: 0 | AF214: 0 | AG214: 0 | AH214: 0 | AI214: 0 | AJ214: 0 | AK214: 0 | AL214: 0 | AM214: 0 | AN214: 0 | AO214: 0 | AP214: 0 | AQ214: 0 | AR214: 0 | AS214: 0 | AT214: 0 | AU214: 0 | AV214: 0 | AW214: 0 | AX214: 0
F215: 0 | G215: 0 | H215: 0 | I215: 0 | J215: 0 | K215: 0 | L215: 0 | M215: 0 | N215: 0 | O215: 0 | P215: 0 | Q215: 0 | R215: 0 | S215: 1 | T215: 0 | U215: 0 | V215: 0 | W215: 0 | X215: 0 | Y215: 0 | Z215: 0 | AA215: 0 | AB215: 0 | AC215: 0 | AD215: 0 | AE215: 0 | AF215: 0 | AG215: 0 | AH215: 0 | AI215: 0 | AJ215: 0 | AK215: 0 | AL215: 0 | AM215: 0 | AN215: 0 | AO215: 0 | AP215: 0 | AQ215: 0 | AR215: 0 | AS215: 0 | AT215: 0 | AU215: 0 | AV215: 0 | AW215: 0 | AX215: 0
F216: 0 | G216: 0 | H216: 0 | I216: 0 | J216: 0 | K216: 0 | L216: 0 | M216: 0 | N216: 0 | O216: 0 | P216: 0 | Q216: 0 | R216: 0 | S216: 1 | T216: 0 | U216: 0 | V216: 0 | W216: 0 | X216: 0 | Y216: 0 | Z216: 0 | AA216: 0 | AB216: 0 | AC216: 0 | AD216: 0 | AE216: 0 | AF216: 0 | AG216: 0 | AH216: 0 | AI216: 0 | AJ216: 0 | AK216: 0 | AL216: 0 | AM216: 0 | AN216: 0 | AO216: 0 | AP216: 0 | AQ216: 0 | AR216: 0 | AS216: 0 | AT216: 0 | AU216: 0 | AV216: 0 | AW216: 0 | AX216: 0
F217: 0 | G217: 0 | H217: 0 | I217: 0 | J217: 0 | K217: 0 | L217: 0 | M217: 0 | N217: 0 | O217: 0 | P217: 0 | Q217: 0 | R217: 0 | S217: 1 | T217: 0 | U217: 0 | V217: 0 | W217: 0 | X217: 0 | Y217: 0 | Z217: 0 | AA217: 0 | AB217: 0 | AC217: 0 | AD217: 0 | AE217: 0 | AF217: 0 | AG217: 0 | AH217: 0 | AI217: 0 | AJ217: 0 | AK217: 0 | AL217: 0 | AM217: 0 | AN217: 0 | AO217: 0 | AP217: 0 | AQ217: 0 | AR217: 0 | AS217: 0 | AT217: 0 | AU217: 0 | AV217: 0 | AW217: 0 | AX217: 0
F218: 0 | G218: 0 | H218: 0 | I218: 0 | J218: 0 | K218: 0 | L218: 0 | M218: 0 | N218: 0 | O218: 0 | P218: 0 | Q218: 0 | R218: 0 | S218: 1 | T218: 0 | U218: 0 | V218: 0 | W218: 0 | X218: 0 | Y218: 0 | Z218: 0 | AA218: 0 | AB218: 0 | AC218: 0 | AD218: 0 | AE218: 0 | AF218: 0 | AG218: 0 | AH218: 0 | AI218: 0 | AJ218: 0 | AK218: 0 | AL218: 0 | AM218: 0 | AN218: 0 | AO218: 0 | AP218: 0 | AQ218: 0 | AR218: 0 | AS218: 0 | AT218: 0 | AU218: 0 | AV218: 0 | AW218: 0 | AX218: 0
F219: 0 | G219: 0 | H219: 0 | I219: 0 | J219: 0 | K219: 0 | L219: 0 | M219: 0 | N219: 0 | O219: 0 | P219: 0 | Q219: 0 | R219: 0 | S219: 1 | T219: 0 | U219: 0 | V219: 0 | W219: 0 | X219: 0 | Y219: 0 | Z219: 0 | AA219: 0 | AB219: 0 | AC219: 0 | AD219: 0 | AE219: 0 | AF219: 0 | AG219: 0 | AH219: 0 | AI219: 0 | AJ219: 0 | AK219: 0 | AL219: 0 | AM219: 0 | AN219: 0 | AO219: 0 | AP219: 0 | AQ219: 0 | AR219: 0 | AS219: 0 | AT219: 0 | AU219: 0 | AV219: 0 | AW219: 0 | AX219: 0
F220: 0 | G220: 0 | H220: 0 | I220: 0 | J220: 0 | K220: 0 | L220: 0 | M220: 0 | N220: 0 | O220: 0 | P220: 0 | Q220: 0 | R220: 0 | S220: 1 | T220: 0 | U220: 0 | V220: 0 | W220: 0 | X220: 0 | Y220: 0 | Z220: 0 | AA220: 0 | AB220: 0 | AC220: 0 | AD220: 0 | AE220: 0 | AF220: 0 | AG220: 0 | AH220: 0 | AI220: 0 | AJ220: 0 | AK220: 0 | AL220: 0 | AM220: 0 | AN220: 0 | AO220: 0 | AP220: 0 | AQ220: 0 | AR220: 0 | AS220: 0 | AT220: 0 | AU220: 0 | AV220: 0 | AW220: 0 | AX220: 0
F221: 0 | G221: 0 | H221: 0 | I221: 0 | J221: 0 | K221: 0 | L221: 0 | M221: 0 | N221: 0 | O221: 0 | P221: 0 | Q221: 0 | R221: 0 | S221: 1 | T221: 0 | U221: 0 | V221: 0 | W221: 0 | X221: 0 | Y221: 0 | Z221: 0 | AA221: 0 | AB221: 0 | AC221: 0 | AD221: 0 | AE221: 0 | AF221: 0 | AG221: 0 | AH221: 0 | AI221: 0 | AJ221: 0 | AK221: 0 | AL221: 0 | AM221: 0 | AN221: 0 | AO221: 0 | AP221: 0 | AQ221: 0 | AR221: 0 | AS221: 0 | AT221: 0 | AU221: 0 | AV221: 0 | AW221: 0 | AX221: 0
F222: 0 | G222: 0 | H222: 0 | I222: 0 | J222: 0 | K222: 0 | L222: 0 | M222: 0 | N222: 0 | O222: 0 | P222: 0 | Q222: 0 | R222: 0 | S222: 1 | T222: 0 | U222: 0 | V222: 0 | W222: 0 | X222: 0 | Y222: 0 | Z222: 0 | AA222: 0 | AB222: 0 | AC222: 0 | AD222: 0 | AE222: 0 | AF222: 0 | AG222: 0 | AH222: 0 | AI222: 0 | AJ222: 0 | AK222: 0 | AL222: 0 | AM222: 0 | AN222: 0 | AO222: 0 | AP222: 0 | AQ222: 0 | AR222: 0 | AS222: 0 | AT222: 0 | AU222: 0 | AV222: 0 | AW222: 0 | AX222: 0
F223: 0 | G223: 0 | H223: 0 | I223: 0 | J223: 0 | K223: 0 | L223: 0 | M223: 0 | N223: 0 | O223: 0 | P223: 0 | Q223: 0 | R223: 0 | S223: 0 | T223: 0 | U223: 0 | V223: 0 | W223: 0 | X223: 0 | Y223: 0 | Z223: 0 | AA223: 0 | AB223: 0 | AC223: 0 | AD223: 0 | AE223: 0 | AF223: 0 | AG223: 0 | AH223: 0 | AI223: 0 | AJ223: 0 | AK223: 0 | AL223: 1 | AM223: 0 | AN223: 0 | AO223: 0 | AP223: 0 | AQ223: 0 | AR223: 0 | AS223: 0 | AT223: 0 | AU223: 0 | AV223: 0 | AW223: 0 | AX223: 0
F224: 0 | G224: 0 | H224: 0 | I224: 0 | J224: 0 | K224: 0 | L224: 0 | M224: 0 | N224: 0 | O224: 0 | P224: 0 | Q224: 0 | R224: 0 | S224: 0 | T224: 0 | U224: 0 | V224: 0 | W224: 0 | X224: 0 | Y224: 0 | Z224: 0 | AA224: 0 | AB224: 0 | AC224: 0 | AD224: 0 | AE224: 0 | AF224: 0 | AG224: 0 | AH224: 0 | AI224: 0 | AJ224: 0 | AK224: 0 | AL224: 1 | AM224: 0 | AN224: 0 | AO224: 0 | AP224: 0 | AQ224: 0 | AR224: 0 | AS224: 0 | AT224: 0 | AU224: 0 | AV224: 0 | AW224: 0 | AX224: 0
F225: 0 | G225: 0 | H225: 0 | I225: 0 | J225: 0 | K225: 0 | L225: 0 | M225: 0 | N225: 0 | O225: 0 | P225: 0 | Q225: 0 | R225: 0 | S225: 0 | T225: 0 | U225: 0 | V225: 0 | W225: 0 | X225: 0 | Y225: 0 | Z225: 0 | AA225: 0 | AB225: 0 | AC225: 0 | AD225: 0 | AE225: 0 | AF225: 0 | AG225: 0 | AH225: 0 | AI225: 0 | AJ225: 0 | AK225: 0 | AL225: 1 | AM225: 0 | AN225: 0 | AO225: 0 | AP225: 0 | AQ225: 0 | AR225: 0 | AS225: 0 | AT225: 0 | AU225: 0 | AV225: 0 | AW225: 0 | AX225: 0
F226: 0 | G226: 0 | H226: 0 | I226: 0 | J226: 0 | K226: 0 | L226: 0 | M226: 0 | N226: 0 | O226: 0 | P226: 0 | Q226: 0 | R226: 0 | S226: 0 | T226: 0 | U226: 0 | V226: 0 | W226: 0 | X226: 0 | Y226: 0 | Z226: 0 | AA226: 0 | AB226: 0 | AC226: 0 | AD226: 0 | AE226: 0 | AF226: 0 | AG226: 0 | AH226: 0 | AI226: 0 | AJ226: 0 | AK226: 0 | AL226: 1 | AM226: 0 | AN226: 0 | AO226: 0 | AP226: 0 | AQ226: 0 | AR226: 0 | AS226: 0 | AT226: 0 | AU226: 0 | AV226: 0 | AW226: 0 | AX226: 0
F227: 0 | G227: 0 | H227: 0 | I227: 0 | J227: 0 | K227: 0 | L227: 0 | M227: 0 | N227: 0 | O227: 0 | P227: 0 | Q227: 0 | R227: 0 | S227: 0 | T227: 0 | U227: 0 | V227: 0 | W227: 0 | X227: 0 | Y227: 0 | Z227: 0 | AA227: 0 | AB227: 0 | AC227: 0 | AD227: 0 | AE227: 0 | AF227: 0 | AG227: 0 | AH227: 0 | AI227: 0 | AJ227: 0 | AK227: 0 | AL227: 1 | AM227: 0 | AN227: 0 | AO227: 0 | AP227: 0 | AQ227: 0 | AR227: 0 | AS227: 0 | AT227: 0 | AU227: 0 | AV227: 0 | AW227: 0 | AX227: 0
F228: 0 | G228: 0 | H228: 0 | I228: 0 | J228: 0 | K228: 0 | L228: 0 | M228: 0 | N228: 0 | O228: 0 | P228: 0 | Q228: 0 | R228: 0 | S228: 0 | T228: 0 | U228: 0 | V228: 0 | W228: 0 | X228: 0 | Y228: 0 | Z228: 0 | AA228: 0 | AB228: 0 | AC228: 0 | AD228: 0 | AE228: 0 | AF228: 0 | AG228: 0 | AH228: 0 | AI228: 0 | AJ228: 0 | AK228: 0 | AL228: 1 | AM228: 0 | AN228: 0 | AO228: 0 | AP228: 0 | AQ228: 0 | AR228: 0 | AS228: 0 | AT228: 0 | AU228: 0 | AV228: 0 | AW228: 0 | AX228: 0
F229: 0 | G229: 0 | H229: 0 | I229: 0 | J229: 0 | K229: 0 | L229: 0 | M229: 0 | N229: 0 | O229: 0 | P229: 0 | Q229: 0 | R229: 0 | S229: 0 | T229: 0 | U229: 0 | V229: 0 | W229: 0 | X229: 0 | Y229: 0 | Z229: 0 | AA229: 0 | AB229: 0 | AC229: 0 | AD229: 0 | AE229: 0 | AF229: 0 | AG229: 0 | AH229: 0 | AI229: 0 | AJ229: 0 | AK229: 0 | AL229: 1 | AM229: 0 | AN229: 0 | AO229: 0 | AP229: 0 | AQ229: 0 | AR229: 0 | AS229: 0 | AT229: 0 | AU229: 0 | AV229: 0 | AW229: 0 | AX229: 0
F230: 0 | G230: 0 | H230: 0 | I230: 0 | J230: 0 | K230: 0 | L230: 0 | M230: 0 | N230: 0 | O230: 0 | P230: 0 | Q230: 0 | R230: 0 | S230: 0 | T230: 0 | U230: 0 | V230: 0 | W230: 0 | X230: 0 | Y230: 0 | Z230: 0 | AA230: 0 | AB230: 0 | AC230: 0 | AD230: 0 | AE230: 0 | AF230: 0 | AG230: 0 | AH230: 0 | AI230: 0 | AJ230: 0 | AK230: 0 | AL230: 1 | AM230: 0 | AN230: 0 | AO230: 0 | AP230: 0 | AQ230: 0 | AR230: 0 | AS230: 0 | AT230: 0 | AU230: 0 | AV230: 0 | AW230: 0 | AX230: 0
F231: 0 | G231: 0 | H231: 0 | I231: 0 | J231: 0 | K231: 0 | L231: 0 | M231: 0 | N231: 0 | O231: 0 | P231: 0 | Q231: 0 | R231: 0 | S231: 0 | T231: 0 | U231: 0 | V231: 0 | W231: 0 | X231: 0 | Y231: 0 | Z231: 0 | AA231: 0 | AB231: 0 | AC231: 0 | AD231: 0 | AE231: 0 | AF231: 0 | AG231: 0 | AH231: 0 | AI231: 0 | AJ231: 0 | AK231: 0 | AL231: 1 | AM231: 0 | AN231: 0 | AO231: 0 | AP231: 0 | AQ231: 0 | AR231: 0 | AS231: 0 | AT231: 0 | AU231: 0 | AV231: 0 | AW231: 0 | AX231: 0
F232: 0 | G232: 0 | H232: 0 | I232: 0 | J232: 0 | K232: 0 | L232: 0 | M232: 0 | N232: 0 | O232: 0 | P232: 0 | Q232: 0 | R232: 0 | S232: 0 | T232: 0 | U232: 0 | V232: 0 | W232: 0 | X232: 0 | Y232: 0 | Z232: 0 | AA232: 0 | AB232: 0 | AC232: 0 | AD232: 0 | AE232: 0 | AF232: 0 | AG232: 0 | AH232: 0 | AI232: 0 | AJ232: 0 | AK232: 0 | AL232: 1 | AM232: 0 | AN232: 0 | AO232: 0 | AP232: 0 | AQ232: 0 | AR232: 0 | AS232: 0 | AT232: 0 | AU232: 0 | AV232: 0 | AW232: 0 | AX232: 0
F233: 0 | G233: 0 | H233: 0 | I233: 0 | J233: 0 | K233: 0 | L233: 0 | M233: 0 | N233: 0 | O233: 0 | P233: 0 | Q233: 0 | R233: 0 | S233: 0 | T233: 0 | U233: 0 | V233: 0 | W233: 0 | X233: 0 | Y233: 0 | Z233: 0 | AA233: 0 | AB233: 0 | AC233: 0 | AD233: 0 | AE233: 0 | AF233: 0 | AG233: 0 | AH233: 0 | AI233: 0 | AJ233: 0 | AK233: 0 | AL233: 1 | AM233: 0 | AN233: 0 | AO233: 0 | AP233: 0 | AQ233: 0 | AR233: 0 | AS233: 0 | AT233: 0 | AU233: 0 | AV233: 0 | AW233: 0 | AX233: 0
F234: 0 | G234: 0 | H234: 0 | I234: 0 | J234: 0 | K234: 0 | L234: 0 | M234: 0 | N234: 0 | O234: 0 | P234: 0 | Q234: 0 | R234: 0 | S234: 0 | T234: 0 | U234: 0 | V234: 0 | W234: 0 | X234: 0 | Y234: 0 | Z234: 0 | AA234: 0 | AB234: 0 | AC234: 0 | AD234: 0 | AE234: 0 | AF234: 0 | AG234: 0 | AH234: 0 | AI234: 0 | AJ234: 0 | AK234: 0 | AL234: 1 | AM234: 0 | AN234: 0 | AO234: 0 | AP234: 0 | AQ234: 0 | AR234: 0 | AS234: 0 | AT234: 0 | AU234: 0 | AV234: 0 | AW234: 0 | AX234: 0
F235: 0 | G235: 0 | H235: 0 | I235: 0 | J235: 0 | K235: 0 | L235: 0 | M235: 0 | N235: 0 | O235: 0 | P235: 0 | Q235: 0 | R235: 0 | S235: 0 | T235: 0 | U235: 0 | V235: 0 | W235: 0 | X235: 0 | Y235: 0 | Z235: 0 | AA235: 0 | AB235: 0 | AC235: 0 | AD235: 0 | AE235: 0 | AF235: 0 | AG235: 0 | AH235: 0 | AI235: 0 | AJ235: 0 | AK235: 0 | AL235: 1 | AM235: 0 | AN235: 0 | AO235: 0 | AP235: 0 | AQ235: 0 | AR235: 0 | AS235: 0 | AT235: 0 | AU235: 0 | AV235: 0 | AW235: 0 | AX235: 0
F236: 0 | G236: 0 | H236: 0 | I236: 0 | J236: 0 | K236: 0 | L236: 0 | M236: 0 | N236: 0 | O236: 0 | P236: 0 | Q236: 0 | R236: 0 | S236: 0 | T236: 0 | U236: 0 | V236: 0 | W236: 0 | X236: 0 | Y236: 0 | Z236: 0 | AA236: 0 | AB236: 0 | AC236: 0 | AD236: 0 | AE236: 0 | AF236: 0 | AG236: 0 | AH236: 0 | AI236: 0 | AJ236: 0 | AK236: 0 | AL236: 1 | AM236: 0 | AN236: 0 | AO236: 0 | AP236: 0 | AQ236: 0 | AR236: 0 | AS236: 0 | AT236: 0 | AU236: 0 | AV236: 0 | AW236: 0 | AX236: 0
F237: 0 | G237: 0 | H237: 0 | I237: 0 | J237: 0 | K237: 0 | L237: 0 | M237: 0 | N237: 0 | O237: 0 | P237: 0 | Q237: 0 | R237: 0 | S237: 0 | T237: 0 | U237: 0 | V237: 0 | W237: 0 | X237: 0 | Y237: 0 | Z237: 0 | AA237: 0 | AB237: 0 | AC237: 0 | AD237: 0 | AE237: 0 | AF237: 0 | AG237: 0 | AH237: 0 | AI237: 0 | AJ237: 0 | AK237: 0 | AL237: 1 | AM237: 0 | AN237: 0 | AO237: 0 | AP237: 0 | AQ237: 0 | AR237: 0 | AS237: 0 | AT237: 0 | AU237: 0 | AV237: 0 | AW237: 0 | AX237: 0
F238: 0 | G238: 0 | H238: 0 | I238: 0 | J238: 0 | K238: 0 | L238: 0 | M238: 0 | N238: 0 | O238: 0 | P238: 0 | Q238: 0 | R238: 0 | S238: 0 | T238: 0 | U238: 0 | V238: 0 | W238: 0 | X238: 0 | Y238: 0 | Z238: 0 | AA238: 0 | AB238: 0 | AC238: 0 | AD238: 0 | AE238: 0 | AF238: 0 | AG238: 0 | AH238: 0 | AI238: 0 | AJ238: 0 | AK238: 0 | AL238: 0 | AM238: 0 | AN238: 0 | AO238: 0 | AP238: 0 | AQ238: 0 | AR238: 0 | AS238: 0 | AT238: 1 | AU238: 0 | AV238: 0 | AW238: 0 | AX238: 0
F239: 0 | G239: 0 | H239: 0 | I239: 0 | J239: 0 | K239: 0 | L239: 0 | M239: 0 | N239: 0 | O239: 0 | P239: 0 | Q239: 0 | R239: 0 | S239: 0 | T239: 0 | U239: 0 | V239: 0 | W239: 0 | X239: 0 | Y239: 0 | Z239: 0 | AA239: 0 | AB239: 0 | AC239: 0 | AD239: 0 | AE239: 0 | AF239: 0 | AG239: 0 | AH239: 0 | AI239: 0 | AJ239: 0 | AK239: 0 | AL239: 0 | AM239: 0 | AN239: 0 | AO239: 0 | AP239: 0 | AQ239: 0 | AR239: 0 | AS239: 0 | AT239: 1 | AU239: 0 | AV239: 0 | AW239: 0 | AX239: 0
F240: 0 | G240: 0 | H240: 0 | I240: 0 | J240: 0 | K240: 0 | L240: 0 | M240: 0 | N240: 0 | O240: 0 | P240: 0 | Q240: 0 | R240: 0 | S240: 0 | T240: 0 | U240: 0 | V240: 0 | W240: 0 | X240: 0 | Y240: 0 | Z240: 0 | AA240: 0 | AB240: 0 | AC240: 0 | AD240: 0 | AE240: 0 | AF240: 0 | AG240: 0 | AH240: 0 | AI240: 0 | AJ240: 0 | AK240: 0 | AL240: 0 | AM240: 0 | AN240: 0 | AO240: 0 | AP240: 0 | AQ240: 0 | AR240: 0 | AS240: 0 | AT240: 1 | AU240: 0 | AV240: 0 | AW240: 0 | AX240: 0
F241: 0 | G241: 0 | H241: 0 | I241: 0 | J241: 0 | K241: 0 | L241: 0 | M241: 0 | N241: 0 | O241: 0 | P241: 0 | Q241: 0 | R241: 0 | S241: 0 | T241: 0 | U241: 0 | V241: 0 | W241: 0 | X241: 0 | Y241: 0 | Z241: 0 | AA241: 0 | AB241: 0 | AC241: 0 | AD241: 0 | AE241: 0 | AF241: 0 | AG241: 0 | AH241: 0 | AI241: 0 | AJ241: 0 | AK241: 0 | AL241: 0 | AM241: 0 | AN241: 0 | AO241: 0 | AP241: 0 | AQ241: 0 | AR241: 0 | AS241: 0 | AT241: 1 | AU241: 0 | AV241: 0 | AW241: 0 | AX241: 0
F242: 0 | G242: 0 | H242: 0 | I242: 0 | J242: 0 | K242: 0 | L242: 0 | M242: 0 | N242: 0 | O242: 0 | P242: 0 | Q242: 0 | R242: 0 | S242: 0 | T242: 0 | U242: 0 | V242: 0 | W242: 0 | X242: 0 | Y242: 0 | Z242: 0 | AA242: 0 | AB242: 0 | AC242: 0 | AD242: 0 | AE242: 0 | AF242: 0 | AG242: 0 | AH242: 0 | AI242: 0 | AJ242: 0 | AK242: 0 | AL242: 0 | AM242: 0 | AN242: 0 | AO242: 0 | AP242: 0 | AQ242: 0 | AR242: 0 | AS242: 0 | AT242: 1 | AU242: 0 | AV242: 0 | AW242: 0 | AX242: 0
F243: 0 | G243: 0 | H243: 0 | I243: 0 | J243: 0 | K243: 0 | L243: 0 | M243: 0 | N243: 0 | O243: 0 | P243: 0 | Q243: 0 | R243: 0 | S243: 0 | T243: 0 | U243: 0 | V243: 0 | W243: 0 | X243: 0 | Y243: 0 | Z243: 0 | AA243: 0 | AB243: 0 | AC243: 0 | AD243: 0 | AE243: 0 | AF243: 0 | AG243: 0 | AH243: 0 | AI243: 0 | AJ243: 0 | AK243: 0 | AL243: 0 | AM243: 0 | AN243: 0 | AO243: 1 | AP243: 0 | AQ243: 0 | AR243: 0 | AS243: 0 | AT243: 0 | AU243: 0 | AV243: 0 | AW243: 0 | AX243: 0
F244: 0 | G244: 0 | H244: 0 | I244: 0 | J244: 0 | K244: 0 | L244: 0 | M244: 0 | N244: 0 | O244: 0 | P244: 0 | Q244: 0 | R244: 0 | S244: 0 | T244: 0 | U244: 0 | V244: 0 | W244: 0 | X244: 0 | Y244: 0 | Z244: 0 | AA244: 0 | AB244: 0 | AC244: 0 | AD244: 0 | AE244: 0 | AF244: 0 | AG244: 0 | AH244: 0 | AI244: 0 | AJ244: 0 | AK244: 0 | AL244: 0 | AM244: 0 | AN244: 0 | AO244: 1 | AP244: 0 | AQ244: 0 | AR244: 0 | AS244: 0 | AT244: 0 | AU244: 0 | AV244: 0 | AW244: 0 | AX244: 0
F245: 0 | G245: 0 | H245: 0 | I245: 0 | J245: 0 | K245: 0 | L245: 0 | M245: 0 | N245: 0 | O245: 0 | P245: 0 | Q245: 0 | R245: 0 | S245: 0 | T245: 0 | U245: 0 | V245: 0 | W245: 0 | X245: 0 | Y245: 0 | Z245: 0 | AA245: 0 | AB245: 0 | AC245: 0 | AD245: 0 | AE245: 0 | AF245: 0 | AG245: 0 | AH245: 0 | AI245: 0 | AJ245: 0 | AK245: 0 | AL245: 0 | AM245: 0 | AN245: 0 | AO245: 1 | AP245: 0 | AQ245: 0 | AR245: 0 | AS245: 0 | AT245: 0 | AU245: 0 | AV245: 0 | AW245: 0 | AX245: 0
F246: 0 | G246: 0 | H246: 0 | I246: 0 | J246: 0 | K246: 0 | L246: 0 | M246: 0 | N246: 0 | O246: 0 | P246: 0 | Q246: 0 | R246: 0 | S246: 0 | T246: 0 | U246: 0 | V246: 0 | W246: 0 | X246: 0 | Y246: 0 | Z246: 0 | AA246: 0 | AB246: 0 | AC246: 0 | AD246: 0 | AE246: 0 | AF246: 0 | AG246: 0 | AH246: 0 | AI246: 0 | AJ246: 0 | AK246: 0 | AL246: 0 | AM246: 0 | AN246: 0 | AO246: 1 | AP246: 0 | AQ246: 0 | AR246: 0 | AS246: 0 | AT246: 0 | AU246: 0 | AV246: 0 | AW246: 0 | AX246: 0
F247: 0 | G247: 0 | H247: 0 | I247: 0 | J247: 0 | K247: 0 | L247: 0 | M247: 0 | N247: 0 | O247: 0 | P247: 0 | Q247: 0 | R247: 0 | S247: 0 | T247: 0 | U247: 0 | V247: 0 | W247: 0 | X247: 0 | Y247: 0 | Z247: 0 | AA247: 0 | AB247: 0 | AC247: 0 | AD247: 0 | AE247: 0 | AF247: 0 | AG247: 0 | AH247: 0 | AI247: 0 | AJ247: 0 | AK247: 0 | AL247: 0 | AM247: 0 | AN247: 0 | AO247: 1 | AP247: 0 | AQ247: 0 | AR247: 0 | AS247: 0 | AT247: 0 | AU247: 0 | AV247: 0 | AW247: 0 | AX247: 0
F248: 0 | G248: 0 | H248: 0 | I248: 0 | J248: 0 | K248: 0 | L248: 0 | M248: 0 | N248: 0 | O248: 0 | P248: 0 | Q248: 0 | R248: 0 | S248: 0 | T248: 0 | U248: 0 | V248: 0 | W248: 0 | X248: 0 | Y248: 0 | Z248: 0 | AA248: 0 | AB248: 0 | AC248: 0 | AD248: 0 | AE248: 0 | AF248: 0 | AG248: 0 | AH248: 0 | AI248: 0 | AJ248: 0 | AK248: 0 | AL248: 0 | AM248: 0 | AN248: 0 | AO248: 1 | AP248: 0 | AQ248: 0 | AR248: 0 | AS248: 0 | AT248: 0 | AU248: 0 | AV248: 0 | AW248: 0 | AX248: 0
F249: 0 | G249: 0 | H249: 0 | I249: 0 | J249: 0 | K249: 0 | L249: 0 | M249: 0 | N249: 0 | O249: 0 | P249: 0 | Q249: 0 | R249: 0 | S249: 0 | T249: 0 | U249: 0 | V249: 0 | W249: 0 | X249: 0 | Y249: 0 | Z249: 0 | AA249: 0 | AB249: 0 | AC249: 0 | AD249: 0 | AE249: 0 | AF249: 0 | AG249: 0 | AH249: 0 | AI249: 0 | AJ249: 0 | AK249: 0 | AL249: 0 | AM249: 0 | AN249: 0 | AO249: 1 | AP249: 0 | AQ249: 0 | AR249: 0 | AS249: 0 | AT249: 0 | AU249: 0 | AV249: 0 | AW249: 0 | AX249: 0
F250: 0 | G250: 0 | H250: 0 | I250: 0 | J250: 0 | K250: 0 | L250: 0 | M250: 0 | N250: 0 | O250: 0 | P250: 0 | Q250: 0 | R250: 0 | S250: 0 | T250: 0 | U250: 0 | V250: 0 | W250: 0 | X250: 0 | Y250: 0 | Z250: 0 | AA250: 0 | AB250: 0 | AC250: 0 | AD250: 0 | AE250: 0 | AF250: 0 | AG250: 0 | AH250: 0 | AI250: 0 | AJ250: 0 | AK250: 0 | AL250: 0 | AM250: 0 | AN250: 0 | AO250: 1 | AP250: 0 | AQ250: 0 | AR250: 0 | AS250: 0 | AT250: 0 | AU250: 0 | AV250: 0 | AW250: 0 | AX250: 0
F251: 0 | G251: 0 | H251: 0 | I251: 0 | J251: 0 | K251: 0 | L251: 0 | M251: 0 | N251: 0 | O251: 0 | P251: 0 | Q251: 0 | R251: 0 | S251: 0 | T251: 0 | U251: 0 | V251: 0 | W251: 0 | X251: 0 | Y251: 0 | Z251: 0 | AA251: 0 | AB251: 0 | AC251: 0 | AD251: 0 | AE251: 0 | AF251: 0 | AG251: 0 | AH251: 0 | AI251: 0 | AJ251: 0 | AK251: 0 | AL251: 0 | AM251: 0 | AN251: 0 | AO251: 1 | AP251: 0 | AQ251: 0 | AR251: 0 | AS251: 0 | AT251: 0 | AU251: 0 | AV251: 0 | AW251: 0 | AX251: 0
F252: 0 | G252: 0 | H252: 0 | I252: 0 | J252: 0 | K252: 0 | L252: 0 | M252: 0 | N252: 0 | O252: 0 | P252: 0 | Q252: 0 | R252: 0 | S252: 0 | T252: 0 | U252: 0 | V252: 0 | W252: 0 | X252: 0 | Y252: 0 | Z252: 0 | AA252: 0 | AB252: 0 | AC252: 0 | AD252: 0 | AE252: 0 | AF252: 0 | AG252: 0 | AH252: 0 | AI252: 0 | AJ252: 0 | AK252: 0 | AL252: 0 | AM252: 0 | AN252: 0 | AO252: 1 | AP252: 0 | AQ252: 0 | AR252: 0 | AS252: 0 | AT252: 0 | AU252: 0 | AV252: 0 | AW252: 0 | AX252: 0
F253: 0 | G253: 0 | H253: 0 | I253: 0 | J253: 0 | K253: 0 | L253: 0 | M253: 0 | N253: 0 | O253: 0 | P253: 0 | Q253: 0 | R253: 0 | S253: 0 | T253: 0 | U253: 0 | V253: 0 | W253: 0 | X253: 0 | Y253: 0 | Z253: 0 | AA253: 0 | AB253: 0 | AC253: 0 | AD253: 0 | AE253: 0 | AF253: 0 | AG253: 0 | AH253: 0 | AI253: 0 | AJ253: 0 | AK253: 0 | AL253: 0 | AM253: 0 | AN253: 0 | AO253: 1 | AP253: 0 | AQ253: 0 | AR253: 0 | AS253: 0 | AT253: 0 | AU253: 0 | AV253: 0 | AW253: 0 | AX253: 0
F254: 0 | G254: 0 | H254: 0 | I254: 0 | J254: 0 | K254: 0 | L254: 0 | M254: 0 | N254: 0 | O254: 0 | P254: 0 | Q254: 0 | R254: 0 | S254: 0 | T254: 0 | U254: 0 | V254: 0 | W254: 0 | X254: 0 | Y254: 0 | Z254: 0 | AA254: 0 | AB254: 0 | AC254: 0 | AD254: 0 | AE254: 0 | AF254: 0 | AG254: 0 | AH254: 0 | AI254: 0 | AJ254: 0 | AK254: 0 | AL254: 0 | AM254: 0 | AN254: 0 | AO254: 1 | AP254: 0 | AQ254: 0 | AR254: 0 | AS254: 0 | AT254: 0 | AU254: 0 | AV254: 0 | AW254: 0 | AX254: 0
F255: 0 | G255: 0 | H255: 0 | I255: 0 | J255: 0 | K255: 0 | L255: 0 | M255: 0 | N255: 0 | O255: 0 | P255: 0 | Q255: 0 | R255: 0 | S255: 0 | T255: 0 | U255: 0 | V255: 0 | W255: 0 | X255: 0 | Y255: 0 | Z255: 0 | AA255: 0 | AB255: 0 | AC255: 0 | AD255: 0 | AE255: 0 | AF255: 0 | AG255: 0 | AH255: 0 | AI255: 0 | AJ255: 0 | AK255: 0 | AL255: 0 | AM255: 0 | AN255: 0 | AO255: 1 | AP255: 0 | AQ255: 0 | AR255: 0 | AS255: 0 | AT255: 0 | AU255: 0 | AV255: 0 | AW255: 0 | AX255: 0
F256: 0 | G256: 0 | H256: 0 | I256: 0 | J256: 0 | K256: 0 | L256: 0 | M256: 0 | N256: 0 | O256: 0 | P256: 0 | Q256: 0 | R256: 0 | S256: 0 | T256: 0 | U256: 0 | V256: 0 | W256: 0 | X256: 0 | Y256: 0 | Z256: 0 | AA256: 0 | AB256: 0 | AC256: 0 | AD256: 0 | AE256: 0 | AF256: 0 | AG256: 0 | AH256: 0 | AI256: 0 | AJ256: 0 | AK256: 0 | AL256: 0 | AM256: 0 | AN256: 0 | AO256: 1 | AP256: 0 | AQ256: 0 | AR256: 0 | AS256: 0 | AT256: 0 | AU256: 0 | AV256: 0 | AW256: 0 | AX256: 0
F257: 0 | G257: 0 | H257: 0 | I257: 0 | J257: 0 | K257: 0 | L257: 0 | M257: 0 | N257: 0 | O257: 0 | P257: 0 | Q257: 0 | R257: 0 | S257: 0 | T257: 0 | U257: 0 | V257: 0 | W257: 0 | X257: 0 | Y257: 0 | Z257: 0 | AA257: 0 | AB257: 0 | AC257: 0 | AD257: 0 | AE257: 0 | AF257: 0 | AG257: 0 | AH257: 0 | AI257: 0 | AJ257: 0 | AK257: 0 | AL257: 0 | AM257: 0 | AN257: 0 | AO257: 1 | AP257: 0 | AQ257: 0 | AR257: 0 | AS257: 0 | AT257: 0 | AU257: 0 | AV257: 0 | AW257: 0 | AX257: 0
F258: 0 | G258: 0 | H258: 0 | I258: 0 | J258: 0 | K258: 0 | L258: 0 | M258: 0 | N258: 0 | O258: 0 | P258: 0 | Q258: 0 | R258: 0 | S258: 0 | T258: 0 | U258: 0 | V258: 0 | W258: 0 | X258: 0 | Y258: 0 | Z258: 0 | AA258: 0 | AB258: 0 | AC258: 0 | AD258: 0 | AE258: 0 | AF258: 0 | AG258: 0 | AH258: 0 | AI258: 0 | AJ258: 0 | AK258: 0 | AL258: 0 | AM258: 0 | AN258: 0 | AO258: 1 | AP258: 0 | AQ258: 0 | AR258: 0 | AS258: 0 | AT258: 0 | AU258: 0 | AV258: 0 | AW258: 0 | AX258: 0
F259: 0 | G259: 0 | H259: 0 | I259: 0 | J259: 0 | K259: 0 | L259: 0 | M259: 0 | N259: 0 | O259: 0 | P259: 0 | Q259: 0 | R259: 0 | S259: 0 | T259: 0 | U259: 0 | V259: 0 | W259: 0 | X259: 0 | Y259: 0 | Z259: 0 | AA259: 0 | AB259: 0 | AC259: 0 | AD259: 0 | AE259: 0 | AF259: 0 | AG259: 0 | AH259: 0 | AI259: 0 | AJ259: 0 | AK259: 0 | AL259: 0 | AM259: 0 | AN259: 0 | AO259: 1 | AP259: 0 | AQ259: 0 | AR259: 0 | AS259: 0 | AT259: 0 | AU259: 0 | AV259: 0 | AW259: 0 | AX259: 0
F260: 0 | G260: 0 | H260: 0 | I260: 0 | J260: 0 | K260: 0 | L260: 0 | M260: 0 | N260: 0 | O260: 0 | P260: 0 | Q260: 0 | R260: 0 | S260: 0 | T260: 0 | U260: 0 | V260: 0 | W260: 0 | X260: 0 | Y260: 0 | Z260: 0 | AA260: 0 | AB260: 0 | AC260: 0 | AD260: 0 | AE260: 0 | AF260: 0 | AG260: 0 | AH260: 0 | AI260: 0 | AJ260: 0 | AK260: 0 | AL260: 0 | AM260: 0 | AN260: 0 | AO260: 1 | AP260: 0 | AQ260: 0 | AR260: 0 | AS260: 0 | AT260: 0 | AU260: 0 | AV260: 0 | AW260: 0 | AX260: 0
F261: 0 | G261: 0 | H261: 0 | I261: 0 | J261: 0 | K261: 0 | L261: 0 | M261: 0 | N261: 0 | O261: 0 | P261: 0 | Q261: 0 | R261: 0 | S261: 0 | T261: 0 | U261: 0 | V261: 0 | W261: 0 | X261: 0 | Y261: 0 | Z261: 0 | AA261: 0 | AB261: 0 | AC261: 0 | AD261: 0 | AE261: 0 | AF261: 0 | AG261: 0 | AH261: 0 | AI261: 0 | AJ261: 0 | AK261: 0 | AL261: 0 | AM261: 0 | AN261: 0 | AO261: 1 | AP261: 0 | AQ261: 0 | AR261: 0 | AS261: 0 | AT261: 0 | AU261: 0 | AV261: 0 | AW261: 0 | AX261: 0
F262: 0 | G262: 0 | H262: 0 | I262: 0 | J262: 0 | K262: 0 | L262: 0 | M262: 0 | N262: 0 | O262: 0 | P262: 0 | Q262: 0 | R262: 0 | S262: 0 | T262: 0 | U262: 0 | V262: 0 | W262: 0 | X262: 0 | Y262: 0 | Z262: 0 | AA262: 0 | AB262: 0 | AC262: 0 | AD262: 0 | AE262: 0 | AF262: 0 | AG262: 0 | AH262: 0 | AI262: 0 | AJ262: 0 | AK262: 0 | AL262: 0 | AM262: 0 | AN262: 0 | AO262: 1 | AP262: 0 | AQ262: 0 | AR262: 0 | AS262: 0 | AT262: 0 | AU262: 0 | AV262: 0 | AW262: 0 | AX262: 0
F263: 0 | G263: 0 | H263: 0 | I263: 0 | J263: 0 | K263: 0 | L263: 0 | M263: 0 | N263: 0 | O263: 0 | P263: 0 | Q263: 0 | R263: 0 | S263: 0 | T263: 0 | U263: 0 | V263: 0 | W263: 0 | X263: 0 | Y263: 0 | Z263: 0 | AA263: 0 | AB263: 0 | AC263: 0 | AD263: 0 | AE263: 0 | AF263: 0 | AG263: 0 | AH263: 0 | AI263: 0 | AJ263: 0 | AK263: 0 | AL263: 0 | AM263: 0 | AN263: 0 | AO263: 1 | AP263: 0 | AQ263: 0 | AR263: 0 | AS263: 0 | AT263: 0 | AU263: 0 | AV263: 0 | AW263: 0 | AX263: 0
F264: 0 | G264: 0 | H264: 0 | I264: 0 | J264: 0 | K264: 0 | L264: 0 | M264: 0 | N264: 0 | O264: 0 | P264: 0 | Q264: 0 | R264: 0 | S264: 0 | T264: 0 | U264: 0 | V264: 0 | W264: 0 | X264: 0 | Y264: 0 | Z264: 0 | AA264: 0 | AB264: 0 | AC264: 0 | AD264: 0 | AE264: 0 | AF264: 0 | AG264: 0 | AH264: 0 | AI264: 0 | AJ264: 0 | AK264: 0 | AL264: 0 | AM264: 0 | AN264: 0 | AO264: 1 | AP264: 0 | AQ264: 0 | AR264: 0 | AS264: 0 | AT264: 0 | AU264: 0 | AV264: 0 | AW264: 0 | AX264: 0
F265: 0 | G265: 0 | H265: 0 | I265: 0 | J265: 0 | K265: 0 | L265: 0 | M265: 0 | N265: 0 | O265: 0 | P265: 0 | Q265: 0 | R265: 0 | S265: 0 | T265: 0 | U265: 0 | V265: 0 | W265: 0 | X265: 0 | Y265: 0 | Z265: 0 | AA265: 0 | AB265: 0 | AC265: 0 | AD265: 0 | AE265: 0 | AF265: 0 | AG265: 0 | AH265: 0 | AI265: 0 | AJ265: 0 | AK265: 0 | AL265: 0 | AM265: 0 | AN265: 0 | AO265: 1 | AP265: 0 | AQ265: 0 | AR265: 0 | AS265: 0 | AT265: 0 | AU265: 0 | AV265: 0 | AW265: 0 | AX265: 0
F266: 0 | G266: 0 | H266: 0 | I266: 0 | J266: 0 | K266: 0 | L266: 0 | M266: 0 | N266: 0 | O266: 0 | P266: 0 | Q266: 0 | R266: 0 | S266: 0 | T266: 0 | U266: 0 | V266: 0 | W266: 0 | X266: 0 | Y266: 0 | Z266: 0 | AA266: 0 | AB266: 0 | AC266: 0 | AD266: 0 | AE266: 0 | AF266: 0 | AG266: 0 | AH266: 0 | AI266: 0 | AJ266: 0 | AK266: 0 | AL266: 0 | AM266: 0 | AN266: 0 | AO266: 1 | AP266: 0 | AQ266: 0 | AR266: 0 | AS266: 0 | AT266: 0 | AU266: 0 | AV266: 0 | AW266: 0 | AX266: 0
F267: 0 | G267: 0 | H267: 0 | I267: 0 | J267: 0 | K267: 0 | L267: 0 | M267: 0 | N267: 0 | O267: 0 | P267: 0 | Q267: 0 | R267: 0 | S267: 0 | T267: 0 | U267: 0 | V267: 0 | W267: 0 | X267: 0 | Y267: 0 | Z267: 0 | AA267: 0 | AB267: 0 | AC267: 0 | AD267: 0 | AE267: 0 | AF267: 0 | AG267: 0 | AH267: 0 | AI267: 0 | AJ267: 0 | AK267: 0 | AL267: 0 | AM267: 0 | AN267: 0 | AO267: 1 | AP267: 0 | AQ267: 0 | AR267: 0 | AS267: 0 | AT267: 0 | AU267: 0 | AV267: 0 | AW267: 0 | AX267: 0
F268: 0 | G268: 0 | H268: 0 | I268: 0 | J268: 0 | K268: 0 | L268: 0 | M268: 0 | N268: 0 | O268: 0 | P268: 0 | Q268: 0 | R268: 0 | S268: 0 | T268: 0 | U268: 0 | V268: 0 | W268: 0 | X268: 0 | Y268: 0 | Z268: 0 | AA268: 0 | AB268: 0 | AC268: 0 | AD268: 0 | AE268: 0 | AF268: 0 | AG268: 0 | AH268: 0 | AI268: 0 | AJ268: 0 | AK268: 0 | AL268: 0 | AM268: 0 | AN268: 0 | AO268: 1 | AP268: 0 | AQ268: 0 | AR268: 0 | AS268: 0 | AT268: 0 | AU268: 0 | AV268: 0 | AW268: 0 | AX268: 0
F269: 0 | G269: 0 | H269: 0 | I269: 0 | J269: 0 | K269: 0 | L269: 0 | M269: 0 | N269: 0 | O269: 0 | P269: 0 | Q269: 0 | R269: 0 | S269: 0 | T269: 0 | U269: 0 | V269: 0 | W269: 0 | X269: 0 | Y269: 0 | Z269: 0 | AA269: 0 | AB269: 0 | AC269: 0 | AD269: 0 | AE269: 0 | AF269: 0 | AG269: 0 | AH269: 0 | AI269: 0 | AJ269: 0 | AK269: 0 | AL269: 0 | AM269: 0 | AN269: 0 | AO269: 1 | AP269: 0 | AQ269: 0 | AR269: 0 | AS269: 0 | AT269: 0 | AU269: 0 | AV269: 0 | AW269: 0 | AX269: 0
F270: 0 | G270: 0 | H270: 0 | I270: 0 | J270: 0 | K270: 0 | L270: 0 | M270: 0 | N270: 0 | O270: 0 | P270: 0 | Q270: 0 | R270: 0 | S270: 0 | T270: 0 | U270: 0 | V270: 0 | W270: 0 | X270: 0 | Y270: 0 | Z270: 0 | AA270: 0 | AB270: 0 | AC270: 0 | AD270: 0 | AE270: 0 | AF270: 0 | AG270: 0 | AH270: 0 | AI270: 0 | AJ270: 0 | AK270: 0 | AL270: 0 | AM270: 0 | AN270: 0 | AO270: 1 | AP270: 0 | AQ270: 0 | AR270: 0 | AS270: 0 | AT270: 0 | AU270: 0 | AV270: 0 | AW270: 0 | AX270: 0
F271: 0 | G271: 0 | H271: 0 | I271: 0 | J271: 0 | K271: 0 | L271: 0 | M271: 0 | N271: 0 | O271: 0 | P271: 0 | Q271: 0 | R271: 0 | S271: 0 | T271: 0 | U271: 0 | V271: 0 | W271: 0 | X271: 0 | Y271: 0 | Z271: 0 | AA271: 0 | AB271: 0 | AC271: 0 | AD271: 0 | AE271: 0 | AF271: 0 | AG271: 0 | AH271: 0 | AI271: 0 | AJ271: 0 | AK271: 0 | AL271: 0 | AM271: 0 | AN271: 0 | AO271: 1 | AP271: 0 | AQ271: 0 | AR271: 0 | AS271: 0 | AT271: 0 | AU271: 0 | AV271: 0 | AW271: 0 | AX271: 0
F272: 0 | G272: 0 | H272: 0 | I272: 0 | J272: 0 | K272: 0 | L272: 0 | M272: 0 | N272: 0 | O272: 0 | P272: 0 | Q272: 0 | R272: 0 | S272: 0 | T272: 0 | U272: 0 | V272: 0 | W272: 0 | X272: 0 | Y272: 0 | Z272: 0 | AA272: 0 | AB272: 0 | AC272: 0 | AD272: 0 | AE272: 0 | AF272: 0 | AG272: 0 | AH272: 0 | AI272: 0 | AJ272: 0 | AK272: 0 | AL272: 0 | AM272: 0 | AN272: 0 | AO272: 1 | AP272: 0 | AQ272: 0 | AR272: 0 | AS272: 0 | AT272: 0 | AU272: 0 | AV272: 0 | AW272: 0 | AX272: 0
F273: 0 | G273: 0 | H273: 0 | I273: 0 | J273: 0 | K273: 0 | L273: 0 | M273: 0 | N273: 0 | O273: 0 | P273: 0 | Q273: 0 | R273: 0 | S273: 0 | T273: 0 | U273: 0 | V273: 0 | W273: 0 | X273: 0 | Y273: 0 | Z273: 0 | AA273: 0 | AB273: 0 | AC273: 0 | AD273: 0 | AE273: 0 | AF273: 0 | AG273: 0 | AH273: 0 | AI273: 0 | AJ273: 0 | AK273: 0 | AL273: 0 | AM273: 0 | AN273: 0 | AO273: 0 | AP273: 1 | AQ273: 0 | AR273: 0 | AS273: 0 | AT273: 0 | AU273: 0 | AV273: 0 | AW273: 0 | AX273: 0
F274: 0 | G274: 0 | H274: 0 | I274: 0 | J274: 0 | K274: 0 | L274: 0 | M274: 0 | N274: 0 | O274: 0 | P274: 0 | Q274: 0 | R274: 0 | S274: 0 | T274: 0 | U274: 0 | V274: 0 | W274: 0 | X274: 0 | Y274: 0 | Z274: 0 | AA274: 0 | AB274: 0 | AC274: 0 | AD274: 0 | AE274: 0 | AF274: 0 | AG274: 0 | AH274: 0 | AI274: 0 | AJ274: 0 | AK274: 0 | AL274: 0 | AM274: 0 | AN274: 0 | AO274: 0 | AP274: 1 | AQ274: 0 | AR274: 0 | AS274: 0 | AT274: 0 | AU274: 0 | AV274: 0 | AW274: 0 | AX274: 0
F275: 0 | G275: 0 | H275: 0 | I275: 0 | J275: 0 | K275: 0 | L275: 0 | M275: 0 | N275: 0 | O275: 0 | P275: 0 | Q275: 0 | R275: 0 | S275: 0 | T275: 0 | U275: 0 | V275: 0 | W275: 0 | X275: 0 | Y275: 0 | Z275: 0 | AA275: 0 | AB275: 0 | AC275: 0 | AD275: 0 | AE275: 0 | AF275: 0 | AG275: 0 | AH275: 0 | AI275: 0 | AJ275: 0 | AK275: 0 | AL275: 0 | AM275: 0 | AN275: 0 | AO275: 0 | AP275: 1 | AQ275: 0 | AR275: 0 | AS275: 0 | AT275: 0 | AU275: 0 | AV275: 0 | AW275: 0 | AX275: 0
F276: 0 | G276: 0 | H276: 0 | I276: 0 | J276: 0 | K276: 0 | L276: 0 | M276: 0 | N276: 0 | O276: 0 | P276: 0 | Q276: 0 | R276: 0 | S276: 0 | T276: 0 | U276: 0 | V276: 0 | W276: 0 | X276: 0 | Y276: 0 | Z276: 0 | AA276: 0 | AB276: 0 | AC276: 0 | AD276: 0 | AE276: 0 | AF276: 0 | AG276: 0 | AH276: 0 | AI276: 0 | AJ276: 0 | AK276: 0 | AL276: 0 | AM276: 0 | AN276: 0 | AO276: 0 | AP276: 1 | AQ276: 0 | AR276: 0 | AS276: 0 | AT276: 0 | AU276: 0 | AV276: 0 | AW276: 0 | AX276: 0
F277: 0 | G277: 0 | H277: 0 | I277: 0 | J277: 0 | K277: 0 | L277: 0 | M277: 0 | N277: 0 | O277: 0 | P277: 0 | Q277: 0 | R277: 0 | S277: 0 | T277: 0 | U277: 0 | V277: 0 | W277: 0 | X277: 0 | Y277: 0 | Z277: 0 | AA277: 0 | AB277: 0 | AC277: 0 | AD277: 0 | AE277: 0 | AF277: 0 | AG277: 0 | AH277: 0 | AI277: 0 | AJ277: 0 | AK277: 0 | AL277: 0 | AM277: 0 | AN277: 0 | AO277: 0 | AP277: 1 | AQ277: 0 | AR277: 0 | AS277: 0 | AT277: 0 | AU277: 0 | AV277: 0 | AW277: 0 | AX277: 0
F278: 0 | G278: 0 | H278: 0 | I278: 0 | J278: 0 | K278: 0 | L278: 0 | M278: 0 | N278: 0 | O278: 0 | P278: 0 | Q278: 0 | R278: 0 | S278: 0 | T278: 0 | U278: 0 | V278: 0 | W278: 0 | X278: 0 | Y278: 0 | Z278: 0 | AA278: 0 | AB278: 0 | AC278: 0 | AD278: 0 | AE278: 0 | AF278: 0 | AG278: 0 | AH278: 0 | AI278: 0 | AJ278: 0 | AK278: 0 | AL278: 0 | AM278: 0 | AN278: 0 | AO278: 0 | AP278: 1 | AQ278: 0 | AR278: 0 | AS278: 0 | AT278: 0 | AU278: 0 | AV278: 0 | AW278: 0 | AX278: 0
F279: 0 | G279: 0 | H279: 0 | I279: 0 | J279: 0 | K279: 0 | L279: 0 | M279: 0 | N279: 0 | O279: 0 | P279: 0 | Q279: 0 | R279: 0 | S279: 0 | T279: 0 | U279: 0 | V279: 0 | W279: 0 | X279: 0 | Y279: 0 | Z279: 0 | AA279: 0 | AB279: 0 | AC279: 0 | AD279: 0 | AE279: 0 | AF279: 0 | AG279: 0 | AH279: 0 | AI279: 0 | AJ279: 0 | AK279: 0 | AL279: 0 | AM279: 0 | AN279: 0 | AO279: 0 | AP279: 1 | AQ279: 0 | AR279: 0 | AS279: 0 | AT279: 0 | AU279: 0 | AV279: 0 | AW279: 0 | AX279: 0
F280: 0 | G280: 0 | H280: 0 | I280: 0 | J280: 0 | K280: 0 | L280: 0 | M280: 0 | N280: 0 | O280: 0 | P280: 0 | Q280: 0 | R280: 0 | S280: 0 | T280: 0 | U280: 0 | V280: 0 | W280: 0 | X280: 0 | Y280: 0 | Z280: 0 | AA280: 0 | AB280: 0 | AC280: 0 | AD280: 0 | AE280: 0 | AF280: 0 | AG280: 0 | AH280: 0 | AI280: 0 | AJ280: 0 | AK280: 0 | AL280: 0 | AM280: 0 | AN280: 0 | AO280: 0 | AP280: 1 | AQ280: 0 | AR280: 0 | AS280: 0 | AT280: 0 | AU280: 0 | AV280: 0 | AW280: 0 | AX280: 0
F281: 0 | G281: 0 | H281: 0 | I281: 0 | J281: 0 | K281: 0 | L281: 0 | M281: 0 | N281: 0 | O281: 0 | P281: 0 | Q281: 0 | R281: 0 | S281: 0 | T281: 0 | U281: 0 | V281: 0 | W281: 0 | X281: 0 | Y281: 0 | Z281: 0 | AA281: 0 | AB281: 0 | AC281: 0 | AD281: 0 | AE281: 0 | AF281: 0 | AG281: 0 | AH281: 0 | AI281: 0 | AJ281: 0 | AK281: 0 | AL281: 0 | AM281: 0 | AN281: 0 | AO281: 0 | AP281: 1 | AQ281: 0 | AR281: 0 | AS281: 0 | AT281: 0 | AU281: 0 | AV281: 0 | AW281: 0 | AX281: 0
F282: 0 | G282: 0 | H282: 0 | I282: 0 | J282: 0 | K282: 0 | L282: 0 | M282: 0 | N282: 0 | O282: 0 | P282: 0 | Q282: 0 | R282: 0 | S282: 0 | T282: 0 | U282: 0 | V282: 0 | W282: 0 | X282: 0 | Y282: 0 | Z282: 0 | AA282: 0 | AB282: 0 | AC282: 0 | AD282: 0 | AE282: 0 | AF282: 0 | AG282: 0 | AH282: 0 | AI282: 0 | AJ282: 0 | AK282: 0 | AL282: 0 | AM282: 0 | AN282: 0 | AO282: 0 | AP282: 1 | AQ282: 0 | AR282: 0 | AS282: 0 | AT282: 0 | AU282: 0 | AV282: 0 | AW282: 0 | AX282: 0
F283: 0 | G283: 0 | H283: 0 | I283: 0 | J283: 0 | K283: 0 | L283: 0 | M283: 0 | N283: 0 | O283: 0 | P283: 0 | Q283: 0 | R283: 0 | S283: 0 | T283: 0 | U283: 0 | V283: 0 | W283: 0 | X283: 0 | Y283: 0 | Z283: 0 | AA283: 0 | AB283: 0 | AC283: 0 | AD283: 0 | AE283: 0 | AF283: 0 | AG283: 0 | AH283: 0 | AI283: 0 | AJ283: 0 | AK283: 0 | AL283: 0 | AM283: 0 | AN283: 0 | AO283: 0 | AP283: 1 | AQ283: 0 | AR283: 0 | AS283: 0 | AT283: 0 | AU283: 0 | AV283: 0 | AW283: 0 | AX283: 0
F284: 0 | G284: 0 | H284: 0 | I284: 0 | J284: 0 | K284: 0 | L284: 0 | M284: 0 | N284: 0 | O284: 0 | P284: 0 | Q284: 0 | R284: 0 | S284: 0 | T284: 0 | U284: 0 | V284: 0 | W284: 0 | X284: 0 | Y284: 0 | Z284: 0 | AA284: 0 | AB284: 0 | AC284: 0 | AD284: 0 | AE284: 0 | AF284: 0 | AG284: 0 | AH284: 0 | AI284: 0 | AJ284: 0 | AK284: 0 | AL284: 0 | AM284: 0 | AN284: 0 | AO284: 0 | AP284: 1 | AQ284: 0 | AR284: 0 | AS284: 0 | AT284: 0 | AU284: 0 | AV284: 0 | AW284: 0 | AX284: 0
F285: 0 | G285: 0 | H285: 0 | I285: 0 | J285: 0 | K285: 0 | L285: 0 | M285: 0 | N285: 0 | O285: 0 | P285: 0 | Q285: 0 | R285: 0 | S285: 0 | T285: 0 | U285: 0 | V285: 0 | W285: 0 | X285: 0 | Y285: 0 | Z285: 0 | AA285: 0 | AB285: 0 | AC285: 0 | AD285: 0 | AE285: 0 | AF285: 0 | AG285: 0 | AH285: 0 | AI285: 0 | AJ285: 0 | AK285: 0 | AL285: 0 | AM285: 0 | AN285: 0 | AO285: 0 | AP285: 0 | AQ285: 1 | AR285: 0 | AS285: 0 | AT285: 0 | AU285: 0 | AV285: 0 | AW285: 0 | AX285: 0
F286: 0 | G286: 0 | H286: 0 | I286: 0 | J286: 0 | K286: 0 | L286: 0 | M286: 0 | N286: 0 | O286: 0 | P286: 0 | Q286: 0 | R286: 0 | S286: 0 | T286: 0 | U286: 0 | V286: 0 | W286: 0 | X286: 0 | Y286: 0 | Z286: 0 | AA286: 0 | AB286: 0 | AC286: 0 | AD286: 0 | AE286: 0 | AF286: 0 | AG286: 0 | AH286: 0 | AI286: 0 | AJ286: 0 | AK286: 0 | AL286: 0 | AM286: 0 | AN286: 0 | AO286: 0 | AP286: 0 | AQ286: 1 | AR286: 0 | AS286: 0 | AT286: 0 | AU286: 0 | AV286: 0 | AW286: 0 | AX286: 0
F287: 0 | G287: 0 | H287: 0 | I287: 0 | J287: 0 | K287: 0 | L287: 0 | M287: 0 | N287: 0 | O287: 0 | P287: 0 | Q287: 0 | R287: 0 | S287: 0 | T287: 0 | U287: 0 | V287: 0 | W287: 0 | X287: 0 | Y287: 0 | Z287: 0 | AA287: 0 | AB287: 0 | AC287: 0 | AD287: 0 | AE287: 0 | AF287: 0 | AG287: 0 | AH287: 0 | AI287: 0 | AJ287: 0 | AK287: 0 | AL287: 0 | AM287: 0 | AN287: 0 | AO287: 0 | AP287: 0 | AQ287: 1 | AR287: 0 | AS287: 0 | AT287: 0 | AU287: 0 | AV287: 0 | AW287: 0 | AX287: 0
F288: 0 | G288: 0 | H288: 0 | I288: 0 | J288: 0 | K288: 0 | L288: 0 | M288: 0 | N288: 0 | O288: 0 | P288: 0 | Q288: 0 | R288: 0 | S288: 0 | T288: 0 | U288: 0 | V288: 0 | W288: 0 | X288: 0 | Y288: 0 | Z288: 0 | AA288: 0 | AB288: 0 | AC288: 0 | AD288: 0 | AE288: 0 | AF288: 0 | AG288: 0 | AH288: 0 | AI288: 0 | AJ288: 0 | AK288: 0 | AL288: 0 | AM288: 0 | AN288: 0 | AO288: 0 | AP288: 0 | AQ288: 1 | AR288: 0 | AS288: 0 | AT288: 0 | AU288: 0 | AV288: 0 | AW288: 0 | AX288: 0
F289: 0 | G289: 0 | H289: 0 | I289: 0 | J289: 0 | K289: 0 | L289: 0 | M289: 0 | N289: 0 | O289: 0 | P289: 0 | Q289: 0 | R289: 0 | S289: 0 | T289: 0 | U289: 0 | V289: 0 | W289: 0 | X289: 0 | Y289: 0 | Z289: 0 | AA289: 0 | AB289: 0 | AC289: 0 | AD289: 0 | AE289: 0 | AF289: 0 | AG289: 0 | AH289: 0 | AI289: 0 | AJ289: 0 | AK289: 0 | AL289: 0 | AM289: 0 | AN289: 0 | AO289: 0 | AP289: 0 | AQ289: 1 | AR289: 0 | AS289: 0 | AT289: 0 | AU289: 0 | AV289: 0 | AW289: 0 | AX289: 0
F290: 0 | G290: 0 | H290: 0 | I290: 0 | J290: 0 | K290: 0 | L290: 0 | M290: 0 | N290: 0 | O290: 0 | P290: 0 | Q290: 0 | R290: 0 | S290: 0 | T290: 0 | U290: 0 | V290: 0 | W290: 0 | X290: 0 | Y290: 0 | Z290: 0 | AA290: 0 | AB290: 0 | AC290: 0 | AD290: 0 | AE290: 0 | AF290: 0 | AG290: 0 | AH290: 0 | AI290: 0 | AJ290: 0 | AK290: 0 | AL290: 0 | AM290: 0 | AN290: 0 | AO290: 0 | AP290: 0 | AQ290: 1 | AR290: 0 | AS290: 0 | AT290: 0 | AU290: 0 | AV290: 0 | AW290: 0 | AX290: 0
F291: 0 | G291: 0 | H291: 0 | I291: 0 | J291: 0 | K291: 0 | L291: 1 | M291: 0 | N291: 0 | O291: 0 | P291: 0 | Q291: 0 | R291: 0 | S291: 0 | T291: 0 | U291: 0 | V291: 0 | W291: 0 | X291: 0 | Y291: 0 | Z291: 0 | AA291: 0 | AB291: 0 | AC291: 0 | AD291: 0 | AE291: 0 | AF291: 0 | AG291: 0 | AH291: 0 | AI291: 0 | AJ291: 0 | AK291: 0 | AL291: 0 | AM291: 0 | AN291: 0 | AO291: 0 | AP291: 0 | AQ291: 0 | AR291: 0 | AS291: 0 | AT291: 0 | AU291: 0 | AV291: 0 | AW291: 0 | AX291: 0
F292: 0 | G292: 0 | H292: 0 | I292: 0 | J292: 0 | K292: 0 | L292: 1 | M292: 0 | N292: 0 | O292: 0 | P292: 0 | Q292: 0 | R292: 0 | S292: 0 | T292: 0 | U292: 0 | V292: 0 | W292: 0 | X292: 0 | Y292: 0 | Z292: 0 | AA292: 0 | AB292: 0 | AC292: 0 | AD292: 0 | AE292: 0 | AF292: 0 | AG292: 0 | AH292: 0 | AI292: 0 | AJ292: 0 | AK292: 0 | AL292: 0 | AM292: 0 | AN292: 0 | AO292: 0 | AP292: 0 | AQ292: 0 | AR292: 0 | AS292: 0 | AT292: 0 | AU292: 0 | AV292: 0 | AW292: 0 | AX292: 0
F293: 0 | G293: 0 | H293: 0 | I293: 0 | J293: 0 | K293: 0 | L293: 1 | M293: 0 | N293: 0 | O293: 0 | P293: 0 | Q293: 0 | R293: 0 | S293: 0 | T293: 0 | U293: 0 | V293: 0 | W293: 0 | X293: 0 | Y293: 0 | Z293: 0 | AA293: 0 | AB293: 0 | AC293: 0 | AD293: 0 | AE293: 0 | AF293: 0 | AG293: 0 | AH293: 0 | AI293: 0 | AJ293: 0 | AK293: 0 | AL293: 0 | AM293: 0 | AN293: 0 | AO293: 0 | AP293: 0 | AQ293: 0 | AR293: 0 | AS293: 0 | AT293: 0 | AU293: 0 | AV293: 0 | AW293: 0 | AX293: 0
F294: 0 | G294: 0 | H294: 0 | I294: 0 | J294: 0 | K294: 0 | L294: 0 | M294: 0 | N294: 0 | O294: 0 | P294: 0 | Q294: 0 | R294: 0 | S294: 0 | T294: 0 | U294: 0 | V294: 0 | W294: 0 | X294: 0 | Y294: 0 | Z294: 0 | AA294: 0 | AB294: 0 | AC294: 0 | AD294: 0 | AE294: 0 | AF294: 0 | AG294: 0 | AH294: 0 | AI294: 0 | AJ294: 0 | AK294: 0 | AL294: 0 | AM294: 0 | AN294: 0 | AO294: 0 | AP294: 0 | AQ294: 0 | AR294: 0 | AS294: 1 | AT294: 0 | AU294: 0 | AV294: 0 | AW294: 0 | AX294: 0
F295: 0 | G295: 0 | H295: 0 | I295: 0 | J295: 0 | K295: 0 | L295: 0 | M295: 0 | N295: 0 | O295: 0 | P295: 0 | Q295: 0 | R295: 0 | S295: 0 | T295: 0 | U295: 0 | V295: 0 | W295: 0 | X295: 0 | Y295: 0 | Z295: 0 | AA295: 0 | AB295: 0 | AC295: 0 | AD295: 0 | AE295: 0 | AF295: 0 | AG295: 0 | AH295: 1 | AI295: 0 | AJ295: 0 | AK295: 0 | AL295: 0 | AM295: 0 | AN295: 0 | AO295: 0 | AP295: 0 | AQ295: 0 | AR295: 0 | AS295: 0 | AT295: 0 | AU295: 0 | AV295: 0 | AW295: 0 | AX295: 0
F296: 0 | G296: 0 | H296: 0 | I296: 0 | J296: 0 | K296: 0 | L296: 0 | M296: 0 | N296: 0 | O296: 0 | P296: 0 | Q296: 0 | R296: 0 | S296: 0 | T296: 0 | U296: 0 | V296: 0 | W296: 0 | X296: 0 | Y296: 0 | Z296: 0 | AA296: 0 | AB296: 0 | AC296: 0 | AD296: 0 | AE296: 0 | AF296: 0 | AG296: 0 | AH296: 1 | AI296: 0 | AJ296: 0 | AK296: 0 | AL296: 0 | AM296: 0 | AN296: 0 | AO296: 0 | AP296: 0 | AQ296: 0 | AR296: 0 | AS296: 0 | AT296: 0 | AU296: 0 | AV296: 0 | AW296: 0 | AX296: 0
F297: 0 | G297: 0 | H297: 0 | I297: 0 | J297: 0 | K297: 0 | L297: 0 | M297: 0 | N297: 0 | O297: 0 | P297: 0 | Q297: 0 | R297: 0 | S297: 0 | T297: 0 | U297: 0 | V297: 0 | W297: 0 | X297: 0 | Y297: 0 | Z297: 0 | AA297: 0 | AB297: 0 | AC297: 0 | AD297: 0 | AE297: 0 | AF297: 0 | AG297: 0 | AH297: 1 | AI297: 0 | AJ297: 0 | AK297: 0 | AL297: 0 | AM297: 0 | AN297: 0 | AO297: 0 | AP297: 0 | AQ297: 0 | AR297: 0 | AS297: 0 | AT297: 0 | AU297: 0 | AV297: 0 | AW297: 0 | AX297: 0
F298: 0 | G298: 0 | H298: 0 | I298: 0 | J298: 0 | K298: 0 | L298: 0 | M298: 0 | N298: 0 | O298: 0 | P298: 0 | Q298: 0 | R298: 0 | S298: 0 | T298: 0 | U298: 0 | V298: 0 | W298: 0 | X298: 0 | Y298: 0 | Z298: 0 | AA298: 0 | AB298: 0 | AC298: 0 | AD298: 0 | AE298: 0 | AF298: 0 | AG298: 0 | AH298: 1 | AI298: 0 | AJ298: 0 | AK298: 0 | AL298: 0 | AM298: 0 | AN298: 0 | AO298: 0 | AP298: 0 | AQ298: 0 | AR298: 0 | AS298: 0 | AT298: 0 | AU298: 0 | AV298: 0 | AW298: 0 | AX298: 0
F299: 0 | G299: 0 | H299: 0 | I299: 0 | J299: 0 | K299: 0 | L299: 0 | M299: 0 | N299: 0 | O299: 0 | P299: 0 | Q299: 0 | R299: 0 | S299: 0 | T299: 0 | U299: 0 | V299: 0 | W299: 0 | X299: 0 | Y299: 0 | Z299: 0 | AA299: 0 | AB299: 0 | AC299: 0 | AD299: 0 | AE299: 0 | AF299: 0 | AG299: 0 | AH299: 1 | AI299: 0 | AJ299: 0 | AK299: 0 | AL299: 0 | AM299: 0 | AN299: 0 | AO299: 0 | AP299: 0 | AQ299: 0 | AR299: 0 | AS299: 0 | AT299: 0 | AU299: 0 | AV299: 0 | AW299: 0 | AX299: 0
F300: 0 | G300: 0 | H300: 0 | I300: 0 | J300: 0 | K300: 0 | L300: 0 | M300: 0 | N300: 0 | O300: 0 | P300: 0 | Q300: 0 | R300: 0 | S300: 0 | T300: 0 | U300: 0 | V300: 0 | W300: 0 | X300: 0 | Y300: 0 | Z300: 0 | AA300: 0 | AB300: 0 | AC300: 0 | AD300: 0 | AE300: 0 | AF300: 0 | AG300: 0 | AH300: 1 | AI300: 0 | AJ300: 0 | AK300: 0 | AL300: 0 | AM300: 0 | AN300: 0 | AO300: 0 | AP300: 0 | AQ300: 0 | AR300: 0 | AS300: 0 | AT300: 0 | AU300: 0 | AV300: 0 | AW300: 0 | AX300: 0
F301: 0 | G301: 0 | H301: 0 | I301: 0 | J301: 0 | K301: 0 | L301: 0 | M301: 0 | N301: 0 | O301: 0 | P301: 0 | Q301: 0 | R301: 0 | S301: 0 | T301: 0 | U301: 0 | V301: 0 | W301: 0 | X301: 0 | Y301: 0 | Z301: 0 | AA301: 0 | AB301: 0 | AC301: 0 | AD301: 0 | AE301: 0 | AF301: 0 | AG301: 0 | AH301: 1 | AI301: 0 | AJ301: 0 | AK301: 0 | AL301: 0 | AM301: 0 | AN301: 0 | AO301: 0 | AP301: 0 | AQ301: 0 | AR301: 0 | AS301: 0 | AT301: 0 | AU301: 0 | AV301: 0 | AW301: 0 | AX301: 0
F302: 0 | G302: 0 | H302: 0 | I302: 0 | J302: 0 | K302: 0 | L302: 0 | M302: 0 | N302: 0 | O302: 0 | P302: 0 | Q302: 0 | R302: 0 | S302: 0 | T302: 0 | U302: 0 | V302: 0 | W302: 0 | X302: 0 | Y302: 0 | Z302: 0 | AA302: 0 | AB302: 0 | AC302: 0 | AD302: 0 | AE302: 0 | AF302: 0 | AG302: 0 | AH302: 1 | AI302: 0 | AJ302: 0 | AK302: 0 | AL302: 0 | AM302: 0 | AN302: 0 | AO302: 0 | AP302: 0 | AQ302: 0 | AR302: 0 | AS302: 0 | AT302: 0 | AU302: 0 | AV302: 0 | AW302: 0 | AX302: 0
F303: 0 | G303: 0 | H303: 0 | I303: 0 | J303: 0 | K303: 0 | L303: 0 | M303: 0 | N303: 1 | O303: 0 | P303: 0 | Q303: 0 | R303: 0 | S303: 0 | T303: 0 | U303: 0 | V303: 0 | W303: 0 | X303: 0 | Y303: 0 | Z303: 0 | AA303: 0 | AB303: 0 | AC303: 0 | AD303: 0 | AE303: 0 | AF303: 0 | AG303: 0 | AH303: 0 | AI303: 0 | AJ303: 0 | AK303: 0 | AL303: 0 | AM303: 0 | AN303: 0 | AO303: 0 | AP303: 0 | AQ303: 0 | AR303: 0 | AS303: 0 | AT303: 0 | AU303: 0 | AV303: 0 | AW303: 0 | AX303: 0
F304: 0 | G304: 0 | H304: 0 | I304: 0 | J304: 0 | K304: 0 | L304: 0 | M304: 0 | N304: 1 | O304: 0 | P304: 0 | Q304: 0 | R304: 0 | S304: 0 | T304: 0 | U304: 0 | V304: 0 | W304: 0 | X304: 0 | Y304: 0 | Z304: 0 | AA304: 0 | AB304: 0 | AC304: 0 | AD304: 0 | AE304: 0 | AF304: 0 | AG304: 0 | AH304: 0 | AI304: 0 | AJ304: 0 | AK304: 0 | AL304: 0 | AM304: 0 | AN304: 0 | AO304: 0 | AP304: 0 | AQ304: 0 | AR304: 0 | AS304: 0 | AT304: 0 | AU304: 0 | AV304: 0 | AW304: 0 | AX304: 0
F305: 0 | G305: 0 | H305: 0 | I305: 0 | J305: 0 | K305: 0 | L305: 0 | M305: 0 | N305: 1 | O305: 0 | P305: 0 | Q305: 0 | R305: 0 | S305: 0 | T305: 0 | U305: 0 | V305: 0 | W305: 0 | X305: 0 | Y305: 0 | Z305: 0 | AA305: 0 | AB305: 0 | AC305: 0 | AD305: 0 | AE305: 0 | AF305: 0 | AG305: 0 | AH305: 0 | AI305: 0 | AJ305: 0 | AK305: 0 | AL305: 0 | AM305: 0 | AN305: 0 | AO305: 0 | AP305: 0 | AQ305: 0 | AR305: 0 | AS305: 0 | AT305: 0 | AU305: 0 | AV305: 0 | AW305: 0 | AX305: 0
F306: 0 | G306: 0 | H306: 0 | I306: 0 | J306: 0 | K306: 0 | L306: 0 | M306: 0 | N306: 1 | O306: 0 | P306: 0 | Q306: 0 | R306: 0 | S306: 0 | T306: 0 | U306: 0 | V306: 0 | W306: 0 | X306: 0 | Y306: 0 | Z306: 0 | AA306: 0 | AB306: 0 | AC306: 0 | AD306: 0 | AE306: 0 | AF306: 0 | AG306: 0 | AH306: 0 | AI306: 0 | AJ306: 0 | AK306: 0 | AL306: 0 | AM306: 0 | AN306: 0 | AO306: 0 | AP306: 0 | AQ306: 0 | AR306: 0 | AS306: 0 | AT306: 0 | AU306: 0 | AV306: 0 | AW306: 0 | AX306: 0
F307: 0 | G307: 0 | H307: 0 | I307: 0 | J307: 0 | K307: 0 | L307: 0 | M307: 0 | N307: 1 | O307: 0 | P307: 0 | Q307: 0 | R307: 0 | S307: 0 | T307: 0 | U307: 0 | V307: 0 | W307: 0 | X307: 0 | Y307: 0 | Z307: 0 | AA307: 0 | AB307: 0 | AC307: 0 | AD307: 0 | AE307: 0 | AF307: 0 | AG307: 0 | AH307: 0 | AI307: 0 | AJ307: 0 | AK307: 0 | AL307: 0 | AM307: 0 | AN307: 0 | AO307: 0 | AP307: 0 | AQ307: 0 | AR307: 0 | AS307: 0 | AT307: 0 | AU307: 0 | AV307: 0 | AW307: 0 | AX307: 0
F308: 0 | G308: 0 | H308: 0 | I308: 0 | J308: 0 | K308: 0 | L308: 0 | M308: 0 | N308: 0 | O308: 0 | P308: 0 | Q308: 0 | R308: 0 | S308: 0 | T308: 0 | U308: 0 | V308: 0 | W308: 0 | X308: 0 | Y308: 1 | Z308: 0 | AA308: 0 | AB308: 0 | AC308: 0 | AD308: 0 | AE308: 0 | AF308: 0 | AG308: 0 | AH308: 0 | AI308: 0 | AJ308: 0 | AK308: 0 | AL308: 0 | AM308: 0 | AN308: 0 | AO308: 0 | AP308: 0 | AQ308: 0 | AR308: 0 | AS308: 0 | AT308: 0 | AU308: 0 | AV308: 0 | AW308: 0 | AX308: 0
F309: 0 | G309: 0 | H309: 0 | I309: 0 | J309: 0 | K309: 0 | L309: 0 | M309: 0 | N309: 0 | O309: 0 | P309: 0 | Q309: 0 | R309: 0 | S309: 0 | T309: 0 | U309: 0 | V309: 0 | W309: 0 | X309: 0 | Y309: 1 | Z309: 0 | AA309: 0 | AB309: 0 | AC309: 0 | AD309: 0 | AE309: 0 | AF309: 0 | AG309: 0 | AH309: 0 | AI309: 0 | AJ309: 0 | AK309: 0 | AL309: 0 | AM309: 0 | AN309: 0 | AO309: 0 | AP309: 0 | AQ309: 0 | AR309: 0 | AS309: 0 | AT309: 0 | AU309: 0 | AV309: 0 | AW309: 0 | AX309: 0
F310: 0 | G310: 0 | H310: 0 | I310: 0 | J310: 0 | K310: 0 | L310: 0 | M310: 0 | N310: 0 | O310: 0 | P310: 0 | Q310: 0 | R310: 0 | S310: 0 | T310: 0 | U310: 0 | V310: 0 | W310: 0 | X310: 0 | Y310: 1 | Z310: 0 | AA310: 0 | AB310: 0 | AC310: 0 | AD310: 0 | AE310: 0 | AF310: 0 | AG310: 0 | AH310: 0 | AI310: 0 | AJ310: 0 | AK310: 0 | AL310: 0 | AM310: 0 | AN310: 0 | AO310: 0 | AP310: 0 | AQ310: 0 | AR310: 0 | AS310: 0 | AT310: 0 | AU310: 0 | AV310: 0 | AW310: 0 | AX310: 0
F311: 0 | G311: 0 | H311: 0 | I311: 0 | J311: 0 | K311: 0 | L311: 0 | M311: 0 | N311: 0 | O311: 0 | P311: 0 | Q311: 0 | R311: 0 | S311: 0 | T311: 0 | U311: 0 | V311: 0 | W311: 1 | X311: 0 | Y311: 0 | Z311: 0 | AA311: 0 | AB311: 0 | AC311: 0 | AD311: 0 | AE311: 0 | AF311: 0 | AG311: 0 | AH311: 0 | AI311: 0 | AJ311: 0 | AK311: 0 | AL311: 0 | AM311: 0 | AN311: 0 | AO311: 0 | AP311: 0 | AQ311: 0 | AR311: 0 | AS311: 0 | AT311: 0 | AU311: 0 | AV311: 0 | AW311: 0 | AX311: 0
F312: 0 | G312: 0 | H312: 0 | I312: 0 | J312: 0 | K312: 0 | L312: 0 | M312: 0 | N312: 0 | O312: 0 | P312: 0 | Q312: 0 | R312: 0 | S312: 0 | T312: 0 | U312: 0 | V312: 0 | W312: 1 | X312: 0 | Y312: 0 | Z312: 0 | AA312: 0 | AB312: 0 | AC312: 0 | AD312: 0 | AE312: 0 | AF312: 0 | AG312: 0 | AH312: 0 | AI312: 0 | AJ312: 0 | AK312: 0 | AL312: 0 | AM312: 0 | AN312: 0 | AO312: 0 | AP312: 0 | AQ312: 0 | AR312: 0 | AS312: 0 | AT312: 0 | AU312: 0 | AV312: 0 | AW312: 0 | AX312: 0
F313: 0 | G313: 0 | H313: 0 | I313: 0 | J313: 0 | K313: 0 | L313: 0 | M313: 0 | N313: 0 | O313: 0 | P313: 0 | Q313: 0 | R313: 0 | S313: 0 | T313: 0 | U313: 0 | V313: 0 | W313: 1 | X313: 0 | Y313: 0 | Z313: 0 | AA313: 0 | AB313: 0 | AC313: 0 | AD313: 0 | AE313: 0 | AF313: 0 | AG313: 0 | AH313: 0 | AI313: 0 | AJ313: 0 | AK313: 0 | AL313: 0 | AM313: 0 | AN313: 0 | AO313: 0 | AP313: 0 | AQ313: 0 | AR313: 0 | AS313: 0 | AT313: 0 | AU313: 0 | AV313: 0 | AW313: 0 | AX313: 0
F314: 0 | G314: 0 | H314: 0 | I314: 0 | J314: 0 | K314: 0 | L314: 0 | M314: 0 | N314: 0 | O314: 0 | P314: 0 | Q314: 0 | R314: 0 | S314: 0 | T314: 0 | U314: 0 | V314: 0 | W314: 1 | X314: 0 | Y314: 0 | Z314: 0 | AA314: 0 | AB314: 0 | AC314: 0 | AD314: 0 | AE314: 0 | AF314: 0 | AG314: 0 | AH314: 0 | AI314: 0 | AJ314: 0 | AK314: 0 | AL314: 0 | AM314: 0 | AN314: 0 | AO314: 0 | AP314: 0 | AQ314: 0 | AR314: 0 | AS314: 0 | AT314: 0 | AU314: 0 | AV314: 0 | AW314: 0 | AX314: 0
F315: 0 | G315: 0 | H315: 0 | I315: 0 | J315: 0 | K315: 0 | L315: 0 | M315: 0 | N315: 0 | O315: 0 | P315: 0 | Q315: 0 | R315: 0 | S315: 0 | T315: 0 | U315: 0 | V315: 0 | W315: 1 | X315: 0 | Y315: 0 | Z315: 0 | AA315: 0 | AB315: 0 | AC315: 0 | AD315: 0 | AE315: 0 | AF315: 0 | AG315: 0 | AH315: 0 | AI315: 0 | AJ315: 0 | AK315: 0 | AL315: 0 | AM315: 0 | AN315: 0 | AO315: 0 | AP315: 0 | AQ315: 0 | AR315: 0 | AS315: 0 | AT315: 0 | AU315: 0 | AV315: 0 | AW315: 0 | AX315: 0
F316: 0 | G316: 0 | H316: 0 | I316: 0 | J316: 0 | K316: 0 | L316: 0 | M316: 0 | N316: 0 | O316: 0 | P316: 0 | Q316: 0 | R316: 0 | S316: 0 | T316: 0 | U316: 0 | V316: 0 | W316: 1 | X316: 0 | Y316: 0 | Z316: 0 | AA316: 0 | AB316: 0 | AC316: 0 | AD316: 0 | AE316: 0 | AF316: 0 | AG316: 0 | AH316: 0 | AI316: 0 | AJ316: 0 | AK316: 0 | AL316: 0 | AM316: 0 | AN316: 0 | AO316: 0 | AP316: 0 | AQ316: 0 | AR316: 0 | AS316: 0 | AT316: 0 | AU316: 0 | AV316: 0 | AW316: 0 | AX316: 0
F317: 0 | G317: 0 | H317: 0 | I317: 0 | J317: 0 | K317: 0 | L317: 0 | M317: 0 | N317: 0 | O317: 0 | P317: 0 | Q317: 0 | R317: 0 | S317: 0 | T317: 0 | U317: 0 | V317: 0 | W317: 1 | X317: 0 | Y317: 0 | Z317: 0 | AA317: 0 | AB317: 0 | AC317: 0 | AD317: 0 | AE317: 0 | AF317: 0 | AG317: 0 | AH317: 0 | AI317: 0 | AJ317: 0 | AK317: 0 | AL317: 0 | AM317: 0 | AN317: 0 | AO317: 0 | AP317: 0 | AQ317: 0 | AR317: 0 | AS317: 0 | AT317: 0 | AU317: 0 | AV317: 0 | AW317: 0 | AX317: 0
F318: 0 | G318: 0 | H318: 0 | I318: 0 | J318: 0 | K318: 0 | L318: 0 | M318: 0 | N318: 0 | O318: 0 | P318: 0 | Q318: 0 | R318: 0 | S318: 0 | T318: 0 | U318: 0 | V318: 0 | W318: 1 | X318: 0 | Y318: 0 | Z318: 0 | AA318: 0 | AB318: 0 | AC318: 0 | AD318: 0 | AE318: 0 | AF318: 0 | AG318: 0 | AH318: 0 | AI318: 0 | AJ318: 0 | AK318: 0 | AL318: 0 | AM318: 0 | AN318: 0 | AO318: 0 | AP318: 0 | AQ318: 0 | AR318: 0 | AS318: 0 | AT318: 0 | AU318: 0 | AV318: 0 | AW318: 0 | AX318: 0
F319: 0 | G319: 0 | H319: 0 | I319: 0 | J319: 0 | K319: 0 | L319: 0 | M319: 0 | N319: 0 | O319: 0 | P319: 0 | Q319: 0 | R319: 0 | S319: 0 | T319: 0 | U319: 0 | V319: 0 | W319: 1 | X319: 0 | Y319: 0 | Z319: 0 | AA319: 0 | AB319: 0 | AC319: 0 | AD319: 0 | AE319: 0 | AF319: 0 | AG319: 0 | AH319: 0 | AI319: 0 | AJ319: 0 | AK319: 0 | AL319: 0 | AM319: 0 | AN319: 0 | AO319: 0 | AP319: 0 | AQ319: 0 | AR319: 0 | AS319: 0 | AT319: 0 | AU319: 0 | AV319: 0 | AW319: 0 | AX319: 0
F320: 0 | G320: 0 | H320: 0 | I320: 0 | J320: 0 | K320: 0 | L320: 0 | M320: 0 | N320: 0 | O320: 0 | P320: 0 | Q320: 0 | R320: 0 | S320: 0 | T320: 0 | U320: 0 | V320: 0 | W320: 1 | X320: 0 | Y320: 0 | Z320: 0 | AA320: 0 | AB320: 0 | AC320: 0 | AD320: 0 | AE320: 0 | AF320: 0 | AG320: 0 | AH320: 0 | AI320: 0 | AJ320: 0 | AK320: 0 | AL320: 0 | AM320: 0 | AN320: 0 | AO320: 0 | AP320: 0 | AQ320: 0 | AR320: 0 | AS320: 0 | AT320: 0 | AU320: 0 | AV320: 0 | AW320: 0 | AX320: 0
F321: 0 | G321: 0 | H321: 0 | I321: 0 | J321: 0 | K321: 0 | L321: 0 | M321: 0 | N321: 0 | O321: 0 | P321: 0 | Q321: 0 | R321: 0 | S321: 0 | T321: 0 | U321: 0 | V321: 0 | W321: 1 | X321: 0 | Y321: 0 | Z321: 0 | AA321: 0 | AB321: 0 | AC321: 0 | AD321: 0 | AE321: 0 | AF321: 0 | AG321: 0 | AH321: 0 | AI321: 0 | AJ321: 0 | AK321: 0 | AL321: 0 | AM321: 0 | AN321: 0 | AO321: 0 | AP321: 0 | AQ321: 0 | AR321: 0 | AS321: 0 | AT321: 0 | AU321: 0 | AV321: 0 | AW321: 0 | AX321: 0
F322: 1 | G322: 0 | H322: 0 | I322: 0 | J322: 0 | K322: 0 | L322: 0 | M322: 0 | N322: 0 | O322: 0 | P322: 0 | Q322: 0 | R322: 0 | S322: 0 | T322: 0 | U322: 0 | V322: 0 | W322: 0 | X322: 0 | Y322: 0 | Z322: 0 | AA322: 0 | AB322: 0 | AC322: 0 | AD322: 0 | AE322: 0 | AF322: 0 | AG322: 0 | AH322: 0 | AI322: 0 | AJ322: 0 | AK322: 0 | AL322: 0 | AM322: 0 | AN322: 0 | AO322: 0 | AP322: 0 | AQ322: 0 | AR322: 0 | AS322: 0 | AT322: 0 | AU322: 0 | AV322: 0 | AW322: 0 | AX322: 0
F323: 1 | G323: 0 | H323: 0 | I323: 0 | J323: 0 | K323: 0 | L323: 0 | M323: 0 | N323: 0 | O323: 0 | P323: 0 | Q323: 0 | R323: 0 | S323: 0 | T323: 0 | U323: 0 | V323: 0 | W323: 0 | X323: 0 | Y323: 0 | Z323: 0 | AA323: 0 | AB323: 0 | AC323: 0 | AD323: 0 | AE323: 0 | AF323: 0 | AG323: 0 | AH323: 0 | AI323: 0 | AJ323: 0 | AK323: 0 | AL323: 0 | AM323: 0 | AN323: 0 | AO323: 0 | AP323: 0 | AQ323: 0 | AR323: 0 | AS323: 0 | AT323: 0 | AU323: 0 | AV323: 0 | AW323: 0 | AX323: 0
F324: 1 | G324: 0 | H324: 0 | I324: 0 | J324: 0 | K324: 0 | L324: 0 | M324: 0 | N324: 0 | O324: 0 | P324: 0 | Q324: 0 | R324: 0 | S324: 0 | T324: 0 | U324: 0 | V324: 0 | W324: 0 | X324: 0 | Y324: 0 | Z324: 0 | AA324: 0 | AB324: 0 | AC324: 0 | AD324: 0 | AE324: 0 | AF324: 0 | AG324: 0 | AH324: 0 | AI324: 0 | AJ324: 0 | AK324: 0 | AL324: 0 | AM324: 0 | AN324: 0 | AO324: 0 | AP324: 0 | AQ324: 0 | AR324: 0 | AS324: 0 | AT324: 0 | AU324: 0 | AV324: 0 | AW324: 0 | AX324: 0
F325: 1 | G325: 0 | H325: 0 | I325: 0 | J325: 0 | K325: 0 | L325: 0 | M325: 0 | N325: 0 | O325: 0 | P325: 0 | Q325: 0 | R325: 0 | S325: 0 | T325: 0 | U325: 0 | V325: 0 | W325: 0 | X325: 0 | Y325: 0 | Z325: 0 | AA325: 0 | AB325: 0 | AC325: 0 | AD325: 0 | AE325: 0 | AF325: 0 | AG325: 0 | AH325: 0 | AI325: 0 | AJ325: 0 | AK325: 0 | AL325: 0 | AM325: 0 | AN325: 0 | AO325: 0 | AP325: 0 | AQ325: 0 | AR325: 0 | AS325: 0 | AT325: 0 | AU325: 0 | AV325: 0 | AW325: 0 | AX325: 0
F326: 1 | G326: 0 | H326: 0 | I326: 0 | J326: 0 | K326: 0 | L326: 0 | M326: 0 | N326: 0 | O326: 0 | P326: 0 | Q326: 0 | R326: 0 | S326: 0 | T326: 0 | U326: 0 | V326: 0 | W326: 0 | X326: 0 | Y326: 0 | Z326: 0 | AA326: 0 | AB326: 0 | AC326: 0 | AD326: 0 | AE326: 0 | AF326: 0 | AG326: 0 | AH326: 0 | AI326: 0 | AJ326: 0 | AK326: 0 | AL326: 0 | AM326: 0 | AN326: 0 | AO326: 0 | AP326: 0 | AQ326: 0 | AR326: 0 | AS326: 0 | AT326: 0 | AU326: 0 | AV326: 0 | AW326: 0 | AX326: 0
F327: 1 | G327: 0 | H327: 0 | I327: 0 | J327: 0 | K327: 0 | L327: 0 | M327: 0 | N327: 0 | O327: 0 | P327: 0 | Q327: 0 | R327: 0 | S327: 0 | T327: 0 | U327: 0 | V327: 0 | W327: 0 | X327: 0 | Y327: 0 | Z327: 0 | AA327: 0 | AB327: 0 | AC327: 0 | AD327: 0 | AE327: 0 | AF327: 0 | AG327: 0 | AH327: 0 | AI327: 0 | AJ327: 0 | AK327: 0 | AL327: 0 | AM327: 0 | AN327: 0 | AO327: 0 | AP327: 0 | AQ327: 0 | AR327: 0 | AS327: 0 | AT327: 0 | AU327: 0 | AV327: 0 | AW327: 0 | AX327: 0
F328: 1 | G328: 0 | H328: 0 | I328: 0 | J328: 0 | K328: 0 | L328: 0 | M328: 0 | N328: 0 | O328: 0 | P328: 0 | Q328: 0 | R328: 0 | S328: 0 | T328: 0 | U328: 0 | V328: 0 | W328: 0 | X328: 0 | Y328: 0 | Z328: 0 | AA328: 0 | AB328: 0 | AC328: 0 | AD328: 0 | AE328: 0 | AF328: 0 | AG328: 0 | AH328: 0 | AI328: 0 | AJ328: 0 | AK328: 0 | AL328: 0 | AM328: 0 | AN328: 0 | AO328: 0 | AP328: 0 | AQ328: 0 | AR328: 0 | AS328: 0 | AT328: 0 | AU328: 0 | AV328: 0 | AW328: 0 | AX328: 0
F329: 0 | G329: 0 | H329: 0 | I329: 0 | J329: 0 | K329: 0 | L329: 0 | M329: 0 | N329: 0 | O329: 0 | P329: 0 | Q329: 0 | R329: 0 | S329: 0 | T329: 1 | U329: 0 | V329: 0 | W329: 0 | X329: 0 | Y329: 0 | Z329: 0 | AA329: 0 | AB329: 0 | AC329: 0 | AD329: 0 | AE329: 0 | AF329: 0 | AG329: 0 | AH329: 0 | AI329: 0 | AJ329: 0 | AK329: 0 | AL329: 0 | AM329: 0 | AN329: 0 | AO329: 0 | AP329: 0 | AQ329: 0 | AR329: 0 | AS329: 0 | AT329: 0 | AU329: 0 | AV329: 0 | AW329: 0 | AX329: 0
F330: 0 | G330: 0 | H330: 0 | I330: 0 | J330: 0 | K330: 0 | L330: 0 | M330: 0 | N330: 0 | O330: 0 | P330: 0 | Q330: 0 | R330: 0 | S330: 0 | T330: 1 | U330: 0 | V330: 0 | W330: 0 | X330: 0 | Y330: 0 | Z330: 0 | AA330: 0 | AB330: 0 | AC330: 0 | AD330: 0 | AE330: 0 | AF330: 0 | AG330: 0 | AH330: 0 | AI330: 0 | AJ330: 0 | AK330: 0 | AL330: 0 | AM330: 0 | AN330: 0 | AO330: 0 | AP330: 0 | AQ330: 0 | AR330: 0 | AS330: 0 | AT330: 0 | AU330: 0 | AV330: 0 | AW330: 0 | AX330: 0
F331: 0 | G331: 0 | H331: 0 | I331: 0 | J331: 0 | K331: 0 | L331: 0 | M331: 0 | N331: 0 | O331: 0 | P331: 0 | Q331: 1 | R331: 0 | S331: 0 | T331: 0 | U331: 0 | V331: 0 | W331: 0 | X331: 0 | Y331: 0 | Z331: 0 | AA331: 0 | AB331: 0 | AC331: 0 | AD331: 0 | AE331: 0 | AF331: 0 | AG331: 0 | AH331: 0 | AI331: 0 | AJ331: 0 | AK331: 0 | AL331: 0 | AM331: 0 | AN331: 0 | AO331: 0 | AP331: 0 | AQ331: 0 | AR331: 0 | AS331: 0 | AT331: 0 | AU331: 0 | AV331: 0 | AW331: 0 | AX331: 0
F332: 0 | G332: 0 | H332: 0 | I332: 0 | J332: 0 | K332: 0 | L332: 0 | M332: 0 | N332: 0 | O332: 0 | P332: 0 | Q332: 1 | R332: 0 | S332: 0 | T332: 0 | U332: 0 | V332: 0 | W332: 0 | X332: 0 | Y332: 0 | Z332: 0 | AA332: 0 | AB332: 0 | AC332: 0 | AD332: 0 | AE332: 0 | AF332: 0 | AG332: 0 | AH332: 0 | AI332: 0 | AJ332: 0 | AK332: 0 | AL332: 0 | AM332: 0 | AN332: 0 | AO332: 0 | AP332: 0 | AQ332: 0 | AR332: 0 | AS332: 0 | AT332: 0 | AU332: 0 | AV332: 0 | AW332: 0 | AX332: 0
F333: 0 | G333: 0 | H333: 0 | I333: 0 | J333: 0 | K333: 0 | L333: 0 | M333: 0 | N333: 0 | O333: 0 | P333: 0 | Q333: 1 | R333: 0 | S333: 0 | T333: 0 | U333: 0 | V333: 0 | W333: 0 | X333: 0 | Y333: 0 | Z333: 0 | AA333: 0 | AB333: 0 | AC333: 0 | AD333: 0 | AE333: 0 | AF333: 0 | AG333: 0 | AH333: 0 | AI333: 0 | AJ333: 0 | AK333: 0 | AL333: 0 | AM333: 0 | AN333: 0 | AO333: 0 | AP333: 0 | AQ333: 0 | AR333: 0 | AS333: 0 | AT333: 0 | AU333: 0 | AV333: 0 | AW333: 0 | AX333: 0
F334: 0 | G334: 0 | H334: 0 | I334: 0 | J334: 0 | K334: 0 | L334: 0 | M334: 0 | N334: 0 | O334: 0 | P334: 0 | Q334: 1 | R334: 0 | S334: 0 | T334: 0 | U334: 0 | V334: 0 | W334: 0 | X334: 0 | Y334: 0 | Z334: 0 | AA334: 0 | AB334: 0 | AC334: 0 | AD334: 0 | AE334: 0 | AF334: 0 | AG334: 0 | AH334: 0 | AI334: 0 | AJ334: 0 | AK334: 0 | AL334: 0 | AM334: 0 | AN334: 0 | AO334: 0 | AP334: 0 | AQ334: 0 | AR334: 0 | AS334: 0 | AT334: 0 | AU334: 0 | AV334: 0 | AW334: 0 | AX334: 0
F335: 0 | G335: 0 | H335: 0 | I335: 0 | J335: 0 | K335: 0 | L335: 0 | M335: 0 | N335: 0 | O335: 0 | P335: 0 | Q335: 1 | R335: 0 | S335: 0 | T335: 0 | U335: 0 | V335: 0 | W335: 0 | X335: 0 | Y335: 0 | Z335: 0 | AA335: 0 | AB335: 0 | AC335: 0 | AD335: 0 | AE335: 0 | AF335: 0 | AG335: 0 | AH335: 0 | AI335: 0 | AJ335: 0 | AK335: 0 | AL335: 0 | AM335: 0 | AN335: 0 | AO335: 0 | AP335: 0 | AQ335: 0 | AR335: 0 | AS335: 0 | AT335: 0 | AU335: 0 | AV335: 0 | AW335: 0 | AX335: 0
F336: 0 | G336: 0 | H336: 0 | I336: 0 | J336: 0 | K336: 0 | L336: 0 | M336: 0 | N336: 0 | O336: 0 | P336: 0 | Q336: 1 | R336: 0 | S336: 0 | T336: 0 | U336: 0 | V336: 0 | W336: 0 | X336: 0 | Y336: 0 | Z336: 0 | AA336: 0 | AB336: 0 | AC336: 0 | AD336: 0 | AE336: 0 | AF336: 0 | AG336: 0 | AH336: 0 | AI336: 0 | AJ336: 0 | AK336: 0 | AL336: 0 | AM336: 0 | AN336: 0 | AO336: 0 | AP336: 0 | AQ336: 0 | AR336: 0 | AS336: 0 | AT336: 0 | AU336: 0 | AV336: 0 | AW336: 0 | AX336: 0
F337: 0 | G337: 0 | H337: 0 | I337: 0 | J337: 0 | K337: 0 | L337: 0 | M337: 0 | N337: 0 | O337: 0 | P337: 0 | Q337: 1 | R337: 0 | S337: 0 | T337: 0 | U337: 0 | V337: 0 | W337: 0 | X337: 0 | Y337: 0 | Z337: 0 | AA337: 0 | AB337: 0 | AC337: 0 | AD337: 0 | AE337: 0 | AF337: 0 | AG337: 0 | AH337: 0 | AI337: 0 | AJ337: 0 | AK337: 0 | AL337: 0 | AM337: 0 | AN337: 0 | AO337: 0 | AP337: 0 | AQ337: 0 | AR337: 0 | AS337: 0 | AT337: 0 | AU337: 0 | AV337: 0 | AW337: 0 | AX337: 0
F338: 0 | G338: 0 | H338: 0 | I338: 0 | J338: 0 | K338: 0 | L338: 0 | M338: 0 | N338: 0 | O338: 0 | P338: 0 | Q338: 1 | R338: 0 | S338: 0 | T338: 0 | U338: 0 | V338: 0 | W338: 0 | X338: 0 | Y338: 0 | Z338: 0 | AA338: 0 | AB338: 0 | AC338: 0 | AD338: 0 | AE338: 0 | AF338: 0 | AG338: 0 | AH338: 0 | AI338: 0 | AJ338: 0 | AK338: 0 | AL338: 0 | AM338: 0 | AN338: 0 | AO338: 0 | AP338: 0 | AQ338: 0 | AR338: 0 | AS338: 0 | AT338: 0 | AU338: 0 | AV338: 0 | AW338: 0 | AX338: 0
F339: 0 | G339: 0 | H339: 0 | I339: 0 | J339: 0 | K339: 0 | L339: 0 | M339: 0 | N339: 0 | O339: 0 | P339: 0 | Q339: 1 | R339: 0 | S339: 0 | T339: 0 | U339: 0 | V339: 0 | W339: 0 | X339: 0 | Y339: 0 | Z339: 0 | AA339: 0 | AB339: 0 | AC339: 0 | AD339: 0 | AE339: 0 | AF339: 0 | AG339: 0 | AH339: 0 | AI339: 0 | AJ339: 0 | AK339: 0 | AL339: 0 | AM339: 0 | AN339: 0 | AO339: 0 | AP339: 0 | AQ339: 0 | AR339: 0 | AS339: 0 | AT339: 0 | AU339: 0 | AV339: 0 | AW339: 0 | AX339: 0
F340: 0 | G340: 0 | H340: 0 | I340: 0 | J340: 0 | K340: 0 | L340: 0 | M340: 0 | N340: 0 | O340: 0 | P340: 0 | Q340: 1 | R340: 0 | S340: 0 | T340: 0 | U340: 0 | V340: 0 | W340: 0 | X340: 0 | Y340: 0 | Z340: 0 | AA340: 0 | AB340: 0 | AC340: 0 | AD340: 0 | AE340: 0 | AF340: 0 | AG340: 0 | AH340: 0 | AI340: 0 | AJ340: 0 | AK340: 0 | AL340: 0 | AM340: 0 | AN340: 0 | AO340: 0 | AP340: 0 | AQ340: 0 | AR340: 0 | AS340: 0 | AT340: 0 | AU340: 0 | AV340: 0 | AW340: 0 | AX340: 0
F341: 0 | G341: 0 | H341: 0 | I341: 0 | J341: 0 | K341: 0 | L341: 0 | M341: 0 | N341: 0 | O341: 0 | P341: 0 | Q341: 1 | R341: 0 | S341: 0 | T341: 0 | U341: 0 | V341: 0 | W341: 0 | X341: 0 | Y341: 0 | Z341: 0 | AA341: 0 | AB341: 0 | AC341: 0 | AD341: 0 | AE341: 0 | AF341: 0 | AG341: 0 | AH341: 0 | AI341: 0 | AJ341: 0 | AK341: 0 | AL341: 0 | AM341: 0 | AN341: 0 | AO341: 0 | AP341: 0 | AQ341: 0 | AR341: 0 | AS341: 0 | AT341: 0 | AU341: 0 | AV341: 0 | AW341: 0 | AX341: 0
F342: 0 | G342: 0 | H342: 0 | I342: 0 | J342: 0 | K342: 0 | L342: 0 | M342: 0 | N342: 0 | O342: 0 | P342: 0 | Q342: 1 | R342: 0 | S342: 0 | T342: 0 | U342: 0 | V342: 0 | W342: 0 | X342: 0 | Y342: 0 | Z342: 0 | AA342: 0 | AB342: 0 | AC342: 0 | AD342: 0 | AE342: 0 | AF342: 0 | AG342: 0 | AH342: 0 | AI342: 0 | AJ342: 0 | AK342: 0 | AL342: 0 | AM342: 0 | AN342: 0 | AO342: 0 | AP342: 0 | AQ342: 0 | AR342: 0 | AS342: 0 | AT342: 0 | AU342: 0 | AV342: 0 | AW342: 0 | AX342: 0
F343: 0 | G343: 0 | H343: 0 | I343: 0 | J343: 0 | K343: 0 | L343: 0 | M343: 0 | N343: 0 | O343: 0 | P343: 0 | Q343: 1 | R343: 0 | S343: 0 | T343: 0 | U343: 0 | V343: 0 | W343: 0 | X343: 0 | Y343: 0 | Z343: 0 | AA343: 0 | AB343: 0 | AC343: 0 | AD343: 0 | AE343: 0 | AF343: 0 | AG343: 0 | AH343: 0 | AI343: 0 | AJ343: 0 | AK343: 0 | AL343: 0 | AM343: 0 | AN343: 0 | AO343: 0 | AP343: 0 | AQ343: 0 | AR343: 0 | AS343: 0 | AT343: 0 | AU343: 0 | AV343: 0 | AW343: 0 | AX343: 0
F344: 0 | G344: 0 | H344: 0 | I344: 0 | J344: 0 | K344: 0 | L344: 0 | M344: 0 | N344: 0 | O344: 0 | P344: 0 | Q344: 1 | R344: 0 | S344: 0 | T344: 0 | U344: 0 | V344: 0 | W344: 0 | X344: 0 | Y344: 0 | Z344: 0 | AA344: 0 | AB344: 0 | AC344: 0 | AD344: 0 | AE344: 0 | AF344: 0 | AG344: 0 | AH344: 0 | AI344: 0 | AJ344: 0 | AK344: 0 | AL344: 0 | AM344: 0 | AN344: 0 | AO344: 0 | AP344: 0 | AQ344: 0 | AR344: 0 | AS344: 0 | AT344: 0 | AU344: 0 | AV344: 0 | AW344: 0 | AX344: 0
F345: 0 | G345: 0 | H345: 0 | I345: 0 | J345: 0 | K345: 0 | L345: 0 | M345: 0 | N345: 0 | O345: 0 | P345: 0 | Q345: 1 | R345: 0 | S345: 0 | T345: 0 | U345: 0 | V345: 0 | W345: 0 | X345: 0 | Y345: 0 | Z345: 0 | AA345: 0 | AB345: 0 | AC345: 0 | AD345: 0 | AE345: 0 | AF345: 0 | AG345: 0 | AH345: 0 | AI345: 0 | AJ345: 0 | AK345: 0 | AL345: 0 | AM345: 0 | AN345: 0 | AO345: 0 | AP345: 0 | AQ345: 0 | AR345: 0 | AS345: 0 | AT345: 0 | AU345: 0 | AV345: 0 | AW345: 0 | AX345: 0
F346: 0 | G346: 0 | H346: 0 | I346: 0 | J346: 0 | K346: 0 | L346: 0 | M346: 0 | N346: 0 | O346: 0 | P346: 0 | Q346: 1 | R346: 0 | S346: 0 | T346: 0 | U346: 0 | V346: 0 | W346: 0 | X346: 0 | Y346: 0 | Z346: 0 | AA346: 0 | AB346: 0 | AC346: 0 | AD346: 0 | AE346: 0 | AF346: 0 | AG346: 0 | AH346: 0 | AI346: 0 | AJ346: 0 | AK346: 0 | AL346: 0 | AM346: 0 | AN346: 0 | AO346: 0 | AP346: 0 | AQ346: 0 | AR346: 0 | AS346: 0 | AT346: 0 | AU346: 0 | AV346: 0 | AW346: 0 | AX346: 0
F347: 0 | G347: 0 | H347: 0 | I347: 0 | J347: 0 | K347: 0 | L347: 0 | M347: 0 | N347: 0 | O347: 0 | P347: 0 | Q347: 1 | R347: 0 | S347: 0 | T347: 0 | U347: 0 | V347: 0 | W347: 0 | X347: 0 | Y347: 0 | Z347: 0 | AA347: 0 | AB347: 0 | AC347: 0 | AD347: 0 | AE347: 0 | AF347: 0 | AG347: 0 | AH347: 0 | AI347: 0 | AJ347: 0 | AK347: 0 | AL347: 0 | AM347: 0 | AN347: 0 | AO347: 0 | AP347: 0 | AQ347: 0 | AR347: 0 | AS347: 0 | AT347: 0 | AU347: 0 | AV347: 0 | AW347: 0 | AX347: 0
F348: 0 | G348: 0 | H348: 0 | I348: 0 | J348: 0 | K348: 0 | L348: 0 | M348: 0 | N348: 0 | O348: 0 | P348: 0 | Q348: 1 | R348: 0 | S348: 0 | T348: 0 | U348: 0 | V348: 0 | W348: 0 | X348: 0 | Y348: 0 | Z348: 0 | AA348: 0 | AB348: 0 | AC348: 0 | AD348: 0 | AE348: 0 | AF348: 0 | AG348: 0 | AH348: 0 | AI348: 0 | AJ348: 0 | AK348: 0 | AL348: 0 | AM348: 0 | AN348: 0 | AO348: 0 | AP348: 0 | AQ348: 0 | AR348: 0 | AS348: 0 | AT348: 0 | AU348: 0 | AV348: 0 | AW348: 0 | AX348: 0
F349: 0 | G349: 0 | H349: 0 | I349: 0 | J349: 0 | K349: 0 | L349: 0 | M349: 0 | N349: 0 | O349: 0 | P349: 0 | Q349: 1 | R349: 0 | S349: 0 | T349: 0 | U349: 0 | V349: 0 | W349: 0 | X349: 0 | Y349: 0 | Z349: 0 | AA349: 0 | AB349: 0 | AC349: 0 | AD349: 0 | AE349: 0 | AF349: 0 | AG349: 0 | AH349: 0 | AI349: 0 | AJ349: 0 | AK349: 0 | AL349: 0 | AM349: 0 | AN349: 0 | AO349: 0 | AP349: 0 | AQ349: 0 | AR349: 0 | AS349: 0 | AT349: 0 | AU349: 0 | AV349: 0 | AW349: 0 | AX349: 0
F350: 0 | G350: 0 | H350: 0 | I350: 0 | J350: 0 | K350: 0 | L350: 0 | M350: 0 | N350: 0 | O350: 0 | P350: 0 | Q350: 1 | R350: 0 | S350: 0 | T350: 0 | U350: 0 | V350: 0 | W350: 0 | X350: 0 | Y350: 0 | Z350: 0 | AA350: 0 | AB350: 0 | AC350: 0 | AD350: 0 | AE350: 0 | AF350: 0 | AG350: 0 | AH350: 0 | AI350: 0 | AJ350: 0 | AK350: 0 | AL350: 0 | AM350: 0 | AN350: 0 | AO350: 0 | AP350: 0 | AQ350: 0 | AR350: 0 | AS350: 0 | AT350: 0 | AU350: 0 | AV350: 0 | AW350: 0 | AX350: 0
F351: 0 | G351: 0 | H351: 0 | I351: 0 | J351: 0 | K351: 0 | L351: 0 | M351: 0 | N351: 0 | O351: 0 | P351: 0 | Q351: 1 | R351: 0 | S351: 0 | T351: 0 | U351: 0 | V351: 0 | W351: 0 | X351: 0 | Y351: 0 | Z351: 0 | AA351: 0 | AB351: 0 | AC351: 0 | AD351: 0 | AE351: 0 | AF351: 0 | AG351: 0 | AH351: 0 | AI351: 0 | AJ351: 0 | AK351: 0 | AL351: 0 | AM351: 0 | AN351: 0 | AO351: 0 | AP351: 0 | AQ351: 0 | AR351: 0 | AS351: 0 | AT351: 0 | AU351: 0 | AV351: 0 | AW351: 0 | AX351: 0
F352: 0 | G352: 0 | H352: 0 | I352: 0 | J352: 0 | K352: 0 | L352: 0 | M352: 0 | N352: 0 | O352: 0 | P352: 0 | Q352: 1 | R352: 0 | S352: 0 | T352: 0 | U352: 0 | V352: 0 | W352: 0 | X352: 0 | Y352: 0 | Z352: 0 | AA352: 0 | AB352: 0 | AC352: 0 | AD352: 0 | AE352: 0 | AF352: 0 | AG352: 0 | AH352: 0 | AI352: 0 | AJ352: 0 | AK352: 0 | AL352: 0 | AM352: 0 | AN352: 0 | AO352: 0 | AP352: 0 | AQ352: 0 | AR352: 0 | AS352: 0 | AT352: 0 | AU352: 0 | AV352: 0 | AW352: 0 | AX352: 0
F353: 0 | G353: 0 | H353: 0 | I353: 0 | J353: 0 | K353: 0 | L353: 0 | M353: 0 | N353: 0 | O353: 0 | P353: 0 | Q353: 1 | R353: 0 | S353: 0 | T353: 0 | U353: 0 | V353: 0 | W353: 0 | X353: 0 | Y353: 0 | Z353: 0 | AA353: 0 | AB353: 0 | AC353: 0 | AD353: 0 | AE353: 0 | AF353: 0 | AG353: 0 | AH353: 0 | AI353: 0 | AJ353: 0 | AK353: 0 | AL353: 0 | AM353: 0 | AN353: 0 | AO353: 0 | AP353: 0 | AQ353: 0 | AR353: 0 | AS353: 0 | AT353: 0 | AU353: 0 | AV353: 0 | AW353: 0 | AX353: 0
F354: 0 | G354: 0 | H354: 0 | I354: 0 | J354: 0 | K354: 0 | L354: 0 | M354: 0 | N354: 0 | O354: 0 | P354: 0 | Q354: 1 | R354: 0 | S354: 0 | T354: 0 | U354: 0 | V354: 0 | W354: 0 | X354: 0 | Y354: 0 | Z354: 0 | AA354: 0 | AB354: 0 | AC354: 0 | AD354: 0 | AE354: 0 | AF354: 0 | AG354: 0 | AH354: 0 | AI354: 0 | AJ354: 0 | AK354: 0 | AL354: 0 | AM354: 0 | AN354: 0 | AO354: 0 | AP354: 0 | AQ354: 0 | AR354: 0 | AS354: 0 | AT354: 0 | AU354: 0 | AV354: 0 | AW354: 0 | AX354: 0
F355: 0 | G355: 0 | H355: 0 | I355: 0 | J355: 0 | K355: 0 | L355: 0 | M355: 0 | N355: 0 | O355: 0 | P355: 0 | Q355: 1 | R355: 0 | S355: 0 | T355: 0 | U355: 0 | V355: 0 | W355: 0 | X355: 0 | Y355: 0 | Z355: 0 | AA355: 0 | AB355: 0 | AC355: 0 | AD355: 0 | AE355: 0 | AF355: 0 | AG355: 0 | AH355: 0 | AI355: 0 | AJ355: 0 | AK355: 0 | AL355: 0 | AM355: 0 | AN355: 0 | AO355: 0 | AP355: 0 | AQ355: 0 | AR355: 0 | AS355: 0 | AT355: 0 | AU355: 0 | AV355: 0 | AW355: 0 | AX355: 0
F356: 0 | G356: 0 | H356: 0 | I356: 0 | J356: 0 | K356: 0 | L356: 0 | M356: 0 | N356: 0 | O356: 0 | P356: 0 | Q356: 1 | R356: 0 | S356: 0 | T356: 0 | U356: 0 | V356: 0 | W356: 0 | X356: 0 | Y356: 0 | Z356: 0 | AA356: 0 | AB356: 0 | AC356: 0 | AD356: 0 | AE356: 0 | AF356: 0 | AG356: 0 | AH356: 0 | AI356: 0 | AJ356: 0 | AK356: 0 | AL356: 0 | AM356: 0 | AN356: 0 | AO356: 0 | AP356: 0 | AQ356: 0 | AR356: 0 | AS356: 0 | AT356: 0 | AU356: 0 | AV356: 0 | AW356: 0 | AX356: 0
F357: 0 | G357: 0 | H357: 0 | I357: 0 | J357: 0 | K357: 0 | L357: 0 | M357: 0 | N357: 0 | O357: 0 | P357: 0 | Q357: 1 | R357: 0 | S357: 0 | T357: 0 | U357: 0 | V357: 0 | W357: 0 | X357: 0 | Y357: 0 | Z357: 0 | AA357: 0 | AB357: 0 | AC357: 0 | AD357: 0 | AE357: 0 | AF357: 0 | AG357: 0 | AH357: 0 | AI357: 0 | AJ357: 0 | AK357: 0 | AL357: 0 | AM357: 0 | AN357: 0 | AO357: 0 | AP357: 0 | AQ357: 0 | AR357: 0 | AS357: 0 | AT357: 0 | AU357: 0 | AV357: 0 | AW357: 0 | AX357: 0
F358: 0 | G358: 0 | H358: 0 | I358: 0 | J358: 0 | K358: 0 | L358: 0 | M358: 0 | N358: 0 | O358: 0 | P358: 0 | Q358: 1 | R358: 0 | S358: 0 | T358: 0 | U358: 0 | V358: 0 | W358: 0 | X358: 0 | Y358: 0 | Z358: 0 | AA358: 0 | AB358: 0 | AC358: 0 | AD358: 0 | AE358: 0 | AF358: 0 | AG358: 0 | AH358: 0 | AI358: 0 | AJ358: 0 | AK358: 0 | AL358: 0 | AM358: 0 | AN358: 0 | AO358: 0 | AP358: 0 | AQ358: 0 | AR358: 0 | AS358: 0 | AT358: 0 | AU358: 0 | AV358: 0 | AW358: 0 | AX358: 0
F359: 0 | G359: 0 | H359: 0 | I359: 0 | J359: 0 | K359: 0 | L359: 0 | M359: 0 | N359: 0 | O359: 0 | P359: 0 | Q359: 1 | R359: 0 | S359: 0 | T359: 0 | U359: 0 | V359: 0 | W359: 0 | X359: 0 | Y359: 0 | Z359: 0 | AA359: 0 | AB359: 0 | AC359: 0 | AD359: 0 | AE359: 0 | AF359: 0 | AG359: 0 | AH359: 0 | AI359: 0 | AJ359: 0 | AK359: 0 | AL359: 0 | AM359: 0 | AN359: 0 | AO359: 0 | AP359: 0 | AQ359: 0 | AR359: 0 | AS359: 0 | AT359: 0 | AU359: 0 | AV359: 0 | AW359: 0 | AX359: 0
F360: 0 | G360: 0 | H360: 0 | I360: 0 | J360: 0 | K360: 0 | L360: 0 | M360: 0 | N360: 0 | O360: 0 | P360: 0 | Q360: 1 | R360: 0 | S360: 0 | T360: 0 | U360: 0 | V360: 0 | W360: 0 | X360: 0 | Y360: 0 | Z360: 0 | AA360: 0 | AB360: 0 | AC360: 0 | AD360: 0 | AE360: 0 | AF360: 0 | AG360: 0 | AH360: 0 | AI360: 0 | AJ360: 0 | AK360: 0 | AL360: 0 | AM360: 0 | AN360: 0 | AO360: 0 | AP360: 0 | AQ360: 0 | AR360: 0 | AS360: 0 | AT360: 0 | AU360: 0 | AV360: 0 | AW360: 0 | AX360: 0
F361: 0 | G361: 0 | H361: 0 | I361: 0 | J361: 0 | K361: 0 | L361: 0 | M361: 0 | N361: 0 | O361: 0 | P361: 0 | Q361: 1 | R361: 0 | S361: 0 | T361: 0 | U361: 0 | V361: 0 | W361: 0 | X361: 0 | Y361: 0 | Z361: 0 | AA361: 0 | AB361: 0 | AC361: 0 | AD361: 0 | AE361: 0 | AF361: 0 | AG361: 0 | AH361: 0 | AI361: 0 | AJ361: 0 | AK361: 0 | AL361: 0 | AM361: 0 | AN361: 0 | AO361: 0 | AP361: 0 | AQ361: 0 | AR361: 0 | AS361: 0 | AT361: 0 | AU361: 0 | AV361: 0 | AW361: 0 | AX361: 0
F362: 0 | G362: 0 | H362: 0 | I362: 0 | J362: 0 | K362: 0 | L362: 0 | M362: 0 | N362: 0 | O362: 0 | P362: 0 | Q362: 1 | R362: 0 | S362: 0 | T362: 0 | U362: 0 | V362: 0 | W362: 0 | X362: 0 | Y362: 0 | Z362: 0 | AA362: 0 | AB362: 0 | AC362: 0 | AD362: 0 | AE362: 0 | AF362: 0 | AG362: 0 | AH362: 0 | AI362: 0 | AJ362: 0 | AK362: 0 | AL362: 0 | AM362: 0 | AN362: 0 | AO362: 0 | AP362: 0 | AQ362: 0 | AR362: 0 | AS362: 0 | AT362: 0 | AU362: 0 | AV362: 0 | AW362: 0 | AX362: 0
F363: 0 | G363: 0 | H363: 0 | I363: 0 | J363: 0 | K363: 0 | L363: 0 | M363: 0 | N363: 0 | O363: 0 | P363: 0 | Q363: 1 | R363: 0 | S363: 0 | T363: 0 | U363: 0 | V363: 0 | W363: 0 | X363: 0 | Y363: 0 | Z363: 0 | AA363: 0 | AB363: 0 | AC363: 0 | AD363: 0 | AE363: 0 | AF363: 0 | AG363: 0 | AH363: 0 | AI363: 0 | AJ363: 0 | AK363: 0 | AL363: 0 | AM363: 0 | AN363: 0 | AO363: 0 | AP363: 0 | AQ363: 0 | AR363: 0 | AS363: 0 | AT363: 0 | AU363: 0 | AV363: 0 | AW363: 0 | AX363: 0
F364: 0 | G364: 0 | H364: 0 | I364: 0 | J364: 0 | K364: 0 | L364: 0 | M364: 0 | N364: 0 | O364: 0 | P364: 0 | Q364: 1 | R364: 0 | S364: 0 | T364: 0 | U364: 0 | V364: 0 | W364: 0 | X364: 0 | Y364: 0 | Z364: 0 | AA364: 0 | AB364: 0 | AC364: 0 | AD364: 0 | AE364: 0 | AF364: 0 | AG364: 0 | AH364: 0 | AI364: 0 | AJ364: 0 | AK364: 0 | AL364: 0 | AM364: 0 | AN364: 0 | AO364: 0 | AP364: 0 | AQ364: 0 | AR364: 0 | AS364: 0 | AT364: 0 | AU364: 0 | AV364: 0 | AW364: 0 | AX364: 0
F365: 0 | G365: 0 | H365: 0 | I365: 0 | J365: 0 | K365: 0 | L365: 0 | M365: 0 | N365: 0 | O365: 0 | P365: 0 | Q365: 1 | R365: 0 | S365: 0 | T365: 0 | U365: 0 | V365: 0 | W365: 0 | X365: 0 | Y365: 0 | Z365: 0 | AA365: 0 | AB365: 0 | AC365: 0 | AD365: 0 | AE365: 0 | AF365: 0 | AG365: 0 | AH365: 0 | AI365: 0 | AJ365: 0 | AK365: 0 | AL365: 0 | AM365: 0 | AN365: 0 | AO365: 0 | AP365: 0 | AQ365: 0 | AR365: 0 | AS365: 0 | AT365: 0 | AU365: 0 | AV365: 0 | AW365: 0 | AX365: 0
F366: 0 | G366: 0 | H366: 0 | I366: 0 | J366: 0 | K366: 0 | L366: 0 | M366: 0 | N366: 0 | O366: 0 | P366: 0 | Q366: 1 | R366: 0 | S366: 0 | T366: 0 | U366: 0 | V366: 0 | W366: 0 | X366: 0 | Y366: 0 | Z366: 0 | AA366: 0 | AB366: 0 | AC366: 0 | AD366: 0 | AE366: 0 | AF366: 0 | AG366: 0 | AH366: 0 | AI366: 0 | AJ366: 0 | AK366: 0 | AL366: 0 | AM366: 0 | AN366: 0 | AO366: 0 | AP366: 0 | AQ366: 0 | AR366: 0 | AS366: 0 | AT366: 0 | AU366: 0 | AV366: 0 | AW366: 0 | AX366: 0
F367: 0 | G367: 0 | H367: 0 | I367: 0 | J367: 0 | K367: 0 | L367: 0 | M367: 0 | N367: 0 | O367: 0 | P367: 0 | Q367: 1 | R367: 0 | S367: 0 | T367: 0 | U367: 0 | V367: 0 | W367: 0 | X367: 0 | Y367: 0 | Z367: 0 | AA367: 0 | AB367: 0 | AC367: 0 | AD367: 0 | AE367: 0 | AF367: 0 | AG367: 0 | AH367: 0 | AI367: 0 | AJ367: 0 | AK367: 0 | AL367: 0 | AM367: 0 | AN367: 0 | AO367: 0 | AP367: 0 | AQ367: 0 | AR367: 0 | AS367: 0 | AT367: 0 | AU367: 0 | AV367: 0 | AW367: 0 | AX367: 0
F368: 0 | G368: 0 | H368: 0 | I368: 0 | J368: 0 | K368: 0 | L368: 0 | M368: 0 | N368: 0 | O368: 0 | P368: 0 | Q368: 1 | R368: 0 | S368: 0 | T368: 0 | U368: 0 | V368: 0 | W368: 0 | X368: 0 | Y368: 0 | Z368: 0 | AA368: 0 | AB368: 0 | AC368: 0 | AD368: 0 | AE368: 0 | AF368: 0 | AG368: 0 | AH368: 0 | AI368: 0 | AJ368: 0 | AK368: 0 | AL368: 0 | AM368: 0 | AN368: 0 | AO368: 0 | AP368: 0 | AQ368: 0 | AR368: 0 | AS368: 0 | AT368: 0 | AU368: 0 | AV368: 0 | AW368: 0 | AX368: 0
F369: 0 | G369: 0 | H369: 0 | I369: 0 | J369: 0 | K369: 0 | L369: 0 | M369: 0 | N369: 0 | O369: 0 | P369: 0 | Q369: 1 | R369: 0 | S369: 0 | T369: 0 | U369: 0 | V369: 0 | W369: 0 | X369: 0 | Y369: 0 | Z369: 0 | AA369: 0 | AB369: 0 | AC369: 0 | AD369: 0 | AE369: 0 | AF369: 0 | AG369: 0 | AH369: 0 | AI369: 0 | AJ369: 0 | AK369: 0 | AL369: 0 | AM369: 0 | AN369: 0 | AO369: 0 | AP369: 0 | AQ369: 0 | AR369: 0 | AS369: 0 | AT369: 0 | AU369: 0 | AV369: 0 | AW369: 0 | AX369: 0
F370: 0 | G370: 0 | H370: 0 | I370: 0 | J370: 0 | K370: 0 | L370: 0 | M370: 0 | N370: 0 | O370: 0 | P370: 0 | Q370: 1 | R370: 0 | S370: 0 | T370: 0 | U370: 0 | V370: 0 | W370: 0 | X370: 0 | Y370: 0 | Z370: 0 | AA370: 0 | AB370: 0 | AC370: 0 | AD370: 0 | AE370: 0 | AF370: 0 | AG370: 0 | AH370: 0 | AI370: 0 | AJ370: 0 | AK370: 0 | AL370: 0 | AM370: 0 | AN370: 0 | AO370: 0 | AP370: 0 | AQ370: 0 | AR370: 0 | AS370: 0 | AT370: 0 | AU370: 0 | AV370: 0 | AW370: 0 | AX370: 0
F371: 0 | G371: 0 | H371: 0 | I371: 0 | J371: 0 | K371: 0 | L371: 0 | M371: 0 | N371: 0 | O371: 0 | P371: 0 | Q371: 0 | R371: 0 | S371: 0 | T371: 0 | U371: 0 | V371: 0 | W371: 0 | X371: 1 | Y371: 0 | Z371: 0 | AA371: 0 | AB371: 0 | AC371: 0 | AD371: 0 | AE371: 0 | AF371: 0 | AG371: 0 | AH371: 0 | AI371: 0 | AJ371: 0 | AK371: 0 | AL371: 0 | AM371: 0 | AN371: 0 | AO371: 0 | AP371: 0 | AQ371: 0 | AR371: 0 | AS371: 0 | AT371: 0 | AU371: 0 | AV371: 0 | AW371: 0 | AX371: 0
F372: 0 | G372: 0 | H372: 0 | I372: 0 | J372: 0 | K372: 0 | L372: 0 | M372: 0 | N372: 0 | O372: 1 | P372: 0 | Q372: 0 | R372: 0 | S372: 0 | T372: 0 | U372: 0 | V372: 0 | W372: 0 | X372: 0 | Y372: 0 | Z372: 0 | AA372: 0 | AB372: 0 | AC372: 0 | AD372: 0 | AE372: 0 | AF372: 0 | AG372: 0 | AH372: 0 | AI372: 0 | AJ372: 0 | AK372: 0 | AL372: 0 | AM372: 0 | AN372: 0 | AO372: 0 | AP372: 0 | AQ372: 0 | AR372: 0 | AS372: 0 | AT372: 0 | AU372: 0 | AV372: 0 | AW372: 0 | AX372: 0
F373: 0 | G373: 0 | H373: 0 | I373: 0 | J373: 0 | K373: 0 | L373: 0 | M373: 0 | N373: 0 | O373: 1 | P373: 0 | Q373: 0 | R373: 0 | S373: 0 | T373: 0 | U373: 0 | V373: 0 | W373: 0 | X373: 0 | Y373: 0 | Z373: 0 | AA373: 0 | AB373: 0 | AC373: 0 | AD373: 0 | AE373: 0 | AF373: 0 | AG373: 0 | AH373: 0 | AI373: 0 | AJ373: 0 | AK373: 0 | AL373: 0 | AM373: 0 | AN373: 0 | AO373: 0 | AP373: 0 | AQ373: 0 | AR373: 0 | AS373: 0 | AT373: 0 | AU373: 0 | AV373: 0 | AW373: 0 | AX373: 0
F374: 0 | G374: 1 | H374: 0 | I374: 0 | J374: 0 | K374: 0 | L374: 0 | M374: 0 | N374: 0 | O374: 0 | P374: 0 | Q374: 0 | R374: 0 | S374: 0 | T374: 0 | U374: 0 | V374: 0 | W374: 0 | X374: 0 | Y374: 0 | Z374: 0 | AA374: 0 | AB374: 0 | AC374: 0 | AD374: 0 | AE374: 0 | AF374: 0 | AG374: 0 | AH374: 0 | AI374: 0 | AJ374: 0 | AK374: 0 | AL374: 0 | AM374: 0 | AN374: 0 | AO374: 0 | AP374: 0 | AQ374: 0 | AR374: 0 | AS374: 0 | AT374: 0 | AU374: 0 | AV374: 0 | AW374: 0 | AX374: 0
F375: 0 | G375: 1 | H375: 0 | I375: 0 | J375: 0 | K375: 0 | L375: 0 | M375: 0 | N375: 0 | O375: 0 | P375: 0 | Q375: 0 | R375: 0 | S375: 0 | T375: 0 | U375: 0 | V375: 0 | W375: 0 | X375: 0 | Y375: 0 | Z375: 0 | AA375: 0 | AB375: 0 | AC375: 0 | AD375: 0 | AE375: 0 | AF375: 0 | AG375: 0 | AH375: 0 | AI375: 0 | AJ375: 0 | AK375: 0 | AL375: 0 | AM375: 0 | AN375: 0 | AO375: 0 | AP375: 0 | AQ375: 0 | AR375: 0 | AS375: 0 | AT375: 0 | AU375: 0 | AV375: 0 | AW375: 0 | AX375: 0
F376: 0 | G376: 0 | H376: 0 | I376: 0 | J376: 0 | K376: 0 | L376: 0 | M376: 0 | N376: 0 | O376: 0 | P376: 0 | Q376: 0 | R376: 0 | S376: 0 | T376: 0 | U376: 0 | V376: 0 | W376: 0 | X376: 0 | Y376: 0 | Z376: 0 | AA376: 0 | AB376: 0 | AC376: 0 | AD376: 1 | AE376: 0 | AF376: 0 | AG376: 0 | AH376: 0 | AI376: 0 | AJ376: 0 | AK376: 0 | AL376: 0 | AM376: 0 | AN376: 0 | AO376: 0 | AP376: 0 | AQ376: 0 | AR376: 0 | AS376: 0 | AT376: 0 | AU376: 0 | AV376: 0 | AW376: 0 | AX376: 0
F377: 0 | G377: 0 | H377: 0 | I377: 0 | J377: 0 | K377: 0 | L377: 0 | M377: 0 | N377: 0 | O377: 0 | P377: 0 | Q377: 0 | R377: 0 | S377: 0 | T377: 0 | U377: 0 | V377: 0 | W377: 0 | X377: 0 | Y377: 0 | Z377: 0 | AA377: 0 | AB377: 0 | AC377: 0 | AD377: 1 | AE377: 0 | AF377: 0 | AG377: 0 | AH377: 0 | AI377: 0 | AJ377: 0 | AK377: 0 | AL377: 0 | AM377: 0 | AN377: 0 | AO377: 0 | AP377: 0 | AQ377: 0 | AR377: 0 | AS377: 0 | AT377: 0 | AU377: 0 | AV377: 0 | AW377: 0 | AX377: 0
F378: 0 | G378: 0 | H378: 0 | I378: 0 | J378: 0 | K378: 0 | L378: 0 | M378: 0 | N378: 0 | O378: 0 | P378: 0 | Q378: 0 | R378: 0 | S378: 0 | T378: 0 | U378: 0 | V378: 0 | W378: 0 | X378: 0 | Y378: 0 | Z378: 0 | AA378: 0 | AB378: 0 | AC378: 0 | AD378: 1 | AE378: 0 | AF378: 0 | AG378: 0 | AH378: 0 | AI378: 0 | AJ378: 0 | AK378: 0 | AL378: 0 | AM378: 0 | AN378: 0 | AO378: 0 | AP378: 0 | AQ378: 0 | AR378: 0 | AS378: 0 | AT378: 0 | AU378: 0 | AV378: 0 | AW378: 0 | AX378: 0
F379: 0 | G379: 0 | H379: 0 | I379: 0 | J379: 0 | K379: 0 | L379: 0 | M379: 0 | N379: 0 | O379: 0 | P379: 0 | Q379: 0 | R379: 0 | S379: 0 | T379: 0 | U379: 0 | V379: 0 | W379: 0 | X379: 0 | Y379: 0 | Z379: 0 | AA379: 0 | AB379: 0 | AC379: 0 | AD379: 1 | AE379: 0 | AF379: 0 | AG379: 0 | AH379: 0 | AI379: 0 | AJ379: 0 | AK379: 0 | AL379: 0 | AM379: 0 | AN379: 0 | AO379: 0 | AP379: 0 | AQ379: 0 | AR379: 0 | AS379: 0 | AT379: 0 | AU379: 0 | AV379: 0 | AW379: 0 | AX379: 0
F380: 0 | G380: 0 | H380: 0 | I380: 0 | J380: 0 | K380: 0 | L380: 0 | M380: 0 | N380: 0 | O380: 0 | P380: 0 | Q380: 0 | R380: 0 | S380: 0 | T380: 0 | U380: 0 | V380: 0 | W380: 0 | X380: 0 | Y380: 0 | Z380: 0 | AA380: 0 | AB380: 0 | AC380: 0 | AD380: 1 | AE380: 0 | AF380: 0 | AG380: 0 | AH380: 0 | AI380: 0 | AJ380: 0 | AK380: 0 | AL380: 0 | AM380: 0 | AN380: 0 | AO380: 0 | AP380: 0 | AQ380: 0 | AR380: 0 | AS380: 0 | AT380: 0 | AU380: 0 | AV380: 0 | AW380: 0 | AX380: 0
F381: 0 | G381: 0 | H381: 0 | I381: 0 | J381: 0 | K381: 0 | L381: 0 | M381: 0 | N381: 0 | O381: 0 | P381: 0 | Q381: 0 | R381: 0 | S381: 0 | T381: 0 | U381: 0 | V381: 0 | W381: 0 | X381: 0 | Y381: 0 | Z381: 0 | AA381: 0 | AB381: 0 | AC381: 0 | AD381: 1 | AE381: 0 | AF381: 0 | AG381: 0 | AH381: 0 | AI381: 0 | AJ381: 0 | AK381: 0 | AL381: 0 | AM381: 0 | AN381: 0 | AO381: 0 | AP381: 0 | AQ381: 0 | AR381: 0 | AS381: 0 | AT381: 0 | AU381: 0 | AV381: 0 | AW381: 0 | AX381: 0
F382: 0 | G382: 0 | H382: 0 | I382: 0 | J382: 0 | K382: 0 | L382: 0 | M382: 0 | N382: 0 | O382: 0 | P382: 0 | Q382: 0 | R382: 0 | S382: 0 | T382: 0 | U382: 0 | V382: 0 | W382: 0 | X382: 0 | Y382: 0 | Z382: 0 | AA382: 0 | AB382: 0 | AC382: 0 | AD382: 1 | AE382: 0 | AF382: 0 | AG382: 0 | AH382: 0 | AI382: 0 | AJ382: 0 | AK382: 0 | AL382: 0 | AM382: 0 | AN382: 0 | AO382: 0 | AP382: 0 | AQ382: 0 | AR382: 0 | AS382: 0 | AT382: 0 | AU382: 0 | AV382: 0 | AW382: 0 | AX382: 0
F383: 0 | G383: 0 | H383: 0 | I383: 0 | J383: 0 | K383: 0 | L383: 0 | M383: 0 | N383: 0 | O383: 0 | P383: 0 | Q383: 0 | R383: 0 | S383: 0 | T383: 0 | U383: 0 | V383: 0 | W383: 0 | X383: 0 | Y383: 0 | Z383: 0 | AA383: 0 | AB383: 0 | AC383: 0 | AD383: 1 | AE383: 0 | AF383: 0 | AG383: 0 | AH383: 0 | AI383: 0 | AJ383: 0 | AK383: 0 | AL383: 0 | AM383: 0 | AN383: 0 | AO383: 0 | AP383: 0 | AQ383: 0 | AR383: 0 | AS383: 0 | AT383: 0 | AU383: 0 | AV383: 0 | AW383: 0 | AX383: 0
F384: 0 | G384: 0 | H384: 0 | I384: 0 | J384: 0 | K384: 0 | L384: 0 | M384: 0 | N384: 0 | O384: 0 | P384: 0 | Q384: 0 | R384: 0 | S384: 0 | T384: 0 | U384: 0 | V384: 0 | W384: 0 | X384: 0 | Y384: 0 | Z384: 0 | AA384: 0 | AB384: 0 | AC384: 0 | AD384: 1 | AE384: 0 | AF384: 0 | AG384: 0 | AH384: 0 | AI384: 0 | AJ384: 0 | AK384: 0 | AL384: 0 | AM384: 0 | AN384: 0 | AO384: 0 | AP384: 0 | AQ384: 0 | AR384: 0 | AS384: 0 | AT384: 0 | AU384: 0 | AV384: 0 | AW384: 0 | AX384: 0
F385: 0 | G385: 0 | H385: 0 | I385: 0 | J385: 0 | K385: 0 | L385: 0 | M385: 0 | N385: 0 | O385: 0 | P385: 0 | Q385: 0 | R385: 0 | S385: 0 | T385: 0 | U385: 0 | V385: 0 | W385: 0 | X385: 0 | Y385: 0 | Z385: 0 | AA385: 0 | AB385: 0 | AC385: 0 | AD385: 1 | AE385: 0 | AF385: 0 | AG385: 0 | AH385: 0 | AI385: 0 | AJ385: 0 | AK385: 0 | AL385: 0 | AM385: 0 | AN385: 0 | AO385: 0 | AP385: 0 | AQ385: 0 | AR385: 0 | AS385: 0 | AT385: 0 | AU385: 0 | AV385: 0 | AW385: 0 | AX385: 0
F386: 0 | G386: 0 | H386: 0 | I386: 0 | J386: 0 | K386: 0 | L386: 0 | M386: 0 | N386: 0 | O386: 0 | P386: 0 | Q386: 0 | R386: 0 | S386: 0 | T386: 0 | U386: 0 | V386: 0 | W386: 0 | X386: 0 | Y386: 0 | Z386: 0 | AA386: 0 | AB386: 0 | AC386: 0 | AD386: 1 | AE386: 0 | AF386: 0 | AG386: 0 | AH386: 0 | AI386: 0 | AJ386: 0 | AK386: 0 | AL386: 0 | AM386: 0 | AN386: 0 | AO386: 0 | AP386: 0 | AQ386: 0 | AR386: 0 | AS386: 0 | AT386: 0 | AU386: 0 | AV386: 0 | AW386: 0 | AX386: 0
F387: 0 | G387: 0 | H387: 0 | I387: 0 | J387: 0 | K387: 0 | L387: 0 | M387: 0 | N387: 0 | O387: 0 | P387: 0 | Q387: 0 | R387: 0 | S387: 0 | T387: 0 | U387: 0 | V387: 0 | W387: 0 | X387: 0 | Y387: 0 | Z387: 0 | AA387: 0 | AB387: 0 | AC387: 0 | AD387: 1 | AE387: 0 | AF387: 0 | AG387: 0 | AH387: 0 | AI387: 0 | AJ387: 0 | AK387: 0 | AL387: 0 | AM387: 0 | AN387: 0 | AO387: 0 | AP387: 0 | AQ387: 0 | AR387: 0 | AS387: 0 | AT387: 0 | AU387: 0 | AV387: 0 | AW387: 0 | AX387: 0
F388: 0 | G388: 0 | H388: 0 | I388: 0 | J388: 0 | K388: 0 | L388: 0 | M388: 0 | N388: 0 | O388: 0 | P388: 0 | Q388: 0 | R388: 0 | S388: 0 | T388: 0 | U388: 0 | V388: 0 | W388: 0 | X388: 0 | Y388: 0 | Z388: 0 | AA388: 0 | AB388: 0 | AC388: 0 | AD388: 0 | AE388: 0 | AF388: 1 | AG388: 0 | AH388: 0 | AI388: 0 | AJ388: 0 | AK388: 0 | AL388: 0 | AM388: 0 | AN388: 0 | AO388: 0 | AP388: 0 | AQ388: 0 | AR388: 0 | AS388: 0 | AT388: 0 | AU388: 0 | AV388: 0 | AW388: 0 | AX388: 0
F389: 0 | G389: 0 | H389: 0 | I389: 0 | J389: 0 | K389: 0 | L389: 0 | M389: 0 | N389: 0 | O389: 0 | P389: 0 | Q389: 0 | R389: 0 | S389: 0 | T389: 0 | U389: 0 | V389: 0 | W389: 0 | X389: 0 | Y389: 0 | Z389: 0 | AA389: 0 | AB389: 0 | AC389: 0 | AD389: 0 | AE389: 1 | AF389: 0 | AG389: 0 | AH389: 0 | AI389: 0 | AJ389: 0 | AK389: 0 | AL389: 0 | AM389: 0 | AN389: 0 | AO389: 0 | AP389: 0 | AQ389: 0 | AR389: 0 | AS389: 0 | AT389: 0 | AU389: 0 | AV389: 0 | AW389: 0 | AX389: 0
F390: 0 | G390: 0 | H390: 0 | I390: 0 | J390: 0 | K390: 0 | L390: 0 | M390: 0 | N390: 0 | O390: 0 | P390: 0 | Q390: 0 | R390: 0 | S390: 0 | T390: 0 | U390: 0 | V390: 0 | W390: 0 | X390: 0 | Y390: 0 | Z390: 0 | AA390: 0 | AB390: 0 | AC390: 0 | AD390: 0 | AE390: 1 | AF390: 0 | AG390: 0 | AH390: 0 | AI390: 0 | AJ390: 0 | AK390: 0 | AL390: 0 | AM390: 0 | AN390: 0 | AO390: 0 | AP390: 0 | AQ390: 0 | AR390: 0 | AS390: 0 | AT390: 0 | AU390: 0 | AV390: 0 | AW390: 0 | AX390: 0
F391: 0 | G391: 0 | H391: 0 | I391: 0 | J391: 0 | K391: 0 | L391: 0 | M391: 0 | N391: 0 | O391: 0 | P391: 0 | Q391: 0 | R391: 0 | S391: 0 | T391: 0 | U391: 0 | V391: 0 | W391: 0 | X391: 0 | Y391: 0 | Z391: 0 | AA391: 0 | AB391: 0 | AC391: 0 | AD391: 0 | AE391: 0 | AF391: 0 | AG391: 0 | AH391: 0 | AI391: 0 | AJ391: 0 | AK391: 0 | AL391: 0 | AM391: 0 | AN391: 0 | AO391: 0 | AP391: 0 | AQ391: 0 | AR391: 1 | AS391: 0 | AT391: 0 | AU391: 0 | AV391: 0 | AW391: 0 | AX391: 0
F392: 0 | G392: 0 | H392: 0 | I392: 0 | J392: 0 | K392: 0 | L392: 0 | M392: 0 | N392: 0 | O392: 0 | P392: 0 | Q392: 0 | R392: 0 | S392: 0 | T392: 0 | U392: 0 | V392: 0 | W392: 0 | X392: 0 | Y392: 0 | Z392: 0 | AA392: 0 | AB392: 0 | AC392: 0 | AD392: 0 | AE392: 0 | AF392: 0 | AG392: 0 | AH392: 0 | AI392: 0 | AJ392: 0 | AK392: 0 | AL392: 0 | AM392: 0 | AN392: 0 | AO392: 0 | AP392: 0 | AQ392: 0 | AR392: 1 | AS392: 0 | AT392: 0 | AU392: 0 | AV392: 0 | AW392: 0 | AX392: 0
F393: 0 | G393: 0 | H393: 0 | I393: 0 | J393: 0 | K393: 0 | L393: 0 | M393: 0 | N393: 0 | O393: 0 | P393: 0 | Q393: 0 | R393: 0 | S393: 0 | T393: 0 | U393: 0 | V393: 0 | W393: 0 | X393: 0 | Y393: 0 | Z393: 0 | AA393: 0 | AB393: 0 | AC393: 0 | AD393: 0 | AE393: 0 | AF393: 0 | AG393: 0 | AH393: 0 | AI393: 0 | AJ393: 0 | AK393: 0 | AL393: 0 | AM393: 0 | AN393: 0 | AO393: 0 | AP393: 0 | AQ393: 0 | AR393: 1 | AS393: 0 | AT393: 0 | AU393: 0 | AV393: 0 | AW393: 0 | AX393: 0
F394: 0 | G394: 0 | H394: 0 | I394: 0 | J394: 0 | K394: 0 | L394: 0 | M394: 0 | N394: 0 | O394: 0 | P394: 0 | Q394: 0 | R394: 0 | S394: 0 | T394: 0 | U394: 0 | V394: 0 | W394: 0 | X394: 0 | Y394: 0 | Z394: 0 | AA394: 0 | AB394: 0 | AC394: 0 | AD394: 0 | AE394: 0 | AF394: 0 | AG394: 0 | AH394: 0 | AI394: 0 | AJ394: 0 | AK394: 0 | AL394: 0 | AM394: 0 | AN394: 0 | AO394: 0 | AP394: 0 | AQ394: 0 | AR394: 1 | AS394: 0 | AT394: 0 | AU394: 0 | AV394: 0 | AW394: 0 | AX394: 0
F395: 0 | G395: 0 | H395: 0 | I395: 0 | J395: 0 | K395: 0 | L395: 0 | M395: 0 | N395: 0 | O395: 0 | P395: 0 | Q395: 0 | R395: 0 | S395: 0 | T395: 0 | U395: 0 | V395: 0 | W395: 0 | X395: 0 | Y395: 0 | Z395: 0 | AA395: 0 | AB395: 0 | AC395: 0 | AD395: 0 | AE395: 0 | AF395: 0 | AG395: 0 | AH395: 0 | AI395: 0 | AJ395: 0 | AK395: 0 | AL395: 0 | AM395: 0 | AN395: 0 | AO395: 0 | AP395: 0 | AQ395: 0 | AR395: 1 | AS395: 0 | AT395: 0 | AU395: 0 | AV395: 0 | AW395: 0 | AX395: 0
F396: 0 | G396: 0 | H396: 0 | I396: 0 | J396: 0 | K396: 0 | L396: 0 | M396: 0 | N396: 0 | O396: 0 | P396: 0 | Q396: 0 | R396: 0 | S396: 0 | T396: 0 | U396: 0 | V396: 0 | W396: 0 | X396: 0 | Y396: 0 | Z396: 0 | AA396: 0 | AB396: 0 | AC396: 0 | AD396: 0 | AE396: 0 | AF396: 0 | AG396: 0 | AH396: 0 | AI396: 0 | AJ396: 0 | AK396: 0 | AL396: 0 | AM396: 0 | AN396: 0 | AO396: 0 | AP396: 0 | AQ396: 0 | AR396: 1 | AS396: 0 | AT396: 0 | AU396: 0 | AV396: 0 | AW396: 0 | AX396: 0
F397: 0 | G397: 0 | H397: 0 | I397: 0 | J397: 0 | K397: 0 | L397: 0 | M397: 0 | N397: 0 | O397: 0 | P397: 0 | Q397: 0 | R397: 0 | S397: 0 | T397: 0 | U397: 0 | V397: 0 | W397: 0 | X397: 0 | Y397: 0 | Z397: 0 | AA397: 0 | AB397: 0 | AC397: 0 | AD397: 0 | AE397: 0 | AF397: 0 | AG397: 0 | AH397: 0 | AI397: 0 | AJ397: 0 | AK397: 0 | AL397: 0 | AM397: 0 | AN397: 0 | AO397: 0 | AP397: 0 | AQ397: 0 | AR397: 1 | AS397: 0 | AT397: 0 | AU397: 0 | AV397: 0 | AW397: 0 | AX397: 0