A1: Suddivisione Corsi per Regione
A3: Regione | B3: Università | C3: Numero corsi | D3: Totale corsi
A4: Abruzzo | B4: L'Aquila | C4: 8 | D4: =SUM(C4:C5) -> 11
B5: Chieti e Pescara | C5: 3
A6: Calabria | B6: della Calabria | C6: 40 | D6: =SUM(C6:C8) -> 43
B7: Catanzaro | C7: 2
B8: Mediterranea | C8: 1
A9: Campania | B9: Napoli Federico II | C9: 12 | D9: =SUM(C9:C13) -> 24
B10: Salerno | C10: 7
B11: Benevento | C11: 2
B12: Napoli Parthenope | C12: 2
B13: Napoli Seconda Università | C13: 1
A14: Emilia Romagna | B14: Bologna | C14: 24 | D14: =SUM(C14:C17) -> 39
B15: Modena e Reggio Emilia | C15: 9
B16: Ferrara | C16: 4
B17: Parma | C17: 2
A18: Friuli Venezia Giulia | B18: Udine | C18: 9 | D18: =SUM(C18:C19) -> 15
B19: Trieste | C19: 6
A20: Lazio | B20: Roma La Sapienza | C20: 30 | D20: =SUM(C20:C22) -> 48
B21: Roma Tor Vergata | C21: 12
B22: Roma Tre | C22: 6
A23: Liguria | B23: Genova | C23: 26 | D23: =SUM(C23) -> 26
A24: Lombardia | B24: Poltecnico di Milano | C24: 21 | D24: =SUM(C24:C28) -> 46
B25: Milano Bicocca | C25: 10
B26: Brescia | C26: 8
B27: Milano Statale | C27: 5
B28: Milano Cattolica | C28: 2
A29: Marche | B29: Camerino | C29: 9 | D29: =SUM(C29:C30) -> 16
B30: Politecnico delle Marche | C30: 7
A31: Piemonte | B31: Torino PoliTO | C31: 14 | D31: =SUM(C31:C33) -> 18
B32: Torino | C32: 2
B33: Piemonte Orientale | C33: 2
A34: Puglia | B34: Foggia | C34: 2 | D34: =SUM(C34:C36) -> 20
B35: Lecce | C35: 11
B36: Bari | C36: 7
A37: Sardegna | B37: Cagliari | C37: 3 | D37: =SUM(C37:C38) -> 4
B38: Sassari | C38: 1
A39: Sicilia | B39: Palermo | C39: 8 | D39: =SUM(C39:C41) -> 16
B40: Catania | C40: 5
B41: Messina | C41: 3
A42: Toscana | B42: Firenze | C42: 13 | D42: =SUM(C42:C44) -> 33
B43: Pisa | C43: 15
B44: Siena | C44: 5
A45: Trentino Alto Adige | B45: Trento | C45: 7 | D45: =SUM(C45:C46) -> 11
B46: Bolzano | C46: 4
A47: Umbria | B47: Perugia | C47: 5 | D47: =SUM(C47) -> 5
A48: Veneto | B48: Padova | C48: 14 | D48: =SUM(C48:C49) -> 25
B49: Ca' Foscari | C49: 11
A50: Totale | D50: =SUM(D4:D49) -> 400