A1: Numero Studenti per Corso
B3: <25 | C3: 25-50 | D3: 50-100 | E3: 100-200 | F3: > 200 | G3: Altro | H3: Totale
A4: Numero | B4: 128 | C4: 110 | D4: 68 | E4: 54 | F4: 19 | G4: 21 | H4: =SUM(B4:G4) -> 400
A5: Percentuale | B5: =B4/$H$4*100 -> 32 | C5: =C4/$H$4*100 -> 27.5 | D5: =D4/$H$4*100 -> 17 | E5: =E4/$H$4*100 -> 13.5 | F5: =F4/$H$4*100 -> 4.75 | G5: =G4/$H$4*100 -> 5.25 | H5: =H4/$H$4*100 -> 100