A1: Fondamenti di Ricerca Operativa L-A
A2: Prova Scritta del 30 Marzo 2006
A4: Validita' per chi registra direttamente il voto: fino al 6 Aprile 2006, ore 16.00
A5: (non procrastinabile; non si risponde a mail o telefonate in merito).
A7: Validita' per chi sostiene l'orale: fino all'appello di Luglio 2006.
A8: Visione degli elaborati e orali: 6 Aprile 2006, ore 15.00, Aula 61
A9: Prossimi appelli: Giugno 2006, Luglio 2006
A11: matricola | B11: Cognome | C11: Nome | D11: 1 | E11: 2 | F11: bonus | G11: voto
A12: 140884 | B12: ARDONDI | C12: ROBERTO | D12: 15 | E12: 10 | F12: 0 | G12: =IF(SUM(D12:F12)<18,"Insuff.",SUM(D12:F12)) -> 25
A13: 158364 | B13: BALDI | C13: ERICK | D13: 12 | E13: 0 | F13: 3 | G13: =IF(SUM(D13:F13)<18,"Insuff.",SUM(D13:F13)) -> Insuff.
A14: 122282 | B14: BETTI | C14: ALESSANDRO | D14: 10 | E14: 2 | F14: 0 | G14: =IF(SUM(D14:F14)<18,"Insuff.",SUM(D14:F14)) -> Insuff.
A15: 161536 | B15: BEZZI | C15: FRANCESCO | D15: 13 | E15: 5 | F15: 0 | G15: =IF(SUM(D15:F15)<18,"Insuff.",SUM(D15:F15)) -> 18
A16: 122835 | B16: BORTONE | C16: ANDREA | D16: 0 | E16: 0 | F16: 0 | G16: =IF(SUM(D16:F16)<18,"Insuff.",SUM(D16:F16)) -> Insuff. | H16: (*)
A17: 149308 | B17: CAPUTO | C17: FABIO | D17: 14 | E17: 9 | F17: 0 | G17: =IF(SUM(D17:F17)<18,"Insuff.",SUM(D17:F17)) -> 23
A18: 160989 | B18: CAPUTO | C18: SIMONE | D18: 17 | E18: 8 | F18: 0 | G18: =IF(SUM(D18:F18)<18,"Insuff.",SUM(D18:F18)) -> 25
A19: 157315 | B19: CASCINI | C19: ALESSANDRO | D19: 17 | E19: 4 | F19: 0 | G19: =IF(SUM(D19:F19)<18,"Insuff.",SUM(D19:F19)) -> 21
A20: 192644 | B20: CIAMBERLANO | C20: FABRIZIO | D20: 11 | E20: 4 | F20: 0 | G20: =IF(SUM(D20:F20)<18,"Insuff.",SUM(D20:F20)) -> Insuff.
A21: 164846 | B21: COCCI | C21: GIACOMO | D21: 14 | E21: 9 | F21: 0 | G21: =IF(SUM(D21:F21)<18,"Insuff.",SUM(D21:F21)) -> 23
A22: 178651 | B22: CRISTIANI | C22: ALESSANDRO | D22: 18 | E22: 10 | F22: 0 | G22: =IF(SUM(D22:F22)<18,"Insuff.",SUM(D22:F22)) -> 28
A23: 160436 | B23: D'AGOSTINO | C23: STEFANO | D23: 14 | E23: 8 | F23: 0 | G23: =IF(SUM(D23:F23)<18,"Insuff.",SUM(D23:F23)) -> 22
A24: 159335 | B24: D'APOTE | C24: LEONARDO | D24: 18 | E24: 11 | F24: 0 | G24: =IF(SUM(D24:F24)<18,"Insuff.",SUM(D24:F24)) -> 29
A25: 159447 | B25: D'AVERSA | C25: DANILO | D25: 15 | E25: 4 | F25: 0 | G25: =IF(SUM(D25:F25)<18,"Insuff.",SUM(D25:F25)) -> 19
A26: 194783 | B26: DE TOGNI | C26: FRANCESCO | D26: 12 | E26: 5 | F26: 3 | G26: =IF(SUM(D26:F26)<18,"Insuff.",SUM(D26:F26)) -> 20
A27: 900022478 | B27: DI GIOVANNI | C27: FERDINANDO | D27: 8 | E27: 0 | F27: 3 | G27: =IF(SUM(D27:F27)<18,"Insuff.",SUM(D27:F27)) -> Insuff.
A28: 183315 | B28: DI NINNO | C28: MARCO | D28: 16 | E28: 6 | F28: 3 | G28: =IF(SUM(D28:F28)<18,"Insuff.",SUM(D28:F28)) -> 25
A29: 181550 | B29: DI PAOLO | C29: ALESSANDRO | D29: 15 | E29: 6 | F29: 3 | G29: =IF(SUM(D29:F29)<18,"Insuff.",SUM(D29:F29)) -> 24
A30: 163699 | B30: FALCONE | C30: FRANCESCO | D30: 14 | E30: 6 | F30: 0 | G30: =IF(SUM(D30:F30)<18,"Insuff.",SUM(D30:F30)) -> 20
A31: 166694 | B31: FARACI | C31: FABIO | D31: 12 | E31: 5 | F31: 0 | G31: 17 | H31: (**)
A32: 158021 | B32: FISCHIETTO | C32: DAVIDE | D32: 14 | E32: 0 | F32: 3 | G32: 17 | H32: (**)
A33: 182270 | B33: FRATONI | C33: ANDREA | D33: 15 | E33: 9 | F33: 3 | G33: =IF(SUM(D33:F33)<18,"Insuff.",SUM(D33:F33)) -> 27
A34: 180979 | B34: GENGA | C34: GIANLUCA | D34: 18 | E34: 5 | F34: 3 | G34: =IF(SUM(D34:F34)<18,"Insuff.",SUM(D34:F34)) -> 26
A35: 179487 | B35: GIONFALO | C35: FRANCESCO | D35: 7 | E35: 6 | F35: 0 | G35: =IF(SUM(D35:F35)<18,"Insuff.",SUM(D35:F35)) -> Insuff.
A36: 178237 | B36: GIULIANI | C36: MATTEO | D36: 18 | E36: 12 | F36: 3 | G36: =IF(SUM(D36:F36)<18,"Insuff.",SUM(D36:F36)) -> 33
A37: 159504 | B37: GRASSI | C37: ENRICO | D37: 9 | E37: 1 | F37: 0 | G37: =IF(SUM(D37:F37)<18,"Insuff.",SUM(D37:F37)) -> Insuff.
A38: 900018747 | B38: IANNUZZI | C38: CRISTIAN | D38: 12 | E38: 0 | F38: 3 | G38: =IF(SUM(D38:F38)<18,"Insuff.",SUM(D38:F38)) -> Insuff.
A39: 139629 | B39: IMPOSIMATO | C39: ARTURO | D39: 0 | E39: 0 | F39: 0 | G39: =IF(SUM(D39:F39)<18,"Insuff.",SUM(D39:F39)) -> Insuff. | H39: (*)
A40: 181832 | B40: KOUSSIS | C40: JONATHAN | D40: 6 | E40: 7 | F40: 0 | G40: =IF(SUM(D40:F40)<18,"Insuff.",SUM(D40:F40)) -> Insuff.
A41: 181321 | B41: LEONE | C41: GIUSEPPE | D41: 10 | E41: 12 | F41: 3 | G41: =IF(SUM(D41:F41)<18,"Insuff.",SUM(D41:F41)) -> 25
A42: 138627 | B42: MACCAFERRI | C42: DAVIDE | D42: 18 | E42: 0 | F42: 0 | G42: =IF(SUM(D42:F42)<18,"Insuff.",SUM(D42:F42)) -> 18
A43: 168278 | B43: MACRI | C43: PAOLO | D43: 9 | E43: 3 | F43: 0 | G43: =IF(SUM(D43:F43)<18,"Insuff.",SUM(D43:F43)) -> Insuff.
A44: 107899 | B44: MALVASIO | C44: ELISA | D44: 10 | E44: 2 | F44: 0 | G44: =IF(SUM(D44:F44)<18,"Insuff.",SUM(D44:F44)) -> Insuff.
A45: 124220 | B45: MANESE | C45: STEFANO GUERINO | D45: 12 | E45: 2 | F45: 0 | G45: =IF(SUM(D45:F45)<18,"Insuff.",SUM(D45:F45)) -> Insuff.
A46: 181340 | B46: MANNI | C46: TIZIANO | D46: 15 | E46: 4 | F46: 3 | G46: =IF(SUM(D46:F46)<18,"Insuff.",SUM(D46:F46)) -> 22
A47: 900012688 | B47: MARUCCIA | C47: ANTONIO | D47: 18 | E47: 12 | F47: 3 | G47: =IF(SUM(D47:F47)<18,"Insuff.",SUM(D47:F47)) -> 33
A48: 2108048325 | B48: MOSCHELLA | C48: MARIA | D48: 11 | E48: 0 | F48: 3 | G48: =IF(SUM(D48:F48)<18,"Insuff.",SUM(D48:F48)) -> Insuff.
A49: 166628 | B49: PALLA | C49: ALGERT | D49: 14 | E49: 6 | F49: 3 | G49: =IF(SUM(D49:F49)<18,"Insuff.",SUM(D49:F49)) -> 23
A50: 215783 | B50: PASQUALI | C50: NICOLA | D50: 10 | E50: 7 | F50: 3 | G50: =IF(SUM(D50:F50)<18,"Insuff.",SUM(D50:F50)) -> 20
A51: 168770 | B51: PIERANTOZZI | C51: MARCO | D51: 16 | E51: 1 | F51: 3 | G51: =IF(SUM(D51:F51)<18,"Insuff.",SUM(D51:F51)) -> 20
A52: 180982 | B52: PIETRELLI | C52: LUCA | D52: 18 | E52: 5 | F52: 0 | G52: =IF(SUM(D52:F52)<18,"Insuff.",SUM(D52:F52)) -> 23
A53: 142717 | B53: PIZZUTI | C53: GIANROCCO | D53: 15 | E53: 2 | F53: 0 | G53: 17 | H53: (**)
A54: 182697 | B54: POLIDORI | C54: MASSIMO | D54: 17 | E54: 4 | F54: 0 | G54: =IF(SUM(D54:F54)<18,"Insuff.",SUM(D54:F54)) -> 21
A55: 138968 | B55: ROMEO | C55: EMILIO | D55: 18 | E55: 0 | F55: 3 | G55: =IF(SUM(D55:F55)<18,"Insuff.",SUM(D55:F55)) -> 21
A56: 138633 | B56: ROSSI | C56: ANTONELLO | D56: 15 | E56: 8 | F56: 0 | G56: =IF(SUM(D56:F56)<18,"Insuff.",SUM(D56:F56)) -> 23
A57: 168871 | B57: ROTONDO | C57: RAFFAELE | D57: 15 | E57: 0 | F57: 3 | G57: =IF(SUM(D57:F57)<18,"Insuff.",SUM(D57:F57)) -> 18
A58: 169597 | B58: SABBATINI | C58: CRISTIAN | D58: 16 | E58: 1 | F58: 3 | G58: =IF(SUM(D58:F58)<18,"Insuff.",SUM(D58:F58)) -> 20
A59: 184040 | B59: SACCO | C59: ALEX | D59: 13 | E59: 2 | F59: 0 | G59: =IF(SUM(D59:F59)<18,"Insuff.",SUM(D59:F59)) -> Insuff.
A60: 187873 | B60: TOMASI | C60: NICOLETTA | D60: 18 | E60: 6 | F60: 3 | G60: =IF(SUM(D60:F60)<18,"Insuff.",SUM(D60:F60)) -> 27
A61: 2148063466 | B61: TRIGIANI | C61: ANTONIO | D61: 14 | E61: 0 | F61: 3 | G61: 17 | H61: (**)
A62: 162366 | B62: VAGNARELLI | C62: VALERIO | D62: 18 | E62: 12 | F62: 0 | G62: =IF(SUM(D62:F62)<18,"Insuff.",SUM(D62:F62)) -> 30
A63: 900012036 | B63: VERONA | C63: DAVIDE | D63: 16 | E63: 1 | F63: 0 | G63: 17 | H63: (**)
A64: (*) L'esito del prossimo appello verra' verbalizzato in ogni caso
A65: (**) Puo' registrare 18.