A1: Prova scritta di Ricerca Operativa del 6 Giugno 2000
A2: (Informatica, Elettronica, Telecomunicazioni)
A4: Validita': fino alla sessione autunnale A.A. 1999/2000
A5: Visione degli elaborati e orali: Mercoledi' 14 Giugno 2000 ore 15.00 Aula 6.1
A6: Prossimi appelli: 5 Luglio, Settembre, Ottobre
A8: Cognome | B8: Nome | C8: cdl | D8: matricola | E8: 1 | F8: 2 | G8: 3 | H8: bonus | I8: voto
A9: Accorsi | B9: Stefano | C9: 2148 | D9: 55091 | E9: 10 | F9: 8 | H9: 0 | I9: =E9+F9+G9+H9 -> 18
A10: Bicchecchi | B10: Davide | C10: 2148 | D10: 52921 | E10: 7 | F10: 10 | H10: 0 | I10: =E10+F10+G10+H10 -> 17 | J10: (*)
A11: Bonora | B11: Stefano | C11: 2148 | D11: 54217 | E11: 9 | F11: 7 | H11: 3 | I11: =E11+F11+G11+H11 -> 19
A12: Bravaccini | B12: Giovanni | C12: 2148 | D12: 52858 | E12: 6 | F12: 9 | H12: 3 | I12: =E12+F12+G12+H12 -> 18
A13: Busi | B13: Maurizio | C13: 2148 | D13: 43498 | E13: 13 | F13: 9 | H13: 3 | I13: =E13+F13+G13+H13 -> 25
A14: Canotti | B14: Lorenzo | C14: 2148 | D14: 57658 | E14: 4 | F14: 5 | H14: 3 | I14: Insuff.
A15: Caremi | B15: Claudio | C15: 2148 | D15: 57802 | E15: 17 | F15: 11 | H15: 3 | I15: =E15+F15+G15+H15 -> 31
A16: Carloni | B16: Nico | C16: 2148 | D16: 57083 | E16: 18 | F16: 8 | H16: 0 | I16: =E16+F16+G16+H16 -> 26
A17: Cavasassi | B17: Emanuele | C17: 2148 | D17: 60430 | E17: 14 | F17: 11 | H17: 3 | I17: =E17+F17+G17+H17 -> 28
A18: Cherin | B18: Renzo | C18: 2148 | D18: 52454 | E18: 17 | F18: 3 | H18: 3 | I18: =E18+F18+G18+H18 -> 23
A19: De Poda | B19: Andrea | C19: 2148 | D19: 58041 | E19: 17 | F19: 4 | H19: 3 | I19: =E19+F19+G19+H19 -> 24
A20: Drudi | B20: Maria Elena | C20: 2148 | D20: 50743 | E20: 6 | F20: 3 | H20: 3 | I20: Insuff.
A21: Fiuzzi | B21: Luca | C21: 2148 | D21: 60140 | E21: 16 | F21: 7 | H21: 3 | I21: =E21+F21+G21+H21 -> 26
A22: Guidetti | B22: Marco | C22: 2148 | D22: 50509 | E22: 17 | F22: 7 | H22: 3 | I22: =E22+F22+G22+H22 -> 27
A23: Iobbi | B23: Cristian | C23: 2148 | D23: 50293 | E23: 14 | F23: 4 | H23: 3 | I23: =E23+F23+G23+H23 -> 21
A24: Losco | B24: Abele | C24: 2108 | D24: 50476 | E24: 5 | F24: 9 | H24: 3 | I24: =E24+F24+G24+H24 -> 17 | J24: OK
A25: Luppoli | B25: Davide | C25: 2148 | D25: 59774 | E25: 15 | F25: 8 | H25: 3 | I25: =E25+F25+G25+H25 -> 26
A26: Predoli | B26: Gabriele | C26: 2148 | D26: 54895 | E26: 12 | F26: 9 | H26: 3 | I26: =E26+F26+G26+H26 -> 24
A27: Salzillo | B27: Domenico | C27: 2148 | D27: 47736 | E27: 13 | F27: 4 | H27: 3 | I27: =E27+F27+G27+H27 -> 20
A28: Scrilatti | B28: Marco | C28: 2148 | D28: 59364 | E28: 7 | F28: 8 | H28: 3 | I28: =E28+F28+G28+H28 -> 18
A29: Stagni | B29: Maurizio | C29: 2148 | D29: 55634 | E29: 4 | F29: 4 | H29: 3 | I29: Insuff.
A30: Volta | B30: Andrea | C30: 2146 | D30: 47710 | E30: 14 | F30: 1 | H30: 3 | I30: =E30+F30+G30+H30 -> 18
A31: Zampetti | B31: Daniela | C31: 2148 | D31: 59332 | E31: 16 | F31: 11 | H31: 3 | I31: =E31+F31+G31+H31 -> 30
A32: (*) Il 14 Giugno comunichi se preferisce accettare o avere insufficienza e mantenere il bonus