A1: Prova scritta di Ricerca Operativa del 23 Febbraio 2000
A2: (Informatica, Elettronica, Telecomunicazioni)
A4: Validita': fino alla sessione estiva A.A. 1999/2000
A5: Visione degli elaborati e orali: Venerdi' 3 Marzo 2000
A6: Prossimi appelli: meta' Febbraio, Maggio
A8: Cognome | B8: Nome | C8: cdl | D8: matricola | E8: 1 | F8: 2 | G8: 3 | H8: bonus | I8: voto
A9: Agostinelli | B9: Fabrizio | C9: 2148 | D9: 58462 | H9: 3 | I9: =E9+F9+G9+H9 -> 3
A10: Allori | B10: Barbara | C10: 2148 | D10: 54643 | H10: 3 | I10: =E10+F10+G10+H10 -> 3
A11: Borsatti | B11: Andrea | C11: 2148 | D11: 48048 | H11: 3 | I11: =E11+F11+G11+H11 -> 3
A12: Cacchiani | B12: Valentina | C12: 2148 | D12: 58319 | H12: 3 | I12: =E12+F12+G12+H12 -> 3
A13: Carboni | B13: Massimo | C13: 2148 | D13: 52639 | H13: 3 | I13: =E13+F13+G13+H13 -> 3
A14: Cesaretto | B14: Cristiano | C14: 2148 | D14: 54452 | H14: 3 | I14: =E14+F14+G14+H14 -> 3
A15: Cesari | B15: Enrico | C15: 2108 | D15: 43306 | H15: 3 | I15: =E15+F15+G15+H15 -> 3
A16: Chiari | B16: Massimo | C16: 2148 | D16: 43589 | H16: 3 | I16: =E16+F16+G16+H16 -> 3
A17: De Maria | B17: Alessandra | C17: 2148 | D17: 60001 | H17: 3 | I17: =E17+F17+G17+H17 -> 3
A18: Fabbri | B18: Emanuela | C18: 2148 | D18: 60340 | H18: 3 | I18: =E18+F18+G18+H18 -> 3
A19: Fabbri | B19: Luca | C19: 2148 | D19: 57408 | H19: 3 | I19: =E19+F19+G19+H19 -> 3
A20: Falzoni | B20: Alberto | C20: 2148 | D20: 54418 | H20: 3 | I20: =E20+F20+G20+H20 -> 3
A21: Ferrante | B21: Paolo | C21: 2148 | D21: 57525 | H21: 3 | I21: =E21+F21+G21+H21 -> 3
A22: Ferretti | B22: Alessio | C22: 2148 | D22: 59709 | H22: 3 | I22: =E22+F22+G22+H22 -> 3
A23: Garbati | B23: Mirco | C23: 2148 | D23: 55144 | H23: 3 | I23: =E23+F23+G23+H23 -> 3
A24: Gherardi | B24: Daniele | C24: 2148 | D24: 48050 | H24: 3 | I24: =E24+F24+G24+H24 -> 3
A25: Girotti | B25: Stefano | C25: 2148 | D25: 55730 | H25: 3 | I25: =E25+F25+G25+H25 -> 3
A26: Gordini | B26: Angelo | C26: 2148 | D26: 59483 | H26: 3 | I26: =E26+F26+G26+H26 -> 3
A27: Iacovella | B27: Mauro | C27: 2148 | D27: 52636 | H27: 3 | I27: =E27+F27+G27+H27 -> 3
A28: Lilli | B28: Alessandro | C28: 2148 | D28: 56984 | H28: 3 | I28: =E28+F28+G28+H28 -> 3
A29: Macchiavelli | B29: Enrico | C29: 2148 | D29: 48266 | H29: 3 | I29: =E29+F29+G29+H29 -> 3
A30: Magi | B30: Giovanni | C30: 2148 | D30: 60080 | H30: 3 | I30: =E30+F30+G30+H30 -> 3
A31: Mariotti | B31: Cristian | C31: 2148 | D31: 57928 | H31: 3 | I31: =E31+F31+G31+H31 -> 3
A32: Massera | B32: Riccardo | C32: 2108 | D32: 43623 | H32: 3 | I32: =E32+F32+G32+H32 -> 3
A33: Melotti | B33: Riccardo | C33: 2148 | D33: 55173 | H33: 3 | I33: =E33+F33+G33+H33 -> 3
A34: Migani | B34: Romina | C34: 2148 | D34: 43520 | H34: 3 | I34: =E34+F34+G34+H34 -> 3
A35: Milandri | B35: Andrea | C35: 2148 | D35: 57368 | H35: 3 | I35: =E35+F35+G35+H35 -> 3
A36: Montanari | B36: Andrea | C36: 2108 | D36: 43725 | H36: 3 | I36: =E36+F36+G36+H36 -> 3
A37: Morelli | B37: Franco | C37: 2143 | D37: 52737 | H37: 3 | I37: =E37+F37+G37+H37 -> 3
A38: Orfei | B38: Marco | C38: 2148 | D38: 60167 | H38: 3 | I38: =E38+F38+G38+H38 -> 3
A39: Paolucci | B39: Miriam | C39: 2148 | D39: 57347 | H39: 3 | I39: =E39+F39+G39+H39 -> 3
A40: Piancastelli | B40: Giulio | C40: 2148 | D40: 54500 | H40: 3 | I40: =E40+F40+G40+H40 -> 3
A41: Rappini | B41: Luca | C41: 2148 | D41: 57275 | H41: 3 | I41: =E41+F41+G41+H41 -> 3
A42: Ricci | B42: Alessandro | C42: 2148 | D42: 53079 | H42: 3 | I42: =E42+F42+G42+H42 -> 3
A43: Ruffini | B43: Lorenzo | C43: 2148 | D43: 57034 | H43: 3 | I43: =E43+F43+G43+H43 -> 3
A44: Taccetti | B44: Francesco | C44: 2148 | D44: 59806 | H44: 3 | I44: =E44+F44+G44+H44 -> 3
A45: Tassi | B45: Davide | C45: 2006 | D45: 41815 | H45: 3 | I45: =E45+F45+G45+H45 -> 3
A46: Terregna | B46: Giampiero | C46: 2006 | D46: 40371 | H46: 3 | I46: =E46+F46+G46+H46 -> 3
A47: Tomasi | B47: Lorenzo | C47: 2106 | D47: 57049 | H47: 3 | I47: =E47+F47+G47+H47 -> 3
A48: Ugolini | B48: Matteo | C48: 2148 | D48: 52557 | H48: 3 | I48: =E48+F48+G48+H48 -> 3
A49: Venturi | B49: Emanuel | C49: 2148 | D49: 59256 | H49: 3 | I49: =E49+F49+G49+H49 -> 3