A9: 41824 | B9: BARACCANI KATIA | C9: 9 | D9: 1 | E9: 5 | G9: 3 | I9: 18
A11: 42058 | B11: BERTINI GIULIO | C11: 7 | D11: 4 | E11: 5 | G11: 3 | I11: 19
A13: 43325 | B13: CAVALLINI LUCA | C13: 4 | D13: 7 | E13: 4 | G13: 3 | I13: 18
A15: 36524 | B15: MORELLI GIANNI | C15: 2 | D15: 3 | E15: 0 | G15: 3 | H15: A | I15: nnul | J15: lato (*)
A17: 42144 | B17: PIERACCINI GABRIELE | C17: 11 | D17: 3 | E17: 7 | G17: 3 | I17: 24
A19: 41855 | B19: AMOROSO MICHELE | C19: 2 | D19: 3 | F19: 10 | G19: 3 | I19: 18
A21: 42130 | B21: PALUMBO MAURO | C21: 3 | D21: 7 | F21: 10 | G21: 3 | I21: 23
A23: 37439 | B23: CESARONI ANDREA | C23: 7 | D23: 6 | F23: 4 | H23: 3 | J23: 20
A25: 42370 | B25: BUCCI ANDREA | C25: 18 | D25: 10 | H25: 3 | J25: 31
A27: 43237 | B27: CAMILLI MARCO | C27: 2 | D27: 7 | F27: 3 | H27: 3 | J27: 15 (ammesso)
A29: 39485 | B29: CARDELLI ALESSANDRO | C29: 15 | D29: 2 | H29: 3 | J29: 20
A31: 43399 | B31: COSTA ANDREA | C31: 12 | D31: 3 | H31: 3 | J31: 18
A33: 41660 | B33: LIGUORO ANDREA | C33: 9 | D33: 6 | H33: 3 | J33: 18
A35: 43447 | B35: MARCHETTI MASSIMO | C35: 18 | D35: 2 | H35: 3 | J35: 23
A37: 41659 | B37: MOLINI DAVIDE | C37: 20 | D37: 5 | H37: 3 | J37: 28
A39: -------- | B39: ----------------------- | C39: -------- | D39: ------ | E39: ---- | F39: --- | G39: ----- | H39: -- | I39: ---- | J39: ------------
B41: PROVA SCRITTA DI RICER | C41: CA OPERA | D41: TIVA D | E41: EL 2 | F41: 7 G | G41: ENNAI | H41: O | I41: 1994
B43: (VALIDITA': fino all | C43: a sessio | D43: ne Est | E43: iva | F43: A.A | G43: . 199 | H43: 3/ | I43: 94)
A45: Visione | B45: degli elaborati: esclu | C45: sivament | D45: e Vene | E45: rdi' | F45: 4 | G45: Febbr | H45: ai | I45: o 11 | J45: .30 Aula 4.2
A47: Orali: | B47: Lunedi' 14 Febbraio 11. | C47: 00 Aula | D47: 0.25069444444444444
A49: Prossim | B49: i appelli: Marzo (la da | C49: ta sara' | D49: comun | E49: icat | F49: a d | G49: opo l | H49: 'i | I49: nizi | J49: o delle
B50: lezio | C50: ni del | D50: II^ c | E50: iclo | F50: ; e | G50: ' gi | H50: a' | I50: po | J50: ssibile
B51: preno | C51: tarsi al | D51: termi | E51: nale | F51: )
B52: Giugno
B53: Luglio
A55: -------- | B55: ----------------------- | C55: -------- | D55: ------ | E55: ---- | F55: --- | G55: ----- | H55: -- | I55: ---- | J55: ------------
C56: I^ | D56: II^ | E56: I | F56: II^ | G56: bon | H56: us | J56: TOT
A57: -------- | B57: ----------------------- | C57: -------- | D57: ------ | E57: ---- | F57: --- | G57: ----- | H57: -- | I57: ---- | J57: ------------
A59: 41551 | B59: ALDROVANDI MARCO | C59: 14 | D59: 9 | H59: 3 | J59: 26
A61: 43509 | B61: BAROCCI MASSIMO | C61: 12 | D61: 13 | H61: 3 | J61: 28
A63: 43968 | B63: BENINI MARCO | C63: 17 | D63: 10 | H63: 3 | J63: 30
A65: 43443 | B65: CANDINI SIRIO | C65: 12 | D65: 13 | H65: 3 | J65: 28
A67: 38779 | B67: CECCONI GIOVANNI | C67: 10 | D67: 10 | H67: 3 | J67: 23
A69: 46184 | B69: CENNI MASSIMILIANO | C69: 8 | D69: 13 | H69: 3 | J69: 24
A71: 43947 | B71: FRANCESCONI MARCO | C71: 13 | D71: 5 | H71: 3 | J71: 21
A73: 46546 | B73: GENOVESE FRANCO | C73: 9 | D73: 8 | H73: 3 | J73: 20
A75: 44555 | B75: MANZINI ANDREA | C75: 7 | D75: 5 | H75: - | J75: I
A77: 43328 | B77: MAZZANTI MARCO | C77: 11 | D77: 13 | H77: 3 | J77: 27
A79: 37667 | B79: POLIANDRI VINCENZA | C79: 9 | D79: 8 | H79: 3 | J79: 20
A81: 41243 | B81: RINALDI STEFANO | C81: 17 | D81: 10 | H81: 3 | J81: 30
A83: 40422 | B83: SCHEMBARI ROBERTO | C83: 16 | D83: 6 | H83: 3 | J83: 25
A85: 43318 | B85: SCILLITANI ALESSANDRO | C85: 14 | D85: 10 | H85: 3 | J85: 27
A87: 42148 | B87: SEVERI CLAUDIO | C87: 14 | D87: 11 | H87: 3 | J87: 28
A89: 43380 | B89: TALIANI MARCO | C89: 16 | D89: 4 | H89: 3 | J89: 23
A91: 42015 | B91: TROMBINI FRANCESCO | C91: 3 | D91: 9 | H91: - | J91: I
A93: 36151 | B93: VALLARA MARTINO | C93: 16 | D93: 2 | H93: 3 | J93: 21
A95: 42133 | B95: ZAVAGLI PAOLA | C95: 10 | D95: 4 | H95: - | J95: I
A97: -------- | B97: ----------------------- | C97: -------- | D97: ------ | E97: ---- | F97: --- | G97: ----- | H97: -- | I97: ---- | J97: ------------
A99: -------- | B99: ----------------------- | C99: -------- | D99: ------ | E99: ---- | F99: --- | G99: ----- | H99: -- | I99: ---- | J99: ------------
B101: PROVA SCRITTA DI RICER | C101: CA OPERA | D101: TIVA D | E101: EL 4 | F101: MA | G101: RZO 1 | H101: 99 | I101: 4
B103: (VALIDITA': fino all | C103: a sessio | D103: ne Est | E103: iva | F103: A.A | G103: . 199 | H103: 3/ | I103: 94)
A105: Visione | B105: degli elaborati e oral | C105: i: Vener | D105: di' 11 | E105: Mar | F105: zo | G105: ore 1 | H105: 0.25 | I105: 0 | J105: ula 6.1
A107: Prossim | B107: i appelli: Giugno
B108: Luglio
A110: -------- | B110: ----------------------- | C110: -------- | D110: ------ | E110: ---- | F110: --- | G110: ----- | H110: -- | I110: ---- | J110: ------------
C111: I^ | D111: II^ | G111: bon | H111: us | J111: TOT
A112: -------- | B112: ----------------------- | C112: -------- | D112: ------ | E112: ---- | F112: --- | G112: ----- | H112: -- | I112: ---- | J112: ------------
A114: 41073 | B114: ANCESCHI GIOVANNI | C114: 8 | D114: 10 | H114: 3 | J114: 21
A116: 43730 | B116: BACHINI MICHELE | C116: 14 | D116: 6 | H116: 3 | J116: 23
A118: 42533 | B118: BELLESIA PAOLO | C118: 14 | D118: 1 | H118: 3 | J118: 18
A120: 43363 | B120: BERNABEI ANGELO | C120: 13 | D120: 8 | H120: 3 | J120: 24
A122: 38643 | B122: BERNARDI LUCA | C122: 9 | D122: 9 | H122: 3 | J122: 21
A124: 43695 | B124: BIANCHI GIOVANNI MARI | C124: A 9 | D124: 6 | H124: 3 | J124: 18
A126: 35877 | B126: BOVO MICHELE | C126: 3 | D126: 12 | H126: 3 | J126: 18
A128: 39018 | B128: BUDA ALESSANDRO | C128: 16 | D128: 5 | H128: 3 | J128: 24
A130: 43237 | B130: CAMILLI MARCO | C130: 11 | D130: 13 | H130: 0 | J130: 24
A132: 37729 | B132: CASET GIOVANNI | C132: 11 | D132: 4 | H132: 3 | J132: 18
A134: 43371 | B134: CENNI MAURIZIO | C134: 17 | D134: 9 | H134: 3 | J134: 29
A136: 44506 | B136: COEN RAFFAELLA | C136: 12 | D136: 8 | H136: 3 | J136: 23
A138: 43399 | B138: COSTA ANDREA | C138: 7 | D138: 7 | H138: 0 | J138: I
A140: 41883 | B140: COVEZZI STEFANO | C140: 9 | D140: 6 | H140: 3 | J140: 18
A142: 37603 | B142: DI LANZO PASQUALINO | C142: 10 | D142: 6 | H142: 3 | J142: 19
A144: 43394 | B144: FANTI FABIO | C144: 13 | D144: 6 | H144: 3 | J144: 22
A146: 43416 | B146: FORTUNATI ANDREA | C146: 14 | D146: 1 | H146: 3 | J146: 18
A148: 43761 | B148: GALDINI CRISTIAN | C148: 16 | D148: 8 | H148: 3 | J148: 27
A150: 45787 | B150: GAUDENZI ROBERTO | C150: 17 | D150: 6 | H150: 3 | J150: 26
A152: 41752 | B152: GHETTI ROMANO | C152: 17 | D152: 12 | H152: 3 | J152: 32
A154: 41750 | B154: GILIBERTO GIANPAOLO | C154: 10 | D154: 10 | H154: 3 | J154: 23
A156: 43471 | B156: GORI ROBERTO | C156: 17 | D156: 5 | H156: 3 | J156: 25
A158: 35673 | B158: GRESLERI STEFANO | C158: 11 | D158: 8 | H158: 3 | J158: 22
A160: 43280 | B160: MIGLIOZZI STEFANO | C160: 10 | D160: 3 | H160: - | J160: I
A162: 43506 | B162: MONARI MARINA | C162: 12 | D162: 3 | H162: 3 | J162: 18
A164: 42488 | B164: MONTANARI LUCA | C164: 17 | D164: 12 | H164: 3 | J164: 32
A166: 40833 | B166: MONTORSI ENRICO | C166: 11 | D166: - | H166: - | J166: I
A168: 38791 | B168: MORETTI DANILO | C168: 17 | D168: 1 | H168: 3 | J168: 21
A170: 38114 | B170: MOSSI CESARE | C170: 17 | D170: 10 | H170: 3 | J170: 30
A172: 45630 | B172: MUSIANI DAVIDE | C172: 17 | D172: 11 | H172: 3 | J172: 31
A174: 43246 | B174: NANNI RICCARDO | C174: 14 | D174: 12 | H174: 3 | J174: 29
A176: 44763 | B176: OLIVIERI FRANCESCO | C176: 14 | D176: 9 | H176: 3 | J176: 26
A178: 44041 | B178: PASSONI GIOVANNI | C178: 14 | D178: 9 | H178: 3 | J178: 26
A180: 43782 | B180: POGGI PAOLO | C180: 17 | D180: 5 | H180: 3 | J180: 25
A182: 43907 | B182: PRANDINI MARCO | C182: 17 | D182: 13 | H182: 3 | J182: 33
A184: 36106 | B184: ROSSI ALESSANDRO | C184: 17 | D184: 8 | H184: 3 | J184: 28
A186: 42087 | B186: SCIOTTO FORTUNATA | C186: 13 | D186: 11 | H186: 3 | J186: 27
A188: 45880 | B188: SEMERARO QUIRICO | C188: 17 | D188: 5 | H188: 3 | J188: 25
A190: 0 | B190: STEFAN JUDIT | C190: 10 | D190: 13 | H190: 3 | J190: 26
A192: 40537 | B192: SUPRANI RICCARDO | C192: 14 | D192: 3 | H192: 3 | J192: 20
A194: 41842 | B194: TESSARI RITA | C194: 13 | D194: 2 | H194: 3 | J194: 18
A196: 45664 | B196: TOSELLI MARCO | C196: 17 | D196: 4 | H196: 3 | J196: 24
A198: 40273 | B198: VANNINI MICHELE | C198: 11 | D198: 12 | H198: 3 | J198: 26
A200: 40287 | B200: VENUTI MARCO | C200: 17 | D200: 6 | H200: 3 | J200: 26
A202: 40699 | B202: VINCENZI ANTONIO | C202: 14 | D202: 5 | H202: 3 | J202: 22
A204: 38997 | B204: VIRGILI MARINO*** | C204: 14 | D204: 8 | H204: 3 | J204: 25
B205: (Parte militare, port | C205: a dich.; | D205: tener | E205: e fi | F205: no | G205: a Set | H205: te | I205: mbre | J205: 1994)
A206: 38795 | B206: ZUCCHI ANDREA | C206: 17 | D206: 13 | H206: 3 | J206: 33
A208: -------- | B208: ----------------------- | C208: -------- | D208: ------ | E208: ---- | F208: --- | G208: ----- | H208: -- | I208: ---- | J208: ------------
A209: -------- | B209: ----------------------- | C209: -------- | D209: ------ | E209: ---- | F209: --- | G209: ----- | H209: -- | I209: ---- | J209: ------------
B211: PROVA SCRITTA DI RICER | C211: CA OPERA | D211: TIVA D | E211: EL 6 | F211: GI | G211: UGNO | H211: 19 | I211: 94
B213: (VALIDITA': fino all | C213: a Sessio | D213: ne AUT | E213: UNNA | F213: LE | G213: A.A. | H213: 19 | I213: 93/9 | J213: 4)
A215: Visione | B215: degli elaborati e oral | C215: i: Luned | D215: i' 13 | E215: Giug | F215: no | G215: ore 1 | H215: 0.20833333333333334 | I215: 0 | J215: ula 6.1
A217: Prossim | B217: i appelli: Luglio
B218: Settembre
A220: -------- | B220: ----------------------- | C220: -------- | D220: ------ | E220: ---- | F220: --- | G220: ----- | H220: -- | I220: ---- | J220: ------------
C221: I^ | D221: II^ | E221: I | F221: II^ | H221: b | I221: onus | J221: TOT
A222: -------- | B222: ----------------------- | C222: -------- | D222: ------ | E222: ---- | F222: --- | G222: ----- | H222: -- | I222: ---- | J222: ------------
A224: 43879 | B224: AMADEI LUCA | C224: 9 | D224: 3 | F224: 7 | I224: 3 | J224: 22
A226: 41855 | B226: AMOROSO MICHELE | C226: 12 | D226: 5 | F226: 8 | I226: 0 | J226: 25
A228: 43990 | B228: BEZZI ADRIANO | C228: 10 | D228: 4 | F228: 6 | I228: 3 | J228: 23
A230: 42890 | B230: BRIGHETTI UMBERTO | C230: 9 | D230: 3 | F230: 8 | I230: 3 | J230: 23
A232: 39084 | B232: CHIAVARINI DONATELLA | C232: 9 | D232: 1 | F232: 6 | I232: 3 | J232: 19
A234: 40728 | B234: COLTORTI MANUEL | C234: 9 | D234: 4 | F234: 2 | I234: 3 | J234: 18
A236: 42271 | B236: DE LUCA GIANPIERO SEB | C236: AST. 6 | D236: 3 | F236: 8 | I236: 3 | J236: 20
A238: 45868 | B238: GAVAGNI RUDY | C238: 8 | D238: 2 | F238: 5 | I238: 3 | J238: 18
A240: 37347 | B240: GENTILE CARLA | C240: 14 | D240: 3 | F240: 8 | I240: 3 | J240: 28
A242: 33666 | B242: GINTOLI GIOVANNI | C242: 9 | D242: 3 | F242: 6 | I242: 3 | J242: 21
A244: 44723 | B244: GUIDETTI ROBERTO | C244: 6 | D244: 4 | F244: 5 | I244: 3 | J244: 18
A246: 45788 | B246: LANDI MIRKO | C246: 10 | D246: 5 | F246: 6 | I246: 3 | J246: 24
A248: 44555 | B248: MANZINI ANDREA | C248: 7 | D248: 0 | F248: 1 | I248: - | J248: I
A250: 44397 | B250: MARTINELLI FABIO | C250: 12 | D250: 0 | F250: 6 | I250: 3 | J250: 21
A252: 42144 | B252: PIERACCINI GABRIELE | C252: 9 | D252: 5 | F252: 8 | I252: 0 | J252: 22
A254: 42673 | B254: SICILIANO PAOLO | C254: 2 | D254: 4 | F254: 0 | I254: - | J254: I
A256: 45689 | B256: TILLI ANDREA | C256: 17 | D256: 4 | F256: 6 | I256: 3 | J256: 30
A258: 34588 | B258: TOTARO FILOMENA | C258: 5 | D258: 1 | F258: 2 | I258: - | J258: I
A260: 42015 | B260: TROMBINI FRANCESCO | C260: 13 | D260: 1 | F260: 2 | I260: 3 | J260: 19
A262: 34165 | B262: VERDINELLI DAVIDE | C262: 5 | D262: 3 | F262: 3 | I262: - | J262: 17
A263: ________ | B263: _______________________ | C263: ________ | D263: ______ | E263: ____ | F263: ___ | G263: _____ | H263: __ | I263: ____ | J263: _________
B265: PROVA SCRITTA DI RICER | C265: CA OPERA | D265: TIVA D | E265: EL 6 | F265: LU | G265: GLIO | H265: 19 | I265: 94
B267: (VALIDITA': fino alla S | C267: essione | D267: AUTUNN | E267: ALE | F267: A.A | G267: . 199 | H267: 3/ | I267: 94)
A269: Visione | B269: degli elaborati e oral | C269: i: Merco | D269: ledi' | E269: 13 L | F269: ugl | G269: io or | H269: e | I269: 0.625 | J269: 0 Aula 5.6
A271: Prossim | B271: i appelli: Settembre
B272: Ottobre
A274: -------- | B274: ----------------------- | C274: -------- | D274: ------ | E274: ---- | F274: --- | G274: ----- | H274: -- | I274: ---- | J274: ------------
C275: I^ | D275: II^ | E275: b | F275: onu | G275: s | H275: T | I275: OT
A276: -------- | B276: ----------------------- | C276: -------- | D276: ------ | E276: ---- | F276: --- | G276: ----- | H276: -- | I276: ---- | J276: ------------
A278: 42010 | B278: AIELLO MICHELE | C278: 15 | D278: 7 | G278: 3 | I278: 25
A280: 35864 | B280: BALDINI GABRIELE | C280: 14 | D280: 5 | G280: 3 | I280: 22
A282: 39454 | B282: BALLABENI ALBERTO | C282: 15 | D282: 7 | G282: 0 | I282: 22
A284: 36380 | B284: CASADIDIO ALBERTO | C284: 16 | D284: 8 | G284: 3 | I284: 27
A286: 43399 | B286: COSTA ANDREA | C286: 17 | D286: 5 | G286: 0 | I286: 22
A288: 0xxxxx | B288: DELL'AMORE MICHELE | C288: 12 | D288: 8 | G288: 3 | I288: 23
B289: (Comunicare numero di | C289: matrico | D289: la)
A291: 48147 | B291: MONTORSI GIULIANO | C291: 11 | D291: 8 | G291: 3 | I291: 22
A293: 44441 | B293: RIGUZZI FABRIZIO | C293: 16 | D293: 12 | G293: 3 | I293: 31
A295: 34588 | B295: TOTARO FILOMENA | C295: 9 | D295: 6 | G295: 3 | I295: 18
A297: 42133 | B297: ZAVAGLI PAOLA | C297: 16 | D297: 8 | G297: 3 | I297: 27
A299: -------- | B299: ----------------------- | C299: -------- | D299: ------ | E299: ---- | F299: --- | G299: ----- | H299: -- | I299: ---- | J299: ------------
B301: PROVA SCRITTA DI RICER | C301: CA OPERA | D301: TIVA D | E301: EL 1 | F301: 5 S | G301: ETTEM | H301: BR | I301: E 19 | J301: 94
B303: (VALIDITA': fino alla S | C303: essione | D303: INVERN | E303: ALE | F303: A.A | G303: . 199 | H303: 3/ | I303: 94)
A305: Visione | B305: degli elaborati e oral | C305: i: Giove | D305: di' 22 | E305: Set | F305: tem | G305: bre o | H305: re | I305: 0.625 | J305: 00 Aula 4.1
A307: Prossim | B307: i appelli: Ottobre (sec | C307: onda met | D307: a'; la | E307: dat | F307: a e | G307: satta | H307: v | I307: erra | J307: ' decisa e
B308: com | C308: unicata | D308: solo D | E308: OPO | F308: l'i | G308: nizio | H308: d | I308: elle | J308: lezioni)
B310: Febbraio
A312: -------- | B312: ----------------------- | C312: -------- | D312: ------ | E312: ---- | F312: --- | G312: ----- | H312: -- | I312: ---- | J312: ------------
C313: I^ | D313: II^ | E313: I | F313: II^ | H313: b | I313: onus | J313: TOT
A314: -------- | B314: ----------------------- | C314: -------- | D314: ------ | E314: ---- | F314: --- | G314: ----- | H314: -- | I314: ---- | J314: ------------
A316: 43489 | B316: ALBERGHINI ANDREA | C316: 18 | D316: 10 | I316: 3 | J316: 31
A318: 44476 | B318: BASSOLI GIACOMO | C318: 18 | D318: 11 | I318: 3 | J318: 32
A320: 49099 | B320: BONORA FRANCESCA | C320: 13 | D320: 5 | I320: 3 | J320: 21
A322: 39004 | B322: BRANCIARI FEDERICO(*) | C322: 13 | D322: 8 | I322: 3 | J322: ANNULLATO (V. #)
A324: 43423 | B324: BRANDOLINI ALBERTO | C324: 18 | D324: 11 | I324: 3 | J324: 32
A326: 43325 | B326: CAVALLINI LUCA | C326: 15 | D326: 12 | I326: 0 | J326: 27
A328: 45655 | B328: CIONI MAURO | C328: 18 | D328: 12 | I328: 3 | J328: 33
A330: 43817 | B330: DONATI CLAUDIO | C330: 13 | D330: 12 | I330: 3 | J330: 28
A332: 42459 | B332: DUO' MASSIMO | C332: 15 | D332: 9 | I332: 3 | J332: 27
A334: 44325 | B334: FOGLIANI ANDREA | C334: 16 | D334: 10 | I334: 3 | J334: 29
A336: 44532 | B336: FORGHIERI PAOLO | C336: 14 | D336: 1 | I336: 3 | J336: 18
A338: 45920 | B338: FUSCHINI GIORGIA | C338: 16 | D338: 2 | I338: 3 | J338: 21
A340: 38846 | B340: GIUSTOZZI GIACOMO | C340: 13 | D340: 8 | I340: 3 | J340: 24
A342: 44403 | B342: GRECO GIOVANNI | C342: 16 | D342: 7 | I342: 3 | J342: 26
A344: 42371 | B344: LANCIARINI STEFANO | C344: 8 | D344: 7 | I344: 3 | J344: 18
A346: 43945 | B346: MARINO GIOVANNI | C346: 14 | D346: 9 | I346: 3 | J346: 26
A348: 38773 | B348: MARTINTONI ANDREA | C348: 18 | D348: 9 | I348: 3 | J348: 30
A350: 43347 | B350: MAZZETTI MARCO | C350: 15 | D350: 6 | I350: 3 | J350: 24
A352: 33376 | B352: MIMMI LEONARDO | C352: 18 | D352: 3 | I352: 3 | J352: 24
A354: 43506 | B354: MONARI MARINA | C354: 18 | D354: 11 | I354: 0 | J354: 29
A356: 40833 | B356: MONTORSI ENRICO | C356: 10 | D356: 9 | I356: 3 | J356: 22
A358: 43731 | B358: PALMI MASSIMO | C358: 13 | D358: 12 | I358: 3 | J358: 28
A360: 43967 | B360: PATTACINI LORENZO | C360: 16 | D360: 11 | I360: 3 | J360: 30
A362: 42361 | B362: PONZIO FRANCO | C362: 18 | D362: 12 | I362: 3 | J362: 33
A364: 43236 | B364: RENZI ANDREA | C364: 18 | D364: 7 | I364: 3 | J364: 28
A366: 38824 | B366: SALVIOLI WILLIAM | C366: 18 | D366: 12 | I366: 3 | J366: 33
A368: 43614 | B368: SERAFINI VALENTINA | C368: 18 | D368: 9 | I368: 3 | J368: 30
A370: 43380 | B370: TALIANI MARCO | C370: 15 | D370: 8 | I370: 0 | J370: 23
A372: 46377 | B372: TAMPIERI MIRKO | C372: 18 | D372: 12 | I372: 3 | J372: 33
A374: 32803 | B374: VALLICELLI MARCO | C374: 4 | D374: 12 | I374: 3 | J374: 19
A376: 37278 | B376: VEGGETTI PAOLO | C376: 14 | D376: 8 | I376: 3 | J376: 25
A378: 42041 | B378: VERDICCHIO CARLA(#) | C378: 13 | D378: 12 | I378: 3 | J378: ANNULLATO(V. *)
A380: 42077 | B380: ZAMPA SIMONE | C380: 16 | D380: 12 | I380: 3 | J380: 31
A382: 43613 | B382: ZAPPOLI MASSIMILIANO | C382: 18 | D382: 12 | I382: 3 | J382: 33
A384: -------- | B384: ----------------------- | C384: -------- | D384: ------ | E384: ---- | F384: --- | G384: ----- | H384: -- | I384: ---- | J384: ------------
A385: -------- | B385: ----------------------- | C385: -------- | D385: ------ | E385: ---- | F385: --- | G385: ----- | H385: -- | I385: ---- | J385: ------------
B387: PROVA SCRITTA DI RICER | C387: CA OPERA | D387: TIVA D | E387: EL 2 | F387: 1 O | G387: TTOBR | H387: E | I387: 1994
B389: (VALIDITA': fino alla S | C389: essione | D389: INVERN | E389: ALE | F389: A.A | G389: . 199 | H389: 3/ | I389: 94)
A391: Visione | B391: degli elaborati e oral | C391: i: Vener | D391: di' 4 | E391: Nove | F391: mbr | G391: e ore | H391: 1 | I391: 0.25 | J391: Aula 6.2
A393: Prossim | B393: i appelli: Febbraio - M | C393: arzo
A395: -------- | B395: ----------------------- | C395: -------- | D395: ------ | E395: ---- | F395: --- | G395: ----- | H395: -- | I395: ---- | J395: ------------
C396: I^ | D396: II^ | E396: I | F396: II^ | H396: b | I396: onus | J396: TOT
A397: -------- | B397: ----------------------- | C397: -------- | D397: ------ | E397: ---- | F397: --- | G397: ----- | H397: -- | I397: ---- | J397: ------------
A399: 35090 | B399: ANGELINI PIERPAOLO | C399: 9 | D399: 6 | I399: 3 | J399: 18
A401: 45738 | B401: BRONZI ENRICO | C401: 12 | D401: 12 | I401: 3 | J401: 27
A403: 43589 | B403: CHIARI MASSIMO | C403: 0 | D403: 0 | J403: I
A405: 43540 | B405: GALASSO COSIMO | C405: 9 | D405: 10 | I405: 3 | J405: 22
A407: 31354 | B407: GREGORI DIEGO | C407: 12 | D407: 6 | I407: 0 | J407: 18
A409: 41552 | B409: GUIDORZI PAOLO | C409: 9 | D409: 7 | I409: 3 | J409: 19
A411: 46213 | B411: MANONI CRISTIAN | C411: 12 | D411: 6 | I411: 3 | J411: 21
A413: 42272 | B413: MARTINI CARLO | C413: 12 | D413: 10 | I413: 3 | J413: 25
A415: 44556 | B415: MIROTTI MASSIMO | C415: 4 | D415: 4 | J415: I
A417: 43355 | B417: NALDI CARLOTTA | C417: 12 | D417: 6 | I417: 3 | J417: 21
A419: 40439 | B419: NANNINI MASSIMO | C419: 9 | D419: 6 | I419: 3 | J419: 18
A421: 48098 | B421: PAZZINI STEFANO | C421: 14 | D421: 5 | I421: 3 | J421: 22
A423: 41978 | B423: PICCAGLI LEONARDO | C423: 9 | D423: 1 | J423: I
A425: 43264 | B425: RASI MICHELE | C425: 13 | D425: 8 | I425: 3 | J425: 23
A427: 34674 | B427: RIZZI LUCA | C427: 6 | D427: 0 | J427: I
A429: 45791 | B429: SCARANO LUCA | C429: 15 | D429: 7 | I429: 3 | J429: 25
A431: 43397 | B431: SCARDOVELLI CRISTIANO | C431: 14 | D431: 5 | I431: 3 | J431: 22
A433: 38763 | B433: TREGGIARI ADOLFO | C433: 8 | D433: 7 | I433: 3 | J433: 18
A435: -------- | B435: ----------------------- | C435: -------- | D435: ------ | E435: ---- | F435: --- | G435: ----- | H435: -- | I435: ---- | J435: ------------
A436: -------- | B436: ----------------------- | C436: -------- | D436: ------ | E436: ---- | F436: --- | G436: ----- | H436: -- | I436: ---- | J436: -----------
B437: PROVA SCRITTA DI RICERC | C437: A OPERAT | D437: IVA DE | E437: L 30 | F437: GE | G437: NNAIO | H437: 1 | I437: 995
B439: (VALIDITA': fino alla | C439: Session | D439: e ESTI | E439: VA A | F439: .A. | G439: 1994 | H439: /9 | I439: 5)
A440: Visione | B440: degli elaborati e orali | C440: : Mercol | D440: edi' 8 | E440: Feb | F440: bra | G440: io or | H440: e | I440: 0.625 | J440: 0 Aula 6.1
A442: Prossimi | B442: appelli: 27 Febbraio ( | C442: scritto) | D442: -10 | E442: Marz | F442: o ( | G442: orale | H442: )
B443: Giugno
B444: Luglio
A445: -------- | B445: ----------------------- | C445: -------- | D445: ------ | E445: ---- | F445: --- | G445: ----- | H445: -- | I445: ---- | J445: -----------
C446: I^ | D446: II^ | E446: II | F446: I^ | H446: bo | I446: nus | J446: TOT
A447: -------- | B447: ----------------------- | C447: -------- | D447: ------ | E447: ---- | F447: --- | G447: ----- | H447: -- | I447: ---- | J447: -----------
A448: 46175 | B448: BIANCO DONATO | C448: 12 | D448: 7 | F448: 5 | I448: 3 | J448: 27
A450: 44826 | B450: BOMBARDI MASSIMO | C450: 13 | D450: 6 | F450: 5 | I450: 3 | J450: 27
A452: 45744 | B452: CANNATA GABRIELE | C452: 11 | D452: 5 | F452: 3 | I452: 3 | J452: 22
A454: 40678 | B454: CAPELLI FABIO | C454: 13 | D454: 3 | F454: 0 | I454: 3 | J454: 19
A456: 38760 | B456: CECCARELLI DAVIDE | C456: 0 | D456: 7 | F456: 6 | I456: - | J456: I
A458: 43345 | B458: CHERICONI MASSIMO | C458: 17 | D458: 6 | F458: 6 | I458: 3 | J458: 32
A460: 43960 | B460: COLARELLI FRANCESCO | C460: 9 | D460: 6 | F460: 4 | I460: 3 | J460: 22
A462: 48352 | B462: CORAZZA VALERIO | C462: 15 | D462: 5 | F462: 6 | I462: 3 | J462: 29
A464: 43648 | B464: CORTECCHIA MAURIZIO | C464: 17 | D464: 6 | F464: 6 | I464: 3 | J464: 32
A466: 48300 | B466: CRISTI CLAUDIA | C466: 13 | D466: 6 | F466: 5 | I466: 3 | J466: 27
A468: 43688 | B468: FARES MASSIMILIANO | C468: 3 | D468: 6 | F468: 6 | I468: 3 | J468: 18
A470: 44417 | B470: FOGLI MARCO | C470: 7 | D470: 5 | F470: 6 | I470: 3 | J470: 21
A472: 45732 | B472: FRAZZONI MIRKO | C472: 14 | D472: 7 | F472: 6 | I472: 3 | J472: 30
A474: 45794 | B474: FULGINITI GREGORIO | C474: 9 | D474: 4 | F474: 4 | I474: 3 | J474: 20
A476: 45305 | B476: GIBERTI MASSIMILIANO | C476: 12 | D476: 5 | F476: 4 | I476: 3 | J476: 24
A478: 39305 | B478: GUIDELLI PAOLO | C478: 10 | D478: 6 | F478: 4 | I478: 3 | J478: 23
A480: 47724 | B480: MADRIGALI NICOLA | C480: 9 | D480: 5 | F480: 2 | I480: 3 | J480: 19
A482: 46141 | B482: MANCINI MARCO | C482: 13 | D482: 7 | F482: 6 | I482: 3 | J482: 29
A484: 43346 | B484: MARANI PAOLO | C484: 14 | D484: 4 | F484: 6 | I484: 3 | J484: 27
A486: 37277 | B486: NATALINI ROBERTO | C486: 9 | D486: 5 | F486: 6 | I486: 3 | J486: 23
A488: 43686 | B488: ONOFRII CARLO | C488: 9 | D488: 6 | F488: 4 | I488: 3 | J488: 22
A490: 47705 | B490: PASSINI STEFANO | C490: 13 | D490: 5 | F490: 6 | I490: 3 | J490: 27
A492: 43984 | B492: RUGGIANO RENZO | C492: 12 | D492: 7 | F492: 5 | I492: 3 | J492: 27
A494: 32908 | B494: SCANAVINI CLAUDIO | C494: 0 | D494: 4 | F494: 6 | I494: - | J494: I
A496: 47924 | B496: STEFANI STEFANO | C496: 14 | D496: 7 | F496: 6 | I496: 3 | J496: 30
A498: 43380 | B498: TALIANI MARCO | C498: 17 | D498: 6 | F498: 6 | I498: 0 | J498: 29
A500: 43396 | B500: TAMBURRIELLO FULVIO | C500: 8 | D500: 6 | F500: 6 | I500: 3 | J500: 23
A502: 47858 | B502: TENTI LUIGI | C502: 13 | D502: 4 | F502: 6 | I502: 3 | J502: 26
A504: 45820 | B504: TOMBESI ANDREA | C504: 8 | D504: 4 | F504: 6 | I504: 3 | J504: 21
A505: -------- | B505: ----------------------- | C505: -------- | D505: ------ | E505: ---- | F505: --- | G505: ----- | H505: -- | I505: ---- | J505: -----------
A506: -------- | B506: ----------------------- | C506: -------- | D506: ------ | E506: ---- | F506: --- | G506: ----- | H506: -- | I506: ---- | J506: -----------
B507: PROVA SCRITTA DI RICERC | C507: A OPERAT | D507: IVA DE | E507: L 27 | F507: FE | G507: BBRAI | H507: O | I507: 1995
B509: (VALIDITA': fino alla | C509: Session | D509: e ESTI | E509: VA A | F509: .A. | G509: 1994 | H509: /9 | I509: 5)
A510: Visione | B510: degli elaborati e orali | C510: : Venerd | D510: i' 10 | E510: Marz | F510: o o | G510: re 16 | H510: .0 | I510: 0 Au | J510: la 6.1
A512: Prossimi | B512: appelli: Giugno
B513: Luglio
A514: -------- | B514: ----------------------- | C514: -------- | D514: ------ | E514: ---- | F514: --- | G514: ----- | H514: -- | I514: ---- | J514: -----------
C515: I | D515: ^ | E515: II | F515: ^ | G515: b | H515: on | I515: us | J515: TOT
A516: -------- | B516: ----------------------- | C516: -------- | D516: ------ | E516: ---- | F516: --- | G516: ----- | H516: -- | I516: ---- | J516: -----------
A518: 48527 | B518: ANGELOZZI GUGLIELMO | C518: 13 | E518: 10 | I518: 3 | J518: 26
A520: 39088 | B520: ARTIOLI DANIELA | C520: 16 | E520: 4 | I520: 3 | J520: 23
A522: 45651 | B522: BONDI ROBERTO | C522: 14 | E522: 13 | I522: 3 | J522: 30
A524: 41836 | B524: BUBANI GIOVANNI | C524: 12 | E524: 5 | I524: 3 | J524: 20
A526: 37362 | B526: CATTIN STEFANO CORRAD | C526: O 5 | E526: 2 | I526: - | J526: I
A528: 43633 | B528: CECCARINI DANIELE | C528: 10 | E528: 13 | I528: 3 | J528: 26
A530: 40728 | B530: COLTORTI MANUEL | C530: 8 | E530: 10 | I530: 0 | J530: 18
A532: 45658 | B532: CROCIANI SAMUELE | C532: 17 | E532: 3 | I532: 3 | J532: 23
A534: 48339 | B534: CUCCU GIOVANNI | C534: 4 | E534: 2 | I534: - | J534: I
A536: 48411 | B536: D'ALICARNASSO MASSIMI | C536: LIANO 10 | E536: 4 | I536: - | J536: I
A538: 43297 | B538: DI SANTO GIANLUCA | C538: 6 | E538: 11 | I538: 3 | J538: 20
A540: 42458 | B540: DONEGA' LEONARDO | C540: 4 | E540: 7 | I540: - | J540: I
A542: 46002 | B542: FABI FEDERICO | C542: 12 | E542: 2 | I542: - | J542: I
A544: 45609 | B544: FARINA ALESSANDRO | C544: 14 | E544: 7 | I544: 3 | J544: 24
A546: 43416 | B546: FORTUNATI ANDREA | C546: 12 | E546: 9 | I546: 0 | J546: 21
A548: 48169 | B548: FRANCIOTTI GIANFRANCO | C548: 16 | E548: 7 | I548: 3 | J548: 26
A550: 43540 | B550: GALASSO COSIMO | C550: 14 | E550: 12 | I550: 0 | J550: 26
A552: 41645 | B552: GAMBERINI MICHELE | C552: 15 | E552: 0 | I552: 3 | J552: 18
A554: 42260 | B554: IMPERATRICE MAURO | C554: 6 | E554: 5 | I554: - | J554: I
A556: 46509 | B556: LAFFI STEFANO | C556: 11 | E556: 10 | I556: 3 | J556: 24
A558: 43956 | B558: LAICO DONATO | C558: 13 | E558: 8 | I558: 3 | J558: 24
A560: 37506 | B560: LEARDINI EUGENIO | C560: 9 | E560: 5 | I560: - | J560: I
A562: 46035 | B562: LOMBARDI CRISTIAN | C562: 9 | E562: 13 | I562: 3 | J562: 24
A564: 46480 | B564: LOVO FRANCESCO | C564: 14 | E564: 11 | I564: 3 | J564: 28
A566: 42380 | B566: MALAVOLTA PAOLO | C566: 10 | E566: 2 | I566: - | J566: I
A568: 45806 | B568: MEGGIOLARO ENRICO | C568: 10 | E568: 8 | I568: 3 | J568: 21
A570: 43395 | B570: MIGNANI LUCA | C570: 14 | E570: 11 | I570: 3 | J570: 28
A572: 43239 | B572: MINELLI GIAN DOMENICO | C572: 17 | E572: 11 | I572: 3 | J572: 31
A574: 44878 | B574: MIRRI ALESSANDRO | C574: 10 | E574: 7 | I574: 3 | J574: 20
A576: 43883 | B576: MONARI MONICA | C576: 12 | E576: 5 | I576: 3 | J576: 20
A578: 43832 | B578: MONTEVECCHI STEFANO | C578: 12 | E578: 11 | I578: 3 | J578: 26
A580: 43415 | B580: NAPOLITANO SERGIO | C580: 15 | E580: 11 | I580: 3 | J580: 29
A582: 43803 | B582: ORFANO VALERIO DAMIAN | C582: O 11 | E582: 4 | I582: 3 | J582: 18
A584: 41581 | B584: PAGANINI MONICA | C584: 8 | E584: 8 | I584: 3 | J584: 19
A586: 40742 | B586: PETELIO PAOLO | C586: 9 | E586: 8 | I586: 3 | J586: 20
A588: 45621 | B588: PIRRO' GIUSEPPE | C588: 15 | E588: 13 | I588: 3 | J588: 31
A590: 34331 | B590: PISETTI MARCO | C590: 0 | E590: 6 | I590: - | J590: I
A592: 34330 | B592: RANI FABIO | C592: 9 | E592: 6 | I592: 3 | J592: 18
A594: 40691 | B594: SACRIPANTE GIANLUCA ( | C594: *) 4 | E594: 2 | I594: - | J594: I
A596: 48360 | B596: SANSONI TOMMASO | C596: 7 | E596: 9 | I596: 3 | J596: 19
A598: 32908 | B598: SCANAVINI CLAUDIO | C598: 5 | E598: 4 | I598: - | J598: I
A600: 37385 | B600: SONCINI PAOLO | C600: 5 | E600: 9 | I600: - | J600: I
A602: 37220 | B602: STUPPAZZONI SUSANNA | C602: 5 | E602: 10 | I602: 3 | J602: 18
A604: 37469 | B604: VARESI ROBERTO | C604: 16 | E604: 9 | I604: 3 | J604: 28
A606: 42041 | B606: VERDICCHIO CARLA | C606: 8 | E606: 12 | I606: - | J606: 20
A608: 35685 | B608: VERGARI ANDREA | C608: 5 | E608: 7 | I608: - | J608: I
A610: 43869 | B610: VIANI DAVIDE | C610: 14 | E610: 7 | I610: 3 | J610: 24
A612: 46355 | B612: VIGNALI DAVIDE | C612: 8 | E612: 8 | I612: 3 | J612: 19
A613: -------- | B613: ----------------------- | C613: -------- | D613: ------ | E613: ---- | F613: --- | G613: ----- | H613: -- | I613: ---- | J613: -----------
A614: (*) SAC | B614: RIPANTE GIANLUCA non ha | C614: riconse | D614: gnato | E614: il t | F614: est | G614: o
A615: -------- | B615: ----------------------- | C615: -------- | D615: ------ | E615: ---- | F615: --- | G615: ----- | H615: -- | I615: ---- | J615: -----------
A617: -------- | B617: ----------------------- | C617: -------- | D617: ------ | E617: ---- | F617: --- | G617: ----- | H617: -- | I617: ---- | J617: -----------
B618: PROVA SCRITTA DI RICERC | C618: A OPERAT | D618: IVA DE | E618: L 26 | F618: MA | G618: GGIO | H618: 19 | I618: 95
B620: (VALIDITA': fino alla | C620: Session | D620: e AUTU | E620: NNAL | F620: E A | G620: .A. 1 | H620: 99 | I620: 34790 | J620: )
A621: Visione | B621: degli elaborati e orali | C621: : Mercol | D621: edi' 7 | E621: Giu | F621: gno | G621: ore | H621: 11 | I621: .00 | J621: Aula 6.1
A623: Prossimo | B623: appello: 26 Giugno, or | C623: e 16.30 | D623: (scrit | E623: to)
B624: 13 Luglio, or | C624: e 15.00 | D624: (orale | E624: )
A626: Appelli | B626: successivi: Settembre
B627: Ottobre
A629: -------- | B629: ----------------------- | C629: -------- | D629: ------ | E629: ---- | F629: --- | G629: ----- | H629: -- | I629: ---- | J629: -----------
C630: I^ | D630: II^ | E630: I | F630: II^ | G630: bon | H630: us | J630: TOT
A631: -------- | B631: ----------------------- | C631: -------- | D631: ------ | E631: ---- | F631: --- | G631: ----- | H631: -- | I631: ---- | J631: -----------
A633: 46042 | B633: BONTA' EDOARDO | C633: 6 | D633: 1 | F633: - | J633: I
A635: 39004 | B635: BRANCIARI FEDERICO | C635: 13 | D635: 3 | F635: 5 | H635: 0 | J635: 21
A637: 38952 | B637: CECCARELLI IVAN | C637: 13 | D637: 8 | F637: 7 | H637: 3 | J637: 31
A639: 39014 | B639: CECCHETTO FRANCESCO | C639: 6 | D639: 2 | F639: 8 | H639: 3 | J639: 19
A641: 43960 | B641: COLARELLI FRANCESCO | C641: 13 | D641: 8 | F641: 7 | H641: 0 | J641: 28
A643: 42110 | B643: DI CARLO GABRIELE FRA | C643: NC. 11 | D643: 6 | F643: - | H643: 3 | J643: 20
A645: 42231 | B645: FILIPPI BARTOLETTI AL | C645: E. 13 | D645: 5 | F645: 7 | H645: 3 | J645: 28
A647: 45794 | B647: FULGINITI GREGORIO | C647: 9 | D647: 8 | F647: 5 | H647: 0 | J647: 22
A649: 47847 | B649: GALEAZZI FABRIZIO | C649: 7 | D649: 6 | F649: 5 | H649: 3 | J649: 21
A651: 37679 | B651: GALLERANI GIANLUCA | C651: 10 | D651: 0 | F651: 7 | H651: 3 | J651: 20
A653: 44500 | B653: GORDINI MARCO | C653: 13 | D653: 2 | F653: 7 | H653: 3 | J653: 25
A655: 41552 | B655: GUIDORZI PAOLO | C655: 12 | D655: 6 | F655: 5 | H655: 0 | J655: 23
A657: 46223 | B657: LOPERFIDO GIANFRANCO | C657: 12 | D657: 6 | F657: 4 | H657: 3 | J657: 25
A659: 47896 | B659: LUCCHI DAVIDE | C659: 11 | D659: 0 | F659: 5 | H659: 3 | J659: 19
A661: 44556 | B661: MIROTTI MASSIMO | C661: 13 | D661: 4 | F661: 7 | H661: 3 | J661: 27
A663: 41770 | B663: OTTAVIANI LUCA | C663: 12 | D663: 4 | F663: - | H663: 3 | J663: 19
A665: 46169 | B665: PASI GIAN LUIGI | C665: 12 | D665: 6 | F665: 3 | H665: 3 | J665: 24
A667: 34331 | B667: PISETTI MARCO | C667: 9 | D667: 4 | F667: 1 | H667: 3 | J667: 17 (ammesso)
A669: 43063 | B669: REMEDIA FILIPPO | C669: 11 | D669: 4 | F669: - | H669: 3 | J669: 18
A671: 43409 | B671: RENZETTI ANTONIO | C671: 13 | D671: 6 | F671: 6 | H671: 3 | J671: 28
A673: 43826 | B673: ROPAGHETTI SERGIO | C673: 12 | D673: 6 | F673: 3 | H673: 3 | J673: 24
A675: 50767 | B675: RUSSO GIANLUCA | C675: 11 | D675: 5 | F675: 5 | H675: 3 | J675: 24
A677: 32908 | B677: SCANAVINI CLAUDIO | C677: 6 | D677: 4 | F677: 4 | H677: 3 | J677: 17 (ammesso)
A679: 45820 | B679: TOMBESI ANDREA | C679: 10 | D679: 7 | F679: 8 | H679: 0 | J679: 25
A681: 45665 | B681: TONI STEFANO | C681: 11 | D681: 5 | F681: 7 | H681: 3 | J681: 26
A683: 38669 | B683: VACCARI STEFANO | C683: 9 | D683: 7 | F683: 1 | H683: 3 | J683: 20
A684: -------- | B684: ----------------------- | C684: -------- | D684: ------ | E684: ---- | F684: --- | G684: ----- | H684: -- | I684: ---- | J684: -----------
A685: -------- | B685: ----------------------- | C685: -------- | D685: ------ | E685: ---- | F685: --- | G685: ----- | H685: -- | I685: ---- | J685: -----------
B686: PROVA SCRITTA DI RICERC | C686: A OPERAT | D686: IVA DE | E686: L 26 | F686: GI | G686: UGNO | H686: 19 | I686: 95
B688: (VALIDITA': fino alla | C688: Session | D688: e AUTU | E688: NNAL | F688: E A | G688: .A. 1 | H688: 99 | I688: 34790 | J688: )
A689: Visione | B689: degli elaborati e orali | C689: : Mercol | D689: edi' 7 | E689: Giu | F689: gno | G689: ore | H689: 11 | I689: .00 | J689: Aula 6.1
A691: Prossimi | B691: appelli: 14 Luglio, or | C691: e 15.00 | D691: (orale | E691: )
B692: 18 Settembre, | C692: ore 15 | D692: (scrit | E692: to)
B693: fine Settembr | C693: e (orale | D693: )
A695: Appelli | B695: successivi: Ottobre
B696: Febbraio
A698: -------- | B698: ----------------------- | C698: -------- | D698: ------ | E698: ---- | F698: --- | G698: ----- | H698: -- | I698: ---- | J698: -----------
C699: I^ | D699: II^ | E699: I | F699: II^ | G699: bon | H699: us | J699: TOT
A700: -------- | B700: ----------------------- | C700: -------- | D700: ------ | E700: ---- | F700: --- | G700: ----- | H700: -- | I700: ---- | J700: -----------
A702: 41762 | B702: ARBIZZANI MASSIMO | C702: 8 | D702: 5 | F702: - | H702: - | J702: I
A704: 45744 | B704: CANNATA GABRIELE | C704: 14 | D704: 7 | F704: 6 | H704: 0 | J704: 27
A706: 48458 | B706: CARBONI ENIO | C706: 7 | D706: 0 | F706: 8 | H706: 3 | J706: 18
A708: 48361 | B708: CARDELLI FULVIO | C708: 4 | D708: 2 | F708: 2 | H708: - | J708: I
A710: 43286 | B710: CARLINO NICOLA | C710: 8 | D710: 7 | F710: 6 | H710: 3 | J710: 24
A712: 48411 | B712: D'ALICARNASSO MASSIMI | C712: 3 | D712: 1 | F712: 6 | H712: - | J712: I
A714: 37798 | B714: FAGLIONI GIOVANNI | C714: 11 | D714: 7 | F714: 0 | H714: 3 | J714: 21
A716: 42260 | B716: IMPERATRICE MAURO | C716: 8 | D716: 4 | F716: 5 | H716: 3 | J716: 20
A718: 37506 | B718: LEARDINI EUGENIO | C718: 6 | D718: 6 | F718: 3 | H718: 3 | J718: 18
A720: 48165 | B720: LOTTI ANDREA | C720: 10 | D720: 8 | F720: 3 | H720: 3 | J720: 24
A722: 42380 | B722: MALAVOLTA PAOLO | C722: 6 | D722: 5 | F722: 0 | H722: - | J722: I
A724: 37445 | B724: MAZZA PIERMARCO | C724: 10 | D724: 7 | F724: 3 | H724: 3 | J724: 23
A726: 46579 | B726: MONTERMINI LORENZO | C726: 11 | D726: 4 | F726: - | H726: 3 | J726: 18
A728: 41858 | B728: PAOLI LUCIANO | C728: 8 | D728: 3 | F728: 5 | H728: 3 | J728: 19
A730: 43724 | B730: SARTONI GIANNI | C730: 10 | D730: 8 | F730: - | H730: 3 | J730: 21
A732: 37385 | B732: SONCINI PAOLO | C732: 11 | D732: 6 | F732: 7 | H732: 3 | J732: 27
A734: 39041 | B734: TOMAINO ORTENSIO | C734: 9 | D734: 5 | F734: - | H734: 3 | J734: 17 *
A736: 35685 | B736: VERGARI ANDREA | C736: 6 | D736: 6 | F736: 2 | H736: 3 | J736: 17 *
A737: -------- | B737: ----------------------- | C737: -------- | D737: ------ | E737: ---- | F737: --- | G737: ----- | H737: -- | I737: ---- | J737: -----------
A738: * Il 14 | B738: .7 comunichi se preferi | C738: sce acce | D738: ttare | E738: o av | F738: ere | G738: insu | H738: ff | I738: icie | J738: nza
A739: e man | B739: tenere il bonus.
A740: -------- | B740: ----------------------- | C740: -------- | D740: ------ | E740: ---- | F740: --- | G740: ----- | H740: -- | I740: ---- | J740: -----------
A742: -------- | B742: ----------------------- | C742: -------- | D742: ------ | E742: ---- | F742: --- | G742: ----- | H742: -- | I742: ---- | J742: -----------
B743: PROVA SCRITTA DI RICER | C743: CA OPERA | D743: TIVA D | E743: EL 1 | F743: 8 S | G743: ETTEM | H743: BR | I743: E 19 | J743: 95
B744: (Informatica, Ele | C744: ttronica | D744: , Tele | E744: comu | F744: nic | G744: azion | H744: i)
B746: (VALIDITA': fino alla | C746: Session | D746: e INVE | E746: RNAL | F746: E A | G746: .A. 1 | H746: 99 | I746: 34790 | J746: )
A747: Visione | B747: degli elaborati e orali | C747: : Marted | D747: i' 26 | E747: Sett | F747: emb | G747: re or | H747: e | I747: 0.625 | J747: 0 Aula 6.1
A749: Prossimo | B749: appello: 20 Ottobre, o | C749: re 16.00 | D749: (scri | E749: tto)
B750: 27 Ottobre, o | C750: re 16.00 | D750: (oral | E750: e)
A752: Appelli | B752: successivi: Febbraio
B753: Marzo
A755: -------- | B755: ----------------------- | C755: -------- | D755: ------ | E755: ---- | F755: --- | G755: ----- | H755: -- | I755: ---- | J755: -----------
C756: I^ | D756: II^ | G756: bon | H756: us | J756: TOT
A757: -------- | B757: ----------------------- | C757: -------- | D757: ------ | E757: ---- | F757: --- | G757: ----- | H757: -- | I757: ---- | J757: -----------
A759: 45623 | B759: CAFASSO DAVIDE | C759: 17 | D759: 12 | H759: 3 | J759: 32
A761: 45691 | B761: CASADIO SERGIO | C761: 17 | D761: 10 | H761: 3 | J761: 30
A763: 37362 | B763: CATTIN STEFANO CORRAD | C763: O 10 | D763: 10 | H763: 3 | J763: 23
A765: 43472 | B765: CAVACIOCCHI PAOLO | C765: 13 | D765: 10 | H765: 3 | J765: 26
A767: 48339 | B767: CUCCU GIOVANNI | C767: 16 | D767: 13 | H767: 3 | J767: 32
A769: 42458 | B769: DONEGA' LEONARDO | C769: 14 | D769: 13 | H769: 3 | J769: 30
A771: 43611 | B771: GENTILE GIANLUCA | C771: 17 | D771: 10 | H771: 3 | J771: 30
A773: 40452 | B773: GROSSI FABIO | C773: 13 | D773: 5 | H773: 3 | J773: 21
A775: 43792 | B775: MAZZUCCHI ALBERTO | C775: 13 | D775: 9 | H775: 3 | J775: 25
A777: 39138 | B777: MERIGHI MASSIMO | C777: 1 | D777: 11 | H777: - | J777: I
A779: 41721 | B779: MONTANARI NICOLA | C779: 17 | D779: 11 | H779: 3 | J779: 31
A781: 34308 | B781: MOZZILLO ROBERTO | C781: 2 | D781: 7 | H781: - | J781: I
A783: 43891 | B783: ORLANDI MASSIMO | C783: 8 | D783: 13 | H783: 3 | J783: 24
A785: 39402 | B785: PACI PAOLO | C785: 8 | D785: 3 | H785: - | J785: I
A787: 40408 | B787: ROSSI ALESSANDRO | C787: 13 | D787: 12 | H787: 3 | J787: 28
A789: 42673 | B789: SICILIANO PAOLO | C789: 2 | D789: 13 | H789: 3 | J789: 18
A791: 45722 | B791: TONELLI ANDREA | C791: 13 | D791: - | H791: - | J791: I
A793: 42041 | B793: VERDICCHIO CARLA | C793: 14 | D793: 13 | H793: 0 | J793: 27
A795: 43339 | B795: ZAVARONI ANDREA | C795: 6 | D795: 9 | H795: 3 | J795: 18
A796: -------- | B796: ----------------------- | C796: -------- | D796: ------ | E796: ---- | F796: --- | G796: ----- | H796: -- | I796: ---- | J796: -----------
A798: -------- | B798: ----------------------- | C798: -------- | D798: ------ | E798: ---- | F798: --- | G798: ----- | H798: -- | I798: ---- | J798: -----------
B799: PROVA SCRITTA DI RICER | C799: CA OPERA | D799: TIVA D | E799: EL 2 | F799: 0 O | G799: TTOBR | H799: E | I799: 1995
B800: (Informatica, Ele | C800: ttronica | D800: , Tele | E800: comu | F800: nic | G800: azion | H800: i)
B802: (VALIDITA': fino alla | C802: Session | D802: e INVE | E802: RNAL | F802: E A | G802: .A. 1 | H802: 99 | I802: 34790 | J802: )
A803: Visione | B803: degli elaborati e orali | C803: : Venerd | D803: i' 27 | E803: Otto | F803: bre | G803: ore | H803: 16 | I803: .00 | J803: Aula 6.1
A805: Prossimi | B805: appelli: Febbraio
B806: Marzo
A808: -------- | B808: ----------------------- | C808: -------- | D808: ------ | E808: ---- | F808: --- | G808: ----- | H808: -- | I808: ---- | J808: -----------
C809: I^ | D809: II^ | E809: I | F809: II^ | H809: b | I809: onus | J809: TOT
A810: -------- | B810: ----------------------- | C810: -------- | D810: ------ | E810: ---- | F810: --- | G810: ----- | H810: -- | I810: ---- | J810: -----------
A812: 38675 | B812: BALSAMO ANDREA | C812: 4 | D812: 2 | F812: 3 | I812: - | J812: I
A814: 45786 | B814: BENTIVOGLI DAVIDE | C814: 14 | D814: 1 | F814: 4 | I814: 3 | J814: 22
A816: 34308 | B816: BERNARDINI LUCA | C816: 4 | D816: - | F816: 3 | I816: - | J816: I
A818: 41628 | B818: BORSARI GIULIO | C818: 9 | D818: 3 | F818: 5 | I818: 3 | J818: 20
A820: 43351 | B820: CALLEGARI SERGIO | C820: 14 | D820: 3 | F820: 8 | I820: 3 | J820: 28
A822: 45915 | B822: CARLINI STEFANO | C822: 11 | D822: - | F822: 7 | I822: 3 | J822: 21
A824: 43382 | B824: CASINI MAURO | C824: 16 | D824: 3 | F824: 11 | I824: 3 | J824: 33
A826: 44517 | B826: CASTALDINI MARCO | C826: 13 | D826: - | F826: 7 | I826: 3 | J826: 23
A828: 33571 | B828: CUCINOTTA ORAZIO | C828: 4 | D828: - | F828: 3 | I828: - | J828: I
A830: 38756 | B830: GASPARI LUCA | C830: 12 | D830: - | F830: 4 | I830: 3 | J830: 19
A832: 47763 | B832: INDOVINI MARIO | C832: 13 | D832: 2 | F832: 5 | I832: 3 | J832: 23
A834: 41662 | B834: MAGOTTI ALESSANDRO | C834: 14 | D834: - | F834: 0 | I834: - | J834: I (*)
A836: 38670 | B836: MALAVOLTI FRANCA | C836: 10 | D836: - | F836: 4 | I836: - | J836: I (*)
A838: 44555 | B838: MANZINI ANDREA | C838: 12 | D838: 1 | F838: 8 | I838: 3 | J838: 24
A840: 34308 | B840: MOZZILLO ROBERTO | C840: 8 | D840: - | F840: 5 | I840: 3 | J840: 16 (*)
A842: 43837 | B842: PIAZZA ROBERTINO | C842: 15 | D842: - | F842: 6 | I842: 3 | J842: 24 (***)
A844: 43972 | B844: PINI GIAN FRANCO | C844: 16 | D844: 1 | F844: 8 | I844: 3 | J844: 28
A846: 34674 | B846: RIZZI LUCA | C846: 6 | D846: - | F846: 4 | I846: - | J846: I
A848: 43456 | B848: SIGNORETTI PAOLO | C848: 13 | D848: - | F848: 7 | I848: 3 | J848: 23
A850: 39046 | B850: TASSONI PIERO | C850: 14 | D850: 1 | F850: 8 | I850: 3 | J850: 26
A852: 45932 | B852: ZAMAGNI MAURO | C852: 14 | D852: - | F852: 9 | I852: 3 | J852: 26
A853: -------- | B853: ----------------------- | C853: -------- | D853: ------ | E853: ---- | F853: --- | G853: ----- | H853: -- | I853: ---- | J853: -----------
A854: (*) I | B854: l 14.7 comunichi se pre | C854: ferisce | D854: accett | E854: are | F854: o a | G854: vere | H854: in | I854: suff | J854: icienza
A855: e | B855: mantenere il bonus.
A856: -------- | B856: ----------------------- | C856: -------- | D856: ------ | E856: ---- | F856: --- | G856: ----- | H856: -- | I856: ---- | J856: -----------
A857: (***) P | B857: IAZZA ROBERTINO non ha | C857: riconseg | D857: nato i | E857: l te | F857: sto
A858: -------- | B858: ----------------------- | C858: -------- | D858: ------ | E858: ---- | F858: --- | G858: ----- | H858: -- | I858: ---- | J858: -----------
A859: -------- | B859: ----------------------- | C859: -------- | D859: ------ | E859: ---- | F859: --- | G859: ----- | H859: -- | I859: ---- | J859: -----------
A861: -------- | B861: ----------------------- | C861: -------- | D861: ------ | E861: ---- | F861: --- | G861: ----- | H861: -- | I861: ---- | J861: -----------
B862: PROVA SCRITTA DI RICER | C862: CA OPERA | D862: TIVA D | E862: EL 1 | F862: 2 F | G862: EBBRA | H862: IO | I862: 199 | J862: 6
B863: (Informatica, Ele | C863: ttronica | D863: , Tele | E863: comu | F863: nic | G863: azion | H863: i)
B865: (VALIDITA': fino alla | C865: Session | D865: e ESTI | E865: VA A | F865: .A. | G865: 1995 | H865: /9 | I865: 6)
A866: Visione | B866: degli elaborati e orali | C866: : Gioved | D866: i' 15 | E866: Febb | F866: rai | G866: o ore | H866: 1 | I866: 0.20833333333333334 | J866: Aula 6.1
A868: Prossimi | B868: appelli: Marzo (la dat | C868: a sara' | D868: comuni | E868: cata | F868: do | G868: po l' | H868: in | I868: izio | J868: delle lezioni)
B869: Giugno
B870: Luglio
A872: -------- | B872: ----------------------- | C872: -------- | D872: ------ | E872: ---- | F872: --- | G872: ----- | H872: -- | I872: ---- | J872: -----------
C873: I^ | D873: II^ | E873: I | F873: II^ | H873: b | I873: onus | J873: TOT
A874: -------- | B874: ----------------------- | C874: -------- | D874: ------ | E874: ---- | F874: --- | G874: ----- | H874: -- | I874: ---- | J874: -----------
A876: 41663 | B876: BAFFE' CARLO | C876: 11 | D876: 0 | F876: 9 | I876: 3 | J876: 23
A878: 38675 | B878: BALSAMO ANDREA | C878: 6 | D878: 1 | F878: 8 | I878: 3 | J878: 18
A880: 38987 | B880: BATTAGLIOLI GIANLUCA | C880: 14 | D880: 0 | F880: 7 | I880: 3 | J880: 24
A882: 46042 | B882: BONTA' EDOARDO | C882: 10 | D882: 2 | F882: 8 | I882: 3 | J882: 23
A884: 43271 | B884: CAGNOLATI MARCO | C884: 8 | D884: 0 | F884: 9 | I884: 3 | J884: 20
A886: 49205 | B886: CASONI RICCARDO | C886: 12 | D886: 2 | F886: 13 | I886: 3 | J886: 30
A888: 43944 | B888: CIANETTI PATRIZIA | C888: 8 | D888: 1 | F888: 12 | I888: 3 | J888: 24
A890: 43599 | B890: D'ADDEZIO MICHELE CLA | C890: UDIO 4 | D890: 1 | F890: 12 | I890: 3 | J890: 20
A892: 42233 | B892: DALL'ARGINE CORRADO | C892: 15 | D892: 2 | F892: 13 | I892: 3 | J892: 33
A894: 41914 | B894: DONATI LUCA | C894: 11 | D894: 2 | F894: 8 | I894: 3 | J894: 24
A896: 43416 | B896: FORTUNATI ANDREA | C896: 15 | D896: 2 | F896: 14 | I896: 0 | J896: 31
A898: 41738 | B898: GOVONI STEFANO | C898: 12 | D898: 2 | F898: 5 | I898: 3 | J898: 22
A900: 0 | B900: LONGO LUCA | C900: 11 | D900: 0 | F900: 7 | I900: 3 | J900: 21
A902: 46579 | B902: MONTERMINI LORENZO | C902: 15 | D902: 0 | F902: 7 | I902: 0 | J902: 22
A904: 37718 | B904: ORI ANNA | C904: 15 | D904: 0 | F904: 7 | I904: 3 | J904: 25
A906: 43521 | B906: PAIARDINI ALESSANDRO | C906: 9 | D906: 0 | F906: 12 | I906: 3 | J906: 24
A908: 43561 | B908: PASSARINI FEDERICO | C908: 11 | D908: 0 | F908: 13 | I908: 3 | J908: 27
A910: 44444 | B910: PELLEI FABRIZIO | C910: 2 | D910: 0 | F910: 13 | I910: 3 | J910: 18
A912: 41978 | B912: PICCAGLI LEONARDO | C912: 11 | D912: 0 | F912: 6 | I912: 3 | J912: 20
A914: 50707 | B914: RICCI ALESSANDRO | C914: 15 | D914: 1 | F914: 10 | I914: 3 | J914: 29
A916: 38636 | B916: SEVERI LUCA | C916: 13 | D916: 2 | F916: 7 | I916: 3 | J916: 25
A918: 41695 | B918: TARTAGLIA COSTANZO | C918: 15 | D918: 0 | F918: 6 | I918: 3 | J918: 24
A920: 45745 | B920: TURRA MATTEO | C920: 10 | D920: 0 | F920: 9 | I920: 3 | J920: 22
A922: 50794 | B922: VIROLI MIRKO | C922: 11 | D922: 2 | F922: 13 | I922: 3 | J922: 29
A923: -------- | B923: ----------------------- | C923: -------- | D923: ------ | E923: ---- | F923: --- | G923: ----- | H923: -- | I923: ---- | J923: -----------
A924: -------- | B924: ----------------------- | C924: -------- | D924: ------ | E924: ---- | F924: --- | G924: ----- | H924: -- | I924: ---- | J924: -----------
B925: PROVA SCRITTA DI RICER | C925: CA OPERA | D925: TIVA D | E925: ELL' | F925: 8 | G925: MARZO | H925: 1 | I925: 996
B926: (Informatica, Ele | C926: ttronica | D926: , Tele | E926: comu | F926: nic | G926: azion | H926: i)
B928: (VALIDITA': fino alla | C928: Session | D928: e ESTI | E928: VA A | F928: .A. | G928: 1995 | H928: /9 | I928: 6)
A929: Visione | B929: degli elaborati e orali | C929: : Venerd | D929: i' 22 | E929: Marz | F929: o o | G929: re 16 | H929: .0 | I929: 0 Au | J929: la 6.2
A931: Prossimi | B931: appelli: Giugno
B932: Luglio
A934: -------- | B934: ----------------------- | C934: -------- | D934: ------ | E934: ---- | F934: --- | G934: ----- | H934: -- | I934: ---- | J934: -----------
C935: I^ | D935: II^ | E935: I | F935: II^ | H935: b | I935: onus | J935: TOT
A936: -------- | B936: ----------------------- | C936: -------- | D936: ------ | E936: ---- | F936: --- | G936: ----- | H936: -- | I936: ---- | J936: -----------
A938: 48372 | B938: ADAMI GIORDANO | C938: 10 | D938: 9 | F938: 7 | J938: 3 29
A940: 43651 | B940: ALFONSI ALESSANDRO | C940: 2 | D940: 7 | F940: 7 | J940: 3 19
A942: 47811 | B942: ANTONELLI GIANMARCO | C942: 4 | D942: 9 | F942: 5 | J942: 3 21
A944: 48242 | B944: BALLINI LUCA | C944: 12 | D944: - | F944: 3 | J944: 3 18
A946: 43938 | B946: BERGAMINI FABIO | C946: 7 | D946: 9 | F946: 3 | J946: 3 22
A948: 43664 | B948: BONTEMPI THOMAS | C948: 11 | D948: 9 | F948: 7 | J948: 3 30
A950: 37855 | B950: BURSI GRAZIANO | C950: 2 | D950: 9 | F950: 5 | J950: 3 19
A952: 48458 | B952: CARBONI ENIO | C952: 7 | D952: 7 | F952: 4 | J952: 0 18
A954: 48361 | B954: CARDELLI FULVIO | C954: 3 | D954: 9 | F954: 3 | J954: 3 18
A956: 43900 | B956: COCCHI FABIO | C956: 7 | D956: 9 | F956: 3 | J956: 3 22
A958: 43796 | B958: COMI GIUSEPPE | C958: 13 | D958: 9 | F958: 3 | J958: 3 28
A960: 43706 | B960: CROCIATI CLAUDIO | C960: 11 | D960: 3 | F960: 5 | J960: 3 22
A962: 48411 | B962: D'ALICARNASSO MASSIM. | C962: 5 | D962: 9 | F962: 7 | J962: 3 24
A964: 45950 | B964: DELLI ROCIOLI MARCO | C964: 3 | D964: 6 | F964: 3 | J964: =-       I -> #NOME?
A966: 45901 | B966: DENTE NICOLA | C966: 4 | D966: 9 | F966: 2 | J966: 3 18
A968: 44409 | B968: ESPOSITO ERCOLE | C968: 10 | D968: 7 | F968: 7 | J968: 3 27
A970: 43745 | B970: FERRARI PIERINO | C970: 4 | D970: 9 | F970: 5 | J970: 3 21
A972: 44791 | B972: FIORE GAETANO | C972: 8 | D972: 9 | F972: - | J972: 3 20
A974: 46136 | B974: GIBELLINI MIRCO | C974: 11 | D974: 9 | F974: 6 | J974: 3 29
A976: 41785 | B976: GIOVANZANA GIOVANNI | C976: 10 | D976: 9 | F976: - | J976: 3 22
A978: 43934 | B978: GIULIANO STEFANO | C978: 10 | D978: 8 | F978: 7 | J978: 3 28
A980: 47985 | B980: GOBBETTI MASSIMO | C980: 11 | D980: 8 | F980: - | J980: 3 21
A982: 48491 | B982: LAZZARATO ANDREA | C982: 5 | D982: 9 | F982: 3 | J982: 3 20
A984: 41851 | B984: LEANDRI ANDREA | C984: 14 | D984: 9 | F984: - | J984: 3 26
A986: 36028 | B986: LOMBARDO SANDRO | C986: 6 | D986: 9 | F986: 6 | J986: 3 24
A988: 38642 | B988: LUCCHI ANDREA | C988: 3 | D988: 9 | F988: 7 | J988: 3 22
A990: 41662 | B990: MAGOTTI ALESSANDRO | C990: 14 | D990: 9 | F990: - | J990: 3 26
A992: 42380 | B992: MALAVOLTA PAOLO | C992: 4 | D992: 9 | F992: 4 | J992: 3 20
A994: 38670 | B994: MALAVOLTI FRANCA | C994: 5 | D994: 5 | F994: 6 | J994: 3 19
A996: 50258 | B996: MATTIOLI FRANCESCO | C996: 11 | D996: 7 | F996: 1 | J996: 3 22
A998: 43580 | B998: MAZZA DANIELE ANGELO | C998: 9 | D998: 5 | F998: 3 | J998: 3 20
A1000: 44429 | B1000: MICHELINI FABRIZIO | C1000: 7 | D1000: 5 | F1000: - | J1000: =-       I -> #NOME?
A1002: 54109 | B1002: MUNAFO' FILIPPO | C1002: 14 | D1002: 5 | F1002: - | J1002: 3 22
A1004: 48317 | B1004: PATTUELLI MATTEO | C1004: 14 | D1004: 9 | F1004: 7 | J1004: 3 33
A1006: 50734 | B1006: PAVONE GRAZIANO | C1006: 14 | D1006: 3 | F1006: 7 | J1006: 3 27
A1008: 46517 | B1008: PUCCI GIOVANNI | C1008: 6 | D1008: 9 | F1008: - | J1008: 3 18
A1010: 34674 | B1010: RIZZI LUCA | C1010: - | D1010: 9 | F1010: 3 | J1010: =-       I -> #NOME?
A1012: 50257 | B1012: RIZZO GIUSEPPE | C1012: 14 | D1012: 9 | F1012: 6 | J1012: 3 32
A1014: 43622 | B1014: SGRECCIA ANDREA | C1014: 12 | D1014: 9 | F1014: 1 | J1014: 3 25
A1016: 50730 | B1016: SPAZZOLI RAFFAELE | C1016: 12 | D1016: 9 | F1016: 6 | J1016: 3 30
A1018: 43758 | B1018: STOICO MATTEO | C1018: 11 | D1018: 9 | F1018: 6 | J1018: 3 29
A1020: 41708 | B1020: TADDEI PAOLO | C1020: 14 | D1020: 2 | F1020: 7 | J1020: 3 26
A1022: 50735 | B1022: TAMPIERI STEFANO | C1022: 8 | D1022: 9 | F1022: 3 | J1022: 3 23
A1024: 43954 | B1024: TASSINARI DANIELE | C1024: 10 | D1024: 9 | F1024: 7 | J1024: 3 29
A1026: 43476 | B1026: TERENZI SABINA | C1026: 11 | D1026: 7 | F1026: 3 | J1026: 3 24
A1028: 45722 | B1028: TONELLI ANDREA | C1028: 7 | D1028: 3 | F1028: 7 | J1028: 3 20
A1030: 43307 | B1030: TURRINI ANDREA | C1030: 0 | D1030: 8 | F1030: 6 | J1030: 3 17(*)
A1032: 40307 | B1032: VILLANI ROSANNA RITA | C1032: 4 | D1032: 8 | F1032: 3 | J1032: 3 18
A1034: 43487 | B1034: ZAZZARONI FEDERICO | C1034: 11 | D1034: 4 | F1034: 3 | J1034: 3 21
A1036: 42018 | B1036: ZONARELLI PAOLA | C1036: 4 | D1036: 3 | F1036: 1 | J1036: =-       I -> #NOME?
A1037: -------- | B1037: ----------------------- | C1037: -------- | D1037: ------ | E1037: ---- | F1037: --- | G1037: ----- | H1037: -- | I1037: ---- | J1037: -----------
A1038: * Il 22 | B1038: .3 comunichi se preferi | C1038: sce acce | D1038: ttare | E1038: il v | F1038: oto | G1038: oppu | H1038: re
A1039: rifiu | B1039: tarlo e mantenere il bo | C1039: nus.
A1040: -------- | B1040: ----------------------- | C1040: -------- | D1040: ------ | E1040: ---- | F1040: --- | G1040: ----- | H1040: -- | I1040: ---- | J1040: -----------
B1042: PROVA SCRITTA DI RICER | C1042: CA OPERA | D1042: TIVA D | E1042: EL 1 | F1042: 3 G | G1042: IUGNO | H1042: 1 | I1042: 996
B1043: (Informatica, Ele | C1043: ttronica | D1043: , Tele | E1043: comu | F1043: nic | G1043: azion | H1043: i)
B1045: (VALIDITA': fino alla | C1045: Session | D1045: e AUTU | E1045: NNAL | F1045: E A | G1045: .A. 1 | H1045: 99 | I1045: 35186 | J1045: )
A1046: Visione | B1046: degli elaborati e orali | C1046: : Venerd | D1046: i' 21 | E1046: Giug | F1046: no | G1046: ore 1 | H1046: 0.20833333333333334 | I1046: 0 | J1046: ula 6.1
A1048: Prossimo | B1048: appello: 18 Luglio ore | C1048: 15 (scr | D1048: itto)
B1049: 25 Luglio ore | C1049: 15 (ora | D1049: le)
A1051: Appelli | B1051: successivi: Settembre
B1052: Ottobre
A1054: -------- | B1054: ----------------------- | C1054: -------- | D1054: ------ | E1054: ---- | F1054: --- | G1054: ----- | H1054: -- | I1054: ---- | J1054: -----------
C1055: I^ | D1055: II^ | E1055: I | F1055: II^ | H1055: b | I1055: onus | J1055: TOT
A1056: -------- | B1056: ----------------------- | C1056: -------- | D1056: ------ | E1056: ---- | F1056: --- | G1056: ----- | H1056: -- | I1056: ---- | J1056: -----------
A1058: 50746 | B1058: BATTISTINI ALESSANDRO | C1058: 12 | D1058: 2 | F1058: 11 | I1058: 3 | J1058: 28
A1060: 38844 | B1060: BERNARDINI LUCA | C1060: 12 | D1060: 3 | F1060: 3 | I1060: 3 | J1060: 21
A1062: 50683 | B1062: CEVOLI ALESSANDRO | C1062: 11 | D1062: 3 | F1062: 11 | I1062: 3 | J1062: 28
A1064: 40379 | B1064: DI GIOSAFFATTE LUIGI | C1064: 12 | D1064: 0 | F1064: 8 | I1064: 3 | J1064: 23
A1066: 44461 | B1066: DI PRATO FABRIZIO | C1066: 11 | D1066: 3 | F1066: 9 | I1066: 3 | J1066: 26
A1068: 47224 | B1068: DI STEFANO LUCA | C1068: 9 | D1068: 1 | F1068: 7 | I1068: 3 | J1068: 20
A1070: 46151 | B1070: FIUMANA ALESSANDRO | C1070: 15 | D1070: 2 | F1070: 2 | I1070: 3 | J1070: 22
A1072: 43769 | B1072: GIORGI DANIELE | C1072: 11 | D1072: 1 | F1072: 9 | I1072: 3 | J1072: 24
A1074: 50711 | B1074: GRAGNATO CRISTIANO | C1074: 14 | D1074: 3 | F1074: 7 | I1074: 3 | J1074: 27
A1076: 43777 | B1076: LUPPI ANDREA | C1076: 13 | D1076: 1 | F1076: 9 | I1076: 3 | J1076: 26
A1078: 40600 | B1078: MAIOLI DAVIDE | C1078: 14 | D1078: 0 | F1078: 9 | I1078: 3 | J1078: 26
A1080: 43694 | B1080: MARCHI MARCO | C1080: 12 | D1080: 0 | F1080: 8 | I1080: 3 | J1080: 23
A1082: 50188 | B1082: MORREALE MARCO | C1082: 10 | D1082: 1 | F1082: 0 | I1082: - | J1082: I
A1084: 50758 | B1084: NUCCI DAVIDE | C1084: 6 | D1084: 1 | F1084: 9 | I1084: 3 | J1084: 19
A1086: 39402 | B1086: PACI PAOLO | C1086: 11 | D1086: 3 | F1086: 4 | I1086: 3 | J1086: 21
A1088: 43818 | B1088: RAVAIOLI DANIELE | C1088: 12 | D1088: 2 | F1088: 6 | I1088: 3 | J1088: 23
A1090: 43319 | B1090: RIGHI GABRIELE | C1090: 15 | D1090: 0 | F1090: 5 | I1090: 3 | J1090: 23
A1092: 41652 | B1092: ROLI ANDREA | C1092: 14 | D1092: 0 | F1092: 8 | I1092: 3 | J1092: 25
A1094: 38784 | B1094: VACCA ROBERTO | C1094: 14 | D1094: 3 | F1094: 10 | I1094: 3 | J1094: 30
A1095: -------- | B1095: ----------------------- | C1095: -------- | D1095: ------ | E1095: ---- | F1095: --- | G1095: ----- | H1095: -- | I1095: ---- | J1095: -----------
A1097: -------- | B1097: ----------------------- | C1097: -------- | D1097: ------ | E1097: ---- | F1097: --- | G1097: ----- | H1097: -- | I1097: ---- | J1097: -----------
B1098: PROVA SCRITTA DI RICER | C1098: CA OPERA | D1098: TIVA D | E1098: EL 1 | F1098: 8 L | G1098: UGLIO | H1098: 1 | I1098: 996
B1099: (Informatica, Ele | C1099: ttronica | D1099: , Tele | E1099: comu | F1099: nic | G1099: azion | H1099: i)
B1101: (VALIDITA': fino alla | C1101: Sessione | D1101: AUTUN | E1101: NALE | F1101: A. | G1101: A. 19 | H1101: 95 | I1101: /96)
A1102: Visione | B1102: degli elaborati e orali | C1102: : Gioved | D1102: i' 25 | E1102: Lugl | F1102: io | G1102: ore 1 | H1102: 0.20833333333333334 | I1102: 0 | J1102: ula 6.1
A1104: Prossimo | B1104: appello: 9 Settembre | C1104: ore 10 ( | D1104: scritt | E1104: o;
D1105: iscriz | E1105: ione | F1105: en | G1105: tro i | H1105: l | I1105: 5 Se | J1105: ttembre)
B1106: 36785 | C1106: ore 15 ( | D1106: orale)
A1108: Appelli | B1108: successivi: Ottobre
B1109: Febbraio
A1111: -------- | B1111: ----------------------- | C1111: -------- | D1111: ------ | E1111: ---- | F1111: --- | G1111: ----- | H1111: -- | I1111: ---- | J1111: -----------
C1112: I^ | D1112: II^ | E1112: I | F1112: II^ | H1112: b | I1112: onus | J1112: TOT
A1113: -------- | B1113: ----------------------- | C1113: -------- | D1113: ------ | E1113: ---- | F1113: --- | G1113: ----- | H1113: -- | I1113: ---- | J1113: -----------
A1115: 48093 | B1115: BETTA OLIVIER | C1115: 16 | D1115: 1 | F1115: 4 | I1115: 3 | J1115: 24
A1117: 37296 | B1117: BIONDI MIRCO | C1117: 13 | D1117: 5 | F1117: 5 | I1117: 3 | J1117: 26
A1119: 39225 | B1119: CERRETO ERALDO | C1119: 6 | D1119: 3 | F1119: 6 | I1119: 3 | J1119: 18
A1121: 43589 | B1121: CHIARI MASSIMO | C1121: 14 | D1121: 7 | F1121: 6 | I1121: 3 | J1121: 30
A1123: 37363 | B1123: CRAST UGO | C1123: 6 | D1123: 7 | F1123: 3 | I1123: 3 | J1123: 19
A1125: 42232 | B1125: DI GIOVANNI ANDREA | C1125: 11 | D1125: 6 | F1125: 4 | I1125: 3 | J1125: 24
A1127: 43846 | B1127: FELICETTI FRANCESCO | C1127: 7 | D1127: 7 | F1127: 6 | I1127: 3 | J1127: 23
A1129: 43922 | B1129: GHETTI LUCA | C1129: 8 | D1129: 2 | F1129: 1 | I1129: - | J1129: I
A1131: 48261 | B1131: IALACCI MASSIMILIANO | C1131: 10 | D1131: 6 | F1131: 6 | I1131: 3 | J1131: 25
A1133: 38670 | B1133: MALAVOLTI FRANCA | C1133: 15 | D1133: 7 | F1133: 6 | I1133: 0 | J1133: 28
A1135: 40479 | B1135: MARZOCCHELLA ANTIMO | C1135: 0 | D1135: 4 | F1135: 4 | I1135: - | J1135: I
A1137: 40620 | B1137: MATTOCCIA STEFANO | C1137: 16 | D1137: 7 | F1137: 6 | I1137: 3 | J1137: 32
A1139: 37703 | B1139: MELIS ROBERTO | C1139: 8 | D1139: 5 | F1139: 2 | I1139: 3 | J1139: 18
A1141: 50594 | B1141: NANNI ILARIO | C1141: 14 | D1141: 5 | F1141: 6 | I1141: 3 | J1141: 28
A1143: 43338 | B1143: POZZI STEFANO | C1143: 13 | D1143: 7 | F1143: 6 | I1143: 3 | J1143: 29
A1145: 34674 | B1145: RIZZI LUCA | C1145: 3 | D1145: 4 | F1145: 3 | I1145: - | J1145: I
A1147: 45657 | B1147: ROSSI DAVIDE | C1147: 16 | D1147: 4 | F1147: 6 | I1147: 3 | J1147: 29
A1149: 43760 | B1149: USAN STEFANO | C1149: 14 | D1149: 5 | F1149: 5 | I1149: 3 | J1149: 27
A1150: -------- | B1150: ----------------------- | C1150: -------- | D1150: ------ | E1150: ---- | F1150: --- | G1150: ----- | H1150: -- | I1150: ---- | J1150: -----------
A1152: -------- | B1152: ----------------------- | C1152: -------- | D1152: ------ | E1152: ---- | F1152: --- | G1152: ----- | H1152: -- | I1152: ---- | J1152: -----------
B1153: PROVA SCRITTA DI RICER | C1153: CA OPERA | D1153: TIVA D | E1153: EL 9 | F1153: SE | G1153: TTEMB | H1153: RE | I1153: 199 | J1153: 6
B1154: (Informatica, Ele | C1154: ttronica | D1154: , Tele | E1154: comu | F1154: nic | G1154: azion | H1154: i)
B1156: (VALIDITA': fino alla | C1156: Sessione | D1156: INVER | E1156: NALE | F1156: A. | G1156: A. 19 | H1156: 95 | I1156: /96)
A1157: Visione | B1157: degli elaborati e orali | C1157: : Lunedi | D1157: ' 16 S | E1157: ETTE | F1157: MBR | G1157: E ore | H1157: 1 | I1157: 0.20833333333333334 | J1157: Aula 6.1
A1159: Prossimo | B1159: appello: 1 Ottobre or | C1159: e 13 (sc | D1159: ritto; | E1159: dat | F1159: a d | G1159: a con | H1159: fe | I1159: rmar | J1159: e)
B1160: settimana su | C1160: ccessiva | D1160: (oral | E1160: e)
A1162: Appelli | B1162: successivi: Febbraio
B1163: Marzo
A1165: -------- | B1165: ----------------------- | C1165: -------- | D1165: ------ | E1165: ---- | F1165: --- | G1165: ----- | H1165: -- | I1165: ---- | J1165: -----------
C1166: I^ | D1166: II^ | E1166: I | F1166: II^ | H1166: b | I1166: onus | J1166: TOT
A1167: -------- | B1167: ----------------------- | C1167: -------- | D1167: ------ | E1167: ---- | F1167: --- | G1167: ----- | H1167: -- | I1167: ---- | J1167: -----------
A1169: 43256 | B1169: ARDUINI DANIELE | C1169: 13 | D1169: 3 | F1169: 0 | I1169: 3 | J1169: 19
A1171: 53422 | B1171: BAROZZI ALESSANDRO | C1171: 15 | D1171: 4 | F1171: 6 | I1171: 3 | J1171: 28
A1173: 48303 | B1173: COLOMBARA SIMONE | C1173: 10 | D1173: 4 | F1173: 5 | I1173: 3 | J1173: 22
A1175: 48304 | B1175: FACCHINI CRISTIANA | C1175: 14 | D1175: 5 | F1175: 6 | I1175: 3 | J1175: 28
A1177: 44679 | B1177: GANDINI MAURO | C1177: 12 | D1177: 4 | F1177: 2 | I1177: 3 | J1177: 21
A1179: 48560 | B1179: MELFI ANTONIO | C1179: 11 | D1179: 2 | F1179: 5 | I1179: 3 | J1179: 21
A1181: 44429 | B1181: MICHELINI FABRIZIO | C1181: 13 | D1181: 2 | F1181: 6 | I1181: 3 | J1181: 24
A1183: 44730 | B1183: MONTAGNANI CARLO | C1183: 14 | D1183: - | F1183: 7 | I1183: 3 | J1183: 24
A1185: 48538 | B1185: PANCIROLI FRANCESCO | C1185: 11 | D1185: 2 | F1185: 4 | I1185: 3 | J1185: 20
A1187: 50692 | B1187: POLI GIANLUCA | C1187: 17 | D1187: 5 | F1187: 5 | I1187: 3 | J1187: 30
A1189: 46166 | B1189: SILVAGNI ANDREA | C1189: 13 | D1189: 2 | F1189: 5 | I1189: 3 | J1189: 23
A1191: 50763 | B1191: TRENTI SIMONA | C1191: 14 | D1191: 4 | F1191: 4 | I1191: 3 | J1191: 25
A1193: 42018 | B1193: ZONARELLI PAOLA | C1193: 9 | D1193: 2 | F1193: 5 | I1193: 3 | J1193: 19
A1194: -------- | B1194: ----------------------- | C1194: -------- | D1194: ------ | E1194: ---- | F1194: --- | G1194: ----- | H1194: -- | I1194: ---- | J1194: -----------
A1195: -------- | B1195: ----------------------- | C1195: -------- | D1195: ------ | E1195: ---- | F1195: --- | G1195: ----- | H1195: -- | I1195: ---- | J1195: -----------
B1196: PROVA SCRITTA DI RICER | C1196: CA OPERA | D1196: TIVA D | E1196: EL 1 | F1196: OT | G1196: TOBRE | H1196: 1 | I1196: 996
B1197: (Informatica, Ele | C1197: ttronica | D1197: , Tele | E1197: comu | F1197: nic | G1197: azion | H1197: i)
B1199: (VALIDITA': fino alla | C1199: Sessione | D1199: INVER | E1199: NALE | F1199: A. | G1199: A. 19 | H1199: 95 | I1199: /96)
A1200: Visione | B1200: degli elaborati e orali | C1200: : Mercol | D1200: edi' 9 | E1200: Ott | F1200: obr | G1200: e ore | H1200: 1 | I1200: 0.33333333333333331 | J1200: Aula 6.1
A1202: Prossimi | B1202: appelli: Febbraio
B1203: Marzo
A1205: -------- | B1205: ----------------------- | C1205: -------- | D1205: ------ | E1205: ---- | F1205: --- | G1205: ----- | H1205: -- | I1205: ---- | J1205: -----------
C1206: I^ | D1206: II^ | F1206: b | G1206: onus | I1206: TO | J1206: T
A1207: -------- | B1207: ----------------------- | C1207: -------- | D1207: ------ | E1207: ---- | F1207: --- | G1207: ----- | H1207: -- | I1207: ---- | J1207: -----------
A1209: 46555 | B1209: BALDINI ALBERTO | C1209: 8 | D1209: 10 | G1209: 3 | I1209: 2 | J1209: 1
A1211: 50729 | B1211: BENASSI LUCA | C1211: 6 | D1211: 8 | G1211: - | J1211: I
A1213: 46062 | B1213: BOSCHETTI GABRIELE | C1213: 4 | D1213: 8 | G1213: - | J1213: I
A1215: 43610 | B1215: CASSI PIER FRANCESCO | C1215: 8 | D1215: 8 | G1215: 3 | I1215: 1 | J1215: 9
A1217: 43260 | B1217: CENNI ANDREA | C1217: 15 | D1217: 11 | G1217: 3 | I1217: 2 | J1217: 9
A1219: 46277 | B1219: DALL'AGLIO CLAUDIA | C1219: 6 | D1219: 9 | G1219: 3 | I1219: 1 | J1219: 8
A1221: 45829 | B1221: DE NOVELLIS PIER FEDE | C1221: LE 14 | D1221: 8 | G1221: 3 | I1221: 2 | J1221: 5
A1223: 42385 | B1223: DI BARI ANDREA | C1223: 14 | D1223: 8 | G1223: 3 | I1223: 2 | J1223: 5
A1225: 42073 | B1225: GAZZOTTI MATTEO | C1225: 8 | D1225: 6 | G1225: 3 | I1225: 1 | J1225: 7 (*)
A1227: 45677 | B1227: GRANDI SAURO | C1227: 17 | D1227: 7 | G1227: 3 | I1227: 2 | J1227: 7
A1229: 41840 | B1229: LONGO LUCA | C1229: 13 | D1229: 4 | G1229: 0 | I1229: 1 | J1229: 7 (*)
A1231: 40479 | B1231: MARZOCCHELLA ANTIMO | C1231: 9 | D1231: 8 | G1231: 3 | I1231: 2 | J1231: 0
A1233: 37509 | B1233: MAZZANTI GIANLUCA | C1233: 2 | D1233: 13 | G1233: 3 | I1233: 1 | J1233: 8
A1235: 39138 | B1235: MERIGHI MASSIMO | C1235: 8 | D1235: 13 | G1235: 3 | I1235: 2 | J1235: 4
A1237: 48384 | B1237: MEUCCI MATTEO COSTANT | C1237: INO 13 | D1237: 11 | G1237: 3 | I1237: 2 | J1237: 7
A1239: 46079 | B1239: MONCO ALESSANDRO | C1239: 11 | D1239: 5 | G1239: 3 | I1239: 1 | J1239: 9
A1241: 35898 | B1241: MORARA FABIO | C1241: 8 | D1241: 13 | G1241: 3 | I1241: 2 | J1241: 4
A1243: 54077 | B1243: PANCANI LORENZO | C1243: 11 | D1243: 10 | G1243: 3 | I1243: 2 | J1243: 4
A1245: 38630 | B1245: PAPPADA' ANDREA | C1245: 9 | D1245: 9 | G1245: 3 | I1245: 2 | J1245: 1
A1247: 48410 | B1247: PERUZZI ALESSANDRO | C1247: 11 | D1247: 12 | G1247: 3 | I1247: 2 | J1247: 6
A1249: 46116 | B1249: PORCU' MATTEO | C1249: 17 | D1249: 13 | G1249: 3 | I1249: 3 | J1249: 3
A1251: 42578 | B1251: RAMBALDI LUIGI | C1251: 14 | D1251: 3 | G1251: 3 | I1251: 2 | J1251: 0
A1253: 48406 | B1253: SCHIUMARINI FABIO | C1253: 8 | D1253: 10 | G1253: 3 | I1253: 2 | J1253: 1
A1255: 46502 | B1255: TASSINARI SAVERIO | C1255: 8 | D1255: 6 | G1255: 3 | I1255: 1 | J1255: 7 (*)
A1257: 47996 | B1257: TORRONI PAOLO | C1257: 8 | D1257: 9 | G1257: 3 | I1257: 2 | J1257: 0
A1259: 46272 | B1259: UGOLINI MARZIA | C1259: 15 | D1259: 9 | G1259: 3 | I1259: 2 | J1259: 7
A1261: -------- | B1261: ----------------------- | C1261: -------- | D1261: ------ | E1261: ---- | F1261: --- | G1261: ----- | H1261: -- | I1261: ---- | J1261: -----------
A1262: (*) Il | B1262: 9.10 comunichi se prefe | C1262: risce ac | D1262: cettar | E1262: e o | F1262: ave | G1262: re in | H1262: su | I1262: ffic | J1262: ienza
A1263: e m | B1263: antenere il bonus. CONF | C1263: ERMATI
A1264: -------- | B1264: ----------------------- | C1264: -------- | D1264: ------ | E1264: ---- | F1264: --- | G1264: ----- | H1264: -- | I1264: ---- | J1264: -----------
A1266: -------- | B1266: ----------------------- | C1266: -------- | D1266: ------ | E1266: ---- | F1266: --- | G1266: ----- | H1266: -- | I1266: ---- | J1266: -----------
B1267: PROVA SCRITTA DI RICER | C1267: CA OPERA | D1267: TIVA D | E1267: EL 2 | F1267: 1 G | G1267: ENNAI | H1267: O | I1267: 1997
B1268: (Informatica, Ele | C1268: ttronica | D1268: , Tele | E1268: comu | F1268: nic | G1268: azion | H1268: i)
B1270: (VALIDITA': fino alla | C1270: Sessione | D1270: ESTIV | E1270: A A. | F1270: A. | G1270: 1996/ | H1270: 97 | I1270: )
A1271: Visione | B1271: degli elaborati e orali | C1271: : Gioved | D1271: i' 30 | E1271: Genn | F1271: aio | G1271: ore | H1271: 15 | I1271: .00 | J1271: Aula 6.1
A1273: Prossimo | B1273: appello: 18 Febbraio, | C1273: ore 15 ( | D1273: scritt | E1273: o)
B1274: data da stabi | C1274: lirsi ( | D1274: orale)
A1276: Appelli | B1276: successivi: Giugno
B1277: Luglio
A1278: -------- | B1278: ----------------------- | C1278: -------- | D1278: ------ | E1278: ---- | F1278: --- | G1278: ----- | H1278: -- | I1278: ---- | J1278: -----------
A1280: 40337 | B1280: ANDRAGHETTI LUCA | C1280: 12 | D1280: 2 | F1280: 5 | I1280: 3 | J1280: 22
A1282: 52849 | B1282: ARGELLI ALESSANDRO | C1282: 12 | D1282: 3 | F1282: 9 | I1282: 3 | J1282: 27
A1284: 48376 | B1284: BIONDI MAURIZIO | C1284: 14 | D1284: 2 | F1284: 10 | I1284: 3 | J1284: 29
A1286: 52230 | B1286: CACITTI ALESSIO | C1286: 10 | D1286: 3 | F1286: 4 | I1286: 3 | J1286: 20
A1288: 53066 | B1288: CANGINI GIANLUCA | C1288: 11 | D1288: 3 | F1288: 12 | I1288: 3 | J1288: 29
A1290: 56559 | B1290: DI CESARE ANDREA | C1290: 6 | D1290: - | F1290: 9 | I1290: 3 | J1290: 18
A1292: 46371 | B1292: DI MARTINO MARCO | C1292: 13 | D1292: 2 | F1292: 3 | I1292: 3 | J1292: 21
A1294: 43922 | B1294: GHETTI LUCA | C1294: 13 | D1294: 1 | F1294: 2 | I1294: 3 | J1294: 19
A1296: 45790 | B1296: LUPPI DANIELE | C1296: 6 | D1296: - | F1296: 10 | I1296: 3 | J1296: 19
A1298: 48306 | B1298: MACCANTI MAXIMILIANO | C1298: 11 | D1298: 3 | F1298: 11 | I1298: 3 | J1298: 28
A1300: 43281 | B1300: MAGALOTTI ANDREA | C1300: 10 | D1300: - | F1300: 7 | I1300: 3 | J1300: 20
A1302: 50082 | B1302: MONACI MICHELE | C1302: 14 | D1302: 3 | F1302: 12 | I1302: 3 | J1302: 32
A1304: 47981 | B1304: PIERINI ANDREA | C1304: 15 | D1304: 3 | F1304: 11 | I1304: 3 | J1304: 32
A1306: 48366 | B1306: PIOVATICCI MATTEO | C1306: 14 | D1306: 3 | F1306: 12 | I1306: 3 | J1306: 32
A1308: 43952 | B1308: TREBBI ALESSANDRO | C1308: 10 | D1308: 3 | F1308: 11 | I1308: 3 | J1308: 27
A1310: 46063 | B1310: VOLPE ALESSANDRO | C1310: 8 | D1310: 2 | F1310: 11 | I1310: 3 | J1310: 24
A1312: -------- | B1312: ----------------------- | C1312: -------- | D1312: ------ | E1312: ---- | F1312: --- | G1312: ----- | H1312: -- | I1312: ---- | J1312: -----------
A1314: -------- | B1314: ----------------------- | C1314: -------- | D1314: ------ | E1314: ---- | F1314: --- | G1314: ----- | H1314: -- | I1314: ---- | J1314: ----------
B1315: PROVA SCRITTA DI RICERC | C1315: A OPERAT | D1315: IVA DE | E1315: L 18 | F1315: FE | G1315: BBRAI | H1315: O | I1315: 1997
B1316: (Informatica, Elet | C1316: tronica, | D1316: Telec | E1316: omun | F1316: ica | G1316: zioni | H1316: )
B1318: (VALIDITA': fino alla S | C1318: essione | D1318: ESTIVA | E1318: A.A | F1318: . 1 | G1318: 996/9 | H1318: 7)
A1319: visione | B1319: degli elaborati e orali | C1319: : Venerd | D1319: i' 7 M | E1319: arzo | F1319: (d | G1319: ata d | H1319: a | I1319: conf | J1319: ermare; sara'
B1320: esposto avviso con | C1320: ora e au | D1320: la dop | E1320: o il | F1320: 5 | G1320: Marzo | H1320: ; | I1320: NON | J1320: telefonare)
A1322: prossimi | B1322: appelli: Giugno
B1323: Luglio
A1324: -------- | B1324: ----------------------- | C1324: -------- | D1324: ------ | E1324: ---- | F1324: --- | G1324: ----- | H1324: -- | I1324: ---- | J1324: ----------
C1325: I^ | D1325: II^ | E1325: II | F1325: I^ | H1325: bo | I1325: nus | J1325: TOT
A1326: -------- | B1326: ----------------------- | C1326: -------- | D1326: ------ | E1326: ---- | F1326: --- | G1326: ----- | H1326: -- | I1326: ---- | J1326: ----------
A1328: 50677 | B1328: ALBERTI LUCA | C1328: 3 | D1328: 7 | F1328: 6 | I1328: 3 | J1328: 19
A1330: 50725 | B1330: AZZOLINI DAVIDE | C1330: 8 | D1330: 7 | F1330: 7 | I1330: 3 | J1330: 25
A1332: 40424 | B1332: BARTOLINI MIRCO | C1332: 16 | D1332: 0 | F1332: 6 | I1332: 3 | J1332: 25
A1334: 46049 | B1334: BENINTENDE PIERPAOLO | C1334: 6 | D1334: 4 | F1334: 5 | I1334: 3 | J1334: 18
A1336: 50736 | B1336: CASTAGNOLI RICCARDO | C1336: 3 | D1336: 6 | F1336: 7 | I1336: 3 | J1336: 19
A1338: 50719 | B1338: CIUFFOLI FABIO | C1338: 5 | D1338: 4 | F1338: 6 | I1338: 3 | J1338: 18
A1340: 47779 | B1340: CIVITELLA GIUSEPPINA | C1340: 11 | D1340: 7 | F1340: 5 | I1340: 3 | J1340: 26
A1342: 48396 | B1342: CRUGNALE CONCEZIO | C1342: 6 | D1342: 4 | F1342: 6 | I1342: 3 | J1342: 19
A1344: 43787 | B1344: D'ANGELO ANTONIO | C1344: 3 | D1344: 7 | F1344: 5 | I1344: 3 | J1344: 18
A1346: 48363 | B1346: FABBRICA ROBERTO | C1346: 16 | D1346: 2 | F1346: 7 | I1346: 3 | J1346: 28
A1348: 48308 | B1348: FACCIOLI FRANCO | C1348: 6 | D1348: 5 | F1348: 7 | I1348: 3 | J1348: 21
A1350: 50806 | B1350: FAGGIOLI LUCA | C1350: 7 | D1350: 3 | F1350: 7 | I1350: 3 | J1350: 20
A1352: 50255 | B1352: FERRARI ALBERTO | C1352: 10 | D1352: 7 | F1352: 6 | I1352: 3 | J1352: 26
A1354: 50710 | B1354: FIORENTINI CRISTIAN | C1354: 14 | D1354: 4 | F1354: 5 | I1354: 3 | J1354: 26
A1356: 47927 | B1356: GABRIELLI MASSIMO | C1356: 6 | D1356: 5 | F1356: 7 | I1356: 3 | J1356: 21
A1358: 50765 | B1358: GALASSO STEFANIA | C1358: 5 | D1358: 7 | F1358: 6 | I1358: 3 | J1358: 21
A1360: 45694 | B1360: GAVANELLI MARCO | C1360: 9 | D1360: 5 | F1360: 7 | I1360: 3 | J1360: 24
A1362: 50805 | B1362: GUERRA DANIELE | C1362: 14 | D1362: 3 | F1362: 6 | I1362: 3 | J1362: 26
A1364: 48341 | B1364: GUIDOTTI GIANLUCA | C1364: 8 | D1364: 3 | F1364: 5 | I1364: 3 | J1364: 19
A1366: 39142 | B1366: LABANTI ENRICO | C1366: 3 | D1366: 7 | F1366: 7 | I1366: 3 | J1366: 20
A1368: 51713 | B1368: LIBANORI PIERPAOLO | C1368: 11 | D1368: 7 | F1368: 7 | I1368: 3 | J1368: 28
A1370: 43763 | B1370: LIVERANI PAOLO | C1370: 4 | D1370: 4 | F1370: 7 | I1370: 3 | J1370: 18
A1372: 51919 | B1372: LOMBARDI ANDREA | C1372: 8 | D1372: 7 | F1372: 5 | I1372: 3 | J1372: 23
A1374: 50716 | B1374: MATTIOLI FEDERICA | C1374: 12 | D1374: 7 | F1374: 5 | I1374: 3 | J1374: 27
A1376: 45885 | B1376: MERIGGI PAOLO | C1376: 3 | D1376: 4 | F1376: 1 | I1376: - | J1376: I
A1378: 52119 | B1378: MONTANARI MARCELLO | C1378: 14 | D1378: 7 | F1378: 7 | I1378: 3 | J1378: 31
A1380: 50188 | B1380: MORREALE MARCO | C1380: 9 | D1380: 1 | F1380: 5 | I1380: 3 | J1380: 18
A1382: 41951 | B1382: NOCETTI MARCO | C1382: 11 | D1382: 7 | F1382: 7 | I1382: 3 | J1382: 28
A1384: 45750 | B1384: OLIVIERI ALBERTO | C1384: 6 | D1384: 7 | F1384: 6 | I1384: 3 | J1384: 22
A1386: 44168 | B1386: PAZZINI DANIELA | C1386: 12 | D1386: 6 | F1386: 5 | I1386: 3 | J1386: 26
A1388: 48336 | B1388: PIANA SILVANO | C1388: 12 | D1388: 3 | F1388: 0 | I1388: 3 | J1388: 18
A1390: 48026 | B1390: PIERETTI CARLO | C1390: 16 | D1390: 7 | F1390: 7 | I1390: 3 | J1390: 33
A1392: 45662 | B1392: PIROZZI ENRICO | C1392: 10 | D1392: 1 | F1392: 5 | I1392: 3 | J1392: 19
A1394: 53710 | B1394: PROFIRI LIVIO | C1394: 5 | D1394: 7 | F1394: 7 | I1394: 3 | J1394: 22
A1396: 56591 | B1396: RANIERI COSIMO | C1396: 5 | D1396: 4 | F1396: 6 | I1396: 3 | J1396: 18
A1398: 50790 | B1398: RITELLI WALTER | C1398: 6 | D1398: 4 | F1398: 5 | I1398: 3 | J1398: 18
A1400: 50094 | B1400: SCHONHAUT MARCO | C1400: 16 | D1400: 7 | F1400: 7 | I1400: 3 | J1400: 33
A1402: 50723 | B1402: SPINARELLI MAURO | C1402: 5 | D1402: 4 | F1402: 6 | I1402: 3 | J1402: 18
A1404: 50672 | B1404: TASSINARI SILVIA | C1404: 7 | D1404: 5 | F1404: 4 | I1404: 3 | J1404: 19
A1406: 52126 | B1406: TEDALDI MIRKO | C1406: 8 | D1406: 7 | F1406: 7 | I1406: 3 | J1406: 25
A1408: 48380 | B1408: TOLOMELLI ALBERTO | C1408: 14 | D1408: 7 | F1408: 4 | I1408: 3 | J1408: 28
A1410: 58909 | B1410: VAMPIRI DAVIDE | C1410: 10 | D1410: 7 | F1410: 7 | I1410: 3 | J1410: 27
A1412: 52580 | B1412: ZAULI ANDREA | C1412: 7 | D1412: 3 | F1412: 5 | I1412: 3 | J1412: 18
A1414: 42018 | B1414: ZONARELLI PAOLA | C1414: 6 | D1414: 6 | F1414: 7 | I1414: 0 | J1414: 19
A1416: 45953 | B1416: ZUBELLI FRANCESCO | C1416: 7 | D1416: 4 | F1416: 6 | I1416: 3 | J1416: 20
A1417: -------- | B1417: ----------------------- | C1417: -------- | D1417: ------ | E1417: ---- | F1417: --- | G1417: ----- | H1417: -- | I1417: ---- | J1417: ----------
A1419: -------- | B1419: ----------------------- | C1419: -------- | D1419: ------ | E1419: ---- | F1419: --- | G1419: ----- | H1419: -- | I1419: ---- | J1419: ----------
B1420: PROVA SCRITTA DI RICER | C1420: CA OPERA | D1420: TIVA D | E1420: EL 1 | F1420: 1 G | G1420: IUGNO | H1420: 1 | I1420: 997
B1421: (Informatica, Elet | C1421: tronica, | D1421: Telec | E1421: omun | F1421: ica | G1421: zioni | H1421: )
B1423: (VALIDITA': fino alla | C1423: Sessione | D1423: AUTUN | E1423: NALE | F1423: A. | G1423: A. 19 | H1423: 96 | I1423: /97)
A1424: v | B1424: isione degli elaborati | C1424: e orali: | D1424: Marte | E1424: di' | F1424: 17 | G1424: Giugn | H1424: o | I1424: ore | J1424: 15
A1426: prossimi | B1426: appelli: 3 Luglio, or | C1426: e 15 (sc | D1426: ritto)
B1427: 10 Luglio, or | C1427: e 15 (or | D1427: ale)
B1428: 10 Settembre, | C1428: ore 15 | D1428: (scrit | E1428: to)
B1429: Settembre (or | C1429: ale)
B1430: Ottobre (scri | C1430: tto e or | D1430: ale)
A1432: -------- | B1432: ----------------------- | C1432: -------- | D1432: ------ | E1432: ---- | F1432: --- | G1432: ----- | H1432: -- | I1432: ---- | J1432: ----------
D1433: I^ | E1433: II | F1433: ^ | G1433: bo | H1433: nu | I1433: s | J1433: TOT
A1434: -------- | B1434: ----------------------- | C1434: -------- | D1434: ------ | E1434: ---- | F1434: --- | G1434: ----- | H1434: -- | I1434: ---- | J1434: ----------
A1436: 52578 | B1436: BENFENATI ANDREA | D1436: 12 | E1436: 11 | I1436: 3 | J1436: 26
A1438: 51878 | B1438: CAVALLARI CRISTIANO | D1438: 10 | E1438: 10 | I1438: 3 | J1438: 23
A1440: 50679 | B1440: DE ANGELIS STEFANO | D1440: 6 | E1440: 4 | I1440: - | J1440: I
A1442: 41849 | B1442: DE GIUSEPPE GEREMIA | D1442: 14 | E1442: 12 | I1442: 3 | J1442: 29
A1444: 38816 | B1444: GUIDUCCI MAXIMILIANO | D1444: 7 | E1444: 7 | I1444: 3 | J1444: 17 (*)
A1446: 40500 | B1446: LANZONI PIERO | D1446: 14 | E1446: 3 | I1446: 3 | J1446: 20
A1448: 43654 | B1448: ROMANELLI DIEGO | D1448: 15 | E1448: 10 | I1448: 3 | J1448: 28
A1450: 48313 | B1450: SANTOBUONO DONATELLA | D1450: 10 | E1450: 5 | I1450: 3 | J1450: 18
A1451: -------- | B1451: ----------------------- | C1451: -------- | D1451: ------ | E1451: ---- | F1451: --- | G1451: ----- | H1451: -- | I1451: ---- | J1451: ----------
A1452: (*) Il 1 | B1452: 7.6 comunichi se prefer | C1452: isce acc | D1452: ettare | E1452: o a | F1452: ver | G1452: e ins | H1452: uf | I1452: fici | J1452: enza
A1453: e ma | B1453: ntenere il bonus.
A1454: -------- | B1454: ----------------------- | C1454: -------- | D1454: ------ | E1454: ---- | F1454: --- | G1454: ----- | H1454: -- | I1454: ---- | J1454: -----------
A1456: -------- | B1456: ----------------------- | C1456: -------- | D1456: ------ | E1456: ---- | F1456: --- | G1456: ----- | H1456: -- | I1456: ---- | J1456: ----------
B1457: PROVA SCRITTA DI RICER | C1457: CA OPERA | D1457: TIVA D | E1457: EL 3 | F1457: LU | G1457: GLIO | H1457: 19 | I1457: 97
B1458: (Informatica, Elet | C1458: tronica, | D1458: Telec | E1458: omun | F1458: ica | G1458: zioni | H1458: )
B1460: (VALIDITA': fino alla | C1460: Sessione | D1460: AUTUN | E1460: NALE | F1460: A. | G1460: A. 19 | H1460: 96 | I1460: /97)
A1461: visio | B1461: ne degli elaborati e or | C1461: ali: Gio | D1461: vedi' | E1461: 10 L | F1461: ugl | G1461: io, o | H1461: re | I1461: 15 | J1461: aula 6.1
A1463: prossimi | B1463: appelli: 10 Settembre, | C1463: ore 15 | D1463: (scrit | E1463: to)
B1464: Settembre (or | C1464: ale)
B1465: Ottobre (scri | C1465: tto e or | D1465: ale)
A1467: -------- | B1467: ----------------------- | C1467: -------- | D1467: ------ | E1467: ---- | F1467: --- | G1467: ----- | H1467: -- | I1467: ---- | J1467: ------------
C1468: I^ | D1468: II^ | E1468: I | F1468: II^ | H1468: b | I1468: onus | J1468: TOT
A1469: -------- | B1469: ----------------------- | C1469: -------- | D1469: ------ | E1469: ---- | F1469: --- | G1469: ----- | H1469: -- | I1469: ---- | J1469: ------------
A1471: 40288 | B1471: ANSALONI ROBERTO | C1471: 12 | D1471: 3 | F1471: 6 | I1471: 3 | J1471: 24
A1473: 46062 | B1473: BOSCHETTI GABRIELE | C1473: 15 | D1473: - | F1473: 10 | I1473: 3 | J1473: 28
A1475: 50719 | B1475: CIUFFOLI FABIO | C1475: 14 | D1475: 5 | F1475: 10 | I1475: 0 | J1475: 29
A1477: 53131 | B1477: COLLINA CLAUDIO | C1477: 11 | D1477: - | F1477: 10 | I1477: 3 | J1477: 24
A1479: 37383 | B1479: DE BONIS ANTONIO | C1479: 12 | D1479: 5 | F1479: 0 | I1479: 3 | J1479: 20
A1481: 47956 | B1481: DRUDI ENRICO | C1481: 15 | D1481: 3 | F1481: 8 | I1481: 3 | J1481: 29
A1483: 42073 | B1483: GAZZOTTI MATTEO | C1483: 5 | D1483: 3 | F1483: 2 | I1483: 0 | J1483: I
A1485: 45818 | B1485: GERACI GIULIO | C1485: 15 | D1485: 3 | F1485: 4 | I1485: 3 | J1485: 25
A1487: 52618 | B1487: LUCENTE STEFANO | C1487: 15 | D1487: 3 | F1487: 10 | I1487: 3 | J1487: 31
A1489: 46256 | B1489: MACCHINI BERNARDETTA | C1489: 10 | D1489: 5 | F1489: 10 | I1489: 3 | J1489: 28
A1491: 47741 | B1491: MASOTTI DANIELE | C1491: 13 | D1491: 5 | F1491: 10 | I1491: 3 | J1491: 31
A1493: 45885 | B1493: MERIGGI PAOLO | C1493: 6 | D1493: 5 | F1493: 5 | I1493: 3 | J1493: 19
A1495: 48042 | B1495: NUNZIATA STEFANO | C1495: 15 | D1495: 3 | F1495: 7 | I1495: 3 | J1495: 28
A1497: 40670 | B1497: REGAZZI ANDREA | C1497: 14 | D1497: 5 | F1497: 0 | I1497: 3 | J1497: 22
A1499: 50790 | B1499: RITELLI WALTER | C1499: 15 | D1499: 5 | F1499: 10 | I1499: 0 | J1499: 30
A1501: 48344 | B1501: ROSA FABRIZIO | C1501: 15 | D1501: 3 | F1501: 3 | I1501: 3 | J1501: 24
A1503: 41641 | B1503: TABANELLI ANDREA | C1503: 15 | D1503: 3 | F1503: 5 | I1503: 3 | J1503: 26
A1505: 45954 | B1505: TASSELLI FILIPPO | C1505: 12 | D1505: 3 | F1505: 10 | I1505: 3 | J1505: 28
A1507: 50672 | B1507: TASSINARI SILVIA | C1507: 11 | D1507: 5 | F1507: 4 | I1507: 0 | J1507: 20
A1509: 44391 | B1509: TOFANI CARLA | C1509: 15 | D1509: 3 | F1509: 5 | I1509: 3 | J1509: 26
A1511: 43699 | B1511: TOLOMELLI PAOLO | C1511: 10 | D1511: 3 | F1511: 5 | I1511: 3 | J1511: 21
A1513: 56296 | B1513: ZANIN MICHELE | C1513: 15 | D1513: 5 | F1513: 10 | I1513: 3 | J1513: 33
A1515: 52580 | B1515: ZAULI ANDREA | C1515: 12 | D1515: 3 | F1515: 10 | I1515: 0 | J1515: 25
A1516: -------- | B1516: ----------------------- | C1516: -------- | D1516: ------ | E1516: ---- | F1516: --- | G1516: ----- | H1516: -- | I1516: ---- | J1516: ----------
A1518: -------- | B1518: ----------------------- | C1518: -------- | D1518: ------ | E1518: ---- | F1518: --- | G1518: ----- | H1518: -- | I1518: ---- | J1518: ----------
B1519: PROVA SCRITTA DI RICERC | C1519: A OPERAT | D1519: IVA DE | E1519: L 10 | F1519: SE | G1519: TTEMB | H1519: RE | I1519: 199 | J1519: 7
B1520: (Informatica, Elet | C1520: tronica, | D1520: Telec | E1520: omun | F1520: ica | G1520: zioni | H1520: )
B1522: (VALIDITA': fino alla | C1522: Sessione | D1522: INVER | E1522: NALE | F1522: A. | G1522: A. 19 | H1522: 96 | I1522: /97)
A1523: visione | B1523: degli elaborati e oral | C1523: i: Luned | D1523: i' 22 | E1523: Sett | F1523: emb | G1523: re, o | H1523: re | I1523: 15 | J1523: aula 5.7
A1525: prossimi | B1525: appelli: meta' Ottobre | C1525: (la dat | D1525: a sara | E1525: ' co | F1525: mun | G1525: icata | H1525: d | I1525: opo | J1525: inizio lezioni)
B1526: Febbraio
B1527: Marzo
A1529: -------- | B1529: ----------------------- | C1529: -------- | D1529: ------ | E1529: ---- | F1529: --- | G1529: ----- | H1529: -- | I1529: ---- | J1529: ------------
D1530: I^ | E1530: II | F1530: ^ | G1530: bo | H1530: nu | I1530: s | J1530: TOT
A1531: -------- | B1531: ----------------------- | C1531: -------- | D1531: ------ | E1531: ---- | F1531: --- | G1531: ----- | H1531: -- | I1531: ---- | J1531: ------------
A1533: 40538 | B1533: BARTOLINI DAVIDE | D1533: 10 | E1533: 9 | I1533: 3 | J1533: 22
A1535: 43609 | B1535: BIDINI MAURIZIO | D1535: 15 | E1535: 7 | I1535: 3 | J1535: 25
A1537: 46320 | B1537: DEGLI ESPOSTI MERLI M | C1537: ONICA | D1537: 16 | E1537: 12 | I1537: 3 | J1537: 31
A1539: 43809 | B1539: FERRARI CLAUDIO | D1539: 7 | E1539: 12 | I1539: 3 | J1539: 22
A1541: 50360 | B1541: GALLEGATI MASSIMO | D1541: 8 | E1541: 12 | I1541: 3 | J1541: 23
A1543: 50076 | B1543: MIELE GIUSEPPE | D1543: 10 | E1543: 5 | I1543: 3 | J1543: 18
A1545: 45615 | B1545: PANTALEONI MAURIZIO | D1545: 11 | E1545: 11 | I1545: 3 | J1545: 25
A1547: 53008 | B1547: ROFFIA LUCA | D1547: 6 | E1547: 10 | I1547: 3 | J1547: 19
A1549: 52719 | B1549: ROSSI MARCO | D1549: 7 | E1549: 12 | I1549: 3 | J1549: 22
A1551: 48332 | B1551: SCAGLIARINI SIMONE | D1551: 18 | E1551: 9 | I1551: 3 | J1551: 30
A1553: 50468 | B1553: TASSINARI GIANFRANCO | D1553: 13 | E1553: 12 | I1553: 3 | J1553: 28
A1555: 40241 | B1555: TEBALDI NICOLA | D1555: 18 | E1555: 9 | I1555: 3 | J1555: 30
A1557: 40471 | B1557: TOTARO PATRIZIA | D1557: 5 | E1557: 10 | I1557: 3 | J1557: 18
A1559: -------- | B1559: ----------------------- | C1559: -------- | D1559: ------ | E1559: ---- | F1559: --- | G1559: ----- | H1559: -- | I1559: ---- | J1559: ----------
A1561: -------- | B1561: ----------------------- | C1561: -------- | D1561: ------ | E1561: ---- | F1561: --- | G1561: ----- | H1561: -- | I1561: ---- | J1561: ----------
B1562: PROVA SCRITTA DI RICERC | C1562: A OPERAT | D1562: IVA DE | E1562: L 17 | F1562: OT | G1562: TOBRE | H1562: 1 | I1562: 997
B1563: (Informatica, Elet | C1563: tronica, | D1563: Telec | E1563: omun | F1563: ica | G1563: zioni | H1563: )
B1565: (VALIDITA': fino alla | C1565: Sessione | D1565: INVER | E1565: NALE | F1565: A. | G1565: A. 19 | H1565: 96 | I1565: /97)
A1566: visione | B1566: degli elaborati e oral | C1566: i: vener | D1566: di' 24 | E1566: Ott | F1566: obr | G1566: e, or | H1566: e | I1566: 16 | J1566: aula 6.2
A1568: prossimi | B1568: appelli: Gennaio
B1569: Marzo
A1571: Si confe | B1571: rma, come peraltro comu | C1571: nicato p | D1571: rima d | E1571: ella | F1571: ri | G1571: chies | H1571: ta | I1571: , ch | J1571: e non
A1572: ci saran | B1572: no appelli in Dicembre. | C1572: Si comu | D1572: nica c | E1572: he l | F1572: 'ap | G1572: pello | H1572: o | I1572: rigi | J1572: nariamente
A1573: previsto | B1573: per Febbraio e' stato | C1573: anticipa | D1573: to al | E1573: 14 G | F1573: enn | G1573: aio.
A1575: -------- | B1575: ----------------------- | C1575: -------- | D1575: ------ | E1575: ---- | F1575: --- | G1575: ----- | H1575: -- | I1575: ---- | J1575: ------------
D1576: I^ | E1576: II | F1576: ^ | G1576: II^ | I1576: b | J1576: onus TOT
A1577: -------- | B1577: ----------------------- | C1577: -------- | D1577: ------ | E1577: ---- | F1577: --- | G1577: ----- | H1577: -- | I1577: ---- | J1577: ------------
A1579: 48243 | B1579: BARBAGLI FEDERICO | D1579: 13 | E1579: 2 | G1579: 12 | J1579: 3 30
A1581: 50740 | B1581: BARTOLOMEOLI MAURO | D1581: 12 | E1581: 3 | G1581: 7 | J1581: 3 25
A1583: 41717 | B1583: BENTIVOGLI LORENZO | D1583: 4 | E1583: - | G1583: 6 | J1583: =-       I -> #NOME?
A1585: 50745 | B1585: BOLOGNESI CARLA | D1585: 13 | E1585: 1 | G1585: 6 | J1585: 3 23
A1587: 52230 | B1587: CACITTI ALESSIO | D1587: 12 | E1587: 3 | G1587: 10 | J1587: 0 25
A1589: 38837 | B1589: CELLUCCI GIOVANNI | D1589: 0 | E1589: - | G1589: 10 | J1589: =-       I -> #NOME?
A1591: 48293 | B1591: CHIUSOLI CLAUDIA | D1591: 11 | E1591: 2 | G1591: 12 | J1591: 3 28
A1593: 50747 | B1593: CISCATO MARCO | D1593: 10 | E1593: - | G1593: 12 | J1593: 3 25
A1595: 47849 | B1595: DOTTI MASSIMO | D1595: 8 | E1595: 1 | G1595: 8 | J1595: 3 20
A1597: 50708 | B1597: FRANCESCHINI MAURO | D1597: 12 | E1597: 3 | G1597: 8 | J1597: 3 26
A1599: 42638 | B1599: LORENZINI ANDREA | D1599: 4 | E1599: - | G1599: 10 | J1599: 3 17 (*)
A1601: 48393 | B1601: RAVALDI FEDERICO | D1601: 6 | E1601: - | G1601: 10 | J1601: 3 19
A1603: 48582 | B1603: TEODORI GIANLUCA | D1603: 5 | E1603: - | G1603: 10 | J1603: 3 18
A1605: 50596 | B1605: TRICASE MARCO | D1605: 5 | E1605: - | G1605: 9 | J1605: =-       I -> #NOME?
A1607: 45764 | B1607: ZANI MASSIMILIANO | D1607: 6 | E1607: 3 | G1607: 9 | J1607: 3 21
A1608: -------- | B1608: ----------------------- | C1608: -------- | D1608: ------ | E1608: ---- | F1608: --- | G1608: ----- | H1608: -- | I1608: ---- | J1608: ------------
A1609: (*) Il | B1609: 24.10 comunichi se pref | C1609: erisce a | D1609: ccetta | E1609: re o | F1609: av | G1609: ere i | H1609: ns | I1609: uffi | J1609: cienza
A1610: e m | B1610: antenere il bonus.
A1611: -------- | B1611: ----------------------- | C1611: -------- | D1611: ------ | E1611: ---- | F1611: --- | G1611: ----- | H1611: -- | I1611: ---- | J1611: ------------
A1613: -------- | B1613: ----------------------- | C1613: -------- | D1613: ------ | E1613: ---- | F1613: --- | G1613: ----- | H1613: -- | I1613: ---- | J1613: ----------
B1614: PROVA SCRITTA DI RICERC | C1614: A OPERAT | D1614: IVA DE | E1614: L 14 | F1614: GE | G1614: NNAIO | H1614: 1 | I1614: 998
B1615: (Informatica, Elet | C1615: tronica, | D1615: Telec | E1615: omun | F1615: ica | G1615: zioni | H1615: )
B1617: (VALIDITA': fino alla | C1617: Sessione | D1617: ESTIV | E1617: A A. | F1617: A. | G1617: 1997/ | H1617: 98 | I1617: )
A1618: visione | B1618: degli elaborati e oral | C1618: i: luned | D1618: i' 26 | E1618: Genn | F1618: aio | G1618: , ore | H1618: 1 | I1618: 5, a | J1618: ula 6.1
A1620: prossimi | B1620: appelli: 26 Febbraio o | C1620: re 15 (s | D1620: critto | E1620: )
B1621: Marzo, data d | C1621: a stabil | D1621: irsi d | E1621: opo | F1621: ini | G1621: zio l | H1621: ez | I1621: ioni | J1621: (orale)
B1622: Giugno (scrit | C1622: to e ora | D1622: le)
B1623: Luglio (scrit | C1623: to e ora | D1623: le)
A1625: -------- | B1625: ----------------------- | C1625: -------- | D1625: ------ | E1625: ---- | F1625: --- | G1625: ----- | H1625: -- | I1625: ---- | J1625: ------------
D1626: I^ | E1626: II | F1626: ^ | G1626: II^ | I1626: b | J1626: onus TOT
A1627: -------- | B1627: ----------------------- | C1627: -------- | D1627: ------ | E1627: ---- | F1627: --- | G1627: ----- | H1627: -- | I1627: ---- | J1627: ------------
A1629: 50729 | B1629: BENASSI LUCA | D1629: 11 | E1629: 3 | G1629: 3 | J1629: 3 20
A1631: 45991 | B1631: BUGNOLI ALESSANDRO | D1631: 13 | E1631: 1 | G1631: 8 | J1631: 3 25
A1633: 55251 | B1633: CASAGRANDE ALBERTO | D1633: 12 | E1633: 3 | G1633: 13 | J1633: 3 31
A1635: 50671 | B1635: CAVA ROBERTO | D1635: 10 | E1635: 3 | G1635: 2 | J1635: 3 18
A1637: 50451 | B1637: CAZZOLA MATTIA | D1637: 4 | E1637: 0 | G1637: 13 | J1637: 3 20
A1639: 38837 | B1639: CELLUCCI GIOVANNI | D1639: 7 | E1639: 0 | G1639: 2 | J1639: =-       I -> #NOME?
A1641: 54926 | B1641: CESARI FABIO | D1641: 14 | E1641: 3 | G1641: 13 | J1641: 3 33
A1643: 46224 | B1643: COCCIA FABRIZIO | D1643: 12 | E1643: 1 | G1643: 10 | J1643: 3 26
A1645: 50679 | B1645: DE ANGELIS STEFANO | D1645: 7 | E1645: 0 | G1645: 10 | J1645: 3 20
A1647: 50115 | B1647: DINI EMILIANO | D1647: 9 | E1647: 1 | G1647: 4 | J1647: 3 17 *
A1649: 50571 | B1649: GENTILI CHIARA | D1649: 12 | E1649: 3 | G1649: 3 | J1649: 3 21
A1651: 54221 | B1651: GESSONI FRANCESCO | D1651: 8 | E1651: 0 | G1651: 7 | J1651: 3 18
A1653: 0 | B1653: GILIOLI MARCO | D1653: 8 | E1653: 3 | G1653: 9 | J1653: 3 23
A1655: 43685 | B1655: MANFREDINI FABRIZIO | D1655: 0 | E1655: 0 | G1655: 10 | J1655: =-       I -> #NOME?
A1657: 45707 | B1657: MERCATALI OSCAR | D1657: 6 | E1657: 0 | G1657: 13 | J1657: 3 22
A1659: 55364 | B1659: MORETTI TIZIANO | D1659: 14 | E1659: 3 | G1659: 10 | J1659: 3 30
A1661: 43564 | B1661: NICOLETTI MASSIMO | D1661: 10 | E1661: 0 | G1661: 2 | J1661: =-       I -> #NOME?
A1663: 43666 | B1663: PIVA ALESSANDRO | D1663: 9 | E1663: 0 | G1663: 11 | J1663: 3 23
A1665: 41685 | B1665: ROFFI STEFANO | D1665: 0 | E1665: 0 | G1665: 12 | J1665: =-       I -> #NOME?
A1667: 58878 | B1667: RUVIERO STEFANO | D1667: 2 | E1667: 3 | G1667: 13 | J1667: 3 21
A1669: 47702 | B1669: SELLERI ROBERTO | D1669: 8 | E1669: 0 | G1669: 13 | J1669: 3 24
A1671: 55651 | B1671: TANTINI LUIGI | D1671: 14 | E1671: 3 | G1671: 13 | J1671: 3 33
A1673: 52348 | B1673: TESTONI STEFANO | D1673: 14 | E1673: 2 | G1673: 8 | J1673: 3 27
A1675: 52009 | B1675: TONTI GIANLUCA | D1675: 14 | E1675: 3 | G1675: 13 | J1675: 3 33
A1677: 53664 | B1677: ZAPPACOSTA EMILIANO | D1677: 13 | E1677: 1 | G1677: 13 | J1677: 3 30
A1679: -------- | B1679: ----------------------- | C1679: -------- | D1679: ------ | E1679: ---- | F1679: --- | G1679: ----- | H1679: -- | I1679: ---- | J1679: ----------
A1680: * Il 26 | B1680: .1 comunichi se preferi | C1680: sce acce | D1680: ttare | E1680: o av | F1680: ere | G1680: insu | H1680: ff | I1680: icie | J1680: nza
A1681: e man | B1681: tenere il bonus.
A1682: -------- | B1682: ----------------------- | C1682: -------- | D1682: ------ | E1682: ---- | F1682: --- | G1682: ----- | H1682: -- | I1682: ---- | J1682: ----------
A1684: -------- | B1684: ----------------------- | C1684: -------- | D1684: ------ | E1684: ---- | F1684: --- | G1684: ----- | H1684: -- | I1684: ---- | J1684: ----------
B1685: PROVA SCRITTA DI RICERC | C1685: A OPERAT | D1685: IVA DE | E1685: L 26 | F1685: FE | G1685: BBRAI | H1685: O | I1685: 1998
B1686: (Informatica, Elet | C1686: tronica, | D1686: Telec | E1686: omun | F1686: ica | G1686: zioni | H1686: )
B1688: (VALIDITA': fino alla | C1688: Sessione | D1688: ESTIV | E1688: A A. | F1688: A. | G1688: 1997/ | H1688: 98 | I1688: )
A1689: visione | B1689: degli elaborati e oral | C1689: i: vener | D1689: di' 13 | E1689: Mar | F1689: zo, | G1689: ore | H1689: 15 | I1689: , au | J1689: la 5.7
A1691: prossimi | B1691: appelli: Giugno (scrit | C1691: to e ora | D1691: le)
B1692: Luglio (scrit | C1692: to e ora | D1692: le)
A1693: -------- | B1693: ----------------------- | C1693: -------- | D1693: ------ | E1693: ---- | F1693: --- | G1693: ----- | H1693: -- | I1693: ---- | J1693: ----------
D1694: I^ | E1694: II | F1694: ^ | G1694: bo | H1694: nu | I1694: s | J1694: TOT
A1695: -------- | B1695: ----------------------- | C1695: -------- | D1695: ------ | E1695: ---- | F1695: --- | G1695: ----- | H1695: -- | I1695: ---- | J1695: ----------
A1697: 50697 | B1697: ALBONI GIORGIO | D1697: 14 | E1697: 11 | I1697: 3 | J1697: 28
A1699: 50542 | B1699: BORDONALI GIUSEPPE | D1699: 5 | E1699: 10 | I1699: 3 | J1699: 18
A1701: 54179 | B1701: CAMPEGGI MASSIMO | D1701: 14 | E1701: 12 | I1701: 3 | J1701: 29
A1703: 48015 | B1703: CAROLI FRANCESCO | D1703: 14 | E1703: 12 | I1703: 3 | J1703: 29
A1705: 52705 | B1705: CELLI ALESSANDRO | D1705: 11 | E1705: 11 | I1705: 3 | J1705: 25
A1707: 38837 | B1707: CELLUCCI GIOVANNI | D1707: 7 | E1707: 9 | I1707: 3 | J1707: 19
A1709: 55804 | B1709: CHERICONI ERINA | D1709: 14 | E1709: 10 | I1709: 3 | J1709: 27
A1711: 43335 | B1711: DUCCI PIETRO | D1711: 5 | E1711: 10 | I1711: 3 | J1711: 18
A1713: 50727 | B1713: FALCIONI STEFANO | D1713: 14 | E1713: 6 | I1713: 3 | J1713: 23
A1715: 50753 | B1715: FASANELLA MATTEO | D1715: 7 | E1715: 10 | I1715: 3 | J1715: 20
A1717: 47773 | B1717: FIOCCHI SIMONE | D1717: 8 | E1717: 11 | I1717: 3 | J1717: 22
A1719: 51979 | B1719: FRANCIOSI MIRKO | D1719: 17 | E1719: 11 | I1719: 3 | J1719: 31
A1721: 46328 | B1721: GALOTTA AMBROGIO EMIL | C1721: IO | D1721: 14 | E1721: 6 | I1721: 3 | J1721: 23
A1723: 55983 | B1723: GOLINELLI MILA | D1723: 13 | E1723: 8 | I1723: 3 | J1723: 24
A1725: 45879 | B1725: LANZONI BARBARA | D1725: 8 | E1725: 11 | I1725: 3 | J1725: 22
A1727: 50305 | B1727: LUPO GIANLUCA | D1727: 17 | E1727: 10 | I1727: 3 | J1727: 30
A1729: 48298 | B1729: MINGHELLI ALESSANDRO | D1729: 6 | E1729: 11 | I1729: 3 | J1729: 20
A1731: 42698 | B1731: MONDUZZI MARINA | D1731: 6 | E1731: 11 | I1731: 3 | J1731: 20
A1733: 53528 | B1733: PAGLIARDINI CINZIA | D1733: 14 | E1733: 11 | I1733: 3 | J1733: 28
A1735: 45853 | B1735: RIZZOLI ALESSANDRO | D1735: 13 | E1735: 6 | I1735: 3 | J1735: 22
A1737: 44406 | B1737: RONCHI STEFANO | D1737: 5 | E1737: 11 | I1737: 3 | J1737: 19
A1739: 46289 | B1739: SCOZZAFAVA COSTANTINO | D1739: 10 | E1739: 11 | I1739: 3 | J1739: 24
A1741: 50752 | B1741: SERRA ROBERTO | D1741: 7 | E1741: 12 | I1741: 3 | J1741: 22
A1743: 52356 | B1743: TOPARINI FABIO | D1743: 13 | E1743: 12 | I1743: 3 | J1743: 28
A1744: -------- | B1744: ----------------------- | C1744: -------- | D1744: ------ | E1744: ---- | F1744: --- | G1744: ----- | H1744: -- | I1744: ---- | J1744: ------------
A1746: -------- | B1746: ----------------------- | C1746: -------- | D1746: ------ | E1746: ---- | F1746: --- | G1746: ----- | H1746: -- | I1746: ---- | J1746: ----------
B1747: PROVA SCRITTA DI RICERC | C1747: A OPERAT | D1747: IVA DE | E1747: L 11 | F1747: Gi | G1747: ugno | H1747: 19 | I1747: 98
B1748: (Informatica, Elet | C1748: tronica, | D1748: Telec | E1748: omun | F1748: ica | G1748: zioni | H1748: )
B1750: (VALIDITA': fino alla | C1750: Sessione | D1750: Autun | E1750: nale | F1750: A. | G1750: A. 19 | H1750: 97 | I1750: /98)
A1751: visione | B1751: degli elaborati e oral | C1751: i: Luned | D1751: i' 22 | E1751: Giug | F1751: no, | G1751: ore | H1751: 15
A1753: prossimi | B1753: appelli: Luglio (scrit | C1753: to e ora | D1753: le)
A1754: -------- | B1754: ----------------------- | C1754: -------- | D1754: ------ | E1754: ---- | F1754: --- | G1754: ----- | H1754: -- | I1754: ---- | J1754: ----------
D1755: I^ | E1755: II | F1755: ^ | G1755: bo | H1755: nu | I1755: s | J1755: TOT
A1756: -------- | B1756: ----------------------- | C1756: -------- | D1756: ------ | E1756: ---- | F1756: --- | G1756: ----- | H1756: -- | I1756: ---- | J1756: ----------
A1758: 41854 | B1758: AGARRI GIOVANNI | D1758: 14 | E1758: 2 | H1758: 3 | J1758: 19
A1760: 45598 | B1760: ALVISI ANDREA | D1760: 16 | E1760: 8 | H1760: 3 | J1760: 27
A1762: 41621 | B1762: ARACRI ANTONIO | D1762: 8 | E1762: 12 | H1762: 3 | J1762: 23
A1764: 50212 | B1764: BALESTRA MARCO | D1764: 13 | E1764: 9 | H1764: 3 | J1764: 25
A1766: 50812 | B1766: BERTUZZI MASSIMO | D1766: 15 | E1766: 8 | H1766: 3 | J1766: 26
A1768: 50542 | B1768: BORDONALI GIUSEPPE | D1768: 16 | E1768: 12 | H1768: 0 | J1768: 28
A1770: 41898 | B1770: CASTIGLIONI KATIA | D1770: 18 | E1770: 12 | H1770: 3 | J1770: 33
A1772: 47876 | B1772: DEGANELLO ALIGI | D1772: 18 | E1772: 8 | H1772: 3 | J1772: 29
A1774: 45952 | B1774: GAROSI ROSSANO | D1774: 15 | E1774: 12 | H1774: 3 | J1774: 30
A1776: 50087 | B1776: GERI WALTER | D1776: 15 | E1776: 10 | H1776: 3 | J1776: 28
A1778: 56709 | B1778: GIUSTI LORENZO | D1778: 13 | E1778: 7 | H1778: 3 | J1778: 23
A1780: 48241 | B1780: LELLI MONICA | D1780: 16 | E1780: 6 | H1780: 3 | J1780: 25
A1782: 46520 | B1782: LENOTTI STEFANO | D1782: 15 | E1782: 2 | H1782: 3 | J1782: 20
A1784: 46575 | B1784: MANCINI SABRINA | D1784: 8 | E1784: 12 | H1784: 3 | J1784: 23
A1786: 42045 | B1786: MARCHESINI MARCO | D1786: 18 | E1786: 12 | H1786: 3 | J1786: 33
A1788: 51955 | B1788: MARINI SIMEONE | D1788: 4 | E1788: 8 | H1788: - | J1788: I
A1790: 43767 | B1790: MARINUCCI ANDREA | D1790: 11 | E1790: 12 | H1790: 3 | J1790: 26
A1792: 43544 | B1792: NICOLINI DAVIDE | D1792: 12 | E1792: 12 | H1792: 3 | J1792: 27
A1794: 33622 | B1794: PETRIS ROBERTO | D1794: 11 | E1794: 12 | H1794: 3 | J1794: 26
A1796: 51967 | B1796: RAFFA GIUSEPPE | D1796: 18 | E1796: 12 | H1796: 3 | J1796: 33
A1798: 41685 | B1798: ROFFI STEFANO | D1798: 10 | E1798: 5 | H1798: 3 | J1798: 18
A1800: 50686 | B1800: ROMEO GIANLUCA | D1800: 18 | E1800: 12 | H1800: 3 | J1800: 33
A1802: 43365 | B1802: ROVERI ANDREA | D1802: 16 | E1802: 12 | H1802: 3 | J1802: 31
A1804: 35750 | B1804: SABBADINI ENRICO | D1804: 5 | E1804: 10 | H1804: 3 | J1804: 18
A1806: 50774 | B1806: SPURI SILVESTRINI MAS | C1806: SIMIL. | D1806: 18 | E1806: 12 | H1806: 3 | J1806: 33
A1808: 51745 | B1808: TOLOMELLI ANDREA | D1808: 18 | E1808: 12 | H1808: 3 | J1808: 33
A1810: 52361 | B1810: TOZZI ANTONIO | D1810: 15 | E1810: 10 | H1810: 3 | J1810: 28
A1812: 56326 | B1812: ZOINA PIERO | D1812: 12 | E1812: 10 | H1812: 3 | J1812: 25
A1814: -------- | B1814: ----------------------- | C1814: -------- | D1814: ------ | E1814: ---- | F1814: --- | G1814: ----- | H1814: -- | I1814: ---- | J1814: ----------
B1815: PROVA SCRITTA DI RICERC | C1815: A OPERAT | D1815: IVA DE | E1815: L 20 | F1815: Lu | G1815: glio | H1815: 19 | I1815: 98
B1816: (Informatica, Elet | C1816: tronica, | D1816: Telec | E1816: omun | F1816: ica | G1816: zioni | H1816: )
B1818: (VALIDITA': fino alla | C1818: Sessione | D1818: Autun | E1818: nale | F1818: A. | G1818: A. 19 | H1818: 97 | I1818: /98)
A1819: visione | B1819: degli elaborati e oral | C1819: i: Vener | D1819: di' 24 | E1819: Lug | F1819: lio | G1819: , ore | H1819: 1 | I1819: 5, a | J1819: ula 6.1
A1821: prossimi | B1821: appelli: vedi avviso
A1822: -------- | B1822: ----------------------- | C1822: -------- | D1822: ------ | E1822: ---- | F1822: --- | G1822: ----- | H1822: -- | I1822: ---- | J1822: ----------
D1823: I^ | E1823: II | F1823: ^ | G1823: bo | H1823: nu | I1823: s | J1823: TOT
A1824: -------- | B1824: ----------------------- | C1824: -------- | D1824: ------ | E1824: ---- | F1824: --- | G1824: ----- | H1824: -- | I1824: ---- | J1824: ----------
A1826: 56786 | B1826: ARMANI LUCA | D1826: 16 | E1826: 5 | I1826: 3 | J1826: 24
A1828: 42124 | B1828: BUCCARELLI EMILIO MAR | C1828: IA | D1828: 10 | E1828: 2 | I1828: - | J1828: I
A1830: 52601 | B1830: CAGNOLATI FULVIO | D1830: 11 | E1830: 6 | I1830: 3 | J1830: 20
A1832: 46592 | B1832: CONGI ANTONIO | D1832: 15 | E1832: 7 | I1832: 3 | J1832: 25
A1834: 56504 | B1834: CORTESI GIACOMO | D1834: 13 | E1834: 5 | I1834: 3 | J1834: 21
A1836: 48340 | B1836: D'ERCOLI LUCIANO | D1836: 16 | E1836: 11 | I1836: 3 | J1836: 30
A1838: 52419 | B1838: DE MAGLIE MASSIMO | D1838: 13 | E1838: 6 | I1838: 3 | J1838: 22
A1840: 41964 | B1840: DI DONATO LUCIO | D1840: 14 | E1840: 7 | I1840: 3 | J1840: 24
A1842: 47849 | B1842: DOTTI MASSIMO | D1842: 14 | E1842: 2 | I1842: 0 | J1842: I
A1844: 42073 | B1844: GAZZOTTI MATTEO | D1844: 4 | E1844: 4 | I1844: - | J1844: I
A1846: 45777 | B1846: MARZELLI STEFANO | D1846: 14 | E1846: 3 | I1846: 3 | J1846: 20
A1848: 55927 | B1848: MAZZOCCO GIANCARLO | D1848: 14 | E1848: 14 | I1848: 3 | J1848: 31
A1850: 48298 | B1850: MINGHELLI ALESSANDRO | D1850: 14 | E1850: 14 | I1850: 0 | J1850: 28
A1852: 53898 | B1852: MULINACCI PATRIZIA (* | C1852: ) | D1852: 10 | E1852: 4 | I1852: 3 | J1852: 17
A1854: 53802 | B1854: PRETELLI MIGUEL | J1854: 42583
A1856: 46196 | B1856: RABONI IVAN | D1856: 8 | E1856: 7 | I1856: 3 | J1856: 18
A1858: 44483 | B1858: RANUZZI FABIO (*) | D1858: 9 | E1858: 5 | I1858: 3 | J1858: 17
A1860: 43849 | B1860: TASSINARI ANDREA | D1860: 16 | E1860: 8 | I1860: 3 | J1860: 27
A1862: 50596 | B1862: TRICASE MARCO | D1862: 15 | E1862: 4 | I1862: 3 | J1862: 22
A1864: 50712 | B1864: VENERI FILIPPO | D1864: 9 | E1864: 9 | I1864: 3 | J1864: 21
A1866: 50284 | B1866: VIVARELLI PAOLA | D1866: 14 | E1866: 14 | I1866: 3 | J1866: 31
A1867: -------- | B1867: ----------------------- | C1867: -------- | D1867: ------ | E1867: ---- | F1867: --- | G1867: ----- | H1867: -- | I1867: ---- | J1867: ----------
A1868: * Il 24 | B1868: .7 comunichi se preferi | C1868: sce acce | D1868: ttare | E1868: o av | F1868: ere | G1868: insu | H1868: ff | I1868: icie | J1868: nza
A1869: e man | B1869: tenere il bonus.
A1870: -------- | B1870: ----------------------- | C1870: -------- | D1870: ------ | E1870: ---- | F1870: --- | G1870: ----- | H1870: -- | I1870: ---- | J1870: ----------
A1872: -------- | B1872: ----------------------- | C1872: -------- | D1872: ------ | E1872: ---- | F1872: --- | G1872: ----- | H1872: -- | I1872: ---- | J1872: ----------
B1873: PROVA SCRITTA DI RICERC | C1873: A OPERAT | D1873: IVA DE | E1873: L 14 | F1873: Se | G1873: ttemb | H1873: re | I1873: 199 | J1873: 8
B1874: (Informatica, Elet | C1874: tronica, | D1874: Telec | E1874: omun | F1874: ica | G1874: zioni | H1874: )
B1876: (VALIDITA': fino alla | C1876: Sessione | D1876: Inver | E1876: nale | F1876: A. | G1876: A. 19 | H1876: 97 | I1876: /98)
A1877: visione | B1877: degli elaborati e orali | C1877: : Lunedi | D1877: ' 21 S | E1877: ette | F1877: mbr | G1877: e, or | H1877: e | I1877: 0.5854166666666667 | J1877: 0, aula 6.1
A1879: prossimi | B1879: appelli: Ottobre (data | C1879: esatta | D1879: dopo i | E1879: nizi | F1879: o l | G1879: ezion | H1879: i)
B1880: Febbraio
A1881: -------- | B1881: ----------------------- | C1881: -------- | D1881: ------ | E1881: ---- | F1881: --- | G1881: ----- | H1881: -- | I1881: ---- | J1881: ----------
D1882: I^ | E1882: II | F1882: ^ | G1882: bo | H1882: nu | I1882: s | J1882: TOT
A1883: -------- | B1883: ----------------------- | C1883: -------- | D1883: ------ | E1883: ---- | F1883: --- | G1883: ----- | H1883: -- | I1883: ---- | J1883: ----------
A1885: 55091 | B1885: ACCORSI STEFANO | D1885: 15 | E1885: 10 | I1885: 3 | J1885: 28
A1887: 55348 | B1887: ALBINI MATTEO | D1887: 8 | E1887: 11 | I1887: 3 | J1887: 22
A1889: 50718 | B1889: ARIENTI MATTEO | D1889: 14 | E1889: 6 | I1889: 3 | J1889: 23
A1891: 54950 | B1891: BARBIERI MAURO | D1891: 14 | E1891: 12 | I1891: 3 | J1891: 29
A1893: 52162 | B1893: BASSI SIMONE | D1893: 18 | E1893: 5 | I1893: 3 | J1893: 26
A1895: 52880 | B1895: BENEDETTI STEFANO | D1895: 14 | E1895: 12 | I1895: 3 | J1895: 29
A1897: 55179 | B1897: BERNI TERENZIO | D1897: 17 | E1897: 12 | I1897: 3 | J1897: 32
A1899: 50642 | B1899: BERTOCCHI LIVIO | D1899: 14 | E1899: 12 | I1899: 3 | J1899: 29
A1901: 50331 | B1901: BICCI LUCA | D1901: 18 | E1901: 12 | I1901: 3 | J1901: 33
A1903: 50705 | B1903: BRANDOLINI DENIS | D1903: 11 | E1903: 9 | I1903: 3 | J1903: 23
A1905: 54389 | B1905: BUCCI FABIO | D1905: 14 | E1905: 7 | I1905: 3 | J1905: 24
A1907: 53760 | B1907: BUDELACCI GABRIELE | D1907: 14 | E1907: 12 | I1907: 3 | J1907: 29
A1909: 52700 | B1909: CARRETTI CRISTIANO | D1909: 14 | E1909: 7 | I1909: 3 | J1909: 24
A1911: 54412 | B1911: COLANTONIO ANGELO | D1911: 14 | E1911: 12 | I1911: 3 | J1911: 29
A1913: 48328 | B1913: CUCCHI MASSIMILIANO | D1913: 8 | E1913: 12 | I1913: 3 | J1913: 23
A1915: 54836 | B1915: DI CECCO TOMMASO | D1915: 6 | E1915: 1 | I1915: - | J1915: I
A1917: 51739 | B1917: FILIPPUCCI ROBERTO | D1917: 18 | E1917: 8 | I1917: 3 | J1917: 29
A1919: 48337 | B1919: FINESSI MARCO | D1919: 14 | E1919: 2 | I1919: 3 | J1919: 19
A1921: 45965 | B1921: FORLANI ANDREA | D1921: 18 | E1921: 3 | I1921: 3 | J1921: 24
A1923: 39126 | B1923: GATTI GIORGIO | D1923: 14 | E1923: 9 | I1923: 3 | J1923: 26
A1925: 55767 | B1925: GERI FRANCESCO | D1925: 14 | E1925: 12 | I1925: 3 | J1925: 29
A1927: 52148 | B1927: GUALINI RICCARDO | D1927: 10 | E1927: 8 | I1927: 3 | J1927: 21
A1929: 55377 | B1929: GUIDI JARNO | D1929: 18 | E1929: 12 | I1929: 3 | J1929: 33
A1931: 46018 | B1931: LUCHETTI EMANUELE | D1931: 18 | E1931: 2 | I1931: 3 | J1931: 23
A1933: 48383 | B1933: MARIANO ALESSANDRO | D1933: 15 | E1933: 12 | I1933: 3 | J1933: 30
A1935: 43623 | B1935: MASSERA RICCARDO | D1935: 5 | E1935: 3 | I1935: - | J1935: I
A1937: 50129 | B1937: MAZZONI STEFANO | D1937: 10 | E1937: 10 | I1937: 3 | J1937: 23
A1939: 46160 | B1939: MONEA DOMENICO | D1939: 10 | E1939: 12 | I1939: 3 | J1939: 25
A1941: 53011 | B1941: MONTANARI MARCO | D1941: 13 | E1941: 8 | I1941: 3 | J1941: 24
A1943: 55176 | B1943: MORRI CRISTIANO | D1943: 18 | E1943: 11 | I1943: 3 | J1943: 32
A1945: 50773 | B1945: MORROIA FABRIZIO | D1945: 8 | E1945: 12 | I1945: 3 | J1945: 23
A1947: 56039 | B1947: MURATORI DAVIDE | D1947: 14 | E1947: 12 | I1947: 3 | J1947: 29
A1949: 52790 | B1949: MUZZI MATTEO | D1949: 11 | E1949: 9 | I1949: 3 | J1949: 23
A1951: 43564 | B1951: NICOLETTI MASSIMO | D1951: 8 | E1951: 4 | I1951: - | J1951: I
A1953: 52616 | B1953: NUCCI ALESSANDRO | D1953: 11 | E1953: 8 | I1953: 3 | J1953: 22
A1955: 52972 | B1955: PALESE GIUSEPPE | D1955: 14 | E1955: 6 | I1955: 3 | J1955: 23
A1957: 52896 | B1957: PETROSINO SIMONE | D1957: 10 | E1957: 12 | I1957: 3 | J1957: 25
A1959: 48322 | B1959: PICCININI STEFANIA | D1959: 11 | E1959: 12 | I1959: 3 | J1959: 26
A1961: 52088 | B1961: TINTI GABRIELE | D1961: 18 | E1961: 12 | I1961: 3 | J1961: 33
A1963: 50706 | B1963: TORELLI FELICE | D1963: 18 | E1963: 1 | I1963: 3 | J1963: 22
A1964: -------- | B1964: ----------------------- | C1964: -------- | D1964: ------ | E1964: ---- | F1964: --- | G1964: ----- | H1964: -- | I1964: ---- | J1964: ----------
A1966: -------- | B1966: ----------------------- | C1966: -------- | D1966: ------ | E1966: ---- | F1966: --- | G1966: ----- | H1966: -- | I1966: ---- | J1966: ----------
B1967: PROVA SCRITTA DI RICERC | C1967: A OPERAT | D1967: IVA DE | E1967: L 16 | F1967: Ot | G1967: tobre | H1967: 1 | I1967: 998
B1968: (Informatica, Elet | C1968: tronica, | D1968: Telec | E1968: omun | F1968: ica | G1968: zioni | H1968: )
B1970: (VALIDITA': fino alla | C1970: Sessione | D1970: Inver | E1970: nale | F1970: A. | G1970: A. 19 | H1970: 97 | I1970: /98)
A1971: visione | B1971: degli elaborati e orali | C1971: : Venerd | D1971: i' 30 | E1971: Otto | F1971: bre | G1971: , ore | H1971: 1 | I1971: 0.25 | J1971: , aula 6.2
A1973: prossimi | B1973: appelli: Gennaio
B1974: Febbraio/Marz | C1974: o
A1975: -------- | B1975: ----------------------- | C1975: -------- | D1975: ------ | E1975: ---- | F1975: --- | G1975: ----- | H1975: -- | I1975: ---- | J1975: ----------
D1976: I^ | E1976: II | F1976: ^ | G1976: bo | H1976: nu | I1976: s | J1976: TOT
A1977: -------- | B1977: ----------------------- | C1977: -------- | D1977: ------ | E1977: ---- | F1977: --- | G1977: ----- | H1977: -- | I1977: ---- | J1977: ----------
A1979: 41717 | B1979: BENTIVOGLI LORENZO | D1979: 15 | E1979: 3 | I1979: 3 | J1979: 21
A1981: 50749 | B1981: BERTUZZI ENZO | D1981: 7 | E1981: 4 | I1981: - | J1981: I
A1983: 41716 | B1983: BRESCIANI ROBERTO | D1983: 12 | E1983: 4 | I1983: 3 | J1983: 19
A1985: 42124 | B1985: BUCCARELLI EMILIO MAR | C1985: IA | D1985: 8 | E1985: 7 | I1985: 3 | J1985: 18
A1987: 45956 | B1987: CAPODIECI MASSIMILIAN | C1987: O | D1987: 14 | E1987: 10 | I1987: 3 | J1987: 27
A1989: 53771 | B1989: CASSANI ALESSANDRO | D1989: 6 | E1989: 9 | I1989: 3 | J1989: 18
A1991: 52962 | B1991: CORTECCHIA DANIELE | D1991: 14 | E1991: 10 | I1991: 3 | J1991: 27
A1993: 52190 | B1993: DOMENICHINI ANDREA | D1993: 11 | E1993: 10 | I1993: 3 | J1993: 24
A1995: 46221 | B1995: FOGLI ENRICO | D1995: 13 | E1995: 7 | I1995: 3 | J1995: 23
A1997: 50684 | B1997: GASPARRONI PAOLO | D1997: 4 | E1997: 6 | I1997: - | J1997: I
A1999: 58920 | B1999: GUZZINI FEDERICO | D1999: 7 | E1999: 10 | I1999: 3 | J1999: 20
A2001: 43685 | B2001: MANFREDINI FABRIZIO | D2001: 17 | E2001: 9 | I2001: 3 | J2001: 29
A2003: 55289 | B2003: MANSERVIGI MARCO | D2003: 20 | E2003: 10 | I2003: 3 | J2003: 33
A2005: 51955 | B2005: MARINI SIMEONE | D2005: 9 | E2005: 8 | I2005: 3 | J2005: 20
A2007: 47716 | B2007: MILANI IGOR | D2007: 20 | E2007: 5 | I2007: 3 | J2007: 28
A2009: 46244 | B2009: NERI MASSIMILIANO | D2009: 10 | E2009: 6 | I2009: 3 | J2009: 19
A2011: 52513 | B2011: PERICOLI PAOLO | D2011: 16 | E2011: 6 | I2011: 3 | J2011: 25
A2013: 49291 | B2013: RABOTTI TOMMASO | D2013: 8 | E2013: 10 | I2013: 3 | J2013: 21
A2015: 52293 | B2015: RINALDINI ALFREDO | D2015: 6 | E2015: 10 | I2015: 3 | J2015: 19
A2017: 54239 | B2017: SECCHI CRISTIAN | D2017: 13 | E2017: 10 | I2017: 3 | J2017: 26
A2019: 46125 | B2019: STRAPPA LUCIA | D2019: 14 | E2019: 9 | I2019: 3 | J2019: 26
A2021: 51757 | B2021: TEGLIA VITTORIO | D2021: 14 | E2021: 10 | I2021: 3 | J2021: 27
A2022: -------- | B2022: ----------------------- | C2022: -------- | D2022: ------ | E2022: ---- | F2022: --- | G2022: ----- | H2022: -- | I2022: ---- | J2022: -----------
A2023: -------- | B2023: ----------------------- | C2023: -------- | D2023: ------ | E2023: ---- | F2023: --- | G2023: ----- | H2023: -- | I2023: ---- | J2023: ----------
B2024: PROVA SCRITTA DI RICERC | C2024: A OPERAT | D2024: IVA DE | E2024: L 18 | F2024: Ge | G2024: nnaio | H2024: 1 | I2024: 999
B2025: (Informatica, Elet | C2025: tronica, | D2025: Telec | E2025: omun | F2025: ica | G2025: zioni | H2025: )
B2027: (VALIDITA': fino alla | C2027: Sessione | D2027: Estiv | E2027: a A. | F2027: A. | G2027: 1998/ | H2027: 99 | I2027: )
A2028: visione | B2028: degli elaborati e orali | C2028: : Lunedi | D2028: ' 25 G | E2028: enna | F2028: io, | G2028: ore | H2028: 15 | I2028: .00, | J2028: aula 6.1
A2030: prossimi | B2030: appelli: Marzo ((la da | C2030: ta sara' | D2030: comun | E2030: icat | F2030: a d | G2030: opo l | H2030: 'i | I2030: nizi | J2030: o delle
B2031: lezio | C2031: ni del | D2031: II^ c | E2031: iclo | F2031: ; e | G2031: ' gi | H2031: a' | I2031: po | J2031: ssibile
B2032: preno | C2032: tarsi al | D2032: termi | E2032: nale | F2032: )
B2033: Giugno
A2034: -------- | B2034: ----------------------- | C2034: -------- | D2034: ------ | E2034: ---- | F2034: --- | G2034: ----- | H2034: -- | I2034: ---- | J2034: ----------
D2035: I^ | E2035: II | F2035: ^ | G2035: III^ | I2035: bonu | J2035: s TOT
A2036: -------- | B2036: ----------------------- | C2036: -------- | D2036: ------ | E2036: ---- | F2036: --- | G2036: ----- | H2036: -- | I2036: ---- | J2036: ----------
A2038: 52941 | B2038: ALBERTAZZI GIANCARLO | D2038: 15 | E2038: 3 | G2038: 10 | J2038: 3 31
A2040: 54616 | B2040: BASCHIERI FRANCESCO | D2040: 15 | E2040: 1 | G2040: 9 | J2040: 3 28
A2042: 57675 | B2042: CARPENTIERO GIANLUCA | D2042: 12 | E2042: 2 | G2042: 8 | J2042: 3 25
A2044: 58143 | B2044: CHIESI MARCO | D2044: 15 | E2044: 3 | G2044: 9 | J2044: 3 30
A2046: 54313 | B2046: CIMATTI DANIELE | D2046: 15 | E2046: 0 | G2046: 10 | J2046: 3 28
A2048: 54860 | B2048: COLLETTA MIRCO | D2048: 15 | E2048: 0 | G2048: 9 | J2048: 3 27
A2050: 60686 | B2050: CONTRI LUCA | D2050: 10 | E2050: 3 | G2050: 3 | J2050: 3 19
A2052: 52290 | B2052: DEGLI ESPOSTI FABIO | D2052: 12 | E2052: 0 | G2052: 8 | J2052: 3 23
A2054: 45966 | B2054: GNOLI DANILO | D2054: 15 | E2054: 1 | G2054: - | J2054: 3 19
A2056: 43390 | B2056: GUIDUCCI ANDREA | D2056: 14 | E2056: 0 | G2056: 7 | J2056: 3 24
A2058: 48012 | B2058: LELLI GABRIELE | D2058: 8 | E2058: 0 | G2058: 7 | J2058: 3 18
A2060: 51830 | B2060: MARCANTONINI FABIO | D2060: 14 | E2060: 0 | G2060: 3 | J2060: 3 20
A2062: 40679 | B2062: MARCHIONNI MASSIMILIA | C2062: NO | D2062: 10 | E2062: 0 | G2062: 7 | J2062: 3 20
A2064: 45777 | B2064: MARZELLI STEFANO | D2064: 11 | E2064: 2 | G2064: 10 | J2064: -23
A2066: 52399 | B2066: MONTORSI LUCA | D2066: 5 | E2066: 0 | G2066: 10 | J2066: 3 18
A2068: 53051 | B2068: PANNUTI FRANCESCO | D2068: 15 | E2068: 0 | G2068: 7 | J2068: 3 25
A2070: 57391 | B2070: PEDERZINI ANDREA | D2070: 7 | E2070: 1 | G2070: 2 | J2070: =-       I -> #NOME?
A2072: 54563 | B2072: PIRACCINI MARCO | D2072: 14 | E2072: 3 | G2072: 10 | J2072: 3 30
A2074: 52703 | B2074: PISTELLI WALTER-ULIAN | C2074: O | D2074: 4 | E2074: 0 | G2074: 10 | J2074: 3 17(*)
A2076: 53751 | B2076: POLITO SALVATORE | D2076: 16 | E2076: 2 | G2076: 10 | J2076: 3 31
A2078: 54617 | B2078: PRATI MICHELE | D2078: 15 | E2078: 2 | G2078: 9 | J2078: 3 29
A2080: 42363 | B2080: SORBELLI ANTONIO | D2080: 12 | E2080: 0 | G2080: 3 | J2080: 3 18
A2082: 43378 | B2082: TOMMESANI MASSIMILIAN | C2082: O | D2082: 11 | E2082: 3 | G2082: 6 | J2082: 3 23
A2084: 51977 | B2084: VENTURA ANDREA | D2084: 11 | E2084: 1 | G2084: 3 | J2084: 3 18
A2086: 50350 | B2086: ZAPPASODI DANIELE | D2086: 14 | E2086: 0 | G2086: 10 | J2086: 3 27
A2088: -------- | B2088: ----------------------- | C2088: -------- | D2088: ------ | E2088: ---- | F2088: --- | G2088: ----- | H2088: -- | I2088: ---- | J2088: ----------
A2089: * Il 25 | B2089: .1 comunichi se preferi | C2089: sce acce | D2089: ttare | E2089: o av | F2089: ere | G2089: insu | H2089: ff | I2089: icie | J2089: nza
A2090: e man | B2090: tenere il bonus.
A2091: -------- | B2091: ----------------------- | C2091: -------- | D2091: ------ | E2091: ---- | F2091: --- | G2091: ----- | H2091: -- | I2091: ---- | J2091: -----------
A2093: -------- | B2093: ----------------------- | C2093: -------- | D2093: ------ | E2093: ---- | F2093: --- | G2093: ----- | H2093: -- | I2093: ---- | J2093: ----------
B2094: PROVA SCRITTA DI RICER | C2094: CA OPERA | D2094: TIVA D | E2094: EL 5 | F2094: Ma | G2094: rzo 1 | H2094: 99 | I2094: 9
B2095: (Informatica, Elet | C2095: tronica, | D2095: Telec | E2095: omun | F2095: ica | G2095: zioni | H2095: )
B2097: (VALIDITA': fino alla | C2097: Sessione | D2097: Estiv | E2097: a A. | F2097: A. | G2097: 1998/ | H2097: 99 | I2097: )
A2098: visione | B2098: degli elaborati e orali | C2098: : Mercol | D2098: edi' 1 | E2098: 7 Ma | F2098: rzo | G2098: , ore | H2098: 1 | I2098: 0.20833333333333334 | J2098: , aula E1B
A2100: prossimi | B2100: appelli: Marzo ((la da | C2100: ta sara' | D2100: comun | E2100: icat | F2100: a d | G2100: opo l | H2100: 'i | I2100: nizi | J2100: o delle
B2101: lezio | C2101: ni del | D2101: II^ c | E2101: iclo | F2101: ; e | G2101: ' gi | H2101: a' | I2101: po | J2101: ssibile
B2102: preno | C2102: tarsi al | D2102: termi | E2102: nale | F2102: )
B2103: Giugno
A2104: -------- | B2104: ----------------------- | C2104: -------- | D2104: ------ | E2104: ---- | F2104: --- | G2104: ----- | H2104: -- | I2104: ---- | J2104: ----------
D2105: I^ | E2105: II | F2105: ^ | G2105: III^ | I2105: bonu | J2105: s TOT
A2106: -------- | B2106: ----------------------- | C2106: -------- | D2106: ------ | E2106: ---- | F2106: --- | G2106: ----- | H2106: -- | I2106: ---- | J2106: ----------
A2108: 51992 | B2108: ACINAPURA ALBERTO | D2108: 13 | E2108: 11 | J2108: 3 27
A2110: 58175 | B2110: ADANI FABIO | D2110: 18 | E2110: 11 | J2110: 3 32
A2112: 57766 | B2112: AGOSTI MONICA | D2112: 13 | E2112: 10 | J2112: 3 26
A2114: 50404 | B2114: AMBROSINI DAVIDE | D2114: 10 | E2114: 9 | J2114: 3 22
A2116: 51725 | B2116: ANTENUCCI LUIGI | D2116: 14 | E2116: 11 | J2116: 3 28
A2118: 57187 | B2118: BASSI FRANCESCO | D2118: 14 | E2118: 11 | J2118: 3 28
A2120: 58625 | B2120: BERIONNI MICHELE | D2120: 15 | E2120: 11 | J2120: 3 29
A2122: 55024 | B2122: BRIZI CLAUDIO | D2122: 16 | E2122: 11 | J2122: 3 30
A2124: 55305 | B2124: CESARI CLAUDIO | D2124: 14 | E2124: 3 | J2124: 3 20
A2126: 53145 | B2126: COLECCHIA DANIELE | D2126: 17 | E2126: 3 | J2126: 3 23
A2128: 54430 | B2128: COSSU RICCARDO | D2128: 13 | E2128: 6 | J2128: 3 22
A2130: 54902 | B2130: CREMONINI DAVIDE | D2130: 9 | E2130: 11 | J2130: 3 23
A2132: 54262 | B2132: D'ERRICO ANTONIO | D2132: 16 | E2132: 7 | J2132: 3 26
A2134: 52788 | B2134: DE BENEDITTIS LUCA | D2134: 19 | E2134: 9 | J2134: 3 31
A2136: 52887 | B2136: DE BERARDIS MARCO | D2136: 9 | E2136: 11 | J2136: 3 23
A2138: 51880 | B2138: DE LELLIS FRANCESCO | D2138: 14 | E2138: 9 | J2138: 3 26
A2140: 50577 | B2140: DE ROBERTO FRANCESCA | D2140: 15 | E2140: 11 | J2140: 3 29
A2142: 54836 | B2142: DI CECCO TOMMASO | D2142: 9 | E2142: 11 | J2142: 3 23
A2144: 50691 | B2144: DI MASSIMO VINCENZO | D2144: 12 | E2144: 0 | J2144: =-       I -> #NOME?
A2146: 52621 | B2146: DI NISIO ALESSANDRO | D2146: 16 | E2146: 7 | J2146: 3 26
A2148: 52263 | B2148: DI STEFANO GIUSEPPE | D2148: 16 | E2148: 9 | J2148: 3 28
A2150: 52945 | B2150: FERRARI DENIS | D2150: 6 | E2150: 11 | J2150: 3 20
A2152: 48337 | B2152: FINESSI MARCO | D2152: 19 | E2152: 11 | J2152: 0 30
A2154: 58900 | B2154: FORLIVESI CLAUDIO | D2154: 14 | E2154: 3 | J2154: 3 20
A2156: 54417 | B2156: GAMBINI MARCO | D2156: 10 | E2156: 3 | J2156: =-       I -> #NOME?
A2158: 57468 | B2158: GRAZIANI EMILIA | D2158: 15 | E2158: 11 | J2158: 3 29
A2160: 57910 | B2160: GUALANO ANDREA | D2160: 19 | E2160: 9 | J2160: 3 31
A2162: 52975 | B2162: LAZZARI MATTEO | D2162: 18 | E2162: 8 | J2162: 3 29
A2164: 62797 | B2164: MARTINELLI MASSIMO | D2164: 15 | E2164: 8 | J2164: 3 26
A2166: 50748 | B2166: MELATO BENIAMINO | D2166: 4 | E2166: 11 | J2166: 3 18
A2168: 54220 | B2168: MENARINI MASSIMILIANO | D2168: 15 | E2168: 1 | J2168: 3 19
A2170: 37777 | B2170: MONTEBELLI ALBERTO | D2170: 5 | E2170: 11 | J2170: 3 19
A2172: 52512 | B2172: MORTELLARO FRANCO | D2172: 16 | E2172: 1 | J2172: 3 20
A2174: 46244 | B2174: NERI MASSIMILIANO | D2174: 16 | E2174: 11 | J2174: 0 27
A2176: 58101 | B2176: PESCOLLER DIETRICH | D2176: 14 | E2176: 9 | J2176: 3 26
A2178: 52243 | B2178: PIERGIOVANNI MICHELA | D2178: 9 | E2178: 6 | J2178: 3 18
A2180: 52379 | B2180: PINELLI STEFANO | D2180: 15 | E2180: 11 | J2180: 3 29
A2182: 43458 | B2182: PRADARELLI ANDREA | D2182: 11 | E2182: 3 | J2182: 3 17(*)
A2184: 58306 | B2184: QUITADAMO LUIGI | D2184: 11 | E2184: 8 | J2184: 3 22
A2186: 57689 | B2186: RAFELLI ALESSANDRO | D2186: 11 | E2186: 8 | J2186: 3 22
A2188: 55435 | B2188: RICCI IAMINO FILIPPO | D2188: 17 | E2188: 11 | J2188: 3 31
A2190: 47739 | B2190: ROCCA CRISTIANA | D2190: 13 | E2190: 4 | J2190: 3 20
A2192: 54557 | B2192: ROCCETTI PAOLO | D2192: 16 | E2192: 11 | J2192: 3 30
A2194: 53156 | B2194: TAGLIANI LUCA | D2194: 17 | E2194: 11 | J2194: 3 31
A2196: 50754 | B2196: TASSI ROBERTO | D2196: 18 | E2196: 2 | J2196: 3 23
A2198: 52165 | B2198: TERZI SILVIA | D2198: 9 | E2198: 3 | J2198: =-       I -> #NOME?
A2200: 50706 | B2200: TORELLI FELICE | D2200: 19 | E2200: 5 | J2200: 0 24
A2202: 52557 | B2202: UGOLINI MATTEO | D2202: 4 | E2202: 6 | J2202: =-       I -> #NOME?
A2204: 45992 | B2204: ZANNONI GABRIELE | D2204: 17 | E2204: 11 | J2204: 3 31
A2206: -------- | B2206: ----------------------- | C2206: -------- | D2206: ------ | E2206: ---- | F2206: --- | G2206: ----- | H2206: -- | I2206: ---- | J2206: -----------
A2207: * Il 17 | B2207: Marzo comunichi se pre | C2207: ferisce | D2207: accett | E2207: are | F2207: o a | G2207: vere | H2207: in | I2207: suff | J2207: icienza
A2208: e man | B2208: tenere il bonus.
A2209: -------- | B2209: ----------------------- | C2209: -------- | D2209: ------ | E2209: ---- | F2209: --- | G2209: ----- | H2209: -- | I2209: ---- | J2209: -----------
A2210: -------- | B2210: ----------------------- | C2210: -------- | D2210: ------ | E2210: ---- | F2210: --- | G2210: ----- | H2210: -- | I2210: ---- | J2210: ----------
B2211: PROVA SCRITTA DI RICER | C2211: CA OPERA | D2211: TIVA D | E2211: EL 4 | F2211: Gi | G2211: ugno | H2211: 19 | I2211: 99
B2212: (Informatica, Elet | C2212: tronica, | D2212: Telec | E2212: omun | F2212: ica | G2212: zioni | H2212: )
B2214: (VALIDITA': fino alla | C2214: Sessione | D2214: Autun | E2214: nale | F2214: A. | G2214: A. 19 | H2214: 98 | I2214: /99)
A2215: visione | B2215: degli elaborati e orali | C2215: : Gioved | D2215: i' 17 | E2215: Giug | F2215: no, | G2215: ore | H2215: 15 | I2215: .00, | J2215: aula 6.1
A2217: prossimi | B2217: appelli: vedere avviso
A2219: -------- | B2219: ----------------------- | C2219: -------- | D2219: ------ | E2219: ---- | F2219: --- | G2219: ----- | H2219: -- | I2219: ---- | J2219: ----------
D2220: I^ | E2220: II | F2220: ^ | G2220: III^ | I2220: bonu | J2220: s TOT
A2221: -------- | B2221: ----------------------- | C2221: -------- | D2221: ------ | E2221: ---- | F2221: --- | G2221: ----- | H2221: -- | I2221: ---- | J2221: ----------
A2223: 46109 | B2223: ARTECONI FILIPPO-MARI | C2223: A | D2223: 13 | E2223: 9 | J2223: 3 25
A2225: 50717 | B2225: BONORA MARCO | D2225: 16 | E2225: 9 | J2225: 3 28
A2227: 57083 | B2227: CARLONI NICO | D2227: 17 | E2227: 2 | J2227: 3 22
A2229: 52636 | B2229: IACOVELLA MAURO | D2229: 6 | E2229: 5 | J2229: =-       I -> #NOME?
A2231: 52437 | B2231: PUCCIARELLI ALESSANDR | C2231: O | D2231: 15 | E2231: 2 | J2231: 3 20
A2233: 55413 | B2233: ROLLO ALESSANDRO | D2233: 17 | E2233: 12 | J2233: 3 32
A2235: 52802 | B2235: TOSI GRETA | D2235: 8 | E2235: 8 | J2235: 3 19
A2236: -------- | B2236: ----------------------- | C2236: -------- | D2236: ------ | E2236: ---- | F2236: --- | G2236: ----- | H2236: -- | I2236: ---- | J2236: ----------
A2238: -------- | B2238: ----------------------- | C2238: -------- | D2238: ------ | E2238: ---- | F2238: --- | G2238: ----- | H2238: -- | I2238: ---- | J2238: ----------
B2239: PROVA SCRITTA DI RICER | C2239: CA OPERA | D2239: TIVA D | E2239: EL 1 | F2239: 5 L | G2239: uglio | H2239: 1 | I2239: 999
B2240: (Informatica, Elet | C2240: tronica, | D2240: Telec | E2240: omun | F2240: ica | G2240: zioni | H2240: )
B2242: (VALIDITA': fino alla | C2242: Sessione | D2242: Autun | E2242: nale | F2242: A. | G2242: A. 19 | H2242: 98 | I2242: /99)
A2243: visione | B2243: degli elaborati e orali | C2243: : Gioved | D2243: i' 22 | E2243: Lugl | F2243: io, | G2243: ore | H2243: 15 | I2243: .00, | J2243: aula 6.1
A2245: prossimi | B2245: appelli: vedere avviso
A2247: -------- | B2247: ----------------------- | C2247: -------- | D2247: ------ | E2247: ---- | F2247: --- | G2247: ----- | H2247: -- | I2247: ---- | J2247: ----------
D2248: I^ | E2248: II | F2248: ^ | G2248: III^ | I2248: bonu | J2248: s TOT
A2249: -------- | B2249: ----------------------- | C2249: -------- | D2249: ------ | E2249: ---- | F2249: --- | G2249: ----- | H2249: -- | I2249: ---- | J2249: ----------
A2251: 50573 | B2251: BASSI ALESSANDRA | D2251: 12 | E2251: 12 | J2251: 3 27
A2253: 51759 | B2253: BOLDURA DAVIDE | D2253: 3 | E2253: 11 | J2253: 3 17(*)
A2255: 52858 | B2255: BRAVACCINI GIOVANNI | D2255: 6 | E2255: 8 | J2255: 3 17(*)
A2257: 42242 | B2257: CAGOSSI FABRIZIO | D2257: 14 | E2257: 3 | J2257: 3 20
A2259: 52791 | B2259: CATAURO RAFFAELE | D2259: 14 | E2259: 13 | J2259: 3 30
A2261: 45943 | B2261: CENNI SIGISMONDO | D2261: 8 | E2261: 1 | J2261: =-       I -> #NOME?
A2263: 52976 | B2263: DEL CINQUE ANTONIO | D2263: 16 | E2263: 13 | J2263: 3 32
A2265: 50691 | B2265: DI MASSIMO VINCENZO | D2265: 1 | E2265: 3 | J2265: =-       I -> #NOME?
A2267: 50743 | B2267: DRUDI MARIA ELENA | D2267: 1 | E2267: 5 | J2267: =-       I -> #NOME?
A2269: 54417 | B2269: GAMBINI MARCO | D2269: 10 | E2269: 4 | J2269: 3 17(*)
A2271: 58731 | B2271: GAROFALO NICOLA | D2271: 9 | E2271: 5 | J2271: 3 17(*)
A2273: 58223 | B2273: GIOVANNINI STEFANO | D2273: 15 | E2273: 13 | J2273: 3 31
A2275: 50086 | B2275: INNOCENTI MARCO | D2275: 10 | E2275: 12 | J2275: 3 25
A2277: 48266 | B2277: MACCHIAVELLI ENRICO | D2277: 7 | E2277: 0 | J2277: =-       I -> #NOME?
A2279: 46134 | B2279: MAZZOLI MASSIMILIANO | D2279: 7 | E2279: 11 | J2279: 3 21
A2281: 40703 | B2281: MEDOS ALESSANDRO | D2281: 4 | E2281: - | J2281: =-       I -> #NOME?
A2283: 43564 | B2283: NICOLETTI MASSIMO | D2283: 12 | E2283: 9 | J2283: 3 24
A2285: 48320 | B2285: SALTUTTI ALESSIO | D2285: 6 | E2285: 9 | J2285: 3 18
A2287: 52557 | B2287: UGOLINI MATTEO | D2287: 5 | E2287: 3 | J2287: =-       I -> #NOME?
A2289: 56704 | B2289: VARGIU NICOLA | D2289: 4 | E2289: 1 | J2289: =-       I -> #NOME?
A2291: 40633 | B2291: VIRGILI PIERA | D2291: 10 | E2291: 5 | J2291: 3 18
A2292: -------- | B2292: ----------------------- | C2292: -------- | D2292: ------ | E2292: ---- | F2292: --- | G2292: ----- | H2292: -- | I2292: ---- | J2292: -----------
A2293: * Il 17 | B2293: Marzo comunichi se pre | C2293: ferisce | D2293: accett | E2293: are | F2293: o a | G2293: vere | H2293: in | I2293: suff | J2293: icienza
A2294: e man | B2294: tenere il bonus.
A2295: -------- | B2295: ----------------------- | C2295: -------- | D2295: ------ | E2295: ---- | F2295: --- | G2295: ----- | H2295: -- | I2295: ---- | J2295: -----------
A2297: -------- | B2297: ----------------------- | C2297: -------- | D2297: ------ | E2297: ---- | F2297: --- | G2297: ----- | H2297: -- | I2297: ---- | J2297: --------------
B2298: PROVA SCRITTA DI RICER | C2298: CA OPERA | D2298: TIVA D | E2298: EL 9 | F2298: Se | G2298: ttemb | H2298: re | I2298: 199 | J2298: 9
B2299: (Informatica, Elet | C2299: tronica, | D2299: Telec | E2299: omun | F2299: ica | G2299: zioni | H2299: )
B2301: (VALIDITA': fino alla | C2301: Session | D2301: e Inve | E2301: rnal | F2301: e A | G2301: .A. 1 | H2301: 99 | I2301: 36373 | J2301: )
A2302: visione | B2302: degli elaborati e orali | C2302: : Mercol | D2302: edi' 1 | E2302: 5 Se | F2302: tte | G2302: mbre, | H2302: o | I2302: re 1 | J2302: 5.00, aula E1A
A2304: prossimi | B2304: appelli: circa meta' O | C2304: ttobre ( | D2304: data d | E2304: opo | F2304: ini | G2304: zio l | H2304: ez | I2304: ioni | J2304: )
B2305: Gennaio
B2306: Febbraio/Marz | C2306: o
A2307: -------- | B2307: ----------------------- | C2307: -------- | D2307: ------ | E2307: ---- | F2307: --- | G2307: ----- | H2307: -- | I2307: ---- | J2307: --------------
D2308: I^ | E2308: II | F2308: ^ | G2308: III^ | I2308: bonu | J2308: s TOT
A2309: -------- | B2309: ----------------------- | C2309: -------- | D2309: ------ | E2309: ---- | F2309: --- | G2309: ----- | H2309: -- | I2309: ---- | J2309: --------------
A2311: 50343 | B2311: BIANCHI GIANGUIDO | D2311: 8 | E2311: 7 | G2311: 3 | J2311: 3 21
A2313: 52921 | B2313: BICCHECCHI DAVIDE | D2313: 11 | E2313: 1 | G2313: 6 | J2313: 3 21
A2315: 57648 | B2315: BIGOTTO STEFANO | D2315: 3 | E2315: 5 | G2315: 6 | J2315: 3 17*
B2317: CARLONI NICO | D2317: 11 | E2317: 4 | G2317: 6 | J2317: 0 21
A2319: 58417 | B2319: GIANESSI PAOLO | D2319: 9 | E2319: 7 | G2319: 6 | J2319: 3 25
A2321: 55539 | B2321: MACCHELLI ALESSANDRO | D2321: 15 | E2321: 4 | G2321: 6 | J2321: 3 28
A2323: 58781 | B2323: MARTINELLI ALESSANDRO | D2323: 7 | E2323: 5 | G2323: 3 | J2323: 3 18
A2325: 55434 | B2325: MOLA MARTINO | D2325: 11 | E2325: 9 | G2325: 6 | J2325: 3 29
A2327: 42698 | B2327: MONDUZZI MARINA | D2327: 5 | E2327: 2 | G2327: 3 | J2327: 0 I
A2329: 55066 | B2329: PAOLI ANDREA | D2329: 7 | E2329: 1 | G2329: 6 | J2329: 3 17*
A2331: 46118 | B2331: RAMOS ROCCO | D2331: 10 | E2331: - | G2331: 5 | J2331: 3 18
A2333: 54346 | B2333: TRAMARIN NICOLA | D2333: 12 | E2333: 9 | G2333: 6 | J2333: 3 30
A2335: 50704 | B2335: VENTURI CRISTIAN | D2335: 4 | E2335: 6 | G2335: 6 | J2335: 3 19
A2336: -------- | B2336: ----------------------- | C2336: -------- | D2336: ------ | E2336: ---- | F2336: --- | G2336: ----- | H2336: -- | I2336: ---- | J2336: --------------
A2337: * Il 15 | B2337: Settembre comunichi se | C2337: preferi | D2337: sce ac | E2337: cett | F2337: are | G2337: o av | H2337: er | I2337: e in | J2337: sufficienza
A2338: e man | B2338: tenere il bonus.
A2339: -------- | B2339: ----------------------- | C2339: -------- | D2339: ------ | E2339: ---- | F2339: --- | G2339: ----- | H2339: -- | I2339: ---- | J2339: --------------
A2341: -------- | B2341: ----------------------- | C2341: -------- | D2341: ------ | E2341: ---- | F2341: --- | G2341: ----- | H2341: -- | I2341: ---- | J2341: --------------
B2342: PROVA SCRITTA DI RICER | C2342: CA OPERA | D2342: TIVA D | E2342: EL 1 | F2342: 5 O | G2342: ttobr | H2342: e | I2342: 1999
B2343: (Informatica, Elet | C2343: tronica, | D2343: Telec | E2343: omun | F2343: ica | G2343: zioni | H2343: )
B2345: (VALIDITA': fino alla | C2345: Session | D2345: e Inve | E2345: rnal | F2345: e A | G2345: .A. 1 | H2345: 99 | I2345: 36373 | J2345: )
A2346: visione | B2346: degli elaborati e orali | C2346: : Venerd | D2346: i' 22 | E2346: Otto | F2346: bre | G2346: , ore | H2346: 1 | I2346: 0.29166666666666669 | J2346: , aula 6.2
A2348: prossimi | B2348: appelli: Gennaio
B2349: Febbraio/Marz | C2349: o
A2350: -------- | B2350: ----------------------- | C2350: -------- | D2350: ------ | E2350: ---- | F2350: --- | G2350: ----- | H2350: -- | I2350: ---- | J2350: --------------
D2351: I^ | E2351: II | F2351: ^ | G2351: III^ | I2351: bonu | J2351: s TOT
A2352: -------- | B2352: ----------------------- | C2352: -------- | D2352: ------ | E2352: ---- | F2352: --- | G2352: ----- | H2352: -- | I2352: ---- | J2352: --------------
A2354: 56946 | B2354: BARULLI VITTORIO | D2354: 11 | E2354: - | G2354: 9 | J2354: 3 23
A2356: 50127 | B2356: BASTIA PAOLO | D2356: 6 | E2356: - | G2356: 9 | J2356: 3 18
A2358: 53858 | B2358: BRAVACCINI GIOVANNI | D2358: 3 | E2358: - | G2358: 7 | J2358: =-      I -> #NOME?
A2360: 56904 | B2360: CAVOLA FRANCESCO | D2360: 11 | E2360: 3 | G2360: 12 | J2360: 3 29
A2362: 45943 | B2362: CENNI SIGISMONDO | D2362: 13 | E2362: - | G2362: 5 | J2362: 3 21
A2364: 48594 | B2364: CORRADINI MARCO | D2364: 11 | E2364: 2 | G2364: 9 | J2364: 3 25
A2366: 54590 | B2366: FECCOMANDI ANDREA | D2366: 11 | E2366: 3 | G2366: - | J2366: 3 17(*)
A2368: 58142 | B2368: FERRI FRANCESCO | D2368: 10 | E2368: 2 | G2368: 12 | J2368: 3 27
A2370: 45680 | B2370: FIORILLI GIOVANNI | D2370: 13 | E2370: - | G2370: 12 | J2370: 3 28
A2372: 53222 | B2372: FRANCESCHETTI LUCA | D2372: 14 | E2372: 1 | G2372: - | J2372: 3 18
A2374: 55569 | B2374: FUSCO FABIO | D2374: 7 | E2374: - | G2374: 12 | J2374: 3 22
A2376: 48050 | B2376: GHERARDI DANIELE | D2376: 4 | E2376: - | G2376: 4 | J2376: =-      I -> #NOME?
A2378: 57112 | B2378: GUIDI RAFFAELE | D2378: 10 | E2378: 3 | G2378: 12 | J2378: 3 28
A2380: 46072 | B2380: LELLI CATERINA | D2380: 13 | E2380: 3 | G2380: 5 | J2380: 3 24
A2382: 48266 | B2382: MACCHIAVELLI ENRICO | D2382: 4 | E2382: - | G2382: 4 | J2382: =-      I -> #NOME?
A2384: 57418 | B2384: MARANI FRANCESCO | D2384: 12 | E2384: 3 | G2384: 3 | J2384: 3 21
A2386: 37777 | B2386: MONTEBELLI ALBERTO | D2386: 13 | E2386: - | G2386: 4 | J2386: 0 17
A2388: 41939 | B2388: MORETTI ROBERTO | D2388: 13 | E2388: 1 | G2388: 12 | J2388: 3 29
A2390: 52474 | B2390: RENZI LUCA | D2390: 7 | E2390: - | G2390: 12 | J2390: 3 22
A2392: 52165 | B2392: TERZI SILVIA | D2392: 13 | E2392: 3 | G2392: 4 | J2392: 3 23
A2394: 51754 | B2394: VICCIANTUONI ANTONIO | D2394: 14 | E2394: - | G2394: 9 | J2394: 3 26
A2395: -------- | B2395: ----------------------- | C2395: -------- | D2395: ------ | E2395: ---- | F2395: --- | G2395: ----- | H2395: -- | I2395: ---- | J2395: --------------
A2396: * Il 22 | B2396: Ottobre comunichi se p | C2396: referisc | D2396: e acce | E2396: ttar | F2396: e o | G2396: aver | H2396: e | I2396: insu | J2396: fficienza
A2397: e man | B2397: tenere il bonus.
A2398: -------- | B2398: ----------------------- | C2398: -------- | D2398: ------ | E2398: ---- | F2398: --- | G2398: ----- | H2398: -- | I2398: ---- | J2398: --------------
A2400: Prova scritta di Ricerca Operativa del 20 Gennaio 2000
A2401: (Informatica, Elettronica, Telecomunicazioni)
A2403: Validita': fino alla sessione estiva A.A. 1999/2000
A2404: Visione degli elaborati e orali: Martedi' 1 Febbraio 2000
A2405: Prossimi appelli: meta' Febbraio, Maggio
A2407: Cognome | B2407: Nome | C2407: cdl | D2407: matricola | E2407: 1 | F2407: 2 | G2407: 3 | H2407: bonus | I2407: voto
A2408: Accorsi | B2408: Stefano | C2408: 2148 | D2408: 55091 | E2408: 7 | F2408: 2 | G2408: 3 | I2408: Insuff.
A2409: Bandini | B2409: Matteo | C2409: 2148 | D2409: 52570 | E2409: 8 | F2409: 5 | G2409: 7 | H2409: 3 | I2409: =E2409+F2409+G2409+H2409 -> 23
A2410: Benelli | B2410: Lucio | C2410: 2108 | D2410: 55390 | E2410: 12 | F2410: 10 | G2410: 7 | H2410: 3 | I2410: =E2410+F2410+G2410+H2410 -> 32
A2411: Bertuzzi | B2411: Enzo | C2411: 2108 | D2411: 50749 | E2411: 12 | F2411: 6 | G2411: 7 | H2411: 3 | I2411: =E2411+F2411+G2411+H2411 -> 28
A2412: Bigotto | B2412: Stefano | C2412: 2148 | D2412: 57648 | E2412: 9 | F2412: 3 | G2412: 7 | H2412: 3 | I2412: =E2412+F2412+G2412+H2412 -> 22
A2413: Bottacchiari | B2413: Lorenzo | C2413: 2108 | D2413: 43560 | E2413: 12 | F2413: 10 | G2413: 5 | H2413: 3 | I2413: =E2413+F2413+G2413+H2413 -> 30
A2414: Bottura | B2414: Nicola | C2414: 2148 | D2414: 58737 | E2414: 12 | F2414: 10 | G2414: 4 | H2414: 3 | I2414: =E2414+F2414+G2414+H2414 -> 29
A2415: Bucci | B2415: Fabio | C2415: 2148 | D2415: 54389 | E2415: 13 | F2415: 10 | G2415: 7 | H2415: 0 | I2415: =E2415+F2415+G2415+H2415 -> 30
A2416: Cameli | B2416: Nazario | C2416: 2148 | D2416: 56949 | E2416: 12 | F2416: 6 | G2416: 6 | H2416: 3 | I2416: =E2416+F2416+G2416+H2416 -> 27
A2417: Contini | B2417: Gabriele | C2417: 2148 | D2417: 56590 | E2417: 13 | F2417: 10 | G2417: 6 | H2417: 3 | I2417: =E2417+F2417+G2417+H2417 -> 32
A2418: Dall'Olio | B2418: Luca | C2418: 2148 | D2418: 55201 | E2418: 10 | F2418: 4 | G2418: 7 | H2418: 3 | I2418: =E2418+F2418+G2418+H2418 -> 24
A2419: De Tommasi | B2419: Maurizio | C2419: 2148 | D2419: 56705 | E2419: 4 | F2419: 10 | G2419: 7 | H2419: 3 | I2419: =E2419+F2419+G2419+H2419 -> 24
A2420: Filippini | B2420: Omar | C2420: 2143 | D2420: 57198 | E2420: 13 | F2420: 10 | G2420: 7 | H2420: 3 | I2420: =E2420+F2420+G2420+H2420 -> 33
A2421: Giudici | B2421: Massimo | C2421: 2148 | D2421: 55084 | E2421: 12 | F2421: 7 | G2421: 7 | H2421: 3 | I2421: =E2421+F2421+G2421+H2421 -> 29
A2422: Ianieri | B2422: Arnaldo | C2422: 2148 | D2422: 61007 | E2422: 13 | F2422: 10 | G2422: 7 | H2422: 3 | I2422: =E2422+F2422+G2422+H2422 -> 33
A2423: Lanzoni | B2423: Claudio | C2423: 2148 | D2423: 50762 | E2423: 12 | F2423: 10 | G2423: 5 | H2423: 3 | I2423: =E2423+F2423+G2423+H2423 -> 30
A2424: Malagola | B2424: Federico | C2424: 2108 | D2424: 45712 | E2424: 0 | F2424: 10 | G2424: 7 | H2424: 3 | I2424: =E2424+F2424+G2424+H2424 -> 20
A2425: Matano | B2425: Andrea | C2425: 2148 | D2425: 59258 | E2425: 11 | F2425: 7 | G2425: 2 | H2425: 3 | I2425: =E2425+F2425+G2425+H2425 -> 23
A2426: Micolucci | B2426: Mario | C2426: 2146 | D2426: 55755 | E2426: 10 | F2426: 3 | G2426: 6 | H2426: 3 | I2426: =E2426+F2426+G2426+H2426 -> 22
A2427: Paoli | B2427: Andrea | C2427: 2148 | D2427: 55066 | E2427: 9 | F2427: 10 | G2427: 5 | H2427: 3 | I2427: =E2427+F2427+G2427+H2427 -> 27
A2428: Pederzini | B2428: Andrea | C2428: 2148 | D2428: 57391 | E2428: 7 | F2428: 0 | G2428: 7 | H2428: 3 | I2428: =E2428+F2428+G2428+H2428 -> 17 | J2428: OK
A2429: Pedori | B2429: Alessandro | C2429: 2148 | D2429: 58396 | E2429: 3 | F2429: 7 | G2429: 4 | H2429: 0 | I2429: Insuff.
A2430: Raimondi | B2430: Monica | C2430: 2108 | D2430: 56693 | E2430: 4 | F2430: 4 | G2430: 7 | H2430: 3 | I2430: =E2430+F2430+G2430+H2430 -> 18
A2431: Rombaldoni | B2431: Fabio | C2431: 2148 | D2431: 56059 | E2431: 10 | F2431: 10 | G2431: 7 | H2431: 3 | I2431: =E2431+F2431+G2431+H2431 -> 30
A2432: Ruvinetti | B2432: Silvia | C2432: 2148 | D2432: 51747 | E2432: 13 | F2432: 10 | G2432: 7 | H2432: 3 | I2432: =E2432+F2432+G2432+H2432 -> 33
A2433: Tenti | B2433: Mirco | C2433: 2148 | D2433: 56527 | E2433: 11 | F2433: 2 | G2433: 7 | H2433: 3 | I2433: =E2433+F2433+G2433+H2433 -> 23
A2434: Terregna | B2434: Giampiero | C2434: 2006 | D2434: 40371 | E2434: 1 | F2434: 4 | G2434: 3 | H2434: 0 | I2434: Insuff.
A2435: Vargiu | B2435: Nicola | C2435: 2148 | D2435: 56704 | E2435: 7 | F2435: 9 | G2435: 0 | H2435: 3 | I2435: =E2435+F2435+G2435+H2435 -> 19
A2436: Zironi | B2436: Andrea | C2436: 2146 | D2436: 50164 | E2436: 10 | F2436: 10 | G2436: 6 | H2436: 3 | I2436: =E2436+F2436+G2436+H2436 -> 29
A2438: * I'1 Febbraio comunichi se preferisce accettare o avere insufficienza e mantenere il bonus
A2440: Prova scritta di Ricerca Operativa del 23 Febbraio 2000
A2441: (Informatica, Elettronica, Telecomunicazioni)
A2443: Validita': fino alla sessione estiva A.A. 1999/2000
A2444: Visione degli elaborati e orali: Venerdi' 3 Marzo 2000
A2445: Prossimi appelli: meta' Febbraio, Maggio
A2447: Cognome | B2447: Nome | C2447: cdl | D2447: matricola | E2447: 1 | F2447: 2 | G2447: 3 | H2447: bonus | I2447: voto
A2448: Agostinelli | B2448: Fabrizio | C2448: 2148 | D2448: 58462 | H2448: 3 | I2448: =E2448+F2448+G2448+H2448 -> 3
A2449: Allori | B2449: Barbara | C2449: 2148 | D2449: 54643 | H2449: 3 | I2449: =E2449+F2449+G2449+H2449 -> 3
A2450: Borsatti | B2450: Andrea | C2450: 2148 | D2450: 48048 | H2450: 3 | I2450: =E2450+F2450+G2450+H2450 -> 3
A2451: Cacchiani | B2451: Valentina | C2451: 2148 | D2451: 58319 | H2451: 3 | I2451: =E2451+F2451+G2451+H2451 -> 3
A2452: Carboni | B2452: Massimo | C2452: 2148 | D2452: 52639 | H2452: 3 | I2452: =E2452+F2452+G2452+H2452 -> 3
A2453: Cesaretto | B2453: Cristiano | C2453: 2148 | D2453: 54452 | H2453: 3 | I2453: =E2453+F2453+G2453+H2453 -> 3
A2454: Cesari | B2454: Enrico | C2454: 2108 | D2454: 43306 | H2454: 3 | I2454: =E2454+F2454+G2454+H2454 -> 3
A2455: Chiari | B2455: Massimo | C2455: 2148 | D2455: 43589 | H2455: 3 | I2455: =E2455+F2455+G2455+H2455 -> 3
A2456: De Maria | B2456: Alessandra | C2456: 2148 | D2456: 60001 | H2456: 3 | I2456: =E2456+F2456+G2456+H2456 -> 3
A2457: Fabbri | B2457: Emanuela | C2457: 2148 | D2457: 60340 | H2457: 3 | I2457: =E2457+F2457+G2457+H2457 -> 3
A2458: Fabbri | B2458: Luca | C2458: 2148 | D2458: 57408 | H2458: 3 | I2458: =E2458+F2458+G2458+H2458 -> 3
A2459: Falzoni | B2459: Alberto | C2459: 2148 | D2459: 54418 | H2459: 3 | I2459: =E2459+F2459+G2459+H2459 -> 3
A2460: Ferrante | B2460: Paolo | C2460: 2148 | D2460: 57525 | H2460: 3 | I2460: =E2460+F2460+G2460+H2460 -> 3
A2461: Ferretti | B2461: Alessio | C2461: 2148 | D2461: 59709 | H2461: 3 | I2461: =E2461+F2461+G2461+H2461 -> 3
A2462: Garbati | B2462: Mirco | C2462: 2148 | D2462: 55144 | H2462: 3 | I2462: =E2462+F2462+G2462+H2462 -> 3
A2463: Gherardi | B2463: Daniele | C2463: 2148 | D2463: 48050 | H2463: 3 | I2463: =E2463+F2463+G2463+H2463 -> 3
A2464: Girotti | B2464: Stefano | C2464: 2148 | D2464: 55730 | H2464: 3 | I2464: =E2464+F2464+G2464+H2464 -> 3
A2465: Gordini | B2465: Angelo | C2465: 2148 | D2465: 59483 | H2465: 3 | I2465: =E2465+F2465+G2465+H2465 -> 3
A2466: Iacovella | B2466: Mauro | C2466: 2148 | D2466: 52636 | H2466: 3 | I2466: =E2466+F2466+G2466+H2466 -> 3
A2467: Lilli | B2467: Alessandro | C2467: 2148 | D2467: 56984 | H2467: 3 | I2467: =E2467+F2467+G2467+H2467 -> 3
A2468: Macchiavelli | B2468: Enrico | C2468: 2148 | D2468: 48266 | H2468: 3 | I2468: =E2468+F2468+G2468+H2468 -> 3
A2469: Magi | B2469: Giovanni | C2469: 2148 | D2469: 60080 | H2469: 3 | I2469: =E2469+F2469+G2469+H2469 -> 3
A2470: Mariotti | B2470: Cristian | C2470: 2148 | D2470: 57928 | H2470: 3 | I2470: =E2470+F2470+G2470+H2470 -> 3
A2471: Massera | B2471: Riccardo | C2471: 2108 | D2471: 43623 | H2471: 3 | I2471: =E2471+F2471+G2471+H2471 -> 3
A2472: Melotti | B2472: Riccardo | C2472: 2148 | D2472: 55173 | H2472: 3 | I2472: =E2472+F2472+G2472+H2472 -> 3
A2473: Migani | B2473: Romina | C2473: 2148 | D2473: 43520 | H2473: 3 | I2473: =E2473+F2473+G2473+H2473 -> 3
A2474: Milandri | B2474: Andrea | C2474: 2148 | D2474: 57368 | H2474: 3 | I2474: =E2474+F2474+G2474+H2474 -> 3
A2475: Montanari | B2475: Andrea | C2475: 2108 | D2475: 43725 | H2475: 3 | I2475: =E2475+F2475+G2475+H2475 -> 3
A2476: Morelli | B2476: Franco | C2476: 2143 | D2476: 52737 | H2476: 3 | I2476: =E2476+F2476+G2476+H2476 -> 3
A2477: Orfei | B2477: Marco | C2477: 2148 | D2477: 60167 | H2477: 3 | I2477: =E2477+F2477+G2477+H2477 -> 3
A2478: Paolucci | B2478: Miriam | C2478: 2148 | D2478: 57347 | H2478: 3 | I2478: =E2478+F2478+G2478+H2478 -> 3
A2479: Piancastelli | B2479: Giulio | C2479: 2148 | D2479: 54500 | H2479: 3 | I2479: =E2479+F2479+G2479+H2479 -> 3
A2480: Rappini | B2480: Luca | C2480: 2148 | D2480: 57275 | H2480: 3 | I2480: =E2480+F2480+G2480+H2480 -> 3
A2481: Ricci | B2481: Alessandro | C2481: 2148 | D2481: 53079 | H2481: 3 | I2481: =E2481+F2481+G2481+H2481 -> 3
A2482: Ruffini | B2482: Lorenzo | C2482: 2148 | D2482: 57034 | H2482: 3 | I2482: =E2482+F2482+G2482+H2482 -> 3
A2483: Taccetti | B2483: Francesco | C2483: 2148 | D2483: 59806 | H2483: 3 | I2483: =E2483+F2483+G2483+H2483 -> 3
A2484: Tassi | B2484: Davide | C2484: 2006 | D2484: 41815 | H2484: 3 | I2484: =E2484+F2484+G2484+H2484 -> 3
A2485: Terregna | B2485: Giampiero | C2485: 2006 | D2485: 40371 | H2485: 3 | I2485: =E2485+F2485+G2485+H2485 -> 3
A2486: Tomasi | B2486: Lorenzo | C2486: 2106 | D2486: 57049 | H2486: 3 | I2486: =E2486+F2486+G2486+H2486 -> 3
A2487: Ugolini | B2487: Matteo | C2487: 2148 | D2487: 52557 | H2487: 3 | I2487: =E2487+F2487+G2487+H2487 -> 3
A2488: Venturi | B2488: Emanuel | C2488: 2148 | D2488: 59256 | H2488: 3 | I2488: =E2488+F2488+G2488+H2488 -> 3
A2490: Prova scritta di Ricerca Operativa del 6 Giugno 2000
A2491: (Informatica, Elettronica, Telecomunicazioni)
A2493: Validita': fino alla sessione autunnale A.A. 1999/2000
A2494: Visione degli elaborati e orali: Mercoledi' 14 Giugno 2000 ore 15.00 Aula 6.1
A2495: Prossimi appelli: 5 Luglio, Settembre, Ottobre
A2497: Cognome | B2497: Nome | C2497: cdl | D2497: matricola | E2497: 1 | F2497: 2 | G2497: 3 | H2497: bonus | I2497: voto
A2498: Accorsi | B2498: Stefano | C2498: 2148 | D2498: 55091 | E2498: 10 | F2498: 8 | H2498: 0 | I2498: =E2498+F2498+G2498+H2498 -> 18
A2499: Bicchecchi | B2499: Davide | C2499: 2148 | D2499: 52921 | E2499: 7 | F2499: 10 | H2499: 0 | I2499: =E2499+F2499+G2499+H2499 -> 17 | J2499: NO
A2500: Bonora | B2500: Stefano | C2500: 2148 | D2500: 54217 | E2500: 9 | F2500: 7 | H2500: 3 | I2500: =E2500+F2500+G2500+H2500 -> 19
A2501: Bravaccini | B2501: Giovanni | C2501: 2148 | D2501: 52858 | E2501: 6 | F2501: 9 | H2501: 3 | I2501: =E2501+F2501+G2501+H2501 -> 18
A2502: Busi | B2502: Maurizio | C2502: 2148 | D2502: 43498 | E2502: 13 | F2502: 9 | H2502: 3 | I2502: =E2502+F2502+G2502+H2502 -> 25
A2503: Canotti | B2503: Lorenzo | C2503: 2148 | D2503: 57658 | E2503: 4 | F2503: 5 | H2503: 3 | I2503: Insuff.
A2504: Caremi | B2504: Claudio | C2504: 2148 | D2504: 57802 | E2504: 17 | F2504: 11 | H2504: 3 | I2504: =E2504+F2504+G2504+H2504 -> 31
A2505: Carloni | B2505: Nico | C2505: 2148 | D2505: 57083 | E2505: 18 | F2505: 8 | H2505: 0 | I2505: =E2505+F2505+G2505+H2505 -> 26
A2506: Cavasassi | B2506: Emanuele | C2506: 2148 | D2506: 60430 | E2506: 14 | F2506: 11 | H2506: 3 | I2506: =E2506+F2506+G2506+H2506 -> 28
A2507: Cherin | B2507: Renzo | C2507: 2148 | D2507: 52454 | E2507: 17 | F2507: 3 | H2507: 3 | I2507: =E2507+F2507+G2507+H2507 -> 23
A2508: De Poda | B2508: Andrea | C2508: 2148 | D2508: 58041 | E2508: 17 | F2508: 4 | H2508: 3 | I2508: =E2508+F2508+G2508+H2508 -> 24
A2509: Drudi | B2509: Maria Elena | C2509: 2148 | D2509: 50743 | E2509: 6 | F2509: 3 | H2509: 3 | I2509: Insuff.
A2510: Fiuzzi | B2510: Luca | C2510: 2148 | D2510: 60140 | E2510: 16 | F2510: 7 | H2510: 3 | I2510: =E2510+F2510+G2510+H2510 -> 26
A2511: Guidetti | B2511: Marco | C2511: 2148 | D2511: 50509 | E2511: 17 | F2511: 7 | H2511: 3 | I2511: =E2511+F2511+G2511+H2511 -> 27
A2512: Iobbi | B2512: Cristian | C2512: 2148 | D2512: 50293 | E2512: 14 | F2512: 4 | H2512: 3 | I2512: =E2512+F2512+G2512+H2512 -> 21
A2513: Losco | B2513: Abele | C2513: 2108 | D2513: 50476 | E2513: 5 | F2513: 9 | H2513: 3 | I2513: =E2513+F2513+G2513+H2513 -> 17 | J2513: OK
A2514: Luppoli | B2514: Davide | C2514: 2148 | D2514: 59774 | E2514: 15 | F2514: 8 | H2514: 3 | I2514: =E2514+F2514+G2514+H2514 -> 26
A2515: Predoli | B2515: Gabriele | C2515: 2148 | D2515: 54895 | E2515: 12 | F2515: 9 | H2515: 3 | I2515: =E2515+F2515+G2515+H2515 -> 24
A2516: Salzillo | B2516: Domenico | C2516: 2148 | D2516: 47736 | E2516: 13 | F2516: 4 | H2516: 3 | I2516: =E2516+F2516+G2516+H2516 -> 20
A2517: Scrilatti | B2517: Marco | C2517: 2148 | D2517: 59364 | E2517: 7 | F2517: 8 | H2517: 3 | I2517: =E2517+F2517+G2517+H2517 -> 18
A2518: Stagni | B2518: Maurizio | C2518: 2148 | D2518: 55634 | E2518: 4 | F2518: 4 | H2518: 3 | I2518: Insuff.
A2519: Volta | B2519: Andrea | C2519: 2146 | D2519: 47710 | E2519: 14 | F2519: 1 | H2519: 3 | I2519: =E2519+F2519+G2519+H2519 -> 18
A2520: Zampetti | B2520: Daniela | C2520: 2148 | D2520: 59332 | E2520: 16 | F2520: 11 | H2520: 3 | I2520: =E2520+F2520+G2520+H2520 -> 30
A2521: (*) Il 14 Giugno comunichi se preferisce accettare o avere insufficienza e mantenere il bonus
A2523: Prova scritta di Ricerca Operativa del 5 Luglio 2000
A2524: (Informatica, Elettronica, Telecomunicazioni)
A2526: Validita': fino alla sessione autunnale A.A. 1999/2000
A2527: Visione degli elaborati e orali: Martedi' 11 Luglio 2000 ore 15.00 Aula 6.1
A2528: Prossimi appelli: 13 Settembre (scritto), Ottobre, Gennaio
A2530: Cognome | B2530: Nome | C2530: cdl | D2530: matricola | E2530: 1 | F2530: 2 | G2530: 3 | H2530: bonus | I2530: voto
A2531: Allori | B2531: Barbara | C2531: 2148 | D2531: 54643 | E2531: 10 | F2531: 9 | G2531: 5 | H2531: 0 | I2531: =E2532+F2532+G2532+H2532 -> 24
A2532: Bazzani | B2532: Andrea | C2532: 2103 | D2532: 49713 | E2532: 8 | F2532: 10 | G2532: 7 | H2532: 3 | I2532: =E2533+F2533+G2533+H2533 -> 28
A2533: Bruno | B2533: Pierluigi Nicola | C2533: 2108 | D2533: 41689 | E2533: 9 | F2533: 10 | G2533: 7 | H2533: 3 | I2533: =E2534+F2534+G2534+H2534 -> 29
A2534: Buffadini | B2534: Nicola | C2534: 2108 | D2534: 52483 | E2534: 11 | F2534: 6 | G2534: 4 | H2534: 3 | I2534: =E2535+F2535+G2535+H2535 -> 24
A2535: Bullini | B2535: Francesco | C2535: 2148 | D2535: 54439 | E2535: 7 | F2535: 0 | G2535: 2 | H2535: 3 | I2535: Insufficiente
A2536: Carlesso | B2536: Riccardo | C2536: 2148 | D2536: 58421 | E2536: 6 | F2536: 9 | G2536: 7 | H2536: 3 | I2536: =E2537+F2537+G2537+H2537 -> 25
A2537: Ciaffoni | B2537: Giovanni | C2537: 2148 | D2537: 58556 | E2537: 5 | F2537: 1 | G2537: 2 | H2537: 3 | I2537: Insufficiente
A2538: Fabbri | B2538: Fabio | C2538: 2006 | D2538: 41672 | E2538: 9 | F2538: 7 | G2538: 0 | H2538: 3 | I2538: =E2539+F2539+G2539+H2539 -> 19
A2539: Ferretti | B2539: Emil | C2539: 2148 | D2539: 58368 | E2539: 6 | F2539: 6 | G2539: 2 | H2539: 3 | I2539: =E2540+F2540+G2540+H2540 -> 17 | J2539: (*)
A2540: Garoia | B2540: Enrico | C2540: 2148 | D2540: 59644 | E2540: 6 | F2540: 8 | G2540: 2 | H2540: 3 | I2540: =E2541+F2541+G2541+H2541 -> 19
A2541: Governatori | B2541: Christian | C2541: 2148 | D2541: 57729 | E2541: 10 | F2541: 3 | G2541: 4 | H2541: 3 | I2541: =E2542+F2542+G2542+H2542 -> 20
A2542: Grossi | B2542: Veruska | C2542: 2148 | D2542: 56078 | E2542: 11 | F2542: 10 | G2542: 2 | H2542: 3 | I2542: =E2543+F2543+G2543+H2543 -> 26
A2543: Manaresi | B2543: Marco | C2543: 2006 | D2543: 41958 | E2543: 4 | F2543: 3 | G2543: 7 | H2543: 3 | I2543: =E2544+F2544+G2544+H2544 -> 17 | J2543: (*)
A2544: Manfroni | B2544: Roberto | C2544: 2108 | D2544: 50520 | E2544: 11 | F2544: 9 | G2544: 7 | H2544: 3 | I2544: =E2545+F2545+G2545+H2545 -> 30
A2545: Medos | B2545: Alessandro | C2545: 2006 | D2545: 40703 | E2545: 1 | F2545: 0 | G2545: 5 | H2545: 3 | I2545: Insufficiente
A2546: Melucci | B2546: Paolo | C2546: 2108 | D2546: 43436 | E2546: 7 | F2546: 7 | G2546: 7 | H2546: 3 | I2546: =E2547+F2547+G2547+H2547 -> 24
A2547: Monduzzi | B2547: Marina | C2547: 2108 | D2547: 42698 | E2547: 5 | F2547: 9 | G2547: 7 | H2547: 0 | I2547: =E2548+F2548+G2548+H2548 -> 21
A2548: (*)l'11 Luglio comunichi se preferisce accettare o avere insufficienza e mantenere il bonus
A2550: Prova Scritta di Ricerca Operativa del 13 Settembre 2000
A2551: (Informatica, Elettronica, Telecomunicazioni)
A2553: Validita': fino alla sessione invernale A.A. 1999/2000
A2554: Visione degli elaborati e orali: Martedi' 19 Settembre 2000 ore 15.00 Aula 6.1
A2555: Prossimi appelli: Ottobre (la data verra' fissata dopo l'inizio delle lezioni), Gennaio, Febbraio
A2557: Cognome | B2557: Nome | C2557: cdl | D2557: matricola | E2557: 1 | F2557: 2 | G2557: 3 | H2557: bonus | I2557: voto
A2558: Borri | B2558: Giacomo | C2558: 2148 | D2558: 59454 | E2558: 13 | F2558: 10 | G2558: 5 | H2558: 3 | I2558: =E2560+F2560+G2560+H2560 -> 31
A2559: Bortolini | B2559: Nicola | C2559: 2106 | D2559: 46317 | E2559: 2 | F2559: 7 | G2559: 0 | H2559: 0 | I2559: Insuff.
A2560: Chiari | B2560: Massimo | C2560: 2148 | D2560: 43589 | E2560: 9 | F2560: 10 | G2560: 5 | H2560: 0 | I2560: =E2562+F2562+G2562+H2562 -> 24
A2561: Feccomandi | B2561: Andrea | C2561: 2148 | D2561: 54590 | E2561: 7 | F2561: 10 | G2561: 4 | H2561: 3 | I2561: =E2563+F2563+G2563+H2563 -> 24
A2562: Scrilatti | B2562: Marco | C2562: 2148 | D2562: 59364 | E2562: 5 | F2562: 9 | G2562: 3 | H2562: 0 | I2562: =E2564+F2564+G2564+H2564 -> 17
A2563: Stagni | B2563: Maurizio | C2563: 2148 | D2563: 55634 | E2563: 11 | F2563: 3 | G2563: 2 | H2563: 3 | I2563: =E2565+F2565+G2565+H2565 -> 19
A2564: Taglioni | B2564: Matteo | C2564: 2143 | D2564: 58666 | E2564: 4 | F2564: 8 | G2564: 3 | H2564: 3 | I2564: =E2566+F2566+G2566+H2566 -> 18
A2566: Prova Scritta di Ricerca Operativa del 13 Ottobre 2000
A2567: (Informatica, Elettronica, Telecomunicazioni)
A2569: Validita': fino alla sessione invernale A.A. 1999/2000
A2570: Visione degli elaborati e orali: Venerdi' 20 Ottobre 2000, ore 16.00 Aula 6.1
A2571: Prossimi appelli: Dicembre (solo orale, per chi ha gia lo scritto), Gennaio, Febbraio/Marzo
A2573: Cognome | B2573: Nome | C2573: cdl | D2573: matricola | E2573: 1 | F2573: 2 | G2573: 3 | H2573: bonus | I2573: voto
A2574: Bicchecchi | B2574: Davide | C2574: 2148 | D2574: 52921 | E2574: 9 | F2574: 6 | G2574: 9 | H2574: 0 | I2574: =E2577+F2577+G2577+H2577 -> 24
A2575: Bortolini | B2575: Nicola | C2575: 2106 | D2575: 46317 | E2575: 0 | F2575: 5 | G2575: 9 | H2575: 3 | I2575: =E2578+F2578+G2578+H2578 -> 17 | J2575: *
A2576: Canotti | B2576: Lorenzo | C2576: 2148 | D2576: 57658 | E2576: 10 | F2576: 2 | G2576: 2 | H2576: 3 | I2576: =E2579+F2579+G2579+H2579 -> 17 | J2576: *
A2577: Ciaffoni | B2577: Giovanni | C2577: 2148 | D2577: 58556 | E2577: 9 | F2577: 6 | G2577: 3 | H2577: 3 | I2577: =E2580+F2580+G2580+H2580 -> 21
A2578: Compagnucci | B2578: Simone | C2578: 2148 | D2578: 44442 | E2578: 9 | F2578: 6 | G2578: 4 | H2578: 3 | I2578: =E2581+F2581+G2581+H2581 -> 22
A2579: Fiorellini | B2579: Gabriele | C2579: 2108 | D2579: 46347 | E2579: 5 | F2579: 5 | G2579: 9 | H2579: 3 | I2579: =E2582+F2582+G2582+H2582 -> 22
A2580: Fortini | B2580: Matteo | C2580: 2148 | D2580: 55367 | E2580: 13 | F2580: 6 | G2580: 11 | H2580: 3 | I2580: =E2583+F2583+G2583+H2583 -> 33
A2581: Girotti | B2581: Simone | C2581: 2148 | D2581: 56194 | E2581: 0 | F2581: 3 | G2581: 11 | H2581: 3 | I2581: =E2584+F2584+G2584+H2584 -> 17 | J2581: *
A2582: Marcolongo | B2582: Giuditta | C2582: 2146 | D2582: 51953 | E2582: 6 | F2582: 2 | G2582: 2 | H2582: 0 | I2582: Insuff.
A2583: Migliori | B2583: Giacomo | C2583: 2148 | D2583: 48020 | E2583: 13 | F2583: 6 | G2583: 11 | H2583: 3 | I2583: =E2586+F2586+G2586+H2586 -> 33
A2584: Mordenti | B2584: Massimiliano | C2584: 2148 | D2584: 54533 | E2584: 7 | F2584: 6 | G2584: 4 | H2584: 3 | I2584: =E2587+F2587+G2587+H2587 -> 20
A2585: Palmeggiani | B2585: Mario | C2585: 2148 | D2585: 48401 | E2585: 9 | F2585: 5 | G2585: 1 | H2585: 3 | I2585: =E2588+F2588+G2588+H2588 -> 18
A2586: Piancastelli | B2586: Giulio | C2586: 2148 | D2586: 54500 | E2586: 10 | F2586: 6 | G2586: 3 | H2586: 0 | I2586: =E2589+F2589+G2589+H2589 -> 19
A2587: Pierini | B2587: Virgilio | C2587: 2148 | D2587: 59773 | E2587: 13 | F2587: 5 | G2587: 11 | H2587: 3 | I2587: =E2590+F2590+G2590+H2590 -> 32
A2588: Poletti | B2588: Francesco | C2588: 2148 | D2588: 60150 | E2588: 9 | F2588: 3 | G2588: 3 | H2588: 3 | I2588: =E2591+F2591+G2591+H2591 -> 18
A2589: Salgo | B2589: Gabriele | C2589: 2148 | D2589: 59905 | E2589: 10 | F2589: 6 | G2589: 3 | H2589: 3 | I2589: =E2592+F2592+G2592+H2592 -> 22
A2590: Savelli | B2590: Pietro | C2590: 2148 | D2590: 59309 | E2590: 3 | F2590: 2 | G2590: 10 | H2590: 3 | I2590: =E2593+F2593+G2593+H2593 -> 18
A2591: Taglioni | B2591: Matteo | C2591: 2143 | D2591: 58666 | E2591: 11 | F2591: 5 | G2591: 11 | H2591: 0 | I2591: =E2594+F2594+G2594+H2594 -> 27
A2592: Turci | B2592: Matteo | C2592: 2148 | D2592: 10379 | E2592: 10 | F2592: 5 | G2592: 9 | H2592: 3 | I2592: =E2595+F2595+G2595+H2595 -> 27
A2593: Vagnerini | B2593: Giovanna | C2593: 2108 | D2593: 55977 | E2593: 12 | F2593: 5 | G2593: 10 | H2593: 3 | I2593: =E2596+F2596+G2596+H2596 -> 30
A2594: Vegetti | B2594: Lorenzo | C2594: 2148 | D2594: 53335 | E2594: 8 | F2594: 4 | G2594: 3 | H2594: 3 | I2594: =E2597+F2597+G2597+H2597 -> 18
A2595: Venturi | B2595: Filippo | C2595: 2148 | D2595: 60084 | E2595: 7 | F2595: 2 | G2595: 5 | H2595: 3 | I2595: =E2598+F2598+G2598+H2598 -> 17 | J2595: *
A2597: * Il 20 Ottobre comunichi se preferisce accettare o rifiutare e mantenere il bonus.
A2598: Prova Scritta di Ricerca Operativa del 10 Gennaio 2001
A2599: (Informatica, Elettronica, Telecomunicazioni)
A2601: Validita': fino alla sessione estiva A.A. 2000/2001
A2602: Visione degli elaborati e orali: Giovedi' 18 Gennaio 2001, ore 15.00 Aula 6.1
A2603: Prossimi appelli: 15 Febbraio 2001, ore 15.00 (scritto)
A2604: 22 Febbraio 2001 (orale)
A2605: Maggio/Giugno, Giugno/Luglio
A2607: Cognome | B2607: Nome | C2607: cdl | D2607: matricola | E2607: 1 | F2607: 2 | G2607: 3 | H2607: bonus | I2607: voto
A2608: Beltrani | B2608: Claudio | C2608: 2148 | D2608: 60055 | E2608: 8 | F2608: 7 | G2608: 0 | H2608: 3 | I2608: =E2611+F2611+G2611+H2611 -> 18
A2609: Bevilacqua | B2609: Marco | C2609: 2148 | D2609: 59912 | E2609: 15 | F2609: 8 | G2609: 6 | H2609: 3 | I2609: =E2612+F2612+G2612+H2612 -> 32
A2610: Capiluppi | B2610: Marta | C2610: 2148 | D2610: 61482 | E2610: 10 | F2610: 9 | G2610: 6 | H2610: 3 | I2610: =E2613+F2613+G2613+H2613 -> 28
A2611: Casali | B2611: Luca | C2611: 2148 | D2611: 61109 | E2611: 8 | F2611: 9 | G2611: 6 | H2611: 3 | I2611: =E2614+F2614+G2614+H2614 -> 26
A2612: Chesani | B2612: Federico | C2612: 2148 | D2612: 54547 | E2612: 12 | F2612: 9 | G2612: 2 | H2612: 3 | I2612: =E2615+F2615+G2615+H2615 -> 26
A2613: Nanetti | B2613: Claudio | C2613: 2148 | D2613: 57965 | E2613: 11 | F2613: 8 | G2613: 6 | H2613: 3 | I2613: =E2616+F2616+G2616+H2616 -> 28
A2614: Ntogramatzidis | B2614: Lorenzo | C2614: 2148 | D2614: 58640 | E2614: 11 | F2614: 8 | G2614: 1 | H2614: 3 | I2614: =E2617+F2617+G2617+H2617 -> 23
A2615: Ricciarelli | B2615: Stefano | C2615: 2148 | D2615: 57359 | E2615: 10 | F2615: 8 | G2615: 6 | H2615: 3 | I2615: =E2618+F2618+G2618+H2618 -> 27
A2616: Spanò | B2616: Fabio | C2616: 2146 | D2616: 56139 | E2616: 8 | F2616: 6 | G2616: 6 | H2616: 3 | I2616: =E2619+F2619+G2619+H2619 -> 23
A2618: Prova Scritta di Ricerca Operativa del 15 Febbraio 2001
A2619: (Informatica, Elettronica, Telecomunicazioni)
A2621: Validita': fino alla sessione estiva A.A. 2000/2001
A2622: Visione degli elaborati e orali: Giovedi' 22 Febbraio 2001, ore 15.00 Aula 6.2
A2623: Prossimi appelli: Maggio/Giugno, Giugno/Luglio
A2626: Cognome | B2626: Nome | C2626: cdl | D2626: matricola | E2626: 1 | F2626: 2 | G2626: 3 | H2626: bonus | I2626: voto
A2627: Agostini | B2627: Luca | C2627: 2148 | D2627: 61812 | E2627: 10 | F2627: 0 | G2627: 12 | H2627: 3 | I2627: =E2631+F2631+G2631+H2631 -> 25
A2628: Artuso | B2628: Matteo | C2628: 2148 | D2628: 52603 | E2628: 10 | F2628: 2 | G2628: 3 | H2628: 3 | I2628: =E2632+F2632+G2632+H2632 -> 18
A2629: Baratta | B2629: Fabio | C2629: 2148 | D2629: 54196 | E2629: 14 | F2629: 3 | G2629: 10 | H2629: 3 | I2629: =E2633+F2633+G2633+H2633 -> 30
A2630: Battaglino | B2630: Andrea | C2630: 2148 | D2630: 61302 | E2630: 13 | F2630: 2 | G2630: 11 | H2630: 3 | I2630: =E2634+F2634+G2634+H2634 -> 29
A2631: Bellodi | B2631: Elia | C2631: 2148 | D2631: 57250 | E2631: 15 | F2631: 3 | G2631: 4 | H2631: 3 | I2631: =E2635+F2635+G2635+H2635 -> 25
A2632: Bertorelli | B2632: Simone | C2632: 2148 | D2632: 62266 | E2632: 10 | F2632: 2 | G2632: 0 | I2632: Insuff.
A2633: Boscolo | B2633: Michele | C2633: 2148 | D2633: 61433 | E2633: 6 | F2633: 0 | G2633: 4 | I2633: Insuff.
A2634: Bovoli | B2634: Francesco | C2634: 2146 | D2634: 61296 | E2634: 8 | F2634: 0 | G2634: 12 | H2634: 3 | I2634: =E2638+F2638+G2638+H2638 -> 23
A2635: Calabrese | B2635: Rolando | E2635: 1 | F2635: 0 | G2635: 1 | I2635: Insuff.
A2636: Campana | B2636: Omar | C2636: 2148 | D2636: 57422 | E2636: 9 | F2636: 0 | G2636: 12 | H2636: 3 | I2636: =E2640+F2640+G2640+H2640 -> 24
A2637: Caselli | B2637: Alessandro | C2637: 2148 | D2637: 900000027 | E2637: 9 | F2637: 3 | G2637: 12 | H2637: 3 | I2637: =E2641+F2641+G2641+H2641 -> 27
A2638: Cesari | B2638: Andrea | C2638: 2108 | D2638: 45755 | E2638: 15 | F2638: 3 | G2638: 12 | H2638: 3 | I2638: =E2642+F2642+G2642+H2642 -> 33
A2639: Clo' | B2639: Davide | C2639: 2148 | D2639: 60138 | E2639: 12 | F2639: 3 | G2639: 4 | H2639: 3 | I2639: =E2643+F2643+G2643+H2643 -> 22
A2640: Di Florio | B2640: Maurizio | C2640: 2148 | D2640: 58802 | E2640: 11 | F2640: 0 | G2640: 10 | H2640: 3 | I2640: =E2644+F2644+G2644+H2644 -> 24
A2641: Drudi | B2641: Maria Elena | C2641: 2148 | D2641: 50743 | E2641: 4 | F2641: 0 | G2641: 10 | H2641: 3 | I2641: =E2645+F2645+G2645+H2645 -> 17 | J2641: *
A2642: Fabbri | B2642: Fabio | E2642: 10 | F2642: 0 | G2642: 12 | H2642: 0 | I2642: =E2646+F2646+G2646+H2646 -> 22
A2643: Falconi | B2643: Riccardo | C2643: 2148 | D2643: 61808 | E2643: 11 | F2643: 3 | G2643: 3 | H2643: 3 | I2643: =E2647+F2647+G2647+H2647 -> 20
A2644: Foschini | B2644: Luca | C2644: 2146 | D2644: 62555 | E2644: 11 | F2644: 1 | G2644: 8 | H2644: 3 | I2644: =E2648+F2648+G2648+H2648 -> 23
A2645: Gordini | B2645: Angelo | C2645: 2148 | D2645: 59483 | E2645: 9 | F2645: 3 | G2645: 11 | H2645: 0 | I2645: =E2649+F2649+G2649+H2649 -> 23
A2646: Guzzetti | B2646: Roberto | C2646: 2148 | D2646: 55665 | E2646: 14 | F2646: 2 | G2646: 11 | H2646: 3 | I2646: =E2650+F2650+G2650+H2650 -> 30
A2647: Leoni | B2647: Antonio | C2647: 2148 | D2647: 51738 | E2647: 5 | F2647: 0 | G2647: 11 | H2647: 3 | I2647: =E2651+F2651+G2651+H2651 -> 19
A2648: Linari | B2648: Alessandro | C2648: 2108 | D2648: 60570 | E2648: 15 | F2648: 3 | G2648: 3 | H2648: 3 | I2648: =E2652+F2652+G2652+H2652 -> 24
A2649: Lucente | B2649: Gianluca | C2649: 2148 | D2649: 61919 | E2649: 14 | F2649: 3 | G2649: 11 | H2649: 3 | I2649: =E2653+F2653+G2653+H2653 -> 31
A2650: Malatesta | B2650: Alessandro | C2650: 2148 | D2650: 50488 | E2650: 11 | F2650: 0 | G2650: 12 | H2650: 3 | I2650: =E2654+F2654+G2654+H2654 -> 26
A2651: Malavolta | B2651: Antonella | C2651: 2148 | D2651: 60297 | E2651: 9 | F2651: 1 | G2651: 4 | H2651: 3 | I2651: =E2655+F2655+G2655+H2655 -> 17 | J2651: *
A2652: Melchiori | B2652: Simone | C2652: 900 | D2652: 33 | E2652: 8 | F2652: 3 | G2652: 11 | H2652: 3 | I2652: =E2656+F2656+G2656+H2656 -> 25
A2653: Montosi | B2653: Piero | C2653: 2148 | D2653: 52831 | E2653: 8 | F2653: 0 | G2653: 11 | H2653: 3 | I2653: =E2657+F2657+G2657+H2657 -> 22
A2654: Moretti | B2654: Carlo | C2654: 2148 | D2654: 61254 | E2654: 9 | F2654: 3 | G2654: 10 | H2654: 3 | I2654: =E2658+F2658+G2658+H2658 -> 25
A2655: Mortellaro | B2655: Franco | C2655: 2148 | D2655: 52512 | E2655: 11 | F2655: 0 | G2655: 12 | H2655: 0 | I2655: =E2659+F2659+G2659+H2659 -> 23
A2656: Napolitano | B2656: Marco | C2656: 2148 | D2656: 60026 | E2656: 4 | F2656: 2 | G2656: 0 | I2656: Insuff.
A2657: Palazzani | B2657: Matteo | C2657: 2148 | D2657: 60396 | E2657: 14 | F2657: 2 | G2657: 12 | H2657: 3 | I2657: =E2661+F2661+G2661+H2661 -> 31
A2658: Pezzi | B2658: Alessandro | C2658: 2148 | D2658: 54265 | E2658: 13 | F2658: 3 | G2658: 8 | H2658: 3 | I2658: =E2662+F2662+G2662+H2662 -> 27
A2659: Pochi | B2659: Serena | C2659: 2148 | D2659: 62262 | E2659: 10 | F2659: 2 | G2659: 12 | H2659: 3 | I2659: =E2663+F2663+G2663+H2663 -> 27
A2660: Scardovi | B2660: Elisa | C2660: 2106 | D2660: 60343 | E2660: 7 | F2660: 3 | G2660: 11 | H2660: 3 | I2660: =E2664+F2664+G2664+H2664 -> 24
A2661: Tardioli | B2661: Danilo | C2661: 2148 | D2661: 62976 | E2661: 6 | F2661: 2 | G2661: 0 | I2661: Insuff.
A2662: Venni | B2662: Alessandro | C2662: 2148 | D2662: 55408 | E2662: 13 | F2662: 2 | G2662: 9 | H2662: 3 | I2662: =E2666+F2666+G2666+H2666 -> 27
A2663: Venturi | B2663: Filippo | C2663: 2148 | D2663: 60084 | E2663: 14 | F2663: 2 | G2663: 11 | H2663: 3 | I2663: =E2667+F2667+G2667+H2667 -> 30
A2664: Vergini | B2664: Daniele | C2664: 2148 | D2664: 59329 | E2664: 12 | F2664: 1 | G2664: 3 | H2664: 3 | I2664: =E2668+F2668+G2668+H2668 -> 19
A2666: Prova Scritta di Ricerca Operativa del 7 Giugno 2001
A2667: (Informatica, Elettronica, Telecomunicazioni)
A2669: Validita': fino alla sessione autunnale A.A. 2000/2001
A2670: Visione degli elaborati e orali: Mercoledi' 13 Giugno 2001, ore 15.00 Aula 5.7
A2671: Prossimi appelli: 5 Luglio (scritto), 12 Luglio (orale),
A2672: 13 Settembre (scritto), 19 Settembre (orale)
A2673: Ottobre, Gennaio
A2674: Cognome | B2674: Nome | C2674: cdl | D2674: matricola | E2674: 1 | F2674: 2 | G2674: 3 | H2674: bonus | I2674: voto
A2675: Cortese | B2675: Saverio | C2675: 2148 | D2675: 62670 | E2675: 9 | F2675: 7 | H2675: 3 | I2675: =E2680+F2680+G2680+H2680 -> 19
A2676: Di Carmine | B2676: Antonio | C2676: 2108 | D2676: 58784 | E2676: 17 | F2676: 10 | H2676: 3 | I2676: =E2681+F2681+G2681+H2681 -> 30
A2677: Franceschetti | B2677: Luca | C2677: 2148 | D2677: 53222 | E2677: 16 | F2677: 4 | H2677: 0 | I2677: =E2682+F2682+G2682+H2682 -> 20
A2678: Gherardi | B2678: Alessandro | C2678: 2148 | D2678: 45857 | E2678: 6 | F2678: 11 | H2678: 3 | I2678: =E2683+F2683+G2683+H2683 -> 20
A2679: Giacomelli | B2679: Nicola | C2679: 2148 | D2679: 58399 | E2679: 15 | F2679: 8 | H2679: 3 | I2679: =E2684+F2684+G2684+H2684 -> 26
A2680: Marcolongo | B2680: Giuditta | C2680: 2146 | D2680: 51953 | E2680: 3 | F2680: 12 | H2680: 3 | I2680: =E2685+F2685+G2685+H2685 -> 18
A2681: Ortoman | B2681: Luca | C2681: 2108 | D2681: 56766 | E2681: 10 | F2681: 8 | H2681: 3 | I2681: =E2686+F2686+G2686+H2686 -> 21
A2682: Piunti | B2682: Michele | C2682: 2148 | D2682: 57571 | E2682: 11 | F2682: 11 | H2682: 3 | I2682: =E2687+F2687+G2687+H2687 -> 25
A2683: Scartozzi | B2683: Gian Luca | C2683: 2106 | D2683: 54343 | E2683: 11 | F2683: 10 | H2683: 3 | I2683: =E2688+F2688+G2688+H2688 -> 24
A2684: Trombini | B2684: Raffaele | C2684: 2148 | D2684: 52372 | E2684: 5 | F2684: 11 | H2684: 3 | I2684: =E2689+F2689+G2689+H2689 -> 19
A2685: Visciotti | B2685: Franco | C2685: 2148 | D2685: 52586 | E2685: 4 | F2685: 10 | H2685: 3 | I2685: =E2690+F2690+G2690+H2690 -> 17
A2686: Vitale | B2686: Filippo | C2686: 2148 | D2686: 56908 | E2686: 15 | F2686: 12 | H2686: 3 | I2686: =E2691+F2691+G2691+H2691 -> 30
A2688: * Il 13 Giugno comunichi se accetta o preferisce insuffcienza e bonus
A2690: Prova Scritta di Ricerca Operativa del 5 Luglio 2001
A2691: (Informatica, Elettronica, Telecomunicazioni)
A2693: Validita': fino alla sessione autunnale A.A. 2000/2001
A2694: Visione degli elaborati e orali: Giovedi' 12 Luglio 2001, ore 15.00, Aula 5.6
A2695: Prossimi appelli: 13 Settembre (scritto), 19 Settembre (orale)
A2696: Ottobre, Gennaio
A2698: Cognome | B2698: Nome | C2698: cdl | D2698: matricola | E2698: 1 | F2698: 2 | G2698: bonus | H2698: voto
A2699: Accorsi | B2699: Stefano | C2699: 2148 | D2699: 55091 | E2699: 12 | F2699: 11 | G2699: 0 | H2699: =E2705+F2705+G2705 -> 23
A2700: Andreani | B2700: Stefano | C2700: 2148 | D2700: 58449 | E2700: 10 | F2700: 10 | G2700: 3 | H2700: =E2706+F2706+G2706 -> 23
A2701: Boldura | B2701: Davide | C2701: 2148 | D2701: 51759 | E2701: 11 | F2701: 11 | G2701: 3 | H2701: =E2707+F2707+G2707 -> 25
A2702: Boscolo | B2702: Michele | C2702: 2148 | D2702: 61433 | E2702: 11 | F2702: 11 | G2702: 3 | H2702: =E2708+F2708+G2708 -> 25
A2703: Catalano | B2703: Roberto | C2703: 2146 | D2703: 52464 | E2703: 4 | F2703: 12 | G2703: 3 | H2703: =E2709+F2709+G2709 -> 19
A2704: Costa | B2704: Francesco | C2704: 2148 | D2704: 62898 | E2704: 4 | F2704: 14 | G2704: 3 | H2704: =E2710+F2710+G2710 -> 21
A2705: Dalmonte | B2705: Vilmer | C2705: 2148 | D2705: 57237 | E2705: 13 | F2705: 10 | G2705: 3 | H2705: =E2711+F2711+G2711 -> 26
A2706: Di Massimo | B2706: Vincenzo | C2706: 2148 | D2706: 50691 | E2706: 8 | F2706: 7 | G2706: 3 | H2706: =E2712+F2712+G2712 -> 18
A2707: Ferretti | B2707: Emil | C2707: 2148 | D2707: 58368 | E2707: 12 | F2707: 4 | G2707: 3 | H2707: =E2713+F2713+G2713 -> 19
A2708: Gattei | B2708: Marco | C2708: 2148 | D2708: 55597 | E2708: 14 | F2708: 10 | G2708: 3 | H2708: =E2714+F2714+G2714 -> 27
A2709: Medos | B2709: Alessandro | C2709: 2006 | D2709: 40703 | E2709: 1 | F2709: 0 | G2709: 0 | H2709: Insuff.
A2710: Memè | B2710: Michele | C2710: 2148 | D2710: 55158 | E2710: 7 | F2710: 11 | G2710: 3 | H2710: =E2716+F2716+G2716 -> 21
A2711: Paolini | B2711: Andrea | C2711: 2148 | D2711: 54299 | E2711: 13 | F2711: 8 | G2711: 3 | H2711: =E2717+F2717+G2717 -> 24
A2712: Perlini | B2712: Pierpaolo | C2712: 2148 | D2712: 46066 | E2712: 9 | F2712: 11 | G2712: 3 | H2712: =E2718+F2718+G2718 -> 23
A2713: Tassi | B2713: Davide | C2713: 2006 | D2713: 41815 | E2713: 5 | F2713: 11 | G2713: 3 | H2713: =E2719+F2719+G2719 -> 19
A2714: Ubaldi | B2714: Guglielmo | C2714: 2148 | D2714: 61841 | E2714: 12 | F2714: 2 | G2714: 3 | H2714: =E2720+F2720+G2720 -> 17 | I2714: *
A2715: * Il 12 Luglio comunichi se accetta o preferisce insufficienza e bonus
A2717: Prova Scritta di Ricerca Operativa del 13 Settembre 2001
A2718: (Informatica, Elettronica, Telecomunicazioni)
A2720: Validita': fino alla sessione invernale A.A. 2000/2001
A2721: Visione degli elaborati e orali: Mercoledi' 19 Settembre 2001, ore 15.00, Aula 6.1
A2722: Prossimi appelli: 12 Ottobre (scritto) (data da confermare)
A2723: Ottobre (orale), Gennaio (scritto+orale)
A2725: Cognome | B2725: Nome | C2725: cdl | D2725: matricola | E2725: 1 | F2725: 2 | G2725: 3 | H2725: bonus | I2725: voto
A2726: Cannone | B2726: Amedeo | C2726: 2148 | D2726: 59249 | E2726: 11 | F2726: 8 | G2726: 4 | H2726: 3 | I2726: =E2732+F2732+G2732+H2732 -> 26
A2727: Foschini | B2727: Luca | C2727: 2146 | D2727: 62555 | E2727: 14 | F2727: 8 | G2727: 5 | H2727: 0 | I2727: =E2733+F2733+G2733+H2733 -> 27
A2728: Giannelli | B2728: Carlo | C2728: 2148 | D2728: 61360 | E2728: 13 | F2728: 9 | G2728: 5 | H2728: 3 | I2728: =E2734+F2734+G2734+H2734 -> 30
A2729: Lucci | B2729: Giacomo | C2729: 2148 | D2729: 61451 | E2729: 15 | F2729: 8 | G2729: 5 | H2729: 3 | I2729: =E2735+F2735+G2735+H2735 -> 31
A2730: Lupo | B2730: Quintino Lucio | C2730: 2148 | D2730: 46351 | E2730: 4 | F2730: 8 | G2730: 5 | H2730: 3 | I2730: =E2736+F2736+G2736+H2736 -> 20
A2731: Milani | B2731: Stefano | C2731: 2006 | D2731: 40585 | E2731: 2 | F2731: 8 | G2731: 5 | H2731: 3 | I2731: =E2737+F2737+G2737+H2737 -> 18
A2732: Monticelli | B2732: Ivan | C2732: 2148 | D2732: 61766 | E2732: 8 | F2732: 4 | G2732: 3 | H2732: 3 | I2732: =E2738+F2738+G2738+H2738 -> 18
A2733: Moretti | B2733: Carlo | C2733: 2148 | D2733: 61254 | E2733: 7 | F2733: 9 | G2733: 5 | H2733: 0 | I2733: =E2739+F2739+G2739+H2739 -> 21
A2734: Panzacchi | B2734: Romano | C2734: 2148 | D2734: 61593 | E2734: 6 | F2734: 8 | G2734: 2 | H2734: 3 | I2734: =E2740+F2740+G2740+H2740 -> 19
A2735: Pazzi | B2735: Katia | C2735: 2148 | D2735: 47900 | E2735: 1 | F2735: 9 | G2735: 5 | H2735: 3 | I2735: =E2741+F2741+G2741+H2741 -> 18
A2736: Ragazzini | B2736: Taymer | C2736: 2148 | D2736: 57778 | E2736: 6 | F2736: 6 | G2736: 3 | H2736: 3 | I2736: =E2742+F2742+G2742+H2742 -> 18
A2737: Santi | B2737: Augusto | C2737: 2106 | D2737: 44460 | E2737: 1 | F2737: 9 | G2737: 5 | H2737: 3 | I2737: =E2743+F2743+G2743+H2743 -> 18
A2738: Tardioli | B2738: Danilo | C2738: 2148 | D2738: 62976 | E2738: 1 | F2738: 5 | G2738: 1 | I2738: Insuff.
A2740: Validita': fino alla sessione invernale A.A. 2000/2001
A2741: Visione degli elaborati e orali: Venerdi' 19 Ottobre 2001, ore 17.00, Aula 6.1
A2742: Prossimi appelli: 18 Dicembre ore 16 Aula 6.2 (solo orale)
A2743: 14 Gennaio pomeriggio (scritto)
A2744: 18 Gennaio pomeriggio (orale)
A2745: Febbraio (scritto+orale)
A2747: Cognome | B2747: Nome | C2747: cdl | D2747: matricola | E2747: 1 | F2747: 2 | G2747: 3 | H2747: bonus | I2747: voto
A2748: Cacciari | B2748: Davide | C2748: 2148 | D2748: 54660 | E2748: 13 | F2748: 0 | G2748: 11 | H2748: 3 | I2748: =E2756+F2756+G2756+H2756 -> 27
A2749: Cordella | B2749: Teodoro | C2749: 2148 | D2749: 53807 | E2749: 6 | F2749: 0 | G2749: 4 | I2749: Insuff.
A2750: De Lellis | B2750: Giuseppe | C2750: 2108 | D2750: 59852 | E2750: 8 | F2750: 2 | G2750: 4 | H2750: 3 | I2750: =E2758+F2758+G2758+H2758 -> 17 | J2750: *
A2751: Fioretti | B2751: Alessandro | C2751: 2148 | D2751: 62063 | E2751: 8 | F2751: 0 | G2751: 3 | I2751: Insuff.
A2752: Giovannini | B2752: Alessandro | C2752: 2148 | D2752: 62686 | E2752: 7 | F2752: 0 | G2752: 3 | H2752: 3 | I2752: Insuff.
A2753: Magistretti | B2753: Eugenio | C2753: 2148 | D2753: 62777 | E2753: 13 | F2753: 3 | G2753: 12 | H2753: 3 | I2753: =E2761+F2761+G2761+H2761 -> 31
A2754: Matta | B2754: Gabriele | C2754: 2108 | D2754: 59452 | E2754: 11 | F2754: 1 | G2754: 5 | H2754: 3 | I2754: =E2762+F2762+G2762+H2762 -> 20
A2755: Mazzi | B2755: Michele | C2755: 2163 | D2755: 61427 | E2755: 13 | F2755: 0 | G2755: 12 | H2755: 3 | I2755: =E2763+F2763+G2763+H2763 -> 28
A2756: Modena | B2756: Stefano | C2756: 2148 | D2756: 60591 | E2756: 13 | F2756: 0 | G2756: 10 | H2756: 3 | I2756: =E2764+F2764+G2764+H2764 -> 26
A2757: Montalti | B2757: Filippo | C2757: 2146 | D2757: 59391 | E2757: 10 | F2757: 2 | G2757: 4 | H2757: 3 | I2757: =E2765+F2765+G2765+H2765 -> 19
A2758: Nervegna | B2758: Fabrizio | C2758: 2108 | D2758: 53022 | E2758: 6 | F2758: 1 | G2758: 10 | H2758: 3 | I2758: =E2766+F2766+G2766+H2766 -> 20
A2759: Perticarini | B2759: Emanuele | C2759: 2148 | D2759: 58261 | E2759: 13 | F2759: 0 | G2759: 2 | H2759: 3 | I2759: =E2767+F2767+G2767+H2767 -> 18
A2760: Roma | B2760: Claudio | C2760: 2148 | D2760: 55942 | E2760: 14 | F2760: 3 | G2760: 5 | H2760: 3 | I2760: =E2768+F2768+G2768+H2768 -> 25
A2761: Romagnoli | B2761: Roberta | C2761: 2148 | D2761: 61583 | E2761: 11 | F2761: 0 | G2761: 12 | H2761: 3 | I2761: =E2769+F2769+G2769+H2769 -> 26
A2762: Ruggeri | B2762: Alessio | C2762: 2148 | D2762: 58573 | E2762: 13 | F2762: 0 | G2762: 7 | H2762: 3 | I2762: =E2770+F2770+G2770+H2770 -> 23
A2763: Straccia | B2763: Davide | C2763: 2148 | D2763: 45756 | E2763: 0 | F2763: 2 | G2763: 7 | I2763: Insuff.
A2764: Tramontani | B2764: Andrea | C2764: 2148 | D2764: 62162 | E2764: 15 | F2764: 2 | G2764: 5 | H2764: 3 | I2764: =E2772+F2772+G2772+H2772 -> 25
A2765: Tresoldi | B2765: Vincenzo | C2765: 2108 | D2765: 52296 | E2765: 12 | F2765: 0 | G2765: 10 | H2765: 3 | I2765: =E2773+F2773+G2773+H2773 -> 25
A2766: Ubaldi | B2766: Guglielmo | C2766: 2148 | D2766: 61841 | E2766: 13 | F2766: 0 | G2766: 3 | H2766: 3 | I2766: =E2774+F2774+G2774+H2774 -> 19
A2767: Valisi | B2767: Sergio | C2767: 2108 | D2767: 60122 | E2767: 15 | F2767: 3 | G2767: 12 | H2767: 3 | I2767: =E2775+F2775+G2775+H2775 -> 33
A2768: Villani | B2768: James | C2768: 2148 | D2768: 52706 | E2768: 5 | F2768: 0 | G2768: 10 | H2768: 3 | I2768: =E2776+F2776+G2776+H2776 -> 18
A2769: Visciotti | B2769: Franco | C2769: 2148 | D2769: 52586 | E2769: 10 | F2769: 2 | G2769: 3 | H2769: 3 | I2769: =E2777+F2777+G2777+H2777 -> 18
A2770: * Il 12 Luglio comunichi se accetta o preferisce insufficienza e bonus
A2772: Prova Scritta di Ricerca Operativa del 14 Gennaio 2002
A2773: (Vecchio ordinamento: Informatica, Elettronica, Telecomunicazioni)
A2775: Validita': fino alla sessione estiva A.A. 2001/2002
A2776: Visione degli elaborati e orali: Venerdi' 18 Gennaio 2002, ore 14.00, Aula 6.2
A2777: Prossimi appelli: 22 febbraio (da confermare), scritto
A2778: circa una settimana dopo, orale
A2779: fine Maggio (scritto+orale)
A2780: Giugno o Luglio (scritto+orale)
A2782: Cognome | B2782: Nome | C2782: cdl | D2782: matricola | E2782: 1 | F2782: 2 | G2782: 3 | H2782: bonus | I2782: voto
A2783: Bottazzi | B2783: Dario | C2783: 2148 | D2783: 56723 | E2783: 9 | F2783: 6 | G2783: 7 | H2783: 3 | I2783: =E2792+F2792+G2792+H2792 -> 25
A2784: Bragaglia | B2784: Stefano | C2784: 2148 | D2784: 57782 | E2784: 14 | F2784: 6 | G2784: 7 | H2784: 3 | I2784: =E2793+F2793+G2793+H2793 -> 30
A2785: Calabrese | B2785: Rolando | C2785: 2148 | D2785: 900000411 | E2785: 9 | F2785: 6 | G2785: 5 | H2785: 3 | I2785: =E2794+F2794+G2794+H2794 -> 23
A2786: Cammerucci | B2786: Denis | C2786: 2148 | D2786: 63330 | E2786: 13 | F2786: 6 | G2786: 5 | H2786: 3 | I2786: =E2795+F2795+G2795+H2795 -> 27
A2787: Cattuto | B2787: Francesco | C2787: 2148 | D2787: 63647 | E2787: 11 | F2787: 6 | G2787: 7 | H2787: 3 | I2787: =E2796+F2796+G2796+H2796 -> 27
A2788: Cavallaro | B2788: Andrea | C2788: 2148 | D2788: 58312 | E2788: 7 | F2788: 6 | G2788: 4 | H2788: 3 | I2788: =E2797+F2797+G2797+H2797 -> 20
A2789: Damis | B2789: Luigi | C2789: 2148 | D2789: 59569 | E2789: 12 | F2789: 6 | G2789: 6 | H2789: 3 | I2789: =E2798+F2798+G2798+H2798 -> 27
A2790: De Coi | B2790: Juri Luca | C2790: 2148 | D2790: 64704 | E2790: 14 | F2790: 7 | G2790: 5 | H2790: 3 | I2790: =E2799+F2799+G2799+H2799 -> 29
A2791: D'Ercoli | B2791: Moreno | C2791: 2148 | D2791: 63507 | E2791: 10 | F2791: 7 | G2791: 7 | H2791: 3 | I2791: =E2800+F2800+G2800+H2800 -> 27
A2792: Deromedis | B2792: Sandro | C2792: 2148 | D2792: 61070 | E2792: 11 | F2792: 5 | G2792: 6 | H2792: 3 | I2792: =E2801+F2801+G2801+H2801 -> 25
A2793: Ferretti | B2793: Emil | C2793: 2148 | D2793: 58368 | E2793: 7 | F2793: 5 | G2793: 6 | H2793: 0 | I2793: =E2802+F2802+G2802+H2802 -> 18
A2794: Gabbani | B2794: Giorgio | C2794: 2148 | D2794: 63548 | E2794: 14 | F2794: 5 | G2794: 6 | H2794: 3 | I2794: =E2803+F2803+G2803+H2803 -> 28
A2795: Lucchi | B2795: Andrea | C2795: 2148 | D2795: 63490 | E2795: 8 | F2795: 3 | G2795: 7 | H2795: 3 | I2795: =E2804+F2804+G2804+H2804 -> 21
A2796: Lucrezi | B2796: Francesco | C2796: 2148 | D2796: 63645 | E2796: 13 | F2796: 6 | G2796: 7 | H2796: 3 | I2796: =E2805+F2805+G2805+H2805 -> 29
A2797: Malvisi | B2797: Alessandro | C2797: 2148 | D2797: 61210 | E2797: 12 | F2797: 7 | G2797: 5 | H2797: 3 | I2797: =E2806+F2806+G2806+H2806 -> 27
A2798: Misuraca | B2798: Rosario Marco | C2798: 2148 | D2798: 61376 | E2798: 11 | F2798: 8 | G2798: 7 | H2798: 3 | I2798: =E2807+F2807+G2807+H2807 -> 29
A2799: Montanari | B2799: Gian Piero Matteo | C2799: 2148 | D2799: 59739 | E2799: 7 | F2799: 8 | G2799: 6 | H2799: 3 | I2799: =E2808+F2808+G2808+H2808 -> 24
A2800: Montosi | B2800: Piero | C2800: 2148 | D2800: 52831 | E2800: 9 | F2800: 6 | G2800: 7 | H2800: 0 | I2800: =E2809+F2809+G2809+H2809 -> 22
A2801: Nerozzi | B2801: Matteo | C2801: 2148 | D2801: 60028 | E2801: 10 | F2801: 5 | G2801: 2 | H2801: 3 | I2801: =E2810+F2810+G2810+H2810 -> 20
A2802: Righi | B2802: Riccardo | C2802: 2148 | D2802: 63559 | E2802: 12 | F2802: 7 | G2802: 7 | H2802: 3 | I2802: =E2811+F2811+G2811+H2811 -> 29
A2803: Rondinini | B2803: Gianni | C2803: 2148 | D2803: 54383 | E2803: 12 | F2803: 3 | G2803: 3 | H2803: 3 | I2803: =E2812+F2812+G2812+H2812 -> 21
A2804: Tampieri | B2804: Riccardo | C2804: 2148 | D2804: 61560 | E2804: 8 | F2804: 7 | G2804: 7 | H2804: 3 | I2804: =E2813+F2813+G2813+H2813 -> 25
A2805: Tassetti | B2805: Matteo | C2805: 2148 | D2805: 63925 | E2805: 14 | F2805: 7 | G2805: 5 | H2805: 3 | I2805: =E2814+F2814+G2814+H2814 -> 29
A2806: Testi | B2806: Fabio | C2806: 2148 | D2806: 55045 | E2806: 9 | F2806: 6 | G2806: 5 | H2806: 3 | I2806: =E2815+F2815+G2815+H2815 -> 23
A2807: Verachi | B2807: Stefania | C2807: 2148 | D2807: 48354 | E2807: 13 | F2807: 6 | G2807: 6 | H2807: 3 | I2807: =E2816+F2816+G2816+H2816 -> 28
A2808: Zamagni | B2808: Fausto | C2808: 2148 | D2808: 50737 | E2808: 14 | F2808: 8 | G2808: 7 | H2808: 3 | I2808: =E2817+F2817+G2817+H2817 -> 32
A2810: Prova Scritta di Ricerca Operativa del 22 Febbraio 2002
A2811: (Vecchio ordinamento: Informatica, Elettronica, Telecomunicazioni)
A2813: Validita': fino alla sessione estiva A.A. 2001/2002
A2814: Visione degli elaborati e orali: Mercoledi' 27 Febbraio 2002, ore 17.00, Aula 6.1
A2815: Prossimi appelli:
A2816: fine Maggio (scritto+orale)
A2817: Giugno o Luglio (scritto+orale)
A2819: Cognome | B2819: Nome | C2819: cdl | D2819: matricola | E2819: 1 | F2819: 2 | G2819: 3 | H2819: bonus | I2819: voto
A2820: Accorsi | B2820: Stefano | C2820: 2148 | D2820: 55091 | E2820: 5 | F2820: 6 | G2820: 1 | H2820: 0 | I2820: Insuff.
A2821: Amati | B2821: Claudio | C2821: 2146 | D2821: 57339 | E2821: 8 | F2821: 9 | G2821: 3 | H2821: 3 | I2821: =E2834+F2834+G2834+H2834 -> 23
A2822: Aniello | B2822: Robertino | C2822: 2148 | D2822: 63736 | E2822: 13 | F2822: 9 | G2822: 4 | H2822: 3 | I2822: =E2835+F2835+G2835+H2835 -> 29
A2823: Caselli | B2823: Giuseppe | C2823: 2148 | D2823: 55649 | E2823: 7 | F2823: 5 | G2823: 4 | H2823: 3 | I2823: =E2836+F2836+G2836+H2836 -> 19
A2824: Castagnini | B2824: Andrea | C2824: 2148 | D2824: 60233 | E2824: 3 | F2824: 9 | G2824: 4 | H2824: 3 | I2824: =E2837+F2837+G2837+H2837 -> 19
A2825: Cognigni | B2825: Fabio | C2825: 2148 | D2825: 63516 | E2825: 9 | F2825: 9 | G2825: 4 | H2825: 3 | I2825: =E2838+F2838+G2838+H2838 -> 25
A2826: Corazza | B2826: Demis | C2826: 2148 | D2826: 63511 | E2826: 10 | F2826: 9 | G2826: 3 | H2826: 3 | I2826: =E2839+F2839+G2839+H2839 -> 25
A2827: Cordella | B2827: Teodoro | C2827: 2148 | D2827: 53807 | E2827: 9 | F2827: 4 | G2827: 2 | H2827: 3 | I2827: =E2840+F2840+G2840+H2840 -> 18
A2828: De Biaggi | B2828: Matteo | C2828: 2146 | D2828: 64142 | E2828: 5 | F2828: 8 | G2828: 2 | H2828: 3 | I2828: =E2841+F2841+G2841+H2841 -> 18
A2829: De Matteis | B2829: Pietro | C2829: 2148 | D2829: 900002572 | E2829: 8 | F2829: 8 | G2829: 0 | H2829: 3 | I2829: =E2842+F2842+G2842+H2842 -> 19
A2830: Fioretti | B2830: Alessandro | C2830: 2148 | D2830: 62063 | E2830: 15 | F2830: 8 | G2830: 3 | H2830: 3 | I2830: =E2843+F2843+G2843+H2843 -> 29
A2831: Fiorini | B2831: Stefano | C2831: 2148 | D2831: 55701 | E2831: 7 | F2831: 4 | G2831: 4 | H2831: 3 | I2831: =E2844+F2844+G2844+H2844 -> 18
A2832: Giovannini | B2832: Alessandro | C2832: 2148 | D2832: 62686 | E2832: 11 | F2832: 8 | G2832: 3 | H2832: 3 | I2832: =E2845+F2845+G2845+H2845 -> 25
A2833: Golinelli | B2833: Marco | C2833: 2148 | D2833: 55342 | E2833: 11 | F2833: 9 | G2833: 2 | H2833: 3 | I2833: =E2846+F2846+G2846+H2846 -> 25
A2834: Mazzotti | B2834: Marcello | C2834: 2148 | D2834: 62341 | E2834: 8 | F2834: 9 | G2834: 3 | H2834: 3 | I2834: =E2847+F2847+G2847+H2847 -> 23
A2835: Medos | B2835: Alessandro | C2835: 2006 | D2835: 40703 | E2835: 2 | F2835: 1 | G2835: 4 | I2835: Insuff.
A2836: Miglietta | B2836: Sandra | C2836: 2148 | D2836: 57090 | E2836: 10 | F2836: 7 | G2836: 2 | H2836: 3 | I2836: =E2849+F2849+G2849+H2849 -> 22
A2837: Mischiati | B2837: Matteo | C2837: 2148 | D2837: 63802 | E2837: 14 | F2837: 1 | G2837: 0 | H2837: 3 | I2837: =E2850+F2850+G2850+H2850 -> 18
A2838: Monaco | B2838: Vincenzo | C2838: 2148 | D2838: 56013 | E2838: 8 | F2838: 7 | G2838: 3 | H2838: 3 | I2838: =E2851+F2851+G2851+H2851 -> 21
A2839: Monti | B2839: Stefano | C2839: 2148 | D2839: 63386 | E2839: 14 | F2839: 9 | G2839: 4 | H2839: 3 | I2839: =E2852+F2852+G2852+H2852 -> 30
A2840: Nuzzo | B2840: Alberto | C2840: 2148 | D2840: 55057 | E2840: 7 | F2840: 5 | G2840: 3 | H2840: 3 | I2840: =E2853+F2853+G2853+H2853 -> 18
A2841: Paganelli | B2841: Luca | C2841: 2146 | D2841: 57289 | E2841: 13 | F2841: 9 | G2841: 4 | H2841: 3 | I2841: =E2854+F2854+G2854+H2854 -> 29
A2842: Pasini | B2842: Samuele | C2842: 2148 | D2842: 63595 | E2842: 14 | F2842: 2 | G2842: 4 | H2842: 3 | I2842: =E2855+F2855+G2855+H2855 -> 23
A2843: Pedori | B2843: Alessandro | C2843: 2148 | D2843: 58376 | E2843: 11 | F2843: 6 | G2843: 4 | H2843: 3 | I2843: =E2856+F2856+G2856+H2856 -> 24
A2844: Scagliosi | B2844: Marco | C2844: 2148 | D2844: 50761 | E2844: 9 | F2844: 9 | G2844: 3 | H2844: 3 | I2844: =E2857+F2857+G2857+H2857 -> 24
A2845: Semeraro | B2845: Gianpiero | C2845: 2148 | D2845: 60384 | E2845: 8 | F2845: 6 | G2845: 3 | H2845: 3 | I2845: =E2858+F2858+G2858+H2858 -> 20
A2846: Zaghini | B2846: Fabio | C2846: 2148 | D2846: 45944 | E2846: 9 | F2846: 7 | G2846: 2 | H2846: 3 | I2846: =E2859+F2859+G2859+H2859 -> 21
A2848: Ricerca Operativa (Vecchio Ordinamento)
A2849: Prova Scritta del 10 Giugno 2002
A2851: Validita': fino alla Sessione Autunnale 2002
A2852: Visione degli elaborati e orali:Giovedi' 13 Giugno 2002, ore 16.00, Aula 6.2
A2853: Prossimi appelli: 23 Luglio, Settembre
A2855: matricola | B2855: Nome | C2855: Cognome | D2855: 1 | E2855: 2 | F2855: 3 | G2855: bonus | H2855: voto
A2857: 2148063696 | B2857: PIETRO | C2857: LANUTI | D2857: 8 | E2857: 5 | F2857: 2 | G2857: 3 | H2857: =D2877+E2877+F2877+G2877 -> 18
A2858: 2148064415 | B2858: LORENZO | C2858: LUCCIARINI DE VINCENZI | D2858: 11 | E2858: 8 | F2858: 5 | G2858: 3 | H2858: =D2878+E2878+F2878+G2878 -> 27
A2859: 2148063512 | B2859: ALIOSCIA | C2859: PETRELLI | D2859: 14 | E2859: 5 | F2859: 4 | G2859: 3 | H2859: =D2879+E2879+F2879+G2879 -> 26
A2860: 2148060386 | B2860: PASQUALE | C2860: SEMERARO | D2860: 12 | E2860: 6 | F2860: 0 | G2860: 3 | H2860: =D2880+E2880+F2880+G2880 -> 21
A2861: 2148062976 | B2861: DANILO | C2861: TARDIOLI | D2861: 12 | E2861: 6 | F2861: 2 | G2861: 3 | H2861: =D2881+E2881+F2881+G2881 -> 23
A2862: 2148061247 | B2862: STEFANO | C2862: VACCARI | D2862: 13 | E2862: 5 | F2862: 4 | G2862: 3 | H2862: =D2882+E2882+F2882+G2882 -> 25
A2864: Ricerca Operativa (Vecchio Ordinamento)
A2865: Prova Scritta del 23 Luglio 2002
A2867: Validita': fino alla Sessione Autunnale 2002
A2868: Visione degli elaborati e orali:Venerdi' 26 Luglio 2002, ore 14.30, Aula 6.1
A2869: Prossimi appelli: 16 Settembre, Ottobre
A2871: matricola | B2871: Nome | C2871: Cognome | D2871: 1 | E2871: 2 | F2871: 3 | G2871: bonus | H2871: voto
A2873: 2148064074 | B2873: GIACOMO | C2873: ANGIONE | D2873: 15 | E2873: 7 | F2873: 6 | G2873: 3 | H2873: =D2896+E2896+F2896+G2896 -> 31
A2874: 2148064267 | B2874: EMILIANO | C2874: BALDO | D2874: 14 | E2874: 7 | F2874: 5 | G2874: 3 | H2874: =D2897+E2897+F2897+G2897 -> 29
A2875: 2148063410 | B2875: ILIAS | C2875: BARTOLINI | D2875: 9 | E2875: 6 | F2875: 3 | G2875: 3 | H2875: =D2898+E2898+F2898+G2898 -> 21
A2876: 2148061594 | B2876: TATIANA | C2876: CAMPAGNA | D2876: 12 | E2876: 5 | F2876: 6 | G2876: 3 | H2876: =D2899+E2899+F2899+G2899 -> 26
A2877: 2108060439 | B2877: ANTONIO | C2877: CECERE | D2877: 10 | E2877: 6 | F2877: 0 | G2877: 3 | H2877: =D2900+E2900+F2900+G2900 -> 19
A2878: 2148064120 | B2878: FABIO | C2878: CIANI | D2878: 12 | E2878: 5 | F2878: 4 | G2878: 3 | H2878: =D2901+E2901+F2901+G2901 -> 24
A2879: 2148062464 | B2879: GRAZIANO | C2879: CLEMENTELLI | D2879: 13 | E2879: 6 | F2879: 5 | G2879: 3 | H2879: =D2902+E2902+F2902+G2902 -> 27
A2880: 2148064152 | B2880: ROBERTO | C2880: COLOMBARI | D2880: 10 | E2880: 1 | F2880: 3 | G2880: 3 | H2880: =D2903+E2903+F2903+G2903 -> 17 | I2880: *
A2881: 2148053824 | B2881: MATTEO | C2881: GAETANI | D2881: 11 | E2881: 6 | F2881: 5 | G2881: 3 | H2881: =D2904+E2904+F2904+G2904 -> 25
A2882: 2148045857 | B2882: ALESSANDRO | C2882: GHERARDI | D2882: 12 | E2882: 6 | F2882: 1 | G2882: 0 | H2882: =D2905+E2905+F2905+G2905 -> 19
A2883: 900001870 | B2883: VINCENZO | C2883: GURNARI | D2883: 10 | E2883: 3 | F2883: 5 | G2883: 3 | H2883: =D2906+E2906+F2906+G2906 -> 21
A2884: 2148057205 | B2884: FILIPPO | C2884: INGIANNI | D2884: 13 | E2884: 4 | F2884: 6 | G2884: 3 | H2884: =D2907+E2907+F2907+G2907 -> 26
A2885: 2148063772 | B2885: GABRIELE | C2885: LASAGNI | D2885: 14 | E2885: 7 | F2885: 6 | G2885: 3 | H2885: =D2908+E2908+F2908+G2908 -> 30
A2886: 2148057073 | B2886: VALERIO | C2886: LUZZI | D2886: 10 | E2886: 5 | F2886: 6 | G2886: 3 | H2886: =D2909+E2909+F2909+G2909 -> 24
A2887: 2148061645 | B2887: MARCO | C2887: MARANI | D2887: 12 | E2887: 8 | F2887: 2 | G2887: 3 | H2887: =D2910+E2910+F2910+G2910 -> 25
A2888: 2006040703 | B2888: ALESSANDRO | C2888: MEDOS | D2888: 5 | E2888: 0 | F2888: 4 | G2888: 0 | H2888: Insuff.
A2889: 2146061985 | B2889: FRANCESCA | C2889: MERIGHI | D2889: 12 | E2889: 5 | F2889: 3 | G2889: 3 | H2889: =D2912+E2912+F2912+G2912 -> 23
A2890: 2148063843 | B2890: IVO | C2890: MUCCIOLI | D2890: 14 | E2890: 8 | F2890: 5 | G2890: 3 | H2890: =D2913+E2913+F2913+G2913 -> 30
A2891: 2148063595 | B2891: SAMUELE | C2891: PASINI | D2891: 12 | E2891: 8 | F2891: 5 | G2891: 0 | H2891: =D2914+E2914+F2914+G2914 -> 25
A2892: 2148048027 | B2892: DIMITRI | C2892: RIDOLFI | D2892: 12 | E2892: 7 | F2892: 6 | G2892: 3 | H2892: =D2915+E2915+F2915+G2915 -> 28
A2893: 2148064110 | B2893: FILIPPO | C2893: SERAFINI | D2893: 13 | E2893: 7 | F2893: 3 | G2893: 3 | H2893: =D2916+E2916+F2916+G2916 -> 26
A2894: 2148060551 | B2894: FABIO | C2894: STROVEGLI | D2894: 6 | E2894: 6 | F2894: 4 | G2894: 3 | H2894: =D2917+E2917+F2917+G2917 -> 19
A2895: 2148048045 | B2895: MASSIMILIANO | C2895: TOMESANI | D2895: 6 | E2895: 9 | F2895: 4 | G2895: 3 | H2895: =D2918+E2918+F2918+G2918 -> 22
A2896: 900001837 | B2896: LEONARDO | C2896: ZEN | D2896: 6 | E2896: 3 | F2896: 2 | G2896: 3 | H2896: Insuff.
A2898: * Il 26 Luglio comunichi se accetta o preferisce insufficienza e bonus
A2900: Ricerca Operativa V-O
A2901: Prova Scritta del 16 Settembre 2002
A2903: Validita': fino a Febbraio 2003
A2904: Visione degli elaborati e orali:Venerdi' 20 Settembre 2002, ore 16.00 Aula 6.1
A2905: Prossimi appelli: Ottobre, Gennaio
A2907: matricola | B2907: Cognome | C2907: Nome | D2907: 1 | E2907: 2 | F2907: 3 | G2907: bonus | H2907: voto
A2908: 2148061190 | B2908: BALLONE | C2908: PAOLO | D2908: 10 | E2908: 4 | G2908: 3 | H2908: =D2933+E2933+F2933+G2933 -> 17 | I2908: *
A2909: 2148061554 | B2909: CICCONI | C2909: GINEVRA | D2909: 9 | E2909: 9 | G2909: 3 | H2909: =D2934+E2934+F2934+G2934 -> 21
A2910: 2148057633 | B2910: CLEMENTI | C2910: FABIO | D2910: 4 | E2910: 14 | G2910: 3 | H2910: =D2935+E2935+F2935+G2935 -> 21
A2911: 2148062670 | B2911: CORTESE | C2911: SAVERIO | D2911: 5 | E2911: 15 | G2911: 0 | H2911: =D2936+E2936+F2936+G2936 -> 20
A2912: 2148043411 | B2912: CRESCENZI | C2912: FRANCESCO | D2912: 4 | E2912: 15 | G2912: 3 | H2912: =D2937+E2937+F2937+G2937 -> 22
A2913: 2148058251 | B2913: D'ALESSANDRO | C2913: PARIDE | D2913: 6 | E2913: 15 | G2913: 3 | H2913: =D2938+E2938+F2938+G2938 -> 24
A2914: 2148048412 | B2914: D'ELIA | C2914: ROBERTO | D2914: 3 | E2914: 15 | G2914: 3 | H2914: =D2939+E2939+F2939+G2939 -> 21
A2915: 2148064160 | B2915: DI NICOLA | C2915: VINCENZO MARIA | D2915: 11 | E2915: 15 | G2915: 3 | H2915: =D2940+E2940+F2940+G2940 -> 29
A2916: 2148061505 | B2916: DI PASQUALE | C2916: MAURIZIO | D2916: 7 | E2916: 10 | G2916: 3 | H2916: =D2941+E2941+F2941+G2941 -> 20
A2917: 2148058368 | B2917: FERRETTI | C2917: EMIL | D2917: 13 | E2917: 11 | G2917: 0 | H2917: =D2942+E2942+F2942+G2942 -> 24
A2918: 2148050713 | B2918: FILIPPINI | C2918: ROBERTO | D2918: 5 | E2918: 15 | G2918: 3 | H2918: =D2943+E2943+F2943+G2943 -> 23
A2919: 900004426 | B2919: LAURIA | C2919: MAURIZIO | D2919: 7 | E2919: 15 | G2919: 3 | H2919: =D2944+E2944+F2944+G2944 -> 25
A2920: 2148063361 | B2920: MENABENI | C2920: ENRICO | D2920: 15 | E2920: 10 | G2920: 3 | H2920: =D2945+E2945+F2945+G2945 -> 28
A2921: 2148058504 | B2921: PARCA | C2921: SIMONE | D2921: 8 | E2921: 9 | G2921: 3 | H2921: =D2946+E2946+F2946+G2946 -> 20
A2922: 2148062010 | B2922: PASINI | C2922: ALBERTO | D2922: 11 | E2922: 15 | G2922: 3 | H2922: =D2947+E2947+F2947+G2947 -> 29
A2923: 2148054957 | B2923: RIMONDI | C2923: SIMONE | D2923: 7 | E2923: 15 | G2923: 3 | H2923: =D2948+E2948+F2948+G2948 -> 25
A2924: 2146064185 | B2924: VENERUCCI | C2924: LORENZO | D2924: 10 | E2924: 9 | G2924: 3 | H2924: =D2949+E2949+F2949+G2949 -> 22
A2925: 2148057219 | B2925: ZUCCHERELLI | C2925: ANDREA | D2925: 10 | E2925: 9 | G2925: 3 | H2925: =D2950+E2950+F2950+G2950 -> 22
A2927: * Il 20 Settembre comunichi se accetta o preferisce insufficienza e bonus
A2929: Ricerca Operativa V-O
A2930: Prova Scritta del 18 Ottobre 2002
A2932: Validita': fino a Gennaio 2003
A2933: Visione degli elaborati e orali:Venerdi' 25 Ottobre 2002, ore 15.00 Aula 8.1
A2934: Prossimi appelli: 17 Dicembre (scritto), 20 Dicembre (orale)
A2935: 10 Gennaio (scritto), 15 Gennaio (orale)
A2936: Appelli successivi: Aprile, Giugno, Luglio
A2938: matricola | B2938: Cognome | C2938: Nome | D2938: 1 | E2938: 2 | F2938: 3 | G2938: bonus | H2938: voto
A2939: 2146050162 | B2939: BACCARI | C2939: ANTONIO | D2939: 7 | E2939: 9 | F2939: 5 | G2939: 3 | H2939: =D2966+E2966+F2966+G2966 -> 24
A2940: 2148060088 | B2940: BARBATI | C2940: MASSIMO | D2940: 8 | E2940: 9 | F2940: 4 | G2940: 3 | H2940: =D2967+E2967+F2967+G2967 -> 24
A2941: 2148063651 | B2941: BARTOLUCCI | C2941: SAURO | D2941: 14 | E2941: 9 | F2941: 5 | G2941: 3 | H2941: =D2968+E2968+F2968+G2968 -> 31
A2942: 2148059143 | B2942: BENINCASA | C2942: FRANCESCO | D2942: 5 | E2942: 4 | F2942: 2 | G2942: 0 | H2942: Insuff.
A2943: 2148053328 | B2943: BORGHI | C2943: EMILIANO | D2943: 5 | E2943: 8 | F2943: 6 | G2943: 3 | H2943: =D2970+E2970+F2970+G2970 -> 22
A2944: 2148064277 | B2944: BOTTURA | C2944: FABIO | D2944: 14 | E2944: 9 | F2944: 6 | G2944: 3 | H2944: =D2971+E2971+F2971+G2971 -> 32
A2945: 2148050346 | B2945: BOZZINI | C2945: ROSSELLA | D2945: 8 | E2945: 6 | F2945: 6 | G2945: 3 | H2945: =D2972+E2972+F2972+G2972 -> 23
A2946: 2148064086 | B2946: BURATTINI | C2946: GIACOMO | D2946: 14 | E2946: 9 | F2946: 6 | G2946: 3 | H2946: =D2973+E2973+F2973+G2973 -> 32
A2947: 2148063593 | B2947: CAFINI | C2947: OMAR | D2947: 10 | E2947: 8 | F2947: 5 | G2947: 3 | H2947: =D2974+E2974+F2974+G2974 -> 26
A2948: 2148063609 | B2948: COLANGELO | C2948: CESARE NICOLAI | D2948: 9 | E2948: 7 | F2948: 3 | G2948: 3 | H2948: =D2975+E2975+F2975+G2975 -> 22
A2949: 2146064142 | B2949: DE BIAGGI | C2949: MATTEO | D2949: 12 | E2949: 9 | F2949: 4 | G2949: 0 | H2949: =D2976+E2976+F2976+G2976 -> 25
A2950: 2108052186 | B2950: DI PEDE | C2950: ANTONELLO | D2950: 7 | E2950: 5 | F2950: 3 | G2950: 3 | H2950: =D2977+E2977+F2977+G2977 -> 18
A2951: 2148059921 | B2951: GARUTI | C2951: MAURO | D2951: 12 | E2951: 5 | F2951: 6 | G2951: 3 | H2951: =D2978+E2978+F2978+G2978 -> 26
A2952: 2148050684 | B2952: GASPARRONI | C2952: PAOLO | D2952: 4 | E2952: 6 | F2952: 5 | G2952: 3 | H2952: =D2979+E2979+F2979+G2979 -> 18
A2953: 2148057615 | B2953: GRILLINI | C2953: GIORGIO | D2953: 6 | E2953: 3 | F2953: 6 | G2953: 3 | H2953: =D2980+E2980+F2980+G2980 -> 18
A2954: 2148054385 | B2954: LANZONI | C2954: VERONICA | D2954: 5 | E2954: 8 | F2954: 2 | G2954: 3 | H2954: =D2981+E2981+F2981+G2981 -> 18
A2955: 2148059234 | B2955: LODI | C2955: DEBORAH | D2955: 13 | E2955: 6 | F2955: 6 | G2955: 3 | H2955: =D2982+E2982+F2982+G2982 -> 28
A2956: 2148064180 | B2956: MEARELLI | C2956: GABRIELE | D2956: 13 | E2956: 2 | F2956: 6 | G2956: 3 | H2956: =D2983+E2983+F2983+G2983 -> 24
A2957: 2143057210 | B2957: MURETTO | C2957: GIOVANNI | D2957: 10 | E2957: 3 | F2957: 6 | G2957: 3 | H2957: =D2984+E2984+F2984+G2984 -> 22
A2958: 2108059628 | B2958: PALMISANO | C2958: MARIA SCALA | D2958: 2 | E2958: 6 | F2958: 6 | G2958: 3 | H2958: =D2985+E2985+F2985+G2985 -> 17 | I2958: *
A2959: 2148060742 | B2959: PIRCHER | C2959: THOMAS | D2959: 12 | E2959: 6 | F2959: 5 | G2959: 3 | H2959: =D2986+E2986+F2986+G2986 -> 26
A2960: 2148059399 | B2960: ROSSINI | C2960: FRANCESCO | D2960: 4 | E2960: 6 | F2960: 5 | G2960: 3 | H2960: =D2987+E2987+F2987+G2987 -> 18
A2961: 2148045756 | B2961: STRACCIA | C2961: DAVIDE | D2961: 9 | E2961: 3 | F2961: 4 | G2961: 3 | H2961: =D2988+E2988+F2988+G2988 -> 19
A2962: 2148064278 | B2962: TONAZZOLLI | C2962: MATTEO | D2962: 9 | E2962: 8 | F2962: 4 | G2962: 3 | H2962: =D2989+E2989+F2989+G2989 -> 24
A2963: 2148064608 | B2963: UGOLINI | C2963: FRANCESCO | D2963: 4 | E2963: 5 | F2963: 6 | G2963: 3 | H2963: =D2990+E2990+F2990+G2990 -> 18
A2964: 900001837 | B2964: ZEN | C2964: LEONARDO | D2964: 4 | E2964: 8 | F2964: 5 | G2964: 3 | H2964: =D2991+E2991+F2991+G2991 -> 20
A2966: * Il 25 Ottobre comunichi se accetta o preferisce insufficienza e bonus
A2968: Ricerca Operativa V-O
A2969: Prova Scritta del 17 Dicembre 2002
A2971: Validita': fino a Aprile 2003
A2972: Visione degli elaborati e orali:Venerdi' 20 Dicembre 2002, ore 15.00 Aula E1.B
A2973: Prossimi appelli: Gennaio, Aprile
A2975: matricola | B2975: Cognome | C2975: Nome | D2975: 1 | E2975: 2 | F2975: 3 | G2975: bonus | H2975: voto
A2976: 2148061121 | B2976: BOSELLI | C2976: SIMONE | D2976: 11 | E2976: 6 | F2976: 8 | G2976: 3 | H2976: =D3006+E3006+F3006+G3006 -> 28
A2977: 2148052029 | B2977: CASADEI | C2977: CRISTIANO | D2977: 5 | E2977: 5 | F2977: 8 | G2977: 3 | H2977: =D3007+E3007+F3007+G3007 -> 21
A2978: 2148063953 | B2978: CORVINI | C2978: MARCO | D2978: 7 | E2978: 7 | F2978: 8 | G2978: 3 | H2978: =D3008+E3008+F3008+G3008 -> 25
A2979: 2148064391 | B2979: COVA | C2979: MARCO | D2979: 11 | G2979: 1.5 | H2979: 25
A2980: 2108052469 | B2980: DALL'OLIO | C2980: FEDERICO | D2980: 1 | E2980: 2 | F2980: 2 | H2980: Insuff.
A2981: 2143061387 | B2981: DEL BALDO | C2981: ALESSANDRO | D2981: 6 | E2981: 5 | F2981: 5 | G2981: 3 | H2981: =D3011+E3011+F3011+G3011 -> 19
A2982: 2148055648 | B2982: LANDI | C2982: TIZIANA | D2982: 10 | E2982: 5 | F2982: 3 | G2982: 3 | H2982: =D3012+E3012+F3012+G3012 -> 21
A2983: 2148063520 | B2983: LANDINI | C2983: ALEX | D2983: 13 | E2983: 7 | F2983: 8 | G2983: 3 | H2983: =D3013+E3013+F3013+G3013 -> 31
A2984: 2148051781 | B2984: LODI RIZZINI | C2984: ENZO | D2984: 8 | E2984: 5 | F2984: 4 | G2984: 3 | H2984: =D3014+E3014+F3014+G3014 -> 20
A2985: 2148048390 | B2985: MASSACESI | C2985: ITALO | D2985: 5 | E2985: 5 | F2985: 8 | G2985: 3 | H2985: =D3015+E3015+F3015+G3015 -> 21
A2986: 2108059204 | B2986: ORTOLANI | C2986: MAURIZIO | D2986: 10 | E2986: 0 | F2986: 8 | G2986: 3 | H2986: =D3016+E3016+F3016+G3016 -> 21
A2987: 2148059715 | B2987: PALAZZI | C2987: MARA | D2987: 2 | E2987: 5 | F2987: 8 | G2987: 3 | H2987: =D3017+E3017+F3017+G3017 -> 18
A2988: 2148050687 | B2988: PARINI | C2988: STEFANO | D2988: 11 | E2988: 6 | F2988: 4 | G2988: 3 | H2988: =D3018+E3018+F3018+G3018 -> 24
A2989: 2148048373 | B2989: PASSERINI | C2989: ALESSANDRO | D2989: 9 | E2989: 4 | F2989: 8 | G2989: 3 | H2989: =D3019+E3019+F3019+G3019 -> 24
A2990: 2148064608 | B2990: UGOLINI | C2990: FRANCESCO | D2990: 10 | E2990: 0 | F2990: 3 | G2990: 0 | H2990: =D3020+E3020+F3020+G3020 -> 13
A2992: Ricerca Operativa V-O
A2993: Prova Scritta del 10 Gennaio 2003
A2995: Validita': fino a Giugno 2003
A2996: Visione degli elaborati e orali:Mercoledi' 15 Gennaio 2003, ore 15.00 Aula 8.1
A2997: Prossimi appelli: Aprile, Giugno, Luglio
A2999: matricola | B2999: Cognome | C2999: Nome | D2999: 1 | E2999: 2 | F2999: 3 | G2999: bonus | H2999: voto
A3000: 2148053511 | B3000: CANUTI | C3000: STEFANO | D3000: 12 | E3000: 8 | F3000: 5 | G3000: 3 | H3000: =D3032+E3032+F3032+G3032 -> 28
A3001: 2148061183 | B3001: CAVINA | C3001: ELKER | D3001: 13 | E3001: 8 | F3001: 2 | G3001: 3 | H3001: =D3033+E3033+F3033+G3033 -> 26
A3002: 2148059445 | B3002: CIONI | C3002: ALESSANDRO | D3002: 11 | E3002: 9 | F3002: 5 | G3002: 3 | H3002: =D3034+E3034+F3034+G3034 -> 28
A3003: 2148057078 | B3003: CUPPI | C3003: ENRICO | D3003: 9 | E3003: 9 | F3003: 5 | G3003: 3 | H3003: =D3035+E3035+F3035+G3035 -> 26
A3004: 2148059513 | B3004: DEL FAVERO | C3004: MARCO | D3004: 14 | E3004: 9 | F3004: 6 | G3004: 3 | H3004: =D3036+E3036+F3036+G3036 -> 32
A3005: 2148053641 | B3005: DI LORENZO | C3005: DANIELE | D3005: 1 | E3005: 6 | F3005: 5 | H3005: Insuff.
A3006: 2146054569 | B3006: DISCENZA | C3006: GIANLUCA | D3006: 10 | E3006: 9 | F3006: 5 | G3006: 3 | H3006: =D3038+E3038+F3038+G3038 -> 27
A3007: 2146059541 | B3007: FABBRI | C3007: ALESSANDRO | D3007: 5 | E3007: 9 | F3007: 2 | G3007: 3 | H3007: =D3039+E3039+F3039+G3039 -> 19
A3008: 2148062906 | B3008: MANDARINI | C3008: GILBERTO | D3008: 6 | E3008: 9 | F3008: 5 | G3008: 3 | H3008: =D3040+E3040+F3040+G3040 -> 23
A3009: 2148057609 | B3009: MARCHETTI | C3009: ROBERTO | D3009: 8 | E3009: 9 | F3009: 5 | G3009: 3 | H3009: =D3041+E3041+F3041+G3041 -> 25
A3010: 2148060029 | B3010: PALLI | C3010: GIANLUCA | D3010: 14 | F3010: 3 | G3010: 3 | H3010: =D3042+E3042+F3042+G3042 -> 20
A3011: 2108059628 | B3011: PALMISANO | C3011: MARIA SCALA | D3011: 3 | E3011: 9 | F3011: 6 | G3011: 3 | H3011: =D3043+E3043+F3043+G3043 -> 21
A3012: 2108047800 | B3012: RICCI | C3012: ALBERTO | D3012: 10 | E3012: 9 | F3012: 3 | G3012: 3 | H3012: =D3044+E3044+F3044+G3044 -> 25
A3013: 2148048353 | B3013: SUCCI | C3013: FEDERICO | D3013: 4 | E3013: 5 | F3013: 5 | G3013: 3 | H3013: =D3045+E3045+F3045+G3045 -> 17 | I3013: *
A3014: 2148052456 | B3014: VANDELLI | C3014: GABRIELE | D3014: 3 | E3014: 3 | F3014: 5 | H3014: Insuff.
A3015: 2148046387 | B3015: ZARRI | C3015: MARCO | D3015: 5 | E3015: 8 | F3015: 5 | G3015: 3 | H3015: =D3047+E3047+F3047+G3047 -> 21
A3016: * Il 15 Gennaio comunichi se accetta o preferisce insufficienza e bonus
A3018: Ricerca Operativa L-A
A3019: Prova Scritta del 17 Marzo 2003
A3021: Validita': fino a Giugno 2003
A3022: Visione degli elaborati e orali:Lunedi' 24 Marzo ore 15.00 Aula 6.1
A3023: Prossimi appelli: Aprile, Giugno, Luglio
A3025: matricola | B3025: Cognome | C3025: Nome | D3025: 1 | E3025: 2 | F3025: 3 | G3025: bonus | H3025: voto
A3026: 2148059143 | B3026: BENINCASA | C3026: FRANCESCO | D3026: 5 | E3026: 5 | F3026: 2 | G3026: 3 | H3026: Insuff.
A3027: 2148053641 | B3027: DI LORENZO | C3027: DANIELE | D3027: 9 | E3027: 1 | F3027: 5 | G3027: 3 | H3027: =D3061+E3061+F3061+G3061 -> 18
A3028: 2148045902 | B3028: POGGIASPALLA | C3028: BARBARA | D3028: 3 | E3028: 3 | F3028: 3 | G3028: 3 | H3028: Insuff.
A3029: 2148062347 | B3029: TARONI | C3029: GIUSEPPE | D3029: 12 | E3029: 6 | F3029: 4 | G3029: 3 | H3029: =D3063+E3063+F3063+G3063 -> 25
A3030: 2148064608 | B3030: UGOLINI | C3030: FRANCESCO | D3030: 13 | E3030: 2 | F3030: 5 | G3030: 0 | H3030: =D3064+E3064+F3064+G3064 -> 20
A3032: Ricerca Operativa L-A
A3033: Prova Scritta del 4 Aprile 2003
A3035: Validita': fino a Luglio 2003
A3036: Visione degli elaborati e orali:Martedi' 15 Aprile ore 14.00 Aula 6.1
A3037: Prossimi appelli: Giugno, Luglio
A3039: matricola | B3039: Cognome | C3039: Nome | D3039: 1 | E3039: 2 | F3039: 3 | G3039: bonus | H3039: voto
A3040: 2148059143 | B3040: BENINCASA | C3040: FRANCESCO | D3040: 8 | E3040: 3 | F3040: 6 | G3040: 0 | H3040: =D3076+E3076+F3076+G3076 -> 17 | I3040: *
A3041: 2148057341 | B3041: DE ANGELIS | C3041: MASSIMILIANO | D3041: 7 | E3041: 5 | F3041: 10 | G3041: 3 | H3041: =D3077+E3077+F3077+G3077 -> 25
A3042: 2148064601 | B3042: MARZO | C3042: ALESSANDRO | D3042: 10 | E3042: 3 | F3042: 9 | G3042: 3 | H3042: =D3078+E3078+F3078+G3078 -> 25
A3043: 2146061279 | B3043: PIRINI | C3043: GIANNI | D3043: 0 | E3043: 5 | F3043: 13 | G3043: 3 | H3043: =D3079+E3079+F3079+G3079 -> 21
A3044: 2148045902 | B3044: POGGIASPALLA | C3044: BARBARA | D3044: 5 | E3044: 4 | F3044: 9 | G3044: 0 | H3044: =D3080+E3080+F3080+G3080 -> 18
A3045: * = ammesso all'orale