A3: Prova Scritta di Ricerca Operativa del 22 Febbraio 2002
A4: (Vecchio ordinamento: Informatica, Elettronica, Telecomunicazioni)
A6: Validita': fino alla sessione estiva A.A. 2001/2002
A7: Visione elaborati e orali: Mercoledi' 27 Febbraio 2002, ore 17.00, Aula 6.1
A8: Prossimi appelli:
A9: fine Maggio (scritto+orale)
A10: Giugno o Luglio (scritto+orale)
A12: Cognome | B12: Nome | C12: cdl | D12: matricola | E12: 1 | F12: 2 | G12: 3 | H12: bonus | I12: voto
A13: Accorsi | B13: Stefano | C13: 2148 | D13: 55091 | E13: 5 | F13: 6 | G13: 1 | H13: 0 | I13: Insuff.
A14: Amati | B14: Claudio | C14: 2146 | D14: 57339 | E14: 8 | F14: 9 | G14: 3 | H14: 3 | I14: =E14+F14+G14+H14 -> 23
A15: Aniello | B15: Robertino | C15: 2148 | D15: 63736 | E15: 13 | F15: 9 | G15: 4 | H15: 3 | I15: =E15+F15+G15+H15 -> 29
A16: Caselli | B16: Giuseppe | C16: 2148 | D16: 55649 | E16: 7 | F16: 5 | G16: 4 | H16: 3 | I16: =E16+F16+G16+H16 -> 19
A17: Castagnini | B17: Andrea | C17: 2148 | D17: 60233 | E17: 3 | F17: 9 | G17: 4 | H17: 3 | I17: =E17+F17+G17+H17 -> 19
A18: Cognigni | B18: Fabio | C18: 2148 | D18: 63516 | E18: 9 | F18: 9 | G18: 4 | H18: 3 | I18: =E18+F18+G18+H18 -> 25
A19: Corazza | B19: Demis | C19: 2148 | D19: 63511 | E19: 10 | F19: 9 | G19: 3 | H19: 3 | I19: =E19+F19+G19+H19 -> 25
A20: Cordella | B20: Teodoro | C20: 2148 | D20: 53807 | E20: 9 | F20: 4 | G20: 2 | H20: 3 | I20: =E20+F20+G20+H20 -> 18
A21: De Biaggi | B21: Matteo | C21: 2146 | D21: 64142 | E21: 5 | F21: 8 | G21: 2 | H21: 3 | I21: =E21+F21+G21+H21 -> 18
A22: De Matteis | B22: Pietro | C22: 2148 | D22: 900002572 | E22: 8 | F22: 8 | G22: 0 | H22: 3 | I22: =E22+F22+G22+H22 -> 19
A23: Fioretti | B23: Alessandro | C23: 2148 | D23: 62063 | E23: 15 | F23: 8 | G23: 3 | H23: 3 | I23: =E23+F23+G23+H23 -> 29
A24: Fiorini | B24: Stefano | C24: 2148 | D24: 55701 | E24: 7 | F24: 4 | G24: 4 | H24: 3 | I24: =E24+F24+G24+H24 -> 18
A25: Giovannini | B25: Alessandro | C25: 2148 | D25: 62686 | E25: 11 | F25: 8 | G25: 3 | H25: 3 | I25: =E25+F25+G25+H25 -> 25
A26: Golinelli | B26: Marco | C26: 2148 | D26: 55342 | E26: 11 | F26: 9 | G26: 2 | H26: 3 | I26: =E26+F26+G26+H26 -> 25
A27: Mazzotti | B27: Marcello | C27: 2148 | D27: 62341 | E27: 8 | F27: 9 | G27: 3 | H27: 3 | I27: =E27+F27+G27+H27 -> 23
A28: Medos | B28: Alessandro | C28: 2006 | D28: 40703 | E28: 2 | F28: 1 | G28: 4 | I28: Insuff.
A29: Miglietta | B29: Sandra | C29: 2148 | D29: 57090 | E29: 10 | F29: 7 | G29: 2 | H29: 3 | I29: =E29+F29+G29+H29 -> 22
A30: Mischiati | B30: Matteo | C30: 2148 | D30: 63802 | E30: 14 | F30: 1 | G30: 0 | H30: 3 | I30: =E30+F30+G30+H30 -> 18
A31: Monaco | B31: Vincenzo | C31: 2148 | D31: 56013 | E31: 8 | F31: 7 | G31: 3 | H31: 3 | I31: =E31+F31+G31+H31 -> 21
A32: Monti | B32: Stefano | C32: 2148 | D32: 63386 | E32: 14 | F32: 9 | G32: 4 | H32: 3 | I32: =E32+F32+G32+H32 -> 30
A33: Nuzzo | B33: Alberto | C33: 2148 | D33: 55057 | E33: 7 | F33: 5 | G33: 3 | H33: 3 | I33: =E33+F33+G33+H33 -> 18
A34: Paganelli | B34: Luca | C34: 2146 | D34: 57289 | E34: 13 | F34: 9 | G34: 4 | H34: 3 | I34: =E34+F34+G34+H34 -> 29
A35: Pasini | B35: Samuele | C35: 2148 | D35: 63595 | E35: 14 | F35: 2 | G35: 4 | H35: 3 | I35: =E35+F35+G35+H35 -> 23
A36: Pedori | B36: Alessandro | C36: 2148 | D36: 58376 | E36: 11 | F36: 6 | G36: 4 | H36: 3 | I36: =E36+F36+G36+H36 -> 24
A37: Scagliosi | B37: Marco | C37: 2148 | D37: 50761 | E37: 9 | F37: 9 | G37: 3 | H37: 3 | I37: =E37+F37+G37+H37 -> 24
A38: Semeraro | B38: Gianpiero | C38: 2148 | D38: 60384 | E38: 8 | F38: 6 | G38: 3 | H38: 3 | I38: =E38+F38+G38+H38 -> 20
A39: Zaghini | B39: Fabio | C39: 2148 | D39: 45944 | E39: 9 | F39: 7 | G39: 2 | H39: 3 | I39: =E39+F39+G39+H39 -> 21