A1: Ricerca Operativa V-O
A2: Prova Scritta del 18 Ottobre 2002
A4: Validita': fino a Gennaio 2003
A5: Visione degli elaborati e orali:Venerdi' 25 Ottobre 2002, ore 15.00 Aula 8.1
A6: Prossimi appelli: 17 Dicembre (scritto), 20 Dicembre (orale)
A7: 10 Gennaio (scritto), 15 Gennaio (orale)
A8: Appelli successivi: Aprile, Giugno, Luglio
A10: matricola | B10: Cognome | C10: Nome | D10: 1 | E10: 2 | F10: 3 | G10: bonus | H10: voto
A11: 2146050162 | B11: BACCARI | C11: ANTONIO | D11: 7 | E11: 9 | F11: 5 | G11: 3 | H11: =D11+E11+F11+G11 -> 24
A12: 2148060088 | B12: BARBATI | C12: MASSIMO | D12: 8 | E12: 9 | F12: 4 | G12: 3 | H12: =D12+E12+F12+G12 -> 24
A13: 2148063651 | B13: BARTOLUCCI | C13: SAURO | D13: 14 | E13: 9 | F13: 5 | G13: 3 | H13: =D13+E13+F13+G13 -> 31
A14: 2148059143 | B14: BENINCASA | C14: FRANCESCO | D14: 5 | E14: 4 | F14: 2 | G14: 0 | H14: Insuff.
A15: 2148053328 | B15: BORGHI | C15: EMILIANO | D15: 5 | E15: 8 | F15: 6 | G15: 3 | H15: =D15+E15+F15+G15 -> 22
A16: 2148064277 | B16: BOTTURA | C16: FABIO | D16: 14 | E16: 9 | F16: 6 | G16: 3 | H16: =D16+E16+F16+G16 -> 32
A17: 2148050346 | B17: BOZZINI | C17: ROSSELLA | D17: 8 | E17: 6 | F17: 6 | G17: 3 | H17: =D17+E17+F17+G17 -> 23
A18: 2148064086 | B18: BURATTINI | C18: GIACOMO | D18: 14 | E18: 9 | F18: 6 | G18: 3 | H18: =D18+E18+F18+G18 -> 32
A19: 2148063593 | B19: CAFINI | C19: OMAR | D19: 10 | E19: 8 | F19: 5 | G19: 3 | H19: =D19+E19+F19+G19 -> 26
A20: 2148063609 | B20: COLANGELO | C20: CESARE NICOLAI | D20: 9 | E20: 7 | F20: 3 | G20: 3 | H20: =D20+E20+F20+G20 -> 22
A21: 2146064142 | B21: DE BIAGGI | C21: MATTEO | D21: 12 | E21: 9 | F21: 4 | G21: 0 | H21: =D21+E21+F21+G21 -> 25
A22: 2108052186 | B22: DI PEDE | C22: ANTONELLO | D22: 7 | E22: 5 | F22: 3 | G22: 3 | H22: =D22+E22+F22+G22 -> 18
A23: 2148059921 | B23: GARUTI | C23: MAURO | D23: 12 | E23: 5 | F23: 6 | G23: 3 | H23: =D23+E23+F23+G23 -> 26
A24: 2148050684 | B24: GASPARRONI | C24: PAOLO | D24: 4 | E24: 6 | F24: 5 | G24: 3 | H24: =D24+E24+F24+G24 -> 18
A25: 2148057615 | B25: GRILLINI | C25: GIORGIO | D25: 6 | E25: 3 | F25: 6 | G25: 3 | H25: =D25+E25+F25+G25 -> 18
A26: 2148054385 | B26: LANZONI | C26: VERONICA | D26: 5 | E26: 8 | F26: 2 | G26: 3 | H26: =D26+E26+F26+G26 -> 18
A27: 2148059234 | B27: LODI | C27: DEBORAH | D27: 13 | E27: 6 | F27: 6 | G27: 3 | H27: =D27+E27+F27+G27 -> 28
A28: 2148064180 | B28: MEARELLI | C28: GABRIELE | D28: 13 | E28: 2 | F28: 6 | G28: 3 | H28: =D28+E28+F28+G28 -> 24
A29: 2143057210 | B29: MURETTO | C29: GIOVANNI | D29: 10 | E29: 3 | F29: 6 | G29: 3 | H29: =D29+E29+F29+G29 -> 22
A30: 2108059628 | B30: PALMISANO | C30: MARIA SCALA | D30: 2 | E30: 6 | F30: 6 | G30: 3 | H30: =D30+E30+F30+G30 -> 17 | I30: *
A31: 2148060742 | B31: PIRCHER | C31: THOMAS | D31: 12 | E31: 6 | F31: 5 | G31: 3 | H31: =D31+E31+F31+G31 -> 26
A32: 2148059399 | B32: ROSSINI | C32: FRANCESCO | D32: 4 | E32: 6 | F32: 5 | G32: 3 | H32: =D32+E32+F32+G32 -> 18
A33: 2148045756 | B33: STRACCIA | C33: DAVIDE | D33: 9 | E33: 3 | F33: 4 | G33: 3 | H33: =D33+E33+F33+G33 -> 19
A34: 2148064278 | B34: TONAZZOLLI | C34: MATTEO | D34: 9 | E34: 8 | F34: 4 | G34: 3 | H34: =D34+E34+F34+G34 -> 24
A35: 2148064608 | B35: UGOLINI | C35: FRANCESCO | D35: 4 | E35: 5 | F35: 6 | G35: 3 | H35: =D35+E35+F35+G35 -> 18
A36: 900001837 | B36: ZEN | C36: LEONARDO | D36: 4 | E36: 8 | F36: 5 | G36: 3 | H36: =D36+E36+F36+G36 -> 20
A37: * Il 25 Ottobre comunichi se accetta o preferisce insufficienza e bonus