A1: Prova Scritta di Ricerca Operativa del 15 Febbraio 2001
A2: (Informatica, Elettronica, Telecomunicazioni)
A4: Validita': fino alla sessione estiva A.A. 2000/2001
A5: Visione degli elaborati e orali: Giovedi' 22 Febbraio 2001, ore 15.00 Aula 6.2
A6: Prossimi appelli: Maggio/Giugno, Giugno/Luglio
A9: Cognome | B9: Nome | C9: cdl | D9: matricola | E9: 1 | F9: 2 | G9: 3 | H9: bonus | I9: voto
A10: Agostini | B10: Luca | C10: 2148 | D10: 61812 | E10: 10 | F10: 0 | G10: 12 | H10: 3 | I10: =E10+F10+G10+H10 -> 25
A11: Artuso | B11: Matteo | C11: 2148 | D11: 52603 | E11: 10 | F11: 2 | G11: 3 | H11: 3 | I11: =E11+F11+G11+H11 -> 18
A12: Baratta | B12: Fabio | C12: 2148 | D12: 54196 | E12: 14 | F12: 3 | G12: 10 | H12: 3 | I12: =E12+F12+G12+H12 -> 30
A13: Battaglino | B13: Andrea | C13: 2148 | D13: 61302 | E13: 13 | F13: 2 | G13: 11 | H13: 3 | I13: =E13+F13+G13+H13 -> 29
A14: Bellodi | B14: Elia | C14: 2148 | D14: 57250 | E14: 15 | F14: 3 | G14: 4 | H14: 3 | I14: =E14+F14+G14+H14 -> 25
A15: Bertorelli | B15: Simone | C15: 2148 | D15: 62266 | E15: 10 | F15: 2 | G15: 0 | I15: Insuff.
A16: Boscolo | B16: Michele | C16: 2148 | D16: 61433 | E16: 6 | F16: 0 | G16: 4 | I16: Insuff.
A17: Bovoli | B17: Francesco | C17: 2146 | D17: 61296 | E17: 8 | F17: 0 | G17: 12 | H17: 3 | I17: =E17+F17+G17+H17 -> 23
A18: Calabrese | B18: Rolando | E18: 1 | F18: 0 | G18: 1 | I18: Insuff.
A19: Campana | B19: Omar | C19: 2148 | D19: 57422 | E19: 9 | F19: 0 | G19: 12 | H19: 3 | I19: =E19+F19+G19+H19 -> 24
A20: Caselli | B20: Alessandro | C20: 2148 | D20: 900000027 | E20: 9 | F20: 3 | G20: 12 | H20: 3 | I20: =E20+F20+G20+H20 -> 27
A21: Cesari | B21: Andrea | C21: 2108 | D21: 45755 | E21: 15 | F21: 3 | G21: 12 | H21: 3 | I21: =E21+F21+G21+H21 -> 33
A22: Clo' | B22: Davide | C22: 2148 | D22: 60138 | E22: 12 | F22: 3 | G22: 4 | H22: 3 | I22: =E22+F22+G22+H22 -> 22
A23: Di Florio | B23: Maurizio | C23: 2148 | D23: 58802 | E23: 11 | F23: 0 | G23: 10 | H23: 3 | I23: =E23+F23+G23+H23 -> 24
A24: Drudi | B24: Maria Elena | C24: 2148 | D24: 50743 | E24: 4 | F24: 0 | G24: 10 | H24: 3 | I24: =E24+F24+G24+H24 -> 17 | J24: *
A25: Fabbri | B25: Fabio | E25: 10 | F25: 0 | G25: 12 | H25: 0 | I25: =E25+F25+G25+H25 -> 22
A26: Falconi | B26: Riccardo | C26: 2148 | D26: 61808 | E26: 11 | F26: 3 | G26: 3 | H26: 3 | I26: =E26+F26+G26+H26 -> 20
A27: Foschini | B27: Luca | C27: 2146 | D27: 62555 | E27: 11 | F27: 1 | G27: 8 | H27: 3 | I27: =E27+F27+G27+H27 -> 23
A28: Gordini | B28: Angelo | C28: 2148 | D28: 59483 | E28: 9 | F28: 3 | G28: 11 | H28: 0 | I28: =E28+F28+G28+H28 -> 23
A29: Guzzetti | B29: Roberto | C29: 2148 | D29: 55665 | E29: 14 | F29: 2 | G29: 11 | H29: 3 | I29: =E29+F29+G29+H29 -> 30
A30: Leoni | B30: Antonio | C30: 2148 | D30: 51738 | E30: 5 | F30: 0 | G30: 11 | H30: 3 | I30: =E30+F30+G30+H30 -> 19
A31: Linari | B31: Alessandro | C31: 2108 | D31: 60570 | E31: 15 | F31: 3 | G31: 3 | H31: 3 | I31: =E31+F31+G31+H31 -> 24
A32: Lucente | B32: Gianluca | C32: 2148 | D32: 61919 | E32: 14 | F32: 3 | G32: 11 | H32: 3 | I32: =E32+F32+G32+H32 -> 31
A33: Malatesta | B33: Alessandro | C33: 2148 | D33: 50488 | E33: 11 | F33: 0 | G33: 12 | H33: 3 | I33: =E33+F33+G33+H33 -> 26
A34: Malavolta | B34: Antonella | C34: 2148 | D34: 60297 | E34: 9 | F34: 1 | G34: 4 | H34: 3 | I34: =E34+F34+G34+H34 -> 17 | J34: *
A35: Melchiori | B35: Simone | C35: 900 | D35: 33 | E35: 8 | F35: 3 | G35: 11 | H35: 3 | I35: =E35+F35+G35+H35 -> 25
A36: Montosi | B36: Piero | C36: 2148 | D36: 52831 | E36: 8 | F36: 0 | G36: 11 | H36: 3 | I36: =E36+F36+G36+H36 -> 22
A37: Moretti | B37: Carlo | C37: 2148 | D37: 61254 | E37: 9 | F37: 3 | G37: 10 | H37: 3 | I37: =E37+F37+G37+H37 -> 25
A38: Mortellaro | B38: Franco | C38: 2148 | D38: 52512 | E38: 11 | F38: 0 | G38: 12 | H38: 0 | I38: =E38+F38+G38+H38 -> 23
A39: Napolitano | B39: Marco | C39: 2148 | D39: 60026 | E39: 4 | F39: 2 | G39: 0 | I39: Insuff.
A40: Palazzani | B40: Matteo | C40: 2148 | D40: 60396 | E40: 14 | F40: 2 | G40: 12 | H40: 3 | I40: =E40+F40+G40+H40 -> 31
A41: Pezzi | B41: Alessandro | C41: 2148 | D41: 54265 | E41: 13 | F41: 3 | G41: 8 | H41: 3 | I41: =E41+F41+G41+H41 -> 27
A42: Pochi | B42: Serena | C42: 2148 | D42: 62262 | E42: 10 | F42: 2 | G42: 12 | H42: 3 | I42: =E42+F42+G42+H42 -> 27
A43: Scardovi | B43: Elisa | C43: 2106 | D43: 60343 | E43: 7 | F43: 3 | G43: 11 | H43: 3 | I43: =E43+F43+G43+H43 -> 24
A44: Tardioli | B44: Danilo | C44: 2148 | D44: 62976 | E44: 6 | F44: 2 | G44: 0 | I44: Insuff.
A45: Venni | B45: Alessandro | C45: 2148 | D45: 55408 | E45: 13 | F45: 2 | G45: 9 | H45: 3 | I45: =E45+F45+G45+H45 -> 27
A46: Venturi | B46: Filippo | C46: 2148 | D46: 60084 | E46: 14 | F46: 2 | G46: 11 | H46: 3 | I46: =E46+F46+G46+H46 -> 30
A47: Vergini | B47: Daniele | C47: 2148 | D47: 59329 | E47: 12 | F47: 1 | G47: 3 | H47: 3 | I47: =E47+F47+G47+H47 -> 19
A49: * Il 22 Febbraio comunichi se preferisce accettare o rifiutare e mantenere il bonus.