A1: Ricerca Operativa (Vecchio Ordinamento)
A2: Prova Scritta del 23 Luglio 2002
A4: Validita': fino alla Sessione Autunnale 2002
A5: Visione degli elaborati e orali:Venerdi' 26 Luglio 2002, ore 14.30, Aula 6.1
A6: Prossimi appelli: 16 Settembre, Ottobre
A8: matricola | B8: Cognome | C8: Nome | D8: 1 | E8: 2 | F8: 3 | G8: bonus | H8: voto
A10: 2148064074 | B10: ANGIONE | C10: GIACOMO | D10: 15 | E10: 7 | F10: 6 | G10: 3 | H10: =D10+E10+F10+G10 -> 31
A11: 2148064267 | B11: BALDO | C11: EMILIANO | D11: 14 | E11: 7 | F11: 5 | G11: 3 | H11: =D11+E11+F11+G11 -> 29
A12: 2148063410 | B12: BARTOLINI | C12: ILIAS | D12: 9 | E12: 6 | F12: 3 | G12: 3 | H12: =D12+E12+F12+G12 -> 21
A13: 2148061594 | B13: CAMPAGNA | C13: TATIANA | D13: 12 | E13: 5 | F13: 6 | G13: 3 | H13: =D13+E13+F13+G13 -> 26
A14: 2108060439 | B14: CECERE | C14: ANTONIO | D14: 10 | E14: 6 | F14: 0 | G14: 3 | H14: =D14+E14+F14+G14 -> 19
A15: 2148064120 | B15: CIANI | C15: FABIO | D15: 12 | E15: 5 | F15: 4 | G15: 3 | H15: =D15+E15+F15+G15 -> 24
A16: 2148062464 | B16: CLEMENTELLI | C16: GRAZIANO | D16: 13 | E16: 6 | F16: 5 | G16: 3 | H16: =D16+E16+F16+G16 -> 27
A17: 2148064152 | B17: COLOMBARI | C17: ROBERTO | D17: 10 | E17: 1 | F17: 3 | G17: 3 | H17: =D17+E17+F17+G17 -> 17 | I17: *
A18: 2148053824 | B18: GAETANI | C18: MATTEO | D18: 11 | E18: 6 | F18: 5 | G18: 3 | H18: =D18+E18+F18+G18 -> 25
A19: 2148045857 | B19: GHERARDI | C19: ALESSANDRO | D19: 12 | E19: 6 | F19: 1 | G19: 0 | H19: =D19+E19+F19+G19 -> 19
A20: 900001870 | B20: GURNARI | C20: VINCENZO | D20: 10 | E20: 3 | F20: 5 | G20: 3 | H20: =D20+E20+F20+G20 -> 21
A21: 2148057205 | B21: INGIANNI | C21: FILIPPO | D21: 13 | E21: 4 | F21: 6 | G21: 3 | H21: =D21+E21+F21+G21 -> 26
A22: 2148063772 | B22: LASAGNI | C22: GABRIELE | D22: 14 | E22: 7 | F22: 6 | G22: 3 | H22: =D22+E22+F22+G22 -> 30
A23: 2148057073 | B23: LUZZI | C23: VALERIO | D23: 10 | E23: 5 | F23: 6 | G23: 3 | H23: =D23+E23+F23+G23 -> 24
A24: 2148061645 | B24: MARANI | C24: MARCO | D24: 12 | E24: 8 | F24: 2 | G24: 3 | H24: =D24+E24+F24+G24 -> 25
A25: 2006040703 | B25: MEDOS | C25: ALESSANDRO | D25: 5 | E25: 0 | F25: 4 | G25: 0 | H25: Insuff.
A26: 2146061985 | B26: MERIGHI | C26: FRANCESCA | D26: 12 | E26: 5 | F26: 3 | G26: 3 | H26: =D26+E26+F26+G26 -> 23
A27: 2148063843 | B27: MUCCIOLI | C27: IVO | D27: 14 | E27: 8 | F27: 5 | G27: 3 | H27: =D27+E27+F27+G27 -> 30
A28: 2148063595 | B28: PASINI | C28: SAMUELE | D28: 12 | E28: 8 | F28: 5 | G28: 0 | H28: =D28+E28+F28+G28 -> 25
A29: 2148048027 | B29: RIDOLFI | C29: DIMITRI | D29: 12 | E29: 7 | F29: 6 | G29: 3 | H29: =D29+E29+F29+G29 -> 28
A30: 2148064110 | B30: SERAFINI | C30: FILIPPO | D30: 13 | E30: 7 | F30: 3 | G30: 3 | H30: =D30+E30+F30+G30 -> 26
A31: 2148060551 | B31: STROVEGLI | C31: FABIO | D31: 6 | E31: 6 | F31: 4 | G31: 3 | H31: =D31+E31+F31+G31 -> 19
A32: 2148048045 | B32: TOMESANI | C32: MASSIMILIANO | D32: 6 | E32: 9 | F32: 4 | G32: 3 | H32: =D32+E32+F32+G32 -> 22
A33: 900001837 | B33: ZEN | C33: LEONARDO | D33: 6 | E33: 3 | F33: 2 | G33: 0 | H33: Insuff.
A35: * Il 26 Luglio comunichi se accetta o preferisce insufficienza e bonus