A1: Ricerca Operativa V-O
A2: Prova Scritta del 17 Dicembre 2002
A4: Validita': fino a Aprile 2003
A5: Visione degli elaborati e orali:Venerdi' 20 Dicembre 2002, ore 15.00 Aula E1.B
A6: Prossimi appelli: Gennaio, Aprile
A8: matricola | B8: Cognome | C8: Nome | D8: 1 | E8: 2 | F8: 3 | G8: bonus | H8: voto
A9: 2148061121 | B9: BOSELLI | C9: SIMONE | D9: 11 | E9: 6 | F9: 8 | G9: 3 | H9: =D9+E9+F9+G9 -> 28
A10: 2148052029 | B10: CASADEI | C10: CRISTIANO | D10: 5 | E10: 5 | F10: 8 | G10: 3 | H10: =D10+E10+F10+G10 -> 21
A11: 2148063953 | B11: CORVINI | C11: MARCO | D11: 7 | E11: 7 | F11: 8 | G11: 3 | H11: =D11+E11+F11+G11 -> 25
A12: 2148064391 | B12: COVA | C12: MARCO | D12: 11 | G12: 1.5 | H12: 25
A13: 2108052469 | B13: DALL'OLIO | C13: FEDERICO | D13: 1 | E13: 2 | F13: 2 | H13: Insuff.
A14: 2143061387 | B14: DEL BALDO | C14: ALESSANDRO | D14: 6 | E14: 5 | F14: 5 | G14: 3 | H14: =D14+E14+F14+G14 -> 19
A15: 2148055648 | B15: LANDI | C15: TIZIANA | D15: 10 | E15: 5 | F15: 3 | G15: 3 | H15: =D15+E15+F15+G15 -> 21
A16: 2148063520 | B16: LANDINI | C16: ALEX | D16: 13 | E16: 7 | F16: 8 | G16: 3 | H16: =D16+E16+F16+G16 -> 31
A17: 2148051781 | B17: LODI RIZZINI | C17: ENZO | D17: 8 | E17: 5 | F17: 4 | G17: 3 | H17: =D17+E17+F17+G17 -> 20
A18: 2148048390 | B18: MASSACESI | C18: ITALO | D18: 5 | E18: 5 | F18: 8 | G18: 3 | H18: =D18+E18+F18+G18 -> 21
A19: 2108059204 | B19: ORTOLANI | C19: MAURIZIO | D19: 10 | E19: 0 | F19: 8 | G19: 3 | H19: =D19+E19+F19+G19 -> 21
A20: 2148059715 | B20: PALAZZI | C20: MARA | D20: 2 | E20: 5 | F20: 8 | G20: 3 | H20: =D20+E20+F20+G20 -> 18
A21: 2148050687 | B21: PARINI | C21: STEFANO | D21: 11 | E21: 6 | F21: 4 | G21: 3 | H21: =D21+E21+F21+G21 -> 24
A22: 2148048373 | B22: PASSERINI | C22: ALESSANDRO | D22: 9 | E22: 4 | F22: 8 | G22: 3 | H22: =D22+E22+F22+G22 -> 24
A23: 2108056927 | B23: SCALORBI | C23: LUCA | D23: 2 | E23: 6 | F23: 7 | G23: 3 | H23: =D23+E23+F23+G23 -> 18
A24: 2148064608 | B24: UGOLINI | C24: FRANCESCO | D24: 10 | E24: 0 | F24: 3 | G24: 0 | H24: =D24+E24+F24+G24 -> 13