A1: Prova Scritta di Ricerca Operativa del 12 Ottobre 2001
A2: (Informatica, Elettronica, Telecomunicazioni)
A4: Validita': fino alla sessione invernale A.A. 2000/2001
A5: Visione degli elaborati e orali: Venerdi' 19 Ottobre 2001, ore 17.00, Aula 6.1
A6: Prossimi appelli: 18 Dicembre ore 16 Aula 6.2 (solo orale)
A7: 14 Gennaio pomeriggio (scritto)
A8: 18 Gennaio pomeriggio (orale)
A9: Febbraio (scritto+orale)
A11: Cognome | B11: Nome | C11: cdl | D11: matricola | E11: 1 | F11: 2 | G11: 3 | H11: bonus | I11: voto
A12: Cacciari | B12: Davide | C12: 2148 | D12: 54660 | E12: 13 | F12: 0 | G12: 11 | H12: 3 | I12: =E12+F12+G12+H12 -> 27
A13: Cordella | B13: Teodoro | C13: 2148 | D13: 53807 | E13: 6 | F13: 0 | G13: 4 | I13: Insuff.
A14: De Lellis | B14: Giuseppe | C14: 2108 | D14: 59852 | E14: 8 | F14: 2 | G14: 4 | H14: 3 | I14: =E14+F14+G14+H14 -> 17 | J14: *
A15: Fioretti | B15: Alessandro | C15: 2148 | D15: 62063 | E15: 8 | F15: 0 | G15: 3 | I15: Insuff.
A16: Giovannini | B16: Alessandro | C16: 2148 | D16: 62686 | E16: 7 | F16: 0 | G16: 3 | H16: 3 | I16: Insuff.
A17: Magistretti | B17: Eugenio | C17: 2148 | D17: 62777 | E17: 13 | F17: 3 | G17: 12 | H17: 3 | I17: =E17+F17+G17+H17 -> 31
A18: Matta | B18: Gabriele | C18: 2108 | D18: 59452 | E18: 11 | F18: 1 | G18: 5 | H18: 3 | I18: =E18+F18+G18+H18 -> 20
A19: Mazzi | B19: Michele | C19: 2163 | D19: 61427 | E19: 13 | F19: 0 | G19: 12 | H19: 3 | I19: =E19+F19+G19+H19 -> 28
A20: Modena | B20: Stefano | C20: 2148 | D20: 60591 | E20: 13 | F20: 0 | G20: 10 | H20: 3 | I20: =E20+F20+G20+H20 -> 26
A21: Montalti | B21: Filippo | C21: 2146 | D21: 59391 | E21: 10 | F21: 2 | G21: 4 | H21: 3 | I21: =E21+F21+G21+H21 -> 19
A22: Nervegna | B22: Fabrizio | C22: 2108 | D22: 53022 | E22: 6 | F22: 1 | G22: 10 | H22: 3 | I22: =E22+F22+G22+H22 -> 20
A23: Perticarini | B23: Emanuele | C23: 2148 | D23: 58261 | E23: 13 | F23: 0 | G23: 2 | H23: 3 | I23: =E23+F23+G23+H23 -> 18
A24: Roma | B24: Claudio | C24: 2148 | D24: 55942 | E24: 14 | F24: 3 | G24: 5 | H24: 3 | I24: =E24+F24+G24+H24 -> 25
A25: Romagnoli | B25: Roberta | C25: 2148 | D25: 61583 | E25: 11 | F25: 0 | G25: 12 | H25: 3 | I25: =E25+F25+G25+H25 -> 26
A26: Ruggeri | B26: Alessio | C26: 2148 | D26: 58573 | E26: 13 | F26: 0 | G26: 7 | H26: 3 | I26: =E26+F26+G26+H26 -> 23
A27: Straccia | B27: Davide | C27: 2148 | D27: 45756 | E27: 0 | F27: 2 | G27: 7 | I27: Insuff.
A28: Tramontani | B28: Andrea | C28: 2148 | D28: 62162 | E28: 15 | F28: 2 | G28: 5 | H28: 3 | I28: =E28+F28+G28+H28 -> 25
A29: Tresoldi | B29: Vincenzo | C29: 2108 | D29: 52296 | E29: 12 | F29: 0 | G29: 10 | H29: 3 | I29: =E29+F29+G29+H29 -> 25
A30: Ubaldi | B30: Guglielmo | C30: 2148 | D30: 61841 | E30: 13 | F30: 0 | G30: 3 | H30: 3 | I30: =E30+F30+G30+H30 -> 19
A31: Valisi | B31: Sergio | C31: 2108 | D31: 60122 | E31: 15 | F31: 3 | G31: 12 | H31: 3 | I31: =E31+F31+G31+H31 -> 33
A32: Villani | B32: James | C32: 2148 | D32: 52706 | E32: 5 | F32: 0 | G32: 10 | H32: 3 | I32: =E32+F32+G32+H32 -> 18
A33: Visciotti | B33: Franco | C33: 2148 | D33: 52586 | E33: 10 | F33: 2 | G33: 3 | H33: 3 | I33: =E33+F33+G33+H33 -> 18
A34: * Il 12 Luglio comunichi se accetta o preferisce insufficienza e bonus