A1: Prova Scritta di Ricerca Operativa del 13 Settembre 2001
A2: (Informatica, Elettronica, Telecomunicazioni)
A4: Validita': fino alla sessione invernale A.A. 2000/2001
A5: Visione degli elaborati e orali: Mercoledi' 19 Settembre 2001, ore 15.00, Aula 6.1
A6: Prossimi appelli: 12 Ottobre (scritto) (data da confermare)
A7: Ottobre (orale), Gennaio (scritto+orale)
A9: Cognome | B9: Nome | C9: cdl | D9: matricola | E9: 1 | F9: 2 | G9: 3 | H9: bonus | I9: voto
A10: Cannone | B10: Amedeo | C10: 2148 | D10: 59249 | E10: 11 | F10: 8 | G10: 4 | H10: 3 | I10: =E10+F10+G10+H10 -> 26
A11: Foschini | B11: Luca | C11: 2146 | D11: 62555 | E11: 14 | F11: 8 | G11: 5 | H11: 0 | I11: =E11+F11+G11+H11 -> 27
A12: Giannelli | B12: Carlo | C12: 2148 | D12: 61360 | E12: 13 | F12: 9 | G12: 5 | H12: 3 | I12: =E12+F12+G12+H12 -> 30
A13: Lucci | B13: Giacomo | C13: 2148 | D13: 61451 | E13: 15 | F13: 8 | G13: 5 | H13: 3 | I13: =E13+F13+G13+H13 -> 31
A14: Lupo | B14: Quintino Lucio | C14: 2148 | D14: 46351 | E14: 4 | F14: 8 | G14: 5 | H14: 3 | I14: =E14+F14+G14+H14 -> 20
A15: Milani | B15: Stefano | C15: 2006 | D15: 40585 | E15: 2 | F15: 8 | G15: 5 | H15: 3 | I15: =E15+F15+G15+H15 -> 18
A16: Monticelli | B16: Ivan | C16: 2148 | D16: 61766 | E16: 8 | F16: 4 | G16: 3 | H16: 3 | I16: =E16+F16+G16+H16 -> 18
A17: Moretti | B17: Carlo | C17: 2148 | D17: 61254 | E17: 7 | F17: 9 | G17: 5 | H17: 0 | I17: =E17+F17+G17+H17 -> 21
A18: Panzacchi | B18: Romano | C18: 2148 | D18: 61593 | E18: 6 | F18: 8 | G18: 2 | H18: 3 | I18: =E18+F18+G18+H18 -> 19
A19: Pazzi | B19: Katia | C19: 2148 | D19: 47900 | E19: 1 | F19: 9 | G19: 5 | H19: 3 | I19: =E19+F19+G19+H19 -> 18
A20: Ragazzini | B20: Taymer | C20: 2148 | D20: 57778 | E20: 6 | F20: 6 | G20: 3 | H20: 3 | I20: =E20+F20+G20+H20 -> 18
A21: Santi | B21: Augusto | C21: 2106 | D21: 44460 | E21: 1 | F21: 9 | G21: 5 | H21: 3 | I21: =E21+F21+G21+H21 -> 18
A22: Tardioli | B22: Danilo | C22: 2148 | D22: 62976 | E22: 1 | F22: 5 | G22: 1 | I22: Insuff.