A1: Prova Scritta di Ricerca Operativa del 13 Ottobre 2000
A2: (Informatica, Elettronica, Telecomunicazioni)
A4: Validita': fino alla sessione invernale A.A. 1999/2000
A5: Visione degli elaborati e orali: Venerdi' 20 Ottobre 2000, ore 16.00 Aula 6.1
A6: Prossimi appelli: Dicembre (solo orale, per chi ha gia lo scritto),
A7: Gennaio, Febbraio/Marzo
A9: Cognome | B9: Nome | C9: cdl | D9: matricola | E9: 1 | F9: 2 | G9: 3 | H9: bonus | I9: voto
A10: Bicchecchi | B10: Davide | C10: 2148 | D10: 52921 | E10: 9 | F10: 6 | G10: 9 | H10: 0 | I10: =E10+F10+G10+H10 -> 24
A11: Bortolini | B11: Nicola | C11: 2106 | D11: 46317 | E11: 0 | F11: 5 | G11: 9 | H11: 3 | I11: =E11+F11+G11+H11 -> 17 | J11: *
A12: Canotti | B12: Lorenzo | C12: 2148 | D12: 57658 | E12: 10 | F12: 2 | G12: 2 | H12: 3 | I12: =E12+F12+G12+H12 -> 17 | J12: *
A13: Ciaffoni | B13: Giovanni | C13: 2148 | D13: 58556 | E13: 9 | F13: 6 | G13: 3 | H13: 3 | I13: =E13+F13+G13+H13 -> 21
A14: Compagnucci | B14: Simone | C14: 2148 | D14: 44442 | E14: 9 | F14: 6 | G14: 4 | H14: 3 | I14: =E14+F14+G14+H14 -> 22
A15: Fiorellini | B15: Gabriele | C15: 2108 | D15: 46347 | E15: 5 | F15: 5 | G15: 9 | H15: 3 | I15: =E15+F15+G15+H15 -> 22
A16: Fortini | B16: Matteo | C16: 2148 | D16: 55367 | E16: 13 | F16: 6 | G16: 11 | H16: 3 | I16: =E16+F16+G16+H16 -> 33
A17: Girotti | B17: Simone | C17: 2148 | D17: 56194 | E17: 0 | F17: 3 | G17: 11 | H17: 3 | I17: =E17+F17+G17+H17 -> 17 | J17: *
A18: Marcolongo | B18: Giuditta | C18: 2146 | D18: 51953 | E18: 6 | F18: 2 | G18: 2 | H18: 0 | I18: Insuff.
A19: Migliori | B19: Giacomo | C19: 2148 | D19: 48020 | E19: 13 | F19: 6 | G19: 11 | H19: 3 | I19: =E19+F19+G19+H19 -> 33
A20: Mordenti | B20: Massimiliano | C20: 2148 | D20: 54533 | E20: 7 | F20: 6 | G20: 4 | H20: 3 | I20: =E20+F20+G20+H20 -> 20
A21: Palmeggiani | B21: Mario | C21: 2148 | D21: 48401 | E21: 9 | F21: 5 | G21: 1 | H21: 3 | I21: =E21+F21+G21+H21 -> 18
A22: Piancastelli | B22: Giulio | C22: 2148 | D22: 54500 | E22: 10 | F22: 6 | G22: 3 | H22: 0 | I22: =E22+F22+G22+H22 -> 19
A23: Pierini | B23: Virgilio | C23: 2148 | D23: 59773 | E23: 13 | F23: 5 | G23: 11 | H23: 3 | I23: =E23+F23+G23+H23 -> 32
A24: Poletti | B24: Francesco | C24: 2148 | D24: 60150 | E24: 9 | F24: 3 | G24: 3 | H24: 3 | I24: =E24+F24+G24+H24 -> 18
A25: Salgo | B25: Gabriele | C25: 2148 | D25: 59905 | E25: 10 | F25: 6 | G25: 3 | H25: 3 | I25: =E25+F25+G25+H25 -> 22
A26: Savelli | B26: Pietro | C26: 2148 | D26: 59309 | E26: 3 | F26: 2 | G26: 10 | H26: 3 | I26: =E26+F26+G26+H26 -> 18
A27: Taglioni | B27: Matteo | C27: 2143 | D27: 58666 | E27: 11 | F27: 5 | G27: 11 | H27: 0 | I27: =E27+F27+G27+H27 -> 27
A28: Turci | B28: Matteo | C28: 2148 | D28: 10379 | E28: 10 | F28: 5 | G28: 9 | H28: 3 | I28: =E28+F28+G28+H28 -> 27
A29: Vagnerini | B29: Giovanna | C29: 2108 | D29: 55977 | E29: 12 | F29: 5 | G29: 10 | H29: 3 | I29: =E29+F29+G29+H29 -> 30
A30: Vegetti | B30: Lorenzo | C30: 2148 | D30: 53335 | E30: 8 | F30: 4 | G30: 3 | H30: 3 | I30: =E30+F30+G30+H30 -> 18
A31: Venturi | B31: Filippo | C31: 2148 | D31: 60084 | E31: 7 | F31: 2 | G31: 5 | H31: 3 | I31: =E31+F31+G31+H31 -> 17 | J31: *
A33: * Il 20 Ottobre comunichi se preferisce accettare o rifiutare e mantenere il bonus.