A1: Prova scritta di Ricerca Operativa del 5 Luglio 2000
A2: (Informatica, Elettronica, Telecomunicazioni)
A4: Validita': fino alla sessione autunnale A.A. 1999/2000
A5: Visione degli elaborati e orali: Martedi' 11 Luglio 2000 ore 15.00 Aula 6.1
A6: Prossimi appelli: 13 Settembre (scritto), Ottobre, Gennaio
A8: Cognome | B8: Nome | C8: cdl | D8: matricola | E8: 1 | F8: 2 | G8: 3 | H8: bonus | I8: voto
A9: Allori | B9: Barbara | C9: 2148 | D9: 54643 | E9: 10 | F9: 9 | G9: 5 | H9: 0 | I9: =E9+F9+G9+H9 -> 24
A10: Bazzani | B10: Andrea | C10: 2103 | D10: 49713 | E10: 8 | F10: 10 | G10: 7 | H10: 3 | I10: =E10+F10+G10+H10 -> 28
A11: Bruno | B11: Pierluigi Nicola | C11: 2108 | D11: 41689 | E11: 9 | F11: 10 | G11: 7 | H11: 3 | I11: =E11+F11+G11+H11 -> 29
A12: Buffadini | B12: Nicola | C12: 2108 | D12: 52483 | E12: 11 | F12: 6 | G12: 4 | H12: 3 | I12: =E12+F12+G12+H12 -> 24
A13: Bullini | B13: Francesco | C13: 2148 | D13: 54439 | E13: 7 | F13: 0 | G13: 2 | H13: 3 | I13: Insufficiente
A14: Carlesso | B14: Riccardo | C14: 2148 | D14: 58421 | E14: 6 | F14: 9 | G14: 7 | H14: 3 | I14: =E14+F14+G14+H14 -> 25
A15: Ciaffoni | B15: Giovanni | C15: 2148 | D15: 58556 | E15: 5 | F15: 1 | G15: 2 | H15: 3 | I15: Insufficiente
A16: Fabbri | B16: Fabio | C16: 2006 | D16: 41672 | E16: 9 | F16: 7 | G16: 0 | H16: 3 | I16: =E16+F16+G16+H16 -> 19
A17: Ferretti | B17: Emil | C17: 2148 | D17: 58368 | E17: 6 | F17: 6 | G17: 2 | H17: 3 | I17: =E17+F17+G17+H17 -> 17 | J17: (*)
A18: Garoia | B18: Enrico | C18: 2148 | D18: 59644 | E18: 6 | F18: 8 | G18: 2 | H18: 3 | I18: =E18+F18+G18+H18 -> 19
A19: Governatori | B19: Christian | C19: 2148 | D19: 57729 | E19: 10 | F19: 3 | G19: 4 | H19: 3 | I19: =E19+F19+G19+H19 -> 20
A20: Grossi | B20: Veruska | C20: 2148 | D20: 56078 | E20: 11 | F20: 10 | G20: 2 | H20: 3 | I20: =E20+F20+G20+H20 -> 26
A21: Manaresi | B21: Marco | C21: 2006 | D21: 41958 | E21: 4 | F21: 3 | G21: 7 | H21: 3 | I21: =E21+F21+G21+H21 -> 17 | J21: (*)
A22: Manfroni | B22: Roberto | C22: 2108 | D22: 50520 | E22: 11 | F22: 9 | G22: 7 | H22: 3 | I22: =E22+F22+G22+H22 -> 30
A23: Medos | B23: Alessandro | C23: 2006 | D23: 40703 | E23: 1 | F23: 0 | G23: 5 | H23: 3 | I23: Insufficiente
A24: Melucci | B24: Paolo | C24: 2108 | D24: 43436 | E24: 7 | F24: 7 | G24: 7 | H24: 3 | I24: =E24+F24+G24+H24 -> 24
A25: Monduzzi | B25: Marina | C25: 2108 | D25: 42698 | E25: 5 | F25: 9 | G25: 7 | H25: 0 | I25: =E25+F25+G25+H25 -> 21
A26: (*)l'11 Luglio comunichi se preferisce accettare o avere insufficienza e mantenere il bonus