A1: Prova scritta di Ricerca Operativa del 20 Gennaio 2000
A2: (Informatica, Elettronica, Telecomunicazioni)
A4: Validita': fino alla sessione estiva A.A. 1999/2000
A5: Visione degli elaborati e orali: Martedi' 1 Febbraio 2000
A6: Prossimi appelli: meta' Febbraio, Maggio
A8: Cognome | B8: Nome | C8: cdl | D8: matricola | E8: 1 | F8: 2 | G8: 3 | H8: bonus | I8: voto
A9: Accorsi | B9: Stefano | C9: 2148 | D9: 55091 | E9: 7 | F9: 2 | G9: 3 | I9: Insuff.
A10: Bandini | B10: Matteo | C10: 2148 | D10: 52570 | E10: 8 | F10: 5 | G10: 7 | H10: 3 | I10: =E10+F10+G10+H10 -> 23
A11: Benelli | B11: Lucio | C11: 2108 | D11: 55390 | E11: 12 | F11: 10 | G11: 7 | H11: 3 | I11: =E11+F11+G11+H11 -> 32
A12: Bertuzzi | B12: Enzo | C12: 2108 | D12: 50749 | E12: 12 | F12: 6 | G12: 7 | H12: 3 | I12: =E12+F12+G12+H12 -> 28
A13: Bigotto | B13: Stefano | C13: 2148 | D13: 57648 | E13: 9 | F13: 3 | G13: 7 | H13: 3 | I13: =E13+F13+G13+H13 -> 22
A14: Bottacchiari | B14: Lorenzo | C14: 2108 | D14: 43560 | E14: 12 | F14: 10 | G14: 5 | H14: 3 | I14: =E14+F14+G14+H14 -> 30
A15: Bottura | B15: Nicola | C15: 2148 | D15: 58737 | E15: 12 | F15: 10 | G15: 4 | H15: 3 | I15: =E15+F15+G15+H15 -> 29
A16: Bucci | B16: Fabio | C16: 2148 | D16: 54389 | E16: 13 | F16: 10 | G16: 7 | H16: 0 | I16: =E16+F16+G16+H16 -> 30
A17: Cameli | B17: Nazario | C17: 2148 | D17: 56949 | E17: 12 | F17: 6 | G17: 6 | H17: 3 | I17: =E17+F17+G17+H17 -> 27
A18: Contini | B18: Gabriele | C18: 2148 | D18: 56590 | E18: 13 | F18: 10 | G18: 6 | H18: 3 | I18: =E18+F18+G18+H18 -> 32
A19: Dall'Olio | B19: Luca | C19: 2148 | D19: 55201 | E19: 10 | F19: 4 | G19: 7 | H19: 3 | I19: =E19+F19+G19+H19 -> 24
A20: De Tommasi | B20: Maurizio | C20: 2148 | D20: 56705 | E20: 4 | F20: 10 | G20: 7 | H20: 3 | I20: =E20+F20+G20+H20 -> 24
A21: Filippini | B21: Omar | C21: 2143 | D21: 57198 | E21: 13 | F21: 10 | G21: 7 | H21: 3 | I21: =E21+F21+G21+H21 -> 33
A22: Giudici | B22: Massimo | C22: 2148 | D22: 55084 | E22: 12 | F22: 7 | G22: 7 | H22: 3 | I22: =E22+F22+G22+H22 -> 29
A23: Ianieri | B23: Arnaldo | C23: 2148 | D23: 61007 | E23: 13 | F23: 10 | G23: 7 | H23: 3 | I23: =E23+F23+G23+H23 -> 33
A24: Lanzoni | B24: Claudio | C24: 2148 | D24: 50762 | E24: 12 | F24: 10 | G24: 5 | H24: 3 | I24: =E24+F24+G24+H24 -> 30
A25: Malagola | B25: Federico | C25: 2108 | D25: 45712 | E25: 0 | F25: 10 | G25: 7 | H25: 3 | I25: =E25+F25+G25+H25 -> 20
A26: Matano | B26: Andrea | C26: 2148 | D26: 59258 | E26: 11 | F26: 7 | G26: 2 | H26: 3 | I26: =E26+F26+G26+H26 -> 23
A27: Micolucci | B27: Mario | C27: 2146 | D27: 55755 | E27: 10 | F27: 3 | G27: 6 | H27: 3 | I27: =E27+F27+G27+H27 -> 22
A28: Paoli | B28: Andrea | C28: 2148 | D28: 55066 | E28: 9 | F28: 10 | G28: 5 | H28: 3 | I28: =E28+F28+G28+H28 -> 27
A29: Pederzini | B29: Andrea | C29: 2148 | D29: 57391 | E29: 7 | F29: 0 | G29: 7 | H29: 3 | I29: =E29+F29+G29+H29 -> 17 | J29: OK
A30: Pedori | B30: Alessandro | C30: 2148 | D30: 58396 | E30: 3 | F30: 7 | G30: 4 | H30: 0 | I30: Insuff.
A31: Raimondi | B31: Monica | C31: 2108 | D31: 56693 | E31: 4 | F31: 4 | G31: 7 | H31: 3 | I31: =E31+F31+G31+H31 -> 18
A32: Rombaldoni | B32: Fabio | C32: 2148 | D32: 56059 | E32: 10 | F32: 10 | G32: 7 | H32: 3 | I32: =E32+F32+G32+H32 -> 30
A33: Ruvinetti | B33: Silvia | C33: 2148 | D33: 51747 | E33: 13 | F33: 10 | G33: 7 | H33: 3 | I33: =E33+F33+G33+H33 -> 33
A34: Tenti | B34: Mirco | C34: 2148 | D34: 56527 | E34: 11 | F34: 2 | G34: 7 | H34: 3 | I34: =E34+F34+G34+H34 -> 23
A35: Terregna | B35: Giampiero | C35: 2006 | D35: 40371 | E35: 1 | F35: 4 | G35: 3 | H35: 0 | I35: Insuff.
A36: Vargiu | B36: Nicola | C36: 2148 | D36: 56704 | E36: 7 | F36: 9 | G36: 0 | H36: 3 | I36: =E36+F36+G36+H36 -> 19
A37: Zironi | B37: Andrea | C37: 2146 | D37: 50164 | E37: 10 | F37: 10 | G37: 6 | H37: 3 | I37: =E37+F37+G37+H37 -> 29
A39: * I'1 Febbraio comunichi se preferisce accettare o avere insufficienza e mantenere il bonus