A1: Ricerca Operativa (Vecchio Ordinamento)
A2: Prova Scritta del 10 Giugno 2002
A4: Validita': fino alla Sessione Autunnale 2002
A5: Visione degli elaborati e orali:Giovedi' 13 Giugno 2002, ore 16.00, Aula 6.2
A6: Prossimi appelli: 23 Luglio, Settembre
A8: matricola | B8: Cognome | C8: Nome | D8: 1 | E8: 2 | F8: 3 | G8: bonus | H8: voto
A10: 2148063696 | B10: LANUTI | C10: PIETRO | D10: 8 | E10: 5 | F10: 2 | G10: 3 | H10: =D10+E10+F10+G10 -> 18
A11: 2148064415 | B11: LUCCIARINI DE VINCENZI | C11: LORENZO | D11: 11 | E11: 8 | F11: 5 | G11: 3 | H11: =D11+E11+F11+G11 -> 27
A12: 2148063512 | B12: PETRELLI | C12: ALIOSCIA | D12: 14 | E12: 5 | F12: 4 | G12: 3 | H12: =D12+E12+F12+G12 -> 26
A13: 2148060386 | B13: SEMERARO | C13: PASQUALE | D13: 12 | E13: 6 | F13: 0 | G13: 3 | H13: =D13+E13+F13+G13 -> 21
A14: 2148062976 | B14: TARDIOLI | C14: DANILO | D14: 12 | E14: 6 | F14: 2 | G14: 3 | H14: =D14+E14+F14+G14 -> 23
A15: 2148061247 | B15: VACCARI | C15: STEFANO | D15: 13 | E15: 5 | F15: 4 | G15: 3 | H15: =D15+E15+F15+G15 -> 25