A1: Prova Scritta di Ricerca Operativa del 10 Gennaio 2001
A2: (Informatica, Elettronica, Telecomunicazioni)
A4: Validita': fino alla sessione estiva A.A. 2000/2001
A5: Visione degli elaborati e orali: Giovedi' 18 Gennaio 2001, ore 15.00 Aula 6.1
A6: Prossimi appelli: 15 Febbraio 2001, ore 15.00 (scritto)
A7: 22 Febbraio 2001 (orale)
A8: Maggio/Giugno, Giugno/Luglio
A10: Cognome | B10: Nome | C10: cdl | D10: matricola | E10: 1 | F10: 2 | G10: 3 | H10: bonus | I10: voto
A11: Beltrani | B11: Claudio | C11: 2148 | D11: 60055 | E11: 8 | F11: 7 | G11: 0 | H11: 3 | I11: =E11+F11+G11+H11 -> 18
A12: Bevilacqua | B12: Marco | C12: 2148 | D12: 59912 | E12: 15 | F12: 8 | G12: 6 | H12: 3 | I12: =E12+F12+G12+H12 -> 32
A13: Capiluppi | B13: Marta | C13: 2148 | D13: 61482 | E13: 10 | F13: 9 | G13: 6 | H13: 3 | I13: =E13+F13+G13+H13 -> 28
A14: Casali | B14: Luca | C14: 2148 | D14: 61109 | E14: 8 | F14: 9 | G14: 6 | H14: 3 | I14: =E14+F14+G14+H14 -> 26
A15: Chesani | B15: Federico | C15: 2148 | D15: 54547 | E15: 12 | F15: 9 | G15: 2 | H15: 3 | I15: =E15+F15+G15+H15 -> 26
A16: Nanetti | B16: Claudio | C16: 2148 | D16: 57965 | E16: 11 | F16: 8 | G16: 6 | H16: 3 | I16: =E16+F16+G16+H16 -> 28
A17: Ntogramatzidis | B17: Lorenzo | C17: 2148 | D17: 58640 | E17: 11 | F17: 8 | G17: 1 | H17: 3 | I17: =E17+F17+G17+H17 -> 23
A18: Ricciarelli | B18: Stefano | C18: 2148 | D18: 57359 | E18: 10 | F18: 8 | G18: 6 | H18: 3 | I18: =E18+F18+G18+H18 -> 27
A19: Spanò | B19: Fabio | C19: 2146 | D19: 56139 | E19: 8 | F19: 6 | G19: 6 | H19: 3 | I19: =E19+F19+G19+H19 -> 23