A1: Prova Scritta di Ricerca Operativa del 14 Gennaio 2002
A2: (Vecchio ordinamento: Informatica, Elettronica, Telecomunicazioni)
A4: Validita': fino alla sessione estiva A.A. 2001/2002
A5: Visione degli elaborati e orali: Venerdi' 18 Gennaio 2002, ore 14.00, Aula 6.2
A6: Prossimi appelli: 22 febbraio (da confermare), scritto
A7: circa una settimana dopo, orale
A8: fine Maggio (scritto+orale)
A9: Giugno o Luglio (scritto+orale)
A11: Cognome | B11: Nome | C11: cdl | D11: matricola | E11: 1 | F11: 2 | G11: 3 | H11: bonus | I11: voto
A12: Bottazzi | B12: Dario | C12: 2148 | D12: 56723 | E12: 9 | F12: 6 | G12: 7 | H12: 3 | I12: =E12+F12+G12+H12 -> 25
A13: Bragaglia | B13: Stefano | C13: 2148 | D13: 57782 | E13: 14 | F13: 6 | G13: 7 | H13: 3 | I13: =E13+F13+G13+H13 -> 30
A14: Calabrese | B14: Rolando | C14: 2148 | D14: 900000411 | E14: 9 | F14: 6 | G14: 5 | H14: 3 | I14: =E14+F14+G14+H14 -> 23
A15: Cammerucci | B15: Denis | C15: 2148 | D15: 63330 | E15: 13 | F15: 6 | G15: 5 | H15: 3 | I15: =E15+F15+G15+H15 -> 27
A16: Cattuto | B16: Francesco | C16: 2148 | D16: 63647 | E16: 11 | F16: 6 | G16: 7 | H16: 3 | I16: =E16+F16+G16+H16 -> 27
A17: Cavallaro | B17: Andrea | C17: 2148 | D17: 58312 | E17: 7 | F17: 6 | G17: 4 | H17: 3 | I17: =E17+F17+G17+H17 -> 20
A18: Damis | B18: Luigi | C18: 2148 | D18: 59569 | E18: 12 | F18: 6 | G18: 6 | H18: 3 | I18: =E18+F18+G18+H18 -> 27
A19: De Coi | B19: Juri Luca | C19: 2148 | D19: 64704 | E19: 14 | F19: 7 | G19: 5 | H19: 3 | I19: =E19+F19+G19+H19 -> 29
A20: D'Ercoli | B20: Moreno | C20: 2148 | D20: 63507 | E20: 10 | F20: 7 | G20: 7 | H20: 3 | I20: =E20+F20+G20+H20 -> 27
A21: Deromedis | B21: Sandro | C21: 2148 | D21: 61070 | E21: 11 | F21: 5 | G21: 6 | H21: 3 | I21: =E21+F21+G21+H21 -> 25
A22: Ferretti | B22: Emil | C22: 2148 | D22: 58368 | E22: 7 | F22: 5 | G22: 6 | H22: 0 | I22: =E22+F22+G22+H22 -> 18
A23: Gabbani | B23: Giorgio | C23: 2148 | D23: 63548 | E23: 14 | F23: 5 | G23: 6 | H23: 3 | I23: =E23+F23+G23+H23 -> 28
A24: Lucchi | B24: Andrea | C24: 2148 | D24: 63490 | E24: 8 | F24: 3 | G24: 7 | H24: 3 | I24: =E24+F24+G24+H24 -> 21
A25: Lucrezi | B25: Francesco | C25: 2148 | D25: 63645 | E25: 13 | F25: 6 | G25: 7 | H25: 3 | I25: =E25+F25+G25+H25 -> 29
A26: Malvisi | B26: Alessandro | C26: 2148 | D26: 61210 | E26: 12 | F26: 7 | G26: 5 | H26: 3 | I26: =E26+F26+G26+H26 -> 27
A27: Misuraca | B27: Rosario Marco | C27: 2148 | D27: 61376 | E27: 11 | F27: 8 | G27: 7 | H27: 3 | I27: =E27+F27+G27+H27 -> 29
A28: Montanari | B28: Gian Piero Matteo | C28: 2148 | D28: 59739 | E28: 7 | F28: 8 | G28: 6 | H28: 3 | I28: =E28+F28+G28+H28 -> 24
A29: Montosi | B29: Piero | C29: 2148 | D29: 52831 | E29: 9 | F29: 6 | G29: 7 | H29: 0 | I29: =E29+F29+G29+H29 -> 22
A30: Nerozzi | B30: Matteo | C30: 2148 | D30: 60028 | E30: 10 | F30: 5 | G30: 2 | H30: 3 | I30: =E30+F30+G30+H30 -> 20
A31: Righi | B31: Riccardo | C31: 2148 | D31: 63559 | E31: 12 | F31: 7 | G31: 7 | H31: 3 | I31: =E31+F31+G31+H31 -> 29
A32: Rondinini | B32: Gianni | C32: 2148 | D32: 54383 | E32: 12 | F32: 3 | G32: 3 | H32: 3 | I32: =E32+F32+G32+H32 -> 21
A33: Tampieri | B33: Riccardo | C33: 2148 | D33: 61560 | E33: 8 | F33: 7 | G33: 7 | H33: 3 | I33: =E33+F33+G33+H33 -> 25
A34: Tassetti | B34: Matteo | C34: 2148 | D34: 63925 | E34: 14 | F34: 7 | G34: 5 | H34: 3 | I34: =E34+F34+G34+H34 -> 29
A35: Testi | B35: Fabio | C35: 2148 | D35: 55045 | E35: 9 | F35: 6 | G35: 5 | H35: 3 | I35: =E35+F35+G35+H35 -> 23
A36: Verachi | B36: Stefania | C36: 2148 | D36: 48354 | E36: 13 | F36: 6 | G36: 6 | H36: 3 | I36: =E36+F36+G36+H36 -> 28
A37: Zamagni | B37: Fausto | C37: 2148 | D37: 50737 | E37: 14 | F37: 8 | G37: 7 | H37: 3 | I37: =E37+F37+G37+H37 -> 32