A2: Ricerca Operativa V-O
A3: Prova Scritta del 16 Settembre 2002
A5: Validita': fino a Febbraio 2003
A6: Visione degli elaborati e orali:Venerdi' 20 Settembre 2002, ore 16.00 Aula 6.1
A7: Prossimi appelli: Ottobre, Gennaio
A9: matricola | B9: Cognome | C9: Nome | D9: 1 | E9: 2 | F9: 3 | G9: bonus | H9: voto
A10: 2148061190 | B10: BALLONE | C10: PAOLO | D10: 10 | E10: 4 | G10: 3 | H10: =D10+E10+F10+G10 -> 17 | I10: *
A11: 2148061554 | B11: CICCONI | C11: GINEVRA | D11: 9 | E11: 9 | G11: 3 | H11: =D11+E11+F11+G11 -> 21
A12: 2148057633 | B12: CLEMENTI | C12: FABIO | D12: 4 | E12: 14 | G12: 3 | H12: =D12+E12+F12+G12 -> 21
A13: 2148062670 | B13: CORTESE | C13: SAVERIO | D13: 5 | E13: 15 | G13: 0 | H13: =D13+E13+F13+G13 -> 20
A14: 2148043411 | B14: CRESCENZI | C14: FRANCESCO | D14: 4 | E14: 15 | G14: 3 | H14: =D14+E14+F14+G14 -> 22
A15: 2148058251 | B15: D'ALESSANDRO | C15: PARIDE | D15: 6 | E15: 15 | G15: 3 | H15: =D15+E15+F15+G15 -> 24
A16: 2148048412 | B16: D'ELIA | C16: ROBERTO | D16: 3 | E16: 15 | G16: 3 | H16: =D16+E16+F16+G16 -> 21
A17: 2148064160 | B17: DI NICOLA | C17: VINCENZO MARIA | D17: 11 | E17: 15 | G17: 3 | H17: =D17+E17+F17+G17 -> 29
A18: 2148061505 | B18: DI PASQUALE | C18: MAURIZIO | D18: 7 | E18: 10 | G18: 3 | H18: =D18+E18+F18+G18 -> 20
A19: 2148058368 | B19: FERRETTI | C19: EMIL | D19: 13 | E19: 11 | G19: 0 | H19: =D19+E19+F19+G19 -> 24
A20: 2148050713 | B20: FILIPPINI | C20: ROBERTO | D20: 5 | E20: 15 | G20: 3 | H20: =D20+E20+F20+G20 -> 23
A21: 900004426 | B21: LAURIA | C21: MAURIZIO | D21: 7 | E21: 15 | G21: 3 | H21: =D21+E21+F21+G21 -> 25
A22: 2148063361 | B22: MENABENI | C22: ENRICO | D22: 15 | E22: 10 | G22: 3 | H22: =D22+E22+F22+G22 -> 28
A23: 2148058504 | B23: PARCA | C23: SIMONE | D23: 8 | E23: 9 | G23: 3 | H23: =D23+E23+F23+G23 -> 20
A24: 2148062010 | B24: PASINI | C24: ALBERTO | D24: 11 | E24: 15 | G24: 3 | H24: =D24+E24+F24+G24 -> 29
A25: 2148054957 | B25: RIMONDI | C25: SIMONE | D25: 7 | E25: 15 | G25: 3 | H25: =D25+E25+F25+G25 -> 25
A26: 2146064185 | B26: VENERUCCI | C26: LORENZO | D26: 10 | E26: 9 | G26: 3 | H26: =D26+E26+F26+G26 -> 22
A27: 2148057219 | B27: ZUCCHERELLI | C27: ANDREA | D27: 10 | E27: 9 | G27: 3 | H27: =D27+E27+F27+G27 -> 22
A29: * Il 20 Settembre comunichi se accetta o preferisce insufficienza e bonus