A1: Prova Scritta di Ricerca Operativa del 7 Giugno 2001
A2: (Informatica, Elettronica, Telecomunicazioni)
A4: Validita': fino alla sessione autunnale A.A. 2000/2001
A5: Visione degli elaborati e orali: Mercoledi' 13 Giugno 2001, ore 15.00, Aula 5.7
A6: Prossimi appelli: 5 Luglio (scritto), 12 Luglio (orale),
A7: 13 Settembre (scritto), 19 Settembre (orale)
A8: Ottobre, Gennaio
A9: Cognome | B9: Nome | C9: cdl | D9: matricola | E9: 1 | F9: 2 | G9: 3 | H9: bonus | I9: voto
A10: Cortese | B10: Saverio | C10: 2148 | D10: 62670 | E10: 9 | F10: 7 | H10: 3 | I10: =E10+F10+G10+H10 -> 19
A11: Di Carmine | B11: Antonio | C11: 2108 | D11: 58784 | E11: 17 | F11: 10 | H11: 3 | I11: =E11+F11+G11+H11 -> 30
A12: Franceschetti | B12: Luca | C12: 2148 | D12: 53222 | E12: 16 | F12: 4 | H12: 0 | I12: =E12+F12+G12+H12 -> 20
A13: Gherardi | B13: Alessandro | C13: 2148 | D13: 45857 | E13: 6 | F13: 11 | H13: 3 | I13: =E13+F13+G13+H13 -> 20
A14: Giacomelli | B14: Nicola | C14: 2148 | D14: 58399 | E14: 15 | F14: 8 | H14: 3 | I14: =E14+F14+G14+H14 -> 26
A15: Marcolongo | B15: Giuditta | C15: 2146 | D15: 51953 | E15: 3 | F15: 12 | H15: 3 | I15: =E15+F15+G15+H15 -> 18
A16: Ortoman | B16: Luca | C16: 2108 | D16: 56766 | E16: 10 | F16: 8 | H16: 3 | I16: =E16+F16+G16+H16 -> 21
A17: Piunti | B17: Michele | C17: 2148 | D17: 57571 | E17: 11 | F17: 11 | H17: 3 | I17: =E17+F17+G17+H17 -> 25
A18: Scartozzi | B18: Gian Luca | C18: 2106 | D18: 54343 | E18: 11 | F18: 10 | H18: 3 | I18: =E18+F18+G18+H18 -> 24
A19: Trombini | B19: Raffaele | C19: 2148 | D19: 52372 | E19: 5 | F19: 11 | H19: 3 | I19: =E19+F19+G19+H19 -> 19
A20: Visciotti | B20: Franco | C20: 2148 | D20: 52586 | E20: 4 | F20: 10 | H20: 3 | I20: =E20+F20+G20+H20 -> 17 | J20: *
A21: Vitale | B21: Filippo | C21: 2148 | D21: 56908 | E21: 15 | F21: 12 | H21: 3 | I21: =E21+F21+G21+H21 -> 30
A23: * Il 13 Giugno comunichi se accetta o preferisce insuffcienza e bonus