A1: Prova Scritta di Ricerca Operativa del 5 Luglio 2001
A2: (Informatica, Elettronica, Telecomunicazioni)
A4: Validita': fino alla sessione autunnale A.A. 2000/2001
A5: Visione degli elaborati e orali: Giovedi' 12 Luglio 2001, ore 15.00, Aula 5.6
A6: Prossimi appelli: 13 Settembre (scritto), 19 Settembre (orale)
A7: Ottobre, Gennaio
A9: Cognome | B9: Nome | C9: cdl | D9: matricola | E9: 1 | F9: 2 | G9: bonus | H9: voto
A10: Accorsi | B10: Stefano | C10: 2148 | D10: 55091 | E10: 12 | F10: 11 | G10: 0 | H10: =E10+F10+G10 -> 23
A11: Andreani | B11: Stefano | C11: 2148 | D11: 58449 | E11: 10 | F11: 10 | G11: 3 | H11: =E11+F11+G11 -> 23
A12: Boldura | B12: Davide | C12: 2148 | D12: 51759 | E12: 11 | F12: 11 | G12: 3 | H12: =E12+F12+G12 -> 25
A13: Boscolo | B13: Michele | C13: 2148 | D13: 61433 | E13: 11 | F13: 11 | G13: 3 | H13: =E13+F13+G13 -> 25
A14: Catalano | B14: Roberto | C14: 2146 | D14: 52464 | E14: 4 | F14: 12 | G14: 3 | H14: =E14+F14+G14 -> 19
A15: Costa | B15: Francesco | C15: 2148 | D15: 62898 | E15: 4 | F15: 14 | G15: 3 | H15: =E15+F15+G15 -> 21
A16: Dalmonte | B16: Vilmer | C16: 2148 | D16: 57237 | E16: 13 | F16: 10 | G16: 3 | H16: =E16+F16+G16 -> 26
A17: Di Massimo | B17: Vincenzo | C17: 2148 | D17: 50691 | E17: 8 | F17: 7 | G17: 3 | H17: =E17+F17+G17 -> 18
A18: Ferretti | B18: Emil | C18: 2148 | D18: 58368 | E18: 12 | F18: 4 | G18: 3 | H18: =E18+F18+G18 -> 19
A19: Gattei | B19: Marco | C19: 2148 | D19: 55597 | E19: 14 | F19: 10 | G19: 3 | H19: =E19+F19+G19 -> 27
A20: Medos | B20: Alessandro | C20: 2006 | D20: 40703 | E20: 1 | F20: 0 | G20: 0 | H20: Insuff.
A21: Memè | B21: Michele | C21: 2148 | D21: 55158 | E21: 7 | F21: 11 | G21: 3 | H21: =E21+F21+G21 -> 21
A22: Paolini | B22: Andrea | C22: 2148 | D22: 54299 | E22: 13 | F22: 8 | G22: 3 | H22: =E22+F22+G22 -> 24
A23: Perlini | B23: Pierpaolo | C23: 2148 | D23: 46066 | E23: 9 | F23: 11 | G23: 3 | H23: =E23+F23+G23 -> 23
A24: Tassi | B24: Davide | C24: 2006 | D24: 41815 | E24: 5 | F24: 11 | G24: 3 | H24: =E24+F24+G24 -> 19
A25: Ubaldi | B25: Guglielmo | C25: 2148 | D25: 61841 | E25: 12 | F25: 2 | G25: 3 | H25: =E25+F25+G25 -> 17 | I25: *
A26: * Il 12 Luglio comunichi se accetta o preferisce insufficienza e bonus