A1: Ricerca Operativa V-O
A2: Prova Scritta del 10 Gennaio 2003
A4: Validita': fino a Giugno 2003
A5: Visione degli elaborati e orali:Mercoledi' 15 Gennaio 2003, ore 15.00 Aula 8.1
A6: Prossimi appelli: Aprile, Giugno, Luglio
A8: matricola | B8: Cognome | C8: Nome | D8: 1 | E8: 2 | F8: 3 | G8: bonus | H8: voto
A9: 2148053511 | B9: CANUTI | C9: STEFANO | D9: 12 | E9: 8 | F9: 5 | G9: 3 | H9: =D9+E9+F9+G9 -> 28
A10: 2148061183 | B10: CAVINA | C10: ELKER | D10: 13 | E10: 8 | F10: 2 | G10: 3 | H10: =D10+E10+F10+G10 -> 26
A11: 2148059445 | B11: CIONI | C11: ALESSANDRO | D11: 11 | E11: 9 | F11: 5 | G11: 3 | H11: =D11+E11+F11+G11 -> 28
A12: 2148057078 | B12: CUPPI | C12: ENRICO | D12: 9 | E12: 9 | F12: 5 | G12: 3 | H12: =D12+E12+F12+G12 -> 26
A13: 2148059513 | B13: DEL FAVERO | C13: MARCO | D13: 14 | E13: 9 | F13: 6 | G13: 3 | H13: =D13+E13+F13+G13 -> 32
A14: 2148053641 | B14: DI LORENZO | C14: DANIELE | D14: 1 | E14: 6 | F14: 5 | H14: Insuff.
A15: 2146054569 | B15: DISCENZA | C15: GIANLUCA | D15: 10 | E15: 9 | F15: 5 | G15: 3 | H15: =D15+E15+F15+G15 -> 27
A16: 2146059541 | B16: FABBRI | C16: ALESSANDRO | D16: 5 | E16: 9 | F16: 2 | G16: 3 | H16: =D16+E16+F16+G16 -> 19
A17: 2148062906 | B17: MANDARINI | C17: GILBERTO | D17: 6 | E17: 9 | F17: 5 | G17: 3 | H17: =D17+E17+F17+G17 -> 23
A18: 2148057609 | B18: MARCHETTI | C18: ROBERTO | D18: 8 | E18: 9 | F18: 5 | G18: 3 | H18: =D18+E18+F18+G18 -> 25
A19: 2148060029 | B19: PALLI | C19: GIANLUCA | D19: 14 | F19: 3 | G19: 3 | H19: =D19+E19+F19+G19 -> 20
A20: 2108059628 | B20: PALMISANO | C20: MARIA SCALA | D20: 3 | E20: 9 | F20: 6 | G20: 3 | H20: =D20+E20+F20+G20 -> 21
A21: 2108047800 | B21: RICCI | C21: ALBERTO | D21: 10 | E21: 9 | F21: 3 | G21: 3 | H21: =D21+E21+F21+G21 -> 25
A22: 2148048353 | B22: SUCCI | C22: FEDERICO | D22: 4 | E22: 5 | F22: 5 | G22: 3 | H22: =D22+E22+F22+G22 -> 17 | I22: *
A23: 2148052456 | B23: VANDELLI | C23: GABRIELE | D23: 3 | E23: 3 | F23: 5 | H23: Insuff.
A24: 2148046387 | B24: ZARRI | C24: MARCO | D24: 5 | E24: 8 | F24: 5 | G24: 3 | H24: =D24+E24+F24+G24 -> 21
A25: * Il 15 Gennaio comunichi se accetta o preferisce insufficienza e bonus