A1: Prova Scritta di Ricerca Operativa del 13 Settembre 2000
A2: (Informatica, Elettronica, Telecomunicazioni)
A4: Validita': fino alla sessione invernale A.A. 1999/2000
A5: Visione degli elaborati e orali: Martedi' 19 Settembre 2000 ore 15.00 Aula 6.1
A6: Prossimi appelli: Venerdi' 13 Ottobre ore 16 (scritto), Ottobre(orale), Gennaio
A8: Cognome | B8: Nome | C8: cdl | D8: matricola | E8: 1 | F8: 2 | G8: 3 | H8: bonus | I8: voto
A9: Borri | B9: Giacomo | C9: 2148 | D9: 59454 | E9: 13 | F9: 10 | G9: 5 | H9: 3 | I9: =E9+F9+G9+H9 -> 31
A10: Bortolini | B10: Nicola | C10: 2106 | D10: 46317 | E10: 2 | F10: 7 | G10: 0 | H10: 0 | I10: Insuff.
A11: Chiari | B11: Massimo | C11: 2148 | D11: 43589 | E11: 9 | F11: 10 | G11: 5 | H11: 0 | I11: =E11+F11+G11+H11 -> 24
A12: Feccomandi | B12: Andrea | C12: 2148 | D12: 54590 | E12: 7 | F12: 10 | G12: 4 | H12: 3 | I12: =E12+F12+G12+H12 -> 24
A13: Scrilatti | B13: Marco | C13: 2148 | D13: 59364 | E13: 5 | F13: 9 | G13: 3 | H13: 0 | I13: =E13+F13+G13+H13 -> 17
A14: Stagni | B14: Maurizio | C14: 2148 | D14: 55634 | E14: 11 | F14: 3 | G14: 2 | H14: 3 | I14: =E14+F14+G14+H14 -> 19
A15: Taglioni | B15: Matteo | C15: 2143 | D15: 58666 | E15: 4 | F15: 8 | G15: 3 | H15: 3 | I15: =E15+F15+G15+H15 -> 18