A1: Ricerca Operativa L-A
A2: Prova Scritta del 4 Aprile 2003
A4: Validita': fino a Luglio 2003
A5: Visione degli elaborati e orali:Martedi' 15 Aprile ore 14.00 Aula 6.1
A6: Prossimi appelli: Giugno, Luglio
A8: matricola | B8: Cognome | C8: Nome | D8: 1 | E8: 2 | F8: 3 | G8: bonus | H8: voto
A9: 2148059143 | B9: BENINCASA | C9: FRANCESCO | D9: 8 | E9: 3 | F9: 6 | G9: 0 | H9: =D9+E9+F9+G9 -> 17 | I9: *
A10: 2148057341 | B10: DE ANGELIS | C10: MASSIMILIANO | D10: 7 | E10: 5 | F10: 10 | G10: 3 | H10: =D10+E10+F10+G10 -> 25
A11: 2148064601 | B11: MARZO | C11: ALESSANDRO | D11: 10 | E11: 3 | F11: 9 | G11: 3 | H11: =D11+E11+F11+G11 -> 25
A12: 2146061279 | B12: PIRINI | C12: GIANNI | D12: 0 | E12: 5 | F12: 13 | G12: 3 | H12: =D12+E12+F12+G12 -> 21
A13: 2148045902 | B13: POGGIASPALLA | C13: BARBARA | D13: 5 | E13: 4 | F13: 9 | G13: 0 | H13: =D13+E13+F13+G13 -> 18
A14: * = ammesso all'orale