A1: Fondamenti di Ricerca Operativa L-A
A2: Prova Scritta del 16 Luglio 2003
A4: Validita': fino a Settembre 2003
A5: Visione degli elaborati: Martedi' 22 Luglio ore 17.00 Aula 6.1
A6: Orali: Martedi' 22/7 ore 17 Aula 6.1, Venerdi' 25/7 ore 15 Aula 6.1
A7: Prossimi appelli: Settembre, Gennaio
A9: matricola | B9: Cognome | C9: Nome | D9: 1 | E9: 2 | F9: 3 | G9: bonus | H9: voto
A10: 127940 | B10: BABINI | C10: MARTINA | D10: 0 | E10: 17 | F10: 8 | G10: 0 | H10: =D10+E10+F10+G10 -> 25
A11: 127287 | B11: BARRANO | C11: EMANUELE | D11: 0 | E11: 7 | F11: 6 | G11: 0 | H11: Insuff.
A12: 121741 | B12: BUCCI | C12: DAVIDE | D12: 0 | E12: 14 | F12: 5 | G12: 0 | H12: =D12+E12+F12+G12 -> 19
A13: 128724 | B13: CESARI | C13: EDOARDO | D13: 0 | E13: 11 | F13: 4 | G13: 0 | H13: Insuff.
A14: 121561 | B14: CONSOLE | C14: MIRKO | D14: 0 | E14: 10 | F14: 8 | G14: 0 | H14: =D14+E14+F14+G14 -> 18
A15: 114918 | B15: CORSINI | C15: ALESSIO | D15: 0 | E15: 11 | F15: 2 | G15: 0 | H15: Insuff.
A16: 900003191 | B16: DI STEFANO | C16: NUNZIO | D16: 0 | E16: 14 | F16: 0 | G16: 3 | H16: =D16+E16+F16+G16 -> 17 | I16: *
A17: 113353 | B17: GALLETTO | C17: GIANMARCO | D17: 0 | E17: 11 | F17: 0 | G17: 3 | H17: Insuff.
A18: 2148062024 | B18: GIOVACCHINI | C18: PARIDE | D18: 0 | E18: 0 | F18: 6 | G18: 0 | H18: Insuff.
A19: 121979 | B19: GOTTARDI | C19: GIANPAOLO | D19: 0 | E19: 21 | F19: 7 | G19: 0 | H19: =D19+E19+F19+G19 -> 28
A20: 124485 | B20: LACCHINI | C20: ROBERTO | D20: 0 | E20: 11 | F20: 3 | G20: 3 | H20: =D20+E20+F20+G20 -> 17 | I20: *
A21: 123175 | B21: MONROY | C21: RICARDO | D21: 0 | E21: 18 | F21: 6 | G21: 0 | H21: =D21+E21+F21+G21 -> 24
A22: 121661 | B22: MORLUNGHI | C22: ANDREA | D22: 0 | E22: 17 | F22: 7 | G22: 0 | H22: =D22+E22+F22+G22 -> 24
A23: 900004149 | B23: RINALDI | C23: MARIO | D23: 0 | E23: 11 | F23: 5 | G23: 0 | H23: =D23+E23+F23+G23 -> 16 | I23: *
A24: 128176 | B24: ROSADA | C24: GIOVANNI BATTISTA | D24: 0 | E24: 20 | F24: 0 | G24: 3 | H24: =D24+E24+F24+G24 -> 23
A25: 125474 | B25: ROSSINI | C25: PROSPERO | D25: 0 | E25: 13 | F25: 3 | G25: 0 | H25: =D25+E25+F25+G25 -> 16 | I25: *
A26: 106141 | B26: SANTINI | C26: MATTEO | D26: 0 | E26: 16 | F26: 7 | G26: 0 | H26: =D26+E26+F26+G26 -> 23
A27: 108113 | B27: VERNA | C27: GERARDO | D27: 0 | E27: 14 | F27: 5 | G27: 0 | H27: =D27+E27+F27+G27 -> 19
A28: 128027 | B28: VIOLI | C28: VALENTINA | D28: 0 | E28: 15 | F28: 7 | G28: 0 | H28: =D28+E28+F28+G28 -> 22
A29: * = ammesso/a all'orale