A1: Fondamenti di Ricerca Operativa L-A
A2: Prova Scritta del 20 Luglio 2005
A4: Validita' per chi registra direttamente il voto: fino a mercoledi' 27 Luglio 2005
A5: (non procrastinabile; non si risponde a mail o telefonate in merito).
A7: Validita' per chi sostiene l'orale: fino all'appello di Dicembre-Gennaio.
A8: Visione degli elaborati e orali: mercoledi' 27 Luglio 2005, ore 15.00, Aula 61
A9: Prossimi appelli: Settembre, Dicembre-Gennaio
A11: matricola | B11: Cognome | C11: Nome | D11: 1 | E11: 2 | F11: bonus | G11: voto
A12: 160202 | B12: ANTONIOLI | C12: FABRIZIO | D12: 14 | E12: 1 | F12: 3 | G12: =IF(SUM(D12:F12)<18,"Insuff.",SUM(D12:F12)) -> 18
A13: 122835 | B13: BORTONE | C13: ANDREA | D13: 0 | E13: 3 | F13: 3 | G13: =IF(SUM(D13:F13)<18,"Insuff.",SUM(D13:F13)) -> Insuff.
A14: 142022 | B14: CATALDO | C14: DONATO ANTONIO | D14: 12 | E14: 3 | F14: 3 | G14: =IF(SUM(D14:F14)<18,"Insuff.",SUM(D14:F14)) -> 18
A15: 129215 | B15: COLICCHIA | C15: VITTORIO | D15: 12 | E15: 7 | F15: 3 | G15: =IF(SUM(D15:F15)<18,"Insuff.",SUM(D15:F15)) -> 22
A16: 160436 | B16: D'AGOSTINO | C16: STEFANO | D16: 9 | E16: 7 | F16: 3 | G16: =IF(SUM(D16:F16)<18,"Insuff.",SUM(D16:F16)) -> 19
A17: 159335 | B17: D'APOTE | C17: LEONARDO | D17: 6 | E17: 9 | F17: 0 | G17: =IF(SUM(D17:F17)<18,"Insuff.",SUM(D17:F17)) -> Insuff.
A18: 140903 | B18: D'ASCANIO | C18: AMEDEO | D18: 14 | E18: 5 | F18: 0 | G18: =IF(SUM(D18:F18)<18,"Insuff.",SUM(D18:F18)) -> 19
A19: 160033 | B19: DI CINTIO | C19: FRANCESCO | D19: 16 | E19: 8 | F19: 3 | G19: =IF(SUM(D19:F19)<18,"Insuff.",SUM(D19:F19)) -> 27
A20: 196007 | B20: DI MARCO | C20: FULVIO | D20: 10 | E20: 6 | F20: 3 | G20: =IF(SUM(D20:F20)<18,"Insuff.",SUM(D20:F20)) -> 19
A21: 166694 | B21: FARACI | C21: FABIO | D21: 12 | E21: 3 | F21: 0 | G21: =IF(SUM(D21:F21)<18,"Insuff.",SUM(D21:F21)) -> Insuff. | H21: (**)
A22: 125528 | B22: FARATRO | C22: ANDREA | D22: 10 | E22: 6 | F22: 3 | G22: =IF(SUM(D22:F22)<18,"Insuff.",SUM(D22:F22)) -> 19
A23: 159504 | B23: GRASSI | C23: ENRICO | D23: 12 | E23: 1 | F23: 3 | G23: =IF(SUM(D23:F23)<18,"Insuff.",SUM(D23:F23)) -> Insuff.
A24: 139629 | B24: IMPOSIMATO | C24: ARTURO | D24: 0 | E24: 0 | F24: 0 | G24: =IF(SUM(D24:F24)<18,"Insuff.",SUM(D24:F24)) -> Insuff. | H24: (***)
A25: 2148064468 | B25: LANZI | C25: GIUSEPPE | D25: 4 | E25: 5 | F25: 3 | G25: =IF(SUM(D25:F25)<18,"Insuff.",SUM(D25:F25)) -> Insuff.
A26: 121686 | B26: LORI | C26: LUCA | D26: 15 | E26: 9 | F26: 3 | G26: =IF(SUM(D26:F26)<18,"Insuff.",SUM(D26:F26)) -> 27
A27: 107899 | B27: MALVASIO | C27: ELISA | D27: 11 | E27: 0 | F27: 0 | G27: =IF(SUM(D27:F27)<18,"Insuff.",SUM(D27:F27)) -> Insuff.
A28: 235389 | B28: MARTELLA | C28: ALESSANDRO | D28: 10 | E28: 9 | F28: 0 | G28: =IF(SUM(D28:F28)<18,"Insuff.",SUM(D28:F28)) -> 19
A29: 229674 | B29: NEGRISOLI | C29: ALBERTO | D29: 7 | E29: 3 | F29: 0 | G29: =IF(SUM(D29:F29)<18,"Insuff.",SUM(D29:F29)) -> Insuff.
A30: 158022 | B30: PALMISANO | C30: GIOVANNI | D30: 12 | E30: 0 | F30: 0 | G30: =IF(SUM(D30:F30)<18,"Insuff.",SUM(D30:F30)) -> Insuff.
A31: 2148063310 | B31: PARENTELA | C31: FABIO | D31: 7 | E31: 7 | F31: 3 | G31: =IF(SUM(D31:F31)<18,"Insuff.",SUM(D31:F31)) -> Insuff. | H31: (*)
A32: 160318 | B32: PETROSINO | C32: MATTIA | D32: 21 | E32: 9 | F32: 0 | G32: =IF(SUM(D32:F32)<18,"Insuff.",SUM(D32:F32)) -> 30
A33: 159743 | B33: POLIDORO | C33: GIORDANO | D33: 6 | E33: 3 | F33: 3 | G33: =IF(SUM(D33:F33)<18,"Insuff.",SUM(D33:F33)) -> Insuff.
A34: 128984 | B34: RASPADORI | C34: GIANLUCA | D34: 9 | E34: 2 | F34: 0 | G34: =IF(SUM(D34:F34)<18,"Insuff.",SUM(D34:F34)) -> Insuff. | H34: (**)
A35: 138633 | B35: ROSSI | C35: ANTONELLO | D35: 11 | E35: 0 | F35: 3 | G35: =IF(SUM(D35:F35)<18,"Insuff.",SUM(D35:F35)) -> Insuff.
A36: 160074 | B36: ROSSIGNOLI | C36: ENRICO | D36: 18 | E36: 4 | F36: 0 | G36: =IF(SUM(D36:F36)<18,"Insuff.",SUM(D36:F36)) -> 22
A37: 900007152 | B37: SCIARRETTA | C37: ELISEO | D37: 8 | E37: 0 | F37: 3 | G37: =IF(SUM(D37:F37)<18,"Insuff.",SUM(D37:F37)) -> Insuff.
A38: 150572 | B38: SFAMURRI | C38: ALESSANDRO | D38: 7 | E38: 6 | F38: 3 | G38: =IF(SUM(D38:F38)<18,"Insuff.",SUM(D38:F38)) -> Insuff.
A39: 143072 | B39: SIMONETTI | C39: ENRICO | D39: 16 | E39: 5 | F39: 3 | G39: =IF(SUM(D39:F39)<18,"Insuff.",SUM(D39:F39)) -> 24
A40: 2108057257 | B40: SPARAPAN | C40: ANDREA | D40: 9 | E40: 9 | F40: 3 | G40: =IF(SUM(D40:F40)<18,"Insuff.",SUM(D40:F40)) -> 21
A41: 158206 | B41: TIRAFERRI | C41: DANIELE | D41: 17 | E41: 6 | F41: 0 | G41: =IF(SUM(D41:F41)<18,"Insuff.",SUM(D41:F41)) -> 23
A42: 105783 | B42: TUGNETTI | C42: MICHELE | D42: 18 | E42: 9 | F42: 3 | G42: =IF(SUM(D42:F42)<18,"Insuff.",SUM(D42:F42)) -> 30
A43: 158267 | B43: VARRIANO | C43: PAOLA | D43: 11 | E43: 0 | F43: 0 | G43: =IF(SUM(D43:F43)<18,"Insuff.",SUM(D43:F43)) -> Insuff.
A44: (*) Puo' registrare 18.
A45: (**) L'esito e' stato verbalizzato.
A46: (***) L'esito del prossimo appello verra' verbalizzato in ogni caso.