A1: Fondamenti di Ricerca Operativa L-A
A2: Prova Scritta del 9 Settembre 2003
A4: Validita': fino a Marzo 2004
A5: Visione degli elaborati e orali: Mercoledi' 17 Settembre ore 16.00, Aula 6.1
A6: Prossimo appello: Gennaio
A8: matricola | B8: Cognome | C8: Nome | D8: 1 | E8: 2 | F8: 3 | G8: bonus | H8: voto
A9: 123833 | B9: BARONCINI | C9: DANIELE | D9: 13 | E9: 0 | G9: 0 | H9: Insuff.
A10: 127287 | B10: BARRANO | C10: EMANUELE | D10: 14 | E10: 4 | G10: 0 | H10: =D10+E10+F10+G10 -> 18
A11: 122915 | B11: BELLINI | C11: MARCO | D11: 17 | E11: 6 | G11: 0 | H11: =D11+E11+F11+G11 -> 23
A12: 126705 | B12: BONOLI | C12: NICOLA | D12: 8 | E12: 6 | G12: 0 | H12: Insuff.
A13: 104375 | B13: CERUTI | C13: ANDREA | D13: 16 | E13: 0 | G13: 0 | H13: =D13+E13+F13+G13 -> 16 | I13: *
A14: 121561 | B14: CONSOLE | C14: MIRKO | D14: 21 | E14: 6 | G14: 0 | H14: =D14+E14+F14+G14 -> 27
A15: 114918 | B15: CORSINI | C15: ALESSIO | D15: 3 | E15: 4 | H15: Insuff.
A16: 900005294 | B16: D'AMELIO | C16: PASQUALINO | D16: 3 | E16: 5 | G16: 3 | H16: Insuff.
A17: 900003191 | B17: DI STEFANO | C17: NUNZIO | D17: 11 | E17: 3 | G17: 0 | H17: Insuff.
A18: 113353 | B18: GALLETTO | C18: GIANMARCO | D18: 23 | E18: 0 | G18: 0 | H18: =D18+E18+F18+G18 -> 23
A19: 127861 | B19: GELSUMINO | C19: ERIKA | D19: 9 | E19: 1 | G19: 0 | H19: Insuff.
A20: 2148062452 | B20: GIORGI | C20: GIANMARCO | D20: 11 | E20: 5 | H20: 16 | I20: *
A21: 2148062024 | B21: GIOVACCHINI | C21: PARIDE | D21: 14 | E21: 2 | G21: 0 | H21: =D21+E21+F21+G21 -> 16 | I21: *
A22: 128035 | B22: LEONETTI | C22: FRANCESCO | D22: 3 | E22: 4 | G22: 0 | H22: Insuff.
A23: 124166 | B23: LUCCHI | C23: FRANCESCO | D23: 21 | E23: 6 | G23: 0 | H23: =D23+E23+F23+G23 -> 27
A24: 2148063924 | B24: MANARESI | C24: FILIPPO | D24: 12 | E24: 3 | G24: 3 | H24: =D24+E24+F24+G24 -> 18
A25: 111021 | B25: MELCHIORRE | C25: PAOLO | D25: 15 | E25: 5 | G25: 3 | H25: =D25+E25+F25+G25 -> 23
A26: 128984 | B26: RASPADORI | C26: GIANLUCA | D26: 4 | E26: 6 | G26: 3 | H26: Insuff.
A27: 125474 | B27: ROSSINI | C27: PROSPERO | D27: 10 | E27: 6 | G27: 0 | H27: =D27+E27+F27+G27 -> 16 | I27: *
A28: 108213 | B28: SUPERGA | C28: FULVIO | D28: 17 | E28: 6 | G28: 3 | H28: =D28+E28+F28+G28 -> 26
A29: 128027 | B29: VIOLI | C29: VALENTINA | D29: 14 | E29: 4 | G29: 0 | H29: =D29+E29+F29+G29 -> 18
A30: * = ammesso all'orale