A2: Prova Scritta del 17 Marzo 2003
A4: Validita': fino a Giugno 2003
A5: Visione degli elaborati e orali:Lunedi' 24 Marzo ore 15.00 Aula 6.1
A6: Prossimi appelli: Aprile, Giugno, Luglio
A8: matricola | B8: Cognome | C8: Nome | D8: 1 | E8: 2 | F8: 3 | G8: bonus | H8: voto
A9: 105881 | B9: ABADIE MANRIQUE | C9: RICARDO ELOY | D9: 20 | E9: 7 | G9: 3 | H9: =D9+E9+F9+G9 -> 30 | J9: =COUNTIF(A:A,A9) -> 1
A10: 122708 | B10: ADDIMANDA | C10: ELISA | D10: 16 | E10: 6 | G10: 3 | H10: =D10+E10+F10+G10 -> 25 | J10: =COUNTIF(A:A,A10) -> 1
A11: 127356 | B11: AGRESTI | C11: SERENA | D11: 12 | E11: 8 | G11: 3 | H11: =D11+E11+F11+G11 -> 23 | J11: =COUNTIF(A:A,A11) -> 3
A12: 127122 | B12: ANCARANI | C12: LUCA | D12: 15 | E12: 9 | G12: 3 | H12: =D12+E12+F12+G12 -> 27 | J12: =COUNTIF(A:A,A12) -> 1
A13: 127370 | B13: ARGENTIERO | C13: STEFANO | D13: 11 | E13: 9 | G13: 3 | H13: =D13+E13+F13+G13 -> 23 | J13: =COUNTIF(A:A,A13) -> 2
A14: 127940 | B14: BABINI | C14: MARTINA | D14: 8 | E14: 9 | G14: 3 | H14: =D14+E14+F14+G14 -> 20 | J14: =COUNTIF(A:A,A14) -> 3
A15: 123594 | B15: BALDUCCI | C15: DANIELE | D15: 7 | E15: 9 | G15: 3 | H15: =D15+E15+F15+G15 -> 19 | J15: =COUNTIF(A:A,A15) -> 5
A16: 122910 | B16: BAMPO | C16: MAURO | D16: 21 | E16: 9 | G16: 3 | H16: =D16+E16+F16+G16 -> 33 | J16: =COUNTIF(A:A,A16) -> 1
A17: 123833 | B17: BARONCINI | C17: DANIELE | D17: 11 | E17: 3 | G17: 3 | H17: =D17+E17+F17+G17 -> 17 | I17: * | J17: =COUNTIF(A:A,A17) -> 5
A18: 127287 | B18: BARRANO | C18: EMANUELE | D18: 2 | E18: 4 | G18: 3 | H18: Insuff. | J18: =COUNTIF(A:A,A18) -> 5
A19: 121895 | B19: BASSINI | C19: ILARIA | D19: 16 | E19: 3 | G19: 3 | H19: =D19+E19+F19+G19 -> 22 | J19: =COUNTIF(A:A,A19) -> 2
A20: 124286 | B20: BATTARRA | C20: PAOLO | D20: 19 | E20: 8 | G20: 3 | H20: =D20+E20+F20+G20 -> 30 | J20: =COUNTIF(A:A,A20) -> 1
A21: 900003207 | B21: BELARDI | C21: ANDREA | D21: 19 | E21: 9 | G21: 3 | H21: =D21+E21+F21+G21 -> 31 | J21: =COUNTIF(A:A,A21) -> 1
A22: 122915 | B22: BELLINI | C22: MARCO | D22: 13 | E22: 2 | G22: 3 | H22: =D22+E22+F22+G22 -> 18 | J22: =COUNTIF(A:A,A22) -> 3
A23: 125461 | B23: BELLOCCHI | C23: MARCO MARIA | D23: 18 | E23: 8 | G23: 3 | H23: =D23+E23+F23+G23 -> 29 | J23: =COUNTIF(A:A,A23) -> 1
A24: 122171 | B24: BERTI | C24: CLAUDIO | D24: 16 | E24: 8 | G24: 3 | H24: =D24+E24+F24+G24 -> 27 | J24: =COUNTIF(A:A,A24) -> 1
A25: 2148062266 | B25: BERTORELLI | C25: SIMONE | D25: 18 | E25: 2 | G25: 3 | H25: =D25+E25+F25+G25 -> 23 | J25: =COUNTIF(A:A,A25) -> 1
A26: 124168 | B26: BONAZZA | C26: FEDERICO | D26: 12 | E26: 8 | G26: 3 | H26: =D26+E26+F26+G26 -> 23 | J26: =COUNTIF(A:A,A26) -> 1
A27: 125511 | B27: BORELLI | C27: VINCENZO | D27: 21 | E27: 9 | G27: 3 | H27: =D27+E27+F27+G27 -> 33 | J27: =COUNTIF(A:A,A27) -> 1
A28: 122560 | B28: BRICCHI | C28: LORENZO | D28: 14 | E28: 5 | G28: 3 | H28: =D28+E28+F28+G28 -> 22 | J28: =COUNTIF(A:A,A28) -> 2
A29: 122507 | B29: BRUGNONI | C29: MIRCO | D29: 14 | E29: 9 | G29: 3 | H29: =D29+E29+F29+G29 -> 26 | J29: =COUNTIF(A:A,A29) -> 1
A30: 122490 | B30: BRUNETTI | C30: LUCA | D30: 16 | E30: 2 | G30: 3 | H30: =D30+E30+F30+G30 -> 21 | J30: =COUNTIF(A:A,A30) -> 3
A31: 900003209 | B31: BUCCELLA | C31: ALBERTO | D31: 13 | E31: 8 | G31: 3 | H31: =D31+E31+F31+G31 -> 24 | J31: =COUNTIF(A:A,A31) -> 1
A32: 123038 | B32: BURGIO | C32: PAOLO | D32: 16 | E32: 7 | G32: 3 | H32: =D32+E32+F32+G32 -> 26 | J32: =COUNTIF(A:A,A32) -> 1
A33: 127284 | B33: BUSACCA | C33: FULVIO | D33: 19 | E33: 9 | G33: 3 | H33: =D33+E33+F33+G33 -> 31 | J33: =COUNTIF(A:A,A33) -> 1
A34: 900003457 | B34: CAFFIERO | C34: ALESSANDRO | D34: 18 | E34: 9 | G34: 3 | H34: =D34+E34+F34+G34 -> 30 | J34: =COUNTIF(A:A,A34) -> 1
A35: 105176 | B35: CALORI | C35: ALESSANDRO | D35: 14 | E35: 2 | G35: 3 | H35: =D35+E35+F35+G35 -> 19 | J35: =COUNTIF(A:A,A35) -> 1
A36: 127911 | B36: CANTARINI | C36: FRANCESCO | D36: 18 | E36: 9 | G36: 3 | H36: =D36+E36+F36+G36 -> 30 | J36: =COUNTIF(A:A,A36) -> 1
A37: 127931 | B37: CAROTTI | C37: LAMBERTO | D37: 15 | E37: 4 | G37: 3 | H37: =D37+E37+F37+G37 -> 22 | J37: =COUNTIF(A:A,A37) -> 1
A38: 122942 | B38: CARPENE' | C38: MICHELE | D38: 8 | E38: 1 | G38: 3 | H38: Insuff. | I38: *** | J38: =COUNTIF(A:A,A38) -> 2
A39: 124354 | B39: CARUSO | C39: VINCENZO | D39: 21 | E39: 9 | G39: 3 | H39: =D39+E39+F39+G39 -> 33 | J39: =COUNTIF(A:A,A39) -> 1
A40: 104375 | B40: CERUTI | C40: ANDREA | D40: 8 | E40: 7 | G40: 3 | H40: =D40+E40+F40+G40 -> 18 | J40: =COUNTIF(A:A,A40) -> 4
A41: 110255 | B41: COCCI GRIFONI | C41: GAETANO | D41: 16 | E41: 8 | G41: 3 | H41: =D41+E41+F41+G41 -> 27 | J41: =COUNTIF(A:A,A41) -> 1
A42: 2148063608 | B42: COLOMBINI | C42: EMANUELE | D42: 20 | E42: 3 | G42: 3 | H42: =D42+E42+F42+G42 -> 26 | J42: =COUNTIF(A:A,A42) -> 1
A43: 125550 | B43: COLOMBINI | C43: GABRIELE | D43: 6 | E43: 4 | G43: 3 | H43: Insuff. | J43: =COUNTIF(A:A,A43) -> 2
A44: 114918 | B44: CORSINI | C44: ALESSIO | D44: 8 | E44: 2 | G44: 3 | H44: Insuff. | J44: =COUNTIF(A:A,A44) -> 6
A45: 123517 | B45: DALLA TORRE | C45: ALESSANDRO | D45: 14 | E45: 9 | G45: 3 | H45: =D45+E45+F45+G45 -> 26 | J45: =COUNTIF(A:A,A45) -> 1
A46: 103924 | B46: DI BIAGIO | C46: ANDREA | D46: 13 | E46: 9 | G46: 3 | H46: =D46+E46+F46+G46 -> 25 | J46: =COUNTIF(A:A,A46) -> 1
A47: 121743 | B47: DI CREDICO | C47: FEDERICO | D47: 13 | E47: 6 | G47: 3 | H47: =D47+E47+F47+G47 -> 22 | J47: =COUNTIF(A:A,A47) -> 2
A48: 121765 | B48: DI NAPOLI | C48: GIOVANNI | D48: 17 | E48: 6 | G48: 3 | H48: =D48+E48+F48+G48 -> 26 | J48: =COUNTIF(A:A,A48) -> 1
A49: 104930 | B49: DI TOLLO | C49: ALFONSO | D49: 7 | E49: 2 | G49: 3 | H49: Insuff. | J49: =COUNTIF(A:A,A49) -> 3
A50: 122109 | B50: DI TOMASO | C50: VITTORIO | D50: 19 | E50: 9 | G50: 3 | H50: =D50+E50+F50+G50 -> 31 | J50: =COUNTIF(A:A,A50) -> 1
A51: 125458 | B51: DIONIGI | C51: GIACOMO | D51: 18 | E51: 9 | G51: 3 | H51: =D51+E51+F51+G51 -> 30 | J51: =COUNTIF(A:A,A51) -> 1
A52: 125672 | B52: DOLIF | C52: EMILIANO | D52: 12 | E52: 7 | G52: 3 | H52: =D52+E52+F52+G52 -> 22 | J52: =COUNTIF(A:A,A52) -> 2
A53: 123273 | B53: FERRANTI | C53: ETTORE | D53: 19 | E53: 9 | G53: 3 | H53: =D53+E53+F53+G53 -> 31 | J53: =COUNTIF(A:A,A53) -> 1
A54: 121528 | B54: FIORANI | C54: ENRICO | D54: 21 | E54: 5 | G54: 3 | H54: =D54+E54+F54+G54 -> 29 | J54: =COUNTIF(A:A,A54) -> 1
A55: 121917 | B55: FIORETTI | C55: FABIO | D55: 12 | E55: 2 | G55: 3 | H55: =D55+E55+F55+G55 -> 17 | I55: * | J55: =COUNTIF(A:A,A55) -> 3
A56: 124843 | B56: GAETANI | C56: ANTONIO | D56: 19 | E56: 9 | G56: 3 | H56: =D56+E56+F56+G56 -> 31 | J56: =COUNTIF(A:A,A56) -> 1
A57: 122877 | B57: GALLI | C57: LAURA | D57: 21 | E57: 9 | G57: 3 | H57: =D57+E57+F57+G57 -> 33 | J57: =COUNTIF(A:A,A57) -> 1
A58: 107073 | B58: GATTAMORTA | C58: MIRKO | D58: 21 | E58: 8 | G58: 3 | H58: =D58+E58+F58+G58 -> 32 | J58: =COUNTIF(A:A,A58) -> 1
A59: 121701 | B59: GATTARI | C59: GABRIELE | D59: 5 | E59: 9 | G59: 3 | H59: =D59+E59+F59+G59 -> 17 | I59: * | J59: =COUNTIF(A:A,A59) -> 2
A60: 127861 | B60: GELSUMINO | C60: ERIKA | D60: 4 | E60: 1 | G60: 3 | H60: Insuff. | J60: =COUNTIF(A:A,A60) -> 8
A61: 2148064429 | B61: GENTILI | C61: PAOLO | D61: 9 | E61: 8 | G61: 3 | H61: =D61+E61+F61+G61 -> 20 | J61: =COUNTIF(A:A,A61) -> 2
A62: 127141 | B62: GERMINALE | C62: MARCO | D62: 14 | E62: 8 | G62: 3 | H62: =D62+E62+F62+G62 -> 25 | J62: =COUNTIF(A:A,A62) -> 1
A63: 128819 | B63: GIGANTE | C63: PAOLO | D63: 4 | E63: 6 | G63: 3 | H63: Insuff. | J63: =COUNTIF(A:A,A63) -> 2
A64: 121979 | B64: GOTTARDI | C64: GIANPAOLO | D64: 17 | E64: 6 | G64: 3 | H64: =D64+E64+F64+G64 -> 26 | J64: =COUNTIF(A:A,A64) -> 4
A65: 122284 | B65: GRUPPIONI | C65: EMANUELE | D65: 14 | E65: 0 | G65: 3 | H65: =D65+E65+F65+G65 -> 17 | I65: * | J65: =COUNTIF(A:A,A65) -> 2
A66: 121673 | B66: GUADAGNO | C66: POTITO | D66: 7 | E66: 3 | G66: 3 | H66: Insuff. | J66: =COUNTIF(A:A,A66) -> 2
A67: 900003117 | B67: INGENITO | C67: GUIDO ANGELO | D67: 12 | E67: 4 | G67: 3 | H67: =D67+E67+F67+G67 -> 19 | J67: =COUNTIF(A:A,A67) -> 1
A68: 900005389 | B68: KASTLUNGER | C68: TONE | D68: 10 | E68: 4 | G68: 3 | H68: =D68+E68+F68+G68 -> 17 | I68: * | J68: =COUNTIF(A:A,A68) -> 1
A69: 122017 | B69: LAGUARDIA | C69: FLAVIO | D69: 14 | E69: 6 | G69: 3 | H69: =D69+E69+F69+G69 -> 23 | J69: =COUNTIF(A:A,A69) -> 1
A70: 122738 | B70: LEARDINI | C70: FRANCESCO | D70: 13 | E70: 5 | G70: 3 | H70: =D70+E70+F70+G70 -> 21 | J70: =COUNTIF(A:A,A70) -> 2
A71: 128035 | B71: LEONETTI | C71: FRANCESCO | D71: 11 | E71: 6 | G71: 3 | H71: =D71+E71+F71+G71 -> 20 | J71: =COUNTIF(A:A,A71) -> 4
A72: 900003528 | B72: LOSARDO | C72: AGOSTINO | D72: 10 | E72: 4 | G72: 3 | H72: =D72+E72+F72+G72 -> 17 | I72: * | J72: =COUNTIF(A:A,A72) -> 2
A73: 124166 | B73: LUCCHI | C73: FRANCESCO | D73: 18 | E73: 6 | G73: 3 | H73: =D73+E73+F73+G73 -> 27 | J73: =COUNTIF(A:A,A73) -> 2
A74: 900003165 | B74: MAGNANI | C74: FEDERICA | D74: 20 | E74: 8 | G74: 3 | H74: =D74+E74+F74+G74 -> 31 | J74: =COUNTIF(A:A,A74) -> 1
A75: 125696 | B75: MAMO | C75: GIUSEPPE | D75: 7 | E75: 7 | G75: 3 | H75: =D75+E75+F75+G75 -> 17 | I75: * | J75: =COUNTIF(A:A,A75) -> 1
A76: 123804 | B76: MANSERVISI | C76: ALBERTO | D76: 16 | E76: 1 | G76: 3 | H76: =D76+E76+F76+G76 -> 20 | J76: =COUNTIF(A:A,A76) -> 2
A77: 123298 | B77: MARCHETTI | C77: ALEX | D77: 17 | E77: 4 | G77: 3 | H77: =D77+E77+F77+G77 -> 24 | J77: =COUNTIF(A:A,A77) -> 1
A78: 122375 | B78: MARIANI | C78: ALESSANDRO | D78: 21 | E78: 9 | G78: 3 | H78: =D78+E78+F78+G78 -> 33 | J78: =COUNTIF(A:A,A78) -> 1
A79: 128859 | B79: MASETTI | C79: MARCO | D79: 10 | E79: 8 | G79: 3 | H79: =D79+E79+F79+G79 -> 21 | J79: =COUNTIF(A:A,A79) -> 1
A80: 122605 | B80: MASI | C80: GIULIANO | D80: 18 | E80: 8 | G80: 3 | H80: =D80+E80+F80+G80 -> 29 | J80: =COUNTIF(A:A,A80) -> 1
A81: 123351 | B81: MAZZONI | C81: ANDREA | D81: 12 | E81: 7 | G81: 3 | H81: =D81+E81+F81+G81 -> 22 | J81: =COUNTIF(A:A,A81) -> 3
A82: 127966 | B82: MERCATI | C82: ALBERTO | D82: 15 | G82: 3 | H82: =D82+E82+F82+G82 -> 18 | J82: =COUNTIF(A:A,A82) -> 2
A83: 121960 | B83: MIRANDOLA | C83: ALEX | D83: 12 | E83: 8 | G83: 3 | H83: =D83+E83+F83+G83 -> 23 | J83: =COUNTIF(A:A,A83) -> 2
A84: 123175 | B84: MONROY | C84: RICARDO | D84: 7 | E84: 4 | G84: 3 | H84: Insuff. | J84: =COUNTIF(A:A,A84) -> 4
A85: 125494 | B85: MONTALI | C85: MARCO | D85: 21 | E85: 8 | G85: 3 | H85: =D85+E85+F85+G85 -> 32 | J85: =COUNTIF(A:A,A85) -> 1
A86: 124749 | B86: MORETTI | C86: LEONARDO | D86: 15 | E86: 9 | G86: 3 | H86: =D86+E86+F86+G86 -> 27 | J86: =COUNTIF(A:A,A86) -> 1
A87: 121661 | B87: MORLUNGHI | C87: ANDREA | D87: 9 | E87: 8 | G87: 3 | H87: =D87+E87+F87+G87 -> 20 | J87: =COUNTIF(A:A,A87) -> 3
A88: 123955 | B88: MORSIANI | C88: MARCO | D88: 17 | E88: 9 | G88: 3 | H88: =D88+E88+F88+G88 -> 29 | J88: =COUNTIF(A:A,A88) -> 1
A89: 106662 | B89: NUVOLI | C89: CHRISTIAN | D89: 19 | E89: 8 | G89: 3 | H89: =D89+E89+F89+G89 -> 30 | J89: =COUNTIF(A:A,A89) -> 1
A90: 122350 | B90: PACE | C90: MICHELE | D90: 18 | E90: 9 | G90: 3 | H90: =D90+E90+F90+G90 -> 30 | J90: =COUNTIF(A:A,A90) -> 1
A91: 121943 | B91: PANACCIO | C91: MARISA | D91: 17 | E91: 5 | G91: 3 | H91: =D91+E91+F91+G91 -> 25 | J91: =COUNTIF(A:A,A91) -> 1
A92: 122261 | B92: PANZACCHI | C92: MATTEO | D92: 12 | E92: 8 | G92: 3 | H92: =D92+E92+F92+G92 -> 23 | J92: =COUNTIF(A:A,A92) -> 1
A93: 127790 | B93: PARENZA | C93: BENEDETTA | D93: 7 | E93: 8 | G93: 3 | H93: =D93+E93+F93+G93 -> 18 | J93: =COUNTIF(A:A,A93) -> 1
A94: 121944 | B94: PARISINI | C94: FABIO | D94: 16 | E94: 9 | G94: 3 | H94: =D94+E94+F94+G94 -> 28 | J94: =COUNTIF(A:A,A94) -> 1
A95: 122278 | B95: PELLEGRINI | C95: SIMONE | D95: 18 | E95: 8 | G95: 3 | H95: =D95+E95+F95+G95 -> 29 | J95: =COUNTIF(A:A,A95) -> 1
A96: 122052 | B96: PETRI | C96: MATTEO TOMMASO | D96: 16 | E96: 6 | G96: 3 | H96: =D96+E96+F96+G96 -> 25 | J96: =COUNTIF(A:A,A96) -> 1
A97: 123566 | B97: PISTOLESI | C97: LUCA | D97: 14 | E97: 5 | G97: 3 | H97: =D97+E97+F97+G97 -> 22 | J97: =COUNTIF(A:A,A97) -> 4
A98: 124882 | B98: PIZZI | C98: ANGELO | D98: 7 | E98: 8 | G98: 3 | H98: =D98+E98+F98+G98 -> 18 | J98: =COUNTIF(A:A,A98) -> 2
A99: 2148064437 | B99: POMPEI | C99: FABIO | D99: 19 | E99: 8 | G99: 3 | H99: =D99+E99+F99+G99 -> 30 | J99: =COUNTIF(A:A,A99) -> 1
A100: 130929 | B100: RAMETTA | C100: FABRIZIO | D100: 13 | E100: 6 | G100: 3 | H100: =D100+E100+F100+G100 -> 22 | J100: =COUNTIF(A:A,A100) -> 1
A101: 2147064457 | B101: RIMONDI | C101: CHRISTIAN | D101: 11 | E101: 8 | G101: 3 | H101: =D101+E101+F101+G101 -> 22 | J101: =COUNTIF(A:A,A101) -> 1
A102: 900004149 | B102: RINALDI | C102: MARIO | D102: 12 | E102: 5 | G102: 3 | H102: =D102+E102+F102+G102 -> 20 | J102: =COUNTIF(A:A,A102) -> 3
A103: 123267 | B103: RONDINI | C103: ELISA | D103: 19 | E103: 8 | G103: 3 | H103: =D103+E103+F103+G103 -> 30 | J103: =COUNTIF(A:A,A103) -> 1
A104: 125603 | B104: ROSSI | C104: DANIELE | D104: 18 | E104: 9 | G104: 3 | H104: =D104+E104+F104+G104 -> 30 | J104: =COUNTIF(A:A,A104) -> 1
A105: 123998 | B105: RUOTOLO | C105: DIEGO | D105: 17 | E105: 7 | G105: 3 | H105: =D105+E105+F105+G105 -> 27 | J105: =COUNTIF(A:A,A105) -> 1
A106: 121989 | B106: SACCHETTI | C106: MAURO | D106: 20 | E106: 9 | G106: 3 | H106: =D106+E106+F106+G106 -> 32 | J106: =COUNTIF(A:A,A106) -> 1
A107: 125652 | B107: SALDARI | C107: FABIO | D107: 13 | E107: 5 | G107: 3 | H107: =D107+E107+F107+G107 -> 21 | J107: =COUNTIF(A:A,A107) -> 1
A108: 121465 | B108: SALICETTI | C108: ANDREA | D108: 10 | E108: 7 | G108: 3 | H108: =D108+E108+F108+G108 -> 20 | J108: =COUNTIF(A:A,A108) -> 2
A109: 121474 | B109: SAMORANI | C109: MICHELE | D109: 20 | E109: 9 | G109: 3 | H109: =D109+E109+F109+G109 -> 32 | J109: =COUNTIF(A:A,A109) -> 1
A110: 123097 | B110: SANTUCCI | C110: PAOLO | D110: 19 | E110: 8 | G110: 3 | H110: =D110+E110+F110+G110 -> 30 | J110: =COUNTIF(A:A,A110) -> 1
A111: 125530 | B111: SIMONE | C111: MICHELE | D111: 21 | E111: 9 | G111: 3 | H111: =D111+E111+F111+G111 -> 33 | J111: =COUNTIF(A:A,A111) -> 1
A112: 122558 | B112: SOTTARA | C112: DAVIDE | D112: 18 | E112: 8 | G112: 3 | H112: =D112+E112+F112+G112 -> 29 | J112: =COUNTIF(A:A,A112) -> 1
A113: 127847 | B113: STORONI | C113: STEFANO | D113: 12 | E113: 8 | G113: 3 | H113: =D113+E113+F113+G113 -> 23 | J113: =COUNTIF(A:A,A113) -> 1
A114: 900000340 | B114: SUZZI | C114: PATRIK | D114: 17 | E114: 6 | G114: 3 | H114: =D114+E114+F114+G114 -> 26 | J114: =COUNTIF(A:A,A114) -> 1
A115: 126674 | B115: TALO' | C115: FRANCESCO | D115: 21 | E115: 8 | G115: 3 | H115: =D115+E115+F115+G115 -> 32 | J115: =COUNTIF(A:A,A115) -> 1
A116: 2146061181 | B116: TAMBURINI | C116: MARCO | D116: 14 | E116: 6 | G116: 3 | H116: =D116+E116+F116+G116 -> 23 | J116: =COUNTIF(A:A,A116) -> 1
A117: 2108055848 | B117: TOMAIUOLI | C117: GIUSEPPE | D117: 19 | E117: 9 | G117: 3 | H117: =D117+E117+F117+G117 -> 31 | J117: =COUNTIF(A:A,A117) -> 1
A118: 2148062646 | B118: TORCHIA | C118: ALESSANDRO | D118: 17 | E118: 3 | G118: 3 | H118: =D118+E118+F118+G118 -> 23 | J118: =COUNTIF(A:A,A118) -> 1
A119: 123243 | B119: TRIVIGNO | C119: ROCCO | D119: 18 | E119: 5 | G119: 3 | H119: =D119+E119+F119+G119 -> 26 | J119: =COUNTIF(A:A,A119) -> 1
A120: 103696 | B120: TUNDIS | C120: LUCA | D120: 14 | E120: 5 | G120: 3 | H120: =D120+E120+F120+G120 -> 22 | J120: =COUNTIF(A:A,A120) -> 1
A121: 105577 | B121: VICINELLI | C121: STEFANO | D121: 19 | E121: 9 | G121: 3 | H121: =D121+E121+F121+G121 -> 31 | J121: =COUNTIF(A:A,A121) -> 1
A122: 122020 | B122: VIGLIOTTI | C122: GUIDO | D122: 16 | E122: 8 | G122: 3 | H122: =D122+E122+F122+G122 -> 27 | J122: =COUNTIF(A:A,A122) -> 1
A123: 128027 | B123: VIOLI | C123: VALENTINA | D123: 9 | E123: 5 | G123: 3 | H123: =D123+E123+F123+G123 -> 17 | I123: * | J123: =COUNTIF(A:A,A123) -> 5
A124: 122074 | B124: VOLI | C124: STEFANO | D124: 12 | E124: 2 | G124: 3 | H124: =D124+E124+F124+G124 -> 17 | I124: * | J124: =COUNTIF(A:A,A124) -> 6
A125: 104243 | B125: ZAMBONELLI | C125: LEONARDO | D125: 16 | E125: 9 | G125: 3 | H125: =D125+E125+F125+G125 -> 28 | J125: =COUNTIF(A:A,A125) -> 1
A126: 121870 | B126: ZANELLA | C126: NICOLA | D126: 16 | E126: 2 | G126: 3 | H126: =D126+E126+F126+G126 -> 21 | J126: =COUNTIF(A:A,A126) -> 2
A127: 126687 | B127: ZORZI | C127: ALESSANDRO | D127: 12 | E127: 9 | G127: 3 | H127: =D127+E127+F127+G127 -> 24 | J127: =COUNTIF(A:A,A127) -> 1
A128: * = ammesso/a all'orale | J128: =COUNTIF(A:A,A128) -> 1
J129: =COUNTIF(A:A,A129) -> 0
A130: *** CARPENE' e BUCCI non hanno riconsegnato il testo | J130: =COUNTIF(A:A,A130) -> 1
J131: =COUNTIF(A:A,A131) -> 0
J132: =COUNTIF(A:A,A132) -> 0
A133: Fondamenti di Ricerca Operativa L-A | J133: =COUNTIF(A:A,A133) -> 22
A134: Prova Scritta del 4 Aprile 2003 | J134: =COUNTIF(A:A,A134) -> 1
J135: =COUNTIF(A:A,A135) -> 0
A136: Validita': fino a Luglio 2003 | J136: =COUNTIF(A:A,A136) -> 1
A137: Visione degli elaborati e orali:Martedi' 15 Aprile ore 14.00 Aula 6.1 | J137: =COUNTIF(A:A,A137) -> 1
A138: Prossimi appelli: Giugno, Luglio | J138: =COUNTIF(A:A,A138) -> 1
J139: =COUNTIF(A:A,A139) -> 0
A140: matricola | B140: Cognome | C140: Nome | D140: 1 | E140: 2 | F140: 3 | G140: bonus | H140: voto | J140: =COUNTIF(A:A,A140) -> 24
A141: 122160 | B141: ACQUAVIVA | C141: LUCA | D141: 14 | E141: 7 | G141: 3 | H141: =D141+E141+F141+G141 -> 24 | J141: =COUNTIF(A:A,A141) -> 1
A142: 127356 | B142: AGRESTI | C142: SERENA | D142: 13 | E142: 10 | G142: 0 | H142: =D142+E142+F142+G142 -> 23 | J142: =COUNTIF(A:A,A142) -> 3
A143: 124205 | B143: AMANTINI | C143: ANDREA | D143: 18 | E143: 5 | G143: 3 | H143: =D143+E143+F143+G143 -> 26 | J143: =COUNTIF(A:A,A143) -> 1
A144: 2148059358 | B144: ANGELINI | C144: CLAUDIO | D144: 10 | E144: 4 | G144: 3 | H144: =D144+E144+F144+G144 -> 17 | I144: * | J144: =COUNTIF(A:A,A144) -> 1
A145: 127370 | B145: ARGENTIERO | C145: STEFANO | D145: 18 | E145: 10 | G145: 0 | H145: =D145+E145+F145+G145 -> 28 | J145: =COUNTIF(A:A,A145) -> 2
A146: 124834 | B146: AVOLESE | C146: MARIO | D146: 20 | E146: 3 | G146: 3 | H146: =D146+E146+F146+G146 -> 26 | J146: =COUNTIF(A:A,A146) -> 1
A147: 127940 | B147: BABINI | C147: MARTINA | D147: 13 | E147: 10 | G147: 0 | H147: =D147+E147+F147+G147 -> 23 | J147: =COUNTIF(A:A,A147) -> 3
A148: 123594 | B148: BALDUCCI | C148: DANIELE | D148: 12 | E148: 8 | G148: 0 | H148: =D148+E148+F148+G148 -> 20 | J148: =COUNTIF(A:A,A148) -> 5
A149: 123833 | B149: BARONCINI | C149: DANIELE | D149: 14 | E149: 9 | G149: 0 | H149: =D149+E149+F149+G149 -> 23 | J149: =COUNTIF(A:A,A149) -> 5
A150: 127287 | B150: BARRANO | C150: EMANUELE | D150: 5 | E150: 4 | G150: 0 | H150: Insuff. | J150: =COUNTIF(A:A,A150) -> 5
A151: 121895 | B151: BASSINI | C151: ILARIA | D151: 16 | E151: 10 | G151: 0 | H151: =D151+E151+F151+G151 -> 26 | J151: =COUNTIF(A:A,A151) -> 2
A152: 122915 | B152: BELLINI | C152: MARCO | D152: 20 | E152: 8 | G152: 0 | H152: =D152+E152+F152+G152 -> 28 | J152: =COUNTIF(A:A,A152) -> 3
A153: 123738 | B153: BERGONZINI | C153: CARLO | D153: 20 | E153: 10 | G153: 3 | H153: =D153+E153+F153+G153 -> 33 | J153: =COUNTIF(A:A,A153) -> 1
A154: 2148061513 | B154: BERNABEI | C154: CHIARA | D154: 8 | E154: 7 | G154: 3 | H154: =D154+E154+F154+G154 -> 18 | J154: =COUNTIF(A:A,A154) -> 3
A155: 2108060319 | B155: BERTOLINI | C155: MONICA | D155: 16 | G155: 1 | H155: =D155+E155+F155+G155 -> 17 | I155: *,*** | J155: =COUNTIF(A:A,A155) -> 2
A156: 122282 | B156: BETTI | C156: ALESSANDRO | D156: 11 | E156: 3 | G156: 3 | H156: =D156+E156+F156+G156 -> 17 | I156: * | J156: =COUNTIF(A:A,A156) -> 11
A157: 126705 | B157: BONOLI | C157: NICOLA | D157: 9 | E157: 10 | G157: 3 | H157: =D157+E157+F157+G157 -> 22 | J157: =COUNTIF(A:A,A157) -> 3
A158: 122560 | B158: BRICCHI | C158: LORENZO | D158: 18 | E158: 10 | G158: 0 | H158: =D158+E158+F158+G158 -> 28 | J158: =COUNTIF(A:A,A158) -> 2
A159: 122490 | B159: BRUNETTI | C159: LUCA | D159: 9 | E159: 6 | G159: 0 | H159: Insuff. | J159: =COUNTIF(A:A,A159) -> 3
A160: 121741 | B160: BUCCI | C160: DAVIDE | D160: 18 | E160: 0 | G160: 1 | H160: =D160+E160+F160+G160 -> 19 | I160: *,*** | J160: =COUNTIF(A:A,A160) -> 4
A161: 112432 | B161: CANESTRARI | C161: RAFFAELE | D161: 9 | E161: 6 | G161: 3 | H161: =D161+E161+F161+G161 -> 18 | J161: =COUNTIF(A:A,A161) -> 1
A162: 122942 | B162: CARPENE' | C162: MICHELE | D162: 12 | E162: 6 | G162: 1 | H162: =D162+E162+F162+G162 -> 19 | I162: *,*** | J162: =COUNTIF(A:A,A162) -> 2
A163: 2148063596 | B163: CARPIGNOLI | C163: ANDREA | D163: 20 | E163: 4 | G163: 3 | H163: =D163+E163+F163+G163 -> 27 | J163: =COUNTIF(A:A,A163) -> 2
A164: 122897 | B164: CASSANELLI | C164: FABIO | D164: 4 | E164: 6 | G164: 3 | H164: Insuff. | J164: =COUNTIF(A:A,A164) -> 3
A165: 2148063627 | B165: CIACCI | C165: LUCA | D165: 12 | E165: 6 | G165: 3 | H165: =D165+E165+F165+G165 -> 21 | J165: =COUNTIF(A:A,A165) -> 1
A166: 125550 | B166: COLOMBINI | C166: GABRIELE | D166: 20 | E166: 10 | G166: 3 | H166: =D166+E166+F166+G166 -> 33 | J166: =COUNTIF(A:A,A166) -> 2
A167: 121561 | B167: CONSOLE | C167: MIRKO | D167: 10 | E167: 8 | G167: 3 | H167: =D167+E167+F167+G167 -> 21 | J167: =COUNTIF(A:A,A167) -> 3
A168: 114918 | B168: CORSINI | C168: ALESSIO | D168: 2 | E168: 10 | G168: 0 | H168: Insuff. | J168: =COUNTIF(A:A,A168) -> 6
A169: 123341 | B169: CORTECCHIA | C169: SIMONE | D169: 10 | E169: 10 | G169: 3 | H169: =D169+E169+F169+G169 -> 23 | J169: =COUNTIF(A:A,A169) -> 1
A170: 124787 | B170: CRESCENTINI | C170: EMANUELE | D170: 20 | E170: 8 | G170: 3 | H170: =D170+E170+F170+G170 -> 31 | J170: =COUNTIF(A:A,A170) -> 1
A171: 104911 | B171: DE MARCO | C171: ANDREA | D171: 10 | E171: 9 | G171: 3 | H171: =D171+E171+F171+G171 -> 22 | J171: =COUNTIF(A:A,A171) -> 2
A172: 2148064641 | B172: DEGLIESPOSTI | C172: FRANCESCO | D172: 11 | E172: 10 | G172: 3 | H172: =D172+E172+F172+G172 -> 24 | J172: =COUNTIF(A:A,A172) -> 1
A173: 121471 | B173: DI CARLO | C173: MATTEO | D173: 20 | E173: 10 | G173: 3 | H173: =D173+E173+F173+G173 -> 33 | J173: =COUNTIF(A:A,A173) -> 1
A174: 121743 | B174: DI CREDICO | C174: FEDERICO | D174: 19 | E174: 10 | G174: 0 | H174: =D174+E174+F174+G174 -> 29 | J174: =COUNTIF(A:A,A174) -> 2
A175: 123763 | B175: DI PIETRO | C175: AZZURRA | D175: 15 | E175: 10 | G175: 3 | H175: =D175+E175+F175+G175 -> 28 | J175: =COUNTIF(A:A,A175) -> 1
A176: 104572 | B176: DI RIENZO | C176: MICHELE | D176: 14 | E176: 8 | G176: 3 | H176: =D176+E176+F176+G176 -> 25 | J176: =COUNTIF(A:A,A176) -> 1
A177: 125672 | B177: DOLIF | C177: EMILIANO | D177: 17 | E177: 10 | G177: 0 | H177: =D177+E177+F177+G177 -> 27 | J177: =COUNTIF(A:A,A177) -> 2
A178: 122344 | B178: FOSCHI | C178: DAVIDE | D178: 10 | E178: 8 | G178: 3 | H178: =D178+E178+F178+G178 -> 21 | J178: =COUNTIF(A:A,A178) -> 1
A179: 121701 | B179: GATTARI | C179: GABRIELE | D179: 15 | E179: 7 | G179: 0 | H179: =D179+E179+F179+G179 -> 22 | J179: =COUNTIF(A:A,A179) -> 2
A180: 2148064429 | B180: GENTILI | C180: PAOLO | D180: 15 | E180: 10 | G180: 0 | H180: =D180+E180+F180+G180 -> 25 | J180: =COUNTIF(A:A,A180) -> 2
A181: 128819 | B181: GIGANTE | C181: PAOLO | D181: 15 | E181: 8 | G181: 0 | H181: =D181+E181+F181+G181 -> 23 | J181: =COUNTIF(A:A,A181) -> 2
A182: 2148062452 | B182: GIORGI | C182: GIANMARCO | D182: 16 | E182: 3 | G182: 3 | H182: =D182+E182+F182+G182 -> 22 | J182: =COUNTIF(A:A,A182) -> 8
A183: 2148062024 | B183: GIOVACCHINI | C183: PARIDE | D183: 3 | E183: 8 | G183: 3 | H183: Insuff. | J183: =COUNTIF(A:A,A183) -> 4
A184: 121979 | B184: GOTTARDI | C184: GIANPAOLO | D184: 11 | E184: 7 | G184: 0 | H184: =D184+E184+F184+G184 -> 18 | J184: =COUNTIF(A:A,A184) -> 4
A185: 122284 | B185: GRUPPIONI | C185: EMANUELE | D185: 17 | E185: 6 | G185: 0 | H185: =D185+E185+F185+G185 -> 23 | J185: =COUNTIF(A:A,A185) -> 2
A186: 121673 | B186: GUADAGNO | C186: POTITO | D186: 17 | E186: 6 | G186: 0 | H186: =D186+E186+F186+G186 -> 23 | J186: =COUNTIF(A:A,A186) -> 2
A187: 107852 | B187: HUYNH | C187: HOANG CHAU | D187: 10 | E187: 6 | G187: 3 | H187: =D187+E187+F187+G187 -> 19 | J187: =COUNTIF(A:A,A187) -> 1
A188: 122738 | B188: LEARDINI | C188: FRANCESCO | D188: 18 | E188: 6 | G188: 0 | H188: =D188+E188+F188+G188 -> 24 | J188: =COUNTIF(A:A,A188) -> 2
A189: 128035 | B189: LEONETTI | C189: FRANCESCO | D189: 20 | E189: 8 | G189: 0 | H189: =D189+E189+F189+G189 -> 28 | J189: =COUNTIF(A:A,A189) -> 4
A190: 900003528 | B190: LOSARDO | C190: AGOSTINO | D190: 20 | E190: 10 | G190: 0 | H190: =D190+E190+F190+G190 -> 30 | J190: =COUNTIF(A:A,A190) -> 2
A191: 127588 | B191: MANCA | C191: MARA | D191: 10 | E191: 7 | G191: 3 | H191: =D191+E191+F191+G191 -> 20 | J191: =COUNTIF(A:A,A191) -> 2
A192: 2146063842 | B192: MANCINI | C192: ELISA | D192: 19 | E192: 7 | G192: 3 | H192: =D192+E192+F192+G192 -> 29 | J192: =COUNTIF(A:A,A192) -> 1
A193: 123804 | B193: MANSERVISI | C193: ALBERTO | D193: 20 | E193: 7 | G193: 0 | H193: =D193+E193+F193+G193 -> 27 | J193: =COUNTIF(A:A,A193) -> 2
A194: 127966 | B194: MERCATI | C194: ALBERTO | D194: 19 | E194: 9 | G194: 0 | H194: =D194+E194+F194+G194 -> 28 | J194: =COUNTIF(A:A,A194) -> 2
A195: 2147059008 | B195: MINOTTI | C195: LORENZO | D195: 11 | E195: 0 | G195: 3 | H195: Insuff. | J195: =COUNTIF(A:A,A195) -> 2
A196: 121960 | B196: MIRANDOLA | C196: ALEX | D196: 20 | E196: 10 | G196: 0 | H196: =D196+E196+F196+G196 -> 30 | J196: =COUNTIF(A:A,A196) -> 2
A197: 123175 | B197: MONROY | C197: RICARDO | D197: 10 | E197: 5 | G197: 0 | H197: Insuff. | J197: =COUNTIF(A:A,A197) -> 4
A198: 112663 | B198: MONTAUTI | C198: ANDREA | D198: 20 | E198: 9 | G198: 3 | H198: =D198+E198+F198+G198 -> 32 | J198: =COUNTIF(A:A,A198) -> 1
A199: 123368 | B199: PASINI | C199: ENRICO | D199: 18 | E199: 9 | G199: 3 | H199: =D199+E199+F199+G199 -> 30 | J199: =COUNTIF(A:A,A199) -> 1
A200: 124882 | B200: PIZZI | C200: ANGELO | D200: 14 | E200: 2 | G200: 3 | H200: =D200+E200+F200+G200 -> 19 | J200: =COUNTIF(A:A,A200) -> 2
A201: 2148060217 | B201: RIVALTA | C201: STEFANO | D201: 16 | E201: 6 | G201: 3 | H201: =D201+E201+F201+G201 -> 25 | J201: =COUNTIF(A:A,A201) -> 1
A202: 2142062040 | B202: ROBIATI | C202: IVAN | D202: 17 | E202: 10 | G202: 3 | H202: =D202+E202+F202+G202 -> 30 | J202: =COUNTIF(A:A,A202) -> 1
A203: 2148062084 | B203: ROCCIA | C203: MARIA TERESA | D203: 18 | E203: 7 | G203: 3 | H203: =D203+E203+F203+G203 -> 28 | J203: =COUNTIF(A:A,A203) -> 1
A204: 124273 | B204: ROMANELLI | C204: ELIO | D204: 11 | E204: 0 | G204: 3 | H204: Insuff. | J204: =COUNTIF(A:A,A204) -> 4
A205: 125474 | B205: ROSSINI | C205: PROSPERO | D205: 15 | E205: 2 | G205: 3 | H205: =D205+E205+F205+G205 -> 20 | J205: =COUNTIF(A:A,A205) -> 3
A206: 2108057373 | B206: RUSSO | C206: ROBERTO | D206: 9 | E206: 5 | G206: 3 | H206: =D206+E206+F206+G206 -> 17 | I206: * | J206: =COUNTIF(A:A,A206) -> 2
A207: 121465 | B207: SALICETTI | C207: ANDREA | D207: 16 | E207: 5 | G207: 3 | H207: =D207+E207+F207+G207 -> 24 | J207: =COUNTIF(A:A,A207) -> 2
A208: 106141 | B208: SANTINI | C208: MATTEO | D208: 11 | E208: 1 | G208: 3 | H208: Insuff. | J208: =COUNTIF(A:A,A208) -> 2
A209: 123119 | B209: SPOLZINO | C209: SIMONE | D209: 20 | E209: 10 | G209: 3 | H209: =D209+E209+F209+G209 -> 33 | J209: =COUNTIF(A:A,A209) -> 1
A210: 900000355 | B210: SREPFLER | C210: SRGJAN | D210: 6 | E210: 5 | G210: 3 | H210: Insuff. | J210: =COUNTIF(A:A,A210) -> 5
A211: ?????? | B211: SUCCI | C211: FEDERICO | D211: 15 | E211: 5 | G211: 3 | H211: =D211+E211+F211+G211 -> 23 | J211: =COUNTIF(A:A,A211) -> 1
A212: 108213 | B212: SUPERGA | C212: FULVIO | D212: 15 | E212: 3 | G212: 3 | H212: =D212+E212+F212+G212 -> 21 | J212: =COUNTIF(A:A,A212) -> 2
A213: 123238 | B213: TAMAGNINI | C213: STEFANO | D213: 15 | E213: 5 | G213: 3 | H213: =D213+E213+F213+G213 -> 23 | J213: =COUNTIF(A:A,A213) -> 3
A214: 123007 | B214: TARONI | C214: MAURO | D214: 9 | E214: 9 | G214: 3 | H214: =D214+E214+F214+G214 -> 21 | J214: =COUNTIF(A:A,A214) -> 1
A215: 125501 | B215: UBERTINI | C215: GABRIELE | D215: 17 | E215: 10 | G215: 3 | H215: =D215+E215+F215+G215 -> 30 | J215: =COUNTIF(A:A,A215) -> 1
A216: 108113 | B216: VERNA | C216: GERARDO | D216: 8 | E216: 6 | G216: 3 | H216: =D216+E216+F216+G216 -> 17 | I216: * | J216: =COUNTIF(A:A,A216) -> 5
A217: 128027 | B217: VIOLI | C217: VALENTINA | D217: 12 | E217: 2 | G217: 0 | H217: Insuff. | J217: =COUNTIF(A:A,A217) -> 5
A218: 125471 | B218: VITALE | C218: VINCENZO | D218: 13 | E218: 7 | G218: 3 | H218: =D218+E218+F218+G218 -> 23 | J218: =COUNTIF(A:A,A218) -> 1
A219: 122074 | B219: VOLI | C219: STEFANO 12 | E219: 3 | G219: 0 | H219: Insuff. | J219: =COUNTIF(A:A,A219) -> 6
A220: 121870 | B220: ZANELLA | C220: NICOLA | D220: 20 | E220: 6 | G220: 0 | H220: =D220+E220+F220+G220 -> 26 | J220: =COUNTIF(A:A,A220) -> 2
A221: * = ammesso all'orale | J221: =COUNTIF(A:A,A221) -> 6
A222: *** = testo non riconsegnato | J222: =COUNTIF(A:A,A222) -> 1
J223: =COUNTIF(A:A,A223) -> 0
J224: =COUNTIF(A:A,A224) -> 0
A225: Fondamenti di Ricerca Operativa L-A | J225: =COUNTIF(A:A,A225) -> 22
A226: Prova Scritta del 26 Giugno 2003 | J226: =COUNTIF(A:A,A226) -> 1
J227: =COUNTIF(A:A,A227) -> 0
A228: Validita': fino a Settembre 2003 | J228: =COUNTIF(A:A,A228) -> 2
A229: Visione degli elaborati e orali:Lunedi' 30 Giugno ore 17.00 Aula 6.1 | J229: =COUNTIF(A:A,A229) -> 1
A230: Prossimi appelli: Luglio, Settembre, Gennaio | J230: =COUNTIF(A:A,A230) -> 2
J231: =COUNTIF(A:A,A231) -> 0
A232: matricola | B232: Cognome | C232: Nome | D232: 1 | E232: 2 | F232: 3 | G232: bonus | H232: voto | J232: =COUNTIF(A:A,A232) -> 24
A233: 127356 | B233: AGRESTI | C233: SERENA | D233: 18 | E233: 5 | G233: 0 | H233: =D233+E233+F233+G233 -> 23 | J233: =COUNTIF(A:A,A233) -> 3
A234: 127287 | B234: BARRANO | C234: EMANUELE | D234: 12 | E234: 4 | G234: 0 | H234: =D234+E234+F234+G234 -> 16 | I234: * | J234: =COUNTIF(A:A,A234) -> 5
A235: 122490 | B235: BRUNETTI | C235: LUCA | D235: 24 | E235: 5 | G235: 0 | H235: =D235+E235+F235+G235 -> 29 | J235: =COUNTIF(A:A,A235) -> 3
A236: 121741 | B236: BUCCI | C236: DAVIDE | D236: 12 | E236: 5 | G236: 0 | H236: =D236+E236+F236+G236 -> 17 | I236: * | J236: =COUNTIF(A:A,A236) -> 4
A237: 128724 | B237: CESARI | C237: EDOARDO | D237: 11 | E237: 1 | G237: 3 | H237: Insuff. | J237: =COUNTIF(A:A,A237) -> 3
A238: 114918 | B238: CORSINI | C238: ALESSIO | D238: 8 | E238: 4 | G238: 0 | H238: Insuff. | J238: =COUNTIF(A:A,A238) -> 6
A239: 2148062024 | B239: GIOVACCHINI | C239: PARIDE | D239: 12 | E239: 3 | G239: 0 | H239: Insuff. | J239: =COUNTIF(A:A,A239) -> 4
A240: 121979 | B240: GOTTARDI | C240: GIANPAOLO | D240: 22 | E240: 3 | G240: 0 | H240: =D240+E240+F240+G240 -> 25 | J240: =COUNTIF(A:A,A240) -> 4
A241: 123175 | B241: MONROY | C241: RICARDO | D241: 12 | E241: 4 | G241: 0 | H241: =D241+E241+F241+G241 -> 16 | I241: * | J241: =COUNTIF(A:A,A241) -> 4
A242: 121661 | B242: MORLUNGHI | C242: ANDREA | D242: 16 | E242: 3 | G242: 0 | H242: =D242+E242+F242+G242 -> 19 | J242: =COUNTIF(A:A,A242) -> 3
A243: 900004149 | B243: RINALDI | C243: MARIO | D243: 10 | E243: 4 | G243: 0 | H243: Insuff. | J243: =COUNTIF(A:A,A243) -> 3
A244: 108113 | B244: VERNA | C244: GERARDO | D244: 8 | E244: 3 | G244: 0 | H244: Insuff. | J244: =COUNTIF(A:A,A244) -> 5
A245: 128027 | B245: VIOLI | C245: VALENTINA | D245: 14 | E245: 5 | G245: 0 | H245: =D245+E245+F245+G245 -> 19 | J245: =COUNTIF(A:A,A245) -> 5
A246: 122074 | B246: VOLI | C246: STEFANO | D246: 5 | E246: 3 | G246: 0 | H246: Insuff. | J246: =COUNTIF(A:A,A246) -> 6
A247: * = ammesso all'orale | J247: =COUNTIF(A:A,A247) -> 6
J248: =COUNTIF(A:A,A248) -> 0
J249: =COUNTIF(A:A,A249) -> 0
A250: Fondamenti di Ricerca Operativa L-A | J250: =COUNTIF(A:A,A250) -> 22
A251: Prova Scritta del 16 Luglio 2003 | J251: =COUNTIF(A:A,A251) -> 1
J252: =COUNTIF(A:A,A252) -> 0
A253: Validita': fino a Settembre 2003 | J253: =COUNTIF(A:A,A253) -> 2
A254: Visione degli elaborati: Martedi' 22 Luglio ore 17.00 Aula 6.1 | J254: =COUNTIF(A:A,A254) -> 1
A255: Orali: Martedi' 22/7 ore 17 Aula 6.1, Venerdi' 25/7 ore 15 Aula 6.1 | J255: =COUNTIF(A:A,A255) -> 1
A256: Prossimi appelli: Settembre, Gennaio | J256: =COUNTIF(A:A,A256) -> 2
J257: =COUNTIF(A:A,A257) -> 0
A258: matricola | B258: Cognome | C258: Nome | D258: 1 | E258: 2 | F258: 3 | G258: bonus | H258: voto | J258: =COUNTIF(A:A,A258) -> 24
A259: 127940 | B259: BABINI | C259: MARTINA | D259: 0 | E259: 17 | F259: 8 | G259: 0 | H259: =D259+E259+F259+G259 -> 25 | J259: =COUNTIF(A:A,A259) -> 3
A260: 127287 | B260: BARRANO | C260: EMANUELE | D260: 0 | E260: 7 | F260: 6 | G260: 0 | H260: Insuff. | J260: =COUNTIF(A:A,A260) -> 5
A261: 121741 | B261: BUCCI | C261: DAVIDE | D261: 0 | E261: 14 | F261: 5 | G261: 0 | H261: =D261+E261+F261+G261 -> 19 | J261: =COUNTIF(A:A,A261) -> 4
A262: 128724 | B262: CESARI | C262: EDOARDO | D262: 0 | E262: 11 | F262: 4 | G262: 0 | H262: Insuff. | J262: =COUNTIF(A:A,A262) -> 3
A263: 121561 | B263: CONSOLE | C263: MIRKO | D263: 0 | E263: 10 | F263: 8 | G263: 0 | H263: =D263+E263+F263+G263 -> 18 | J263: =COUNTIF(A:A,A263) -> 3
A264: 114918 | B264: CORSINI | C264: ALESSIO | D264: 0 | E264: 11 | F264: 2 | G264: 0 | H264: Insuff. | J264: =COUNTIF(A:A,A264) -> 6
A265: 900003191 | B265: DI STEFANO | C265: NUNZIO | D265: 0 | E265: 14 | F265: 0 | G265: 3 | H265: =D265+E265+F265+G265 -> 17 | I265: * | J265: =COUNTIF(A:A,A265) -> 6
A266: 113353 | B266: GALLETTO | C266: GIANMARCO | D266: 0 | E266: 11 | F266: 0 | G266: 3 | H266: Insuff. | J266: =COUNTIF(A:A,A266) -> 2
A267: 2148062024 | B267: GIOVACCHINI | C267: PARIDE | D267: 0 | E267: 0 | F267: 6 | G267: 0 | H267: Insuff. | J267: =COUNTIF(A:A,A267) -> 4
A268: 121979 | B268: GOTTARDI | C268: GIANPAOLO | D268: 0 | E268: 21 | F268: 7 | G268: 0 | H268: =D268+E268+F268+G268 -> 28 | J268: =COUNTIF(A:A,A268) -> 4
A269: 124485 | B269: LACCHINI | C269: ROBERTO | D269: 0 | E269: 11 | F269: 3 | G269: 3 | H269: =D269+E269+F269+G269 -> 17 | I269: * | J269: =COUNTIF(A:A,A269) -> 1
A270: 123175 | B270: MONROY | C270: RICARDO | D270: 0 | E270: 18 | F270: 6 | G270: 0 | H270: =D270+E270+F270+G270 -> 24 | J270: =COUNTIF(A:A,A270) -> 4
A271: 121661 | B271: MORLUNGHI | C271: ANDREA | D271: 0 | E271: 17 | F271: 7 | G271: 0 | H271: =D271+E271+F271+G271 -> 24 | J271: =COUNTIF(A:A,A271) -> 3
A272: 900004149 | B272: RINALDI | C272: MARIO | D272: 0 | E272: 11 | F272: 5 | G272: 0 | H272: =D272+E272+F272+G272 -> 16 | I272: * | J272: =COUNTIF(A:A,A272) -> 3
A273: 128176 | B273: ROSADA | C273: GIOVANNI BATTISTA | D273: 0 | E273: 20 | F273: 0 | G273: 3 | H273: =D273+E273+F273+G273 -> 23 | J273: =COUNTIF(A:A,A273) -> 3
A274: 125474 | B274: ROSSINI | C274: PROSPERO | D274: 0 | E274: 13 | F274: 3 | G274: 0 | H274: =D274+E274+F274+G274 -> 16 | I274: * | J274: =COUNTIF(A:A,A274) -> 3
A275: 106141 | B275: SANTINI | C275: MATTEO | D275: 0 | E275: 16 | F275: 7 | G275: 0 | H275: =D275+E275+F275+G275 -> 23 | J275: =COUNTIF(A:A,A275) -> 2
A276: 108113 | B276: VERNA | C276: GERARDO | D276: 0 | E276: 14 | F276: 5 | G276: 0 | H276: =D276+E276+F276+G276 -> 19 | J276: =COUNTIF(A:A,A276) -> 5
A277: 128027 | B277: VIOLI | C277: VALENTINA | D277: 0 | E277: 15 | F277: 7 | G277: 0 | H277: =D277+E277+F277+G277 -> 22 | J277: =COUNTIF(A:A,A277) -> 5
A278: * = ammesso all'orale | J278: =COUNTIF(A:A,A278) -> 6
J279: =COUNTIF(A:A,A279) -> 0
J280: =COUNTIF(A:A,A280) -> 0
A281: Fondamenti di Ricerca Operativa L-A | J281: =COUNTIF(A:A,A281) -> 22
A282: Prova Scritta del 9 Settembre 2003 | J282: =COUNTIF(A:A,A282) -> 1
J283: =COUNTIF(A:A,A283) -> 0
A284: Validita': fino a Marzo 2004 | J284: =COUNTIF(A:A,A284) -> 1
A285: Visione degli elaborati e orali: Mercoledi' 17 Settembre ore 16.00, Aula 6.1 | J285: =COUNTIF(A:A,A285) -> 1
A286: Prossimo appello: Gennaio | J286: =COUNTIF(A:A,A286) -> 1
J287: =COUNTIF(A:A,A287) -> 0
A288: matricola | B288: Cognome | C288: Nome | D288: 1 | E288: 2 | F288: 3 | G288: bonus | H288: voto | J288: =COUNTIF(A:A,A288) -> 24
A289: 123833 | B289: BARONCINI | C289: DANIELE | D289: 13 | E289: 0 | G289: 0 | H289: Insuff. | J289: =COUNTIF(A:A,A289) -> 5
A290: 127287 | B290: BARRANO | C290: EMANUELE | D290: 14 | E290: 4 | G290: 0 | H290: =D290+E290+F290+G290 -> 18 | J290: =COUNTIF(A:A,A290) -> 5
A291: 122915 | B291: BELLINI | C291: MARCO | D291: 17 | E291: 6 | G291: 0 | H291: =D291+E291+F291+G291 -> 23 | J291: =COUNTIF(A:A,A291) -> 3
A292: 126705 | B292: BONOLI | C292: NICOLA | D292: 8 | E292: 6 | G292: 0 | H292: Insuff. | J292: =COUNTIF(A:A,A292) -> 3
A293: 104375 | B293: CERUTI | C293: ANDREA | D293: 16 | E293: 0 | G293: 0 | H293: =D293+E293+F293+G293 -> 16 | I293: * | J293: =COUNTIF(A:A,A293) -> 4
A294: 121561 | B294: CONSOLE | C294: MIRKO | D294: 21 | E294: 6 | G294: 0 | H294: =D294+E294+F294+G294 -> 27 | J294: =COUNTIF(A:A,A294) -> 3
A295: 114918 | B295: CORSINI | C295: ALESSIO | D295: 3 | E295: 4 | G295: 0 | H295: Insuff. | J295: =COUNTIF(A:A,A295) -> 6
A296: 900005294 | B296: D'AMELIO | C296: PASQUALINO | D296: 3 | E296: 5 | G296: 3 | H296: Insuff. | J296: =COUNTIF(A:A,A296) -> 4
A297: 900003191 | B297: DI STEFANO | C297: NUNZIO | D297: 11 | E297: 3 | G297: 0 | H297: Insuff. | J297: =COUNTIF(A:A,A297) -> 6
A298: 113353 | B298: GALLETTO | C298: GIANMARCO | D298: 23 | E298: 0 | G298: 0 | H298: =D298+E298+F298+G298 -> 23 | J298: =COUNTIF(A:A,A298) -> 2
A299: 127861 | B299: GELSUMINO | C299: ERIKA | D299: 9 | E299: 1 | G299: 0 | H299: Insuff. | J299: =COUNTIF(A:A,A299) -> 8
A300: 2148062452 | B300: GIORGI | C300: GIANMARCO | D300: 11 | E300: 5 | G300: 0 | H300: 16 | I300: * | J300: =COUNTIF(A:A,A300) -> 8
A301: 2148062024 | B301: GIOVACCHINI | C301: PARIDE | D301: 14 | E301: 2 | G301: 0 | H301: =D301+E301+F301+G301 -> 16 | I301: * | J301: =COUNTIF(A:A,A301) -> 4
A302: 128035 | B302: LEONETTI | C302: FRANCESCO | D302: 3 | E302: 4 | G302: 0 | H302: Insuff. | J302: =COUNTIF(A:A,A302) -> 4
A303: 124166 | B303: LUCCHI | C303: FRANCESCO | D303: 21 | E303: 6 | G303: 0 | H303: =D303+E303+F303+G303 -> 27 | J303: =COUNTIF(A:A,A303) -> 2
A304: 2148063924 | B304: MANARESI | C304: FILIPPO | D304: 12 | E304: 3 | G304: 3 | H304: =D304+E304+F304+G304 -> 18 | J304: =COUNTIF(A:A,A304) -> 1
A305: 111021 | B305: MELCHIORRE | C305: PAOLO | D305: 15 | E305: 5 | G305: 3 | H305: =D305+E305+F305+G305 -> 23 | J305: =COUNTIF(A:A,A305) -> 1
A306: 128984 | B306: RASPADORI | C306: GIANLUCA | D306: 4 | E306: 6 | G306: 3 | H306: Insuff. | J306: =COUNTIF(A:A,A306) -> 5
A307: 125474 | B307: ROSSINI | C307: PROSPERO | D307: 10 | E307: 6 | G307: 0 | H307: =D307+E307+F307+G307 -> 16 | I307: * | J307: =COUNTIF(A:A,A307) -> 3
A308: 108213 | B308: SUPERGA | C308: FULVIO | D308: 17 | E308: 6 | G308: 3 | H308: =D308+E308+F308+G308 -> 26 | J308: =COUNTIF(A:A,A308) -> 2
A309: 128027 | B309: VIOLI | C309: VALENTINA | D309: 14 | E309: 4 | G309: 0 | H309: =D309+E309+F309+G309 -> 18 | J309: =COUNTIF(A:A,A309) -> 5
A310: * = ammesso all'orale | J310: =COUNTIF(A:A,A310) -> 6
J311: =COUNTIF(A:A,A311) -> 0
J312: =COUNTIF(A:A,A312) -> 0
J313: =COUNTIF(A:A,A313) -> 0
A314: Fondamenti di Ricerca Operativa L-A | J314: =COUNTIF(A:A,A314) -> 22
A315: Prova Scritta del 16 Gennaio 2004 | J315: =COUNTIF(A:A,A315) -> 1
J316: =COUNTIF(A:A,A316) -> 0
A317: Validita': fino a Aprile 2004 | J317: =COUNTIF(A:A,A317) -> 1
A318: Visione degli elaborati e orali: Mercoledi' 21Gennaio 2004, ore 15.00, Aula 6.1 | J318: =COUNTIF(A:A,A318) -> 1
A319: Prossimo appello: Marzo | J319: =COUNTIF(A:A,A319) -> 2
J320: =COUNTIF(A:A,A320) -> 0
A321: matricola | B321: Cognome | C321: Nome | D321: 1 | E321: 2 | F321: 3 | G321: bonus | H321: voto | J321: =COUNTIF(A:A,A321) -> 24
A322: 2108060319 | B322: BERTOLINI | C322: MONICA | D322: 13 | E322: 8 | G322: 0 | H322: =SUM(D322:G322) -> 21 | J322: =COUNTIF(A:A,A322) -> 2
A323: 126705 | B323: BONOLI | C323: NICOLA | D323: 15 | E323: 10 | G323: 0 | H323: =SUM(D323:G323) -> 25 | J323: =COUNTIF(A:A,A323) -> 3
A324: 121741 | B324: BUCCI | C324: DAVIDE | D324: 9 | E324: 10 | G324: 0 | H324: =SUM(D324:G324) -> 19 | J324: =COUNTIF(A:A,A324) -> 4
A325: 2148063596 | B325: CARPIGNOLI | C325: ANDREA | D325: 11 | E325: 9 | G325: 0 | H325: =SUM(D325:G325) -> 20 | J325: =COUNTIF(A:A,A325) -> 2
A326: 126273 | B326: CASETTA | C326: FABRIZIO | D326: 13 | E326: 10 | G326: 3 | H326: =SUM(D326:G326) -> 26 | J326: =COUNTIF(A:A,A326) -> 1
A327: 122897 | B327: CASSANELLI | C327: FABIO | G327: 0 | H327: Annullato | I327: * | J327: =COUNTIF(A:A,A327) -> 3
A328: 104375 | B328: CERUTI | C328: ANDREA | D328: 8 | E328: 3 | G328: 0 | H328: Insuff. | J328: =COUNTIF(A:A,A328) -> 4
A329: 114918 | B329: CORSINI | C329: ALESSIO | D329: 10 | E329: 8 | G329: 0 | H329: =SUM(D329:G329) -> 18 | J329: =COUNTIF(A:A,A329) -> 6
A330: 900005294 | B330: D'AMELIO | C330: PASQUALINO | D330: 6 | E330: 8 | G330: 0 | H330: Insuff. | J330: =COUNTIF(A:A,A330) -> 4
A331: 127858 | B331: FANTUZZI | C331: ELLIS | G331: 3 | H331: Annullato | I331: ** | J331: =COUNTIF(A:A,A331) -> 2
A332: 127861 | B332: GELSUMINO | C332: ERIKA | D332: 8 | E332: 10 | G332: 0 | H332: =SUM(D332:G332) -> 18 | J332: =COUNTIF(A:A,A332) -> 8
A333: 128035 | B333: LEONETTI | C333: FRANCESCO | D333: 11 | E333: 10 | G333: 0 | H333: =SUM(D333:G333) -> 21 | J333: =COUNTIF(A:A,A333) -> 4
A334: 2108057373 | B334: RUSSO | C334: ROBERTO | D334: 9 | E334: 9 | G334: 0 | H334: =SUM(D334:G334) -> 18 | J334: =COUNTIF(A:A,A334) -> 2
A335: 108113 | B335: VERNA | C335: GERARDO | D335: 9 | E335: 5 | G335: 0 | H335: Insuff. | J335: =COUNTIF(A:A,A335) -> 5
A336: 122074 | B336: VOLI | C336: STEFANO | D336: 16 | E336: 1 | G336: 0 | H336: =SUM(D336:G336) -> 17 | I336: *** | J336: =COUNTIF(A:A,A336) -> 6
A337: * =** | J337: =COUNTIF(A:A,A337) -> 9
A338: *** = ammesso all'orale | J338: =COUNTIF(A:A,A338) -> 6
J339: =COUNTIF(A:A,A339) -> 0
J340: =COUNTIF(A:A,A340) -> 0
J341: =COUNTIF(A:A,A341) -> 0
A342: Fondamenti di Ricerca Operativa L-A | J342: =COUNTIF(A:A,A342) -> 22
A343: Prova Scritta del 24 Marzo 2004 | J343: =COUNTIF(A:A,A343) -> 1
J344: =COUNTIF(A:A,A344) -> 0
A345: Validita': fino a Giugno 2004 | J345: =COUNTIF(A:A,A345) -> 1
A346: Visione degli elaborati e orali: Lunedi' 5 Aprile 2004, ore 15.00, Aula 6.1 | J346: =COUNTIF(A:A,A346) -> 1
A347: Prossimo appello: Aprile | J347: =COUNTIF(A:A,A347) -> 1
J348: =COUNTIF(A:A,A348) -> 0
A349: matricola | B349: Cognome | C349: Nome | D349: 1 | E349: 2 | F349: 3 | G349: bonus | H349: voto | J349: =COUNTIF(A:A,A349) -> 24
A350: 139035 | B350: ALBERTIN | C350: MASSIMO | D350: 19 | E350: 4 | G350: 3 | H350: =SUM(D350:G350) -> 26 | J350: =COUNTIF(A:A,A350) -> 1
A351: 138771 | B351: ANDOLFO | C351: MARCO | D351: 15 | E351: 9 | G351: 3 | H351: =SUM(D351:G351) -> 27 | J351: =COUNTIF(A:A,A351) -> 1
A352: 900007225 | B352: ANGJELI | C352: ELIDOR | D352: 20 | E352: 7 | G352: 3 | H352: =SUM(D352:G352) -> 30 | J352: =COUNTIF(A:A,A352) -> 1
A353: 142378 | B353: ANGRISANI | C353: ANDREA | D353: 19 | E353: 9 | G353: 3 | H353: =SUM(D353:G353) -> 31 | J353: =COUNTIF(A:A,A353) -> 1
A354: 143116 | B354: AZZINI | C354: NICOLA | D354: 21 | E354: 9 | G354: 3 | H354: =SUM(D354:G354) -> 33 | J354: =COUNTIF(A:A,A354) -> 1
A355: 145646 | B355: BAMBINI | C355: STEFANO | D355: 18 | E355: 5 | G355: 3 | H355: =SUM(D355:G355) -> 26 | J355: =COUNTIF(A:A,A355) -> 1
A356: 139494 | B356: BARBIERI | C356: DIEGO | D356: 19 | E356: 6 | G356: 3 | H356: =SUM(D356:G356) -> 28 | J356: =COUNTIF(A:A,A356) -> 1
A357: 123833 | B357: BARONCINI | C357: DANIELE | D357: 8 | E357: 6 | G357: 0 | H357: Insuff. | J357: =COUNTIF(A:A,A357) -> 5
A358: 123183 | B358: BELLOTTI | C358: NICOLA | D358: 17 | E358: 6 | G358: 3 | H358: =SUM(D358:G358) -> 26 | J358: =COUNTIF(A:A,A358) -> 1
A359: 142421 | B359: BELTRANDI | C359: CRISTIAN | D359: 3 | E359: 0 | G359: 3 | H359: Insuff. | J359: =COUNTIF(A:A,A359) -> 1
B360: BERARDI | C360: FRANCESCO | D360: 21 | E360: 9 | G360: 3 | H360: =SUM(D360:G360) -> 33 | J360: =COUNTIF(A:A,A360) -> 0
A361: 2148061513 | B361: BERNABEI | C361: CHIARA | D361: 7 | E361: 6 | G361: 0 | H361: Insuff. | J361: =COUNTIF(A:A,A361) -> 3
A362: 124835 | B362: BERTACCHINI | C362: RICCARDO ANDREA | D362: 13 | E362: 8 | G362: 3 | H362: =SUM(D362:G362) -> 24 | J362: =COUNTIF(A:A,A362) -> 1
A363: 143597 | B363: BETTI | C363: DANIELE | D363: 17 | E363: 6 | G363: 3 | H363: =SUM(D363:G363) -> 26 | J363: =COUNTIF(A:A,A363) -> 1
A364: 141552 | B364: BONFATTI | C364: VALERIO | D364: 20 | E364: 6 | G364: 3 | H364: =SUM(D364:G364) -> 29 | J364: =COUNTIF(A:A,A364) -> 1
A365: 139786 | B365: BONSI | C365: VALENTINA | D365: 8 | E365: 9 | G365: 3 | H365: =SUM(D365:G365) -> 20 | J365: =COUNTIF(A:A,A365) -> 2
A366: 142103 | B366: BORIONI | C366: VALERIO | D366: 15 | E366: 8 | G366: 3 | H366: =SUM(D366:G366) -> 26 | J366: =COUNTIF(A:A,A366) -> 1
A367: 2148062305 | B367: BRUNELLI | C367: FRANCESCA | D367: 10 | E367: 2 | G367: 3 | H367: Insuff. | J367: =COUNTIF(A:A,A367) -> 4
A368: 149951 | B368: BUCCO | C368: NICOLA | D368: 16 | E368: 7 | G368: 3 | H368: =SUM(D368:G368) -> 26 | J368: =COUNTIF(A:A,A368) -> 1
A369: 140054 | B369: CALEGARI | C369: ROBERTA | D369: 21 | E369: 6 | G369: 3 | H369: =SUM(D369:G369) -> 30 | J369: =COUNTIF(A:A,A369) -> 1
A370: 138890 | B370: CAMPEGGI | C370: CLAUDIO | D370: 13 | E370: 7 | G370: 3 | H370: =SUM(D370:G370) -> 23 | J370: =COUNTIF(A:A,A370) -> 1
A371: 142244 | B371: CAMPELLONE | C371: DAVIDE | D371: 20 | E371: 9 | G371: 3 | H371: =SUM(D371:G371) -> 32 | J371: =COUNTIF(A:A,A371) -> 1
A372: 150090 | B372: CAMURANI | C372: MARCO | D372: 12 | E372: 6 | G372: 3 | H372: =SUM(D372:G372) -> 21 | J372: =COUNTIF(A:A,A372) -> 1
A373: 900007453 | B373: CANDREVA | C373: ENZO ALBERTO | D373: 18 | E373: 6 | G373: 3 | H373: =SUM(D373:G373) -> 27 | J373: =COUNTIF(A:A,A373) -> 1
A374: 146548 | B374: CAPPA | C374: SEBASTIANO | D374: 21 | E374: 1 | G374: 3 | H374: =SUM(D374:G374) -> 25 | J374: =COUNTIF(A:A,A374) -> 1
A375: 122897 | B375: CASSANELLI | C375: FABIO | D375: 14 | E375: 4 | G375: 0 | H375: =SUM(D375:G375) -> 18 | J375: =COUNTIF(A:A,A375) -> 3
A376: 126003 | B376: CASSANI | C376: RICCARDO | D376: 16 | E376: 7 | G376: 3 | H376: =SUM(D376:G376) -> 26 | J376: =COUNTIF(A:A,A376) -> 1
A377: 128045 | B377: CAVALLARO | C377: FRANCESCO | D377: 17 | E377: 3 | G377: 3 | H377: =SUM(D377:G377) -> 23 | J377: =COUNTIF(A:A,A377) -> 4
A378: 104375 | B378: CERUTI | C378: ANDREA | D378: 14 | E378: 4 | G378: 0 | H378: =SUM(D378:G378) -> 18 | J378: =COUNTIF(A:A,A378) -> 4
A379: 121503 | B379: CHIODINI | C379: ALESSANDRO | D379: 21 | E379: 7 | G379: 3 | H379: =SUM(D379:G379) -> 31 | J379: =COUNTIF(A:A,A379) -> 1
A380: 140199 | B380: COLOMBO | C380: SIMONE | D380: 17 | E380: 9 | G380: 3 | H380: =SUM(D380:G380) -> 29 | J380: =COUNTIF(A:A,A380) -> 1
A381: 142413 | B381: COLUCCIO | C381: LUIGI | D381: 19 | E381: 5 | G381: 3 | H381: =SUM(D381:G381) -> 27 | J381: =COUNTIF(A:A,A381) -> 1
A382: 140763 | B382: CORSI | C382: BARBARA | D382: 18 | E382: 3 | G382: 3 | H382: =SUM(D382:G382) -> 24 | J382: =COUNTIF(A:A,A382) -> 1
A383: 139454 | B383: DALESSANDRO | C383: ANDREA | D383: 16 | E383: 5 | G383: 3 | H383: =SUM(D383:G383) -> 24 | J383: =COUNTIF(A:A,A383) -> 1
A384: 138743 | B384: DE ANGELI | C384: MATTEO | D384: 15 | E384: 5 | G384: 3 | H384: =SUM(D384:G384) -> 23 | J384: =COUNTIF(A:A,A384) -> 2
A385: 2148058541 | B385: DE PIETRO | C385: FABRIZIA | D385: 8 | E385: 4 | G385: 3 | H385: Insuff. | J385: =COUNTIF(A:A,A385) -> 1
A386: 143069 | B386: DE SANCTIS | C386: ROBERTO | D386: 20 | E386: 7 | G386: 3 | H386: =SUM(D386:G386) -> 30 | J386: =COUNTIF(A:A,A386) -> 1
A387: 141296 | B387: DEGLI ESPOSTI | C387: MATTEO | D387: 11 | E387: 4 | G387: 3 | H387: =SUM(D387:G387) -> 18 | J387: =COUNTIF(A:A,A387) -> 2
A388: 123116 | B388: DI CARLO | C388: LEO | D388: 15 | E388: 3 | G388: 3 | H388: =SUM(D388:G388) -> 21 | J388: =COUNTIF(A:A,A388) -> 1
A389: 120997 | B389: DI GIACOMO | C389: EMANUELE | D389: 19 | E389: 5 | G389: 3 | H389: =SUM(D389:G389) -> 27 | J389: =COUNTIF(A:A,A389) -> 1
A390: 138775 | B390: DI SABATINO | C390: MARCO | D390: 12 | E390: 9 | G390: 3 | H390: =SUM(D390:G390) -> 24 | J390: =COUNTIF(A:A,A390) -> 1
A391: 2146063940 | B391: DOCIMO | C391: BRUNO | D391: 16 | E391: 9 | G391: 3 | H391: =SUM(D391:G391) -> 28 | J391: =COUNTIF(A:A,A391) -> 1
A392: 139104 | B392: FAVARA | C392: SIMONE | D392: 16 | E392: 7 | G392: 3 | H392: =SUM(D392:G392) -> 26 | J392: =COUNTIF(A:A,A392) -> 2
A393: 149984 | B393: FEBO | C393: EMANUELE | D393: 20 | E393: 1 | G393: 3 | H393: =SUM(D393:G393) -> 24 | J393: =COUNTIF(A:A,A393) -> 1
A394: 150371 | B394: FERRARA | C394: MARCO | D394: 19 | E394: 2 | G394: 3 | H394: =SUM(D394:G394) -> 24 | J394: =COUNTIF(A:A,A394) -> 1
A395: 146315 | B395: FIORI | C395: FRANCESCO | D395: 17 | E395: 5 | G395: 3 | H395: =SUM(D395:G395) -> 25 | J395: =COUNTIF(A:A,A395) -> 1
A396: 146499 | B396: FONTAN | C396: CLAUDIA | D396: 21 | E396: 9 | G396: 3 | H396: =SUM(D396:G396) -> 33 | J396: =COUNTIF(A:A,A396) -> 1
A397: 141984 | B397: FORESTI | C397: FEDERICO | D397: 11 | E397: 1 | G397: 3 | H397: Insuff. | J397: =COUNTIF(A:A,A397) -> 2
A398: 139293 | B398: FRANCHI | C398: ALESSANDRO | D398: 20 | E398: 8 | G398: 3 | H398: =SUM(D398:G398) -> 31 | J398: =COUNTIF(A:A,A398) -> 1
A399: 123366 | B399: GABBANI | C399: FABIO | D399: 19 | E399: 7 | G399: 3 | H399: =SUM(D399:G399) -> 29 | J399: =COUNTIF(A:A,A399) -> 1
A400: 122359 | B400: GALUPPO | C400: VALENTINA | D400: 16 | E400: 0 | G400: 3 | H400: =SUM(D400:G400) -> 19 | J400: =COUNTIF(A:A,A400) -> 1
A401: 145578 | B401: GAMBONI | C401: ROBERTO | D401: 21 | E401: 9 | G401: 3 | H401: =SUM(D401:G401) -> 33 | J401: =COUNTIF(A:A,A401) -> 1
A402: 141466 | B402: GARDOSI | C402: STEFANO | D402: 14 | E402: 1 | G402: 3 | H402: =SUM(D402:G402) -> 18 | J402: =COUNTIF(A:A,A402) -> 2
A403: 148873 | B403: GAUDENZI | C403: ERMETE | D403: 12 | E403: 4 | G403: 3 | H403: =SUM(D403:G403) -> 19 | J403: =COUNTIF(A:A,A403) -> 1
A404: 141020 | B404: GHIDINI | C404: GIACOMO | D404: 21 | E404: 9 | G404: 3 | H404: =SUM(D404:G404) -> 33 | J404: =COUNTIF(A:A,A404) -> 1
A405: 2148062538 | B405: GHIDONI | C405: ROBERTO | D405: 13 | E405: 6 | G405: 3 | H405: =SUM(D405:G405) -> 22 | J405: =COUNTIF(A:A,A405) -> 1
A406: 126788 | B406: GIAFFREDA | C406: DANIELE | D406: 16 | E406: 3 | G406: 3 | H406: =SUM(D406:G406) -> 22 | J406: =COUNTIF(A:A,A406) -> 1
A407: 140846 | B407: GIAMPICCOLO | C407: DAVIDE | D407: 20 | E407: 8 | G407: 3 | H407: =SUM(D407:G407) -> 31 | J407: =COUNTIF(A:A,A407) -> 1
A408: 2148062452 | B408: GIORGI | C408: GIANMARCO | D408: 2 | E408: 2 | G408: 0 | H408: Insuff. | J408: =COUNTIF(A:A,A408) -> 8
A409: 193625 | B409: GOZZI | C409: DANIELE | D409: 19 | E409: 6 | G409: 3 | H409: =SUM(D409:G409) -> 28 | J409: =COUNTIF(A:A,A409) -> 1
A410: 141093 | B410: GRAZI | C410: ALESSANDRO | D410: 6 | E410: 4 | G410: 3 | H410: Insuff. | J410: =COUNTIF(A:A,A410) -> 3
A411: 900003357 | B411: GRIMALDI | C411: GIOVANNI | D411: 14 | E411: 7 | G411: 3 | H411: =SUM(D411:G411) -> 24 | J411: =COUNTIF(A:A,A411) -> 1
A412: 143881 | B412: GUAGLIUMI | C412: VALERIO | D412: 18 | E412: 8 | G412: 3 | H412: =SUM(D412:G412) -> 29 | J412: =COUNTIF(A:A,A412) -> 1
A413: 139669 | B413: GUBELLINI | C413: FEDERICO | D413: 14 | E413: 9 | G413: 3 | H413: =SUM(D413:G413) -> 26 | J413: =COUNTIF(A:A,A413) -> 1
A414: 900008065 | B414: HARIRI | C414: AHMAD KHALED | D414: 16 | E414: 3 | G414: 3 | H414: =SUM(D414:G414) -> 22 | J414: =COUNTIF(A:A,A414) -> 1
A415: 143789 | B415: IANNIELLO | C415: RAFFAELE | D415: 21 | E415: 9 | G415: 3 | H415: =SUM(D415:G415) -> 33 | J415: =COUNTIF(A:A,A415) -> 1
A416: 124815 | B416: INNOCENTI | C416: SIMONE | D416: 2 | E416: 6 | G416: 3 | H416: Insuff. | J416: =COUNTIF(A:A,A416) -> 3
A417: 141580 | B417: IURA | C417: LUCA | D417: 13 | E417: 8 | G417: 3 | H417: =SUM(D417:G417) -> 24 | J417: =COUNTIF(A:A,A417) -> 1
A418: 139998 | B418: LAI | C418: SIMONE | D418: 9 | E418: 1 | G418: 3 | H418: Insuff. | J418: =COUNTIF(A:A,A418) -> 1
A419: 141889 | B419: LANDI | C419: STEFANO | D419: 19 | E419: 5 | G419: 3 | H419: =SUM(D419:G419) -> 27 | J419: =COUNTIF(A:A,A419) -> 1
A420: 139868 | B420: LANZONI | C420: SIMONE | D420: 17 | E420: 4 | G420: 3 | H420: =SUM(D420:G420) -> 24 | J420: =COUNTIF(A:A,A420) -> 1
A421: 143604 | B421: LAZZARETTI | C421: MARCO | D421: 12 | E421: 3 | G421: 3 | H421: =SUM(D421:G421) -> 18 | J421: =COUNTIF(A:A,A421) -> 1
A422: 140945 | B422: LEARDINI | C422: SIMONE | D422: 21 | E422: 9 | G422: 3 | H422: =SUM(D422:G422) -> 33 | J422: =COUNTIF(A:A,A422) -> 1
A423: 126073 | B423: LEONE | C423: MASSIMILIANO | D423: 1 | E423: 0 | G423: 3 | H423: Insuff. | J423: =COUNTIF(A:A,A423) -> 3
A424: 144019 | B424: LOSI | C424: FILIPPO | D424: 13 | E424: 8 | G424: 3 | H424: =SUM(D424:G424) -> 24 | J424: =COUNTIF(A:A,A424) -> 1
A425: 142138 | B425: LUTTEROTTI | C425: PAOLO | D425: 21 | E425: 8 | G425: 3 | H425: =SUM(D425:G425) -> 32 | J425: =COUNTIF(A:A,A425) -> 1
A426: 141041 | B426: MAFFEI | C426: FEDERICO | D426: 13 | E426: 4 | G426: 3 | H426: =SUM(D426:G426) -> 20 | J426: =COUNTIF(A:A,A426) -> 1
A427: 121713 | B427: MANARINI | C427: MASSIMO | D427: 20 | E427: 7 | G427: 3 | H427: =SUM(D427:G427) -> 30 | J427: =COUNTIF(A:A,A427) -> 1
A428: 127588 | B428: MANCA | C428: MARA | D428: 19 | E428: 4 | G428: 0 | H428: =SUM(D428:G428) -> 23 | J428: =COUNTIF(A:A,A428) -> 2
A429: 143837 | B429: MANCINI | C429: FABIO | D429: 16 | E429: 6 | G429: 3 | H429: =SUM(D429:G429) -> 25 | J429: =COUNTIF(A:A,A429) -> 1
A430: 149306 | B430: MANCO | C430: ROCCO ALESSANDRO | D430: 17 | E430: 0 | G430: 3 | H430: =SUM(D430:G430) -> 20 | J430: =COUNTIF(A:A,A430) -> 3
A431: 124067 | B431: MANCUSO | C431: ANTONIO | D431: 15 | E431: 3 | G431: 3 | H431: =SUM(D431:G431) -> 21 | J431: =COUNTIF(A:A,A431) -> 1
A432: 139816 | B432: MANTOVANI | C432: MARCO | D432: 18 | E432: 3 | G432: 3 | H432: =SUM(D432:G432) -> 24 | J432: =COUNTIF(A:A,A432) -> 1
A433: 149318 | B433: MARINELLI | C433: ALESSIO | D433: 16 | E433: 1 | G433: 3 | H433: =SUM(D433:G433) -> 20 | J433: =COUNTIF(A:A,A433) -> 1
A434: 109000 | B434: MARTELLA | C434: PIERLUCA | D434: 20 | E434: 9 | G434: 3 | H434: =SUM(D434:G434) -> 32 | J434: =COUNTIF(A:A,A434) -> 1
A435: 900008614 | B435: MARTINO | C435: DANILO | D435: 20 | E435: 8 | G435: 3 | H435: =SUM(D435:G435) -> 31 | J435: =COUNTIF(A:A,A435) -> 1
A436: 143323 | B436: MAURO | C436: GIANLUCA | D436: 21 | E436: 9 | G436: 3 | H436: =SUM(D436:G436) -> 33 | J436: =COUNTIF(A:A,A436) -> 1
A437: 139523 | B437: MAZZANTI | C437: ROBERTO | D437: 16 | E437: 2 | G437: 3 | H437: =SUM(D437:G437) -> 21 | J437: =COUNTIF(A:A,A437) -> 3
A438: 140792 | B438: MELANDRI | C438: VINCENZO | D438: 10 | E438: 5 | G438: 3 | H438: =SUM(D438:G438) -> 18 | J438: =COUNTIF(A:A,A438) -> 1
A439: 142494 | B439: MELLI | C439: MICHELE | D439: 18 | E439: 3 | G439: 3 | H439: =SUM(D439:G439) -> 24 | J439: =COUNTIF(A:A,A439) -> 1
A440: 139129 | B440: MICOCCI | C440: GIUSEPPE | D440: 18 | E440: 1 | G440: 3 | H440: =SUM(D440:G440) -> 22 | J440: =COUNTIF(A:A,A440) -> 1
A441: 147208 | B441: MOLINO | C441: MAURO | D441: 19 | E441: 7 | G441: 3 | H441: =SUM(D441:G441) -> 29 | J441: =COUNTIF(A:A,A441) -> 1
A442: 142104 | B442: MONOPOLI | C442: ANDREA | D442: 9 | E442: 6 | G442: 3 | H442: =SUM(D442:G442) -> 18 | J442: =COUNTIF(A:A,A442) -> 3
A443: 147730 | B443: NARDINI | C443: ELENA | D443: 21 | E443: 9 | G443: 3 | H443: =SUM(D443:G443) -> 33 | J443: =COUNTIF(A:A,A443) -> 1
A444: 139458 | B444: NEGRI | C444: CLAUDIO | D444: 18 | E444: 9 | G444: 3 | H444: =SUM(D444:G444) -> 30 | J444: =COUNTIF(A:A,A444) -> 1
A445: 900003319 | B445: NICULESCU | C445: M. LAURENTIU OCTAVIAN | D445: 20 | E445: 9 | G445: 3 | H445: =SUM(D445:G445) -> 32 | J445: =COUNTIF(A:A,A445) -> 1
A446: 144130 | B446: PALLADINI | C446: AMBRA | D446: 17 | E446: 3 | G446: 3 | H446: =SUM(D446:G446) -> 23 | J446: =COUNTIF(A:A,A446) -> 1
A447: 141076 | B447: PANICO | C447: FRANCESCO | D447: 17 | E447: 7 | G447: 3 | H447: =SUM(D447:G447) -> 27 | J447: =COUNTIF(A:A,A447) -> 1
A448: 150328 | B448: PAPETTI | C448: MARCO | D448: 14 | E448: 1 | G448: 3 | H448: =SUM(D448:G448) -> 18 | J448: =COUNTIF(A:A,A448) -> 2
A449: 139974 | B449: PASINI | C449: ALESSANDRO | D449: 19 | E449: 8 | G449: 3 | H449: =SUM(D449:G449) -> 30 | J449: =COUNTIF(A:A,A449) -> 2
A450: 139416 | B450: PASSERINI | C450: MARCO | D450: 14 | E450: 6 | G450: 3 | H450: =SUM(D450:G450) -> 23 | J450: =COUNTIF(A:A,A450) -> 1
A451: 125523 | B451: PAU | C451: CLAUDIA | D451: 13 | E451: 7 | G451: 3 | H451: =SUM(D451:G451) -> 23 | J451: =COUNTIF(A:A,A451) -> 1
A452: 143490 | B452: PELLEGRINI | C452: ANDREA | D452: 19 | E452: 4 | G452: 3 | H452: =SUM(D452:G452) -> 26 | J452: =COUNTIF(A:A,A452) -> 1
A453: 139283 | B453: PELLINI | C453: GIOVANNI | D453: 13 | E453: 7 | G453: 3 | H453: =SUM(D453:G453) -> 23 | J453: =COUNTIF(A:A,A453) -> 1
A454: 141941 | B454: PIERANGELI | C454: DIEGO | D454: 1 | E454: 1 | G454: 3 | H454: Insuff. | J454: =COUNTIF(A:A,A454) -> 2
A455: 144037 | B455: PIERGENTILI | C455: LUCA | D455: 16 | E455: 4 | G455: 3 | H455: Annullato. | J455: =COUNTIF(A:A,A455) -> 3
A456: 140328 | B456: PILI | C456: MATIA | D456: 6 | E456: 2 | G456: 3 | H456: Insuff. | J456: =COUNTIF(A:A,A456) -> 2
A457: 140098 | B457: PINTO | C457: FABRIZIO | D457: 19 | E457: 9 | G457: 3 | H457: =SUM(D457:G457) -> 31 | J457: =COUNTIF(A:A,A457) -> 1
A458: 123566 | B458: PISTOLESI | C458: LUCA | D458: 2 | E458: 5 | G458: 0 | H458: Insuff. | J458: =COUNTIF(A:A,A458) -> 4
A459: 147669 | B459: PIVI | C459: MARCO | D459: 20 | E459: 9 | G459: 3 | H459: =SUM(D459:G459) -> 32 | J459: =COUNTIF(A:A,A459) -> 1
A460: 142717 | B460: PIZZUTI | C460: GIANROCCO | D460: 16 | E460: 0 | G460: 3 | H460: Annullato. | J460: =COUNTIF(A:A,A460) -> 6
A461: 2146055269 | B461: POSSATI | C461: CARLO | D461: 14 | E461: 8 | G461: 3 | H461: =SUM(D461:G461) -> 25 | J461: =COUNTIF(A:A,A461) -> 1
A462: 147812 | B462: PRESTA | C462: SALVATORE | D462: 16 | E462: 9 | G462: 3 | H462: =SUM(D462:G462) -> 28 | J462: =COUNTIF(A:A,A462) -> 1
A463: 143398 | B463: RIZZI | C463: DAVIDE | D463: 19 | E463: 7 | G463: 3 | H463: =SUM(D463:G463) -> 29 | J463: =COUNTIF(A:A,A463) -> 1
A464: 124273 | B464: ROMANELLI | C464: ELIO | D464: 10 | E464: 3 | G464: 0 | H464: Insuff. | J464: =COUNTIF(A:A,A464) -> 4
A465: 140902 | B465: ROMANI | C465: CORRADO | D465: 16 | E465: 6 | G465: 3 | H465: Annullato. | J465: =COUNTIF(A:A,A465) -> 2
A466: 140875 | B466: ROMBOLI | C466: FABRIZIO | D466: 14 | E466: 1 | G466: 3 | H466: =SUM(D466:G466) -> 18 | J466: =COUNTIF(A:A,A466) -> 2
A467: 140095 | B467: SALAROLI | C467: ANDREA | D467: 14 | E467: 9 | G467: 3 | H467: =SUM(D467:G467) -> 26 | J467: =COUNTIF(A:A,A467) -> 1
A468: 140926 | B468: SALTI | C468: SAMUELE | D468: 21 | E468: 9 | G468: 3 | H468: =SUM(D468:G468) -> 33 | J468: =COUNTIF(A:A,A468) -> 1
A469: 139135 | B469: SALVADORI | C469: DAVIDE | D469: 2 | E469: 4 | G469: 3 | H469: Insuff. | J469: =COUNTIF(A:A,A469) -> 2
A470: 123383 | B470: SALVATORE | C470: GIUSEPPE | D470: 20 | E470: 5 | G470: 3 | H470: =SUM(D470:G470) -> 28 | J470: =COUNTIF(A:A,A470) -> 1
A471: 900007158 | B471: SAPORITO | C471: MASSIMILIANO | D471: 6 | E471: 0 | G471: 3 | H471: Annullato. | J471: =COUNTIF(A:A,A471) -> 5
A472: 125533 | B472: SCORTICHINI | C472: MARCO | D472: 18 | E472: 3 | G472: 3 | H472: =SUM(D472:G472) -> 24 | J472: =COUNTIF(A:A,A472) -> 1
A473: 143810 | B473: SIANO | C473: GIANPAOLO | D473: 16 | E473: 9 | G473: 3 | H473: =SUM(D473:G473) -> 28 | J473: =COUNTIF(A:A,A473) -> 1
A474: 150119 | B474: SILENZI | C474: ELISA | D474: 9 | E474: 6 | G474: 3 | H474: =SUM(D474:G474) -> 18 | J474: =COUNTIF(A:A,A474) -> 3
A475: 900000355 | B475: SREPFLER | C475: SRGJAN | D475: 11 | E475: 2 | G475: 3 | H475: Insuff. | J475: =COUNTIF(A:A,A475) -> 5
A476: 2148063685 | B476: STAGNI | C476: DAVIDE | D476: 6 | E476: 2 | G476: 3 | H476: Insuff. | J476: =COUNTIF(A:A,A476) -> 2
A477: 139296 | B477: TARTAGLIONE | C477: DAVIDE | D477: 21 | E477: 9 | G477: 3 | H477: =SUM(D477:G477) -> 33 | J477: =COUNTIF(A:A,A477) -> 1
A478: 126571 | B478: TILLI | C478: PRIMO | D478: 12 | E478: 3 | G478: 3 | H478: =SUM(D478:G478) -> 18 | J478: =COUNTIF(A:A,A478) -> 4
A479: 143378 | B479: VALENT | C479: CRISTINA | D479: 20 | E479: 5 | G479: 3 | H479: =SUM(D479:G479) -> 28 | J479: =COUNTIF(A:A,A479) -> 1
A480: 144181 | B480: VALORI | C480: ANDREA LIBERO | D480: 21 | E480: 4 | G480: 3 | H480: =SUM(D480:G480) -> 28 | J480: =COUNTIF(A:A,A480) -> 1
A481: 108113 | B481: VERNA | C481: GERARDO | D481: 11 | E481: 7 | G481: 0 | H481: =SUM(D481:G481) -> 18 | J481: =COUNTIF(A:A,A481) -> 5
A482: 139481 | B482: VISCIOTTI | C482: ELISABETTA | D482: 21 | E482: 9 | G482: 3 | H482: =SUM(D482:G482) -> 33 | J482: =COUNTIF(A:A,A482) -> 1
A483: 122074 | B483: VOLI | C483: STEFANO | D483: 8 | E483: 2 | G483: 0 | H483: Insuff. | J483: =COUNTIF(A:A,A483) -> 6
A484: 140326 | B484: ZANELLI | C484: DARIO | D484: 21 | E484: 7 | G484: 3 | H484: =SUM(D484:G484) -> 31 | J484: =COUNTIF(A:A,A484) -> 1
A485: 900003862 | B485: ZECCA | C485: PARIDE | D485: 1 | E485: 0 | G485: 3 | H485: Insuff. | J485: =COUNTIF(A:A,A485) -> 4
J486: =COUNTIF(A:A,A486) -> 0
J487: =COUNTIF(A:A,A487) -> 0
J488: =COUNTIF(A:A,A488) -> 0
J489: =COUNTIF(A:A,A489) -> 0
J490: =COUNTIF(A:A,A490) -> 0
A491: Fondamenti di Ricerca Operativa L-A | J491: =COUNTIF(A:A,A491) -> 22
A492: Prova Scritta del 19 Aprile 2004 | J492: =COUNTIF(A:A,A492) -> 1
J493: =COUNTIF(A:A,A493) -> 0
A494: Validita' per chi registra direttamente il voto: fino a venerdi' 23 Aprile 2004. | J494: =COUNTIF(A:A,A494) -> 1
A495: Validita' per chi sostiene l'orale: fino a Luglio 2004. | J495: =COUNTIF(A:A,A495) -> 1
A496: Visione degli elaborati e orali: Venerdi' 23 Aprile 2004, ore 15.00, Aula 05 | J496: =COUNTIF(A:A,A496) -> 1
A497: Prossimi appelli: Giugno, Luglio, Settembre, Gennaio | J497: =COUNTIF(A:A,A497) -> 1
J498: =COUNTIF(A:A,A498) -> 0
A499: matricola | B499: Cognome | C499: Nome | D499: 1 | E499: 2 | F499: 3 | G499: bonus | H499: voto | J499: =COUNTIF(A:A,A499) -> 24
A500: 139521 | B500: ALBERTIN | C500: MARCO | D500: 14 | E500: 15 | G500: 3 | H500: =SUM(D500:G500) -> 32 | J500: =COUNTIF(A:A,A500) -> 1
A501: 141000 | B501: AMATI | C501: DANIELE | D501: 7 | E501: 1 | G501: 3 | H501: Insuff. | J501: =COUNTIF(A:A,A501) -> 2
A502: 2103058081 | B502: AMENDOLA | C502: LUCA | D502: 12 | E502: 4 | G502: 3 | H502: =SUM(D502:G502) -> 19 | J502: =COUNTIF(A:A,A502) -> 1
A503: 139196 | B503: BALDASSARRO | C503: MICHELE | D503: 14 | E503: 6 | G503: 3 | H503: =SUM(D503:G503) -> 23 | J503: =COUNTIF(A:A,A503) -> 1
A504: 123594 | B504: BALDUCCI | C504: DANIELE | D504: 3 | E504: 7 | G504: 0 | H504: Insuff. | J504: =COUNTIF(A:A,A504) -> 5
A505: 140497 | B505: BERGAMINI | C505: ANDREA | D505: 15 | E505: 6 | G505: 3 | H505: =SUM(D505:G505) -> 24 | J505: =COUNTIF(A:A,A505) -> 1
A506: 122282 | B506: BETTI | C506: ALESSANDRO | D506: 7 | E506: 0 | G506: 0 | H506: Insuff. | J506: =COUNTIF(A:A,A506) -> 11
A507: 139786 | B507: BONSI | C507: VALENTINA | D507: 13 | E507: 15 | G507: 0 | H507: =SUM(D507:G507) -> 28 | J507: =COUNTIF(A:A,A507) -> 2
A508: 122271 | B508: BOTTIN | C508: MATTEO | D508: 12 | E508: 15 | G508: 3 | H508: =SUM(D508:G508) -> 30 | J508: =COUNTIF(A:A,A508) -> 1
A509: 140859 | B509: BRACCI | C509: FABIO | D509: 14 | E509: 15 | G509: 3 | H509: =SUM(D509:G509) -> 32 | J509: =COUNTIF(A:A,A509) -> 1
A510: 900008644 | B510: BRIZI | C510: MARCO | D510: 15 | E510: 15 | G510: 3 | H510: =SUM(D510:G510) -> 33 | J510: =COUNTIF(A:A,A510) -> 1
A511: 2148062305 | B511: BRUNELLI | C511: FRANCESCA | D511: 7 | E511: 0 | G511: 0 | H511: Insuff. | J511: =COUNTIF(A:A,A511) -> 4
A512: 139201 | B512: CAMPETI | C512: LUCA | D512: 7 | E512: 14 | G512: 3 | H512: =SUM(D512:G512) -> 24 | J512: =COUNTIF(A:A,A512) -> 2
A513: 145534 | B513: CARUGNO | C513: GIANGREGORIO | D513: 9 | E513: 6 | G513: 3 | H513: =SUM(D513:G513) -> 18 | J513: =COUNTIF(A:A,A513) -> 2
A514: 144180 | B514: CARUSO | C514: CRISTIAN | D514: 12 | E514: 15 | G514: 3 | H514: =SUM(D514:G514) -> 30 | J514: =COUNTIF(A:A,A514) -> 1
A515: 139980 | B515: COLTELLI | C515: DINO | D515: 5 | E515: 6 | G515: 3 | H515: Insuff. | J515: =COUNTIF(A:A,A515) -> 2
A516: 122144 | B516: CUCCHIELLA | C516: RODOLFO | D516: 3 | E516: 15 | G516: 3 | H516: =SUM(D516:G516) -> 21 | J516: =COUNTIF(A:A,A516) -> 1
A517: 140118 | B517: CUDDEMI | C517: MASSIMO | D517: 8 | E517: 11 | G517: 3 | H517: =SUM(D517:G517) -> 22 | J517: =COUNTIF(A:A,A517) -> 1
A518: 900005294 | B518: D'AMELIO | C518: PASQUALINO | D518: 8 | E518: 4 | G518: 0 | H518: Insuff. | J518: =COUNTIF(A:A,A518) -> 4
A519: 138743 | B519: DE ANGELI | C519: MATTEO | D519: 14 | E519: 13 | G519: 0 | H519: =SUM(D519:G519) -> 27 | J519: =COUNTIF(A:A,A519) -> 2
A520: 141296 | B520: DEGLI ESPOSTI | C520: MATTEO | D520: 15 | E520: 8 | G520: 0 | H520: =SUM(D520:G520) -> 23 | J520: =COUNTIF(A:A,A520) -> 2
A521: 145304 | B521: DELLE NOCI | C521: DAVIDE GIROLAMO | D521: 8 | E521: 7 | G521: 3 | H521: =SUM(D521:G521) -> 18 | J521: =COUNTIF(A:A,A521) -> 1
A522: 104930 | B522: DI TOLLO | C522: ALFONSO | D522: 15 | E522: 14 | G522: 0 | H522: =SUM(D522:G522) -> 29 | J522: =COUNTIF(A:A,A522) -> 3
A523: 125467 | B523: FAIENZA | C523: STEFANO ERNESTO | D523: 3 | E523: 6 | G523: 3 | H523: Insuff. | J523: =COUNTIF(A:A,A523) -> 2
A524: 141194 | B524: FARINA | C524: CRISTIAN | D524: 15 | E524: 14 | G524: 3 | H524: =SUM(D524:G524) -> 32 | J524: =COUNTIF(A:A,A524) -> 2
A525: 139104 | B525: FAVARA | C525: SIMONE | D525: 15 | E525: 14 | G525: 0 | H525: =SUM(D525:G525) -> 29 | J525: =COUNTIF(A:A,A525) -> 2
A526: 121917 | B526: FIORETTI | C526: FABIO | D526: 4 | E526: 7 | G526: 0 | H526: Insuff. | J526: =COUNTIF(A:A,A526) -> 3
A527: 141984 | B527: FORESTI | C527: FEDERICO | D527: 12 | E527: 6 | G527: 0 | H527: =SUM(D527:G527) -> 18 | J527: =COUNTIF(A:A,A527) -> 2
A528: 141466 | B528: GARDOSI | C528: STEFANO | D528: 14 | E528: 8 | G528: 0 | H528: =SUM(D528:G528) -> 22 | J528: =COUNTIF(A:A,A528) -> 2
A529: 127861 | B529: GELSUMINO | C529: ERIKA | D529: 8 | E529: 0 | G529: 0 | H529: Insuff. | J529: =COUNTIF(A:A,A529) -> 8
A530: 141015 | B530: GRANDIS | C530: DAVIDE | D530: 11 | E530: 5 | G530: 3 | H530: =SUM(D530:G530) -> 19 | J530: =COUNTIF(A:A,A530) -> 1
A531: 141093 | B531: GRAZI | C531: ALESSANDRO | D531: 13 | E531: 0 | G531: 0 | H531: Insuff. | J531: =COUNTIF(A:A,A531) -> 3
A532: 124815 | B532: INNOCENTI | C532: SIMONE | D532: 11 | E532: 4 | G532: 0 | H532: Insuff. | J532: =COUNTIF(A:A,A532) -> 3
A533: 900007177 | B533: KAGHO NGUIMATSIA | C533: ELVIS | D533: 11 | E533: 5 | G533: 3 | H533: =SUM(D533:G533) -> 19 | J533: =COUNTIF(A:A,A533) -> 1
A534: 126073 | B534: LEONE | C534: MASSIMILIANO | D534: 5 | E534: 0 | G534: 0 | H534: Insuff. | J534: =COUNTIF(A:A,A534) -> 3
A535: 149306 | B535: MANCO | C535: ROCCO ALESSANDRO | D535: 14 | E535: 9 | G535: 0 | H535: =SUM(D535:G535) -> 23 | J535: =COUNTIF(A:A,A535) -> 3
A536: 104543 | B536: MANTOVANI | C536: DIMITRI | D536: 10 | E536: 8 | G536: 3 | H536: =SUM(D536:G536) -> 21 | J536: =COUNTIF(A:A,A536) -> 1
A537: 150115 | B537: MARCHETTI | C537: LORENA | D537: 15 | E537: 6 | G537: 3 | H537: =SUM(D537:G537) -> 24 | J537: =COUNTIF(A:A,A537) -> 1
A538: 145228 | B538: MARTELLA | C538: VITO | D538: 14 | E538: 4 | G538: 3 | H538: =SUM(D538:G538) -> 21 | J538: =COUNTIF(A:A,A538) -> 2
A539: 139523 | B539: MAZZANTI | C539: ROBERTO | D539: 15 | E539: 3 | G539: 0 | H539: =SUM(D539:G539) -> 18 | J539: =COUNTIF(A:A,A539) -> 3
A540: 123351 | B540: MAZZONI | C540: ANDREA | D540: 9 | E540: 5 | G540: 0 | H540: Insuff. | J540: =COUNTIF(A:A,A540) -> 3
A541: 2147059008 | B541: MINOTTI | C541: LORENZO | D541: 12 | E541: 6 | G541: 0 | H541: =SUM(D541:G541) -> 18 | J541: =COUNTIF(A:A,A541) -> 2
A542: 142104 | B542: MONOPOLI | C542: ANDREA | D542: 9 | E542: 5 | G542: 0 | H542: Insuff. | J542: =COUNTIF(A:A,A542) -> 3
A543: 150643 | B543: NAPOLI | C543: GIANPIERO | D543: 11 | E543: 5 | G543: 3 | H543: =SUM(D543:G543) -> 19 | J543: =COUNTIF(A:A,A543) -> 1
A544: 139366 | B544: NOSARI | C544: LUCA | D544: 12 | E544: 3 | G544: 3 | H544: =SUM(D544:G544) -> 18 | J544: =COUNTIF(A:A,A544) -> 2
A545: 150328 | B545: PAPETTI | C545: MARCO | D545: 10 | E545: 15 | G545: 0 | H545: =SUM(D545:G545) -> 25 | J545: =COUNTIF(A:A,A545) -> 2
A546: 146505 | B546: PEGOLO | C546: MARCO | D546: 10 | E546: 6 | G546: 3 | H546: =SUM(D546:G546) -> 19 | J546: =COUNTIF(A:A,A546) -> 3
A547: 141941 | B547: PIERANGELI | C547: DIEGO | D547: 15 | E547: 15 | G547: 0 | H547: =SUM(D547:G547) -> 30 | J547: =COUNTIF(A:A,A547) -> 2
A548: 144037 | B548: PIERGENTILI | C548: LUCA | D548: 11 | E548: 0 | G548: 0 | H548: Insuff. | J548: =COUNTIF(A:A,A548) -> 3
A549: 140328 | B549: PILI | C549: MATIA | D549: 15 | E549: 3 | G549: 0 | H549: =SUM(D549:G549) -> 18 | J549: =COUNTIF(A:A,A549) -> 2
A550: 123566 | B550: PISTOLESI | C550: LUCA | D550: 7 | E550: 6 | G550: 0 | H550: Insuff. | J550: =COUNTIF(A:A,A550) -> 4
A551: 121976 | B551: PORRECA | C551: LUCA | D551: 15 | E551: 6 | G551: 3 | H551: =SUM(D551:G551) -> 24 | J551: =COUNTIF(A:A,A551) -> 1
A552: 900016361 | B552: POZZULO | C552: EMILIO | D552: 7 | E552: 1 | G552: 3 | H552: Insuff. | J552: =COUNTIF(A:A,A552) -> 2
A553: 141882 | B553: PRANDINI | C553: ROBERTO | D553: 9 | E553: 1 | G553: 3 | H553: Insuff. | J553: =COUNTIF(A:A,A553) -> 2
A554: 124273 | B554: ROMANELLI | C554: ELIO | D554: 7 | E554: 1 | G554: 0 | H554: Insuff. | J554: =COUNTIF(A:A,A554) -> 4
A555: 140902 | B555: ROMANI | C555: CORRADO | D555: 14 | E555: 15 | G555: 0 | H555: =SUM(D555:G555) -> 29 | J555: =COUNTIF(A:A,A555) -> 2
A556: 140875 | B556: ROMBOLI | C556: FABRIZIO | D556: 10 | E556: 13 | G556: 0 | H556: =SUM(D556:G556) -> 23 | J556: =COUNTIF(A:A,A556) -> 2
A557: 2006029334 | B557: ROSSI | C557: MANUELA | D557: 15 | E557: 14 | G557: 3 | H557: =SUM(D557:G557) -> 32 | J557: =COUNTIF(A:A,A557) -> 1
A558: 122727 | B558: RUCCI | C558: MARCO | D558: 11 | E558: 14 | G558: 3 | H558: =SUM(D558:G558) -> 28 | J558: =COUNTIF(A:A,A558) -> 1
A559: 150119 | B559: SILENZI | C559: ELISA | D559: 13 | E559: 6 | G559: 0 | H559: =SUM(D559:G559) -> 19 | J559: =COUNTIF(A:A,A559) -> 3
A560: 2148061942 | B560: SOLMI | C560: LUCA | D560: 14 | E560: 9 | G560: 3 | H560: =SUM(D560:G560) -> 26 | J560: =COUNTIF(A:A,A560) -> 1
A561: 129419 | B561: SPINELLI | C561: MARCO | D561: 13 | E561: 11 | G561: 3 | H561: =SUM(D561:G561) -> 27 | J561: =COUNTIF(A:A,A561) -> 1
A562: 900000355 | B562: SREPFLER | C562: SRGJAN | D562: 10 | E562: 1 | G562: 0 | H562: Insuff. | J562: =COUNTIF(A:A,A562) -> 5
A563: 2148063685 | B563: STAGNI | C563: DAVIDE | D563: 10 | E563: 12 | G563: 0 | H563: =SUM(D563:G563) -> 22 | J563: =COUNTIF(A:A,A563) -> 2
A564: 123238 | B564: TAMAGNINI | C564: STEFANO | D564: 4 | E564: 0 | G564: 0 | H564: Insuff. | J564: =COUNTIF(A:A,A564) -> 3
A565: 148936 | B565: TOPPAN | C565: ANDREA | D565: 13 | E565: 3 | G565: 3 | H565: =SUM(D565:G565) -> 19 | J565: =COUNTIF(A:A,A565) -> 1
A566: 113440 | B566: TROCINO | C566: ANDREA | D566: 10 | E566: 3 | G566: 3 | H566: Insuff. | J566: =COUNTIF(A:A,A566) -> 2
A567: 142344 | B567: VINCI | C567: MASSIMILIANO | D567: 5 | E567: 14 | G567: 3 | H567: =SUM(D567:G567) -> 22 | J567: =COUNTIF(A:A,A567) -> 1
A568: 142380 | B568: VITALONE | C568: GIUSEPPE | D568: 14 | E568: 10 | G568: 3 | H568: =SUM(D568:G568) -> 27 | J568: =COUNTIF(A:A,A568) -> 1
A569: 122074 | B569: VOLI | C569: STEFANO | D569: 13 | E569: 8 | G569: 0 | H569: =SUM(D569:G569) -> 21 | J569: =COUNTIF(A:A,A569) -> 6
A570: 142235 | B570: ZAPPACOSTA | C570: DAVIDE | D570: 11 | E570: 1 | G570: 3 | H570: Insuff. | J570: =COUNTIF(A:A,A570) -> 2
J571: =COUNTIF(A:A,A571) -> 0
J572: =COUNTIF(A:A,A572) -> 0
J573: =COUNTIF(A:A,A573) -> 0
A574: Fondamenti di Ricerca Operativa L-A | J574: =COUNTIF(A:A,A574) -> 22
A575: Prova Scritta del 21 Giugno 2004 | J575: =COUNTIF(A:A,A575) -> 1
J576: =COUNTIF(A:A,A576) -> 0
A577: Validita': fino a Settembre 2004 | J577: =COUNTIF(A:A,A577) -> 1
A578: Visione degli elaborati e orali: Mercoledi' 30 Giugno 2004, ore 15.00 | J578: =COUNTIF(A:A,A578) -> 1
A579: (Per l'aula vedere la bacheca del DEIS) | J579: =COUNTIF(A:A,A579) -> 1
A580: Prossimi appelli: Luglio, Settembre, Gennaio | J580: =COUNTIF(A:A,A580) -> 2
J581: =COUNTIF(A:A,A581) -> 0
A582: matricola | B582: Cognome | C582: Nome | D582: 1 | E582: 2 | F582: 3 | G582: bonus | H582: voto | J582: =COUNTIF(A:A,A582) -> 24
A583: 141000 | B583: AMATI | C583: DANIELE | D583: 18 | E583: 11 | G583: 0 | H583: =SUM(D583:G583) -> 29 | J583: =COUNTIF(A:A,A583) -> 2
A584: 141214 | B584: BALDINI | C584: VITTORIO | D584: 18 | E584: 8 | G584: 3 | H584: =SUM(D584:G584) -> 29 | J584: =COUNTIF(A:A,A584) -> 1
A585: 123833 | B585: BARONCINI | C585: DANIELE | D585: 14 | E585: 11 | G585: 0 | H585: =SUM(D585:G585) -> 25 | J585: =COUNTIF(A:A,A585) -> 5
A586: 142536 | B586: BERGAMASCHI | C586: PAOLO | D586: 14 | E586: 8 | G586: 3 | H586: =SUM(D586:G586) -> 25 | J586: =COUNTIF(A:A,A586) -> 1
A587: 2148061513 | B587: BERNABEI | C587: CHIARA | D587: 13 | E587: 11 | G587: 0 | H587: =SUM(D587:G587) -> 24 | J587: =COUNTIF(A:A,A587) -> 3
A588: 122282 | B588: BETTI | C588: ALESSANDRO | D588: 14 | E588: 2 | G588: 0 | H588: =SUM(D588:G588) -> 16 | I588: * | J588: =COUNTIF(A:A,A588) -> 11
A589: 122010 | B589: BONFIETTI | C589: ALESSIO | D589: 7 | E589: 10 | G589: 3 | H589: =SUM(D589:G589) -> 20 | J589: =COUNTIF(A:A,A589) -> 1
A590: 149845 | B590: BUONAMICO | C590: ORAZIO | D590: 17 | E590: 11 | G590: 3 | H590: =SUM(D590:G590) -> 31 | J590: =COUNTIF(A:A,A590) -> 1
A591: 139201 | B591: CAMPETI | C591: LUCA | D591: 19 | E591: 11 | G591: 0 | H591: =SUM(D591:G591) -> 30 | J591: =COUNTIF(A:A,A591) -> 2
A592: 149124 | B592: CARANNA | C592: VITTORIA | D592: 17 | E592: 8 | G592: 3 | H592: =SUM(D592:G592) -> 28 | J592: =COUNTIF(A:A,A592) -> 1
A593: 145534 | B593: CARUGNO | C593: GIANGREGORIO | D593: 18 | E593: 8 | G593: 0 | H593: =SUM(D593:G593) -> 26 | J593: =COUNTIF(A:A,A593) -> 2
A594: 126767 | B594: CASTAGNO | C594: CRISTIAN | D594: 10 | E594: 1 | G594: 3 | H594: Insuff. | J594: =COUNTIF(A:A,A594) -> 1
A595: 140533 | B595: CASTELLI | C595: LORENZO | D595: 19 | E595: 11 | G595: 3 | H595: =SUM(D595:G595) -> 33 | J595: =COUNTIF(A:A,A595) -> 1
A596: 142021 | B596: CELLEMME | C596: FRANCESCO | D596: 17 | E596: 11 | G596: 3 | H596: =SUM(D596:G596) -> 31 | J596: =COUNTIF(A:A,A596) -> 1
A597: 139980 | B597: COLTELLI | C597: DINO | D597: 19 | E597: 11 | G597: 0 | H597: =SUM(D597:G597) -> 30 | J597: =COUNTIF(A:A,A597) -> 2
A598: 900007251 | B598: CUTILLO | C598: LUCA | D598: 18 | E598: 11 | G598: 3 | H598: =SUM(D598:G598) -> 32 | J598: =COUNTIF(A:A,A598) -> 1
A599: 900005294 | B599: D'AMELIO | C599: PASQUALINO | D599: 16 | E599: 9 | G599: 0 | H599: =SUM(D599:G599) -> 25 | J599: =COUNTIF(A:A,A599) -> 4
A600: 104911 | B600: DE MARCO | C600: ANDREA | D600: 18 | E600: 11 | G600: 0 | H600: =SUM(D600:G600) -> 29 | J600: =COUNTIF(A:A,A600) -> 2
A601: 122201 | B601: DI RUSCIO | C601: GIULIO | D601: 8 | E601: 11 | G601: 3 | H601: =SUM(D601:G601) -> 22 | J601: =COUNTIF(A:A,A601) -> 1
A602: 900003191 | B602: DI STEFANO | C602: NUNZIO | D602: 14 | E602: 2 | G602: 0 | H602: =SUM(D602:G602) -> 16 | I602: * | J602: =COUNTIF(A:A,A602) -> 6
A603: 125467 | B603: FAIENZA | C603: STEFANO ERNESTO | D603: 19 | E603: 9 | G603: 0 | H603: =SUM(D603:G603) -> 28 | J603: =COUNTIF(A:A,A603) -> 2
A604: 121917 | B604: FIORETTI | C604: FABIO | D604: 18 | E604: 11 | G604: 0 | H604: =SUM(D604:G604) -> 29 | J604: =COUNTIF(A:A,A604) -> 3
A605: 127861 | B605: GELSUMINO | C605: ERIKA | D605: 13 | E605: 6 | G605: 0 | H605: =SUM(D605:G605) -> 19 | J605: =COUNTIF(A:A,A605) -> 8
A606: 2146059188 | B606: GHERGO | C606: GIANLUCA | D606: 18 | E606: 11 | G606: 3 | H606: =SUM(D606:G606) -> 32 | J606: =COUNTIF(A:A,A606) -> 1
A607: 2148062452 | B607: GIORGI | C607: GIANMARCO | D607: 11 | E607: 1 | G607: 0 | H607: Insuff. | J607: =COUNTIF(A:A,A607) -> 8
A608: 141093 | B608: GRAZI | C608: ALESSANDRO | D608: 16 | E608: 11 | G608: 0 | H608: =SUM(D608:G608) -> 27 | J608: =COUNTIF(A:A,A608) -> 3
A609: 124815 | B609: INNOCENTI | C609: SIMONE | D609: 19 | E609: 5 | G609: 0 | H609: =SUM(D609:G609) -> 24 | J609: =COUNTIF(A:A,A609) -> 3
A610: 138978 | B610: LICASTRO | C610: ANDREA | D610: 19 | E610: 11 | G610: 3 | H610: =SUM(D610:G610) -> 33 | J610: =COUNTIF(A:A,A610) -> 1
A611: 144358 | B611: LUPINETTI | C611: ALESSANDRO | D611: 12 | E611: 11 | G611: 3 | H611: =SUM(D611:G611) -> 26 | J611: =COUNTIF(A:A,A611) -> 1
B612: MALVASIO | C612: ELISA | D612: 11 | E612: 0 | G612: 3 | H612: Insuff. | J612: =COUNTIF(A:A,A612) -> 0
A613: 149306 | B613: MANCO | C613: ROCCO ALESSANDRO | D613: 19 | E613: 11 | G613: 0 | H613: =SUM(D613:G613) -> 30 | J613: =COUNTIF(A:A,A613) -> 3
A614: 106904 | B614: MARINO | C614: LUIGI | D614: 5 | E614: 4 | G614: 3 | H614: Insuff. | J614: =COUNTIF(A:A,A614) -> 3
A615: 145228 | B615: MARTELLA | C615: VITO | D615: 19 | E615: 11 | G615: 0 | H615: =SUM(D615:G615) -> 30 | J615: =COUNTIF(A:A,A615) -> 2
A616: 139523 | B616: MAZZANTI | C616: ROBERTO | D616: 16 | E616: 11 | G616: 0 | H616: =SUM(D616:G616) -> 27 | J616: =COUNTIF(A:A,A616) -> 3
A617: 123351 | B617: MAZZONI | C617: ANDREA | D617: 18 | E617: 9 | G617: 0 | H617: =SUM(D617:G617) -> 27 | J617: =COUNTIF(A:A,A617) -> 3
A618: 110691 | B618: MINGHETTI | C618: ELISA | D618: 2 | E618: 0 | G618: 3 | H618: Insuff. | J618: =COUNTIF(A:A,A618) -> 5
A619: 142104 | B619: MONOPOLI | C619: ANDREA | D619: 15 | E619: 11 | G619: 0 | H619: =SUM(D619:G619) -> 26 | J619: =COUNTIF(A:A,A619) -> 3
A620: 106601 | B620: MOTTULA | C620: MARIO | D620: 16 | E620: 8 | G620: 3 | H620: =SUM(D620:G620) -> 27 | J620: =COUNTIF(A:A,A620) -> 1
A621: 146505 | B621: PEGOLO | C621: MARCO | D621: 12 | E621: 6 | G621: 0 | H621: =SUM(D621:G621) -> 18 | J621: =COUNTIF(A:A,A621) -> 3
A622: 144037 | B622: PIERGENTILI | C622: LUCA | D622: 12 | E622: 11 | G622: 0 | H622: =SUM(D622:G622) -> 23 | J622: =COUNTIF(A:A,A622) -> 3
A623: 2148062353 | B623: PIKASSIS | C623: CRISTINA CATERINA | D623: 10 | E623: 0 | G623: 3 | H623: Insuff. | J623: =COUNTIF(A:A,A623) -> 4
A624: 148973 | B624: PINTO | C624: ALBERTO | D624: 5 | E624: 3 | G624: 3 | H624: Insuff. | J624: =COUNTIF(A:A,A624) -> 4
A625: 123566 | B625: PISTOLESI | C625: LUCA | D625: 18 | E625: 9 | G625: 0 | H625: =SUM(D625:G625) -> 27 | J625: =COUNTIF(A:A,A625) -> 4
A626: 142717 | B626: PIZZUTI | C626: GIANROCCO | D626: 9 | E626: 1 | G626: 0 | H626: Insuff. | J626: =COUNTIF(A:A,A626) -> 6
A627: 2148063442 | B627: POLIANDRI | C627: ALESSANDRA | D627: 19 | E627: 7 | G627: 3 | H627: =SUM(D627:G627) -> 29 | J627: =COUNTIF(A:A,A627) -> 1
A628: 900016361 | B628: POZZULO | C628: EMILIO | D628: 13 | E628: 7 | G628: 0 | H628: =SUM(D628:G628) -> 20 | J628: =COUNTIF(A:A,A628) -> 2
A629: 141882 | B629: PRANDINI | C629: ROBERTO | D629: 19 | E629: 11 | G629: 0 | H629: =SUM(D629:G629) -> 30 | J629: =COUNTIF(A:A,A629) -> 2
A630: 124273 | B630: ROMANELLI | C630: ELIO | D630: 16 | E630: 11 | G630: 0 | H630: =SUM(D630:G630) -> 27 | J630: =COUNTIF(A:A,A630) -> 4
A631: 139135 | B631: SALVADORI | C631: DAVIDE | D631: 7 | E631: 11 | G631: 0 | H631: =SUM(D631:G631) -> 18 | J631: =COUNTIF(A:A,A631) -> 2
A632: 900009617 | B632: SAPONARA | C632: ALFREDO | D632: 9 | E632: 11 | G632: 3 | H632: =SUM(D632:G632) -> 23 | J632: =COUNTIF(A:A,A632) -> 1
A633: 900007158 | B633: SAPORITO | C633: MASSIMILIANO | G633: 0 | H633: Annullato | J633: =COUNTIF(A:A,A633) -> 5
A634: 126597 | B634: SCHIAVONI | C634: RICCARDO | D634: 17 | E634: 8 | G634: 3 | H634: =SUM(D634:G634) -> 28 | J634: =COUNTIF(A:A,A634) -> 1
A635: 150119 | B635: SILENZI | C635: ELISA | D635: 16 | E635: 7 | G635: 0 | H635: =SUM(D635:G635) -> 23 | J635: =COUNTIF(A:A,A635) -> 3
A636: 900000355 | B636: SREPFLER | C636: SRGJAN | D636: 8 | E636: 9 | G636: 0 | H636: =SUM(D636:G636) -> 17 | I636: * | J636: =COUNTIF(A:A,A636) -> 5
A637: 123238 | B637: TAMAGNINI | C637: STEFANO | D637: 11 | E637: 11 | G637: 0 | H637: =SUM(D637:G637) -> 22 | J637: =COUNTIF(A:A,A637) -> 3
A638: 113440 | B638: TROCINO | C638: ANDREA | D638: 13 | E638: 11 | G638: 0 | H638: =SUM(D638:G638) -> 24 | J638: =COUNTIF(A:A,A638) -> 2
A639: 142235 | B639: ZAPPACOSTA | C639: DAVIDE | D639: 14 | E639: 6 | G639: 0 | H639: =SUM(D639:G639) -> 20 | J639: =COUNTIF(A:A,A639) -> 2
A640: * = ammesso all'orale
A642: Fondamenti di Ricerca Operativa L-A
A643: Prova Scritta del 14 Luglio 2004
A645: Validita' per chi registra direttamente il voto: fino a mercoledi' 21 Luglio 2004.
A646: Validita' per chi sostiene l'orale: fino a Gennaio 2005.
A647: Visione degli elaborati e orali: Mercoledi' 21 Lugio 2004, ore 15.00, Aula 61
A648: Prossimi appelli: Settembre, Gennaio
A650: matricola | B650: Cognome | C650: Nome | D650: 1 | E650: 2 | F650: bonus | G650: voto
A651: 123594 | B651: BALDUCCI | C651: DANIELE | D651: 5 | E651: 7 | F651: 0 | G651: Insuff. | I651: =COUNTIF(A:A,A653) -> 5
A652: 2148062305 | B652: BRUNELLI | C652: FRANCESCA | D652: 9 | E652: 2 | F652: 0 | G652: Insuff. | I652: =COUNTIF(A:A,A654) -> 4
A653: 143222 | B653: CORBELLI | C653: MATTEO | D653: 10 | E653: 5 | F653: 3 | G653: =SUM(D655:F655) -> 18 | I653: =COUNTIF(A:A,A655) -> 2
A654: 106249 | B654: D'APOLITO | C654: FABIO | D654: 15 | E654: 8 | F654: 3 | G654: =SUM(D656:F656) -> 26 | I654: =COUNTIF(A:A,A656) -> 1
A655: 2148064426 | B655: D'ARDES | C655: LUCA | D655: 6 | E655: 0 | F655: 3 | G655: Insuff. | I655: =COUNTIF(A:A,A657) -> 2
A656: 143865 | B656: DE ANGELIS | C656: DANIELE | D656: 13 | E656: 8 | F656: 3 | G656: =SUM(D658:F658) -> 24 | I656: =COUNTIF(A:A,A658) -> 1
A657: 142395 | B657: DI FABIO | C657: CARMINE | D657: 14 | E657: 0 | F657: 3 | G657: =SUM(D659:F659) -> 17 | H657: * | I657: =COUNTIF(A:A,A659) -> 1
A658: 900003191 | B658: DI STEFANO | C658: NUNZIO | D658: 7 | E658: 1 | F658: 0 | G658: Insuff. | I658: =COUNTIF(A:A,A660) -> 6
A659: 104930 | B659: DI TOLLO | C659: ALFONSO | D659: 18 | E659: 3 | F659: 0 | G659: =SUM(D661:F661) -> 21 | I659: =COUNTIF(A:A,A661) -> 3
A660: 141194 | B660: FARINA | C660: CRISTIAN | D660: 19 | E660: 8 | F660: 0 | G660: =SUM(D662:F662) -> 27 | I660: =COUNTIF(A:A,A662) -> 2
A661: 127861 | B661: GELSUMINO | C661: ERIKA | D661: 8 | E661: 1 | F661: 0 | G661: Insuff. | I661: =COUNTIF(A:A,A663) -> 8
A662: 2148062452 | B662: GIORGI | C662: GIANMARCO | D662: 6 | E662: 1 | F662: 0 | G662: Insuff. | I662: =COUNTIF(A:A,A664) -> 8
A663: 131127 | B663: LEFEMINE | C663: VITO | D663: 9 | E663: 5 | F663: 3 | G663: =SUM(D665:F665) -> 17 | H663: * | I663: =COUNTIF(A:A,A665) -> 5
A664: 144302 | B664: MACCIONI | C664: CARLA | D664: 20 | E664: 8 | F664: 3 | G664: =SUM(D666:F666) -> 31 | I664: =COUNTIF(A:A,A666) -> 1
A665: 106904 | B665: MARINO | C665: LUIGI | D665: 6 | E665: 8 | F665: 0 | G665: Insuff. | I665: =COUNTIF(A:A,A667) -> 3
B666: OCCHIPINTI | C666: ANDREA | D666: 10 | E666: 2 | F666: 3 | G666: Insuff. | I666: =COUNTIF(A:A,A668) -> 0
A667: 139463 | B667: PALMUCCI | C667: MASSIMILIANO | D667: 8 | E667: 0 | F667: 3 | G667: Insuff. | I667: =COUNTIF(A:A,A669) -> 6
A668: 139974 | B668: PASINI | C668: ALESSANDRO | D668: 15 | E668: 4 | F668: 3 | G668: =SUM(D670:F670) -> 22 | I668: =COUNTIF(A:A,A670) -> 2
A669: 146630 | B669: PEDONE | C669: GIOVANNI | D669: 4 | E669: 4 | F669: 3 | G669: Insuff. | I669: =COUNTIF(A:A,A671) -> 2
A670: 2148062353 | B670: PIKASSIS | C670: CRISTINA CATERINA | D670: 2 | E670: 0 | F670: 0 | G670: Insuff. | I670: =COUNTIF(A:A,A672) -> 4
A671: 148973 | B671: PINTO | C671: ALBERTO | D671: 8 | E671: 1 | F671: 0 | G671: Insuff. | I671: =COUNTIF(A:A,A673) -> 4
A672: 128984 | B672: RASPADORI | C672: GIANLUCA | D672: 9 | E672: 3 | F672: 0 | G672: Insuff. | I672: =COUNTIF(A:A,A674) -> 5
A673: 900007158 | B673: SAPORITO | C673: MASSIMILIANO | D673: 4 | E673: 0 | F673: 0 | G673: Insuff. | I673: =COUNTIF(A:A,A675) -> 5
A674: 140069 | B674: SPECA | C674: YARI | D674: 2 | E674: 3 | F674: 3 | G674: Insuff. | I674: =COUNTIF(A:A,A676) -> 2
A675: 2148064438 | B675: TEMPESTA | C675: DAVIDE | D675: 6 | E675: 1 | F675: 3 | G675: Insuff. | I675: =COUNTIF(A:A,A677) -> 2
A676: 126571 | B676: TILLI | C676: PRIMO | D676: 6 | E676: 3 | F676: 0 | G676: Insuff. | I676: =COUNTIF(A:A,A678) -> 4
A677: * Puo' registrare 18 | I677: =COUNTIF(A:A,A679) -> 3
I678: =COUNTIF(A:A,A680) -> 0
I679: =COUNTIF(A:A,A681) -> 0
I680: =COUNTIF(A:A,A682) -> 0
A681: Fondamenti di Ricerca Operativa L-A | I681: =COUNTIF(A:A,A683) -> 22
A682: Prova Scritta del 14 Settembre 2004 | I682: =COUNTIF(A:A,A684) -> 1
I683: =COUNTIF(A:A,A685) -> 0
A684: Validita' per chi registra direttamente il voto: fino a lunedi' 20 Settembre 2004. | I684: =COUNTIF(A:A,A686) -> 1
A685: Validita' per chi sostiene l'orale: fino a Marzo 2005. | I685: =COUNTIF(A:A,A687) -> 1
A686: Visione degli elaborati e orali: lunedi' 20 Settembre 2004, ore 14.00, Aula 61 | I686: =COUNTIF(A:A,A688) -> 1
A687: Prossimi appelli: Gennaio, Marzo | I687: =COUNTIF(A:A,A689) -> 1
I688: =COUNTIF(A:A,A690) -> 0
A689: matricola | B689: Cognome | C689: Nome | D689: 1 | E689: 2 | F689: bonus | G689: voto | I689: =COUNTIF(A:A,A691) -> 24
A690: 122282 | B690: BETTI | C690: ALESSANDRO | D690: 5 | E690: 2 | F690: 0 | G690: Insuff | I690: =COUNTIF(A:A,A692) -> 11
A691: 143065 | B691: BIONDI | C691: ANDREA | D691: 19 | E691: 7 | F691: 3 | G691: =SUM(D693:F693) -> 29 | I691: =COUNTIF(A:A,A693) -> 1
A692: 2148062305 | B692: BRUNELLI | C692: FRANCESCA | D692: 13 | E692: 5 | F692: 0 | G692: =SUM(D694:F694) -> 18 | I692: =COUNTIF(A:A,A694) -> 4
A693: 2146052105 | B693: CANTI | C693: GIANLUCA | D693: 18 | E693: 9 | F693: 3 | G693: =SUM(D695:F695) -> 30 | I693: =COUNTIF(A:A,A695) -> 1
A694: 140644 | B694: CAPORALETTI | C694: GIOVANNI ALBERTO | D694: 21 | E694: 8 | F694: 3 | G694: =SUM(D696:F696) -> 32 | I694: =COUNTIF(A:A,A696) -> 1
A695: 128724 | B695: CESARI | C695: EDOARDO | D695: 15 | E695: 0 | F695: 0 | G695: Insuff | I695: =COUNTIF(A:A,A697) -> 3
A696: 143222 | B696: CORBELLI | C696: MATTEO | D696: 19 | E696: 7 | F696: 0 | G696: =SUM(D698:F698) -> 26 | I696: =COUNTIF(A:A,A698) -> 2
A697: 2148064426 | B697: D'ARDES | C697: LUCA | D697: 9 | E697: 1 | F697: 0 | G697: Insuff | I697: =COUNTIF(A:A,A699) -> 2
A698: 900003191 | B698: DI STEFANO | C698: NUNZIO | D698: 5 | E698: 4 | F698: 0 | G698: Insuff | I698: =COUNTIF(A:A,A700) -> 6
A699: 127858 | B699: FANTUZZI | C699: ELLIS | D699: 3 | E699: 6 | F699: 0 | G699: Insuff | I699: =COUNTIF(A:A,A701) -> 2
A700: 143110 | B700: FEDERICO | C700: DANIELE | D700: 19 | E700: 7 | F700: 3 | G700: =SUM(D702:F702) -> 29 | I700: =COUNTIF(A:A,A702) -> 1
A701: 127861 | B701: GELSUMINO | C701: ERIKA | D701: 5 | E701: 5 | F701: 0 | G701: Insuff | I701: =COUNTIF(A:A,A703) -> 8
A702: 2148062452 | B702: GIORGI | C702: GIANMARCO | D702: 9 | E702: 4 | F702: 0 | G702: Insuff | I702: =COUNTIF(A:A,A704) -> 8
A703: 139261 | B703: GRAZIA | C703: CARLO UMBERTO | D703: 11 | E703: 5 | F703: 3 | G703: =SUM(D705:F705) -> 19 | I703: =COUNTIF(A:A,A705) -> 1
A704: 900017039 | B704: GUSMAROLI | C704: EDOARDO | D704: 3 | E704: 5 | F704: 3 | G704: Insuff | I704: =COUNTIF(A:A,A706) -> 1
A705: 139629 | B705: IMPOSIMATO | C705: ARTURO | D705: 3 | E705: 0 | F705: 3 | G705: Insuff | I705: =COUNTIF(A:A,A707) -> 8
A706: 131127 | B706: LEFEMINE | C706: VITO | D706: 13 | E706: 7 | F706: 0 | G706: =SUM(D708:F708) -> 20 | I706: =COUNTIF(A:A,A708) -> 5
A707: 106904 | B707: MARINO | C707: LUIGI | D707: 10 | E707: 8 | F707: 0 | G707: =SUM(D709:F709) -> 18 | I707: =COUNTIF(A:A,A709) -> 3
A708: 2143062565 | B708: MAZZANTI | C708: DIEGO | D708: 20 | E708: 9 | F708: 3 | G708: =SUM(D710:F710) -> 32 | I708: =COUNTIF(A:A,A710) -> 1
A709: 110691 | B709: MINGHETTI | C709: ELISA | D709: 3 | E709: 0 | F709: 0 | G709: Insuff | I709: =COUNTIF(A:A,A711) -> 5
A710: 139366 | B710: NOSARI | C710: LUCA | D710: 18 | E710: 2 | F710: 0 | G710: =SUM(D712:F712) -> 20 | I710: =COUNTIF(A:A,A712) -> 2
A711: 900005606 | B711: OCCHIPINTI | C711: ANDREA | D711: 11 | E711: 2 | F711: 0 | G711: Insuff | I711: =COUNTIF(A:A,A713) -> 3
A712: 139463 | B712: PALMUCCI | C712: MASSIMILIANO | D712: 14 | E712: 0 | F712: 0 | G712: Insuff | I712: =COUNTIF(A:A,A714) -> 6
A713: 146505 | B713: PEGOLO | C713: MARCO | D713: 12 | E713: 9 | F713: 0 | G713: =SUM(D715:F715) -> 21 | I713: =COUNTIF(A:A,A715) -> 3
A714: 2148062353 | B714: PIKASSIS | C714: CRISTINA CATERINA | D714: 13 | E714: 0 | F714: 0 | G714: Insuff | I714: =COUNTIF(A:A,A716) -> 4
A715: 148973 | B715: PINTO | C715: ALBERTO | D715: 6 | E715: 1 | F715: 0 | G715: =IF(SUM(D717:F717)<18,"Insuff",SUM(D717:F717)) -> Insuff | I715: =COUNTIF(A:A,A717) -> 4
A716: 142052 | B716: POLIDORI | C716: ALESSANDRO | D716: 20 | E716: 9 | F716: 3 | G716: =IF(SUM(D718:F718)<18,"Insuff",SUM(D718:F718)) -> 32 | I716: =COUNTIF(A:A,A718) -> 1
A717: 128004 | B717: POLUZZI | C717: ALESSANDRO | D717: 20 | E717: 9 | F717: 3 | G717: =IF(SUM(D719:F719)<18,"Insuff",SUM(D719:F719)) -> 32 | I717: =COUNTIF(A:A,A719) -> 1
A718: 122933 | B718: PORCARELLI | C718: DANILO | D718: 20 | E718: 1 | F718: 3 | G718: =IF(SUM(D720:F720)<18,"Insuff",SUM(D720:F720)) -> 24 | I718: =COUNTIF(A:A,A720) -> 1
A719: 900007158 | B719: SAPORITO | C719: MASSIMILIANO | D719: 3 | E719: 0 | F719: 0 | G719: =IF(SUM(D721:F721)<18,"Insuff",SUM(D721:F721)) -> Insuff | I719: =COUNTIF(A:A,A721) -> 5
A720: 900000355 | B720: SREPFLER | C720: SRGJAN | D720: 18 | E720: 3 | F720: 0 | G720: =IF(SUM(D722:F722)<18,"Insuff",SUM(D722:F722)) -> 21 | I720: =COUNTIF(A:A,A722) -> 5
A721: 2148064438 | B721: TEMPESTA | C721: DAVIDE | D721: 15 | E721: 3 | F721: 0 | G721: =IF(SUM(D723:F723)<18,"Insuff",SUM(D723:F723)) -> 18 | I721: =COUNTIF(A:A,A723) -> 2
A722: 126571 | B722: TILLI | C722: PRIMO | D722: 9 | E722: 1 | F722: 0 | G722: =IF(SUM(D724:F724)<18,"Insuff",SUM(D724:F724)) -> Insuff | I722: =COUNTIF(A:A,A724) -> 4
A723: 2147063667 | B723: UGENTI | C723: GRAZIANO | D723: 14 | E723: 3 | F723: 3 | G723: =IF(SUM(D725:F725)<18,"Insuff",SUM(D725:F725)) -> 20 | I723: =COUNTIF(A:A,A725) -> 1
A724: 150087 | B724: VALLECORSA | C724: JACOPO | D724: 12 | E724: 3 | F724: 3 | G724: =IF(SUM(D726:F726)<18,"Insuff",SUM(D726:F726)) -> 18 | I724: =COUNTIF(A:A,A726) -> 1
I725: =COUNTIF(A:A,A727) -> 0
A726: ATTENZIONE: A partire dal prossimo appello, la terza insufficienza in tre appelli | I726: =COUNTIF(A:A,A728) -> 1
A727: consecutivi ne comportera' l'annotazione sul verbale d'esame | I727: =COUNTIF(A:A,A729) -> 1
I728: =COUNTIF(A:A,A730) -> 0
I729: =COUNTIF(A:A,A731) -> 0
I730: =COUNTIF(A:A,A732) -> 0
A731: Fondamenti di Ricerca Operativa L-A | I731: =COUNTIF(A:A,A733) -> 22
A732: Prova Scritta del 21 Dicembre 2004 | I732: =COUNTIF(A:A,A734) -> 1
I733: =COUNTIF(A:A,A735) -> 0
A734: Validita': fino a Aprile 2005. | I734: =COUNTIF(A:A,A736) -> 1
A735: Visione degli elaborati e orali: lunedi' 10 Gennaio 2005, ore 15.00, Aula 56 | I735: =COUNTIF(A:A,A737) -> 1
A736: Prossimo appello: Marzo | I736: =COUNTIF(A:A,A738) -> 2
I737: =COUNTIF(A:A,A739) -> 0
A738: matricola | B738: Cognome | C738: Nome | D738: 1 | E738: 2 | F738: bonus | G738: voto | I738: =COUNTIF(A:A,A740) -> 24
A739: 123594 | B739: BALDUCCI | C739: DANIELE | D739: 13 | E739: 8 | F739: 0 | G739: =IF(SUM(D741:F741)<18,"Insuff.",SUM(D741:F741)) -> 21 | I739: =COUNTIF(A:A,A741) -> 5
A740: 122282 | B740: BETTI | C740: ALESSANDRO | D740: 12 | E740: 0 | F740: 0 | G740: =IF(SUM(D742:F742)<18,"Insuff.",SUM(D742:F742)) -> Insuff. | I740: =COUNTIF(A:A,A742) -> 11
A741: 900003191 | B741: DI STEFANO | C741: NUNZIO | D741: 19 | E741: 4 | F741: 0 | G741: =IF(SUM(D743:F743)<18,"Insuff.",SUM(D743:F743)) -> 23 | I741: =COUNTIF(A:A,A743) -> 6
A742: 127861 | B742: GELSUMINO | C742: ERIKA | D742: 15 | E742: 2 | F742: 0 | G742: 17 | H742: * | I742: =COUNTIF(A:A,A744) -> 8
A743: 139629 | B743: IMPOSIMATO | C743: ARTURO | D743: 8 | E743: 0 | F743: 0 | G743: =IF(SUM(D745:F745)<18,"Insuff.",SUM(D745:F745)) -> Insuff. | I743: =COUNTIF(A:A,A745) -> 8
A744: 131127 | B744: LEFEMINE | C744: VITO | D744: 16 | E744: 4 | F744: 0 | G744: =IF(SUM(D746:F746)<18,"Insuff.",SUM(D746:F746)) -> 20 | I744: =COUNTIF(A:A,A746) -> 5
A745: 107899 | B745: MALVASIO | C745: ELISA | D745: 9 | E745: 0 | F745: 0 | G745: =IF(SUM(D747:F747)<18,"Insuff.",SUM(D747:F747)) -> Insuff. | I745: =COUNTIF(A:A,A747) -> 8
A746: 110691 | B746: MINGHETTI | C746: ELISA | D746: 9 | E746: 0 | F746: 0 | G746: =IF(SUM(D748:F748)<18,"Insuff.",SUM(D748:F748)) -> Insuff. | I746: =COUNTIF(A:A,A748) -> 5
A747: 900005606 | B747: OCCHIPINTI | C747: ANDREA | D747: 16 | E747: 7 | F747: 0 | G747: =IF(SUM(D749:F749)<18,"Insuff.",SUM(D749:F749)) -> 23 | I747: =COUNTIF(A:A,A749) -> 3
A748: 139463 | B748: PALMUCCI | C748: MASSIMILIANO | D748: 18 | E748: 0 | F748: 0 | G748: =IF(SUM(D750:F750)<18,"Insuff.",SUM(D750:F750)) -> 18 | I748: =COUNTIF(A:A,A750) -> 6
A749: 2148062353 | B749: PIKASSIS | C749: CRISTINA CATERINA | D749: 18 | E749: 8 | F749: 0 | G749: =IF(SUM(D751:F751)<18,"Insuff.",SUM(D751:F751)) -> 26 | I749: =COUNTIF(A:A,A751) -> 4
A750: 148973 | B750: PINTO | C750: ALBERTO | D750: 15 | E750: 7 | F750: 0 | G750: =IF(SUM(D752:F752)<18,"Insuff.",SUM(D752:F752)) -> 22 | I750: =COUNTIF(A:A,A752) -> 4
A751: 128176 | B751: ROSADA | C751: GIOVANNI BATTISTA | D751: 14 | E751: 0 | F751: 0 | G751: =IF(SUM(D753:F753)<18,"Insuff.",SUM(D753:F753)) -> Insuff. | I751: =COUNTIF(A:A,A753) -> 3
A752: 900007158 | B752: SAPORITO | C752: MASSIMILIANO | D752: 16 | E752: 1 | F752: 0 | G752: 17 | H752: * | I752: =COUNTIF(A:A,A754) -> 5
A753: 140069 | B753: SPECA | C753: YARI | D753: 10 | E753: 7 | F753: 0 | G753: 17 | H753: * | I753: =COUNTIF(A:A,A755) -> 2
A754: 126571 | B754: TILLI | C754: PRIMO | D754: 10 | E754: 7 | F754: 0 | G754: 17 | H754: * | I754: =COUNTIF(A:A,A756) -> 4
A755: 900003862 | B755: ZECCA | C755: PARIDE | D755: 6 | E755: 1 | F755: 0 | G755: =IF(SUM(D757:F757)<18,"Insuff.",SUM(D757:F757)) -> Insuff. | I755: =COUNTIF(A:A,A757) -> 4
A756: * Puo' registrare 18 | I756: =COUNTIF(A:A,A758) -> 3
I757: =COUNTIF(A:A,A759) -> 0
I758: =COUNTIF(A:A,A760) -> 0
A759: Fondamenti di Ricerca Operativa L-A | I759: =COUNTIF(A:A,A761) -> 22
A760: Prova Scritta del 24 Marzo 2005 | I760: =COUNTIF(A:A,A762) -> 1
I761: =COUNTIF(A:A,A763) -> 0
A762: Validita' per chi registra direttamente il voto: fino a giovedi' 31 Marzo 2005. | I762: =COUNTIF(A:A,A764) -> 1
A763: Validita' per chi sostiene l'orale: fino a Giugno 2005. | I763: =COUNTIF(A:A,A765) -> 1
A764: Visione degli elaborati e orali: giovedi' 31 Marzo 2005, ore 14.00, Aula 81 | I764: =COUNTIF(A:A,A766) -> 1
A765: Prossimi appelli: 12 Aprile 2005, Giugno 2005, Luglio 2005 | I765: =COUNTIF(A:A,A767) -> 1
I766: =COUNTIF(A:A,A768) -> 0
A767: matricola | B767: Cognome | C767: Nome | D767: 1 | E767: 2 | F767: bonus | G767: voto | I767: =COUNTIF(A:A,A769) -> 24
A768: 221057 | B768: ACERBO | C768: LORENZO | D768: 18 | E768: 6 | F768: 3 | G768: =IF(SUM(D770:F770)<18,"Insuff.",SUM(D770:F770)) -> 27 | I768: =COUNTIF(A:A,A770) -> 1
A769: 161187 | B769: ACHILLE | C769: FRANCESCO | D769: 22 | E769: 8 | F769: 3 | G769: =IF(SUM(D771:F771)<18,"Insuff.",SUM(D771:F771)) -> 33 | I769: =COUNTIF(A:A,A771) -> 1
A770: 130382 | B770: ALAGNA | C770: LUCA | D770: 20 | E770: 1 | F770: 3 | G770: =IF(SUM(D772:F772)<18,"Insuff.",SUM(D772:F772)) -> 24 | I770: =COUNTIF(A:A,A772) -> 1
A771: 161252 | B771: ANTONELLI | C771: ALESSANDRO | D771: 19 | E771: 8 | F771: 3 | G771: =IF(SUM(D773:F773)<18,"Insuff.",SUM(D773:F773)) -> 30 | I771: =COUNTIF(A:A,A773) -> 1
A772: 159852 | B772: ARTESINO | C772: SIMONE | D772: 14 | E772: 8 | F772: 3 | G772: =IF(SUM(D774:F774)<18,"Insuff.",SUM(D774:F774)) -> 25 | I772: =COUNTIF(A:A,A774) -> 1
A773: 161408 | B773: BARBIERI | C773: PRISCO | D773: 8 | E773: 0 | F773: 3 | G773: =IF(SUM(D775:F775)<18,"Insuff.",SUM(D775:F775)) -> Insuff. | I773: =COUNTIF(A:A,A775) -> 2
A774: 158824 | B774: BASSETTI | C774: MANUELA | D774: 22 | E774: 5 | F774: 3 | G774: =IF(SUM(D776:F776)<18,"Insuff.",SUM(D776:F776)) -> 30 | I774: =COUNTIF(A:A,A776) -> 1
A775: 162437 | B775: BENCIVENNI | C775: PIERO | D775: 20 | E775: 3 | F775: 3 | G775: =IF(SUM(D777:F777)<18,"Insuff.",SUM(D777:F777)) -> 26 | I775: =COUNTIF(A:A,A777) -> 1
A776: 900011581 | B776: BENINI | C776: MASSIMO | D776: 20 | E776: 8 | F776: 3 | G776: =IF(SUM(D778:F778)<18,"Insuff.",SUM(D778:F778)) -> 31 | I776: =COUNTIF(A:A,A778) -> 1
A777: 157833 | B777: BENINI | C777: PAOLO | D777: 20 | E777: 1 | F777: 3 | G777: =IF(SUM(D779:F779)<18,"Insuff.",SUM(D779:F779)) -> 24 | I777: =COUNTIF(A:A,A779) -> 1
A778: 157856 | B778: BERTELLI | C778: GIANLUCA | D778: 22 | E778: 5 | F778: 3 | G778: =IF(SUM(D780:F780)<18,"Insuff.",SUM(D780:F780)) -> 30 | I778: =COUNTIF(A:A,A780) -> 1
A779: 2148064414 | B779: BERTONI | C779: GIANLUCA | D779: 10 | E779: 1 | F779: 3 | G779: =IF(SUM(D781:F781)<18,"Insuff.",SUM(D781:F781)) -> Insuff. | I779: =COUNTIF(A:A,A781) -> 2
A780: 122282 | B780: BETTI | C780: ALESSANDRO | D780: 12 | E780: 0 | F780: 0 | G780: =IF(SUM(D782:F782)<18,"Insuff.",SUM(D782:F782)) -> Insuff. | I780: =COUNTIF(A:A,A782) -> 11
A781: 900005789 | B781: BIANCHERA | C781: DANIELE | D781: 21 | E781: 8 | F781: 3 | G781: =IF(SUM(D783:F783)<18,"Insuff.",SUM(D783:F783)) -> 32 | I781: =COUNTIF(A:A,A783) -> 1
A782: 156855 | B782: BORSELLI | C782: MICHELE | D782: 15 | E782: 3 | F782: 3 | G782: =IF(SUM(D784:F784)<18,"Insuff.",SUM(D784:F784)) -> 21 | I782: =COUNTIF(A:A,A784) -> 1
A783: 162925 | B783: BORTOLINI | C783: MARIA ELENA | D783: 18 | E783: 1 | F783: 3 | G783: =IF(SUM(D785:F785)<18,"Insuff.",SUM(D785:F785)) -> 22 | I783: =COUNTIF(A:A,A785) -> 1
A784: 161451 | B784: BRANDOLESE | C784: ANDREA | D784: 21 | E784: 4 | F784: 3 | G784: =IF(SUM(D786:F786)<18,"Insuff.",SUM(D786:F786)) -> 28 | I784: =COUNTIF(A:A,A786) -> 1
A785: 157684 | B785: CAFINI | C785: RAUL | D785: 12 | E785: 0 | F785: 3 | G785: =IF(SUM(D787:F787)<18,"Insuff.",SUM(D787:F787)) -> Insuff. | I785: =COUNTIF(A:A,A787) -> 2
A786: 140594 | B786: CAMAIONI | C786: EMANUELE | D786: 17 | E786: 3 | F786: 3 | G786: =IF(SUM(D788:F788)<18,"Insuff.",SUM(D788:F788)) -> 23 | I786: =COUNTIF(A:A,A788) -> 1
A787: 149988 | B787: CAMPITELLI | C787: NUNZIO | D787: 11 | E787: 7 | F787: 3 | G787: =IF(SUM(D789:F789)<18,"Insuff.",SUM(D789:F789)) -> 21 | I787: =COUNTIF(A:A,A789) -> 1
A788: 162316 | B788: CANTORESI | C788: PATRIZIA | D788: 22 | E788: 8 | F788: 3 | G788: =IF(SUM(D790:F790)<18,"Insuff.",SUM(D790:F790)) -> 33 | I788: =COUNTIF(A:A,A790) -> 1
A789: 900003451 | B789: CAVALLARI | C789: VALERIA | D789: 20 | E789: 4 | F789: 3 | G789: =IF(SUM(D791:F791)<18,"Insuff.",SUM(D791:F791)) -> 27 | I789: =COUNTIF(A:A,A791) -> 1
A790: 160528 | B790: CERAVOLO | C790: FRANCESCO | D790: 21 | E790: 8 | F790: 3 | G790: =IF(SUM(D792:F792)<18,"Insuff.",SUM(D792:F792)) -> 32 | I790: =COUNTIF(A:A,A792) -> 1
A791: 229657 | B791: CHIARINI | C791: MATTIA | D791: 7 | E791: 0 | F791: 3 | G791: =IF(SUM(D793:F793)<18,"Insuff.",SUM(D793:F793)) -> Insuff. | I791: =COUNTIF(A:A,A793) -> 2
A792: 163489 | B792: CINALLI | C792: PATRIC | D792: 12 | E792: 8 | F792: 3 | G792: =IF(SUM(D794:F794)<18,"Insuff.",SUM(D794:F794)) -> 23 | I792: =COUNTIF(A:A,A794) -> 1
A793: 157932 | B793: CIRRI | C793: ANDREA | D793: 21 | E793: 3 | F793: 3 | G793: =IF(SUM(D795:F795)<18,"Insuff.",SUM(D795:F795)) -> 27 | I793: =COUNTIF(A:A,A795) -> 1
A794: 900003238 | B794: COIANA | C794: ROBERTO | D794: 17 | E794: 6 | F794: 3 | G794: =IF(SUM(D796:F796)<18,"Insuff.",SUM(D796:F796)) -> 26 | I794: =COUNTIF(A:A,A796) -> 1
A795: 158275 | B795: CORAPI | C795: DOMENICO | D795: 21 | E795: 8 | F795: 3 | G795: =IF(SUM(D797:F797)<18,"Insuff.",SUM(D797:F797)) -> 32 | I795: =COUNTIF(A:A,A797) -> 1
A796: 157964 | B796: CORVARO | C796: MATTEO | D796: 20 | E796: 5 | F796: 3 | G796: =IF(SUM(D798:F798)<18,"Insuff.",SUM(D798:F798)) -> 28 | I796: =COUNTIF(A:A,A798) -> 1
A797: 160485 | B797: DAL MONTE | C797: AGNESE | D797: 21 | E797: 8 | F797: 3 | G797: =IF(SUM(D799:F799)<18,"Insuff.",SUM(D799:F799)) -> 32 | I797: =COUNTIF(A:A,A799) -> 1
A798: 157982 | B798: DI LELLO | C798: ALESSANDRO | D798: 22 | E798: 8 | F798: 3 | G798: =IF(SUM(D800:F800)<18,"Insuff.",SUM(D800:F800)) -> 33 | I798: =COUNTIF(A:A,A800) -> 1
A799: 164605 | B799: DI MARIA | C799: COSTANZO | D799: 21 | E799: 8 | F799: 3 | G799: =IF(SUM(D801:F801)<18,"Insuff.",SUM(D801:F801)) -> 32 | I799: =COUNTIF(A:A,A801) -> 1
A800: 158845 | B800: DIGNANI | C800: DANILO | D800: 21 | E800: 5 | F800: 3 | G800: =IF(SUM(D802:F802)<18,"Insuff.",SUM(D802:F802)) -> 29 | I800: =COUNTIF(A:A,A802) -> 1
A801: 159128 | B801: DINARDO | C801: MICHELE | D801: 18 | E801: 8 | F801: 3 | G801: =IF(SUM(D803:F803)<18,"Insuff.",SUM(D803:F803)) -> 29 | I801: =COUNTIF(A:A,A803) -> 1
A802: 166694 | B802: FARACI | C802: FABIO | D802: 0 | E802: 0 | F802: 3 | G802: =IF(SUM(D804:F804)<18,"Insuff.",SUM(D804:F804)) -> Insuff. | I802: =COUNTIF(A:A,A804) -> 7
A803: 157748 | B803: FERRI | C803: FRANCESCO | D803: 18 | E803: 6 | F803: 3 | G803: =IF(SUM(D805:F805)<18,"Insuff.",SUM(D805:F805)) -> 27 | I803: =COUNTIF(A:A,A805) -> 1
A804: 160516 | B804: FERRONI | C804: ADRIANO | D804: 13 | E804: 2 | F804: 3 | G804: =IF(SUM(D806:F806)<18,"Insuff.",SUM(D806:F806)) -> 18 | I804: =COUNTIF(A:A,A806) -> 1
A805: 144319 | B805: FILOPOULOS | C805: NIKOS | D805: 22 | E805: 7 | F805: 3 | G805: =IF(SUM(D807:F807)<18,"Insuff.",SUM(D807:F807)) -> 32 | I805: =COUNTIF(A:A,A807) -> 1
A806: 159638 | B806: FIOCCHI | C806: RICCARDO | D806: 16 | E806: 4 | F806: 3 | G806: =IF(SUM(D808:F808)<18,"Insuff.",SUM(D808:F808)) -> 23 | I806: =COUNTIF(A:A,A808) -> 1
A807: 158280 | B807: FLORIO | C807: CHRISTIAN | D807: 13 | E807: 8 | F807: 3 | G807: =IF(SUM(D809:F809)<18,"Insuff.",SUM(D809:F809)) -> 24 | I807: =COUNTIF(A:A,A809) -> 1
A808: 227706 | B808: FRANCIOSI | C808: LORENZO | D808: 6 | E808: 1 | F808: 3 | G808: =IF(SUM(D810:F810)<18,"Insuff.",SUM(D810:F810)) -> Insuff. | I808: =COUNTIF(A:A,A810) -> 3
A809: 170532 | B809: FUSARO | C809: FAUSTO GIORGIO MARIA | D809: 22 | E809: 6 | F809: 3 | G809: =IF(SUM(D811:F811)<18,"Insuff.",SUM(D811:F811)) -> 31 | I809: =COUNTIF(A:A,A811) -> 1
A810: 158414 | B810: GALASSI | C810: FRANCESCO | D810: 20 | E810: 8 | F810: 3 | G810: =IF(SUM(D812:F812)<18,"Insuff.",SUM(D812:F812)) -> 31 | I810: =COUNTIF(A:A,A812) -> 1
A811: 168023 | B811: GESUALDI | C811: MARCO MATTEO | D811: 21 | E811: 8 | F811: 3 | G811: =IF(SUM(D813:F813)<18,"Insuff.",SUM(D813:F813)) -> 32 | I811: =COUNTIF(A:A,A813) -> 1
A812: 160204 | B812: GHIRLANDA | C812: MARCO | D812: 12 | E812: 6 | F812: 3 | G812: =IF(SUM(D814:F814)<18,"Insuff.",SUM(D814:F814)) -> 21 | I812: =COUNTIF(A:A,A814) -> 1
A813: 159028 | B813: GIOMBI | C813: GIORGIO | D813: 19 | E813: 8 | F813: 3 | G813: =IF(SUM(D815:F815)<18,"Insuff.",SUM(D815:F815)) -> 30 | I813: =COUNTIF(A:A,A815) -> 1
A814: 2148062452 | B814: GIORGI | C814: GIANMARCO | D814: 6 | E814: 1 | F814: 0 | G814: =IF(SUM(D816:F816)<18,"Insuff.",SUM(D816:F816)) -> Insuff. | I814: =COUNTIF(A:A,A816) -> 8
A815: 158576 | B815: GIOVANNELLI | C815: ANTONIO | D815: 18 | E815: 8 | F815: 3 | G815: =IF(SUM(D817:F817)<18,"Insuff.",SUM(D817:F817)) -> 29 | I815: =COUNTIF(A:A,A817) -> 1
A816: 160563 | B816: GIRI | C816: GIANLUCA | D816: 22 | E816: 8 | F816: 3 | G816: =IF(SUM(D818:F818)<18,"Insuff.",SUM(D818:F818)) -> 33 | I816: =COUNTIF(A:A,A818) -> 1
A817: 168897 | B817: GIULIONI | C817: CRISTIANO | D817: 19 | E817: 6 | F817: 3 | G817: =IF(SUM(D819:F819)<18,"Insuff.",SUM(D819:F819)) -> 28 | I817: =COUNTIF(A:A,A819) -> 1
A818: 161980 | B818: GREGORI | C818: RICCARDO | D818: 21 | E818: 8 | F818: 3 | G818: =IF(SUM(D820:F820)<18,"Insuff.",SUM(D820:F820)) -> 32 | I818: =COUNTIF(A:A,A820) -> 1
A819: 165737 | B819: GROTTESI | C819: RENATO | D819: 16 | E819: 5 | F819: 3 | G819: =IF(SUM(D821:F821)<18,"Insuff.",SUM(D821:F821)) -> 24 | I819: =COUNTIF(A:A,A821) -> 1
A820: 900007168 | B820: KENMEGNE TAME | C820: CAMILLE | D820: 14 | E820: 1 | F820: 3 | G820: =IF(SUM(D822:F822)<18,"Insuff.",SUM(D822:F822)) -> 18 | I820: =COUNTIF(A:A,A822) -> 1
A821: 167722 | B821: LA MORGIA | C821: CINZIA | D821: 20 | E821: 8 | F821: 3 | G821: =IF(SUM(D823:F823)<18,"Insuff.",SUM(D823:F823)) -> 31 | I821: =COUNTIF(A:A,A823) -> 1
A822: 166964 | B822: LAGNA | C822: ANTONIO | D822: 9 | E822: 6 | F822: 3 | G822: =IF(SUM(D824:F824)<18,"Insuff.",SUM(D824:F824)) -> 18 | I822: =COUNTIF(A:A,A824) -> 3
A823: 131127 | B823: LEFEMINE | C823: VITO | D823: 12 | E823: 6 | F823: 0 | G823: =IF(SUM(D825:F825)<18,"Insuff.",SUM(D825:F825)) -> 18 | I823: =COUNTIF(A:A,A825) -> 5
A824: 900013208 | B824: LOPCI | C824: JUVENT | D824: 22 | E824: 8 | F824: 3 | G824: =IF(SUM(D826:F826)<18,"Insuff.",SUM(D826:F826)) -> 33 | I824: =COUNTIF(A:A,A826) -> 1
A825: 900018289 | B825: LOPOPOLO | C825: MAURO | D825: 18 | E825: 6 | F825: 3 | G825: =IF(SUM(D827:F827)<18,"Insuff.",SUM(D827:F827)) -> 27 | I825: =COUNTIF(A:A,A827) -> 1
A826: 158219 | B826: MALTONI | C826: ELISA | D826: 9 | E826: 6 | F826: 3 | G826: =IF(SUM(D828:F828)<18,"Insuff.",SUM(D828:F828)) -> 18 | I826: =COUNTIF(A:A,A828) -> 1
A827: 158006 | B827: MARONCELLI | C827: GIOVANNI | D827: 16 | E827: 6 | F827: 3 | G827: =IF(SUM(D829:F829)<18,"Insuff.",SUM(D829:F829)) -> 25 | I827: =COUNTIF(A:A,A829) -> 1
A828: 157432 | B828: MASI | C828: FRANCESCO | D828: 21 | E828: 7 | F828: 3 | G828: =IF(SUM(D830:F830)<18,"Insuff.",SUM(D830:F830)) -> 31 | I828: =COUNTIF(A:A,A830) -> 1
A829: 130238 | B829: MENALDO | C829: GIACOMO | D829: 21 | E829: 1 | F829: 3 | G829: =IF(SUM(D831:F831)<18,"Insuff.",SUM(D831:F831)) -> 25 | I829: =COUNTIF(A:A,A831) -> 1
A830: 158349 | B830: MENGOLI | C830: DARIO | D830: 11 | E830: 6 | F830: 3 | G830: =IF(SUM(D832:F832)<18,"Insuff.",SUM(D832:F832)) -> 20 | I830: =COUNTIF(A:A,A832) -> 2
A831: 161488 | B831: MINARDI | C831: CLAUDIO | D831: 21 | E831: 8 | F831: 3 | G831: =IF(SUM(D833:F833)<18,"Insuff.",SUM(D833:F833)) -> 32 | I831: =COUNTIF(A:A,A833) -> 1
A832: 900012086 | B832: MINELLI | C832: MARCO | D832: 18 | E832: 0 | F832: 3 | G832: =IF(SUM(D834:F834)<18,"Insuff.",SUM(D834:F834)) -> 21 | I832: =COUNTIF(A:A,A834) -> 1
A833: 158527 | B833: MINIELLO | C833: GIUSEPPE | D833: 22 | E833: 8 | F833: 3 | G833: =IF(SUM(D835:F835)<18,"Insuff.",SUM(D835:F835)) -> 33 | I833: =COUNTIF(A:A,A835) -> 1
A834: 900011722 | B834: MONTECCHIA | C834: AMBRA | D834: 20 | E834: 8 | F834: 3 | G834: =IF(SUM(D836:F836)<18,"Insuff.",SUM(D836:F836)) -> 31 | I834: =COUNTIF(A:A,A836) -> 1
A835: 158779 | B835: MONTI | C835: STEFANO | D835: 19 | E835: 6 | F835: 3 | G835: =IF(SUM(D837:F837)<18,"Insuff.",SUM(D837:F837)) -> 28 | I835: =COUNTIF(A:A,A837) -> 1
A836: 168942 | B836: NANNI | C836: VALERIA | D836: 20 | E836: 4 | F836: 3 | G836: =IF(SUM(D838:F838)<18,"Insuff.",SUM(D838:F838)) -> 27 | I836: =COUNTIF(A:A,A838) -> 1
A837: 161825 | B837: NEGRO | C837: ROCCO | D837: 17 | E837: 7 | F837: 3 | G837: =IF(SUM(D839:F839)<18,"Insuff.",SUM(D839:F839)) -> 27 | I837: =COUNTIF(A:A,A839) -> 1
A838: 157408 | B838: NERI | C838: ANDREA | D838: 11 | E838: 8 | F838: 3 | G838: =IF(SUM(D840:F840)<18,"Insuff.",SUM(D840:F840)) -> 22 | I838: =COUNTIF(A:A,A840) -> 1
A839: 900005606 | B839: OCCHIPINTI | C839: ANDREA | D839: 21 | E839: 8 | F839: 0 | G839: =IF(SUM(D841:F841)<18,"Insuff.",SUM(D841:F841)) -> 29 | I839: =COUNTIF(A:A,A841) -> 3
A840: 162519 | B840: ORSI | C840: MICHELE | D840: 22 | E840: 5 | F840: 3 | G840: =IF(SUM(D842:F842)<18,"Insuff.",SUM(D842:F842)) -> 30 | I840: =COUNTIF(A:A,A842) -> 1
A841: 142594 | B841: ORTOLANI | C841: ALESSANDRO | D841: 15 | E841: 0 | F841: 3 | G841: =IF(SUM(D843:F843)<18,"Insuff.",SUM(D843:F843)) -> 18 | I841: =COUNTIF(A:A,A843) -> 2
A842: 158820 | B842: PALUMBO | C842: CLAUDIO | D842: 21 | E842: 5 | F842: 3 | G842: =IF(SUM(D844:F844)<18,"Insuff.",SUM(D844:F844)) -> 29 | I842: =COUNTIF(A:A,A844) -> 1
A843: 163236 | B843: PATRICELLI | C843: LUIGI | D843: 20 | E843: 6 | F843: 3 | G843: =IF(SUM(D845:F845)<18,"Insuff.",SUM(D845:F845)) -> 29 | I843: =COUNTIF(A:A,A845) -> 1
A844: 233655 | B844: PELAGATTI | C844: NICOLA | D844: 11 | E844: 1 | F844: 3 | G844: =IF(SUM(D846:F846)<18,"Insuff.",SUM(D846:F846)) -> Insuff. | I844: =COUNTIF(A:A,A846) -> 2
A845: 165941 | B845: PERSI | C845: SARA | D845: 22 | E845: 8 | F845: 3 | G845: =IF(SUM(D847:F847)<18,"Insuff.",SUM(D847:F847)) -> 33 | I845: =COUNTIF(A:A,A847) -> 1
A846: 160489 | B846: PESENTI | C846: ANDREA | D846: 20 | E846: 8 | F846: 3 | G846: =IF(SUM(D848:F848)<18,"Insuff.",SUM(D848:F848)) -> 31 | I846: =COUNTIF(A:A,A848) -> 2
A847: 160318 | B847: PETROSINO | C847: MATTIA | D847: 17 | E847: 8 | F847: 3 | G847: =IF(SUM(D849:F849)<18,"Insuff.",SUM(D849:F849)) -> 28 | I847: =COUNTIF(A:A,A849) -> 2
A848: 143287 | B848: POLETTI | C848: LUCA | D848: 21 | E848: 8 | F848: 3 | G848: =IF(SUM(D850:F850)<18,"Insuff.",SUM(D850:F850)) -> 32 | I848: =COUNTIF(A:A,A850) -> 1
A849: 162333 | B849: PORZI | C849: FABRIZIO | D849: 22 | E849: 8 | F849: 3 | G849: =IF(SUM(D851:F851)<18,"Insuff.",SUM(D851:F851)) -> 33 | I849: =COUNTIF(A:A,A851) -> 1
A850: 162228 | B850: PRENCIPE | C850: PAOLO | D850: 17 | E850: 3 | F850: 3 | G850: =IF(SUM(D852:F852)<18,"Insuff.",SUM(D852:F852)) -> 23 | I850: =COUNTIF(A:A,A852) -> 1
A851: 159749 | B851: QUARANTA | C851: MARCO | D851: 19 | E851: 6 | F851: 3 | G851: =IF(SUM(D853:F853)<18,"Insuff.",SUM(D853:F853)) -> 28 | I851: =COUNTIF(A:A,A853) -> 1
A852: 163651 | B852: RISI | C852: IACOPO | D852: 10 | E852: 5 | F852: 3 | G852: =IF(SUM(D854:F854)<18,"Insuff.",SUM(D854:F854)) -> 18 | I852: =COUNTIF(A:A,A854) -> 1
A853: 158318 | B853: RIZZI | C853: ELISA | D853: 19 | E853: 8 | F853: 3 | G853: =IF(SUM(D855:F855)<18,"Insuff.",SUM(D855:F855)) -> 30 | I853: =COUNTIF(A:A,A855) -> 1
A854: 128176 | B854: ROSADA | C854: GIOVANNI BATTISTA | D854: 20 | E854: 2 | F854: 0 | G854: =IF(SUM(D856:F856)<18,"Insuff.",SUM(D856:F856)) -> 22 | I854: =COUNTIF(A:A,A856) -> 3
A855: 222378 | B855: ROSSI | C855: EMANUELE | D855: 7 | E855: 6 | F855: 3 | G855: =IF(SUM(D857:F857)<18,"Insuff.",SUM(D857:F857)) -> Insuff. | I855: =COUNTIF(A:A,A857) -> 2
A856: 2148054237 | B856: ROSSI | C856: FRANCESCO | D856: 19 | E856: 1 | F856: 3 | G856: =IF(SUM(D858:F858)<18,"Insuff.",SUM(D858:F858)) -> 23 | I856: =COUNTIF(A:A,A858) -> 1
A857: 160074 | B857: ROSSIGNOLI | C857: ENRICO | D857: 21 | E857: 6 | F857: 3 | G857: =IF(SUM(D859:F859)<18,"Insuff.",SUM(D859:F859)) -> 30 | I857: =COUNTIF(A:A,A859) -> 2
A858: 160495 | B858: ROVATTI | C858: FABRIZIO | D858: 22 | E858: 5 | F858: 3 | G858: =IF(SUM(D860:F860)<18,"Insuff.",SUM(D860:F860)) -> 30 | I858: =COUNTIF(A:A,A860) -> 2
A859: 158184 | B859: SCALAVINO | C859: ENRICO | D859: 21 | E859: 8 | F859: 3 | G859: =IF(SUM(D861:F861)<18,"Insuff.",SUM(D861:F861)) -> 32 | I859: =COUNTIF(A:A,A861) -> 1
A860: 157906 | B860: SERRANGELI | C860: ALESSIO | D860: 18 | E860: 8 | F860: 3 | G860: =IF(SUM(D862:F862)<18,"Insuff.",SUM(D862:F862)) -> 29 | I860: =COUNTIF(A:A,A862) -> 1
A861: 162004 | B861: SIGNANI | C861: LORENZO | D861: 11 | E861: 4 | F861: 3 | G861: =IF(SUM(D863:F863)<18,"Insuff.",SUM(D863:F863)) -> 18 | I861: =COUNTIF(A:A,A863) -> 1
A862: 161624 | B862: SINATTI | C862: STEFANO | D862: 19 | E862: 0 | F862: 3 | G862: =IF(SUM(D864:F864)<18,"Insuff.",SUM(D864:F864)) -> 22 | I862: =COUNTIF(A:A,A864) -> 1
A863: 140287 | B863: SLAGER | C863: GIANFILIPPO | D863: 18 | E863: 1 | F863: 3 | G863: =IF(SUM(D865:F865)<18,"Insuff.",SUM(D865:F865)) -> 22 | I863: =COUNTIF(A:A,A865) -> 1
A864: 159585 | B864: SOFFRITTI | C864: LUCA | D864: 14 | E864: 5 | F864: 3 | G864: =IF(SUM(D866:F866)<18,"Insuff.",SUM(D866:F866)) -> 22 | I864: =COUNTIF(A:A,A866) -> 1
A865: 159835 | B865: SPADAVECCHIA | C865: STEFANO | D865: 15 | E865: 8 | F865: 3 | G865: =IF(SUM(D867:F867)<18,"Insuff.",SUM(D867:F867)) -> 26 | I865: =COUNTIF(A:A,A867) -> 1
A866: 157278 | B866: SPROTETTO | C866: FRANCESCO MARIA | D866: 11 | E866: 4 | F866: 3 | G866: =IF(SUM(D868:F868)<18,"Insuff.",SUM(D868:F868)) -> 18 | I866: =COUNTIF(A:A,A868) -> 1
A867: 230797 | B867: TASSINI | C867: NICOLA | D867: 8 | E867: 0 | F867: 3 | G867: =IF(SUM(D869:F869)<18,"Insuff.",SUM(D869:F869)) -> Insuff. | I867: =COUNTIF(A:A,A869) -> 2
A868: 159528 | B868: TILES | C868: DANIELE | D868: 20 | E868: 6 | F868: 3 | G868: =IF(SUM(D870:F870)<18,"Insuff.",SUM(D870:F870)) -> 29 | I868: =COUNTIF(A:A,A870) -> 1
A869: 158206 | B869: TIRAFERRI | C869: DANIELE | D869: 16 | E869: 6 | F869: 3 | G869: =IF(SUM(D871:F871)<18,"Insuff.",SUM(D871:F871)) -> 25 | I869: =COUNTIF(A:A,A871) -> 2
A870: 168821 | B870: TRAINA | C870: SALVATORE | D870: 7 | E870: 8 | F870: 3 | G870: =IF(SUM(D872:F872)<18,"Insuff.",SUM(D872:F872)) -> 18 | I870: =COUNTIF(A:A,A872) -> 2
A871: 163298 | B871: TRECCANI | C871: TIZIANO | D871: 5 | E871: 6 | F871: 3 | G871: =IF(SUM(D873:F873)<18,"Insuff.",SUM(D873:F873)) -> Insuff. | I871: =COUNTIF(A:A,A873) -> 3
A872: 164814 | B872: TUFAROLO | C872: YURI | D872: 22 | E872: 4 | F872: 3 | G872: =IF(SUM(D874:F874)<18,"Insuff.",SUM(D874:F874)) -> 29 | I872: =COUNTIF(A:A,A874) -> 1
A873: 158267 | B873: VARRIANO | C873: PAOLA | D873: 20 | E873: 5 | F873: 3 | G873: =IF(SUM(D875:F875)<18,"Insuff.",SUM(D875:F875)) -> 28 | I873: =COUNTIF(A:A,A875) -> 5
A874: 158468 | B874: VENTURI | C874: MAURIZIO | D874: 22 | E874: 8 | F874: 3 | G874: =IF(SUM(D876:F876)<18,"Insuff.",SUM(D876:F876)) -> 33 | I874: =COUNTIF(A:A,A876) -> 1
A875: 159346 | B875: VITALI | C875: ANDREA | D875: 22 | E875: 8 | F875: 3 | G875: =IF(SUM(D877:F877)<18,"Insuff.",SUM(D877:F877)) -> 33 | I875: =COUNTIF(A:A,A877) -> 1
A876: 900012076 | B876: VUKOVIC | C876: VELJKO | D876: 6 | E876: 6 | F876: 3 | G876: =IF(SUM(D878:F878)<18,"Insuff.",SUM(D878:F878)) -> Insuff. | I876: =COUNTIF(A:A,A878) -> 2
A877: 233659 | B877: ZACCHE | C877: ALESSANDRO | D877: 11 | E877: 4 | F877: 3 | G877: =IF(SUM(D879:F879)<18,"Insuff.",SUM(D879:F879)) -> 18 | I877: =COUNTIF(A:A,A879) -> 5
A878: 157573 | B878: ZANARDI | C878: VALENTINA | D878: 21 | E878: 8 | F878: 3 | G878: =IF(SUM(D880:F880)<18,"Insuff.",SUM(D880:F880)) -> 32 | I878: =COUNTIF(A:A,A880) -> 1
A879: 900003862 | B879: ZECCA | C879: PARIDE | D879: 20 | E879: 1 | F879: 3 | G879: =IF(SUM(D881:F881)<18,"Insuff.",SUM(D881:F881)) -> 24 | I879: =COUNTIF(A:A,A881) -> 4
I880: =COUNTIF(A:A,A882) -> 0
I881: =COUNTIF(A:A,A883) -> 0
I882: =COUNTIF(A:A,A884) -> 0
I883: =COUNTIF(A:A,A885) -> 0
I884: =COUNTIF(A:A,A886) -> 0
I885: =COUNTIF(A:A,A887) -> 0
A886: Fondamenti di Ricerca Operativa L-A | I886: =COUNTIF(A:A,A888) -> 22
A887: Prova Scritta del 12 Aprile 2005 | I887: =COUNTIF(A:A,A889) -> 1
I888: =COUNTIF(A:A,A890) -> 0
A889: Validita' per chi registra direttamente il voto: fino a giovedi' 21 Aprile 2005. | I889: =COUNTIF(A:A,A891) -> 1
A890: Validita' per chi sostiene l'orale: fino a Luglio 2005. | I890: =COUNTIF(A:A,A892) -> 1
A891: Visione degli elaborati e orali: giovedi' 21 Aprile 2005, ore 14.00, Aula 61 | I891: =COUNTIF(A:A,A893) -> 1
A892: Prossimi appelli: Giugno 2005, Luglio 2005, Settembre 2005 | I892: =COUNTIF(A:A,A894) -> 1
I893: =COUNTIF(A:A,A895) -> 0
A894: matricola | B894: Cognome | C894: Nome | D894: 1 | E894: 2 | F894: bonus | G894: voto | I894: =COUNTIF(A:A,A896) -> 24
A895: 140525 | B895: AGRESTI | C895: MASSIMILIANO | D895: 20 | E895: 9 | F895: 3 | G895: =IF(SUM(D897:F897)<18,"Insuff.",SUM(D897:F897)) -> 32 | I895: =COUNTIF(A:A,A897) -> 1
A896: 161594 | B896: ALLAMPRESE | C896: GIAMPIERO | D896: 20 | E896: 5 | F896: 3 | G896: =IF(SUM(D898:F898)<18,"Insuff.",SUM(D898:F898)) -> 28 | I896: =COUNTIF(A:A,A898) -> 1
A897: 164783 | B897: AMICI | C897: ROBERTO | D897: 21 | E897: 9 | F897: 3 | G897: =IF(SUM(D899:F899)<18,"Insuff.",SUM(D899:F899)) -> 33 | I897: =COUNTIF(A:A,A899) -> 1
A898: 160676 | B898: ANDREINI | C898: ELISA | D898: 11 | E898: 9 | F898: 3 | G898: =IF(SUM(D900:F900)<18,"Insuff.",SUM(D900:F900)) -> 23 | I898: =COUNTIF(A:A,A900) -> 1
A899: 145393 | B899: BADIALI | C899: MARCO | D899: 6 | E899: 5 | F899: 3 | G899: =IF(SUM(D901:F901)<18,"Insuff.",SUM(D901:F901)) -> Insuff. | I899: =COUNTIF(A:A,A901) -> 2
A900: 161408 | B900: BARBIERI | C900: PRISCO | D900: 12 | E900: 5 | F900: 0 | G900: 17 | H900: * | I900: =COUNTIF(A:A,A902) -> 2
A901: 2148064414 | B901: BERTONI | C901: GIANLUCA | D901: 12 | E901: 5 | F901: 0 | G901: 17 | H901: * | I901: =COUNTIF(A:A,A903) -> 2
A902: 122282 | B902: BETTI | C902: ALESSANDRO | D902: 8 | E902: 6 | F902: 0 | G902: =IF(SUM(D904:F904)<18,"Insuff.",SUM(D904:F904)) -> Insuff. | I902: =COUNTIF(A:A,A904) -> 11
A903: 141277 | B903: BON | C903: ALESSANDRO | D903: 10 | E903: 0 | F903: 3 | G903: =IF(SUM(D905:F905)<18,"Insuff.",SUM(D905:F905)) -> Insuff. | I903: =COUNTIF(A:A,A905) -> 2
A904: 168666 | B904: BUSA | C904: CARLO | D904: 19 | E904: 8 | F904: 3 | G904: =IF(SUM(D906:F906)<18,"Insuff.",SUM(D906:F906)) -> 30 | I904: =COUNTIF(A:A,A906) -> 1
A905: 157684 | B905: CAFINI | C905: RAUL | D905: 20 | E905: 9 | F905: 0 | G905: =IF(SUM(D907:F907)<18,"Insuff.",SUM(D907:F907)) -> 29 | I905: =COUNTIF(A:A,A907) -> 2
A906: 900011375 | B906: CANTUCCI | C906: FILIPPO | D906: 12 | E906: 6 | F906: 3 | G906: =IF(SUM(D908:F908)<18,"Insuff.",SUM(D908:F908)) -> 21 | I906: =COUNTIF(A:A,A908) -> 1
A907: 161879 | B907: CEREDA | C907: SILVIA | D907: 20 | E907: 7 | F907: 3 | G907: =IF(SUM(D909:F909)<18,"Insuff.",SUM(D909:F909)) -> 30 | I907: =COUNTIF(A:A,A909) -> 1
A908: 229657 | B908: CHIARINI | C908: MATTIA | D908: 16 | E908: 8 | F908: 0 | G908: =IF(SUM(D910:F910)<18,"Insuff.",SUM(D910:F910)) -> 24 | I908: =COUNTIF(A:A,A910) -> 2
A909: 900007180 | B909: CICORA | C909: SAVERIO | D909: 11 | E909: 6 | F909: 3 | G909: =IF(SUM(D911:F911)<18,"Insuff.",SUM(D911:F911)) -> 20 | I909: =COUNTIF(A:A,A911) -> 1
A910: 900017545 | B910: CIOTOLI | C910: FABIO | D910: 15 | E910: 3 | F910: 3 | G910: =IF(SUM(D912:F912)<18,"Insuff.",SUM(D912:F912)) -> 21 | I910: =COUNTIF(A:A,A912) -> 1
A911: 158735 | B911: CUIUS BOSCARELLO | C911: ANDREA | D911: 10 | E911: 4 | F911: 3 | G911: 17 | H911: * | I911: =COUNTIF(A:A,A913) -> 1
A912: 163446 | B912: DAMIANI | C912: MARCO | D912: 18 | E912: 4 | F912: 3 | G912: =IF(SUM(D914:F914)<18,"Insuff.",SUM(D914:F914)) -> 25 | I912: =COUNTIF(A:A,A914) -> 1
A913: 140903 | B913: D'ASCANIO | C913: AMEDEO | D913: 18 | E913: 6 | F913: 3 | G913: =IF(SUM(D915:F915)<18,"Insuff.",SUM(D915:F915)) -> 27 | I913: =COUNTIF(A:A,A915) -> 4
A914: 150520 | B914: DI LUZIO | C914: ANDREA | D914: 14 | E914: 6 | F914: 3 | G914: =IF(SUM(D916:F916)<18,"Insuff.",SUM(D916:F916)) -> 23 | I914: =COUNTIF(A:A,A916) -> 1
A915: 143261 | B915: EVANGELISTI | C915: MATTEO | D915: 9 | E915: 5 | F915: 3 | G915: 17 | H915: * | I915: =COUNTIF(A:A,A917) -> 1
A916: 106109 | B916: FALASCONI | C916: MICHELE | D916: 20 | E916: 7 | F916: 3 | G916: =IF(SUM(D918:F918)<18,"Insuff.",SUM(D918:F918)) -> 30 | I916: =COUNTIF(A:A,A918) -> 1
A917: 159862 | B917: FANTONI | C917: FABIO | D917: 12 | E917: 5 | F917: 3 | G917: =IF(SUM(D919:F919)<18,"Insuff.",SUM(D919:F919)) -> 20 | I917: =COUNTIF(A:A,A919) -> 1
A918: 166694 | B918: FARACI | C918: FABIO | D918: 5 | E918: 4 | F918: 0 | G918: =IF(SUM(D920:F920)<18,"Insuff.",SUM(D920:F920)) -> Insuff. | I918: =COUNTIF(A:A,A920) -> 7
A919: 158833 | B919: FAZI | C919: MATTEO | D919: 18 | E919: 6 | F919: 3 | G919: =IF(SUM(D921:F921)<18,"Insuff.",SUM(D921:F921)) -> 27 | I919: =COUNTIF(A:A,A921) -> 1
A920: 900007313 | B920: FELAHI | C920: ROMINA | D920: 16 | E920: 3 | F920: 3 | G920: =IF(SUM(D922:F922)<18,"Insuff.",SUM(D922:F922)) -> 22 | I920: =COUNTIF(A:A,A922) -> 1
A921: 227706 | B921: FRANCIOSI | C921: LORENZO | D921: 12 | E921: 3 | F921: 0 | G921: =IF(SUM(D923:F923)<18,"Insuff.",SUM(D923:F923)) -> Insuff. | I921: =COUNTIF(A:A,A923) -> 3
A922: 900010372 | B922: GAIM GEBRE | C922: TEMESGEN | D922: 17 | E922: 5 | F922: 3 | G922: =IF(SUM(D924:F924)<18,"Insuff.",SUM(D924:F924)) -> 25 | I922: =COUNTIF(A:A,A924) -> 1
A923: 900010370 | B923: GHIDE MEBRAHTU | C923: ERMIAS | D923: 18 | E923: 4 | F923: 3 | G923: =IF(SUM(D925:F925)<18,"Insuff.",SUM(D925:F925)) -> 25 | I923: =COUNTIF(A:A,A925) -> 1
A924: 124071 | B924: GHIDOTTI PIOVAN | C924: ALESSANDRO | D924: 10 | E924: 9 | F924: 3 | G924: =IF(SUM(D926:F926)<18,"Insuff.",SUM(D926:F926)) -> 22 | I924: =COUNTIF(A:A,A926) -> 1
A925: 2148062452 | B925: GIORGI | C925: GIANMARCO | D925: 20 | E925: 7 | F925: 0 | G925: =IF(SUM(D927:F927)<18,"Insuff.",SUM(D927:F927)) -> 27 | I925: =COUNTIF(A:A,A927) -> 8
A926: 144641 | B926: GIOTTA | C926: GERMANO | D926: 11 | E926: 4 | F926: 3 | G926: =IF(SUM(D928:F928)<18,"Insuff.",SUM(D928:F928)) -> 18 | I926: =COUNTIF(A:A,A928) -> 1
A927: 139629 | B927: IMPOSIMATO | C927: ARTURO | D927: 2 | E927: 5 | F927: 0 | G927: =IF(SUM(D929:F929)<18,"Insuff.",SUM(D929:F929)) -> Insuff. | I927: =COUNTIF(A:A,A929) -> 8
A928: 166964 | B928: LAGNA | C928: ANTONIO | D928: 12 | E928: 9 | F928: 0 | G928: =IF(SUM(D930:F930)<18,"Insuff.",SUM(D930:F930)) -> 21 | I928: =COUNTIF(A:A,A930) -> 3
A929: 161375 | B929: LAZZERINI | C929: CHIARA | D929: 16 | E929: 6 | F929: 3 | G929: =IF(SUM(D931:F931)<18,"Insuff.",SUM(D931:F931)) -> 25 | I929: =COUNTIF(A:A,A931) -> 1
A930: 131127 | B930: LEFEMINE | C930: VITO | D930: 14 | E930: 5 | F930: 0 | G930: =IF(SUM(D932:F932)<18,"Insuff.",SUM(D932:F932)) -> 19 | I930: =COUNTIF(A:A,A932) -> 5
A931: 156949 | B931: LOMBARDO | C931: MARCO | D931: 20 | E931: 9 | F931: 3 | G931: =IF(SUM(D933:F933)<18,"Insuff.",SUM(D933:F933)) -> 32 | I931: =COUNTIF(A:A,A933) -> 1
A932: 140585 | B932: LORENZELLI | C932: GIACOMO | D932: 16 | E932: 6 | F932: 3 | G932: =IF(SUM(D934:F934)<18,"Insuff.",SUM(D934:F934)) -> 25 | I932: =COUNTIF(A:A,A934) -> 1
A933: 158724 | B933: MAGALE | C933: ROBERTO | D933: 13 | E933: 6 | F933: 3 | G933: =IF(SUM(D935:F935)<18,"Insuff.",SUM(D935:F935)) -> 22 | I933: =COUNTIF(A:A,A935) -> 1
A934: 107899 | B934: MALVASIO | C934: ELISA | D934: 0 | E934: 3 | F934: 0 | G934: =IF(SUM(D936:F936)<18,"Insuff.",SUM(D936:F936)) -> Insuff. | I934: =COUNTIF(A:A,A936) -> 8
A935: 235389 | B935: MARTELLA | C935: ALESSANDRO | D935: 14 | E935: 4 | F935: 3 | G935: =IF(SUM(D937:F937)<18,"Insuff.",SUM(D937:F937)) -> 21 | I935: =COUNTIF(A:A,A937) -> 3
A936: 158349 | B936: MENGOLI | C936: DARIO | D936: 16 | E936: 9 | F936: 0 | G936: =IF(SUM(D938:F938)<18,"Insuff.",SUM(D938:F938)) -> 25 | I936: =COUNTIF(A:A,A938) -> 2
A937: 110691 | B937: MINGHETTI | C937: ELISA | D937: 2 | E937: 7 | F937: 0 | G937: =IF(SUM(D939:F939)<18,"Insuff.",SUM(D939:F939)) -> Insuff. | I937: =COUNTIF(A:A,A939) -> 5
A938: 158658 | B938: MINNUCCI | C938: LUCA | D938: 17 | E938: 6 | F938: 3 | G938: =IF(SUM(D940:F940)<18,"Insuff.",SUM(D940:F940)) -> 26 | I938: =COUNTIF(A:A,A940) -> 1
A939: 229674 | B939: NEGRISOLI | C939: ALBERTO | D939: 0 | E939: 3 | F939: 3 | G939: =IF(SUM(D941:F941)<18,"Insuff.",SUM(D941:F941)) -> Insuff. | I939: =COUNTIF(A:A,A941) -> 4
A940: 142594 | B940: ORTOLANI | C940: ALESSANDRO | D940: 19 | E940: 6 | F940: 0 | G940: =IF(SUM(D942:F942)<18,"Insuff.",SUM(D942:F942)) -> 25 | I940: =COUNTIF(A:A,A942) -> 2
A941: 2108059204 | B941: ORTOLANI | C941: MAURIZIO | D941: 18 | E941: 5 | F941: 3 | G941: =IF(SUM(D943:F943)<18,"Insuff.",SUM(D943:F943)) -> 26 | I941: =COUNTIF(A:A,A943) -> 2
A942: 158022 | B942: PALMISANO | C942: GIOVANNI | D942: 14 | E942: 2 | F942: 3 | G942: =IF(SUM(D944:F944)<18,"Insuff.",SUM(D944:F944)) -> 19 | I942: =COUNTIF(A:A,A944) -> 6
A943: 233655 | B943: PELAGATTI | C943: NICOLA | D943: 2 | E943: 8 | F943: 0 | G943: =IF(SUM(D945:F945)<18,"Insuff.",SUM(D945:F945)) -> Insuff. | I943: =COUNTIF(A:A,A945) -> 2
A944: 122114 | B944: PIEROTTI | C944: PAOLO | D944: 19 | E944: 5 | F944: 3 | G944: =IF(SUM(D946:F946)<18,"Insuff.",SUM(D946:F946)) -> 27 | I944: =COUNTIF(A:A,A946) -> 1
A945: 142717 | B945: PIZZUTI | C945: GIANROCCO | D945: 4 | E945: 1 | F945: 0 | G945: =IF(SUM(D947:F947)<18,"Insuff.",SUM(D947:F947)) -> Insuff. | I945: =COUNTIF(A:A,A947) -> 6
A946: 900019215 | B946: PREITE | C946: GUIDO | D946: 11 | E946: 3 | F946: 3 | G946: =IF(SUM(D948:F948)<18,"Insuff.",SUM(D948:F948)) -> Insuff. | H946: * | I946: =COUNTIF(A:A,A948) -> 1
A947: 900012671 | B947: PRIMICERI | C947: MARCO ANTONIO | D947: 11 | E947: 5 | F947: 3 | G947: =IF(SUM(D949:F949)<18,"Insuff.",SUM(D949:F949)) -> 19 | I947: =COUNTIF(A:A,A949) -> 1
A948: 128984 | B948: RASPADORI | C948: GIANLUCA | D948: 4 | E948: 3 | F948: 0 | G948: =IF(SUM(D950:F950)<18,"Insuff.",SUM(D950:F950)) -> Insuff. | I948: =COUNTIF(A:A,A950) -> 5
A949: 222378 | B949: ROSSI | C949: EMANUELE | D949: 13 | E949: 6 | F949: 0 | G949: =IF(SUM(D951:F951)<18,"Insuff.",SUM(D951:F951)) -> 19 | I949: =COUNTIF(A:A,A951) -> 2
A950: 2148063712 | B950: RUSSO | C950: LUCA | D950: 4 | E950: 5 | F950: 3 | G950: =IF(SUM(D952:F952)<18,"Insuff.",SUM(D952:F952)) -> Insuff. | I950: =COUNTIF(A:A,A952) -> 1
A951: 144583 | B951: SENATORE | C951: RITA | D951: 11 | E951: 4 | F951: 3 | G951: =IF(SUM(D953:F953)<18,"Insuff.",SUM(D953:F953)) -> 18 | I951: =COUNTIF(A:A,A953) -> 1
A952: 157649 | B952: SPINELLI | C952: MASSIMO | D952: 17 | E952: 6 | F952: 3 | G952: =IF(SUM(D954:F954)<18,"Insuff.",SUM(D954:F954)) -> 26 | I952: =COUNTIF(A:A,A954) -> 1
A953: 167022 | B953: TAPPI | C953: THOMAS | D953: 16 | E953: 5 | F953: 3 | G953: =IF(SUM(D955:F955)<18,"Insuff.",SUM(D955:F955)) -> 24 | I953: =COUNTIF(A:A,A955) -> 1
A954: 230797 | B954: TASSINI | C954: NICOLA | D954: 16 | E954: 9 | F954: 0 | G954: =IF(SUM(D956:F956)<18,"Insuff.",SUM(D956:F956)) -> 25 | I954: =COUNTIF(A:A,A956) -> 2
A955: 168821 | B955: TRAINA | C955: SALVATORE | D955: 19 | E955: 9 | F955: 0 | G955: =IF(SUM(D957:F957)<18,"Insuff.",SUM(D957:F957)) -> 28 | I955: =COUNTIF(A:A,A957) -> 2
A956: 163298 | B956: TRECCANI | C956: TIZIANO | D956: 18 | E956: 3 | F956: 0 | G956: =IF(SUM(D958:F958)<18,"Insuff.",SUM(D958:F958)) -> 21 | I956: =COUNTIF(A:A,A958) -> 3
A957: 168939 | B957: VACCARI | C957: MARCO | D957: 13 | E957: 1 | F957: 3 | G957: 17 | H957: * | I957: =COUNTIF(A:A,A959) -> 1
A958: 900012036 | B958: VERONA | C958: DAVIDE | D958: 12 | E958: 0 | F958: 3 | G958: =IF(SUM(D960:F960)<18,"Insuff.",SUM(D960:F960)) -> Insuff. | I958: =COUNTIF(A:A,A960) -> 2
A959: 900012076 | B959: VUKOVIC | C959: VELJKO | D959: 20 | E959: 9 | F959: 0 | G959: =IF(SUM(D961:F961)<18,"Insuff.",SUM(D961:F961)) -> 29 | I959: =COUNTIF(A:A,A961) -> 2
A960: 233659 | B960: ZACCHE | C960: ALESSANDRO | D960: 5 | E960: 5 | F960: 0 | G960: =IF(SUM(D962:F962)<18,"Insuff.",SUM(D962:F962)) -> Insuff. | I960: =COUNTIF(A:A,A962) -> 5
A961: 158101 | B961: ZAPPAROLI | C961: PAMELA | D961: 21 | E961: 9 | F961: 3 | G961: =IF(SUM(D963:F963)<18,"Insuff.",SUM(D963:F963)) -> 33 | I961: =COUNTIF(A:A,A963) -> 1
A962: * Puo' registrare 18 | I962: =COUNTIF(A:A,A964) -> 3
I963: =COUNTIF(A:A,A965) -> 0
I964: =COUNTIF(A:A,A966) -> 0
I965: =COUNTIF(A:A,A967) -> 0
A966: Fondamenti di Ricerca Operativa L-A | I966: =COUNTIF(A:A,A968) -> 22
A967: Prova Scritta del 22 Giugno 2005 | I967: =COUNTIF(A:A,A969) -> 1
I968: =COUNTIF(A:A,A970) -> 0
A969: Validita' per chi registra direttamente il voto: fino a giovedi' 30 Giugno 2005. | I969: =COUNTIF(A:A,A971) -> 1
A970: Validita' per chi sostiene l'orale: fino a Settembre 2005. | I970: =COUNTIF(A:A,A972) -> 1
A971: Visione degli elaborati e orali: giovedi' 30 Giugno 2005, ore 15.00, Aula 61 | I971: =COUNTIF(A:A,A973) -> 1
A972: Prossimi appelli: Luglio 2005, Settembre 2005 | I972: =COUNTIF(A:A,A974) -> 1
I973: =COUNTIF(A:A,A975) -> 0
A974: matricola | B974: Cognome | C974: Nome | D974: 1 | E974: 2 | F974: bonus | G974: voto | I974: =COUNTIF(A:A,A976) -> 24
A975: 145393 | B975: BADIALI | C975: MARCO | D975: 11 | E975: 7 | F975: 0 | G975: =IF(SUM(D977:F977)<18,"Insuff.",SUM(D977:F977)) -> 18 | I975: =COUNTIF(A:A,A977) -> 2
A976: 122282 | B976: BETTI | C976: ALESSANDRO | D976: 9 | E976: 1 | F976: 0 | G976: =IF(SUM(D978:F978)<18,"Insuff.",SUM(D978:F978)) -> Insuff. | H976: *** | I976: =COUNTIF(A:A,A978) -> 11
A977: 141277 | B977: BON | C977: ALESSANDRO | D977: 19 | E977: 5 | F977: 0 | G977: =IF(SUM(D979:F979)<18,"Insuff.",SUM(D979:F979)) -> 24 | I977: =COUNTIF(A:A,A979) -> 2
A978: 128045 | B978: CAVALLARO | C978: FRANCESCO | D978: 11 | E978: 2 | F978: 0 | G978: =IF(SUM(D980:F980)<18,"Insuff.",SUM(D980:F980)) -> Insuff. | I978: =COUNTIF(A:A,A980) -> 4
A979: 159335 | B979: D'APOTE | C979: LEONARDO | D979: 6 | E979: 10 | F979: 3 | G979: =IF(SUM(D981:F981)<18,"Insuff.",SUM(D981:F981)) -> 19 | I979: =COUNTIF(A:A,A981) -> 4
A980: 140903 | B980: D'ASCANIO | C980: AMEDEO | D980: 10 | E980: 3 | F980: 0 | G980: =IF(SUM(D982:F982)<18,"Insuff.",SUM(D982:F982)) -> Insuff. | I980: =COUNTIF(A:A,A982) -> 4
A981: 158166 | B981: DE FILIPPIS | C981: LUCA | D981: 15 | E981: 10 | F981: 3 | G981: =IF(SUM(D983:F983)<18,"Insuff.",SUM(D983:F983)) -> 28 | I981: =COUNTIF(A:A,A983) -> 1
A982: 900012012 | B982: DE MARCO | C982: MASSIMO | D982: 19 | E982: 3 | F982: 3 | G982: =IF(SUM(D984:F984)<18,"Insuff.",SUM(D984:F984)) -> 25 | I982: =COUNTIF(A:A,A984) -> 1
A983: 144105 | B983: D'ERCOLE | C983: FRANCESCO | D983: 17 | E983: 6 | F983: 3 | G983: =IF(SUM(D985:F985)<18,"Insuff.",SUM(D985:F985)) -> 26 | I983: =COUNTIF(A:A,A985) -> 1
A984: 166694 | B984: FARACI | C984: FABIO | D984: 1 | E984: 2 | F984: 0 | G984: =IF(SUM(D986:F986)<18,"Insuff.",SUM(D986:F986)) -> Insuff. | H984: *** | I984: =COUNTIF(A:A,A986) -> 7
A985: 227706 | B985: FRANCIOSI | C985: LORENZO | D985: 18 | E985: 5 | F985: 0 | G985: =IF(SUM(D987:F987)<18,"Insuff.",SUM(D987:F987)) -> 23 | I985: =COUNTIF(A:A,A987) -> 3
A986: 236072 | B986: FURLOTTI | C986: ANDREA | D986: 15 | E986: 0 | F986: 3 | G986: =IF(SUM(D988:F988)<18,"Insuff.",SUM(D988:F988)) -> 18 | I986: =COUNTIF(A:A,A988) -> 1
A987: 166964 | B987: LAGNA | C987: ANTONIO | D987: 19 | E987: 6 | F987: 0 | G987: =IF(SUM(D989:F989)<18,"Insuff.",SUM(D989:F989)) -> 25 | I987: =COUNTIF(A:A,A989) -> 3
A988: 107899 | B988: MALVASIO | C988: ELISA | D988: 9 | E988: 1 | F988: 0 | G988: =IF(SUM(D990:F990)<18,"Insuff.",SUM(D990:F990)) -> Insuff. | I988: =COUNTIF(A:A,A990) -> 8
A989: 235389 | B989: MARTELLA | C989: ALESSANDRO | D989: 0 | E989: 0 | F989: 0 | G989: =IF(SUM(D991:F991)<18,"Insuff.",SUM(D991:F991)) -> Insuff. | I989: =COUNTIF(A:A,A991) -> 3
A990: 158022 | B990: PALMISANO | C990: GIOVANNI | D990: 8 | E990: 1 | F990: 0 | G990: =IF(SUM(D992:F992)<18,"Insuff.",SUM(D992:F992)) -> Insuff. | I990: =COUNTIF(A:A,A992) -> 6
A991: 139463 | B991: PALMUCCI | C991: MASSIMILIANO | D991: 18 | E991: 0 | F991: 0 | G991: =IF(SUM(D993:F993)<18,"Insuff.",SUM(D993:F993)) -> 18 | I991: =COUNTIF(A:A,A993) -> 6
A992: 160489 | B992: PESENTI | C992: ANDREA | D992: 17 | E992: 11 | F992: 0 | G992: =IF(SUM(D994:F994)<18,"Insuff.",SUM(D994:F994)) -> 28 | I992: =COUNTIF(A:A,A994) -> 2
A993: 142717 | B993: PIZZUTI | C993: GIANROCCO | D993: 9 | E993: 0 | F993: 0 | G993: =IF(SUM(D995:F995)<18,"Insuff.",SUM(D995:F995)) -> Insuff. | I993: =COUNTIF(A:A,A995) -> 6
A994: 128984 | B994: RASPADORI | C994: GIANLUCA | D994: 0 | E994: 0 | F994: 0 | G994: =IF(SUM(D996:F996)<18,"Insuff.",SUM(D996:F996)) -> Insuff. | H994: *** | I994: =COUNTIF(A:A,A996) -> 5
A995: 160495 | B995: ROVATTI | C995: FABRIZIO | D995: 19 | E995: 10 | F995: 3 | G995: =IF(SUM(D997:F997)<18,"Insuff.",SUM(D997:F997)) -> 32 | I995: =COUNTIF(A:A,A997) -> 2
A996: 150572 | B996: SFAMURRI | C996: ALESSANDRO | D996: 6 | E996: 4 | F996: 3 | G996: =IF(SUM(D998:F998)<18,"Insuff.",SUM(D998:F998)) -> Insuff. | I996: =COUNTIF(A:A,A998) -> 2
A997: 167152 | B997: TASSONI | C997: DAVIDE | D997: 18 | E997: 4 | F997: 3 | G997: =IF(SUM(D999:F999)<18,"Insuff.",SUM(D999:F999)) -> 25 | I997: =COUNTIF(A:A,A999) -> 1
A998: 163298 | B998: TRECCANI | C998: TIZIANO | D998: 17 | E998: 7 | F998: 0 | G998: =IF(SUM(D1000:F1000)<18,"Insuff.",SUM(D1000:F1000)) -> 24 | I998: =COUNTIF(A:A,A1000) -> 3
A999: 233659 | B999: ZACCHE | C999: ALESSANDRO | D999: 13 | E999: 1 | F999: 0 | G999: =IF(SUM(D1001:F1001)<18,"Insuff.",SUM(D1001:F1001)) -> Insuff. | I999: =COUNTIF(A:A,A1001) -> 5
A1000: 900003862 | B1000: ZECCA | C1000: PARIDE | D1000: 15 | E1000: 3 | F1000: 0 | G1000: =IF(SUM(D1002:F1002)<18,"Insuff.",SUM(D1002:F1002)) -> 18 | I1000: =COUNTIF(A:A,A1002) -> 4
A1001: *** Il prossimo risultato verra' registrato in ogni caso | I1001: =COUNTIF(A:A,A1003) -> 1
I1002: =COUNTIF(A:A,A1004) -> 0
I1003: =COUNTIF(A:A,A1005) -> 0
A1004: Fondamenti di Ricerca Operativa L-A | I1004: =COUNTIF(A:A,A1006) -> 22
A1005: Prova Scritta del 20 Luglio 2005 | I1005: =COUNTIF(A:A,A1007) -> 1
I1006: =COUNTIF(A:A,A1008) -> 0
A1007: Validita' per chi registra direttamente il voto: fino a mercoledi' 27 Luglio 2005 | I1007: =COUNTIF(A:A,A1009) -> 1
A1008: (non procrastinabile; non si risponde a mail o telefonate in merito). | I1008: =COUNTIF(A:A,A1010) -> 9
I1009: =COUNTIF(A:A,A1011) -> 0
A1010: Validita' per chi sostiene l'orale: fino all'appello di Dicembre-Gennaio. | I1010: =COUNTIF(A:A,A1012) -> 1
A1011: Visione degli elaborati e orali: mercoledi' 27 Luglio 2005, ore 15.00, Aula 61 | I1011: =COUNTIF(A:A,A1013) -> 1
A1012: Prossimi appelli: Settembre, Dicembre-Gennaio | I1012: =COUNTIF(A:A,A1014) -> 1
I1013: =COUNTIF(A:A,A1015) -> 0
A1014: matricola | B1014: Cognome | C1014: Nome | D1014: 1 | E1014: 2 | F1014: bonus | G1014: voto | I1014: =COUNTIF(A:A,A1016) -> 24
A1015: 160202 | B1015: ANTONIOLI | C1015: FABRIZIO | D1015: 14 | E1015: 1 | F1015: 3 | G1015: =IF(SUM(D1017:F1017)<18,"Insuff.",SUM(D1017:F1017)) -> 18 | I1015: =COUNTIF(A:A,A1017) -> 3
A1016: 122835 | B1016: BORTONE | C1016: ANDREA | D1016: 0 | E1016: 3 | F1016: 3 | G1016: =IF(SUM(D1018:F1018)<18,"Insuff.",SUM(D1018:F1018)) -> Insuff. | I1016: =COUNTIF(A:A,A1018) -> 5
A1017: 142022 | B1017: CATALDO | C1017: DONATO ANTONIO | D1017: 12 | E1017: 3 | F1017: 3 | G1017: =IF(SUM(D1019:F1019)<18,"Insuff.",SUM(D1019:F1019)) -> 18 | I1017: =COUNTIF(A:A,A1019) -> 1
A1018: 129215 | B1018: COLICCHIA | C1018: VITTORIO | D1018: 12 | E1018: 7 | F1018: 3 | G1018: =IF(SUM(D1020:F1020)<18,"Insuff.",SUM(D1020:F1020)) -> 22 | I1018: =COUNTIF(A:A,A1020) -> 1
A1019: 160436 | B1019: D'AGOSTINO | C1019: STEFANO | D1019: 9 | E1019: 7 | F1019: 3 | G1019: =IF(SUM(D1021:F1021)<18,"Insuff.",SUM(D1021:F1021)) -> 19 | I1019: =COUNTIF(A:A,A1021) -> 4
A1020: 159335 | B1020: D'APOTE | C1020: LEONARDO | D1020: 6 | E1020: 9 | F1020: 0 | G1020: =IF(SUM(D1022:F1022)<18,"Insuff.",SUM(D1022:F1022)) -> Insuff. | I1020: =COUNTIF(A:A,A1022) -> 4
A1021: 140903 | B1021: D'ASCANIO | C1021: AMEDEO | D1021: 14 | E1021: 5 | F1021: 0 | G1021: =IF(SUM(D1023:F1023)<18,"Insuff.",SUM(D1023:F1023)) -> 19 | I1021: =COUNTIF(A:A,A1023) -> 4
A1022: 160033 | B1022: DI CINTIO | C1022: FRANCESCO | D1022: 16 | E1022: 8 | F1022: 3 | G1022: =IF(SUM(D1024:F1024)<18,"Insuff.",SUM(D1024:F1024)) -> 27 | I1022: =COUNTIF(A:A,A1024) -> 1
A1023: 196007 | B1023: DI MARCO | C1023: FULVIO | D1023: 10 | E1023: 6 | F1023: 3 | G1023: =IF(SUM(D1025:F1025)<18,"Insuff.",SUM(D1025:F1025)) -> 19 | I1023: =COUNTIF(A:A,A1025) -> 2
A1024: 166694 | B1024: FARACI | C1024: FABIO | D1024: 12 | E1024: 3 | F1024: 0 | G1024: =IF(SUM(D1026:F1026)<18,"Insuff.",SUM(D1026:F1026)) -> Insuff. | H1024: (**) | I1024: =COUNTIF(A:A,A1026) -> 7
A1025: 125528 | B1025: FARATRO | C1025: ANDREA | D1025: 10 | E1025: 6 | F1025: 3 | G1025: =IF(SUM(D1027:F1027)<18,"Insuff.",SUM(D1027:F1027)) -> 19 | I1025: =COUNTIF(A:A,A1027) -> 1
A1026: 159504 | B1026: GRASSI | C1026: ENRICO | D1026: 12 | E1026: 1 | F1026: 3 | G1026: =IF(SUM(D1028:F1028)<18,"Insuff.",SUM(D1028:F1028)) -> Insuff. | I1026: =COUNTIF(A:A,A1028) -> 5
A1027: 139629 | B1027: IMPOSIMATO | C1027: ARTURO | D1027: 0 | E1027: 0 | F1027: 0 | G1027: =IF(SUM(D1029:F1029)<18,"Insuff.",SUM(D1029:F1029)) -> Insuff. | H1027: (***) | I1027: =COUNTIF(A:A,A1029) -> 8
A1028: 2148064468 | B1028: LANZI | C1028: GIUSEPPE | D1028: 4 | E1028: 5 | F1028: 3 | G1028: =IF(SUM(D1030:F1030)<18,"Insuff.",SUM(D1030:F1030)) -> Insuff. | I1028: =COUNTIF(A:A,A1030) -> 2
A1029: 121686 | B1029: LORI | C1029: LUCA | D1029: 15 | E1029: 9 | F1029: 3 | G1029: =IF(SUM(D1031:F1031)<18,"Insuff.",SUM(D1031:F1031)) -> 27 | I1029: =COUNTIF(A:A,A1031) -> 1
A1030: 107899 | B1030: MALVASIO | C1030: ELISA | D1030: 11 | E1030: 0 | F1030: 0 | G1030: =IF(SUM(D1032:F1032)<18,"Insuff.",SUM(D1032:F1032)) -> Insuff. | I1030: =COUNTIF(A:A,A1032) -> 8
A1031: 235389 | B1031: MARTELLA | C1031: ALESSANDRO | D1031: 10 | E1031: 9 | F1031: 0 | G1031: =IF(SUM(D1033:F1033)<18,"Insuff.",SUM(D1033:F1033)) -> 19 | I1031: =COUNTIF(A:A,A1033) -> 3
A1032: 229674 | B1032: NEGRISOLI | C1032: ALBERTO | D1032: 7 | E1032: 3 | F1032: 0 | G1032: =IF(SUM(D1034:F1034)<18,"Insuff.",SUM(D1034:F1034)) -> Insuff. | I1032: =COUNTIF(A:A,A1034) -> 4
A1033: 158022 | B1033: PALMISANO | C1033: GIOVANNI | D1033: 12 | E1033: 0 | F1033: 0 | G1033: =IF(SUM(D1035:F1035)<18,"Insuff.",SUM(D1035:F1035)) -> Insuff. | I1033: =COUNTIF(A:A,A1035) -> 6
A1034: 2148063310 | B1034: PARENTELA | C1034: FABIO | D1034: 7 | E1034: 7 | F1034: 3 | G1034: =IF(SUM(D1036:F1036)<18,"Insuff.",SUM(D1036:F1036)) -> Insuff. | H1034: (*) | I1034: =COUNTIF(A:A,A1036) -> 1
A1035: 160318 | B1035: PETROSINO | C1035: MATTIA | D1035: 21 | E1035: 9 | F1035: 0 | G1035: =IF(SUM(D1037:F1037)<18,"Insuff.",SUM(D1037:F1037)) -> 30 | I1035: =COUNTIF(A:A,A1037) -> 2
A1036: 159743 | B1036: POLIDORO | C1036: GIORDANO | D1036: 6 | E1036: 3 | F1036: 3 | G1036: =IF(SUM(D1038:F1038)<18,"Insuff.",SUM(D1038:F1038)) -> Insuff. | I1036: =COUNTIF(A:A,A1038) -> 3
A1037: 128984 | B1037: RASPADORI | C1037: GIANLUCA | D1037: 9 | E1037: 2 | F1037: 0 | G1037: =IF(SUM(D1039:F1039)<18,"Insuff.",SUM(D1039:F1039)) -> Insuff. | H1037: (**) | I1037: =COUNTIF(A:A,A1039) -> 5
A1038: 138633 | B1038: ROSSI | C1038: ANTONELLO | D1038: 11 | E1038: 0 | F1038: 3 | G1038: =IF(SUM(D1040:F1040)<18,"Insuff.",SUM(D1040:F1040)) -> Insuff. | I1038: =COUNTIF(A:A,A1040) -> 4
A1039: 160074 | B1039: ROSSIGNOLI | C1039: ENRICO | D1039: 18 | E1039: 4 | F1039: 0 | G1039: =IF(SUM(D1041:F1041)<18,"Insuff.",SUM(D1041:F1041)) -> 22 | I1039: =COUNTIF(A:A,A1041) -> 2
A1040: 900007152 | B1040: SCIARRETTA | C1040: ELISEO | D1040: 8 | E1040: 0 | F1040: 3 | G1040: =IF(SUM(D1042:F1042)<18,"Insuff.",SUM(D1042:F1042)) -> Insuff. | I1040: =COUNTIF(A:A,A1042) -> 2
A1041: 150572 | B1041: SFAMURRI | C1041: ALESSANDRO | D1041: 7 | E1041: 6 | F1041: 3 | G1041: =IF(SUM(D1043:F1043)<18,"Insuff.",SUM(D1043:F1043)) -> Insuff. | I1041: =COUNTIF(A:A,A1043) -> 2
A1042: 143072 | B1042: SIMONETTI | C1042: ENRICO | D1042: 16 | E1042: 5 | F1042: 3 | G1042: =IF(SUM(D1044:F1044)<18,"Insuff.",SUM(D1044:F1044)) -> 24 | I1042: =COUNTIF(A:A,A1044) -> 1
A1043: 2108057257 | B1043: SPARAPAN | C1043: ANDREA | D1043: 9 | E1043: 9 | F1043: 3 | G1043: =IF(SUM(D1045:F1045)<18,"Insuff.",SUM(D1045:F1045)) -> 21 | I1043: =COUNTIF(A:A,A1045) -> 1
A1044: 158206 | B1044: TIRAFERRI | C1044: DANIELE | D1044: 17 | E1044: 6 | F1044: 0 | G1044: =IF(SUM(D1046:F1046)<18,"Insuff.",SUM(D1046:F1046)) -> 23 | I1044: =COUNTIF(A:A,A1046) -> 2
A1045: 105783 | B1045: TUGNETTI | C1045: MICHELE | D1045: 18 | E1045: 9 | F1045: 3 | G1045: =IF(SUM(D1047:F1047)<18,"Insuff.",SUM(D1047:F1047)) -> 30 | I1045: =COUNTIF(A:A,A1047) -> 1
A1046: 158267 | B1046: VARRIANO | C1046: PAOLA | D1046: 11 | E1046: 0 | F1046: 0 | G1046: =IF(SUM(D1048:F1048)<18,"Insuff.",SUM(D1048:F1048)) -> Insuff. | I1046: =COUNTIF(A:A,A1048) -> 5
A1047: (*) Puo' registrare 18. | I1047: =COUNTIF(A:A,A1049) -> 1
A1048: (**) L'esito e' stato verbalizzato. | I1048: =COUNTIF(A:A,A1050) -> 1
A1049: (***) L'esito del prossimo appello verra' verbalizzato in ogni caso. | I1049: =COUNTIF(A:A,A1051) -> 2
I1050: =COUNTIF(A:A,A1052) -> 0
I1051: =COUNTIF(A:A,A1053) -> 0
A1052: Fondamenti di Ricerca Operativa L-A | I1052: =COUNTIF(A:A,A1054) -> 22
A1053: Prova Scritta del 12 Settembre 2005 | I1053: =COUNTIF(A:A,A1055) -> 1
I1054: =COUNTIF(A:A,A1056) -> 0
A1055: Validita' per chi registra direttamente il voto: fino a martedi' 20 Settembre 2005 | I1055: =COUNTIF(A:A,A1057) -> 1
A1056: (non procrastinabile; non si risponde a mail o telefonate in merito). | I1056: =COUNTIF(A:A,A1058) -> 9
I1057: =COUNTIF(A:A,A1059) -> 0
A1058: Validita' per chi sostiene l'orale: fino all'appello di Gennaio 2006. | I1058: =COUNTIF(A:A,A1060) -> 1
A1059: Visione degli elaborati e orali: martedi' 20 Settembre 2005, ore 15.00, Aula 61 | I1059: =COUNTIF(A:A,A1061) -> 1
A1060: Prossimi appelli: Dicembre, Gennaio | I1060: =COUNTIF(A:A,A1062) -> 1
I1061: =COUNTIF(A:A,A1063) -> 0
A1062: matricola | B1062: Cognome | C1062: Nome | D1062: 1 | E1062: 2 | F1062: bonus | G1062: voto | I1062: =COUNTIF(A:A,A1064) -> 24
A1063: 160202 | B1063: ANTONIOLI | C1063: FABRIZIO | D1063: 3 | E1063: 9 | F1063: 0 | G1063: =IF(SUM(D1065:F1065)<18,"Insuff.",SUM(D1065:F1065)) -> Insuff. | I1063: =COUNTIF(A:A,A1065) -> 3
A1064: 122835 | B1064: BORTONE | C1064: ANDREA | D1064: 1 | E1064: 4 | F1064: 0 | G1064: =IF(SUM(D1066:F1066)<18,"Insuff.",SUM(D1066:F1066)) -> Insuff. | I1064: =COUNTIF(A:A,A1066) -> 5
A1065: 158809 | B1065: CARDONE | C1065: RAFFAELE | D1065: 7 | E1065: 8 | F1065: 3 | G1065: =IF(SUM(D1067:F1067)<18,"Insuff.",SUM(D1067:F1067)) -> 18 | I1065: =COUNTIF(A:A,A1067) -> 1
A1066: 128045 | B1066: CAVALLARO | C1066: FRANCESCO | D1066: 6 | E1066: 7 | F1066: 0 | G1066: =IF(SUM(D1068:F1068)<18,"Insuff.",SUM(D1068:F1068)) -> Insuff. | I1066: =COUNTIF(A:A,A1068) -> 4
A1067: 160436 | B1067: D'AGOSTINO | C1067: STEFANO | D1067: 6 | E1067: 9 | F1067: 0 | G1067: =IF(SUM(D1069:F1069)<18,"Insuff.",SUM(D1069:F1069)) -> Insuff. | I1067: =COUNTIF(A:A,A1069) -> 4
A1068: 140903 | B1068: D'ASCANIO | C1068: AMEDEO | D1068: 16 | E1068: 9 | F1068: 0 | G1068: =IF(SUM(D1070:F1070)<18,"Insuff.",SUM(D1070:F1070)) -> 25 | I1068: =COUNTIF(A:A,A1070) -> 4
A1069: 196007 | B1069: DI MARCO | C1069: FULVIO | D1069: 21 | E1069: 9 | F1069: 0 | G1069: =IF(SUM(D1071:F1071)<18,"Insuff.",SUM(D1071:F1071)) -> 30 | I1069: =COUNTIF(A:A,A1071) -> 2
A1070: 168981 | B1070: FALGHERI | C1070: GIUSEPPE | D1070: 4 | E1070: 0 | F1070: 3 | G1070: =IF(SUM(D1072:F1072)<18,"Insuff.",SUM(D1072:F1072)) -> Insuff. | I1070: =COUNTIF(A:A,A1072) -> 3
A1071: 162122 | B1071: FIORE | C1071: VINCENZO | D1071: 15 | E1071: 0 | F1071: 3 | G1071: =IF(SUM(D1073:F1073)<18,"Insuff.",SUM(D1073:F1073)) -> 18 | I1071: =COUNTIF(A:A,A1073) -> 2
A1072: 158218 | B1072: GASBARRO | C1072: DAVIDE | D1072: 5 | E1072: 3 | F1072: 3 | G1072: =IF(SUM(D1074:F1074)<18,"Insuff.",SUM(D1074:F1074)) -> Insuff. | I1072: =COUNTIF(A:A,A1074) -> 3
A1073: 900012698 | B1073: GENOVESE | C1073: EMANUELE | D1073: 15 | E1073: 7 | F1073: 3 | G1073: =IF(SUM(D1075:F1075)<18,"Insuff.",SUM(D1075:F1075)) -> 25 | I1073: =COUNTIF(A:A,A1075) -> 1
A1074: 159145 | B1074: GIULIANELLI | C1074: MICHELE | D1074: 21 | E1074: 5 | F1074: 3 | G1074: =IF(SUM(D1076:F1076)<18,"Insuff.",SUM(D1076:F1076)) -> 29 | I1074: =COUNTIF(A:A,A1076) -> 1
A1075: 159504 | B1075: GRASSI | C1075: ENRICO | D1075: 9 | E1075: 4 | F1075: 0 | G1075: =IF(SUM(D1077:F1077)<18,"Insuff.",SUM(D1077:F1077)) -> Insuff. | I1075: =COUNTIF(A:A,A1077) -> 5
A1076: 2148064468 | B1076: LANZI | C1076: GIUSEPPE | D1076: 15 | E1076: 8 | F1076: 0 | G1076: =IF(SUM(D1078:F1078)<18,"Insuff.",SUM(D1078:F1078)) -> 23 | I1076: =COUNTIF(A:A,A1078) -> 2
A1077: 229674 | B1077: NEGRISOLI | C1077: ALBERTO | D1077: 1 | E1077: 7 | F1077: 0 | G1077: =IF(SUM(D1079:F1079)<18,"Insuff.",SUM(D1079:F1079)) -> Insuff. | I1077: =COUNTIF(A:A,A1079) -> 4
A1078: 2148061650 | B1078: PALLOTTI | C1078: GIACOMO | D1078: 4 | E1078: 5 | F1078: 3 | G1078: =IF(SUM(D1080:F1080)<18,"Insuff.",SUM(D1080:F1080)) -> Insuff. | I1078: =COUNTIF(A:A,A1080) -> 2
A1079: 158022 | B1079: PALMISANO | C1079: GIOVANNI | D1079: 11 | E1079: 4 | F1079: 0 | G1079: =IF(SUM(D1081:F1081)<18,"Insuff.",SUM(D1081:F1081)) -> Insuff. | I1079: =COUNTIF(A:A,A1081) -> 6
A1080: 139463 | B1080: PALMUCCI | C1080: MASSIMILIANO | D1080: 13 | E1080: 0 | F1080: 0 | G1080: =IF(SUM(D1082:F1082)<18,"Insuff.",SUM(D1082:F1082)) -> Insuff. | I1080: =COUNTIF(A:A,A1082) -> 6
A1081: 161401 | B1081: PANTISANO | C1081: FRANCESCO | D1081: 13 | E1081: 8 | F1081: 3 | G1081: =IF(SUM(D1083:F1083)<18,"Insuff.",SUM(D1083:F1083)) -> 24 | I1081: =COUNTIF(A:A,A1083) -> 1
A1082: 122810 | B1082: PERONI | C1082: GIOVANNI | D1082: 20 | E1082: 9 | F1082: 3 | G1082: =IF(SUM(D1084:F1084)<18,"Insuff.",SUM(D1084:F1084)) -> 32 | I1082: =COUNTIF(A:A,A1084) -> 1
A1083: 159743 | B1083: POLIDORO | C1083: GIORDANO | D1083: 7 | E1083: 7 | F1083: 0 | G1083: =IF(SUM(D1085:F1085)<18,"Insuff.",SUM(D1085:F1085)) -> Insuff. | I1083: =COUNTIF(A:A,A1085) -> 3
A1084: 233154 | B1084: PRESICCE | C1084: CARMELO GIUSEPPE | D1084: 19 | E1084: 9 | F1084: 3 | G1084: =IF(SUM(D1086:F1086)<18,"Insuff.",SUM(D1086:F1086)) -> 31 | I1084: =COUNTIF(A:A,A1086) -> 1
A1085: 900007152 | B1085: SCIARRETTA | C1085: ELISEO | D1085: 9 | E1085: 9 | F1085: 0 | G1085: =IF(SUM(D1087:F1087)<18,"Insuff.",SUM(D1087:F1087)) -> 18 | I1085: =COUNTIF(A:A,A1087) -> 2
A1086: 158267 | B1086: VARRIANO | C1086: PAOLA | D1086: 13 | E1086: 7 | F1086: 0 | G1086: =IF(SUM(D1088:F1088)<18,"Insuff.",SUM(D1088:F1088)) -> 20 | I1086: =COUNTIF(A:A,A1088) -> 5
A1087: 900013879 | B1087: VERNALI | C1087: ALESSANDRO | D1087: 17 | E1087: 7 | F1087: 3 | G1087: =IF(SUM(D1089:F1089)<18,"Insuff.",SUM(D1089:F1089)) -> 27 | I1087: =COUNTIF(A:A,A1089) -> 1
A1088: 139968 | B1088: VIMINI | C1088: PAOLO | D1088: 15 | E1088: 8 | F1088: 3 | G1088: =IF(SUM(D1090:F1090)<18,"Insuff.",SUM(D1090:F1090)) -> 26 | I1088: =COUNTIF(A:A,A1090) -> 1
A1089: 212516 | B1089: ZANELLA | C1089: MATTEO | D1089: 14 | E1089: 9 | F1089: 3 | G1089: =IF(SUM(D1091:F1091)<18,"Insuff.",SUM(D1091:F1091)) -> 26 | I1089: =COUNTIF(A:A,A1091) -> 1
A1090: 138998 | B1090: ZANUSO | C1090: CLARISSA | D1090: 8 | E1090: 9 | F1090: 3 | G1090: =IF(SUM(D1092:F1092)<18,"Insuff.",SUM(D1092:F1092)) -> 20 | I1090: =COUNTIF(A:A,A1092) -> 1
A1091: 122985 | B1091: ZINCANI | C1091: MIRCO | D1091: 21 | E1091: 9 | F1091: 3 | G1091: =IF(SUM(D1093:F1093)<18,"Insuff.",SUM(D1093:F1093)) -> 33 | I1091: =COUNTIF(A:A,A1093) -> 1
A1092: 236939 | B1092: ZUCCHINI | C1092: CLAUDIO | D1092: 15 | E1092: 9 | F1092: 3 | G1092: =IF(SUM(D1094:F1094)<18,"Insuff.",SUM(D1094:F1094)) -> 27 | I1092: =COUNTIF(A:A,A1094) -> 1
I1093: =COUNTIF(A:A,A1095) -> 0
I1094: =COUNTIF(A:A,A1096) -> 0
I1095: =COUNTIF(A:A,A1097) -> 0
I1096: =COUNTIF(A:A,A1098) -> 0
I1097: =COUNTIF(A:A,A1099) -> 0
A1098: Fondamenti di Ricerca Operativa L-A | I1098: =COUNTIF(A:A,A1100) -> 22
A1099: Prova Scritta del 12 Dicembre 2005 | I1099: =COUNTIF(A:A,A1101) -> 1
I1100: =COUNTIF(A:A,A1102) -> 0
A1101: Validita' per chi registra direttamente il voto: fino a martedi' 20 Dicembre 2005 | I1101: =COUNTIF(A:A,A1103) -> 1
A1102: (non procrastinabile; non si risponde a mail o telefonate in merito). | I1102: =COUNTIF(A:A,A1104) -> 9
I1103: =COUNTIF(A:A,A1105) -> 0
A1104: Validita' per chi sostiene l'orale: fino all'appello di Aprile 2006. | I1104: =COUNTIF(A:A,A1106) -> 1
A1105: Visione degli elaborati e orali: martedi' 20 Dicembre 2005, ore 15.00, Aula 61 | I1105: =COUNTIF(A:A,A1107) -> 1
A1106: Prossimi appelli: Gennaio, Aprile | I1106: =COUNTIF(A:A,A1108) -> 1
I1107: =COUNTIF(A:A,A1109) -> 0
A1108: matricola | B1108: Cognome | C1108: Nome | D1108: 1 | E1108: 2 | F1108: bonus | G1108: voto | I1108: =COUNTIF(A:A,A1110) -> 24
A1109: 182758 | B1109: AGRIMAN | C1109: PAOLO | D1109: 20 | E1109: 9 | F1109: 3 | G1109: =IF(SUM(D1111:F1111)<18,"Insuff.",SUM(D1111:F1111)) -> 32 | I1109: =COUNTIF(A:A,A1111) -> 1
A1110: 179267 | B1110: ALTINI | C1110: MARCO | D1110: 17 | E1110: 7 | F1110: 3 | G1110: =IF(SUM(D1112:F1112)<18,"Insuff.",SUM(D1112:F1112)) -> 27 | I1110: =COUNTIF(A:A,A1112) -> 1
A1111: 181725 | B1111: ALUIGI | C1111: ANDREA | D1111: 21 | E1111: 9 | F1111: 3 | G1111: =IF(SUM(D1113:F1113)<18,"Insuff.",SUM(D1113:F1113)) -> 33 | I1111: =COUNTIF(A:A,A1113) -> 1
A1112: 900012520 | B1112: ALVA OLIVA | C1112: ALEXANDRA | D1112: 15 | E1112: 1 | F1112: 3 | G1112: =IF(SUM(D1114:F1114)<18,"Insuff.",SUM(D1114:F1114)) -> 19 | I1112: =COUNTIF(A:A,A1114) -> 1
A1113: 900016367 | B1113: ANGJELI | C1113: SALVI | D1113: 19 | E1113: 9 | F1113: 3 | G1113: =IF(SUM(D1115:F1115)<18,"Insuff.",SUM(D1115:F1115)) -> 31 | I1113: =COUNTIF(A:A,A1115) -> 1
A1114: 160202 | B1114: ANTONIOLI | C1114: FABRIZIO | D1114: 21 | E1114: 7 | F1114: 0 | G1114: =IF(SUM(D1116:F1116)<18,"Insuff.",SUM(D1116:F1116)) -> 28 | I1114: =COUNTIF(A:A,A1116) -> 3
A1115: 140884 | B1115: ARDONDI | C1115: ROBERTO | D1115: 7 | E1115: 2 | F1115: 3 | G1115: =IF(SUM(D1117:F1117)<18,"Insuff.",SUM(D1117:F1117)) -> Insuff. | I1115: =COUNTIF(A:A,A1117) -> 3
A1116: 168217 | B1116: ASAADI | C1116: RACHID | D1116: 16 | E1116: 9 | F1116: 3 | G1116: =IF(SUM(D1118:F1118)<18,"Insuff.",SUM(D1118:F1118)) -> 28 | I1116: =COUNTIF(A:A,A1118) -> 1
A1117: 183082 | B1117: ASCANI | C1117: LORENZO | D1117: 15 | E1117: 3 | F1117: 3 | G1117: =IF(SUM(D1119:F1119)<18,"Insuff.",SUM(D1119:F1119)) -> 21 | I1117: =COUNTIF(A:A,A1119) -> 1
A1118: 242516 | B1118: BELARDINELLI | C1118: ENRICO | D1118: 10 | E1118: 9 | F1118: 3 | G1118: =IF(SUM(D1120:F1120)<18,"Insuff.",SUM(D1120:F1120)) -> 22 | I1118: =COUNTIF(A:A,A1120) -> 1
A1119: 183155 | B1119: BERNARDINI | C1119: LUCA | D1119: 21 | E1119: 1 | F1119: 3 | G1119: =IF(SUM(D1121:F1121)<18,"Insuff.",SUM(D1121:F1121)) -> 25 | I1119: =COUNTIF(A:A,A1121) -> 1
A1120: 184930 | B1120: BERTOZZI | C1120: SIMONA | D1120: 20 | E1120: 8 | F1120: 3 | G1120: =IF(SUM(D1122:F1122)<18,"Insuff.",SUM(D1122:F1122)) -> 31 | I1120: =COUNTIF(A:A,A1122) -> 1
A1121: 161536 | B1121: BEZZI | C1121: FRANCESCO | D1121: 8 | E1121: 9 | F1121: 3 | G1121: =IF(SUM(D1123:F1123)<18,"Insuff.",SUM(D1123:F1123)) -> 20 | I1121: =COUNTIF(A:A,A1123) -> 4
A1122: 180851 | B1122: BONETTI | C1122: STEFANO | D1122: 14 | E1122: 1 | F1122: 3 | G1122: =IF(SUM(D1124:F1124)<18,"Insuff.",SUM(D1124:F1124)) -> 18 | I1122: =COUNTIF(A:A,A1124) -> 2
A1123: 180215 | B1123: BONI | C1123: GIULIO | D1123: 15 | E1123: 8 | F1123: 3 | G1123: =IF(SUM(D1125:F1125)<18,"Insuff.",SUM(D1125:F1125)) -> 26 | I1123: =COUNTIF(A:A,A1125) -> 1
A1124: 122835 | B1124: BORTONE | C1124: ANDREA | D1124: 2 | E1124: 1 | F1124: 0 | G1124: =IF(SUM(D1126:F1126)<18,"Insuff.",SUM(D1126:F1126)) -> Insuff. | H1124: (*) | I1124: =COUNTIF(A:A,A1126) -> 5
A1125: 122811 | B1125: BRESCIA | C1125: FERNANDO | D1125: 17 | E1125: 9 | F1125: 3 | G1125: =IF(SUM(D1127:F1127)<18,"Insuff.",SUM(D1127:F1127)) -> 29 | I1125: =COUNTIF(A:A,A1127) -> 1
A1126: 181844 | B1126: BRUNI | C1126: MATTEO | D1126: 21 | E1126: 5 | F1126: 3 | G1126: =IF(SUM(D1128:F1128)<18,"Insuff.",SUM(D1128:F1128)) -> 29 | I1126: =COUNTIF(A:A,A1128) -> 1
A1127: 181394 | B1127: CACCIARI | C1127: ALESSANDRO | D1127: 20 | E1127: 9 | F1127: 3 | G1127: =IF(SUM(D1129:F1129)<18,"Insuff.",SUM(D1129:F1129)) -> 32 | I1127: =COUNTIF(A:A,A1129) -> 1
A1128: 183651 | B1128: CALORE | C1128: FRANCESCO | D1128: 21 | E1128: 8 | F1128: 3 | G1128: =IF(SUM(D1130:F1130)<18,"Insuff.",SUM(D1130:F1130)) -> 32 | I1128: =COUNTIF(A:A,A1130) -> 1
A1129: 192671 | B1129: CANGINI | C1129: ALESSANDRO | D1129: 19 | E1129: 9 | F1129: 3 | G1129: =IF(SUM(D1131:F1131)<18,"Insuff.",SUM(D1131:F1131)) -> 31 | I1129: =COUNTIF(A:A,A1131) -> 1
A1130: 149308 | B1130: CAPUTO | C1130: FABIO | D1130: 7 | E1130: 3 | F1130: 3 | G1130: =IF(SUM(D1132:F1132)<18,"Insuff.",SUM(D1132:F1132)) -> Insuff. | I1130: =COUNTIF(A:A,A1132) -> 2
A1131: 179941 | B1131: CARDONE | C1131: GIUSEPPE | D1131: 8 | E1131: 7 | F1131: 3 | G1131: =IF(SUM(D1133:F1133)<18,"Insuff.",SUM(D1133:F1133)) -> 18 | I1131: =COUNTIF(A:A,A1133) -> 2
A1132: 180908 | B1132: CARISI | C1132: ROBERTO | D1132: 21 | E1132: 9 | F1132: 3 | G1132: =IF(SUM(D1134:F1134)<18,"Insuff.",SUM(D1134:F1134)) -> 33 | I1132: =COUNTIF(A:A,A1134) -> 1
A1133: 128045 | B1133: CAVALLARO | C1133: FRANCESCO | D1133: 16 | E1133: 3 | F1133: 0 | G1133: =IF(SUM(D1135:F1135)<18,"Insuff.",SUM(D1135:F1135)) -> 19 | I1133: =COUNTIF(A:A,A1135) -> 4
A1134: 182245 | B1134: CHIAPPINI | C1134: CHIARA | D1134: 17 | E1134: 7 | F1134: 3 | G1134: =IF(SUM(D1136:F1136)<18,"Insuff.",SUM(D1136:F1136)) -> 27 | I1134: =COUNTIF(A:A,A1136) -> 1
A1135: 192644 | B1135: CIAMBERLANO | C1135: FABRIZIO | D1135: 3 | E1135: 4 | F1135: 3 | G1135: =IF(SUM(D1137:F1137)<18,"Insuff.",SUM(D1137:F1137)) -> Insuff. | I1135: =COUNTIF(A:A,A1137) -> 4
A1136: 121748 | B1136: CIAVARELLA | C1136: PRIMIANO | D1136: 12 | E1136: 8 | F1136: 3 | G1136: =IF(SUM(D1138:F1138)<18,"Insuff.",SUM(D1138:F1138)) -> 23 | I1136: =COUNTIF(A:A,A1138) -> 1
A1137: 164846 | B1137: COCCI | C1137: GIACOMO | D1137: 6 | E1137: 1 | F1137: 3 | G1137: =IF(SUM(D1139:F1139)<18,"Insuff.",SUM(D1139:F1139)) -> Insuff. | I1137: =COUNTIF(A:A,A1139) -> 3
A1138: 900012128 | B1138: CORADDUZZA | C1138: EMMA | D1138: 14 | E1138: 3 | F1138: 3 | G1138: =IF(SUM(D1140:F1140)<18,"Insuff.",SUM(D1140:F1140)) -> 20 | I1138: =COUNTIF(A:A,A1140) -> 1
A1139: 178651 | B1139: CRISTIANI | C1139: ALESSANDRO | D1139: 7 | E1139: 4 | F1139: 3 | G1139: =IF(SUM(D1141:F1141)<18,"Insuff.",SUM(D1141:F1141)) -> Insuff. | I1139: =COUNTIF(A:A,A1141) -> 4
A1140: 183729 | B1140: D'ALESSANDRO | C1140: DAVIDE | D1140: 17 | E1140: 6 | F1140: 3 | G1140: =IF(SUM(D1142:F1142)<18,"Insuff.",SUM(D1142:F1142)) -> 26 | I1140: =COUNTIF(A:A,A1142) -> 1
A1141: 900021975 | B1141: D'ANTONA | C1141: LUCA | D1141: 20 | E1141: 8 | F1141: 3 | G1141: =IF(SUM(D1143:F1143)<18,"Insuff.",SUM(D1143:F1143)) -> 31 | I1141: =COUNTIF(A:A,A1143) -> 1
A1142: 159447 | B1142: D'AVERSA | C1142: DANILO | D1142: 14 | E1142: 1 | F1142: 3 | G1142: =IF(SUM(D1144:F1144)<18,"Insuff.",SUM(D1144:F1144)) -> 18 | I1142: =COUNTIF(A:A,A1144) -> 3
A1143: 900016682 | B1143: DE GIOVANNI | C1143: LORENZO | D1143: 15 | E1143: 7 | F1143: 3 | G1143: =IF(SUM(D1145:F1145)<18,"Insuff.",SUM(D1145:F1145)) -> 25 | I1143: =COUNTIF(A:A,A1145) -> 1
A1144: 183212 | B1144: DE LISI | C1144: FRANCESCO | D1144: 13 | E1144: 9 | F1144: 3 | G1144: =IF(SUM(D1146:F1146)<18,"Insuff.",SUM(D1146:F1146)) -> 25 | I1144: =COUNTIF(A:A,A1146) -> 1
A1145: 185044 | B1145: DEL GATTO | C1145: TOMMASO | D1145: 16 | E1145: 8 | F1145: 3 | G1145: =IF(SUM(D1147:F1147)<18,"Insuff.",SUM(D1147:F1147)) -> 27 | I1145: =COUNTIF(A:A,A1147) -> 1
A1146: 183628 | B1146: DI GIACOMO | C1146: MATTEO | D1146: 8 | E1146: 2 | F1146: 3 | G1146: =IF(SUM(D1148:F1148)<18,"Insuff.",SUM(D1148:F1148)) -> Insuff. | I1146: =COUNTIF(A:A,A1148) -> 2
A1147: 185587 | B1147: DI GIOVANNI | C1147: ALESSANDRO | D1147: 17 | E1147: 6 | F1147: 3 | G1147: =IF(SUM(D1149:F1149)<18,"Insuff.",SUM(D1149:F1149)) -> 26 | I1147: =COUNTIF(A:A,A1149) -> 1
A1148: 180457 | B1148: DI MICHELE | C1148: VALENTINA | D1148: 10 | E1148: 7 | F1148: 3 | G1148: =IF(SUM(D1150:F1150)<18,"Insuff.",SUM(D1150:F1150)) -> 20 | I1148: =COUNTIF(A:A,A1150) -> 1
A1149: 159636 | B1149: DI PIERRI | C1149: DARIO | D1149: 12 | E1149: 9 | F1149: 3 | G1149: =IF(SUM(D1151:F1151)<18,"Insuff.",SUM(D1151:F1151)) -> 24 | I1149: =COUNTIF(A:A,A1151) -> 1
A1150: 180561 | B1150: DI ZIO | C1150: ANGELO | D1150: 19 | E1150: 0 | F1150: 3 | G1150: =IF(SUM(D1152:F1152)<18,"Insuff.",SUM(D1152:F1152)) -> 22 | I1150: =COUNTIF(A:A,A1152) -> 1
A1151: 159622 | B1151: DONINI | C1151: LUCA | D1151: 20 | E1151: 1 | F1151: 3 | G1151: =IF(SUM(D1153:F1153)<18,"Insuff.",SUM(D1153:F1153)) -> 24 | I1151: =COUNTIF(A:A,A1153) -> 1
A1152: 184317 | B1152: DONINI | C1152: MAURIZIO | D1152: 12 | E1152: 9 | F1152: 3 | G1152: =IF(SUM(D1154:F1154)<18,"Insuff.",SUM(D1154:F1154)) -> 24 | I1152: =COUNTIF(A:A,A1154) -> 1
A1153: 163699 | B1153: FALCONE | C1153: FRANCESCO | D1153: 14 | E1153: 3 | F1153: 3 | G1153: =IF(SUM(D1155:F1155)<18,"Insuff.",SUM(D1155:F1155)) -> 20 | I1153: =COUNTIF(A:A,A1155) -> 3
A1154: 185573 | B1154: FANELLI | C1154: MARIO | D1154: 21 | E1154: 9 | F1154: 3 | G1154: =IF(SUM(D1156:F1156)<18,"Insuff.",SUM(D1156:F1156)) -> 33 | I1154: =COUNTIF(A:A,A1156) -> 1
A1155: 166694 | B1155: FARACI | C1155: FABIO | D1155: 12 | E1155: 1 | F1155: 0 | G1155: =IF(SUM(D1157:F1157)<18,"Insuff.",SUM(D1157:F1157)) -> Insuff. | I1155: =COUNTIF(A:A,A1157) -> 7
A1156: 178967 | B1156: FARINA | C1156: FEDERICO | D1156: 11 | E1156: 8 | F1156: 3 | G1156: =IF(SUM(D1158:F1158)<18,"Insuff.",SUM(D1158:F1158)) -> 22 | I1156: =COUNTIF(A:A,A1158) -> 1
A1157: 158368 | B1157: FAZZINI | C1157: FRANCESCO | D1157: 13 | E1157: 2 | F1157: 3 | G1157: =IF(SUM(D1159:F1159)<18,"Insuff.",SUM(D1159:F1159)) -> 18 | I1157: =COUNTIF(A:A,A1159) -> 1
A1158: 179887 | B1158: FILIPPI | C1158: MATTIA | D1158: 20 | E1158: 6 | F1158: 3 | G1158: =IF(SUM(D1160:F1160)<18,"Insuff.",SUM(D1160:F1160)) -> 29 | I1158: =COUNTIF(A:A,A1160) -> 1
A1159: 162122 | B1159: FIORE | C1159: VINCENZO | D1159: 16 | E1159: 9 | F1159: 0 | G1159: =IF(SUM(D1161:F1161)<18,"Insuff.",SUM(D1161:F1161)) -> 25 | I1159: =COUNTIF(A:A,A1161) -> 2
A1160: 189009 | B1160: GALANTI | C1160: ANGELO | D1160: 19 | E1160: 9 | F1160: 3 | G1160: =IF(SUM(D1162:F1162)<18,"Insuff.",SUM(D1162:F1162)) -> 31 | I1160: =COUNTIF(A:A,A1162) -> 1
A1161: 158218 | B1161: GASBARRO | C1161: DAVIDE | D1161: 11 | E1161: 2 | F1161: 0 | G1161: =IF(SUM(D1163:F1163)<18,"Insuff.",SUM(D1163:F1163)) -> Insuff. | I1161: =COUNTIF(A:A,A1163) -> 3
A1162: 191871 | B1162: GIACCHETTA | C1162: MARIANNA | D1162: 16 | E1162: 9 | F1162: 3 | G1162: =IF(SUM(D1164:F1164)<18,"Insuff.",SUM(D1164:F1164)) -> 28 | I1162: =COUNTIF(A:A,A1164) -> 1
A1163: 179897 | B1163: GIOVANNINI | C1163: GIACOMO | D1163: 12 | E1163: 9 | F1163: 3 | G1163: =IF(SUM(D1165:F1165)<18,"Insuff.",SUM(D1165:F1165)) -> 24 | I1163: =COUNTIF(A:A,A1165) -> 1
A1164: 179921 | B1164: GOLINELLI | C1164: STEFANO | D1164: 20 | E1164: 7 | F1164: 3 | G1164: =IF(SUM(D1166:F1166)<18,"Insuff.",SUM(D1166:F1166)) -> 30 | I1164: =COUNTIF(A:A,A1166) -> 1
A1165: 185272 | B1165: GRECO | C1165: FEDERICA | D1165: 13 | E1165: 8 | F1165: 3 | G1165: =IF(SUM(D1167:F1167)<18,"Insuff.",SUM(D1167:F1167)) -> 24 | I1165: =COUNTIF(A:A,A1167) -> 1
A1166: 190581 | B1166: GUALTIERI | C1166: CHIARA | D1166: 18 | E1166: 8 | F1166: 3 | G1166: =IF(SUM(D1168:F1168)<18,"Insuff.",SUM(D1168:F1168)) -> 29 | I1166: =COUNTIF(A:A,A1168) -> 1
A1167: 182170 | B1167: LAMA | C1167: LORENZO | D1167: 14 | E1167: 6 | F1167: 3 | G1167: =IF(SUM(D1169:F1169)<18,"Insuff.",SUM(D1169:F1169)) -> 23 | I1167: =COUNTIF(A:A,A1169) -> 1
A1168: 188294 | B1168: LAURIA | C1168: MANUELA | D1168: 16 | E1168: 9 | F1168: 3 | G1168: =IF(SUM(D1170:F1170)<18,"Insuff.",SUM(D1170:F1170)) -> 28 | I1168: =COUNTIF(A:A,A1170) -> 1
A1169: 178388 | B1169: LEPORE | C1169: VALENTINA | D1169: 20 | E1169: 8 | F1169: 3 | G1169: =IF(SUM(D1171:F1171)<18,"Insuff.",SUM(D1171:F1171)) -> 31 | I1169: =COUNTIF(A:A,A1171) -> 1
A1170: 186268 | B1170: LORETI | C1170: DANIELA | D1170: 20 | E1170: 9 | F1170: 3 | G1170: =IF(SUM(D1172:F1172)<18,"Insuff.",SUM(D1172:F1172)) -> 32 | I1170: =COUNTIF(A:A,A1172) -> 1
A1171: 138627 | B1171: MACCAFERRI | C1171: DAVIDE | D1171: 8 | E1171: 0 | F1171: 3 | G1171: =IF(SUM(D1173:F1173)<18,"Insuff.",SUM(D1173:F1173)) -> Insuff. | I1171: =COUNTIF(A:A,A1173) -> 3
A1172: 168278 | B1172: MACRI | C1172: PAOLO | D1172: 8 | E1172: 3 | F1172: 3 | G1172: =IF(SUM(D1174:F1174)<18,"Insuff.",SUM(D1174:F1174)) -> Insuff. | I1172: =COUNTIF(A:A,A1174) -> 5
A1173: 124220 | B1173: MANESE | C1173: STEFANO GUERINO | D1173: 6 | E1173: 2 | F1173: 3 | G1173: =IF(SUM(D1175:F1175)<18,"Insuff.",SUM(D1175:F1175)) -> Insuff. | I1173: =COUNTIF(A:A,A1175) -> 4
A1174: 192700 | B1174: MANGANARO | C1174: ANDREA | D1174: 19 | E1174: 9 | F1174: 3 | G1174: =IF(SUM(D1176:F1176)<18,"Insuff.",SUM(D1176:F1176)) -> 31 | I1174: =COUNTIF(A:A,A1176) -> 1
A1175: 187012 | B1175: MANZOLI | C1175: DAVIDE | D1175: 21 | E1175: 8 | F1175: 3 | G1175: =IF(SUM(D1177:F1177)<18,"Insuff.",SUM(D1177:F1177)) -> 32 | I1175: =COUNTIF(A:A,A1177) -> 1
A1176: 178565 | B1176: MARTINI | C1176: LUCA | D1176: 14 | E1176: 6 | F1176: 3 | G1176: =IF(SUM(D1178:F1178)<18,"Insuff.",SUM(D1178:F1178)) -> 23 | I1176: =COUNTIF(A:A,A1178) -> 1
A1177: 185941 | B1177: MASCARO | C1177: PAOLO | D1177: 14 | E1177: 1 | F1177: 3 | G1177: =IF(SUM(D1179:F1179)<18,"Insuff.",SUM(D1179:F1179)) -> 18 | I1177: =COUNTIF(A:A,A1179) -> 1
A1178: 185475 | B1178: MASCIOLI | C1178: SILVIO | D1178: 13 | E1178: 9 | F1178: 3 | G1178: =IF(SUM(D1180:F1180)<18,"Insuff.",SUM(D1180:F1180)) -> 25 | I1178: =COUNTIF(A:A,A1180) -> 1
A1179: 182984 | B1179: MATALONI | C1179: GIACOMO | D1179: 12 | E1179: 1 | F1179: 3 | G1179: =IF(SUM(D1181:F1181)<18,"Insuff.",SUM(D1181:F1181)) -> Insuff. | I1179: =COUNTIF(A:A,A1181) -> 2
A1180: 157115 | B1180: MOLITERNI | C1180: ANDREA | D1180: 13 | E1180: 0 | F1180: 3 | G1180: =IF(SUM(D1182:F1182)<18,"Insuff.",SUM(D1182:F1182)) -> Insuff. | I1180: =COUNTIF(A:A,A1182) -> 2
A1181: 182976 | B1181: MONTICELLI | C1181: DAVIDE | D1181: 19 | E1181: 6 | F1181: 3 | G1181: =IF(SUM(D1183:F1183)<18,"Insuff.",SUM(D1183:F1183)) -> 28 | I1181: =COUNTIF(A:A,A1183) -> 1
A1182: 180372 | B1182: MORARA | C1182: ALBERTO | D1182: 21 | E1182: 9 | F1182: 3 | G1182: =IF(SUM(D1184:F1184)<18,"Insuff.",SUM(D1184:F1184)) -> 33 | I1182: =COUNTIF(A:A,A1184) -> 1
A1183: 229674 | B1183: NEGRISOLI | C1183: ALBERTO | D1183: 10 | E1183: 0 | F1183: 0 | G1183: =IF(SUM(D1185:F1185)<18,"Insuff.",SUM(D1185:F1185)) -> Insuff. | H1183: (*) | I1183: =COUNTIF(A:A,A1185) -> 4
A1184: 2148061650 | B1184: PALLOTTI | C1184: GIACOMO | D1184: 20 | E1184: 1 | F1184: 3 | G1184: =IF(SUM(D1186:F1186)<18,"Insuff.",SUM(D1186:F1186)) -> 24 | I1184: =COUNTIF(A:A,A1186) -> 2
A1185: 158022 | B1185: PALMISANO | C1185: GIOVANNI | D1185: 11 | E1185: 7 | F1185: 0 | G1185: =IF(SUM(D1187:F1187)<18,"Insuff.",SUM(D1187:F1187)) -> 18 | I1185: =COUNTIF(A:A,A1187) -> 6
A1186: 181106 | B1186: PATTUZZI | C1186: DANIELE | D1186: 19 | E1186: 8 | F1186: 3 | G1186: =IF(SUM(D1188:F1188)<18,"Insuff.",SUM(D1188:F1188)) -> 30 | I1186: =COUNTIF(A:A,A1188) -> 1
A1187: 179352 | B1187: PERINI | C1187: GIORGIO | D1187: 12 | E1187: 9 | F1187: 3 | G1187: =IF(SUM(D1189:F1189)<18,"Insuff.",SUM(D1189:F1189)) -> 24 | I1187: =COUNTIF(A:A,A1189) -> 1
A1188: 180404 | B1188: PERNAFINI | C1188: ALESSANDRO | D1188: 21 | E1188: 9 | F1188: 3 | G1188: =IF(SUM(D1190:F1190)<18,"Insuff.",SUM(D1190:F1190)) -> 33 | I1188: =COUNTIF(A:A,A1190) -> 1
A1189: 191384 | B1189: PICHINELLI | C1189: MATTEO | D1189: 15 | E1189: 8 | F1189: 3 | G1189: =IF(SUM(D1191:F1191)<18,"Insuff.",SUM(D1191:F1191)) -> 26 | I1189: =COUNTIF(A:A,A1191) -> 1
A1190: 900012077 | B1190: PIRO | C1190: RAFFAELE | D1190: 9 | E1190: 6 | F1190: 3 | G1190: =IF(SUM(D1192:F1192)<18,"Insuff.",SUM(D1192:F1192)) -> 18 | I1190: =COUNTIF(A:A,A1192) -> 1
A1191: 178246 | B1191: PISCINO | C1191: PAOLO | D1191: 8 | E1191: 9 | F1191: 3 | G1191: =IF(SUM(D1193:F1193)<18,"Insuff.",SUM(D1193:F1193)) -> 20 | I1191: =COUNTIF(A:A,A1193) -> 1
A1192: 182058 | B1192: PIVA | C1192: MARCO | D1192: 13 | E1192: 3 | F1192: 3 | G1192: =IF(SUM(D1194:F1194)<18,"Insuff.",SUM(D1194:F1194)) -> 19 | I1192: =COUNTIF(A:A,A1194) -> 1
A1193: 142717 | B1193: PIZZUTI | C1193: GIANROCCO | D1193: 13 | E1193: 0 | F1193: 0 | G1193: =IF(SUM(D1195:F1195)<18,"Insuff.",SUM(D1195:F1195)) -> Insuff. | I1193: =COUNTIF(A:A,A1195) -> 6
A1194: 159743 | B1194: POLIDORO | C1194: GIORDANO | D1194: 13 | E1194: 8 | F1194: 0 | G1194: =IF(SUM(D1196:F1196)<18,"Insuff.",SUM(D1196:F1196)) -> 21 | I1194: =COUNTIF(A:A,A1196) -> 3
A1195: 178931 | B1195: POMPEO | C1195: DAVIDE | D1195: 15 | E1195: 5 | F1195: 3 | G1195: =IF(SUM(D1197:F1197)<18,"Insuff.",SUM(D1197:F1197)) -> 23 | I1195: =COUNTIF(A:A,A1197) -> 1
A1196: 180928 | B1196: PRATI | C1196: ALEX | D1196: 19 | E1196: 8 | F1196: 3 | G1196: =IF(SUM(D1198:F1198)<18,"Insuff.",SUM(D1198:F1198)) -> 30 | I1196: =COUNTIF(A:A,A1198) -> 1
A1197: 192627 | B1197: RAIMONDO | C1197: ALESSANDRO | D1197: 13 | E1197: 2 | F1197: 3 | G1197: =IF(SUM(D1199:F1199)<18,"Insuff.",SUM(D1199:F1199)) -> 18 | I1197: =COUNTIF(A:A,A1199) -> 1
A1198: 184277 | B1198: RAPINO | C1198: DAVIDE | D1198: 6 | E1198: 1 | F1198: 3 | G1198: =IF(SUM(D1200:F1200)<18,"Insuff.",SUM(D1200:F1200)) -> Insuff. | I1198: =COUNTIF(A:A,A1200) -> 3
A1199: 188884 | B1199: ROMAGNOLI | C1199: CAMILLA | D1199: 12 | E1199: 1 | F1199: 3 | G1199: =IF(SUM(D1201:F1201)<18,"Insuff.",SUM(D1201:F1201)) -> Insuff. | I1199: =COUNTIF(A:A,A1201) -> 1
A1200: 138633 | B1200: ROSSI | C1200: ANTONELLO | D1200: 11 | E1200: 2 | F1200: 0 | G1200: =IF(SUM(D1202:F1202)<18,"Insuff.",SUM(D1202:F1202)) -> Insuff. | I1200: =COUNTIF(A:A,A1202) -> 4
A1201: 179378 | B1201: ROVINETTI | C1201: ANDREA | D1201: 11 | E1201: 9 | F1201: 3 | G1201: =IF(SUM(D1203:F1203)<18,"Insuff.",SUM(D1203:F1203)) -> 23 | I1201: =COUNTIF(A:A,A1203) -> 1
A1202: 184040 | B1202: SACCO | C1202: ALEX | D1202: 11 | E1202: 0 | F1202: 3 | G1202: =IF(SUM(D1204:F1204)<18,"Insuff.",SUM(D1204:F1204)) -> Insuff. | I1202: =COUNTIF(A:A,A1204) -> 4
A1203: 181076 | B1203: SALBAROLI | C1203: FRANCESCO | D1203: 16 | E1203: 8 | F1203: 3 | G1203: =IF(SUM(D1205:F1205)<18,"Insuff.",SUM(D1205:F1205)) -> 27 | I1203: =COUNTIF(A:A,A1205) -> 1
A1204: 900018170 | B1204: SALVARO | C1204: MATTIA | D1204: 20 | E1204: 9 | F1204: 3 | G1204: =IF(SUM(D1206:F1206)<18,"Insuff.",SUM(D1206:F1206)) -> 32 | I1204: =COUNTIF(A:A,A1206) -> 1
A1205: 178737 | B1205: SAVIOLI | C1205: ALESSANDRO | D1205: 21 | E1205: 9 | F1205: 3 | G1205: =IF(SUM(D1207:F1207)<18,"Insuff.",SUM(D1207:F1207)) -> 33 | I1205: =COUNTIF(A:A,A1207) -> 1
A1206: 178811 | B1206: SCHIROSI | C1206: ANTONIO | D1206: 19 | E1206: 1 | F1206: 3 | G1206: =IF(SUM(D1208:F1208)<18,"Insuff.",SUM(D1208:F1208)) -> 23 | I1206: =COUNTIF(A:A,A1208) -> 1
A1207: 181423 | B1207: TARINI | C1207: MARCO | D1207: 16 | E1207: 9 | F1207: 3 | G1207: =IF(SUM(D1209:F1209)<18,"Insuff.",SUM(D1209:F1209)) -> 28 | I1207: =COUNTIF(A:A,A1209) -> 1
A1208: 158591 | B1208: TOMEI | C1208: STEFANO | D1208: 8 | E1208: 4 | F1208: 3 | G1208: =IF(SUM(D1210:F1210)<18,"Insuff.",SUM(D1210:F1210)) -> Insuff. | I1208: =COUNTIF(A:A,A1210) -> 2
A1209: 187325 | B1209: TONELLI | C1209: ANDREA | D1209: 11 | E1209: 6 | F1209: 3 | G1209: =IF(SUM(D1211:F1211)<18,"Insuff.",SUM(D1211:F1211)) -> 20 | I1209: =COUNTIF(A:A,A1211) -> 1
A1210: 185896 | B1210: TONIOLO | C1210: GIORGIO | D1210: 15 | E1210: 6 | F1210: 3 | G1210: =IF(SUM(D1212:F1212)<18,"Insuff.",SUM(D1212:F1212)) -> 24 | I1210: =COUNTIF(A:A,A1212) -> 1
A1211: 158267 | B1211: VARRIANO | C1211: PAOLA | D1211: 13 | E1211: 0 | F1211: 0 | G1211: =IF(SUM(D1213:F1213)<18,"Insuff.",SUM(D1213:F1213)) -> Insuff. | I1211: =COUNTIF(A:A,A1213) -> 5
A1212: 159801 | B1212: VETRI | C1212: SIMONE | D1212: 19 | E1212: 3 | F1212: 3 | G1212: =IF(SUM(D1214:F1214)<18,"Insuff.",SUM(D1214:F1214)) -> 25 | I1212: =COUNTIF(A:A,A1214) -> 1
A1213: 180015 | B1213: VIMERCATI | C1213: UMBERTO | D1213: 21 | E1213: 1 | F1213: 3 | G1213: =IF(SUM(D1215:F1215)<18,"Insuff.",SUM(D1215:F1215)) -> 25 | I1213: =COUNTIF(A:A,A1215) -> 1
A1214: 233659 | B1214: ZACCHE | C1214: ALESSANDRO | D1214: 8 | E1214: 0 | F1214: 0 | G1214: =IF(SUM(D1216:F1216)<18,"Insuff.",SUM(D1216:F1216)) -> Insuff. | I1214: =COUNTIF(A:A,A1216) -> 5
A1215: 184689 | B1215: ZAPPACOSTA | C1215: ALEX | D1215: 20 | E1215: 8 | F1215: 3 | G1215: =IF(SUM(D1217:F1217)<18,"Insuff.",SUM(D1217:F1217)) -> 31 | I1215: =COUNTIF(A:A,A1217) -> 1
A1216: (*) L'esito del prossimo appello verra' verbalizzato in ogni caso. | I1216: =COUNTIF(A:A,A1218) -> 2
I1217: =COUNTIF(A:A,A1219) -> 0
I1218: =COUNTIF(A:A,A1220) -> 0
I1219: =COUNTIF(A:A,A1221) -> 0
A1220: Fondamenti di Ricerca Operativa L-A | I1220: =COUNTIF(A:A,A1222) -> 22
A1221: Prova Scritta del 10 Gennaio 2006 | I1221: =COUNTIF(A:A,A1223) -> 1
I1222: =COUNTIF(A:A,A1224) -> 0
A1223: Validita' per chi registra direttamente il voto: fino a venerdi' 20 Gennaio 2006 | I1223: =COUNTIF(A:A,A1225) -> 1
A1224: (non procrastinabile; non si risponde a mail o telefonate in merito). | I1224: =COUNTIF(A:A,A1226) -> 9
I1225: =COUNTIF(A:A,A1227) -> 0
A1226: Validita' per chi sostiene l'orale: fino all'appello di Giugno 2006. | I1226: =COUNTIF(A:A,A1228) -> 1
A1227: Visione degli elaborati e orali: venerdi' 20 Gennaio 2006, ore 14.30, Aula 61 | I1227: =COUNTIF(A:A,A1229) -> 1
A1228: Prossimi appelli: Aprile 2006, Giugno 2006, Luglio 2006 | I1228: =COUNTIF(A:A,A1230) -> 1
I1229: =COUNTIF(A:A,A1231) -> 0
A1230: matricola | B1230: Cognome | C1230: Nome | D1230: 1 | E1230: 2 | F1230: bonus | G1230: voto | I1230: =COUNTIF(A:A,A1232) -> 24
A1231: 900018756 | B1231: ACETO | C1231: GIACOMO | D1231: 20 | E1231: 9 | F1231: 3 | G1231: =IF(SUM(D1233:F1233)<18,"Insuff.",SUM(D1233:F1233)) -> 32 | I1231: =COUNTIF(A:A,A1233) -> 1
A1232: 169499 | B1232: ALDROVANDI | C1232: DAVIDE | D1232: 7 | E1232: 9 | F1232: 3 | G1232: =IF(SUM(D1234:F1234)<18,"Insuff.",SUM(D1234:F1234)) -> 19 | I1232: =COUNTIF(A:A,A1234) -> 1
A1233: 140884 | B1233: ARDONDI | C1233: ROBERTO | D1233: 6 | E1233: 2 | F1233: 0 | G1233: =IF(SUM(D1235:F1235)<18,"Insuff.",SUM(D1235:F1235)) -> Insuff. | I1233: =COUNTIF(A:A,A1235) -> 3
A1234: 190497 | B1234: BAGNINI | C1234: DIANA | D1234: 8 | E1234: 6 | F1234: 3 | G1234: 17 | H1234: * | I1234: =COUNTIF(A:A,A1236) -> 1
A1235: 180540 | B1235: BELLOMARIA | C1235: JONATHAN | D1235: 10 | E1235: 8 | F1235: 3 | G1235: =IF(SUM(D1237:F1237)<18,"Insuff.",SUM(D1237:F1237)) -> 21 | I1235: =COUNTIF(A:A,A1237) -> 1
A1236: 161536 | B1236: BEZZI | C1236: FRANCESCO | D1236: 7 | E1236: 8 | F1236: 0 | G1236: =IF(SUM(D1238:F1238)<18,"Insuff.",SUM(D1238:F1238)) -> Insuff. | I1236: =COUNTIF(A:A,A1238) -> 4
A1237: 180445 | B1237: BONDI | C1237: ANDREA | D1237: 17 | E1237: 6 | F1237: 3 | G1237: =IF(SUM(D1239:F1239)<18,"Insuff.",SUM(D1239:F1239)) -> 26 | I1237: =COUNTIF(A:A,A1239) -> 1
A1238: 180851 | B1238: BONETTI | C1238: STEFANO | D1238: 18 | E1238: 9 | F1238: 0 | G1238: =IF(SUM(D1240:F1240)<18,"Insuff.",SUM(D1240:F1240)) -> 27 | I1238: =COUNTIF(A:A,A1240) -> 2
A1239: 184823 | B1239: BOSCHETTI | C1239: NICOLA | D1239: 15 | E1239: 9 | F1239: 3 | G1239: =IF(SUM(D1241:F1241)<18,"Insuff.",SUM(D1241:F1241)) -> 27 | I1239: =COUNTIF(A:A,A1241) -> 1
A1240: 160989 | B1240: CAPUTO | C1240: SIMONE | D1240: 10 | E1240: 0 | F1240: 3 | G1240: =IF(SUM(D1242:F1242)<18,"Insuff.",SUM(D1242:F1242)) -> Insuff. | I1240: =COUNTIF(A:A,A1242) -> 2
A1241: 179941 | B1241: CARDONE | C1241: GIUSEPPE | D1241: 15 | E1241: 10 | F1241: 0 | G1241: =IF(SUM(D1243:F1243)<18,"Insuff.",SUM(D1243:F1243)) -> 25 | I1241: =COUNTIF(A:A,A1243) -> 2
A1242: 157315 | B1242: CASCINI | C1242: ALESSANDRO | D1242: 7 | E1242: 3 | F1242: 3 | G1242: =IF(SUM(D1244:F1244)<18,"Insuff.",SUM(D1244:F1244)) -> Insuff. | I1242: =COUNTIF(A:A,A1244) -> 2
A1243: 179852 | B1243: CHIEFFO | C1243: NICOLO' | D1243: 9 | E1243: 10 | F1243: 3 | G1243: =IF(SUM(D1245:F1245)<18,"Insuff.",SUM(D1245:F1245)) -> 22 | I1243: =COUNTIF(A:A,A1245) -> 1
A1244: 192644 | B1244: CIAMBERLANO | C1244: FABRIZIO | D1244: 8 | E1244: 0 | F1244: 0 | G1244: =IF(SUM(D1246:F1246)<18,"Insuff.",SUM(D1246:F1246)) -> Insuff. | I1244: =COUNTIF(A:A,A1246) -> 4
A1245: 159962 | B1245: CIARROCCHI | C1245: PAOLO | D1245: 10 | E1245: 1 | F1245: 3 | G1245: =IF(SUM(D1247:F1247)<18,"Insuff.",SUM(D1247:F1247)) -> Insuff. | I1245: =COUNTIF(A:A,A1247) -> 2
A1246: 186224 | B1246: CILLI | C1246: SIMONE | D1246: 14 | E1246: 10 | F1246: 3 | G1246: =IF(SUM(D1248:F1248)<18,"Insuff.",SUM(D1248:F1248)) -> 27 | I1246: =COUNTIF(A:A,A1248) -> 1
A1247: 164846 | B1247: COCCI | C1247: GIACOMO | D1247: 7 | E1247: 10 | F1247: 0 | G1247: 17 | H1247: * | I1247: =COUNTIF(A:A,A1249) -> 3
A1248: 183256 | B1248: COLLINA | C1248: MATTEO | D1248: 14 | E1248: 9 | F1248: 3 | G1248: =IF(SUM(D1250:F1250)<18,"Insuff.",SUM(D1250:F1250)) -> 26 | I1248: =COUNTIF(A:A,A1250) -> 1
A1249: 183787 | B1249: COLUCCIO | C1249: ROBERTO | D1249: 14 | E1249: 4 | F1249: 3 | G1249: =IF(SUM(D1251:F1251)<18,"Insuff.",SUM(D1251:F1251)) -> 21 | I1249: =COUNTIF(A:A,A1251) -> 1
A1250: 178651 | B1250: CRISTIANI | C1250: ALESSANDRO | D1250: 9 | E1250: 3 | F1250: 0 | G1250: =IF(SUM(D1252:F1252)<18,"Insuff.",SUM(D1252:F1252)) -> Insuff. | I1250: =COUNTIF(A:A,A1252) -> 4
A1251: 160436 | B1251: D'AGOSTINO | C1251: STEFANO | D1251: 8 | E1251: 7 | F1251: 0 | G1251: =IF(SUM(D1253:F1253)<18,"Insuff.",SUM(D1253:F1253)) -> Insuff. | I1251: =COUNTIF(A:A,A1253) -> 4
A1252: 179774 | B1252: DAMIAN | C1252: MICHELE | D1252: 19 | E1252: 3 | F1252: 3 | G1252: =IF(SUM(D1254:F1254)<18,"Insuff.",SUM(D1254:F1254)) -> 25 | I1252: =COUNTIF(A:A,A1254) -> 1
A1253: 159335 | B1253: D'APOTE | C1253: LEONARDO | D1253: 15 | E1253: 4 | F1253: 0 | G1253: =IF(SUM(D1255:F1255)<18,"Insuff.",SUM(D1255:F1255)) -> 19 | I1253: =COUNTIF(A:A,A1255) -> 4
A1254: 184515 | B1254: DI BACCO | C1254: MARIO | D1254: 15 | E1254: 8 | F1254: 3 | G1254: =IF(SUM(D1256:F1256)<18,"Insuff.",SUM(D1256:F1256)) -> 26 | I1254: =COUNTIF(A:A,A1256) -> 1
A1255: 183628 | B1255: DI GIACOMO | C1255: MATTEO | D1255: 15 | E1255: 7 | F1255: 0 | G1255: =IF(SUM(D1257:F1257)<18,"Insuff.",SUM(D1257:F1257)) -> 22 | I1255: =COUNTIF(A:A,A1257) -> 2
A1256: 164447 | B1256: DINAPOLI | C1256: ANTONIO | D1256: 8 | E1256: 8 | F1256: 3 | G1256: =IF(SUM(D1258:F1258)<18,"Insuff.",SUM(D1258:F1258)) -> 19 | I1256: =COUNTIF(A:A,A1258) -> 1
A1257: 163699 | B1257: FALCONE | C1257: FRANCESCO | D1257: 14 | E1257: 1 | F1257: 0 | G1257: =IF(SUM(D1259:F1259)<18,"Insuff.",SUM(D1259:F1259)) -> Insuff. | I1257: =COUNTIF(A:A,A1259) -> 3
A1258: 168981 | B1258: FALGHERI | C1258: GIUSEPPE | D1258: 15 | E1258: 0 | F1258: 0 | G1258: =IF(SUM(D1260:F1260)<18,"Insuff.",SUM(D1260:F1260)) -> Insuff. | I1258: =COUNTIF(A:A,A1260) -> 3
A1259: 166694 | B1259: FARACI | C1259: FABIO | D1259: 6 | E1259: 3 | F1259: 0 | G1259: =IF(SUM(D1261:F1261)<18,"Insuff.",SUM(D1261:F1261)) -> Insuff. | I1259: =COUNTIF(A:A,A1261) -> 7
A1260: 179314 | B1260: FARISELLI | C1260: NICOLO' | D1260: 17 | E1260: 4 | F1260: 3 | G1260: =IF(SUM(D1262:F1262)<18,"Insuff.",SUM(D1262:F1262)) -> 24 | I1260: =COUNTIF(A:A,A1262) -> 1
A1261: 158218 | B1261: GASBARRO | C1261: DAVIDE | D1261: 13 | E1261: 7 | F1261: 0 | G1261: =IF(SUM(D1263:F1263)<18,"Insuff.",SUM(D1263:F1263)) -> 20 | I1261: =COUNTIF(A:A,A1263) -> 3
A1262: 179487 | B1262: GIONFALO | C1262: FRANCESCO | D1262: 10 | E1262: 0 | F1262: 3 | G1262: =IF(SUM(D1264:F1264)<18,"Insuff.",SUM(D1264:F1264)) -> Insuff. | I1262: =COUNTIF(A:A,A1264) -> 3
A1263: 189531 | B1263: GIULIANI | C1263: PIERPAOLO | D1263: 20 | E1263: 10 | F1263: 3 | G1263: =IF(SUM(D1265:F1265)<18,"Insuff.",SUM(D1265:F1265)) -> 33 | I1263: =COUNTIF(A:A,A1265) -> 1
A1264: 161018 | B1264: GUERRINI | C1264: ALESSANDRO | D1264: 19 | E1264: 7 | F1264: 3 | G1264: =IF(SUM(D1266:F1266)<18,"Insuff.",SUM(D1266:F1266)) -> 29 | I1264: =COUNTIF(A:A,A1266) -> 1
A1265: 139629 | B1265: IMPOSIMATO | C1265: ARTURO | D1265: 7 | E1265: 0 | F1265: 0 | G1265: =IF(SUM(D1267:F1267)<18,"Insuff.",SUM(D1267:F1267)) -> Insuff. | I1265: =COUNTIF(A:A,A1267) -> 8
A1266: 181832 | B1266: KOUSSIS | C1266: JONATHAN | D1266: 8 | E1266: 6 | F1266: 3 | G1266: 17 | H1266: * | I1266: =COUNTIF(A:A,A1268) -> 3
A1267: 138627 | B1267: MACCAFERRI | C1267: DAVIDE | D1267: 3 | E1267: 1 | F1267: 0 | G1267: =IF(SUM(D1269:F1269)<18,"Insuff.",SUM(D1269:F1269)) -> Insuff. | I1267: =COUNTIF(A:A,A1269) -> 3
A1268: 168278 | B1268: MACRI | C1268: PAOLO | D1268: 4 | E1268: 10 | F1268: 0 | G1268: =IF(SUM(D1270:F1270)<18,"Insuff.",SUM(D1270:F1270)) -> Insuff. | I1268: =COUNTIF(A:A,A1270) -> 5
A1269: 107899 | B1269: MALVASIO | C1269: ELISA | D1269: 10 | E1269: 1 | F1269: 0 | G1269: =IF(SUM(D1271:F1271)<18,"Insuff.",SUM(D1271:F1271)) -> Insuff. | I1269: =COUNTIF(A:A,A1271) -> 8
A1270: 900016607 | B1270: MANCINI | C1270: STEFANO | D1270: 16 | E1270: 4 | F1270: 3 | G1270: =IF(SUM(D1272:F1272)<18,"Insuff.",SUM(D1272:F1272)) -> 23 | I1270: =COUNTIF(A:A,A1272) -> 1
A1271: 182984 | B1271: MATALONI | C1271: GIACOMO | D1271: 15 | E1271: 6 | F1271: 0 | G1271: =IF(SUM(D1273:F1273)<18,"Insuff.",SUM(D1273:F1273)) -> 21 | I1271: =COUNTIF(A:A,A1273) -> 2
A1272: 178842 | B1272: MATTIOLI | C1272: SIMONE | D1272: 20 | E1272: 4 | F1272: 3 | G1272: =IF(SUM(D1274:F1274)<18,"Insuff.",SUM(D1274:F1274)) -> 27 | I1272: =COUNTIF(A:A,A1274) -> 1
A1273: 110691 | B1273: MINGHETTI | C1273: ELISA | D1273: 5 | E1273: 0 | F1273: 0 | G1273: =IF(SUM(D1275:F1275)<18,"Insuff.",SUM(D1275:F1275)) -> Insuff. | I1273: =COUNTIF(A:A,A1275) -> 5
A1274: 180716 | B1274: MODENESE | C1274: MARCO | D1274: 15 | E1274: 3 | F1274: 3 | G1274: =IF(SUM(D1276:F1276)<18,"Insuff.",SUM(D1276:F1276)) -> 21 | I1274: =COUNTIF(A:A,A1276) -> 1
A1275: 157115 | B1275: MOLITERNI | C1275: ANDREA | D1275: 19 | E1275: 10 | F1275: 0 | G1275: =IF(SUM(D1277:F1277)<18,"Insuff.",SUM(D1277:F1277)) -> 29 | I1275: =COUNTIF(A:A,A1277) -> 2
A1276: 178435 | B1276: MONTANARI | C1276: MARCO | D1276: 15 | E1276: 7 | F1276: 3 | G1276: =IF(SUM(D1278:F1278)<18,"Insuff.",SUM(D1278:F1278)) -> 25 | I1276: =COUNTIF(A:A,A1278) -> 1
A1277: 158022 | B1277: PALMISANO | C1277: GIOVANNI | D1277: 20 | E1277: 7 | F1277: 0 | G1277: =IF(SUM(D1279:F1279)<18,"Insuff.",SUM(D1279:F1279)) -> 27 | I1277: =COUNTIF(A:A,A1279) -> 6
A1278: 179333 | B1278: PETTAZZONI | C1278: BARBARA | D1278: 20 | E1278: 10 | F1278: 3 | G1278: =IF(SUM(D1280:F1280)<18,"Insuff.",SUM(D1280:F1280)) -> 33 | I1278: =COUNTIF(A:A,A1280) -> 1
A1279: 180982 | B1279: PIETRELLI | C1279: LUCA | D1279: 11 | E1279: 0 | F1279: 3 | G1279: =IF(SUM(D1281:F1281)<18,"Insuff.",SUM(D1281:F1281)) -> Insuff. | I1279: =COUNTIF(A:A,A1281) -> 2
A1280: 182697 | B1280: POLIDORI | C1280: MASSIMO | D1280: 11 | E1280: 0 | F1280: 3 | G1280: =IF(SUM(D1282:F1282)<18,"Insuff.",SUM(D1282:F1282)) -> Insuff. | I1280: =COUNTIF(A:A,A1282) -> 2
A1281: 184277 | B1281: RAPINO | C1281: DAVIDE | D1281: 7 | E1281: 0 | F1281: 0 | G1281: =IF(SUM(D1283:F1283)<18,"Insuff.",SUM(D1283:F1283)) -> Insuff. | I1281: =COUNTIF(A:A,A1283) -> 3
A1282: 182012 | B1282: RIA | C1282: LUIGI | D1282: 15 | E1282: 1 | F1282: 3 | G1282: =IF(SUM(D1284:F1284)<18,"Insuff.",SUM(D1284:F1284)) -> 19 | I1282: =COUNTIF(A:A,A1284) -> 3
A1283: 900021037 | B1283: ROSSETTI | C1283: MATTEO | D1283: 19 | E1283: 5 | F1283: 3 | G1283: =IF(SUM(D1285:F1285)<18,"Insuff.",SUM(D1285:F1285)) -> 27 | I1283: =COUNTIF(A:A,A1285) -> 1
A1284: 138633 | B1284: ROSSI | C1284: ANTONELLO | D1284: 12 | E1284: 0 | F1284: 0 | G1284: =IF(SUM(D1286:F1286)<18,"Insuff.",SUM(D1286:F1286)) -> Insuff. | I1284: =COUNTIF(A:A,A1286) -> 4
A1285: 184040 | B1285: SACCO | C1285: ALEX | D1285: 12 | E1285: 0 | F1285: 0 | G1285: =IF(SUM(D1287:F1287)<18,"Insuff.",SUM(D1287:F1287)) -> Insuff. | I1285: =COUNTIF(A:A,A1287) -> 4
A1286: 183225 | B1286: SCALET | C1286: RICCARDO | D1286: 17 | E1286: 10 | F1286: 3 | G1286: =IF(SUM(D1288:F1288)<18,"Insuff.",SUM(D1288:F1288)) -> 30 | I1286: =COUNTIF(A:A,A1288) -> 1
A1287: 178426 | B1287: SOLA | C1287: ALESSANDRO | D1287: 9 | E1287: 10 | F1287: 3 | G1287: =IF(SUM(D1289:F1289)<18,"Insuff.",SUM(D1289:F1289)) -> 22 | I1287: =COUNTIF(A:A,A1289) -> 1
A1288: 188147 | B1288: SPANO | C1288: ELISABETTA | D1288: 20 | E1288: 10 | F1288: 3 | G1288: =IF(SUM(D1290:F1290)<18,"Insuff.",SUM(D1290:F1290)) -> 33 | I1288: =COUNTIF(A:A,A1290) -> 1
A1289: 158591 | B1289: TOMEI | C1289: STEFANO | D1289: 18 | E1289: 5 | F1289: 0 | G1289: =IF(SUM(D1291:F1291)<18,"Insuff.",SUM(D1291:F1291)) -> 23 | I1289: =COUNTIF(A:A,A1291) -> 2
A1290: 179306 | B1290: TONINI | C1290: ELISA | D1290: 20 | E1290: 6 | F1290: 3 | G1290: =IF(SUM(D1292:F1292)<18,"Insuff.",SUM(D1292:F1292)) -> 29 | I1290: =COUNTIF(A:A,A1292) -> 1
A1291: 162366 | B1291: VAGNARELLI | C1291: VALERIO | D1291: 8 | E1291: 1 | F1291: 3 | G1291: =IF(SUM(D1293:F1293)<18,"Insuff.",SUM(D1293:F1293)) -> Insuff. | I1291: =COUNTIF(A:A,A1293) -> 3
A1292: 158267 | B1292: VARRIANO | C1292: PAOLA | D1292: 15 | E1292: 2 | F1292: 0 | G1292: 17 | H1292: * | I1292: =COUNTIF(A:A,A1294) -> 5
A1293: 181488 | B1293: ZANCANARO | C1293: MARCO | D1293: 7 | E1293: 5 | F1293: 3 | G1293: =IF(SUM(D1295:F1295)<18,"Insuff.",SUM(D1295:F1295)) -> Insuff. | I1293: =COUNTIF(A:A,A1295) -> 2
A1294: * Puo' registrare 18. | I1294: =COUNTIF(A:A,A1296) -> 2
I1295: =COUNTIF(A:A,A1297) -> 0
I1296: =COUNTIF(A:A,A1298) -> 0
I1297: =COUNTIF(A:A,A1299) -> 0
I1298: =COUNTIF(A:A,A1300) -> 0
A1299: Fondamenti di Ricerca Operativa L-A | I1299: =COUNTIF(A:A,A1301) -> 22
A1300: Prova Scritta del 30 Marzo 2006 | I1300: =COUNTIF(A:A,A1302) -> 1
I1301: =COUNTIF(A:A,A1303) -> 0
A1302: Validita' per chi registra direttamente il voto: fino al 6 Aprile 2006, ore 16.00 | I1302: =COUNTIF(A:A,A1304) -> 1
A1303: (non procrastinabile; non si risponde a mail o telefonate in merito). | I1303: =COUNTIF(A:A,A1305) -> 9
I1304: =COUNTIF(A:A,A1306) -> 0
A1305: Validita' per chi sostiene l'orale: fino all'appello di Luglio 2006. | I1305: =COUNTIF(A:A,A1307) -> 1
A1306: Visione degli elaborati e orali: 6 Aprile 2006, ore 15.00, Aula 61 | I1306: =COUNTIF(A:A,A1308) -> 1
A1307: Prossimi appelli: Giugno 2006, Luglio 2006 | I1307: =COUNTIF(A:A,A1309) -> 1
I1308: =COUNTIF(A:A,A1310) -> 0
A1309: matricola | B1309: Cognome | C1309: Nome | D1309: 1 | E1309: 2 | F1309: bonus | G1309: voto | I1309: =COUNTIF(A:A,A1311) -> 24
A1310: 140884 | B1310: ARDONDI | C1310: ROBERTO | D1310: 15 | E1310: 10 | F1310: 0 | G1310: =IF(SUM(D1312:F1312)<18,"Insuff.",SUM(D1312:F1312)) -> 25 | I1310: =COUNTIF(A:A,A1312) -> 3
A1311: 158364 | B1311: BALDI | C1311: ERICK | D1311: 12 | E1311: 0 | F1311: 3 | G1311: =IF(SUM(D1313:F1313)<18,"Insuff.",SUM(D1313:F1313)) -> Insuff. | I1311: =COUNTIF(A:A,A1313) -> 4
A1312: 122282 | B1312: BETTI | C1312: ALESSANDRO | D1312: 10 | E1312: 2 | F1312: 0 | G1312: =IF(SUM(D1314:F1314)<18,"Insuff.",SUM(D1314:F1314)) -> Insuff. | I1312: =COUNTIF(A:A,A1314) -> 11
A1313: 161536 | B1313: BEZZI | C1313: FRANCESCO | D1313: 13 | E1313: 5 | F1313: 0 | G1313: =IF(SUM(D1315:F1315)<18,"Insuff.",SUM(D1315:F1315)) -> 18 | I1313: =COUNTIF(A:A,A1315) -> 4
A1314: 122835 | B1314: BORTONE | C1314: ANDREA | D1314: 0 | E1314: 0 | F1314: 0 | G1314: =IF(SUM(D1316:F1316)<18,"Insuff.",SUM(D1316:F1316)) -> Insuff. | H1314: (*) | I1314: =COUNTIF(A:A,A1316) -> 5
A1315: 149308 | B1315: CAPUTO | C1315: FABIO | D1315: 14 | E1315: 9 | F1315: 0 | G1315: =IF(SUM(D1317:F1317)<18,"Insuff.",SUM(D1317:F1317)) -> 23 | I1315: =COUNTIF(A:A,A1317) -> 2
A1316: 160989 | B1316: CAPUTO | C1316: SIMONE | D1316: 17 | E1316: 8 | F1316: 0 | G1316: =IF(SUM(D1318:F1318)<18,"Insuff.",SUM(D1318:F1318)) -> 25 | I1316: =COUNTIF(A:A,A1318) -> 2
A1317: 157315 | B1317: CASCINI | C1317: ALESSANDRO | D1317: 17 | E1317: 4 | F1317: 0 | G1317: =IF(SUM(D1319:F1319)<18,"Insuff.",SUM(D1319:F1319)) -> 21 | I1317: =COUNTIF(A:A,A1319) -> 2
A1318: 192644 | B1318: CIAMBERLANO | C1318: FABRIZIO | D1318: 11 | E1318: 4 | F1318: 0 | G1318: =IF(SUM(D1320:F1320)<18,"Insuff.",SUM(D1320:F1320)) -> Insuff. | I1318: =COUNTIF(A:A,A1320) -> 4
A1319: 164846 | B1319: COCCI | C1319: GIACOMO | D1319: 14 | E1319: 9 | F1319: 0 | G1319: =IF(SUM(D1321:F1321)<18,"Insuff.",SUM(D1321:F1321)) -> 23 | I1319: =COUNTIF(A:A,A1321) -> 3
A1320: 178651 | B1320: CRISTIANI | C1320: ALESSANDRO | D1320: 18 | E1320: 10 | F1320: 0 | G1320: =IF(SUM(D1322:F1322)<18,"Insuff.",SUM(D1322:F1322)) -> 28 | I1320: =COUNTIF(A:A,A1322) -> 4
A1321: 160436 | B1321: D'AGOSTINO | C1321: STEFANO | D1321: 14 | E1321: 8 | F1321: 0 | G1321: =IF(SUM(D1323:F1323)<18,"Insuff.",SUM(D1323:F1323)) -> 22 | I1321: =COUNTIF(A:A,A1323) -> 4
A1322: 159335 | B1322: D'APOTE | C1322: LEONARDO | D1322: 18 | E1322: 11 | F1322: 0 | G1322: =IF(SUM(D1324:F1324)<18,"Insuff.",SUM(D1324:F1324)) -> 29 | I1322: =COUNTIF(A:A,A1324) -> 4
A1323: 159447 | B1323: D'AVERSA | C1323: DANILO | D1323: 15 | E1323: 4 | F1323: 0 | G1323: =IF(SUM(D1325:F1325)<18,"Insuff.",SUM(D1325:F1325)) -> 19 | I1323: =COUNTIF(A:A,A1325) -> 3
A1324: 194783 | B1324: DE TOGNI | C1324: FRANCESCO | D1324: 12 | E1324: 5 | F1324: 3 | G1324: =IF(SUM(D1326:F1326)<18,"Insuff.",SUM(D1326:F1326)) -> 20 | I1324: =COUNTIF(A:A,A1326) -> 1
A1325: 900022478 | B1325: DI GIOVANNI | C1325: FERDINANDO | D1325: 8 | E1325: 0 | F1325: 3 | G1325: =IF(SUM(D1327:F1327)<18,"Insuff.",SUM(D1327:F1327)) -> Insuff. | I1325: =COUNTIF(A:A,A1327) -> 2
A1326: 183315 | B1326: DI NINNO | C1326: MARCO | D1326: 16 | E1326: 6 | F1326: 3 | G1326: =IF(SUM(D1328:F1328)<18,"Insuff.",SUM(D1328:F1328)) -> 25 | I1326: =COUNTIF(A:A,A1328) -> 1
A1327: 181550 | B1327: DI PAOLO | C1327: ALESSANDRO | D1327: 15 | E1327: 6 | F1327: 3 | G1327: =IF(SUM(D1329:F1329)<18,"Insuff.",SUM(D1329:F1329)) -> 24 | I1327: =COUNTIF(A:A,A1329) -> 1
A1328: 163699 | B1328: FALCONE | C1328: FRANCESCO | D1328: 14 | E1328: 6 | F1328: 0 | G1328: =IF(SUM(D1330:F1330)<18,"Insuff.",SUM(D1330:F1330)) -> 20 | I1328: =COUNTIF(A:A,A1330) -> 3
A1329: 166694 | B1329: FARACI | C1329: FABIO | D1329: 12 | E1329: 5 | F1329: 0 | G1329: 17 | H1329: (**) | I1329: =COUNTIF(A:A,A1331) -> 7
A1330: 158021 | B1330: FISCHIETTO | C1330: DAVIDE | D1330: 14 | E1330: 0 | F1330: 3 | G1330: 17 | H1330: (**) | I1330: =COUNTIF(A:A,A1332) -> 1
A1331: 182270 | B1331: FRATONI | C1331: ANDREA | D1331: 15 | E1331: 9 | F1331: 3 | G1331: =IF(SUM(D1333:F1333)<18,"Insuff.",SUM(D1333:F1333)) -> 27 | I1331: =COUNTIF(A:A,A1333) -> 1
A1332: 180979 | B1332: GENGA | C1332: GIANLUCA | D1332: 18 | E1332: 5 | F1332: 3 | G1332: =IF(SUM(D1334:F1334)<18,"Insuff.",SUM(D1334:F1334)) -> 26 | I1332: =COUNTIF(A:A,A1334) -> 1
A1333: 179487 | B1333: GIONFALO | C1333: FRANCESCO | D1333: 7 | E1333: 6 | F1333: 0 | G1333: =IF(SUM(D1335:F1335)<18,"Insuff.",SUM(D1335:F1335)) -> Insuff. | I1333: =COUNTIF(A:A,A1335) -> 3
A1334: 178237 | B1334: GIULIANI | C1334: MATTEO | D1334: 18 | E1334: 12 | F1334: 3 | G1334: =IF(SUM(D1336:F1336)<18,"Insuff.",SUM(D1336:F1336)) -> 33 | I1334: =COUNTIF(A:A,A1336) -> 1
A1335: 159504 | B1335: GRASSI | C1335: ENRICO | D1335: 9 | E1335: 1 | F1335: 0 | G1335: =IF(SUM(D1337:F1337)<18,"Insuff.",SUM(D1337:F1337)) -> Insuff. | I1335: =COUNTIF(A:A,A1337) -> 5
A1336: 900018747 | B1336: IANNUZZI | C1336: CRISTIAN | D1336: 12 | E1336: 0 | F1336: 3 | G1336: =IF(SUM(D1338:F1338)<18,"Insuff.",SUM(D1338:F1338)) -> Insuff. | I1336: =COUNTIF(A:A,A1338) -> 3
A1337: 139629 | B1337: IMPOSIMATO | C1337: ARTURO | D1337: 0 | E1337: 0 | F1337: 0 | G1337: =IF(SUM(D1339:F1339)<18,"Insuff.",SUM(D1339:F1339)) -> Insuff. | H1337: (*) | I1337: =COUNTIF(A:A,A1339) -> 8
A1338: 181832 | B1338: KOUSSIS | C1338: JONATHAN | D1338: 6 | E1338: 7 | F1338: 0 | G1338: =IF(SUM(D1340:F1340)<18,"Insuff.",SUM(D1340:F1340)) -> Insuff. | I1338: =COUNTIF(A:A,A1340) -> 3
A1339: 181321 | B1339: LEONE | C1339: GIUSEPPE | D1339: 10 | E1339: 12 | F1339: 3 | G1339: =IF(SUM(D1341:F1341)<18,"Insuff.",SUM(D1341:F1341)) -> 25 | I1339: =COUNTIF(A:A,A1341) -> 2
A1340: 138627 | B1340: MACCAFERRI | C1340: DAVIDE | D1340: 18 | E1340: 0 | F1340: 0 | G1340: =IF(SUM(D1342:F1342)<18,"Insuff.",SUM(D1342:F1342)) -> 18 | I1340: =COUNTIF(A:A,A1342) -> 3
A1341: 168278 | B1341: MACRI | C1341: PAOLO | D1341: 9 | E1341: 3 | F1341: 0 | G1341: =IF(SUM(D1343:F1343)<18,"Insuff.",SUM(D1343:F1343)) -> Insuff. | I1341: =COUNTIF(A:A,A1343) -> 5
A1342: 107899 | B1342: MALVASIO | C1342: ELISA | D1342: 10 | E1342: 2 | F1342: 0 | G1342: =IF(SUM(D1344:F1344)<18,"Insuff.",SUM(D1344:F1344)) -> Insuff. | I1342: =COUNTIF(A:A,A1344) -> 8
A1343: 124220 | B1343: MANESE | C1343: STEFANO GUERINO | D1343: 12 | E1343: 2 | F1343: 0 | G1343: =IF(SUM(D1345:F1345)<18,"Insuff.",SUM(D1345:F1345)) -> Insuff. | I1343: =COUNTIF(A:A,A1345) -> 4
A1344: 181340 | B1344: MANNI | C1344: TIZIANO | D1344: 15 | E1344: 4 | F1344: 3 | G1344: =IF(SUM(D1346:F1346)<18,"Insuff.",SUM(D1346:F1346)) -> 22 | I1344: =COUNTIF(A:A,A1346) -> 1
A1345: 900012688 | B1345: MARUCCIA | C1345: ANTONIO | D1345: 18 | E1345: 12 | F1345: 3 | G1345: =IF(SUM(D1347:F1347)<18,"Insuff.",SUM(D1347:F1347)) -> 33 | I1345: =COUNTIF(A:A,A1347) -> 1
A1346: 2108048325 | B1346: MOSCHELLA | C1346: MARIA | D1346: 11 | E1346: 0 | F1346: 3 | G1346: =IF(SUM(D1348:F1348)<18,"Insuff.",SUM(D1348:F1348)) -> Insuff. | I1346: =COUNTIF(A:A,A1348) -> 2
A1347: 166628 | B1347: PALLA | C1347: ALGERT | D1347: 14 | E1347: 6 | F1347: 3 | G1347: =IF(SUM(D1349:F1349)<18,"Insuff.",SUM(D1349:F1349)) -> 23 | I1347: =COUNTIF(A:A,A1349) -> 1
A1348: 215783 | B1348: PASQUALI | C1348: NICOLA | D1348: 10 | E1348: 7 | F1348: 3 | G1348: =IF(SUM(D1350:F1350)<18,"Insuff.",SUM(D1350:F1350)) -> 20 | I1348: =COUNTIF(A:A,A1350) -> 1
A1349: 168770 | B1349: PIERANTOZZI | C1349: MARCO | D1349: 16 | E1349: 1 | F1349: 3 | G1349: =IF(SUM(D1351:F1351)<18,"Insuff.",SUM(D1351:F1351)) -> 20 | I1349: =COUNTIF(A:A,A1351) -> 1
A1350: 180982 | B1350: PIETRELLI | C1350: LUCA | D1350: 18 | E1350: 5 | F1350: 0 | G1350: =IF(SUM(D1352:F1352)<18,"Insuff.",SUM(D1352:F1352)) -> 23 | I1350: =COUNTIF(A:A,A1352) -> 2
A1351: 142717 | B1351: PIZZUTI | C1351: GIANROCCO | D1351: 15 | E1351: 2 | F1351: 0 | G1351: 17 | H1351: (**) | I1351: =COUNTIF(A:A,A1353) -> 6
A1352: 182697 | B1352: POLIDORI | C1352: MASSIMO | D1352: 17 | E1352: 4 | F1352: 0 | G1352: =IF(SUM(D1354:F1354)<18,"Insuff.",SUM(D1354:F1354)) -> 21 | I1352: =COUNTIF(A:A,A1354) -> 2
A1353: 138968 | B1353: ROMEO | C1353: EMILIO | D1353: 18 | E1353: 0 | F1353: 3 | G1353: =IF(SUM(D1355:F1355)<18,"Insuff.",SUM(D1355:F1355)) -> 21 | I1353: =COUNTIF(A:A,A1355) -> 1
A1354: 138633 | B1354: ROSSI | C1354: ANTONELLO | D1354: 15 | E1354: 8 | F1354: 0 | G1354: =IF(SUM(D1356:F1356)<18,"Insuff.",SUM(D1356:F1356)) -> 23 | I1354: =COUNTIF(A:A,A1356) -> 4
A1355: 168871 | B1355: ROTONDO | C1355: RAFFAELE | D1355: 15 | E1355: 0 | F1355: 3 | G1355: =IF(SUM(D1357:F1357)<18,"Insuff.",SUM(D1357:F1357)) -> 18 | I1355: =COUNTIF(A:A,A1357) -> 1
A1356: 169597 | B1356: SABBATINI | C1356: CRISTIAN | D1356: 16 | E1356: 1 | F1356: 3 | G1356: =IF(SUM(D1358:F1358)<18,"Insuff.",SUM(D1358:F1358)) -> 20 | I1356: =COUNTIF(A:A,A1358) -> 2
A1357: 184040 | B1357: SACCO | C1357: ALEX | D1357: 13 | E1357: 2 | F1357: 0 | G1357: =IF(SUM(D1359:F1359)<18,"Insuff.",SUM(D1359:F1359)) -> Insuff. | I1357: =COUNTIF(A:A,A1359) -> 4
A1358: 187873 | B1358: TOMASI | C1358: NICOLETTA | D1358: 18 | E1358: 6 | F1358: 3 | G1358: =IF(SUM(D1360:F1360)<18,"Insuff.",SUM(D1360:F1360)) -> 27 | I1358: =COUNTIF(A:A,A1360) -> 1
A1359: 2148063466 | B1359: TRIGIANI | C1359: ANTONIO | D1359: 14 | E1359: 0 | F1359: 3 | G1359: 17 | H1359: (**) | I1359: =COUNTIF(A:A,A1361) -> 1
A1360: 162366 | B1360: VAGNARELLI | C1360: VALERIO | D1360: 18 | E1360: 12 | F1360: 0 | G1360: =IF(SUM(D1362:F1362)<18,"Insuff.",SUM(D1362:F1362)) -> 30 | I1360: =COUNTIF(A:A,A1362) -> 3
A1361: 900012036 | B1361: VERONA | C1361: DAVIDE | D1361: 16 | E1361: 1 | F1361: 0 | G1361: 17 | H1361: (**) | I1361: =COUNTIF(A:A,A1363) -> 2
A1362: (*) L'esito del prossimo appello verra' verbalizzato in ogni caso | I1362: =COUNTIF(A:A,A1364) -> 1
A1363: (**) Puo' registrare 18. | I1363: =COUNTIF(A:A,A1365) -> 5
I1364: =COUNTIF(A:A,A1366) -> 0
I1365: =COUNTIF(A:A,A1367) -> 0
I1366: =COUNTIF(A:A,A1368) -> 0
I1367: =COUNTIF(A:A,A1369) -> 0
A1368: Fondamenti di Ricerca Operativa L-A | I1368: =COUNTIF(A:A,A1370) -> 22
A1369: Prova Scritta del 21 Giugno 2006 | I1369: =COUNTIF(A:A,A1371) -> 1
I1370: =COUNTIF(A:A,A1372) -> 0
A1371: Validita' per chi non sostiene l'orale: fino al 27 Giugno 2006, ore 15.00 | I1371: =COUNTIF(A:A,A1373) -> 1
A1372: (non procrastinabile; non si risponde a mail o telefonate in merito). | I1372: =COUNTIF(A:A,A1374) -> 9
I1373: =COUNTIF(A:A,A1375) -> 0
A1374: Validita' per chi sostiene l'orale: fino all'appello di Settembre 2006. | I1374: =COUNTIF(A:A,A1376) -> 1
A1375: Visione degli elaborati e orali: 27 Giugno 2006, ore 14.00, Aula 81 | I1375: =COUNTIF(A:A,A1377) -> 1
A1376: Prossimi appelli: Luglio 2006, Settembre 2006 | I1376: =COUNTIF(A:A,A1378) -> 1
I1377: =COUNTIF(A:A,A1379) -> 0
A1378: matricola | B1378: Cognome | C1378: Nome | D1378: 1 | E1378: 2 | F1378: bonus | G1378: voto | I1378: =COUNTIF(A:A,A1380) -> 24
A1379: 143059 | B1379: ANGELINI | C1379: ENRICO | D1379: 15 | E1379: 12 | F1379: 3 | G1379: =IF(SUM(D1381:F1381)<18,"Insuff.",SUM(D1381:F1381)) -> 30 | I1379: =COUNTIF(A:A,A1381) -> 1
A1380: 158364 | B1380: BALDI | C1380: ERICK | D1380: 2 | E1380: 7 | F1380: 0 | G1380: =IF(SUM(D1382:F1382)<18,"Insuff.",SUM(D1382:F1382)) -> Insuff. | I1380: =COUNTIF(A:A,A1382) -> 4
A1381: 122282 | B1381: BETTI | C1381: ALESSANDRO | D1381: 1 | E1381: 2 | F1381: 0 | G1381: =IF(SUM(D1383:F1383)<18,"Insuff.",SUM(D1383:F1383)) -> Insuff. | I1381: =COUNTIF(A:A,A1383) -> 11
A1382: 161536 | B1382: BEZZI | C1382: FRANCESCO | D1382: 9 | E1382: 9 | F1382: 0 | G1382: =IF(SUM(D1384:F1384)<18,"Insuff.",SUM(D1384:F1384)) -> 18 | H1382: (*) | I1382: =COUNTIF(A:A,A1384) -> 4
A1383: 122835 | B1383: BORTONE | C1383: ANDREA | D1383: 1 | E1383: 2 | F1383: 0 | G1383: =IF(SUM(D1385:F1385)<18,"Insuff.",SUM(D1385:F1385)) -> Insuff. | H1383: (**) | I1383: =COUNTIF(A:A,A1385) -> 5
A1384: 900016641 | B1384: BURRHUS | C1384: LANDRY NJIKE | D1384: 11 | E1384: 3 | F1384: 3 | G1384: 17 | H1384: (***) | I1384: =COUNTIF(A:A,A1386) -> 3
A1385: 192644 | B1385: CIAMBERLANO | C1385: FABRIZIO | D1385: 9 | E1385: 8 | F1385: 0 | G1385: 17 | H1385: (***) | I1385: =COUNTIF(A:A,A1387) -> 4
A1386: 159962 | B1386: CIARROCCHI | C1386: PAOLO | D1386: 16 | E1386: 8 | F1386: 0 | G1386: =IF(SUM(D1388:F1388)<18,"Insuff.",SUM(D1388:F1388)) -> 24 | I1386: =COUNTIF(A:A,A1388) -> 2
A1387: 159447 | B1387: D'AVERSA | C1387: DANILO | D1387: 13 | E1387: 10 | F1387: 0 | G1387: =IF(SUM(D1389:F1389)<18,"Insuff.",SUM(D1389:F1389)) -> 23 | I1387: =COUNTIF(A:A,A1389) -> 3
A1388: 159504 | B1388: GRASSI | C1388: ENRICO | D1388: 7 | E1388: 6 | F1388: 0 | G1388: =IF(SUM(D1390:F1390)<18,"Insuff.",SUM(D1390:F1390)) -> Insuff. | I1388: =COUNTIF(A:A,A1390) -> 5
A1389: 900018747 | B1389: IANNUZZI | C1389: CRISTIAN | D1389: 3 | E1389: 1 | F1389: 0 | G1389: =IF(SUM(D1391:F1391)<18,"Insuff.",SUM(D1391:F1391)) -> Insuff. | I1389: =COUNTIF(A:A,A1391) -> 3
A1390: 181321 | B1390: LEONE | C1390: GIUSEPPE | D1390: 18 | E1390: 12 | F1390: 0 | G1390: =IF(SUM(D1392:F1392)<18,"Insuff.",SUM(D1392:F1392)) -> 30 | I1390: =COUNTIF(A:A,A1392) -> 2
A1391: 900018299 | B1391: LIPARI | C1391: TIZIANA | D1391: 5 | E1391: 10 | F1391: 3 | G1391: =IF(SUM(D1393:F1393)<18,"Insuff.",SUM(D1393:F1393)) -> 18 | I1391: =COUNTIF(A:A,A1393) -> 1
A1392: 168278 | B1392: MACRI | C1392: PAOLO | D1392: 7 | E1392: 1 | F1392: 0 | G1392: =IF(SUM(D1394:F1394)<18,"Insuff.",SUM(D1394:F1394)) -> Insuff. | I1392: =COUNTIF(A:A,A1394) -> 5
A1393: 161046 | B1393: MAZZOTTA | C1393: GIOVANNI | D1393: 6 | E1393: 8 | F1393: 3 | G1393: 17 | H1393: (***) | I1393: =COUNTIF(A:A,A1395) -> 1
A1394: 2108048325 | B1394: MOSCHELLA | C1394: MARIA | D1394: 7 | E1394: 10 | F1394: 0 | G1394: 17 | H1394: (***) | I1394: =COUNTIF(A:A,A1396) -> 2
A1395: 139463 | B1395: PALMUCCI | C1395: MASSIMILIANO | D1395: 11 | E1395: 10 | F1395: 0 | G1395: =IF(SUM(D1397:F1397)<18,"Insuff.",SUM(D1397:F1397)) -> 21 | I1395: =COUNTIF(A:A,A1397) -> 6
A1396: 146630 | B1396: PEDONE | C1396: GIOVANNI | D1396: 12 | E1396: 7 | F1396: 0 | G1396: =IF(SUM(D1398:F1398)<18,"Insuff.",SUM(D1398:F1398)) -> 19 | I1396: =COUNTIF(A:A,A1398) -> 2
A1397: 184277 | B1397: RAPINO | C1397: DAVIDE | D1397: 6 | E1397: 8 | F1397: 0 | G1397: =IF(SUM(D1399:F1399)<18,"Insuff.",SUM(D1399:F1399)) -> Insuff. | I1397: =COUNTIF(A:A,A1399) -> 3
A1398: 169597 | B1398: SABBATINI | C1398: CRISTIAN | D1398: 18 | E1398: 12 | F1398: 0 | G1398: =IF(SUM(D1400:F1400)<18,"Insuff.",SUM(D1400:F1400)) -> 30 | I1398: =COUNTIF(A:A,A1400) -> 2
A1399: 181004 | B1399: SAVORELLI | C1399: MATTEO | D1399: 11 | E1399: 7 | F1399: 3 | G1399: =IF(SUM(D1401:F1401)<18,"Insuff.",SUM(D1401:F1401)) -> 21 | I1399: =COUNTIF(A:A,A1401) -> 1
A1400: 185970 | B1400: SPATARO | C1400: CATALDO | D1400: 14 | E1400: 10 | F1400: 3 | G1400: =IF(SUM(D1402:F1402)<18,"Insuff.",SUM(D1402:F1402)) -> 27 | I1400: =COUNTIF(A:A,A1402) -> 1
A1401: 233659 | B1401: ZACCHE | C1401: ALESSANDRO | D1401: 12 | E1401: 12 | F1401: 0 | G1401: =IF(SUM(D1403:F1403)<18,"Insuff.",SUM(D1403:F1403)) -> 24 | I1401: =COUNTIF(A:A,A1403) -> 5
A1402: (*) L'eventuale esito negativo del prossimo appello verra' verbalizzato. | I1402: =COUNTIF(A:A,A1404) -> 2
A1403: (**) L'esito e' stato verbalizzato. | I1403: =COUNTIF(A:A,A1405) -> 1
A1404: (***) Puo' registrare 18. | I1404: =COUNTIF(A:A,A1406) -> 5
I1405: =COUNTIF(A:A,A1407) -> 0
I1406: =COUNTIF(A:A,A1408) -> 0
A1407: Fondamenti di Ricerca Operativa L-A | I1407: =COUNTIF(A:A,A1409) -> 22
A1408: Prova Scritta del 12 Luglio 2006 | I1408: =COUNTIF(A:A,A1410) -> 1
I1409: =COUNTIF(A:A,A1411) -> 0
A1410: Validita' per chi non sostiene l'orale: fino al 18 Luglio 2006, ore 15.00 | I1410: =COUNTIF(A:A,A1412) -> 1
A1411: (non procrastinabile; non si risponde a mail o telefonate in merito). | I1411: =COUNTIF(A:A,A1413) -> 9
I1412: =COUNTIF(A:A,A1414) -> 0
A1413: Validita' per chi sostiene l'orale: fino all'appello di Dicembre 2006. | I1413: =COUNTIF(A:A,A1415) -> 1
A1414: Visione degli elaborati e orali: 18 Luglio 2006, ore 14.00, Aula 61 | I1414: =COUNTIF(A:A,A1416) -> 1
A1415: Prossimi appelli: Settembre 2006, Dicembre 2006 | I1415: =COUNTIF(A:A,A1417) -> 1
I1416: =COUNTIF(A:A,A1418) -> 0
A1417: matricola | B1417: Cognome | C1417: Nome | D1417: 1 | E1417: 2 | F1417: bonus | G1417: voto | I1417: =COUNTIF(A:A,A1419) -> 24
A1418: 158364 | B1418: BALDI | C1418: ERICK | D1418: 3 | E1418: 8 | F1418: 0 | G1418: =IF(SUM(D1420:F1420)<18,"Insuff.",SUM(D1420:F1420)) -> Insuff. | I1418: =COUNTIF(A:A,A1420) -> 4
A1419: 900016641 | B1419: BURRHUS | C1419: LANDRY NJIKE | D1419: 5 | E1419: 0 | F1419: 0 | G1419: =IF(SUM(D1421:F1421)<18,"Insuff.",SUM(D1421:F1421)) -> Insuff. | I1419: =COUNTIF(A:A,A1421) -> 3
A1420: 185974 | B1420: CHIARELLI | C1420: GIOVANNI | D1420: 3 | E1420: 0 | F1420: 3 | G1420: =IF(SUM(D1422:F1422)<18,"Insuff.",SUM(D1422:F1422)) -> Insuff. | I1420: =COUNTIF(A:A,A1422) -> 2
A1421: 178651 | B1421: CRISTIANI | C1421: ALESSANDRO | D1421: 5 | E1421: 12 | F1421: 0 | G1421: 17 | H1421: (**) | I1421: =COUNTIF(A:A,A1423) -> 4
A1422: 181432 | B1422: FRANCESCHELLI | C1422: ALESSIO | D1422: 13 | E1422: 15 | F1422: 3 | G1422: =IF(SUM(D1424:F1424)<18,"Insuff.",SUM(D1424:F1424)) -> 31 | I1422: =COUNTIF(A:A,A1424) -> 1
A1423: 236303 | B1423: GAETA | C1423: ALESSIO | D1423: 15 | E1423: 12 | F1423: 3 | G1423: =IF(SUM(D1425:F1425)<18,"Insuff.",SUM(D1425:F1425)) -> 30 | I1423: =COUNTIF(A:A,A1425) -> 1
A1424: 159504 | B1424: GRASSI | C1424: ENRICO | D1424: 7 | E1424: 13 | F1424: 0 | G1424: =IF(SUM(D1426:F1426)<18,"Insuff.",SUM(D1426:F1426)) -> 20 | I1424: =COUNTIF(A:A,A1426) -> 5
A1425: 147388 | B1425: GUERRIERI | C1425: ANDREA | D1425: 7 | E1425: 8 | F1425: 3 | G1425: =IF(SUM(D1427:F1427)<18,"Insuff.",SUM(D1427:F1427)) -> 18 | I1425: =COUNTIF(A:A,A1427) -> 1
A1426: 900018747 | B1426: IANNUZZI | C1426: CRISTIAN | D1426: 9 | E1426: 13 | F1426: 0 | G1426: =IF(SUM(D1428:F1428)<18,"Insuff.",SUM(D1428:F1428)) -> 22 | I1426: =COUNTIF(A:A,A1428) -> 3
A1427: 139629 | B1427: IMPOSIMATO | C1427: ARTURO | D1427: 0 | E1427: 0 | F1427: 0 | G1427: Insuff. | H1427: (*) | I1427: =COUNTIF(A:A,A1429) -> 8
A1428: 181832 | B1428: KOUSSIS | C1428: JONATHAN | D1428: 1 | E1428: 0 | F1428: 0 | G1428: =IF(SUM(D1430:F1430)<18,"Insuff.",SUM(D1430:F1430)) -> Insuff. | H1428: (*) | I1428: =COUNTIF(A:A,A1430) -> 3
A1429: 900025523 | B1429: MA | C1429: YUE | D1429: 13 | E1429: 8 | F1429: 3 | G1429: =IF(SUM(D1431:F1431)<18,"Insuff.",SUM(D1431:F1431)) -> 24 | I1429: =COUNTIF(A:A,A1431) -> 1
A1430: 168278 | B1430: MACRI | C1430: PAOLO | D1430: 12 | E1430: 12 | F1430: 0 | G1430: =IF(SUM(D1432:F1432)<18,"Insuff.",SUM(D1432:F1432)) -> 24 | I1430: =COUNTIF(A:A,A1432) -> 5
A1431: 107899 | B1431: MALVASIO | C1431: ELISA | D1431: 2 | E1431: 6 | F1431: 0 | G1431: =IF(SUM(D1433:F1433)<18,"Insuff.",SUM(D1433:F1433)) -> Insuff. | I1431: =COUNTIF(A:A,A1433) -> 8
A1432: 124220 | B1432: MANESE | C1432: STEFANO GUERINO | D1432: 5 | E1432: 9 | F1432: 0 | G1432: =IF(SUM(D1434:F1434)<18,"Insuff.",SUM(D1434:F1434)) -> Insuff. | I1432: =COUNTIF(A:A,A1434) -> 4
A1433: 245147 | B1433: MORINI | C1433: NICOLA | D1433: 9 | E1433: 12 | F1433: 3 | G1433: =IF(SUM(D1435:F1435)<18,"Insuff.",SUM(D1435:F1435)) -> 24 | I1433: =COUNTIF(A:A,A1435) -> 1
A1434: 107016 | B1434: NASILLI | C1434: NUNZIO | D1434: 4 | E1434: 6 | F1434: 3 | G1434: =IF(SUM(D1436:F1436)<18,"Insuff.",SUM(D1436:F1436)) -> Insuff. | I1434: =COUNTIF(A:A,A1436) -> 3
A1435: 180408 | B1435: PIZZUTI | C1435: FRANCESCO | D1435: 9 | E1435: 5 | F1435: 3 | G1435: 17 | H1435: (**) | I1435: =COUNTIF(A:A,A1437) -> 1
A1436: 182012 | B1436: RIA | C1436: LUIGI | D1436: 9 | E1436: 14 | F1436: 0 | G1436: =IF(SUM(D1438:F1438)<18,"Insuff.",SUM(D1438:F1438)) -> 23 | I1436: =COUNTIF(A:A,A1438) -> 3
A1437: 184040 | B1437: SACCO | C1437: ALEX | D1437: 3 | E1437: 11 | F1437: 0 | G1437: =IF(SUM(D1439:F1439)<18,"Insuff.",SUM(D1439:F1439)) -> Insuff. | I1437: =COUNTIF(A:A,A1439) -> 4
A1438: 181488 | B1438: ZANCANARO | C1438: MARCO | D1438: 11 | E1438: 13 | F1438: 0 | G1438: =IF(SUM(D1440:F1440)<18,"Insuff.",SUM(D1440:F1440)) -> 24 | I1438: =COUNTIF(A:A,A1440) -> 2
A1439: (*) L'eventuale esito negativo del prossimo appello verra' verbalizzato.
A1440: (**) Puo' registrare 18.
A1442: Fondamenti di Ricerca Operativa L-A | I1442: =COUNTIF(A:A,A1446) -> 22
A1443: Prova Scritta del 15 Settembre 2006 | I1443: =COUNTIF(A:A,A1447) -> 1
I1444: =COUNTIF(A:A,A1448) -> 0
A1445: Validita' per chi non sostiene l'orale: fino al 22 Settembre 2006, ore 16.00 | I1445: =COUNTIF(A:A,A1449) -> 1
A1446: (non procrastinabile; non si risponde a mail o telefonate in merito). | I1446: =COUNTIF(A:A,A1450) -> 9
I1447: =COUNTIF(A:A,A1451) -> 0
A1448: Validita' per chi sostiene l'orale: fino all'appello di Gennaio 2007. | I1448: =COUNTIF(A:A,A1452) -> 1
A1449: Visione degli elaborati e orali: 22 Settembre 2006, ore 15.00, Aula 61
A1450: Prossimi appelli: Dicembre 2006, Gennaio 2007
I1451: =COUNTIF(A:A,A1455) -> 0
A1452: matricola | B1452: Cognome | C1452: Nome | D1452: 1 | E1452: 2 | F1452: bonus | G1452: voto | I1452: =COUNTIF(A:A,A1456) -> 24
A1453: 158364 | B1453: BALDI | C1453: ERICK | D1453: 15 | E1453: 2 | F1453: =IF(I1457>1,0,3) -> 0 | G1453: =IF(SUM(D1457:F1457)<17,"Insuff.",SUM(D1457:F1457)) -> 17 | H1453: =IF(G1457<18,"(*)","   ") -> (*) | I1453: =COUNTIF(A:A,A1457) -> 4
A1454: 122282 | B1454: BETTI | C1454: ALESSANDRO | D1454: 16 | E1454: 5 | F1454: =IF(I1458>1,0,3) -> 0 | G1454: =IF(SUM(D1458:F1458)<17,"Insuff.",SUM(D1458:F1458)) -> 21 | H1454: =IF(G1458<18,"(*)","   ") ->  | I1454: =COUNTIF(A:A,A1458) -> 11
A1455: 900016641 | B1455: BURRHUS | C1455: LANDRY NJIKE | D1455: 16 | E1455: 6 | F1455: =IF(I1459>1,0,3) -> 0 | G1455: =IF(SUM(D1459:F1459)<17,"Insuff.",SUM(D1459:F1459)) -> 22 | H1455: =IF(G1459<18,"(*)","   ") ->  | I1455: =COUNTIF(A:A,A1459) -> 3
A1456: 168981 | B1456: FALGHERI | C1456: GIUSEPPE | D1456: 6 | E1456: 5 | F1456: =IF(I1460>1,0,3) -> 0 | G1456: =IF(SUM(D1460:F1460)<17,"Insuff.",SUM(D1460:F1460)) -> Insuff. | H1456: =IF(G1460<18,"(*)","   ") ->  | I1456: =COUNTIF(A:A,A1460) -> 3
A1457: 165037 | B1457: FIORENTINI | C1457: NICOLA | D1457: 5 | E1457: 0 | F1457: =IF(I1461>1,0,3) -> 3 | G1457: =IF(SUM(D1461:F1461)<17,"Insuff.",SUM(D1461:F1461)) -> Insuff. | H1457: =IF(G1461<18,"(*)","   ") ->  | I1457: =COUNTIF(A:A,A1461) -> 1
A1458: 131105 | B1458: FIORENTINO | C1458: CARMELO | D1458: 14 | E1458: 0 | F1458: =IF(I1462>1,0,3) -> 3 | G1458: =IF(SUM(D1462:F1462)<17,"Insuff.",SUM(D1462:F1462)) -> 17 | H1458: =IF(G1462<18,"(*)","   ") -> (*) | I1458: =COUNTIF(A:A,A1462) -> 1
A1459: 179487 | B1459: GIONFALO | C1459: FRANCESCO | D1459: 15 | E1459: 6 | F1459: =IF(I1463>1,0,3) -> 0 | G1459: =IF(SUM(D1463:F1463)<17,"Insuff.",SUM(D1463:F1463)) -> 21 | H1459: =IF(G1463<18,"(*)","   ") ->  | I1459: =COUNTIF(A:A,A1463) -> 3
A1460: 107899 | B1460: MALVASIO | C1460: ELISA | D1460: 3 | E1460: 5 | F1460: =IF(I1464>1,0,3) -> 0 | G1460: =IF(SUM(D1464:F1464)<17,"Insuff.",SUM(D1464:F1464)) -> Insuff. | H1460: =IF(G1464<18,"(*)","   ") ->  | I1460: =COUNTIF(A:A,A1464) -> 8
A1461: 183442 | B1461: MENCHISE | C1461: MASSIMO | D1461: 17 | E1461: 0 | F1461: =IF(I1465>1,0,3) -> 3 | G1461: =IF(SUM(D1465:F1465)<17,"Insuff.",SUM(D1465:F1465)) -> 20 | H1461: =IF(G1465<18,"(*)","   ") ->  | I1461: =COUNTIF(A:A,A1465) -> 1
A1462: 107016 | B1462: NASILLI | C1462: NUNZIO | D1462: 5 | E1462: 6 | F1462: =IF(I1466>1,0,3) -> 0 | G1462: =IF(SUM(D1466:F1466)<17,"Insuff.",SUM(D1466:F1466)) -> Insuff. | H1462: =IF(G1466<18,"(*)","   ") ->  | I1462: =COUNTIF(A:A,A1466) -> 3
A1463: 182012 | B1463: RIA | C1463: LUIGI | D1463: 13 | E1463: 7 | F1463: =IF(I1467>1,0,3) -> 0 | G1463: =IF(SUM(D1467:F1467)<17,"Insuff.",SUM(D1467:F1467)) -> 20 | H1463: =IF(G1467<18,"(*)","   ") ->  | I1463: =COUNTIF(A:A,A1467) -> 3
A1464: 900011710 | B1464: TSILA ESSALA | C1464: CLAUDE ARMAND | D1464: 10 | E1464: 4 | F1464: =IF(I1468>1,0,3) -> 3 | G1464: =IF(SUM(D1468:F1468)<17,"Insuff.",SUM(D1468:F1468)) -> 17 | H1464: =IF(G1468<18,"(*)","   ") -> (*) | I1464: =COUNTIF(A:A,A1468) -> 1
A1465: (*) Puo' registrare 18.
A1467: Fondamenti di Ricerca Operativa LA
A1468: Prova Scritta del 18 Dicembre 2006
A1470: Validita' per chi non sostiene l'orale: fino al 22 Dicembre 2006, ore 16.00 | I1470: =COUNTIF(A:A,A1476) -> 1
A1471: (non procrastinabile; non si risponde a mail o telefonate in merito). | I1471: =COUNTIF(A:A,A1477) -> 9
I1472: =COUNTIF(A:A,A1478) -> 0
A1473: Validita' per chi sostiene l'orale: fino all'appello di Aprile 2007. | I1473: =COUNTIF(A:A,A1479) -> 1
A1474: Visione degli elaborati e orali: 22 Dicembre 2006, ore 15.00, Aula 62
A1475: Prossimi appelli: Gennaio 2007, Aprile 2007
I1476: =COUNTIF(A:A,A1482) -> 0
A1477: matricola | B1477: Cognome | C1477: Nome | D1477: 1 | E1477: 2 | F1477: bonus | G1477: voto | I1477: =COUNTIF(A:A,A1483) -> 24
A1478: 222850 | B1478: ACCOGLI | C1478: DONATO | D1478: 2 | E1478: 7 | F1478: 3 | G1478: =IF(SUM(D1484:F1484)<17,"Insuff.",SUM(D1484:F1484)) -> Insuff. | I1478: =COUNTIF(A:A,A1484) -> 1
A1479: 217184 | B1479: ALBERGHINI | C1479: ALAN | D1479: 17 | E1479: 5 | F1479: 3 | G1479: =IF(SUM(D1485:F1485)<17,"Insuff.",SUM(D1485:F1485)) -> 25 | I1479: =COUNTIF(A:A,A1485) -> 1
A1480: 141553 | B1480: BALBONI | C1480: CHIARA | D1480: 5 | E1480: 9 | F1480: 3 | G1480: =IF(SUM(D1486:F1486)<17,"Insuff.",SUM(D1486:F1486)) -> 17 | H1480: (*) | I1480: =COUNTIF(A:A,A1486) -> 1
A1481: 223595 | B1481: BEDESCHI | C1481: EMANUELE | D1481: 16 | E1481: 2 | F1481: 3 | G1481: =IF(SUM(D1487:F1487)<17,"Insuff.",SUM(D1487:F1487)) -> 21 | I1481: =COUNTIF(A:A,A1487) -> 1
A1482: 133920 | B1482: BENVENUTI | C1482: LORENZO | D1482: 8 | E1482: 2 | F1482: 3 | G1482: =IF(SUM(D1488:F1488)<17,"Insuff.",SUM(D1488:F1488)) -> Insuff. | I1482: =COUNTIF(A:A,A1488) -> 1
A1483: 220193 | B1483: BERGAMINI | C1483: ENRICO | D1483: 5 | E1483: 3 | F1483: 3 | G1483: =IF(SUM(D1489:F1489)<17,"Insuff.",SUM(D1489:F1489)) -> Insuff. | I1483: =COUNTIF(A:A,A1489) -> 1
A1484: 139610 | B1484: BIANCONCINI | C1484: LUCA | D1484: 3 | E1484: 2 | F1484: 3 | G1484: =IF(SUM(D1490:F1490)<17,"Insuff.",SUM(D1490:F1490)) -> Insuff. | I1484: =COUNTIF(A:A,A1490) -> 1
A1485: 218689 | B1485: BILLI | C1485: DENIS | D1485: 13 | E1485: 6 | F1485: 3 | G1485: =IF(SUM(D1491:F1491)<17,"Insuff.",SUM(D1491:F1491)) -> 22 | I1485: =COUNTIF(A:A,A1491) -> 1
A1486: 219430 | B1486: BOIANI | C1486: FABIO | D1486: 19 | E1486: 10 | F1486: 3 | G1486: =IF(SUM(D1492:F1492)<17,"Insuff.",SUM(D1492:F1492)) -> 32 | I1486: =COUNTIF(A:A,A1492) -> 1
A1487: 218712 | B1487: BRUCIATI | C1487: STEFANO | D1487: 5 | E1487: 5 | F1487: 3 | G1487: =IF(SUM(D1493:F1493)<17,"Insuff.",SUM(D1493:F1493)) -> Insuff. | I1487: =COUNTIF(A:A,A1493) -> 1
A1488: 221404 | B1488: BUCALETTI | C1488: ANDREA | D1488: 19 | E1488: 6 | F1488: 3 | G1488: =IF(SUM(D1494:F1494)<17,"Insuff.",SUM(D1494:F1494)) -> 28 | I1488: =COUNTIF(A:A,A1494) -> 1
A1489: 225498 | B1489: BUETI | C1489: LUCA | D1489: 8 | E1489: 8 | F1489: 3 | G1489: =IF(SUM(D1495:F1495)<17,"Insuff.",SUM(D1495:F1495)) -> 19 | I1489: =COUNTIF(A:A,A1495) -> 1
A1490: 160958 | B1490: BUSICO | C1490: ALESSANDRO | D1490: 10 | E1490: 4 | F1490: 3 | G1490: =IF(SUM(D1496:F1496)<17,"Insuff.",SUM(D1496:F1496)) -> 17 | H1490: (*) | I1490: =COUNTIF(A:A,A1496) -> 1
A1491: 180378 | B1491: CALZOLARI | C1491: MANUEL | D1491: 2 | E1491: 7 | F1491: 3 | G1491: =IF(SUM(D1497:F1497)<17,"Insuff.",SUM(D1497:F1497)) -> Insuff. | I1491: =COUNTIF(A:A,A1497) -> 1
A1492: 217560 | B1492: CANDELORO | C1492: DAVIDE | D1492: 5 | E1492: 10 | F1492: 3 | G1492: =IF(SUM(D1498:F1498)<17,"Insuff.",SUM(D1498:F1498)) -> 18 | I1492: =COUNTIF(A:A,A1498) -> 1
A1493: 900009741 | B1493: CARAGNULO | C1493: VINCENZO | D1493: 2 | E1493: 0 | F1493: 3 | G1493: =IF(SUM(D1499:F1499)<17,"Insuff.",SUM(D1499:F1499)) -> Insuff. | I1493: =COUNTIF(A:A,A1499) -> 1
A1494: 900011534 | B1494: CARBONARO | C1494: FRANCESCO | D1494: 5 | E1494: 9 | F1494: 3 | G1494: =IF(SUM(D1500:F1500)<17,"Insuff.",SUM(D1500:F1500)) -> 17 | H1494: (*) | I1494: =COUNTIF(A:A,A1500) -> 1
A1495: 217290 | B1495: CARPINO | C1495: GIULIO | D1495: 5 | E1495: 9 | F1495: 3 | G1495: =IF(SUM(D1501:F1501)<17,"Insuff.",SUM(D1501:F1501)) -> 17 | H1495: (*) | I1495: =COUNTIF(A:A,A1501) -> 1
A1496: 218734 | B1496: CASADIO | C1496: MARCO | D1496: 7 | E1496: 7 | F1496: 3 | G1496: =IF(SUM(D1502:F1502)<17,"Insuff.",SUM(D1502:F1502)) -> 17 | H1496: (*) | I1496: =COUNTIF(A:A,A1502) -> 1
A1497: 219836 | B1497: CAVAGNERO | C1497: FILIPPO | D1497: 4 | E1497: 0 | F1497: 3 | G1497: =IF(SUM(D1503:F1503)<17,"Insuff.",SUM(D1503:F1503)) -> Insuff. | I1497: =COUNTIF(A:A,A1503) -> 1
A1498: 185974 | B1498: CHIARELLI | C1498: GIOVANNI | D1498: 4 | E1498: 6 | F1498: 0 | G1498: =IF(SUM(D1504:F1504)<17,"Insuff.",SUM(D1504:F1504)) -> Insuff. | I1498: =COUNTIF(A:A,A1504) -> 2
A1499: 217397 | B1499: CINARDO | C1499: ANGELO DAVIDE | D1499: 19 | E1499: 10 | F1499: 3 | G1499: =IF(SUM(D1505:F1505)<17,"Insuff.",SUM(D1505:F1505)) -> 32 | I1499: =COUNTIF(A:A,A1505) -> 1
A1500: 222373 | B1500: COGNIGNI | C1500: ALESSIA | D1500: 3 | E1500: 0 | F1500: 3 | G1500: =IF(SUM(D1506:F1506)<17,"Insuff.",SUM(D1506:F1506)) -> Insuff. | I1500: =COUNTIF(A:A,A1506) -> 1
A1501: 2146064668 | B1501: COLASANTE | C1501: FILIPPO | D1501: 3 | E1501: 2 | F1501: 3 | G1501: =IF(SUM(D1507:F1507)<17,"Insuff.",SUM(D1507:F1507)) -> Insuff. | I1501: =COUNTIF(A:A,A1507) -> 1
A1502: 219145 | B1502: COLONNA | C1502: FABRIZIO | D1502: 5 | E1502: 10 | F1502: 3 | G1502: =IF(SUM(D1508:F1508)<17,"Insuff.",SUM(D1508:F1508)) -> 18 | I1502: =COUNTIF(A:A,A1508) -> 1
A1503: 168244 | B1503: CONTE | C1503: PASQUALE | D1503: 3 | E1503: 2 | F1503: 3 | G1503: =IF(SUM(D1509:F1509)<17,"Insuff.",SUM(D1509:F1509)) -> Insuff. | I1503: =COUNTIF(A:A,A1509) -> 1
A1504: 184583 | B1504: CORRADINI | C1504: FEDERICO | D1504: 19 | E1504: 10 | F1504: 3 | G1504: =IF(SUM(D1510:F1510)<17,"Insuff.",SUM(D1510:F1510)) -> 32 | I1504: =COUNTIF(A:A,A1510) -> 1
A1505: 191116 | B1505: CURATOLA | C1505: GIOVANNI | D1505: 7 | E1505: 7 | F1505: 3 | G1505: =IF(SUM(D1511:F1511)<17,"Insuff.",SUM(D1511:F1511)) -> 17 | H1505: (*) | I1505: =COUNTIF(A:A,A1511) -> 1
A1506: 225170 | B1506: D'ALESSANDRO | C1506: MARCO | D1506: 7 | E1506: 8 | F1506: 3 | G1506: =IF(SUM(D1512:F1512)<17,"Insuff.",SUM(D1512:F1512)) -> 18 | I1506: =COUNTIF(A:A,A1512) -> 1
A1507: 218738 | B1507: DE BENEDETTO | C1507: JACOPO | D1507: 7 | E1507: 1 | F1507: 3 | G1507: =IF(SUM(D1513:F1513)<17,"Insuff.",SUM(D1513:F1513)) -> Insuff. | I1507: =COUNTIF(A:A,A1513) -> 1
A1508: 218094 | B1508: DE LUCA | C1508: PATRIZIA | D1508: 7 | E1508: 7 | F1508: 3 | G1508: =IF(SUM(D1514:F1514)<17,"Insuff.",SUM(D1514:F1514)) -> 17 | H1508: (*) | I1508: =COUNTIF(A:A,A1514) -> 1
A1509: 221093 | B1509: DE VITO | C1509: DIEGO | D1509: 12 | E1509: 6 | F1509: 3 | G1509: =IF(SUM(D1515:F1515)<17,"Insuff.",SUM(D1515:F1515)) -> 21 | I1509: =COUNTIF(A:A,A1515) -> 1
A1510: 221042 | B1510: DECORTE | C1510: ANDREA | D1510: 6 | E1510: 1 | F1510: 3 | G1510: =IF(SUM(D1516:F1516)<17,"Insuff.",SUM(D1516:F1516)) -> Insuff. | I1510: =COUNTIF(A:A,A1516) -> 1
A1511: 218250 | B1511: DELLA MOTTA | C1511: ALESSIO | D1511: 2 | E1511: 2 | F1511: 3 | G1511: =IF(SUM(D1517:F1517)<17,"Insuff.",SUM(D1517:F1517)) -> Insuff. | I1511: =COUNTIF(A:A,A1517) -> 1
A1512: 222801 | B1512: DI CARLO | C1512: DOMENICO | D1512: 13 | E1512: 5 | F1512: 3 | G1512: =IF(SUM(D1518:F1518)<17,"Insuff.",SUM(D1518:F1518)) -> 21 | I1512: =COUNTIF(A:A,A1518) -> 1
A1513: 163504 | B1513: DI GIACINTO | C1513: EDOARDO | D1513: 3 | E1513: 7 | F1513: 3 | G1513: =IF(SUM(D1519:F1519)<17,"Insuff.",SUM(D1519:F1519)) -> Insuff. | I1513: =COUNTIF(A:A,A1519) -> 1
A1514: 900022478 | B1514: DI GIOVANNI | C1514: FERDINANDO | D1514: 5 | E1514: 2 | F1514: 0 | G1514: =IF(SUM(D1520:F1520)<17,"Insuff.",SUM(D1520:F1520)) -> Insuff. | I1514: =COUNTIF(A:A,A1520) -> 2
A1515: 164368 | B1515: DI STANISLAO | C1515: ALESSANDRO | D1515: 4 | E1515: 6 | F1515: 3 | G1515: =IF(SUM(D1521:F1521)<17,"Insuff.",SUM(D1521:F1521)) -> Insuff. | I1515: =COUNTIF(A:A,A1521) -> 1
A1516: 218559 | B1516: D'IORIO | C1516: ANDREA | D1516: 19 | E1516: 8 | F1516: 3 | G1516: =IF(SUM(D1522:F1522)<17,"Insuff.",SUM(D1522:F1522)) -> 30 | I1516: =COUNTIF(A:A,A1522) -> 1
A1517: 900025666 | B1517: ENYEGUE | C1517: FRANCIS DECHERIBERT | D1517: 14 | E1517: 10 | F1517: 3 | G1517: =IF(SUM(D1523:F1523)<17,"Insuff.",SUM(D1523:F1523)) -> 27 | I1517: =COUNTIF(A:A,A1523) -> 1
A1518: 900026160 | B1518: ESPOSITO | C1518: GIOVANNI | D1518: 6 | E1518: 10 | F1518: 3 | G1518: =IF(SUM(D1524:F1524)<17,"Insuff.",SUM(D1524:F1524)) -> 19 | I1518: =COUNTIF(A:A,A1524) -> 1
A1519: 220692 | B1519: FAETANI | C1519: DANIELE | D1519: 15 | E1519: 9 | F1519: 3 | G1519: =IF(SUM(D1525:F1525)<17,"Insuff.",SUM(D1525:F1525)) -> 27 | I1519: =COUNTIF(A:A,A1525) -> 1
A1520: 217784 | B1520: FERRARI | C1520: MARCO | D1520: 16 | E1520: 1 | F1520: 3 | G1520: =IF(SUM(D1526:F1526)<17,"Insuff.",SUM(D1526:F1526)) -> 20 | I1520: =COUNTIF(A:A,A1526) -> 1
A1521: 218263 | B1521: FERRUZZI | C1521: SIMONE | D1521: 6 | E1521: 9 | F1521: 3 | G1521: =IF(SUM(D1527:F1527)<17,"Insuff.",SUM(D1527:F1527)) -> 18 | I1521: =COUNTIF(A:A,A1527) -> 1
A1522: 217189 | B1522: FONTANA | C1522: DAMIANO | D1522: 19 | E1522: 10 | F1522: 3 | G1522: =IF(SUM(D1528:F1528)<17,"Insuff.",SUM(D1528:F1528)) -> 32 | I1522: =COUNTIF(A:A,A1528) -> 1
A1523: 217157 | B1523: FONTANELLI | C1523: DAVIDE | D1523: 20 | E1523: 10 | F1523: 3 | G1523: =IF(SUM(D1529:F1529)<17,"Insuff.",SUM(D1529:F1529)) -> 33 | I1523: =COUNTIF(A:A,A1529) -> 1
A1524: 167583 | B1524: FRISULLO | C1524: FEDERICA MARIA | D1524: 3 | E1524: 6 | F1524: 3 | G1524: =IF(SUM(D1530:F1530)<17,"Insuff.",SUM(D1530:F1530)) -> Insuff. | I1524: =COUNTIF(A:A,A1530) -> 1
A1525: 220317 | B1525: GIAMMARINO | C1525: GIUSEPPE | D1525: 2 | E1525: 4 | F1525: 3 | G1525: =IF(SUM(D1531:F1531)<17,"Insuff.",SUM(D1531:F1531)) -> Insuff. | I1525: =COUNTIF(A:A,A1531) -> 1
A1526: 217281 | B1526: GRASSANO | C1526: UGO | D1526: 6 | E1526: 2 | F1526: 3 | G1526: =IF(SUM(D1532:F1532)<17,"Insuff.",SUM(D1532:F1532)) -> Insuff. | I1526: =COUNTIF(A:A,A1532) -> 1
A1527: 218082 | B1527: GRATTI | C1527: LUIGI | D1527: 3 | E1527: 3 | F1527: 3 | G1527: =IF(SUM(D1533:F1533)<17,"Insuff.",SUM(D1533:F1533)) -> Insuff. | I1527: =COUNTIF(A:A,A1533) -> 1
A1528: 167601 | B1528: HEIBI | C1528: FAYAD | D1528: 3 | E1528: 3 | F1528: 3 | G1528: =IF(SUM(D1534:F1534)<17,"Insuff.",SUM(D1534:F1534)) -> Insuff. | I1528: =COUNTIF(A:A,A1534) -> 1
A1529: 139629 | B1529: IMPOSIMATO | C1529: ARTURO | D1529: 5 | E1529: 0 | F1529: 3 | G1529: =IF(SUM(D1535:F1535)<17,"Insuff.",SUM(D1535:F1535)) -> Insuff. | I1529: =COUNTIF(A:A,A1535) -> 8
A1530: 224197 | B1530: LA ROTA | C1530: FRANCESCO MARIA | D1530: 14 | E1530: 9 | F1530: 3 | G1530: =IF(SUM(D1536:F1536)<17,"Insuff.",SUM(D1536:F1536)) -> 26 | I1530: =COUNTIF(A:A,A1536) -> 1
A1531: 217386 | B1531: LAMALFA | C1531: SALVATORE | D1531: 17 | E1531: 3 | F1531: 3 | G1531: =IF(SUM(D1537:F1537)<17,"Insuff.",SUM(D1537:F1537)) -> 23 | I1531: =COUNTIF(A:A,A1537) -> 1
A1532: 126073 | B1532: LEONE | C1532: MASSIMILIANO | D1532: 4 | E1532: 0 | F1532: 0 | G1532: =IF(SUM(D1538:F1538)<17,"Insuff.",SUM(D1538:F1538)) -> Insuff. | I1532: =COUNTIF(A:A,A1538) -> 3
A1533: 217252 | B1533: LIVINI | C1533: MARCO | D1533: 5 | E1533: 2 | F1533: 3 | G1533: =IF(SUM(D1539:F1539)<17,"Insuff.",SUM(D1539:F1539)) -> Insuff. | I1533: =COUNTIF(A:A,A1539) -> 1
A1534: 219487 | B1534: LOLLI | C1534: ANDREA | D1534: 4 | E1534: 4 | F1534: 3 | G1534: =IF(SUM(D1540:F1540)<17,"Insuff.",SUM(D1540:F1540)) -> Insuff. | I1534: =COUNTIF(A:A,A1540) -> 1
A1535: 223425 | B1535: LOVERRE | C1535: FRANCESCO | D1535: 9 | E1535: 2 | F1535: 3 | G1535: =IF(SUM(D1541:F1541)<17,"Insuff.",SUM(D1541:F1541)) -> Insuff. | I1535: =COUNTIF(A:A,A1541) -> 1
A1536: 113561 | B1536: LUCHENA | C1536: FRANCESCO | D1536: 19 | E1536: 7 | F1536: 3 | G1536: =IF(SUM(D1542:F1542)<17,"Insuff.",SUM(D1542:F1542)) -> 29 | I1536: =COUNTIF(A:A,A1542) -> 1
A1537: 218720 | B1537: MACAGNINO | C1537: DANIELE | D1537: 5 | E1537: 4 | F1537: 3 | G1537: =IF(SUM(D1543:F1543)<17,"Insuff.",SUM(D1543:F1543)) -> Insuff. | I1537: =COUNTIF(A:A,A1543) -> 1
A1538: 289158 | B1538: MACCOLINI | C1538: SILVIA | D1538: 5 | E1538: 10 | F1538: 3 | G1538: =IF(SUM(D1544:F1544)<17,"Insuff.",SUM(D1544:F1544)) -> 18 | I1538: =COUNTIF(A:A,A1544) -> 1
A1539: 227903 | B1539: MAISTO | C1539: LUCA | D1539: 5 | E1539: 9 | F1539: 3 | G1539: =IF(SUM(D1545:F1545)<17,"Insuff.",SUM(D1545:F1545)) -> 17 | H1539: (*) | I1539: =COUNTIF(A:A,A1545) -> 1
A1540: 218265 | B1540: MANCINI | C1540: LAURA | D1540: 18 | E1540: 9 | F1540: 3 | G1540: =IF(SUM(D1546:F1546)<17,"Insuff.",SUM(D1546:F1546)) -> 30 | I1540: =COUNTIF(A:A,A1546) -> 1
A1541: 900025017 | B1541: MANCO | C1541: SIMONE | D1541: 6 | E1541: 5 | F1541: 3 | G1541: =IF(SUM(D1547:F1547)<17,"Insuff.",SUM(D1547:F1547)) -> Insuff. | I1541: =COUNTIF(A:A,A1547) -> 1
A1542: 124220 | B1542: MANESE | C1542: STEFANO GUERINO | D1542: 2 | E1542: 3 | F1542: 0 | G1542: =IF(SUM(D1548:F1548)<17,"Insuff.",SUM(D1548:F1548)) -> Insuff. | I1542: =COUNTIF(A:A,A1548) -> 4
A1543: 225269 | B1543: MATTEI | C1543: ALESSANDRO | D1543: 16 | E1543: 8 | F1543: 3 | G1543: =IF(SUM(D1549:F1549)<17,"Insuff.",SUM(D1549:F1549)) -> 27 | I1543: =COUNTIF(A:A,A1549) -> 1
A1544: 158710 | B1544: MONACHINI | C1544: LORENZO | D1544: 14 | E1544: 2 | F1544: 3 | G1544: =IF(SUM(D1550:F1550)<17,"Insuff.",SUM(D1550:F1550)) -> 19 | I1544: =COUNTIF(A:A,A1550) -> 1
A1545: 218598 | B1545: NANNI | C1545: MARCO | D1545: 10 | E1545: 8 | F1545: 3 | G1545: =IF(SUM(D1551:F1551)<17,"Insuff.",SUM(D1551:F1551)) -> 21 | I1545: =COUNTIF(A:A,A1551) -> 1
A1546: 217043 | B1546: NARDELLI | C1546: LUCA | D1546: 19 | E1546: 5 | F1546: 3 | G1546: =IF(SUM(D1552:F1552)<17,"Insuff.",SUM(D1552:F1552)) -> 27 | I1546: =COUNTIF(A:A,A1552) -> 1
A1547: 107016 | B1547: NASILLI | C1547: NUNZIO | D1547: 3 | E1547: 8 | F1547: 0 | G1547: =IF(SUM(D1553:F1553)<17,"Insuff.",SUM(D1553:F1553)) -> Insuff. | I1547: =COUNTIF(A:A,A1553) -> 3
A1548: 2108059204 | B1548: ORTOLANI | C1548: MAURIZIO | D1548: 6 | E1548: 4 | F1548: 0 | G1548: =IF(SUM(D1554:F1554)<17,"Insuff.",SUM(D1554:F1554)) -> Insuff. | I1548: =COUNTIF(A:A,A1554) -> 2
A1549: 221504 | B1549: PACI | C1549: FRANCESCO | D1549: 18 | E1549: 10 | F1549: 3 | G1549: =IF(SUM(D1555:F1555)<17,"Insuff.",SUM(D1555:F1555)) -> 31 | I1549: =COUNTIF(A:A,A1555) -> 1
A1550: 217406 | B1550: PALOSSI | C1550: DANIELE | D1550: 11 | E1550: 5 | F1550: 3 | G1550: =IF(SUM(D1556:F1556)<17,"Insuff.",SUM(D1556:F1556)) -> 19 | I1550: =COUNTIF(A:A,A1556) -> 1
A1551: 219175 | B1551: PARCAROLI | C1551: STEFANO | D1551: 7 | E1551: 4 | F1551: 3 | G1551: =IF(SUM(D1557:F1557)<17,"Insuff.",SUM(D1557:F1557)) -> Insuff. | I1551: =COUNTIF(A:A,A1557) -> 1
A1552: 221593 | B1552: PEDICINI | C1552: FEDELE | D1552: 5 | E1552: 1 | F1552: 3 | G1552: =IF(SUM(D1558:F1558)<17,"Insuff.",SUM(D1558:F1558)) -> Insuff. | I1552: =COUNTIF(A:A,A1558) -> 1
A1553: 215458 | B1553: PERI | C1553: FRANCESCO | D1553: 19 | E1553: 6 | F1553: 3 | G1553: =IF(SUM(D1559:F1559)<17,"Insuff.",SUM(D1559:F1559)) -> 28 | I1553: =COUNTIF(A:A,A1559) -> 1
A1554: 221855 | B1554: PIETROBELLI | C1554: FRANCESCO | D1554: 14 | E1554: 10 | F1554: 3 | G1554: =IF(SUM(D1560:F1560)<17,"Insuff.",SUM(D1560:F1560)) -> 27 | I1554: =COUNTIF(A:A,A1560) -> 1
A1555: 900021517 | B1555: QIAO | C1555: XIN | D1555: 7 | E1555: 7 | F1555: 3 | G1555: =IF(SUM(D1561:F1561)<17,"Insuff.",SUM(D1561:F1561)) -> 17 | H1555: (*) | I1555: =COUNTIF(A:A,A1561) -> 1
A1556: 900025170 | B1556: ROMANO | C1556: MARCO BERNARDINO | D1556: 4 | E1556: 4 | F1556: 3 | G1556: =IF(SUM(D1562:F1562)<17,"Insuff.",SUM(D1562:F1562)) -> Insuff. | I1556: =COUNTIF(A:A,A1562) -> 1
A1557: 123698 | B1557: RUSSO | C1557: GABRIELLA | D1557: 5 | E1557: 7 | F1557: 3 | G1557: =IF(SUM(D1563:F1563)<17,"Insuff.",SUM(D1563:F1563)) -> Insuff. | I1557: =COUNTIF(A:A,A1563) -> 1
A1558: 157623 | B1558: SANTIN | C1558: LUCA | D1558: 7 | E1558: 7 | F1558: 3 | G1558: =IF(SUM(D1564:F1564)<17,"Insuff.",SUM(D1564:F1564)) -> 17 | H1558: (*) | I1558: =COUNTIF(A:A,A1564) -> 1
A1559: 217777 | B1559: SAVIOLI | C1559: ENRICO | D1559: 20 | E1559: 7 | F1559: 3 | G1559: =IF(SUM(D1565:F1565)<17,"Insuff.",SUM(D1565:F1565)) -> 30 | I1559: =COUNTIF(A:A,A1565) -> 1
A1560: 220716 | B1560: SELVAGNO | C1560: ALESSANDRO | D1560: 18 | E1560: 7 | F1560: 3 | G1560: =IF(SUM(D1566:F1566)<17,"Insuff.",SUM(D1566:F1566)) -> 28 | I1560: =COUNTIF(A:A,A1566) -> 1
A1561: 217476 | B1561: SIBANI | C1561: GABRIELE | D1561: 11 | E1561: 3 | F1561: 3 | G1561: =IF(SUM(D1567:F1567)<17,"Insuff.",SUM(D1567:F1567)) -> 17 | H1561: (*) | I1561: =COUNTIF(A:A,A1567) -> 1
A1562: 900020757 | B1562: SIMO DJILO | C1562: ZACHARIE | D1562: 11 | E1562: 3 | F1562: 3 | G1562: =IF(SUM(D1568:F1568)<17,"Insuff.",SUM(D1568:F1568)) -> 17 | H1562: (*) | I1562: =COUNTIF(A:A,A1568) -> 1
A1563: 219400 | B1563: TABARONI | C1563: ANDREA | D1563: 6 | E1563: 9 | F1563: 3 | G1563: =IF(SUM(D1569:F1569)<17,"Insuff.",SUM(D1569:F1569)) -> 18 | I1563: =COUNTIF(A:A,A1569) -> 1
A1564: 185954 | B1564: TALLA FOKO | C1564: ROGER | D1564: 4 | E1564: 1 | F1564: 3 | G1564: =IF(SUM(D1570:F1570)<17,"Insuff.",SUM(D1570:F1570)) -> Insuff. | I1564: =COUNTIF(A:A,A1570) -> 1
A1565: 216387 | B1565: TERZINI | C1565: MARIO | D1565: 14 | E1565: 10 | F1565: 3 | G1565: =IF(SUM(D1571:F1571)<17,"Insuff.",SUM(D1571:F1571)) -> 27 | I1565: =COUNTIF(A:A,A1571) -> 1
A1566: 180234 | B1566: TICCA | C1566: NICOLA | D1566: 14 | E1566: 0 | F1566: 3 | G1566: =IF(SUM(D1572:F1572)<17,"Insuff.",SUM(D1572:F1572)) -> 17 | H1566: (*) | I1566: =COUNTIF(A:A,A1572) -> 1
A1567: 900025844 | B1567: TOMMASI | C1567: PIERPAOLO | D1567: 5 | E1567: 0 | F1567: 3 | G1567: =IF(SUM(D1573:F1573)<17,"Insuff.",SUM(D1573:F1573)) -> Insuff. | I1567: =COUNTIF(A:A,A1573) -> 1
A1568: 221646 | B1568: TURRINI | C1568: ANDREA | D1568: 13 | E1568: 3 | F1568: 3 | G1568: =IF(SUM(D1574:F1574)<17,"Insuff.",SUM(D1574:F1574)) -> 19 | I1568: =COUNTIF(A:A,A1574) -> 1
A1569: 162366 | B1569: VAGNARELLI | C1569: VALERIO | D1569: 4 | E1569: 4 | F1569: 0 | G1569: =IF(SUM(D1575:F1575)<17,"Insuff.",SUM(D1575:F1575)) -> Insuff. | I1569: =COUNTIF(A:A,A1575) -> 3
A1570: 179677 | B1570: VERDICCHIA | C1570: QUINTINO | D1570: 19 | E1570: 2 | F1570: 3 | G1570: =IF(SUM(D1576:F1576)<17,"Insuff.",SUM(D1576:F1576)) -> 24 | I1570: =COUNTIF(A:A,A1576) -> 1
A1571: 271759 | B1571: ZAMPOLINI | C1571: GIANFRANCO | D1571: 7 | E1571: 10 | F1571: 3 | G1571: =IF(SUM(D1577:F1577)<17,"Insuff.",SUM(D1577:F1577)) -> 20 | I1571: =COUNTIF(A:A,A1577) -> 1
A1572: 123295 | B1572: ZANELLI | C1572: DIEGO | D1572: 14 | E1572: 7 | F1572: 3 | G1572: =IF(SUM(D1578:F1578)<17,"Insuff.",SUM(D1578:F1578)) -> 24 | I1572: =COUNTIF(A:A,A1578) -> 1
A1573: (*) Puo' registrare 18.