A1: Fondamenti di Ricerca Operativa L-A
A2: Prova Scritta del 21 Dicembre 2004
A4: Validita': fino a Aprile 2005.
A5: Visione degli elaborati e orali: lunedi' 10 Gennaio 2005, ore 15.00, Aula 56
A6: Prossimo appello: Marzo
A8: matricola | B8: Cognome | C8: Nome | D8: 1 | E8: 2 | F8: bonus | G8: voto
A9: 123594 | B9: BALDUCCI | C9: DANIELE | D9: 13 | E9: 8 | F9: 0 | G9: =IF(SUM(D9:F9)<18,"Insuff.",SUM(D9:F9)) -> 21
A10: 122282 | B10: BETTI | C10: ALESSANDRO | D10: 12 | E10: 0 | F10: 0 | G10: =IF(SUM(D10:F10)<18,"Insuff.",SUM(D10:F10)) -> Insuff.
A11: 900003191 | B11: DI STEFANO | C11: NUNZIO | D11: 19 | E11: 4 | F11: 0 | G11: =IF(SUM(D11:F11)<18,"Insuff.",SUM(D11:F11)) -> 23
A12: 127861 | B12: GELSUMINO | C12: ERIKA | D12: 15 | E12: 2 | F12: 0 | G12: 17 | H12: *
A13: 139629 | B13: IMPOSIMATO | C13: ARTURO | D13: 8 | E13: 0 | F13: 0 | G13: =IF(SUM(D13:F13)<18,"Insuff.",SUM(D13:F13)) -> Insuff.
A14: 131127 | B14: LEFEMINE | C14: VITO | D14: 16 | E14: 4 | F14: 0 | G14: =IF(SUM(D14:F14)<18,"Insuff.",SUM(D14:F14)) -> 20
A15: 107899 | B15: MALVASIO | C15: ELISA | D15: 9 | E15: 0 | F15: 0 | G15: =IF(SUM(D15:F15)<18,"Insuff.",SUM(D15:F15)) -> Insuff.
A16: 110691 | B16: MINGHETTI | C16: ELISA | D16: 9 | E16: 0 | F16: 0 | G16: =IF(SUM(D16:F16)<18,"Insuff.",SUM(D16:F16)) -> Insuff.
A17: 900005606 | B17: OCCHIPINTI | C17: ANDREA | D17: 16 | E17: 7 | F17: 0 | G17: =IF(SUM(D17:F17)<18,"Insuff.",SUM(D17:F17)) -> 23
A18: 139463 | B18: PALMUCCI | C18: MASSIMILIANO | D18: 18 | E18: 0 | F18: 0 | G18: =IF(SUM(D18:F18)<18,"Insuff.",SUM(D18:F18)) -> 18
A19: 2148062353 | B19: PIKASSIS | C19: CRISTINA CATERINA | D19: 18 | E19: 8 | F19: 0 | G19: =IF(SUM(D19:F19)<18,"Insuff.",SUM(D19:F19)) -> 26
A20: 148973 | B20: PINTO | C20: ALBERTO | D20: 15 | E20: 7 | F20: 0 | G20: =IF(SUM(D20:F20)<18,"Insuff.",SUM(D20:F20)) -> 22
A21: 128176 | B21: ROSADA | C21: GIOVANNI BATTISTA | D21: 14 | E21: 0 | F21: 0 | G21: =IF(SUM(D21:F21)<18,"Insuff.",SUM(D21:F21)) -> Insuff.
A22: 900007158 | B22: SAPORITO | C22: MASSIMILIANO | D22: 16 | E22: 1 | F22: 0 | G22: 17 | H22: *
A23: 140069 | B23: SPECA | C23: YARI | D23: 10 | E23: 7 | F23: 0 | G23: 17 | H23: *
A24: 126571 | B24: TILLI | C24: PRIMO | D24: 10 | E24: 7 | F24: 0 | G24: 17 | H24: *
A25: 900003862 | B25: ZECCA | C25: PARIDE | D25: 6 | E25: 1 | F25: 0 | G25: =IF(SUM(D25:F25)<18,"Insuff.",SUM(D25:F25)) -> Insuff.
A26: * Puo' registrare 18