A1: Fondamenti di Ricerca Operativa L-A
A2: Prova Scritta del 4 Aprile 2003
A4: Validita': fino a Luglio 2003
A5: Visione degli elaborati e orali:Martedi' 15 Aprile ore 14.00 Aula 6.1
A6: Prossimi appelli: Giugno, Luglio
A8: matricola | B8: Cognome | C8: Nome | D8: 1 | E8: 2 | F8: 3 | G8: bonus | H8: voto
A9: 122160 | B9: ACQUAVIVA | C9: LUCA | D9: 14 | E9: 7 | G9: 3 | H9: =D9+E9+F9+G9 -> 24
A10: 127356 | B10: AGRESTI | C10: SERENA | D10: 13 | E10: 10 | G10: 0 | H10: =D10+E10+F10+G10 -> 23
A11: 124205 | B11: AMANTINI | C11: ANDREA | D11: 18 | E11: 5 | G11: 3 | H11: =D11+E11+F11+G11 -> 26
A12: 2148059358 | B12: ANGELINI | C12: CLAUDIO | D12: 10 | E12: 4 | G12: 3 | H12: =D12+E12+F12+G12 -> 17 | I12: *
A13: 127370 | B13: ARGENTIERO | C13: STEFANO | D13: 18 | E13: 10 | G13: 0 | H13: =D13+E13+F13+G13 -> 28
A14: 124834 | B14: AVOLESE | C14: MARIO | D14: 20 | E14: 3 | G14: 3 | H14: =D14+E14+F14+G14 -> 26
A15: 127940 | B15: BABINI | C15: MARTINA | D15: 13 | E15: 10 | G15: 0 | H15: =D15+E15+F15+G15 -> 23
A16: 123594 | B16: BALDUCCI | C16: DANIELE | D16: 12 | E16: 8 | G16: 0 | H16: =D16+E16+F16+G16 -> 20
A17: 123833 | B17: BARONCINI | C17: DANIELE | D17: 14 | E17: 9 | G17: 0 | H17: =D17+E17+F17+G17 -> 23
A18: 127287 | B18: BARRANO | C18: EMANUELE | D18: 5 | E18: 4 | G18: 0 | H18: Insuff.
A19: 121895 | B19: BASSINI | C19: ILARIA | D19: 16 | E19: 10 | G19: 0 | H19: =D19+E19+F19+G19 -> 26
A20: 122915 | B20: BELLINI | C20: MARCO | D20: 20 | E20: 8 | G20: 0 | H20: =D20+E20+F20+G20 -> 28
A21: 123738 | B21: BERGONZINI | C21: CARLO | D21: 20 | E21: 10 | G21: 3 | H21: =D21+E21+F21+G21 -> 33
A22: 2148061513 | B22: BERNABEI | C22: CHIARA | D22: 8 | E22: 7 | G22: 3 | H22: =D22+E22+F22+G22 -> 18
A23: 2108060319 | B23: BERTOLINI | C23: MONICA | D23: 16 | G23: 1 | H23: =D23+E23+F23+G23 -> 17 | I23: * | J23: ***
A24: 122282 | B24: BETTI | C24: ALESSANDRO | D24: 11 | E24: 3 | G24: 3 | H24: =D24+E24+F24+G24 -> 17 | I24: *
A25: 126705 | B25: BONOLI | C25: NICOLA | D25: 9 | E25: 10 | G25: 3 | H25: =D25+E25+F25+G25 -> 22
A26: 122560 | B26: BRICCHI | C26: LORENZO | D26: 18 | E26: 10 | G26: 0 | H26: =D26+E26+F26+G26 -> 28
A27: 122490 | B27: BRUNETTI | C27: LUCA | D27: 9 | E27: 6 | G27: 0 | H27: Insuff.
A28: 121741 | B28: BUCCI | C28: DAVIDE | D28: 18 | E28: 0 | G28: 1 | H28: =D28+E28+F28+G28 -> 19 | J28: ***
A29: 112432 | B29: CANESTRARI | C29: RAFFAELE | D29: 9 | E29: 6 | G29: 3 | H29: =D29+E29+F29+G29 -> 18
A30: 122942 | B30: CARPENE' | C30: MICHELE | D30: 12 | E30: 6 | G30: 1 | H30: =D30+E30+F30+G30 -> 19 | J30: ***
A31: 2148063596 | B31: CARPIGNOLI | C31: ANDREA | D31: 20 | E31: 4 | G31: 3 | H31: =D31+E31+F31+G31 -> 27
A32: 122897 | B32: CASSANELLI | C32: FABIO | D32: 4 | E32: 6 | G32: 3 | H32: Insuff.
A33: 2148063627 | B33: CIACCI | C33: LUCA | D33: 12 | E33: 6 | G33: 3 | H33: =D33+E33+F33+G33 -> 21
A34: 125550 | B34: COLOMBINI | C34: GABRIELE | D34: 20 | E34: 10 | G34: 3 | H34: =D34+E34+F34+G34 -> 33
A35: 121561 | B35: CONSOLE | C35: MIRKO | D35: 10 | E35: 8 | G35: 3 | H35: =D35+E35+F35+G35 -> 21
A36: 114918 | B36: CORSINI | C36: ALESSIO | D36: 2 | E36: 10 | G36: 0 | H36: Insuff.
A37: 123341 | B37: CORTECCHIA | C37: SIMONE | D37: 10 | E37: 10 | G37: 3 | H37: =D37+E37+F37+G37 -> 23
A38: 124787 | B38: CRESCENTINI | C38: EMANUELE | D38: 20 | E38: 8 | G38: 3 | H38: =D38+E38+F38+G38 -> 31
A39: 104911 | B39: DE MARCO | C39: ANDREA | D39: 10 | E39: 9 | G39: 3 | H39: =D39+E39+F39+G39 -> 22
A40: 2148064641 | B40: DEGLIESPOSTI | C40: FRANCESCO | D40: 11 | E40: 10 | G40: 3 | H40: =D40+E40+F40+G40 -> 24
A41: 121471 | B41: DI CARLO | C41: MATTEO | D41: 20 | E41: 10 | G41: 3 | H41: =D41+E41+F41+G41 -> 33
A42: 121743 | B42: DI CREDICO | C42: FEDERICO | D42: 19 | E42: 10 | G42: 0 | H42: =D42+E42+F42+G42 -> 29
A43: 123763 | B43: DI PIETRO | C43: AZZURRA | D43: 15 | E43: 10 | G43: 3 | H43: =D43+E43+F43+G43 -> 28
A44: 104572 | B44: DI RIENZO | C44: MICHELE | D44: 14 | E44: 8 | G44: 3 | H44: =D44+E44+F44+G44 -> 25
A45: 125672 | B45: DOLIF | C45: EMILIANO | D45: 17 | E45: 10 | G45: 0 | H45: =D45+E45+F45+G45 -> 27
A46: 122344 | B46: FOSCHI | C46: DAVIDE | D46: 10 | E46: 8 | G46: 3 | H46: =D46+E46+F46+G46 -> 21
A47: 121701 | B47: GATTARI | C47: GABRIELE | D47: 15 | E47: 7 | G47: 0 | H47: =D47+E47+F47+G47 -> 22
A48: 2148064429 | B48: GENTILI | C48: PAOLO | D48: 15 | E48: 10 | G48: 0 | H48: =D48+E48+F48+G48 -> 25
A49: 128819 | B49: GIGANTE | C49: PAOLO | D49: 15 | E49: 8 | G49: 0 | H49: =D49+E49+F49+G49 -> 23
A50: 2148062452 | B50: GIORGI | C50: GIANMARCO | D50: 16 | E50: 3 | G50: 3 | H50: =D50+E50+F50+G50 -> 22
A51: 2148062024 | B51: GIOVACCHINI | C51: PARIDE | D51: 3 | E51: 8 | G51: 3 | H51: Insuff.
A52: 121979 | B52: GOTTARDI | C52: GIANPAOLO | D52: 11 | E52: 7 | G52: 0 | H52: =D52+E52+F52+G52 -> 18
A53: 122284 | B53: GRUPPIONI | C53: EMANUELE | D53: 17 | E53: 6 | G53: 0 | H53: =D53+E53+F53+G53 -> 23
A54: 121673 | B54: GUADAGNO | C54: POTITO | D54: 17 | E54: 6 | G54: 0 | H54: =D54+E54+F54+G54 -> 23
A55: 107852 | B55: HUYNH | C55: HOANG CHAU | D55: 10 | E55: 6 | G55: 3 | H55: =D55+E55+F55+G55 -> 19
A56: 122738 | B56: LEARDINI | C56: FRANCESCO | D56: 18 | E56: 6 | G56: 0 | H56: =D56+E56+F56+G56 -> 24
A57: 128035 | B57: LEONETTI | C57: FRANCESCO | D57: 20 | E57: 8 | G57: 0 | H57: =D57+E57+F57+G57 -> 28
A58: 900003528 | B58: LOSARDO | C58: AGOSTINO | D58: 20 | E58: 10 | G58: 0 | H58: =D58+E58+F58+G58 -> 30
A59: 127588 | B59: MANCA | C59: MARA | D59: 10 | E59: 7 | G59: 3 | H59: =D59+E59+F59+G59 -> 20
A60: 2146063842 | B60: MANCINI | C60: ELISA | D60: 19 | E60: 7 | G60: 3 | H60: =D60+E60+F60+G60 -> 29
A61: 123804 | B61: MANSERVISI | C61: ALBERTO | D61: 20 | E61: 7 | G61: 0 | H61: =D61+E61+F61+G61 -> 27
A62: 127966 | B62: MERCATI | C62: ALBERTO | D62: 19 | E62: 9 | G62: 0 | H62: =D62+E62+F62+G62 -> 28
A63: 2147059008 | B63: MINOTTI | C63: LORENZO | D63: 11 | E63: 0 | G63: 3 | H63: Insuff.
A64: 121960 | B64: MIRANDOLA | C64: ALEX | D64: 20 | E64: 10 | G64: 0 | H64: =D64+E64+F64+G64 -> 30
A65: 123175 | B65: MONROY | C65: RICARDO | D65: 10 | E65: 5 | G65: 0 | H65: Insuff.
A66: 112663 | B66: MONTAUTI | C66: ANDREA | D66: 20 | E66: 9 | G66: 3 | H66: =D66+E66+F66+G66 -> 32
A67: 123368 | B67: PASINI | C67: ENRICO | D67: 18 | E67: 9 | G67: 3 | H67: =D67+E67+F67+G67 -> 30
A68: 124882 | B68: PIZZI | C68: ANGELO | D68: 14 | E68: 2 | G68: 3 | H68: =D68+E68+F68+G68 -> 19
A69: 2148060217 | B69: RIVALTA | C69: STEFANO | D69: 16 | E69: 6 | G69: 3 | H69: =D69+E69+F69+G69 -> 25
A70: 2142062040 | B70: ROBIATI | C70: IVAN | D70: 17 | E70: 10 | G70: 3 | H70: =D70+E70+F70+G70 -> 30
A71: 2148062084 | B71: ROCCIA | C71: MARIA TERESA | D71: 18 | E71: 7 | G71: 3 | H71: =D71+E71+F71+G71 -> 28
A72: 124273 | B72: ROMANELLI | C72: ELIO | D72: 11 | E72: 0 | G72: 3 | H72: Insuff.
A73: 125474 | B73: ROSSINI | C73: PROSPERO | D73: 15 | E73: 2 | G73: 3 | H73: =D73+E73+F73+G73 -> 20
A74: 2108057373 | B74: RUSSO | C74: ROBERTO | D74: 9 | E74: 5 | G74: 3 | H74: =D74+E74+F74+G74 -> 17 | I74: *
A75: 121465 | B75: SALICETTI | C75: ANDREA | D75: 16 | E75: 5 | G75: 3 | H75: =D75+E75+F75+G75 -> 24
A76: 106141 | B76: SANTINI | C76: MATTEO | D76: 11 | E76: 1 | G76: 3 | H76: Insuff.
A77: 123119 | B77: SPOLZINO | C77: SIMONE | D77: 20 | E77: 10 | G77: 3 | H77: =D77+E77+F77+G77 -> 33
A78: 900000355 | B78: SREPFLER | C78: SRGJAN | D78: 6 | E78: 5 | G78: 3 | H78: Insuff.
A79: ?????? | B79: SUCCI | C79: FEDERICO | D79: 15 | E79: 5 | G79: 3 | H79: =D79+E79+F79+G79 -> 23
A80: 108213 | B80: SUPERGA | C80: FULVIO | D80: 15 | E80: 3 | G80: 3 | H80: =D80+E80+F80+G80 -> 21
A81: 123238 | B81: TAMAGNINI | C81: STEFANO | D81: 15 | E81: 5 | G81: 3 | H81: =D81+E81+F81+G81 -> 23
A82: 123007 | B82: TARONI | C82: MAURO | D82: 9 | E82: 9 | G82: 3 | H82: =D82+E82+F82+G82 -> 21
A83: 125501 | B83: UBERTINI | C83: GABRIELE | D83: 17 | E83: 10 | G83: 3 | H83: =D83+E83+F83+G83 -> 30
A84: 108113 | B84: VERNA | C84: GERARDO | D84: 8 | E84: 6 | G84: 3 | H84: =D84+E84+F84+G84 -> 17 | I84: *
A85: 128027 | B85: VIOLI | C85: VALENTINA | D85: 12 | E85: 2 | G85: 0 | H85: Insuff.
A86: 125471 | B86: VITALE | C86: VINCENZO | D86: 13 | E86: 7 | G86: 3 | H86: =D86+E86+F86+G86 -> 23
A87: 122074 | B87: VOLI | C87: STEFANO 12 | E87: 3 | G87: 0 | H87: Insuff.
A88: 121870 | B88: ZANELLA | C88: NICOLA | D88: 20 | E88: 6 | G88: 0 | H88: =D88+E88+F88+G88 -> 26
A89: * = ammesso all'orale
A90: *** = testo non riconsegnato