A1: Fondamenti di Ricerca Operativa L-A
A2: Prova Scritta del 10 Gennaio 2006
A4: Validita' per chi registra direttamente il voto: fino a venerdi' 20 Gennaio 2006
A5: (non procrastinabile; non si risponde a mail o telefonate in merito).
A7: Validita' per chi sostiene l'orale: fino all'appello di Giugno 2006.
A8: Visione degli elaborati e orali: venerdi' 20 Gennaio 2006, ore 14.30, Aula 61
A9: Prossimi appelli: Aprile 2006, Giugno 2006, Luglio 2006
A11: matricola | B11: Cognome | C11: Nome | D11: 1 | E11: 2 | F11: bonus | G11: voto
A12: 900018756 | B12: ACETO | C12: GIACOMO | D12: 20 | E12: 9 | F12: 3 | G12: =IF(SUM(D12:F12)<18,"Insuff.",SUM(D12:F12)) -> 32
A13: 169499 | B13: ALDROVANDI | C13: DAVIDE | D13: 7 | E13: 9 | F13: 3 | G13: =IF(SUM(D13:F13)<18,"Insuff.",SUM(D13:F13)) -> 19
A14: 140884 | B14: ARDONDI | C14: ROBERTO | D14: 6 | E14: 2 | F14: 0 | G14: =IF(SUM(D14:F14)<18,"Insuff.",SUM(D14:F14)) -> Insuff.
A15: 190497 | B15: BAGNINI | C15: DIANA | D15: 8 | E15: 6 | F15: 3 | G15: 17 | H15: *
A16: 180540 | B16: BELLOMARIA | C16: JONATHAN | D16: 10 | E16: 8 | F16: 3 | G16: =IF(SUM(D16:F16)<18,"Insuff.",SUM(D16:F16)) -> 21
A17: 161536 | B17: BEZZI | C17: FRANCESCO | D17: 7 | E17: 8 | F17: 0 | G17: =IF(SUM(D17:F17)<18,"Insuff.",SUM(D17:F17)) -> Insuff.
A18: 180445 | B18: BONDI | C18: ANDREA | D18: 17 | E18: 6 | F18: 3 | G18: =IF(SUM(D18:F18)<18,"Insuff.",SUM(D18:F18)) -> 26
A19: 180851 | B19: BONETTI | C19: STEFANO | D19: 18 | E19: 9 | F19: 0 | G19: =IF(SUM(D19:F19)<18,"Insuff.",SUM(D19:F19)) -> 27
A20: 184823 | B20: BOSCHETTI | C20: NICOLA | D20: 15 | E20: 9 | F20: 3 | G20: =IF(SUM(D20:F20)<18,"Insuff.",SUM(D20:F20)) -> 27
A21: 160989 | B21: CAPUTO | C21: SIMONE | D21: 10 | E21: 0 | F21: 3 | G21: =IF(SUM(D21:F21)<18,"Insuff.",SUM(D21:F21)) -> Insuff.
A22: 179941 | B22: CARDONE | C22: GIUSEPPE | D22: 15 | E22: 10 | F22: 0 | G22: =IF(SUM(D22:F22)<18,"Insuff.",SUM(D22:F22)) -> 25
A23: 157315 | B23: CASCINI | C23: ALESSANDRO | D23: 7 | E23: 3 | F23: 3 | G23: =IF(SUM(D23:F23)<18,"Insuff.",SUM(D23:F23)) -> Insuff.
A24: 179852 | B24: CHIEFFO | C24: NICOLO' | D24: 9 | E24: 10 | F24: 3 | G24: =IF(SUM(D24:F24)<18,"Insuff.",SUM(D24:F24)) -> 22
A25: 192644 | B25: CIAMBERLANO | C25: FABRIZIO | D25: 8 | E25: 0 | F25: 0 | G25: =IF(SUM(D25:F25)<18,"Insuff.",SUM(D25:F25)) -> Insuff.
A26: 159962 | B26: CIARROCCHI | C26: PAOLO | D26: 10 | E26: 1 | F26: 3 | G26: =IF(SUM(D26:F26)<18,"Insuff.",SUM(D26:F26)) -> Insuff.
A27: 186224 | B27: CILLI | C27: SIMONE | D27: 14 | E27: 10 | F27: 3 | G27: =IF(SUM(D27:F27)<18,"Insuff.",SUM(D27:F27)) -> 27
A28: 164846 | B28: COCCI | C28: GIACOMO | D28: 7 | E28: 10 | F28: 0 | G28: 17 | H28: *
A29: 183256 | B29: COLLINA | C29: MATTEO | D29: 14 | E29: 9 | F29: 3 | G29: =IF(SUM(D29:F29)<18,"Insuff.",SUM(D29:F29)) -> 26
A30: 183787 | B30: COLUCCIO | C30: ROBERTO | D30: 14 | E30: 4 | F30: 3 | G30: =IF(SUM(D30:F30)<18,"Insuff.",SUM(D30:F30)) -> 21
A31: 178651 | B31: CRISTIANI | C31: ALESSANDRO | D31: 9 | E31: 3 | F31: 0 | G31: =IF(SUM(D31:F31)<18,"Insuff.",SUM(D31:F31)) -> Insuff.
A32: 160436 | B32: D'AGOSTINO | C32: STEFANO | D32: 8 | E32: 7 | F32: 0 | G32: =IF(SUM(D32:F32)<18,"Insuff.",SUM(D32:F32)) -> Insuff.
A33: 179774 | B33: DAMIAN | C33: MICHELE | D33: 19 | E33: 3 | F33: 3 | G33: =IF(SUM(D33:F33)<18,"Insuff.",SUM(D33:F33)) -> 25
A34: 159335 | B34: D'APOTE | C34: LEONARDO | D34: 15 | E34: 4 | F34: 0 | G34: =IF(SUM(D34:F34)<18,"Insuff.",SUM(D34:F34)) -> 19
A35: 184515 | B35: DI BACCO | C35: MARIO | D35: 15 | E35: 8 | F35: 3 | G35: =IF(SUM(D35:F35)<18,"Insuff.",SUM(D35:F35)) -> 26
A36: 183628 | B36: DI GIACOMO | C36: MATTEO | D36: 15 | E36: 7 | F36: 0 | G36: =IF(SUM(D36:F36)<18,"Insuff.",SUM(D36:F36)) -> 22
A37: 164447 | B37: DINAPOLI | C37: ANTONIO | D37: 8 | E37: 8 | F37: 3 | G37: =IF(SUM(D37:F37)<18,"Insuff.",SUM(D37:F37)) -> 19
A38: 163699 | B38: FALCONE | C38: FRANCESCO | D38: 14 | E38: 1 | F38: 0 | G38: =IF(SUM(D38:F38)<18,"Insuff.",SUM(D38:F38)) -> Insuff.
A39: 168981 | B39: FALGHERI | C39: GIUSEPPE | D39: 15 | E39: 0 | F39: 0 | G39: =IF(SUM(D39:F39)<18,"Insuff.",SUM(D39:F39)) -> Insuff.
A40: 166694 | B40: FARACI | C40: FABIO | D40: 6 | E40: 3 | F40: 0 | G40: =IF(SUM(D40:F40)<18,"Insuff.",SUM(D40:F40)) -> Insuff.
A41: 179314 | B41: FARISELLI | C41: NICOLO' | D41: 17 | E41: 4 | F41: 3 | G41: =IF(SUM(D41:F41)<18,"Insuff.",SUM(D41:F41)) -> 24
A42: 158218 | B42: GASBARRO | C42: DAVIDE | D42: 13 | E42: 7 | F42: 0 | G42: =IF(SUM(D42:F42)<18,"Insuff.",SUM(D42:F42)) -> 20
A43: 179487 | B43: GIONFALO | C43: FRANCESCO | D43: 10 | E43: 0 | F43: 3 | G43: =IF(SUM(D43:F43)<18,"Insuff.",SUM(D43:F43)) -> Insuff.
A44: 189531 | B44: GIULIANI | C44: PIERPAOLO | D44: 20 | E44: 10 | F44: 3 | G44: =IF(SUM(D44:F44)<18,"Insuff.",SUM(D44:F44)) -> 33
A45: 161018 | B45: GUERRINI | C45: ALESSANDRO | D45: 19 | E45: 7 | F45: 3 | G45: =IF(SUM(D45:F45)<18,"Insuff.",SUM(D45:F45)) -> 29
A46: 139629 | B46: IMPOSIMATO | C46: ARTURO | D46: 7 | E46: 0 | F46: 0 | G46: =IF(SUM(D46:F46)<18,"Insuff.",SUM(D46:F46)) -> Insuff.
A47: 181832 | B47: KOUSSIS | C47: JONATHAN | D47: 8 | E47: 6 | F47: 3 | G47: 17 | H47: *
A48: 138627 | B48: MACCAFERRI | C48: DAVIDE | D48: 3 | E48: 1 | F48: 0 | G48: =IF(SUM(D48:F48)<18,"Insuff.",SUM(D48:F48)) -> Insuff.
A49: 168278 | B49: MACRI | C49: PAOLO | D49: 4 | E49: 10 | F49: 0 | G49: =IF(SUM(D49:F49)<18,"Insuff.",SUM(D49:F49)) -> Insuff.
A50: 107899 | B50: MALVASIO | C50: ELISA | D50: 10 | E50: 1 | F50: 0 | G50: =IF(SUM(D50:F50)<18,"Insuff.",SUM(D50:F50)) -> Insuff.
A51: 900016607 | B51: MANCINI | C51: STEFANO | D51: 16 | E51: 4 | F51: 3 | G51: =IF(SUM(D51:F51)<18,"Insuff.",SUM(D51:F51)) -> 23
A52: 182984 | B52: MATALONI | C52: GIACOMO | D52: 15 | E52: 6 | F52: 0 | G52: =IF(SUM(D52:F52)<18,"Insuff.",SUM(D52:F52)) -> 21
A53: 178842 | B53: MATTIOLI | C53: SIMONE | D53: 20 | E53: 4 | F53: 3 | G53: =IF(SUM(D53:F53)<18,"Insuff.",SUM(D53:F53)) -> 27
A54: 110691 | B54: MINGHETTI | C54: ELISA | D54: 5 | E54: 0 | F54: 0 | G54: =IF(SUM(D54:F54)<18,"Insuff.",SUM(D54:F54)) -> Insuff.
A55: 180716 | B55: MODENESE | C55: MARCO | D55: 15 | E55: 3 | F55: 3 | G55: =IF(SUM(D55:F55)<18,"Insuff.",SUM(D55:F55)) -> 21
A56: 157115 | B56: MOLITERNI | C56: ANDREA | D56: 19 | E56: 10 | F56: 0 | G56: =IF(SUM(D56:F56)<18,"Insuff.",SUM(D56:F56)) -> 29
A57: 178435 | B57: MONTANARI | C57: MARCO | D57: 15 | E57: 7 | F57: 3 | G57: =IF(SUM(D57:F57)<18,"Insuff.",SUM(D57:F57)) -> 25
A58: 158022 | B58: PALMISANO | C58: GIOVANNI | D58: 20 | E58: 7 | F58: 0 | G58: =IF(SUM(D58:F58)<18,"Insuff.",SUM(D58:F58)) -> 27
A59: 179333 | B59: PETTAZZONI | C59: BARBARA | D59: 20 | E59: 10 | F59: 3 | G59: =IF(SUM(D59:F59)<18,"Insuff.",SUM(D59:F59)) -> 33
A60: 180982 | B60: PIETRELLI | C60: LUCA | D60: 11 | E60: 0 | F60: 3 | G60: =IF(SUM(D60:F60)<18,"Insuff.",SUM(D60:F60)) -> Insuff.
A61: 182697 | B61: POLIDORI | C61: MASSIMO | D61: 11 | E61: 0 | F61: 3 | G61: =IF(SUM(D61:F61)<18,"Insuff.",SUM(D61:F61)) -> Insuff.
A62: 184277 | B62: RAPINO | C62: DAVIDE | D62: 7 | E62: 0 | F62: 0 | G62: =IF(SUM(D62:F62)<18,"Insuff.",SUM(D62:F62)) -> Insuff.
A63: 182012 | B63: RIA | C63: LUIGI | D63: 15 | E63: 1 | F63: 3 | G63: =IF(SUM(D63:F63)<18,"Insuff.",SUM(D63:F63)) -> 19
A64: 900021037 | B64: ROSSETTI | C64: MATTEO | D64: 19 | E64: 5 | F64: 3 | G64: =IF(SUM(D64:F64)<18,"Insuff.",SUM(D64:F64)) -> 27
A65: 138633 | B65: ROSSI | C65: ANTONELLO | D65: 12 | E65: 0 | F65: 0 | G65: =IF(SUM(D65:F65)<18,"Insuff.",SUM(D65:F65)) -> Insuff.
A66: 184040 | B66: SACCO | C66: ALEX | D66: 12 | E66: 0 | F66: 0 | G66: =IF(SUM(D66:F66)<18,"Insuff.",SUM(D66:F66)) -> Insuff.
A67: 183225 | B67: SCALET | C67: RICCARDO | D67: 17 | E67: 10 | F67: 3 | G67: =IF(SUM(D67:F67)<18,"Insuff.",SUM(D67:F67)) -> 30
A68: 178426 | B68: SOLA | C68: ALESSANDRO | D68: 9 | E68: 10 | F68: 3 | G68: =IF(SUM(D68:F68)<18,"Insuff.",SUM(D68:F68)) -> 22
A69: 188147 | B69: SPANO | C69: ELISABETTA | D69: 20 | E69: 10 | F69: 3 | G69: =IF(SUM(D69:F69)<18,"Insuff.",SUM(D69:F69)) -> 33
A70: 158591 | B70: TOMEI | C70: STEFANO | D70: 18 | E70: 5 | F70: 0 | G70: =IF(SUM(D70:F70)<18,"Insuff.",SUM(D70:F70)) -> 23
A71: 179306 | B71: TONINI | C71: ELISA | D71: 20 | E71: 6 | F71: 3 | G71: =IF(SUM(D71:F71)<18,"Insuff.",SUM(D71:F71)) -> 29
A72: 162366 | B72: VAGNARELLI | C72: VALERIO | D72: 8 | E72: 1 | F72: 3 | G72: =IF(SUM(D72:F72)<18,"Insuff.",SUM(D72:F72)) -> Insuff.
A73: 158267 | B73: VARRIANO | C73: PAOLA | D73: 15 | E73: 2 | F73: 0 | G73: 17 | H73: *
A74: 181488 | B74: ZANCANARO | C74: MARCO | D74: 7 | E74: 5 | F74: 3 | G74: =IF(SUM(D74:F74)<18,"Insuff.",SUM(D74:F74)) -> Insuff.
A75: * Puo' registrare 18.