A1: Fondamenti di Ricerca Operativa L-A
A2: Prova Scritta del 12 Aprile 2005
A4: Validita' per chi registra direttamente il voto: fino a giovedi' 21 Aprile 2005.
A5: Validita' per chi sostiene l'orale: fino a Luglio 2005.
A6: Visione degli elaborati e orali: giovedi' 21 Aprile 2005, ore 14.00, Aula 61
A7: Prossimi appelli: Giugno 2005, Luglio 2005, Settembre 2005
A9: matricola | B9: Cognome | C9: Nome | D9: 1 | E9: 2 | F9: bonus | G9: voto
A10: 140525 | B10: AGRESTI | C10: MASSIMILIANO | D10: 20 | E10: 9 | F10: 3 | G10: =IF(SUM(D10:F10)<18,"Insuff.",SUM(D10:F10)) -> 32
A11: 161594 | B11: ALLAMPRESE | C11: GIAMPIERO | D11: 20 | E11: 5 | F11: 3 | G11: =IF(SUM(D11:F11)<18,"Insuff.",SUM(D11:F11)) -> 28
A12: 164783 | B12: AMICI | C12: ROBERTO | D12: 21 | E12: 9 | F12: 3 | G12: =IF(SUM(D12:F12)<18,"Insuff.",SUM(D12:F12)) -> 33
A13: 160676 | B13: ANDREINI | C13: ELISA | D13: 11 | E13: 9 | F13: 3 | G13: =IF(SUM(D13:F13)<18,"Insuff.",SUM(D13:F13)) -> 23
A14: 145393 | B14: BADIALI | C14: MARCO | D14: 6 | E14: 5 | F14: 3 | G14: =IF(SUM(D14:F14)<18,"Insuff.",SUM(D14:F14)) -> Insuff.
A15: 161408 | B15: BARBIERI | C15: PRISCO | D15: 12 | E15: 5 | F15: 0 | G15: 17 | H15: *
A16: 2148064414 | B16: BERTONI | C16: GIANLUCA | D16: 12 | E16: 5 | F16: 0 | G16: 17 | H16: *
A17: 122282 | B17: BETTI | C17: ALESSANDRO | D17: 8 | E17: 6 | F17: 0 | G17: =IF(SUM(D17:F17)<18,"Insuff.",SUM(D17:F17)) -> Insuff.
A18: 141277 | B18: BON | C18: ALESSANDRO | D18: 10 | E18: 0 | F18: 3 | G18: =IF(SUM(D18:F18)<18,"Insuff.",SUM(D18:F18)) -> Insuff.
A19: 168666 | B19: BUSA | C19: CARLO | D19: 19 | E19: 8 | F19: 3 | G19: =IF(SUM(D19:F19)<18,"Insuff.",SUM(D19:F19)) -> 30
A20: 157684 | B20: CAFINI | C20: RAUL | D20: 20 | E20: 9 | F20: 0 | G20: =IF(SUM(D20:F20)<18,"Insuff.",SUM(D20:F20)) -> 29
A21: 900011375 | B21: CANTUCCI | C21: FILIPPO | D21: 12 | E21: 6 | F21: 3 | G21: =IF(SUM(D21:F21)<18,"Insuff.",SUM(D21:F21)) -> 21
A22: 161879 | B22: CEREDA | C22: SILVIA | D22: 20 | E22: 7 | F22: 3 | G22: =IF(SUM(D22:F22)<18,"Insuff.",SUM(D22:F22)) -> 30
A23: 229657 | B23: CHIARINI | C23: MATTIA | D23: 16 | E23: 8 | F23: 0 | G23: =IF(SUM(D23:F23)<18,"Insuff.",SUM(D23:F23)) -> 24
A24: 900007180 | B24: CICORA | C24: SAVERIO | D24: 11 | E24: 6 | F24: 3 | G24: =IF(SUM(D24:F24)<18,"Insuff.",SUM(D24:F24)) -> 20
A25: 900017545 | B25: CIOTOLI | C25: FABIO | D25: 15 | E25: 3 | F25: 3 | G25: =IF(SUM(D25:F25)<18,"Insuff.",SUM(D25:F25)) -> 21
A26: 158735 | B26: CUIUS BOSCARELLO | C26: ANDREA | D26: 10 | E26: 4 | F26: 3 | G26: 17 | H26: *
A27: 163446 | B27: DAMIANI | C27: MARCO | D27: 18 | E27: 4 | F27: 3 | G27: =IF(SUM(D27:F27)<18,"Insuff.",SUM(D27:F27)) -> 25
A28: 140903 | B28: D'ASCANIO | C28: AMEDEO | D28: 18 | E28: 6 | F28: 3 | G28: =IF(SUM(D28:F28)<18,"Insuff.",SUM(D28:F28)) -> 27
A29: 150520 | B29: DI LUZIO | C29: ANDREA | D29: 14 | E29: 6 | F29: 3 | G29: =IF(SUM(D29:F29)<18,"Insuff.",SUM(D29:F29)) -> 23
A30: 143261 | B30: EVANGELISTI | C30: MATTEO | D30: 9 | E30: 5 | F30: 3 | G30: 17 | H30: *
A31: 106109 | B31: FALASCONI | C31: MICHELE | D31: 20 | E31: 7 | F31: 3 | G31: =IF(SUM(D31:F31)<18,"Insuff.",SUM(D31:F31)) -> 30
A32: 159862 | B32: FANTONI | C32: FABIO | D32: 12 | E32: 5 | F32: 3 | G32: =IF(SUM(D32:F32)<18,"Insuff.",SUM(D32:F32)) -> 20
A33: 166694 | B33: FARACI | C33: FABIO | D33: 5 | E33: 4 | F33: 0 | G33: =IF(SUM(D33:F33)<18,"Insuff.",SUM(D33:F33)) -> Insuff.
A34: 158833 | B34: FAZI | C34: MATTEO | D34: 18 | E34: 6 | F34: 3 | G34: =IF(SUM(D34:F34)<18,"Insuff.",SUM(D34:F34)) -> 27
A35: 900007313 | B35: FELAHI | C35: ROMINA | D35: 16 | E35: 3 | F35: 3 | G35: =IF(SUM(D35:F35)<18,"Insuff.",SUM(D35:F35)) -> 22
A36: 227706 | B36: FRANCIOSI | C36: LORENZO | D36: 12 | E36: 3 | F36: 0 | G36: =IF(SUM(D36:F36)<18,"Insuff.",SUM(D36:F36)) -> Insuff.
A37: 900010372 | B37: GAIM GEBRE | C37: TEMESGEN | D37: 17 | E37: 5 | F37: 3 | G37: =IF(SUM(D37:F37)<18,"Insuff.",SUM(D37:F37)) -> 25
A38: 900010370 | B38: GHIDE MEBRAHTU | C38: ERMIAS | D38: 18 | E38: 4 | F38: 3 | G38: =IF(SUM(D38:F38)<18,"Insuff.",SUM(D38:F38)) -> 25
A39: 124071 | B39: GHIDOTTI PIOVAN | C39: ALESSANDRO | D39: 10 | E39: 9 | F39: 3 | G39: =IF(SUM(D39:F39)<18,"Insuff.",SUM(D39:F39)) -> 22
A40: 2148062452 | B40: GIORGI | C40: GIANMARCO | D40: 20 | E40: 7 | F40: 0 | G40: =IF(SUM(D40:F40)<18,"Insuff.",SUM(D40:F40)) -> 27
A41: 144641 | B41: GIOTTA | C41: GERMANO | D41: 11 | E41: 4 | F41: 3 | G41: =IF(SUM(D41:F41)<18,"Insuff.",SUM(D41:F41)) -> 18
A42: 139629 | B42: IMPOSIMATO | C42: ARTURO | D42: 2 | E42: 5 | F42: 0 | G42: =IF(SUM(D42:F42)<18,"Insuff.",SUM(D42:F42)) -> Insuff.
A43: 166964 | B43: LAGNA | C43: ANTONIO | D43: 12 | E43: 9 | F43: 0 | G43: =IF(SUM(D43:F43)<18,"Insuff.",SUM(D43:F43)) -> 21
A44: 161375 | B44: LAZZERINI | C44: CHIARA | D44: 16 | E44: 6 | F44: 3 | G44: =IF(SUM(D44:F44)<18,"Insuff.",SUM(D44:F44)) -> 25
A45: 131127 | B45: LEFEMINE | C45: VITO | D45: 14 | E45: 5 | F45: 0 | G45: =IF(SUM(D45:F45)<18,"Insuff.",SUM(D45:F45)) -> 19
A46: 156949 | B46: LOMBARDO | C46: MARCO | D46: 20 | E46: 9 | F46: 3 | G46: =IF(SUM(D46:F46)<18,"Insuff.",SUM(D46:F46)) -> 32
A47: 140585 | B47: LORENZELLI | C47: GIACOMO | D47: 16 | E47: 6 | F47: 3 | G47: =IF(SUM(D47:F47)<18,"Insuff.",SUM(D47:F47)) -> 25
A48: 158724 | B48: MAGALE | C48: ROBERTO | D48: 13 | E48: 6 | F48: 3 | G48: =IF(SUM(D48:F48)<18,"Insuff.",SUM(D48:F48)) -> 22
A49: 107899 | B49: MALVASIO | C49: ELISA | D49: 0 | E49: 3 | F49: 0 | G49: =IF(SUM(D49:F49)<18,"Insuff.",SUM(D49:F49)) -> Insuff.
A50: 235389 | B50: MARTELLA | C50: ALESSANDRO | D50: 14 | E50: 4 | F50: 3 | G50: =IF(SUM(D50:F50)<18,"Insuff.",SUM(D50:F50)) -> 21
A51: 158349 | B51: MENGOLI | C51: DARIO | D51: 16 | E51: 9 | F51: 0 | G51: =IF(SUM(D51:F51)<18,"Insuff.",SUM(D51:F51)) -> 25
A52: 110691 | B52: MINGHETTI | C52: ELISA | D52: 2 | E52: 7 | F52: 0 | G52: =IF(SUM(D52:F52)<18,"Insuff.",SUM(D52:F52)) -> Insuff.
A53: 158658 | B53: MINNUCCI | C53: LUCA | D53: 17 | E53: 6 | F53: 3 | G53: =IF(SUM(D53:F53)<18,"Insuff.",SUM(D53:F53)) -> 26
A54: 229674 | B54: NEGRISOLI | C54: ALBERTO | D54: 0 | E54: 3 | F54: 3 | G54: =IF(SUM(D54:F54)<18,"Insuff.",SUM(D54:F54)) -> Insuff.
A55: 142594 | B55: ORTOLANI | C55: ALESSANDRO | D55: 19 | E55: 6 | F55: 0 | G55: =IF(SUM(D55:F55)<18,"Insuff.",SUM(D55:F55)) -> 25
A56: 2108059204 | B56: ORTOLANI | C56: MAURIZIO | D56: 18 | E56: 5 | F56: 3 | G56: =IF(SUM(D56:F56)<18,"Insuff.",SUM(D56:F56)) -> 26
A57: 158022 | B57: PALMISANO | C57: GIOVANNI | D57: 14 | E57: 2 | F57: 3 | G57: =IF(SUM(D57:F57)<18,"Insuff.",SUM(D57:F57)) -> 19
A58: 233655 | B58: PELAGATTI | C58: NICOLA | D58: 2 | E58: 8 | F58: 0 | G58: =IF(SUM(D58:F58)<18,"Insuff.",SUM(D58:F58)) -> Insuff.
A59: 122114 | B59: PIEROTTI | C59: PAOLO | D59: 19 | E59: 5 | F59: 3 | G59: =IF(SUM(D59:F59)<18,"Insuff.",SUM(D59:F59)) -> 27
A60: 142717 | B60: PIZZUTI | C60: GIANROCCO | D60: 4 | E60: 1 | F60: 0 | G60: =IF(SUM(D60:F60)<18,"Insuff.",SUM(D60:F60)) -> Insuff.
A61: 900019215 | B61: PREITE | C61: GUIDO | D61: 11 | E61: 3 | F61: 3 | G61: =IF(SUM(D61:F61)<18,"Insuff.",SUM(D61:F61)) -> Insuff. | H61: *
A62: 900012671 | B62: PRIMICERI | C62: MARCO ANTONIO | D62: 11 | E62: 5 | F62: 3 | G62: =IF(SUM(D62:F62)<18,"Insuff.",SUM(D62:F62)) -> 19
A63: 128984 | B63: RASPADORI | C63: GIANLUCA | D63: 4 | E63: 3 | F63: 0 | G63: =IF(SUM(D63:F63)<18,"Insuff.",SUM(D63:F63)) -> Insuff.
A64: 222378 | B64: ROSSI | C64: EMANUELE | D64: 13 | E64: 6 | F64: 0 | G64: =IF(SUM(D64:F64)<18,"Insuff.",SUM(D64:F64)) -> 19
A65: 2148063712 | B65: RUSSO | C65: LUCA | D65: 4 | E65: 5 | F65: 3 | G65: =IF(SUM(D65:F65)<18,"Insuff.",SUM(D65:F65)) -> Insuff.
A66: 144583 | B66: SENATORE | C66: RITA | D66: 11 | E66: 4 | F66: 3 | G66: =IF(SUM(D66:F66)<18,"Insuff.",SUM(D66:F66)) -> 18
A67: 157649 | B67: SPINELLI | C67: MASSIMO | D67: 17 | E67: 6 | F67: 3 | G67: =IF(SUM(D67:F67)<18,"Insuff.",SUM(D67:F67)) -> 26
A68: 167022 | B68: TAPPI | C68: THOMAS | D68: 16 | E68: 5 | F68: 3 | G68: =IF(SUM(D68:F68)<18,"Insuff.",SUM(D68:F68)) -> 24
A69: 230797 | B69: TASSINI | C69: NICOLA | D69: 16 | E69: 9 | F69: 0 | G69: =IF(SUM(D69:F69)<18,"Insuff.",SUM(D69:F69)) -> 25
A70: 168821 | B70: TRAINA | C70: SALVATORE | D70: 19 | E70: 9 | F70: 0 | G70: =IF(SUM(D70:F70)<18,"Insuff.",SUM(D70:F70)) -> 28
A71: 163298 | B71: TRECCANI | C71: TIZIANO | D71: 18 | E71: 3 | F71: 0 | G71: =IF(SUM(D71:F71)<18,"Insuff.",SUM(D71:F71)) -> 21
A72: 168939 | B72: VACCARI | C72: MARCO | D72: 13 | E72: 1 | F72: 3 | G72: 17 | H72: *
A73: 900012036 | B73: VERONA | C73: DAVIDE | D73: 12 | E73: 0 | F73: 3 | G73: =IF(SUM(D73:F73)<18,"Insuff.",SUM(D73:F73)) -> Insuff.
A74: 900012076 | B74: VUKOVIC | C74: VELJKO | D74: 20 | E74: 9 | F74: 0 | G74: =IF(SUM(D74:F74)<18,"Insuff.",SUM(D74:F74)) -> 29
A75: 233659 | B75: ZACCHE | C75: ALESSANDRO | D75: 5 | E75: 5 | F75: 0 | G75: =IF(SUM(D75:F75)<18,"Insuff.",SUM(D75:F75)) -> Insuff.
A76: 158101 | B76: ZAPPAROLI | C76: PAMELA | D76: 21 | E76: 9 | F76: 3 | G76: =IF(SUM(D76:F76)<18,"Insuff.",SUM(D76:F76)) -> 33
A77: * Puo' registrare 18