A1: Fondamenti di Ricerca Operativa L-A
A2: Prova Scritta del 19 Aprile 2004
A4: Validita' per chi registra direttamente il voto: fino a venerdi' 23 Aprile 2004.
A5: Validita' per chi sostiene l'orale: fino a Luglio 2004.
A6: Visione degli elaborati e orali: Venerdi' 23 Aprile 2004, ore 15.00, Aula 05
A7: Prossimi appelli: Giugno, Luglio, Settembre, Gennaio
A9: matricola | B9: Cognome | C9: Nome | D9: 1 | E9: 2 | F9: bonus | G9: voto
A10: 139521 | B10: ALBERTIN | C10: MARCO | D10: 14 | E10: 15 | F10: 3 | G10: =SUM(D10:F10) -> 32
A11: 141000 | B11: AMATI | C11: DANIELE | D11: 7 | E11: 1 | F11: 3 | G11: Insuff.
A12: 2103058081 | B12: AMENDOLA | C12: LUCA | D12: 12 | E12: 4 | F12: 3 | G12: =SUM(D12:F12) -> 19
A13: 139196 | B13: BALDASSARRO | C13: MICHELE | D13: 14 | E13: 6 | F13: 3 | G13: =SUM(D13:F13) -> 23
A14: 123594 | B14: BALDUCCI | C14: DANIELE | D14: 3 | E14: 7 | F14: 0 | G14: Insuff.
A15: 140497 | B15: BERGAMINI | C15: ANDREA | D15: 15 | E15: 6 | F15: 3 | G15: =SUM(D15:F15) -> 24
A16: 122282 | B16: BETTI | C16: ALESSANDRO | D16: 7 | E16: 0 | F16: 0 | G16: Insuff.
A17: 139786 | B17: BONSI | C17: VALENTINA | D17: 13 | E17: 15 | F17: 0 | G17: =SUM(D17:F17) -> 28
A18: 122271 | B18: BOTTIN | C18: MATTEO | D18: 12 | E18: 15 | F18: 3 | G18: =SUM(D18:F18) -> 30
A19: 140859 | B19: BRACCI | C19: FABIO | D19: 14 | E19: 15 | F19: 3 | G19: =SUM(D19:F19) -> 32
A20: 900008644 | B20: BRIZI | C20: MARCO | D20: 15 | E20: 15 | F20: 3 | G20: =SUM(D20:F20) -> 33
A21: 2148062305 | B21: BRUNELLI | C21: FRANCESCA | D21: 7 | E21: 0 | F21: 0 | G21: Insuff.
A22: 139201 | B22: CAMPETI | C22: LUCA | D22: 7 | E22: 14 | F22: 3 | G22: =SUM(D22:F22) -> 24
A23: 145534 | B23: CARUGNO | C23: GIANGREGORIO | D23: 9 | E23: 6 | F23: 3 | G23: =SUM(D23:F23) -> 18
A24: 144180 | B24: CARUSO | C24: CRISTIAN | D24: 12 | E24: 15 | F24: 3 | G24: =SUM(D24:F24) -> 30
A25: 139980 | B25: COLTELLI | C25: DINO | D25: 5 | E25: 6 | F25: 3 | G25: Insuff.
A26: 122144 | B26: CUCCHIELLA | C26: RODOLFO | D26: 3 | E26: 15 | F26: 3 | G26: =SUM(D26:F26) -> 21
A27: 140118 | B27: CUDDEMI | C27: MASSIMO | D27: 8 | E27: 11 | F27: 3 | G27: =SUM(D27:F27) -> 22
A28: 900005294 | B28: D'AMELIO | C28: PASQUALINO | D28: 8 | E28: 4 | F28: 0 | G28: Insuff.
A29: 138743 | B29: DE ANGELI | C29: MATTEO | D29: 14 | E29: 13 | F29: 0 | G29: =SUM(D29:F29) -> 27
A30: 141296 | B30: DEGLI ESPOSTI | C30: MATTEO | D30: 15 | E30: 8 | F30: 0 | G30: =SUM(D30:F30) -> 23
A31: 145304 | B31: DELLE NOCI | C31: DAVIDE GIROLAMO | D31: 8 | E31: 7 | F31: 3 | G31: =SUM(D31:F31) -> 18
A32: 104930 | B32: DI TOLLO | C32: ALFONSO | D32: 15 | E32: 14 | F32: 0 | G32: =SUM(D32:F32) -> 29
A33: 125467 | B33: FAIENZA | C33: STEFANO ERNESTO | D33: 3 | E33: 6 | F33: 3 | G33: Insuff.
A34: 141194 | B34: FARINA | C34: CRISTIAN | D34: 15 | E34: 14 | F34: 3 | G34: =SUM(D34:F34) -> 32
A35: 139104 | B35: FAVARA | C35: SIMONE | D35: 15 | E35: 14 | F35: 0 | G35: =SUM(D35:F35) -> 29
A36: 121917 | B36: FIORETTI | C36: FABIO | D36: 4 | E36: 7 | F36: 0 | G36: Insuff.
A37: 141984 | B37: FORESTI | C37: FEDERICO | D37: 12 | E37: 6 | F37: 0 | G37: =SUM(D37:F37) -> 18
A38: 141466 | B38: GARDOSI | C38: STEFANO | D38: 14 | E38: 8 | F38: 0 | G38: =SUM(D38:F38) -> 22
A39: 127861 | B39: GELSUMINO | C39: ERIKA | D39: 8 | E39: 0 | F39: 0 | G39: Insuff.
A40: 141015 | B40: GRANDIS | C40: DAVIDE | D40: 11 | E40: 5 | F40: 3 | G40: =SUM(D40:F40) -> 19
A41: 141093 | B41: GRAZI | C41: ALESSANDRO | D41: 13 | E41: 0 | F41: 0 | G41: Insuff.
A42: 124815 | B42: INNOCENTI | C42: SIMONE | D42: 11 | E42: 4 | F42: 0 | G42: Insuff.
A43: 900007177 | B43: KAGHO NGUIMATSIA | C43: ELVIS | D43: 11 | E43: 5 | F43: 3 | G43: =SUM(D43:F43) -> 19
A44: 126073 | B44: LEONE | C44: MASSIMILIANO | D44: 5 | E44: 0 | F44: 0 | G44: Insuff.
A45: 149306 | B45: MANCO | C45: ROCCO ALESSANDRO | D45: 14 | E45: 9 | F45: 0 | G45: =SUM(D45:F45) -> 23
A46: 104543 | B46: MANTOVANI | C46: DIMITRI | D46: 10 | E46: 8 | F46: 3 | G46: =SUM(D46:F46) -> 21
A47: 150115 | B47: MARCHETTI | C47: LORENA | D47: 15 | E47: 6 | F47: 3 | G47: =SUM(D47:F47) -> 24
A48: 145228 | B48: MARTELLA | C48: VITO | D48: 14 | E48: 4 | F48: 3 | G48: =SUM(D48:F48) -> 21
A49: 139523 | B49: MAZZANTI | C49: ROBERTO | D49: 15 | E49: 3 | F49: 0 | G49: =SUM(D49:F49) -> 18
A50: 123351 | B50: MAZZONI | C50: ANDREA | D50: 9 | E50: 5 | F50: 0 | G50: Insuff.
A51: 2147059008 | B51: MINOTTI | C51: LORENZO | D51: 12 | E51: 6 | F51: 0 | G51: =SUM(D51:F51) -> 18
A52: 142104 | B52: MONOPOLI | C52: ANDREA | D52: 9 | E52: 5 | F52: 0 | G52: Insuff.
A53: 150643 | B53: NAPOLI | C53: GIANPIERO | D53: 11 | E53: 5 | F53: 3 | G53: =SUM(D53:F53) -> 19
A54: 139366 | B54: NOSARI | C54: LUCA | D54: 12 | E54: 3 | F54: 3 | G54: =SUM(D54:F54) -> 18
A55: 150328 | B55: PAPETTI | C55: MARCO | D55: 10 | E55: 15 | F55: 0 | G55: =SUM(D55:F55) -> 25
A56: 146505 | B56: PEGOLO | C56: MARCO | D56: 10 | E56: 6 | F56: 3 | G56: =SUM(D56:F56) -> 19
A57: 141941 | B57: PIERANGELI | C57: DIEGO | D57: 15 | E57: 15 | F57: 0 | G57: =SUM(D57:F57) -> 30
A58: 144037 | B58: PIERGENTILI | C58: LUCA | D58: 11 | E58: 0 | F58: 0 | G58: Insuff.
A59: 140328 | B59: PILI | C59: MATIA | D59: 15 | E59: 3 | F59: 0 | G59: =SUM(D59:F59) -> 18
A60: 123566 | B60: PISTOLESI | C60: LUCA | D60: 7 | E60: 6 | F60: 0 | G60: Insuff.
A61: 121976 | B61: PORRECA | C61: LUCA | D61: 15 | E61: 6 | F61: 3 | G61: =SUM(D61:F61) -> 24
A62: 900016361 | B62: POZZULO | C62: EMILIO | D62: 7 | E62: 1 | F62: 3 | G62: Insuff.
A63: 141882 | B63: PRANDINI | C63: ROBERTO | D63: 9 | E63: 1 | F63: 3 | G63: Insuff.
A64: 124273 | B64: ROMANELLI | C64: ELIO | D64: 7 | E64: 1 | F64: 0 | G64: Insuff.
A65: 140902 | B65: ROMANI | C65: CORRADO | D65: 14 | E65: 15 | F65: 0 | G65: =SUM(D65:F65) -> 29
A66: 140875 | B66: ROMBOLI | C66: FABRIZIO | D66: 10 | E66: 13 | F66: 0 | G66: =SUM(D66:F66) -> 23
A67: 2006029334 | B67: ROSSI | C67: MANUELA | D67: 15 | E67: 14 | F67: 3 | G67: =SUM(D67:F67) -> 32
A68: 122727 | B68: RUCCI | C68: MARCO | D68: 11 | E68: 14 | F68: 3 | G68: =SUM(D68:F68) -> 28
A69: 150119 | B69: SILENZI | C69: ELISA | D69: 13 | E69: 6 | F69: 0 | G69: =SUM(D69:F69) -> 19
A70: 2148061942 | B70: SOLMI | C70: LUCA | D70: 14 | E70: 9 | F70: 3 | G70: =SUM(D70:F70) -> 26
A71: 129419 | B71: SPINELLI | C71: MARCO | D71: 13 | E71: 11 | F71: 3 | G71: =SUM(D71:F71) -> 27
A72: 900000355 | B72: SREPFLER | C72: SRGJAN | D72: 10 | E72: 1 | F72: 0 | G72: Insuff.
A73: 2148063685 | B73: STAGNI | C73: DAVIDE | D73: 10 | E73: 12 | F73: 0 | G73: =SUM(D73:F73) -> 22
A74: 123238 | B74: TAMAGNINI | C74: STEFANO | D74: 4 | E74: 0 | F74: 0 | G74: Insuff.
A75: 148936 | B75: TOPPAN | C75: ANDREA | D75: 13 | E75: 3 | F75: 3 | G75: =SUM(D75:F75) -> 19
A76: 113440 | B76: TROCINO | C76: ANDREA | D76: 10 | E76: 3 | F76: 3 | G76: Insuff.
A77: 142344 | B77: VINCI | C77: MASSIMILIANO | D77: 5 | E77: 14 | F77: 3 | G77: =SUM(D77:F77) -> 22
A78: 142380 | B78: VITALONE | C78: GIUSEPPE | D78: 14 | E78: 10 | F78: 3 | G78: =SUM(D78:F78) -> 27
A79: 122074 | B79: VOLI | C79: STEFANO | D79: 13 | E79: 8 | F79: 0 | G79: =SUM(D79:F79) -> 21
A80: 142235 | B80: ZAPPACOSTA | C80: DAVIDE | D80: 11 | E80: 1 | F80: 3 | G80: Insuff.