A1: Fondamenti di Ricerca Operativa L-A
A2: Prova Scritta del 16 Gennaio 2004
A4: Validita': fino a Aprile 2004
A5: Visione degli elaborati e orali: Mercoledi' 21Gennaio 2004, ore 15.00, Aula 6.1
A6: Prossimo appello: Marzo
A8: matricola | B8: Cognome | C8: Nome | D8: 1 | E8: 2 | F8: 3 | G8: bonus | H8: voto
A9: 2108060319 | B9: BERTOLINI | C9: MONICA | D9: 13 | E9: 8 | G9: 0 | H9: =SUM(D9:G9) -> 21
A10: 126705 | B10: BONOLI | C10: NICOLA | D10: 15 | E10: 10 | G10: 0 | H10: =SUM(D10:G10) -> 25
A11: 121741 | B11: BUCCI | C11: DAVIDE | D11: 9 | E11: 10 | G11: 0 | H11: =SUM(D11:G11) -> 19
A12: 2148063596 | B12: CARPIGNOLI | C12: ANDREA | D12: 11 | E12: 9 | G12: 0 | H12: =SUM(D12:G12) -> 20
A13: 126273 | B13: CASETTA | C13: FABRIZIO | D13: 13 | E13: 10 | G13: 3 | H13: =SUM(D13:G13) -> 26
A14: 122897 | B14: CASSANELLI | C14: FABIO | G14: 0 | H14: Annullato | I14: *
A15: 104375 | B15: CERUTI | C15: ANDREA | D15: 8 | E15: 3 | G15: 0 | H15: Insuff.
A16: 114918 | B16: CORSINI | C16: ALESSIO | D16: 10 | E16: 8 | G16: 0 | H16: =SUM(D16:G16) -> 18
A17: 900005294 | B17: D'AMELIO | C17: PASQUALINO | D17: 6 | E17: 8 | G17: 0 | H17: Insuff.
A18: 127858 | B18: FANTUZZI | C18: ELLIS | G18: 3 | H18: Annullato | I18: **
A19: 127861 | B19: GELSUMINO | C19: ERIKA | D19: 8 | E19: 10 | G19: 0 | H19: =SUM(D19:G19) -> 18
A20: 128035 | B20: LEONETTI | C20: FRANCESCO | D20: 11 | E20: 10 | G20: 0 | H20: =SUM(D20:G20) -> 21
A21: 2108057373 | B21: RUSSO | C21: ROBERTO | D21: 9 | E21: 9 | G21: 0 | H21: =SUM(D21:G21) -> 18
A22: 108113 | B22: VERNA | C22: GERARDO | D22: 9 | E22: 5 | G22: 0 | H22: Insuff.
A23: 122074 | B23: VOLI | C23: STEFANO | D23: 16 | E23: 1 | G23: 0 | H23: =SUM(D23:G23) -> 17 | I23: ***
A24: * =**
A25: *** = ammesso all'orale