A1: Fondamenti di Ricerca Operativa L-A
A2: Prova Scritta del 24 Marzo 2004
A4: Validita': fino a Giugno 2004
A5: Visione degli elaborati e orali: Lunedi' 5 Aprile 2004, ore 15.00, Aula 6.1
A6: Prossimo appello: Aprile
A8: matricola | B8: Cognome | C8: Nome | D8: 1 | E8: 2 | F8: bonus | G8: voto
A9: 139035 | B9: ALBERTIN | C9: MASSIMO | D9: 19 | E9: 4 | F9: 3 | G9: =SUM(D9:F9) -> 26
A10: 138771 | B10: ANDOLFO | C10: MARCO | D10: 15 | E10: 9 | F10: 3 | G10: =SUM(D10:F10) -> 27
A11: 900007225 | B11: ANGJELI | C11: ELIDOR | D11: 20 | E11: 7 | F11: 3 | G11: =SUM(D11:F11) -> 30
A12: 142378 | B12: ANGRISANI | C12: ANDREA | D12: 19 | E12: 9 | F12: 3 | G12: =SUM(D12:F12) -> 31
A13: 143116 | B13: AZZINI | C13: NICOLA | D13: 21 | E13: 9 | F13: 3 | G13: =SUM(D13:F13) -> 33
A14: 145646 | B14: BAMBINI | C14: STEFANO | D14: 18 | E14: 5 | F14: 3 | G14: =SUM(D14:F14) -> 26
A15: 139494 | B15: BARBIERI | C15: DIEGO | D15: 19 | E15: 6 | F15: 3 | G15: =SUM(D15:F15) -> 28
A16: 123833 | B16: BARONCINI | C16: DANIELE | D16: 8 | E16: 6 | F16: 0 | G16: Insuff.
A17: 123183 | B17: BELLOTTI | C17: NICOLA | D17: 17 | E17: 6 | F17: 3 | G17: =SUM(D17:F17) -> 26
A18: 142421 | B18: BELTRANDI | C18: CRISTIAN | D18: 3 | E18: 0 | F18: 3 | G18: Insuff.
B19: BERARDI | C19: FRANCESCO | D19: 21 | E19: 9 | F19: 3 | G19: =SUM(D19:F19) -> 33
A20: 2148061513 | B20: BERNABEI | C20: CHIARA | D20: 7 | E20: 6 | F20: 0 | G20: Insuff.
A21: 124835 | B21: BERTACCHINI | C21: RICCARDO ANDREA | D21: 13 | E21: 8 | F21: 3 | G21: =SUM(D21:F21) -> 24
A22: 143597 | B22: BETTI | C22: DANIELE | D22: 17 | E22: 6 | F22: 3 | G22: =SUM(D22:F22) -> 26
A23: 141552 | B23: BONFATTI | C23: VALERIO | D23: 20 | E23: 6 | F23: 3 | G23: =SUM(D23:F23) -> 29
A24: 139786 | B24: BONSI | C24: VALENTINA | D24: 8 | E24: 9 | F24: 3 | G24: =SUM(D24:F24) -> 20
A25: 142103 | B25: BORIONI | C25: VALERIO | D25: 15 | E25: 8 | F25: 3 | G25: =SUM(D25:F25) -> 26
A26: 2148062305 | B26: BRUNELLI | C26: FRANCESCA | D26: 10 | E26: 2 | F26: 3 | G26: Insuff.
A27: 149951 | B27: BUCCO | C27: NICOLA | D27: 16 | E27: 7 | F27: 3 | G27: =SUM(D27:F27) -> 26
A28: 140054 | B28: CALEGARI | C28: ROBERTA | D28: 21 | E28: 6 | F28: 3 | G28: =SUM(D28:F28) -> 30
A29: 138890 | B29: CAMPEGGI | C29: CLAUDIO | D29: 13 | E29: 7 | F29: 3 | G29: =SUM(D29:F29) -> 23
A30: 142244 | B30: CAMPELLONE | C30: DAVIDE | D30: 20 | E30: 9 | F30: 3 | G30: =SUM(D30:F30) -> 32
A31: 150090 | B31: CAMURANI | C31: MARCO | D31: 12 | E31: 6 | F31: 3 | G31: =SUM(D31:F31) -> 21
A32: 900007453 | B32: CANDREVA | C32: ENZO ALBERTO | D32: 18 | E32: 6 | F32: 3 | G32: =SUM(D32:F32) -> 27
A33: 146548 | B33: CAPPA | C33: SEBASTIANO | D33: 21 | E33: 1 | F33: 3 | G33: =SUM(D33:F33) -> 25
A34: 122897 | B34: CASSANELLI | C34: FABIO | D34: 14 | E34: 4 | F34: 0 | G34: =SUM(D34:F34) -> 18
A35: 126003 | B35: CASSANI | C35: RICCARDO | D35: 16 | E35: 7 | F35: 3 | G35: =SUM(D35:F35) -> 26
A36: 128045 | B36: CAVALLARO | C36: FRANCESCO | D36: 17 | E36: 3 | F36: 3 | G36: =SUM(D36:F36) -> 23
A37: 104375 | B37: CERUTI | C37: ANDREA | D37: 14 | E37: 4 | F37: 0 | G37: =SUM(D37:F37) -> 18
A38: 121503 | B38: CHIODINI | C38: ALESSANDRO | D38: 21 | E38: 7 | F38: 3 | G38: =SUM(D38:F38) -> 31
A39: 140199 | B39: COLOMBO | C39: SIMONE | D39: 17 | E39: 9 | F39: 3 | G39: =SUM(D39:F39) -> 29
A40: 142413 | B40: COLUCCIO | C40: LUIGI | D40: 19 | E40: 5 | F40: 3 | G40: =SUM(D40:F40) -> 27
A41: 140763 | B41: CORSI | C41: BARBARA | D41: 18 | E41: 3 | F41: 3 | G41: =SUM(D41:F41) -> 24
A42: 139454 | B42: DALESSANDRO | C42: ANDREA | D42: 16 | E42: 5 | F42: 3 | G42: =SUM(D42:F42) -> 24
A43: 138743 | B43: DE ANGELI | C43: MATTEO | D43: 15 | E43: 5 | F43: 3 | G43: =SUM(D43:F43) -> 23
A44: 2148058541 | B44: DE PIETRO | C44: FABRIZIA | D44: 8 | E44: 4 | F44: 3 | G44: Insuff.
A45: 143069 | B45: DE SANCTIS | C45: ROBERTO | D45: 20 | E45: 7 | F45: 3 | G45: =SUM(D45:F45) -> 30
A46: 141296 | B46: DEGLI ESPOSTI | C46: MATTEO | D46: 11 | E46: 4 | F46: 3 | G46: =SUM(D46:F46) -> 18
A47: 123116 | B47: DI CARLO | C47: LEO | D47: 15 | E47: 3 | F47: 3 | G47: =SUM(D47:F47) -> 21
A48: 120997 | B48: DI GIACOMO | C48: EMANUELE | D48: 19 | E48: 5 | F48: 3 | G48: =SUM(D48:F48) -> 27
A49: 138775 | B49: DI SABATINO | C49: MARCO | D49: 12 | E49: 9 | F49: 3 | G49: =SUM(D49:F49) -> 24
A50: 2146063940 | B50: DOCIMO | C50: BRUNO | D50: 16 | E50: 9 | F50: 3 | G50: =SUM(D50:F50) -> 28
A51: 139104 | B51: FAVARA | C51: SIMONE | D51: 16 | E51: 7 | F51: 3 | G51: =SUM(D51:F51) -> 26
A52: 149984 | B52: FEBO | C52: EMANUELE | D52: 20 | E52: 1 | F52: 3 | G52: =SUM(D52:F52) -> 24
A53: 150371 | B53: FERRARA | C53: MARCO | D53: 19 | E53: 2 | F53: 3 | G53: =SUM(D53:F53) -> 24
A54: 146315 | B54: FIORI | C54: FRANCESCO | D54: 17 | E54: 5 | F54: 3 | G54: =SUM(D54:F54) -> 25
A55: 146499 | B55: FONTAN | C55: CLAUDIA | D55: 21 | E55: 9 | F55: 3 | G55: =SUM(D55:F55) -> 33
A56: 141984 | B56: FORESTI | C56: FEDERICO | D56: 11 | E56: 1 | F56: 3 | G56: Insuff.
A57: 139293 | B57: FRANCHI | C57: ALESSANDRO | D57: 20 | E57: 8 | F57: 3 | G57: =SUM(D57:F57) -> 31
A58: 123366 | B58: GABBANI | C58: FABIO | D58: 19 | E58: 7 | F58: 3 | G58: =SUM(D58:F58) -> 29
A59: 122359 | B59: GALUPPO | C59: VALENTINA | D59: 16 | E59: 0 | F59: 3 | G59: =SUM(D59:F59) -> 19
A60: 145578 | B60: GAMBONI | C60: ROBERTO | D60: 21 | E60: 9 | F60: 3 | G60: =SUM(D60:F60) -> 33
A61: 141466 | B61: GARDOSI | C61: STEFANO | D61: 14 | E61: 1 | F61: 3 | G61: =SUM(D61:F61) -> 18
A62: 148873 | B62: GAUDENZI | C62: ERMETE | D62: 12 | E62: 4 | F62: 3 | G62: =SUM(D62:F62) -> 19
A63: 141020 | B63: GHIDINI | C63: GIACOMO | D63: 21 | E63: 9 | F63: 3 | G63: =SUM(D63:F63) -> 33
A64: 2148062538 | B64: GHIDONI | C64: ROBERTO | D64: 13 | E64: 6 | F64: 3 | G64: =SUM(D64:F64) -> 22
A65: 126788 | B65: GIAFFREDA | C65: DANIELE | D65: 16 | E65: 3 | F65: 3 | G65: =SUM(D65:F65) -> 22
A66: 140846 | B66: GIAMPICCOLO | C66: DAVIDE | D66: 20 | E66: 8 | F66: 3 | G66: =SUM(D66:F66) -> 31
A67: 2148062452 | B67: GIORGI | C67: GIANMARCO | D67: 2 | E67: 2 | F67: 0 | G67: Insuff.
A68: 193625 | B68: GOZZI | C68: DANIELE | D68: 19 | E68: 6 | F68: 3 | G68: =SUM(D68:F68) -> 28
A69: 141093 | B69: GRAZI | C69: ALESSANDRO | D69: 6 | E69: 4 | F69: 3 | G69: Insuff.
A70: 900003357 | B70: GRIMALDI | C70: GIOVANNI | D70: 14 | E70: 7 | F70: 3 | G70: =SUM(D70:F70) -> 24
A71: 143881 | B71: GUAGLIUMI | C71: VALERIO | D71: 18 | E71: 8 | F71: 3 | G71: =SUM(D71:F71) -> 29
A72: 139669 | B72: GUBELLINI | C72: FEDERICO | D72: 14 | E72: 9 | F72: 3 | G72: =SUM(D72:F72) -> 26
A73: 900008065 | B73: HARIRI | C73: AHMAD KHALED | D73: 16 | E73: 3 | F73: 3 | G73: =SUM(D73:F73) -> 22
A74: 143789 | B74: IANNIELLO | C74: RAFFAELE | D74: 21 | E74: 9 | F74: 3 | G74: =SUM(D74:F74) -> 33
A75: 124815 | B75: INNOCENTI | C75: SIMONE | D75: 2 | E75: 6 | F75: 3 | G75: Insuff.
A76: 141580 | B76: IURA | C76: LUCA | D76: 13 | E76: 8 | F76: 3 | G76: =SUM(D76:F76) -> 24
A77: 139998 | B77: LAI | C77: SIMONE | D77: 9 | E77: 1 | F77: 3 | G77: Insuff.
A78: 141889 | B78: LANDI | C78: STEFANO | D78: 19 | E78: 5 | F78: 3 | G78: =SUM(D78:F78) -> 27
A79: 139868 | B79: LANZONI | C79: SIMONE | D79: 17 | E79: 4 | F79: 3 | G79: =SUM(D79:F79) -> 24
A80: 143604 | B80: LAZZARETTI | C80: MARCO | D80: 12 | E80: 3 | F80: 3 | G80: =SUM(D80:F80) -> 18
A81: 140945 | B81: LEARDINI | C81: SIMONE | D81: 21 | E81: 9 | F81: 3 | G81: =SUM(D81:F81) -> 33
A82: 126073 | B82: LEONE | C82: MASSIMILIANO | D82: 1 | E82: 0 | F82: 3 | G82: Insuff.
A83: 144019 | B83: LOSI | C83: FILIPPO | D83: 13 | E83: 8 | F83: 3 | G83: =SUM(D83:F83) -> 24
A84: 142138 | B84: LUTTEROTTI | C84: PAOLO | D84: 21 | E84: 8 | F84: 3 | G84: =SUM(D84:F84) -> 32
A85: 141041 | B85: MAFFEI | C85: FEDERICO | D85: 13 | E85: 4 | F85: 3 | G85: =SUM(D85:F85) -> 20
A86: 121713 | B86: MANARINI | C86: MASSIMO | D86: 20 | E86: 7 | F86: 3 | G86: =SUM(D86:F86) -> 30
A87: 127588 | B87: MANCA | C87: MARA | D87: 19 | E87: 4 | F87: 0 | G87: =SUM(D87:F87) -> 23
A88: 143837 | B88: MANCINI | C88: FABIO | D88: 16 | E88: 6 | F88: 3 | G88: =SUM(D88:F88) -> 25
A89: 149306 | B89: MANCO | C89: ROCCO ALESSANDRO | D89: 17 | E89: 0 | F89: 3 | G89: =SUM(D89:F89) -> 20
A90: 124067 | B90: MANCUSO | C90: ANTONIO | D90: 15 | E90: 3 | F90: 3 | G90: =SUM(D90:F90) -> 21
A91: 139816 | B91: MANTOVANI | C91: MARCO | D91: 18 | E91: 3 | F91: 3 | G91: =SUM(D91:F91) -> 24
A92: 149318 | B92: MARINELLI | C92: ALESSIO | D92: 16 | E92: 1 | F92: 3 | G92: =SUM(D92:F92) -> 20
A93: 109000 | B93: MARTELLA | C93: PIERLUCA | D93: 20 | E93: 9 | F93: 3 | G93: =SUM(D93:F93) -> 32
A94: 900008614 | B94: MARTINO | C94: DANILO | D94: 20 | E94: 8 | F94: 3 | G94: =SUM(D94:F94) -> 31
A95: 143323 | B95: MAURO | C95: GIANLUCA | D95: 21 | E95: 9 | F95: 3 | G95: =SUM(D95:F95) -> 33
A96: 139523 | B96: MAZZANTI | C96: ROBERTO | D96: 16 | E96: 2 | F96: 3 | G96: =SUM(D96:F96) -> 21
A97: 140792 | B97: MELANDRI | C97: VINCENZO | D97: 10 | E97: 5 | F97: 3 | G97: =SUM(D97:F97) -> 18
A98: 142494 | B98: MELLI | C98: MICHELE | D98: 18 | E98: 3 | F98: 3 | G98: =SUM(D98:F98) -> 24
A99: 139129 | B99: MICOCCI | C99: GIUSEPPE | D99: 18 | E99: 1 | F99: 3 | G99: =SUM(D99:F99) -> 22
A100: 147208 | B100: MOLINO | C100: MAURO | D100: 19 | E100: 7 | F100: 3 | G100: =SUM(D100:F100) -> 29
A101: 142104 | B101: MONOPOLI | C101: ANDREA | D101: 9 | E101: 6 | F101: 3 | G101: =SUM(D101:F101) -> 18
A102: 147730 | B102: NARDINI | C102: ELENA | D102: 21 | E102: 9 | F102: 3 | G102: =SUM(D102:F102) -> 33
A103: 139458 | B103: NEGRI | C103: CLAUDIO | D103: 18 | E103: 9 | F103: 3 | G103: =SUM(D103:F103) -> 30
A104: 900003319 | B104: NICULESCU | C104: M. LAURENTIU OCTAVIAN | D104: 20 | E104: 9 | F104: 3 | G104: =SUM(D104:F104) -> 32
A105: 144130 | B105: PALLADINI | C105: AMBRA | D105: 17 | E105: 3 | F105: 3 | G105: =SUM(D105:F105) -> 23
A106: 141076 | B106: PANICO | C106: FRANCESCO | D106: 17 | E106: 7 | F106: 3 | G106: =SUM(D106:F106) -> 27
A107: 150328 | B107: PAPETTI | C107: MARCO | D107: 14 | E107: 1 | F107: 3 | G107: =SUM(D107:F107) -> 18
A108: 139974 | B108: PASINI | C108: ALESSANDRO | D108: 19 | E108: 8 | F108: 3 | G108: =SUM(D108:F108) -> 30
A109: 139416 | B109: PASSERINI | C109: MARCO | D109: 14 | E109: 6 | F109: 3 | G109: =SUM(D109:F109) -> 23
A110: 125523 | B110: PAU | C110: CLAUDIA | D110: 13 | E110: 7 | F110: 3 | G110: =SUM(D110:F110) -> 23
A111: 143490 | B111: PELLEGRINI | C111: ANDREA | D111: 19 | E111: 4 | F111: 3 | G111: =SUM(D111:F111) -> 26
A112: 139283 | B112: PELLINI | C112: GIOVANNI | D112: 13 | E112: 7 | F112: 3 | G112: =SUM(D112:F112) -> 23
A113: 141941 | B113: PIERANGELI | C113: DIEGO | D113: 1 | E113: 1 | F113: 3 | G113: Insuff.
A114: 144037 | B114: PIERGENTILI | C114: LUCA | D114: 16 | E114: 4 | F114: 3 | G114: Annullato.
A115: 140328 | B115: PILI | C115: MATIA | D115: 6 | E115: 2 | F115: 3 | G115: Insuff.
A116: 140098 | B116: PINTO | C116: FABRIZIO | D116: 19 | E116: 9 | F116: 3 | G116: =SUM(D116:F116) -> 31
A117: 123566 | B117: PISTOLESI | C117: LUCA | D117: 2 | E117: 5 | F117: 0 | G117: Insuff.
A118: 147669 | B118: PIVI | C118: MARCO | D118: 20 | E118: 9 | F118: 3 | G118: =SUM(D118:F118) -> 32
A119: 142717 | B119: PIZZUTI | C119: GIANROCCO | D119: 16 | E119: 0 | F119: 3 | G119: Annullato.
A120: 2146055269 | B120: POSSATI | C120: CARLO | D120: 14 | E120: 8 | F120: 3 | G120: =SUM(D120:F120) -> 25
A121: 147812 | B121: PRESTA | C121: SALVATORE | D121: 16 | E121: 9 | F121: 3 | G121: =SUM(D121:F121) -> 28
A122: 143398 | B122: RIZZI | C122: DAVIDE | D122: 19 | E122: 7 | F122: 3 | G122: =SUM(D122:F122) -> 29
A123: 124273 | B123: ROMANELLI | C123: ELIO | D123: 10 | E123: 3 | F123: 0 | G123: Insuff.
A124: 140902 | B124: ROMANI | C124: CORRADO | D124: 16 | E124: 6 | F124: 3 | G124: Annullato.
A125: 140875 | B125: ROMBOLI | C125: FABRIZIO | D125: 14 | E125: 1 | F125: 3 | G125: =SUM(D125:F125) -> 18
A126: 140095 | B126: SALAROLI | C126: ANDREA | D126: 14 | E126: 9 | F126: 3 | G126: =SUM(D126:F126) -> 26
A127: 140926 | B127: SALTI | C127: SAMUELE | D127: 21 | E127: 9 | F127: 3 | G127: =SUM(D127:F127) -> 33
A128: 139135 | B128: SALVADORI | C128: DAVIDE | D128: 2 | E128: 4 | F128: 3 | G128: Insuff.
A129: 123383 | B129: SALVATORE | C129: GIUSEPPE | D129: 20 | E129: 5 | F129: 3 | G129: =SUM(D129:F129) -> 28
A130: 900007158 | B130: SAPORITO | C130: MASSIMILIANO | D130: 6 | E130: 0 | F130: 3 | G130: Annullato.
A131: 125533 | B131: SCORTICHINI | C131: MARCO | D131: 18 | E131: 3 | F131: 3 | G131: =SUM(D131:F131) -> 24
A132: 143810 | B132: SIANO | C132: GIANPAOLO | D132: 16 | E132: 9 | F132: 3 | G132: =SUM(D132:F132) -> 28
A133: 150119 | B133: SILENZI | C133: ELISA | D133: 9 | E133: 6 | F133: 3 | G133: =SUM(D133:F133) -> 18
A134: 900000355 | B134: SREPFLER | C134: SRGJAN | D134: 11 | E134: 2 | F134: 3 | G134: Insuff.
A135: 2148063685 | B135: STAGNI | C135: DAVIDE | D135: 6 | E135: 2 | F135: 3 | G135: Insuff.
A136: 139296 | B136: TARTAGLIONE | C136: DAVIDE | D136: 21 | E136: 9 | F136: 3 | G136: =SUM(D136:F136) -> 33
A137: 126571 | B137: TILLI | C137: PRIMO | D137: 12 | E137: 3 | F137: 3 | G137: =SUM(D137:F137) -> 18
A138: 143378 | B138: VALENT | C138: CRISTINA | D138: 20 | E138: 5 | F138: 3 | G138: =SUM(D138:F138) -> 28
A139: 144181 | B139: VALORI | C139: ANDREA LIBERO | D139: 21 | E139: 4 | F139: 3 | G139: =SUM(D139:F139) -> 28
A140: 108113 | B140: VERNA | C140: GERARDO | D140: 11 | E140: 7 | F140: 0 | G140: =SUM(D140:F140) -> 18
A141: 139481 | B141: VISCIOTTI | C141: ELISABETTA | D141: 21 | E141: 9 | F141: 3 | G141: =SUM(D141:F141) -> 33
A142: 122074 | B142: VOLI | C142: STEFANO | D142: 8 | E142: 2 | F142: 0 | G142: Insuff.
A143: 140326 | B143: ZANELLI | C143: DARIO | D143: 21 | E143: 7 | F143: 3 | G143: =SUM(D143:F143) -> 31
A144: 900003862 | B144: ZECCA | C144: PARIDE | D144: 1 | E144: 0 | F144: 3 | G144: Insuff.