A1: Fondamenti di Ricerca Operativa L-A
A2: Prova Scritta del 14 Settembre 2004
A4: Validita' per chi registra direttamente il voto: fino a lunedi' 20 Settembre 2004.
A5: Validita' per chi sostiene l'orale: fino a Marzo 2005.
A6: Visione degli elaborati e orali: lunedi' 20 Settembre 2004, ore 14.00, Aula 61
A7: Prossimi appelli: Gennaio, Marzo
A9: matricola | B9: Cognome | C9: Nome | D9: 1 | E9: 2 | F9: bonus | G9: voto
A10: 122282 | B10: BETTI | C10: ALESSANDRO | D10: 5 | E10: 2 | F10: 0 | G10: Insuff
A11: 143065 | B11: BIONDI | C11: ANDREA | D11: 19 | E11: 7 | F11: 3 | G11: =SUM(D11:F11) -> 29
A12: 2148062305 | B12: BRUNELLI | C12: FRANCESCA | D12: 13 | E12: 5 | F12: 0 | G12: =SUM(D12:F12) -> 18
A13: 2146052105 | B13: CANTI | C13: GIANLUCA | D13: 18 | E13: 9 | F13: 3 | G13: =SUM(D13:F13) -> 30
A14: 140644 | B14: CAPORALETTI | C14: GIOVANNI ALBERTO | D14: 21 | E14: 8 | F14: 3 | G14: =SUM(D14:F14) -> 32
A15: 128724 | B15: CESARI | C15: EDOARDO | D15: 15 | E15: 0 | F15: 0 | G15: Insuff
A16: 143222 | B16: CORBELLI | C16: MATTEO | D16: 19 | E16: 7 | F16: 0 | G16: =SUM(D16:F16) -> 26
A17: 2148064426 | B17: D'ARDES | C17: LUCA | D17: 9 | E17: 1 | F17: 0 | G17: Insuff
A18: 900003191 | B18: DI STEFANO | C18: NUNZIO | D18: 5 | E18: 4 | F18: 0 | G18: Insuff
A19: 127858 | B19: FANTUZZI | C19: ELLIS | D19: 3 | E19: 6 | F19: 0 | G19: Insuff
A20: 143110 | B20: FEDERICO | C20: DANIELE | D20: 19 | E20: 7 | F20: 3 | G20: =SUM(D20:F20) -> 29
A21: 127861 | B21: GELSUMINO | C21: ERIKA | D21: 5 | E21: 5 | F21: 0 | G21: Insuff
A22: 2148062452 | B22: GIORGI | C22: GIANMARCO | D22: 9 | E22: 4 | F22: 0 | G22: Insuff
A23: 139261 | B23: GRAZIA | C23: CARLO UMBERTO | D23: 11 | E23: 5 | F23: 3 | G23: =SUM(D23:F23) -> 19
A24: 900017039 | B24: GUSMAROLI | C24: EDOARDO | D24: 3 | E24: 5 | F24: 3 | G24: Insuff
A25: 139629 | B25: IMPOSIMATO | C25: ARTURO | D25: 3 | E25: 0 | F25: 3 | G25: Insuff
A26: 131127 | B26: LEFEMINE | C26: VITO | D26: 13 | E26: 7 | F26: 0 | G26: =SUM(D26:F26) -> 20
A27: 106904 | B27: MARINO | C27: LUIGI | D27: 10 | E27: 8 | F27: 0 | G27: =SUM(D27:F27) -> 18
A28: 2143062565 | B28: MAZZANTI | C28: DIEGO | D28: 20 | E28: 9 | F28: 3 | G28: =SUM(D28:F28) -> 32
A29: 110691 | B29: MINGHETTI | C29: ELISA | D29: 3 | E29: 0 | F29: 3 | G29: Insuff
A30: 139366 | B30: NOSARI | C30: LUCA | D30: 18 | E30: 2 | F30: 0 | G30: =SUM(D30:F30) -> 20
A31: 900005606 | B31: OCCHIPINTI | C31: ANDREA | D31: 11 | E31: 2 | F31: 0 | G31: Insuff
A32: 139463 | B32: PALMUCCI | C32: MASSIMILIANO | D32: 14 | E32: 0 | F32: 0 | G32: Insuff
A33: 146505 | B33: PEGOLO | C33: MARCO | D33: 12 | E33: 9 | F33: 0 | G33: =SUM(D33:F33) -> 21
A34: 2148062353 | B34: PIKASSIS | C34: CRISTINA CATERINA | D34: 13 | E34: 0 | F34: 0 | G34: Insuff
A35: 148973 | B35: PINTO | C35: ALBERTO | D35: 6 | E35: 1 | F35: 0 | G35: =IF(SUM(D35:F35)<18,"Insuff",SUM(D35:F35)) -> Insuff
A36: 142052 | B36: POLIDORI | C36: ALESSANDRO | D36: 20 | E36: 9 | F36: 3 | G36: =IF(SUM(D36:F36)<18,"Insuff",SUM(D36:F36)) -> 32
A37: 128004 | B37: POLUZZI | C37: ALESSANDRO | D37: 20 | E37: 9 | F37: 3 | G37: =IF(SUM(D37:F37)<18,"Insuff",SUM(D37:F37)) -> 32
A38: 122933 | B38: PORCARELLI | C38: DANILO | D38: 20 | E38: 1 | F38: 3 | G38: =IF(SUM(D38:F38)<18,"Insuff",SUM(D38:F38)) -> 24
A39: 900007158 | B39: SAPORITO | C39: MASSIMILIANO | D39: 3 | E39: 0 | F39: 0 | G39: =IF(SUM(D39:F39)<18,"Insuff",SUM(D39:F39)) -> Insuff
A40: 900000355 | B40: SREPFLER | C40: SRGJAN | D40: 18 | E40: 3 | F40: 0 | G40: =IF(SUM(D40:F40)<18,"Insuff",SUM(D40:F40)) -> 21
A41: 2148064438 | B41: TEMPESTA | C41: DAVIDE | D41: 15 | E41: 3 | F41: 0 | G41: =IF(SUM(D41:F41)<18,"Insuff",SUM(D41:F41)) -> 18
A42: 126571 | B42: TILLI | C42: PRIMO | D42: 9 | E42: 1 | F42: 0 | G42: =IF(SUM(D42:F42)<18,"Insuff",SUM(D42:F42)) -> Insuff
A43: 2147063667 | B43: UGENTI | C43: GRAZIANO | D43: 14 | E43: 3 | F43: 3 | G43: =IF(SUM(D43:F43)<18,"Insuff",SUM(D43:F43)) -> 20
A44: 150087 | B44: VALLECORSA | C44: JACOPO | D44: 12 | E44: 3 | F44: 3 | G44: =IF(SUM(D44:F44)<18,"Insuff",SUM(D44:F44)) -> 18
A46: ATTENZIONE: A partire dal prossimo appello, la terza insufficienza in tre appelli
A47: consecutivi ne comportera' l'annotazione sul verbale d'esame
A49: Ricerca Operativa LS
A50: Prova Scritta del 21 Dicembre 2004
A52: Validita': fino a Aprile 2005.
A53: Visione degli elaborati e orali: lunedi' 10 Gennaio 2005, ore 15.00, Aula 56
A54: Prossimo appello: Marzo
A56: matricola | B56: Cognome | C56: Nome | D56: 1 | E56: 2 | F56: bonus | G56: voto
A57: 193314 | B57: BABINI | C57: MARTINA | E57: 10 | F57: 0 | G57: =IF(SUM(D60:F60)<18,"Insuff.",SUM(D60:F60)) -> Insuff.
A58: 145393 | B58: BADIALI | C58: MARCO
A59: 123594 | B59: BALDUCCI | C59: DANIELE
A60: 122282 | B60: BETTI | C60: ALESSANDRO
A61: 129120 | B61: BRUNO | C61: ALESSIO
A62: 2148058541 | B62: DE PIETRO | C62: FABRIZIA
A63: 144105 | B63: D'ERCOLE | C63: FRANCESCO
A64: 900003191 | B64: DI STEFANO | C64: NUNZIO
A65: 143261 | B65: EVANGELISTI | C65: MATTEO
A66: 127858 | B66: FANTUZZI | C66: ELLIS
A67: 900010372 | B67: GAIM GEBRE | C67: TEMESGEN
A68: 127861 | B68: GELSUMINO | C68: ERIKA
A69: 2148062452 | B69: GIORGI | C69: GIANMARCO
A70: 900017039 | B70: GUSMAROLI | C70: EDOARDO
A71: 139629 | B71: IMPOSIMATO | C71: ARTURO
A72: 131127 | B72: LEFEMINE | C72: VITO
A73: 107899 | B73: MALVASIO | C73: ELISA
A74: 110691 | B74: MINGHETTI | C74: ELISA
A75: 900005606 | B75: OCCHIPINTI | C75: ANDREA
A76: 139463 | B76: PALMUCCI | C76: MASSIMILIANO
A77: 146630 | B77: PEDONE | C77: GIOVANNI
A78: 2148062353 | B78: PIKASSIS | C78: CRISTINA CATERINA
A79: 148973 | B79: PINTO | C79: ALBERTO
A80: 142717 | B80: PIZZUTI | C80: GIANROCCO
A81: 128984 | B81: RASPADORI | C81: GIANLUCA
A82: 128176 | B82: ROSADA | C82: GIOVANNI BATTISTA
A83: 2148063712 | B83: RUSSO | C83: LUCA
A84: 900007158 | B84: SAPORITO | C84: MASSIMILIANO
A85: 150572 | B85: SFAMURRI | C85: ALESSANDRO
A86: 140069 | B86: SPECA | C86: YARI
A87: 126571 | B87: TILLI | C87: PRIMO
A88: 143857 | B88: VENUTI | C88: ALBERTO
A89: 900003862 | B89: ZECCA | C89: PARIDE